[
    {
        "act": "FUGITIVE OFFENDERS ACT",
        "source": "https://mola.gov.gy/laws-of-guyana",
        "type": {
            "name": "section",
            "representation": "1",
            "title": "Short title. ",
            "context": "FUGITIVE OFFENDERS ACT under Short title. 1. This Act may be cited as the Fugitive Offenders Act.",
            "description": "This Act may be cited as the Fugitive Offenders Act."
        }
    },
    {
        "act": "FUGITIVE OFFENDERS ACT",
        "source": "https://mola.gov.gy/laws-of-guyana",
        "type": {
            "name": "section",
            "representation": "2",
            "title": "Interpretation.  PART II GENERAL PROVISIONS  ",
            "context": "FUGITIVE OFFENDERS ACT under Interpretation.  PART II GENERAL PROVISIONS  2. In this Act  Commonwealth country means any country mentioned in  article 47 (3) of the Constitution, and includes  (a)  a colony, territory, protectorate or other dependency of any such country;  (b)  a territory for the international relations of which any such country is responsible; and  (c)  a ship or aircraft of, or registered in, any such country;   extraditable offence has the meaning given to that  expression in section 5;   foreign territory means any country other than Guyana or  a Commonwealth country;  FUGITIVE OFFENDERS ACT LAWS OF GUYANA 6 Cap. 10:04                        Fugitive Offenders   L.R.O. 1/2012                                            Application of this Act in respect of Common- wealth countries.   Form means a form set out in the Schedule;   fugitive offender means a person who is accused, or alleged to be unlawfully at large after conviction, of an extraditable offence committed within the jurisdiction of Guyana or any Commonwealth country or foreign territory and is or is suspected to be in any country or territory, other than the country or territory in which the offence was committed or the person was convicted;  treaty territory means a foreign territory in respect of  extradition to and from which, from or to Guyana,  the provisions of this Act apply with or without  modifications, limitations or conditions by virtue of  section 4 and includes  (a)  a colony, territory, protectorate or other dependency of any such foreign territory;  (b)  a territory for the international relations of which any such foreign territory is responsible; and  (c)  a ship or aircraft of, or registered in, any such foreign territory.   PART II GENERAL PROVISIONS",
            "description": [
                {
                    "representation": "(3)",
                    "description": "of the Constitution, and includes"
                },
                {
                    "representation": "(a)",
                    "description": "a colony, territory, protectorate or other dependency of any such foreign territory;"
                },
                {
                    "representation": "(b)",
                    "description": "a territory for the international relations of which any such foreign territory is responsible; and"
                },
                {
                    "representation": "(c)",
                    "description": "a ship or aircraft of, or registered in, any such foreign territory.   PART II GENERAL PROVISIONS"
                }
            ]
        }
    },
    {
        "act": "FUGITIVE OFFENDERS ACT",
        "source": "https://mola.gov.gy/laws-of-guyana",
        "type": {
            "name": "section",
            "representation": "3",
            "title": "Application of this Act in respect of Commonwealth countries. ",
            "context": "FUGITIVE OFFENDERS ACT under Application of this Act in respect of Commonwealth countries. 3. (1) The provisions of this Act shall apply in respect of extradition from and to Guyana to and from every Commonwealth country:   Provided that the Minister may, by order, declare that the provisions of this Act shall apply in respect of LAWS OF GUYANA                                                               Fugitive Offenders                Cap. 10:04 7  L.R.O. 1/2012          Application of this Act in respect of treaty territories.                                     extradition from or to Guyana to or from any Commonwealth country specified therein, subject to such modifications, limitations or conditions as may be specified in the order.  (2) Every order made under subsection (1) shall be subject to negative resolution of the National Assembly.",
            "description": [
                {
                    "representation": "(1)",
                    "description": "shall be subject to negative resolution of the National Assembly."
                },
                {
                    "representation": "(2)",
                    "description": "Every order made under subsection"
                }
            ]
        }
    },
    {
        "act": "FUGITIVE OFFENDERS ACT",
        "source": "https://mola.gov.gy/laws-of-guyana",
        "type": {
            "name": "section",
            "representation": "4",
            "title": "Application of this Act in respect of treaty territories. ",
            "context": "FUGITIVE OFFENDERS ACT under Application of this Act in respect of treaty territories. 4. (1) Where   (a)  an arrangement made between the Government of the United Kingdom and the Government of a foreign territory relating to the extradition of fugitive offenders, prior to the 26th May, 1966, extends to and remains in force in Guyana; or  (b)  an arrangement has been made by the Government of Guyana with the Government of a foreign territory relating to the extradition of fugitive offenders, prior to the commencement of this Act, the provisions of this Act shall apply in respect of extradition from and to Guyana to and from that foreign territory so long, and so long only, as that arrangement remains in force:   Provided that the Minister may, by order, declare that this Act shall apply in respect of extradition from or to Guyana to or from a foreign territory referred to in paragraph (a) or (b) subject to such modifications, limitations or conditions as the Minister, having due regard to the terms of the arrangement referred to in paragraph (a) or (b), as the case  may be, may deem expedient to specify in the order for the purpose of implementing the terms of the arrangement and any such order shall remain in force so long, and so long only, as such arrangement remains in force. LAWS OF GUYANA 8 Cap. 10:04                        Fugitive Offenders   L.R.O. 1/2012                                                  (2) Where, after the commencement of this Act, an arrangement is made by the Government of Guyana with the Government of any foreign territory relating to the extradition of fugitive offenders, the Minister may, subject to subsection (4), by order, declare that the provisions of this Act shall apply in respect of extradition from and to Guyana to and from that foreign territory subject to such modifications, limitations or conditions as the Minister, having due regard to the terms of the arrangement, may deem expedient to specify in the order for the purposes of implementing such terms.  (3) Every order made under subsection (2) shall recite and embody the terms of the arrangement in consequence of which the order is made and shall remain in force so long, and so long only, as such arrangement remains in force and any such order shall be conclusive evidence of the existence and terms of the arrangement and that the arrangement complies with the provisions of subsection (4).  (4) The Minister shall not make an order under subsection (2) unless the arrangement, in consequence of which the order is made, is, in the opinion of the Minister  (a)    in conformity in all respects with the provisions of this Act containing restrictions on the extradition of fugitive offenders; and  (b)   substantially in conformity with the other provisions of this Act subject to the modifications, limitations or conditions, if any, specified in the order for the purpose of implementing the terms of such arrangement.  (5) Every order made under the proviso to subsection LAWS OF GUYANA                                                               Fugitive Offenders                Cap. 10:04 9  L.R.O. 1/2012     Extraditable offence.                                                   (1) or under subsection (2) shall be subject to negative resolution of the National Assembly.",
            "description": [
                {
                    "representation": "(1)",
                    "description": "or under subsection"
                },
                {
                    "representation": "(a)",
                    "description": "in conformity in all respects with the provisions of this Act containing restrictions on the extradition of fugitive offenders; and"
                },
                {
                    "representation": "(b)",
                    "description": "substantially in conformity with the other provisions of this Act subject to the modifications, limitations or conditions, if any, specified in the order for the purpose of implementing the terms of such arrangement."
                },
                {
                    "representation": "(2)",
                    "description": "shall be subject to negative resolution of the National Assembly."
                },
                {
                    "representation": "(3)",
                    "description": "Every order made under subsection"
                },
                {
                    "representation": "(4)",
                    "description": "The Minister shall not make an order under subsection"
                },
                {
                    "representation": "(5)",
                    "description": "Every order made under the proviso to subsection LAWS OF GUYANA                                                               Fugitive Offenders                Cap. 10:04 9  L.R.O. 1/2012     Extraditable offence."
                }
            ]
        }
    },
    {
        "act": "FUGITIVE OFFENDERS ACT",
        "source": "https://mola.gov.gy/laws-of-guyana",
        "type": {
            "name": "section",
            "representation": "5",
            "title": "Extraditable offence. ",
            "context": "FUGITIVE OFFENDERS ACT under Extraditable offence. 5. FUGITIVE OFFENDERS ACT LAWS OF GUYANA 4 Cap. 10:04                        Fugitive Offenders   L.R.O. 1/2012 SECTION",
            "description": "FUGITIVE OFFENDERS ACT LAWS OF GUYANA 4 Cap. 10:04                        Fugitive Offenders   L.R.O. 1/2012 SECTION"
        }
    },
    {
        "act": "FUGITIVE OFFENDERS ACT",
        "source": "https://mola.gov.gy/laws-of-guyana",
        "type": {
            "name": "section",
            "representation": "6",
            "title": "Mode of proof of certain arrangements.         PART III EXTRADITION FROM GUYANA  ",
            "context": "FUGITIVE OFFENDERS ACT under Mode of proof of certain arrangements.         PART III EXTRADITION FROM GUYANA  6. A certificate issued by the Minister assigned responsibility for foreign affairs, or on his behalf by any other person authorised by him  (a)  confirming the existence of an arrangement, referred to in section 4 (1) (a), made between the United Kingdom and the Government of a foreign territory, and that the arrangement extends to and remains in force in Guyana, and stating the terms thereof; or  (b)  confirming the existence of an arrangement referred to in section 4 (1) (b), made between the Government of Guyana and the Government of any foreign territory, and stating the terms thereof,   shall be admissible in evidence as conclusive proof of the matters stated therein without proof of the signature of that Minister or the other person or of the authorisation of the other person by the Minister.  PART III EXTRADITION  FROM  GUYANA",
            "description": [
                {
                    "representation": "(a)",
                    "description": "confirming the existence of an arrangement, referred to in section 4"
                },
                {
                    "representation": "(1)",
                    "description": "(b), made between the Government of Guyana and the Government of any foreign territory, and stating the terms thereof,   shall be admissible in evidence as conclusive proof of the matters stated therein without proof of the signature of that Minister or the other person or of the authorisation of the other person by the Minister.  PART III EXTRADITION  FROM  GUYANA"
                },
                {
                    "representation": "(b)",
                    "description": "confirming the existence of an arrangement referred to in section 4"
                }
            ]
        }
    },
    {
        "act": "FUGITIVE OFFENDERS ACT",
        "source": "https://mola.gov.gy/laws-of-guyana",
        "type": {
            "name": "section",
            "representation": "7",
            "title": "Persons liable to extradition from Guyana. ",
            "context": "FUGITIVE OFFENDERS ACT under Persons liable to extradition from Guyana. 7. Subject to this Act, a person found in Guyana who is accused of an Extraditable offence in any Commonwealth country or treaty territory, or who is alleged to be unlawfully at large after conviction of any such offence in any such country or territory, may be arrested and returned to that country or territory as provided by this Act.",
            "description": "Subject to this Act, a person found in Guyana who is accused of an Extraditable offence in any Commonwealth country or treaty territory, or who is alleged to be unlawfully at large after conviction of any such offence in any such country or territory, may be arrested and returned to that country or territory as provided by this Act."
        }
    },
    {
        "act": "FUGITIVE OFFENDERS ACT",
        "source": "https://mola.gov.gy/laws-of-guyana",
        "type": {
            "name": "section",
            "representation": "8",
            "title": "General restrictions on extradition. ",
            "context": "FUGITIVE OFFENDERS ACT under General restrictions on extradition. 8. (1) A person shall not be extradited under this Act from Guyana to a Commonwealth country or treaty territory, or be committed to, or held in, custody for the purposes of LAWS OF GUYANA                                                               Fugitive Offenders                Cap. 10:04 11  L.R.O. 1/2012                                                 such extradition, if it appears to the Minister, to the magistrate before whom he is brought in pursuance of a warrant issued under section 13, to the High Court, where any application under section 17 (l) or 19 (l) is made to that court, or to the Court of Appeal, having regard to any question of law arising in any appeal under section 21, that  (a)  the offence of which the person is accused or has been convicted is an offence of a political character;  (b)  the request for extradition, though purporting to be made on account of an extraditable offence, is in fact made for the purpose of prosecuting or punishing him on account of his race, tribe, sex,  religion, nationality or political opinions; or  (c)  he might, if extradited, be prejudiced at his trial or punished, detained or restricted in his personal liberty by reason of his race, tribe, sex, religion, nationality or political opinions.  (2) A person accused of an offence shall not be extradited from Guyana under this Act, other than under section 14, to any Commonwealth country or treaty territory or be committed to, or kept in, custody for the purpose of such extradition, if it appears to the Minister, or to the magistrate, the High Court or the Court of Appeal as aforesaid in subsection (l), that, if the person is charged with that offence in Guyana, he would be entitled to be discharged under any rule of law relating to previous acquittal or conviction.  (3) A person shall not be extradited from Guyana under this Act to any Commonwealth country or treaty LAWS OF GUYANA 12 Cap. 10:04                        Fugitive Offenders   L.R.O. 1/2012                                                 territory, or be committed to, or kept in, custody for the purpose of such extradition, unless provision has been made by the law of that Commonwealth country, or, in the case of a treaty territory, by the arrangement with that territory relating to the extradition of fugitive offenders, for securing that he will not  (a)  until he has left or has been free to leave that Commonwealth country or treaty territory, as the case may be, be arrested, detained, remanded or otherwise dealt with in that Commonwealth country or treaty territory for or in respect of any offence committed before his aforesaid extradition under this Act, other than  (i)  the extraditable offence in respect of which the said extradition under this Act is requested;  (ii)  any lesser offence proved by the facts established before the court before which he is brought in pursuance of a warrant issued under section 13; or  (iii)  any other extraditable offence in respect of which the Minister may consent to his being so dealt with; or  (b)  be extradited by the Government of that Commonwealth country or treaty territory to any other Commonwealth LAWS OF GUYANA                                                               Fugitive Offenders                Cap. 10:04 13  L.R.O. 1/2012                                                 country or foreign territory, to be dealt with for any offence committed before his aforesaid extradition under this Act, without the consent of the Minister.  (3A)(a) Notwithstanding anything contained in subsection 3 (b) or any other law or treaty a fugitive offender or any class or category of fugitive offenders may be committed to, or kept in custody for the purpose of extradition or may be extradited to the Commonwealth country or a treaty territory in connection with any extraditable offence, if the Minister considers it necessary in the interest of justice.  (b) In determining under paragraph (a) whether it is in the interest of justice, the Minister may take into account any relevant factors, including but not limited to, any creditable evidence that there is a likelihood of the fugitive offender being extradited to a third country from the Commonwealth country or a treaty territory.  (3B)(a) Notwithstanding the requirement of the express provision in subsection (3)(b) but subject to paragraph (b) a person may  be extradited from Guyana under this Act to any Commonwealth country or treaty territory and prior to the extradition, be committed to, or kept in custody for the purpose of extradition where the law of a Commonwealth country or a treaty with a treaty territory relating to the extradition of fugitive offenders does not contain the provision required by sub-section (3)(b).   (b) Where the law of a Commonwealth country or a treaty territory or a treaty relating to the extradition of fugitive offenders does not contain the provision required by the subsection (3)(b), the law or treaty shall by necessary implication be read and construed by the Minister, Magistrate, High Court, Full Court and Court of Appeal as if LAWS OF GUYANA 14 Cap. 10:04                        Fugitive Offenders   L.R.O. 1/2012                                             Request for extradition.   the provision was incorporated into the law or treaty.  (c) The right to complain of infractions, if any in the extradition agreements lies in the asylum state and the person whose extradition is sought is not entitled so to complain to the court in any proceedings.   (4) The reference in this section to an offence of a political character does not include an offence against the life or person of the Head of State, or a Minister, of Guyana or any Commonwealth country or treaty territory or any related offence referred to in section 5 (3), or an offence established under an international convention to which any Commonwealth country or treaty territory, as the case may be, and Guyana are parties and declared by such convention as an offence not of a political character for the purposes of extradition.  (5) In this section Head of State includes  (i)     any member of a collegial body performing the functions of a Head of State under the constitution of the state concerned; and  (ii)     any head of the Government of the state.  (6) For the purposes of this section an offence against the law of a Commonwealth country or a treaty territory may be regarded as being an offence of a political character notwithstanding that there are not competing political parties in that country or territory.",
            "description": [
                {
                    "representation": "(1)",
                    "description": "A person shall not be extradited under this Act from Guyana to a Commonwealth country or treaty territory, or be committed to, or held in, custody for the purposes of LAWS OF GUYANA                                                               Fugitive Offenders                Cap. 10:04 11  L.R.O. 1/2012                                                 such extradition, if it appears to the Minister, to the magistrate before whom he is brought in pursuance of a warrant issued under section 13, to the High Court, where any application under section 17"
                },
                {
                    "representation": "(l)",
                    "description": "is made to that court, or to the Court of Appeal, having regard to any question of law arising in any appeal under section 21, that"
                },
                {
                    "representation": "(a)",
                    "description": "Notwithstanding the requirement of the express provision in subsection"
                },
                {
                    "representation": "(b)",
                    "description": "Where the law of a Commonwealth country or a treaty territory or a treaty relating to the extradition of fugitive offenders does not contain the provision required by the subsection"
                },
                {
                    "representation": "(c)",
                    "description": "The right to complain of infractions, if any in the extradition agreements lies in the asylum state and the person whose extradition is sought is not entitled so to complain to the court in any proceedings."
                },
                {
                    "representation": "(2)",
                    "description": "A person accused of an offence shall not be extradited from Guyana under this Act, other than under section 14, to any Commonwealth country or treaty territory or be committed to, or kept in, custody for the purpose of such extradition, if it appears to the Minister, or to the magistrate, the High Court or the Court of Appeal as aforesaid in subsection"
                },
                {
                    "representation": "(3)",
                    "description": "A person shall not be extradited from Guyana under this Act to any Commonwealth country or treaty LAWS OF GUYANA 12 Cap. 10:04                        Fugitive Offenders   L.R.O. 1/2012                                                 territory, or be committed to, or kept in, custody for the purpose of such extradition, unless provision has been made by the law of that Commonwealth country, or, in the case of a treaty territory, by the arrangement with that territory relating to the extradition of fugitive offenders, for securing that he will not"
                },
                {
                    "representation": "(i)",
                    "description": "any member of a collegial body performing the functions of a Head of State under the constitution of the state concerned; and"
                },
                {
                    "representation": "(4)",
                    "description": "The reference in this section to an offence of a political character does not include an offence against the life or person of the Head of State, or a Minister, of Guyana or any Commonwealth country or treaty territory or any related offence referred to in section 5"
                },
                {
                    "representation": "(5)",
                    "description": "In this section Head of State includes"
                },
                {
                    "representation": "(6)",
                    "description": "For the purposes of this section an offence against the law of a Commonwealth country or a treaty territory may be regarded as being an offence of a political character notwithstanding that there are not competing political parties in that country or territory."
                }
            ]
        }
    },
    {
        "act": "FUGITIVE OFFENDERS ACT",
        "source": "https://mola.gov.gy/laws-of-guyana",
        "type": {
            "name": "section",
            "representation": "9",
            "title": "Request for extradition. ",
            "context": "FUGITIVE OFFENDERS ACT under Request for extradition. 9.(1) A request for the extradition to a Commonwealth country of a person who is, or is suspected to be in or to be arriving in, Guyana may be made to the LAWS OF GUYANA                                                               Fugitive Offenders                Cap. 10:04 15  L.R.O. 1/2012                                                 Minister (a)  by any person resident in Guyana who is recognised by the Minister as a consular officer of that Commonwealth country;  (b)  by the Head of State, Head of Government or any Minister of the Government of the Commonwealth country who communicates with the Minister through the diplomatic representative of Guyana in or for that Commonwealth country; or  (c)  by such other person or in such other manner as may be approved by the Minister where it is not convenient for any person referred to in paragraph (a) or (b) to make the request or, in the case of a person referred to in paragraph (b), to make the request in the manner provided in that paragraph.  (2) A request for the extradition to a treaty territory of a person who is, or is suspected to be in or to be arriving in, Guyana may be made to the Minister  (a)  by any person resident in Guyana who is recognised by the Minister as a consular officer of that treaty territory;  (b)  by any Minister of the treaty territory who communicates with the Minister through the diplomatic representative of Guyana in or for that treaty territory; or LAWS OF GUYANA 16 Cap. 10:04                        Fugitive Offenders   L.R.O. 1/2012                                                         Concurrent requests.     (c)  by such other person or in such other manner as may be approved by the Minister where it is not convenient for any person referred to in paragraph (a) or (b) to make the request or, in the case of a person referred to in paragraph (b), to make the request in the manner provided in that paragraph.  (3) A request made under subsection (1) or (2) by or on behalf of any Commonwealth country or treaty territory shall be accompanied by  (a)  in the case of a person accused of an offence, a warrant for his arrest issued in the Commonwealth country or treaty territory; or  (b)  in the case of a person unlawfully at large after conviction of an offence, a certificate of the conviction and sentence in the Commonwealth country or treaty territory and a statement of the part, if any, of such sentence which has been served,  together with, in each case, the particulars of the person whose extradition is requested and of the facts upon which and the law under which he is accused or has been convicted, and of the evidence sufficient to justify the issue of a warrant for his arrest under section",
            "description": [
                {
                    "representation": "(1)",
                    "description": "or"
                },
                {
                    "representation": "(a)",
                    "description": "in the case of a person accused of an offence, a warrant for his arrest issued in the Commonwealth country or treaty territory; or"
                },
                {
                    "representation": "(b)",
                    "description": "in the case of a person unlawfully at large after conviction of an offence, a certificate of the conviction and sentence in the Commonwealth country or treaty territory and a statement of the part, if any, of such sentence which has been served,  together with, in each case, the particulars of the person whose extradition is requested and of the facts upon which and the law under which he is accused or has been convicted, and of the evidence sufficient to justify the issue of a warrant for his arrest under section"
                },
                {
                    "representation": "(c)",
                    "description": "by such other person or in such other manner as may be approved by the Minister where it is not convenient for any person referred to in paragraph"
                },
                {
                    "representation": "(2)",
                    "description": "by or on behalf of any Commonwealth country or treaty territory shall be accompanied by"
                },
                {
                    "representation": "(3)",
                    "description": "A request made under subsection"
                }
            ]
        }
    },
    {
        "act": "FUGITIVE OFFENDERS ACT",
        "source": "https://mola.gov.gy/laws-of-guyana",
        "type": {
            "name": "section",
            "representation": "10",
            "title": "Concurrent requests. ",
            "context": "FUGITIVE OFFENDERS ACT under Concurrent requests. 10. Where in respect of any person, the Minister receives requests for his extradition from Guyana  (a)  from more than one Commonwealth LAWS OF GUYANA                                                               Fugitive Offenders                Cap. 10:04 17  L.R.O. 1/2012                    Powers of Minister on request made under section 8 (3) (a) (iii) or (b).                                country;  (b)  from more than one treaty territory; or (c)  from one or more Commonwealth countries and one or more treaty territories,   that person may, subject to the other provisions of this Act, be ordered to be extradited in response to the request of that Commonwealth country or treaty territory which, having regard to all the circumstances, should, in the opinion of the Minister, be preferred.",
            "description": [
                {
                    "representation": "(a)",
                    "description": "from more than one Commonwealth LAWS OF GUYANA                                                               Fugitive Offenders                Cap. 10:04 17  L.R.O. 1/2012                    Powers of Minister on request made under section 8"
                },
                {
                    "representation": "(3)",
                    "description": "(a)"
                },
                {
                    "representation": "(b)",
                    "description": "from more than one treaty territory; or"
                },
                {
                    "representation": "(c)",
                    "description": "from one or more Commonwealth countries and one or more treaty territories,   that person may, subject to the other provisions of this Act, be ordered to be extradited in response to the request of that Commonwealth country or treaty territory which, having regard to all the circumstances, should, in the opinion of the Minister, be preferred."
                }
            ]
        }
    },
    {
        "act": "FUGITIVE OFFENDERS ACT",
        "source": "https://mola.gov.gy/laws-of-guyana",
        "type": {
            "name": "section",
            "representation": "11",
            "title": "Powers of Minister on request made under section 8(3) (a) (iii) or (b). ",
            "context": "FUGITIVE OFFENDERS ACT under Powers of Minister on request made under section 8(3) (a) (iii) or (b). 11. (1) Where a request is made by or on behalf of a Commonwealth country, or treaty territory for the consent of the Minister in respect of an extraditable offence referred to in section 8(3)(a)(iii), the Minister may call for such information as he may deem necessary for the purpose of satisfying himself that such request relates to an extraditable offence for which extradition is not prohibited by this Act and may refuse consent where he is not so satisfied or is of opinion that, on the facts known to the Commonwealth country or treaty territory at the time of the request for the extradition of the fugitive offender, a request for his extradition in respect of that offence could also have been made.  (2) Where a request is made for the consent of the Minister for the extradition of a fugitive offender under section 8 (3) (b), the Minister may call for such information as he may deem necessary for the purpose of satisfying himself that the request does not relate to an offence for which extradition is prohibited by this Act and may refuse consent where he is not so satisfied.  (3) The powers of the Minister referred to in this section shall be without prejudice to any other power he may have under this Act. LAWS OF GUYANA 18 Cap. 10:04                        Fugitive Offenders   L.R.O. 1/2012  Authority to proceed. Form",
            "description": [
                {
                    "representation": "(1)",
                    "description": "Where a request is made by or on behalf of a Commonwealth country, or treaty territory for the consent of the Minister in respect of an extraditable offence referred to in section 8(3)(a)(iii), the Minister may call for such information as he may deem necessary for the purpose of satisfying himself that such request relates to an extraditable offence for which extradition is not prohibited by this Act and may refuse consent where he is not so satisfied or is of opinion that, on the facts known to the Commonwealth country or treaty territory at the time of the request for the extradition of the fugitive offender, a request for his extradition in respect of that offence could also have been made."
                },
                {
                    "representation": "(2)",
                    "description": "Where a request is made for the consent of the Minister for the extradition of a fugitive offender under section 8"
                },
                {
                    "representation": "(3)",
                    "description": "The powers of the Minister referred to in this section shall be without prejudice to any other power he may have under this Act. LAWS OF GUYANA 18 Cap. 10:04                        Fugitive Offenders   L.R.O. 1/2012  Authority to proceed. Form"
                }
            ]
        }
    },
    {
        "act": "FUGITIVE OFFENDERS ACT",
        "source": "https://mola.gov.gy/laws-of-guyana",
        "type": {
            "name": "section",
            "representation": "12",
            "title": "Authority to proceed. ",
            "context": "FUGITIVE OFFENDERS ACT under Authority to proceed. 12.(1) On receipt of a request under section 9 the Minister may issue an order in Form 1 (hereinafter referred to as authority to proceed) signifying to a magistrate that the request for the extradition of the person mentioned in the order has been received and requiring the magistrate to proceed with the case in accordance with the provisions of this Act.  (2) The Minister shall not issue an authority to proceed if it appears to him that an order for the extradition of the person concerned could not lawfully be made, or would not in fact be made, in accordance with this Act.  (3) Subject to this Act, no person shall be dealt with by a magistrate under this Act except in pursuance of an authority to proceed issued by the Minister.",
            "description": [
                {
                    "representation": "(1)",
                    "description": "On receipt of a request under section 9 the Minister may issue an order in Form 1"
                },
                {
                    "representation": "(2)",
                    "description": "The Minister shall not issue an authority to proceed if it appears to him that an order for the extradition of the person concerned could not lawfully be made, or would not in fact be made, in accordance with this Act."
                },
                {
                    "representation": "(3)",
                    "description": "Subject to this Act, no person shall be dealt with by a magistrate under this Act except in pursuance of an authority to proceed issued by the Minister."
                }
            ]
        }
    },
    {
        "act": "FUGITIVE OFFENDERS ACT",
        "source": "https://mola.gov.gy/laws-of-guyana",
        "type": {
            "name": "section",
            "representation": "13",
            "title": "Arrest for purposes of committal. ",
            "context": "FUGITIVE OFFENDERS ACT under Arrest for purposes of committal. 13.",
            "description": "13."
        }
    },
    {
        "act": "FUGITIVE OFFENDERS ACT",
        "source": "https://mola.gov.gy/laws-of-guyana",
        "type": {
            "name": "section",
            "representation": "14",
            "title": "Consent order for return. ",
            "context": "FUGITIVE OFFENDERS ACT under Consent order for return. 14. (1) Where the extradition of any person from Guyana is requested under this Act by a Commonwealth country or a treaty territory and such person is arrested in pursuance of any warrant under section 13, he may request LAWS OF GUYANA 20 Cap. 10:04                        Fugitive Offenders   L.R.O. 1/2012         Form",
            "description": [
                {
                    "representation": "(1)",
                    "description": "Where the extradition of any person from Guyana is requested under this Act by a Commonwealth country or a treaty territory and such person is arrested in pursuance of any warrant under section 13, he may request LAWS OF GUYANA 20 Cap. 10:04                        Fugitive Offenders   L.R.O. 1/2012         Form"
                }
            ]
        }
    },
    {
        "act": "FUGITIVE OFFENDERS ACT",
        "source": "https://mola.gov.gy/laws-of-guyana",
        "type": {
            "name": "section",
            "representation": "15",
            "title": "Proceedings for committal. ",
            "context": "FUGITIVE OFFENDERS ACT under Proceedings for committal. 15.       (2) Where the Minister consents to the request made by such person under subsection (1), after being satisfied that such person understands the consequences of the request, the Minister may, without any proceedings before a magistrate under section 15, make an order in Form 4 directing the person to be committed to custody, to be kept there for the purposes of his extradition unless admitted to bail; and at any time thereafter the Minister shall, with the consent of such person, by warrant in Form 5 order him to be extradited to the Commonwealth country or treaty territory by which the request for his extradition was made.  (3) Where a person whose extradition has been ordered under subsection (2) withdraws his consent to the order before his departure from Guyana, he shall be brought as soon as practicable before a magistrate for the purposes of proceedings under section 15, and thereupon shall be dealt with as if the Minister had not made the order.  (4) The provisions of sections 8(3) and 11 shall apply to the extradition of any person under this section unless, on a request made by that person, the Minister agrees to the waiver thereof.",
            "description": [
                {
                    "representation": "(2)",
                    "description": "withdraws his consent to the order before his departure from Guyana, he shall be brought as soon as practicable before a magistrate for the purposes of proceedings under section 15, and thereupon shall be dealt with as if the Minister had not made the order."
                },
                {
                    "representation": "(3)",
                    "description": "Where a person whose extradition has been ordered under subsection"
                },
                {
                    "representation": "(4)",
                    "description": "The provisions of sections 8(3) and 11 shall apply to the extradition of any person under this section unless, on a request made by that person, the Minister agrees to the waiver thereof."
                }
            ]
        }
    },
    {
        "act": "FUGITIVE OFFENDERS ACT",
        "source": "https://mola.gov.gy/laws-of-guyana",
        "type": {
            "name": "section",
            "representation": "16",
            "title": "Information as to right to apply for habeas corpus. ",
            "context": "FUGITIVE OFFENDERS ACT under Information as to right to apply for habeas corpus. 16. Where a person is committed to custody under section 15 (4) the court of committal shall inform him in ordinary language of his right to make an application to the High Court, within the period allowed by section 17, for habeas corpus and shall forthwith give notice of the committal to the  Minister.",
            "description": [
                {
                    "representation": "(4)",
                    "description": "the court of committal shall inform him in ordinary language of his right to make an application to the High Court, within the period allowed by section 17, for habeas corpus and shall forthwith give notice of the committal to the  Minister."
                }
            ]
        }
    },
    {
        "act": "FUGITIVE OFFENDERS ACT",
        "source": "https://mola.gov.gy/laws-of-guyana",
        "type": {
            "name": "section",
            "representation": "17",
            "title": "Application for habeas corpus. ",
            "context": "FUGITIVE OFFENDERS ACT under Application for habeas corpus. 17. (1) A person committed to custody under section 15 (4) may make an application to the High Court for habeas corpus within fifteen days from the day on which the order of committal is made and, on such application, the High Court may, without prejudice to any other jurisdiction of that Court, exercise any of the powers conferred upon it by this Act.  (2) On an application made by any person under subsection (1), the High Court may order the person committed to be discharged from custody if that court is satisfied that by reason of  (a)  the trivial nature of the offence of which he is accused or was convicted;  (b)  the passage of time since he is alleged to have committed it or to have become unlawfully at large, as the case may be;  (c)  the accusation against him being not made in good faith or in the interests of justice; or  (d)  any other sufficient cause,  it would, having regard to all the circumstances, be unjust or oppressive to extradite him.",
            "description": [
                {
                    "representation": "(1)",
                    "description": "A person committed to custody under section 15"
                },
                {
                    "representation": "(4)",
                    "description": "may make an application to the High Court for habeas corpus within fifteen days from the day on which the order of committal is made and, on such application, the High Court may, without prejudice to any other jurisdiction of that Court, exercise any of the powers conferred upon it by this Act."
                },
                {
                    "representation": "(2)",
                    "description": "On an application made by any person under subsection"
                },
                {
                    "representation": "(a)",
                    "description": "the trivial nature of the offence of which he is accused or was convicted;"
                },
                {
                    "representation": "(b)",
                    "description": "the passage of time since he is alleged to have committed it or to have become unlawfully at large, as the case may be;"
                },
                {
                    "representation": "(c)",
                    "description": "the accusation against him being not made in good faith or in the interests of justice; or"
                },
                {
                    "representation": "(d)",
                    "description": "any other sufficient cause,  it would, having regard to all the circumstances, be unjust or oppressive to extradite him."
                }
            ]
        }
    },
    {
        "act": "FUGITIVE OFFENDERS ACT",
        "source": "https://mola.gov.gy/laws-of-guyana",
        "type": {
            "name": "section",
            "representation": "18",
            "title": "Extradition to be delayed in certain cases. ",
            "context": "FUGITIVE OFFENDERS ACT under Extradition to be delayed in certain cases. 18. (1) A person committed to custody under section 15 (4) shall not be extradited under this Act LAWS OF GUYANA                                                               Fugitive Offenders                Cap. 10:04 23  L.R.O. 1/2012                                        Application for review by requesting Government.                (a)  until the expiration of the time allowed by section 17 (1) for the making, by him, of an application to the High Court for habeas corpus; and  (b)  if any such application is made to the High Court, so long as proceedings on that application are pending.  (2) For the purposes of this section proceedings on an application for habeas corpus made to the High Court shall be deemed to be pending  (a)  until the expiration of the time allowed by section 21 for the making of an appeal to the Court of Appeal from the decision of the High Court on the application; and  (b)  where any such appeal is made to the Court of Appeal, until the appeal is disposed of.",
            "description": [
                {
                    "representation": "(1)",
                    "description": "for the making, by him, of an application to the High Court for habeas corpus; and"
                },
                {
                    "representation": "(4)",
                    "description": "shall not be extradited under this Act LAWS OF GUYANA                                                               Fugitive Offenders                Cap. 10:04 23  L.R.O. 1/2012                                        Application for review by requesting Government."
                },
                {
                    "representation": "(a)",
                    "description": "until the expiration of the time allowed by section 21 for the making of an appeal to the Court of Appeal from the decision of the High Court on the application; and"
                },
                {
                    "representation": "(b)",
                    "description": "where any such appeal is made to the Court of Appeal, until the appeal is disposed of."
                },
                {
                    "representation": "(2)",
                    "description": "For the purposes of this section proceedings on an application for habeas corpus made to the High Court shall be deemed to be pending"
                }
            ]
        }
    },
    {
        "act": "FUGITIVE OFFENDERS ACT",
        "source": "https://mola.gov.gy/laws-of-guyana",
        "type": {
            "name": "section",
            "representation": "19",
            "title": "Application for review by requesting Government. ",
            "context": "FUGITIVE OFFENDERS ACT under Application for review by requesting Government. 19. (1) Where a person, whose extradition is requested by the Government of a Commonwealth country or a treaty territory is ordered by a magistrate under section 15 (4) to be discharged from custody, the Government which requested the extradition of that person may, within fifteen days of the making of the order by the magistrate, apply to the High Court for review of the order of discharge on any question of law or fact and on such application being made the High Court may review the order.  (2) Where any Government referred to in subsection (1) desires to make any application thereunder that Government shall, at the time of the making of the order of discharge by the magistrate, give to the magistrate notice of LAWS OF GUYANA 24 Cap. 10:04                        Fugitive Offenders   L.R.O. 1/2012                                                   its intention to apply to the High Court for review of the order and such notice shall operate as a stay of the order of the magistrate  (a)  until the expiration of the time allowed by this section for the making of the application to the High Court for the review of the order of discharge; and  (b)  if any such application is made to the High Court, until the determination of the application by the High Court.  (3) Where any Government referred to in subsection (1) gives notice of its intention to apply for review of the order of discharge, the magistrate shall immediately grant bail to the person in respect of whom the order of discharge has been made, pending the determination by the High Court of the application.  (4) Upon application for review of the order of the magistrate being made by the Government referred to in subsection (1), the Registrar of the High Court shall immediately make a request to the magistrate for a statement of the evidence tendered before the magistrate and on which the magistrate came to his decision and of his reasons for his decision and his finding on any question of law or fact under review, and the magistrate shall, with all convenient dispatch, transmit the same to the Registrar.  (5) The High Court may, on an application made to it by any Government referred to in subsection (1), and if that Court is satisfied that the magistrate has erred on a question of law or fact raised in the application, direct the magistrate to commit the person so discharged to custody to await his extradition and shall forthwith inform the Minister of the decision. LAWS OF GUYANA                                                               Fugitive Offenders                Cap. 10:04 25  L.R.O. 1/2012      Power of High Court to receive additional evidence.    Appeal to Court of Appeal.",
            "description": [
                {
                    "representation": "(1)",
                    "description": "gives notice of its intention to apply for review of the order of discharge, the magistrate shall immediately grant bail to the person in respect of whom the order of discharge has been made, pending the determination by the High Court of the application."
                },
                {
                    "representation": "(4)",
                    "description": "Upon application for review of the order of the magistrate being made by the Government referred to in subsection"
                },
                {
                    "representation": "(2)",
                    "description": "Where any Government referred to in subsection"
                },
                {
                    "representation": "(a)",
                    "description": "until the expiration of the time allowed by this section for the making of the application to the High Court for the review of the order of discharge; and"
                },
                {
                    "representation": "(b)",
                    "description": "if any such application is made to the High Court, until the determination of the application by the High Court."
                },
                {
                    "representation": "(3)",
                    "description": "Where any Government referred to in subsection"
                },
                {
                    "representation": "(5)",
                    "description": "The High Court may, on an application made to it by any Government referred to in subsection"
                }
            ]
        }
    },
    {
        "act": "FUGITIVE OFFENDERS ACT",
        "source": "https://mola.gov.gy/laws-of-guyana",
        "type": {
            "name": "section",
            "representation": "20",
            "title": "Power of High Court to receive additional evidence. ",
            "context": "FUGITIVE OFFENDERS ACT under Power of High Court to receive additional evidence. 20. On an application for habeas corpus under section 17 or for review under section 19, the High Court may receive additional evidence relevant to the exercise of its jurisdiction under section 8 or under section 17 (2).",
            "description": "On an application for habeas corpus under section 17 or for review under section 19, the High Court may receive additional evidence relevant to the exercise of its jurisdiction under section 8 or under section 17 (2)."
        }
    },
    {
        "act": "FUGITIVE OFFENDERS ACT",
        "source": "https://mola.gov.gy/laws-of-guyana",
        "type": {
            "name": "section",
            "representation": "21",
            "title": "Appeal to Court of Appeal. ",
            "context": "FUGITIVE OFFENDERS ACT under Appeal to Court of Appeal. 21. (1) Any person whose extradition is sought, or the Government of any Commonwealth country or treaty territory which is seeking his extradition, if dissatisfied with the decision of the High Court on an application for habeas corpus under section 17 or on application for review under section 19, may, within fifteen days of the pronouncing of the decision, appeal to the Court of Appeal on any question of law.  (2) Where any person or Government desires to appeal under subsection (1) the person or the Government, as the case may be, shall at the time of the pronouncing of the decision of the High Court, give to the High Court notice of his or its intention to appeal to the Court of Appeal and any such notice shall operate as a stay of the decision of the High Court  (a)  until the expiration of the time allowed for making the appeal to the Court of Appeal under subsection (l); and  (b)  if any such appeal is made under subsection (1), until the determination of the appeal by the Court of Appeal.  (3) Where any Government referred to in subsection (l) gives notice of its intention to appeal to the Court of Appeal under that subsection, the High Court shall immediately grant bail to the person whose extradition is sought if he is in custody, or, if he has been granted bail under section 19(3), he shall continue to be on bail, pending LAWS OF GUYANA 26 Cap. 10:04                        Fugitive Offenders   L.R.O. 1/2012                                         Bail in certain cases.                 Magistrate to comply with direction under section 19 (5) or 21 (5). Form",
            "description": [
                {
                    "representation": "(1)",
                    "description": "the person or the Government, as the case may be, shall at the time of the pronouncing of the decision of the High Court, give to the High Court notice of his or its intention to appeal to the Court of Appeal and any such notice shall operate as a stay of the decision of the High Court"
                },
                {
                    "representation": "(2)",
                    "description": "Where any person or Government desires to appeal under subsection"
                },
                {
                    "representation": "(a)",
                    "description": "until the expiration of the time allowed for making the appeal to the Court of Appeal under subsection"
                },
                {
                    "representation": "(b)",
                    "description": "if any such appeal is made under subsection"
                },
                {
                    "representation": "(3)",
                    "description": "Where any Government referred to in subsection"
                },
                {
                    "representation": "(l)",
                    "description": "gives notice of its intention to appeal to the Court of Appeal under that subsection, the High Court shall immediately grant bail to the person whose extradition is sought if he is in custody, or, if he has been granted bail under section 19(3), he shall continue to be on bail, pending LAWS OF GUYANA 26 Cap. 10:04                        Fugitive Offenders   L.R.O. 1/2012                                         Bail in certain cases.                 Magistrate to comply with direction under section 19"
                },
                {
                    "representation": "(5)",
                    "description": "or 21"
                }
            ]
        }
    },
    {
        "act": "FUGITIVE OFFENDERS ACT",
        "source": "https://mola.gov.gy/laws-of-guyana",
        "type": {
            "name": "section",
            "representation": "22",
            "title": "Bail in certain cases. ",
            "context": "FUGITIVE OFFENDERS ACT under Bail in certain cases. 22. Without prejudice to the provisions of sections 19 (3) and 21(3), the High Court, where an application has been made to it under section 17 for habeas corpus by a person who has been committed to custody, or the Court of Appeal, where an appeal has been made to it under section 21 by any person whose extradition is sought, having regard to all the circumstances of the case, may grant bail to the person.",
            "description": [
                {
                    "representation": "(3)",
                    "description": "and 21(3), the High Court, where an application has been made to it under section 17 for habeas corpus by a person who has been committed to custody, or the Court of Appeal, where an appeal has been made to it under section 21 by any person whose extradition is sought, having regard to all the circumstances of the case, may grant bail to the person."
                }
            ]
        }
    },
    {
        "act": "FUGITIVE OFFENDERS ACT",
        "source": "https://mola.gov.gy/laws-of-guyana",
        "type": {
            "name": "section",
            "representation": "23",
            "title": "Magistrate to comply with direction under section 19 (5) or (21)",
            "context": "FUGITIVE OFFENDERS ACT under Magistrate to comply with direction under section 19 (5) or (21)23. The magistrate shall, on receipt of any direction under section 19(5) or 21(5) comply with such direction and for that purpose may, if the person in respect of whom the direction is given is not in custody, issue a warrant for his arrest and on his apprehension commit him to custody by LAWS OF GUYANA                                                               Fugitive Offenders                Cap. 10:04 27  L.R.O. 1/2012      Evidence for extradition.                                            warrant in Form",
            "description": [
                {
                    "representation": "(5)",
                    "description": "or 21(5) comply with such direction and for that purpose may, if the person in respect of whom the direction is given is not in custody, issue a warrant for his arrest and on his apprehension commit him to custody by LAWS OF GUYANA                                                               Fugitive Offenders                Cap. 10:04 27  L.R.O. 1/2012      Evidence for extradition.                                            warrant in Form"
                }
            ]
        }
    },
    {
        "act": "FUGITIVE OFFENDERS ACT",
        "source": "https://mola.gov.gy/laws-of-guyana",
        "type": {
            "name": "section",
            "representation": "24",
            "title": "Evidence for extradition. ",
            "context": "FUGITIVE OFFENDERS ACT under Evidence for extradition. 24. (1) In any proceedings under this Act, including proceedings on an application for habeas corpus under section 17 or for review under section 19  (a)  a document, duly authenticated, which purports to set out evidence given on oath or affirmation in a Commonwealth country or treaty territory shall be admissible as evidence of the matters stated therein;   (b)  a document, duly authenticated, which purports to have been received in evidence, or to be copy of a document so received, in any proceedings in any Commonwealth country or treaty territory shall be admissible in evidence; and  (c)  a document, duly authenticated, which certifies that a person was convicted on a date specified in the document of an offence against the law of, or a part of, any Commonwealth country or treaty territory shall be admissible as evidence of the fact and the date of the conviction.  (2) A document shall be deemed to be duly authenticated for the purposes of this section  (a)  in the case of a document purporting to set out evidence given as aforesaid, if the document purports to be certified by a judge or magistrate or LAWS OF GUYANA 28 Cap. 10:04                        Fugitive Offenders   L.R.O. 1/2012                                           Evidence for fugitive offender.      other officer in or of the Commonwealth country or treaty territory in question to be the original document containing or recording that evidence or a true copy of such document;  (b)  in the case of a document which purports to have been received in evidence as aforesaid or to be a copy of a document so received, if the document purports to be certified as aforesaid to have been, or to be a true copy of a document which has been, so received; and  (c)  in the case of a document which certifies that a person was convicted as aforesaid, if the document purports to be certified as aforesaid,   and, in any such case, the document purports to be authenticated either by the oath or affirmation of a witness, or by the official seal of a Minister, or a secretary or other officer administering a department of the Government, of the Commonwealth country or treaty territory in question.  (3) Nothing in this section shall be deemed or construed to affect or prejudice the admission in evidence of any document which is admissible in evidence otherwise than under this section.",
            "description": [
                {
                    "representation": "(1)",
                    "description": "In any proceedings under this Act, including proceedings on an application for habeas corpus under section 17 or for review under section 19"
                },
                {
                    "representation": "(a)",
                    "description": "in the case of a document purporting to set out evidence given as aforesaid, if the document purports to be certified by a judge or magistrate or LAWS OF GUYANA 28 Cap. 10:04                        Fugitive Offenders   L.R.O. 1/2012                                           Evidence for fugitive offender.      other officer in or of the Commonwealth country or treaty territory in question to be the original document containing or recording that evidence or a true copy of such document;"
                },
                {
                    "representation": "(b)",
                    "description": "in the case of a document which purports to have been received in evidence as aforesaid or to be a copy of a document so received, if the document purports to be certified as aforesaid to have been, or to be a true copy of a document which has been, so received; and"
                },
                {
                    "representation": "(c)",
                    "description": "in the case of a document which certifies that a person was convicted as aforesaid, if the document purports to be certified as aforesaid,   and, in any such case, the document purports to be authenticated either by the oath or affirmation of a witness, or by the official seal of a Minister, or a secretary or other officer administering a department of the Government, of the Commonwealth country or treaty territory in question."
                },
                {
                    "representation": "(2)",
                    "description": "A document shall be deemed to be duly authenticated for the purposes of this section"
                },
                {
                    "representation": "(3)",
                    "description": "Nothing in this section shall be deemed or construed to affect or prejudice the admission in evidence of any document which is admissible in evidence otherwise than under this section."
                }
            ]
        }
    },
    {
        "act": "FUGITIVE OFFENDERS ACT",
        "source": "https://mola.gov.gy/laws-of-guyana",
        "type": {
            "name": "section",
            "representation": "25",
            "title": "Evidence for fugitive offender. ",
            "context": "FUGITIVE OFFENDERS ACT under Evidence for fugitive offender. 25. A magistrate shall receive any relevant evidence, that is tendered by or on behalf of any person whose extradition has been sought, in the manner provided by section 24, to show  (a)  that the offence of which the person is LAWS OF GUYANA                                                               Fugitive Offenders                Cap. 10:04 29  L.R.O. 1/2012               Order for extradition.               Form",
            "description": [
                {
                    "representation": "(a)",
                    "description": "that the offence of which the person is LAWS OF GUYANA                                                               Fugitive Offenders                Cap. 10:04 29  L.R.O. 1/2012               Order for extradition.               Form"
                }
            ]
        }
    },
    {
        "act": "FUGITIVE OFFENDERS ACT",
        "source": "https://mola.gov.gy/laws-of-guyana",
        "type": {
            "name": "section",
            "representation": "26",
            "title": "Order for extradition. ",
            "context": "FUGITIVE OFFENDERS ACT under Order for extradition. 26.",
            "description": "26."
        }
    },
    {
        "act": "FUGITIVE OFFENDERS ACT",
        "source": "https://mola.gov.gy/laws-of-guyana",
        "type": {
            "name": "section",
            "representation": "27",
            "title": "Discharge in case of delay in extradition. ",
            "context": "FUGITIVE OFFENDERS ACT under Discharge in case of delay in extradition. 27. (1) If any person committed to await his extradition is in custody in Guyana under this Act after the expiration of the following period that is to say  (a)  in any case, the period of two months commencing on the first day on which, having regard to sections 18 (1) and 21 (2), he could have been extradited; or  (b)  where a warrant for his extradition has been issued under section 26, a period of one month commencing on the day on which that warrant was issued,   he may apply to the High Court for his discharge from custody.  (2) If, upon any such application, the High Court is satisfied that reasonable notice of the proposed application has been given to the Minister, that Court may, unless sufficient cause is shown to the contrary, by order direct the applicant to be discharged from custody and, if a warrant for his extradition has been issued under section 26, quash that warrant. LAWS OF GUYANA 32 Cap. 10:04                        Fugitive Offenders   L.R.O. 1/2012                            Execution of warrant under section",
            "description": [
                {
                    "representation": "(1)",
                    "description": "and 21"
                },
                {
                    "representation": "(a)",
                    "description": "in any case, the period of two months commencing on the first day on which, having regard to sections 18"
                },
                {
                    "representation": "(b)",
                    "description": "where a warrant for his extradition has been issued under section 26, a period of one month commencing on the day on which that warrant was issued,   he may apply to the High Court for his discharge from custody."
                },
                {
                    "representation": "(2)",
                    "description": "If, upon any such application, the High Court is satisfied that reasonable notice of the proposed application has been given to the Minister, that Court may, unless sufficient cause is shown to the contrary, by order direct the applicant to be discharged from custody and, if a warrant for his extradition has been issued under section 26, quash that warrant. LAWS OF GUYANA 32 Cap. 10:04                        Fugitive Offenders   L.R.O. 1/2012                            Execution of warrant under section"
                }
            ]
        }
    },
    {
        "act": "FUGITIVE OFFENDERS ACT",
        "source": "https://mola.gov.gy/laws-of-guyana",
        "type": {
            "name": "section",
            "representation": "28",
            "title": "Execution of warrant under section ",
            "context": "FUGITIVE OFFENDERS ACT under Execution of warrant under section 28. A warrant under section 26 ordering the extradition of a person to any Commonwealth country or treaty territory shall be sufficient authority for all persons to whom it is directed and all police constables to receive that person, keep him in custody and convey him into the jurisdiction of that country or territory.",
            "description": "A warrant under section 26 ordering the extradition of a person to any Commonwealth country or treaty territory shall be sufficient authority for all persons to whom it is directed and all police constables to receive that person, keep him in custody and convey him into the jurisdiction of that country or territory."
        }
    },
    {
        "act": "FUGITIVE OFFENDERS ACT",
        "source": "https://mola.gov.gy/laws-of-guyana",
        "type": {
            "name": "section",
            "representation": "29",
            "title": "Custody. ",
            "context": "FUGITIVE OFFENDERS ACT under Custody. 29. (1) Any person remanded or committed to custody under any provision of this Act shall be remanded or committed to a like institution as a person charged with an offence before the court of committal.  (2) If any person, who is in custody in Guyana by virtue of a warrant under this Act, escapes out of custody, he may be apprehended in any part of Guyana in like manner as a person escaping from custody under a warrant for his arrest issued in Guyana in respect of an offence committed therein.  (3) Where a person, being in custody in any part of Guyana, whether under this Act or otherwise, is required to be removed in custody under this Act to another part of Guyana and is so removed by sea or air, he shall be deemed to be in legal custody until he reaches the place to which he is required to be removed.",
            "description": [
                {
                    "representation": "(1)",
                    "description": "Any person remanded or committed to custody under any provision of this Act shall be remanded or committed to a like institution as a person charged with an offence before the court of committal."
                },
                {
                    "representation": "(2)",
                    "description": "If any person, who is in custody in Guyana by virtue of a warrant under this Act, escapes out of custody, he may be apprehended in any part of Guyana in like manner as a person escaping from custody under a warrant for his arrest issued in Guyana in respect of an offence committed therein."
                },
                {
                    "representation": "(3)",
                    "description": "Where a person, being in custody in any part of Guyana, whether under this Act or otherwise, is required to be removed in custody under this Act to another part of Guyana and is so removed by sea or air, he shall be deemed to be in legal custody until he reaches the place to which he is required to be removed."
                }
            ]
        }
    },
    {
        "act": "FUGITIVE OFFENDERS ACT",
        "source": "https://mola.gov.gy/laws-of-guyana",
        "type": {
            "name": "section",
            "representation": "30",
            "title": "Delivering up person for extradition. ",
            "context": "FUGITIVE OFFENDERS ACT under Delivering up person for extradition. 30. (1) Where the Minister has made an order under section 26 ordering the extradition of any person to a Commonwealth country or treaty territory, the Minister may, by order under his hand, direct any person who has the custody of the person to surrender that person to such LAWS OF GUYANA                                                               Fugitive Offenders                Cap. 10:04 33  L.R.O. 1/2012                 Powers of custodian of extradited person.                  Property found on persons arrested under this Act.       Expenses.              persons (to be named in order) as are, in the opinion of the Minister, duly authorised to receive the person in the name and on behalf of that Commonwealth country or treaty territory, as the case may be.  (2) A person is extradited under this Act when he is delivered, as ordered by the Minister, into the custody of the persons named in the order under subsection (1).",
            "description": [
                {
                    "representation": "(1)",
                    "description": "Where the Minister has made an order under section 26 ordering the extradition of any person to a Commonwealth country or treaty territory, the Minister may, by order under his hand, direct any person who has the custody of the person to surrender that person to such LAWS OF GUYANA                                                               Fugitive Offenders                Cap. 10:04 33  L.R.O. 1/2012                 Powers of custodian of extradited person.                  Property found on persons arrested under this Act.       Expenses.              persons"
                },
                {
                    "representation": "(2)",
                    "description": "A person is extradited under this Act when he is delivered, as ordered by the Minister, into the custody of the persons named in the order under subsection"
                }
            ]
        }
    },
    {
        "act": "FUGITIVE OFFENDERS ACT",
        "source": "https://mola.gov.gy/laws-of-guyana",
        "type": {
            "name": "section",
            "representation": "31",
            "title": "Powers of custodian of extradited person. ",
            "context": "FUGITIVE OFFENDERS ACT under Powers of custodian of extradited person. 31. The persons to whom a fugitive offender is surrendered pursuant to an order under section 30 may  (a)  receive and hold the fugitive offender within the jurisdiction of Guyana; and  (b)  convey the fugitive offender to a place within the Commonwealth country or treaty territory to which he has been extradited under this Act.",
            "description": [
                {
                    "representation": "(a)",
                    "description": "receive and hold the fugitive offender within the jurisdiction of Guyana; and"
                },
                {
                    "representation": "(b)",
                    "description": "convey the fugitive offender to a place within the Commonwealth country or treaty territory to which he has been extradited under this Act."
                }
            ]
        }
    },
    {
        "act": "FUGITIVE OFFENDERS ACT",
        "source": "https://mola.gov.gy/laws-of-guyana",
        "type": {
            "name": "section",
            "representation": "32",
            "title": "Property found on persons arrested under this Act. ",
            "context": "FUGITIVE OFFENDERS ACT under Property found on persons arrested under this Act. 32. Everything found in the possession of a person at the time of his arrest under this Act that may be material evidence in proving the extraditable offence may be delivered up with the person on his extradition, but such delivery shall be subject to the rights of third parties with regard to that thing.",
            "description": "Everything found in the possession of a person at the time of his arrest under this Act that may be material evidence in proving the extraditable offence may be delivered up with the person on his extradition, but such delivery shall be subject to the rights of third parties with regard to that thing."
        }
    },
    {
        "act": "FUGITIVE OFFENDERS ACT",
        "source": "https://mola.gov.gy/laws-of-guyana",
        "type": {
            "name": "section",
            "representation": "33",
            "title": "Expenses.  PART IV EXTRADITION TO GUYANA  ",
            "context": "FUGITIVE OFFENDERS ACT under Expenses.  PART IV EXTRADITION TO GUYANA  33. All expenses incurred in respect of any person whose extradition is sought shall be paid by the Commonwealth country or treaty territory that requests his extradition under this Act unless other provisions for the payment of the expenses have been made by treaty, convention or other arrangement, between Guyana and that Commonwealth country or treaty territory.     LAWS OF GUYANA 34 Cap. 10:04                        Fugitive Offenders   L.R.O. 1/2012     Extradition of persons to Guyana and certain restrictions upon proceedings against them.                                      PART IV EXTRADITION  TO  GUYANA",
            "description": "All expenses incurred in respect of any person whose extradition is sought shall be paid by the Commonwealth country or treaty territory that requests his extradition under this Act unless other provisions for the payment of the expenses have been made by treaty, convention or other arrangement, between Guyana and that Commonwealth country or treaty territory.     LAWS OF GUYANA 34 Cap. 10:04                        Fugitive Offenders   L.R.O. 1/2012     Extradition of persons to Guyana and certain restrictions upon proceedings against them.                                      PART IV EXTRADITION  TO  GUYANA"
        }
    },
    {
        "act": "FUGITIVE OFFENDERS ACT",
        "source": "https://mola.gov.gy/laws-of-guyana",
        "type": {
            "name": "section",
            "representation": "34",
            "title": "Extradition of persons to Guyana and certain restrictions upon proceedings against them. ",
            "context": "FUGITIVE OFFENDERS ACT under Extradition of persons to Guyana and certain restrictions upon proceedings against them. 34. (1) Where a person accused of an extraditable offence in Guyana, or alleged to be unlawfully at large after conviction in Guyana of any such offence whether committed before or after the commencement of this Act, is, or is suspected to be in or to be arriving, in any Commonwealth country or treaty territory or within the jurisdiction of any such country or territory, the Minister may make a request to that country or territory for the extradition of that person.   (2) Where a person has been extradited to Guyana upon a request  for his extradition being made, that person shall not, during the period specified in subsection (3)  (a)  be arrested, detained, remanded or otherwise dealt with in Guyana for or in respect of any offence committed before his extradition other than:  (i)  the extraditable offence in respect of which he was extradited;  (ii)  any lesser offence proved by the facts established for the purpose of securing his extradition; or  (iii)  any other extraditable offence in respect of which the Government of the Commonwealth country or treaty territory from which he was extradited has consented to his being so dealt with; or  LAWS OF GUYANA                                                               Fugitive Offenders                Cap. 10:04 35  L.R.O. 1/2012                         Restoration of persons acquitted or not tried.                          (b)  be extradited by the Government of Guyana to any other country to be dealt with for any offence committed before his extradition without the consent of the Government of the Commonwealth country or treaty territory from which he was extradited.  (3) The period referred to in subsection (2) in relation to a person to whom this section applies is the period commencing on the day of his arrival in Guyana on his extradition and ending on the expiry of forty- five days from the day on which he is free to leave Guyana.",
            "description": [
                {
                    "representation": "(1)",
                    "description": "Where a person accused of an extraditable offence in Guyana, or alleged to be unlawfully at large after conviction in Guyana of any such offence whether committed before or after the commencement of this Act, is, or is suspected to be in or to be arriving, in any Commonwealth country or treaty territory or within the jurisdiction of any such country or territory, the Minister may make a request to that country or territory for the extradition of that person."
                },
                {
                    "representation": "(2)",
                    "description": "in relation to a person to whom this section applies is the period commencing on the day of his arrival in Guyana on his extradition and ending on the expiry of forty- five days from the day on which he is free to leave Guyana."
                },
                {
                    "representation": "(a)",
                    "description": "be arrested, detained, remanded or otherwise dealt with in Guyana for or in respect of any offence committed before his extradition other than:"
                },
                {
                    "representation": "(i)",
                    "description": "the extraditable offence in respect of which he was extradited;"
                },
                {
                    "representation": "(b)",
                    "description": "be extradited by the Government of Guyana to any other country to be dealt with for any offence committed before his extradition without the consent of the Government of the Commonwealth country or treaty territory from which he was extradited."
                },
                {
                    "representation": "(3)",
                    "description": "The period referred to in subsection"
                }
            ]
        }
    },
    {
        "act": "FUGITIVE OFFENDERS ACT",
        "source": "https://mola.gov.gy/laws-of-guyana",
        "type": {
            "name": "section",
            "representation": "35",
            "title": "Restoration of persons acquitted or not tried.  PART V EXTRADITION IN SPECIAL CASES  ",
            "context": "FUGITIVE OFFENDERS ACT under Restoration of persons acquitted or not tried.  PART V EXTRADITION IN SPECIAL CASES  35. Where  a person accused of an extraditable offence is extradited to Guyana and    (a)  proceedings against him for that offence are not begun within the period of six months commencing on the day of his arrival in Guyana on being extradited; or  (b)  on his trial for that offence, he is acquitted or discharged by any court in Guyana, and in the event of one or more appeals from the decision of such court, he is acquitted or discharged by the court determining the appeal or the last appeal, as the case may be,   the Minister may, if he thinks fit, on the request of that person, arrange for him to be sent back free of charge, and with as little delay as possible, to the Commonwealth country or treaty territory from which he was extradited.  LAWS OF GUYANA 36 Cap. 10:04                        Fugitive Offenders   L.R.O. 1/2012           Extradition to and from Non-Common-wealth countries, where no arrangement exists. Form",
            "description": [
                {
                    "representation": "(a)",
                    "description": "proceedings against him for that offence are not begun within the period of six months commencing on the day of his arrival in Guyana on being extradited; or"
                },
                {
                    "representation": "(b)",
                    "description": "on his trial for that offence, he is acquitted or discharged by any court in Guyana, and in the event of one or more appeals from the decision of such court, he is acquitted or discharged by the court determining the appeal or the last appeal, as the case may be,   the Minister may, if he thinks fit, on the request of that person, arrange for him to be sent back free of charge, and with as little delay as possible, to the Commonwealth country or treaty territory from which he was extradited.  LAWS OF GUYANA 36 Cap. 10:04                        Fugitive Offenders   L.R.O. 1/2012           Extradition to and from Non-Common-wealth countries, where no arrangement exists. Form"
                }
            ]
        }
    },
    {
        "act": "FUGITIVE OFFENDERS ACT",
        "source": "https://mola.gov.gy/laws-of-guyana",
        "type": {
            "name": "section",
            "representation": "36",
            "title": "Extradition to and from non-Commonwealth countries where no arrangement exists.  PART VI MISCELLANEOUS  ",
            "context": "FUGITIVE OFFENDERS ACT under Extradition to and from non-Commonwealth countries where no arrangement exists.  PART VI MISCELLANEOUS  36. (1) Notwithstanding any other provision of this Act, although no arrangement as is referred to in section 4(1) or (2) exists between the Government of Guyana and the Government of any foreign territory, upon the request of the Government of that foreign territory, the Minister may issue an authority to proceed in Form 1 signifying to a magistrate that a request has been received for the extradition of the person mentioned therein and requiring the magistrate to proceed with the case in accordance with the provisions of this Act as if the request for the extradition had been received from the Government of a treaty territory, if the Minister is satisfied that  (a)  the person whose extradition is sought is accused of, or is alleged to be unlawfully at large after conviction of, any offence in such foreign territory, which offence if committed in a treaty territory would be an extraditable offence;  (b)  the aforesaid person is, or is suspected to be in or to be arriving in, Guyana; and  (c)  it is in the interests of justice that the said person should be extradited to the foreign territory referred to in paragraph (a).  (2) On an authority to proceed being  issued under subsection (1) in relation to any person, whose extradition has been sought by a foreign territory referred to therein, the provisions of this Act relating to extradition from Guyana to a treaty territory shall mutatis mutandis apply to all matters and LAWS OF GUYANA                                                               Fugitive Offenders                Cap. 10:04 37  L.R.O. 1/2012                                               Jurisdiction regarding offence on aircraft. proceedings arising from the request for extradition and relating to the extradition of the person in the same manner and to the same extent as if the said foreign territory were a treaty territory.  (3) Notwithstanding any other provision of this Act, where under the law in force in any foreign territory, not being a treaty territory, such request can be made the Minister may make a request to the Government of that foreign territory for the extradition to Guyana of any person who  (a)  is accused of, or is unlawfully at large after conviction, in Guyana of any offence which would be an extraditable offence if that foreign territory were a treaty territory; and  (b)  is, or is suspected to be in or to be arriving in, that foreign territory.   (4) The provisions of this Act in relation to persons extradited to Guyana from any treaty territory shall mutatis mutandis apply to and in relation to a person extradited to Guyana upon a request made under subsection (3) as if the foreign territory to which the request was made were a treaty territory.   (5) This section applies whether or not any offence referred to in subsection (1) or (3) of which a person is accused or is alleged to have been convicted was committed before or after the commencement of this Act.  PART VI MISCELLANEOUS",
            "description": [
                {
                    "representation": "(1)",
                    "description": "or"
                },
                {
                    "representation": "(2)",
                    "description": "On an authority to proceed being  issued under subsection"
                },
                {
                    "representation": "(a)",
                    "description": "is accused of, or is unlawfully at large after conviction, in Guyana of any offence which would be an extraditable offence if that foreign territory were a treaty territory; and"
                },
                {
                    "representation": "(b)",
                    "description": "is, or is suspected to be in or to be arriving in, that foreign territory."
                },
                {
                    "representation": "(c)",
                    "description": "it is in the interests of justice that the said person should be extradited to the foreign territory referred to in paragraph"
                },
                {
                    "representation": "(3)",
                    "description": "of which a person is accused or is alleged to have been convicted was committed before or after the commencement of this Act.  PART VI MISCELLANEOUS"
                },
                {
                    "representation": "(4)",
                    "description": "The provisions of this Act in relation to persons extradited to Guyana from any treaty territory shall mutatis mutandis apply to and in relation to a person extradited to Guyana upon a request made under subsection"
                },
                {
                    "representation": "(5)",
                    "description": "This section applies whether or not any offence referred to in subsection"
                }
            ]
        }
    },
    {
        "act": "FUGITIVE OFFENDERS ACT",
        "source": "https://mola.gov.gy/laws-of-guyana",
        "type": {
            "name": "section",
            "representation": "37",
            "title": "Jurisdiction regarding offence on aircraft. ",
            "context": "FUGITIVE OFFENDERS ACT under Jurisdiction regarding offence on aircraft. 37. (1) For the purposes of the application of this Act, an offence committed on board an aircraft, being an aircraft registered in a Commonwealth country or a treaty territory, in LAWS OF GUYANA 38 Cap. 10:04                        Fugitive Offenders   L.R.O. 1/2012                            Power to make regulations.       Power to amend Schedule.  Cesser of operation of extradition laws of the United Kingdom.       which the Tokyo Convention is in force, at any time while that aircraft is in flight, shall be deemed to be committed within the jurisdiction of that country or territory as the case may be, notwithstanding that when the offence was committed the aircraft was within the jurisdiction of any other Commonwealth country or foreign territory.  (2) For the purposes of this section, a certificate issued by the Minister assigned responsibility for foreign affairs, or on his behalf by another person authorised by him, that a Commonwealth country or a treaty territory is a country or territory in which the Tokyo Convention is in force, shall be admissible in evidence as conclusive proof of the matters stated therein without proof of the signature of that Minister or the other person or of the authorisation of the other person by the Minister.  (3) In this section, Tokyo Convention means the Convention on offences and certain other acts committed on board aircraft signed in Tokyo on 14th September",
            "description": [
                {
                    "representation": "(1)",
                    "description": "For the purposes of the application of this Act, an offence committed on board an aircraft, being an aircraft registered in a Commonwealth country or a treaty territory, in LAWS OF GUYANA 38 Cap. 10:04                        Fugitive Offenders   L.R.O. 1/2012                            Power to make regulations.       Power to amend Schedule.  Cesser of operation of extradition laws of the United Kingdom.       which the Tokyo Convention is in force, at any time while that aircraft is in flight, shall be deemed to be committed within the jurisdiction of that country or territory as the case may be, notwithstanding that when the offence was committed the aircraft was within the jurisdiction of any other Commonwealth country or foreign territory."
                },
                {
                    "representation": "(2)",
                    "description": "For the purposes of this section, a certificate issued by the Minister assigned responsibility for foreign affairs, or on his behalf by another person authorised by him, that a Commonwealth country or a treaty territory is a country or territory in which the Tokyo Convention is in force, shall be admissible in evidence as conclusive proof of the matters stated therein without proof of the signature of that Minister or the other person or of the authorisation of the other person by the Minister."
                },
                {
                    "representation": "(3)",
                    "description": "In this section, Tokyo Convention means the Convention on offences and certain other acts committed on board aircraft signed in Tokyo on 14th September"
                }
            ]
        }
    },
    {
        "act": "FUGITIVE OFFENDERS ACT",
        "source": "https://mola.gov.gy/laws-of-guyana",
        "type": {
            "name": "section",
            "representation": "38",
            "title": "Power to make regulations. ",
            "context": "FUGITIVE OFFENDERS ACT under Power to make regulations. 38. The Minister may make regulations for carrying out the purposes of this Act, and without prejudice to the generality of the foregoing may, in particular, prescribe the form for any purposes under this Act.",
            "description": "The Minister may make regulations for carrying out the purposes of this Act, and without prejudice to the generality of the foregoing may, in particular, prescribe the form for any purposes under this Act."
        }
    },
    {
        "act": "FUGITIVE OFFENDERS ACT",
        "source": "https://mola.gov.gy/laws-of-guyana",
        "type": {
            "name": "section",
            "representation": "39",
            "title": "Power to amend Schedule. ",
            "context": "FUGITIVE OFFENDERS ACT under Power to amend Schedule. 39. The Minister may by regulations amend any form in the Schedule.",
            "description": "The Minister may by regulations amend any form in the Schedule."
        }
    },
    {
        "act": "FUGITIVE OFFENDERS ACT",
        "source": "https://mola.gov.gy/laws-of-guyana",
        "type": {
            "name": "section",
            "representation": "40",
            "title": "Cesser of operation of extradition laws of the United Kingdom.   SCHEDULE - Forms   __________________________                  LAWS OF GUYANA                                                               Fugitive Offenders                Cap. 10:04 5  L.R.O. 1/2012  CHAPTER 10:04      15 of 1988 An Act to make provision with respect to the extradition of fugitive offenders from and to Guyana and for matters connected therewith.  [11th AUGUST, 1988]        Short title.     Interpretation.        c.1:01                        PART I PRELIMINARY  ",
            "context": "FUGITIVE OFFENDERS ACT under Cesser of operation of extradition laws of the United Kingdom.   SCHEDULE - Forms   __________________________                  LAWS OF GUYANA                                                               Fugitive Offenders                Cap. 10:04 5  L.R.O. 1/2012  CHAPTER 10:04      15 of 1988 An Act to make provision with respect to the extradition of fugitive offenders from and to Guyana and for matters connected therewith.  [11th AUGUST, 1988]        Short title.     Interpretation.        c.1:01                        PART I PRELIMINARY  40. On and from the commencement of this Act the applied Acts entitled the Extradition Acts, 1870 to 1935, and the Fugitive Offenders Act, 1881, shall cease to have effect in Guyana.      LAWS OF GUYANA                                                               Fugitive Offenders                Cap. 10:04 39  L.R.O. 1/2012  ss. 12(1) and 36                             s. 13(1)                   SCHEDULE                                                 FORM 1                  AUTHORITY TO PROCEED  GUYANA To His Worship A request having been made to the Minister by or on behalf of..................... for the return to that country/territory of A.B. who is accused (or alleged to be unlawfully at large after conviction) of the offence of .....................................against the law of ............................;  The Minister hereby requires you to proceed with the casein accordance with the provisions  of the  Fugitive  Offenders  Act, Cap 10:",
            "description": [
                {
                    "representation": "(1)",
                    "description": "and 36                             s. 13(1)                   SCHEDULE                                                 FORM 1                  AUTHORITY TO PROCEED  GUYANA To His Worship A request having been made to the Minister by or on behalf of..................... for the return to that country/territory of A.B. who is accused"
                }
            ]
        }
    }
]