[
    {
        "act": "KIDNAPPING ACT",
        "source": "https://mola.gov.gy/laws-of-guyana",
        "type": {
            "name": "section",
            "representation": "1",
            "title": "Short title. ",
            "context": "KIDNAPPING ACT under Short title. 1. This Act may be cited as the Kidnapping Act.",
            "description": "This Act may be cited as the Kidnapping Act."
        }
    },
    {
        "act": "KIDNAPPING ACT",
        "source": "https://mola.gov.gy/laws-of-guyana",
        "type": {
            "name": "section",
            "representation": "2",
            "title": "Interpretation. ",
            "context": "KIDNAPPING ACT under Interpretation. 2. In this Act abduction, wrongful restraint and wrongful confinement shall have the meanings assigned to them in sections 3, 5 and 7, respectively. LAWS OF GUYANA 4 Cap. 10:05 Kidnapping  L.R.O. 1/2012  Abduction.     Punishment for abduction with intent secretly or wrongfully to confine a person.    Wrongful restraint.     Punishment for wrongful restraint.    Wrongful confinement.      Punishment for wrongful confinement.      Abduction, wrongful restraint or wrongful confinement for ransom.     Knowingly receiving ransom.",
            "description": "In this Act abduction, wrongful restraint and wrongful confinement shall have the meanings assigned to them in sections 3, 5 and 7, respectively. LAWS OF GUYANA 4 Cap. 10:05 Kidnapping  L.R.O. 1/2012  Abduction.     Punishment for abduction with intent secretly or wrongfully to confine a person.    Wrongful restraint.     Punishment for wrongful restraint.    Wrongful confinement.      Punishment for wrongful confinement.      Abduction, wrongful restraint or wrongful confinement for ransom.     Knowingly receiving ransom."
        }
    },
    {
        "act": "KIDNAPPING ACT",
        "source": "https://mola.gov.gy/laws-of-guyana",
        "type": {
            "name": "section",
            "representation": "3",
            "title": "Abduction. ",
            "context": "KIDNAPPING ACT under Abduction. 3. Whoever by force or fear compels, or by any deceitful means induces any person to go from any place, is said to abduct that person.",
            "description": "Whoever by force or fear compels, or by any deceitful means induces any person to go from any place, is said to abduct that person."
        }
    },
    {
        "act": "KIDNAPPING ACT",
        "source": "https://mola.gov.gy/laws-of-guyana",
        "type": {
            "name": "section",
            "representation": "4",
            "title": "Punishment for abduction with intent secretly or wrongfully to confine a person. ",
            "context": "KIDNAPPING ACT under Punishment for abduction with intent secretly or wrongfully to confine a person. 4. Whoever abducts any person with intent to cause that person to be secretly or wrongfully confined, shall be guilty of an offence and shall be liable on conviction on indictment to a seven hundred and fifty thousand dollars and to imprisonment for five years.",
            "description": "Whoever abducts any person with intent to cause that person to be secretly or wrongfully confined, shall be guilty of an offence and shall be liable on conviction on indictment to a seven hundred and fifty thousand dollars and to imprisonment for five years."
        }
    },
    {
        "act": "KIDNAPPING ACT",
        "source": "https://mola.gov.gy/laws-of-guyana",
        "type": {
            "name": "section",
            "representation": "5",
            "title": "Wrongful restraint. ",
            "context": "KIDNAPPING ACT under Wrongful restraint. 5. Whoever unlawfully obstructs any person, so as to prevent that person from proceeding in any direction in which that person has a right to proceed, is said wrongfully to restrain that person.",
            "description": "Whoever unlawfully obstructs any person, so as to prevent that person from proceeding in any direction in which that person has a right to proceed, is said wrongfully to restrain that person."
        }
    },
    {
        "act": "KIDNAPPING ACT",
        "source": "https://mola.gov.gy/laws-of-guyana",
        "type": {
            "name": "section",
            "representation": "6",
            "title": "Punishment for wrongful restraint. ",
            "context": "KIDNAPPING ACT under Punishment for wrongful restraint. 6. Whoever wrongfully restrains any person shall be guilty of an offence and shall be liable on summary conviction to a fine not exceeding one hundred thousand dollars.",
            "description": "Whoever wrongfully restrains any person shall be guilty of an offence and shall be liable on summary conviction to a fine not exceeding one hundred thousand dollars."
        }
    },
    {
        "act": "KIDNAPPING ACT",
        "source": "https://mola.gov.gy/laws-of-guyana",
        "type": {
            "name": "section",
            "representation": "7",
            "title": "Wrongful confinement. ",
            "context": "KIDNAPPING ACT under Wrongful confinement. 7. Whoever wrongfully restrains any person in such a manner as to prevent that person from proceeding beyond certain circumscribing limits, is said wrongfully to confine that person.",
            "description": "Whoever wrongfully restrains any person in such a manner as to prevent that person from proceeding beyond certain circumscribing limits, is said wrongfully to confine that person."
        }
    },
    {
        "act": "KIDNAPPING ACT",
        "source": "https://mola.gov.gy/laws-of-guyana",
        "type": {
            "name": "section",
            "representation": "8",
            "title": "Punishment for wrongful confinement. ",
            "context": "KIDNAPPING ACT under Punishment for wrongful confinement. 8. Whoever wrongfully confines any person shall be guilty of an offence and shall be liable on summary conviction to a fine not exceeding two hundred and fifty thousand dollars.",
            "description": "Whoever wrongfully confines any person shall be guilty of an offence and shall be liable on summary conviction to a fine not exceeding two hundred and fifty thousand dollars."
        }
    },
    {
        "act": "KIDNAPPING ACT",
        "source": "https://mola.gov.gy/laws-of-guyana",
        "type": {
            "name": "section",
            "representation": "9",
            "title": "Abduction, wrongful restraint or wrongful confinement for ransom. ",
            "context": "KIDNAPPING ACT under Abduction, wrongful restraint or wrongful confinement for ransom. 9. Whoever, with intent to hold any person for ransom, abducts or wrongfully restrains or wrongfully confines that person shall be guilty of an offence and shall be liable on conviction on indictment to a fine of ten million dollars together with imprisonment for not less than fifteen and not more than twenty years.",
            "description": "Whoever, with intent to hold any person for ransom, abducts or wrongfully restrains or wrongfully confines that person shall be guilty of an offence and shall be liable on conviction on indictment to a fine of ten million dollars together with imprisonment for not less than fifteen and not more than twenty years."
        }
    },
    {
        "act": "KIDNAPPING ACT",
        "source": "https://mola.gov.gy/laws-of-guyana",
        "type": {
            "name": "section",
            "representation": "10",
            "title": "Knowingly receiving ransom. 10A. Knowingly negotiating to obtain or for payment of ransom. ",
            "context": "KIDNAPPING ACT under Knowingly receiving ransom. 10A. Knowingly negotiating to obtain or for payment of ransom. 10. Whoever receives, has possession of or disposes of any money or property or any proceeds thereof, which has at LAWS OF GUYANA Kidnapping Cap. 10:05 5  L.R.O. 1/2012             Knowingly negotiating to obtain or for payment of ransom.            Duty to give information to police.                   Evidence of accomplice.   any time been delivered as ransom in connection with any offence punishable under section 9, knowing that the money or other property has at any time been delivered as such ransom, shall be guilty of an offence and shall be liable on conviction on indictment to a fine equivalent to the ransom delivered or to seven million dollars, whichever is greater, together with imprisonment for a term not exceeding ten years.  10A. (1) Whoever knowingly negotiates or assists in any negotiation to obtain any ransom for the release of any person who has been wrongfully confined shall be guilty of an offence and shall be liable on conviction on indictment to a fine of one million dollars and to imprisonment for a term not exceeding twenty years.  (2) Subsection (1) does not apply to a person who in good faith negotiates or assists in negotiations on behalf of the kidnapped person.",
            "description": [
                {
                    "representation": "(1)",
                    "description": "does not apply to a person who in good faith negotiates or assists in negotiations on behalf of the kidnapped person."
                },
                {
                    "representation": "(2)",
                    "description": "Subsection"
                }
            ]
        }
    },
    {
        "act": "KIDNAPPING ACT",
        "source": "https://mola.gov.gy/laws-of-guyana",
        "type": {
            "name": "section",
            "representation": "11",
            "title": "Duty to give information to the police. ",
            "context": "KIDNAPPING ACT under Duty to give information to the police. 11. (1) Notwithstanding the provisions of any written law, any person who is aware of the commission of or the intention of any other person to commit any offence under this Act shall, in the absence of reasonable excuse, the burden of proving which shall lie upon the person so aware, forthwith given information to a police officer of such commission or intention, as the case may be.  (2) Any person bound to give any information under subsection (1) who fails to do so in accordance with that subsection shall be guilty of an offence and shall be liable on summary conviction to a fine not exceeding two hundred thousand dollars or to imprisonment for a term not exceeding one year or to both.",
            "description": [
                {
                    "representation": "(1)",
                    "description": "who fails to do so in accordance with that subsection shall be guilty of an offence and shall be liable on summary conviction to a fine not exceeding two hundred thousand dollars or to imprisonment for a term not exceeding one year or to both."
                },
                {
                    "representation": "(2)",
                    "description": "Any person bound to give any information under subsection"
                }
            ]
        }
    },
    {
        "act": "KIDNAPPING ACT",
        "source": "https://mola.gov.gy/laws-of-guyana",
        "type": {
            "name": "section",
            "representation": "12",
            "title": "Evidence of accomplice. ",
            "context": "KIDNAPPING ACT under Evidence of accomplice. 12. Notwithstanding any rule of law or written law to the contrary, no witness shall in any trial of any offence under this Act be presumed to be unworthy of credit by reason only LAWS OF GUYANA 6 Cap. 10:05 Kidnapping  L.R.O. 1/2012         Evidence of pecuniary resources or property.                              Protection of informers.         that he has paid or negotiated to pay any ransom or has provided funds for the payment of any ransom to procure the release of any person who has been wrongfully restrained or wrongfully confined.",
            "description": "Notwithstanding any rule of law or written law to the contrary, no witness shall in any trial of any offence under this Act be presumed to be unworthy of credit by reason only LAWS OF GUYANA 6 Cap. 10:05 Kidnapping  L.R.O. 1/2012         Evidence of pecuniary resources or property.                              Protection of informers.         that he has paid or negotiated to pay any ransom or has provided funds for the payment of any ransom to procure the release of any person who has been wrongfully restrained or wrongfully confined."
        }
    },
    {
        "act": "KIDNAPPING ACT",
        "source": "https://mola.gov.gy/laws-of-guyana",
        "type": {
            "name": "section",
            "representation": "13",
            "title": "Evidence of pecuniary resources or property. ",
            "context": "KIDNAPPING ACT under Evidence of pecuniary resources or property. 13. (1) In any trial or inquiry by a court into an offence under this Act or into a conspiracy to commit, or attempt to commit, or an abetment of any such offence the fact that an accused person is in possession, for which he cannot satisfactorily account, of pecuniary resources or property disproportionate to his known sources of income, or that he had, at or about the time of the alleged offence, obtained an accretion to his pecuniary resources or property for which he cannot satisfactorily account, may be proved and may be taken into consideration by the court as corroborating the testimony of any witness in the trial or inquiry that the accused person has received a ransom for the release of a person who has been wrongfully restrained or wrongfully confined.  (2) An accused person shall, for the purpose of subsection (1) be deemed to be in possession of resources or property or to have obtained an accretion thereto where the resources or property are held or the accretion is obtained by any other person whom, having regard to his relationship to the accused person or to any other circumstances, there is reason to believe to be holding the resources or property or to have obtained the accretion in trust for or on behalf of the accused person or as a gift from the accused person.",
            "description": [
                {
                    "representation": "(1)",
                    "description": "be deemed to be in possession of resources or property or to have obtained an accretion thereto where the resources or property are held or the accretion is obtained by any other person whom, having regard to his relationship to the accused person or to any other circumstances, there is reason to believe to be holding the resources or property or to have obtained the accretion in trust for or on behalf of the accused person or as a gift from the accused person."
                },
                {
                    "representation": "(2)",
                    "description": "An accused person shall, for the purpose of subsection"
                }
            ]
        }
    },
    {
        "act": "KIDNAPPING ACT",
        "source": "https://mola.gov.gy/laws-of-guyana",
        "type": {
            "name": "section",
            "representation": "14",
            "title": "Protection of informers. ",
            "context": "KIDNAPPING ACT under Protection of informers. 14. (1) Subject to this section, no complaint as to an offence under this Act shall be admitted in evidence in any civil or criminal proceeding whatsoever, and no witness shall be obliged or permitted to disclose the name or address of any informer, or state any matter which might lead to his discovery.  (2) If any books, documents or papers which are in LAWS OF GUYANA Kidnapping Cap. 10:05 7  L.R.O. 1/2012                         Bail.     evidence or liable to inspection in any civil or criminal proceeding whatsoever, contain any entry in which any informer is named or described or which might lead to his discovery, the court before which the proceeding is heard shall cause all such passages to be concealed from view or to be obliterated so far as is necessary to protect the informer from discovery, but no further.  (3) If on a trial for any offence under this Act the court, after full inquiry into the case, is of opinion that the informer wilfully made in his complaint a material statement which he knew or believed to be false or did not believe to be true, or if in any other proceeding the court is of opinion that justice cannot be fully done between the parties thereto without the discovery of the informer, the court may require the production of the original complaint, if in writing, and permit inquiry and require full disclosure concerning the informer.",
            "description": [
                {
                    "representation": "(1)",
                    "description": "Subject to this section, no complaint as to an offence under this Act shall be admitted in evidence in any civil or criminal proceeding whatsoever, and no witness shall be obliged or permitted to disclose the name or address of any informer, or state any matter which might lead to his discovery."
                },
                {
                    "representation": "(2)",
                    "description": "If any books, documents or papers which are in LAWS OF GUYANA Kidnapping Cap. 10:05 7  L.R.O. 1/2012                         Bail.     evidence or liable to inspection in any civil or criminal proceeding whatsoever, contain any entry in which any informer is named or described or which might lead to his discovery, the court before which the proceeding is heard shall cause all such passages to be concealed from view or to be obliterated so far as is necessary to protect the informer from discovery, but no further."
                },
                {
                    "representation": "(3)",
                    "description": "If on a trial for any offence under this Act the court, after full inquiry into the case, is of opinion that the informer wilfully made in his complaint a material statement which he knew or believed to be false or did not believe to be true, or if in any other proceeding the court is of opinion that justice cannot be fully done between the parties thereto without the discovery of the informer, the court may require the production of the original complaint, if in writing, and permit inquiry and require full disclosure concerning the informer."
                }
            ]
        }
    }
]