[
    {
        "act": "REPRESENTATION OF THE PEOPLE ACT",
        "source": "https://mola.gov.gy/laws-of-guyana",
        "type": {
            "name": "section",
            "representation": "",
            "title": "0.50/1980 16 of 1985]                          Opening packets of non-resident electors\u2019  ballot papers. [O. 50/1980 16 of 1985 12 of 2006]                      section 40(2) but shall not be used for the purpose of casting the votes of any electors other than non- resident  electors;  (b)     ensure that there are no ballot papers or other papers in the ballot box;  (c)   lock the ballot box, retain the key thereof and place his seal upon the ballot box in such manner as to prevent it being opened without breaking the seal;  (d)    place the ballot box on a table in full view of all present where  it  shall  remain  until  the  ballot  papers  have  been removed therefrom under section 92(1)(b).  ",
            "context": "REPRESENTATION OF THE PEOPLE ACT under 0.50/1980 16 of 1985]                          Opening packets of non-resident electors  ballot papers. [O. 50/1980 16 of 1985 12 of 2006]                      section 40(2) but shall not be used for the purpose of casting the votes of any electors other than non- resident  electors;  (b)     ensure that there are no ballot papers or other papers in the ballot box;  (c)   lock the ballot box, retain the key thereof and place his seal upon the ballot box in such manner as to prevent it being opened without breaking the seal;  (d)    place the ballot box on a table in full view of all present where  it  shall  remain  until  the  ballot  papers  have  been removed therefrom under section 92(1)(b).  0.50/1980]                    such representations.  (3) The findings of the Ethnic Relations Commission deriving from the investigations referred to in subsection (1) shall be notified promptly to the representative of the political party, a copy shall be delivered to the chairperson of the Elections Commission, and shall be published in a daily newspaper.  (4)  Where the findings of the Ethnic Relations Commission determine that the political party is culpable; the party shall pay promptly a fine of five hundred thousand dollars to the Ethnic Relations Commission.  (5) The provisions of section 139D (6), (7) and (9) shall mutatis mutandis apply to this section.",
            "description": [
                {
                    "representation": "(3)",
                    "description": "The findings of the Ethnic Relations Commission deriving from the investigations referred to in subsection"
                },
                {
                    "representation": "(1)",
                    "description": "shall be notified promptly to the representative of the political party, a copy shall be delivered to the chairperson of the Elections Commission, and shall be published in a daily newspaper."
                },
                {
                    "representation": "(4)",
                    "description": "Where the findings of the Ethnic Relations Commission determine that the political party is culpable; the party shall pay promptly a fine of five hundred thousand dollars to the Ethnic Relations Commission."
                },
                {
                    "representation": "(5)",
                    "description": "The provisions of section 139D"
                },
                {
                    "representation": "(7)",
                    "description": "and"
                },
                {
                    "representation": "(9)",
                    "description": "shall mutatis mutandis apply to this section."
                }
            ]
        }
    },
    {
        "act": "REPRESENTATION OF THE PEOPLE ACT",
        "source": "https://mola.gov.gy/laws-of-guyana",
        "type": {
            "name": "section",
            "representation": "1",
            "title": "Short title. ",
            "context": "REPRESENTATION OF THE PEOPLE ACT under Short title. 1. This Act may be cited as the Representation of the People Act.",
            "description": "This Act may be cited as the Representation of the People Act."
        }
    },
    {
        "act": "REPRESENTATION OF THE PEOPLE ACT",
        "source": "https://mola.gov.gy/laws-of-guyana",
        "type": {
            "name": "section",
            "representation": "2",
            "title": "Interpretation. ",
            "context": "REPRESENTATION OF THE PEOPLE ACT under Interpretation. 2.  (1) In this Act  carriage  includes a mechanically propelled vehicle;  certificate  of employment  means  a  certificate   issued u n d e r  section 29(4);  Commission means the Elections Commission established by article 161 of the Constitution;   disciplined   force  has  the  same  meaning  as  in  article  154  of the Constitution;  district  means a polling district constituted under section 6(1);  division means a polling division as defined by section 6(2);  election means  an election  in accordance  with article  60(2) of the Constitution of members to the LAWS OF GUYANA 12 Cap. 1:03 Representation of the People   L.R.O. 1/2012                                                 National Assembly, and elector shall be construed accordingly;  election day, in relation to any election, means the day appointed under article 61 of the Constitution for the holding of the election;  election  expenses  declaration means  a  declaration  as  to           election expenses as required by section 108;       election  officer  means  (a)       the Chief Election Officer; (aa)      the Deputy Chief Election Officer (b)       a returning officer; (c)        a deputy returning officer; (d)         an election clerk; (e)         a presiding officer; (f)           an assistant presiding officer; (g)          a poll clerk;     elector in Parts IV, V, VI, VII, VIII and IX, means an elector whose name is on the official list of electors;  form means Form in the Schedule;  geographical constituencies  means one of the ten constituencies into  which Guyana is divided under section 11A;  group  of  candidates   means  the  candidates  named  in  a    list  of candidates;  identity paper  means an identification card issued under   LAWS OF GUYANA Representation of the People Cap. 1:03 13  L.R.O. 1/2012       c. 19:08                                             the National Registration Act and includes a replacement identification card so issued:             Provided the identity paper tendered to a presiding officer on the day of an election by an elector shall be the latest identity paper issued to him by the Commissioner under this Act, as amended by the Election Laws (Amendment) Act 2000;  member in relation to a disciplined  force,   has   the same meaning as in article 154 of the Constitution.  official  list of elector  means the official list of electors for a polling division as prescribed by subsection (3);   official  mark\"  means such official mark as the Chief Election Officer shall approve for the purpose of stamping ballot papers;  payment  includes any pecuniary or other reward;  personal expenses, in relation to the expenses of a candidate, includes his reasonable travelling expenses and the  reasonable expenses of his living at hotels or elsewhere for the purposes of and in relation to the election;  poll means the poll, by voters whose names are on the official lists of electors, for the purpose of any election;  presiding  officer  means    (a)  a presiding officer of a polling place;   (b)  an assistant presiding officer;  LAWS OF GUYANA 14 Cap. 1:03 Representation of the People   L.R.O. 1/2012          c.1:01             c. 19:08                              c.19:08            region  means any of the ten regions which may be established under article 72(1) of the Constitution;    registration record has the same meaning as in the National Registration Act;     returning  officer  means  (a)    a returning officer of a polling district;   (b)       a deputy returning officer.    (2) In this Act the expression committee     room does not include any house or room occupied by a candidate at an election as a dwelling, by reason solely of the candidate there transacting general business with his agents in relation to the election; nor shall any room or building be deemed to be a committee room for the purposes of this Act by reason only of the candidate or any agent of the group of candidates addressing therein electors, committee men, or others.   (3) The  official  list  of  electors  for  any  division  shall  be  the preliminary list of the electors resident in that division, prepared before election day in pursuance of section 14 of the National Registration Act or last prepared in pursuance thereof before such day, as the case may be, but with every such modification as may be necessary to bring that list into conformity with the divisional register  (a)     as   altered   under   section   15(6)   of   the   National Registration Act to give effect to claims and   LAWS OF GUYANA Representation of the People Cap. 1:03 15  L.R.O. 1/2012                                                objections finally determined before the said election day;  (b)   pursuant to  any  alteration thereto made under section 8 of the National Registration Act, prior to compliance with section 34(2)(a)(iv) in respect of the said official list, for the purpose of changing the registered address of any electors residence   within   Guyana   or   the   registered   name   or occupation of any elector; or   (c)    pursuant  to  the   cancellation  of  any  electors registration therein effected in contravention of section 11(1) of the National Registration Act, or relating to an elector who is dead, under section 8 of the National Registration Act,  and every reference made to the official list of electors in the provisions hereinafter contained shall, in relation to any time on or before election day,  be construed as a reference to such preliminary list as  aforesaid with such modifications thereto (if any) as, at that time, shall have been made in conformity with this subsection.  (4) In subsection (3) reference to a preliminary list is a reference to such list read in conjunction with any supplementary list prepared for a revision of that preliminary list pursuant to regulations made under the Act for the purpose of showing the aforementioned LAWS OF GUYANA 16 Cap. 1:03 Representation of the People   L.R.O. 1/2012     Electoral  system.             [16 of 1968]        Other functions of Commission. [16 of 1968]        Extension of time. [16 of 1968 15 of 2000]                      modifications.",
            "description": [
                {
                    "representation": "(1)",
                    "description": "In this Act  carriage  includes a mechanically propelled vehicle;  certificate  of employment  means  a  certificate   issued u n d e r  section 29(4);  Commission means the Elections Commission established by article 161 of the Constitution;   disciplined   force  has  the  same  meaning  as  in  article  154  of the Constitution;  district  means a polling district constituted under section 6(1);  division means a polling division as defined by section 6(2);  election means  an election  in accordance  with article  60(2) of the Constitution of members to the LAWS OF GUYANA 12 Cap. 1:03 Representation of the People   L.R.O. 1/2012                                                 National Assembly, and elector shall be construed accordingly;  election day, in relation to any election, means the day appointed under article 61 of the Constitution for the holding of the election;  election  expenses  declaration means  a  declaration  as  to           election expenses as required by section 108;       election  officer  means"
                },
                {
                    "representation": "(a)",
                    "description": "as   altered   under   section   15(6)   of   the   National Registration Act to give effect to claims and   LAWS OF GUYANA Representation of the People Cap. 1:03 15  L.R.O. 1/2012                                                objections finally determined before the said election day;"
                },
                {
                    "representation": "(b)",
                    "description": "pursuant to  any  alteration thereto made under section 8 of the National Registration Act, prior to compliance with section 34(2)(a)(iv) in respect of the said official list, for the purpose of changing the registered address of any electors residence   within   Guyana   or   the   registered   name   or occupation of any elector; or"
                },
                {
                    "representation": "(c)",
                    "description": "pursuant  to  the   cancellation  of  any  electors registration therein effected in contravention of section 11(1) of the National Registration Act, or relating to an elector who is dead, under section 8 of the National Registration Act,  and every reference made to the official list of electors in the provisions hereinafter contained shall, in relation to any time on or before election day,  be construed as a reference to such preliminary list as  aforesaid with such modifications thereto"
                },
                {
                    "representation": "(d)",
                    "description": "an election clerk;"
                },
                {
                    "representation": "(e)",
                    "description": "a presiding officer;"
                },
                {
                    "representation": "(f)",
                    "description": "an assistant presiding officer;"
                },
                {
                    "representation": "(g)",
                    "description": "a poll clerk;     elector in Parts IV, V, VI, VII, VIII and IX, means an elector whose name is on the official list of electors;  form means Form in the Schedule;  geographical constituencies  means one of the ten constituencies into  which Guyana is divided under section 11A;  group  of  candidates   means  the  candidates  named  in  a    list  of candidates;  identity paper  means an identification card issued under   LAWS OF GUYANA Representation of the People Cap. 1:03 13  L.R.O. 1/2012       c. 19:08                                             the National Registration Act and includes a replacement identification card so issued:             Provided the identity paper tendered to a presiding officer on the day of an election by an elector shall be the latest identity paper issued to him by the Commissioner under this Act, as amended by the Election Laws"
                },
                {
                    "representation": "(2)",
                    "description": "In this Act the expression committee     room does not include any house or room occupied by a candidate at an election as a dwelling, by reason solely of the candidate there transacting general business with his agents in relation to the election; nor shall any room or building be deemed to be a committee room for the purposes of this Act by reason only of the candidate or any agent of the group of candidates addressing therein electors, committee men, or others."
                },
                {
                    "representation": "(3)",
                    "description": "reference to a preliminary list is a reference to such list read in conjunction with any supplementary list prepared for a revision of that preliminary list pursuant to regulations made under the Act for the purpose of showing the aforementioned LAWS OF GUYANA 16 Cap. 1:03 Representation of the People   L.R.O. 1/2012     Electoral  system.             [16 of 1968]        Other functions of Commission. [16 of 1968]        Extension of time. [16 of 1968 15 of 2000]                      modifications."
                },
                {
                    "representation": "(4)",
                    "description": "In subsection"
                }
            ]
        }
    },
    {
        "act": "REPRESENTATION OF THE PEOPLE ACT",
        "source": "https://mola.gov.gy/laws-of-guyana",
        "type": {
            "name": "section",
            "representation": "3",
            "title": "Electoral system. ",
            "context": "REPRESENTATION OF THE PEOPLE ACT under Electoral system. 3. (1) An election shall be conducted by secret ballot in conformity with this Act.         (2) Throughout Guyana, votes shall be cast in favour of lists of candidates published in accordance with section",
            "description": [
                {
                    "representation": "(1)",
                    "description": "An election shall be conducted by secret ballot in conformity with this Act."
                },
                {
                    "representation": "(2)",
                    "description": "Throughout Guyana, votes shall be cast in favour of lists of candidates published in accordance with section"
                }
            ]
        }
    },
    {
        "act": "REPRESENTATION OF THE PEOPLE ACT",
        "source": "https://mola.gov.gy/laws-of-guyana",
        "type": {
            "name": "section",
            "representation": "4",
            "title": "Other functions of Commission. ",
            "context": "REPRESENTATION OF THE PEOPLE ACT under Other functions of Commission. 4. The Commission shall have, in addition to the functions assigned to it by the Constitution, such functions as are assigned to it by this Act and, in the execution of this Act, such authority of the Commission as is exercised in pursuance of the provisions of the Constitution shall be duly deferred to.",
            "description": "The Commission shall have, in addition to the functions assigned to it by the Constitution, such functions as are assigned to it by this Act and, in the execution of this Act, such authority of the Commission as is exercised in pursuance of the provisions of the Constitution shall be duly deferred to."
        }
    },
    {
        "act": "REPRESENTATION OF THE PEOPLE ACT",
        "source": "https://mola.gov.gy/laws-of-guyana",
        "type": {
            "name": "section",
            "representation": "5",
            "title": "Extension of time ",
            "context": "REPRESENTATION OF THE PEOPLE ACT under Extension of time 5. Where under this Act any act is required to be done not later than a   specified   number   of  days  before   election   day,  the Commission may by  direction under its hand, if it deems it requisite or desirable so to do, extend the time allowed by reducing the number of days so specified;  and  the following  provisions  shall  have effect  in relation to that power  (a)   the  power  may  be  exercised   either    generally   or specially;  (b)    the  power  may  be  exercised  so  as  to  make  valid anything already done after the expiration of the  time allowed;  (c)   the Commission  shall, as soon as practicable after any exercise of the power, publish in the Gazette a   LAWS OF GUYANA Representation of the People Cap. 1:03 17  L.R.O. 1/2012          Polling districts and divisions.  [16 of 1968 4 of 1972 O. 50/1980 O. 68/1980 15 of 2000]                   c. 19:08                          notification thereof, which shall include a brief statement of the reasons for, and the effect of, that exercise.",
            "description": [
                {
                    "representation": "(a)",
                    "description": "the  power  may  be  exercised   either    generally   or specially;"
                },
                {
                    "representation": "(b)",
                    "description": "the  power  may  be  exercised  so  as  to  make  valid anything already done after the expiration of the  time allowed;"
                },
                {
                    "representation": "(c)",
                    "description": "the Commission  shall, as soon as practicable after any exercise of the power, publish in the Gazette a   LAWS OF GUYANA Representation of the People Cap. 1:03 17  L.R.O. 1/2012          Polling districts and divisions.  [16 of 1968 4 of 1972 O. 50/1980 O. 68/1980 15 of 2000]                   c. 19:08                          notification thereof, which shall include a brief statement of the reasons for, and the effect of, that exercise."
                }
            ]
        }
    },
    {
        "act": "REPRESENTATION OF THE PEOPLE ACT",
        "source": "https://mola.gov.gy/laws-of-guyana",
        "type": {
            "name": "section",
            "representation": "6",
            "title": "Polling districts and divisions. ",
            "context": "REPRESENTATION OF THE PEOPLE ACT under Polling districts and divisions. 6. (1) Guyana shall be divided into polling districts, each of which shall  consist  of such polling  divisions,  and be distinguished  by such names, as may be specified by order of the Commission:  Provided that no polling district shall extend across the boundary of any region.     (2) Subject to any orders made by the Commission under subsection (1), every registration division as constituted under section 5(2) of the National Registration Act shall be a polling division for the purposes of this Act.  (3) Subject to subsections (4) and (5), there shall be for each division such polling places as the returning officer of the district in which the division is situate, subject to the approval of the Chief Election Officer, may appoint; and each polling place shall bear such numerical or other designation as may be approved by the Chief Election Officer.   (4) Where  the  Chief  Election  Officer  is  satisfied  that  it  is impracticable to appoint a polling place within a division or any part thereof, he may appoint some other place in another division within the same district as a polling place at which electors of the first-mentioned division or that part thereof shall be entitled to vote.  LAWS OF GUYANA 18 Cap. 1:03 Representation of the People   L.R.O. 1/2012         Election Officer and staff. [30 of 1990]                          Oaths. Form 1                 (5) The Chief Election Officer shall publish in the Gazette not later than the 20th day before election day a notice of any polling place appointed under subsection (4).",
            "description": [
                {
                    "representation": "(1)",
                    "description": "Guyana shall be divided into polling districts, each of which shall  consist  of such polling  divisions,  and be distinguished  by such names, as may be specified by order of the Commission:  Provided that no polling district shall extend across the boundary of any region."
                },
                {
                    "representation": "(2)",
                    "description": "of the National Registration Act shall be a polling division for the purposes of this Act."
                },
                {
                    "representation": "(3)",
                    "description": "Subject to subsections"
                },
                {
                    "representation": "(4)",
                    "description": "Where  the  Chief  Election  Officer  is  satisfied  that  it  is impracticable to appoint a polling place within a division or any part thereof, he may appoint some other place in another division within the same district as a polling place at which electors of the first-mentioned division or that part thereof shall be entitled to vote.  LAWS OF GUYANA 18 Cap. 1:03 Representation of the People   L.R.O. 1/2012         Election Officer and staff. [30 of 1990]                          Oaths. Form 1"
                },
                {
                    "representation": "(5)",
                    "description": "The Chief Election Officer shall publish in the Gazette not later than the 20th day before election day a notice of any polling place appointed under subsection"
                }
            ]
        }
    },
    {
        "act": "REPRESENTATION OF THE PEOPLE ACT",
        "source": "https://mola.gov.gy/laws-of-guyana",
        "type": {
            "name": "section",
            "representation": "7",
            "title": "Election Officer and staff. ",
            "context": "REPRESENTATION OF THE PEOPLE ACT under Election Officer and staff. 7.  There shall be  (a)     a Chief Election Officer;  (b)   for  each   district   a   returning    officer  and  an  election clerk;  (c)    for  each  polling  place  a  presiding officer, a poll clerk and a counting assistant;  (d)  such deputy returning   officers,    assistant   presiding officers and other staff  as may be necessary or desirable for the implementation of this Act.",
            "description": [
                {
                    "representation": "(a)",
                    "description": "a Chief Election Officer;"
                },
                {
                    "representation": "(b)",
                    "description": "for  each   district   a   returning    officer  and  an  election clerk;"
                },
                {
                    "representation": "(c)",
                    "description": "for  each  polling  place  a  presiding officer, a poll clerk and a counting assistant;"
                },
                {
                    "representation": "(d)",
                    "description": "such deputy returning   officers,    assistant   presiding officers and other staff  as may be necessary or desirable for the implementation of this Act."
                }
            ]
        }
    },
    {
        "act": "REPRESENTATION OF THE PEOPLE ACT",
        "source": "https://mola.gov.gy/laws-of-guyana",
        "type": {
            "name": "section",
            "representation": "8",
            "title": "Oaths.  PART II LISTS OF CANDIDATES  ",
            "context": "REPRESENTATION OF THE PEOPLE ACT under Oaths.  PART II LISTS OF CANDIDATES  8. (1) Every election officer, before performing any of his functions under this Act, shall take and subscribe an oath in Form 1 before a Justice of the Peace or an election officer.  (2) Every  Justice  of  the  Peace  and  every  election  officer  is authorised and empowered to administer any oath required by or under this  Act:         Provided that no election officer shall administer an oath until he has himself taken the oath prescribed in pursuance of subsection (1).    LAWS OF GUYANA Representation of the People Cap. 1:03 19  L.R.O. 1/2012                 Notice of date for submission  of  lists. [16 of 1968 Reg. 6/1973]       Chief Election Officer to receive lists.      Requirements of lists.  [16 of 1968 Reg. 32/1964 Reg. 6/1973 O. 50/1980 O. 68/1980 22 of 1997 15 of 2000 12 of 2006]       (3) Forthwith upon taking the oath prescribed in pursuance of subsection (1), the returning officer of every district shall establish an office in his district and cause an advertisement t o  be inserted in a newspaper circulating in the district specifying the place at which he has established his office.  PART II LISTS  OF  CANDIDATES",
            "description": [
                {
                    "representation": "(1)",
                    "description": "Every election officer, before performing any of his functions under this Act, shall take and subscribe an oath in Form 1 before a Justice of the Peace or an election officer."
                },
                {
                    "representation": "(2)",
                    "description": "Every  Justice  of  the  Peace  and  every  election  officer  is authorised and empowered to administer any oath required by or under this  Act:         Provided that no election officer shall administer an oath until he has himself taken the oath prescribed in pursuance of subsection"
                },
                {
                    "representation": "(3)",
                    "description": "Forthwith upon taking the oath prescribed in pursuance of subsection"
                }
            ]
        }
    },
    {
        "act": "REPRESENTATION OF THE PEOPLE ACT",
        "source": "https://mola.gov.gy/laws-of-guyana",
        "type": {
            "name": "section",
            "representation": "9",
            "title": "Notice of date for submission of lists. ",
            "context": "REPRESENTATION OF THE PEOPLE ACT under Notice of date for submission of lists. 9.  The Commission shall, by notice published in the Gazette, appoint the day, being a day not later than the 32nd day before election day, on which lists of candidates may be submitted to the Chief Election Officer; and there shall be included in the notice particulars of the hours between which and the place at which the Chief Election Officer will attend to receive the lists.",
            "description": "The Commission shall, by notice published in the Gazette, appoint the day, being a day not later than the 32nd day before election day, on which lists of candidates may be submitted to the Chief Election Officer; and there shall be included in the notice particulars of the hours between which and the place at which the Chief Election Officer will attend to receive the lists."
        }
    },
    {
        "act": "REPRESENTATION OF THE PEOPLE ACT",
        "source": "https://mola.gov.gy/laws-of-guyana",
        "type": {
            "name": "section",
            "representation": "10",
            "title": "Chief Election Officer to receive lists. ",
            "context": "REPRESENTATION OF THE PEOPLE ACT under Chief Election Officer to receive lists. 10. The Chief Election Officer shall attend in accordance with the notice given under section 9 to receive the lists of candidates; and no list shall be received at any other time or place.",
            "description": "The Chief Election Officer shall attend in accordance with the notice given under section 9 to receive the lists of candidates; and no list shall be received at any other time or place."
        }
    },
    {
        "act": "REPRESENTATION OF THE PEOPLE ACT",
        "source": "https://mola.gov.gy/laws-of-guyana",
        "type": {
            "name": "section",
            "representation": "11",
            "title": "Requirements of lists 11A.   Requirements for geographical constituencies. 11B.   Characteristics that party lists must satisfy. 11C.   Voting and allocation of seats in the National Assembly. ",
            "context": "REPRESENTATION OF THE PEOPLE ACT under Requirements of lists 11A.   Requirements for geographical constituencies. 11B.   Characteristics that party lists must satisfy. 11C.   Voting and allocation of seats in the National Assembly. 11.  (1) A list  of candidates  comprising  registered voters  who  are eligible to be members of the National Assembly may be submitted by not less than three hundred and not more than three hundred and thirty persons for  national top-up lists, and for each geographical constituency not less than one hundred and fifty and not more than one hundred and seventy-five persons whose names appear at the time of submission on the preliminary list mentioned in section 2(3), whether or not that list has at that date been modified as required by that section and shall  be  handed together with one copy thereof to the Chief Election  Officer by the representative or the deputy LAWS OF GUYANA 20 Cap. 1:03 Representation of the People   L.R.O. 1/2012                 Form",
            "description": [
                {
                    "representation": "(1)",
                    "description": "A list  of candidates  comprising  registered voters  who  are eligible to be members of the National Assembly may be submitted by not less than three hundred and not more than three hundred and thirty persons for  national top-up lists, and for each geographical constituency not less than one hundred and fifty and not more than one hundred and seventy-five persons whose names appear at the time of submission on the preliminary list mentioned in section 2(3), whether or not that list has at that date been modified as required by that section and shall  be  handed together with one copy thereof to the Chief Election  Officer by the representative or the deputy LAWS OF GUYANA 20 Cap. 1:03 Representation of the People   L.R.O. 1/2012                 Form"
                }
            ]
        }
    },
    {
        "act": "REPRESENTATION OF THE PEOPLE ACT",
        "source": "https://mola.gov.gy/laws-of-guyana",
        "type": {
            "name": "section",
            "representation": "12",
            "title": "Representatives of lists. ",
            "context": "REPRESENTATION OF THE PEOPLE ACT under Representatives of lists. 12.   (3) A list of candidates shall set out the names, one below the other in such order as each party may determine of the surnames and other names, of at least 42 persons qualified to be elected to the National Assembly and who have consented to the inclusion of their names in the list as candidates for election, together with the address and occupation of each such person.  (4) Each list of candidates shall be accompanied by a statutory declaration, in Form 3, by each person named therein as a candidate of his qualifications an d  consent, made before a justice of the peace, commissioner of oaths, notary public or other person authorised by law to administer an oath in the place where the declaration is made.  (5) Each  list  of  candidates  shall  bear  a  title    LAWS OF GUYANA Representation of the People Cap. 1:03 21  L.R.O. 1/2012                                                selected  by  the persons by whom it is submitted.  (6) Subject to section 11B, no person shall be a candidate on more than one list of candidates and no person shall be a signatory to more than one list.  (7) For the avoidance of doubt it is declared that a person may be a signatory to a list of candidates notwithstanding that he is named therein as a candidate.  (8) Stamp   duty shall   not   be chargeable on any declaration made for the purposes of this section.  (9) In the event of the name of the person designated by any list of  candidates  as a  Presidential  candidate  being  deleted  pursuant  to section 21 from the list  (a)       the  representative  of  the list;  or  (b)     if there is no representative  or if the representative  is unwilling or unable (by reason of absence, illness or any other cause) to act, the deputy representative of the list; or   (c)  in  the  case of any  such unwillingness or inability on the part of the deputy representative   or if there  is no deputy representative, a majority of persons named as candidates in the  list may designate in writing any such person able and willing LAWS OF GUYANA 22 Cap. 1:03 Representation of the People   L.R.O. 1/2012                              Requirements for geographical constituencies. [15 of 2000 2 of 2001]                  to act, who  shall forthwith and before election day, by written notice signed by him and delivered to the Commission,  amend the list by designating any person whose name remains as a candidate on the list as the Presidential candidate designated by that list.  (10)  On receipt of any notice of amendment pursuant to subsection (9), the Commission shall forthwith and before elections day give public notice of the amendment in such manner as it may in all the circumstances deem the most practicable and with effect from the time when such notice is given the new Presidential candidate specified in the notice shall be the Presidential candidate designated by that list.  11A. (1) The National Assembly shall contain at least sixty-five elected members, and their election shall be on a party lists basis to which the system of proportional representation shall be applied; in this section and in section 11C the system of proportional representation referred to is known as the largest remainder system using the Hare quota.  (2) Guyana shall be divided in ten geographical constituencies for the purpose of electing members of the National Assembly from each geographical constituency.  (3) Each of the ten regions of Guyana constituted as a registration district  and  a  polling  district  under  the  Local  Democratic   Organs (Regional Democratic  Councils) Order 1980 shall be deemed to be a geographical  constituency.      (4)  The ten geographical constituencies shall   LAWS OF GUYANA Representation of the People Cap. 1:03 23  L.R.O. 1/2012                                              Characteristics that party lists must satisfy. [15 of 2000]     elect twenty-five of the members of the National Assembly. The number of members to be elected from each geographical constituency mentioned in the first column of the Table below shall be as shown in the corresponding entry in the second column of the Table.  Table  Geographical  Constituencies  Number of members of the National Assembly elected No. 1 No. 2 No. 3 No. 4 No. 5 No. 6 No. 7 No. 8 No. 9   No. 10 2 2 3 7 2 3 2 1 1 2  (5)  The remaining elected members of the National Assembly shall be chosen from lists supplied by contesting parties and such list shall be designated national top-up lists.  11B. (1) Each party shall contest in a minimum of six of the ten geographical constituencies, and shall also satisfy the criterion that a contesting party is contesting at least thirteen of the twenty-five seats specified in section 11A (4) in respect of the geographical constituencies.  (2) Each party shall submit, for each LAWS OF GUYANA 24 Cap. 1:03 Representation of the People   L.R.O. 1/2012                                                 geographical constituency in which it is contesting the general election, a list of names of persons qualified to be elected to the National Assembly; and each such li st shall comprise two more names than the number of members of the National Assembly specified in section 11A (4) for the specific geographical constituency for which the list is submitted.  (3) Each party shall submit a national top-up list, separate and distinct from lists relating to geographical constituencies, comprising at least forty-two names of persons qualified to be elected to the National Assembly, and the partys Presidential Candidate shall be so identified on, and only on, its national top-up list.  (4) Each party may duplicate names on its geographical constituency lists and its national top-up list, subject to the  following provisions    (a)   a  candidates  name  can  appear on only one geographical constituency list;  (b)    a candidates  name  can  appear on  only one partys lists;   (c)    a candidates name can appear on a geographical constituency list and also on the national top-up list of a party, but if the candidate is allocated a seat based on the results in a geographical constituency that candidates name cannot also be extracted from the national top-up list, and vice versa,   LAWS OF GUYANA Representation of the People Cap. 1:03 25  L.R.O. 1/2012                                                for membership of the National Assembly.  (5)  The total number of females on each partys national top-up list shall be at least one-third of the total number of persons on that list.  (6)  The total number of females on any partys lists for geographical constituencies, taken together, shall be at least one-third of the total number of persons on those lists taken together for the geographical constituencies in which that party is contesting.  (7) There shall be no more than twenty per cent of the number of geographical constituencies in which a party is contesting for which the partys geographical constituency list contains no female.  (8) In the extraction from the lists and declaration of names of the candidates who have been elected account shall be taken   (i)    of the total number of females on each partys national top-up lists and the lists for geographical constituencies, taken together, being at least one-third of the number of persons on those lists as mentioned in paragraphs (5), (6) and (7); and (ii)  of the proportion that women formed  of the electorate.   LAWS OF GUYANA 26 Cap. 1:03 Representation of the People   L.R.O. 1/2012        Voting and allocation of seats in the National Assembly. [15 of 2000 2 of 2001]                                     (9) The order in which a party states the names of candidates on its lists shall be as the party deems fit.  11C. (1) Every elector shall have only one vote which shall be cast in the geographical constituency in which he is registered and votes in respect of the list of his choice, and that vote shall be counted to determine the outcomes of both the election for that geographical constituency and for the country taken as a whole: a vote for a Partys geographical constituency list is simultaneously a vote for that Partys national top-up list.  (2)  Within each geographical constituency, the seats allocated to a party for membership of the National Assembly from the geographical constituency shall be determined by application of the system of proportional representation to the valid votes cast in that geographical constituency in relation to the total number of seats being contested in that geographical constituency, thereby allocating to parties the twenty-five seats under section 11A (4).  (3)  Subject to the proviso to subsection (5) for the country taken as a whole, the total seats allocated to a party for membership of the National Assembly shall be determined by application of the system of proportional representation to the valid votes for parties countrywide in relation to the sixty-five elected seats of the National Assembly.  (4)  For each geographical constituency, each party  shall extract from its geographical constituency list the candidates to become members of the National Assembly on the basis of the seats allocated under   LAWS OF GUYANA Representation of the People Cap. 1:03 27  L.R.O. 1/2012                                             Representatives of lists. [16 of 1968] subsection (2)         (5) The number of seats in the National Assembly that is additional to the number of seats allocated to a party from the geographical constituencies as determined under subsection (2) shall be determined by subtracting the number determined under subsection (2) from the total number of seats that is to be allocated to the party under subsection (3):  Provided that in the event that the arithmetical calculations of total seats allocated to a party for membership of the National Assembly in accordance with subsection (3) produce the result that a party is allocated a fewer number of seats than those it has already obtained on the basis of the calculations that are in accordance with subsection (2), the allocations based on the distribution of sixty-five seats shall be made; the number of geographical constituency seats already allocated to parties shall not be changed, thereby maintaining the total number of geographical constituency seats at twenty-five; the total number of elected members of the National assembly shall be increased to accommodate the allocations of the number of non- geographical members and no further calculation based on the increased size of the Assembly shall be done.   (6)  Each party shall extract from its national top-up list candidates who together comprise the additional number of seats allocated to the party under subsection (4), provided that the provisions in section 11B (4) (c) are observed.",
            "description": [
                {
                    "representation": "(3)",
                    "description": "produce the result that a party is allocated a fewer number of seats than those it has already obtained on the basis of the calculations that are in accordance with subsection"
                },
                {
                    "representation": "(4)",
                    "description": "(c) are observed."
                },
                {
                    "representation": "(5)",
                    "description": "The number of seats in the National Assembly that is additional to the number of seats allocated to a party from the geographical constituencies as determined under subsection"
                },
                {
                    "representation": "(6)",
                    "description": "Each party shall extract from its national top-up list candidates who together comprise the additional number of seats allocated to the party under subsection"
                },
                {
                    "representation": "(7)",
                    "description": "There shall be no more than twenty per cent of the number of geographical constituencies in which a party is contesting for which the partys geographical constituency list contains no female."
                },
                {
                    "representation": "(8)",
                    "description": "In the extraction from the lists and declaration of names of the candidates who have been elected account shall be taken"
                },
                {
                    "representation": "(9)",
                    "description": "The order in which a party states the names of candidates on its lists shall be as the party deems fit.  11C."
                },
                {
                    "representation": "(a)",
                    "description": "a  candidates  name  can  appear on only one geographical constituency list;"
                },
                {
                    "representation": "(b)",
                    "description": "a candidates  name  can  appear on  only one partys lists;"
                },
                {
                    "representation": "(c)",
                    "description": "a candidates name can appear on a geographical constituency list and also on the national top-up list of a party, but if the candidate is allocated a seat based on the results in a geographical constituency that candidates name cannot also be extracted from the national top-up list, and vice versa,   LAWS OF GUYANA Representation of the People Cap. 1:03 25  L.R.O. 1/2012                                                for membership of the National Assembly."
                },
                {
                    "representation": "(1)",
                    "description": "Every elector shall have only one vote which shall be cast in the geographical constituency in which he is registered and votes in respect of the list of his choice, and that vote shall be counted to determine the outcomes of both the election for that geographical constituency and for the country taken as a whole: a vote for a Partys geographical constituency list is simultaneously a vote for that Partys national top-up list."
                },
                {
                    "representation": "(2)",
                    "description": "from the total number of seats that is to be allocated to the party under subsection"
                },
                {
                    "representation": "(i)",
                    "description": "of the total number of females on each partys national top-up lists and the lists for geographical constituencies, taken together, being at least one-third of the number of persons on those lists as mentioned in paragraphs"
                }
            ]
        }
    },
    {
        "act": "REPRESENTATION OF THE PEOPLE ACT",
        "source": "https://mola.gov.gy/laws-of-guyana",
        "type": {
            "name": "section",
            "representation": "13",
            "title": "Examination of lists. ",
            "context": "REPRESENTATION OF THE PEOPLE ACT under Examination of lists. 13.  On receipt of the lists of candidates the Chief Election Officer shall examine them for the purpose of ascertaining whether they have been submitted in accordance with section 11 or section 11A, as the case may be, and shall, after examination, deliver them to the Commission together with his report thereon.",
            "description": "On receipt of the lists of candidates the Chief Election Officer shall examine them for the purpose of ascertaining whether they have been submitted in accordance with section 11 or section 11A, as the case may be, and shall, after examination, deliver them to the Commission together with his report thereon."
        }
    },
    {
        "act": "REPRESENTATION OF THE PEOPLE ACT",
        "source": "https://mola.gov.gy/laws-of-guyana",
        "type": {
            "name": "section",
            "representation": "14",
            "title": "Defective lists. ",
            "context": "REPRESENTATION OF THE PEOPLE ACT under Defective lists. 14.  (1) If it appears to the Commission that a list of candidates is defective, that is to say, that the list or its submission does not comply in all respects with the requirements of section 11(1), (2), (3), (4), (5) or section 11B or bears a misleading title, the Chief Election  Officer shall, not later than the 30th day before election  day, so inform the representative and the deputy representative  of the list, specifying the defects:  LAWS OF GUYANA 30 Cap. 1:03 Representation of the People   L.R.O. 1/2012                                                 Provided that if the list does not bear a title the Commission may, if it seems to it just and proper to do so, instead of treating the list as defective, allocate a title thereto. (2) If the name of any person appears as a candidate on two or more lists of candidates the Chief Election Officer shall  (a)   not later than the 30th day before election day inform the  representatives and  deputy  representatives of the lists concerned;  (b)     delete the name of that person from any list on which the Commission  i s   satisfied  he  did  not  consent  to  the inclusion of his name;  (c)    delete his name  from  each list on which it  appears if  the  Commission is satisfied that he consented to the inclusion of  his name on more than one list.             (3) If  the  name  of  any person  appears  as  a  signatory  to  the submission of more than one list, his signature shall be inoperative on any list other than the one first delivered to the Chief Election Officer and the Chief Election Officer shall delete his name from each other list, and if by reason of such deletion it appears to the Commission that any list is defective in that in the case of the national top-up lists there remain less  than three hundred signatories thereto or in case of a geographical constituency  there  remain  less  than  one  hundred  and    LAWS OF GUYANA Representation of the People Cap. 1:03 31  L.R.O. 1/2012        Correction to lists. [16 of 1968 Reg. 6/1973]            Applications for symbols. [16 of 1968 Reg. 6/1973]                        Approval of lists. [16 of 1968 Reg. 6/1973 O. 50/1980]       fifty  of  the registered  voters  as  signatories  thereto,  such  list  shall  be  treated  as defective.",
            "description": [
                {
                    "representation": "(1)",
                    "description": "If it appears to the Commission that a list of candidates is defective, that is to say, that the list or its submission does not comply in all respects with the requirements of section 11(1),"
                },
                {
                    "representation": "(5)",
                    "description": "or section 11B or bears a misleading title, the Chief Election  Officer shall, not later than the 30th day before election  day, so inform the representative and the deputy representative  of the list, specifying the defects:  LAWS OF GUYANA 30 Cap. 1:03 Representation of the People   L.R.O. 1/2012                                                 Provided that if the list does not bear a title the Commission may, if it seems to it just and proper to do so, instead of treating the list as defective, allocate a title thereto."
                },
                {
                    "representation": "(2)",
                    "description": "If the name of any person appears as a candidate on two or more lists of candidates the Chief Election Officer shall"
                },
                {
                    "representation": "(a)",
                    "description": "not later than the 30th day before election day inform the  representatives and  deputy  representatives of the lists concerned;"
                },
                {
                    "representation": "(b)",
                    "description": "delete the name of that person from any list on which the Commission  i s   satisfied  he  did  not  consent  to  the inclusion of his name;"
                },
                {
                    "representation": "(c)",
                    "description": "delete his name  from  each list on which it  appears if  the  Commission is satisfied that he consented to the inclusion of  his name on more than one list."
                },
                {
                    "representation": "(3)",
                    "description": "If  the  name  of  any person  appears  as  a  signatory  to  the submission of more than one list, his signature shall be inoperative on any list other than the one first delivered to the Chief Election Officer and the Chief Election Officer shall delete his name from each other list, and if by reason of such deletion it appears to the Commission that any list is defective in that in the case of the national top-up lists there remain less  than three hundred signatories thereto or in case of a geographical constituency  there  remain  less  than  one  hundred  and    LAWS OF GUYANA Representation of the People Cap. 1:03 31  L.R.O. 1/2012        Correction to lists. [16 of 1968 Reg. 6/1973]            Applications for symbols. [16 of 1968 Reg. 6/1973]                        Approval of lists. [16 of 1968 Reg. 6/1973 O. 50/1980]       fifty  of  the registered  voters  as  signatories  thereto,  such  list  shall  be  treated  as defective."
                }
            ]
        }
    },
    {
        "act": "REPRESENTATION OF THE PEOPLE ACT",
        "source": "https://mola.gov.gy/laws-of-guyana",
        "type": {
            "name": "section",
            "representation": "15",
            "title": "Correction of lists. ",
            "context": "REPRESENTATION OF THE PEOPLE ACT under Correction of lists. 15.  The  representative   and  deputy  representative   of  a  list  of candidates, or either of them, may, not later than the 29th day before election  day, submit to the Chief Election  Officer corrections  of any defects in the list (whether or not those defects are defects which have been  notified under section  14); and the Chief Election  Officer shall forward the corrections  to the Commission  together  with his report thereon.",
            "description": "The  representative   and  deputy  representative   of  a  list  of candidates, or either of them, may, not later than the 29th day before election  day, submit to the Chief Election  Officer corrections  of any defects in the list (whether or not those defects are defects which have been  notified under section  14); and the Chief Election  Officer shall forward the corrections  to the Commission  together  with his report thereon."
        }
    },
    {
        "act": "REPRESENTATION OF THE PEOPLE ACT",
        "source": "https://mola.gov.gy/laws-of-guyana",
        "type": {
            "name": "section",
            "representation": "16",
            "title": "Application for symbols. ",
            "context": "REPRESENTATION OF THE PEOPLE ACT under Application for symbols. 16. (1) The  representative  and  deputy  representative  of  a  list  of candidates, or either of them, may, not later than the 32nd day before election day, make application in writing addressed to the Chief Election Officer for the allocation of a symbol which shall be a symbol approved by the Commission.  (2) Applications for symbols   shall   be   considered   by the Commission in the order in which they have been received but no right shall be conferred by priority of application to the allocation of the symbol for which application is made or for any particular symbol.",
            "description": [
                {
                    "representation": "(1)",
                    "description": "The  representative  and  deputy  representative  of  a  list  of candidates, or either of them, may, not later than the 32nd day before election day, make application in writing addressed to the Chief Election Officer for the allocation of a symbol which shall be a symbol approved by the Commission."
                },
                {
                    "representation": "(2)",
                    "description": "Applications for symbols   shall   be   considered   by the Commission in the order in which they have been received but no right shall be conferred by priority of application to the allocation of the symbol for which application is made or for any particular symbol."
                }
            ]
        }
    },
    {
        "act": "REPRESENTATION OF THE PEOPLE ACT",
        "source": "https://mola.gov.gy/laws-of-guyana",
        "type": {
            "name": "section",
            "representation": "17",
            "title": "Approval of lists. ",
            "context": "REPRESENTATION OF THE PEOPLE ACT under Approval of lists. 17.  (1) Subject to section 18 no list of candidates shall be valid unless it has been approved by the Commission not later than the 28th day before election day.             (2) If it appears to the Commission that a list of candidates is not defective or that defects in it have been cured by corrections submitted in accordance with section LAWS OF GUYANA 32 Cap. 1:03 Representation of the People   L.R.O. 1/2012                              Appeal against refusal of approval.                     15, they shall approve it and allocate thereto such symbol as they in their discretion decide; and if it appears to the Commission that a defective list has not been so corrected, they shall refuse to approve it. (3) Not  later   than  the  28th  day  before   election day, the Commission shall notify the representative and deputy representative of each list that the list is or is not approved and shall publicly declare the titles of the approved lists and the names of candidates thereon.                     (4) The refusal of the Commission to approve a list shall not be called in question in any court except by appeal under section 18, and the approval of a list by the Commission shall not be called in question in any court except in accordance with a law made under article 163 of the Constitution.",
            "description": [
                {
                    "representation": "(1)",
                    "description": "Subject to section 18 no list of candidates shall be valid unless it has been approved by the Commission not later than the 28th day before election day."
                },
                {
                    "representation": "(2)",
                    "description": "If it appears to the Commission that a list of candidates is not defective or that defects in it have been cured by corrections submitted in accordance with section LAWS OF GUYANA 32 Cap. 1:03 Representation of the People   L.R.O. 1/2012                              Appeal against refusal of approval.                     15, they shall approve it and allocate thereto such symbol as they in their discretion decide; and if it appears to the Commission that a defective list has not been so corrected, they shall refuse to approve it."
                },
                {
                    "representation": "(3)",
                    "description": "Not  later   than  the  28th  day  before   election day, the Commission shall notify the representative and deputy representative of each list that the list is or is not approved and shall publicly declare the titles of the approved lists and the names of candidates thereon."
                },
                {
                    "representation": "(4)",
                    "description": "The refusal of the Commission to approve a list shall not be called in question in any court except by appeal under section 18, and the approval of a list by the Commission shall not be called in question in any court except in accordance with a law made under article 163 of the Constitution."
                }
            ]
        }
    },
    {
        "act": "REPRESENTATION OF THE PEOPLE ACT",
        "source": "https://mola.gov.gy/laws-of-guyana",
        "type": {
            "name": "section",
            "representation": "18",
            "title": "Appeal against refusal of approval. ",
            "context": "REPRESENTATION OF THE PEOPLE ACT under Appeal against refusal of approval. 18. (1) Where the Commission have refused to approve a list of candidates, the representative and deputy representative of the list, or either of them, may, not later than the 26th day before election day, appeal to the High Court against such refusal.  (2) The High Court shall hear the appeal and deliver judgment within such time before election day as will enable the Commission duly to comply with the requirement of section 19 relating to publication of the list; and the judgment of the court shall not be subject to appeal.  (3) The court may              (a)  dismiss the appeal; or  (b)   approve the list to which the   LAWS OF GUYANA Representation of the People Cap. 1:03 33  L.R.O. 1/2012                  Publication of lists.  [16 of 1968 Reg. 6/1973]          Withdrawal of lists.                      Death of withdrawal of candidate. [16 of 1968 Reg. 6/1973   Commission have refused to give their approval; or  (c)   approve that list with such modifications as to court may seem just;  and when the court approves a list, with or without modification, the list as approved by the court shall have effect as if it had been approved by the Commission under section",
            "description": [
                {
                    "representation": "(1)",
                    "description": "Where the Commission have refused to approve a list of candidates, the representative and deputy representative of the list, or either of them, may, not later than the 26th day before election day, appeal to the High Court against such refusal."
                },
                {
                    "representation": "(2)",
                    "description": "The High Court shall hear the appeal and deliver judgment within such time before election day as will enable the Commission duly to comply with the requirement of section 19 relating to publication of the list; and the judgment of the court shall not be subject to appeal."
                },
                {
                    "representation": "(3)",
                    "description": "The court may"
                },
                {
                    "representation": "(a)",
                    "description": "dismiss the appeal; or"
                },
                {
                    "representation": "(b)",
                    "description": "approve the list to which the   LAWS OF GUYANA Representation of the People Cap. 1:03 33  L.R.O. 1/2012                  Publication of lists.  [16 of 1968 Reg. 6/1973]          Withdrawal of lists.                      Death of withdrawal of candidate. [16 of 1968 Reg. 6/1973   Commission have refused to give their approval; or"
                },
                {
                    "representation": "(c)",
                    "description": "approve that list with such modifications as to court may seem just;  and when the court approves a list, with or without modification, the list as approved by the court shall have effect as if it had been approved by the Commission under section"
                }
            ]
        }
    },
    {
        "act": "REPRESENTATION OF THE PEOPLE ACT",
        "source": "https://mola.gov.gy/laws-of-guyana",
        "type": {
            "name": "section",
            "representation": "19",
            "title": "Publication of lists. ",
            "context": "REPRESENTATION OF THE PEOPLE ACT under Publication of lists. 19.",
            "description": "19."
        }
    },
    {
        "act": "REPRESENTATION OF THE PEOPLE ACT",
        "source": "https://mola.gov.gy/laws-of-guyana",
        "type": {
            "name": "section",
            "representation": "20",
            "title": "Withdrawal of lists. ",
            "context": "REPRESENTATION OF THE PEOPLE ACT under Withdrawal of lists. 20.  A  list  of  candidates  may  be  withdrawn  by notice  in  writing addressed  to  the  Chief  Election  Officer  and  signed  by  both  the representative and deputy representative  of the list:  Provided that a list shall not be withdrawn after the Commission have notified the representative and deputy representative thereof that it has been approved.",
            "description": "A  list  of  candidates  may  be  withdrawn  by notice  in  writing addressed  to  the  Chief  Election  Officer  and  signed  by  both  the representative and deputy representative  of the list:  Provided that a list shall not be withdrawn after the Commission have notified the representative and deputy representative thereof that it has been approved."
        }
    },
    {
        "act": "REPRESENTATION OF THE PEOPLE ACT",
        "source": "https://mola.gov.gy/laws-of-guyana",
        "type": {
            "name": "section",
            "representation": "21",
            "title": "Death or withdrawal of candidate. LAWS OF GUYANA 4 Cap. 1:03 Representation of the People   L.R.O. 1/2012  SECTION   ",
            "context": "REPRESENTATION OF THE PEOPLE ACT under Death or withdrawal of candidate. LAWS OF GUYANA 4 Cap. 1:03 Representation of the People   L.R.O. 1/2012  SECTION   21.  (1) If a person whose name is included in a list of candidates which has been submitted to the Chief Election Officer dies or, by notice in  writing  signed  by him  and  addressed  and  delivered  to the  Chief Election Officer, withdraws his candidature, his name shall be deleted from the list and, if the list has already been LAWS OF GUYANA 34 Cap. 1:03 Representation of the People   L.R.O. 1/2012                                 Joinder of lists. [16 of 1968 Reg. 6/1973]                   published under section 19, the Commission shall cause notification of the deletion to be published in like manner:  Provided that no such notice shall be delivered as aforesaid after the 31st day before election day.  (2) The deletion of the name of any candidate by reason of his death from any list of candidates after its approval by the Commission shall not render the list defective; and correction of any defect caused by deletion of a dead candidates name from any list of candidates may, notwithstanding  anything  to  the  contrary  provided  in  section  15,  be submitted at any time before the approval of such list:   Provided that where, by reason of any deletion first mentioned in this paragraph no names remain on a list of candidates, such list shall cease to have effect.",
            "description": [
                {
                    "representation": "(1)",
                    "description": "If a person whose name is included in a list of candidates which has been submitted to the Chief Election Officer dies or, by notice in  writing  signed  by him  and  addressed  and  delivered  to the  Chief Election Officer, withdraws his candidature, his name shall be deleted from the list and, if the list has already been LAWS OF GUYANA 34 Cap. 1:03 Representation of the People   L.R.O. 1/2012                                 Joinder of lists. [16 of 1968 Reg. 6/1973]                   published under section 19, the Commission shall cause notification of the deletion to be published in like manner:  Provided that no such notice shall be delivered as aforesaid after the 31st day before election day."
                },
                {
                    "representation": "(2)",
                    "description": "The deletion of the name of any candidate by reason of his death from any list of candidates after its approval by the Commission shall not render the list defective; and correction of any defect caused by deletion of a dead candidates name from any list of candidates may, notwithstanding  anything  to  the  contrary  provided  in  section  15,  be submitted at any time before the approval of such list:   Provided that where, by reason of any deletion first mentioned in this paragraph no names remain on a list of candidates, such list shall cease to have effect."
                }
            ]
        }
    },
    {
        "act": "REPRESENTATION OF THE PEOPLE ACT",
        "source": "https://mola.gov.gy/laws-of-guyana",
        "type": {
            "name": "section",
            "representation": "22",
            "title": "Joinder of lists.         PART III        AGENTS  ",
            "context": "REPRESENTATION OF THE PEOPLE ACT under Joinder of lists.         PART III        AGENTS  22. (1) Subject to subsection (2), two or more lists of candidates shall be joined for the distribution of seats (but not for the purpose of voting) if the representative and deputy representative of each list to be so joined gives notice accordingly in writing to the Chief Election Officer not later than the 25th day before election day; and lists so joined are hereinafter referred to collectively as a combination of lists.  (2) No list of candidates shall be included in more than one combination of lists and if any notice given under subsection (1) would, if given effect, result in a contravention of this section, that list shall not be included in any combination of lists.     LAWS OF GUYANA Representation of the People Cap. 1:03 35  L.R.O. 1/2012               Appointment   of election agents. [Reg. 6/1973]                  Appointments of  assistant agents, counting agents and polling  agents.          (3) The Commission shall cause a notification of combinations of lists to be published not later than the 23rd day before election day in the Gazette and may cause such further publication of the same, for the information of electors, as the Commission considers desirable.  PART III AGENTS",
            "description": [
                {
                    "representation": "(1)",
                    "description": "would, if given effect, result in a contravention of this section, that list shall not be included in any combination of lists.     LAWS OF GUYANA Representation of the People Cap. 1:03 35  L.R.O. 1/2012               Appointment   of election agents. [Reg. 6/1973]                  Appointments of  assistant agents, counting agents and polling  agents."
                },
                {
                    "representation": "(2)",
                    "description": "No list of candidates shall be included in more than one combination of lists and if any notice given under subsection"
                },
                {
                    "representation": "(3)",
                    "description": "The Commission shall cause a notification of combinations of lists to be published not later than the 23rd day before election day in the Gazette and may cause such further publication of the same, for the information of electors, as the Commission considers desirable.  PART III AGENTS"
                }
            ]
        }
    },
    {
        "act": "REPRESENTATION OF THE PEOPLE ACT",
        "source": "https://mola.gov.gy/laws-of-guyana",
        "type": {
            "name": "section",
            "representation": "23",
            "title": "Appointment of election agents. ",
            "context": "REPRESENTATION OF THE PEOPLE ACT under Appointment of election agents. 23.    (1) The representative  of each list of candidates shall not later than the 32nd day before election day give notice in writing to the Chief Election  Officer  appointing  himself  or some  other  person  to be the election agent of the candidates in the list and if the appointment of an election  agent  is  revoked  or  the  election  agent  dies  and  no  further appointment is made, the representative of the list of candidates shall be deemed  to  have  been  appointed  to  be  the  election  agent  of  the candidates.   (2) The  Chief  Election   Officer  shall  cause  a  notice  to  be published  in  the  Gazette  of  the  name  and  address  of  the  person appointed or deemed to be appointed as election agent.",
            "description": [
                {
                    "representation": "(1)",
                    "description": "The representative  of each list of candidates shall not later than the 32nd day before election day give notice in writing to the Chief Election  Officer  appointing  himself  or some  other  person  to be the election agent of the candidates in the list and if the appointment of an election  agent  is  revoked  or  the  election  agent  dies  and  no  further appointment is made, the representative of the list of candidates shall be deemed  to  have  been  appointed  to  be  the  election  agent  of  the candidates."
                },
                {
                    "representation": "(2)",
                    "description": "The  Chief  Election   Officer  shall  cause  a  notice  to  be published  in  the  Gazette  of  the  name  and  address  of  the  person appointed or deemed to be appointed as election agent."
                }
            ]
        }
    },
    {
        "act": "REPRESENTATION OF THE PEOPLE ACT",
        "source": "https://mola.gov.gy/laws-of-guyana",
        "type": {
            "name": "section",
            "representation": "24",
            "title": "Appointment of assistant agents, counting agents and polling agents. ",
            "context": "REPRESENTATION OF THE PEOPLE ACT under Appointment of assistant agents, counting agents and polling agents. 24.  (1) An election agent may appoint  (a)      an assistant agent for each district;  (b)      a counting agent for each district;  (c)   a polling  agent for each polling place.   (2) Notice in writing of every appointment of an assistant agent, counting agent and polling agent, stating LAWS OF GUYANA 36 Cap. 1:03 Representation of the People   L.R.O. 1/2012                                                 the name and address of the person appointed shall be given not later than the 7th day before election day by the election agent to the returning officer of the district for which the assistant agent or counting agent is appointed or in which is situate the polling place for which the polling agent is appointed.  (3) The  returning  officer  shall  upon  receiving  a  notice  of  an appointment of an assistant  agent give public notice of the name and address of the person appointed.  (4) There shall not be, at the same time, more than one assistant agent or more than one counting agent of a group of candidates for any one district nor shall there be more than one polling agent of that group for any one polling place.  (5) Upon the revocation of the appointment of or upon the death of an assistant agent, counting agent or polling agent the election agent shall forthwith give notice in writing thereof to the returning officer to whom notice of appointment was given and shall give notice in writing of any further appointment made in accordance with subsection (2):  Provided that the appointment of an assistant agent, counting agent or polling agent shall not be vacated solely by reason of the revocation of the appointment or the death of the election agent who appointed him.  (6) Nothing in this section shall preclude the appointment of a person as an assistant agent for two or more districts or as polling agent for two or more polling places or as both assistant agent and counting agent.   LAWS OF GUYANA Representation of the People Cap. 1:03 37  L.R.O. 1/2012    Actions of assistant agents, polling agents and counting agents.                         Liability of candidates for offences by election agents.                        Electors to have one vote and to",
            "description": [
                {
                    "representation": "(1)",
                    "description": "An election agent may appoint"
                },
                {
                    "representation": "(a)",
                    "description": "an assistant agent for each district;"
                },
                {
                    "representation": "(b)",
                    "description": "a counting agent for each district;"
                },
                {
                    "representation": "(c)",
                    "description": "a polling  agent for each polling place."
                },
                {
                    "representation": "(2)",
                    "description": "Notice in writing of every appointment of an assistant agent, counting agent and polling agent, stating LAWS OF GUYANA 36 Cap. 1:03 Representation of the People   L.R.O. 1/2012                                                 the name and address of the person appointed shall be given not later than the 7th day before election day by the election agent to the returning officer of the district for which the assistant agent or counting agent is appointed or in which is situate the polling place for which the polling agent is appointed."
                },
                {
                    "representation": "(3)",
                    "description": "The  returning  officer  shall  upon  receiving  a  notice  of  an appointment of an assistant  agent give public notice of the name and address of the person appointed."
                },
                {
                    "representation": "(4)",
                    "description": "There shall not be, at the same time, more than one assistant agent or more than one counting agent of a group of candidates for any one district nor shall there be more than one polling agent of that group for any one polling place."
                },
                {
                    "representation": "(5)",
                    "description": "Upon the revocation of the appointment of or upon the death of an assistant agent, counting agent or polling agent the election agent shall forthwith give notice in writing thereof to the returning officer to whom notice of appointment was given and shall give notice in writing of any further appointment made in accordance with subsection"
                },
                {
                    "representation": "(6)",
                    "description": "Nothing in this section shall preclude the appointment of a person as an assistant agent for two or more districts or as polling agent for two or more polling places or as both assistant agent and counting agent.   LAWS OF GUYANA Representation of the People Cap. 1:03 37  L.R.O. 1/2012    Actions of assistant agents, polling agents and counting agents.                         Liability of candidates for offences by election agents.                        Electors to have one vote and to"
                }
            ]
        }
    },
    {
        "act": "REPRESENTATION OF THE PEOPLE ACT",
        "source": "https://mola.gov.gy/laws-of-guyana",
        "type": {
            "name": "section",
            "representation": "25",
            "title": "Actions of assistant agents, polling agents and counting agents. ",
            "context": "REPRESENTATION OF THE PEOPLE ACT under Actions of assistant agents, polling agents and counting agents. 25. (1)Every  election  agent  may  act,  in  relation  to  any  matter required to be done in any district, by the assistant agent for that district; and anything done for the purposes of this Act by an assistant agent in his district shall be deemed to have been done by the election agent.         (2) Any act or default by an assistant agent which, if he were an election agent, would be an illegal practice or other offence against this Act,  shall  be  an  illegal  practice  or  other  offence  against  this  Act committed  by the assistant  agent  who shall  be liable  to punishment accordingly.  (3) Where in this Act any action or thing is required to be done in the presence of candidates, polling agents or counting agents, the non- attendance of any such candidate, polling agent or counting agent at the time and place appointed for the purpose shall not, if any act or thing is otherwise properly done, invalidate the act or thing done.",
            "description": [
                {
                    "representation": "(2)",
                    "description": "Any act or default by an assistant agent which, if he were an election agent, would be an illegal practice or other offence against this Act,  shall  be  an  illegal  practice  or  other  offence  against  this  Act committed  by the assistant  agent  who shall  be liable  to punishment accordingly."
                },
                {
                    "representation": "(3)",
                    "description": "Where in this Act any action or thing is required to be done in the presence of candidates, polling agents or counting agents, the non- attendance of any such candidate, polling agent or counting agent at the time and place appointed for the purpose shall not, if any act or thing is otherwise properly done, invalidate the act or thing done."
                }
            ]
        }
    },
    {
        "act": "REPRESENTATION OF THE PEOPLE ACT",
        "source": "https://mola.gov.gy/laws-of-guyana",
        "type": {
            "name": "section",
            "representation": "26",
            "title": "Liability of candidates for offences by election agents.  PART IV ENTITLEMENT TO VOTE ",
            "context": "REPRESENTATION OF THE PEOPLE ACT under Liability of candidates for offences by election agents.  PART IV ENTITLEMENT TO VOTE 26.  Where any corrupt or illegal practice or any illegal payment, employment or hiring, or other offence under this Act, is proved to have been committed by an election agent or assistant agent with the consent or connivance of a candidate, such candidate shall also be deemed to have been guilty of such corrupt or illegal practice or illegal payment, employment or hiring or other offence.  PART  IV ENTITLEMENT  TO  VOTE",
            "description": "Where any corrupt or illegal practice or any illegal payment, employment or hiring, or other offence under this Act, is proved to have been committed by an election agent or assistant agent with the consent or connivance of a candidate, such candidate shall also be deemed to have been guilty of such corrupt or illegal practice or illegal payment, employment or hiring or other offence.  PART  IV ENTITLEMENT  TO  VOTE"
        }
    },
    {
        "act": "REPRESENTATION OF THE PEOPLE ACT",
        "source": "https://mola.gov.gy/laws-of-guyana",
        "type": {
            "name": "section",
            "representation": "27",
            "title": "Electors to have one vote and to vote in person. ",
            "context": "REPRESENTATION OF THE PEOPLE ACT under Electors to have one vote and to vote in person. 27. (1) An elector shall be entitled to vote in a polling place at an election if he complies with this Act and with LAWS OF GUYANA 38 Cap. 1:03 Representation of the People   L.R.O. 1/2012  vote in person. [16 of 1968]                                       Voting to be at polling place where electors name displayed. [16 of 1968 Reg. 6/1973 16 of 1985]      Right of electors in certain cases to vote at other polling places.  [16 of 1968 O. 50/1980 O. 80/1980 15 of 2000] requirements made and directions given there under  and if the presiding officer of the polling place at which he applies for a ballot paper is satisfied as to the matters specified in section 79(1).  (2) No person shall be entitled to vote in a polling place at an election unless he is entitled to do so under subsection (1).  (3) Every elector who votes at an election shall, subject to the provisions of this Act relating to voting by proxy and to the marking of ballot papers on behalf of blind and incapacitated electors, vote at a polling place in person.  (4) Without prejudice to the provisions of this Act relating to voting as a proxy and to the marking of ballot papers on behalf of blind and incapacitated electors, no elector shall vote more than once at the election.",
            "description": [
                {
                    "representation": "(1)",
                    "description": "An elector shall be entitled to vote in a polling place at an election if he complies with this Act and with LAWS OF GUYANA 38 Cap. 1:03 Representation of the People   L.R.O. 1/2012  vote in person. [16 of 1968]                                       Voting to be at polling place where electors name displayed. [16 of 1968 Reg. 6/1973 16 of 1985]      Right of electors in certain cases to vote at other polling places.  [16 of 1968 O. 50/1980 O. 80/1980 15 of 2000] requirements made and directions given there under  and if the presiding officer of the polling place at which he applies for a ballot paper is satisfied as to the matters specified in section 79(1)."
                },
                {
                    "representation": "(2)",
                    "description": "No person shall be entitled to vote in a polling place at an election unless he is entitled to do so under subsection"
                },
                {
                    "representation": "(3)",
                    "description": "Every elector who votes at an election shall, subject to the provisions of this Act relating to voting by proxy and to the marking of ballot papers on behalf of blind and incapacitated electors, vote at a polling place in person."
                },
                {
                    "representation": "(4)",
                    "description": "Without prejudice to the provisions of this Act relating to voting as a proxy and to the marking of ballot papers on behalf of blind and incapacitated electors, no elector shall vote more than once at the election."
                }
            ]
        }
    },
    {
        "act": "REPRESENTATION OF THE PEOPLE ACT",
        "source": "https://mola.gov.gy/laws-of-guyana",
        "type": {
            "name": "section",
            "representation": "28",
            "title": "Voting to be at polling-place where elector\u2019s name displayed. ",
            "context": "REPRESENTATION OF THE PEOPLE ACT under Voting to be at polling-place where electors name displayed. 28.  An elector shall be entitled to vote (whether in person or as a proxy on behalf of another elector) at the polling place where is displayed in pursuance of section 36 the official list of electors or part thereof, as the case may be, on which his name appears; and no elector shall, subject to section 29, be entitled to vote (either in person or as a proxy on behalf of another elector), at any other polling place.",
            "description": "An elector shall be entitled to vote (whether in person or as a proxy on behalf of another elector) at the polling place where is displayed in pursuance of section 36 the official list of electors or part thereof, as the case may be, on which his name appears; and no elector shall, subject to section 29, be entitled to vote (either in person or as a proxy on behalf of another elector), at any other polling place."
        }
    },
    {
        "act": "REPRESENTATION OF THE PEOPLE ACT",
        "source": "https://mola.gov.gy/laws-of-guyana",
        "type": {
            "name": "section",
            "representation": "29",
            "title": "Right of electors in certain cases to vote at other polling-places. ",
            "context": "REPRESENTATION OF THE PEOPLE ACT under Right of electors in certain cases to vote at other polling-places. 29. (1) The Commission may by notice published in the Gazette specify divisions or groups of divisions to which subsections (2) and (3) shall apply:  Provided that divisions which form part of different districts shall not be grouped together.   LAWS OF GUYANA Representation of the People Cap. 1:03 39  L.R.O. 1/2012                             Form 4            Entitlement to vote by proxy.  [16 of 1968 Reg. 21/1968 6 of 1973 16 of 1985]        (2) An elector whose name appears on the official list of electors of a division which is one of a group of divisions specified by the Commission by notice under this section may vote at any polling place in that group of divisions.  (3) An elector whose name appears on the official list of electors of a division which is specified by the Commission by notice under this section may vote at any polling place in that division.  (4) An elector who, in the district in which his address as entered in the official list of electors affixed under section 34(2)(a)(iv) is situate is employed as an election officer, member of the Police Force or of the Guyana Defence Force for a purpose connected with the election at a polling place other than that where his name is displayed under section 28 may vote at that polling place if, not later than the day before election day, he obtains from the returning officer of that district a certificate under his hand, in Form 4, authorising him to vote at that polling place, which certificate shall state the name of the elector, the number of his identity paper and the fact that he is to be so employed.",
            "description": [
                {
                    "representation": "(1)",
                    "description": "The Commission may by notice published in the Gazette specify divisions or groups of divisions to which subsections"
                },
                {
                    "representation": "(2)",
                    "description": "An elector whose name appears on the official list of electors of a division which is one of a group of divisions specified by the Commission by notice under this section may vote at any polling place in that group of divisions."
                },
                {
                    "representation": "(3)",
                    "description": "An elector whose name appears on the official list of electors of a division which is specified by the Commission by notice under this section may vote at any polling place in that division."
                },
                {
                    "representation": "(4)",
                    "description": "An elector who, in the district in which his address as entered in the official list of electors affixed under section 34(2)(a)(iv) is situate is employed as an election officer, member of the Police Force or of the Guyana Defence Force for a purpose connected with the election at a polling place other than that where his name is displayed under section 28 may vote at that polling place if, not later than the day before election day, he obtains from the returning officer of that district a certificate under his hand, in Form 4, authorising him to vote at that polling place, which certificate shall state the name of the elector, the number of his identity paper and the fact that he is to be so employed."
                }
            ]
        }
    },
    {
        "act": "REPRESENTATION OF THE PEOPLE ACT",
        "source": "https://mola.gov.gy/laws-of-guyana",
        "type": {
            "name": "section",
            "representation": "30",
            "title": "Entitlement to vote by proxy. ",
            "context": "REPRESENTATION OF THE PEOPLE ACT under Entitlement to vote by proxy. 30.  (1) The following electors shall be entitled to vote by proxy at an election  (a)       those unable, or likely to be unable, to go in person to the polling place, at which they are entitled to vote, for any of the following  reasons  (i)      the  particular  circumstances LAWS OF GUYANA 40 Cap. 1:03 Representation of the People   L.R.O. 1/2012                                                 of that persons employment on the election day either as a member of a disciplined force, or as a rural constable, or for a purpose connected with the election, by a returning officer; (ii)    the  fact  that at the election that person is acting as returning officer for a district other than the district in which his address as entered in the official list of electors is situate;  (iii)     the    particular circum-stances of that   persons employment on the election day by the returning officer for a  district,  other than the district  in which his address as entered in the official list of electors is situate, for a purpose connected with the election in that district; (iv)    the  fact  that  that  person  is  an  employee  of  the Transport and Harbours  Department engaged in running a vessel on the election day;  (b)     a candidate at the election, where he is unable, or likely to be unable, to go in person to the polling place at which he is entitled to vote, by   LAWS OF GUYANA Representation of the People Cap. 1:03 41  L.R.O. 1/2012                                                      Application for  appointment of proxy.  [16 of 1968] reason of being engaged in any activity connected with the election in a district other than the district in which that polling place is situate;  (c)      those unable, or likely to be unable, by reason either of blindness or any other physical incapacity, to go in person to the polling place or, if able to go, to vote unaided.  (2) Not more than one person shall be appointed to vote as a proxy on behalf of any one elector.  (3) No person shall be appointed to vote as a proxy  (a)       on behalf  of another  elector  unless  he is himself  an elector who is entitled to vote at the same polling place as that at  which  the  elector  on  whose  behalf  his  appointment  is sought is entitled to vote;  (b)      for more than two electors.  (4) An elector voting as a proxy on behalf of another elector so shall do at the same polling place and at the same time as he votes on his own behalf.",
            "description": [
                {
                    "representation": "(1)",
                    "description": "The following electors shall be entitled to vote by proxy at an election"
                },
                {
                    "representation": "(a)",
                    "description": "on behalf  of another  elector  unless  he is himself  an elector who is entitled to vote at the same polling place as that at  which  the  elector  on  whose  behalf  his  appointment  is sought is entitled to vote;"
                },
                {
                    "representation": "(i)",
                    "description": "the  particular  circumstances LAWS OF GUYANA 40 Cap. 1:03 Representation of the People   L.R.O. 1/2012                                                 of that persons employment on the election day either as a member of a disciplined force, or as a rural constable, or for a purpose connected with the election, by a returning officer;"
                },
                {
                    "representation": "(b)",
                    "description": "for more than two electors."
                },
                {
                    "representation": "(c)",
                    "description": "those unable, or likely to be unable, by reason either of blindness or any other physical incapacity, to go in person to the polling place or, if able to go, to vote unaided."
                },
                {
                    "representation": "(2)",
                    "description": "Not more than one person shall be appointed to vote as a proxy on behalf of any one elector."
                },
                {
                    "representation": "(3)",
                    "description": "No person shall be appointed to vote as a proxy"
                },
                {
                    "representation": "(4)",
                    "description": "An elector voting as a proxy on behalf of another elector so shall do at the same polling place and at the same time as he votes on his own behalf."
                }
            ]
        }
    },
    {
        "act": "REPRESENTATION OF THE PEOPLE ACT",
        "source": "https://mola.gov.gy/laws-of-guyana",
        "type": {
            "name": "section",
            "representation": "31",
            "title": "Application for appointment of proxy. ",
            "context": "REPRESENTATION OF THE PEOPLE ACT under Application for appointment of proxy. 31.  Every application for any such appointment of an elector to vote as proxy at an election shall  LAWS OF GUYANA 42 Cap. 1:03 Representation of the People   L.R.O. 1/2012  Form",
            "description": "Every application for any such appointment of an elector to vote as proxy at an election shall  LAWS OF GUYANA 42 Cap. 1:03 Representation of the People   L.R.O. 1/2012  Form"
        }
    },
    {
        "act": "REPRESENTATION OF THE PEOPLE ACT",
        "source": "https://mola.gov.gy/laws-of-guyana",
        "type": {
            "name": "section",
            "representation": "32",
            "title": "Notice of appointment as proxy and list of proxies. ",
            "context": "REPRESENTATION OF THE PEOPLE ACT under Notice of appointment as proxy and list of proxies. 32. (1) If a returning officer is satisfied that an application for the appointment of another elector to vote as a proxy on behalf of the applicant has been duly submitted in accordance with section 31 and that the person whose appointment is sought is entitled to vote as a proxy on behalf of the applicant and consents to his appointment, he shall issue to that person a notice of appointment as a proxy in Form 6 and shall notify the applicant accordingly.  (2) If the returning officer refuses the application he shall notify the applicant of his refusal and of his reasons therefor.  (3) The  returning  officer  of  each  district  shall  keep  a  list  of proxies which shall be in Form 7 and shall set out the names, addresses and the serial numbers of the registration records of the electors for whom the  proxies have been appointed  and of the electors  who have been appointed to vote as proxies on their behalf; and the   LAWS OF GUYANA Representation of the People Cap. 1:03 43  L.R.O. 1/2012          Cancellation of appointment as proxy. Form",
            "description": [
                {
                    "representation": "(1)",
                    "description": "If a returning officer is satisfied that an application for the appointment of another elector to vote as a proxy on behalf of the applicant has been duly submitted in accordance with section 31 and that the person whose appointment is sought is entitled to vote as a proxy on behalf of the applicant and consents to his appointment, he shall issue to that person a notice of appointment as a proxy in Form 6 and shall notify the applicant accordingly."
                },
                {
                    "representation": "(2)",
                    "description": "If the returning officer refuses the application he shall notify the applicant of his refusal and of his reasons therefor."
                },
                {
                    "representation": "(3)",
                    "description": "The  returning  officer  of  each  district  shall  keep  a  list  of proxies which shall be in Form 7 and shall set out the names, addresses and the serial numbers of the registration records of the electors for whom the  proxies have been appointed  and of the electors  who have been appointed to vote as proxies on their behalf; and the   LAWS OF GUYANA Representation of the People Cap. 1:03 43  L.R.O. 1/2012          Cancellation of appointment as proxy. Form"
                }
            ]
        }
    },
    {
        "act": "REPRESENTATION OF THE PEOPLE ACT",
        "source": "https://mola.gov.gy/laws-of-guyana",
        "type": {
            "name": "section",
            "representation": "33",
            "title": "Cancellation of appointment as proxy.   33A- 33K   [PART IVA - Sections 33A to 33K deleted by Act No. 16 of               1985]  PART V PREPARATIONS FOR THE POLL ",
            "context": "REPRESENTATION OF THE PEOPLE ACT under Cancellation of appointment as proxy.   33A- 33K   [PART IVA - Sections 33A to 33K deleted by Act No. 16 of               1985]  PART V PREPARATIONS FOR THE POLL 33. An elector may cancel the appointment of another person to vote as a proxy on his behalf by giving notice in writing in Form 8 addressed and sent to the returning officer who issued the notice of appointment so that the notice of cancellation is received by the returning officer not later than the 10th day before election day; and thereupon the notice of appointment shall be void and the returning officer shall  (a)  so notify the elector whose appointment as a proxy is cancelled;  (b)      delete  the  names  of  both  electors  from  the  list  of proxies.   [PART IV A 33-A to 33K deleted by  Act No. 16 of 1985]  PART  V PREPARATION  FOR  THE  POLL",
            "description": [
                {
                    "representation": "(a)",
                    "description": "so notify the elector whose appointment as a proxy is cancelled;"
                },
                {
                    "representation": "(b)",
                    "description": "delete  the  names  of  both  electors  from  the  list  of proxies.   [PART IV A 33-A to 33K deleted by  Act No. 16 of 1985]  PART  V PREPARATION  FOR  THE  POLL"
                }
            ]
        }
    },
    {
        "act": "REPRESENTATION OF THE PEOPLE ACT",
        "source": "https://mola.gov.gy/laws-of-guyana",
        "type": {
            "name": "section",
            "representation": "34",
            "title": "Notice of poll. ",
            "context": "REPRESENTATION OF THE PEOPLE ACT under Notice of poll. 34.  (1) Not later than the 20th day before election day the returning officer of each district shall give a notice of poll which shall be in Form 9 and which shall specify  (a)     the day on and the hours between which the poll will be taken; and  (b)      the situation of each polling place LAWS OF GUYANA 44 Cap. 1:03 Representation of the People   L.R.O. 1/2012                                                 in the district.  (2) Not later than the 14th day before election day the returning officer shall  (a)    cause to be affixed to one building in each division of his district the following:  (i)       a copy of the notice of poll; (ii)   a  copy  of  each  list  of  candidates  published  in accordance with section 19; (iii)   notification of joinder of any such lists; and (iv)   a copy of the official list of electors for that division;  (b)     cause   such   further   publication   of  such   lists   and notification as he may think desirable to bring their contents to the attention of electors in his district.   (3) The hours between which the poll shall be taken shall be from 6 oclock in the forenoon until 6 oclock in the afternoon at all polling places in all districts unless the Commission shall prescribe different hours, being twelve consecutive hours, for any polling place.    (4) Nothing in subsection (2) shall be construed as precluding the returning officer from annexing to the copy of the official list of voters affixed under that subsection copies of such supplementary lists as are mentioned in section 2(4).   LAWS OF GUYANA Representation of the People Cap. 1:03 45  L.R.O. 1/2012  Division of official list of electors. [16 of 1968]            Display  of lists at  polling places. [16 of 1968 O. 68/1980]            Preparation of polling   places.  [16 of 1968]",
            "description": [
                {
                    "representation": "(1)",
                    "description": "Not later than the 20th day before election day the returning officer of each district shall give a notice of poll which shall be in Form 9 and which shall specify"
                },
                {
                    "representation": "(a)",
                    "description": "cause to be affixed to one building in each division of his district the following:"
                },
                {
                    "representation": "(b)",
                    "description": "cause   such   further   publication   of  such   lists   and notification as he may think desirable to bring their contents to the attention of electors in his district."
                },
                {
                    "representation": "(2)",
                    "description": "shall be construed as precluding the returning officer from annexing to the copy of the official list of voters affixed under that subsection copies of such supplementary lists as are mentioned in section 2(4).   LAWS OF GUYANA Representation of the People Cap. 1:03 45  L.R.O. 1/2012  Division of official list of electors. [16 of 1968]            Display  of lists at  polling places. [16 of 1968 O. 68/1980]            Preparation of polling   places.  [16 of 1968]"
                },
                {
                    "representation": "(i)",
                    "description": "a copy of the notice of poll;"
                },
                {
                    "representation": "(3)",
                    "description": "The hours between which the poll shall be taken shall be from 6 oclock in the forenoon until 6 oclock in the afternoon at all polling places in all districts unless the Commission shall prescribe different hours, being twelve consecutive hours, for any polling place."
                },
                {
                    "representation": "(4)",
                    "description": "Nothing in subsection"
                }
            ]
        }
    },
    {
        "act": "REPRESENTATION OF THE PEOPLE ACT",
        "source": "https://mola.gov.gy/laws-of-guyana",
        "type": {
            "name": "section",
            "representation": "35",
            "title": "Division of official list of electors. ",
            "context": "REPRESENTATION OF THE PEOPLE ACT under Division of official list of electors. 35.  Where more than one polling place is established for any division the returning officer of the district in which the division is situate shall apportion in such manner as he thinks fit, between the polling places so established, the entries in the official list of electors for that division and shall compile such lists of electors as comprise the entries allotted to such polling places, respectively; and each list so compiled shall be regarded and dealt with as a part of the said official list.",
            "description": "Where more than one polling place is established for any division the returning officer of the district in which the division is situate shall apportion in such manner as he thinks fit, between the polling places so established, the entries in the official list of electors for that division and shall compile such lists of electors as comprise the entries allotted to such polling places, respectively; and each list so compiled shall be regarded and dealt with as a part of the said official list."
        }
    },
    {
        "act": "REPRESENTATION OF THE PEOPLE ACT",
        "source": "https://mola.gov.gy/laws-of-guyana",
        "type": {
            "name": "section",
            "representation": "36",
            "title": "Display of lists at polling-places. ",
            "context": "REPRESENTATION OF THE PEOPLE ACT under Display of lists at polling-places. 36.  The returning officer for each district shall cause to be displayed at every polling place therein a copy of the official list of electors for the division in which that polling place is situate or, as the case may be, a copy of such part of the said list as has been allotted to that polling place under section 35 and the foregoing provisions of this section shall apply mutatis mutandis in the case of any polling place established under subsections (4) and (5) of section",
            "description": [
                {
                    "representation": "(4)",
                    "description": "and"
                },
                {
                    "representation": "(5)",
                    "description": "of section"
                }
            ]
        }
    },
    {
        "act": "REPRESENTATION OF THE PEOPLE ACT",
        "source": "https://mola.gov.gy/laws-of-guyana",
        "type": {
            "name": "section",
            "representation": "37",
            "title": "Preparation of polling-places. ",
            "context": "REPRESENTATION OF THE PEOPLE ACT under Preparation of polling-places. 37. The returning officer of each district shall before election day cause every polling place in his district to be provided with   (a)     such doors, barriers, tables, chairs and other conveniences as are necessary or desirable, or as the Chief Election Officer may direct, for the purpose of  implementing this  Act;  (b)     such number  of  compartments  as  are  necessary  or desirable   and   in   which   electors   can vote   free   from observation. LAWS OF GUYANA 46 Cap. 1:03 Representation of the People   L.R.O. 1/2012     Printing of directions for voting and ballot papers. Form",
            "description": [
                {
                    "representation": "(a)",
                    "description": "such doors, barriers, tables, chairs and other conveniences as are necessary or desirable, or as the Chief Election Officer may direct, for the purpose of  implementing this  Act;"
                },
                {
                    "representation": "(b)",
                    "description": "such number  of  compartments  as  are  necessary  or desirable   and   in   which   electors   can vote   free   from observation. LAWS OF GUYANA 46 Cap. 1:03 Representation of the People   L.R.O. 1/2012     Printing of directions for voting and ballot papers. Form"
                }
            ]
        }
    },
    {
        "act": "REPRESENTATION OF THE PEOPLE ACT",
        "source": "https://mola.gov.gy/laws-of-guyana",
        "type": {
            "name": "section",
            "representation": "38",
            "title": "Printing of directions for voting and ballot papers. ",
            "context": "REPRESENTATION OF THE PEOPLE ACT under Printing of directions for voting and ballot papers. 38. The Chief Election Officer shall cause to be printed in Forms 10, 11 and 12 and sent to the returning officer of each district before election day a sufficient number of the following documents  (a)      directions for voting;  (b)      ballot papers;  (c)      tendered ballot papers.",
            "description": [
                {
                    "representation": "(a)",
                    "description": "directions for voting;"
                },
                {
                    "representation": "(b)",
                    "description": "ballot papers;"
                },
                {
                    "representation": "(c)",
                    "description": "tendered ballot papers."
                }
            ]
        }
    },
    {
        "act": "REPRESENTATION OF THE PEOPLE ACT",
        "source": "https://mola.gov.gy/laws-of-guyana",
        "type": {
            "name": "section",
            "representation": "39",
            "title": "Requirements of ballot papers. 39A.   Requirements of ballot paper for geographic constituencies. ",
            "context": "REPRESENTATION OF THE PEOPLE ACT under Requirements of ballot papers. 39A.   Requirements of ballot paper for geographic constituencies. 39.  (1) Every such ballot paper shall  (a)      contain,   serially  numbered on the left hand side and in alphabetical order of the initial letters of the title of each list of candidates, the initial letters, title and symbol of each list of candidates;  (b)     be capable of being folded up;       (c)     be attached to a counterfoil  bearing, printed on the face, a serial number and the words and dots  Electors  number ....   (2) In the printing of the ballot paper  (a)    no letter, word or design shall be printed on the face except the initial letters, titles  and symbols  of the lists  of candidates; (b)    no rule shall be printed on the face except the horizontal rules   LAWS OF GUYANA Representation of the People Cap. 1:03 47  L.R.O. 1/2012                                 Requirements of ballot paper for geographic constituencies.  [15 of 2000]              separating the particulars of the lists of candidates from one another and the vertical rules separating those particulars from the numbers on the left hand side and from the spaces on the right where the symbols are shown and separating the spaces for symbols from the spaces on their right where the vote is to be marked;  (c)     the  whole  space  between the top and bottom of the paper shall be equally divided between the lists of candidates by rules separating their particulars;  (d)    the initial  letters  of each  list  of candidates  shall  be printed in large capitals and the full titles of each list in small capitals.  39A. (1) Every ballot paper for a geographical constituency shall    (a)     contain,  serially  numbered  on  the  left  hand  side,  and  in alphabetical order of the initial letters of each list of a contesting party, the title and symbol of each contesting party; but the serial numbering on the ballot paper under paragraph (a) and the serial numbering on the counterfoil, under paragraph (c), shall be done LAWS OF GUYANA 48 Cap. 1:03 Representation of the People   L.R.O. 1/2012                                                 in such a manner as to ensure that the two sets of serial numbers cannot  be  correlated;  (b)      be capable of being folded; (c)       be attached to a counterfoil bearing, printed on the face, a serial  number and the words and dots-    Electors No.................in the   Official List  (2)   In the printing of the ballot paper    (a)    no  letter, word or design shall be printed on the face except the initial letters, title and symbol of the contesting parties;  (b)    no rules shall be printed on the face except the horizontal rules separating the particulars of the contesting parties from one another and the vertical rules separating those particulars from the numbers on the left hand side and from the spaces on the right where the symbols are shown and separating the spaces for symbols from the spaces on their right where the  vote is to be marked;  (c)        the whole space between the top and the bottom of the paper shall be equally divided between the   LAWS OF GUYANA Representation of the People Cap. 1:03 49  L.R.O. 1/2012                         Form 11 Schedule        Supplies of election material. [16 of 1968 O.  68/1980]                contesting parties by rules separating their particulars;  (d)    the initial letters of each contesting party shall be printed in large capitals and the full titles of each in small capitals.  (3) The symbol shall be printed between the parties particulars and the vertical rule separating the parties particulars from the spaces where the vote is to be marked.  (4) Tendered ballot papers shall be of a different colour from ordinary ballot papers but, subject to difference of colour, this section shall apply to tendered ballot papers as it does to ordinary ballot papers.  (5) The ballot paper shall be in Form 11 in the Schedule.",
            "description": [
                {
                    "representation": "(1)",
                    "description": "Every ballot paper for a geographical constituency shall"
                },
                {
                    "representation": "(a)",
                    "description": "no  letter, word or design shall be printed on the face except the initial letters, title and symbol of the contesting parties;"
                },
                {
                    "representation": "(b)",
                    "description": "no rules shall be printed on the face except the horizontal rules separating the particulars of the contesting parties from one another and the vertical rules separating those particulars from the numbers on the left hand side and from the spaces on the right where the symbols are shown and separating the spaces for symbols from the spaces on their right where the  vote is to be marked;"
                },
                {
                    "representation": "(c)",
                    "description": "the whole space between the top and the bottom of the paper shall be equally divided between the   LAWS OF GUYANA Representation of the People Cap. 1:03 49  L.R.O. 1/2012                         Form 11 Schedule        Supplies of election material. [16 of 1968 O.  68/1980]                contesting parties by rules separating their particulars;"
                },
                {
                    "representation": "(2)",
                    "description": "In the printing of the ballot paper"
                },
                {
                    "representation": "(d)",
                    "description": "the initial letters of each contesting party shall be printed in large capitals and the full titles of each in small capitals."
                },
                {
                    "representation": "(3)",
                    "description": "The symbol shall be printed between the parties particulars and the vertical rule separating the parties particulars from the spaces where the vote is to be marked."
                },
                {
                    "representation": "(4)",
                    "description": "Tendered ballot papers shall be of a different colour from ordinary ballot papers but, subject to difference of colour, this section shall apply to tendered ballot papers as it does to ordinary ballot papers."
                },
                {
                    "representation": "(5)",
                    "description": "The ballot paper shall be in Form 11 in the Schedule."
                }
            ]
        }
    },
    {
        "act": "REPRESENTATION OF THE PEOPLE ACT",
        "source": "https://mola.gov.gy/laws-of-guyana",
        "type": {
            "name": "section",
            "representation": "40",
            "title": "Supplies of election material. LAWS OF GUYANA Representation of the People Cap. 1:03 5  L.R.O. 1/2012 SECTION  ",
            "context": "REPRESENTATION OF THE PEOPLE ACT under Supplies of election material. LAWS OF GUYANA Representation of the People Cap. 1:03 5  L.R.O. 1/2012 SECTION  40. (1) The returning officer of each district shall  supply  to  every presiding officer in his district the following  (a)     a sufficient number of ballot papers and tendered ballot papers,  together  with  a  statement  showing  the  numbers supplied and their serial numbers;  (b)     a  sufficient  number  of  copies  of  the  directions  for voting;  (c)     a sufficient number of copies of this LAWS OF GUYANA 50 Cap. 1:03 Representation of the People   L.R.O. 1/2012                  c. 2:02                                      Act (including any amendments made  thereto  for the  purpose  of holding  any election pursuant to article 60(2) of the Constitution but not yet  incorporated  in  the  text  thereof  as  published  in  any revision thereof made pursuant to the Law Revision Act;  (d)    a  sufficient  number  of  copies  of  the  official  list  of electors or part thereof, as the case may require, containing the names of the electors entitled to vote at the polling place;  (e)     a sufficient number of copies of the list of proxies;  (f)    a  ballot  box  and  materials  for  affixing  thereto  or stamping thereon the seal of the presiding officer;  (g)     the  several  forms  of  oaths  to  be  administered  to electors;  (h)      a poll book;  (i)       the   necessary   envelopes  and such   other   forms, documents and supplies as may be authorised by, or furnished at the direction of, the Chief Election Officer;    LAWS OF GUYANA Representation of the People Cap. 1:03 51  L.R.O. 1/2012                     Form",
            "description": [
                {
                    "representation": "(1)",
                    "description": "The returning officer of each district shall  supply  to  every presiding officer in his district the following"
                },
                {
                    "representation": "(a)",
                    "description": "a sufficient number of ballot papers and tendered ballot papers,  together  with  a  statement  showing  the  numbers supplied and their serial numbers;"
                },
                {
                    "representation": "(b)",
                    "description": "a  sufficient  number  of  copies  of  the  directions  for voting;"
                },
                {
                    "representation": "(c)",
                    "description": "a sufficient number of copies of this LAWS OF GUYANA 50 Cap. 1:03 Representation of the People   L.R.O. 1/2012                  c. 2:02                                      Act"
                },
                {
                    "representation": "(2)",
                    "description": "of the Constitution but not yet  incorporated  in  the  text  thereof  as  published  in  any revision thereof made pursuant to the Law Revision Act;"
                },
                {
                    "representation": "(d)",
                    "description": "a  sufficient  number  of  copies  of  the  official  list  of electors or part thereof, as the case may require, containing the names of the electors entitled to vote at the polling place;"
                },
                {
                    "representation": "(e)",
                    "description": "a sufficient number of copies of the list of proxies;"
                },
                {
                    "representation": "(f)",
                    "description": "a  ballot  box  and  materials  for  affixing  thereto  or stamping thereon the seal of the presiding officer;"
                },
                {
                    "representation": "(g)",
                    "description": "the  several  forms  of  oaths  to  be  administered  to electors;"
                },
                {
                    "representation": "(h)",
                    "description": "a poll book;"
                },
                {
                    "representation": "(i)",
                    "description": "the   necessary   envelopes  and such   other   forms, documents and supplies as may be authorised by, or furnished at the direction of, the Chief Election Officer;    LAWS OF GUYANA Representation of the People Cap. 1:03 51  L.R.O. 1/2012                     Form"
                }
            ]
        }
    },
    {
        "act": "REPRESENTATION OF THE PEOPLE ACT",
        "source": "https://mola.gov.gy/laws-of-guyana",
        "type": {
            "name": "section",
            "representation": "41",
            "title": "Display of lists of candidates and directions for voting. ",
            "context": "REPRESENTATION OF THE PEOPLE ACT under Display of lists of candidates and directions for voting. 41.  The  presiding  officer  of  each  polling  place  shall  before  the opening of the poll post up in a conspicuous position outside the polling place a copy of  (a)      the directions for voting;  (b)      the lists of candidates  published  in accordance  with section",
            "description": [
                {
                    "representation": "(a)",
                    "description": "the directions for voting;"
                },
                {
                    "representation": "(b)",
                    "description": "the lists of candidates  published  in accordance  with section"
                }
            ]
        }
    },
    {
        "act": "REPRESENTATION OF THE PEOPLE ACT",
        "source": "https://mola.gov.gy/laws-of-guyana",
        "type": {
            "name": "section",
            "representation": "42",
            "title": "Safe custody of elections material. ",
            "context": "REPRESENTATION OF THE PEOPLE ACT under Safe custody of elections material. 42.  The presiding officer of each polling place shall, until the opening of the poll, keep the documents supplied to him in pursuance of section 40 (other than those required to be posted up by section 41) locked in the ballot box or other depository and shall take every precaution to prevent any person having unauthorised access thereto.",
            "description": "The presiding officer of each polling place shall, until the opening of the poll, keep the documents supplied to him in pursuance of section 40 (other than those required to be posted up by section 41) locked in the ballot box or other depository and shall take every precaution to prevent any person having unauthorised access thereto."
        }
    },
    {
        "act": "REPRESENTATION OF THE PEOPLE ACT",
        "source": "https://mola.gov.gy/laws-of-guyana",
        "type": {
            "name": "section",
            "representation": "43",
            "title": "Application of section 12 of the National Registration Act.   PART VI PREPARATION FOR NON-RESIDENT ELECTORS\u2019 BALLOT  ",
            "context": "REPRESENTATION OF THE PEOPLE ACT under Application of section 12 of the National Registration Act.   PART VI PREPARATION FOR NON-RESIDENT ELECTORS BALLOT  43.  Section 12 of the National Registration Act shall apply in relation to  every person who is an elector but, in such application,  shall have effect  as if  (a)   the words, and cause them to be issued in such  manner as he thinks fit to,  had been deleted therefrom; and LAWS OF GUYANA 52 Cap. 1:03 Representation of the People   L.R.O. 1/2012                                          c. 19:08              (b)     the  words  and  shall  cause  every  such  registration record to be issued in such manner as the Commissioner thinks fit to the person for whom it has been prepared, or to be made available   for  his  procurement   in  such  manner   as  the Commissioner   may  specify  by  notice  published  in  the Gazette had  been  inserted  immediately  after  the  word Act  therein:                    Provided that if the Commissioner of Registration finds it for any reason impracticable  (a)    for a print of the photograph of any elector to be affixed to such  identification card of that elector as may be required for the purposes of this Act;  (b)    for  any  such identification   card  of  an  elector  as aforesaid  to  be  prepared  in  conformity  with  regulation 20(2) (b) of the  National  Registration  (Residents)  Regulations;  the lack of any such print or preparation, as the case may be, shall not invalidate the identification card for the said purposes.        LAWS OF GUYANA Representation of the People Cap. 1:03 53  L.R.O. 1/2012                Interpretation of Part VI. [Reg. 25/1968 Reg. 6/1973 16 of 1985 3 of 1991 11 of 1992 12 of 2006]                           c. 19:08       PART  VI PREPARATION   FOR  NON-RESIDENT   ELECTORS  BALLOT",
            "description": [
                {
                    "representation": "(a)",
                    "description": "for a print of the photograph of any elector to be affixed to such  identification card of that elector as may be required for the purposes of this Act;"
                },
                {
                    "representation": "(b)",
                    "description": "of the  National  Registration"
                }
            ]
        }
    },
    {
        "act": "REPRESENTATION OF THE PEOPLE ACT",
        "source": "https://mola.gov.gy/laws-of-guyana",
        "type": {
            "name": "section",
            "representation": "44",
            "title": "Interpretation of Part VI. ",
            "context": "REPRESENTATION OF THE PEOPLE ACT under Interpretation of Part VI. 44.  (1) In this Part  ballot  officer  means    (a)  an  ambassador or  High Commissioner resident in any country and representing Guyana therein;  (b)     any person appointed to be a ballot officer in any other country in which an ambassador  or High Commissioner  is accredited but is not resident therein;  non- resident elector means an elector whose name is on the non-residents electors roll;  non-resident electors roll  means the non-resident  electors  roll as prescribed by subsection (2).  (2) The non-resident electors roll shall be the preliminary list of the electors not resident in Guyana comprising the persons specified in subsection (2A), prepared before election day in pursuance of section 14 of the National Registration Act or last prepared in pursuance thereof before such day, as the case may be, but with every such modification as may be necessary to bring that list into conformity with the central register (to the extent to which it consists of the registration records of electors  aforesaid) LAWS OF GUYANA 54 Cap. 1:03 Representation of the People   L.R.O. 1/2012      c. 19:08         c. 19:08                       c. 19:08                   (a)     as   altered   under   section   15(6)   of   the   National Registration Act to give effect to claims and objections finally determined before the said election day;  (b)    pursuant to any alteration thereto made under section 8  of  the  National  Registration  Act,  prior  to  the  date  of publication in the Gazette under section 19 of the names of candidates,  for  the  purpose   of  changing   the   registered address, name or occupation of an elector;  (c)     pursuant  to the cancellation  therein  under  section  8 aforesaid of an electors registration effected in contravention of section  11(1) of the National  Registration Act, or of relating to an elector who does not exist by reason of death or otherwise ought not to be registered;  and  every  reference  made  to  the  non-resident  electors  roll  in  the provisions hereinafter contained shall, in relation to any time on or before election  day, be construed  as a reference  to such preliminary  list as aforesaid with such modifications thereto (if any) as, at that time, shall have been made in conformity with this subsection.     LAWS OF GUYANA Representation of the People Cap. 1:03 55  L.R.O. 1/2012                                           c. 19:08         Display of non-resident electors roll. [3 of 1991]                Printing of ballot  officers supplies. [16 of 1985]   (2A) The preliminary list of electors not resident in Guyana shall consist of the names of every elector not resident in Guyana who is (i)   an Ambassador or a High Commissioner; (ii)    the wife or husband or child of an Ambassador or a High Commissioner; (iii)   a  member   of  the  staff  of  an  Embassy  or  High Commission; (iv)    the wife or husband or child of a member of the staff of an Embassy or High Commission.  (3) In subsection (2) or (2A) reference to a preliminary list is a reference to such list read in conjunction with any supplementary list prepared for a revision of that preliminary list pursuant to regulations made under the National Registration Act for the purpose of showing the aforementioned modifications.",
            "description": [
                {
                    "representation": "(1)",
                    "description": "In this Part  ballot  officer  means"
                },
                {
                    "representation": "(a)",
                    "description": "as   altered   under   section   15(6)   of   the   National Registration Act to give effect to claims and objections finally determined before the said election day;"
                },
                {
                    "representation": "(b)",
                    "description": "pursuant to any alteration thereto made under section 8  of  the  National  Registration  Act,  prior  to  the  date  of publication in the Gazette under section 19 of the names of candidates,  for  the  purpose   of  changing   the   registered address, name or occupation of an elector;"
                },
                {
                    "representation": "(2)",
                    "description": "or"
                },
                {
                    "representation": "(c)",
                    "description": "pursuant  to the cancellation  therein  under  section  8 aforesaid of an electors registration effected in contravention of section  11(1) of the National  Registration Act, or of relating to an elector who does not exist by reason of death or otherwise ought not to be registered;  and  every  reference  made  to  the  non-resident  electors  roll  in  the provisions hereinafter contained shall, in relation to any time on or before election  day, be construed  as a reference  to such preliminary  list as aforesaid with such modifications thereto"
                },
                {
                    "representation": "(i)",
                    "description": "an Ambassador or a High Commissioner;"
                },
                {
                    "representation": "(3)",
                    "description": "In subsection"
                }
            ]
        }
    },
    {
        "act": "REPRESENTATION OF THE PEOPLE ACT",
        "source": "https://mola.gov.gy/laws-of-guyana",
        "type": {
            "name": "section",
            "representation": "45",
            "title": "Display of non-resident elector\u2019s roll. 45A.   [45A repealed by Act No. 3 of 1991]. ",
            "context": "REPRESENTATION OF THE PEOPLE ACT under Display of non-resident electors roll. 45A.   [45A repealed by Act No. 3 of 1991]. 45.  The Chief Election Officer shall cause a copy of the non-resident electors   roll  to  be  displayed   for  public  information,   or  for  the information,  of  non-resident  electors,  at  every  such  place  as  the Commission may appoint by notice published in the Gazette.  [45A repealed by Act No. 3 of 1991]",
            "description": "The Chief Election Officer shall cause a copy of the non-resident electors   roll  to  be  displayed   for  public  information,   or  for  the information,  of  non-resident  electors,  at  every  such  place  as  the Commission may appoint by notice published in the Gazette.  [45A repealed by Act No. 3 of 1991]"
        }
    },
    {
        "act": "REPRESENTATION OF THE PEOPLE ACT",
        "source": "https://mola.gov.gy/laws-of-guyana",
        "type": {
            "name": "section",
            "representation": "46",
            "title": "Printing of ballot officer\u2019s supplies. ",
            "context": "REPRESENTATION OF THE PEOPLE ACT under Printing of ballot officers supplies. 46. The Chief Election Officer shall cause to be printed and supplied to each ballot officer a sufficient number of the following    LAWS OF GUYANA 56 Cap. 1:03 Representation of the People   L.R.O. 1/2012                                    Non-resident electors ballot papers. [16 of 1985]              Additional supplies  for ballot  officers. [16 of 1985]        (a)     copies  of  directions  for  balloting  by  non-resident electors;  (b)      ballot papers;  (c)   such envelopes and forms as are requisite;  to enable the ballot officer to carry out his functions under this Act; and the Chief Election Officer shall make the necessary arrangements to be provided  with  a  sufficient  number  of  the  same  for  the  purpose  of carrying out his like functions under Part VII.",
            "description": [
                {
                    "representation": "(a)",
                    "description": "copies  of  directions  for  balloting  by  non-resident electors;"
                },
                {
                    "representation": "(b)",
                    "description": "ballot papers;"
                },
                {
                    "representation": "(c)",
                    "description": "such envelopes and forms as are requisite;  to enable the ballot officer to carry out his functions under this Act; and the Chief Election Officer shall make the necessary arrangements to be provided  with  a  sufficient  number  of  the  same  for  the  purpose  of carrying out his like functions under Part VII."
                }
            ]
        }
    },
    {
        "act": "REPRESENTATION OF THE PEOPLE ACT",
        "source": "https://mola.gov.gy/laws-of-guyana",
        "type": {
            "name": "section",
            "representation": "47",
            "title": "Non-resident elector\u2019s papers. ",
            "context": "REPRESENTATION OF THE PEOPLE ACT under Non-resident electors papers. 47.  (1) Ballot  papers supplied  to ballot  officers  and used by non-resident electors shall be of a different colour from all other ballot papers conforming  to  the  requirements  of  section  39  but,  subject  to  such difference of colour,  shall  conform  to those  requirements  in the like manner as such other ballot papers.  (2) Reference in subsection (1) to ballot papers supplied to ballot officers shall be construed to include reference to ballot papers with which the Chief Election Officer is provided under section",
            "description": [
                {
                    "representation": "(1)",
                    "description": "to ballot papers supplied to ballot officers shall be construed to include reference to ballot papers with which the Chief Election Officer is provided under section"
                },
                {
                    "representation": "(2)",
                    "description": "Reference in subsection"
                }
            ]
        }
    },
    {
        "act": "REPRESENTATION OF THE PEOPLE ACT",
        "source": "https://mola.gov.gy/laws-of-guyana",
        "type": {
            "name": "section",
            "representation": "48",
            "title": "Additional supplies for ballot officers. ",
            "context": "REPRESENTATION OF THE PEOPLE ACT under Additional supplies for ballot officers. 48.  In addition to the supplies to be furnished under section 46, the Chief Election Officer shall provide every ballot officer with  (a)     a sufficient number of copies of this Act;  (b)     a  sufficient  number  of  copies  of  the  non-resident electors  roll  in    LAWS OF GUYANA Representation of the People Cap. 1:03 57  L.R.O. 1/2012                                  Safe custody of officers supplies.           Interpretation of Part VII.  [Reg. 31/1968 16 of 1985 22 of 1997 so  far  as  it  comprises  entries  relating  to electors resident in the country in which that ballot officer is accredited to represent Guyana or appointed to be a ballot officer, as the case may be;  (c)     a  statement  showing  the  number  of  ballot  papers supplied to him under section 46(b) and their serial numbers; and (d)  such  other  documents   and  supplies  as  the  Chief Election Officer may consider expedient;  for use by that ballot officer in the execution of his functions; and the Chief  Election  Officer  shall  record  every  such  statement  and  the number of ballot papers with which he is provided under arrangements mentioned in section 46 and the serial numbers of the ballot papers so provided.",
            "description": [
                {
                    "representation": "(a)",
                    "description": "a sufficient number of copies of this Act;"
                },
                {
                    "representation": "(b)",
                    "description": "a  sufficient  number  of  copies  of  the  non-resident electors  roll  in    LAWS OF GUYANA Representation of the People Cap. 1:03 57  L.R.O. 1/2012                                  Safe custody of officers supplies.           Interpretation of Part VII.  [Reg. 31/1968 16 of 1985 22 of 1997 so  far  as  it  comprises  entries  relating  to electors resident in the country in which that ballot officer is accredited to represent Guyana or appointed to be a ballot officer, as the case may be;"
                },
                {
                    "representation": "(c)",
                    "description": "a  statement  showing  the  number  of  ballot  papers supplied to him under section 46(b) and their serial numbers; and"
                },
                {
                    "representation": "(d)",
                    "description": "such  other  documents   and  supplies  as  the  Chief Election Officer may consider expedient;  for use by that ballot officer in the execution of his functions; and the Chief  Election  Officer  shall  record  every  such  statement  and  the number of ballot papers with which he is provided under arrangements mentioned in section 46 and the serial numbers of the ballot papers so provided."
                }
            ]
        }
    },
    {
        "act": "REPRESENTATION OF THE PEOPLE ACT",
        "source": "https://mola.gov.gy/laws-of-guyana",
        "type": {
            "name": "section",
            "representation": "49",
            "title": "Safe custody of officers\u2019 supplies.  PART VII NON-RESIDENT ELECTORS\u2019 BALLOT  ",
            "context": "REPRESENTATION OF THE PEOPLE ACT under Safe custody of officers supplies.  PART VII NON-RESIDENT ELECTORS BALLOT  49.  Every  officer  shall  be  responsible  for the  safe  custody  of all supplies with which he is furnished or provided under section 46 or 48 and  shall   take   every   precaution to  prevent   any   person   having unauthorised access  thereto.  PART  VII NON-RESIDENT  ELECTORS   BALLOT",
            "description": "Every  officer  shall  be  responsible  for the  safe  custody  of all supplies with which he is furnished or provided under section 46 or 48 and  shall   take   every   precaution to  prevent   any   person   having unauthorised access  thereto.  PART  VII NON-RESIDENT  ELECTORS   BALLOT"
        }
    },
    {
        "act": "REPRESENTATION OF THE PEOPLE ACT",
        "source": "https://mola.gov.gy/laws-of-guyana",
        "type": {
            "name": "section",
            "representation": "50",
            "title": "Interpretation of Part VII. ",
            "context": "REPRESENTATION OF THE PEOPLE ACT under Interpretation of Part VII. 50.  (1) In this Part  ballot  attendant  means an officer appointed under section 53(1); LAWS OF GUYANA 58 Cap. 1:03 Representation of the People   L.R.O. 1/2012  15 of 2000 12 of 2006]                              Issue of ballot papers to non- resident electors. [Reg. 6/1973 16 of 1985]                      ballot officer, non-resident elector and non-resident electors roll shall have the meanings assigned to them, respectively, by section",
            "description": [
                {
                    "representation": "(1)",
                    "description": "In this Part  ballot  attendant  means an officer appointed under section 53(1); LAWS OF GUYANA 58 Cap. 1:03 Representation of the People   L.R.O. 1/2012  15 of 2000 12 of 2006]                              Issue of ballot papers to non- resident electors. [Reg. 6/1973 16 of 1985]                      ballot officer, non-resident elector and non-resident electors roll shall have the meanings assigned to them, respectively, by section"
                }
            ]
        }
    },
    {
        "act": "REPRESENTATION OF THE PEOPLE ACT",
        "source": "https://mola.gov.gy/laws-of-guyana",
        "type": {
            "name": "section",
            "representation": "51",
            "title": "Issue of ballot papers to non-resident electors. ",
            "context": "REPRESENTATION OF THE PEOPLE ACT under Issue of ballot papers to non-resident electors. 51.  Not later than the 14th day before election day, there shall be posted to every non-resident elector  (a)   by such ballot officer as shall be provided under section 48(b) with copies of entries in the non-resident electors roll which include the name of that non-resident elector; or  (b)    in  any case where there is no such ballot officer, by the Chief Election Officer;  a sealed envelope, which shall be directed to the non-resident elector at his address appearing on the non-resident electors roll and shall contain the  following  (i)    an      unsealed     envelope   (hereafter  referred  to in this   LAWS OF GUYANA Representation of the People Cap. 1:03 59  L.R.O. 1/2012            Form 14                     Form 15       Notes of ballot papers issued. [16 of 1985]        Part as the addressed envelope) addressed in the name, and to the office, of the officer issuing the same, which shall be recognisable by him on  its  return  as having  been  issued under this paragraph; (ii)     a declaration of identity in Form 14 which shall bear the serial number of the non-resident elector on its reverse side; (iii)      an   unsealed  envelope (here-inafter referred to in this Part as the ballot envelope) addressed with the words To the  Chief  Election  Officer  and  capable  of containing  a ballot  paper and of being enclosed, together with the last-mentioned form, in the addressed envelope; (iv)   a copy of the directions for balloting by non-resident electors as set out in Form 15; (v)      a ballot paper stamped with the official mark.",
            "description": [
                {
                    "representation": "(a)",
                    "description": "by such ballot officer as shall be provided under section 48(b) with copies of entries in the non-resident electors roll which include the name of that non-resident elector; or"
                },
                {
                    "representation": "(b)",
                    "description": "in  any case where there is no such ballot officer, by the Chief Election Officer;  a sealed envelope, which shall be directed to the non-resident elector at his address appearing on the non-resident electors roll and shall contain the  following"
                },
                {
                    "representation": "(i)",
                    "description": "an      unsealed     envelope"
                },
                {
                    "representation": "(v)",
                    "description": "a ballot paper stamped with the official mark."
                }
            ]
        }
    },
    {
        "act": "REPRESENTATION OF THE PEOPLE ACT",
        "source": "https://mola.gov.gy/laws-of-guyana",
        "type": {
            "name": "section",
            "representation": "52",
            "title": "Notes of ballot papers issued. ",
            "context": "REPRESENTATION OF THE PEOPLE ACT under Notes of ballot papers issued. 52.  Upon issuing a ballot  paper to any non-resident  elector  under section 51, a ballot officer or the Chief Election Officer, as the case may be, shall  (a)    show  that  a ballot paper has been issued to the non- resident  elector,  but  without  showing  the  particular  ballot paper issued, place a mark on LAWS OF GUYANA 60 Cap. 1:03 Representation of the People   L.R.O. 1/2012                       Ballot attendants. [16 of 1985]                                  such copy of entries in the non- resident electors roll as shall be used by him for the purposes of this paragraph; and   (b)    enter on  the counterfoil of the ballot paper the serial number of the non-resident elector.",
            "description": [
                {
                    "representation": "(a)",
                    "description": "show  that  a ballot paper has been issued to the non- resident  elector,  but  without  showing  the  particular  ballot paper issued, place a mark on LAWS OF GUYANA 60 Cap. 1:03 Representation of the People   L.R.O. 1/2012                       Ballot attendants. [16 of 1985]                                  such copy of entries in the non- resident electors roll as shall be used by him for the purposes of this paragraph; and"
                },
                {
                    "representation": "(b)",
                    "description": "enter on  the counterfoil of the ballot paper the serial number of the non-resident elector."
                }
            ]
        }
    },
    {
        "act": "REPRESENTATION OF THE PEOPLE ACT",
        "source": "https://mola.gov.gy/laws-of-guyana",
        "type": {
            "name": "section",
            "representation": "53",
            "title": "Ballot attendants. ",
            "context": "REPRESENTATION OF THE PEOPLE ACT under Ballot attendants. 53.  (1) There shall be appointed such number of officers as the Chief Election Officer may consider requisite for the performance in any country of the functions of ballot attendants under this Act.  (2) The Chief Election Officer shall cause notice of the name and address of every ballot attendant to be published in the Gazette and may cause such further publication of the same, for the information of non- resident electors, as the Chief Election Officer considers desirable; and the address of the office of each ballot officer shall be notified under the foregoing provisions of this subsection as being also the address of a ballot attendant.  (3) The ballot attendant at every such office as aforesaid shall permit any person having authority by virtue of section  30(1)(f) for promotion of the election of a group of candidates, and designated in writing by their election  agent, to attend  the balloting  there by non- resident electors in the presence of the ballot attendant and shall afford that  person, if and when the attends, all such reasonable facilities for observing the said balloting as that attendant can afford consistently with the  orderly conduct of the proceedings, the discharge of his duties in connection therewith and the maintenance of the secrecy of the ballot.    LAWS OF GUYANA Representation of the People Cap. 1:03 61  L.R.O. 1/2012            Recording of non-resident electors vote.  [16 of 1985]  Form",
            "description": [
                {
                    "representation": "(1)",
                    "description": "There shall be appointed such number of officers as the Chief Election Officer may consider requisite for the performance in any country of the functions of ballot attendants under this Act."
                },
                {
                    "representation": "(2)",
                    "description": "The Chief Election Officer shall cause notice of the name and address of every ballot attendant to be published in the Gazette and may cause such further publication of the same, for the information of non- resident electors, as the Chief Election Officer considers desirable; and the address of the office of each ballot officer shall be notified under the foregoing provisions of this subsection as being also the address of a ballot attendant."
                },
                {
                    "representation": "(3)",
                    "description": "The ballot attendant at every such office as aforesaid shall permit any person having authority by virtue of section  30(1)(f) for promotion of the election of a group of candidates, and designated in writing by their election  agent, to attend  the balloting  there by non- resident electors in the presence of the ballot attendant and shall afford that  person, if and when the attends, all such reasonable facilities for observing the said balloting as that attendant can afford consistently with the  orderly conduct of the proceedings, the discharge of his duties in connection therewith and the maintenance of the secrecy of the ballot.    LAWS OF GUYANA Representation of the People Cap. 1:03 61  L.R.O. 1/2012            Recording of non-resident electors vote.  [16 of 1985]  Form"
                }
            ]
        }
    },
    {
        "act": "REPRESENTATION OF THE PEOPLE ACT",
        "source": "https://mola.gov.gy/laws-of-guyana",
        "type": {
            "name": "section",
            "representation": "54",
            "title": "Recording of non-resident elector\u2019s vote. ",
            "context": "REPRESENTATION OF THE PEOPLE ACT under Recording of non-resident electors vote. 54. Every non-resident elector in receipt of the addressed and ballot envelopes, Form 13 and ballot paper issued to him under section 51(i), (ii), (iii) and (v)  (a)   may  upon  satisfying  any  ballot  attendant  as  to  his identity by way of production of his passport, travel document or other proof of such identity, and of the envelope directed to  him  under section 51, not later than the 9th day before election day  (i)   exhibit the said envelopes, Form 14 and ballot paper (unmarked) to the ballot attendant; (ii)   secretly  mark and fold the ballot  paper in the like manner as provided by section 81(2), enclose it in the ballot envelope and seal that envelope, in the presence of the ballot attendant, but so that the ballot attendant does not observe the said manner of marking the ballot paper; and (iii)   give the ballot envelope so sealed and Form 14 to the ballot attendant, who shall forthwith complete the said LAWS OF GUYANA 62 Cap. 1:03 Representation of the People   L.R.O. 1/2012      Form 16                                           Form in the presence of the non-resident elector and issue to him a receipt in Form 16: Provided that  (a)  if the non-resident elector is incapacitated by blindness or  other physical cause from personally complying with the foregoing  provisions  of this paragraph,  the ballot attendant may, at the request of the non-resident elector,  comply or permit  a  person  appointed  by  the  non-resident  elector  to comply with any such provisions on his behalf, in his presence and according to his directions;  (b)    the person so appointed shall be a non-resident elector, who shall, before the form of declaration is given to the ballot attendant under subparagraph (iii) of this paragraph, endorse on the reverse side of the form a certificate in the following terms:  I, .............................................................................................. (names in block letters) hereby  certify  that  the  non-resident   elector  whose  serial  number appears  next  hereto  is  physically  incapacitated  and  voted  with  my assistance  rendered at his request. ........................................... (Signature) ;    LAWS OF GUYANA Representation of the People Cap. 1:03 63  L.R.O. 1/2012                  Form 13         Transmission of non-resident electors vote to  ballot officer. [16 of 1985]                  Or  (a)       if  he  prefers  so  to  do,  or  if  no  ballot  attendant  is available, may  (i)    secretly  mark and fold the ballot  paper in the like manner as provided by section 72(2) and enclose it in the ballot envelope; (ii)      seal the ballot envelope; (iii)  complete Form  13  and enclose it, together with the ballot envelope, in the addressed envelope for posting under section 55(b).",
            "description": [
                {
                    "representation": "(a)",
                    "description": "if  he  prefers  so  to  do,  or  if  no  ballot  attendant  is available, may"
                },
                {
                    "representation": "(i)",
                    "description": "secretly  mark and fold the ballot  paper in the like manner as provided by section 72(2) and enclose it in the ballot envelope;"
                },
                {
                    "representation": "(b)",
                    "description": "the person so appointed shall be a non-resident elector, who shall, before the form of declaration is given to the ballot attendant under subparagraph"
                }
            ]
        }
    },
    {
        "act": "REPRESENTATION OF THE PEOPLE ACT",
        "source": "https://mola.gov.gy/laws-of-guyana",
        "type": {
            "name": "section",
            "representation": "55",
            "title": "Transmission of non-resident elector\u2019s vote to ballot officer. ",
            "context": "REPRESENTATION OF THE PEOPLE ACT under Transmission of non-resident electors vote to ballot officer. 55.  For the purpose of causing the vote recorded by him to be cast in the manner provided by section 62(1), every non-resident elector  (a)   having  complied  with  section  54(a),  shall  thereupon surrender  to  the  ballot  attendant  the  addressed  envelope exhibited under subparagraph  (i) of that paragraph  to such attendant, who shall  (i)     forthwith, in the presence of the non-resident elector, enclose therein the ballot envelope, and the declaration  in the form, LAWS OF GUYANA 64 Cap. 1:03 Representation of the People   L.R.O. 1/2012                                                Safe custody of votes returned. [16 of 1985]    given by him under subparagraph (iii) of the said paragraph and seal the addressed envelope; (ii)     until its delivery to the officer mentioned in the next following subparagraph,  keep  the addressed  envelope so sealed in safe custody and take every precaution to prevent its being opened or unauthorised access being had thereto; and (iii)    be responsible for delivering the addressed envelope not later than the 5th day before election day to the officer to whose office it is so addressed;  (b)   having  complied  with  section  54(b),  shall  seal  the addressed  envelope  containing  its  enclosures  under  that paragraph and post it so as to be received by the officer to whose office it is so addressed not later than the 7th day before election day.",
            "description": [
                {
                    "representation": "(a)",
                    "description": "having  complied  with  section  54(a),  shall  thereupon surrender  to  the  ballot  attendant  the  addressed  envelope exhibited under subparagraph"
                },
                {
                    "representation": "(i)",
                    "description": "forthwith, in the presence of the non-resident elector, enclose therein the ballot envelope, and the declaration  in the form, LAWS OF GUYANA 64 Cap. 1:03 Representation of the People   L.R.O. 1/2012                                                Safe custody of votes returned. [16 of 1985]    given by him under subparagraph"
                },
                {
                    "representation": "(b)",
                    "description": "having  complied  with  section  54(b),  shall  seal  the addressed  envelope  containing  its  enclosures  under  that paragraph and post it so as to be received by the officer to whose office it is so addressed not later than the 7th day before election day."
                }
            ]
        }
    },
    {
        "act": "REPRESENTATION OF THE PEOPLE ACT",
        "source": "https://mola.gov.gy/laws-of-guyana",
        "type": {
            "name": "section",
            "representation": "56",
            "title": "Safe custody of votes returned. ",
            "context": "REPRESENTATION OF THE PEOPLE ACT under Safe custody of votes returned. 56.  (1) Each officer to whom the addressed envelope issued by him in  pursuance  of section  51 (a) or (b) to any non-resident  elector  is returned as having been duly sealed by a ballot attendant, or as a sealed envelope presumably with enclosures under section 54(b), shall keep   LAWS OF GUYANA Representation of the People Cap. 1:03 65  L.R.O. 1/2012                                                it in safe custody, and take every precaution to prevent its being illegally opened or unauthorised access being had thereto, prior to the discharge of his other duties and responsibilities in respect thereof:  Provided that any such envelope returned after the time allowed for its delivery or receipt under section 55(a)(iii) or (b), as the case may be, shall be kept separately from all other such envelopes returned in due time; and  every ballot officer to whom any such envelope is returned after the time  allowed as aforesaid shall cause it to be delivered to the Chief Election Officer as soon as practicable after such return thereof.  (2) For the purposes of section 137, and without prejudice to the generality of the provisions thereof, every envelope which has been sealed by a ballot attendant under section 55(a)(i), or has been returned to any officer as a sealed envelope mentioned in subsection (1) of this section, shall be deemed to be, until removal of the ballot paper therefrom according to law, a packet referred to in section 137(1)(d).   (3) Where the addressed envelope, form (whether completed or not), marked or unmarked ballot paper and the ballot envelope therefor, or any of the foregoing, issued by any officer in pursuance of section 51(a)  or (b) are  returned  to him in such manner  or condition  as to preclude the application of subsection (1) in relation thereto, such officer shall nevertheless keep them in safe custody, and take every precaution to prevent unauthorised access being had thereto or any such envelope (if sealed) from being illegally opened, prior to the discharge of his other duties and responsibilities in respect thereof and, if he is a ballot officer, shall cause the LAWS OF GUYANA 66 Cap. 1:03 Representation of the People   L.R.O. 1/2012          Officers responsibilities [16 of 1985]                                       Form",
            "description": [
                {
                    "representation": "(1)",
                    "description": "in relation thereto, such officer shall nevertheless keep them in safe custody, and take every precaution to prevent unauthorised access being had thereto or any such envelope"
                },
                {
                    "representation": "(a)",
                    "description": "or"
                },
                {
                    "representation": "(b)",
                    "description": "are  returned  to him in such manner  or condition  as to preclude the application of subsection"
                },
                {
                    "representation": "(2)",
                    "description": "For the purposes of section 137, and without prejudice to the generality of the provisions thereof, every envelope which has been sealed by a ballot attendant under section 55(a)(i), or has been returned to any officer as a sealed envelope mentioned in subsection"
                },
                {
                    "representation": "(3)",
                    "description": "Where the addressed envelope, form"
                }
            ]
        }
    },
    {
        "act": "REPRESENTATION OF THE PEOPLE ACT",
        "source": "https://mola.gov.gy/laws-of-guyana",
        "type": {
            "name": "section",
            "representation": "57",
            "title": "Officer\u2019s responsibilities. ",
            "context": "REPRESENTATION OF THE PEOPLE ACT under Officers responsibilities. 57.  (1)  Each officer referred to in section 56 shall  make up into separate packets, sealed with his seal  (a)    all   the   addressed   envelopes   returned   to   him   as mentioned in section 56(1) and to which the proviso to that paragraph does not apply; (b)   such copy of entries in the non-resident electors roll as has been used by him for the purposes of section 52(a);  (c)      the  counterfoils  with  entries  made  thereon  by  him under section 52(b);  (d)     any ballot papers with which he was furnished under section 46 and which have not been issued to non-resident electors pursuant to section 51;  (e)     a statement in writing, to be called the non-resident electors ballot papers account prepared by him in Form",
            "description": [
                {
                    "representation": "(1)",
                    "description": "Each officer referred to in section 56 shall  make up into separate packets, sealed with his seal"
                },
                {
                    "representation": "(a)",
                    "description": "all   the   addressed   envelopes   returned   to   him   as mentioned in section 56(1) and to which the proviso to that paragraph does not apply;"
                },
                {
                    "representation": "(b)",
                    "description": "such copy of entries in the non-resident electors roll as has been used by him for the purposes of section 52(a);"
                },
                {
                    "representation": "(c)",
                    "description": "the  counterfoils  with  entries  made  thereon  by  him under section 52(b);"
                },
                {
                    "representation": "(d)",
                    "description": "any ballot papers with which he was furnished under section 46 and which have not been issued to non-resident electors pursuant to section 51;"
                },
                {
                    "representation": "(e)",
                    "description": "a statement in writing, to be called the non-resident electors ballot papers account prepared by him in Form"
                }
            ]
        }
    },
    {
        "act": "REPRESENTATION OF THE PEOPLE ACT",
        "source": "https://mola.gov.gy/laws-of-guyana",
        "type": {
            "name": "section",
            "representation": "58",
            "title": "Balloting by non-resident electors in particular cases. ",
            "context": "REPRESENTATION OF THE PEOPLE ACT under Balloting by non-resident electors in particular cases. 58. (1) Notwithstanding anything in the foregoing provisions of this Part, where any non-resident elector present in Guyana has reason to apprehend  his  being  unable  to  vote  (apart  from  subsection  (4))  on account of his absence from the address to which any sealed envelope is required by section 51 to be directed to him by post, such address being situated outside Guyana, the non-resident elector may apply to the Chief Election Officer for a ballot paper.  (2) Such application shall be in Form 18 and shall be posted to the office of the Chief Election Officer so as to be received by him not later than the 7th day before election day.  (3) Unless the Chief Election Officer is not satisfied as to the identity of the applicant upon comparison of his signature with that of the said non-resident elector on his registration record, which shall be LAWS OF GUYANA 68 Cap. 1:03 Representation of the People   L.R.O. 1/2012                                                 made available for the purpose by the Commissioner of Registration, the Chief Election Officer shall grant the application and comply with sections 51 and 52, whether or not previously complied with, in relation to that non- resident  elector as if  (a)     for  the reference in section 51 to the 14th day before election day there had been substituted a reference to the 5th day before election day; and  (b)  his address appearing in the non-resident electors roll were, by virtue of section 44(2)(b), such address in Guyana as shall be given by him in the said application.                 (4) Where  a  non-resident   elector  is  in  receipt  of  a  sealed envelope directed to him at an address in Guyana by virtue of the last preceding subsection, sections 54 and 55 apply in relation to such non- resident elector as if  (a)   reference in section 54(a) to proof of identity in lieu of (but not in so far as it may be requisite in addition to) a passport or travel document had been omitted;  (b)    for  every  reference  in section  54 or  55  to a  ballot attendant  there  had  been  substituted  a  reference  to  the returning  officer  for the district  in which  that  non-resident electors address given as mentioned in subsection (3)(b) is situated;   LAWS OF GUYANA Representation of the People Cap. 1:03 69  L.R.O. 1/2012                                                 (c)    for the reference in section 54(a) to the 9th day before election  day there  had been  substituted  a reference  to the second day next before election day;  (d)    for  the reference in section 55 to the 5th day before election day there had been substituted a reference to election day:  Provided that section 54(b) or 55 does not apply to any non-resident elector in receipt of a sealed envelope directed to him as aforesaid.  (5) For the purposes of section 56(2), a returning officer acting by virtue of subsection (4)(b) of this section shall be deemed to be a ballot attendant.  (6) Where after the 10th day before election day a non-resident elector  who  apprehends  his  being  unable  to  vote,  apart  from  this subsection, on account of no ballot paper having been received by him, satisfies as to his identity the ballot attendant at the office of any ballot officer required to have issued a ballot paper to the non-resident elector that ballot officer shall cause such a sealed envelope as is mentioned in section 51 to be thereupon handed to the non-resident elector and this Act applies to the envelope so handed to the non-resident elector and its contents as if they had been posted to him by the ballot officer not later than the 14th day before election day:  Provided that  (a)    section 54(b) or 55 does not apply as LAWS OF GUYANA 70 Cap. 1:03 Representation of the People   L.R.O. 1/2012                        Time and place for casting non-resident electors votes. [Reg. 32/1968 O. 68/1980 12 of 1996] 15 of 2000 12 of  2006]                  aforesaid and no ballot attendant, other than the ballot attendant so satisfied, shall be deemed referred to by subsection (a) of either such section in its application as aforesaid;  (b)   the   addressed  envelopes  duly returned  to the  ballot officer by virtue of the foregoing provisions of this paragraph shall   be  parcelled   together,   separately   from   the   other enclosures,  in  his  packet  containing  addressed  envelopes under section 57(1)(a).",
            "description": [
                {
                    "representation": "(1)",
                    "description": "Notwithstanding anything in the foregoing provisions of this Part, where any non-resident elector present in Guyana has reason to apprehend  his  being  unable  to  vote"
                },
                {
                    "representation": "(2)",
                    "description": "Such application shall be in Form 18 and shall be posted to the office of the Chief Election Officer so as to be received by him not later than the 7th day before election day."
                },
                {
                    "representation": "(3)",
                    "description": "Unless the Chief Election Officer is not satisfied as to the identity of the applicant upon comparison of his signature with that of the said non-resident elector on his registration record, which shall be LAWS OF GUYANA 68 Cap. 1:03 Representation of the People   L.R.O. 1/2012                                                 made available for the purpose by the Commissioner of Registration, the Chief Election Officer shall grant the application and comply with sections 51 and 52, whether or not previously complied with, in relation to that non- resident  elector as if"
                },
                {
                    "representation": "(a)",
                    "description": "of either such section in its application as aforesaid;"
                },
                {
                    "representation": "(b)",
                    "description": "the   addressed  envelopes  duly returned  to the  ballot officer by virtue of the foregoing provisions of this paragraph shall   be  parcelled   together,   separately   from   the   other enclosures,  in  his  packet  containing  addressed  envelopes under section 57(1)(a)."
                },
                {
                    "representation": "(4)",
                    "description": "Where  a  non-resident   elector  is  in  receipt  of  a  sealed envelope directed to him at an address in Guyana by virtue of the last preceding subsection, sections 54 and 55 apply in relation to such non- resident elector as if"
                },
                {
                    "representation": "(c)",
                    "description": "for the reference in section 54(a) to the 9th day before election  day there  had been  substituted  a reference  to the second day next before election day;"
                },
                {
                    "representation": "(d)",
                    "description": "for  the reference in section 55 to the 5th day before election day there had been substituted a reference to election day:  Provided that section 54(b) or 55 does not apply to any non-resident elector in receipt of a sealed envelope directed to him as aforesaid."
                },
                {
                    "representation": "(5)",
                    "description": "For the purposes of section 56(2), a returning officer acting by virtue of subsection"
                },
                {
                    "representation": "(6)",
                    "description": "Where after the 10th day before election day a non-resident elector  who  apprehends  his  being  unable  to  vote,  apart  from  this subsection, on account of no ballot paper having been received by him, satisfies as to his identity the ballot attendant at the office of any ballot officer required to have issued a ballot paper to the non-resident elector that ballot officer shall cause such a sealed envelope as is mentioned in section 51 to be thereupon handed to the non-resident elector and this Act applies to the envelope so handed to the non-resident elector and its contents as if they had been posted to him by the ballot officer not later than the 14th day before election day:  Provided that"
                }
            ]
        }
    },
    {
        "act": "REPRESENTATION OF THE PEOPLE ACT",
        "source": "https://mola.gov.gy/laws-of-guyana",
        "type": {
            "name": "section",
            "representation": "59",
            "title": "Time and place for casting non-resident electors\u2019 votes. ",
            "context": "REPRESENTATION OF THE PEOPLE ACT under Time and place for casting non-resident electors votes. 59.  (1) The provisions of the following sections of this Part shall be executed at such place in Guyana, and during such period commencing on  election day, as may be specified by the Chief Election Officer by notice published in the Gazette and no person, other than  (a)    the  Chief  Election  Officer and such staff appointed under section 7(d) as he may designate to assist him in the execution of those provisions;  (b)       members of the Commission;  (c)     candidates  appointed   under   sub-section (2);   (d)  election  agents;  (e)    of the Police Force, the Guyana Defence Force on duty;   LAWS OF GUYANA Representation of the People Cap. 1:03 71  L.R.O. 1/2012                                                  Commencement of proceedings  on election  day for casting non-resident electors votes.  (f)      such  other  persons  as, in the  opinion  of  the  Chief Election Officer, have good reason to be present, shall be present at the execution of any such provisions:  Provided  that  notwithstanding  anything  provided  by any law  or specified as aforesaid, but without prejudice to section 4, the execution of the provisions of the following sections of this Part may, in so far as the Chief Election Officer finds necessary for the purpose of ensuring the casting of the votes of non-resident electors duly delivered to him in accordance  with  this  Act,  be  continued  and  completed   after  the expiration of the said period whether it expired during or with election day.  (2) The election agent of each group of candidates may appoint one of the candidates for the purposes of subsection (1)(c).  (3) Notice in writing of such appointment, stating the name and address of the candidate, shall be signed by the election agent and delivered to the Chief Election Officer not later than the 7th day before election day.  (4) There shall not be more than one candidate appointed from the same list of candidates for the said purposes.",
            "description": [
                {
                    "representation": "(1)",
                    "description": "The provisions of the following sections of this Part shall be executed at such place in Guyana, and during such period commencing on  election day, as may be specified by the Chief Election Officer by notice published in the Gazette and no person, other than"
                },
                {
                    "representation": "(a)",
                    "description": "the  Chief  Election  Officer and such staff appointed under section 7(d) as he may designate to assist him in the execution of those provisions;"
                },
                {
                    "representation": "(b)",
                    "description": "members of the Commission;"
                },
                {
                    "representation": "(c)",
                    "description": "candidates  appointed   under   sub-section"
                },
                {
                    "representation": "(d)",
                    "description": "election  agents;"
                },
                {
                    "representation": "(e)",
                    "description": "of the Police Force, the Guyana Defence Force on duty;   LAWS OF GUYANA Representation of the People Cap. 1:03 71  L.R.O. 1/2012                                                  Commencement of proceedings  on election  day for casting non-resident electors votes."
                },
                {
                    "representation": "(f)",
                    "description": "such  other  persons  as, in the  opinion  of  the  Chief Election Officer, have good reason to be present, shall be present at the execution of any such provisions:  Provided  that  notwithstanding  anything  provided  by any law  or specified as aforesaid, but without prejudice to section 4, the execution of the provisions of the following sections of this Part may, in so far as the Chief Election Officer finds necessary for the purpose of ensuring the casting of the votes of non-resident electors duly delivered to him in accordance  with  this  Act,  be  continued  and  completed   after  the expiration of the said period whether it expired during or with election day."
                },
                {
                    "representation": "(2)",
                    "description": "The election agent of each group of candidates may appoint one of the candidates for the purposes of subsection"
                },
                {
                    "representation": "(3)",
                    "description": "Notice in writing of such appointment, stating the name and address of the candidate, shall be signed by the election agent and delivered to the Chief Election Officer not later than the 7th day before election day."
                },
                {
                    "representation": "(4)",
                    "description": "There shall not be more than one candidate appointed from the same list of candidates for the said purposes."
                }
            ]
        }
    },
    {
        "act": "REPRESENTATION OF THE PEOPLE ACT",
        "source": "https://mola.gov.gy/laws-of-guyana",
        "type": {
            "name": "section",
            "representation": "60",
            "title": "Commencement of proceedings on election day for casting non-resident electors\u2019 votes. ",
            "context": "REPRESENTATION OF THE PEOPLE ACT under Commencement of proceedings on election day for casting non-resident electors votes. 60.  At the commencement of the period mentioned in section 59, the Chief Election Officer shall  (a)    open   a   ballot   box,   which   shall   confirm   to   the requirements of LAWS OF GUYANA 72 Cap. 1:03 Representation of the People   L.R.O. 1/2012  [40 of 1964",
            "description": [
                {
                    "representation": "(a)",
                    "description": "open   a   ballot   box,   which   shall   confirm   to   the requirements of LAWS OF GUYANA 72 Cap. 1:03 Representation of the People   L.R.O. 1/2012  [40 of 1964"
                }
            ]
        }
    },
    {
        "act": "REPRESENTATION OF THE PEOPLE ACT",
        "source": "https://mola.gov.gy/laws-of-guyana",
        "type": {
            "name": "section",
            "representation": "61",
            "title": "Opening packets of non-resident electors; ballot papers. ",
            "context": "REPRESENTATION OF THE PEOPLE ACT under Opening packets of non-resident electors; ballot papers. 61.  (3) For the purposes of section 137, and without prejudice to the generality of the provisions thereof, each packet made up in pursuance of subsection (l)(a) of this section shall be deemed to be, until it is opened for the purposes of section 61, a packet referred to in section 137(1)(d).",
            "description": [
                {
                    "representation": "(3)",
                    "description": "For the purposes of section 137, and without prejudice to the generality of the provisions thereof, each packet made up in pursuance of subsection"
                },
                {
                    "representation": "(a)",
                    "description": "of this section shall be deemed to be, until it is opened for the purposes of section 61, a packet referred to in section 137(1)(d)."
                }
            ]
        }
    },
    {
        "act": "REPRESENTATION OF THE PEOPLE ACT",
        "source": "https://mola.gov.gy/laws-of-guyana",
        "type": {
            "name": "section",
            "representation": "62",
            "title": "Casting non-resident electors\u2019 votes. ",
            "context": "REPRESENTATION OF THE PEOPLE ACT under Casting non-resident electors votes. 62. (1) The casting  of every  vote  dealt  with  in accordance  with section 55 shall be effected by way of the ballot the paper being removed without being unfolded from the envelope which contained it and being placed in the ballot box by the Chief Election Officer as soon as he shall have opened the addressed envelope so dealt with and, in the event of any request having been duly made in that behalf, satisfied himself under section 61(2) that the identity of the signatory of the declaration enclosed with the ballot envelope conforms to the requirements of this Act; and upon every such casting, the Chief Election Officer shall place a mark on his copy of the non-resident electors roll against the name of the non- resident elector whose serial number appears on the reverse side of the declaration enclosed  as aforesaid.   (2) For the purposes of the preceding subsection, a vote shall be deemed to have been dealt with in accordance with section 55 notwithstanding that the ballot envelope containing the same is found open except the ballot envelope appears to the Chief Election Officer to have been tampered with after having been sealed.  (3) Notwithstanding anything in the foregoing   LAWS OF GUYANA Representation of the People Cap. 1:03 75  L.R.O. 1/2012                             Casting of non-resident vote for geographical constituencies [15 of 2000 2 of 2001]               provisions of this section, a vote shall not be cast if upon opening the addressed envelope containing the same, there is disclosed a declaration bearing under section 51(ii) the like serial number  (a)    as  was  entered  on any counterfoil under section 52(b)and by virtue of section 58(3), the addressed envelope aforesaid not having been delivered as mentioned in section 61(1); or  (b)     as belongs to any non-resident elector against whose name an additional mark has been placed under section 52(a) and by virtue of section 58(6), the addressed envelope aforesaid not having been among parcelled enclosures referred to in the proviso to the last-mentioned subsection.  62A. (1) The ballot officer shall supply to every person entitled to vote at the balloting place his ballot paper in an unsealed envelope; on the envelope shall be stated his name, polling district, division, code number and polling place.  (2) Upon issuing the unsealed envelop to the person entitled to ballot such person shall cast his ballot and place it in the envelope which he shall seal before placing it in the ballot box provided by the ballot attendant.  (3) Upon receipt of the envelopes containing the ballots cast the Chief Election Officer or his duly authorised representative shall sort the envelopes with the ballot cast therein and place each envelope in a packet for the relevant LAWS OF GUYANA 76 Cap. 1:03 Representation of the People   L.R.O. 1/2012                                               Further duties of Chief Election polling station in the relevant geographical district and prepare a written statement of the number of envelopes so sorted.  (4) The Chief Election Officer shall transmit all sealed envelopes with the cast ballots to the respective returning officers for each geographical district, together with a copy of the written record of the envelopes so despatched.  (5)  The Elections Commission shall in respect of each geographical constituency publish the names of polling stations in each polling district where the sealed envelopes with the cast ballots shall be sent by the Returning Officer for the votes to be cast at such polling stations before the close of poll.  (6) In the presence of the polling agents the presiding officer shall verify and record the number of envelopes with the cast ballots before casting the ballots contained in the envelopes at each polling station.   (7) The persons who balloted in accordance with this section shall be deemed to have cast their votes at the election in the districts in which the relevant balloting places are situated.  (8)  The votes deemed to have been cast at the election in each district under subsection (7) shall be counted by the respective presiding officer and the provisions of section 83 shall apply mutatis mutandis in relation to the counting of votes under this section.",
            "description": [
                {
                    "representation": "(1)",
                    "description": "The ballot officer shall supply to every person entitled to vote at the balloting place his ballot paper in an unsealed envelope; on the envelope shall be stated his name, polling district, division, code number and polling place."
                },
                {
                    "representation": "(2)",
                    "description": "Upon issuing the unsealed envelop to the person entitled to ballot such person shall cast his ballot and place it in the envelope which he shall seal before placing it in the ballot box provided by the ballot attendant."
                },
                {
                    "representation": "(3)",
                    "description": "Upon receipt of the envelopes containing the ballots cast the Chief Election Officer or his duly authorised representative shall sort the envelopes with the ballot cast therein and place each envelope in a packet for the relevant LAWS OF GUYANA 76 Cap. 1:03 Representation of the People   L.R.O. 1/2012                                               Further duties of Chief Election polling station in the relevant geographical district and prepare a written statement of the number of envelopes so sorted."
                },
                {
                    "representation": "(a)",
                    "description": "as  was  entered  on any counterfoil under section 52(b)and by virtue of section 58(3), the addressed envelope aforesaid not having been delivered as mentioned in section 61(1); or"
                },
                {
                    "representation": "(b)",
                    "description": "as belongs to any non-resident elector against whose name an additional mark has been placed under section 52(a) and by virtue of section 58(6), the addressed envelope aforesaid not having been among parcelled enclosures referred to in the proviso to the last-mentioned subsection.  62A."
                },
                {
                    "representation": "(4)",
                    "description": "The Chief Election Officer shall transmit all sealed envelopes with the cast ballots to the respective returning officers for each geographical district, together with a copy of the written record of the envelopes so despatched."
                },
                {
                    "representation": "(5)",
                    "description": "The Elections Commission shall in respect of each geographical constituency publish the names of polling stations in each polling district where the sealed envelopes with the cast ballots shall be sent by the Returning Officer for the votes to be cast at such polling stations before the close of poll."
                },
                {
                    "representation": "(6)",
                    "description": "In the presence of the polling agents the presiding officer shall verify and record the number of envelopes with the cast ballots before casting the ballots contained in the envelopes at each polling station."
                },
                {
                    "representation": "(7)",
                    "description": "shall be counted by the respective presiding officer and the provisions of section 83 shall apply mutatis mutandis in relation to the counting of votes under this section."
                },
                {
                    "representation": "(8)",
                    "description": "The votes deemed to have been cast at the election in each district under subsection"
                }
            ]
        }
    },
    {
        "act": "REPRESENTATION OF THE PEOPLE ACT",
        "source": "https://mola.gov.gy/laws-of-guyana",
        "type": {
            "name": "section",
            "representation": "63",
            "title": "Further duties of Chief Election Officer in relation to packets. ",
            "context": "REPRESENTATION OF THE PEOPLE ACT under Further duties of Chief Election Officer in relation to packets. 63.  (1) The Chief Election Officer shall not leave  outside  any addressed envelope opened under section   LAWS OF GUYANA Representation of the People Cap. 1:03 77  L.R.O. 1/2012 Officer in relation to packets. [Reg. 25/1968 16 of 1985]                                            61(1) such contents thereof as are not placed in the ballot box under section 62(1); and he shall make up into separate packets, sealed with his seal  (a)    all such envelopes from which votes have not been cast by  reason of their containing declarations  or certificates  in respect of which the Chief Election Officer, having been duly requested  to  satisfy  himself  as  to  the  identities   of  the signatories thereof, is not satisfied as mentioned in section 62(1);  (b)   all such envelopes which contained votes cast under section 62(1);  (c)    all other such envelopes from which such casting was not effected by reason of their having been found, upon being opened as aforesaid, to contain enclosures which appear not to have been dealt with in accordance with section 55;  (d)   all the  addressed  envelopes  from which  votes  were precluded by virtue of section 62(3) from being cast;  (e)     all  the addressed envelopes returned as mentioned  in the proviso to section 56(1), or delivered under that proviso, to him on or before election day;  LAWS OF GUYANA 78 Cap. 1:03 Representation of the People   L.R.O. 1/2012                                              Ballot boxes. [Reg. 25/1968]    (f)      everything  returned  in  such  manner  (not  being  the manner provided by virtue of section 58(4)(b) or condition as mentioned in section 56(3), or delivered in pursuance of that subsection, to him on or before election day;  (g)      the copy  of  the  non-resident  electors  roll  marked under section 62(1).  (2) The   Chief   Election   Officer   shall,   for   the   purpose   of compliance with section 62(3), open the packet made up by each officer in  pursuance of section 57(1)(b), and the packet made up by him in pursuance of subsection (c) of that section and containing counterfoils with entries made under section 52(b) and by virtue of section 58(3), and shall reseal every packet so opened as soon as its contents cease to be in use for the said purpose.  (3) The Chief Election Officer shall open the packet made up by each officer pursuant to section 57(1)(d), and the packet containing the non-resident  electors  ballot  papers  account  prepared  by that officer under section 57(1)(e), for the purpose of verification of the said account by  comparing it with the contents of the packet made up by him as aforesaid and with the relevant records made under sections 48 and 61(1) and the Chief Election Officer shall thereafter reseal both such packets.",
            "description": [
                {
                    "representation": "(1)",
                    "description": "The Chief Election Officer shall not leave  outside  any addressed envelope opened under section   LAWS OF GUYANA Representation of the People Cap. 1:03 77  L.R.O. 1/2012 Officer in relation to packets. [Reg. 25/1968 16 of 1985]                                            61(1) such contents thereof as are not placed in the ballot box under section 62(1); and he shall make up into separate packets, sealed with his seal"
                },
                {
                    "representation": "(a)",
                    "description": "all such envelopes from which votes have not been cast by  reason of their containing declarations  or certificates  in respect of which the Chief Election Officer, having been duly requested  to  satisfy  himself  as  to  the  identities   of  the signatories thereof, is not satisfied as mentioned in section 62(1);"
                },
                {
                    "representation": "(b)",
                    "description": "or condition as mentioned in section 56(3), or delivered in pursuance of that subsection, to him on or before election day;"
                },
                {
                    "representation": "(c)",
                    "description": "of that section and containing counterfoils with entries made under section 52(b) and by virtue of section 58(3), and shall reseal every packet so opened as soon as its contents cease to be in use for the said purpose."
                },
                {
                    "representation": "(d)",
                    "description": "all the  addressed  envelopes  from which  votes  were precluded by virtue of section 62(3) from being cast;"
                },
                {
                    "representation": "(e)",
                    "description": "all  the addressed envelopes returned as mentioned  in the proviso to section 56(1), or delivered under that proviso, to him on or before election day;  LAWS OF GUYANA 78 Cap. 1:03 Representation of the People   L.R.O. 1/2012                                              Ballot boxes. [Reg. 25/1968]"
                },
                {
                    "representation": "(f)",
                    "description": "everything  returned  in  such  manner"
                },
                {
                    "representation": "(g)",
                    "description": "the copy  of  the  non-resident  electors  roll  marked under section 62(1)."
                },
                {
                    "representation": "(2)",
                    "description": "The   Chief   Election   Officer   shall,   for   the   purpose   of compliance with section 62(3), open the packet made up by each officer in  pursuance of section 57(1)(b), and the packet made up by him in pursuance of subsection"
                },
                {
                    "representation": "(3)",
                    "description": "The Chief Election Officer shall open the packet made up by each officer pursuant to section 57(1)(d), and the packet containing the non-resident  electors  ballot  papers  account  prepared  by that officer under section 57(1)(e), for the purpose of verification of the said account by  comparing it with the contents of the packet made up by him as aforesaid and with the relevant records made under sections 48 and 61(1) and the Chief Election Officer shall thereafter reseal both such packets."
                }
            ]
        }
    },
    {
        "act": "REPRESENTATION OF THE PEOPLE ACT",
        "source": "https://mola.gov.gy/laws-of-guyana",
        "type": {
            "name": "section",
            "representation": "64",
            "title": "Ballot boxes. ",
            "context": "REPRESENTATION OF THE PEOPLE ACT under Ballot boxes. 64.  More than one ballot box may be used for the purposes of this Part if the Chief Election Officer considers or finds a single ballot box to be inadequate, or the use thereof to be inexpedient, for those purposes; and the   LAWS OF GUYANA Representation of the People Cap. 1:03 79  L.R.O. 1/2012                Delegation of Chief Election Officers functions.  [Reg. 25/1968]                        Definitions. [16 of 1985 15 of 2000]          provisions of section 60 shall, in so far as they are applicable, be complied with in relation to every ballot box which the Chief Election Officer decides shall be used as aforesaid.",
            "description": "More than one ballot box may be used for the purposes of this Part if the Chief Election Officer considers or finds a single ballot box to be inadequate, or the use thereof to be inexpedient, for those purposes; and the   LAWS OF GUYANA Representation of the People Cap. 1:03 79  L.R.O. 1/2012                Delegation of Chief Election Officers functions.  [Reg. 25/1968]                        Definitions. [16 of 1985 15 of 2000]          provisions of section 60 shall, in so far as they are applicable, be complied with in relation to every ballot box which the Chief Election Officer decides shall be used as aforesaid."
        }
    },
    {
        "act": "REPRESENTATION OF THE PEOPLE ACT",
        "source": "https://mola.gov.gy/laws-of-guyana",
        "type": {
            "name": "section",
            "representation": "65",
            "title": "Delegation of Chief Election Officer\u2019s functions.  LAWS OF GUYANA 6 Cap. 1:03 Representation of the People   L.R.O. 1/2012              65A- 65F           [PART VIIA 65 A- 65F repealed by Act No. 3 of ",
            "context": "REPRESENTATION OF THE PEOPLE ACT under Delegation of Chief Election Officers functions.  LAWS OF GUYANA 6 Cap. 1:03 Representation of the People   L.R.O. 1/2012              65A- 65F           [PART VIIA 65 A- 65F repealed by Act No. 3 of 65.  The Chief Election Officer may depute officers belonging to the staff appointed under section 7(d) to carry out his functions, or any of them, (including, without prejudice to the generality of the foregoing, the exercise  of  his  authority  for  the  casting  of  any  vote),  under  such provisions of the foregoing sections of this Part as are to be executed in conformity with section 59(1); and the officers so deputed, who shall be called overseas presiding officers, shall subject to any general or special directions given by the Chief Election Officer, have and exercise all the powers and perform all the duties, delegated under this section to them, respectively.  65A- 65 F. [PART VIIA - Sections 65A-65F repealed by Act No.3 of 1991].  PART  VIIB PROCEDURE  FOR  VOTING  BY  SPECIFIED DISCIPLINED  FORCES   65G.  (1) In this Part  ballot attendant means a person appointed as such under section 65I;  ballot officer  means a person appointed as such under section 65I;   balloting place  means a place appointed as a balloting LAWS OF GUYANA 80 Cap. 1:03 Representation of the People   L.R.O. 1/2012                         Application of Part. [16 of 1985 12 of 1996]                 Appointment of ballot officers, ballot attendants  and balloting places for the purposes  of this  Part. [16 of 1985]           place under section 65I;  specified disciplined force means a disciplined force specified for the purposes of this Part by order under section 65H.           [Subsection (2) repealed by Act No. 15 of 2000]  65 H.  In order to allow members of any disciplined force or disciplined forces to exercise their right to vote at an election without affecting the performance by them of their duties on the election day, the Elections Commission may by order direct that the provisions of this Part shall apply to the exercise of that right, by any member of such disciplined force or disciplined forces as may be specified in the order, in an election and if the Elections Commission makes such an order the provisions of this Part shall apply to voting by any member of a specified disciplined force or specified disciplined forces at any election held after the date of the order.  65I.  (1) The Chief Election Officer shall appoint by notification in the Gazette   (a)   one ballot officer for each of the specified disciplined forces;  (b)     such number of ballot attendants, as he thinks fit, so that there will be one ballot attendant for each balloting place; and   (c)      such place or places, as he thinks fit, in each district as balloting place or balloting places.   LAWS OF GUYANA Representation of the People Cap. 1:03 81  L.R.O. 1/2012                   List of electors entitled to vote under  this Part. [16 of 1985 12 of 1996 22 of 1997 15 of 2000]                        (2) Different ballot attendants and different balloting places may be  appointed  in  relation  to  electors  who  are  members  of  different specified disciplined forces.  (3) A ballot clerk may be appointed by the Chief Election Officer in relation to a balloting place: Provided that it shall be lawful for the Chief Election Officer to appoint the same person as ballot attendant and ballot clerk.  65 J.(1) Each  ballot  officer  shall  prepare  a  list  of  persons  whose names are on any official list of electors and who are members of the specified disciplined force, in relation to which he has been appointed ballot  officer.  (2) The list prepared by a ballot officer under subsection (1) shall be divided into parts according to the division, in the official list of electors for which the names of the persons mentioned in that part are included, and  shall state the registration card number of each such person, his serial  number  of registration  in the official  list  of electors,  to which division  the official  list of electors  relates,  the district  in which  that division is situate, and such other particulars as may be prescribed by the Elections Commission by regulations.  (3) Each of the ballot officers shall forward a copy of the list prepared by him under subsection (1) (but excluding therefrom the names of the persons referred to in the proviso to section 65K(6)) to the Chief Election Officer.  (4) The Chief Election Officer shall forward those parts of the copy of the list referred to in subsection (3) as LAWS OF GUYANA 82 Cap. 1:03 Representation of the People   L.R.O. 1/2012                               Balloting. [16 of 1985]                                  are relevant in respect of the divisions in any district to the returning officer of that district and the returning officer shall cause to be displayed at each polling place in the district the names and other particulars included in the copy of the list, referred to in subsection (1), of those who are, but for this Part, entitled to vote at that polling place.   65K. (l) The Chief Election Officer shall by notification in the Gazette appoint a day on which, and the hours during which, persons entitled to vote under this Part may ballot and different days and hours may be appointed in relation to different balloting places:  Provided that any day appointed under this subsection for balloting shall not be more than ten days earlier than the election day or later than five days before the election day.  (2) The  Chief  Election  Officer  shall  forward  to  each  ballot officer sufficient number of ballot papers having regard to the names in the copy of the list forwarded by that ballot officer to the Chief Election Officer under section 65J (3).  (3) The ballot officer shall, before the hour appointed for the commencement of balloting under this Part at a balloting place, cause to be displayed at the balloting place a list containing the names, and other particulars referred to in section 65J (2), of the persons entitled to ballot under this Part at that balloting place, such names being of persons who are, but for this Part, entitled to vote at a polling place in the district where that balloting place is situate.    LAWS OF GUYANA Representation of the People Cap. 1:03 83  L.R.O. 1/2012                                                (4) The ballot officer shall cause to be supplied to the ballot attendant for a balloting place, the day before the day fixed for balloting at that balloting place, sufficient number of ballot papers having regard to the names in the list, referred to in subsection (3), of persons entitled to ballot at that balloting place.  (5) Any person whose  name is on a list prepared  by a ballot officer under section 65 J(1) and who desires to vote at an election may exercise his right to ballot under this Part at the balloting place where a list containing his name is displayed under subsection (3).  (6) Nothing in this Part shall be deemed to prevent any person whose name is included in a list  prepared  under  section  65J(1)  from exercising his right to vote in accordance with any other provision of this Act and not in accordance with this Part:  Provided   that   where   any  such  person   desires   to  vote   in accordance with any other provision of this Act he shall intimate  the ballot officer in relation to such list wherein his name is included, not later than  fifteen days before the day appointed under subsection (1) for balloting at the balloting place where he is entitled to ballot under this Part, of his desire so to do and thereupon the ballot officer shall make a note of it in that list and his name shall not be included in the list referred to in subsection (3) or in the copy of the list referred to in section 65J(3) and forwarded by the ballot officer to the Chief Election Officer.  (7) Subject to the provisions of this Part, the provisions of this Act in relation to presiding officers and their functions, polling clerks and their functions, polling places, preparation for poll and polling shall  mutatis LAWS OF GUYANA 84 Cap. 1:03 Representation of the People   L.R.O. 1/2012          Ballot attendant to hand over ballot box to ballot officer.  [16 of 1985 30 of 1990] 15 of 2005]                      Application   of certain provisions relating to penalties to balloting under this Part. [16 of 1985]       mutandis apply respectively to, and in relation to, ballot attendants, ballot clerks, balloting  places, preparation for ballot and balloting  under this Part.  65L. (1) As soon as possible after the expiry of the hour appointed for the closing of balloting in relation to a balloting place, on the day of the balloting, the ballot attendant shall deliver personally the sealed ballot box containing the sealed envelopes with the marked ballots and the sealed packets referred to in section 83(10) (b) together with the key of the ballot box to the ballot officer.  (2) The ballot attendant shall be responsible for the safe custody of the ballot box and the aforesaid sealed packets until they are delivered to the ballot officer under subsection (1) and thereafter the ballot officer shall deliver them to the Chief Election Officer who shall be responsible for their safe custody.  (3) The provisions of 62A as they apply in relation to the non- resident electors ballot shall apply mutatis mutandis to voting by the disciplined forces.  (4) [Repealed by Act No. 15 of 2000]  65M. (1) The provisions of sections 119, 122(1)(a), 126(a) in so far as it relates to voting on his own behalf, 126(d)(i) and (ii), 127(a) and (b),129, 130, 131(a), (b), (c), (d), (h) and (i), 131(e) and (f) in so far as they relate to vote of any elector at an election, 132 in so far as it relates to voting in person and 138, shall apply in relation to balloting under this Part subject to the modification that references therein to     LAWS OF GUYANA Representation of the People Cap. 1:03 85  L.R.O. 1/2012                      Modification, etc. of provisions   of Act. [16 of 1985 12 of 1996]                    Over-riding effect of this Part. [16 of 1985]       Place and time of poll. (a)    poll  and  voting  shall  be construed  as references  to balloting under this Part; and  (b)     a poll clerk and presiding officer shall be construed as references to a ballot clerk and ballot attendant respectively.  (2) Subsection (1) shall not be deemed to modify the law relating to any other offences under this Act.  65N. (1) In order to give effect to the right of an elector, who is a member of any of the disciplined forces, to exercise his right to ballot in accordance with the provisions of this Part, and consistently with the interests  of  defence,  public  safety  and  public  order,  the  Elections Commission may by order direct that the provisions of this Act, other than the provisions of this Part, shall apply to, and in relation to, the exercise by members of the disciplined forces of any right they have to vote at an election, with such adaptations, modifications, exceptions or qualifications as may be specified in the order.  (2) An order made under subsection (1) shall be subject to negative resolution of the National Assembly.  65O. The provisions of this Part shall have effect notwithstanding anything contained in any other Part of this Act. PART   VIII THE POLL",
            "description": [
                {
                    "representation": "(d)",
                    "description": "to carry out his functions, or any of them,"
                },
                {
                    "representation": "(1)",
                    "description": "shall be subject to negative resolution of the National Assembly.  65O. The provisions of this Part shall have effect notwithstanding anything contained in any other Part of this Act. PART   VIII THE POLL"
                },
                {
                    "representation": "(2)",
                    "description": "An order made under subsection"
                },
                {
                    "representation": "(a)",
                    "description": "poll  and  voting  shall  be construed  as references  to balloting under this Part; and"
                },
                {
                    "representation": "(b)",
                    "description": "a poll clerk and presiding officer shall be construed as references to a ballot clerk and ballot attendant respectively."
                },
                {
                    "representation": "(c)",
                    "description": "such place or places, as he thinks fit, in each district as balloting place or balloting places.   LAWS OF GUYANA Representation of the People Cap. 1:03 81  L.R.O. 1/2012                   List of electors entitled to vote under  this Part. [16 of 1985 12 of 1996 22 of 1997 15 of 2000]"
                },
                {
                    "representation": "(3)",
                    "description": "The provisions of 62A as they apply in relation to the non- resident electors ballot shall apply mutatis mutandis to voting by the disciplined forces."
                },
                {
                    "representation": "(4)",
                    "description": "[Repealed by Act No. 15 of 2000]  65M."
                },
                {
                    "representation": "(l)",
                    "description": "The Chief Election Officer shall by notification in the Gazette appoint a day on which, and the hours during which, persons entitled to vote under this Part may ballot and different days and hours may be appointed in relation to different balloting places:  Provided that any day appointed under this subsection for balloting shall not be more than ten days earlier than the election day or later than five days before the election day."
                },
                {
                    "representation": "(5)",
                    "description": "Any person whose  name is on a list prepared  by a ballot officer under section 65 J(1) and who desires to vote at an election may exercise his right to ballot under this Part at the balloting place where a list containing his name is displayed under subsection"
                },
                {
                    "representation": "(6)",
                    "description": "Nothing in this Part shall be deemed to prevent any person whose name is included in a list  prepared  under  section  65J(1)  from exercising his right to vote in accordance with any other provision of this Act and not in accordance with this Part:  Provided   that   where   any  such  person   desires   to  vote   in accordance with any other provision of this Act he shall intimate  the ballot officer in relation to such list wherein his name is included, not later than  fifteen days before the day appointed under subsection"
                },
                {
                    "representation": "(7)",
                    "description": "Subject to the provisions of this Part, the provisions of this Act in relation to presiding officers and their functions, polling clerks and their functions, polling places, preparation for poll and polling shall  mutatis LAWS OF GUYANA 84 Cap. 1:03 Representation of the People   L.R.O. 1/2012          Ballot attendant to hand over ballot box to ballot officer.  [16 of 1985 30 of 1990] 15 of 2005]                      Application   of certain provisions relating to penalties to balloting under this Part. [16 of 1985]       mutandis apply respectively to, and in relation to, ballot attendants, ballot clerks, balloting  places, preparation for ballot and balloting  under this Part.  65L."
                },
                {
                    "representation": "(h)",
                    "description": "and"
                },
                {
                    "representation": "(e)",
                    "description": "and"
                },
                {
                    "representation": "(f)",
                    "description": "in so far as they relate to vote of any elector at an election, 132 in so far as it relates to voting in person and 138, shall apply in relation to balloting under this Part subject to the modification that references therein to     LAWS OF GUYANA Representation of the People Cap. 1:03 85  L.R.O. 1/2012                      Modification, etc. of provisions   of Act. [16 of 1985 12 of 1996]                    Over-riding effect of this Part. [16 of 1985]       Place and time of poll."
                }
            ]
        }
    },
    {
        "act": "REPRESENTATION OF THE PEOPLE ACT",
        "source": "https://mola.gov.gy/laws-of-guyana",
        "type": {
            "name": "section",
            "representation": "66",
            "title": "Place and time of poll. ",
            "context": "REPRESENTATION OF THE PEOPLE ACT under Place and time of poll. 66.  The poll shall be taken at each polling place on LAWS OF GUYANA 86 Cap. 1:03 Representation of the People   L.R.O. 1/2012  [Reg. 24/1964]          Appointment of candidate to attend poll.                         Opening of poll. [15 of 2000]        election day  in accordance with this Part during the hours specified in the notice of poll:  Provided that if at the hour of the closing of the poll there are any electors waiting at the polling place to vote, the poll shall remain open for sufficient time to enable those electors to vote.",
            "description": "The poll shall be taken at each polling place on LAWS OF GUYANA 86 Cap. 1:03 Representation of the People   L.R.O. 1/2012  [Reg. 24/1964]          Appointment of candidate to attend poll.                         Opening of poll. [15 of 2000]        election day  in accordance with this Part during the hours specified in the notice of poll:  Provided that if at the hour of the closing of the poll there are any electors waiting at the polling place to vote, the poll shall remain open for sufficient time to enable those electors to vote."
        }
    },
    {
        "act": "REPRESENTATION OF THE PEOPLE ACT",
        "source": "https://mola.gov.gy/laws-of-guyana",
        "type": {
            "name": "section",
            "representation": "67",
            "title": "Appointment of candidate to attend poll. ",
            "context": "REPRESENTATION OF THE PEOPLE ACT under Appointment of candidate to attend poll. 67. (1) The election agent of each group of candidates may appoint one of the candidates, hereinafter in this Part referred to as the duly appointed candidate to attend the poll at a polling place.  (2) Notice  in writing  of the appointment  of a duly appointed candidate, stating his name and address, shall be signed by the election agent and delivered to the returning officer of the district in which the polling place is situate not later than the 7th day before election day.  (3) There shall not be more than one duly appointed candidate of the same list of candidates for any one polling place.  (4) Nothing in this section shall preclude a candidate being a duly appointed candidate for two or more polling places whether or not in the same district.",
            "description": [
                {
                    "representation": "(1)",
                    "description": "The election agent of each group of candidates may appoint one of the candidates, hereinafter in this Part referred to as the duly appointed candidate to attend the poll at a polling place."
                },
                {
                    "representation": "(2)",
                    "description": "Notice  in writing  of the appointment  of a duly appointed candidate, stating his name and address, shall be signed by the election agent and delivered to the returning officer of the district in which the polling place is situate not later than the 7th day before election day."
                },
                {
                    "representation": "(3)",
                    "description": "There shall not be more than one duly appointed candidate of the same list of candidates for any one polling place."
                },
                {
                    "representation": "(4)",
                    "description": "Nothing in this section shall preclude a candidate being a duly appointed candidate for two or more polling places whether or not in the same district."
                }
            ]
        }
    },
    {
        "act": "REPRESENTATION OF THE PEOPLE ACT",
        "source": "https://mola.gov.gy/laws-of-guyana",
        "type": {
            "name": "section",
            "representation": "68",
            "title": "Opening of poll. ",
            "context": "REPRESENTATION OF THE PEOPLE ACT under Opening of poll. 68. At the hour specified in the notice of poll for the opening of the poll the presiding officer, in the presence of such persons, if any, (being persons entitled to enter the polling place) as are present, shall  (a)   open the ballot box and ensure that there are no ballot papers  or  other  papers  therein  and  allow  any    LAWS OF GUYANA Representation of the People Cap. 1:03 87  L.R.O. 1/2012                       Applicant to vote to hand identity paper to poll clerk. [Reg.30/1968  22 of 1997  15 of 2000]                   authorised person present to make an entry in the poll book attesting to this  fact;  (b)   lock  the ballot box, retain the key thereof and place his seal upon the ballot box in such manner as to prevent it being opened without breaking the seal;  (c)    place the ballot box on a table in full view of all present where it shall remain until the poll is closed;  (d)       call upon the electors to vote.",
            "description": [
                {
                    "representation": "(a)",
                    "description": "open the ballot box and ensure that there are no ballot papers  or  other  papers  therein  and  allow  any    LAWS OF GUYANA Representation of the People Cap. 1:03 87  L.R.O. 1/2012                       Applicant to vote to hand identity paper to poll clerk. [Reg.30/1968  22 of 1997  15 of 2000]                   authorised person present to make an entry in the poll book attesting to this  fact;"
                },
                {
                    "representation": "(b)",
                    "description": "lock  the ballot box, retain the key thereof and place his seal upon the ballot box in such manner as to prevent it being opened without breaking the seal;"
                },
                {
                    "representation": "(c)",
                    "description": "place the ballot box on a table in full view of all present where it shall remain until the poll is closed;"
                },
                {
                    "representation": "(d)",
                    "description": "call upon the electors to vote."
                }
            ]
        }
    },
    {
        "act": "REPRESENTATION OF THE PEOPLE ACT",
        "source": "https://mola.gov.gy/laws-of-guyana",
        "type": {
            "name": "section",
            "representation": "69",
            "title": "Applicant to vote to hand identity paper to poll clerk. ",
            "context": "REPRESENTATION OF THE PEOPLE ACT under Applicant to vote to hand identity paper to poll clerk. 69.  (1) Each applicant to vote shall, upon entering the room where the poll is held, and after procuring his identity paper if made available for his procurement at the polling place in pursuance of section 43, state to the poll clerk his name, address and occupation and hand to him   (a)       his  identity paper; and  (b)     if he has been appointed to vote as a proxy on behalf of another elector, the  identity paper of that elector and his notice of appointment to vote as proxy; and  (c)       if he claims to be entitled to vote at the polling place by virtue of section 29(4) his certificate of employment.  (2) The poll clerk shall ascertain if the name of the LAWS OF GUYANA 88 Cap. 1:03 Representation of the People   L.R.O. 1/2012                           Form",
            "description": [
                {
                    "representation": "(1)",
                    "description": "Each applicant to vote shall, upon entering the room where the poll is held, and after procuring his identity paper if made available for his procurement at the polling place in pursuance of section 43, state to the poll clerk his name, address and occupation and hand to him"
                },
                {
                    "representation": "(a)",
                    "description": "his  identity paper; and"
                },
                {
                    "representation": "(b)",
                    "description": "if he has been appointed to vote as a proxy on behalf of another elector, the  identity paper of that elector and his notice of appointment to vote as proxy; and"
                },
                {
                    "representation": "(c)",
                    "description": "if he claims to be entitled to vote at the polling place by virtue of section 29(4) his certificate of employment."
                },
                {
                    "representation": "(2)",
                    "description": "The poll clerk shall ascertain if the name of the LAWS OF GUYANA 88 Cap. 1:03 Representation of the People   L.R.O. 1/2012                           Form"
                }
            ]
        }
    },
    {
        "act": "REPRESENTATION OF THE PEOPLE ACT",
        "source": "https://mola.gov.gy/laws-of-guyana",
        "type": {
            "name": "section",
            "representation": "70",
            "title": "Duty of presiding officer upon application for a ballot paper. ",
            "context": "REPRESENTATION OF THE PEOPLE ACT under Duty of presiding officer upon application for a ballot paper. 70.  (1) Upon receipt of the identity paper and other documents as directed under section 69(5) and upon application  made to him for a ballot paper the presiding officer shall satisfy himself as to following     LAWS OF GUYANA Representation of the People Cap. 1:03 89  L.R.O. 1/2012 15 of 2000 12 of 2006]                                              (a)    that  the  applicant  has not already voted;  (b)    the identity of the applicant and his entitlement to vote at the polling place;  (c)     the authority of the applicant  to vote as a proxy on behalf of another elector (if he applies so to vote).  (2) For  the  purposes  of  subsection  (1)  the  presiding  officer may    (a)    examine  the  applicants  fingers  to ascertain  if there appears on them any stain of electoral ink;  (b)     compare the signature of the applicant with that on his identity papers;  (c)     compare  any  photograph   on  his    identity paper with his face;  (d)   compare  the  thumb print or other finger print recorded on his identity paper with that of the applicant;  (e)       [Repealed by Act No. 22/1997];  (f)     examine his notice of appointment (if any) to vote as a proxy   on   behalf   of   another   elector   and   compare   the particulars in the notice with those LAWS OF GUYANA 90 Cap. 1:03 Representation of the People   L.R.O. 1/2012                                                      recorded in the copy of the list of proxies;  (g)     make  such  further  comparisons   as  are  reasonably necessary between  the particulars  recorded  on his identity paper and those of the applicant;  (h)      require the applicant to take an oath of identity in Form pursuant to section 69(3).  (3) An applicant shall  (a)    comply with any requirement of the presiding officer made pursuant to subsection (2)(h);  (b)     comply with such requirements of the presiding officer for the examination of his fingers, the taking and recording of his thumb or finger print, of his signature and of his height as are reasonably necessary for the purposes of subsection (1);   (c) answer such questions as the presiding officer may ask as are reasonably   necessary   to ask for the aforesaid purposes.                 (4) References in subsection (2) to the identity of any applicant shall  be  construed  to  include  references  to  his  registration  record if available pursuant to any   LAWS OF GUYANA Representation of the People Cap. 1:03 91  L.R.O. 1/2012    Issue of ballot paper to elector. [16 of 1968 Reg. 30/1968 22 of 1997 15 of 2000]                                      direction given under section 40(1)(i).",
            "description": [
                {
                    "representation": "(1)",
                    "description": "the  presiding  officer may"
                },
                {
                    "representation": "(a)",
                    "description": "comply with any requirement of the presiding officer made pursuant to subsection"
                },
                {
                    "representation": "(b)",
                    "description": "comply with such requirements of the presiding officer for the examination of his fingers, the taking and recording of his thumb or finger print, of his signature and of his height as are reasonably necessary for the purposes of subsection"
                },
                {
                    "representation": "(c)",
                    "description": "answer such questions as the presiding officer may ask as are reasonably   necessary   to ask for the aforesaid purposes."
                },
                {
                    "representation": "(2)",
                    "description": "to the identity of any applicant shall  be  construed  to  include  references  to  his  registration  record if available pursuant to any   LAWS OF GUYANA Representation of the People Cap. 1:03 91  L.R.O. 1/2012    Issue of ballot paper to elector. [16 of 1968 Reg. 30/1968 22 of 1997 15 of 2000]                                      direction given under section 40(1)(i)."
                },
                {
                    "representation": "(d)",
                    "description": "compare  the  thumb print or other finger print recorded on his identity paper with that of the applicant;"
                },
                {
                    "representation": "(e)",
                    "description": "[Repealed by Act No. 22/1997];"
                },
                {
                    "representation": "(f)",
                    "description": "examine his notice of appointment"
                },
                {
                    "representation": "(g)",
                    "description": "make  such  further  comparisons   as  are  reasonably necessary between  the particulars  recorded  on his identity paper and those of the applicant;"
                },
                {
                    "representation": "(h)",
                    "description": "require the applicant to take an oath of identity in Form pursuant to section 69(3)."
                },
                {
                    "representation": "(3)",
                    "description": "An applicant shall"
                },
                {
                    "representation": "(4)",
                    "description": "References in subsection"
                }
            ]
        }
    },
    {
        "act": "REPRESENTATION OF THE PEOPLE ACT",
        "source": "https://mola.gov.gy/laws-of-guyana",
        "type": {
            "name": "section",
            "representation": "71",
            "title": "Issue of ballot paper to elector. ",
            "context": "REPRESENTATION OF THE PEOPLE ACT under Issue of ballot paper to elector. 71.  (1) The presiding officer shall refuse to issue a ballot paper to any applicant therefor who does not hand to him his identity paper and other documents as directed under section 69(5) and he shall refuse to issue a ballot paper to any applicant if he is not satisfied as required by section 70(1); but if such identity paper and other documents are handed to him and he is so satisfied he shall  (a)   deliver to the elector a ballot paper stamped with the official mark;  (b)     enter  on the counterfoil of the ballot paper the serial number of the elector on the official list of electors;  (c)     add  to  his copy of the official list of electors or part thereof the name of an elector who has produced to him a certificate of employment;  (d)     place a mark on his copy of the official list of electors, or part thereof, to show that a ballot paper has been delivered to the elector but without showing the particular ballot paper issued;  (e)      return to the elector his identity paper, and also if he has been appointed to vote as proxy on behalf of another elector the  identity  paper of that elector  unless  any such LAWS OF GUYANA 92 Cap. 1:03 Representation of the People   L.R.O. 1/2012                                      Mode of voting. [6 of 1997 15 of 2000]             identity paper has been provided at the polling place in pursuance of section",
            "description": [
                {
                    "representation": "(1)",
                    "description": "The presiding officer shall refuse to issue a ballot paper to any applicant therefor who does not hand to him his identity paper and other documents as directed under section 69(5) and he shall refuse to issue a ballot paper to any applicant if he is not satisfied as required by section 70(1); but if such identity paper and other documents are handed to him and he is so satisfied he shall"
                },
                {
                    "representation": "(a)",
                    "description": "deliver to the elector a ballot paper stamped with the official mark;"
                },
                {
                    "representation": "(b)",
                    "description": "enter  on the counterfoil of the ballot paper the serial number of the elector on the official list of electors;"
                },
                {
                    "representation": "(c)",
                    "description": "add  to  his copy of the official list of electors or part thereof the name of an elector who has produced to him a certificate of employment;"
                },
                {
                    "representation": "(d)",
                    "description": "place a mark on his copy of the official list of electors, or part thereof, to show that a ballot paper has been delivered to the elector but without showing the particular ballot paper issued;"
                },
                {
                    "representation": "(e)",
                    "description": "return to the elector his identity paper, and also if he has been appointed to vote as proxy on behalf of another elector the  identity  paper of that elector  unless  any such LAWS OF GUYANA 92 Cap. 1:03 Representation of the People   L.R.O. 1/2012                                      Mode of voting. [6 of 1997 15 of 2000]             identity paper has been provided at the polling place in pursuance of section"
                }
            ]
        }
    },
    {
        "act": "REPRESENTATION OF THE PEOPLE ACT",
        "source": "https://mola.gov.gy/laws-of-guyana",
        "type": {
            "name": "section",
            "representation": "72",
            "title": "Mode of voting. ",
            "context": "REPRESENTATION OF THE PEOPLE ACT under Mode of voting. 72.  (1) The presiding officer shall by demonstration by the use of a specimen ballot paper ensure that the elector understands how and where to place his mark (without indicating that the elector should vote for any particular list of candidates) and how to fold the ballot paper and shall direct him to return with it when marked, folded as shown.  (2) The elector shall enter one of the polling compartments and there record his vote by secretly  marking his ballot paper within the space opposite the name and symbol of the list of candidates for whom he   LAWS OF GUYANA Representation of the People Cap. 1:03 93  L.R.O. 1/2012                                                wishes to vote and shall then fold his ballot paper so as to conceal the vote; and if he has been appointed to vote as a proxy he shall record the vote of the elector on whose behalf he has been so appointed, for the list of candidates for whom that elector wishes to vote by secretly marking, in the manner aforesaid, the ballot paper issued to him for that elector and shall then similarly fold that ballot paper.  (3) The elector shall, having recorded his vote (and if such be the case that of an elector for whom he has been appointed a proxy), show the  folded ballot  paper  (or papers)  to the presiding  officer  so as to disclose  the official  mark appearing  on the reverse  thereof  and shall place it (or  them) so folded in the ballot  box in the presence  of the presiding  officer:  Provided  that  the  presiding  officer  shall  not  permit  any elector whether voting on his own behalf or as a proxy on behalf of another elector to put a ballot paper in the ballot box unless, immediately before he  does  so, one of his fingers  has been  stained  by immersion  in a container of electoral ink.  (4) Notwithstanding  the  proviso  to subsection  (3),  where  the presiding officer is satisfied that an elector is suffering from an injury to any finger of such a nature as to render it undesirable for that finger to be stained with electoral ink, he shall not require that finger to be stained but shall stain another finger.  (5) If  an  elector  fails  or  refuses  to  comply  with  a  lawful requirement of the presiding officer for the staining of one of his fingers, the  presiding officer shall order him to return to him any ballot paper issued to him and to leave the polling place forthwith; and the presiding LAWS OF GUYANA 94 Cap. 1:03 Representation of the People   L.R.O. 1/2012                                                Form",
            "description": [
                {
                    "representation": "(1)",
                    "description": "The presiding officer shall by demonstration by the use of a specimen ballot paper ensure that the elector understands how and where to place his mark"
                },
                {
                    "representation": "(2)",
                    "description": "The elector shall enter one of the polling compartments and there record his vote by secretly  marking his ballot paper within the space opposite the name and symbol of the list of candidates for whom he   LAWS OF GUYANA Representation of the People Cap. 1:03 93  L.R.O. 1/2012                                                wishes to vote and shall then fold his ballot paper so as to conceal the vote; and if he has been appointed to vote as a proxy he shall record the vote of the elector on whose behalf he has been so appointed, for the list of candidates for whom that elector wishes to vote by secretly marking, in the manner aforesaid, the ballot paper issued to him for that elector and shall then similarly fold that ballot paper."
                },
                {
                    "representation": "(3)",
                    "description": "The elector shall, having recorded his vote"
                },
                {
                    "representation": "(4)",
                    "description": "Notwithstanding  the  proviso  to subsection"
                },
                {
                    "representation": "(5)",
                    "description": "If  an  elector  fails  or  refuses  to  comply  with  a  lawful requirement of the presiding officer for the staining of one of his fingers, the  presiding officer shall order him to return to him any ballot paper issued to him and to leave the polling place forthwith; and the presiding LAWS OF GUYANA 94 Cap. 1:03 Representation of the People   L.R.O. 1/2012                                                Form"
                }
            ]
        }
    },
    {
        "act": "REPRESENTATION OF THE PEOPLE ACT",
        "source": "https://mola.gov.gy/laws-of-guyana",
        "type": {
            "name": "section",
            "representation": "73",
            "title": "Blind and incapacitated electors. ",
            "context": "REPRESENTATION OF THE PEOPLE ACT under Blind and incapacitated electors. 73. (1) The presiding officer shall, on the application of any elector who is incapacitated by blindness or other physical cause from voting in the manner prescribed by section 72 and who takes an oath in Form 21, mark the ballot paper of such elector in his presence and in the manner directed by him.   (2) The  presiding  officer  may,  at  the  request  of  any  elector incapacitated in the manner prescribed in subsection (1) and who has taken the oath in Form 21 and is accompanied by a friend who has taken the oath in Form 22, permit such friend, if he is an elector entitled to vote at the polling place, immediately after he has voted on his own behalf, and notwithstanding that his finger has been immersed in electoral ink, to  accompany the elector  into the voting compartment  and mark his ballot paper for him:  Provided that no person may mark the ballot paper of more than one elector as his friend under this subsection or mark such ballot paper unless he first takes an oath in the form prescribed.  (3) Whenever the ballot paper of an elector has been marked in accordance with this section, the poll clerk shall enter in the poll book opposite the name of the elector the fact that the ballot paper was so marked, the reason therefor and, if marked by a friend, the name and the number in the official list of electors of that friend.   LAWS OF GUYANA 96 Cap. 1:03 Representation of the People   L.R.O. 1/2012  Tendered  ballot papers.  [16 of 1968 22 of 1997 15 of 2000]                                              Presiding officer to accept other identification in certain circumstances. [22 of 1997",
            "description": [
                {
                    "representation": "(1)",
                    "description": "and who has taken the oath in Form 21 and is accompanied by a friend who has taken the oath in Form 22, permit such friend, if he is an elector entitled to vote at the polling place, immediately after he has voted on his own behalf, and notwithstanding that his finger has been immersed in electoral ink, to  accompany the elector  into the voting compartment  and mark his ballot paper for him:  Provided that no person may mark the ballot paper of more than one elector as his friend under this subsection or mark such ballot paper unless he first takes an oath in the form prescribed."
                },
                {
                    "representation": "(2)",
                    "description": "The  presiding  officer  may,  at  the  request  of  any  elector incapacitated in the manner prescribed in subsection"
                },
                {
                    "representation": "(3)",
                    "description": "Whenever the ballot paper of an elector has been marked in accordance with this section, the poll clerk shall enter in the poll book opposite the name of the elector the fact that the ballot paper was so marked, the reason therefor and, if marked by a friend, the name and the number in the official list of electors of that friend.   LAWS OF GUYANA 96 Cap. 1:03 Representation of the People   L.R.O. 1/2012  Tendered  ballot papers.  [16 of 1968 22 of 1997 15 of 2000]                                              Presiding officer to accept other identification in certain circumstances. [22 of 1997"
                }
            ]
        }
    },
    {
        "act": "REPRESENTATION OF THE PEOPLE ACT",
        "source": "https://mola.gov.gy/laws-of-guyana",
        "type": {
            "name": "section",
            "representation": "74",
            "title": "Tendered ballot papers. 74A.   [74A repealed by Act No. 15 of 2000] ",
            "context": "REPRESENTATION OF THE PEOPLE ACT under Tendered ballot papers. 74A.   [74A repealed by Act No. 15 of 2000] 74.  (1) If an applicant to vote represents himself to be an elector whose name appears on the official list of electors or part thereof for a polling place and there has already been placed a mark against the name of such elector on the presiding officers copy of such list or part thereof, the presiding officer shall issue to such applicant a tendered ballot paper if  (a)      the applicant hands to him his identity paper;  (b)   the  applicant  takes  an oath  of  identity  in the  form prescribed; and  (c)     the presiding officer is satisfied as to the matters set out in section 70(1).  (2) A tendered ballot paper shall not be put in the ballot box but shall be given to the presiding officer and endorsed by him with the name of the elector and his number in the official list of electors; and the tendered ballot paper shall be set aside in a separate packet and shall not be counted by the returning officer.  (3) The poll clerk shall enter in the poll book the name of every elector to whom a tendered ballot paper is given and a note of his having marked such a ballot paper.  74A. [74A  repealed by Act No. 15 of 2000]",
            "description": [
                {
                    "representation": "(1)",
                    "description": "If an applicant to vote represents himself to be an elector whose name appears on the official list of electors or part thereof for a polling place and there has already been placed a mark against the name of such elector on the presiding officers copy of such list or part thereof, the presiding officer shall issue to such applicant a tendered ballot paper if"
                },
                {
                    "representation": "(a)",
                    "description": "the applicant hands to him his identity paper;"
                },
                {
                    "representation": "(b)",
                    "description": "the  applicant  takes  an oath  of  identity  in the  form prescribed; and"
                },
                {
                    "representation": "(c)",
                    "description": "the presiding officer is satisfied as to the matters set out in section 70(1)."
                },
                {
                    "representation": "(2)",
                    "description": "A tendered ballot paper shall not be put in the ballot box but shall be given to the presiding officer and endorsed by him with the name of the elector and his number in the official list of electors; and the tendered ballot paper shall be set aside in a separate packet and shall not be counted by the returning officer."
                },
                {
                    "representation": "(3)",
                    "description": "The poll clerk shall enter in the poll book the name of every elector to whom a tendered ballot paper is given and a note of his having marked such a ballot paper.  74A. [74A  repealed by Act No. 15 of 2000]"
                }
            ]
        }
    },
    {
        "act": "REPRESENTATION OF THE PEOPLE ACT",
        "source": "https://mola.gov.gy/laws-of-guyana",
        "type": {
            "name": "section",
            "representation": "75",
            "title": "Presiding officer to accept other identification in certain circumstances. ",
            "context": "REPRESENTATION OF THE PEOPLE ACT under Presiding officer to accept other identification in certain circumstances. 75.  The presiding officer shall, in the event of his needing to be satisfied of the identity of any elector whose name is on the official list of   electors accept in lieu of the prescribed identity paper such other identification as is authorised by the Commission and entailing the same   LAWS OF GUYANA Representation of the People Cap. 1:03 97  L.R.O. 1/2012 15 of 2000]           Entries in poll book.                      Maintenance of secrecy at polling   place.  [6 of 1997]              stringency for its generation as to leave no doubt as to its authenticity as in the case of the identity paper and permit an elector to vote in the same manner as if his identity paper had been produced.",
            "description": "The presiding officer shall, in the event of his needing to be satisfied of the identity of any elector whose name is on the official list of   electors accept in lieu of the prescribed identity paper such other identification as is authorised by the Commission and entailing the same   LAWS OF GUYANA Representation of the People Cap. 1:03 97  L.R.O. 1/2012 15 of 2000]           Entries in poll book.                      Maintenance of secrecy at polling   place.  [6 of 1997]              stringency for its generation as to leave no doubt as to its authenticity as in the case of the identity paper and permit an elector to vote in the same manner as if his identity paper had been produced."
        }
    },
    {
        "act": "REPRESENTATION OF THE PEOPLE ACT",
        "source": "https://mola.gov.gy/laws-of-guyana",
        "type": {
            "name": "section",
            "representation": "76",
            "title": "Entries in poll book. ",
            "context": "REPRESENTATION OF THE PEOPLE ACT under Entries in poll book. 76.  The poll clerk shall  (a)     make in the poll book such entries as are required by this Act or directed by the presiding officer;  (b)  enter in the poll book the word SWORN opposite the name of each elector to whom any oath is administered and REFUSED TO BE SWORN or REFUSED TO ANSWER opposite the name of each elector who has refused to take an oath or who has refused to answer any question when legally so required.",
            "description": [
                {
                    "representation": "(a)",
                    "description": "make in the poll book such entries as are required by this Act or directed by the presiding officer;"
                },
                {
                    "representation": "(b)",
                    "description": "enter in the poll book the word SWORN opposite the name of each elector to whom any oath is administered and REFUSED TO BE SWORN or REFUSED TO ANSWER opposite the name of each elector who has refused to take an oath or who has refused to answer any question when legally so required."
                }
            ]
        }
    },
    {
        "act": "REPRESENTATION OF THE PEOPLE ACT",
        "source": "https://mola.gov.gy/laws-of-guyana",
        "type": {
            "name": "section",
            "representation": "77",
            "title": "Maintenance of secrecy at polling-place. ",
            "context": "REPRESENTATION OF THE PEOPLE ACT under Maintenance of secrecy at polling-place. 77.  (1) Every  person  specified  in  section  79(1)(b)  attending  the polling place shall maintain and aid in maintaining  the secrecy of the voting  and  shall   not,  except   for  a  purpose   authorised   by  law, communicate to any person before the poll is closed any information as to (a)      the name of any elector who has or has not applied for a ballot paper or voted whether on his own behalf or as a proxy on behalf of another elector;  (b)    the  number  in  the  official list of electors of any elector who, or whose LAWS OF GUYANA 98 Cap. 1:03 Representation of the People   L.R.O. 1/2012                                                 proxy on his behalf, has or has not applied for a ballot paper or voted;  (c)      the official mark.   (2) No person shall  (a)     except in the performance of his duty under this Act interfere  with or attempt  to interfere  with an elector when casting his vote or, as a proxy, that of another elector;  (b)     obtain or attempt to obtain in a polling place information as to the list of candidates for whom an elector in that polling place is about to vote or has voted either on his own behalf or as a proxy on behalf of another elector;  (c)      communicate at any time to any person any information obtained in a polling place as to the list of candidates for whom an elector in that polling place is about to vote or has voted either on his own behalf or as a proxy on behalf of another elector;  (d)     directly or indirectly induce an elector to display his ballot paper or that of another elector for whom he has voted as a proxy after he has marked it, so as to make known the list of   LAWS OF GUYANA Representation of the People Cap. 1:03 99  L.R.O. 1/2012                        Molestation   of electors. [6 of 1997]                     Obstruction. [Reg. 13/1973 6 of 1997]      candidates for whom he has or has not voted either on his own behalf or on behalf of an elector for whom he has voted as a proxy.  (3) No person having undertaken to assist an elector incapacitated by blindness or other physical   cause   to vote shall communicate at any time to any person any information as to the list of candidates for whom that elector intends to vote or has voted.  (4) Any person who contravenes any of the provisions of this section shall be liable on summary conviction to a fine of sixty-five thousand dollars and to imprisonment for six months.",
            "description": [
                {
                    "representation": "(1)",
                    "description": "Every  person  specified  in  section  79(1)(b)  attending  the polling place shall maintain and aid in maintaining  the secrecy of the voting  and  shall   not,  except   for  a  purpose   authorised   by  law, communicate to any person before the poll is closed any information as to"
                },
                {
                    "representation": "(a)",
                    "description": "except in the performance of his duty under this Act interfere  with or attempt  to interfere  with an elector when casting his vote or, as a proxy, that of another elector;"
                },
                {
                    "representation": "(b)",
                    "description": "obtain or attempt to obtain in a polling place information as to the list of candidates for whom an elector in that polling place is about to vote or has voted either on his own behalf or as a proxy on behalf of another elector;"
                },
                {
                    "representation": "(c)",
                    "description": "communicate at any time to any person any information obtained in a polling place as to the list of candidates for whom an elector in that polling place is about to vote or has voted either on his own behalf or as a proxy on behalf of another elector;"
                },
                {
                    "representation": "(2)",
                    "description": "No person shall"
                },
                {
                    "representation": "(d)",
                    "description": "directly or indirectly induce an elector to display his ballot paper or that of another elector for whom he has voted as a proxy after he has marked it, so as to make known the list of   LAWS OF GUYANA Representation of the People Cap. 1:03 99  L.R.O. 1/2012                        Molestation   of electors. [6 of 1997]                     Obstruction. [Reg. 13/1973 6 of 1997]      candidates for whom he has or has not voted either on his own behalf or on behalf of an elector for whom he has voted as a proxy."
                },
                {
                    "representation": "(3)",
                    "description": "No person having undertaken to assist an elector incapacitated by blindness or other physical   cause   to vote shall communicate at any time to any person any information as to the list of candidates for whom that elector intends to vote or has voted."
                },
                {
                    "representation": "(4)",
                    "description": "Any person who contravenes any of the provisions of this section shall be liable on summary conviction to a fine of sixty-five thousand dollars and to imprisonment for six months."
                }
            ]
        }
    },
    {
        "act": "REPRESENTATION OF THE PEOPLE ACT",
        "source": "https://mola.gov.gy/laws-of-guyana",
        "type": {
            "name": "section",
            "representation": "78",
            "title": "Molestation of electors. 78A.   Obstruction.    65G.       Definitions. LAWS OF GUYANA Representation of the People Cap. 1:03 7  L.R.O. 1/2012              SECTION ",
            "context": "REPRESENTATION OF THE PEOPLE ACT under Molestation of electors. 78A.   Obstruction.    65G.       Definitions. LAWS OF GUYANA Representation of the People Cap. 1:03 7  L.R.O. 1/2012              SECTION 78.  (1) No person shall anywhere within a distance of two hundred yards of a polling place annoy, molest or otherwise interfere with an elector or attempt to obtain any information as to the list of candidates for whom any elector in the polling place is about to vote or has voted either on his own behalf or as a proxy on behalf of another elector.                (2) Any person who contravenes any of the provisions of this section shall be liable on summary conviction to a fine of sixty-five thousand dollars and to imprisonment for six months.  78A.  (1) Any  person  who,  without  due  authority,  obstructs,  or otherwise  interferes  with  (a)   access  to, or egress from, a polling place;  LAWS OF GUYANA 100 Cap. 1:03 Representation of the People   L.R.O. 1/2012                                            Preservation of order. Reg. 37/1964 [16 of 1968 O. 68/1980 12 of 1996 (b)      the voting at an election by any person registered as an elector;  (c)   the  conveyance  of  documents,  supplies  and  other material pertaining to an election, including ballot boxes and ballot papers;  (d)   the counting of the votes cast at an election; or  (e)      an  election  officer  in  the  exercise  of  any  function conferred upon him by this Act,  shall be liable on summary conviction to a fine of sixty-five thousand dollars together with imprisonment for a term of one year and shall, in addition, be incapable  during a period of five years from the date of conviction  (i)       of being registered as an elector; and (ii)     of being  elected  as  a  member  of  the  National Assembly.  (2) Section 128(2), as the same applies in relation to a person convicted of an illegal practice, applies mutatis mutandis in relation to a person convicted of an offence under this section.",
            "description": [
                {
                    "representation": "(1)",
                    "description": "Any  person  who,  without  due  authority,  obstructs,  or otherwise  interferes  with"
                },
                {
                    "representation": "(2)",
                    "description": "Section 128(2), as the same applies in relation to a person convicted of an illegal practice, applies mutatis mutandis in relation to a person convicted of an offence under this section."
                },
                {
                    "representation": "(a)",
                    "description": "access  to, or egress from, a polling place;  LAWS OF GUYANA 100 Cap. 1:03 Representation of the People   L.R.O. 1/2012                                            Preservation of order. Reg. 37/1964 [16 of 1968 O. 68/1980 12 of 1996"
                },
                {
                    "representation": "(b)",
                    "description": "the voting at an election by any person registered as an elector;"
                },
                {
                    "representation": "(c)",
                    "description": "the  conveyance  of  documents,  supplies  and  other material pertaining to an election, including ballot boxes and ballot papers;"
                },
                {
                    "representation": "(d)",
                    "description": "the counting of the votes cast at an election; or"
                },
                {
                    "representation": "(e)",
                    "description": "an  election  officer  in  the  exercise  of  any  function conferred upon him by this Act,  shall be liable on summary conviction to a fine of sixty-five thousand dollars together with imprisonment for a term of one year and shall, in addition, be incapable  during a period of five years from the date of conviction"
                },
                {
                    "representation": "(i)",
                    "description": "of being registered as an elector; and"
                }
            ]
        }
    },
    {
        "act": "REPRESENTATION OF THE PEOPLE ACT",
        "source": "https://mola.gov.gy/laws-of-guyana",
        "type": {
            "name": "section",
            "representation": "79",
            "title": "Preservation of order. ",
            "context": "REPRESENTATION OF THE PEOPLE ACT under Preservation of order. 79. (1) The presiding officer may, for the purpose of maintaining order at the polling place  (a)     regulate the admission of electors and may, if he deems it  advisable, direct   LAWS OF GUYANA Representation of the People Cap. 1:03 101  L.R.O. 1/2012 15 of 2000 12 of 2006]                                              that not more than one elector for each compartment shall at the same time enter the room where the poll is held;  (b)     exclude all other persons except  (i)        members of the Commission;   (ii)      election  officers; (iii)     duly appointed candidates; (iv)   polling agents for the polling    place; (v)     members of the Police Force, the Guyana Defence Force; (vi)     election  agents; (vii)    assistant  agents  for the district in which the polling place is situate;  (c)   issue such  directions  as may be necessary  for  such purpose.  (2) If any person (whether entitled to enter or not) misconducts himself  at  a  polling  place  or  fails  to  obey  any  lawful  direction, requirement or order of the presiding officer, whether given or made under this or any other section, he may immediately,  by order of the presiding  officer,  be removed  therefrom  by a member  of the Police Force or by any other person authorised  in writing by the presiding officer to remove him, and the person so removed shall not, without the permission  of  the  presiding  officer,  again  enter  the  polling  place  on election day:  Provided that the powers conferred by this LAWS OF GUYANA 102 Cap. 1:03 Representation of the People   L.R.O. 1/2012                 Closing of spirit   shops.  [6 of 1997] c. 82:21           c. 83:26                            Employers   to allow employees period for subsection shall not be so exercised as to prevent an elector entitled to vote at a polling place having an opportunity to vote thereat.  (3) Any person removed from a polling place under subsection (2) may, if charged with the commission of an offence at or anywhere within a distance of two hundred yards of the polling place, be dealt with as a person taken into custody by a police officer for an offence without warrant.",
            "description": [
                {
                    "representation": "(1)",
                    "description": "The presiding officer may, for the purpose of maintaining order at the polling place"
                },
                {
                    "representation": "(a)",
                    "description": "regulate the admission of electors and may, if he deems it  advisable, direct   LAWS OF GUYANA Representation of the People Cap. 1:03 101  L.R.O. 1/2012 15 of 2000 12 of 2006]                                              that not more than one elector for each compartment shall at the same time enter the room where the poll is held;"
                },
                {
                    "representation": "(b)",
                    "description": "exclude all other persons except"
                },
                {
                    "representation": "(i)",
                    "description": "members of the Commission;"
                },
                {
                    "representation": "(v)",
                    "description": "members of the Police Force, the Guyana Defence Force;"
                },
                {
                    "representation": "(c)",
                    "description": "issue such  directions  as may be necessary  for  such purpose."
                },
                {
                    "representation": "(2)",
                    "description": "may, if charged with the commission of an offence at or anywhere within a distance of two hundred yards of the polling place, be dealt with as a person taken into custody by a police officer for an offence without warrant."
                },
                {
                    "representation": "(3)",
                    "description": "Any person removed from a polling place under subsection"
                }
            ]
        }
    },
    {
        "act": "REPRESENTATION OF THE PEOPLE ACT",
        "source": "https://mola.gov.gy/laws-of-guyana",
        "type": {
            "name": "section",
            "representation": "80",
            "title": "Closing of spirit shops. ",
            "context": "REPRESENTATION OF THE PEOPLE ACT under Closing of spirit shops. 80. (1) All premises to which spirit shop licences, off licences and railway  station   or  stelling   licences   have   been   issued   under   the Intoxicating  Liquor Licensing  Act shall be closed and kept closed on election day.   (2) No intoxicating liquor shall be sold, offered for sale, or given away at any premises to which a licence issued under the Intoxicating Liquor Licensing Act applies, at any time between the opening of and the closing of the poll on election day.  (3) No intoxicating liquor shall be supplied to any person at any premises to which a licence issued under the Registration of Clubs Act applies at any time between the opening of and the closing of the poll on election day.  (4) Any person who contravenes any of the provisions of this section shall be liable on summary conviction to a fine of sixty-five thousand dollars and to imprisonment for six months.",
            "description": [
                {
                    "representation": "(1)",
                    "description": "All premises to which spirit shop licences, off licences and railway  station   or  stelling   licences   have   been   issued   under   the Intoxicating  Liquor Licensing  Act shall be closed and kept closed on election day."
                },
                {
                    "representation": "(2)",
                    "description": "No intoxicating liquor shall be sold, offered for sale, or given away at any premises to which a licence issued under the Intoxicating Liquor Licensing Act applies, at any time between the opening of and the closing of the poll on election day."
                },
                {
                    "representation": "(3)",
                    "description": "No intoxicating liquor shall be supplied to any person at any premises to which a licence issued under the Registration of Clubs Act applies at any time between the opening of and the closing of the poll on election day."
                },
                {
                    "representation": "(4)",
                    "description": "Any person who contravenes any of the provisions of this section shall be liable on summary conviction to a fine of sixty-five thousand dollars and to imprisonment for six months."
                }
            ]
        }
    },
    {
        "act": "REPRESENTATION OF THE PEOPLE ACT",
        "source": "https://mola.gov.gy/laws-of-guyana",
        "type": {
            "name": "section",
            "representation": "81",
            "title": "Employers to allow employees period for voting. ",
            "context": "REPRESENTATION OF THE PEOPLE ACT under Employers to allow employees period for voting. 81.",
            "description": "81."
        }
    },
    {
        "act": "REPRESENTATION OF THE PEOPLE ACT",
        "source": "https://mola.gov.gy/laws-of-guyana",
        "type": {
            "name": "section",
            "representation": "82",
            "title": "Penalty for breach of section ",
            "context": "REPRESENTATION OF THE PEOPLE ACT under Penalty for breach of section 82. Any employer  who, directly  or indirectly,  refuses or who by intimidation,  undue influence or in any other way interferes with the granting to any elector in his employ of the period for voting prescribed by section 81, shall on summary conviction be liable to a fine of thirty- two thousand five hundred dollars or to imprisonment for six months.",
            "description": "Any employer  who, directly  or indirectly,  refuses or who by intimidation,  undue influence or in any other way interferes with the granting to any elector in his employ of the period for voting prescribed by section 81, shall on summary conviction be liable to a fine of thirty- two thousand five hundred dollars or to imprisonment for six months."
        }
    },
    {
        "act": "REPRESENTATION OF THE PEOPLE ACT",
        "source": "https://mola.gov.gy/laws-of-guyana",
        "type": {
            "name": "section",
            "representation": "83",
            "title": "Procedure on closing of poll. 83A.   Accompanying ballot boxes.   PART IX COUNTING OF VOTES POLLED  ",
            "context": "REPRESENTATION OF THE PEOPLE ACT under Procedure on closing of poll. 83A.   Accompanying ballot boxes.   PART IX COUNTING OF VOTES POLLED  83.  (1) The presiding officer, as soon as practicable after the closing of the poll, in the presence of such of the persons entitled under section 79(1) (b) to be present, as attend shall  (a)   count the number of spoiled ballot papers and tendered ballot  papers,  if  any,  and  place  them  in  separate  special envelopes  supplied  for  that  purpose,  indicate  thereon  the number of the spoiled ballot papers LAWS OF GUYANA 104 Cap. 1:03 Representation of the People   L.R.O. 1/2012                                                 and tendered ballot papers and seal the envelopes;  (b)     count the used tendered ballot papers without unfolding them and place them back in the special envelope supplied for that  purpose,  indicate  thereon  the  number  of  the  used tendered ballot papers and seal the envelope;  (c)      count  the  unused  ballot  papers  and  tendered  ballot papers,  undetached  from  the  books  of  ballot  papers  and tendered ballot papers, place them with the counterfoils of all used  ballot  papers  and  tendered  ballot  papers  in separate special envelopes supplied for that purpose, indicate thereon the number of unused ballot papers and tendered ballot papers and seal the envelopes;  (d)      check the number of ballot papers and tendered ballot papers supplied by the returning officer against the number of spoiled ballot papers and tendered ballot papers, if any, the number of unused ballot papers and tendered ballot papers and the number of destroyed ballot papers and tendered ballot papers,  as  recorded  in the  poll  book,  and  the  number  of electors who voted at the polling place as reflected from the   LAWS OF GUYANA Representation of the People Cap. 1:03 105  L.R.O. 1/2012                                                counterfoils of the ballot papers and tendered ballot papers issued at the polling place, in order to ascertain that all ballot papers are accounted for;  (e)    record  the  number  of ballot papers and tendered ballot  papers received  by the presiding officer, issued to electors, unused, and spoiled, in the ballot paper account and tendered ballot paper account in Form 23;  (f)   open the ballot box and empty its contents upon a table;  (g)     distribute tally sheets to the assistant presiding officer, the poll clerk and the duly appointed candidates and polling agents  present;  (h)     count and record the number of ballot papers that were in the ballot box;   (i)     sort out the ballot papers on the basis of lists for which the votes have been cast; and  (j)      count  the  number  of  votes  recorded  for  each  list  of candidates on his tally sheet, giving full opportunity for those present to examine each ballot paper.  (2) Subject to the provisions of this section, section LAWS OF GUYANA 106 Cap. 1:03 Representation of the People   L.R.O. 1/2012                                                 87 shall mutatis mutandis apply to the counting of votes under subsection (1).  (3) In counting the votes the presiding officer shall, wherever his decision on a ballot paper is questioned, record the fact by writing the letter Q at the back of the ballot paper and appending his initials.  (4) The decision  of the presiding  officer  as to the  validity  or otherwise of  a  ballot  paper  shall  be  final  subject  to  review  by the returning  officer.  (5) The presiding officer shall place the ballot papers cast for each list of candidates and counted under this section in a separate envelope, whether or not any such ballot paper is a questioned ballot paper.  (6) All rejected ballot papers shall be placed in a separate envelope by the presiding officer.  (7) The envelopes referred to in subsections (5) and (6) shall be endorsed as to indicate their contents and shall be sealed by the presiding officer and the number of any questioned ballot papers and the total number of ballot papers contained in the envelopes shall be indicated on their outside.  (8) The  presiding  officer  shall  affix  his seal  to the  envelopes referred to in the preceding subsections and shall invite such of the duly appointed candidates and the polling agents as are present to do likewise.  (9) After the completion  of the counting,  the presiding  officer shall  complete  the  ballot  paper  account  and  tendered  ballot  paper account in Form 23, the   LAWS OF GUYANA Representation of the People Cap. 1:03 107  L.R.O. 1/2012                                                Statement of Poll in Form 23A, and prepare and certify a sufficient  number of copies of the same for distribution  as follows (a)      to the returning officer;  (b)      to the assistant presiding officer;  (c)  to  such of the duly appointed candidates or the polling agents as are present;  (d)      to the Chief Election Officer.  (9A) The statement  of poll prepared in accordance with subsection (9) shall be posted in a conspicuous place outside the polling place as conclusive evidence of the result of the election for that polling place unless there is a recount of the votes.  (10) The presiding officer shall then  (a)    place the sealed envelope containing the counted and rejected ballot papers in the ballot box, and secure and seal, with his seal and with the seals of such of the duly appointed candidates and polling agents as desire to affix their seals, to the ballot box in such manner that it cannot be opened and that nothing can be inserted therein or taken therefrom without breaking the seals; and (b)   make  up  in separate packets, the marked copies of the official list of electors or part thereof, notices of LAWS OF GUYANA 108 Cap. 1:03 Representation of the People   L.R.O. 1/2012                                             Accompanying         ballot boxes.    [30 of 1990]  appointments to vote as proxy and copies of the lists of proxies, the poll book, the ballot paper account and tendered ballot paper account and such other election documents as may be decided upon by the Commission, and seal the packets with his seal and with the seals of such of the duly appointed candidates and polling agents as are present and desire to affix their seals; and  (c)      deliver   the sealed   ballot   box,   the sealed packets referred to in paragraph (b), and together with an envelope containing the key of the ballot box and a Statement of the Poll in Form 23A placed in one envelope sealed in the manner referred to in paragraph (b), to the returning officer of the district in which the polling place is situated.  (11) A presiding officer may in writing delegate all or any of his functions  under  this  section  to  a  counting  assistant  and  where  any function of a presiding officer is delegated  to a counting assistant, in respect  of  the  function  so  delegated   references  in  the  preceding subsections to the presiding officer of a polling place shall be deemed to be references to the counting assistant of the same polling place.  83A. (1) Subject to the availability of space in the conveyance carrying ballot boxes from polling places for delivery to a returning officer, the polling agents or the   LAWS OF GUYANA Representation of the People Cap. 1:03 109  L.R.O. 1/2012                                    Counting of votes. [Reg. 30/1968 31 of 1968 30 of 1990 3 of 1991 12 of 2006]           duly appointed candidates  for the polling places, who are desirous of accompanying the ballot boxes, may travel in such conveyance:  Provided that where the conveyance carrying the ballot boxes can accommodate only one or some of the polling agents or duly appointed candidates for a polling place, desirous of accompanying the ballot boxes from that polling place, the polling agent or agents or duly appointed candidate or candidates who shall accompany the ballot boxes shall be determined by the majority of the polling agents and duly appointed candidates for the polling place.  (2) Nothing in this section shall be deemed to affect the right of any polling agent or duly appointed candidate for a polling place to follow, in a separate conveyance, a conveyance carrying ballot boxes from the polling place for delivery to a returning officer.  PART  IX COUNTING  OF  VOTES  POLLED",
            "description": [
                {
                    "representation": "(1)",
                    "description": "Subject to the availability of space in the conveyance carrying ballot boxes from polling places for delivery to a returning officer, the polling agents or the   LAWS OF GUYANA Representation of the People Cap. 1:03 109  L.R.O. 1/2012                                    Counting of votes. [Reg. 30/1968 31 of 1968 30 of 1990 3 of 1991 12 of 2006]           duly appointed candidates  for the polling places, who are desirous of accompanying the ballot boxes, may travel in such conveyance:  Provided that where the conveyance carrying the ballot boxes can accommodate only one or some of the polling agents or duly appointed candidates for a polling place, desirous of accompanying the ballot boxes from that polling place, the polling agent or agents or duly appointed candidate or candidates who shall accompany the ballot boxes shall be determined by the majority of the polling agents and duly appointed candidates for the polling place."
                },
                {
                    "representation": "(b)",
                    "description": "make  up  in separate packets, the marked copies of the official list of electors or part thereof, notices of LAWS OF GUYANA 108 Cap. 1:03 Representation of the People   L.R.O. 1/2012                                             Accompanying         ballot boxes.    [30 of 1990]  appointments to vote as proxy and copies of the lists of proxies, the poll book, the ballot paper account and tendered ballot paper account and such other election documents as may be decided upon by the Commission, and seal the packets with his seal and with the seals of such of the duly appointed candidates and polling agents as are present and desire to affix their seals; and"
                },
                {
                    "representation": "(a)",
                    "description": "place the sealed envelope containing the counted and rejected ballot papers in the ballot box, and secure and seal, with his seal and with the seals of such of the duly appointed candidates and polling agents as desire to affix their seals, to the ballot box in such manner that it cannot be opened and that nothing can be inserted therein or taken therefrom without breaking the seals; and"
                },
                {
                    "representation": "(c)",
                    "description": "deliver   the sealed   ballot   box,   the sealed packets referred to in paragraph"
                },
                {
                    "representation": "(d)",
                    "description": "to the Chief Election Officer."
                },
                {
                    "representation": "(e)",
                    "description": "record  the  number  of ballot papers and tendered ballot  papers received  by the presiding officer, issued to electors, unused, and spoiled, in the ballot paper account and tendered ballot paper account in Form 23;"
                },
                {
                    "representation": "(f)",
                    "description": "open the ballot box and empty its contents upon a table;"
                },
                {
                    "representation": "(g)",
                    "description": "distribute tally sheets to the assistant presiding officer, the poll clerk and the duly appointed candidates and polling agents  present;"
                },
                {
                    "representation": "(h)",
                    "description": "count and record the number of ballot papers that were in the ballot box;"
                },
                {
                    "representation": "(i)",
                    "description": "sort out the ballot papers on the basis of lists for which the votes have been cast; and"
                },
                {
                    "representation": "(j)",
                    "description": "count  the  number  of  votes  recorded  for  each  list  of candidates on his tally sheet, giving full opportunity for those present to examine each ballot paper."
                },
                {
                    "representation": "(2)",
                    "description": "Nothing in this section shall be deemed to affect the right of any polling agent or duly appointed candidate for a polling place to follow, in a separate conveyance, a conveyance carrying ballot boxes from the polling place for delivery to a returning officer.  PART  IX COUNTING  OF  VOTES  POLLED"
                },
                {
                    "representation": "(3)",
                    "description": "In counting the votes the presiding officer shall, wherever his decision on a ballot paper is questioned, record the fact by writing the letter Q at the back of the ballot paper and appending his initials."
                },
                {
                    "representation": "(4)",
                    "description": "The decision  of the presiding  officer  as to the  validity  or otherwise of  a  ballot  paper  shall  be  final  subject  to  review  by the returning  officer."
                },
                {
                    "representation": "(5)",
                    "description": "and"
                },
                {
                    "representation": "(6)",
                    "description": "shall be endorsed as to indicate their contents and shall be sealed by the presiding officer and the number of any questioned ballot papers and the total number of ballot papers contained in the envelopes shall be indicated on their outside."
                },
                {
                    "representation": "(7)",
                    "description": "The envelopes referred to in subsections"
                },
                {
                    "representation": "(8)",
                    "description": "The  presiding  officer  shall  affix  his seal  to the  envelopes referred to in the preceding subsections and shall invite such of the duly appointed candidates and the polling agents as are present to do likewise."
                },
                {
                    "representation": "(9)",
                    "description": "shall be posted in a conspicuous place outside the polling place as conclusive evidence of the result of the election for that polling place unless there is a recount of the votes."
                }
            ]
        }
    },
    {
        "act": "REPRESENTATION OF THE PEOPLE ACT",
        "source": "https://mola.gov.gy/laws-of-guyana",
        "type": {
            "name": "section",
            "representation": "84",
            "title": "Counting of votes. ",
            "context": "REPRESENTATION OF THE PEOPLE ACT under Counting of votes. 84.  (1) As soon as practicable after the receipt of all the ballot boxes and the envelopes and packets delivered to him in pursuance of section 83(10),  the Returning  Officer  shall,  in the presence  of such of the persons entitled under section 86(1) to be present as attend, ascertain the total votes cast in favour of each list in the district by adding up the votes recorded in favour of the list in accordance with the Statements of Poll, and  thereupon  publicly  declare  the  votes  recorded  for  each  list  of candidates.  (1A) (a)       Where an election officer for a polling district discovers a material error on the Statement of Poll from a polling LAWS OF GUYANA 110 Cap. 1:03 Representation of the People   L.R.O. 1/2012                                                 station for that polling district, he shall inform the presiding officer for that polling station forthwith, and the presiding officer, if  the Statement of Poll has not yet been sent to the Returning Officer, in the presence of the persons who signed the original Statement of Poll, shall prepare a corrected Statement of Poll, signed by himself and the original signatories present and the corrected Statement of Poll shall be sent to the Returning Officer.  (b)     Where the mistake is discovered when the Statement of Poll is in the possession of the Returning Officer, the presiding officer shall be informed of the mistake and the Returning Officer shall summon the presiding officer and the persons who signed the original Statement of Poll, for the purpose of effecting the necessary correction to the Statement of Poll by the presiding officer in the presence of the other persons mentioned in this paragraph, as attend.  (c)   The presiding officer shall post the corrected Statement of Poll next to the original incorrect Statement of Poll at his polling station and the Returning Officer shall use the corrected Statement of Poll in making the public declaration under subsection (1).   LAWS OF GUYANA Representation of the People Cap. 1:03 111  L.R.O. 1/2012                                                  (2) Where  before  twelve  noon  of  the  day  following the declaration under subsection (1) any counting agent for the district does not request the Returning Officer to conduct a final count of the votes counted  by the presiding officers in the district under section 83, the declaration of the votes obtained by the lists under subsection (1) shall be final; but where any counting agent for the district seeks a final count of the votes already counted by the presiding officers in the district under section 83, the Returning Officer shall count such votes in accordance with the provisions contained in the following subsections and section 87 and on the basis of such recount confirm or vary the declaration of the votes recorded in the district for each list of candidates under subsection (1).  (3) Where any counting agent for the district requests a final count, he shall indicate whether he requests a general count or a limited count, and in the latter case shall specify the polling places in respect of which the final count is to be conducted and the Returning Officer shall conduct the count as requested.  (4) Where a limited final count is conducted, the Returning Officer shall review only the decisions of the presiding officers as regards questioned and rejected ballot papers at the polling places specified in the request for the final count, and in such a case all ballot papers marked Q by the presiding officers of those polling places and all ballot papers rejected by them shall be examined by the Returning Officer.  (5) Where in a limited final count the Returning Officer agrees with the decision of a presiding  officer as regards any questioned  or rejected ballot paper, he shall LAWS OF GUYANA 112 Cap. 1:03 Representation of the People   L.R.O. 1/2012                                                 write the word confirmed at the back of the  ballot  paper,  and  where  he  disagrees  with  the  decision  of  the presiding officer as regards any such ballot paper, he shall write the word varied at the back of the ballot paper.  (6) Where  a  general  final  count  is  conducted,  the  Returning Officer  shall  review  all  used  ballot  papers,  including  rejected  ballot papers, received from all polling places, and where he agrees with the decision  of a presiding  officer  as regards  any questioned  or rejected ballot paper, he shall write the word confirmed at the back of the ballot paper and where he disagrees with the decision of any presiding officer as regards any such ballot paper, he shall write the word varied  at the back of the ballot paper.  (7) Where a duly appointed candidate or any counting agent for the district disagrees with the Returning Officer as regards   any ballot paper, the Returning Officer shall write the letter Q on the back of the ballot paper.  (8) All ballot papers marked in any way by the Returning Officer in a final count shall be marked with his initials.  (9) All markings on a ballot paper by the Returning Officer shall be made on the back of the ballot paper in ink different in colour from that used by the presiding officer.  (10) At the conclusion of any final count, the Returning Officer shall comply with section 89 in respect of the polling places to which the final count related.  (11) On ascertaining the votes cast in the district for each list of candidates in accordance with the preceding   LAWS OF GUYANA Representation of the People Cap. 1:03 113  L.R.O. 1/2012                                   Candidates appointed   to attend count.                         Attendance at count. Reg. 37/1964 [16 of 1968 12 of 1996]                subsections, the returning officer shall communicate to the Chief Election Officer, by the quickest available means, the total number of valid votes cast in the district for each list of candidates.",
            "description": [
                {
                    "representation": "(1)",
                    "description": "shall be final; but where any counting agent for the district seeks a final count of the votes already counted by the presiding officers in the district under section 83, the Returning Officer shall count such votes in accordance with the provisions contained in the following subsections and section 87 and on the basis of such recount confirm or vary the declaration of the votes recorded in the district for each list of candidates under subsection"
                },
                {
                    "representation": "(a)",
                    "description": "Where an election officer for a polling district discovers a material error on the Statement of Poll from a polling LAWS OF GUYANA 110 Cap. 1:03 Representation of the People   L.R.O. 1/2012                                                 station for that polling district, he shall inform the presiding officer for that polling station forthwith, and the presiding officer, if  the Statement of Poll has not yet been sent to the Returning Officer, in the presence of the persons who signed the original Statement of Poll, shall prepare a corrected Statement of Poll, signed by himself and the original signatories present and the corrected Statement of Poll shall be sent to the Returning Officer."
                },
                {
                    "representation": "(b)",
                    "description": "Where the mistake is discovered when the Statement of Poll is in the possession of the Returning Officer, the presiding officer shall be informed of the mistake and the Returning Officer shall summon the presiding officer and the persons who signed the original Statement of Poll, for the purpose of effecting the necessary correction to the Statement of Poll by the presiding officer in the presence of the other persons mentioned in this paragraph, as attend."
                },
                {
                    "representation": "(c)",
                    "description": "The presiding officer shall post the corrected Statement of Poll next to the original incorrect Statement of Poll at his polling station and the Returning Officer shall use the corrected Statement of Poll in making the public declaration under subsection"
                },
                {
                    "representation": "(2)",
                    "description": "Where  before  twelve  noon  of  the  day  following the declaration under subsection"
                },
                {
                    "representation": "(3)",
                    "description": "Where any counting agent for the district requests a final count, he shall indicate whether he requests a general count or a limited count, and in the latter case shall specify the polling places in respect of which the final count is to be conducted and the Returning Officer shall conduct the count as requested."
                },
                {
                    "representation": "(4)",
                    "description": "Where a limited final count is conducted, the Returning Officer shall review only the decisions of the presiding officers as regards questioned and rejected ballot papers at the polling places specified in the request for the final count, and in such a case all ballot papers marked Q by the presiding officers of those polling places and all ballot papers rejected by them shall be examined by the Returning Officer."
                },
                {
                    "representation": "(5)",
                    "description": "Where in a limited final count the Returning Officer agrees with the decision of a presiding  officer as regards any questioned  or rejected ballot paper, he shall LAWS OF GUYANA 112 Cap. 1:03 Representation of the People   L.R.O. 1/2012                                                 write the word confirmed at the back of the  ballot  paper,  and  where  he  disagrees  with  the  decision  of  the presiding officer as regards any such ballot paper, he shall write the word varied at the back of the ballot paper."
                },
                {
                    "representation": "(6)",
                    "description": "Where  a  general  final  count  is  conducted,  the  Returning Officer  shall  review  all  used  ballot  papers,  including  rejected  ballot papers, received from all polling places, and where he agrees with the decision  of a presiding  officer  as regards  any questioned  or rejected ballot paper, he shall write the word confirmed at the back of the ballot paper and where he disagrees with the decision of any presiding officer as regards any such ballot paper, he shall write the word varied  at the back of the ballot paper."
                },
                {
                    "representation": "(7)",
                    "description": "Where a duly appointed candidate or any counting agent for the district disagrees with the Returning Officer as regards   any ballot paper, the Returning Officer shall write the letter Q on the back of the ballot paper."
                },
                {
                    "representation": "(8)",
                    "description": "All ballot papers marked in any way by the Returning Officer in a final count shall be marked with his initials."
                },
                {
                    "representation": "(9)",
                    "description": "All markings on a ballot paper by the Returning Officer shall be made on the back of the ballot paper in ink different in colour from that used by the presiding officer."
                }
            ]
        }
    },
    {
        "act": "REPRESENTATION OF THE PEOPLE ACT",
        "source": "https://mola.gov.gy/laws-of-guyana",
        "type": {
            "name": "section",
            "representation": "85",
            "title": "Candidates appointed to attend count. ",
            "context": "REPRESENTATION OF THE PEOPLE ACT under Candidates appointed to attend count. 85.  (1) The election agent of each group of candidates may appoint one of the candidates, hereinafter in this Part referred to as the duly appointed candidate to attend at the counting of the votes in a district.  (2) Notice in writing of appointments made under subsection (1), stating the names and addresses of the candidates  appointed shall be signed by the election agent and delivered to the returning officer of the district not later than the 7th day before election day.  (3) There shall not be more than one duly appointed candidate of the same list of candidates for any one district.",
            "description": [
                {
                    "representation": "(1)",
                    "description": "The election agent of each group of candidates may appoint one of the candidates, hereinafter in this Part referred to as the duly appointed candidate to attend at the counting of the votes in a district."
                },
                {
                    "representation": "(2)",
                    "description": "Notice in writing of appointments made under subsection"
                },
                {
                    "representation": "(3)",
                    "description": "There shall not be more than one duly appointed candidate of the same list of candidates for any one district."
                }
            ]
        }
    },
    {
        "act": "REPRESENTATION OF THE PEOPLE ACT",
        "source": "https://mola.gov.gy/laws-of-guyana",
        "type": {
            "name": "section",
            "representation": "86",
            "title": "Attendance at count. ",
            "context": "REPRESENTATION OF THE PEOPLE ACT under Attendance at count. 86.  (1) No  person  shall  be  present  at  the  counting  of  the  votes except  (a)   the returning officer and such other election officers as he may appoint to assist him in the counting;  (b)      members of the Commission;   (c)       duly appointed candidates;  (d)      counting  agents;  (e)      such other persons as, in the opinion of the returning officer, have good LAWS OF GUYANA 114 Cap. 1:03 Representation of the People   L.R.O. 1/2012                      Method of counting. [30 of 1990]                                 reason to be present.  (2) The returning officer shall give the counting agents all such reasonable facilities   for overseeing   the proceedings   and all such information with respect thereto as he can give them consistent with the orderly conduct of the proceedings and with the discharge of his duties in connection therewith.",
            "description": [
                {
                    "representation": "(1)",
                    "description": "No  person  shall  be  present  at  the  counting  of  the  votes except"
                },
                {
                    "representation": "(a)",
                    "description": "the returning officer and such other election officers as he may appoint to assist him in the counting;"
                },
                {
                    "representation": "(b)",
                    "description": "members of the Commission;"
                },
                {
                    "representation": "(c)",
                    "description": "duly appointed candidates;"
                },
                {
                    "representation": "(d)",
                    "description": "counting  agents;"
                },
                {
                    "representation": "(e)",
                    "description": "such other persons as, in the opinion of the returning officer, have good LAWS OF GUYANA 114 Cap. 1:03 Representation of the People   L.R.O. 1/2012                      Method of counting. [30 of 1990]                                 reason to be present."
                },
                {
                    "representation": "(2)",
                    "description": "The returning officer shall give the counting agents all such reasonable facilities   for overseeing   the proceedings   and all such information with respect thereto as he can give them consistent with the orderly conduct of the proceedings and with the discharge of his duties in connection therewith."
                }
            ]
        }
    },
    {
        "act": "REPRESENTATION OF THE PEOPLE ACT",
        "source": "https://mola.gov.gy/laws-of-guyana",
        "type": {
            "name": "section",
            "representation": "87",
            "title": "Method of counting. ",
            "context": "REPRESENTATION OF THE PEOPLE ACT under Method of counting. 87.  (1) Where a returning officer is required to have a final count of the  votes cast for all, or some, of the polling places,  he shall in the presence  of  such  of  the  persons  entitled  under  section  86(1)  to be present as attend  (a)      open each ballot box;  (b)      take out the ballot papers;  (c)      count and record the number of ballot papers taken from each ballot box;  (d)       [Repealed by Act No. 30 of 1990].  (e)      count the votes recorded for each list of candidates.  (2) In counting the votes the returning officer shall, subject to subsection (3), reject as invalid and not count any ballot paper  (a)      which does not bear the official mark;  (b)     which has not been marked for any list of candidates or is void for uncertainty;   LAWS OF GUYANA Representation of the People Cap. 1:03 115  L.R.O. 1/2012                                                          (c)    on which votes have been given for more than one list of  candidates;  (d)    on which there is any writing or mark by which the elector can be identified.  (3) A ballot paper on which the vote is marked  (a)      elsewhere than in the proper place;  (b)     otherwise than by means of a cross;  (c)      by more than one mark;  shall not be rejected solely by reason thereof if  (i)      an intention that the vote shall be for one or other of the lists of candidates clearly appears; and (ii)    the elector is neither identified nor can be identified by the manner in which the ballot paper is marked.  (4) The returning officer shall endorse the word rejected  on any ballot paper which he may reject as invalid and shall add to the endorsement the words rejection  objected to  if any objection to his decision be made by a duly appointed  candidate  or a counting  agent present during the counting.  (5) The decision of the returning officer as to any question arising in respect of any ballot paper shall be final.  LAWS OF GUYANA 116 Cap. 1:03 Representation of the People   L.R.O. 1/2012  Recounts.                   Procedure on conclusion of count. [30 of 1990]",
            "description": [
                {
                    "representation": "(1)",
                    "description": "Where a returning officer is required to have a final count of the  votes cast for all, or some, of the polling places,  he shall in the presence  of  such  of  the  persons  entitled  under  section  86(1)  to be present as attend"
                },
                {
                    "representation": "(a)",
                    "description": "elsewhere than in the proper place;"
                },
                {
                    "representation": "(b)",
                    "description": "otherwise than by means of a cross;"
                },
                {
                    "representation": "(c)",
                    "description": "by more than one mark;  shall not be rejected solely by reason thereof if"
                },
                {
                    "representation": "(d)",
                    "description": "on which there is any writing or mark by which the elector can be identified."
                },
                {
                    "representation": "(e)",
                    "description": "count the votes recorded for each list of candidates."
                },
                {
                    "representation": "(2)",
                    "description": "In counting the votes the returning officer shall, subject to subsection"
                },
                {
                    "representation": "(3)",
                    "description": "A ballot paper on which the vote is marked"
                },
                {
                    "representation": "(i)",
                    "description": "an intention that the vote shall be for one or other of the lists of candidates clearly appears; and"
                },
                {
                    "representation": "(4)",
                    "description": "The returning officer shall endorse the word rejected  on any ballot paper which he may reject as invalid and shall add to the endorsement the words rejection  objected to  if any objection to his decision be made by a duly appointed  candidate  or a counting  agent present during the counting."
                },
                {
                    "representation": "(5)",
                    "description": "The decision of the returning officer as to any question arising in respect of any ballot paper shall be final.  LAWS OF GUYANA 116 Cap. 1:03 Representation of the People   L.R.O. 1/2012  Recounts.                   Procedure on conclusion of count. [30 of 1990]"
                }
            ]
        }
    },
    {
        "act": "REPRESENTATION OF THE PEOPLE ACT",
        "source": "https://mola.gov.gy/laws-of-guyana",
        "type": {
            "name": "section",
            "representation": "88",
            "title": "Recounts. ",
            "context": "REPRESENTATION OF THE PEOPLE ACT under Recounts. 88.  A duly appointed candidate, or counting agent present when the counting or any recount of votes is completed, may request the returning officer to have the votes recounted or again recounted; but the returning officer may refuse such request if in his opinion it is unreasonable.",
            "description": "A duly appointed candidate, or counting agent present when the counting or any recount of votes is completed, may request the returning officer to have the votes recounted or again recounted; but the returning officer may refuse such request if in his opinion it is unreasonable."
        }
    },
    {
        "act": "REPRESENTATION OF THE PEOPLE ACT",
        "source": "https://mola.gov.gy/laws-of-guyana",
        "type": {
            "name": "section",
            "representation": "89",
            "title": "Procedure on conclusion of count. ",
            "context": "REPRESENTATION OF THE PEOPLE ACT under Procedure on conclusion of count. 89.(1) Upon the conclusion of the final counting, under section 84, of the votes the returning officer, in the presence of such of the persons entitled under section 86(1) to be present as attend, shall  (a)     seal  in  separate packets the counted and rejected ballot papers;  (b)    verify the ballot papers account given by each presiding officer by comparing it with  (i)   the number of ballot papers recorded under section  87(1)(c); (ii)   the   unused   and   spoiled   ballot   papers   in   his possession; and (iii)  the record of tendered votes contained in the poll book;  (c)   reseal  the  packets of unused and spoiled ballot papers;   (d)     prepare   a  written  statement  as  to  the  result  of  the verification of the ballot papers account and on request allow any counting agent present to   LAWS OF GUYANA Representation of the People Cap. 1:03 117  L.R.O. 1/2012                                Form",
            "description": [
                {
                    "representation": "(1)",
                    "description": "Upon the conclusion of the final counting, under section 84, of the votes the returning officer, in the presence of such of the persons entitled under section 86(1) to be present as attend, shall"
                },
                {
                    "representation": "(a)",
                    "description": "seal  in  separate packets the counted and rejected ballot papers;"
                },
                {
                    "representation": "(b)",
                    "description": "verify the ballot papers account given by each presiding officer by comparing it with"
                },
                {
                    "representation": "(i)",
                    "description": "the number of ballot papers recorded under section  87(1)(c);"
                },
                {
                    "representation": "(c)",
                    "description": "reseal  the  packets of unused and spoiled ballot papers;"
                },
                {
                    "representation": "(d)",
                    "description": "prepare   a  written  statement  as  to  the  result  of  the verification of the ballot papers account and on request allow any counting agent present to   LAWS OF GUYANA Representation of the People Cap. 1:03 117  L.R.O. 1/2012                                Form"
                }
            ]
        }
    },
    {
        "act": "REPRESENTATION OF THE PEOPLE ACT",
        "source": "https://mola.gov.gy/laws-of-guyana",
        "type": {
            "name": "section",
            "representation": "90",
            "title": "Maintenance of Secrecy at count.  PART X COUNTING NON-RESIDENT ELECTORS\u2019 VOTES  ",
            "context": "REPRESENTATION OF THE PEOPLE ACT under Maintenance of Secrecy at count.  PART X COUNTING NON-RESIDENT ELECTORS VOTES  90. Every person attending at the counting of votes shall maintain and shall not communicate any information obtained at the count as to the list of candidates for which any vote has been given.   LAWS OF GUYANA 118 Cap. 1:03 Representation of the People   L.R.O. 1/2012        Persons who may be present at count. [Reg. 25/1968 12 of 1996 15 of 2000]                                      PART  X COUNTING  NON-RESIDENT  ELECTORS  VOTES",
            "description": "Every person attending at the counting of votes shall maintain and shall not communicate any information obtained at the count as to the list of candidates for which any vote has been given.   LAWS OF GUYANA 118 Cap. 1:03 Representation of the People   L.R.O. 1/2012        Persons who may be present at count. [Reg. 25/1968 12 of 1996 15 of 2000]                                      PART  X COUNTING  NON-RESIDENT  ELECTORS  VOTES"
        }
    },
    {
        "act": "REPRESENTATION OF THE PEOPLE ACT",
        "source": "https://mola.gov.gy/laws-of-guyana",
        "type": {
            "name": "section",
            "representation": "91",
            "title": "Persons who may be present at count. ",
            "context": "REPRESENTATION OF THE PEOPLE ACT under Persons who may be present at count. 91.  (1) No person, other than  (a)    the  Chief  Election  Officer  and such staff  appointed under section 7(d) as he may designate to assist him in the             counting;  (b)      members of the Commission;  (c)   candidates  appointed  under sub-section (2);   (d)  election  agents;  (e)   such   other   persons   as, in the  opinion  of  the  Chief Election Officer, have good reason to be present,   shall be present at the counting of the votes cast under Part VII.  (2) The election agent of each group of candidates may appoint one of the candidates for the purposes of subsection (1)(c).   (3) Notice in writing of such appointment, stating the name and address of the candidate, shall be signed by the election agent and delivered to the Chief Election Officer not later than the 7th day before election day.  (4) There shall not be more than one candidate appointed from the same list of candidates for the said   LAWS OF GUYANA Representation of the People Cap. 1:03 119  L.R.O. 1/2012                   Method of counting non- resident electors votes. [Reg. 25/1968 O. 50/1980]                            purposes.  (5) The  Chief  Election  Officer  shall  give  persons  present  by virtue  of  subsection  (l)  (c)  or  (d)  all  such  reasonable  facilities  for overseeing the proceedings and all such information with respect thereto as   he  can  give  them  consistent  with  the  orderly  conduct  of  the proceedings and with the discharge of his duties in connection therewith.",
            "description": [
                {
                    "representation": "(1)",
                    "description": "No person, other than"
                },
                {
                    "representation": "(a)",
                    "description": "the  Chief  Election  Officer  and such staff  appointed under section 7(d) as he may designate to assist him in the             counting;"
                },
                {
                    "representation": "(b)",
                    "description": "members of the Commission;"
                },
                {
                    "representation": "(c)",
                    "description": "or"
                },
                {
                    "representation": "(d)",
                    "description": "all  such  reasonable  facilities  for overseeing the proceedings and all such information with respect thereto as   he  can  give  them  consistent  with  the  orderly  conduct  of  the proceedings and with the discharge of his duties in connection therewith."
                },
                {
                    "representation": "(e)",
                    "description": "such   other   persons   as, in the  opinion  of  the  Chief Election Officer, have good reason to be present,   shall be present at the counting of the votes cast under Part VII."
                },
                {
                    "representation": "(2)",
                    "description": "The election agent of each group of candidates may appoint one of the candidates for the purposes of subsection"
                },
                {
                    "representation": "(3)",
                    "description": "Notice in writing of such appointment, stating the name and address of the candidate, shall be signed by the election agent and delivered to the Chief Election Officer not later than the 7th day before election day."
                },
                {
                    "representation": "(4)",
                    "description": "There shall not be more than one candidate appointed from the same list of candidates for the said   LAWS OF GUYANA Representation of the People Cap. 1:03 119  L.R.O. 1/2012                   Method of counting non- resident electors votes. [Reg. 25/1968 O. 50/1980]                            purposes."
                },
                {
                    "representation": "(5)",
                    "description": "The  Chief  Election  Officer  shall  give  persons  present  by virtue  of  subsection"
                },
                {
                    "representation": "(l)",
                    "description": ""
                }
            ]
        }
    },
    {
        "act": "REPRESENTATION OF THE PEOPLE ACT",
        "source": "https://mola.gov.gy/laws-of-guyana",
        "type": {
            "name": "section",
            "representation": "92",
            "title": "Method of counting non-resident electors\u2019 votes.  ",
            "context": "REPRESENTATION OF THE PEOPLE ACT under Method of counting non-resident electors votes.  92. (1) The Chief Election Officer shall, as soon as practicable after the discharge of his functions assigned by Part VII with reference to election day, in the presence of such of the persons entitled under section 91(1) to be present as attend  (a)   open each ballot box used for the purposes of that Part;   (b)      take out the ballot papers;  (c)       [deleted by O. 50/1980]   (d)     mix together the ballot papers which were contained in each ballot box;  (e)    count and record the number of such votes for each list of candidates as were cast in each ballot box.  (2) The provisions of section 87(2), (3), (4) and (5) shall, as they apply in relation to the counting of votes by a returning officer, apply mutatis mutandis in relation to the counting of votes under this section:  LAWS OF GUYANA 120 Cap. 1:03 Representation of the People   L.R.O. 1/2012                       Recounts of non-resident electors votes.           Procedure on conclusion of count of non- resident electors votes. [16 of 1985]                       Provided that subsection  (4) aforesaid shall, in its application  by virtue of the foregoing provisions of this subsection, have effect as if for the  reference  in that  subsection  to a counting  agent  there  had been substituted reference to an election agent.",
            "description": [
                {
                    "representation": "(1)",
                    "description": "The Chief Election Officer shall, as soon as practicable after the discharge of his functions assigned by Part VII with reference to election day, in the presence of such of the persons entitled under section 91(1) to be present as attend"
                },
                {
                    "representation": "(a)",
                    "description": "open each ballot box used for the purposes of that Part;"
                },
                {
                    "representation": "(b)",
                    "description": "take out the ballot papers;"
                },
                {
                    "representation": "(c)",
                    "description": "[deleted by O. 50/1980]"
                },
                {
                    "representation": "(d)",
                    "description": "mix together the ballot papers which were contained in each ballot box;"
                },
                {
                    "representation": "(e)",
                    "description": "count and record the number of such votes for each list of candidates as were cast in each ballot box."
                },
                {
                    "representation": "(2)",
                    "description": "The provisions of section 87(2),"
                },
                {
                    "representation": "(4)",
                    "description": "aforesaid shall, in its application  by virtue of the foregoing provisions of this subsection, have effect as if for the  reference  in that  subsection  to a counting  agent  there  had been substituted reference to an election agent."
                },
                {
                    "representation": "(5)",
                    "description": "shall, as they apply in relation to the counting of votes by a returning officer, apply mutatis mutandis in relation to the counting of votes under this section:  LAWS OF GUYANA 120 Cap. 1:03 Representation of the People   L.R.O. 1/2012                       Recounts of non-resident electors votes.           Procedure on conclusion of count of non- resident electors votes. [16 of 1985]                       Provided that subsection"
                }
            ]
        }
    },
    {
        "act": "REPRESENTATION OF THE PEOPLE ACT",
        "source": "https://mola.gov.gy/laws-of-guyana",
        "type": {
            "name": "section",
            "representation": "93",
            "title": "Recounts of non-resident electors\u2019 votes. ",
            "context": "REPRESENTATION OF THE PEOPLE ACT under Recounts of non-resident electors votes. 93.  A candidate appointed under section 91 or an election agent may, when the counting or recounting of the votes cast in any ballot box is completed in conformity with section 92(1)(e), request the Chief Election Officer to have the votes recounted or again recounted; but the Chief Election Officer may refuse such request if in his opinion it is unreasonable.",
            "description": "A candidate appointed under section 91 or an election agent may, when the counting or recounting of the votes cast in any ballot box is completed in conformity with section 92(1)(e), request the Chief Election Officer to have the votes recounted or again recounted; but the Chief Election Officer may refuse such request if in his opinion it is unreasonable."
        }
    },
    {
        "act": "REPRESENTATION OF THE PEOPLE ACT",
        "source": "https://mola.gov.gy/laws-of-guyana",
        "type": {
            "name": "section",
            "representation": "94",
            "title": "Procedure on conclusion of count of non-residents\u2019 votes. ",
            "context": "REPRESENTATION OF THE PEOPLE ACT under Procedure on conclusion of count of non-residents votes. 94.  (1) Upon the conclusion of the counting of the votes under this Part the Chief Election Officer, in the presence of such of the persons entitled under section 91(1) to be present as attend, shall  (a)    seal in separate packets the counted and rejected ballot papers;  (b)     prepare  a  written  statement  as  to  the  result  of  the verification  of   the   non-resident   electors   ballot   papers accounts  under  section  63(3)  and  on  request  allow  any candidate  appointed  under  section  91  or  election  agent present to make a copy thereof;  (c)     publicly declare the aggregate number of valid votes cast under section 62(1) for each list of candidates;   LAWS OF GUYANA Representation of the People Cap. 1:03 121  L.R.O. 1/2012                               Delegation of Chief Election Officers functions under this Part.                     Ascertain-ment of election results. [16 of  1968 30 of 1990 15 of 2000 12 of 2006]       (d)      record, in Form 25, the number of  (i)      valid   votes   cast   as  aforesaid   for  each   list   of candidates; (ii)   rejected ballot papers together with, in each case, the reason  for rejection; (iii)  persons who appear to have voted under Part VII.  (2) Any candidate appointed as aforesaid or election agent may copy the record made under subsection (l)(d).",
            "description": [
                {
                    "representation": "(1)",
                    "description": "Upon the conclusion of the counting of the votes under this Part the Chief Election Officer, in the presence of such of the persons entitled under section 91(1) to be present as attend, shall"
                },
                {
                    "representation": "(a)",
                    "description": "seal in separate packets the counted and rejected ballot papers;"
                },
                {
                    "representation": "(b)",
                    "description": "prepare  a  written  statement  as  to  the  result  of  the verification  of   the   non-resident   electors   ballot   papers accounts  under  section  63(3)  and  on  request  allow  any candidate  appointed  under  section  91  or  election  agent present to make a copy thereof;"
                },
                {
                    "representation": "(c)",
                    "description": "publicly declare the aggregate number of valid votes cast under section 62(1) for each list of candidates;   LAWS OF GUYANA Representation of the People Cap. 1:03 121  L.R.O. 1/2012                               Delegation of Chief Election Officers functions under this Part.                     Ascertain-ment of election results. [16 of  1968 30 of 1990 15 of 2000 12 of 2006]"
                },
                {
                    "representation": "(d)",
                    "description": "record, in Form 25, the number of"
                },
                {
                    "representation": "(i)",
                    "description": "valid   votes   cast   as  aforesaid   for  each   list   of candidates;"
                },
                {
                    "representation": "(2)",
                    "description": "Any candidate appointed as aforesaid or election agent may copy the record made under subsection"
                }
            ]
        }
    },
    {
        "act": "REPRESENTATION OF THE PEOPLE ACT",
        "source": "https://mola.gov.gy/laws-of-guyana",
        "type": {
            "name": "section",
            "representation": "95",
            "title": "Delegation of Chief Election Officer\u2019s functions under this Part.  PART XI ASCERTAINMENT OF ELECTION RESULTS  ",
            "context": "REPRESENTATION OF THE PEOPLE ACT under Delegation of Chief Election Officers functions under this Part.  PART XI ASCERTAINMENT OF ELECTION RESULTS  95.  The Chief Election Officer may delegate to any overseas presiding officers deputed under section 65 his functions, or any of them, under sections 92, 93 and 94, and such officers shall, subject to any general or special directions given by the Chief Election Officer, have and exercise all the powers and perform all the duties, delegated under this section to them, respectively.  PART  XI ASCERTAINMENT  OF  THE  ELECTION  RESULTS",
            "description": "The Chief Election Officer may delegate to any overseas presiding officers deputed under section 65 his functions, or any of them, under sections 92, 93 and 94, and such officers shall, subject to any general or special directions given by the Chief Election Officer, have and exercise all the powers and perform all the duties, delegated under this section to them, respectively.  PART  XI ASCERTAINMENT  OF  THE  ELECTION  RESULTS"
        }
    },
    {
        "act": "REPRESENTATION OF THE PEOPLE ACT",
        "source": "https://mola.gov.gy/laws-of-guyana",
        "type": {
            "name": "section",
            "representation": "96",
            "title": "Totalling of votes. ",
            "context": "REPRESENTATION OF THE PEOPLE ACT under Totalling of votes. 96. (1)  The  Chief  Election  Officer  shall,  after  calculating  the total number of valid votes of electors which have been cast for each list of candidates, on the basis  of the votes counted and the information furnished by returning officers under section 84 (11), ascertain the result of the election in accordance with sections 97 and",
            "description": [
                {
                    "representation": "(1)",
                    "description": "The  Chief  Election  Officer  shall,  after  calculating  the total number of valid votes of electors which have been cast for each list of candidates, on the basis  of the votes counted and the information furnished by returning officers under section 84"
                }
            ]
        }
    },
    {
        "act": "REPRESENTATION OF THE PEOPLE ACT",
        "source": "https://mola.gov.gy/laws-of-guyana",
        "type": {
            "name": "section",
            "representation": "97",
            "title": "Allocation of seats. ",
            "context": "REPRESENTATION OF THE PEOPLE ACT under Allocation of seats. 97.  (1) The total number of votes cast for all the lists of candidates shall be divided by fifty-three and the whole number resulting from that division shall be known as the electoral quota.  (2) The number of votes cast for any list shall be divided by the electoral quota; there shall be allocated  to that list a number of seats equal to the whole number resulting from that division; and the number of votes represented by a fraction so resulting shall be known as surplus votes of the list; and if the number of votes cast in accordance with this Act  for  any  list  is  less  than  the  electoral  quota,  those  votes  shall accordingly be treated as surplus votes of that list.  (3) Any  seat  or  seats  remaining  unallocated  after  seats  have been allocated in accordance with subsection (2) shall be allocated as follows  (a)     one seat shall be allocated to the list with the largest number of surplus votes;  (b)     if the number of seats so remaining is two or more, one seat shall be allocated to the list with the next largest number of surplus votes, and so on until all the seats so remaining have been  allocated;  (c)   for the purposes of this paragraph, where two or more lists have equal   LAWS OF GUYANA Representation of the People Cap. 1:03 123  L.R.O. 1/2012                                Membership of National Assembly. [16 of 1968 O. 50/1980 O. 80/1980]                numbers of surplus votes, then lots shall be drawn by the Chairman of the Commission in the presence of the  representatives  of the lists affected to determine  which list or lists shall be deemed to have more surplus votes than the other list or lists.  (4) For the purposes of the foregoing provisions of this section a combination of lists shall be treated as one list.   (5) The seats allocated to a combination of lists shall be allocated among the lists comprised in the combination in accordance with subsections (2) and (3), the electoral quota for that purpose being the whole number found by dividing the total number of votes cast for the combination of lists by the number of seats allocated to the combination.",
            "description": [
                {
                    "representation": "(1)",
                    "description": "The total number of votes cast for all the lists of candidates shall be divided by fifty-three and the whole number resulting from that division shall be known as the electoral quota."
                },
                {
                    "representation": "(2)",
                    "description": "and"
                },
                {
                    "representation": "(3)",
                    "description": "Any  seat  or  seats  remaining  unallocated  after  seats  have been allocated in accordance with subsection"
                },
                {
                    "representation": "(a)",
                    "description": "one seat shall be allocated to the list with the largest number of surplus votes;"
                },
                {
                    "representation": "(b)",
                    "description": "if the number of seats so remaining is two or more, one seat shall be allocated to the list with the next largest number of surplus votes, and so on until all the seats so remaining have been  allocated;"
                },
                {
                    "representation": "(c)",
                    "description": "for the purposes of this paragraph, where two or more lists have equal   LAWS OF GUYANA Representation of the People Cap. 1:03 123  L.R.O. 1/2012                                Membership of National Assembly. [16 of 1968 O. 50/1980 O. 80/1980]                numbers of surplus votes, then lots shall be drawn by the Chairman of the Commission in the presence of the  representatives  of the lists affected to determine  which list or lists shall be deemed to have more surplus votes than the other list or lists."
                },
                {
                    "representation": "(4)",
                    "description": "For the purposes of the foregoing provisions of this section a combination of lists shall be treated as one list."
                },
                {
                    "representation": "(5)",
                    "description": "The seats allocated to a combination of lists shall be allocated among the lists comprised in the combination in accordance with subsections"
                }
            ]
        }
    },
    {
        "act": "REPRESENTATION OF THE PEOPLE ACT",
        "source": "https://mola.gov.gy/laws-of-guyana",
        "type": {
            "name": "section",
            "representation": "98",
            "title": "Membership of National Assembly. ",
            "context": "REPRESENTATION OF THE PEOPLE ACT under Membership of National Assembly. 98.  (2) The Chief Election Officer shall prepare a report manually and in electronic form in terms of section 99 for the benefit of the Commission, which shall be the basis for LAWS OF GUYANA 122 Cap. 1:03 Representation of the People   L.R.O. 1/2012          Allocation of seats. Reg. 6/1973                                         the Commission to declare and publish the election results under section",
            "description": [
                {
                    "representation": "(2)",
                    "description": "The Chief Election Officer shall prepare a report manually and in electronic form in terms of section 99 for the benefit of the Commission, which shall be the basis for LAWS OF GUYANA 122 Cap. 1:03 Representation of the People   L.R.O. 1/2012          Allocation of seats. Reg. 6/1973                                         the Commission to declare and publish the election results under section"
                }
            ]
        }
    },
    {
        "act": "REPRESENTATION OF THE PEOPLE ACT",
        "source": "https://mola.gov.gy/laws-of-guyana",
        "type": {
            "name": "section",
            "representation": "99",
            "title": "Publication of election results. 99A    Filling of casual vacancies in the case of members selected under Article 60(2) of the Constitution. ",
            "context": "REPRESENTATION OF THE PEOPLE ACT under Publication of election results. 99A    Filling of casual vacancies in the case of members selected under Article 60(2) of the Constitution. 99.",
            "description": "99."
        }
    },
    {
        "act": "REPRESENTATION OF THE PEOPLE ACT",
        "source": "https://mola.gov.gy/laws-of-guyana",
        "type": {
            "name": "section",
            "representation": "100",
            "title": "Certificates of election. LAWS OF GUYANA 8 Cap. 1:03 Representation of the People   L.R.O. 1/2012       SECTION  ",
            "context": "REPRESENTATION OF THE PEOPLE ACT under Certificates of election. LAWS OF GUYANA 8 Cap. 1:03 Representation of the People   L.R.O. 1/2012       SECTION  100. The Commission shall furnish each of the persons who have become members of the National Assembly with a certificate that he has been so elected. LAWS OF GUYANA 126 Cap. 1:03 Representation of the People   L.R.O. 1/2012         Election Report. [16 of 1968] c.  19:08            Custody of election documents. [16 of 1968 Reg. 25/1968 O. 50/1980] 30 of 1990 15 of 2000]                   c. 1:01",
            "description": "The Commission shall furnish each of the persons who have become members of the National Assembly with a certificate that he has been so elected. LAWS OF GUYANA 126 Cap. 1:03 Representation of the People   L.R.O. 1/2012         Election Report. [16 of 1968] c.  19:08            Custody of election documents. [16 of 1968 Reg. 25/1968 O. 50/1980] 30 of 1990 15 of 2000]                   c. 1:01"
        }
    },
    {
        "act": "REPRESENTATION OF THE PEOPLE ACT",
        "source": "https://mola.gov.gy/laws-of-guyana",
        "type": {
            "name": "section",
            "representation": "101",
            "title": "Election report. ",
            "context": "REPRESENTATION OF THE PEOPLE ACT under Election report. 101. The Chief Election Officer shall as soon as practicable after the election cause to be prepared and printed a general report on the election including the particulars specified in section 110 and the total number of electors registered under the National Registration  Act.",
            "description": "The Chief Election Officer shall as soon as practicable after the election cause to be prepared and printed a general report on the election including the particulars specified in section 110 and the total number of electors registered under the National Registration  Act."
        }
    },
    {
        "act": "REPRESENTATION OF THE PEOPLE ACT",
        "source": "https://mola.gov.gy/laws-of-guyana",
        "type": {
            "name": "section",
            "representation": "102",
            "title": "Custody of election documents.  PART XII ELECTION EXPENSES  ",
            "context": "REPRESENTATION OF THE PEOPLE ACT under Custody of election documents.  PART XII ELECTION EXPENSES  102.  (1) The  returning  officer  of  each  district  shall,  as  soon  as practicable after making the return required by section 89 (1)(f) make up in one parcel the packets he has received in pursuance of section 83(10)(b)  and the other papers  used at the polling  places  and in his possession and shall seal the parcel so that it cannot be opened without breaking the seals and deliver it to the Chief Election Officer.           (2) The Chief Election Officer shall keep all parcels received in pursuance of subsection (1) in safe custody and, subject to the provisions of this Act and any law made under article 163 of the Constitution, allow no person to have access thereto.           (3) The  returning  officer  of  each  district  shall,  as  soon  as practicable after delivering the election documents, in accordance with subsection (1), cause the ballot boxes used at the election, together with their locks and keys, to be deposited in the custody of the Commission.  (4) The Chief Election Officer shall, as soon as practicable after the discharge of his functions under Part X, cause the ballot boxes used for the purposes of Part VII, together with their locks and keys, to be deposited in the custody of the Commission.    LAWS OF GUYANA Representation of the People Cap. 1:03 127  L.R.O. 1/2012                    Making of contracts through  election agents.                        Payment of expenses.  [16 of 1968 24 of 1990]  (5) Subject  to the requirements  of section  63(2)  and (3), the provisions of section 102(2) shall, as they apply to the parcels mentioned therein, apply to every packet delivered to, or made up by, the Chief Election Officer pursuant to section 57(1)(b), (c), (d) or (e), or made up under section 94(1)(a), and to everything not dealt with under section 63(1)(e) or (f) by reason of its having been returned or delivered to the Chief Election Officer after election day.  PART  XII ELECTION  EXPENSES",
            "description": [
                {
                    "representation": "(1)",
                    "description": "in safe custody and, subject to the provisions of this Act and any law made under article 163 of the Constitution, allow no person to have access thereto."
                },
                {
                    "representation": "(f)",
                    "description": "by reason of its having been returned or delivered to the Chief Election Officer after election day.  PART  XII ELECTION  EXPENSES"
                },
                {
                    "representation": "(2)",
                    "description": "shall, as they apply to the parcels mentioned therein, apply to every packet delivered to, or made up by, the Chief Election Officer pursuant to section 57(1)(b),"
                },
                {
                    "representation": "(3)",
                    "description": "The  returning  officer  of  each  district  shall,  as  soon  as practicable after delivering the election documents, in accordance with subsection"
                },
                {
                    "representation": "(4)",
                    "description": "The Chief Election Officer shall, as soon as practicable after the discharge of his functions under Part X, cause the ballot boxes used for the purposes of Part VII, together with their locks and keys, to be deposited in the custody of the Commission.    LAWS OF GUYANA Representation of the People Cap. 1:03 127  L.R.O. 1/2012                    Making of contracts through  election agents.                        Payment of expenses.  [16 of 1968 24 of 1990]"
                },
                {
                    "representation": "(5)",
                    "description": "Subject  to the requirements  of section  63(2)  and"
                },
                {
                    "representation": "(d)",
                    "description": "or"
                },
                {
                    "representation": "(e)",
                    "description": "or"
                }
            ]
        }
    },
    {
        "act": "REPRESENTATION OF THE PEOPLE ACT",
        "source": "https://mola.gov.gy/laws-of-guyana",
        "type": {
            "name": "section",
            "representation": "103",
            "title": "Making of contracts through election agents. ",
            "context": "REPRESENTATION OF THE PEOPLE ACT under Making of contracts through election agents. 103.  (1) The election agent of a group of candidates shall appoint every clerk and messenger employed for payment on behalf of the group at the election and shall hire every committee room hired on behalf of the group.   (2) A contract whereby any expenses are incurred on account of or in respect of the conduct or the management of the election shall not be enforceable against a candidate unless made by the candidate or by the election agent of the group to which the candidate belongs:  Provided that the inability under this Act to enforce such contract against   a   candidate   shall   not   relieve   such   candidate   from   the consequences  of  any  corrupt  or  illegal  practices  committed  by  the election  agent  or  assistant  agent  of  his  group  with  the  consent  or connivance of such candidate.",
            "description": [
                {
                    "representation": "(1)",
                    "description": "The election agent of a group of candidates shall appoint every clerk and messenger employed for payment on behalf of the group at the election and shall hire every committee room hired on behalf of the group."
                },
                {
                    "representation": "(2)",
                    "description": "A contract whereby any expenses are incurred on account of or in respect of the conduct or the management of the election shall not be enforceable against a candidate unless made by the candidate or by the election agent of the group to which the candidate belongs:  Provided that the inability under this Act to enforce such contract against   a   candidate   shall   not   relieve   such   candidate   from   the consequences  of  any  corrupt  or  illegal  practices  committed  by  the election  agent  or  assistant  agent  of  his  group  with  the  consent  or connivance of such candidate."
                }
            ]
        }
    },
    {
        "act": "REPRESENTATION OF THE PEOPLE ACT",
        "source": "https://mola.gov.gy/laws-of-guyana",
        "type": {
            "name": "section",
            "representation": "104",
            "title": "Payment of expenses. ",
            "context": "REPRESENTATION OF THE PEOPLE ACT under Payment of expenses. 104.  (1) Except as permitted by this section or in pursuance of section 111, no payment and no advance or deposit shall be made by a candidate or  by any other person  at any time  in respect  of election  expenses LAWS OF GUYANA 128 Cap. 1:03 Representation of the People   L.R.O. 1/2012                                Petty and overseas expenditure. [16 of 1968]                  otherwise  than  by  or  through  the  election  agent  of  the  group  of candidates to which the candidate belongs.   (2) A candidate may pay personal expenses incurred by him on account of or in connection with or incidental to the election to an amount not exceeding  twenty-five  thousand  dollars;  and such candidate  shall send to the election agent of his group of candidates not later than the 14th day after the declaration of the results of the election under section 99 a written statement of personal expenses so paid.  (3) Any personal expenses in excess of twenty-five thousand dollars incurred by a candidate shall be paid by the election agent.  (4) If a candidate pays personal expenses in excess of the sum specified in subsection (2) he shall be guilty of an illegal practice.",
            "description": [
                {
                    "representation": "(1)",
                    "description": "Except as permitted by this section or in pursuance of section 111, no payment and no advance or deposit shall be made by a candidate or  by any other person  at any time  in respect  of election  expenses LAWS OF GUYANA 128 Cap. 1:03 Representation of the People   L.R.O. 1/2012                                Petty and overseas expenditure. [16 of 1968]                  otherwise  than  by  or  through  the  election  agent  of  the  group  of candidates to which the candidate belongs."
                },
                {
                    "representation": "(2)",
                    "description": "he shall be guilty of an illegal practice."
                },
                {
                    "representation": "(3)",
                    "description": "Any personal expenses in excess of twenty-five thousand dollars incurred by a candidate shall be paid by the election agent."
                },
                {
                    "representation": "(4)",
                    "description": "If a candidate pays personal expenses in excess of the sum specified in subsection"
                }
            ]
        }
    },
    {
        "act": "REPRESENTATION OF THE PEOPLE ACT",
        "source": "https://mola.gov.gy/laws-of-guyana",
        "type": {
            "name": "section",
            "representation": "105",
            "title": "Petty and overseas expenditure. ",
            "context": "REPRESENTATION OF THE PEOPLE ACT under Petty and overseas expenditure. 105.(1) A person authorised in that behalf by an election agent may pay  any  necessary  expenses  for  stationery,  postage,  telegrams  and other petty expenses, or may pay any expenses incurred outside Guyana on account  of or in respect of the conduct or the management of the election, to a total amount not exceeding that named in the authority; and such person shall send to the election agent not later than the 14th day after the declaration of the results of the election under section 99 a written statement of the payments so made together with particulars thereof.   (2) Any petty expenses incurred in excess of the amount named in the authority of the election agent shall be paid by the election agent.    LAWS OF GUYANA Representation of the People Cap. 1:03 129  L.R.O. 1/2012 Maximum expenses. [Reg. 32/1964 16 of 1968 24 of 1990]                                                       c. 19:08",
            "description": [
                {
                    "representation": "(1)",
                    "description": "A person authorised in that behalf by an election agent may pay  any  necessary  expenses  for  stationery,  postage,  telegrams  and other petty expenses, or may pay any expenses incurred outside Guyana on account  of or in respect of the conduct or the management of the election, to a total amount not exceeding that named in the authority; and such person shall send to the election agent not later than the 14th day after the declaration of the results of the election under section 99 a written statement of the payments so made together with particulars thereof."
                },
                {
                    "representation": "(2)",
                    "description": "Any petty expenses incurred in excess of the amount named in the authority of the election agent shall be paid by the election agent.    LAWS OF GUYANA Representation of the People Cap. 1:03 129  L.R.O. 1/2012 Maximum expenses. [Reg. 32/1964 16 of 1968 24 of 1990]                                                       c. 19:08"
                }
            ]
        }
    },
    {
        "act": "REPRESENTATION OF THE PEOPLE ACT",
        "source": "https://mola.gov.gy/laws-of-guyana",
        "type": {
            "name": "section",
            "representation": "106",
            "title": "Maximum expenses. ",
            "context": "REPRESENTATION OF THE PEOPLE ACT under Maximum expenses. 106.  (1) No expense shall be incurred by or on behalf of a group of candidates  and  no  payment  shall  be  made  on  their  behalf  whether before, during or after the election, on account of or in respect of the conduct and management of the election  (a)      in excess of the sum of fifty thousand dollars multiplied by  the number of candidates not exceeding 53 on the list of candidates;  (b)    for purposes other than the following  (i)   the  expenses  of  printing,  advertising, publishing, issuing and distributing addresses and notices; (ii)  the  expense  of stationery,  messages,  postages  and telegrams; (iii)   the expense of holding public meetings and holding outside Guyana meetings open to electors generally; (iv)  the  expenses of committee rooms, no more than one such room being situated in each district within the meaning of the National Registration  Act; (v)   expenses  permitted  under section 118;  (vi) the personal expenses of candidates.  (2) In determining the total expenditure incurred LAWS OF GUYANA 130 Cap. 1:03 Representation of the People   L.R.O. 1/2012                    Remuneration of election agent.          Election expenses return and declarations. [24 of 1990] Form",
            "description": [
                {
                    "representation": "(1)",
                    "description": "No expense shall be incurred by or on behalf of a group of candidates  and  no  payment  shall  be  made  on  their  behalf  whether before, during or after the election, on account of or in respect of the conduct and management of the election"
                },
                {
                    "representation": "(a)",
                    "description": "in excess of the sum of fifty thousand dollars multiplied by  the number of candidates not exceeding 53 on the list of candidates;"
                },
                {
                    "representation": "(b)",
                    "description": "for purposes other than the following"
                },
                {
                    "representation": "(i)",
                    "description": "the  expenses  of  printing,  advertising, publishing, issuing and distributing addresses and notices;"
                },
                {
                    "representation": "(v)",
                    "description": "expenses  permitted  under section 118;"
                },
                {
                    "representation": "(2)",
                    "description": "In determining the total expenditure incurred LAWS OF GUYANA 130 Cap. 1:03 Representation of the People   L.R.O. 1/2012                    Remuneration of election agent.          Election expenses return and declarations. [24 of 1990] Form"
                }
            ]
        }
    },
    {
        "act": "REPRESENTATION OF THE PEOPLE ACT",
        "source": "https://mola.gov.gy/laws-of-guyana",
        "type": {
            "name": "section",
            "representation": "107",
            "title": "Remuneration of election agent. ",
            "context": "REPRESENTATION OF THE PEOPLE ACT under Remuneration of election agent. 107.  So far as circumstances permit, this Part shall apply to a claim for his remuneration by an election agent and to the payment thereof in like manner as if he were any other creditor; and, if there is any dispute as to the amount due, such claim shall be a disputed claim within the meaning of this Part and dealt with accordingly.",
            "description": "So far as circumstances permit, this Part shall apply to a claim for his remuneration by an election agent and to the payment thereof in like manner as if he were any other creditor; and, if there is any dispute as to the amount due, such claim shall be a disputed claim within the meaning of this Part and dealt with accordingly."
        }
    },
    {
        "act": "REPRESENTATION OF THE PEOPLE ACT",
        "source": "https://mola.gov.gy/laws-of-guyana",
        "type": {
            "name": "section",
            "representation": "108",
            "title": "Elections expenses return and declarations. ",
            "context": "REPRESENTATION OF THE PEOPLE ACT under Elections expenses return and declarations. 108. (1) Not later than the 35th day after the declaration of the results of the election under section 99 the election agent of each group of candidates shall forward to the Chief Election Officer a return which shall be in Form 26 and shall contain statements of  (a)    all  payments  made by the election agent;  (b)    the   amount   of  personal expenses   paid by each of the candidates;  (c)    all   disputed   claims  of  which the election agent is aware;     LAWS OF GUYANA Representation of the People Cap. 1:03 131  L.R.O. 1/2012                                           Form",
            "description": [
                {
                    "representation": "(1)",
                    "description": "Not later than the 35th day after the declaration of the results of the election under section 99 the election agent of each group of candidates shall forward to the Chief Election Officer a return which shall be in Form 26 and shall contain statements of"
                },
                {
                    "representation": "(a)",
                    "description": "all  payments  made by the election agent;"
                },
                {
                    "representation": "(b)",
                    "description": "the   amount   of  personal expenses   paid by each of the candidates;"
                },
                {
                    "representation": "(c)",
                    "description": "all   disputed   claims  of  which the election agent is aware;     LAWS OF GUYANA Representation of the People Cap. 1:03 131  L.R.O. 1/2012                                           Form"
                }
            ]
        }
    },
    {
        "act": "REPRESENTATION OF THE PEOPLE ACT",
        "source": "https://mola.gov.gy/laws-of-guyana",
        "type": {
            "name": "section",
            "representation": "109",
            "title": "Publication of summary of election expenses return. ",
            "context": "REPRESENTATION OF THE PEOPLE ACT under Publication of summary of election expenses return. 109. (1) The Chief Election Officer shall, as soon as may be after the receipt of each election expenses return, cause to be published in the Gazette a summary thereof, accompanied by a notice of the time and place   at  which   the   election   expenses   return   and   accompanying documents and the election expenses declarations  can be inspected.   (2) Election expenses returns and accompanying documents and election  expenses declarations  shall at all reasonable  times  during a period of two years after their receipt be open to inspection at the office of  the Chief Election  Officer by any person on payment of a fee of fifteen dollars; and the Chief Election Officer shall on demand furnish copies thereof or of part thereof on payment of a fee of fifteen dollars for every  one hundred and twenty words or part of one hundred and twenty  words.   (3) After the expiration of two years the Chief   LAWS OF GUYANA Representation of the People Cap. 1:03 133  L.R.O. 1/2012          Authorised excuse for failure to submit return and declarations.  [6 of 1997]                                  Election Officer may cause the election expenses return and accompanying documents and  the  election  expenses  declarations  to  be  destroyed  unless  any election agent requires them to be sent to him.",
            "description": [
                {
                    "representation": "(1)",
                    "description": "The Chief Election Officer shall, as soon as may be after the receipt of each election expenses return, cause to be published in the Gazette a summary thereof, accompanied by a notice of the time and place   at  which   the   election   expenses   return   and   accompanying documents and the election expenses declarations  can be inspected."
                },
                {
                    "representation": "(2)",
                    "description": "Election expenses returns and accompanying documents and election  expenses declarations  shall at all reasonable  times  during a period of two years after their receipt be open to inspection at the office of  the Chief Election  Officer by any person on payment of a fee of fifteen dollars; and the Chief Election Officer shall on demand furnish copies thereof or of part thereof on payment of a fee of fifteen dollars for every  one hundred and twenty words or part of one hundred and twenty  words."
                },
                {
                    "representation": "(3)",
                    "description": "After the expiration of two years the Chief   LAWS OF GUYANA Representation of the People Cap. 1:03 133  L.R.O. 1/2012          Authorised excuse for failure to submit return and declarations.  [6 of 1997]                                  Election Officer may cause the election expenses return and accompanying documents and  the  election  expenses  declarations  to  be  destroyed  unless  any election agent requires them to be sent to him."
                }
            ]
        }
    },
    {
        "act": "REPRESENTATION OF THE PEOPLE ACT",
        "source": "https://mola.gov.gy/laws-of-guyana",
        "type": {
            "name": "section",
            "representation": "110",
            "title": "Authorised excuse for failure to submit return and declarations. ",
            "context": "REPRESENTATION OF THE PEOPLE ACT under Authorised excuse for failure to submit return and declarations. 110.  (1) Where   the   election   expenses   return   or   any   expenses declaration has not been submitted as required by section 120, or having been submitted contains an error or a false statement, then  (a)    if any candidate applies to the High Court, and shows that his failure to submit an election expenses declaration or any part thereof, or any error or false statement therein has arisen by reason of his illness, or of the absence, death, illness or misconduct of another candidate or of the election agent or of an assistant agent or of any clerk or officer employed by the  election  agent, or by reason of inadvertence  or of any reasonable cause of a like nature, and not by reason of any want of good faith on the part of the applicant; or  (b)     if an election agent applies to the High Court and shows that  his failure to submit the return and his declaration,  or either  of them,  or any part  thereof,  or any error  or false statement therein, has arisen by reason of his illness, or by reason  of  the  absence,  death,  illness  or  misconduct  of  a candidate or of a LAWS OF GUYANA 134 Cap. 1:03 Representation of the People   L.R.O. 1/2012                                                 former election agent of the group or of an assistant  agent or of any clerk or officer employed by the election  agent,  or  by  reason  of  inadvertence  or  of  any reasonable cause of a like nature, and not by reason of any want of good faith on the part of the applicant;  the court may, on being satisfied that notice of the application has been published in two newspapers circulating in Guyana, and on production of such evidence of the grounds stated in the application, and of the good faith of the application, and otherwise, as to the court seems fit, make an order allowing an authorised excuse for the failure to submit the return or any declaration as the case may be or for any error or a false statement therein, as to the court seems just.  (2) Where it appears to the court that any person being or having been a candidate,  an election  agent or assistant  agent has refused or failed to make such return or declaration or supply such particulars as to  enable  any  candidate  or  an  election  agent  to  comply  with  any requirement imposed on him by section 120, the court, before making an order allowing an authorised excuse, shall order such person to attend before the court; and, on his attendance shall, unless he shows cause to the contrary, order him to make and deliver such return or declaration or  supply such particulars  within such time and to such person and in such manner as to the court seems just, or may order him to be examined with respect to such particulars, and may, in default of compliance with any  such order, order him to pay a fine of thirty-two  thousand  five hundred dollars.   LAWS OF GUYANA Representation of the People Cap. 1:03 135  L.R.O. 1/2012                             Period of claims for payment of election expenses. [16 of 1968]                   (3) An  order  allowing  an  authorised  excuse  may  be  made conditional upon  the  making  of the  election  expenses  return  or any election expenses declaration or upon the making of them in a modified form or within an extended time and upon the compliance  with such other terms as to the court seem best calculated for carrying into effect the  objects  of these regulations;  and an order allowing  an authorised excuse  shall  relieve  the applicant  for the order from any liability  or consequences under this Act in respect of the matter excused by the order.   (4) The date of the order allowing an authorised  excuse, or if conditions and terms are to be complied with, the date on which the applicant for the order fully complies with them, is in this Act referred to as the date of the allowance of the excuse.",
            "description": [
                {
                    "representation": "(1)",
                    "description": "Where   the   election   expenses   return   or   any   expenses declaration has not been submitted as required by section 120, or having been submitted contains an error or a false statement, then"
                },
                {
                    "representation": "(a)",
                    "description": "if any candidate applies to the High Court, and shows that his failure to submit an election expenses declaration or any part thereof, or any error or false statement therein has arisen by reason of his illness, or of the absence, death, illness or misconduct of another candidate or of the election agent or of an assistant agent or of any clerk or officer employed by the  election  agent, or by reason of inadvertence  or of any reasonable cause of a like nature, and not by reason of any want of good faith on the part of the applicant; or"
                },
                {
                    "representation": "(b)",
                    "description": "if an election agent applies to the High Court and shows that  his failure to submit the return and his declaration,  or either  of them,  or any part  thereof,  or any error  or false statement therein, has arisen by reason of his illness, or by reason  of  the  absence,  death,  illness  or  misconduct  of  a candidate or of a LAWS OF GUYANA 134 Cap. 1:03 Representation of the People   L.R.O. 1/2012                                                 former election agent of the group or of an assistant  agent or of any clerk or officer employed by the election  agent,  or  by  reason  of  inadvertence  or  of  any reasonable cause of a like nature, and not by reason of any want of good faith on the part of the applicant;  the court may, on being satisfied that notice of the application has been published in two newspapers circulating in Guyana, and on production of such evidence of the grounds stated in the application, and of the good faith of the application, and otherwise, as to the court seems fit, make an order allowing an authorised excuse for the failure to submit the return or any declaration as the case may be or for any error or a false statement therein, as to the court seems just."
                },
                {
                    "representation": "(2)",
                    "description": "Where it appears to the court that any person being or having been a candidate,  an election  agent or assistant  agent has refused or failed to make such return or declaration or supply such particulars as to  enable  any  candidate  or  an  election  agent  to  comply  with  any requirement imposed on him by section 120, the court, before making an order allowing an authorised excuse, shall order such person to attend before the court; and, on his attendance shall, unless he shows cause to the contrary, order him to make and deliver such return or declaration or  supply such particulars  within such time and to such person and in such manner as to the court seems just, or may order him to be examined with respect to such particulars, and may, in default of compliance with any  such order, order him to pay a fine of thirty-two  thousand  five hundred dollars.   LAWS OF GUYANA Representation of the People Cap. 1:03 135  L.R.O. 1/2012                             Period of claims for payment of election expenses. [16 of 1968]"
                },
                {
                    "representation": "(3)",
                    "description": "An  order  allowing  an  authorised  excuse  may  be  made conditional upon  the  making  of the  election  expenses  return  or any election expenses declaration or upon the making of them in a modified form or within an extended time and upon the compliance  with such other terms as to the court seem best calculated for carrying into effect the  objects  of these regulations;  and an order allowing  an authorised excuse  shall  relieve  the applicant  for the order from any liability  or consequences under this Act in respect of the matter excused by the order."
                },
                {
                    "representation": "(4)",
                    "description": "The date of the order allowing an authorised  excuse, or if conditions and terms are to be complied with, the date on which the applicant for the order fully complies with them, is in this Act referred to as the date of the allowance of the excuse."
                }
            ]
        }
    },
    {
        "act": "REPRESENTATION OF THE PEOPLE ACT",
        "source": "https://mola.gov.gy/laws-of-guyana",
        "type": {
            "name": "section",
            "representation": "111",
            "title": "Period of claims for payment of election expenses. ",
            "context": "REPRESENTATION OF THE PEOPLE ACT under Period of claims for payment of election expenses. 111.  (1) Every claim against any candidate or  against  an  election agent in respect of any expenses incurred on account of or in respect of the conduct or management of an election shall be sent to the election agent not later than the 14th day after the publication under section 99 of the results of the election.   (2) Any such claim as is specified in subsection (1) which is not sent to the election agent within the time therein prescribed shall be barred and not paid.  (3) An election agent who pays a claim in contravention of subsection (2) shall be guilty of an illegal practice.  (4) All  expenses  incurred  on  account  of  or  in  LAWS OF GUYANA 136 Cap. 1:03 Representation of the People   L.R.O. 1/2012                                                 respect  of  the conduct or management of the election shall be paid not later than the 28th day after the publication under section 99 of the results of the election.  (5) An election agent who makes a payment in contravention of subsection (4) shall be guilty of an illegal practice.  (6) If an election agent disputes any claim received by him within the time limited by subsection (1) or if he refuses or fails to pay such claim within the period mentioned in subsection (4), such claim shall be deemed to be a disputed claim.  (7) A claimant may, if he thinks fit, bring an action for a disputed claim in any competent court; and anything paid by a candidate or by an election agent in pursuance of the judgment or order of the court shall be deemed to be paid within the time limited by subsection (1) and to be an exception from the provisions of this Act requiring claims to be paid by the election agent.  (8) The High Court may, on application by the claimant or by a candidate or by an election agent and on cause shown to its satisfaction, by order give leave for the payment by a candidate or by an election agent of a disputed claim or for a claim in respect of expenses incurred on account of or in respect of the conduct or management of an election, notwithstanding that such claim was sent after the time limit prescribed by subsection (1), and notwithstanding the sending of such claim to a candidate and not to the election agent.  (9) Any sum specified in any order of the court made under subsection (8) may be paid by a candidate or   LAWS OF GUYANA Representation of the People Cap. 1:03 137  L.R.O. 1/2012         Exemption of act done in good faith from being an illegal practice. [16 of 1968]                                  by an election agent and when paid in pursuance of such order shall be deemed to be paid within the time limited by subsection (1).",
            "description": [
                {
                    "representation": "(1)",
                    "description": "and to be an exception from the provisions of this Act requiring claims to be paid by the election agent."
                },
                {
                    "representation": "(2)",
                    "description": "shall be guilty of an illegal practice."
                },
                {
                    "representation": "(3)",
                    "description": "An election agent who pays a claim in contravention of subsection"
                },
                {
                    "representation": "(4)",
                    "description": "shall be guilty of an illegal practice."
                },
                {
                    "representation": "(5)",
                    "description": "An election agent who makes a payment in contravention of subsection"
                },
                {
                    "representation": "(6)",
                    "description": "If an election agent disputes any claim received by him within the time limited by subsection"
                },
                {
                    "representation": "(7)",
                    "description": "A claimant may, if he thinks fit, bring an action for a disputed claim in any competent court; and anything paid by a candidate or by an election agent in pursuance of the judgment or order of the court shall be deemed to be paid within the time limited by subsection"
                },
                {
                    "representation": "(8)",
                    "description": "may be paid by a candidate or   LAWS OF GUYANA Representation of the People Cap. 1:03 137  L.R.O. 1/2012         Exemption of act done in good faith from being an illegal practice. [16 of 1968]                                  by an election agent and when paid in pursuance of such order shall be deemed to be paid within the time limited by subsection"
                },
                {
                    "representation": "(9)",
                    "description": "Any sum specified in any order of the court made under subsection"
                }
            ]
        }
    },
    {
        "act": "REPRESENTATION OF THE PEOPLE ACT",
        "source": "https://mola.gov.gy/laws-of-guyana",
        "type": {
            "name": "section",
            "representation": "112",
            "title": "Exemption of act done in good faith from being an illegal practice. ",
            "context": "REPRESENTATION OF THE PEOPLE ACT under Exemption of act done in good faith from being an illegal practice. 112.  Where, on application made, it is shown to the High Court by such evidence as to the court seems sufficient that  (a)     any   act    or omission of any candidate or of any election agent or of any other agent or person, would, by reason of being a  payment,  contract,  engagement,  employment  or hiring,  or  the  incurring  of  an  expense  in  excess  of  the maximum allowed, in contravention of any of the provisions of this Act pertaining thereto, be but for this section an illegal practice, payment, employment or hiring; and  (b)  such act or omission arose from inadvertence or from accidental  miscalculation   or  from  some  other  reasonable cause of a like nature, and in any case did not arise from any want of good faith; and  (c)   notice  of the application  has been  published  in two newspapers circulating in Guyana,  and in the circumstances  it seems  to the court  to be just  that  such candidate, election agent and other agent or person, or certain of them should not be subject to any of LAWS OF GUYANA 138 Cap. 1:03 Representation of the People   L.R.O. 1/2012                Saving for creditors.             Prohibition   of expenses not authorised by election agent.  [16 of 1968 24 of 1990]               the consequences under this Act of the act  or omission  the court  may make  an order  allowing  such act  or omission to be an exception from the provisions of this Act which would otherwise make  the  same  an illegal  practice,  payment,  employment, hiring or an incurring of an expense in excess of the maximum allowed, and such candidate, election agent or other agent or person as the court may specify in its order shall not be subject to any of the consequences under this Act of the act or omission.",
            "description": [
                {
                    "representation": "(a)",
                    "description": "any   act    or omission of any candidate or of any election agent or of any other agent or person, would, by reason of being a  payment,  contract,  engagement,  employment  or hiring,  or  the  incurring  of  an  expense  in  excess  of  the maximum allowed, in contravention of any of the provisions of this Act pertaining thereto, be but for this section an illegal practice, payment, employment or hiring; and"
                },
                {
                    "representation": "(b)",
                    "description": "such act or omission arose from inadvertence or from accidental  miscalculation   or  from  some  other  reasonable cause of a like nature, and in any case did not arise from any want of good faith; and"
                },
                {
                    "representation": "(c)",
                    "description": "notice  of the application  has been  published  in two newspapers circulating in Guyana,  and in the circumstances  it seems  to the court  to be just  that  such candidate, election agent and other agent or person, or certain of them should not be subject to any of LAWS OF GUYANA 138 Cap. 1:03 Representation of the People   L.R.O. 1/2012                Saving for creditors.             Prohibition   of expenses not authorised by election agent.  [16 of 1968 24 of 1990]               the consequences under this Act of the act  or omission  the court  may make  an order  allowing  such act  or omission to be an exception from the provisions of this Act which would otherwise make  the  same  an illegal  practice,  payment,  employment, hiring or an incurring of an expense in excess of the maximum allowed, and such candidate, election agent or other agent or person as the court may specify in its order shall not be subject to any of the consequences under this Act of the act or omission."
                }
            ]
        }
    },
    {
        "act": "REPRESENTATION OF THE PEOPLE ACT",
        "source": "https://mola.gov.gy/laws-of-guyana",
        "type": {
            "name": "section",
            "representation": "113",
            "title": "Saving for creditors. ",
            "context": "REPRESENTATION OF THE PEOPLE ACT under Saving for creditors. 113.  The  provisions  of  this  Act  prohibiting  certain  payments  and contracts for payments, and the payment of any sum and the incurring of any expense in excess of the prescribed maximum, shall not affect the rights of any creditor who when the contract was made or the expense incurred  was ignorant that such contract,  payment or expense was in contravention of this Act.",
            "description": "The  provisions  of  this  Act  prohibiting  certain  payments  and contracts for payments, and the payment of any sum and the incurring of any expense in excess of the prescribed maximum, shall not affect the rights of any creditor who when the contract was made or the expense incurred  was ignorant that such contract,  payment or expense was in contravention of this Act."
        }
    },
    {
        "act": "REPRESENTATION OF THE PEOPLE ACT",
        "source": "https://mola.gov.gy/laws-of-guyana",
        "type": {
            "name": "section",
            "representation": "114",
            "title": "Prohibition of expenses not authorised by election agent. ",
            "context": "REPRESENTATION OF THE PEOPLE ACT under Prohibition of expenses not authorised by election agent. 114.  (1) No expenses shall, with a view to promoting or procuring the election of a group of candidates, be incurred by any person other than the election agent of the group or by a person authorised in writing by him on account of  (a)   holding any meetings mentioned in section 106(1)(b)(iii) or organising  (i)       any public display; or (ii)      any  display,  outside   Guyana,   open    to  electors  generally;  (b)   issuing  advertisements, circulars or publications;  (c)      otherwise presenting to the electors   LAWS OF GUYANA Representation of the People Cap. 1:03 139  L.R.O. 1/2012                                                  the candidates of the group or any of them or their views or the extent or nature of  their  backing or of disparaging the candidates  of another group or any of them:  Provided that paragraph (c) shall not  (i)   restrict the publication of any matter relating to the election in a newspaper or other periodical; or (ii)  apply to any expenses not exceeding in the aggregate the sum of one hundred dollars which may be incurred by an individual  and  are  not  incurred  in  pursuance  of  a  plan suggested  by  or  concerted  with  others,  or  to  expenses incurred by any person  travelling  or in living  away from home or similar personal expenses.  (2) Any  person  other  than  an  election   agent  or  a  person authorised  in  that  behalf  in  writing  by  him  who  incurs  expenses prohibited by subsection (l) shall be guilty of a corrupt practice.  (3) Any expenses incurred on account of any purpose referred to in subsection (1) and duly authorised by the election agent shall be returned as part of the election expenses of the group of candidates.  LAWS OF GUYANA 140 Cap. 1:03 Representation of the People   L.R.O. 1/2012      False election expenses declarations. [16 of 1968]                  Providing money for illegal purposes.                 Corrupt withdrawal of candidate.          Prohibition   of certain forms of employment. [16 of 1968]",
            "description": [
                {
                    "representation": "(1)",
                    "description": "and duly authorised by the election agent shall be returned as part of the election expenses of the group of candidates.  LAWS OF GUYANA 140 Cap. 1:03 Representation of the People   L.R.O. 1/2012      False election expenses declarations. [16 of 1968]                  Providing money for illegal purposes.                 Corrupt withdrawal of candidate.          Prohibition   of certain forms of employment. [16 of 1968]"
                },
                {
                    "representation": "(a)",
                    "description": "holding any meetings mentioned in section 106(1)(b)(iii) or organising"
                },
                {
                    "representation": "(i)",
                    "description": "restrict the publication of any matter relating to the election in a newspaper or other periodical; or"
                },
                {
                    "representation": "(b)",
                    "description": "issuing  advertisements, circulars or publications;"
                },
                {
                    "representation": "(c)",
                    "description": "shall not"
                },
                {
                    "representation": "(2)",
                    "description": "Any  person  other  than  an  election   agent  or  a  person authorised  in  that  behalf  in  writing  by  him  who  incurs  expenses prohibited by subsection"
                },
                {
                    "representation": "(l)",
                    "description": "shall be guilty of a corrupt practice."
                },
                {
                    "representation": "(3)",
                    "description": "Any expenses incurred on account of any purpose referred to in subsection"
                }
            ]
        }
    },
    {
        "act": "REPRESENTATION OF THE PEOPLE ACT",
        "source": "https://mola.gov.gy/laws-of-guyana",
        "type": {
            "name": "section",
            "representation": "115",
            "title": "False election expenses declarations.  PART XIII ILLEGAL PAYMENT, EMPLOYMENT, HIRING  ",
            "context": "REPRESENTATION OF THE PEOPLE ACT under False election expenses declarations.  PART XIII ILLEGAL PAYMENT, EMPLOYMENT, HIRING  115.  Any candidate or election agent who makes an election expenses declaration containing any statement false in fact, which he knows or believes to be false or does not believe to be true, shall be guilty of a corrupt practice.  PART  XIII ILLEGAL  PAYMENT  EMPLOYMENT  HIRING",
            "description": "Any candidate or election agent who makes an election expenses declaration containing any statement false in fact, which he knows or believes to be false or does not believe to be true, shall be guilty of a corrupt practice.  PART  XIII ILLEGAL  PAYMENT  EMPLOYMENT  HIRING"
        }
    },
    {
        "act": "REPRESENTATION OF THE PEOPLE ACT",
        "source": "https://mola.gov.gy/laws-of-guyana",
        "type": {
            "name": "section",
            "representation": "116",
            "title": "Providing money for illegal purposes. ",
            "context": "REPRESENTATION OF THE PEOPLE ACT under Providing money for illegal purposes. 116.  Any person who knowingly provides money  (a)    for any payment which is contrary to this Act;  (b)  for any expenses in excess of the maximum allowed by this  Act;  (c)       to replace any money expended in any such payment or  expenses,  shall be guilty of illegal payment.",
            "description": [
                {
                    "representation": "(a)",
                    "description": "for any payment which is contrary to this Act;"
                },
                {
                    "representation": "(b)",
                    "description": "for any expenses in excess of the maximum allowed by this  Act;"
                },
                {
                    "representation": "(c)",
                    "description": "to replace any money expended in any such payment or  expenses,  shall be guilty of illegal payment."
                }
            ]
        }
    },
    {
        "act": "REPRESENTATION OF THE PEOPLE ACT",
        "source": "https://mola.gov.gy/laws-of-guyana",
        "type": {
            "name": "section",
            "representation": "117",
            "title": "Corrupt withdrawal of candidate. ",
            "context": "REPRESENTATION OF THE PEOPLE ACT under Corrupt withdrawal of candidate. 117.  Any person who corruptly induces or procures any other person to withdraw from being a candidate at an election, in consideration of any payment or promise of payment shall be guilty of illegal payment; and any    person withdrawing   in pursuance   of   such   inducement   or procurement, shall also be guilty of illegal payment.",
            "description": "Any person who corruptly induces or procures any other person to withdraw from being a candidate at an election, in consideration of any payment or promise of payment shall be guilty of illegal payment; and any    person withdrawing   in pursuance   of   such   inducement   or procurement, shall also be guilty of illegal payment."
        }
    },
    {
        "act": "REPRESENTATION OF THE PEOPLE ACT",
        "source": "https://mola.gov.gy/laws-of-guyana",
        "type": {
            "name": "section",
            "representation": "118",
            "title": "Prohibition of certain forms of employment. ",
            "context": "REPRESENTATION OF THE PEOPLE ACT under Prohibition of certain forms of employment. 118.  (1) No person shall, for the purpose of promoting or procuring the election of a group of candidates at an election be engaged or employed for payment or promise of payment for any purpose or in any capacity whatsoever, except for the following  (a)      one election agent;   LAWS OF GUYANA Representation of the People Cap. 1:03 141  L.R.O. 1/2012                                Illegal hiring of transport  for electors.                (b)      one assistant agent for each district;  (c)    one  polling  agent  in  each polling place;   (d)      one counting agent for each district;  (e)    two clerks  and two messengers  for each  committee room;  (f)     persons to  exercise  outside  Guyana  such  authority mentioned in section 105 or 114 as may be conferred upon them, respectively.  (2) If any person is engaged or employed in contravention of this section the person engaging or employing him shall be guilty of illegal employment; and the person so engaged or employed shall also be guilty of illegal employment if he knew that he was so engaged or employed contrary to law.",
            "description": [
                {
                    "representation": "(1)",
                    "description": "No person shall, for the purpose of promoting or procuring the election of a group of candidates at an election be engaged or employed for payment or promise of payment for any purpose or in any capacity whatsoever, except for the following"
                },
                {
                    "representation": "(a)",
                    "description": "one election agent;   LAWS OF GUYANA Representation of the People Cap. 1:03 141  L.R.O. 1/2012                                Illegal hiring of transport  for electors."
                },
                {
                    "representation": "(b)",
                    "description": "one assistant agent for each district;"
                },
                {
                    "representation": "(c)",
                    "description": "one  polling  agent  in  each polling place;"
                },
                {
                    "representation": "(d)",
                    "description": "one counting agent for each district;"
                },
                {
                    "representation": "(e)",
                    "description": "two clerks  and two messengers  for each  committee room;"
                },
                {
                    "representation": "(f)",
                    "description": "persons to  exercise  outside  Guyana  such  authority mentioned in section 105 or 114 as may be conferred upon them, respectively."
                },
                {
                    "representation": "(2)",
                    "description": "If any person is engaged or employed in contravention of this section the person engaging or employing him shall be guilty of illegal employment; and the person so engaged or employed shall also be guilty of illegal employment if he knew that he was so engaged or employed contrary to law."
                }
            ]
        }
    },
    {
        "act": "REPRESENTATION OF THE PEOPLE ACT",
        "source": "https://mola.gov.gy/laws-of-guyana",
        "type": {
            "name": "section",
            "representation": "119",
            "title": "Illegal hiring of transport for electors. ",
            "context": "REPRESENTATION OF THE PEOPLE ACT under Illegal hiring of transport for electors. 119. (1) No person shall let, lend or employ for the purposes of the conveyance of electors to or from the poll, any public stage or hackney carriage, or any horse or other animal kept or used for drawing the same, or any carriage, horse or other animal which he keeps or uses for the purpose of letting out for hire; and any person who contravenes this subsection knowing the purpose of the letting, lending or hiring shall be guilty of illegal hiring.   (2) No person shall hire, borrow or use for the purpose of the conveyance of electors to or from the poll any carriage, horse or other animal which he knows the owner thereof is prohibited by subsection (1) from letting, LAWS OF GUYANA 142 Cap. 1:03 Representation of the People   L.R.O. 1/2012                       Use of certain premises as committee room prohibited.                              lending or employing; and any person who contravenes this subsection shall be guilty of illegal hiring. (3) Nothing  in  this  section  or  in  section  122  shall  prevent  a carriage, horse or other animal being let to or hired, employed or used by an elector or several electors at his own or their own joint cost, for the purpose of being conveyed to or from the poll.",
            "description": [
                {
                    "representation": "(1)",
                    "description": "from letting, LAWS OF GUYANA 142 Cap. 1:03 Representation of the People   L.R.O. 1/2012                       Use of certain premises as committee room prohibited.                              lending or employing; and any person who contravenes this subsection shall be guilty of illegal hiring."
                },
                {
                    "representation": "(2)",
                    "description": "No person shall hire, borrow or use for the purpose of the conveyance of electors to or from the poll any carriage, horse or other animal which he knows the owner thereof is prohibited by subsection"
                },
                {
                    "representation": "(3)",
                    "description": "Nothing  in  this  section  or  in  section  122  shall  prevent  a carriage, horse or other animal being let to or hired, employed or used by an elector or several electors at his own or their own joint cost, for the purpose of being conveyed to or from the poll."
                }
            ]
        }
    },
    {
        "act": "REPRESENTATION OF THE PEOPLE ACT",
        "source": "https://mola.gov.gy/laws-of-guyana",
        "type": {
            "name": "section",
            "representation": "120",
            "title": "Use of certain premises as committee room prohibited. ",
            "context": "REPRESENTATION OF THE PEOPLE ACT under Use of certain premises as committee room prohibited. 120.  (1) No person shall let, hire or use as a committee room for the purpose of promoting or procuring the election of a group of candidates at an election any of the following premises  (a)   any premises wherein the sale by wholesale or retail of any intoxicating liquor is authorised by any licence, whether such licence authorises the sale for consumption on or off the premises;  (b)    any premises where any intoxicating  liquor is sold or supplied to members of a club, society or association other than a permanent political club;  (c)     any   premises   wherein   refreshment   of   any   kind, whether food or drink, is ordinarily sold for consumption in the premises.  (2) Any person who hires or uses premises in contravention of subsection (1) shall be guilty of illegal hiring and any person who lets or permits to be used such premises or part thereof shall also, if he knew it was intended to use such premises or part thereof as a   LAWS OF GUYANA Representation of the People Cap. 1:03 143  L.R.O. 1/2012               Penalty for illegal payment, employment or hiring. [16 of 1968 6 of 1997]                     Certain expenditure to be illegal practice.     committee room, be guilty of illegal hiring.  (3) Nothing in this section shall apply to any part of premises described in subsection (1) which is ordinarily let for the purpose of chambers or offices or the holding of public meetings or arbitrations if such part has a separate entrance and no direct communication with any part of the premises on which intoxicating liquor or refreshment is sold or supplied.",
            "description": [
                {
                    "representation": "(1)",
                    "description": "which is ordinarily let for the purpose of chambers or offices or the holding of public meetings or arbitrations if such part has a separate entrance and no direct communication with any part of the premises on which intoxicating liquor or refreshment is sold or supplied."
                },
                {
                    "representation": "(a)",
                    "description": "any premises wherein the sale by wholesale or retail of any intoxicating liquor is authorised by any licence, whether such licence authorises the sale for consumption on or off the premises;"
                },
                {
                    "representation": "(b)",
                    "description": "any premises where any intoxicating  liquor is sold or supplied to members of a club, society or association other than a permanent political club;"
                },
                {
                    "representation": "(c)",
                    "description": "any   premises   wherein   refreshment   of   any   kind, whether food or drink, is ordinarily sold for consumption in the premises."
                },
                {
                    "representation": "(2)",
                    "description": "Any person who hires or uses premises in contravention of subsection"
                },
                {
                    "representation": "(3)",
                    "description": "Nothing in this section shall apply to any part of premises described in subsection"
                }
            ]
        }
    },
    {
        "act": "REPRESENTATION OF THE PEOPLE ACT",
        "source": "https://mola.gov.gy/laws-of-guyana",
        "type": {
            "name": "section",
            "representation": "121",
            "title": "Penalty for illegal payment, employment or hiring.   PART XIV ILLEGAL PRACTICES  ",
            "context": "REPRESENTATION OF THE PEOPLE ACT under Penalty for illegal payment, employment or hiring.   PART XIV ILLEGAL PRACTICES  121.  Any person guilty of an offence of illegal payment, employment or hiring shall be liable on summary conviction to a fine of thirty-two thousand five hundred dollars or, if the offence be not triable summarily by reason of anything comprehended therein having been done, omitted or   situated   anywhere   beyond   the  limits   of  summary   jurisdiction exercisable  in Guyana, he shall, unless it is proved that he was not a citizen of Guyana at the time of the offence, be liable upon conviction on indictment  in Guyana  to a  fine  of  sixty-five  thousand  dollars  or  to imprisonment for one year and any candidate or election agent who is guilty of such an offence shall be guilty of an illegal practice.   PART  XIV ILLEGAL  PRACTICES",
            "description": "Any person guilty of an offence of illegal payment, employment or hiring shall be liable on summary conviction to a fine of thirty-two thousand five hundred dollars or, if the offence be not triable summarily by reason of anything comprehended therein having been done, omitted or   situated   anywhere   beyond   the  limits   of  summary   jurisdiction exercisable  in Guyana, he shall, unless it is proved that he was not a citizen of Guyana at the time of the offence, be liable upon conviction on indictment  in Guyana  to a  fine  of  sixty-five  thousand  dollars  or  to imprisonment for one year and any candidate or election agent who is guilty of such an offence shall be guilty of an illegal practice.   PART  XIV ILLEGAL  PRACTICES"
        }
    },
    {
        "act": "REPRESENTATION OF THE PEOPLE ACT",
        "source": "https://mola.gov.gy/laws-of-guyana",
        "type": {
            "name": "section",
            "representation": "122",
            "title": "Certain expenditure to be illegal practice. ",
            "context": "REPRESENTATION OF THE PEOPLE ACT under Certain expenditure to be illegal practice. 122.  (1) No payment or contract shall, for the purpose of promoting the election of a group of candidates at an election, be made  (a)   on  account  of the conveyance of electors to or from the poll,  whether  for  the  hiring  of  horses  or  LAWS OF GUYANA 144 Cap. 1:03 Representation of the People   L.R.O. 1/2012                                           Disorderly behaviour  at election meeting.       False statements concerning candidates. carriages  or  for railway fares, water or air transport fares or otherwise; or (b)    to an elector on account of the use of any house, land, building or premises for the exhibition of any address, bill or notice, or on account of the exhibition of any address, bill or notice:  Provided that where it is the ordinary business of an elector as an advertising  agent  to  exhibit  for  payment  bills  and  advertisements,  a payment to or contract with such elector, if made in the ordinary course of  business,  shall  not be deemed  to be an illegal  practice  within the meaning of this section.  (2) If payment or contract for payment is knowingly made in contravention of this section either before, during or after an election, the person making such payment or contract for payment shall be guilty of an illegal practice; and any person receiving such payment, or being a party to any such contract, knowing it to be in contravention of this section, shall also be guilty of an illegal practice.",
            "description": [
                {
                    "representation": "(1)",
                    "description": "No payment or contract shall, for the purpose of promoting the election of a group of candidates at an election, be made"
                },
                {
                    "representation": "(a)",
                    "description": "on  account  of the conveyance of electors to or from the poll,  whether  for  the  hiring  of  horses  or  LAWS OF GUYANA 144 Cap. 1:03 Representation of the People   L.R.O. 1/2012                                           Disorderly behaviour  at election meeting.       False statements concerning candidates. carriages  or  for railway fares, water or air transport fares or otherwise; or"
                },
                {
                    "representation": "(b)",
                    "description": "to an elector on account of the use of any house, land, building or premises for the exhibition of any address, bill or notice, or on account of the exhibition of any address, bill or notice:  Provided that where it is the ordinary business of an elector as an advertising  agent  to  exhibit  for  payment  bills  and  advertisements,  a payment to or contract with such elector, if made in the ordinary course of  business,  shall  not be deemed  to be an illegal  practice  within the meaning of this section."
                },
                {
                    "representation": "(2)",
                    "description": "If payment or contract for payment is knowingly made in contravention of this section either before, during or after an election, the person making such payment or contract for payment shall be guilty of an illegal practice; and any person receiving such payment, or being a party to any such contract, knowing it to be in contravention of this section, shall also be guilty of an illegal practice."
                }
            ]
        }
    },
    {
        "act": "REPRESENTATION OF THE PEOPLE ACT",
        "source": "https://mola.gov.gy/laws-of-guyana",
        "type": {
            "name": "section",
            "representation": "123",
            "title": "Disorderly behaviour at election meeting. LAWS OF GUYANA Representation of the People Cap. 1:03 9  L.R.O. 1/2012               SECTION  ",
            "context": "REPRESENTATION OF THE PEOPLE ACT under Disorderly behaviour at election meeting. LAWS OF GUYANA Representation of the People Cap. 1:03 9  L.R.O. 1/2012               SECTION  123.  Every  person  who,  at  a  lawful  political  meeting  held  before election day, acts or incites any other person to act in a disorderly manner for the purpose of preventing the transaction of the business for which the meeting was called together shall be guilty of an illegal practice.",
            "description": "Every  person  who,  at  a  lawful  political  meeting  held  before election day, acts or incites any other person to act in a disorderly manner for the purpose of preventing the transaction of the business for which the meeting was called together shall be guilty of an illegal practice."
        }
    },
    {
        "act": "REPRESENTATION OF THE PEOPLE ACT",
        "source": "https://mola.gov.gy/laws-of-guyana",
        "type": {
            "name": "section",
            "representation": "124",
            "title": "False statements concerning candidates. ",
            "context": "REPRESENTATION OF THE PEOPLE ACT under False statements concerning candidates. 124. (1) Any person who, before or during an election, shall, for the purpose of affecting  the return of any group of candidates,  make or publish any false statement of fact   LAWS OF GUYANA Representation of the People Cap. 1:03 145  L.R.O. 1/2012                             Election publications.  [16 of 1968 6 of 1997]                   in relation to the personal character or conduct of the candidates of that group or any of them shall, subject to subsection (2), be guilty of an illegal practice.   (2) No person shall  be deemed  to be guilty of illegal  practice under this section if he can show that he had reasonable grounds for believing, and did believe, the statement made by him to be true.  (3) A person making or publishing a false statement  of fact in contravention  of  subsection  (1)  may  be  restrained  by  interim  or perpetual injunction by the High Court from any repetition of that false statement or of a false statement of a similar character in relation to the candidate, and, for the purposes of granting an interim injunction, prima facie proof of the falsity of the statement shall be sufficient.",
            "description": [
                {
                    "representation": "(1)",
                    "description": "may  be  restrained  by  interim  or perpetual injunction by the High Court from any repetition of that false statement or of a false statement of a similar character in relation to the candidate, and, for the purposes of granting an interim injunction, prima facie proof of the falsity of the statement shall be sufficient."
                },
                {
                    "representation": "(2)",
                    "description": "No person shall  be deemed  to be guilty of illegal  practice under this section if he can show that he had reasonable grounds for believing, and did believe, the statement made by him to be true."
                },
                {
                    "representation": "(3)",
                    "description": "A person making or publishing a false statement  of fact in contravention  of  subsection"
                }
            ]
        }
    },
    {
        "act": "REPRESENTATION OF THE PEOPLE ACT",
        "source": "https://mola.gov.gy/laws-of-guyana",
        "type": {
            "name": "section",
            "representation": "125",
            "title": "Election publications. ",
            "context": "REPRESENTATION OF THE PEOPLE ACT under Election publications. 125.  (1) No person shall  (a)       print or publish, or cause to be printed or published, any bill, placard or poster having reference to an election or any printed document distributed for the purpose of promoting or procuring the election of a group of candidates;  (b)      post   or   cause  to be posted any such bill, placard or poster as specified in paragraph (a);  (c)      distribute  or  cause  to  be  distributed  any printed document for the purpose specified in paragraph (a), LAWS OF GUYANA 146 Cap. 1:03 Representation of the People   L.R.O. 1/2012                                       Miscellaneous illegal practices. [22 of 1997 15 of 2000]              unless the bill, placard, poster or document bears upon the face thereof the names and addresses of the printer and publisher.  (2) For the purposes of this section, any process for multiplying copies of a document, other than copying it by hand, shall be deemed to be printing and the word printer shall be construed accordingly. (3) Any candidate,  or any election  agent who contravenes  this section shall be guilty of an illegal practice; and any other person who contravenes this section shall be liable on summary conviction to a fine of  thirty-two  thousand  five hundred dollars, or if the offence be not triable summarily by reason of anything comprehended therein having been done, omitted or situated anywhere beyond the limits of summary jurisdiction exercisable in Guyana, he shall, unless it is proved that he was not a citizen  of Guyana  at  the  time  of the  offence,  be liable  upon conviction on  indictment  in Guyana  to a fine of sixty-five  thousand dollars or to imprisonment for one year.",
            "description": [
                {
                    "representation": "(1)",
                    "description": "No person shall"
                },
                {
                    "representation": "(a)",
                    "description": "print or publish, or cause to be printed or published, any bill, placard or poster having reference to an election or any printed document distributed for the purpose of promoting or procuring the election of a group of candidates;"
                },
                {
                    "representation": "(b)",
                    "description": "post   or   cause  to be posted any such bill, placard or poster as specified in paragraph"
                },
                {
                    "representation": "(c)",
                    "description": "distribute  or  cause  to  be  distributed  any printed document for the purpose specified in paragraph"
                },
                {
                    "representation": "(2)",
                    "description": "For the purposes of this section, any process for multiplying copies of a document, other than copying it by hand, shall be deemed to be printing and the word printer shall be construed accordingly."
                },
                {
                    "representation": "(3)",
                    "description": "Any candidate,  or any election  agent who contravenes  this section shall be guilty of an illegal practice; and any other person who contravenes this section shall be liable on summary conviction to a fine of  thirty-two  thousand  five hundred dollars, or if the offence be not triable summarily by reason of anything comprehended therein having been done, omitted or situated anywhere beyond the limits of summary jurisdiction exercisable in Guyana, he shall, unless it is proved that he was not a citizen  of Guyana  at  the  time  of the  offence,  be liable  upon conviction on  indictment  in Guyana  to a fine of sixty-five  thousand dollars or to imprisonment for one year."
                }
            ]
        }
    },
    {
        "act": "REPRESENTATION OF THE PEOPLE ACT",
        "source": "https://mola.gov.gy/laws-of-guyana",
        "type": {
            "name": "section",
            "representation": "126",
            "title": "Miscellaneous illegal practice. ",
            "context": "REPRESENTATION OF THE PEOPLE ACT under Miscellaneous illegal practice. 126.  Any person who  (a)    votes either on his own behalf or as a proxy on behalf of another person or procures any person to vote either on his own behalf or as a proxy on behalf of another person, at an election,  knowing  that  he or  such  other  person  is not  an elector;  (b)   applies  for  the appointment of a person to vote on his behalf at an   LAWS OF GUYANA Representation of the People Cap. 1:03 147  L.R.O. 1/2012                                                election as a proxy knowing that he or the person for whose appointment he applies is not an elector or who in such application makes a false statement as to his entitlement to vote by proxy;  (c)     before or during  an election knowingly publishes a false statement of the withdrawal of a list of candidates or of any of the candidates named therein for the purpose of promoting or procuring the election of the candidates named in another list;  (d)   hands to a poll clerk or a presiding officer  (i)       a forged identity paper; or (ii)  save as permitted by these regulations the identity paper of some other person; or (iii)   a forged notice of appointment to vote as a proxy on behalf of some other person;  (e)    for  the  purpose  of  affecting  the  return  of  a  list  of candidates causes any person to cast an invalid vote;   (f)   conspires with persons known or unknown to deprive a qualified person of the right to be registered or to cause a person not qualified to LAWS OF GUYANA 148 Cap. 1:03 Representation of the People   L.R.O. 1/2012                     Plural voting to be illegal practice. [16 of 1968 Reg. 21/1968 6/1973]                              register as a voter;  (g)     except as otherwise provided in section 29, with intent to vote enters, or who votes in, a polling division other than the polling division where he is registered,  shall be guilty of an illegal practice.",
            "description": [
                {
                    "representation": "(a)",
                    "description": "votes either on his own behalf or as a proxy on behalf of another person or procures any person to vote either on his own behalf or as a proxy on behalf of another person, at an election,  knowing  that  he or  such  other  person  is not  an elector;"
                },
                {
                    "representation": "(b)",
                    "description": "applies  for  the appointment of a person to vote on his behalf at an   LAWS OF GUYANA Representation of the People Cap. 1:03 147  L.R.O. 1/2012                                                election as a proxy knowing that he or the person for whose appointment he applies is not an elector or who in such application makes a false statement as to his entitlement to vote by proxy;"
                },
                {
                    "representation": "(c)",
                    "description": "before or during  an election knowingly publishes a false statement of the withdrawal of a list of candidates or of any of the candidates named therein for the purpose of promoting or procuring the election of the candidates named in another list;"
                },
                {
                    "representation": "(d)",
                    "description": "hands to a poll clerk or a presiding officer"
                },
                {
                    "representation": "(i)",
                    "description": "a forged identity paper; or"
                },
                {
                    "representation": "(e)",
                    "description": "for  the  purpose  of  affecting  the  return  of  a  list  of candidates causes any person to cast an invalid vote;"
                },
                {
                    "representation": "(f)",
                    "description": "conspires with persons known or unknown to deprive a qualified person of the right to be registered or to cause a person not qualified to LAWS OF GUYANA 148 Cap. 1:03 Representation of the People   L.R.O. 1/2012                     Plural voting to be illegal practice. [16 of 1968 Reg. 21/1968 6/1973]                              register as a voter;"
                },
                {
                    "representation": "(g)",
                    "description": "except as otherwise provided in section 29, with intent to vote enters, or who votes in, a polling division other than the polling division where he is registered,  shall be guilty of an illegal practice."
                }
            ]
        }
    },
    {
        "act": "REPRESENTATION OF THE PEOPLE ACT",
        "source": "https://mola.gov.gy/laws-of-guyana",
        "type": {
            "name": "section",
            "representation": "127",
            "title": "Plural voting to be illegal practice. ",
            "context": "REPRESENTATION OF THE PEOPLE ACT under Plural voting to be illegal practice. 127.  Any person who  (a)   votes  on his own behalf more than once; or  (b)   votes  in  person on his own behalf when there is in force an appointment of another person to vote as a proxy on his behalf; or  (c)     applies  for  a person to be appointed as a proxy to vote on  his  behalf  without  applying  for  the  cancellation  of  an existing appointment of some other person to vote as a proxy on his behalf or without withdrawing a pending application for such appointment; or  (d)   votes as a proxy more than once on behalf of the same elector; or  (e)     votes  as  a proxy  on behalf of more than two electors,    LAWS OF GUYANA Representation of the People Cap. 1:03 149  L.R.O. 1/2012          Penalty for illegal practice.  [16 of 1968 6 of 1997]                                          shall be guilty of an illegal practice.",
            "description": [
                {
                    "representation": "(a)",
                    "description": "votes  on his own behalf more than once; or"
                },
                {
                    "representation": "(b)",
                    "description": "votes  in  person on his own behalf when there is in force an appointment of another person to vote as a proxy on his behalf; or"
                },
                {
                    "representation": "(c)",
                    "description": "applies  for  a person to be appointed as a proxy to vote on  his  behalf  without  applying  for  the  cancellation  of  an existing appointment of some other person to vote as a proxy on his behalf or without withdrawing a pending application for such appointment; or"
                },
                {
                    "representation": "(d)",
                    "description": "votes as a proxy more than once on behalf of the same elector; or"
                },
                {
                    "representation": "(e)",
                    "description": "votes  as  a proxy  on behalf of more than two electors,    LAWS OF GUYANA Representation of the People Cap. 1:03 149  L.R.O. 1/2012          Penalty for illegal practice.  [16 of 1968 6 of 1997]                                          shall be guilty of an illegal practice."
                }
            ]
        }
    },
    {
        "act": "REPRESENTATION OF THE PEOPLE ACT",
        "source": "https://mola.gov.gy/laws-of-guyana",
        "type": {
            "name": "section",
            "representation": "128",
            "title": "Penalty for illegal practice.  PART XV CORRUPT PRACTICES  ",
            "context": "REPRESENTATION OF THE PEOPLE ACT under Penalty for illegal practice.  PART XV CORRUPT PRACTICES  128.  (1) Any person guilty of an illegal practice  (a)   shall,  on summary  conviction,  be liable  to a fine of thirty-two thousand five hundred dollars and to imprisonment for six months or, if the offence be not triable summarily by reason of anything comprehended therein having been done, omitted or situated anywhere beyond the limits of summary jurisdiction  exercisable  in Guyana,  he shall,  unless  having been neither a candidate nor an election agent at the time of the offence he is proved not to have been a citizen of Guyana at that time, be liable on conviction on indictment in Guyana to a fine of sixty-five thousand dollars or to imprisonment for one year; and                (b)  subject to subsection (2), shall be incapable during a period of five years from the date of his conviction, whether summarily or on indictment, of being registered as an elector.  (2) In the case of any conviction of an illegal practice the court may, if it deems it just in the special circumstances of the case mitigate or entirely remit any incapacity imposed by this section.   LAWS OF GUYANA 150 Cap. 1:03 Representation of the People   L.R.O. 1/2012       Treating.                                     Undue influence.            PART  XV CORRUPT  PRACTICES",
            "description": [
                {
                    "representation": "(1)",
                    "description": "Any person guilty of an illegal practice"
                },
                {
                    "representation": "(a)",
                    "description": "shall,  on summary  conviction,  be liable  to a fine of thirty-two thousand five hundred dollars and to imprisonment for six months or, if the offence be not triable summarily by reason of anything comprehended therein having been done, omitted or situated anywhere beyond the limits of summary jurisdiction  exercisable  in Guyana,  he shall,  unless  having been neither a candidate nor an election agent at the time of the offence he is proved not to have been a citizen of Guyana at that time, be liable on conviction on indictment in Guyana to a fine of sixty-five thousand dollars or to imprisonment for one year; and"
                },
                {
                    "representation": "(b)",
                    "description": "subject to subsection"
                },
                {
                    "representation": "(2)",
                    "description": "In the case of any conviction of an illegal practice the court may, if it deems it just in the special circumstances of the case mitigate or entirely remit any incapacity imposed by this section.   LAWS OF GUYANA 150 Cap. 1:03 Representation of the People   L.R.O. 1/2012       Treating.                                     Undue influence.            PART  XV CORRUPT  PRACTICES"
                }
            ]
        }
    },
    {
        "act": "REPRESENTATION OF THE PEOPLE ACT",
        "source": "https://mola.gov.gy/laws-of-guyana",
        "type": {
            "name": "section",
            "representation": "129",
            "title": "Treating. ",
            "context": "REPRESENTATION OF THE PEOPLE ACT under Treating. 129.  The following  persons  shall be deemed  guilty of the corrupt practice  of treating  (a)   every  person  who  corruptly,  by himself or by any other person, either before, during or after an election, directly or indirectly,  gives or provides  or pays wholly or in part the expense of giving or providing any food, drink, entertainment or provision to or for any person for the purpose of corruptly influencing that person, or any other person, to vote or to refrain from voting, at the election,  or on account of such person, or any other person, having voted or refrained from voting, or being about to vote or refrain from voting, at the election;  (b)      every elector who corruptly accepts or takes any such food, drink, entertainment or provision.",
            "description": [
                {
                    "representation": "(a)",
                    "description": "every  person  who  corruptly,  by himself or by any other person, either before, during or after an election, directly or indirectly,  gives or provides  or pays wholly or in part the expense of giving or providing any food, drink, entertainment or provision to or for any person for the purpose of corruptly influencing that person, or any other person, to vote or to refrain from voting, at the election,  or on account of such person, or any other person, having voted or refrained from voting, or being about to vote or refrain from voting, at the election;"
                },
                {
                    "representation": "(b)",
                    "description": "every elector who corruptly accepts or takes any such food, drink, entertainment or provision."
                }
            ]
        }
    },
    {
        "act": "REPRESENTATION OF THE PEOPLE ACT",
        "source": "https://mola.gov.gy/laws-of-guyana",
        "type": {
            "name": "section",
            "representation": "130",
            "title": "Undue influence. ",
            "context": "REPRESENTATION OF THE PEOPLE ACT under Undue influence. 130.  The following  persons  shall be deemed  guilty of the corrupt practice of using undue influence  (a)     every person who directly or indirectly by himself or by any other person on his behalf  (i)    makes use of, or threatens to make use of, any force, violence   LAWS OF GUYANA Representation of the People Cap. 1:03 151  L.R.O. 1/2012                                   Bribery.                   or restraint; or (ii)    inflicts,  or  threatens to inflict, by himself or by any other person, any temporal or spiritual injury, damage, harm or  loss upon or against any person, in order to induce or compel such person to vote or refrain from voting or on account  of  such  person  having  voted  or  refrained  from voting at any election; or             (b)     every  person   who   by  abduction,   duress, or any fraudulent contrivance, impedes or prevents the free exercise of the franchise of any elector, or thereby compels, induces or prevails upon any elector either to vote or to refrain from voting at any election.",
            "description": [
                {
                    "representation": "(a)",
                    "description": "every person who directly or indirectly by himself or by any other person on his behalf"
                },
                {
                    "representation": "(i)",
                    "description": "makes use of, or threatens to make use of, any force, violence   LAWS OF GUYANA Representation of the People Cap. 1:03 151  L.R.O. 1/2012                                   Bribery.                   or restraint; or"
                },
                {
                    "representation": "(b)",
                    "description": "every  person   who   by  abduction,   duress, or any fraudulent contrivance, impedes or prevents the free exercise of the franchise of any elector, or thereby compels, induces or prevails upon any elector either to vote or to refrain from voting at any election."
                }
            ]
        }
    },
    {
        "act": "REPRESENTATION OF THE PEOPLE ACT",
        "source": "https://mola.gov.gy/laws-of-guyana",
        "type": {
            "name": "section",
            "representation": "131",
            "title": "Bribery. ",
            "context": "REPRESENTATION OF THE PEOPLE ACT under Bribery. 131.  The following persons shall be deemed to be guilty of the corrupt practice of bribery:  (a)  every  person  who, directly or indirectly, by himself or by any other person on his behalf  (i) gives or agrees to give; or  (ii) lends or agrees to lend; or (iii) offers or promises; or (iv) promises to procure or promises to endeavour  to procure,  LAWS OF GUYANA 152 Cap. 1:03 Representation of the People   L.R.O. 1/2012                                                 any money or valuable consideration to or for any elector, or to or for any other person, in order to induce any elector to vote or to refrain from voting;  (b)  every  person  who, directly or indirectly, by himself or by any other person on his behalf, corruptly (i)      gives or agrees to give; or  (ii)     lends or agrees to lend; or  (iii)    offers or promises; or (iv)  promises  to  procure  or promises  to endeavour  to procure   any money or valuable consideration to or for any elector, or to or for any person on behalf of any elector, or to or for any other  person,  on account  of such  elector  having  voted  or refrained from voting at any election;  (c)  every  person  who, directly or indirectly, by himself or by any other person on his behalf, corruptly  (i)       gives or agrees to give; or (ii)     procures  or  agrees  to procure; or  (iii)     offers or promises; or (iv)  promises   to  procure  or promises  to endeavour  to procure    LAWS OF GUYANA Representation of the People Cap. 1:03 153  L.R.O. 1/2012                                                 any office, place or employment or to or for any elector or to or for any person on behalf of any elector, or to or for any other person, in order to induce such elector to vote or refrain from voting;  (d)  every  person  who,  directly or indirectly, by himself or by any other person on his behalf, corruptly (i)       gives or agrees to give; or (ii)      procures or agrees to procure; or (iii)    offers or promises; or (iv)  promises  to  procure  or promises  to endeavour  to procure   any office, place or employment to or for any elector or to or for any person on behalf of any elector, or to or for any other person, on account of any elector having voted or refrained from voting at any election;  (e)  every  person who, directly  or indirectly, by himself or by any other person on his behalf, makes any such gift, loan, offer, promise, procurement or agreement as aforesaid to or for any person, in order to induce such person to procure the return of a group of candidates, as members of the National Assembly, or the vote of any elector at any election; LAWS OF GUYANA 154 Cap. 1:03 Representation of the People   L.R.O. 1/2012                                                  (f)   every person who, upon or in consequence of any such gift,   loan,   offer,   promise,   procurement   or   agreement, procures or engages, promises or endeavours to procure the return of any group of candidates as members of the National Assembly, or the vote of any elector at any election; (g)        every person who  (i)     advances or pays, or causes to be paid, any money to or to the use of any other person, with the intent that such money, or any part thereof, shall be expended in bribery at any election; or (ii)     knowingly pays, or causes to be paid, any money to any person in discharge or repayment of any money wholly or in part expended in bribery at any election;  (h)     every  elector  who,  before  or  during  any  election, directly or indirectly, by himself or by any other person on his behalf, receives, agrees or contracts for any money, gift, loan or  valuable  consideration,  office, place or employment  for himself or for any other person, for voting or agreeing to vote, or  for refraining  or agreeing  to   LAWS OF GUYANA Representation of the People Cap. 1:03 155  L.R.O. 1/2012                   Personation.     [16 of 1968]                              refrain  from voting at any election;  (i)     every  person   who,  after  any  election,   directly   or indirectly, by himself or by any other person on his behalf, receives any money or valuable consideration on account of any person having voted or refrained from voting, or having induced any other person to vote or refrain from voting at any election.",
            "description": [
                {
                    "representation": "(a)",
                    "description": "every  person  who, directly or indirectly, by himself or by any other person on his behalf"
                },
                {
                    "representation": "(i)",
                    "description": "every  person   who,  after  any  election,   directly   or indirectly, by himself or by any other person on his behalf, receives any money or valuable consideration on account of any person having voted or refrained from voting, or having induced any other person to vote or refrain from voting at any election."
                },
                {
                    "representation": "(b)",
                    "description": "every  person  who, directly or indirectly, by himself or by any other person on his behalf, corruptly"
                },
                {
                    "representation": "(c)",
                    "description": "every  person  who, directly or indirectly, by himself or by any other person on his behalf, corruptly"
                },
                {
                    "representation": "(d)",
                    "description": "every  person  who,  directly or indirectly, by himself or by any other person on his behalf, corruptly"
                },
                {
                    "representation": "(e)",
                    "description": "every  person who, directly  or indirectly, by himself or by any other person on his behalf, makes any such gift, loan, offer, promise, procurement or agreement as aforesaid to or for any person, in order to induce such person to procure the return of a group of candidates, as members of the National Assembly, or the vote of any elector at any election; LAWS OF GUYANA 154 Cap. 1:03 Representation of the People   L.R.O. 1/2012"
                },
                {
                    "representation": "(f)",
                    "description": "every person who, upon or in consequence of any such gift,   loan,   offer,   promise,   procurement   or   agreement, procures or engages, promises or endeavours to procure the return of any group of candidates as members of the National Assembly, or the vote of any elector at any election;"
                },
                {
                    "representation": "(g)",
                    "description": "every person who"
                },
                {
                    "representation": "(h)",
                    "description": "every  elector  who,  before  or  during  any  election, directly or indirectly, by himself or by any other person on his behalf, receives, agrees or contracts for any money, gift, loan or  valuable  consideration,  office, place or employment  for himself or for any other person, for voting or agreeing to vote, or  for refraining  or agreeing  to   LAWS OF GUYANA Representation of the People Cap. 1:03 155  L.R.O. 1/2012                   Personation.     [16 of 1968]                              refrain  from voting at any election;"
                }
            ]
        }
    },
    {
        "act": "REPRESENTATION OF THE PEOPLE ACT",
        "source": "https://mola.gov.gy/laws-of-guyana",
        "type": {
            "name": "section",
            "representation": "132",
            "title": "Personation. ",
            "context": "REPRESENTATION OF THE PEOPLE ACT under Personation. 132.  (1) A person shall be deemed to be guilty of the corrupt practice of personation at an election if he  (a)       votes as some other person whether as an elector on his own behalf or as a proxy on behalf of another elector, and whether that other person is living or dead or is a fictitious person; or  (b)      having any mark of electoral ink upon any of his fingers applies  for a ballot  paper  for the purpose  of voting  as an elector; or  (c)      votes in person or as proxy        (i)      for  a  person  whom  he  knows  or  has  reasonable grounds for supposing to be dead or to be a fictitious person; or (ii)  when he  knows  or  has  reasonable  grounds  for LAWS OF GUYANA 156 Cap. 1:03 Representation of the People   L.R.O. 1/2012                   General penalty for corrupt practices. [6 of 1997]        Penalty for personation.        Disqualification. [16 of 1968]                       supposing that his appointment as proxy is no longer in force.            (2) For the purpose of subsection 1 (a) and (c), a person who has applied for a ballot paper for the purpose of voting shall be deemed to have voted.",
            "description": [
                {
                    "representation": "(1)",
                    "description": "A person shall be deemed to be guilty of the corrupt practice of personation at an election if he"
                },
                {
                    "representation": "(a)",
                    "description": "and"
                },
                {
                    "representation": "(b)",
                    "description": "having any mark of electoral ink upon any of his fingers applies  for a ballot  paper  for the purpose  of voting  as an elector; or"
                },
                {
                    "representation": "(c)",
                    "description": "votes in person or as proxy"
                },
                {
                    "representation": "(i)",
                    "description": "for  a  person  whom  he  knows  or  has  reasonable grounds for supposing to be dead or to be a fictitious person; or"
                },
                {
                    "representation": "(2)",
                    "description": "For the purpose of subsection 1"
                }
            ]
        }
    },
    {
        "act": "REPRESENTATION OF THE PEOPLE ACT",
        "source": "https://mola.gov.gy/laws-of-guyana",
        "type": {
            "name": "section",
            "representation": "133",
            "title": "General penalty for corrupt practices. ",
            "context": "REPRESENTATION OF THE PEOPLE ACT under General penalty for corrupt practices. 133.  Every person who is guilty of a corrupt practice other than as specified in section 134, shall, on conviction on indictment be liable to a fine of sixty-five thousand dollars and to imprisonment for one year.",
            "description": "Every person who is guilty of a corrupt practice other than as specified in section 134, shall, on conviction on indictment be liable to a fine of sixty-five thousand dollars and to imprisonment for one year."
        }
    },
    {
        "act": "REPRESENTATION OF THE PEOPLE ACT",
        "source": "https://mola.gov.gy/laws-of-guyana",
        "type": {
            "name": "section",
            "representation": "134",
            "title": "Penalty for personation. ",
            "context": "REPRESENTATION OF THE PEOPLE ACT under Penalty for personation. 134. Every person who is guilty of personation or aiding, abetting, counselling or procuring the commission of the offence of personation shall, on conviction on indictment, be liable to imprisonment for two years.",
            "description": "Every person who is guilty of personation or aiding, abetting, counselling or procuring the commission of the offence of personation shall, on conviction on indictment, be liable to imprisonment for two years."
        }
    },
    {
        "act": "REPRESENTATION OF THE PEOPLE ACT",
        "source": "https://mola.gov.gy/laws-of-guyana",
        "type": {
            "name": "section",
            "representation": "135",
            "title": "Disqualification.  PART XVI MISCELLANEOUS ELECTIONS OFFENCES  ",
            "context": "REPRESENTATION OF THE PEOPLE ACT under Disqualification.  PART XVI MISCELLANEOUS ELECTIONS OFFENCES  135.  (1) Subject to this section, every person who is convicted of a corrupt practice shall, in addition to any other punishment, be incapable during a period of five years from the date of conviction  (a)      of being registered as an elector;  (b)      of   being   elected   as  a   member   of   the   National Assembly.   (2) In the event of any conviction under section 114, the court may, if it deems it just in the special circumstances of the case, mitigate or entirely remit any incapacity imposed by this section.       LAWS OF GUYANA Representation of the People Cap. 1:03 157  L.R.O. 1/2012          Offences in respect of ballot boxes and ballot papers, identity   papers, and appointments as proxy. [16 of 1968 Reg. 25/1968 O. 50/1980 6 of 1997 22 of 1997 15 of 2000]                            PART  XVI MISCELLANEOUS  ELECTION  OFFENCES",
            "description": [
                {
                    "representation": "(1)",
                    "description": "Subject to this section, every person who is convicted of a corrupt practice shall, in addition to any other punishment, be incapable during a period of five years from the date of conviction"
                },
                {
                    "representation": "(a)",
                    "description": "of being registered as an elector;"
                },
                {
                    "representation": "(b)",
                    "description": "of   being   elected   as  a   member   of   the   National Assembly."
                },
                {
                    "representation": "(2)",
                    "description": "In the event of any conviction under section 114, the court may, if it deems it just in the special circumstances of the case, mitigate or entirely remit any incapacity imposed by this section.       LAWS OF GUYANA Representation of the People Cap. 1:03 157  L.R.O. 1/2012          Offences in respect of ballot boxes and ballot papers, identity   papers, and appointments as proxy. [16 of 1968 Reg. 25/1968 O. 50/1980 6 of 1997 22 of 1997 15 of 2000]                            PART  XVI MISCELLANEOUS  ELECTION  OFFENCES"
                }
            ]
        }
    },
    {
        "act": "REPRESENTATION OF THE PEOPLE ACT",
        "source": "https://mola.gov.gy/laws-of-guyana",
        "type": {
            "name": "section",
            "representation": "136",
            "title": "[Repealed by Act No. 24 of 1990]. ",
            "context": "REPRESENTATION OF THE PEOPLE ACT under [Repealed by Act No. 24 of 1990]. 136.  [Repealed by Act No.24 of 1990]",
            "description": "[Repealed by Act No.24 of 1990]"
        }
    },
    {
        "act": "REPRESENTATION OF THE PEOPLE ACT",
        "source": "https://mola.gov.gy/laws-of-guyana",
        "type": {
            "name": "section",
            "representation": "137",
            "title": "Offences in respect of ballot boxes and ballot papers, identity papers and appointments as proxy. ",
            "context": "REPRESENTATION OF THE PEOPLE ACT under Offences in respect of ballot boxes and ballot papers, identity papers and appointments as proxy. 137.  (1) Every person who  (a)   forges   or  counterfeits   or  fraud-ulently   defaces,   or destroys, any ballot paper or the official mark thereon or any identity paper or notice of appointment of a person to vote as a proxy; or (b)   without  due authority  supplies  a ballot  paper  to any person; or  (c)     fraudulently puts or causes to be put into any ballot box any paper other than the lawful ballot paper; or  (d)    without   due   authority   destroys,   takes,   opens   or otherwise interferes with any ballot box or packet of ballot papers then in use for the purposes of any election; or  (e)   wilfully or  negligently   fails to discharge  any duty or responsibility imposed on him by any of the provisions of Part VII and relating to any packet to which paragraph (d) applies by virtue of section 56(2); or  (f)      being present at any proceedings under section 54 or 55(a) of these LAWS OF GUYANA 158 Cap. 1:03 Representation of the People   L.R.O. 1/2012                                                 sections to be executed  in conformity with section 59(1) or section 92, 93 or 94  (i)   interferes  or  attempts   to interfere  with any person, balloting as an elector, or obstructs or attempts to obstruct the course of any such proceedings, except in the exercise of any  functions required by law to be discharged for the purposes of such balloting or proceedings, as the case may be; or (ii)   obtains or attempts to obtain (except for the purposes of the proviso to section 54(a)) information as to the list of candidates  for whom any person is about to vote or has voted; or (iii)   acquires any such information  as aforesaid and, at any time thereafter, communicates it to any person; or (iv)   directly  or  indirectly induces any person balloting as an elector to display his ballot paper so as to make known the list of candidates for whom he has or has not voted; or  (v) is guilty of any wilful act or omission inconsistent with the maintenance of the secrecy of   LAWS OF GUYANA Representation of the People Cap. 1:03 159  L.R.O. 1/2012                                                the ballot; or  (g)     undertakes to assist any person under the proviso to section 54(a) and at any time thereafter  communicates any information as to the list of candidates for whom such person intends to vote, or has voted, to any other person; or  (h)     being a ballot attendant participating in any proceedings under section 54 or 55, influences or attempts to influence any person either not to vote or in his choice of a list of candidates to vote for at those proceedings; or  (i)     in any Form, or in any certificate  on the reverse side thereof, makes any declaration or statement that he does not believe to be true, or has reasonable grounds to believe to be false, in any material respect;  shall be guilty of a misdemeanour, and be liable on conviction  (i)      if he is an election officer or other person exercising powers or performing duties connected with or relating to the  conduct of elections,  to a fine of sixty-five  thousand dollars and to imprisonment for two years; LAWS OF GUYANA 160 Cap. 1:03 Representation of the People   L.R.O. 1/2012                Voting when not entitled. [16 of 1968 6 of 1997] c. 19:08]                 Interference with notices and lists. [6 of 1997]        Terror intimidation causing withdrawal of (ii)     if he is not an election officer or such a person, to a fine of sixteen thousand two hundred and fifty dollars and to imprisonment for six months.  (2) Any person who attempts to commit an offence under this section shall be deemed to be guilty of an offence under this section.",
            "description": [
                {
                    "representation": "(1)",
                    "description": "Every person who"
                },
                {
                    "representation": "(a)",
                    "description": "forges   or  counterfeits   or  fraud-ulently   defaces,   or destroys, any ballot paper or the official mark thereon or any identity paper or notice of appointment of a person to vote as a proxy; or"
                },
                {
                    "representation": "(b)",
                    "description": "without  due authority  supplies  a ballot  paper  to any person; or"
                },
                {
                    "representation": "(c)",
                    "description": "fraudulently puts or causes to be put into any ballot box any paper other than the lawful ballot paper; or"
                },
                {
                    "representation": "(d)",
                    "description": "applies by virtue of section 56(2); or"
                },
                {
                    "representation": "(e)",
                    "description": "wilfully or  negligently   fails to discharge  any duty or responsibility imposed on him by any of the provisions of Part VII and relating to any packet to which paragraph"
                },
                {
                    "representation": "(f)",
                    "description": "being present at any proceedings under section 54 or 55(a) of these LAWS OF GUYANA 158 Cap. 1:03 Representation of the People   L.R.O. 1/2012                                                 sections to be executed  in conformity with section 59(1) or section 92, 93 or 94"
                },
                {
                    "representation": "(i)",
                    "description": "if he is an election officer or other person exercising powers or performing duties connected with or relating to the  conduct of elections,  to a fine of sixty-five  thousand dollars and to imprisonment for two years; LAWS OF GUYANA 160 Cap. 1:03 Representation of the People   L.R.O. 1/2012                Voting when not entitled. [16 of 1968 6 of 1997] c. 19:08]                 Interference with notices and lists. [6 of 1997]        Terror intimidation causing withdrawal of"
                },
                {
                    "representation": "(v)",
                    "description": "is guilty of any wilful act or omission inconsistent with the maintenance of the secrecy of   LAWS OF GUYANA Representation of the People Cap. 1:03 159  L.R.O. 1/2012                                                the ballot; or"
                },
                {
                    "representation": "(g)",
                    "description": "undertakes to assist any person under the proviso to section 54(a) and at any time thereafter  communicates any information as to the list of candidates for whom such person intends to vote, or has voted, to any other person; or"
                },
                {
                    "representation": "(h)",
                    "description": "being a ballot attendant participating in any proceedings under section 54 or 55, influences or attempts to influence any person either not to vote or in his choice of a list of candidates to vote for at those proceedings; or"
                },
                {
                    "representation": "(2)",
                    "description": "Any person who attempts to commit an offence under this section shall be deemed to be guilty of an offence under this section."
                }
            ]
        }
    },
    {
        "act": "REPRESENTATION OF THE PEOPLE ACT",
        "source": "https://mola.gov.gy/laws-of-guyana",
        "type": {
            "name": "section",
            "representation": "138",
            "title": "Voting when not entitled. ",
            "context": "REPRESENTATION OF THE PEOPLE ACT under Voting when not entitled. 138. Without prejudice to section 138(a), every person who (a)     not  being  registered  as  a  qualified   person  on  an electoral  register  compiled  under the National  Registration Act, votes at an election; or  (b)     induces  or procures  any person  not so registered  to vote at an election,  shall be liable on summary conviction to a fine of sixteen thousand two hundred and fifty dollars and to imprisonment for six months.",
            "description": [
                {
                    "representation": "(a)",
                    "description": "not  being  registered  as  a  qualified   person  on  an electoral  register  compiled  under the National  Registration Act, votes at an election; or"
                },
                {
                    "representation": "(b)",
                    "description": "induces  or procures  any person  not so registered  to vote at an election,  shall be liable on summary conviction to a fine of sixteen thousand two hundred and fifty dollars and to imprisonment for six months."
                }
            ]
        }
    },
    {
        "act": "REPRESENTATION OF THE PEOPLE ACT",
        "source": "https://mola.gov.gy/laws-of-guyana",
        "type": {
            "name": "section",
            "representation": "139",
            "title": "Interference with notices and lists. 139A Terrors intimidation causing withdrawal of candidate. 139B  Abetment of offence under this Act. 139C  Attempt and incitement to commit offence under this Act. 139D  Person causing racial or ethnic violence or hatred. 139E  Complaint of statement or action by political party on racial  and ethnic violence or hatred.   PART XVII GENERAL  ",
            "context": "REPRESENTATION OF THE PEOPLE ACT under Interference with notices and lists. 139A Terrors intimidation causing withdrawal of candidate. 139B  Abetment of offence under this Act. 139C  Attempt and incitement to commit offence under this Act. 139D  Person causing racial or ethnic violence or hatred. 139E  Complaint of statement or action by political party on racial  and ethnic violence or hatred.   PART XVII GENERAL  139.  Every  person  who  wilfully  mutilates,  tears  down,  destroys, obscures, or  makes  any alteration  in any list  or notice  published  in accordance with this Act, shall be liable on summary conviction to a fine of sixteen thousand five hundred dollars or to imprisonment for three months.  139A. Any person who through intimidation, terror or force causes any other person to withdraw from being a candidate at any election shall be guilty of an offence and   LAWS OF GUYANA Representation of the People Cap. 1:03 161  L.R.O. 1/2012 candidate. [22 of 1997 15 of 2000]  Abetment of offence under this Act. [22 of 1997 15 of 2000]                  Attempt and incitement to commit offence under this Act. [22 of 1997 15 of 2000]    Person causing racial or ethnic violence or hatred. [1 of 2001]                   shall be liable on summary conviction to a fine of forty thousand dollars together with imprisonment for one year.  139B. Save as otherwise provided in this Act, every person who aids, abets, counsels, causes, or procures, the commission of any offence under this Act shall be liable to be proceeded against and convicted for that offence, either together with the principal offender or before or after his conviction, and shall be liable on summary conviction to the same punishment as that to which the principal offender is liable by law.   139C. Every person who attempts to commit, or incites any other person to commit any offence under this Act shall be liable to one-half of the punishment prescribed for that offence.  139 D. (1) Any person who     (a)   makes or published or causes to be made or published any statement; or    (b)    takes any action,  which results or can result in racial or ethnic violence or hatred among the people shall be liable on conviction on indictment to a fine of one hundred thousand dollars together with imprisonment for two years.  (2)  Every person convicted of an office under subsection (1) shall, in addition to any punishment under the said subsection, be incapable, during a period of five years from the date of the conviction, of being a member of the National Assembly or being a member of any local LAWS OF GUYANA 162 Cap. 1:03 Representation of the People   L.R.O. 1/2012                                                 democratic organ or of the holder of any constitutional or statutory office.  (3) Where a person is convicted of an offence under subsection (1), the Registrar of the Supreme Court shall send the particulars of the conviction to the chairperson of the Ethnic Relations Commission who shall, subject to the provisions of subsection (7), take such measures or issue such instructions as are required or necessary to give effect to the provisions of subsection (2)  (4)  In all cases  considered by the Court that relate to subsection (1), the registrar of the Supreme Court shall send a copy of the notes of evidence to the chairperson of the Ethnic Relations Commission, and the registrar shall take such measures or issue such instructions as are required to give effect to the provision of this Act.   (5)  Subject to the provisions of subsection (8) where in the opinion of the Judge or the chairperson of the Ethnic Relations Commission the notes of evidence disclose the involvement of any political party in the matter considered under subsection (1) the chairperson of the Ethnic Relations Commission shall summon as a representative of the party the Leader of the political party or if there is no Leader the General Secretary of the political party, by whatever name either office is designated to attend meetings of the Commission for the purpose of participating in investigations by the Ethnic Relations Commission with regard to the aforesaid involvement; and if after hearing the Leader of the party or the General Secretary, as the case may be, the Commission is satisfied that the statement or action, the subject of the enquiry related to subsection (1), was made or published or it was caused to be made or published on behalf of the political   LAWS OF GUYANA Representation of the People Cap. 1:03 163  L.R.O. 1/2012                                                party, or the action was taken on behalf of the political party, and the political party has not publicly disassociated  itself from the statement or the action, the chairperson of the Ethnic  Relations Commission shall send, in such form as he or she thinks fit, the findings of the Commission to the chairperson  of the Elections Commission, and also deliver a copy with a clearly stated date of notification to the representative of the party who participated in the investigations.  (6) The representative of the political party referred to in subsection (5) shall have the right to appeal in a summary way to the Full Court against the findings of the Ethnic Relations Commission, but shall be deemed to have forfeited that right if such appeal is not made within fourteen days of the date receipt of notification of those findings.   (7) The chairperson of the Elections Commission shall, subject to the provisions of subsection (9), on receipt of the findings referred to in subsection (5) in respect of a political party, not accept any list of candidates with the name of that political party thereon for a period of five years from the date  of the notification of those findings by the Ethnic Relations Commission; and, subject to the provisions of subsection (9), there shall not  for the period aforesaid, be a ballot containing the name of that political party.  (8)  The Ethnic Relations Commission shall not take any action under subsection (3) or initiate any formal inquiry under subsection (5) in any case where an appeal against a conviction under subsection (1) has not been determined or has been allowed.  LAWS OF GUYANA 164 Cap. 1:03 Representation of the People   L.R.O. 1/2012                      Complaint  of statement  or action  by political party on racial and ethnic violence or hatred. [1 of 2001]                          (9) The Elections Commission shall not take the actions under subsection (7) if, within fourteen days of the date of receipt of notification by the Ethnic Relations Commission of its findings, the representative of the party referred to in subsection (5) has exercised the right of appeal under subsection (6), and the Commission shall act only after it has been specifically directed by the Ethnic Relations Commission consequent upon the determination of the appeal.  139E. (1) Where there is a written complaint to the Ethnic Relations Commission that any political party  (a)      has made or published or caused to be made or published any statement; or  (b)     has taken any action, which results or can result in racial or ethnic violence or hatred, the Leader or General Secretary of the political party shall be summoned by the Ethnic Relations Commission to participate in investigations of the matter by the Ethnic Relations Commission as the Commission deems fit, provided that such investigations be conducted in a manner open to the public.  (2) With respect to the investigations referred to in subsection (1) the party shall have the right to make representations by itself or by attorney-at-law during such investigations by filing defences, being heard, and making submissions, in accordance with the procedures determined by the Ethnic Relations Commission, which procedures shall make adequate provision for receiving   LAWS OF GUYANA Representation of the People Cap. 1:03 165  L.R.O. 1/2012                           Elections Commission proceedings. [Reg.21/1968",
            "description": [
                {
                    "representation": "(1)",
                    "description": "the party shall have the right to make representations by itself or by attorney-at-law during such investigations by filing defences, being heard, and making submissions, in accordance with the procedures determined by the Ethnic Relations Commission, which procedures shall make adequate provision for receiving   LAWS OF GUYANA Representation of the People Cap. 1:03 165  L.R.O. 1/2012                           Elections Commission proceedings. [Reg.21/1968"
                },
                {
                    "representation": "(a)",
                    "description": "has made or published or caused to be made or published any statement; or"
                },
                {
                    "representation": "(b)",
                    "description": "has taken any action, which results or can result in racial or ethnic violence or hatred, the Leader or General Secretary of the political party shall be summoned by the Ethnic Relations Commission to participate in investigations of the matter by the Ethnic Relations Commission as the Commission deems fit, provided that such investigations be conducted in a manner open to the public."
                },
                {
                    "representation": "(2)",
                    "description": "With respect to the investigations referred to in subsection"
                },
                {
                    "representation": "(3)",
                    "description": "or initiate any formal inquiry under subsection"
                },
                {
                    "representation": "(4)",
                    "description": "In all cases  considered by the Court that relate to subsection"
                },
                {
                    "representation": "(5)",
                    "description": "has exercised the right of appeal under subsection"
                },
                {
                    "representation": "(8)",
                    "description": "The Ethnic Relations Commission shall not take any action under subsection"
                },
                {
                    "representation": "(6)",
                    "description": "The representative of the political party referred to in subsection"
                },
                {
                    "representation": "(7)",
                    "description": "if, within fourteen days of the date of receipt of notification by the Ethnic Relations Commission of its findings, the representative of the party referred to in subsection"
                },
                {
                    "representation": "(9)",
                    "description": "The Elections Commission shall not take the actions under subsection"
                }
            ]
        }
    },
    {
        "act": "REPRESENTATION OF THE PEOPLE ACT",
        "source": "https://mola.gov.gy/laws-of-guyana",
        "type": {
            "name": "section",
            "representation": "140",
            "title": "Elections Commission proceedings. LAWS OF GUYANA 10 Cap. 1:03 Representation of the People   L.R.O. 1/2012             SECTION  ",
            "context": "REPRESENTATION OF THE PEOPLE ACT under Elections Commission proceedings. LAWS OF GUYANA 10 Cap. 1:03 Representation of the People   L.R.O. 1/2012             SECTION  140.  (1) Except to the extent that jurisdiction in that behalf has been conferred, and the exercise thereof is required, by the Constitution or any   law  made  under  article  163  thereof  (which  provides  for  the determination by the Supreme Court of Judicature of questions as to membership of the National Assembly and elections thereto) and save as  hereinbefore  provided  to  the  contrary,  no  question  whether  any function of the Elections Commission or of any of its members has been performed validly or at all shall be enquired into in any court.  (2) No evidence of any deliberations of the Elections Commission or communications between members of the Commission regarding its business shall be admissible in any court.   LAWS OF GUYANA 166 Cap. 1:03 Representation of the People   L.R.O. 1/2012           Property in election material.        Certificate of Chief Election Officer.             Offences by bodies corporate.                Limitation of time. [16 of 1968]        Special provisions as to convictions.     PART  XVII GENERAL",
            "description": [
                {
                    "representation": "(1)",
                    "description": "Except to the extent that jurisdiction in that behalf has been conferred, and the exercise thereof is required, by the Constitution or any   law  made  under  article  163  thereof"
                },
                {
                    "representation": "(2)",
                    "description": "No evidence of any deliberations of the Elections Commission or communications between members of the Commission regarding its business shall be admissible in any court.   LAWS OF GUYANA 166 Cap. 1:03 Representation of the People   L.R.O. 1/2012           Property in election material.        Certificate of Chief Election Officer.             Offences by bodies corporate.                Limitation of time. [16 of 1968]        Special provisions as to convictions.     PART  XVII GENERAL"
                }
            ]
        }
    },
    {
        "act": "REPRESENTATION OF THE PEOPLE ACT",
        "source": "https://mola.gov.gy/laws-of-guyana",
        "type": {
            "name": "section",
            "representation": "141",
            "title": "Property in election material. ",
            "context": "REPRESENTATION OF THE PEOPLE ACT under Property in election material. 141.  In any indictment, information or complaint for an offence in relation to ballot boxes, ballot papers and other election material, the property in them may be stated to be in the Chief Election Officer.",
            "description": "In any indictment, information or complaint for an offence in relation to ballot boxes, ballot papers and other election material, the property in them may be stated to be in the Chief Election Officer."
        }
    },
    {
        "act": "REPRESENTATION OF THE PEOPLE ACT",
        "source": "https://mola.gov.gy/laws-of-guyana",
        "type": {
            "name": "section",
            "representation": "142",
            "title": "Certificate of Chief Election Officer. ",
            "context": "REPRESENTATION OF THE PEOPLE ACT under Certificate of Chief Election Officer. 142.  In any prosecution under this Act, whether on indictment or summarily, the certificate of the Chief Election Officer that the election was duly held and that the person or persons named therein were named as a candidate or candidates at such election, shall be sufficient evidence of the facts therein stated.",
            "description": "In any prosecution under this Act, whether on indictment or summarily, the certificate of the Chief Election Officer that the election was duly held and that the person or persons named therein were named as a candidate or candidates at such election, shall be sufficient evidence of the facts therein stated."
        }
    },
    {
        "act": "REPRESENTATION OF THE PEOPLE ACT",
        "source": "https://mola.gov.gy/laws-of-guyana",
        "type": {
            "name": "section",
            "representation": "143",
            "title": "Offences by bodies corporate. ",
            "context": "REPRESENTATION OF THE PEOPLE ACT under Offences by bodies corporate. 143.  Where an offence under this Act committed by a body corporate is proved to have been committed with the consent or connivance of any director, manager, secretary or other officer of the body corporate, or any person purporting to act in any such capacity, he, as well as the body corporate, shall be deemed to be guilty of the offence and punished accordingly.",
            "description": "Where an offence under this Act committed by a body corporate is proved to have been committed with the consent or connivance of any director, manager, secretary or other officer of the body corporate, or any person purporting to act in any such capacity, he, as well as the body corporate, shall be deemed to be guilty of the offence and punished accordingly."
        }
    },
    {
        "act": "REPRESENTATION OF THE PEOPLE ACT",
        "source": "https://mola.gov.gy/laws-of-guyana",
        "type": {
            "name": "section",
            "representation": "144",
            "title": "Limitation of time. ",
            "context": "REPRESENTATION OF THE PEOPLE ACT under Limitation of time. 144.  A complaint or information against a person in respect of any offence under this Act shall be made or filed within one year or, in the case of an offence to be tried on indictment, two years after the offence was committed.",
            "description": "A complaint or information against a person in respect of any offence under this Act shall be made or filed within one year or, in the case of an offence to be tried on indictment, two years after the offence was committed."
        }
    },
    {
        "act": "REPRESENTATION OF THE PEOPLE ACT",
        "source": "https://mola.gov.gy/laws-of-guyana",
        "type": {
            "name": "section",
            "representation": "145",
            "title": "Special provision as to convictions. ",
            "context": "REPRESENTATION OF THE PEOPLE ACT under Special provision as to convictions. 145.  (1) Any person  charged  with illegal  payment,  employment  or hiring,  may,  notwithstanding   that  the  act  constituting  the  offence amounted  to a corrupt  or  illegal  practice,  be  found  guilty  of  illegal payment, employment or hiring, as the case may be, if the circumstances warrant such finding.   LAWS OF GUYANA Representation of the People Cap. 1:03 167  L.R.O. 1/2012                        Rules of Court.  c 3:02     Duty not to disclose finger- prints.                       Extra-territorial application of penal provisions  of this Act. [16 of 1968]  (2) A person charged with an illegal practice or other offence not being a corrupt practice may, notwithstanding that the act constituting the offence amounted to a corrupt practice, be found guilty of an illegal practice  or other  offence,  as the case  may be, if the  circumstances warrant such finding.  (3) Any  person  charged  with  a  corrupt  practice  may,  if  the circumstances warrant such finding, be found guilty of an illegal practice and  for  that  purpose  the  offence  of  an  illegal  practice  shall  be  an indictable  offence.",
            "description": [
                {
                    "representation": "(1)",
                    "description": "Any person  charged  with illegal  payment,  employment  or hiring,  may,  notwithstanding   that  the  act  constituting  the  offence amounted  to a corrupt  or  illegal  practice,  be  found  guilty  of  illegal payment, employment or hiring, as the case may be, if the circumstances warrant such finding.   LAWS OF GUYANA Representation of the People Cap. 1:03 167  L.R.O. 1/2012                        Rules of Court.  c 3:02     Duty not to disclose finger- prints.                       Extra-territorial application of penal provisions  of this Act. [16 of 1968]"
                },
                {
                    "representation": "(2)",
                    "description": "A person charged with an illegal practice or other offence not being a corrupt practice may, notwithstanding that the act constituting the offence amounted to a corrupt practice, be found guilty of an illegal practice  or other  offence,  as the case  may be, if the  circumstances warrant such finding."
                },
                {
                    "representation": "(3)",
                    "description": "Any  person  charged  with  a  corrupt  practice  may,  if  the circumstances warrant such finding, be found guilty of an illegal practice and  for  that  purpose  the  offence  of  an  illegal  practice  shall  be  an indictable  offence."
                }
            ]
        }
    },
    {
        "act": "REPRESENTATION OF THE PEOPLE ACT",
        "source": "https://mola.gov.gy/laws-of-guyana",
        "type": {
            "name": "section",
            "representation": "146",
            "title": "Rules of Court. ",
            "context": "REPRESENTATION OF THE PEOPLE ACT under Rules of Court. 146.  Rules of Court may, for any of the purposes of this Act, be made from time to time in the manner prescribed by the High Court Act.",
            "description": "Rules of Court may, for any of the purposes of this Act, be made from time to time in the manner prescribed by the High Court Act."
        }
    },
    {
        "act": "REPRESENTATION OF THE PEOPLE ACT",
        "source": "https://mola.gov.gy/laws-of-guyana",
        "type": {
            "name": "section",
            "representation": "147",
            "title": "Duty not to disclose fingerprints. ",
            "context": "REPRESENTATION OF THE PEOPLE ACT under Duty not to disclose fingerprints. 147.  No election  officer shall produce for inspection  or supply the thumb-print of an elector, or a copy thereof except (a)   for the purposes of this Act and its enforcement;  (b)   for  purposes  connected with the conduct of an election;   (c)   as otherwise expressly provided by law.",
            "description": [
                {
                    "representation": "(a)",
                    "description": "for the purposes of this Act and its enforcement;"
                },
                {
                    "representation": "(b)",
                    "description": "for  purposes  connected with the conduct of an election;"
                },
                {
                    "representation": "(c)",
                    "description": "as otherwise expressly provided by law."
                }
            ]
        }
    },
    {
        "act": "REPRESENTATION OF THE PEOPLE ACT",
        "source": "https://mola.gov.gy/laws-of-guyana",
        "type": {
            "name": "section",
            "representation": "148",
            "title": "Extra-territorial application of penal provisions of this Act. ",
            "context": "REPRESENTATION OF THE PEOPLE ACT under Extra-territorial application of penal provisions of this Act. 148.  (1) No charge laid, and no proceedings taken, in Guyana against any person on or with a view to his indictment for any offence under this Act shall, unless the contrary intention hereinbefore appears, be deemed to be unsanctioned by law, or otherwise untenable, on the LAWS OF GUYANA 168 Cap. 1:03 Representation of the People   L.R.O. 1/2012                                                Expenses.    ground that anything  to which  the  indictment  relates  or  might  relate  was  done, omitted or situated outside Guyana or beyond any territorial limitation affecting the exercise of jurisdiction by the High Court, whether within the territory of any other State or not, provided that such person was a candidate, election agent or citizen of Guyana at the time of the offence in question.   (2) For the purposes of subsection (1), a person against whom any charge is laid as aforesaid shall, in any proceedings taken against him as aforesaid, be deemed to have been a citizen of Guyana at the said time unless the contrary is proved.  (3) No  objection  to  any  such  proceedings  as  aforesaid  on indictment for an offence punishable under the provisions of section 121 or 125(3) or 128(1) shall be taken or allowed for inconsistency with any such  provision  conditioning  the  proceedings  upon  the  absence  of summary jurisdiction:  Provided that where the person so indicted is convicted on such indictment and the judge is satisfied that the offence could have been tried summarily, such person shall be liable to no more than the like punishment as on summary conviction for such an offence.  (4) The foregoing provisions of this section are in addition to, and not in derogation of, such provisions of any other laws as sanction the prosecution of indictable offences.",
            "description": [
                {
                    "representation": "(1)",
                    "description": "No charge laid, and no proceedings taken, in Guyana against any person on or with a view to his indictment for any offence under this Act shall, unless the contrary intention hereinbefore appears, be deemed to be unsanctioned by law, or otherwise untenable, on the LAWS OF GUYANA 168 Cap. 1:03 Representation of the People   L.R.O. 1/2012                                                Expenses.    ground that anything  to which  the  indictment  relates  or  might  relate  was  done, omitted or situated outside Guyana or beyond any territorial limitation affecting the exercise of jurisdiction by the High Court, whether within the territory of any other State or not, provided that such person was a candidate, election agent or citizen of Guyana at the time of the offence in question."
                },
                {
                    "representation": "(2)",
                    "description": "For the purposes of subsection"
                },
                {
                    "representation": "(3)",
                    "description": "No  objection  to  any  such  proceedings  as  aforesaid  on indictment for an offence punishable under the provisions of section 121 or 125(3) or 128(1) shall be taken or allowed for inconsistency with any such  provision  conditioning  the  proceedings  upon  the  absence  of summary jurisdiction:  Provided that where the person so indicted is convicted on such indictment and the judge is satisfied that the offence could have been tried summarily, such person shall be liable to no more than the like punishment as on summary conviction for such an offence."
                },
                {
                    "representation": "(4)",
                    "description": "The foregoing provisions of this section are in addition to, and not in derogation of, such provisions of any other laws as sanction the prosecution of indictable offences."
                }
            ]
        }
    },
    {
        "act": "REPRESENTATION OF THE PEOPLE ACT",
        "source": "https://mola.gov.gy/laws-of-guyana",
        "type": {
            "name": "section",
            "representation": "149",
            "title": "Expenses. ",
            "context": "REPRESENTATION OF THE PEOPLE ACT under Expenses. 149.  The expenses of carrying out the provisions of this Act shall be defrayed from moneys provided by Parliament except in so far as any such   expenses   may   LAWS OF GUYANA Representation of the People Cap. 1:03 169  L.R.O. 1/2012        Regulations.  [16 of 1968 16 of 1985 12 of 2006]                   Commission to determine every Form in the Schedule. [12 of 2006]                     Overseas time and delivery by hand instead of post. [Reg. 25/1968]    otherwise   lawfully   be defrayed   out of the Consolidated Fund.",
            "description": "The expenses of carrying out the provisions of this Act shall be defrayed from moneys provided by Parliament except in so far as any such   expenses   may   LAWS OF GUYANA Representation of the People Cap. 1:03 169  L.R.O. 1/2012        Regulations.  [16 of 1968 16 of 1985 12 of 2006]                   Commission to determine every Form in the Schedule. [12 of 2006]                     Overseas time and delivery by hand instead of post. [Reg. 25/1968]    otherwise   lawfully   be defrayed   out of the Consolidated Fund."
        }
    },
    {
        "act": "REPRESENTATION OF THE PEOPLE ACT",
        "source": "https://mola.gov.gy/laws-of-guyana",
        "type": {
            "name": "section",
            "representation": "150",
            "title": "Regulations. 150A. Commission to determine every Form in the Schedule. ",
            "context": "REPRESENTATION OF THE PEOPLE ACT under Regulations. 150A. Commission to determine every Form in the Schedule. 150. The Elections Commission may  make  regulations  for  giving effect to the provisions of this Act, including, subject to the provisions of  the Constitution and this Act, regulations to make provision for all matters, in respect of the conduct of an election, for which in its opinion it is necessary or expedient to make provision, and, without prejudice to the generality of the foregoing, any such regulation may prescribe the hours between which an act may be done on any day not later than which the act is required by virtue of this Act to be done before election day and the particulars to be included in a list prepared under section 65J(1).  150A. (1) The Commission may determine the nature and content of and publish every form in the Schedule.  (2) The Commission shall determine and effect such amendments as may be necessary to any form as determined by the Commission and may completely substitute one form for another where circumstances so justify.  (3) The Forms in the Schedule shall continue to have effect as though determined by the Commission until amended by determination of the Commission.",
            "description": [
                {
                    "representation": "(1)",
                    "description": "The Commission may determine the nature and content of and publish every form in the Schedule."
                },
                {
                    "representation": "(2)",
                    "description": "The Commission shall determine and effect such amendments as may be necessary to any form as determined by the Commission and may completely substitute one form for another where circumstances so justify."
                },
                {
                    "representation": "(3)",
                    "description": "The Forms in the Schedule shall continue to have effect as though determined by the Commission until amended by determination of the Commission."
                }
            ]
        }
    },
    {
        "act": "REPRESENTATION OF THE PEOPLE ACT",
        "source": "https://mola.gov.gy/laws-of-guyana",
        "type": {
            "name": "section",
            "representation": "151",
            "title": "Overseas time and delivery by hand instead of post. ",
            "context": "REPRESENTATION OF THE PEOPLE ACT under Overseas time and delivery by hand instead of post. 151.  (1)  For the purposes of any requirement under this Act that anything be done in a country other than Guyana not later than a specified number of days before election day, election day shall be deemed to be the like date in that country as is appointed in Guyana for the holding of the election. LAWS OF GUYANA 170 Cap. 1:03 Representation of the People   L.R.O. 1/2012                                     Commission to be consulted on emoluments of officers and staff. [",
            "description": [
                {
                    "representation": "(1)",
                    "description": "For the purposes of any requirement under this Act that anything be done in a country other than Guyana not later than a specified number of days before election day, election day shall be deemed to be the like date in that country as is appointed in Guyana for the holding of the election. LAWS OF GUYANA 170 Cap. 1:03 Representation of the People   L.R.O. 1/2012                                     Commission to be consulted on emoluments of officers and staff. ["
                }
            ]
        }
    },
    {
        "act": "REPRESENTATION OF THE PEOPLE ACT",
        "source": "https://mola.gov.gy/laws-of-guyana",
        "type": {
            "name": "section",
            "representation": "152",
            "title": "Commission to be consulted on emoluments of officers and staff.  SCHEDULE \u2013 TABLE OF FORMS    _________________________             LAWS OF GUYANA Representation of the People Cap. 1:03 11  L.R.O. 1/2012       Reg. 24/1964 O.  50/1980             Short title.     Interpretation. [16 of 1968 4 of 1972 Reg. 6/1973 O. 50/1980 O. 80/1980 16 of 1985 15 of 2000 12 of 2006  c 1:01               CHAPTER 1:03  REPRESENTATION OF THE PEOPLE ACT   An Act to make provision for the election of members of the National Assembly under a system of proportional representation and for purposes connected therewith.  [23RD  SEPTEMBER,1964]  PART I PRELIMINARY  ",
            "context": "REPRESENTATION OF THE PEOPLE ACT under Commission to be consulted on emoluments of officers and staff.  SCHEDULE  TABLE OF FORMS    _________________________             LAWS OF GUYANA Representation of the People Cap. 1:03 11  L.R.O. 1/2012       Reg. 24/1964 O.  50/1980             Short title.     Interpretation. [16 of 1968 4 of 1972 Reg. 6/1973 O. 50/1980 O. 80/1980 16 of 1985 15 of 2000 12 of 2006  c 1:01               CHAPTER 1:03  REPRESENTATION OF THE PEOPLE ACT   An Act to make provision for the election of members of the National Assembly under a system of proportional representation and for purposes connected therewith.  [23RD  SEPTEMBER,1964]  PART I PRELIMINARY  152. The Commission shall be consulted by Government with regard to the emoluments to be paid to election officers and other staff employed under this Act.     SCHEDULE   TABLE  OF  FORMS  NO.",
            "description": "The Commission shall be consulted by Government with regard to the emoluments to be paid to election officers and other staff employed under this Act.     SCHEDULE   TABLE  OF  FORMS  NO."
        }
    }
]