[
    {
        "act": "REPRESENTATION OF THE PEOPLE (ADAPTATION AND  MODIFICATION OF LAWS) ACT",
        "source": "https://mola.gov.gy/laws-of-guyana",
        "type": {
            "name": "section",
            "representation": "1",
            "title": "Short title. ",
            "context": "REPRESENTATION OF THE PEOPLE (ADAPTATION AND  MODIFICATION OF LAWS) ACT under Short title. 1.  This Act may be cited as the Representation of the People (Adaptation and Modification of Laws) Act.",
            "description": "This Act may be cited as the Representation of the People (Adaptation and Modification of Laws) Act."
        }
    },
    {
        "act": "REPRESENTATION OF THE PEOPLE (ADAPTATION AND  MODIFICATION OF LAWS) ACT",
        "source": "https://mola.gov.gy/laws-of-guyana",
        "type": {
            "name": "section",
            "representation": "2",
            "title": "Reduction of the age of majority from twenty-one years to eighteen years. ",
            "context": "REPRESENTATION OF THE PEOPLE (ADAPTATION AND  MODIFICATION OF LAWS) ACT under Reduction of the age of majority from twenty-one years to eighteen years. 2.  (1) As from the 1st January, 1974 a person shall attain full age on attaining the age of eighteen years instead of on attaining the age of twenty-one years; and a person shall attain full age on that date if he has then already attained the age of eighteen years but not the age of twenty- one years.  (2)   Subsection (1) applies for the purposes of any rule of law and, in the absence of a definition or of any indication of a contrary intention, for the construction of the expressions full age, infant, infancy, minor,  LAWS OF GUYANA 4 Cap. 1:09 Representation of the People (Adaptation and Modification of Laws)  L.R.O. 1/2012                                    Time  at which a person attains a particular age.          Persons under full  minority and similar expressions in (a)   any law, enacted before, on or after the 1st January, 1974; and  (b)    any deed,  will  or  other  instrument  of whatever   nature (not being a law) made on or after that date.  (3) The President may, by order, which shall be subject to negative resolution, amend any provision in any law enacted before the 1st January, 1974 by substituting a reference to the age of eighteen years for any reference therein to the age of twenty-one years; and any such order may contain such other provisions for the purpose of giving effect to this subsection.  (4)  Notwithstanding any rule of law, a will or codicil executed before the 1st January, 1974 shall not be treated for the purposes of this section as made on or after that date by reason only that the will or codicil is confirmed by a codicil executed on or after that date.",
            "description": [
                {
                    "representation": "(1)",
                    "description": "applies for the purposes of any rule of law and, in the absence of a definition or of any indication of a contrary intention, for the construction of the expressions full age, infant, infancy, minor,  LAWS OF GUYANA 4 Cap. 1:09 Representation of the People"
                },
                {
                    "representation": "(2)",
                    "description": "Subsection"
                },
                {
                    "representation": "(a)",
                    "description": "any law, enacted before, on or after the 1st January, 1974; and"
                },
                {
                    "representation": "(b)",
                    "description": "any deed,  will  or  other  instrument  of whatever   nature"
                },
                {
                    "representation": "(3)",
                    "description": "The President may, by order, which shall be subject to negative resolution, amend any provision in any law enacted before the 1st January, 1974 by substituting a reference to the age of eighteen years for any reference therein to the age of twenty-one years; and any such order may contain such other provisions for the purpose of giving effect to this subsection."
                },
                {
                    "representation": "(4)",
                    "description": "Notwithstanding any rule of law, a will or codicil executed before the 1st January, 1974 shall not be treated for the purposes of this section as made on or after that date by reason only that the will or codicil is confirmed by a codicil executed on or after that date."
                }
            ]
        }
    },
    {
        "act": "REPRESENTATION OF THE PEOPLE (ADAPTATION AND  MODIFICATION OF LAWS) ACT",
        "source": "https://mola.gov.gy/laws-of-guyana",
        "type": {
            "name": "section",
            "representation": "3",
            "title": "Time at which person attains a particular age. ",
            "context": "REPRESENTATION OF THE PEOPLE (ADAPTATION AND  MODIFICATION OF LAWS) ACT under Time at which person attains a particular age. 3. (1) The time at which a person attains a particular age expressed in years shall be the commencement of the relevant anniversary of the date of his birth.  (2) This section applies only where the relevant anniversary falls on a date after that of the 1st January, 1974, and, in relation to any law, deed, will or other instrument, has effect subject to any provision therein.",
            "description": [
                {
                    "representation": "(1)",
                    "description": "The time at which a person attains a particular age expressed in years shall be the commencement of the relevant anniversary of the date of his birth."
                },
                {
                    "representation": "(2)",
                    "description": "This section applies only where the relevant anniversary falls on a date after that of the 1st January, 1974, and, in relation to any law, deed, will or other instrument, has effect subject to any provision therein."
                }
            ]
        }
    },
    {
        "act": "REPRESENTATION OF THE PEOPLE (ADAPTATION AND  MODIFICATION OF LAWS) ACT",
        "source": "https://mola.gov.gy/laws-of-guyana",
        "type": {
            "name": "section",
            "representation": "4",
            "title": "Persons under full age may be described as minors instead of infants.  __________________________        7 of 1973 An Act for reducing the age of majority generally and for matters connected therewith.                                                           [ 1ST  JANUARY, 1974]  Short title.    Reduction of the age of majority from twenty-one years to eighteen years.        ",
            "context": "REPRESENTATION OF THE PEOPLE (ADAPTATION AND  MODIFICATION OF LAWS) ACT under Persons under full age may be described as minors instead of infants.  __________________________        7 of 1973 An Act for reducing the age of majority generally and for matters connected therewith.                                                           [ 1ST  JANUARY, 1974]  Short title.    Reduction of the age of majority from twenty-one years to eighteen years.        4. Anything in any law to the contrary notwithstanding a person who is not of full age may be LAWS OF GUYANA Representation of the People (Adaptation and Modification of  Laws) Cap. 1:09  5  L.R.O. 1/2012 age may be described as minors instead of infants. described as a minor instead of as an infant.  ___________________________                                 LAWS OF GUYANA 6 Cap. 1:09 Representation of the People (Adaptation and Modification of Laws)  L.R.O. 1/2012   SUBSIDIARY LEGISLATION  _________________   O. 4/1974 AGE OF MAJORITIY ORDER  made under section 2(3)    Citation.     Cap. 10:01        Statutory provisions Schedule.",
            "description": [
                {
                    "representation": "(3)",
                    "description": "Citation.     Cap. 10:01        Statutory provisions Schedule."
                }
            ]
        }
    }
]