[
    {
        "act": "IMMIGRATION ACT",
        "source": "https://mola.gov.gy/laws-of-guyana",
        "type": {
            "name": "section",
            "representation": "1",
            "title": "Short title. ",
            "context": "IMMIGRATION ACT under Short title. 1. This Act may be cited as the Immigration Act.",
            "description": "This Act may be cited as the Immigration Act."
        }
    },
    {
        "act": "IMMIGRATION ACT",
        "source": "https://mola.gov.gy/laws-of-guyana",
        "type": {
            "name": "section",
            "representation": "2",
            "title": "Interpretation. ",
            "context": "IMMIGRATION ACT under Interpretation. 2. (1) In this Act   advance passenger information means the information in CHAPTER 14:02  IMMIGRATION ACT  LAWS OF GUYANA Immigration Cap. 14:02 5  L.R.O. 1/2012 2 of 2007]                                                respect of a passenger, crew member or other person transported in the vessel;  competent authority means any person or entity as the Minister may by order prescribe;  dependant in relation to another person means  (a) the spouse of such person unless that spouse is living apart from the other spouse under a deed of separation or the decree of a competent court;  (b) the child or step-child under the age of sixteen years, of such person;  (c) an adopted child under the age of sixteen years where such child is adopted by such person in a manner recognised by the law for the time being in force in the country where the adoption took place;  (d) any other relative of such person who is wholly dependent on such person for his subsistence;  domestic space means the domestic space of any country  specified in Schedule III;   domicile means, subject to subsection (2), the place in which a person has his present home or in which he resides or to which he returns as his place of present permanent abode and not for a mere special or temporary purpose, and domiciled shall have a corresponding meaning;   LAWS OF GUYANA 6 Cap. 14:02 Immigration  L.R.O. 1/2012                                                  immigrant means a person who enters Guyana from a place outside Guyana, whether for the first or at any subsequent time;  immigration officer includes the Chief Immigration Officer, the Deputy Chief Immigration Officer, and any member of the police force authorised under section 4(4) to exercise and perform the powers, functions and duties of an immigration officer;  master means the person having command or charge of a vessel;  passenger means any person not being a bona fide member of the crew , travelling or seeking to travel on a vessel;  vessel means any steamship, ship, vessel, sloop, boat or other floating craft, and includes any description of aircraft.  (2) For the purposes of this Act  (a) a person shall not be deemed to have acquired a domicile in Guyana unless he has resided therein for at least two years otherwise than  (i) under terms of conditional or temporary residence permitted by this Act or any other law in force in Guyana; or (ii) as a person under detention in a prison or other place for the reception of persons found guilty of criminal offences; or (iii) as a person under detention in a mental hospital or a leprosy hospital; and LAWS OF GUYANA Immigration Cap. 14:02 7  L.R.O. 1/2012                                 Prohibited immigrants.  [2 of 1969 4 of 1972]               (b) a person shall be deemed to have lost his domicile in Guyana if he voluntarily goes and resides outside Guyana (except for a special or temporary purpose) with the intention of making his home outside Guyana.  (3) For the purposes of this Act a person shall be deemed to belong to Guyana if he is a citizen of Guyana or a dependant of any such citizen.  (4) For the purposes of this Act any person enters Guyana who  (a) crosses a land frontier of Guyana; or  (b) arrives in Guyana by sea or air and disembarks in Guyana; or  (c) arrives in Guyana by sea or air with the intention of disembarking in Guyana.",
            "description": [
                {
                    "representation": "(1)",
                    "description": "In this Act   advance passenger information means the information in CHAPTER 14:02  IMMIGRATION ACT  LAWS OF GUYANA Immigration Cap. 14:02 5  L.R.O. 1/2012 2 of 2007]                                                respect of a passenger, crew member or other person transported in the vessel;  competent authority means any person or entity as the Minister may by order prescribe;  dependant in relation to another person means"
                },
                {
                    "representation": "(a)",
                    "description": "crosses a land frontier of Guyana; or"
                },
                {
                    "representation": "(b)",
                    "description": "arrives in Guyana by sea or air and disembarks in Guyana; or"
                },
                {
                    "representation": "(c)",
                    "description": "arrives in Guyana by sea or air with the intention of disembarking in Guyana."
                },
                {
                    "representation": "(d)",
                    "description": "any other relative of such person who is wholly dependent on such person for his subsistence;  domestic space means the domestic space of any country  specified in Schedule III;   domicile means, subject to subsection"
                },
                {
                    "representation": "(4)",
                    "description": "For the purposes of this Act any person enters Guyana who"
                },
                {
                    "representation": "(2)",
                    "description": "For the purposes of this Act"
                },
                {
                    "representation": "(i)",
                    "description": "under terms of conditional or temporary residence permitted by this Act or any other law in force in Guyana; or"
                },
                {
                    "representation": "(3)",
                    "description": "For the purposes of this Act a person shall be deemed to belong to Guyana if he is a citizen of Guyana or a dependant of any such citizen."
                }
            ]
        }
    },
    {
        "act": "IMMIGRATION ACT",
        "source": "https://mola.gov.gy/laws-of-guyana",
        "type": {
            "name": "section",
            "representation": "3",
            "title": "Prohibited immigrants. ",
            "context": "IMMIGRATION ACT under Prohibited immigrants. 3. (1) Except as otherwise provided in this section, every person who  (a) is an idiot, or an epileptic, or of unsound mind, or mentally deficient, or deaf and dumb, or deaf and blind, or dumb or blind; or  (b) is suffering from any variety of leprosy, or from a communicable disease, as certified by a Government Medical Officer;  LAWS OF GUYANA 8 Cap. 14:02 Immigration  L.R.O. 1/2012                                                  (c) is a prostitute; or  (d) lives on, or receives, or has lived on, or has received, the proceeds of prostitution; or  (e) is a member of a class of persons, or a person, specified in an order made by the Minister under subsection (3); or  (f) is not in possession of sufficient means to support himself and such of his dependants as he shall bring with him to Guyana; or  (g) is likely if he entered Guyana to become a charge on public funds by reason of infirmity of body or mind, or ill-health, or for any other reason; or  (h) is a dependant of a prohibited immigrant,  shall be a prohibited immigrant for the purposes of this Act; and every person who is deemed under this Act to be a prohibited immigrant may be dealt with as such.  (2) The expression communicable disease in subsection (l) (b) means a communicable disease which makes the entry into Guyana of a person suffering from it, dangerous to the community.  (3) Where the Minister is satisfied  (a) that, on economic grounds or on account of standard or habits  of life, the members of any class of persons LAWS OF GUYANA Immigration Cap. 14:02 9  L.R.O. 1/2012                                                 are undesirable as immigrants; or  (b) on information or advice that any person is undesirable as an inhabitant of, or a visitor to, Guyana; or  (c) that, on the ground that a person has been convicted in any country of an offence for which a sentence of imprisonment has been passed and in respect of which he has not received a free pardon, such person is undesirable as an immigrant  he may, by order published in the Gazette, declare the members of such class of persons or such person as the case may be to be prohibited immigrants  or a prohibited immigrant, and may from time to time exempt any member of a class of persons from the operation of an order made under paragraph (a).  (4) The Minister may from time to time exempt any person from the provisions of subsection (1)(a), (b), (f), (g) or (h).  (5) The following persons or classes of persons shall not be prohibited immigrants for the purposes of this Act  (a) persons who are, within the meaning of section 2(3), deemed to belong to Guyana;  (b) persons in possession of valid re-entry permits issued under section 36;  (c) persons in the public service;  LAWS OF GUYANA 10 Cap. 14:02 Immigration  L.R.O. 1/2012                                     Immigration officers.            (d) persons in the service of the Government of any Commonwealth territory;  (e) members of the regular naval, military or air forces of any Commonwealth territory;  (f) members of the mission in Guyana of a foreign sovereign Power, consular officers and consular employees in Guyana of a foreign sovereign Power, and members of their families forming part of their households;  (g) any other persons or classes of persons who are declared by regulations made under this Act not to be prohibited immigrants for the purposes of this Act;  (h) the dependants of any person under the foregoing paragraphs of this subsection;  (i) the dependants of any person who is not a prohibited immigrant.",
            "description": [
                {
                    "representation": "(1)",
                    "description": "Except as otherwise provided in this section, every person who"
                },
                {
                    "representation": "(a)",
                    "description": "persons who are, within the meaning of section 2(3), deemed to belong to Guyana;"
                },
                {
                    "representation": "(b)",
                    "description": "persons in possession of valid re-entry permits issued under section 36;"
                },
                {
                    "representation": "(c)",
                    "description": "persons in the public service;  LAWS OF GUYANA 10 Cap. 14:02 Immigration  L.R.O. 1/2012                                     Immigration officers."
                },
                {
                    "representation": "(d)",
                    "description": "persons in the service of the Government of any Commonwealth territory;"
                },
                {
                    "representation": "(e)",
                    "description": "members of the regular naval, military or air forces of any Commonwealth territory;"
                },
                {
                    "representation": "(f)",
                    "description": "members of the mission in Guyana of a foreign sovereign Power, consular officers and consular employees in Guyana of a foreign sovereign Power, and members of their families forming part of their households;"
                },
                {
                    "representation": "(g)",
                    "description": "any other persons or classes of persons who are declared by regulations made under this Act not to be prohibited immigrants for the purposes of this Act;"
                },
                {
                    "representation": "(h)",
                    "description": "the dependants of any person under the foregoing paragraphs of this subsection;"
                },
                {
                    "representation": "(2)",
                    "description": "The expression communicable disease in subsection"
                },
                {
                    "representation": "(l)",
                    "description": "(b) means a communicable disease which makes the entry into Guyana of a person suffering from it, dangerous to the community."
                },
                {
                    "representation": "(3)",
                    "description": "Where the Minister is satisfied"
                },
                {
                    "representation": "(4)",
                    "description": "The Minister may from time to time exempt any person from the provisions of subsection"
                },
                {
                    "representation": "(5)",
                    "description": "The following persons or classes of persons shall not be prohibited immigrants for the purposes of this Act"
                },
                {
                    "representation": "(i)",
                    "description": "the dependants of any person who is not a prohibited immigrant."
                }
            ]
        }
    },
    {
        "act": "IMMIGRATION ACT",
        "source": "https://mola.gov.gy/laws-of-guyana",
        "type": {
            "name": "section",
            "representation": "4",
            "title": "Immigration officers. ",
            "context": "IMMIGRATION ACT under Immigration officers. 4. (1) The Commissioner of Police shall be the Chief Immigration Officer for the purposes of this Act.  (2) A Deputy Chief Immigration Officer may be appointed and such officer shall have and may exercise all the powers, functions and duties of the Chief Immigration Officer under this Act.  (3) Immigration officers may be appointed for the purposes of this Act or for any specified part thereof. LAWS OF GUYANA Immigration Cap. 14:02 11  L.R.O. 1/2012                            Person entering Guyana to have a passport. [2 of 1969]                      (4) The Chief Immigration Officer may, by writing under his hand,  authorise any member of the police force, subject to such directions as he may give to him from time to time, to exercise and perform in a specified part of Guyana, and any such authorised person shall have and may exercise and perform subject to such directions, all the powers, functions and duties of an immigration officer; and the Chief Immigration Officer may at any time, by writing under his hand, cancel any such authorisation.  (5) Every appointment or authorisation under this section shall be published in the Gazette.  (6) For the purpose of performing his duties under this Act, every immigration officer shall have, and may exercise and perform, all the powers, functions and duties of a member of the police force.",
            "description": [
                {
                    "representation": "(1)",
                    "description": "The Commissioner of Police shall be the Chief Immigration Officer for the purposes of this Act."
                },
                {
                    "representation": "(2)",
                    "description": "A Deputy Chief Immigration Officer may be appointed and such officer shall have and may exercise all the powers, functions and duties of the Chief Immigration Officer under this Act."
                },
                {
                    "representation": "(3)",
                    "description": "Immigration officers may be appointed for the purposes of this Act or for any specified part thereof. LAWS OF GUYANA Immigration Cap. 14:02 11  L.R.O. 1/2012                            Person entering Guyana to have a passport. [2 of 1969]"
                },
                {
                    "representation": "(4)",
                    "description": "The Chief Immigration Officer may, by writing under his hand,  authorise any member of the police force, subject to such directions as he may give to him from time to time, to exercise and perform in a specified part of Guyana, and any such authorised person shall have and may exercise and perform subject to such directions, all the powers, functions and duties of an immigration officer; and the Chief Immigration Officer may at any time, by writing under his hand, cancel any such authorisation."
                },
                {
                    "representation": "(5)",
                    "description": "Every appointment or authorisation under this section shall be published in the Gazette."
                },
                {
                    "representation": "(6)",
                    "description": "For the purpose of performing his duties under this Act, every immigration officer shall have, and may exercise and perform, all the powers, functions and duties of a member of the police force."
                }
            ]
        }
    },
    {
        "act": "IMMIGRATION ACT",
        "source": "https://mola.gov.gy/laws-of-guyana",
        "type": {
            "name": "section",
            "representation": "5",
            "title": "Person entering Guyana to have a passport. ",
            "context": "IMMIGRATION ACT under Person entering Guyana to have a passport. 05.  SCHEDULE I SCHEDULE II SCHEDULE III __________________________   1953 Ed. c. 98 _______________________________________________________ 42 of 1947 An Act to with respect to immigration and for purposes connected therewith.  [1ST JANUARY, 1948]  Short title.    Interpretation. [2 of 1969 19 of 1990",
            "description": "SCHEDULE I SCHEDULE II SCHEDULE III __________________________   1953 Ed. c. 98 _______________________________________________________ 42 of 1947 An Act to with respect to immigration and for purposes connected therewith.  [1ST JANUARY, 1948]  Short title.    Interpretation. [2 of 1969 19 of 1990"
        }
    },
    {
        "act": "IMMIGRATION ACT",
        "source": "https://mola.gov.gy/laws-of-guyana",
        "type": {
            "name": "section",
            "representation": "6",
            "title": "Restrictions on the right to leave Guyana. ",
            "context": "IMMIGRATION ACT under Restrictions on the right to leave Guyana. 6. (1) The Minister may, by directions in writing, impose restrictions on the right of  (a) any person to leave Guyana if he is satisfied that it is necessary so to do in the interests of defence, public safety or public order or for the purpose of preventing the subversion of democratic institutions in Guyana;  (b) persons generally or any class of persons to leave Guyana if he is satisfied that it is necessary so to do in the interests of defence, public safety, public order, public morality or public health or for the purpose of preventing the subversion of democratic institutions in Guyana.  (2) Where any person is the subject of directions given by the Minister under subsection (l)(a), notice thereof in writing (together with a concise statement of the grounds for the imposition of the restrictions, so, however, that no defect LAWS OF GUYANA Immigration Cap. 14:02 13  L.R.O. 1/2012        c. 16:02                                           of any kind in such statement shall invalidate the directions) shall be served on him by an immigration officer as soon as practicable after the directions have been given and his case shall be reviewed by the tribunal established by section 13 of the National Security (Miscellaneous Provisions) Act, and the said section 13 shall apply mutatis mutandis in relation to the review of the case of any such person as it applies to the review of the case of a person who is the subject of an order made under section 12 of that Act.  (3) Notice of any directions given by the Minister under subsection (l)(b) shall be published in the Gazette and in one newspaper circulating in Guyana.  (4) Any person with respect to whom directions have been given pursuant to subsection (l)(a), or any member of a class of persons with respect to whom directions have been given pursuant to paragraph (b) of the said subsection  (a) shall forthwith upon notice thereof being served on him, or upon publication thereof, as the case may be, surrender to the Chief Immigration Officer or any other immigration officer any valid passport issued to him by or on behalf of the Government of Guyana and the Chief Immigration Officer shall retain such passport so long as those directions continue in force; and if that person does not possess such a passport any application made by him for the purpose of procuring the issue to him of such a passport shall not be entertained so long as those directions continue in force;  (b) may, so long as those directions LAWS OF GUYANA 14 Cap. 14:02 Immigration  L.R.O. 1/2012                                         Entry of persons into Guyana.            continue in force, be prevented by any immigration officer, member of the Police Force, or officer or soldier of the Guyana Defence Force, from leaving Guyana by any means whatever for any place outside Guyana and the immigration officer, member of the Police Force, or officer or soldier of the Guyana Defence Force may, for that purpose, take any necessary measures, including the use with  any assistance of such force as is reasonably justifiable in the circumstances.  (5) Any person who contravenes or fails to comply with any of the provisions of this section or any directions given thereunder shall be liable on summary conviction to a fine of not less than twenty-five thousand dollars nor more than fifty thousand dollars and to imprisonment for two years.  (6) In this section, the expression passport includes a certificate of identity or a travel permit and any other document establishing the identity and national status of the person in respect of whom it has been issued.",
            "description": [
                {
                    "representation": "(1)",
                    "description": "The Minister may, by directions in writing, impose restrictions on the right of"
                },
                {
                    "representation": "(a)",
                    "description": "shall forthwith upon notice thereof being served on him, or upon publication thereof, as the case may be, surrender to the Chief Immigration Officer or any other immigration officer any valid passport issued to him by or on behalf of the Government of Guyana and the Chief Immigration Officer shall retain such passport so long as those directions continue in force; and if that person does not possess such a passport any application made by him for the purpose of procuring the issue to him of such a passport shall not be entertained so long as those directions continue in force;"
                },
                {
                    "representation": "(b)",
                    "description": "may, so long as those directions LAWS OF GUYANA 14 Cap. 14:02 Immigration  L.R.O. 1/2012                                         Entry of persons into Guyana.            continue in force, be prevented by any immigration officer, member of the Police Force, or officer or soldier of the Guyana Defence Force, from leaving Guyana by any means whatever for any place outside Guyana and the immigration officer, member of the Police Force, or officer or soldier of the Guyana Defence Force may, for that purpose, take any necessary measures, including the use with  any assistance of such force as is reasonably justifiable in the circumstances."
                },
                {
                    "representation": "(2)",
                    "description": "Where any person is the subject of directions given by the Minister under subsection"
                },
                {
                    "representation": "(3)",
                    "description": "Notice of any directions given by the Minister under subsection"
                },
                {
                    "representation": "(4)",
                    "description": "Any person with respect to whom directions have been given pursuant to subsection"
                },
                {
                    "representation": "(5)",
                    "description": "Any person who contravenes or fails to comply with any of the provisions of this section or any directions given thereunder shall be liable on summary conviction to a fine of not less than twenty-five thousand dollars nor more than fifty thousand dollars and to imprisonment for two years."
                },
                {
                    "representation": "(6)",
                    "description": "In this section, the expression passport includes a certificate of identity or a travel permit and any other document establishing the identity and national status of the person in respect of whom it has been issued."
                }
            ]
        }
    },
    {
        "act": "IMMIGRATION ACT",
        "source": "https://mola.gov.gy/laws-of-guyana",
        "type": {
            "name": "section",
            "representation": "7",
            "title": "Entry of persons into Guyana. ",
            "context": "IMMIGRATION ACT under Entry of persons into Guyana. 7. (1) No person shall enter Guyana by sea or by air except at a port of entry under this Act.  (2) Where a person enters Guyana by crossing a land frontier of Guyana he shall forthwith present himself to the nearest immigration officer.  (3) No person arriving in Guyana by sea or air shall disembark without the consent of an immigration officer.  LAWS OF GUYANA Immigration Cap. 14:02 15  L.R.O. 1/2012              List of passengers and members of the crew and matters in connection therewith. [48 of 1952]                              (4) The master of the vessel in which a person arrives in Guyana by sea or air shall not allow any such person to disembark from the vessel without the consent of an immigration officer.  (5) Any person who contravenes, or fails to comply with, any of the provisions of subsection (l), (2) or (3) shall be deemed to be a prohibited immigrant.",
            "description": [
                {
                    "representation": "(1)",
                    "description": "No person shall enter Guyana by sea or by air except at a port of entry under this Act."
                },
                {
                    "representation": "(2)",
                    "description": "or"
                },
                {
                    "representation": "(3)",
                    "description": "shall be deemed to be a prohibited immigrant."
                },
                {
                    "representation": "(4)",
                    "description": "The master of the vessel in which a person arrives in Guyana by sea or air shall not allow any such person to disembark from the vessel without the consent of an immigration officer."
                },
                {
                    "representation": "(5)",
                    "description": "Any person who contravenes, or fails to comply with, any of the provisions of subsection"
                }
            ]
        }
    },
    {
        "act": "IMMIGRATION ACT",
        "source": "https://mola.gov.gy/laws-of-guyana",
        "type": {
            "name": "section",
            "representation": "8",
            "title": "List of passengers and members of the crew and matters in connection therewith. 8A.        Duty of master to provide advance passenger information.  ",
            "context": "IMMIGRATION ACT under List of passengers and members of the crew and matters in connection therewith. 8A.        Duty of master to provide advance passenger information.  8. (1) The master of a vessel arriving from any place outside Guyana or departing from Guyana shall  (a) answer truthfully to the best of his ability all proper questions relating to the passengers and members of the crew, in so far as is necessary for the purposes of this Act, put to him by an immigration officer; and  (b) if required so to do, furnish the immigration officer with a list in duplicate, in the form from time to time approved by the Chief Immigration Officer, containing the names of the passengers and members of the crew arriving or departing as the case may be, and such other information as may be prescribed.  (2) Every passenger and member of the crew in a vessel arriving from any place outside Guyana or departing from Guyana shall supply the information necessary for the preparation of the list under subsection (1).  (3) Every immigration officer shall have the power to board and search any vessel at any time and at all places in Guyana. LAWS OF GUYANA 16 Cap. 14:02 Immigration  L.R.O. 1/2012  Duty of master to provide advance passenger information. [7  of  2007]                                           8A. (1) The Master of a vessel expecting to arrive at a destination in Guyana or is leaving or is expected to leave Guyana shall, before the arrival or the departure, as the case may be, of the vessel from the last port of call, provide to the competent authority at the intended port of arrival in or departure from Guyana the information as is set out in Schedule II in respect of the vessel and each person on board the vessel in the form and manner as may be approved by the Chief Immigration Officer.  (2)  The information required to be provided by the master of a vessel  shall be provided    (a)     in  the case  of a commercial aircraft, not later than fifteen minutes after departure from the last port of call;  (b)    in  the case of a private aircraft, not later than thirty minutes prior to the departure from the last port of call;  (c)   in the case of a ship arriving from outside the domestic space not later than twenty- four hours prior to the arrival in Guyana;  (d)   in the case of a ship arriving from a destination within the domestic space, not later than one hour prior to the arrival of the vessel from the last port of call.  (3) Where a master intentionally or recklessly     (a)  fails  to transmit the information required to be provided under this section; or   LAWS OF GUYANA Immigration Cap. 14:02 17  L.R.O. 1/2012                                Duty of person entering Guyana.                 (b)  transmits  incomplete  or  false information,   the master commits an offence and is liable on summary conviction to a fine of twenty million dollars.   (4) The Minister may by order and for reasons to be recorded in writing waive the requirements of subsection (1) in such circumstances and on such conditions as he may specify.   (5) For the removal of doubt it is clarified that    (a)   the provisions of this section do not apply to the arrival or departure from Guyana to a domestic space;  or  (b)  the requirement of furnishing of information under this section is in addition to and not in derogation of compliance with the requirements under section 8 (1).",
            "description": [
                {
                    "representation": "(1)",
                    "description": "in such circumstances and on such conditions as he may specify."
                },
                {
                    "representation": "(a)",
                    "description": "the provisions of this section do not apply to the arrival or departure from Guyana to a domestic space;  or"
                },
                {
                    "representation": "(b)",
                    "description": "the requirement of furnishing of information under this section is in addition to and not in derogation of compliance with the requirements under section 8"
                },
                {
                    "representation": "(2)",
                    "description": "The information required to be provided by the master of a vessel  shall be provided"
                },
                {
                    "representation": "(3)",
                    "description": "Where a master intentionally or recklessly"
                },
                {
                    "representation": "(c)",
                    "description": "in the case of a ship arriving from outside the domestic space not later than twenty- four hours prior to the arrival in Guyana;"
                },
                {
                    "representation": "(d)",
                    "description": "in the case of a ship arriving from a destination within the domestic space, not later than one hour prior to the arrival of the vessel from the last port of call."
                },
                {
                    "representation": "(4)",
                    "description": "The Minister may by order and for reasons to be recorded in writing waive the requirements of subsection"
                },
                {
                    "representation": "(5)",
                    "description": "For the removal of doubt it is clarified that"
                }
            ]
        }
    },
    {
        "act": "IMMIGRATION ACT",
        "source": "https://mola.gov.gy/laws-of-guyana",
        "type": {
            "name": "section",
            "representation": "9",
            "title": "Duty of person entering Guyana. ",
            "context": "IMMIGRATION ACT under Duty of person entering Guyana. 9. (1) Every person who enters Guyana by sea, air or land shall  (a) answer truthfully to the best of his ability all proper questions, in so far as is necessary for the purposes of this Act, put to him by an immigration officer; and  (b) if required by an immigration officer so to do,  (i) make and sign the prescribed declaration; and (ii) submit to be examined by a LAWS OF GUYANA 18 Cap. 14:02 Immigration  L.R.O. 1/2012              Departure of persons from Guyana. [2 of 1969 14 of 1997]                                    Government Medical Officer.  (2) Any person who contravenes, or fails to comply with, any of the provisions of this section shall be deemed to be a prohibited immigrant.",
            "description": [
                {
                    "representation": "(1)",
                    "description": "Every person who enters Guyana by sea, air or land shall"
                },
                {
                    "representation": "(a)",
                    "description": "answer truthfully to the best of his ability all proper questions, in so far as is necessary for the purposes of this Act, put to him by an immigration officer; and"
                },
                {
                    "representation": "(b)",
                    "description": "if required by an immigration officer so to do,"
                },
                {
                    "representation": "(i)",
                    "description": "make and sign the prescribed declaration; and"
                },
                {
                    "representation": "(2)",
                    "description": "Any person who contravenes, or fails to comply with, any of the provisions of this section shall be deemed to be a prohibited immigrant."
                }
            ]
        }
    },
    {
        "act": "IMMIGRATION ACT",
        "source": "https://mola.gov.gy/laws-of-guyana",
        "type": {
            "name": "section",
            "representation": "10",
            "title": "Departure of persons from Guyana. ",
            "context": "IMMIGRATION ACT under Departure of persons from Guyana. 10. (l) No person shall depart from Guyana by sea or by air except at a port of entry under this Act.  (2) The master of a vessel departing from Guyana shall not allow any person to embark thereon without the consent of an immigration officer.  (3) Where a person desires to depart from Guyana by crossing a land frontier he shall, before departing, present himself to the nearest immigration officer.  (4) Every person departing from Guyana shall  (a) answer truthfully to the best of his ability all proper questions, in so far as is necessary for the purposes of this Act, put to him by an immigration officer; and  (b) make and sign the prescribed declaration.  (5) In the performance of his duties under this section, an immigration officer shall have the power to board and search any vessel at any time and place in Guyana and to detain any person who contravenes, or fails to comply with, any of the provisions of this section.  (6) Every person who  (a) contravenes or fails to comply with any of the provisions of this section; LAWS OF GUYANA Immigration Cap. 14:02 19  L.R.O. 1/2012                       Certificate that immigrant not a prohibited immigrant.                       Permit to remain in Guyana for a temporary purpose. [9 of 1992 7 of 2006 7 of 2007 or  (b) knowingly and wilfully gives an untrue answer to any of the questions referred to in subsection (4)(a); or  (c) knowingly and wilfully makes any false statement in the declaration referred to in subsection (4)(b),  shall be liable on summary conviction to a fine of not less than twenty thousand dollars nor more than forty thousand dollars and to imprisonment for twelve months.",
            "description": [
                {
                    "representation": "(l)",
                    "description": "No person shall depart from Guyana by sea or by air except at a port of entry under this Act."
                },
                {
                    "representation": "(2)",
                    "description": "The master of a vessel departing from Guyana shall not allow any person to embark thereon without the consent of an immigration officer."
                },
                {
                    "representation": "(3)",
                    "description": "Where a person desires to depart from Guyana by crossing a land frontier he shall, before departing, present himself to the nearest immigration officer."
                },
                {
                    "representation": "(4)",
                    "description": "Every person departing from Guyana shall"
                },
                {
                    "representation": "(a)",
                    "description": "contravenes or fails to comply with any of the provisions of this section; LAWS OF GUYANA Immigration Cap. 14:02 19  L.R.O. 1/2012                       Certificate that immigrant not a prohibited immigrant.                       Permit to remain in Guyana for a temporary purpose. [9 of 1992 7 of 2006 7 of 2007 or"
                },
                {
                    "representation": "(b)",
                    "description": "knowingly and wilfully gives an untrue answer to any of the questions referred to in subsection"
                },
                {
                    "representation": "(5)",
                    "description": "In the performance of his duties under this section, an immigration officer shall have the power to board and search any vessel at any time and place in Guyana and to detain any person who contravenes, or fails to comply with, any of the provisions of this section."
                },
                {
                    "representation": "(6)",
                    "description": "Every person who"
                },
                {
                    "representation": "(c)",
                    "description": "knowingly and wilfully makes any false statement in the declaration referred to in subsection"
                }
            ]
        }
    },
    {
        "act": "IMMIGRATION ACT",
        "source": "https://mola.gov.gy/laws-of-guyana",
        "type": {
            "name": "section",
            "representation": "11",
            "title": "Certificate that immigrant not a prohibited immigrant. ",
            "context": "IMMIGRATION ACT under Certificate that immigrant not a prohibited immigrant. 11. (1) Where an immigration officer decides that an immigrant is not a prohibited immigrant he may, and shall if required so to do, issue to the immigrant a certificate to that effect.  (2) The certificate shall be in such form as may from time to time be approved by the Chief Immigration Officer modified, if necessary, to suit the circumstances of any particular case.  (3) The certificate shall contain such particulars and marks, together with any finger-prints, as may be deemed necessary for the purpose of identification.  (4) The certificate may be endorsed on the passport or other document establishing the identity and national status of the person to whom the certificate relates.",
            "description": [
                {
                    "representation": "(1)",
                    "description": "Where an immigration officer decides that an immigrant is not a prohibited immigrant he may, and shall if required so to do, issue to the immigrant a certificate to that effect."
                },
                {
                    "representation": "(2)",
                    "description": "The certificate shall be in such form as may from time to time be approved by the Chief Immigration Officer modified, if necessary, to suit the circumstances of any particular case."
                },
                {
                    "representation": "(3)",
                    "description": "The certificate shall contain such particulars and marks, together with any finger-prints, as may be deemed necessary for the purpose of identification."
                },
                {
                    "representation": "(4)",
                    "description": "The certificate may be endorsed on the passport or other document establishing the identity and national status of the person to whom the certificate relates."
                }
            ]
        }
    },
    {
        "act": "IMMIGRATION ACT",
        "source": "https://mola.gov.gy/laws-of-guyana",
        "type": {
            "name": "section",
            "representation": "12",
            "title": "Permit to remain in Guyana for a temporary purpose. ",
            "context": "IMMIGRATION ACT under Permit to remain in Guyana for a temporary purpose. 12.",
            "description": "12."
        }
    },
    {
        "act": "IMMIGRATION ACT",
        "source": "https://mola.gov.gy/laws-of-guyana",
        "type": {
            "name": "section",
            "representation": "13",
            "title": "Immigrant to be deemed prohibited immigrant if he fails to leave Guyana on or before the expiration of permit granted under section ",
            "context": "IMMIGRATION ACT under Immigrant to be deemed prohibited immigrant if he fails to leave Guyana on or before the expiration of permit granted under section 13. If an immigrant to whom a permit has been granted under section  12 fails to leave Guyana on or before the expiration of the period for which the permit has been granted, he shall, unless such period has been extended as provided in subsection (3) of that section, be deemed to be a prohibited immigrant.",
            "description": [
                {
                    "representation": "(3)",
                    "description": "of that section, be deemed to be a prohibited immigrant."
                }
            ]
        }
    },
    {
        "act": "IMMIGRATION ACT",
        "source": "https://mola.gov.gy/laws-of-guyana",
        "type": {
            "name": "section",
            "representation": "14",
            "title": "Postponement of decision by immigration officer. ",
            "context": "IMMIGRATION ACT under Postponement of decision by immigration officer. 14. An immigration officer may, for the purpose of making further inquiry and for such period as may be necessary therefor, postpone deciding whether an immigrant is or is not a prohibited immigrant and in any such case may, on such conditions as he may deem expedient, grant a permit to the immigrant to remain in Guyana:  Provided that    (a) the grant of such a permit shall not prejudice in any way the making of the decision as to whether the immigrant is or is not a prohibited immigrant, or the taking of any action under this Act as a consequence of such decision; and  (b) no such action shall be taken while such permit is still in force.",
            "description": [
                {
                    "representation": "(a)",
                    "description": "the grant of such a permit shall not prejudice in any way the making of the decision as to whether the immigrant is or is not a prohibited immigrant, or the taking of any action under this Act as a consequence of such decision; and"
                },
                {
                    "representation": "(b)",
                    "description": "no such action shall be taken while such permit is still in force."
                }
            ]
        }
    },
    {
        "act": "IMMIGRATION ACT",
        "source": "https://mola.gov.gy/laws-of-guyana",
        "type": {
            "name": "section",
            "representation": "15",
            "title": "Prohibited immigrant not to enter or remain in Guyana. ",
            "context": "IMMIGRATION ACT under Prohibited immigrant not to enter or remain in Guyana. 15. Except as otherwise provided by this Act, no person (a) who is a prohibited immigrant; or  (b) who being deemed under this Act to be a prohibited immigrant, is dealt LAWS OF GUYANA 24 Cap. 14:02 Immigration  L.R.O. 1/2012       Powers of immigration officer in relation to prohibited immigrants.  [8 of 1956]                                Permits to prohibited immigrants.      with as such,  shall enter or remain in Guyana.",
            "description": [
                {
                    "representation": "(a)",
                    "description": "who is a prohibited immigrant; or"
                },
                {
                    "representation": "(b)",
                    "description": "who being deemed under this Act to be a prohibited immigrant, is dealt LAWS OF GUYANA 24 Cap. 14:02 Immigration  L.R.O. 1/2012       Powers of immigration officer in relation to prohibited immigrants.  [8 of 1956]                                Permits to prohibited immigrants.      with as such,  shall enter or remain in Guyana."
                }
            ]
        }
    },
    {
        "act": "IMMIGRATION ACT",
        "source": "https://mola.gov.gy/laws-of-guyana",
        "type": {
            "name": "section",
            "representation": "16",
            "title": "Powers of immigration officer in relation to prohibited immigrants. ",
            "context": "IMMIGRATION ACT under Powers of immigration officer in relation to prohibited immigrants. 16. (l) An immigration officer who decides that an immigrant is a prohibited immigrant may in his discretion  (a) order him to leave Guyana and proceed immediately by the same vessel (or other means of transportation) by which he arrived;  (b) order him to leave Guyana within a specified period to be determined by the immigration officer; or  (c) cause him to be arrested and brought before a magistrates court, with a view to an order being made for his removal from Guyana.  (2) The specified period in an order made under subsection (l)(b) may from time to time be extended by an immigration officer, and such extension may be granted after the expiration of the specified period.  (3) Where the immigrant to whom an order made under subsection (l)(b) relates, gives notice of appeal under section 27 he shall not, without his consent in writing, be removed from Guyana before the hearing and determination of the appeal.",
            "description": [
                {
                    "representation": "(l)",
                    "description": "An immigration officer who decides that an immigrant is a prohibited immigrant may in his discretion"
                },
                {
                    "representation": "(a)",
                    "description": "order him to leave Guyana and proceed immediately by the same vessel"
                },
                {
                    "representation": "(b)",
                    "description": "relates, gives notice of appeal under section 27 he shall not, without his consent in writing, be removed from Guyana before the hearing and determination of the appeal."
                },
                {
                    "representation": "(c)",
                    "description": "cause him to be arrested and brought before a magistrates court, with a view to an order being made for his removal from Guyana."
                },
                {
                    "representation": "(2)",
                    "description": "The specified period in an order made under subsection"
                },
                {
                    "representation": "(3)",
                    "description": "Where the immigrant to whom an order made under subsection"
                }
            ]
        }
    },
    {
        "act": "IMMIGRATION ACT",
        "source": "https://mola.gov.gy/laws-of-guyana",
        "type": {
            "name": "section",
            "representation": "17",
            "title": "Permits to prohibited immigrants. ",
            "context": "IMMIGRATION ACT under Permits to prohibited immigrants. 17. (1) Subject to this Act, the President or an immigration officer may grant a permit, subject to such conditions as may be deemed expedient, to a prohibited immigrant to enter and remain in Guyana:  Provided that an immigration officer shall, in granting LAWS OF GUYANA Immigration Cap. 14:02 25  L.R.O. 1/2012                 Permit to immigrant to remain in Guyana pending the furnishing of security.    Finger-prints.         Detention in custody under this Act.                General provisions as to permits. such permit, act subject to and in accordance with the general or special directions of the President.  (2) The expression conditions in subsection (1) means conditions as to duration, place of residence, occupation, or furnishing of security, and includes conditions as to any other matter or thing whether similar or not to the matters or things in this subsection specified.",
            "description": [
                {
                    "representation": "(1)",
                    "description": "means conditions as to duration, place of residence, occupation, or furnishing of security, and includes conditions as to any other matter or thing whether similar or not to the matters or things in this subsection specified."
                },
                {
                    "representation": "(2)",
                    "description": "The expression conditions in subsection"
                }
            ]
        }
    },
    {
        "act": "IMMIGRATION ACT",
        "source": "https://mola.gov.gy/laws-of-guyana",
        "type": {
            "name": "section",
            "representation": "18",
            "title": "Permit to immigrant to remain in Guyana pending the furnishing of security. ",
            "context": "IMMIGRATION ACT under Permit to immigrant to remain in Guyana pending the furnishing of security. 18. Where security is required to be furnished in respect of an immigrant, an immigration officer may grant, on such conditions as he may deem expedient, a permit to the immigrant to enter and remain in Guyana pending the furnishing of the security.",
            "description": "Where security is required to be furnished in respect of an immigrant, an immigration officer may grant, on such conditions as he may deem expedient, a permit to the immigrant to enter and remain in Guyana pending the furnishing of the security."
        }
    },
    {
        "act": "IMMIGRATION ACT",
        "source": "https://mola.gov.gy/laws-of-guyana",
        "type": {
            "name": "section",
            "representation": "19",
            "title": "Finger-prints. ",
            "context": "IMMIGRATION ACT under Finger-prints. 19. Where an immigration officer decides that an immigrant is a prohibited immigrant or grants or issues a permit or a certificate under this Act to an immigrant, the immigrant shall, if required by an immigration officer so to do, submit to his finger-prints being taken by the immigration officer or by any person on the direction of such officer.",
            "description": "Where an immigration officer decides that an immigrant is a prohibited immigrant or grants or issues a permit or a certificate under this Act to an immigrant, the immigrant shall, if required by an immigration officer so to do, submit to his finger-prints being taken by the immigration officer or by any person on the direction of such officer."
        }
    },
    {
        "act": "IMMIGRATION ACT",
        "source": "https://mola.gov.gy/laws-of-guyana",
        "type": {
            "name": "section",
            "representation": "20",
            "title": "Detention in custody under this Act. ",
            "context": "IMMIGRATION ACT under Detention in custody under this Act. 20. (1) An immigration officer may cause any immigrant (not being an immigrant as to whom an immigration officer has decided that he is not a prohibited immigrant), unless a permit has been granted to him under this Act, to be arrested and brought before a magistrate, and the magistrate shall, if satisfied that this section applies to the immigrant, order that he be detained in custody under this Act, and if not so satisfied he shall order his release.  (2) Where a person is detained in custody under this section he shall be released from such custody on a permit being granted to him to remain in Guyana.",
            "description": [
                {
                    "representation": "(1)",
                    "description": "An immigration officer may cause any immigrant"
                },
                {
                    "representation": "(2)",
                    "description": "Where a person is detained in custody under this section he shall be released from such custody on a permit being granted to him to remain in Guyana."
                }
            ]
        }
    },
    {
        "act": "IMMIGRATION ACT",
        "source": "https://mola.gov.gy/laws-of-guyana",
        "type": {
            "name": "section",
            "representation": "21",
            "title": "General provisions as to permits. ",
            "context": "IMMIGRATION ACT under General provisions as to permits. 21. (1) Every permit granted under this Act shall be in the form from time to time approved by the Chief LAWS OF GUYANA 26 Cap. 14:02 Immigration  L.R.O. 1/2012                                                Conditions and restrictions relating to Immigration Officer, modified if necessary in accordance with the facts of any particular case.  (2) The Chief Immigration Officer may direct that any permit, or any permit of a particular class, granted under this Act may be endorsed on the passport or other document establishing the identity and national status of the immigrant or in such other manner as the Chief Immigration Officer may think fit.  (3) Every permit granted under this Act shall contain such particulars and marks, together with any finger-prints, as may be deemed necessary for the purpose of identification.  (4) A permit granted under this Act may be revoked  (a) where there is a contravention or failure to comply with the conditions of the permit; or  (b) at any time, by the President or by an immigration officer acting on the direction of the President.  (5) Where a permit is revoked, the immigrant to whom the permit related may be arrested and brought before a magistrates court to be dealt with under section 20:  Provided that the court may, if the permit was revoked under subsection (4)(a) and the court is not satisfied that there was a contravention or failure to comply with the conditions of the permit, cancel the revocation of the permit and order the immigrant to be released.",
            "description": [
                {
                    "representation": "(1)",
                    "description": "Every permit granted under this Act shall be in the form from time to time approved by the Chief LAWS OF GUYANA 26 Cap. 14:02 Immigration  L.R.O. 1/2012                                                Conditions and restrictions relating to Immigration Officer, modified if necessary in accordance with the facts of any particular case."
                },
                {
                    "representation": "(2)",
                    "description": "The Chief Immigration Officer may direct that any permit, or any permit of a particular class, granted under this Act may be endorsed on the passport or other document establishing the identity and national status of the immigrant or in such other manner as the Chief Immigration Officer may think fit."
                },
                {
                    "representation": "(3)",
                    "description": "Every permit granted under this Act shall contain such particulars and marks, together with any finger-prints, as may be deemed necessary for the purpose of identification."
                },
                {
                    "representation": "(4)",
                    "description": "A permit granted under this Act may be revoked"
                },
                {
                    "representation": "(a)",
                    "description": "and the court is not satisfied that there was a contravention or failure to comply with the conditions of the permit, cancel the revocation of the permit and order the immigrant to be released."
                },
                {
                    "representation": "(b)",
                    "description": "at any time, by the President or by an immigration officer acting on the direction of the President."
                },
                {
                    "representation": "(5)",
                    "description": "Where a permit is revoked, the immigrant to whom the permit related may be arrested and brought before a magistrates court to be dealt with under section 20:  Provided that the court may, if the permit was revoked under subsection"
                }
            ]
        }
    },
    {
        "act": "IMMIGRATION ACT",
        "source": "https://mola.gov.gy/laws-of-guyana",
        "type": {
            "name": "section",
            "representation": "22",
            "title": "Conditions and restrictions relating to permits and certificates. ",
            "context": "IMMIGRATION ACT under Conditions and restrictions relating to permits and certificates. 22. (1) Every person to whom a permit or certificate under this Act has been granted shall at all times, if required LAWS OF GUYANA Immigration Cap. 14:02 27  L.R.O. 1/2012 permits and certificates.                     Notice and grounds of decision that immigrant is a prohibited immigrant.          Power of Chief Immigration Officer to annul or vary certain  decisions of immigration officer.      so to do, produce the permit or certificate to any immigration officer or member of the police force.  (2) No person to whom a permit or certificate under this Act has been granted shall lend, transfer, assign, or part with the possession of, such permit or certificate to any other person.  (3) Where a person has in his possession a permit or certificate appearing to have been granted under this Act, he shall answer all questions put to him by an immigration officer or a member of the police force for the purpose of establishing his identity with the person named in the permit or certificate, as the case may be, and shall, if required by an immigration officer or member of the police force so to do, submit to his finger-prints being taken for that purpose.",
            "description": [
                {
                    "representation": "(1)",
                    "description": "Every person to whom a permit or certificate under this Act has been granted shall at all times, if required LAWS OF GUYANA Immigration Cap. 14:02 27  L.R.O. 1/2012 permits and certificates.                     Notice and grounds of decision that immigrant is a prohibited immigrant.          Power of Chief Immigration Officer to annul or vary certain  decisions of immigration officer.      so to do, produce the permit or certificate to any immigration officer or member of the police force."
                },
                {
                    "representation": "(2)",
                    "description": "No person to whom a permit or certificate under this Act has been granted shall lend, transfer, assign, or part with the possession of, such permit or certificate to any other person."
                },
                {
                    "representation": "(3)",
                    "description": "Where a person has in his possession a permit or certificate appearing to have been granted under this Act, he shall answer all questions put to him by an immigration officer or a member of the police force for the purpose of establishing his identity with the person named in the permit or certificate, as the case may be, and shall, if required by an immigration officer or member of the police force so to do, submit to his finger-prints being taken for that purpose."
                }
            ]
        }
    },
    {
        "act": "IMMIGRATION ACT",
        "source": "https://mola.gov.gy/laws-of-guyana",
        "type": {
            "name": "section",
            "representation": "23",
            "title": "Notice and grounds of decision that immigrant is a prohibited immigrant. ",
            "context": "IMMIGRATION ACT under Notice and grounds of decision that immigrant is a prohibited immigrant. 23.",
            "description": "23."
        }
    },
    {
        "act": "IMMIGRATION ACT",
        "source": "https://mola.gov.gy/laws-of-guyana",
        "type": {
            "name": "section",
            "representation": "24",
            "title": "Power of Chief Immigration Officer to annul or vary certain decisions of immigration officer. ",
            "context": "IMMIGRATION ACT under Power of Chief Immigration Officer to annul or vary certain decisions of immigration officer. 24. (1) Where an immigration officer decides that an immigrant is a prohibited immigrant, the Chief Immigration Officer may, if he thinks fit, whether or not the immigrant has given notice of appeal under section 23, annul that decision and either substitute therefor the decision that the immigrant is not a prohibited immigrant or remit the matter to the immigration officer for further consideration.  (2) An immigrant may appeal to the Chief or cause to be served, a copy of such notice on the master or LAWS OF GUYANA 28 Cap. 14:02 Immigration  L.R.O. 1/2012         Where immigrant  not discovered to be prohibited immigrant until after he enters Guyana.                                 Immigration officer to cause prohibited immigrants entering or found in Guyana to be removed Immigration Officer from any decision of an immigration officer refusing or revoking a permit, or imposing conditions in a permit, under this Act, and the decision of the Chief Immigration Officer shall be final.",
            "description": [
                {
                    "representation": "(1)",
                    "description": "Where an immigration officer decides that an immigrant is a prohibited immigrant, the Chief Immigration Officer may, if he thinks fit, whether or not the immigrant has given notice of appeal under section 23, annul that decision and either substitute therefor the decision that the immigrant is not a prohibited immigrant or remit the matter to the immigration officer for further consideration."
                },
                {
                    "representation": "(2)",
                    "description": "An immigrant may appeal to the Chief or cause to be served, a copy of such notice on the master or LAWS OF GUYANA 28 Cap. 14:02 Immigration  L.R.O. 1/2012         Where immigrant  not discovered to be prohibited immigrant until after he enters Guyana.                                 Immigration officer to cause prohibited immigrants entering or found in Guyana to be removed Immigration Officer from any decision of an immigration officer refusing or revoking a permit, or imposing conditions in a permit, under this Act, and the decision of the Chief Immigration Officer shall be final."
                }
            ]
        }
    },
    {
        "act": "IMMIGRATION ACT",
        "source": "https://mola.gov.gy/laws-of-guyana",
        "type": {
            "name": "section",
            "representation": "25",
            "title": "Where immigrant not discovered to be prohibited immigrant until after he enters Guyana. LAWS OF GUYANA 4 Cap. 14:02 Immigration  L.R.O. 1/2012  SECTION  ",
            "context": "IMMIGRATION ACT under Where immigrant not discovered to be prohibited immigrant until after he enters Guyana. LAWS OF GUYANA 4 Cap. 14:02 Immigration  L.R.O. 1/2012  SECTION  25. Subject to section 28, where a person enters Guyana without a permit under this Act and at the time he so enters is a prohibited immigrant, he shall not be exempt from the provisions of this Act or be deemed to have acquired a right to remain in Guyana or a domicile therein, by reason only  (a) that he had not been informed that he could not enter or remain in Guyana; or  (b) that he had been allowed to enter or remain in Guyana  (i) through the oversight of, or any misrepresentation made to, an immigration officer; or (ii) owing to the decision of an immigration officer that he is not a prohibited immigrant, where such decision was given by mistake or in ignorance of material facts; or (iii) owing to the fact having been undiscovered that he was a prohibited immigrant.",
            "description": [
                {
                    "representation": "(a)",
                    "description": "that he had not been informed that he could not enter or remain in Guyana; or"
                },
                {
                    "representation": "(b)",
                    "description": "that he had been allowed to enter or remain in Guyana"
                },
                {
                    "representation": "(i)",
                    "description": "through the oversight of, or any misrepresentation made to, an immigration officer; or"
                }
            ]
        }
    },
    {
        "act": "IMMIGRATION ACT",
        "source": "https://mola.gov.gy/laws-of-guyana",
        "type": {
            "name": "section",
            "representation": "26",
            "title": "Immigration officer to cause prohibited immigrants entering or found in Guyana to be removed therefrom. ",
            "context": "IMMIGRATION ACT under Immigration officer to cause prohibited immigrants entering or found in Guyana to be removed therefrom. 26. Except as otherwise provided in this Act, an immigration officer shall cause to be removed from Guyana every prohibited immigrant, and every person deemed to be a prohibited immigrant and dealt with as such  (a) who enters Guyana; or LAWS OF GUYANA Immigration Cap. 14:02 29  L.R.O. 1/2012 therefrom.      Appeal from decision of immigration officer under section",
            "description": [
                {
                    "representation": "(a)",
                    "description": "who enters Guyana; or LAWS OF GUYANA Immigration Cap. 14:02 29  L.R.O. 1/2012 therefrom.      Appeal from decision of immigration officer under section"
                }
            ]
        }
    },
    {
        "act": "IMMIGRATION ACT",
        "source": "https://mola.gov.gy/laws-of-guyana",
        "type": {
            "name": "section",
            "representation": "27",
            "title": "Appeal from decision of immigration officer under section ",
            "context": "IMMIGRATION ACT under Appeal from decision of immigration officer under section 27. (1) Where notice under section 23 is given to an immigrant, the immigrant may appeal  (a) to the nearest magistrates court, from the decision specified in the notice, by giving notice of appeal in the prescribed form to the immigration officer within seven days after the date on which the notice under section 23 was given to the immigrant; and  (b) to a judge of the High Court sitting in Chambers, from the decision of the magistrates court, by giving notice of appeal in the prescribed form to the immigration officer and to the clerk of the said magistrates court within seven days (or within such extended period as may be allowed on an application made to a Judge of the High Court sitting in Chambers) after the date of the decision of the magistrates court.  (2) Where a notice of appeal is given under subsection (l)(b) to the clerk of the magistrates court, the clerk shall forthwith transmit to the Registrar of the Supreme Court four copies of the notice of appeal, the notes of proceedings in the magistrates court, the documentary exhibits, the decision of the magistrate and his reasons therefor (if available).  LAWS OF GUYANA 30 Cap. 14:02 Immigration  L.R.O. 1/2012                                                  (3) No fee shall be charged for the hearing of any appeal under this section, or for the filing of any documents in relation thereto.  (4) Where an immigrant gives notice of appeal under subsection (l)(b), an immigration officer may apply to a magistrate of the magisterial district in which the magistrates court is situate, or to a judge of the High Court sitting in Chambers, for an order requiring the immigrant to furnish the prescribed security within a time to be fixed by the magistrate or judge as the case may be; and the magistrate or Judge shall, if the circumstances so warrant, make an order accordingly.  (5) If an immigrant fails to furnish the required security within the time fixed by an order made under subsection (4), the notice of appeal under subsection (l)(b) shall cease to have effect and the appeal to a judge of the High Court sitting in Chambers shall be deemed to have been abandoned.  (6) On the hearing of an appeal under this section  (a) an order made under section 3(3)(a) shall be conclusive evidence that an immigrant who is one of the members of the class of persons declared by the order to be prohibited immigrants, is a prohibited immigrant;  (b) an order made under section 3(3)(b) or (c) shall be conclusive evidence that the person declared by the order to be a prohibited immigrant, is a prohibited immigrant.  (7) On the hearing of an appeal under this section oral evidence may be adduced before the magistrates court, LAWS OF GUYANA Immigration Cap. 14:02 31  L.R.O. 1/2012               Orders for removal of prohibited immigrants from Guyana.  [2 of 1969]                               and a judge of the High Court sitting in Chambers shall have power to take oral evidence.  (8) No order for the removal from Guyana as a prohibited immigrant of the person to whom a notice of appeal under subsection (l)(a) or (b) relates shall be issued before the hearing and determination of the appeal, and where such order is issued it shall not be enforced before such hearing and determination.",
            "description": [
                {
                    "representation": "(1)",
                    "description": "Where notice under section 23 is given to an immigrant, the immigrant may appeal"
                },
                {
                    "representation": "(a)",
                    "description": "or"
                },
                {
                    "representation": "(b)",
                    "description": "relates shall be issued before the hearing and determination of the appeal, and where such order is issued it shall not be enforced before such hearing and determination."
                },
                {
                    "representation": "(2)",
                    "description": "Where a notice of appeal is given under subsection"
                },
                {
                    "representation": "(3)",
                    "description": "No fee shall be charged for the hearing of any appeal under this section, or for the filing of any documents in relation thereto."
                },
                {
                    "representation": "(4)",
                    "description": "Where an immigrant gives notice of appeal under subsection"
                },
                {
                    "representation": "(5)",
                    "description": "If an immigrant fails to furnish the required security within the time fixed by an order made under subsection"
                },
                {
                    "representation": "(6)",
                    "description": "On the hearing of an appeal under this section"
                },
                {
                    "representation": "(c)",
                    "description": "shall be conclusive evidence that the person declared by the order to be a prohibited immigrant, is a prohibited immigrant."
                },
                {
                    "representation": "(7)",
                    "description": "On the hearing of an appeal under this section oral evidence may be adduced before the magistrates court, LAWS OF GUYANA Immigration Cap. 14:02 31  L.R.O. 1/2012               Orders for removal of prohibited immigrants from Guyana.  [2 of 1969]                               and a judge of the High Court sitting in Chambers shall have power to take oral evidence."
                },
                {
                    "representation": "(8)",
                    "description": "No order for the removal from Guyana as a prohibited immigrant of the person to whom a notice of appeal under subsection"
                }
            ]
        }
    },
    {
        "act": "IMMIGRATION ACT",
        "source": "https://mola.gov.gy/laws-of-guyana",
        "type": {
            "name": "section",
            "representation": "28",
            "title": "Orders for removal of prohibited immigrants from Guyana. ",
            "context": "IMMIGRATION ACT under Orders for removal of prohibited immigrants from Guyana. 28. (1) If any immigrant is a prohibited immigrant, then, subject to the provisions of this Act and the terms of any permit granted thereunder, any magistrate may, on the application of an immigration officer or of any person deputed in writing by the Chief Immigration Officer for the purpose of making such application, order the immigrant to be removed from Guyana and in the meantime to be detained in custody.  (2) Where an order is made under this section for the removal of an immigrant from Guyana, he shall be removed therefrom at such time and in such manner as the Chief Immigration Officer may direct, and in giving such directions the Chief Immigration officer shall have regard to the place from which the immigrant came when he entered Guyana, the country of which he is a subject or citizen, the place therein to which he is alleged to belong, the country which is willing to receive him, and the wishes and the means of the immigrant.  (3) Where an order is made under this section for the removal of an immigrant from Guyana and the immigrant is at the time of the making of the order serving a sentence of imprisonment, the Minister may give directions as to whether the whole or what part of the sentence is to be served before such removal and in default of such directions the immigrant shall be removed after completion of his sentence.  LAWS OF GUYANA 32 Cap. 14:02 Immigration  L.R.O. 1/2012               Warrant to convey deserting seaman, or stowaway or prohibited immigrant who lands in Guyana back on board vessel.           Variation and revocation of orders made by the President or the Minister.  [2 of 1969]   Detention in custody and places of detention.        (4) Where an order is made under this section for the removal of an immigrant from Guyana, the immigrant may be placed on board a suitable vessel by any immigration officer or member of the police force and may be lawfully detained in custody on board such vessel so long as the vessel is within the territorial waters of Guyana.  (5) In this section the expression immigrant includes the dependants of the immigrant.",
            "description": [
                {
                    "representation": "(1)",
                    "description": "If any immigrant is a prohibited immigrant, then, subject to the provisions of this Act and the terms of any permit granted thereunder, any magistrate may, on the application of an immigration officer or of any person deputed in writing by the Chief Immigration Officer for the purpose of making such application, order the immigrant to be removed from Guyana and in the meantime to be detained in custody."
                },
                {
                    "representation": "(2)",
                    "description": "Where an order is made under this section for the removal of an immigrant from Guyana, he shall be removed therefrom at such time and in such manner as the Chief Immigration Officer may direct, and in giving such directions the Chief Immigration officer shall have regard to the place from which the immigrant came when he entered Guyana, the country of which he is a subject or citizen, the place therein to which he is alleged to belong, the country which is willing to receive him, and the wishes and the means of the immigrant."
                },
                {
                    "representation": "(3)",
                    "description": "Where an order is made under this section for the removal of an immigrant from Guyana and the immigrant is at the time of the making of the order serving a sentence of imprisonment, the Minister may give directions as to whether the whole or what part of the sentence is to be served before such removal and in default of such directions the immigrant shall be removed after completion of his sentence.  LAWS OF GUYANA 32 Cap. 14:02 Immigration  L.R.O. 1/2012               Warrant to convey deserting seaman, or stowaway or prohibited immigrant who lands in Guyana back on board vessel.           Variation and revocation of orders made by the President or the Minister.  [2 of 1969]   Detention in custody and places of detention."
                },
                {
                    "representation": "(4)",
                    "description": "Where an order is made under this section for the removal of an immigrant from Guyana, the immigrant may be placed on board a suitable vessel by any immigration officer or member of the police force and may be lawfully detained in custody on board such vessel so long as the vessel is within the territorial waters of Guyana."
                },
                {
                    "representation": "(5)",
                    "description": "In this section the expression immigrant includes the dependants of the immigrant."
                }
            ]
        }
    },
    {
        "act": "IMMIGRATION ACT",
        "source": "https://mola.gov.gy/laws-of-guyana",
        "type": {
            "name": "section",
            "representation": "29",
            "title": "Warrant to convey deserting seaman, or stowaway or prohibited immigrant who lands in Guyana, back on board vessel. ",
            "context": "IMMIGRATION ACT under Warrant to convey deserting seaman, or stowaway or prohibited immigrant who lands in Guyana, back on board vessel. 29. The master of a vessel may, on information in writing made by him on oath before any magistrate, apply for a warrant to arrest and convey back on board the vessel-  (a) any seaman who has deserted the vessel; or  (b) any stowaway or prohibited immigrant who has landed from the vessel,  and the magistrate may, unless there are special reasons for not so doing, issue a warrant accordingly.",
            "description": [
                {
                    "representation": "(a)",
                    "description": "any seaman who has deserted the vessel; or"
                },
                {
                    "representation": "(b)",
                    "description": "any stowaway or prohibited immigrant who has landed from the vessel,  and the magistrate may, unless there are special reasons for not so doing, issue a warrant accordingly."
                }
            ]
        }
    },
    {
        "act": "IMMIGRATION ACT",
        "source": "https://mola.gov.gy/laws-of-guyana",
        "type": {
            "name": "section",
            "representation": "30",
            "title": "Variation and revocation of orders made by the President or the Minister. ",
            "context": "IMMIGRATION ACT under Variation and revocation of orders made by the President or the Minister. 30. Any order or direction made or given by the President or by the Minister under this Act may be varied or revoked by him.",
            "description": "Any order or direction made or given by the President or by the Minister under this Act may be varied or revoked by him."
        }
    },
    {
        "act": "IMMIGRATION ACT",
        "source": "https://mola.gov.gy/laws-of-guyana",
        "type": {
            "name": "section",
            "representation": "31",
            "title": "Detention in custody and places of detention. ",
            "context": "IMMIGRATION ACT under Detention in custody and places of detention. 31. (l) Where a person is detained in custody under this Act, he may be so detained in a prison or in any place from time to time appointed by the Minister for the purpose of such detention in custody:  Provided that where any such person is detained in a prison he shall be treated in the same manner as if he were a person awaiting trial.  LAWS OF GUYANA Immigration Cap. 14:02 33  L.R.O. 1/2012                            Expenses of removal from Guyana of an immigrant.                    (2) Any person in charge of a prison, and any member of the police force, may, on the written order of an immigration officer, accept custody of any person, and detain such person in custody under this Act.  (3) No person shall be so detained in custody for any longer period than is necessary for the purpose of any inquiry under this Act, or for the completion by the immigration officer of arrangements for the removal of such person (being a prohibited immigrant) from Guyana at the first reasonable opportunity.  (4) The production to any person in charge of a prison or of a place of detention under this Act of an order of removal shall be sufficient authority to such person in charge to deliver the person named therein to the escort appointed to bring such person from the prison or place of detention for the purpose of his removal from Guyana in terms of such order.",
            "description": [
                {
                    "representation": "(l)",
                    "description": "Where a person is detained in custody under this Act, he may be so detained in a prison or in any place from time to time appointed by the Minister for the purpose of such detention in custody:  Provided that where any such person is detained in a prison he shall be treated in the same manner as if he were a person awaiting trial.  LAWS OF GUYANA Immigration Cap. 14:02 33  L.R.O. 1/2012                            Expenses of removal from Guyana of an immigrant."
                },
                {
                    "representation": "(2)",
                    "description": "Any person in charge of a prison, and any member of the police force, may, on the written order of an immigration officer, accept custody of any person, and detain such person in custody under this Act."
                },
                {
                    "representation": "(3)",
                    "description": "No person shall be so detained in custody for any longer period than is necessary for the purpose of any inquiry under this Act, or for the completion by the immigration officer of arrangements for the removal of such person"
                },
                {
                    "representation": "(4)",
                    "description": "The production to any person in charge of a prison or of a place of detention under this Act of an order of removal shall be sufficient authority to such person in charge to deliver the person named therein to the escort appointed to bring such person from the prison or place of detention for the purpose of his removal from Guyana in terms of such order."
                }
            ]
        }
    },
    {
        "act": "IMMIGRATION ACT",
        "source": "https://mola.gov.gy/laws-of-guyana",
        "type": {
            "name": "section",
            "representation": "32",
            "title": "Expenses of removal from Guyana of an immigrant. ",
            "context": "IMMIGRATION ACT under Expenses of removal from Guyana of an immigrant. 32. (1) Except as otherwise provided in this section, the expenses of the removal from Guyana of a prohibited immigrant, in so far as they are not defrayed by the immigrant, shall be payable out of moneys provided by Parliament.  (2) The expenses of the passage from Guyana of a prohibited immigrant removed therefrom under this Act shall be borne by the vessel in which the immigrant arrived in Guyana or by the owner or agent thereof  (a) where the immigrant is so removed in consequence of an order made under section 16(1)(a);  (b) where the immigrant is so removed in consequence of an order made under section 16(1)(b): LAWS OF GUYANA 34 Cap. 14:02 Immigration  L.R.O. 1/2012                                      Recovery of expenses.              Provided that this provision shall not apply where the specified period in the order as originally made or extended exceeds sixty days;  (c) where the immigrant is so removed in consequence of proceedings taken under section 16(1)(c):  Provided that this provision shall not apply where the immigrant was not brought before a magistrates court within fourteen days after his arrival in Guyana.  (3) The liability of the vessel or of the owner or agent thereof under subsection (2) shall not be affected by reason only of the fact that the immigrant has appealed under section 27 against the decision of the immigration officer that he is a prohibited immigrant.  (4) Nothing in this section shall be construed as affecting the liability (if any) of the immigrant to pay the expenses of his passage from Guyana, to the master, owner or agent of the vessel in which he arrived in Guyana.  (5) In this section the expression immigrant includes the dependants of the immigrant.",
            "description": [
                {
                    "representation": "(1)",
                    "description": "Except as otherwise provided in this section, the expenses of the removal from Guyana of a prohibited immigrant, in so far as they are not defrayed by the immigrant, shall be payable out of moneys provided by Parliament."
                },
                {
                    "representation": "(2)",
                    "description": "shall not be affected by reason only of the fact that the immigrant has appealed under section 27 against the decision of the immigration officer that he is a prohibited immigrant."
                },
                {
                    "representation": "(a)",
                    "description": "where the immigrant is so removed in consequence of an order made under section 16(1)(a);"
                },
                {
                    "representation": "(b)",
                    "description": "where the immigrant is so removed in consequence of an order made under section 16(1)(b): LAWS OF GUYANA 34 Cap. 14:02 Immigration  L.R.O. 1/2012                                      Recovery of expenses.              Provided that this provision shall not apply where the specified period in the order as originally made or extended exceeds sixty days;"
                },
                {
                    "representation": "(c)",
                    "description": "where the immigrant is so removed in consequence of proceedings taken under section 16(1)(c):  Provided that this provision shall not apply where the immigrant was not brought before a magistrates court within fourteen days after his arrival in Guyana."
                },
                {
                    "representation": "(3)",
                    "description": "The liability of the vessel or of the owner or agent thereof under subsection"
                },
                {
                    "representation": "(4)",
                    "description": "Nothing in this section shall be construed as affecting the liability"
                },
                {
                    "representation": "(5)",
                    "description": "In this section the expression immigrant includes the dependants of the immigrant."
                }
            ]
        }
    },
    {
        "act": "IMMIGRATION ACT",
        "source": "https://mola.gov.gy/laws-of-guyana",
        "type": {
            "name": "section",
            "representation": "33",
            "title": "Recovery of expenses. ",
            "context": "IMMIGRATION ACT under Recovery of expenses. 33. (1) Where a magistrate is satisfied, by information in writing made on oath  (a) that expenses have been or will be incurred by or on behalf of the Government in connection with the maintenance, medical treatment, or removal from Guyana, of an immigrant or of his dependants, and  (b) as to the amount or the estimated LAWS OF GUYANA Immigration Cap. 14:02 35  L.R.O. 1/2012                       c. 10:02              Offences.  [48 of 1952 14 of 1997 15 of 1998]           amount of such expenses  the following provisions shall apply  (i) the magistrate may issue a warrant for the levy of the amount as aforesaid by distress and sale of any movable property of the immigrant; and (ii) for the purposes of the recovery of the amount as aforesaid, the magistrate may order forfeiture of any moneys in the possession of the immigrant.  (2) A warrant issued under subsection (1) may be executed in the same manner as a warrant of distress issued under the Summary Jurisdiction (Procedure) Act for the levy of a sum of money adjudged to be paid by an order.  (3) The partial recovery of expenses under subsection (1) (i) or (ii) shall not prejudice the liability of any surety for the balance, nor shall the issue or execution of a warrant or the forfeiture of moneys under this section be a condition precedent to the liability of any surety or to the enforcement of such liability.",
            "description": [
                {
                    "representation": "(1)",
                    "description": "(i) or"
                },
                {
                    "representation": "(a)",
                    "description": "that expenses have been or will be incurred by or on behalf of the Government in connection with the maintenance, medical treatment, or removal from Guyana, of an immigrant or of his dependants, and"
                },
                {
                    "representation": "(b)",
                    "description": "as to the amount or the estimated LAWS OF GUYANA Immigration Cap. 14:02 35  L.R.O. 1/2012                       c. 10:02              Offences.  [48 of 1952 14 of 1997 15 of 1998]           amount of such expenses  the following provisions shall apply"
                },
                {
                    "representation": "(i)",
                    "description": "the magistrate may issue a warrant for the levy of the amount as aforesaid by distress and sale of any movable property of the immigrant; and"
                },
                {
                    "representation": "(2)",
                    "description": "A warrant issued under subsection"
                },
                {
                    "representation": "(3)",
                    "description": "The partial recovery of expenses under subsection"
                }
            ]
        }
    },
    {
        "act": "IMMIGRATION ACT",
        "source": "https://mola.gov.gy/laws-of-guyana",
        "type": {
            "name": "section",
            "representation": "34",
            "title": "Offences. ",
            "context": "IMMIGRATION ACT under Offences. 34. (1) Any person who  (a) enters Guyana by sea or by air, except at a port of entry under this Act; or  (b) having entered Guyana by crossing a land frontier of Guyana, does not forthwith present himself in person to the nearest immigration officer; or  (c) having arrived in Guyana, by sea or LAWS OF GUYANA 36 Cap. 14:02 Immigration  L.R.O. 1/2012                                                  air, disembarks without the consent of an immigration officer; or  (d) being the master of a vessel arriving in Guyana by sea or air, allows any person who arrives in such vessel to disembark therefrom without the consent of an immigration officer; or (e) being the master of a vessel arriving from any place outside Guyana or departing from Guyana  (i) refuses to answer any of the questions referred to in section 8(1)(a); or (ii) knowingly and wilfully gives an untrue answer to any such question; or (iii) refuses to furnish the immigration officer with the list referred to in section 8(1)(b); or  (f) being a passenger intending to enter or entering Guyana, or a member of the crew of a vessel arriving from any place outside Guyana or departing from Guyana  (i) knowingly and wilfully supplies any false information for the preparation of the list referred to in section 8(1)(b); or (ii) knowingly and wilfully gives an untrue answer to any of the questions referred to in section 9(1)(a); or (iii) knowingly and wilfully makes any false statement in the LAWS OF GUYANA Immigration Cap. 14:02 37  L.R.O. 1/2012                                                 declaration referred to in section 9(1)(b)(i); or  (g) not being a person as to whom an immigration officer has decided that he is not a prohibited immigrant, disembarks in Guyana or otherwise enters Guyana without previously obtaining a permit under this Act; or  (h) aids, assists or procures a prohibited immigrant who has not obtained a permit under this Act to enter Guyana, knowing him to be such, to disembark in Guyana or otherwise to enter Guyana; or  (i) assaults, resists, obstructs, or hinders any immigration officer or member of the police force in the execution of his duty under this Act; or  (j) without lawful excuse knowingly harbours or conceals  (i) any other person who is within Guyana in contravention of this Act; or (ii) any other person who having entered Guyana under the authority of a permit issued under this Act has contravened, or failed to comply with, any condition subject to which the permit is granted; or  (k) contravenes, or fails to comply with, any of the provisions of sections 19 or LAWS OF GUYANA 38 Cap. 14:02 Immigration  L.R.O. 1/2012                                                   22; or  (1) contravenes, or fails to comply with, any of the conditions subject to which any permit has been granted under this Act,  shall be liable on summary conviction to a fine of not less than thirty thousand dollars nor more than sixty thousand dollars and to imprisonment for twelve months.  (2) A complaint for an offence under subsection (l)(a), (b), (c) or (d) may be made at any time.  (3) Any person who for the purpose of entering Guyana or of remaining therein or of assisting any other person to enter Guyana or to remain therein, in contravention of the provisions of this Act  (a) fabricates or falsifies any passport, permit, certificate, or other document; or  (b) uses, utters, or attempts to use or utter  (i) any passport, permit, certificate, or other document which has not been issued by lawful authority or which he is not entitled to use or utter; or (ii) any fabricated or falsified passport, permit, certificate, or other document, knowing the same to have been fabricated or falsified,  shall be liable on summary conviction to imprisonment for LAWS OF GUYANA Immigration Cap. 14:02 39  L.R.O. 1/2012          Evidence and burden of proof.                          Re-entry permits.            twelve months.  (4) Any person who makes a statement which is to his knowledge untrue for the purpose of procuring a re-entry permit under section 36 shall be liable on summary conviction to imprisonment for twelve months.",
            "description": [
                {
                    "representation": "(1)",
                    "description": "contravenes, or fails to comply with, any of the conditions subject to which any permit has been granted under this Act,  shall be liable on summary conviction to a fine of not less than thirty thousand dollars nor more than sixty thousand dollars and to imprisonment for twelve months."
                },
                {
                    "representation": "(a)",
                    "description": "fabricates or falsifies any passport, permit, certificate, or other document; or"
                },
                {
                    "representation": "(b)",
                    "description": "uses, utters, or attempts to use or utter"
                },
                {
                    "representation": "(c)",
                    "description": "or"
                },
                {
                    "representation": "(d)",
                    "description": "may be made at any time."
                },
                {
                    "representation": "(e)",
                    "description": "being the master of a vessel arriving from any place outside Guyana or departing from Guyana"
                },
                {
                    "representation": "(i)",
                    "description": "any passport, permit, certificate, or other document which has not been issued by lawful authority or which he is not entitled to use or utter; or"
                },
                {
                    "representation": "(f)",
                    "description": "being a passenger intending to enter or entering Guyana, or a member of the crew of a vessel arriving from any place outside Guyana or departing from Guyana"
                },
                {
                    "representation": "(g)",
                    "description": "not being a person as to whom an immigration officer has decided that he is not a prohibited immigrant, disembarks in Guyana or otherwise enters Guyana without previously obtaining a permit under this Act; or"
                },
                {
                    "representation": "(h)",
                    "description": "aids, assists or procures a prohibited immigrant who has not obtained a permit under this Act to enter Guyana, knowing him to be such, to disembark in Guyana or otherwise to enter Guyana; or"
                },
                {
                    "representation": "(j)",
                    "description": "without lawful excuse knowingly harbours or conceals"
                },
                {
                    "representation": "(k)",
                    "description": "contravenes, or fails to comply with, any of the provisions of sections 19 or LAWS OF GUYANA 38 Cap. 14:02 Immigration  L.R.O. 1/2012                                                   22; or"
                },
                {
                    "representation": "(2)",
                    "description": "A complaint for an offence under subsection"
                },
                {
                    "representation": "(3)",
                    "description": "Any person who for the purpose of entering Guyana or of remaining therein or of assisting any other person to enter Guyana or to remain therein, in contravention of the provisions of this Act"
                },
                {
                    "representation": "(4)",
                    "description": "Any person who makes a statement which is to his knowledge untrue for the purpose of procuring a re-entry permit under section 36 shall be liable on summary conviction to imprisonment for twelve months."
                }
            ]
        }
    },
    {
        "act": "IMMIGRATION ACT",
        "source": "https://mola.gov.gy/laws-of-guyana",
        "type": {
            "name": "section",
            "representation": "35",
            "title": "Evidence and burden of proof. ",
            "context": "IMMIGRATION ACT under Evidence and burden of proof. 35. In any proceedings under this Act  (a) the burden of proof that the person charged belongs to Guyana or that he is not likely to become a charge on public funds shall be upon that person;  (b) any document purporting to be a removal order made under this Act shall be deemed, until the contrary is proved, to be such an order;  (c) any order or direction made or given under this Act shall be deemed, until the contrary is proved, to have been validly made or given and to have been made or given on the date on which it purports to have been made or given.",
            "description": [
                {
                    "representation": "(a)",
                    "description": "the burden of proof that the person charged belongs to Guyana or that he is not likely to become a charge on public funds shall be upon that person;"
                },
                {
                    "representation": "(b)",
                    "description": "any document purporting to be a removal order made under this Act shall be deemed, until the contrary is proved, to be such an order;"
                },
                {
                    "representation": "(c)",
                    "description": "any order or direction made or given under this Act shall be deemed, until the contrary is proved, to have been validly made or given and to have been made or given on the date on which it purports to have been made or given."
                }
            ]
        }
    },
    {
        "act": "IMMIGRATION ACT",
        "source": "https://mola.gov.gy/laws-of-guyana",
        "type": {
            "name": "section",
            "representation": "36",
            "title": "Re-entry permits. ",
            "context": "IMMIGRATION ACT under Re-entry permits. 36. (1) Where any person, who is deemed under section 2(3) to belong to Guyana, proposes to depart from Guyana with the intention of returning thereto, the Chief Immigration Officer, or an immigration officer, shall have, subject to regulations made under this Act, power to issue a re-entry permit to such person.  (2) Every re-entry permit issued under this section shall be valid for a period of two years from the date thereof.  LAWS OF GUYANA 40 Cap. 14:02 Immigration  L.R.O. 1/2012                Power to make regulations. [2 of 1969]                                (3) Where the person to whom a re-entry permit relates returns to Guyana at any time within two years from the date of the permit and produces the same to an immigration officer, the immigration officer shall accept the re-entry permit as conclusive evidence that such person belongs to Guyana for the purposes of this Act.  (4) A re-entry permit issued under this section may be endorsed on the passport, as defined in section 5(2) of the person to whom the re-entry permit relates.",
            "description": [
                {
                    "representation": "(1)",
                    "description": "Where any person, who is deemed under section 2(3) to belong to Guyana, proposes to depart from Guyana with the intention of returning thereto, the Chief Immigration Officer, or an immigration officer, shall have, subject to regulations made under this Act, power to issue a re-entry permit to such person."
                },
                {
                    "representation": "(2)",
                    "description": "Every re-entry permit issued under this section shall be valid for a period of two years from the date thereof.  LAWS OF GUYANA 40 Cap. 14:02 Immigration  L.R.O. 1/2012                Power to make regulations. [2 of 1969]"
                },
                {
                    "representation": "(3)",
                    "description": "Where the person to whom a re-entry permit relates returns to Guyana at any time within two years from the date of the permit and produces the same to an immigration officer, the immigration officer shall accept the re-entry permit as conclusive evidence that such person belongs to Guyana for the purposes of this Act."
                },
                {
                    "representation": "(4)",
                    "description": "A re-entry permit issued under this section may be endorsed on the passport, as defined in section 5(2) of the person to whom the re-entry permit relates."
                }
            ]
        }
    },
    {
        "act": "IMMIGRATION ACT",
        "source": "https://mola.gov.gy/laws-of-guyana",
        "type": {
            "name": "section",
            "representation": "37",
            "title": "Power to make regulations. ",
            "context": "IMMIGRATION ACT under Power to make regulations. 37. Subject to negative resolution of the National Assembly, the Minister may make regulations  (a) prescribing the diseases which are communicable diseases for the purpose of section 3(1)(b);  (b) declaring the persons, or the classes of persons, who shall not, under section 3(5)(g) be prohibited immigrants;  (c) prescribing the powers, functions and duties of immigration officers;  (d) declaring ports of entry for the purposes of section 7;  (e) prescribing the steps to be taken to prevent prohibited immigrants from entering Guyana;  (f) prescribing the time, place and manner of the inquiry and examination under section 9 in relation to persons entering Guyana;  (g) prescribing the conditions subject to LAWS OF GUYANA Immigration Cap. 14:02 41  L.R.O. 1/2012                                                 which permits may be issued under section 12(1), and section 14, and section 18, and the fees to be charged for any permit granted under this Act;  (h) prescribing the amount and the nature of the security to be furnished under this Act;  (i) prescribing the manner in which an order made under section 16(1)(a) or (b) may be carried into effect;  (j) prescribing the time, place and manner of the inquiry and examination of persons who having entered Guyana after the commencement of this Act are found in Guyana and are suspected to be prohibited immigrants within the meaning of this Act;  (k) prescribing the practice and procedure in an appeal under section 27, and in any application or other proceeding connected therewith or incidental thereto;  (l) prescribing the means to be taken, including the taking of photographs and finger-prints, for the identification of any person believed to be a prohibited immigrant;  (m) prescribing the procedure for the carrying into effect of an order made under section 28 for the removal from Guyana of a prohibited immigrant, LAWS OF GUYANA 42 Cap. 14:02 Immigration  L.R.O. 1/2012                                               Power to prohibit the entry of aliens into Guyana.    and for his detention in custody pending such removal;  (n) for the management, control and discipline of any place appointed by the Minister under section 31 for the detention of persons in custody, for the diet of persons detained in any such place, and for the punishment of persons detained therein where they commit any offence against such regulations;  (o) prescribing the procedure on the making of an application under section 36 for the issue of a re-entry permit, the evidence to be required in relation thereto, and the fee to be charged on application for and on issue of the same;  (p) prescribing the forms of, and the particulars to be inserted in, applications, declarations, notices given by immigration officers, notices of appeal, orders made by immigration officers, or other documents made, kept, issued or used under or for the purposes of this Act;  (q) generally for the carrying out of the objects and purposes of this Act.",
            "description": [
                {
                    "representation": "(a)",
                    "description": "prescribing the diseases which are communicable diseases for the purpose of section 3(1)(b);"
                },
                {
                    "representation": "(b)",
                    "description": "may be carried into effect;"
                },
                {
                    "representation": "(c)",
                    "description": "prescribing the powers, functions and duties of immigration officers;"
                },
                {
                    "representation": "(d)",
                    "description": "declaring ports of entry for the purposes of section 7;"
                },
                {
                    "representation": "(e)",
                    "description": "prescribing the steps to be taken to prevent prohibited immigrants from entering Guyana;"
                },
                {
                    "representation": "(f)",
                    "description": "prescribing the time, place and manner of the inquiry and examination under section 9 in relation to persons entering Guyana;"
                },
                {
                    "representation": "(g)",
                    "description": "prescribing the conditions subject to LAWS OF GUYANA Immigration Cap. 14:02 41  L.R.O. 1/2012                                                 which permits may be issued under section 12(1), and section 14, and section 18, and the fees to be charged for any permit granted under this Act;"
                },
                {
                    "representation": "(h)",
                    "description": "prescribing the amount and the nature of the security to be furnished under this Act;"
                },
                {
                    "representation": "(i)",
                    "description": "prescribing the manner in which an order made under section 16(1)(a) or"
                },
                {
                    "representation": "(j)",
                    "description": "prescribing the time, place and manner of the inquiry and examination of persons who having entered Guyana after the commencement of this Act are found in Guyana and are suspected to be prohibited immigrants within the meaning of this Act;"
                },
                {
                    "representation": "(k)",
                    "description": "prescribing the practice and procedure in an appeal under section 27, and in any application or other proceeding connected therewith or incidental thereto;"
                },
                {
                    "representation": "(l)",
                    "description": "prescribing the means to be taken, including the taking of photographs and finger-prints, for the identification of any person believed to be a prohibited immigrant;"
                },
                {
                    "representation": "(m)",
                    "description": "prescribing the procedure for the carrying into effect of an order made under section 28 for the removal from Guyana of a prohibited immigrant, LAWS OF GUYANA 42 Cap. 14:02 Immigration  L.R.O. 1/2012                                               Power to prohibit the entry of aliens into Guyana.    and for his detention in custody pending such removal;"
                },
                {
                    "representation": "(n)",
                    "description": "for the management, control and discipline of any place appointed by the Minister under section 31 for the detention of persons in custody, for the diet of persons detained in any such place, and for the punishment of persons detained therein where they commit any offence against such regulations;"
                },
                {
                    "representation": "(o)",
                    "description": "prescribing the procedure on the making of an application under section 36 for the issue of a re-entry permit, the evidence to be required in relation thereto, and the fee to be charged on application for and on issue of the same;"
                },
                {
                    "representation": "(p)",
                    "description": "prescribing the forms of, and the particulars to be inserted in, applications, declarations, notices given by immigration officers, notices of appeal, orders made by immigration officers, or other documents made, kept, issued or used under or for the purposes of this Act;"
                },
                {
                    "representation": "(q)",
                    "description": "generally for the carrying out of the objects and purposes of this Act."
                }
            ]
        }
    },
    {
        "act": "IMMIGRATION ACT",
        "source": "https://mola.gov.gy/laws-of-guyana",
        "type": {
            "name": "section",
            "representation": "38",
            "title": "Power to prohibit the entry of aliens into Guyana. ",
            "context": "IMMIGRATION ACT under Power to prohibit the entry of aliens into Guyana. 38. Anything to the contrary contained in this Act notwithstanding, the President may in his absolute discretion prohibit the entry of any alien into Guyana.   LAWS OF GUYANA Immigration Cap. 14:02 43  L.R.O. 1/2012 Saving as to  c. 14:05    [9 of 1992 O. 17/2003]                                          Free entry of graduates.",
            "description": "Anything to the contrary contained in this Act notwithstanding, the President may in his absolute discretion prohibit the entry of any alien into Guyana.   LAWS OF GUYANA Immigration Cap. 14:02 43  L.R.O. 1/2012 Saving as to  c. 14:05    [9 of 1992 O. 17/2003]                                          Free entry of graduates."
        }
    },
    {
        "act": "IMMIGRATION ACT",
        "source": "https://mola.gov.gy/laws-of-guyana",
        "type": {
            "name": "section",
            "representation": "39",
            "title": "Saving as to Cap. 14:",
            "context": "IMMIGRATION ACT under Saving as to Cap. 14:39. Nothing in this Act shall be deemed to affect the operation of the Expulsion of Undesirables Act.   SCHEDULE I  PART A  (a) graduates of the University of the West Indies;  (b) graduates of the University of Guyana; (bb) graduates of the University of Suriname; (c) other skilled and professional personnel;  (d) contract workers on a seasonal basis; (e) persons engaged in the visual and performing arts;  (f) persons engaged in sports; (g) persons engaged in the media.  PART B",
            "description": [
                {
                    "representation": "(a)",
                    "description": "graduates of the University of the West Indies;"
                },
                {
                    "representation": "(b)",
                    "description": "graduates of the University of Guyana;"
                },
                {
                    "representation": "(c)",
                    "description": "other skilled and professional personnel;"
                },
                {
                    "representation": "(d)",
                    "description": "contract workers on a seasonal basis;"
                },
                {
                    "representation": "(e)",
                    "description": "persons engaged in the visual and performing arts;"
                },
                {
                    "representation": "(f)",
                    "description": "persons engaged in sports;"
                },
                {
                    "representation": "(g)",
                    "description": "persons engaged in the media.  PART B"
                }
            ]
        }
    }
]