[
    {
        "act": "POLICE COMPLAINTS AUTHORITY ACT",
        "source": "https://mola.gov.gy/laws-of-guyana",
        "type": {
            "name": "section",
            "representation": "1",
            "title": "Short title. ",
            "context": "POLICE COMPLAINTS AUTHORITY ACT under Short title. 1. This Act may be cited as the Police Complaints Authority Act.",
            "description": "This Act may be cited as the Police Complaints Authority Act."
        }
    },
    {
        "act": "POLICE COMPLAINTS AUTHORITY ACT",
        "source": "https://mola.gov.gy/laws-of-guyana",
        "type": {
            "name": "section",
            "representation": "2",
            "title": "Interpretation. ",
            "context": "POLICE COMPLAINTS AUTHORITY ACT under Interpretation. 2. In this Act  appropriate disciplinary authority means  LAWS OF GUYANA Police Complaints Authority Cap. 17:02 5  L.R.O. 1/2012                       c. 17:01                        Establishment of Police Complaints (a)      in relation to any member of the Force of or above the rank of Inspector, but not being the Commissioner, the Police Service Commission; and  (b)     in relation to any member of the Force, other than those mentioned in subparagraph (i), the  disciplinary authority;  Authority means the person appointed as the Police Complaints Authority established by section 3 and includes any person appointed as an ad hoc Police Complaints Authority under section 4;  Commissioner means the Commissioner of Police;  disciplinary authority has the  same  meaning as in the  Police (Discipline) Act; member of the Force  (a)    except in Part II and the Schedule, has the same meaning as in the Police Act;  (b)     in Part II and the Schedule, does not include the Commissioner, but in other respects has the same meaning as in the Police Act;  misconduct means any of the acts or omissions specified in the Schedule, each of such acts or omissions being an offence against discipline under the Police (Discipline) Act;  prescribed means prescribed by the Minister by regulations;  the Force has the same meaning as in the Police Act.",
            "description": [
                {
                    "representation": "(a)",
                    "description": "except in Part II and the Schedule, has the same meaning as in the Police Act;"
                },
                {
                    "representation": "(b)",
                    "description": "in Part II and the Schedule, does not include the Commissioner, but in other respects has the same meaning as in the Police Act;  misconduct means any of the acts or omissions specified in the Schedule, each of such acts or omissions being an offence against discipline under the Police"
                }
            ]
        }
    },
    {
        "act": "POLICE COMPLAINTS AUTHORITY ACT",
        "source": "https://mola.gov.gy/laws-of-guyana",
        "type": {
            "name": "section",
            "representation": "3",
            "title": "Establishment of Police Complaints Authority. ",
            "context": "POLICE COMPLAINTS AUTHORITY ACT under Establishment of Police Complaints Authority. 3. (1) There is hereby established an authority to be known as the Police Complaints Authority which shall consist LAWS OF GUYANA 6 Cap. 17:02 Police Complaints Authority  L.R.O. 1/2012 Authority.                   Ad hoc appointment  as Authority.                             of one person to be appointed by the President from among persons who have been, who are, or who are qualified to be, a Puisne Judge of the High Court.  (2) The terms and conditions of appointment of the person appointed as the Authority shall be such as may be determined by the President.  (3) The headquarters of the Authority shall be in such place as may be determined by the President.  (4) The appointment of any person as the Authority shall be published in the Gazette.",
            "description": [
                {
                    "representation": "(1)",
                    "description": "There is hereby established an authority to be known as the Police Complaints Authority which shall consist LAWS OF GUYANA 6 Cap. 17:02 Police Complaints Authority  L.R.O. 1/2012 Authority.                   Ad hoc appointment  as Authority.                             of one person to be appointed by the President from among persons who have been, who are, or who are qualified to be, a Puisne Judge of the High Court."
                },
                {
                    "representation": "(2)",
                    "description": "The terms and conditions of appointment of the person appointed as the Authority shall be such as may be determined by the President."
                },
                {
                    "representation": "(3)",
                    "description": "The headquarters of the Authority shall be in such place as may be determined by the President."
                },
                {
                    "representation": "(4)",
                    "description": "The appointment of any person as the Authority shall be published in the Gazette."
                }
            ]
        }
    },
    {
        "act": "POLICE COMPLAINTS AUTHORITY ACT",
        "source": "https://mola.gov.gy/laws-of-guyana",
        "type": {
            "name": "section",
            "representation": "4",
            "title": "Ad hoc appointment as Authority. ",
            "context": "POLICE COMPLAINTS AUTHORITY ACT under Ad hoc appointment as Authority. 4. (1) Where the President is satisfied that the person who is holding office as the Authority is personally interested in  (a)      any matter in relation to any complaint made to the Authority under section 8; or  (b)    any matter in relation to any complaint or information of   the   nature   referred   to   in   section   12,   including   the investigation into any such complaint or information,  the President may appoint any person who is qualified to be appointed as the Authority as an ad hoc Police Complaints Authority to perform the functions of the Authority under this Act in respect of the complaint referred to in paragraph (a) or investigation into the complaint or information referred to in paragraph (b), as the case may be, on such terms and conditions of appointment as may be determined by the President.  (2) The appointment of any person as an ad hoc Police LAWS OF GUYANA Police Complaints Authority Cap. 17:02 7  L.R.O. 1/2012                                           Oath of office.          Officers and employees of Authority.        Provisions of this Part in Complaints Authority and the matter or matters in respect of which the appointment has been made shall be published in the Gazette.  (3) One person may be appointed as ad hoc Police Complaints Authority in respect of more than one complaint or investigation referred to in subsection (l).  (4) Any person appointed as an ad hoc Police Complaints Authority under subsection (1) shall have all the functions of the Authority under this Act in respect of the complaint or investigation in relation to which he has been appointed.  (5) Where an ad hoc Police Complaints Authority has been appointed under subsection (1) in respect of any complaint under section 8 or investigation into any complaint or information of the nature referred to in section 12, the  Police Complaints Authority shall not exercise any function in respect of that complaint or investigation.",
            "description": [
                {
                    "representation": "(1)",
                    "description": "in respect of any complaint under section 8 or investigation into any complaint or information of the nature referred to in section 12, the  Police Complaints Authority shall not exercise any function in respect of that complaint or investigation."
                },
                {
                    "representation": "(a)",
                    "description": "or investigation into the complaint or information referred to in paragraph"
                },
                {
                    "representation": "(b)",
                    "description": "any matter in relation to any complaint or information of   the   nature   referred   to   in   section   12,   including   the investigation into any such complaint or information,  the President may appoint any person who is qualified to be appointed as the Authority as an ad hoc Police Complaints Authority to perform the functions of the Authority under this Act in respect of the complaint referred to in paragraph"
                },
                {
                    "representation": "(2)",
                    "description": "The appointment of any person as an ad hoc Police LAWS OF GUYANA Police Complaints Authority Cap. 17:02 7  L.R.O. 1/2012                                           Oath of office.          Officers and employees of Authority.        Provisions of this Part in Complaints Authority and the matter or matters in respect of which the appointment has been made shall be published in the Gazette."
                },
                {
                    "representation": "(3)",
                    "description": "One person may be appointed as ad hoc Police Complaints Authority in respect of more than one complaint or investigation referred to in subsection"
                },
                {
                    "representation": "(4)",
                    "description": "Any person appointed as an ad hoc Police Complaints Authority under subsection"
                },
                {
                    "representation": "(5)",
                    "description": "Where an ad hoc Police Complaints Authority has been appointed under subsection"
                }
            ]
        }
    },
    {
        "act": "POLICE COMPLAINTS AUTHORITY ACT",
        "source": "https://mola.gov.gy/laws-of-guyana",
        "type": {
            "name": "section",
            "representation": "5",
            "title": "Oath of office. ",
            "context": "POLICE COMPLAINTS AUTHORITY ACT under Oath of office. 5. It shall be the duty of a person appointed as the Authority to make and subscribe, before entering upon the duties of his office, an oath or affirmation that he will faithfully, impartially and to the best of his ability discharge the trust, and perform the duties devolving upon him by virtue of the appointment, such oath or affirmation being taken before the President.",
            "description": "It shall be the duty of a person appointed as the Authority to make and subscribe, before entering upon the duties of his office, an oath or affirmation that he will faithfully, impartially and to the best of his ability discharge the trust, and perform the duties devolving upon him by virtue of the appointment, such oath or affirmation being taken before the President."
        }
    },
    {
        "act": "POLICE COMPLAINTS AUTHORITY ACT",
        "source": "https://mola.gov.gy/laws-of-guyana",
        "type": {
            "name": "section",
            "representation": "6",
            "title": "Officers and employees of Authority.                                                                 PART II INQUIRY INTO COMPLAINTS OF MISCONDUCT BY MEMBERS OF THE FORCE  ",
            "context": "POLICE COMPLAINTS AUTHORITY ACT under Officers and employees of Authority.                                                                 PART II INQUIRY INTO COMPLAINTS OF MISCONDUCT BY MEMBERS OF THE FORCE  6. The Minister shall provide the Authority with a Secretary and such other officers and employees as are required for the proper performance of his functions.  PART II INQUIRY INTO COMPLAINTS OF MISCONDUCT BY MEMBERS OF THE FORCE",
            "description": "The Minister shall provide the Authority with a Secretary and such other officers and employees as are required for the proper performance of his functions.  PART II INQUIRY INTO COMPLAINTS OF MISCONDUCT BY MEMBERS OF THE FORCE"
        }
    },
    {
        "act": "POLICE COMPLAINTS AUTHORITY ACT",
        "source": "https://mola.gov.gy/laws-of-guyana",
        "type": {
            "name": "section",
            "representation": "7",
            "title": "Provisions of this Part in addition to and not in derogation of Police (Discipline) Act; powers of appropriate disciplinary authority preserved.  ",
            "context": "POLICE COMPLAINTS AUTHORITY ACT under Provisions of this Part in addition to and not in derogation of Police (Discipline) Act; powers of appropriate disciplinary authority preserved.  7. (1) The provisions of this Part shall be in addition LAWS OF GUYANA 8 Cap. 17:02 Police Complaints Authority  L.R.O. 1/2012 addition to and not in derogation of Police (Discipline) Act; powers of appropriate disciplinary authority preserved. c. 17:",
            "description": [
                {
                    "representation": "(1)",
                    "description": "The provisions of this Part shall be in addition LAWS OF GUYANA 8 Cap. 17:02 Police Complaints Authority  L.R.O. 1/2012 addition to and not in derogation of Police"
                }
            ]
        }
    },
    {
        "act": "POLICE COMPLAINTS AUTHORITY ACT",
        "source": "https://mola.gov.gy/laws-of-guyana",
        "type": {
            "name": "section",
            "representation": "8",
            "title": "Complaint to Authority. ",
            "context": "POLICE COMPLAINTS AUTHORITY ACT under Complaint to Authority. 8. (1) Any person who has reasonable grounds to believe that a member of the Force is guilty of any misconduct may make a complaint to the Authority stating  (a) the particulars of the complaint;  (b)    the  particulars,  as  far  as  they  are  known,  of  the person against whom the complaint is made;  (c)    the  nature  of  the  evidence  that  the  complainant proposes to produce in respect of the complaint; and  (d)  such other matters as may be prescribed.  (2) A complaint to the Authority under this section may be presented in person, or may be sent by registered post, to the Secretary of the Authority.",
            "description": [
                {
                    "representation": "(1)",
                    "description": "Any person who has reasonable grounds to believe that a member of the Force is guilty of any misconduct may make a complaint to the Authority stating"
                },
                {
                    "representation": "(a)",
                    "description": "the particulars of the complaint;"
                },
                {
                    "representation": "(b)",
                    "description": "the  particulars,  as  far  as  they  are  known,  of  the person against whom the complaint is made;"
                },
                {
                    "representation": "(c)",
                    "description": "the  nature  of  the  evidence  that  the  complainant proposes to produce in respect of the complaint; and"
                },
                {
                    "representation": "(d)",
                    "description": "such other matters as may be prescribed."
                },
                {
                    "representation": "(2)",
                    "description": "A complaint to the Authority under this section may be presented in person, or may be sent by registered post, to the Secretary of the Authority."
                }
            ]
        }
    },
    {
        "act": "POLICE COMPLAINTS AUTHORITY ACT",
        "source": "https://mola.gov.gy/laws-of-guyana",
        "type": {
            "name": "section",
            "representation": "9",
            "title": "Procedure on receipt of complaint.  ",
            "context": "POLICE COMPLAINTS AUTHORITY ACT under Procedure on receipt of complaint.  9. (1) Where any complaint has been made to the Authority under section 8, the Authority, after considering the complaint and, where found necessary, examining the complainant,  (a)  may reject the complaint if the Authority is of the opinion  LAWS OF GUYANA Police Complaints Authority Cap. 17:02 9  L.R.O. 1/2012                                                 (i)  that the complaint is frivolous or that it does not pertain to a matter the Authority is empowered to deal with under this Act; or (ii)   that  there  has  been  undue  delay in making the complaint after the complainant has come to know of the commission of the misconduct complained of:  Provided  that  no  complaint  shall  be  rejected  by  the  Authority without giving the person who made the complaint a reasonable opportunity of being heard;  (b)     where    the    Authority  does not reject a complaint under paragraph (a), he shall refer it to the Commissioner for investigation and inquiry, under the Police (Discipline) Act.  (2)  Where a complaint is referred to the Commissioner under subsection (1) by the Authority, the Commissioner shall cause the complaint to be investigated expeditiously under section 5 of the Police (Discipline) Act and a copy of the report of the investigating officer referred to in section 5(4) of that Act shall be forwarded by the Commissioner, as soon as possible after the report is submitted, to the Authority for his comments.  (3)  The comments of the Authority on the report of the investigating officer, referred to in subsection (2), shall be taken into account before a decision is taken under section 5(4) of the Police (Discipline) Act as to whether any charge of any misconduct should be instituted against a member of the Force.  LAWS OF GUYANA 10 Cap. 17:02 Police Complaints Authority  L.R.O. 1/2012                                      Direction  to record complaint, etc.         (4) Where a complaint has been referred to the  Commissioner under  subsection (1)  by the  Authority and an inquiry conducted against a member of the Force, in respect of the misconduct alleged in the complaint, under sections 5 and 6 of the Police (Discipline) Act, a copy of the report containing the findings of the officer conducting the inquiry shall be forwarded to the  Authority for his comments before any punishment is imposed on a member of the Force pursuant to the findings and the disciplinary authority or the Police Service Commission shall take into account the comments of the Authority while imposing any punishment on a member of the Force:  Provided that the concerned member of the Force shall be provided with a copy of the comments of the Authority referred to above and given   an   opportunity   to   make   representation against such comments, before any punishment is imposed on him.  (5) Without prejudice to the provisions of subsections (2), (3) and (4), where the Authority has referred a complaint to the Commissioner under subsection (1), the Authority may, before the completion of the investigation or inquiry, resulting from the complaint, under the Police (Discipline) Act, request the  commissioner to furnish interim reports containing information relating to particular aspects of the investigation or of the inquiry and The Commissioner shall comply with the request as expeditiously as possible.",
            "description": [
                {
                    "representation": "(1)",
                    "description": "by the  Authority and an inquiry conducted against a member of the Force, in respect of the misconduct alleged in the complaint, under sections 5 and 6 of the Police"
                },
                {
                    "representation": "(a)",
                    "description": "may reject the complaint if the Authority is of the opinion  LAWS OF GUYANA Police Complaints Authority Cap. 17:02 9  L.R.O. 1/2012"
                },
                {
                    "representation": "(i)",
                    "description": "that the complaint is frivolous or that it does not pertain to a matter the Authority is empowered to deal with under this Act; or"
                },
                {
                    "representation": "(b)",
                    "description": "where    the    Authority  does not reject a complaint under paragraph"
                },
                {
                    "representation": "(2)",
                    "description": "Where a complaint is referred to the Commissioner under subsection"
                },
                {
                    "representation": "(4)",
                    "description": "Where a complaint has been referred to the  Commissioner under  subsection"
                },
                {
                    "representation": "(3)",
                    "description": "and"
                },
                {
                    "representation": "(5)",
                    "description": "Without prejudice to the provisions of subsections"
                }
            ]
        }
    },
    {
        "act": "POLICE COMPLAINTS AUTHORITY ACT",
        "source": "https://mola.gov.gy/laws-of-guyana",
        "type": {
            "name": "section",
            "representation": "10",
            "title": "Direction to record complaint, etc. ",
            "context": "POLICE COMPLAINTS AUTHORITY ACT under Direction to record complaint, etc. 10.   (1) Without prejudice to the preceding provisions of this Act, where a complaint under section 8 relates to the refusal or failure by any member of the Force in charge of a police station or branch to record any complaint or information as to the commission of any offence against any law and the Authority after considering the complaint and examining the complaint is prima facie satisfied that the said complaint or information ought to have  been recorded and investigated, the Authority may direct the member of the LAWS OF GUYANA Police Complaints Authority Cap. 17:02 11  L.R.O. 1/2012                         Contravention of Act, etc. to  be deemed to  be misconduct or  misbehaviour.                     Force in charge  of  the  relevant  police  station  or  branch  to  record  the complaint or information and to investigate the same.  (2) A copy of every direction under subsection (1) shall be forwarded to the Commissioner.  (3) On receipt of a direction under subsection (1), the member of the Force in charge of the police station or branch shall record the complaint or information and investigate the same as expeditiously as possible.  (4) The Commissioner shall forward to the Authority a report stating the result of every investigation under subsection (3), and any action taken on the basis of the investigation, as soon as possible after the investigation is completed.",
            "description": [
                {
                    "representation": "(1)",
                    "description": "shall be forwarded to the Commissioner."
                },
                {
                    "representation": "(2)",
                    "description": "A copy of every direction under subsection"
                },
                {
                    "representation": "(3)",
                    "description": "On receipt of a direction under subsection"
                },
                {
                    "representation": "(4)",
                    "description": "The Commissioner shall forward to the Authority a report stating the result of every investigation under subsection"
                }
            ]
        }
    },
    {
        "act": "POLICE COMPLAINTS AUTHORITY ACT",
        "source": "https://mola.gov.gy/laws-of-guyana",
        "type": {
            "name": "section",
            "representation": "11",
            "title": "Contravention of Act, etc., to be deemed to be misconduct or misbehaviour.           PART III SUPERVISION OF INVESTIGATION  ",
            "context": "POLICE COMPLAINTS AUTHORITY ACT under Contravention of Act, etc., to be deemed to be misconduct or misbehaviour.           PART III SUPERVISION OF INVESTIGATION  11. (1) A contravention of any provision of this Act by any member of the Force, other than the Commissioner, or refusal or failure without lawful excuse by any such member to comply with any direction or request made to him by the Authority under this Act, shall notwithstanding anything contained in this Act, or the Police (Discipline) Act, be deemed to be a misconduct for the purposes of this Act and an offence against discipline for the purposes of the Police (Discipline) Act.  (2) For any misconduct and offence against discipline referred to in subsection (1), the appropriate disciplinary authority may impose on any member of the Force (not being the Commissioner) any of the punishments specified in paragraph 1 of the Schedule to the Police (Discipline) Act.  (3) A   contravention   of   any   provision  of  this   Act   by   the Commissioner, or refusal or failure, by the Commissioner, without lawful excuse to comply with any LAWS OF GUYANA 12 Cap. 17:02 Police Complaints Authority  L.R.O. 1/2012            Application  of Part.         c. 8:01               Authority to  be notified of complaint or information.          Supervision  of investigation by Authority.        direction or request made to him under this Act by the Authority, shall be deemed to be misbehaviour by the Commissioner for the purposes of article 225 of the Constitution.  PART III SUPERVISION OF INVESTIGATION",
            "description": [
                {
                    "representation": "(1)",
                    "description": "A contravention of any provision of this Act by any member of the Force, other than the Commissioner, or refusal or failure without lawful excuse by any such member to comply with any direction or request made to him by the Authority under this Act, shall notwithstanding anything contained in this Act, or the Police"
                },
                {
                    "representation": "(2)",
                    "description": "For any misconduct and offence against discipline referred to in subsection"
                },
                {
                    "representation": "(3)",
                    "description": "A   contravention   of   any   provision  of  this   Act   by   the Commissioner, or refusal or failure, by the Commissioner, without lawful excuse to comply with any LAWS OF GUYANA 12 Cap. 17:02 Police Complaints Authority  L.R.O. 1/2012            Application  of Part.         c. 8:01               Authority to  be notified of complaint or information.          Supervision  of investigation by Authority.        direction or request made to him under this Act by the Authority, shall be deemed to be misbehaviour by the Commissioner for the purposes of article 225 of the Constitution.  PART III SUPERVISION OF INVESTIGATION"
                }
            ]
        }
    },
    {
        "act": "POLICE COMPLAINTS AUTHORITY ACT",
        "source": "https://mola.gov.gy/laws-of-guyana",
        "type": {
            "name": "section",
            "representation": "12",
            "title": "Application of Part. ",
            "context": "POLICE COMPLAINTS AUTHORITY ACT under Application of Part. 12. (1)  This  Part  shall  apply  in  relation  to  any  complaint  or information that any member of the Force has unlawfully caused the death of any person or has committed any offence referred to in section 48, 49, or 50, section 55 read with section 56, or section 57 of the Criminal Law (Offences) Act or such other offence as may be specified by the Minister by order.  (2) This Part shall apply in relation to a complaint or information of the nature referred to in subsection (1), notwithstanding that any person against whom, jointly with a member of the Force, the complaint is made or information is received, is not a member of the Force.",
            "description": [
                {
                    "representation": "(1)",
                    "description": "This  Part  shall  apply  in  relation  to  any  complaint  or information that any member of the Force has unlawfully caused the death of any person or has committed any offence referred to in section 48, 49, or 50, section 55 read with section 56, or section 57 of the Criminal Law"
                },
                {
                    "representation": "(2)",
                    "description": "This Part shall apply in relation to a complaint or information of the nature referred to in subsection"
                }
            ]
        }
    },
    {
        "act": "POLICE COMPLAINTS AUTHORITY ACT",
        "source": "https://mola.gov.gy/laws-of-guyana",
        "type": {
            "name": "section",
            "representation": "13",
            "title": "Authority to be notified of complaint or information.  ",
            "context": "POLICE COMPLAINTS AUTHORITY ACT under Authority to be notified of complaint or information.  13.  A member of the Force, to or by whom, while acting in that capacity, any complaint or information, of the nature referred to in section 12, is made or received, shall forthwith inform the Authority of  the  particulars  of  the  complaint  or  information,  including  the name and other  particulars  of  the  member  of  the  Force  against whom  the complaint or information has been made or received.",
            "description": "A member of the Force, to or by whom, while acting in that capacity, any complaint or information, of the nature referred to in section 12, is made or received, shall forthwith inform the Authority of  the  particulars  of  the  complaint  or  information,  including  the name and other  particulars  of  the  member  of  the  Force  against whom  the complaint or information has been made or received."
        }
    },
    {
        "act": "POLICE COMPLAINTS AUTHORITY ACT",
        "source": "https://mola.gov.gy/laws-of-guyana",
        "type": {
            "name": "section",
            "representation": "14",
            "title": "Supervision of investigation by Authority. ",
            "context": "POLICE COMPLAINTS AUTHORITY ACT under Supervision of investigation by Authority. 14. (1) The Authority shall supervise the investigation  of  every complaint or information of the nature referred to in section",
            "description": [
                {
                    "representation": "(1)",
                    "description": "The Authority shall supervise the investigation  of  every complaint or information of the nature referred to in section"
                }
            ]
        }
    },
    {
        "act": "POLICE COMPLAINTS AUTHORITY ACT",
        "source": "https://mola.gov.gy/laws-of-guyana",
        "type": {
            "name": "section",
            "representation": "15",
            "title": "Statement by Authority. ",
            "context": "POLICE COMPLAINTS AUTHORITY ACT under Statement by Authority. 15. (1) After considering the report of the  investigating  officer referred to in section 14(5), the evidence disclosed in the course of the  investigation  referred  to  therein  and  other  relevant  matters relating  to  the  investigation,  the  Authority  shall  submit  to  the Director of Public Prosecutions a statement containing the following  particulars  (a)    whether the investigation was or was not conducted to the Authoritys satisfaction;  (b)  specifying any particular aspect in relation to which it was not conducted to the satisfaction of the Authority; and  (c)   any other particulars that may be prescribed.  (2) A copy of the statement referred to in subsection (1) shall be forwarded by the Authority to each of the following, namely, the Minister and the Commissioner.  (3) In deciding whether or not any person should be prosecuted for any offence pursuant to any complaint or information of the nature referred to in section 12, due regard shall be had to the statement referred to in sub-section (1).",
            "description": [
                {
                    "representation": "(1)",
                    "description": "shall be forwarded by the Authority to each of the following, namely, the Minister and the Commissioner."
                },
                {
                    "representation": "(a)",
                    "description": "whether the investigation was or was not conducted to the Authoritys satisfaction;"
                },
                {
                    "representation": "(b)",
                    "description": "specifying any particular aspect in relation to which it was not conducted to the satisfaction of the Authority; and"
                },
                {
                    "representation": "(c)",
                    "description": "any other particulars that may be prescribed."
                },
                {
                    "representation": "(2)",
                    "description": "A copy of the statement referred to in subsection"
                },
                {
                    "representation": "(3)",
                    "description": "In deciding whether or not any person should be prosecuted for any offence pursuant to any complaint or information of the nature referred to in section 12, due regard shall be had to the statement referred to in sub-section"
                }
            ]
        }
    },
    {
        "act": "POLICE COMPLAINTS AUTHORITY ACT",
        "source": "https://mola.gov.gy/laws-of-guyana",
        "type": {
            "name": "section",
            "representation": "16",
            "title": "Confidentiality of information.    LAWS OF GUYANA 4 Cap. 17:02 Police Complaints Authority  L.R.O. 1/2012 SECTION PART IV MISCELLANEOUS  ",
            "context": "POLICE COMPLAINTS AUTHORITY ACT under Confidentiality of information.    LAWS OF GUYANA 4 Cap. 17:02 Police Complaints Authority  L.R.O. 1/2012 SECTION PART IV MISCELLANEOUS  16.",
            "description": "16."
        }
    },
    {
        "act": "POLICE COMPLAINTS AUTHORITY ACT",
        "source": "https://mola.gov.gy/laws-of-guyana",
        "type": {
            "name": "section",
            "representation": "17",
            "title": "Panel to assist Authority. ",
            "context": "POLICE COMPLAINTS AUTHORITY ACT under Panel to assist Authority. 17. (1)  In  the  discharge  of  his  functions  the  authority  shall  be assisted by a panel of two persons to be appointed by the President from   among persons who in   his   opinion,  have adequate qualifications or experience in regard to matters relevant to the functions conferred on the Authority.  (2)   The   appointment   of   any   person   to   the   panel   under subsection (l) shall be published in the Gazette.  (3) Section 5 shall apply to a member of the panel in the same manner as it applies to a person appointed as the Authority.  (4) The terms and conditions of appointment of a member of the panel shall be such as may be determined by the President.  (5) The Authority shall consider the views expressed by the members of the panel in relation to any matter arising for decision, while discharging his functions under this Act.",
            "description": [
                {
                    "representation": "(1)",
                    "description": "In  the  discharge  of  his  functions  the  authority  shall  be assisted by a panel of two persons to be appointed by the President from   among persons who in   his   opinion,  have adequate qualifications or experience in regard to matters relevant to the functions conferred on the Authority."
                },
                {
                    "representation": "(2)",
                    "description": "The   appointment   of   any   person   to   the   panel   under subsection"
                },
                {
                    "representation": "(l)",
                    "description": "shall be published in the Gazette."
                },
                {
                    "representation": "(3)",
                    "description": "Section 5 shall apply to a member of the panel in the same manner as it applies to a person appointed as the Authority."
                },
                {
                    "representation": "(4)",
                    "description": "The terms and conditions of appointment of a member of the panel shall be such as may be determined by the President."
                },
                {
                    "representation": "(5)",
                    "description": "The Authority shall consider the views expressed by the members of the panel in relation to any matter arising for decision, while discharging his functions under this Act."
                }
            ]
        }
    },
    {
        "act": "POLICE COMPLAINTS AUTHORITY ACT",
        "source": "https://mola.gov.gy/laws-of-guyana",
        "type": {
            "name": "section",
            "representation": "18",
            "title": "Authority to be independent.  ",
            "context": "POLICE COMPLAINTS AUTHORITY ACT under Authority to be independent.  18. In the exercise of his functions under this Act the Authority shall not be subject to the direction or control of any other person or authority.  LAWS OF GUYANA 16 Cap. 17:02 Police Complaints Authority  L.R.O. 1/2012 Power for local inspection.           Duty of  member of  Force to assist Authority.                    Manner of service of notice by Authority.  Amendment  of Schedule.        c. 17:01        Annual report by Authority.",
            "description": "In the exercise of his functions under this Act the Authority shall not be subject to the direction or control of any other person or authority.  LAWS OF GUYANA 16 Cap. 17:02 Police Complaints Authority  L.R.O. 1/2012 Power for local inspection.           Duty of  member of  Force to assist Authority.                    Manner of service of notice by Authority.  Amendment  of Schedule.        c. 17:01        Annual report by Authority."
        }
    },
    {
        "act": "POLICE COMPLAINTS AUTHORITY ACT",
        "source": "https://mola.gov.gy/laws-of-guyana",
        "type": {
            "name": "section",
            "representation": "19",
            "title": "Power for local inspection. ",
            "context": "POLICE COMPLAINTS AUTHORITY ACT under Power for local inspection. 19. The Authority may, either by himself or accompanied by such persons as the Authority deems proper, inspect any place, building or other premises where any act relating to any misconduct or relating to any offence which is the subject of any complaint or information of the nature referred to in section 12, is alleged to have been committed.",
            "description": "The Authority may, either by himself or accompanied by such persons as the Authority deems proper, inspect any place, building or other premises where any act relating to any misconduct or relating to any offence which is the subject of any complaint or information of the nature referred to in section 12, is alleged to have been committed."
        }
    },
    {
        "act": "POLICE COMPLAINTS AUTHORITY ACT",
        "source": "https://mola.gov.gy/laws-of-guyana",
        "type": {
            "name": "section",
            "representation": "20",
            "title": "Duty of member of Force to assist Authority. ",
            "context": "POLICE COMPLAINTS AUTHORITY ACT under Duty of member of Force to assist Authority. 20.  It shall be the duty of every member of the Force to render to the Authority and the officers and employees provided to the Authority under section 6 such assistance as the Authority may request for the purpose of discharging the functions of the Authority.",
            "description": "It shall be the duty of every member of the Force to render to the Authority and the officers and employees provided to the Authority under section 6 such assistance as the Authority may request for the purpose of discharging the functions of the Authority."
        }
    },
    {
        "act": "POLICE COMPLAINTS AUTHORITY ACT",
        "source": "https://mola.gov.gy/laws-of-guyana",
        "type": {
            "name": "section",
            "representation": "21",
            "title": "Manner of service of notice by Authority.  ",
            "context": "POLICE COMPLAINTS AUTHORITY ACT under Manner of service of notice by Authority.  21.  Any notice to be served by the Authority shall be served in such manner as may be prescribed.",
            "description": "Any notice to be served by the Authority shall be served in such manner as may be prescribed."
        }
    },
    {
        "act": "POLICE COMPLAINTS AUTHORITY ACT",
        "source": "https://mola.gov.gy/laws-of-guyana",
        "type": {
            "name": "section",
            "representation": "22",
            "title": "Amendment of Schedule. ",
            "context": "POLICE COMPLAINTS AUTHORITY ACT under Amendment of Schedule. 22. (1) The Minister may, by order, amend the Schedule.    (2) Every order under subsection (1) shall be subject to negative resolution of the National Assembly.   (3) Notwithstanding anything contained in this Act or the Police (Discipline) Act, every act or omission mentioned in the Schedule shall be deemed to be a misconduct for the purposes of this Act and an offence   against   discipline   for   the   purposes   of   the   Police (Discipline) Act.",
            "description": [
                {
                    "representation": "(1)",
                    "description": "shall be subject to negative resolution of the National Assembly."
                },
                {
                    "representation": "(2)",
                    "description": "Every order under subsection"
                },
                {
                    "representation": "(3)",
                    "description": "Notwithstanding anything contained in this Act or the Police"
                }
            ]
        }
    },
    {
        "act": "POLICE COMPLAINTS AUTHORITY ACT",
        "source": "https://mola.gov.gy/laws-of-guyana",
        "type": {
            "name": "section",
            "representation": "23",
            "title": "Annual report by Authority. ",
            "context": "POLICE COMPLAINTS AUTHORITY ACT under Annual report by Authority. 23.  (1) The Authority shall, before the expiry of three months after the end of each calendar year, submit to the Minister a report containing an account of the activities of the Authority throughout the preceding calendar year and the difficulties, if any, experienced by the Authority in the exercise of his functions.  (2) A copy of the report referred to in subsection LAWS OF GUYANA Police Complaints Authority Cap. 17:02 17  L.R.O. 1/2012             Penalties for contravention of section",
            "description": [
                {
                    "representation": "(1)",
                    "description": "The Authority shall, before the expiry of three months after the end of each calendar year, submit to the Minister a report containing an account of the activities of the Authority throughout the preceding calendar year and the difficulties, if any, experienced by the Authority in the exercise of his functions."
                },
                {
                    "representation": "(2)",
                    "description": "A copy of the report referred to in subsection LAWS OF GUYANA Police Complaints Authority Cap. 17:02 17  L.R.O. 1/2012             Penalties for contravention of section"
                }
            ]
        }
    },
    {
        "act": "POLICE COMPLAINTS AUTHORITY ACT",
        "source": "https://mola.gov.gy/laws-of-guyana",
        "type": {
            "name": "section",
            "representation": "24",
            "title": "Penalties for contravention of section ",
            "context": "POLICE COMPLAINTS AUTHORITY ACT under Penalties for contravention of section 24. Any person who contravenes section 16 shall be liable on summary conviction to a fine of fifteen thousand dollars and to imprisonment for six months.",
            "description": "Any person who contravenes section 16 shall be liable on summary conviction to a fine of fifteen thousand dollars and to imprisonment for six months."
        }
    },
    {
        "act": "POLICE COMPLAINTS AUTHORITY ACT",
        "source": "https://mola.gov.gy/laws-of-guyana",
        "type": {
            "name": "section",
            "representation": "25",
            "title": "Power to make regulations.                     SCHEDULE __________________________  CHAPTER 17:02  POLICE COMPLAINTS AUTHORITY ACT    9 of 1989  An Act to make provision for  the  establishment  of  a  Police Complaints Authority and in respect of the functions and procedure of the Authority and other matters connected therewith.   [29th December, 1989] PART I PRELIMINARY  Short title.     Interpretation.   ",
            "context": "POLICE COMPLAINTS AUTHORITY ACT under Power to make regulations.                     SCHEDULE __________________________  CHAPTER 17:02  POLICE COMPLAINTS AUTHORITY ACT    9 of 1989  An Act to make provision for  the  establishment  of  a  Police Complaints Authority and in respect of the functions and procedure of the Authority and other matters connected therewith.   [29th December, 1989] PART I PRELIMINARY  Short title.     Interpretation.   25. (1) The Minister may make regulations for   carrying out the purposes of this Act.  (2) Without prejudice to the generality of the provisions of subsection (1), the Minister may in particular make regulations to provide for all or any of the following matters  (a)    the  matters  that  a  complaint  to  the  Authority  under section 8(1) shall contain;  (b)      the procedure of the Authority;  (c)     the particulars that a statement  under section 15 shall contain;  (d)    the form of any notice to be given or served by the Authority  and  the  manner  of  giving  or  serving  any  such notice;  (e)      any  other  matter  that  is  required  to  be  or  may  be prescribed by or under this Act. LAWS OF GUYANA 18 Cap. 17:02 Police Complaints Authority  L.R.O. 1/2012                                                 SCHEDULE  ACTS OR OMISSIONS BY ANY MEMBER OF THE FORCE CONSTITUTING MISCONDUCT",
            "description": [
                {
                    "representation": "(1)",
                    "description": "The Minister may make regulations for   carrying out the purposes of this Act."
                },
                {
                    "representation": "(2)",
                    "description": "Without prejudice to the generality of the provisions of subsection"
                },
                {
                    "representation": "(a)",
                    "description": "the  matters  that  a  complaint  to  the  Authority  under section 8(1) shall contain;"
                },
                {
                    "representation": "(b)",
                    "description": "the procedure of the Authority;"
                },
                {
                    "representation": "(c)",
                    "description": "the particulars that a statement  under section 15 shall contain;"
                },
                {
                    "representation": "(d)",
                    "description": "the form of any notice to be given or served by the Authority  and  the  manner  of  giving  or  serving  any  such notice;"
                },
                {
                    "representation": "(e)",
                    "description": "any  other  matter  that  is  required  to  be  or  may  be prescribed by or under this Act. LAWS OF GUYANA 18 Cap. 17:02 Police Complaints Authority  L.R.O. 1/2012                                                 SCHEDULE  ACTS OR OMISSIONS BY ANY MEMBER OF THE FORCE CONSTITUTING MISCONDUCT"
                }
            ]
        }
    }
]