[
    {
        "act": "CARIBBEAN COMMUNITY (MOVEMENT OF FACTORS) ACT",
        "source": "https://mola.gov.gy/laws-of-guyana",
        "type": {
            "name": "section",
            "representation": "1",
            "title": "Short title. ",
            "context": "CARIBBEAN COMMUNITY (MOVEMENT OF FACTORS) ACT under Short title. 1. This Act may be cited as the Caribbean Community (Movement of Factors) Act.",
            "description": "This Act may be cited as the Caribbean Community (Movement of Factors) Act."
        }
    },
    {
        "act": "CARIBBEAN COMMUNITY (MOVEMENT OF FACTORS) ACT",
        "source": "https://mola.gov.gy/laws-of-guyana",
        "type": {
            "name": "section",
            "representation": "2",
            "title": "Interpretation. ",
            "context": "CARIBBEAN COMMUNITY (MOVEMENT OF FACTORS) ACT under Interpretation. 2. (1) In this Act, unless the context otherwise requires   Committee of Central Bank Governors means the body of the Community so named in Article 18 (2) of the Treaty;   Community means the Caribbean Community including the CARICOM Single Market and Economy established by the Treaty;  Community Council of Ministers or the Community Council means the organ of the Community so named in Article 10 (1)(b) of the Treaty.  Minister means the Minster assigned responsibility for LAWS OF GUYANA 6 Cap. 18:10 Caribbean Community (Movement of Factors)  L.R.O. 1/2012                                     Foreign Trade and International Co-operation;  Conference of Heads of Government or Conference means the organ of the Community so named in Article 10 (1)(a) of the Treaty;  Council for Finance and Planning means the organ of the Community so named in Article 10 (2)(a) of the Treaty;   Council for Trade and Economic Development means the organ of the Community so named in Article 10 (2)(b) of the Treaty;  economic enterprise includes   (a)  any type of organization for the production of, or the trade in, goods or the provision of services (other than a non-profit organisation) owned and controlled by a national of a Member State;  (b)   an agency, branch or a subsidiary of such enterprise of a national of a Member State;  Member State means a member State of the Community excluding an Associate Member within the meaning of Article 231 of the Treaty;  national means a person who   (a)   is a citizen of a Member State;  (b)      has a connection with a Member State of a kind which entitles that person to be regarded as belonging to or, if it be LAWS OF GUYANA Caribbean Community (Movement of Factors) Cap. 18:10 7  L.R.O. 1/2012                                     so expressed, as being a native or resident of such a Member State for the purposes of the laws thereof relating to immigration; or  (c)  is a company or other legal entity constituted in a Member State in accordance with the laws thereof and which that Member State regards as belonging to it, provided that such company or other legal entity has been formed for gainful purposes and has its registered office and central administration, and carries on substantial activity within the Community owned and effectively controlled by persons mentioned in paragraphs (a) and (b);  non-wage-earning activity means an activity undertaken by a self employed person;  right of establishment includes the right to   (a)  engage in any non-wage-earning activity of a commercial, industrial, agricultural, professional or artisanal nature;  (b) create and manage an economic enterprise;  service means a service provided against remuneration other than wages in any approved sector and the provision of a service means the supply of a service   (a)   from the territory of a Member State into the territory of another Member LAWS OF GUYANA 8 Cap. 18:10 Caribbean Community (Movement of Factors)  L.R.O. 1/2012                    Application of this Act.                State;  (b)    in the territory of one Member State to a service consumer of  another Member State;  (c)    by a service supplier of one Member State through commercial presence in the territory of another Member State;  (d)   by a service supplier of one Member State through the presence of a natural person of a Member State in the territory of another Member State;  \"Treaty\" means the Revised Treaty of Chaguaramas establishing the Caribbean Community including the CARICOM Single Market and Economy signed at Nassau, The Bahamas, on 5th July,",
            "description": [
                {
                    "representation": "(1)",
                    "description": "In this Act, unless the context otherwise requires   Committee of Central Bank Governors means the body of the Community so named in Article 18"
                },
                {
                    "representation": "(2)",
                    "description": "of the Treaty;   Community means the Caribbean Community including the CARICOM Single Market and Economy established by the Treaty;  Community Council of Ministers or the Community Council means the organ of the Community so named in Article 10"
                },
                {
                    "representation": "(b)",
                    "description": "in the territory of one Member State to a service consumer of  another Member State;"
                },
                {
                    "representation": "(a)",
                    "description": "from the territory of a Member State into the territory of another Member LAWS OF GUYANA 8 Cap. 18:10 Caribbean Community"
                },
                {
                    "representation": "(c)",
                    "description": "by a service supplier of one Member State through commercial presence in the territory of another Member State;"
                },
                {
                    "representation": "(d)",
                    "description": "by a service supplier of one Member State through the presence of a natural person of a Member State in the territory of another Member State;  \"Treaty\" means the Revised Treaty of Chaguaramas establishing the Caribbean Community including the CARICOM Single Market and Economy signed at Nassau, The Bahamas, on 5th July,"
                }
            ]
        }
    },
    {
        "act": "CARIBBEAN COMMUNITY (MOVEMENT OF FACTORS) ACT",
        "source": "https://mola.gov.gy/laws-of-guyana",
        "type": {
            "name": "section",
            "representation": "3",
            "title": "Application of this Act. . ",
            "context": "CARIBBEAN COMMUNITY (MOVEMENT OF FACTORS) ACT under Application of this Act. . 3.  (1)   Subject  to  this  section  and  sections  7  and  9,  the provisions of this Act shall apply to   (a)    the right of establishment, and the right to provide a service in Guyana by a national of a Member State; and  (b)   the right of a national of a Member State to move capital into and within Guyana and out of Guyana to another Member State.  (2) An  activity  in  Guyana  involving  the   exercise  of governmental  authority  by  a  duly  authorised  person  shall  be excluded from the operation of this Act.  (3) For  the  purposes  of  subsection  (2)  \"an  LAWS OF GUYANA Caribbean Community (Movement of Factors) Cap. 18:10 9  L.R.O. 1/2012                           Rights of nationals of a Member State in respect of establishment, services and capital.        activity  in Guyana involving the exercise of governmental authority\" means an activity conducted in Guyana neither on a commercial basis nor in competition with one or more economic enterprises such as   (a)  an activity conducted by the Central Bank of Guyana or a monetary authority or any other public entity in pursuance of monetary or exchange rate policies; (b)      an activity forming part of a statutory system of social security or public retirement plans;  (c)       an activity forming part of a system of national security or for the establishment or maintenance of public order;  (d)   any other activity conducted by a public entity for the account of, or with the guarantee or using financial resources of, the Government; and  (e)     such other activity as may be excluded by regulations made pursuant to section",
            "description": [
                {
                    "representation": "(1)",
                    "description": "Subject  to  this  section  and  sections  7  and  9,  the provisions of this Act shall apply to"
                },
                {
                    "representation": "(a)",
                    "description": "an activity conducted by the Central Bank of Guyana or a monetary authority or any other public entity in pursuance of monetary or exchange rate policies;"
                },
                {
                    "representation": "(b)",
                    "description": "an activity forming part of a statutory system of social security or public retirement plans;"
                },
                {
                    "representation": "(2)",
                    "description": "\"an  LAWS OF GUYANA Caribbean Community"
                },
                {
                    "representation": "(3)",
                    "description": "For  the  purposes  of  subsection"
                },
                {
                    "representation": "(c)",
                    "description": "an activity forming part of a system of national security or for the establishment or maintenance of public order;"
                },
                {
                    "representation": "(d)",
                    "description": "any other activity conducted by a public entity for the account of, or with the guarantee or using financial resources of, the Government; and"
                },
                {
                    "representation": "(e)",
                    "description": "such other activity as may be excluded by regulations made pursuant to section"
                }
            ]
        }
    },
    {
        "act": "CARIBBEAN COMMUNITY (MOVEMENT OF FACTORS) ACT",
        "source": "https://mola.gov.gy/laws-of-guyana",
        "type": {
            "name": "section",
            "representation": "4",
            "title": "Rights of nationals of a Member State in respect of establishment,        services and capital. ",
            "context": "CARIBBEAN COMMUNITY (MOVEMENT OF FACTORS) ACT under Rights of nationals of a Member State in respect of establishment,        services and capital. 4. (1)  Subject to the provisions of this Act, a national of a Member State shall enjoy -  (a)   in Guyana   (i)     the right of establishment;  (ii)   the right to provide a service; and  LAWS OF GUYANA 10 Cap. 18:10 Caribbean Community (Movement of Factors)  L.R.O. 1/2012            Schedule.               Obligation to notify restrictions.                 Prohibition of new restrictions.    (b)   the right to move capital into and within Guyana and out of Guyana to other Member States, without discrimination on the ground of nationality.  (2) Notwithstanding any other law, a person to whom this   subsection  applies,  shall,  for  the  purposes  of  the  Acts mentioned  in the Schedule and to the extent set out therein in respect of each Act, be treated as if he were a national of Guyana.  (3) Subsection (2) applies to a national exercising or seeking to exercise a right conferred by subsection (1).  (4) The Minister may, by order which shall be subject to negative   resolution   of   the   National   Assembly,   amend   the Schedule.",
            "description": [
                {
                    "representation": "(1)",
                    "description": "Subject to the provisions of this Act, a national of a Member State shall enjoy -"
                },
                {
                    "representation": "(a)",
                    "description": "in Guyana"
                },
                {
                    "representation": "(i)",
                    "description": "the right of establishment;"
                },
                {
                    "representation": "(b)",
                    "description": "the right to move capital into and within Guyana and out of Guyana to other Member States, without discrimination on the ground of nationality."
                },
                {
                    "representation": "(2)",
                    "description": "applies to a national exercising or seeking to exercise a right conferred by subsection"
                },
                {
                    "representation": "(3)",
                    "description": "Subsection"
                },
                {
                    "representation": "(4)",
                    "description": "The Minister may, by order which shall be subject to negative   resolution   of   the   National   Assembly,   amend   the Schedule."
                }
            ]
        }
    },
    {
        "act": "CARIBBEAN COMMUNITY (MOVEMENT OF FACTORS) ACT",
        "source": "https://mola.gov.gy/laws-of-guyana",
        "type": {
            "name": "section",
            "representation": "5",
            "title": "Obligation to notify restrictions. ",
            "context": "CARIBBEAN COMMUNITY (MOVEMENT OF FACTORS) ACT under Obligation to notify restrictions. 5. The Minister shall not later than 30th   April, 2006, notify the Council for Trade and Economic Development or the Council for Finance and Planning, as the case may require, any remaining restrictions on   (a)   the right of establishment and the right to provide a service in Guyana by a national of another Member State; and  (b)  the right to move capital into and within Guyana and out of Guyana to another Member State, and to make current payments and transfers.",
            "description": [
                {
                    "representation": "(a)",
                    "description": "the right of establishment and the right to provide a service in Guyana by a national of another Member State; and"
                },
                {
                    "representation": "(b)",
                    "description": "the right to move capital into and within Guyana and out of Guyana to another Member State, and to make current payments and transfers."
                }
            ]
        }
    },
    {
        "act": "CARIBBEAN COMMUNITY (MOVEMENT OF FACTORS) ACT",
        "source": "https://mola.gov.gy/laws-of-guyana",
        "type": {
            "name": "section",
            "representation": "6",
            "title": "Prohibition of new restrictions.  PART II THE RIGHT OF ESTABLISHMENT  ",
            "context": "CARIBBEAN COMMUNITY (MOVEMENT OF FACTORS) ACT under Prohibition of new restrictions.  PART II THE RIGHT OF ESTABLISHMENT  6. Subject to the provisions of this Act, the Minister shall not introduce new restrictions on a  national  of  another Member State entitled to the rights specified in section",
            "description": "Subject to the provisions of this Act, the Minister shall not introduce new restrictions on a  national  of  another Member State entitled to the rights specified in section"
        }
    },
    {
        "act": "CARIBBEAN COMMUNITY (MOVEMENT OF FACTORS) ACT",
        "source": "https://mola.gov.gy/laws-of-guyana",
        "type": {
            "name": "section",
            "representation": "7",
            "title": "Treatment of monopolies. ",
            "context": "CARIBBEAN COMMUNITY (MOVEMENT OF FACTORS) ACT under Treatment of monopolies. 7. (1) Notwithstanding any of the provisions of this Act, the  Minister may determine that the public interest requires the exclusion  or  restriction  of  the  right  of  establishment  in  any industry or in a particular section of an industry.  (2) Where a determination by the Minister has been made pursuant to subsection (1) and results in the continuation or establishment of   (a) a government monopoly, the Minister shall adopt appropriate measures to ensure that the monopoly does not discriminate among nationals of Member States, save as otherwise provided in this Act, and is subject to the agreed rules of competition established for an economic enterprise of the Community; or  (b)    a private sector monopoly, the Minister shall, subject to the provisions of this Act, adopt appropriate measures to ensure that national treatment is accorded to a national of another Member State in terms of participation in its operations.",
            "description": [
                {
                    "representation": "(1)",
                    "description": "and results in the continuation or establishment of"
                },
                {
                    "representation": "(2)",
                    "description": "Where a determination by the Minister has been made pursuant to subsection"
                },
                {
                    "representation": "(a)",
                    "description": "a government monopoly, the Minister shall adopt appropriate measures to ensure that the monopoly does not discriminate among nationals of Member States, save as otherwise provided in this Act, and is subject to the agreed rules of competition established for an economic enterprise of the Community; or"
                },
                {
                    "representation": "(b)",
                    "description": "a private sector monopoly, the Minister shall, subject to the provisions of this Act, adopt appropriate measures to ensure that national treatment is accorded to a national of another Member State in terms of participation in its operations."
                }
            ]
        }
    },
    {
        "act": "CARIBBEAN COMMUNITY (MOVEMENT OF FACTORS) ACT",
        "source": "https://mola.gov.gy/laws-of-guyana",
        "type": {
            "name": "section",
            "representation": "8",
            "title": "Programme to remove restrictions on establishment. ",
            "context": "CARIBBEAN COMMUNITY (MOVEMENT OF FACTORS) ACT under Programme to remove restrictions on establishment. 8. Restrictions   on   the   right   of   establishment   in Guyana by a national of another Member State shall be removed in accordance with the programme approved by Conference in accordance with Article 33 (3) of the Treaty.",
            "description": [
                {
                    "representation": "(3)",
                    "description": "of the Treaty."
                }
            ]
        }
    },
    {
        "act": "CARIBBEAN COMMUNITY (MOVEMENT OF FACTORS) ACT",
        "source": "https://mola.gov.gy/laws-of-guyana",
        "type": {
            "name": "section",
            "representation": "9",
            "title": "Minister to adopt safeguard measures. ",
            "context": "CARIBBEAN COMMUNITY (MOVEMENT OF FACTORS) ACT under Minister to adopt safeguard measures. 9. The Minister shall, by order, adopt measures based adopt LAWS OF GUYANA 12 Cap. 18:10 Caribbean Community (Movement of Factors)  L.R.O. 1/2012  safeguard measures.     Management of removal of restrictions on the rights of establishment.                                      on criteria established by the competent Organ of the Community to   safeguard against manipulation  or  abuse  of  the  right  of establishment, to gain an unfair advantage against a national of Guyana or another Member State.",
            "description": "The Minister shall, by order, adopt measures based adopt LAWS OF GUYANA 12 Cap. 18:10 Caribbean Community (Movement of Factors)  L.R.O. 1/2012  safeguard measures.     Management of removal of restrictions on the rights of establishment.                                      on criteria established by the competent Organ of the Community to   safeguard against manipulation  or  abuse  of  the  right  of establishment, to gain an unfair advantage against a national of Guyana or another Member State."
        }
    },
    {
        "act": "CARIBBEAN COMMUNITY (MOVEMENT OF FACTORS) ACT",
        "source": "https://mola.gov.gy/laws-of-guyana",
        "type": {
            "name": "section",
            "representation": "10",
            "title": "Management of removal of restrictions on the rights of           establishment.  PART III THE RIGHT TO PROVIDE SERVICES  ",
            "context": "CARIBBEAN COMMUNITY (MOVEMENT OF FACTORS) ACT under Management of removal of restrictions on the rights of           establishment.  PART III THE RIGHT TO PROVIDE SERVICES  10.  (1) In carrying out his duties under this Part, the Minister shall use his best endeavours to ensure that a national of another Member State of the Community desirous of engaging in an approved  economic activity in Guyana is not impeded in the exercise of his right of establishment.  (2) Without prejudice to the generality of subsection (1) the Minister shall -  (a)   abolish administrative practices and procedures which impede the exercise of the right of establishment by a national of another Member State;  (b)   remove all restrictions on the movement of managerial, technical and supervisory  staff of an economic enterprise established by a national of a Member State in Guyana;  (c)     remove all restrictions on entering and residing in Guyana by spouses and immediate dependent family members of nationals establishing economic enterprises and of managerial, technical and supervisory staff of an economic enterprise of a national of another Member State;  (d)  ensure that a national of another Member State exercising his right of establishment has the right to acquire LAWS OF GUYANA Caribbean Community (Movement of Factors) Cap. 18:10 13  L.R.O. 1/2012                                  Programme to remove restrictions.                 Collateral activities by service providers. or otherwise possess or control land, buildings and other property adequate for the purpose;  (e)       implement Community standards to ensure protection of the interests of partners, members and other persons with financial interests in companies and other entities have rights equivalent to those of similar entities in other Member States;  (f)     implement measures established by the Council for Human and Social Development for the coordination of legislative and administrative requirements of member States for the conduct of non-wage-earning activities in the Community.  PART III THE RIGHT TO PROVIDE SERVICES",
            "description": [
                {
                    "representation": "(1)",
                    "description": "the Minister shall -"
                },
                {
                    "representation": "(2)",
                    "description": "Without prejudice to the generality of subsection"
                },
                {
                    "representation": "(a)",
                    "description": "abolish administrative practices and procedures which impede the exercise of the right of establishment by a national of another Member State;"
                },
                {
                    "representation": "(b)",
                    "description": "remove all restrictions on the movement of managerial, technical and supervisory  staff of an economic enterprise established by a national of a Member State in Guyana;"
                },
                {
                    "representation": "(c)",
                    "description": "remove all restrictions on entering and residing in Guyana by spouses and immediate dependent family members of nationals establishing economic enterprises and of managerial, technical and supervisory staff of an economic enterprise of a national of another Member State;"
                },
                {
                    "representation": "(d)",
                    "description": "ensure that a national of another Member State exercising his right of establishment has the right to acquire LAWS OF GUYANA Caribbean Community"
                },
                {
                    "representation": "(e)",
                    "description": "implement Community standards to ensure protection of the interests of partners, members and other persons with financial interests in companies and other entities have rights equivalent to those of similar entities in other Member States;"
                },
                {
                    "representation": "(f)",
                    "description": "implement measures established by the Council for Human and Social Development for the coordination of legislative and administrative requirements of member States for the conduct of non-wage-earning activities in the Community.  PART III THE RIGHT TO PROVIDE SERVICES"
                }
            ]
        }
    },
    {
        "act": "CARIBBEAN COMMUNITY (MOVEMENT OF FACTORS) ACT",
        "source": "https://mola.gov.gy/laws-of-guyana",
        "type": {
            "name": "section",
            "representation": "11",
            "title": "Programme to remove restrictions. ",
            "context": "CARIBBEAN COMMUNITY (MOVEMENT OF FACTORS) ACT under Programme to remove restrictions. 11. (1) Subject to the provisions of this Act, restrictions on the right to provide a service in Guyana by a national of another Member   State   shall   be   removed   in   accordance   with   the programme approved by Conference pursuant to Article 38(2) of the Treaty.  (2)  Notwithstanding subsection (1), the Minister may with the consent of the Council for Finance and Planning and with the approval of the Conference, exclude certain financial services from the application of this Act in accordance with Article 38(2) of the Treaty.",
            "description": [
                {
                    "representation": "(1)",
                    "description": "Subject to the provisions of this Act, restrictions on the right to provide a service in Guyana by a national of another Member   State   shall   be   removed   in   accordance   with   the programme approved by Conference pursuant to Article 38(2) of the Treaty."
                },
                {
                    "representation": "(2)",
                    "description": "of the Treaty."
                }
            ]
        }
    },
    {
        "act": "CARIBBEAN COMMUNITY (MOVEMENT OF FACTORS) ACT",
        "source": "https://mola.gov.gy/laws-of-guyana",
        "type": {
            "name": "section",
            "representation": "12",
            "title": "Collateral activities by services providers. ",
            "context": "CARIBBEAN COMMUNITY (MOVEMENT OF FACTORS) ACT under Collateral activities by services providers. 12. Without prejudice to the provisions relating to the right of establishment, a national exercising the right to provide a service   in   Guyana   may,   in   order   to   provide   LAWS OF GUYANA 14 Cap. 18:10 Caribbean Community (Movement of Factors)  L.R.O. 1/2012         Management of removal of restriction on right to provide a service.                                      the   service, temporarily  engage  in  an  approved  activity  in  Guyana  under conditions no less  favourable than those enjoyed by nationals of Guyana.",
            "description": "Without prejudice to the provisions relating to the right of establishment, a national exercising the right to provide a service   in   Guyana   may,   in   order   to   provide   LAWS OF GUYANA 14 Cap. 18:10 Caribbean Community (Movement of Factors)  L.R.O. 1/2012         Management of removal of restriction on right to provide a service.                                      the   service, temporarily  engage  in  an  approved  activity  in  Guyana  under conditions no less  favourable than those enjoyed by nationals of Guyana."
        }
    },
    {
        "act": "CARIBBEAN COMMUNITY (MOVEMENT OF FACTORS) ACT",
        "source": "https://mola.gov.gy/laws-of-guyana",
        "type": {
            "name": "section",
            "representation": "13",
            "title": "Management of removal of restriction on right to provide a           service.  PART IV THE RIGHT TO MOVE CAPITAL  ",
            "context": "CARIBBEAN COMMUNITY (MOVEMENT OF FACTORS) ACT under Management of removal of restriction on right to provide a           service.  PART IV THE RIGHT TO MOVE CAPITAL  13. (1) The Minister shall take such measures as may be necessary to ensure that a national of another Member State is not impeded  in  the  exercise  of  his  right  to  provide  a  service  in Guyana.  (2) Without prejudice to the generality of subsection (1), the Minister shall -  (a)  remove administrative practices and procedures in Guyana which impede the exercise of the right to provide a service by a national of another Member State;  (b)  remove all restrictions on the entry and residence in Guyana by spouses and immediate dependent family members of a national of another Member State providing a service and of the managerial, technical and supervisory staff of such a national; and  (c)  ensure that a national of another Member State exercising the right to provide a service in Guyana has the right to acquire or otherwise possess or control land, buildings and other property on a non-discriminatory basis for purposes directly related to the provision of the service.  LAWS OF GUYANA Caribbean Community (Movement of Factors) Cap. 18:10 15  L.R.O. 1/2012     Prohibition of new restrictions on the movement of capital                  Removal of restrictions on capital movements.                       THE RIGHT TO MOVE CAPITAL",
            "description": [
                {
                    "representation": "(1)",
                    "description": "The Minister shall take such measures as may be necessary to ensure that a national of another Member State is not impeded  in  the  exercise  of  his  right  to  provide  a  service  in Guyana."
                },
                {
                    "representation": "(2)",
                    "description": "Without prejudice to the generality of subsection"
                },
                {
                    "representation": "(a)",
                    "description": "remove administrative practices and procedures in Guyana which impede the exercise of the right to provide a service by a national of another Member State;"
                },
                {
                    "representation": "(b)",
                    "description": "remove all restrictions on the entry and residence in Guyana by spouses and immediate dependent family members of a national of another Member State providing a service and of the managerial, technical and supervisory staff of such a national; and"
                },
                {
                    "representation": "(c)",
                    "description": "ensure that a national of another Member State exercising the right to provide a service in Guyana has the right to acquire or otherwise possess or control land, buildings and other property on a non-discriminatory basis for purposes directly related to the provision of the service.  LAWS OF GUYANA Caribbean Community"
                }
            ]
        }
    },
    {
        "act": "CARIBBEAN COMMUNITY (MOVEMENT OF FACTORS) ACT",
        "source": "https://mola.gov.gy/laws-of-guyana",
        "type": {
            "name": "section",
            "representation": "14",
            "title": "Prohibition of new restrictions on the movement of capital. ",
            "context": "CARIBBEAN COMMUNITY (MOVEMENT OF FACTORS) ACT under Prohibition of new restrictions on the movement of capital. 14. Subject to this Act, the Minister    (a)    shall not introduce new restrictions -  (i)       on the movement of capital;  (ii)  on payments connected with the movement of capital; and  (iii)    on current payments and transfers;  (b) shall not render more restrictive the operation of existing subsidiary legislation or other law governing the movement of capital, except as authorised by the Treaty.",
            "description": [
                {
                    "representation": "(a)",
                    "description": "shall not introduce new restrictions -"
                },
                {
                    "representation": "(i)",
                    "description": "on the movement of capital;"
                },
                {
                    "representation": "(b)",
                    "description": "shall not render more restrictive the operation of existing subsidiary legislation or other law governing the movement of capital, except as authorised by the Treaty."
                }
            ]
        }
    },
    {
        "act": "CARIBBEAN COMMUNITY (MOVEMENT OF FACTORS) ACT",
        "source": "https://mola.gov.gy/laws-of-guyana",
        "type": {
            "name": "section",
            "representation": "15",
            "title": "Removal of restrictions on capital movements. ",
            "context": "CARIBBEAN COMMUNITY (MOVEMENT OF FACTORS) ACT under Removal of restrictions on capital movements. 15. (1) Subject to the provisions of this Act, restrictions on  the  movement  of  all  capital  payments,  and  on  all  current payments,  including payments for goods and services and other current transfers to Member States shall be removed.  (2) For the purposes of this Part, capital and current payments and transfers include   (a)     equity and portfolio investments;  (b)   short-term bank and credit transactions;  (c)   payment of interest on loans and amortisation;  (d)  dividends and other income on investments after taxes;   PART IV LAWS OF GUYANA 16 Cap. 18:10 Caribbean Community (Movement of Factors)  L.R.O. 1/2012        Authorisation  to facilitate movement of capital.        Coordination  of foreign exchange policies and information exchange.           Restrictions to safeguard balance-of- payments.           (e)     repatriation of proceeds from the sale of assets; and  (f)       other transfers and payments relating to investment flows.",
            "description": [
                {
                    "representation": "(1)",
                    "description": "Subject to the provisions of this Act, restrictions on  the  movement  of  all  capital  payments,  and  on  all  current payments,  including payments for goods and services and other current transfers to Member States shall be removed."
                },
                {
                    "representation": "(2)",
                    "description": "For the purposes of this Part, capital and current payments and transfers include"
                },
                {
                    "representation": "(a)",
                    "description": "equity and portfolio investments;"
                },
                {
                    "representation": "(b)",
                    "description": "short-term bank and credit transactions;"
                },
                {
                    "representation": "(c)",
                    "description": "payment of interest on loans and amortisation;"
                },
                {
                    "representation": "(d)",
                    "description": "dividends and other income on investments after taxes;   PART IV LAWS OF GUYANA 16 Cap. 18:10 Caribbean Community"
                },
                {
                    "representation": "(e)",
                    "description": "repatriation of proceeds from the sale of assets; and"
                },
                {
                    "representation": "(f)",
                    "description": "other transfers and payments relating to investment flows."
                }
            ]
        }
    },
    {
        "act": "CARIBBEAN COMMUNITY (MOVEMENT OF FACTORS) ACT",
        "source": "https://mola.gov.gy/laws-of-guyana",
        "type": {
            "name": "section",
            "representation": "16",
            "title": "Authorisation to facilitate movement of capital. LAWS OF GUYANA 4 Cap. 18:10 Caribbean Community (Movement of Factors)  L.R.O. 1/2012  SECTION ",
            "context": "CARIBBEAN COMMUNITY (MOVEMENT OF FACTORS) ACT under Authorisation to facilitate movement of capital. LAWS OF GUYANA 4 Cap. 18:10 Caribbean Community (Movement of Factors)  L.R.O. 1/2012  SECTION 16. (1) Subject to subsection (2),  the  Minister  shall, where   necessary,   grant   the   authorisations   required   for   the movement   of   capital   mentioned   in   section   15   on   a   non- discriminatory basis.  (2) Loans intended for State purposes shall require prior notification to the Government.",
            "description": [
                {
                    "representation": "(1)",
                    "description": "Subject to subsection"
                },
                {
                    "representation": "(2)",
                    "description": "Loans intended for State purposes shall require prior notification to the Government."
                }
            ]
        }
    },
    {
        "act": "CARIBBEAN COMMUNITY (MOVEMENT OF FACTORS) ACT",
        "source": "https://mola.gov.gy/laws-of-guyana",
        "type": {
            "name": "section",
            "representation": "17",
            "title": "Co-ordination of foreign exchange policies and information          exchange.  PART V SAFEGUARD MEASURES  ",
            "context": "CARIBBEAN COMMUNITY (MOVEMENT OF FACTORS) ACT under Co-ordination of foreign exchange policies and information          exchange.  PART V SAFEGUARD MEASURES  17. (1) The Minister shall take such measures as may be required to coordinate the foreign exchange policies of Guyana with those of other Member States in respect of the movement of capital among them and with third States.   (2) The Minister shall keep the competent authorities of other Member States informed of significant   unusual movements  of  capital  within  his  knowledge to  and from third States.  PART V SAFEGUARD MEASURES",
            "description": [
                {
                    "representation": "(1)",
                    "description": "The Minister shall take such measures as may be required to coordinate the foreign exchange policies of Guyana with those of other Member States in respect of the movement of capital among them and with third States."
                },
                {
                    "representation": "(2)",
                    "description": "The Minister shall keep the competent authorities of other Member States informed of significant   unusual movements  of  capital  within  his  knowledge to  and from third States.  PART V SAFEGUARD MEASURES"
                }
            ]
        }
    },
    {
        "act": "CARIBBEAN COMMUNITY (MOVEMENT OF FACTORS) ACT",
        "source": "https://mola.gov.gy/laws-of-guyana",
        "type": {
            "name": "section",
            "representation": "18",
            "title": "Restrictions to safeguard balance of payments. ",
            "context": "CARIBBEAN COMMUNITY (MOVEMENT OF FACTORS) ACT under Restrictions to safeguard balance of payments. 18. (1)   Subject to subsection (3), where the Minister is satisfied that there are serious balance-of-payments and external financial  difficulties  or  the  threat  thereof,  the  Minister  may, consistently with international obligation assumed by Government,   adopt   or   maintain   restrictions   to   address   the difficulties.  (2) The   restrictions   which   may   be   adopted   or maintained pursuant subsection (1) include -  LAWS OF GUYANA Caribbean Community (Movement of Factors) Cap. 18:10 17  L.R.O. 1/2012                                                 (a)     quantitative restrictions on imports;  (b)  restrictions on the right of establishment;  (c)     restrictions on the right to provide a service; and  (d)    restrictions on the right to move capital or on payments and transfers or transactions connected therewith.  (3) The restrictions mentioned in subsection (2) shall-  (a)    subject to the provisions of this Act, and relevant determination of Conference, the Council for Finance and Planning and the Council for Trade and Economic Development, as the case may require, not discriminate among Member States or against Member States in favour of third States;  (b)     at all times seek to minimise damage to the commercial, economic or financial interests of other Member States;  (c)     not exceed those necessary to deal with the circumstances mentioned in subsection (1);  (d) be temporary and not longer than eighteen months and must be removed progressively as the situation mentioned in subsection (1) improves. LAWS OF GUYANA 18 Cap. 18:10 Caribbean Community (Movement of Factors)  L.R.O. 1/2012    Incidence and notification of restrictions.                      Consultations for the removal of restrictions.",
            "description": [
                {
                    "representation": "(1)",
                    "description": "improves. LAWS OF GUYANA 18 Cap. 18:10 Caribbean Community"
                },
                {
                    "representation": "(2)",
                    "description": "shall-"
                },
                {
                    "representation": "(a)",
                    "description": "subject to the provisions of this Act, and relevant determination of Conference, the Council for Finance and Planning and the Council for Trade and Economic Development, as the case may require, not discriminate among Member States or against Member States in favour of third States;"
                },
                {
                    "representation": "(b)",
                    "description": "at all times seek to minimise damage to the commercial, economic or financial interests of other Member States;"
                },
                {
                    "representation": "(c)",
                    "description": "not exceed those necessary to deal with the circumstances mentioned in subsection"
                },
                {
                    "representation": "(d)",
                    "description": "be temporary and not longer than eighteen months and must be removed progressively as the situation mentioned in subsection"
                },
                {
                    "representation": "(3)",
                    "description": "The restrictions mentioned in subsection"
                }
            ]
        }
    },
    {
        "act": "CARIBBEAN COMMUNITY (MOVEMENT OF FACTORS) ACT",
        "source": "https://mola.gov.gy/laws-of-guyana",
        "type": {
            "name": "section",
            "representation": "19",
            "title": "Incidence and notification of restrictions. ",
            "context": "CARIBBEAN COMMUNITY (MOVEMENT OF FACTORS) ACT under Incidence and notification of restrictions. 19. (1) In   determining   the   incidence   of   restrictions mentioned  in  section  18,  the  Minister  may  accord  priority  to activities which are essential to the economic stability of Guyana but  such restrictions shall not be adopted or maintained for the purpose of protecting a particular sector due regard being paid to any  special   factors  which  may  be  affecting  the  reserves  of Government or its need for reserves.  (2) Restrictions adopted or  maintained  pursuant  to subsection (1) or any changes therein shall be notified within three working days to the Council for Finance and Planning and the Council for Trade and Economic Development, and, in any event, the  Minister shall forthwith consult with the competent organ of the Community if requested to do so.",
            "description": [
                {
                    "representation": "(1)",
                    "description": "or any changes therein shall be notified within three working days to the Council for Finance and Planning and the Council for Trade and Economic Development, and, in any event, the  Minister shall forthwith consult with the competent organ of the Community if requested to do so."
                },
                {
                    "representation": "(2)",
                    "description": "Restrictions adopted or  maintained  pursuant  to subsection"
                }
            ]
        }
    },
    {
        "act": "CARIBBEAN COMMUNITY (MOVEMENT OF FACTORS) ACT",
        "source": "https://mola.gov.gy/laws-of-guyana",
        "type": {
            "name": "section",
            "representation": "20",
            "title": "Consultations for the removal of restrictions. ",
            "context": "CARIBBEAN COMMUNITY (MOVEMENT OF FACTORS) ACT under Consultations for the removal of restrictions. 20. (1) The Minister shall consult with the Council for Finance   and   Planning,   and,   where   practicable,   before   the imposition  of  restrictions  mentioned  in  section  18,  with  the objective  of  being  informed  of  any  recommendations  for  the removal of the restrictions.  (2) The  consultations  mentioned  in  subsection  (1) shall    (a) designed to assist Government to overcome its Balance-of-payments and external financial difficulties;  (b)  assess the balance-of-payments situation of  Government and the restrictions adopted or maintained under section 18 taking into account inter alia  LAWS OF GUYANA Caribbean Community (Movement of Factors) Cap. 18:10 19  L.R.O. 1/2012                                Application of restrictions on exercise rights to resolve difficulties.                (i)  the nature and extent of the balance-of-payments and external financial difficulties; (ii)  the external economic and trading environment of Guyana; and (iii) alternative corrective measures which may be available.  (3) The consultations shall address the compliance of any restrictions with section   18(3)   and,   in   particular,   the progressive removal of restrictions in accordance with section 18 (3)(d).  (4) In such consultations, all findings of statistical and other facts presented by the Committee of Central Bank Governors relating to  foreign exchange, monetary reserves and balance-of- payments shall be accepted and conclusions shall be based on the assessment  by  the  Committee  of  the  balance-of-payments  and external financial situation of Guyana.",
            "description": [
                {
                    "representation": "(1)",
                    "description": "shall"
                },
                {
                    "representation": "(2)",
                    "description": "The  consultations  mentioned  in  subsection"
                },
                {
                    "representation": "(a)",
                    "description": "designed to assist Government to overcome its Balance-of-payments and external financial difficulties;"
                },
                {
                    "representation": "(b)",
                    "description": "assess the balance-of-payments situation of  Government and the restrictions adopted or maintained under section 18 taking into account inter alia  LAWS OF GUYANA Caribbean Community"
                },
                {
                    "representation": "(i)",
                    "description": "the nature and extent of the balance-of-payments and external financial difficulties;"
                },
                {
                    "representation": "(3)",
                    "description": "The consultations shall address the compliance of any restrictions with section   18(3)   and,   in   particular,   the progressive removal of restrictions in accordance with section 18"
                },
                {
                    "representation": "(4)",
                    "description": "In such consultations, all findings of statistical and other facts presented by the Committee of Central Bank Governors relating to  foreign exchange, monetary reserves and balance-of- payments shall be accepted and conclusions shall be based on the assessment  by  the  Committee  of  the  balance-of-payments  and external financial situation of Guyana."
                }
            ]
        }
    },
    {
        "act": "CARIBBEAN COMMUNITY (MOVEMENT OF FACTORS) ACT",
        "source": "https://mola.gov.gy/laws-of-guyana",
        "type": {
            "name": "section",
            "representation": "21",
            "title": "Application of restrictions on exercise of rights to resolve           difficulties. ",
            "context": "CARIBBEAN COMMUNITY (MOVEMENT OF FACTORS) ACT under Application of restrictions on exercise of rights to resolve           difficulties. 21. (1) Where the exercise of rights conferred by this Act creates  serious  difficulties  in  any  sector  of  the  economy  of Guyana, or results in economic hardship in  any region thereof, the Minister may, subject to the provisions of this section, apply such restrictions on  the  exercise of  rights  as the  Minister  considers appropriate  in  order  to  resolve  the  difficulties  or  alleviate  the hardships.  (2) If   the   Minister   intends   to   apply   restrictions pursuant to subsection (1), the Minister shall, prior to applying the restrictions, notify the Organ of the Community of the Minister's intention and the nature of the restrictions.  (3) If the Minister is unable to notify the competent LAWS OF GUYANA 20 Cap. 18:10 Caribbean Community (Movement of Factors)  L.R.O. 1/2012        Conditions for the application of restrictions.                  Permissible restrictions.                    organ prior to the application of the restrictions, the Minister shall, upon applying  the  restrictions,  forthwith  notify  the  competent organ of the Community of the application and the nature of the restrictions.",
            "description": [
                {
                    "representation": "(1)",
                    "description": "Where the exercise of rights conferred by this Act creates  serious  difficulties  in  any  sector  of  the  economy  of Guyana, or results in economic hardship in  any region thereof, the Minister may, subject to the provisions of this section, apply such restrictions on  the  exercise of  rights  as the  Minister  considers appropriate  in  order  to  resolve  the  difficulties  or  alleviate  the hardships."
                },
                {
                    "representation": "(2)",
                    "description": "If   the   Minister   intends   to   apply   restrictions pursuant to subsection"
                },
                {
                    "representation": "(3)",
                    "description": "If the Minister is unable to notify the competent LAWS OF GUYANA 20 Cap. 18:10 Caribbean Community"
                }
            ]
        }
    },
    {
        "act": "CARIBBEAN COMMUNITY (MOVEMENT OF FACTORS) ACT",
        "source": "https://mola.gov.gy/laws-of-guyana",
        "type": {
            "name": "section",
            "representation": "22",
            "title": "Conditions for the application of restrictions. ",
            "context": "CARIBBEAN COMMUNITY (MOVEMENT OF FACTORS) ACT under Conditions for the application of restrictions. 22. (1) The Minister shall, at the time of applying the restrictions mentioned in section 21, submit to the Council for Trade and Economic Development or the Council for Finance and Planning, as  the case may require, a programme setting out the measures  to  be  taken  by  Guyana to  resolve the  difficulties or alleviate the hardships.  (2) The Minister shall act on the determinations of the competent organ of the Community regarding -  (a)   the appropriateness of the restrictions and whether they shall continue;  (b)   the adequacy of the programme and the duration of the restrictions.",
            "description": [
                {
                    "representation": "(1)",
                    "description": "The Minister shall, at the time of applying the restrictions mentioned in section 21, submit to the Council for Trade and Economic Development or the Council for Finance and Planning, as  the case may require, a programme setting out the measures  to  be  taken  by  Guyana to  resolve the  difficulties or alleviate the hardships."
                },
                {
                    "representation": "(2)",
                    "description": "The Minister shall act on the determinations of the competent organ of the Community regarding -"
                },
                {
                    "representation": "(a)",
                    "description": "the appropriateness of the restrictions and whether they shall continue;"
                },
                {
                    "representation": "(b)",
                    "description": "the adequacy of the programme and the duration of the restrictions."
                }
            ]
        }
    },
    {
        "act": "CARIBBEAN COMMUNITY (MOVEMENT OF FACTORS) ACT",
        "source": "https://mola.gov.gy/laws-of-guyana",
        "type": {
            "name": "section",
            "representation": "23",
            "title": "Permissible restrictions. ",
            "context": "CARIBBEAN COMMUNITY (MOVEMENT OF FACTORS) ACT under Permissible restrictions. 23. (1) Restrictions  applied  by  the  competent  Minister pursuant to section 21 shall be confined to those necessary   (a)    to resolve the difficulties in the affected sectors;  (b)    to alleviate economic hardships in a particular region;   (c)       to minimise damage to the commercial or economic interests of other Member States;  (d)    to prevent the unreasonable exercise of rights granted by this Act; LAWS OF GUYANA Caribbean Community (Movement of Factors) Cap. 18:10 21  L.R.O. 1/2012      Non-discrimination applying permissible restrictions.               General exceptions to  the obligation to remove restrictions.                          (e)    the exercise of which could impair the development of the CARICOM Single Market and Economy.",
            "description": [
                {
                    "representation": "(1)",
                    "description": "Restrictions  applied  by  the  competent  Minister pursuant to section 21 shall be confined to those necessary"
                },
                {
                    "representation": "(a)",
                    "description": "to resolve the difficulties in the affected sectors;"
                },
                {
                    "representation": "(b)",
                    "description": "to alleviate economic hardships in a particular region;"
                },
                {
                    "representation": "(c)",
                    "description": "to minimise damage to the commercial or economic interests of other Member States;"
                },
                {
                    "representation": "(d)",
                    "description": "to prevent the unreasonable exercise of rights granted by this Act; LAWS OF GUYANA Caribbean Community"
                },
                {
                    "representation": "(e)",
                    "description": "the exercise of which could impair the development of the CARICOM Single Market and Economy."
                }
            ]
        }
    },
    {
        "act": "CARIBBEAN COMMUNITY (MOVEMENT OF FACTORS) ACT",
        "source": "https://mola.gov.gy/laws-of-guyana",
        "type": {
            "name": "section",
            "representation": "24",
            "title": "Non-discrimination applying permissible restrictions. ",
            "context": "CARIBBEAN COMMUNITY (MOVEMENT OF FACTORS) ACT under Non-discrimination applying permissible restrictions. 24. The Minister in applying the restrictions pursuant to  section 21 shall not discriminate on the ground of nationality and   (a)   shall progressively relax them as relevant conditions improve;  (b)   may maintain them only to the extent that conditions mentioned in section 21 continue to justify their application.",
            "description": [
                {
                    "representation": "(a)",
                    "description": "shall progressively relax them as relevant conditions improve;"
                },
                {
                    "representation": "(b)",
                    "description": "may maintain them only to the extent that conditions mentioned in section 21 continue to justify their application."
                }
            ]
        }
    },
    {
        "act": "CARIBBEAN COMMUNITY (MOVEMENT OF FACTORS) ACT",
        "source": "https://mola.gov.gy/laws-of-guyana",
        "type": {
            "name": "section",
            "representation": "25",
            "title": "General exceptions to the obligation to remove restrictions. ",
            "context": "CARIBBEAN COMMUNITY (MOVEMENT OF FACTORS) ACT under General exceptions to the obligation to remove restrictions. 25. (1) Notwithstanding any of the provisions of this Act, the Minister shall not be precluded from taking measures   (a)   to protect public morals or maintain public order and safety;  (b)    to protect human, animal and plant life;  (c)  to secure compliance with laws or regulations relating to customs enforcement, or to the classification, grading or marketing of goods, or to the operation of monopolies by state enterprises or enterprises given exclusive or special privileges;  (d)    to protect intellectual property rights or to prevent deceptive practices;  (e)      relating to gold or silver; LAWS OF GUYANA 22 Cap. 18:10 Caribbean Community (Movement of Factors)  L.R.O. 1/2012                                                  (f)     relating to products of prison labour;   (g)  relating to child labour;  (h)     to protect national treasures of artistic, historic or archaeological value; (i)  to prevent or relieve critical food shortages in any exporting Member State;  (j)       relating to the conservation of natural resources or the preservation of the environment;  (k)  to secure compliance with laws or regulations which are consistent with the provisions of the Treaty including those relating to   (i)    the prevention of deceptive and fraudulent practices, and the effects of default on contracts;  (ii)   the protection of the privacy of individuals in relation to the processing and dissemination of personal data and the protection of confidentiality of individual records and accounts;  (l)      to protect existing economic activities which are based on traditional, historical or customary practices;  (m) to give effect to international LAWS OF GUYANA Caribbean Community (Movement of Factors) Cap. 18:10 23  L.R.O. 1/2012            Security exceptions to obligation to remove restrictions.                        Determinations of organs and bodies of the Community to be carried out.  Implemen- tation of  Community Standards. obligations including treaties on the avoidance of double taxation.  (2) Nothing in subsection (l) shall  be construed as permitting  the  Minister to  take  any  measure  which constitutes arbitrary  or  unjustifiable  discrimination  against  a  national  of another Member State.",
            "description": [
                {
                    "representation": "(1)",
                    "description": "Notwithstanding any of the provisions of this Act, the Minister shall not be precluded from taking measures"
                },
                {
                    "representation": "(a)",
                    "description": "to protect public morals or maintain public order and safety;"
                },
                {
                    "representation": "(b)",
                    "description": "to protect human, animal and plant life;"
                },
                {
                    "representation": "(c)",
                    "description": "to secure compliance with laws or regulations relating to customs enforcement, or to the classification, grading or marketing of goods, or to the operation of monopolies by state enterprises or enterprises given exclusive or special privileges;"
                },
                {
                    "representation": "(d)",
                    "description": "to protect intellectual property rights or to prevent deceptive practices;"
                },
                {
                    "representation": "(e)",
                    "description": "relating to gold or silver; LAWS OF GUYANA 22 Cap. 18:10 Caribbean Community"
                },
                {
                    "representation": "(f)",
                    "description": "relating to products of prison labour;"
                },
                {
                    "representation": "(g)",
                    "description": "relating to child labour;"
                },
                {
                    "representation": "(h)",
                    "description": "to protect national treasures of artistic, historic or archaeological value;"
                },
                {
                    "representation": "(i)",
                    "description": "the prevention of deceptive and fraudulent practices, and the effects of default on contracts;"
                },
                {
                    "representation": "(j)",
                    "description": "relating to the conservation of natural resources or the preservation of the environment;"
                },
                {
                    "representation": "(k)",
                    "description": "to secure compliance with laws or regulations which are consistent with the provisions of the Treaty including those relating to"
                },
                {
                    "representation": "(l)",
                    "description": "shall  be construed as permitting  the  Minister to  take  any  measure  which constitutes arbitrary  or  unjustifiable  discrimination  against  a  national  of another Member State."
                },
                {
                    "representation": "(m)",
                    "description": "to give effect to international LAWS OF GUYANA Caribbean Community"
                },
                {
                    "representation": "(2)",
                    "description": "Nothing in subsection"
                }
            ]
        }
    },
    {
        "act": "CARIBBEAN COMMUNITY (MOVEMENT OF FACTORS) ACT",
        "source": "https://mola.gov.gy/laws-of-guyana",
        "type": {
            "name": "section",
            "representation": "26",
            "title": "Security exceptions to obligation to remove restrictions.  PART VI GENERAL  ",
            "context": "CARIBBEAN COMMUNITY (MOVEMENT OF FACTORS) ACT under Security exceptions to obligation to remove restrictions.  PART VI GENERAL  26. Nothing   in   this   Act   shall   be   construed   as preventing the Minister from taking measures to   (a)  protect the essential security interests of Guyana   (i)    relating to the supply of services carried out directly or indirectly for the purpose of provisioning a military establishment;  (ii)  in time of war or other public emergency; or  (b)    discharge the obligations of Guyana for the maintenance of international peace and security.   PART VI GENERAL",
            "description": [
                {
                    "representation": "(a)",
                    "description": "protect the essential security interests of Guyana"
                },
                {
                    "representation": "(i)",
                    "description": "relating to the supply of services carried out directly or indirectly for the purpose of provisioning a military establishment;"
                },
                {
                    "representation": "(b)",
                    "description": "discharge the obligations of Guyana for the maintenance of international peace and security.   PART VI GENERAL"
                }
            ]
        }
    },
    {
        "act": "CARIBBEAN COMMUNITY (MOVEMENT OF FACTORS) ACT",
        "source": "https://mola.gov.gy/laws-of-guyana",
        "type": {
            "name": "section",
            "representation": "27",
            "title": "Determination of organs and bodies of the Community to be           carried out. ",
            "context": "CARIBBEAN COMMUNITY (MOVEMENT OF FACTORS) ACT under Determination of organs and bodies of the Community to be           carried out. 27. The Minister shall, where an organ or body of the Community has been authorised to make any determinations in respect of any of the rights referred to section 4, carry out such determination.",
            "description": "The Minister shall, where an organ or body of the Community has been authorised to make any determinations in respect of any of the rights referred to section 4, carry out such determination."
        }
    },
    {
        "act": "CARIBBEAN COMMUNITY (MOVEMENT OF FACTORS) ACT",
        "source": "https://mola.gov.gy/laws-of-guyana",
        "type": {
            "name": "section",
            "representation": "28",
            "title": "Implementation of Community standards. ",
            "context": "CARIBBEAN COMMUNITY (MOVEMENT OF FACTORS) ACT under Implementation of Community standards. 28. The Minister shall establish or employ as required an appropriate mechanism to implement Community LAWS OF GUYANA 24 Cap. 18:10 Caribbean Community (Movement of Factors)  L.R.O. 1/2012       Right to appeal to Minister for speedy review of decision of a functionary.       Offences  against this  Act.         Regulations.                      standards to determine  equivalency  or  to  accord  accreditation  or  mutual recognition  to   diplomas,  certificates   and  other   evidence   of qualifications secured by a national of another Member State.",
            "description": "The Minister shall establish or employ as required an appropriate mechanism to implement Community LAWS OF GUYANA 24 Cap. 18:10 Caribbean Community (Movement of Factors)  L.R.O. 1/2012       Right to appeal to Minister for speedy review of decision of a functionary.       Offences  against this  Act.         Regulations.                      standards to determine  equivalency  or  to  accord  accreditation  or  mutual recognition  to   diplomas,  certificates   and  other   evidence   of qualifications secured by a national of another Member State."
        }
    },
    {
        "act": "CARIBBEAN COMMUNITY (MOVEMENT OF FACTORS) ACT",
        "source": "https://mola.gov.gy/laws-of-guyana",
        "type": {
            "name": "section",
            "representation": "29",
            "title": "Right to appeal to Minister for speedy review of decision of a functionary. ",
            "context": "CARIBBEAN COMMUNITY (MOVEMENT OF FACTORS) ACT under Right to appeal to Minister for speedy review of decision of a functionary. 29. Where a functionary purports to restrict a person in the exercise of a right under section 4, the person aggrieved may, without prejudice to any other remedy, appeal to the Minister for a speedy review of the decision of such functionary.",
            "description": "Where a functionary purports to restrict a person in the exercise of a right under section 4, the person aggrieved may, without prejudice to any other remedy, appeal to the Minister for a speedy review of the decision of such functionary."
        }
    },
    {
        "act": "CARIBBEAN COMMUNITY (MOVEMENT OF FACTORS) ACT",
        "source": "https://mola.gov.gy/laws-of-guyana",
        "type": {
            "name": "section",
            "representation": "30",
            "title": "Offences against this Act. ",
            "context": "CARIBBEAN COMMUNITY (MOVEMENT OF FACTORS) ACT under Offences against this Act. 30. Any person who, contrary to the provisions of this Act,  knowingly obstructs or otherwise impedes a national of a Member State in the lawful enjoyment of any right mentioned in section 4 or  any right collateral thereto commits an offence and shall be liable on summary conviction to a fine not exceeding one hundred and twenty  thousand dollars or to imprisonment for a term  not  exceeding  three   years  or  to  both  such  fine  and imprisonment.",
            "description": "Any person who, contrary to the provisions of this Act,  knowingly obstructs or otherwise impedes a national of a Member State in the lawful enjoyment of any right mentioned in section 4 or  any right collateral thereto commits an offence and shall be liable on summary conviction to a fine not exceeding one hundred and twenty  thousand dollars or to imprisonment for a term  not  exceeding  three   years  or  to  both  such  fine  and imprisonment."
        }
    },
    {
        "act": "CARIBBEAN COMMUNITY (MOVEMENT OF FACTORS) ACT",
        "source": "https://mola.gov.gy/laws-of-guyana",
        "type": {
            "name": "section",
            "representation": "31",
            "title": "Regulations.  SCHEDULE   __________________________       LAWS OF GUYANA Caribbean Community (Movement of Factors) Cap. 18:10 5  L.R.O. 1/2012 CHAPTER 18:10  CARIBBEAN COMMUNITY (MOVEMENT OF FACTORS) ACT   7 of 2006 An Act to give effect to the provisions of the Treaty establishing the Caribbean Community, including the CARICOM Single Market and Economy, relating  to the exercise by nationals of the Caribbean Community of the right of establishment, the right to provide services and the right to move  capital  into  and  within  Guyana  and  out of Guyana  to  other Member   States  of  the  Caribbean  Community  and  for  connected matters.   [1ST JANUARY, 2006]     Short title.    Interpretation.             PART I PRELIMINARY  ",
            "context": "CARIBBEAN COMMUNITY (MOVEMENT OF FACTORS) ACT under Regulations.  SCHEDULE   __________________________       LAWS OF GUYANA Caribbean Community (Movement of Factors) Cap. 18:10 5  L.R.O. 1/2012 CHAPTER 18:10  CARIBBEAN COMMUNITY (MOVEMENT OF FACTORS) ACT   7 of 2006 An Act to give effect to the provisions of the Treaty establishing the Caribbean Community, including the CARICOM Single Market and Economy, relating  to the exercise by nationals of the Caribbean Community of the right of establishment, the right to provide services and the right to move  capital  into  and  within  Guyana  and  out of Guyana  to  other Member   States  of  the  Caribbean  Community  and  for  connected matters.   [1ST JANUARY, 2006]     Short title.    Interpretation.             PART I PRELIMINARY  31.",
            "description": "31."
        }
    }
]