[
    {
        "act": "GUYANA COAT OF ARMS (REGULATION) ACT",
        "source": "https://mola.gov.gy/laws-of-guyana",
        "type": {
            "name": "section",
            "representation": "1",
            "title": "Short title. ",
            "context": "GUYANA COAT OF ARMS (REGULATION) ACT under Short title. 1. This act may be cited as the Guyana Coat of Arms (Regulation) Act.",
            "description": "This act may be cited as the Guyana Coat of Arms (Regulation) Act."
        }
    },
    {
        "act": "GUYANA COAT OF ARMS (REGULATION) ACT",
        "source": "https://mola.gov.gy/laws-of-guyana",
        "type": {
            "name": "section",
            "representation": "2",
            "title": "Restrictions on using the Coat of Arms of Guyana. ",
            "context": "GUYANA COAT OF ARMS (REGULATION) ACT under Restrictions on using the Coat of Arms of Guyana. 2.  Subject as hereinafter provided, any  person  who, otherwise than in accordance with the terms of a licence granted by the Minister, uses or displays  (a)      in connection with the carrying on of any business, trade, profession or calling; or  (b)       in connection with the activities of any body or persons, whether corporate or unincorporate,  the national Coat of Arms of Guyana, or any arms so nearly resembling them as to be calculated to deceive, shall be guilty of an offence against this Act:  Provided that  the  foregoing provisions of this  section shall  not apply  to the  reproduction or representation of theL.R.O. 1/2012  LAWS OF GUYANA  4              Cap. 19:06          Guyana Coat of Arms (Regulation)   national  Coat  of Arms of Guyana  on any article, goods or thing sold or offered   for sale except the Minister, lest any affront to public good   taste   be thereby occasioned or continued, declares by order   published in the Gazette that the said foregoing provisions shall  apply to the reproduction or representation of the  national Coat of Arms of Guyana on those articles, goods or things. Licences may be subject to terms and conditions.           Penalty. [6 of 1997]",
            "description": [
                {
                    "representation": "(a)",
                    "description": "in connection with the carrying on of any business, trade, profession or calling; or"
                },
                {
                    "representation": "(b)",
                    "description": "in connection with the activities of any body or persons, whether corporate or unincorporate,  the national Coat of Arms of Guyana, or any arms so nearly resembling them as to be calculated to deceive, shall be guilty of an offence against this Act:  Provided that  the  foregoing provisions of this  section shall  not apply  to the  reproduction or representation of theL.R.O. 1/2012  LAWS OF GUYANA  4              Cap. 19:06          Guyana Coat of Arms"
                }
            ]
        }
    },
    {
        "act": "GUYANA COAT OF ARMS (REGULATION) ACT",
        "source": "https://mola.gov.gy/laws-of-guyana",
        "type": {
            "name": "section",
            "representation": "3",
            "title": "Licences may be subject to terms and conditions. ",
            "context": "GUYANA COAT OF ARMS (REGULATION) ACT under Licences may be subject to terms and conditions. 3.  (l)   A licence  may  be granted  under  this Act by the Minister subject to such terms and conditions  (if any) as are specified in the licence and it may at any time be revoked, amended or altered by the Minister.  (2)   Every application for any such licence shall be in writing,   shall be made by transmission   thereof to the Minister responsible  for ceremonial and shall contain  such information as the Minister may from time to time require.",
            "description": [
                {
                    "representation": "(l)",
                    "description": "A licence  may  be granted  under  this Act by the Minister subject to such terms and conditions"
                },
                {
                    "representation": "(2)",
                    "description": "Every application for any such licence shall be in writing,   shall be made by transmission   thereof to the Minister responsible  for ceremonial and shall contain  such information as the Minister may from time to time require."
                }
            ]
        }
    }
]