[
    {
        "act": "PUBLIC HOLIDAYS ACT",
        "source": "https://mola.gov.gy/laws-of-guyana",
        "type": {
            "name": "section",
            "representation": "1",
            "title": "Short title. ",
            "context": "PUBLIC HOLIDAYS ACT under Short title. 1. This Act may be cited as the Public Holidays Act.",
            "description": "This Act may be cited as the Public Holidays Act."
        }
    },
    {
        "act": "PUBLIC HOLIDAYS ACT",
        "source": "https://mola.gov.gy/laws-of-guyana",
        "type": {
            "name": "section",
            "representation": "2",
            "title": "What is a public holiday. ",
            "context": "PUBLIC HOLIDAYS ACT under What is a public holiday. 2. In this Act public holiday means a day which (subject to the provisions of section 4) is dies non, and which is kept as a holiday by all banks, educational establishments, public offices and government departments.",
            "description": "In this Act public holiday means a day which (subject to the provisions of section 4) is dies non, and which is kept as a holiday by all banks, educational establishments, public offices and government departments."
        }
    },
    {
        "act": "PUBLIC HOLIDAYS ACT",
        "source": "https://mola.gov.gy/laws-of-guyana",
        "type": {
            "name": "section",
            "representation": "3",
            "title": "Public holidays. ",
            "context": "PUBLIC HOLIDAYS ACT under Public holidays. 3. (1) The following days shall be public holidays namely  every Sunday; the first week-day of January; Republic Day, that is to say such day in each year as shall, by notice LAWS OF GUYANA 4 19:07 Public Holidays  L.R.O. 1/2012                                Exclusion of certain offices, or departments.   Acts relating to negotiable instruments.  c. 90:13      Appointment of holidays by the Minister.  published in the Gazette, be appointed for the purpose by the Minister responsible for public holidays; Good Friday; Easter Monday; Labour Day, that is to say, the 1st May, or, if that day is a Sunday, the following day;  Commonwealth Day, that is to say the first Monday in August; Christmas Day, or, if that day is a Sunday, the following day; the 26th December, or if that day is a Sunday, the following day, unless Christmas  Day falls on a Sunday,  and then the Tuesday following Christmas Day;  Phagwah Day, or, if that day is a Sunday, the following day; Deepavali Day, or, if that day is a Sunday, the following day; Eid-Ul-Azha Day, or, if that day is a Sunday, the following day; Youman Nabi Day, or, if that day is a Sunday, the following day.  (2) During every year, the Minister responsible for public holidays shall cause notices of the days constituted  public holidays in respect of that years Phagwah, Deepavali, Eid-Ul-Azha and Youman Nabi by subsection (1) to be published in the Gazette as soon as reasonably practicable before the dates so notified, respectively.",
            "description": [
                {
                    "representation": "(1)",
                    "description": "to be published in the Gazette as soon as reasonably practicable before the dates so notified, respectively."
                },
                {
                    "representation": "(2)",
                    "description": "During every year, the Minister responsible for public holidays shall cause notices of the days constituted  public holidays in respect of that years Phagwah, Deepavali, Eid-Ul-Azha and Youman Nabi by subsection"
                }
            ]
        }
    },
    {
        "act": "PUBLIC HOLIDAYS ACT",
        "source": "https://mola.gov.gy/laws-of-guyana",
        "type": {
            "name": "section",
            "representation": "4",
            "title": "Exclusion of certain offices, or departments. ",
            "context": "PUBLIC HOLIDAYS ACT under Exclusion of certain offices, or departments. 4. The Minister may make regulations excluding any public office or government department in whole or in part from the operation of section",
            "description": "The Minister may make regulations excluding any public office or government department in whole or in part from the operation of section"
        }
    },
    {
        "act": "PUBLIC HOLIDAYS ACT",
        "source": "https://mola.gov.gy/laws-of-guyana",
        "type": {
            "name": "section",
            "representation": "5",
            "title": "Acts relating to negotiable instruments. ",
            "context": "PUBLIC HOLIDAYS ACT under Acts relating to negotiable instruments. 5. Subject to the Bills of Exchange Act, it is not necessary for anyone to make any payment or to do any other act, including noting or protesting, relating  to any negotiable  instrument  on a public holiday, but all obligation  to make  that payment  or to do that other act shall apply to the next following day not being itself a public holiday.",
            "description": "Subject to the Bills of Exchange Act, it is not necessary for anyone to make any payment or to do any other act, including noting or protesting, relating  to any negotiable  instrument  on a public holiday, but all obligation  to make  that payment  or to do that other act shall apply to the next following day not being itself a public holiday."
        }
    },
    {
        "act": "PUBLIC HOLIDAYS ACT",
        "source": "https://mola.gov.gy/laws-of-guyana",
        "type": {
            "name": "section",
            "representation": "6",
            "title": "Appointment of holidays by the Minister. ",
            "context": "PUBLIC HOLIDAYS ACT under Appointment of holidays by the Minister. 6. The Minister may by notification in the Gazette appoint any day to be observed  as a public holiday in LAWS OF GUYANA Public Holidays Cap. 19:07 5  L.R.O. 1/2012        Saving.  c. 91:",
            "description": "The Minister may by notification in the Gazette appoint any day to be observed  as a public holiday in LAWS OF GUYANA Public Holidays Cap. 19:07 5  L.R.O. 1/2012        Saving.  c. 91:"
        }
    }
]