[
    {
        "act": "RACIAL HOSTILITY ACT",
        "source": "https://mola.gov.gy/laws-of-guyana",
        "type": {
            "name": "section",
            "representation": "1",
            "title": "Short title. ",
            "context": "RACIAL HOSTILITY ACT under Short title. 1.  This Act may be cited as the Racial Hostility Act.",
            "description": "This Act may be cited as the Racial Hostility Act."
        }
    },
    {
        "act": "RACIAL HOSTILITY ACT",
        "source": "https://mola.gov.gy/laws-of-guyana",
        "type": {
            "name": "section",
            "representation": "2",
            "title": "Excitement of hostility or ill-will on grounds of race. ",
            "context": "RACIAL HOSTILITY ACT under Excitement of hostility or ill-will on grounds of race. 2.",
            "description": "2."
        }
    },
    {
        "act": "RACIAL HOSTILITY ACT",
        "source": "https://mola.gov.gy/laws-of-guyana",
        "type": {
            "name": "section",
            "representation": "3",
            "title": "Disabilities consequent upon conviction under section ",
            "context": "RACIAL HOSTILITY ACT under Disabilities consequent upon conviction under section 3. (1)  If a person is convicted of an offence under section 2, then, irrespective of any punishment to which he may be sentenced in pursuance of that section, for a period of five years commencing with the date of his conviction he shall be disqualified for  (a)   election as a member of the National Assembly;  (b)   membership of any local government authority;  and  (c)  any of the following offices and appointments, that is to say  (i)  the office (by whatever name called) of agent or deputy  agent  or  assistant  agent  of  any  candidate  for election to the National Assembly or any local government authority;  (ii)  any office in a political party whether paid or unpaid (including membership of any committee or other body that  is  concerned  with  the  direction  of  the  policy  or activities of LAWS OF GUYANA Racial Hostility Cap. 23:01 7  L.R.O. 1/2012                                                 such party);  (iii)   any office established by Guyana law being an office power to make appointments to which is vested in the President or a Minister;  (iv)   the appointment of editor of any newspaper or any appointment on the editorial staff of any newspaper; and   (v) any appointment on the managerial or editorial staff of any broadcasting station.  (2) Any  person  who,  being  disqualified  in  pursuance  of subsection (1) for any office or appointment referred to in paragraph (c) of that subsection, performs any of the functions of that office or appointment, shall be liable on summary conviction to a fine of two hundred and  fifty thousand dollars or to imprisonment for three years  (3) Where a person who is a member of a local government authority   is   convicted   of   an   offence   under   section   2,   his disqualification in pursuance of subsection (1) of this section for membership of that authority shall not take effect  (a)   until the expiration of any period prescribed by or under any law during which he may enter an appeal against his conviction or a notice of  _______________________________________________________ * Order 36/1966B provided that this subsection shall have effect as if inserted by Parliament pursuant to articles 60(2) (d) (i) and 120 of the Constitution of Guyana. (See footnote at page 3 above.  LAWS OF GUYANA 8 Cap. 23:01 Racial Hostility  L.R.O. 1/2012                                                 such an appeal or may apply for leave to bring such an appeal; or  (b)   if within the time so prescribed he enters such an appeal or a notice of such an appeal or applies for leave to bring such an appeal, unless and until the appeal is dismissed or discontinued and no further appeal against the dismissal is available to him  as of right or, as the case may be, his application for leave to bring such an appeal is refused or withdrawn.  (4) Where a person has become disqualified as prescribed by subsection (1) and the conviction by reason of which he became so disqualified is set aside on appeal or he is granted a free pardon in respect  thereof, the disqualification shall thereupon cease to have effect but without prejudice to its previous operation.  (5) In this section  Guyana law means law enacted by any legislature established in and for Guyana;  broadcasting station means  stations, and includes a television station; and for the dissemination of any form of radio-electric communication, including, radio-telephone,  the  wireless  transmission  of  writing,  signs, signals, pictures and sounds of all kinds by means of Hertzian  waves, intended to be received by the public either directly or through the medium of relay stations; and  local government authority, newspaper and political party have the same meanings as in section",
            "description": [
                {
                    "representation": "(1)",
                    "description": "and the conviction by reason of which he became so disqualified is set aside on appeal or he is granted a free pardon in respect  thereof, the disqualification shall thereupon cease to have effect but without prejudice to its previous operation."
                },
                {
                    "representation": "(a)",
                    "description": "until the expiration of any period prescribed by or under any law during which he may enter an appeal against his conviction or a notice of  _______________________________________________________ * Order 36/1966B provided that this subsection shall have effect as if inserted by Parliament pursuant to articles 60(2)"
                },
                {
                    "representation": "(b)",
                    "description": "if within the time so prescribed he enters such an appeal or a notice of such an appeal or applies for leave to bring such an appeal, unless and until the appeal is dismissed or discontinued and no further appeal against the dismissal is available to him  as of right or, as the case may be, his application for leave to bring such an appeal is refused or withdrawn."
                },
                {
                    "representation": "(c)",
                    "description": "of that subsection, performs any of the functions of that office or appointment, shall be liable on summary conviction to a fine of two hundred and  fifty thousand dollars or to imprisonment for three years"
                },
                {
                    "representation": "(i)",
                    "description": "the office"
                },
                {
                    "representation": "(v)",
                    "description": "any appointment on the managerial or editorial staff of any broadcasting station."
                },
                {
                    "representation": "(2)",
                    "description": "Any  person  who,  being  disqualified  in  pursuance  of subsection"
                },
                {
                    "representation": "(3)",
                    "description": "Where a person who is a member of a local government authority   is   convicted   of   an   offence   under   section   2,   his disqualification in pursuance of subsection"
                },
                {
                    "representation": "(d)",
                    "description": "(i) and 120 of the Constitution of Guyana."
                },
                {
                    "representation": "(4)",
                    "description": "Where a person has become disqualified as prescribed by subsection"
                },
                {
                    "representation": "(5)",
                    "description": "In this section  Guyana law means law enacted by any legislature established in and for Guyana;  broadcasting station means  stations, and includes a television station; and for the dissemination of any form of radio-electric communication, including, radio-telephone,  the  wireless  transmission  of  writing,  signs, signals, pictures and sounds of all kinds by means of Hertzian  waves, intended to be received by the public either directly or through the medium of relay stations; and  local government authority, newspaper and political party have the same meanings as in section"
                }
            ]
        }
    }
]