[
    {
        "act": "PENSIONS ACT",
        "source": "https://mola.gov.gy/laws-of-guyana",
        "type": {
            "name": "section",
            "representation": "1",
            "title": "Short title. ",
            "context": "PENSIONS ACT under Short title. 1. This Act may be cited as the Pensions Act.",
            "description": "This Act may be cited as the Pensions Act."
        }
    },
    {
        "act": "PENSIONS ACT",
        "source": "https://mola.gov.gy/laws-of-guyana",
        "type": {
            "name": "section",
            "representation": "2",
            "title": "Interpretation. ",
            "context": "PENSIONS ACT under Interpretation. 2.  In this Act  inducement allowance means the inducement allowance referred to in (a) of the Schedule to the Overseas Service Agreement Act;  other public service means public service not under the Government of Guyana;  pensionable emoluments  (a) in respect of service in Guyana includes  (i)        salary;  (ii)       personal allowance; and  (iii)      duty allowance paid to a           Permanent Secretary:  Provided that this subparagraph shall not be construed as applying to the Solicitor-General;  (iv) surcharge allowance paid to a pilot employed in the Transport an Harbours LAWS OF GUYANA Pensions Cap. 27:02 5  L.R.O. 1/2012                                                 Department; (v) such portion of the inducement  allowance as the Government of the United Kingdom and the Government of Guyana may, from time to  time,  by  agreement determine to be pensionable,   but does not include any duty allowance paid to any other officer, or any entertainment allowance or any other emoluments whatever;  (b) in respect of other public service means emoluments which   count for pension in accordance with the law or regulations in force in such service;  pensionable office means  (a) in respect of service in Guyana an office which has been declared by the Minister with the approval of the National Assembly by a notification published in the Gazette to be pensionable:  Provided that any office declared to be pensionable under this section may be declared at any time by the Minister with the approval of the National Assembly by a notification published in the Gazette to be no longer pensionable due regard being had to existing rights;  (b) in respect of other public service an office which is a pensionable office LAWS OF GUYANA 6 27:02 Pensions  L.R.O. 1/2012                                                 under the law or regulations in force in such service;  personal  allowance  means  a  special  addition  to  such  salary granted personally to the holder for the time being of the office and expressed to be pensionable;  public service or service means  (a) service in a civil capacity under the Government of Guyana or of any other Commonwealth country or territory;  (b) service under the East Africa High Commission, the East African Railways and Harbours Administration, the East African   Posts and Telecommunications Administration or the East African Common Services Organisation;  (c) service which is pensionable  (i)  under the Over sea Superannuation Scheme;  (ii) under any Acts relating to the superannuation of teachers in the United Kingdom or Northern Ireland; (iii) under a local authority in the United Kingdom or Northern Ireland; or (iv) under the National Health Service of the United Kingdom or Northern Ireland Health Service;  LAWS OF GUYANA Pensions Cap. 27:02 7  L.R.O. 1/2012       5 and 6 Eliz 2c. 62           S.I. 1996/2323                      Grant of pensions, etc regulated by Act.    Pensions not of right. (d) except for the purposes of computation of a pension or gratuity and of section 12 of this Act, service in respect of which a pension may be granted under the Governors Pensions Act, 1957, of the United Kingdom;  (e) service as the holder of the office of President, Vice- President, Justice of Appeal, Registrar, officer or servant of the Court of Appeal for Eastern Africa established by the Eastern Africa Court of Appeal Order in Council, 1961, of the United Kingdom;  (f) service in the service of the Interim Commissioner for the West Indies; and  (g) any other service that the Minister has determined to be public service for the purpose of this Act;  the Regulations means the regulations contained in the Schedule;  salary means the salary attached to an office;  service  of  Guyana  means  service  in  a  civil  capacity  under the Government of Guyana.",
            "description": [
                {
                    "representation": "(a)",
                    "description": "service in a civil capacity under the Government of Guyana or of any other Commonwealth country or territory;"
                },
                {
                    "representation": "(i)",
                    "description": "under the Over sea Superannuation Scheme;"
                },
                {
                    "representation": "(v)",
                    "description": "such portion of the inducement  allowance as the Government of the United Kingdom and the Government of Guyana may, from time to  time,  by  agreement determine to be pensionable,   but does not include any duty allowance paid to any other officer, or any entertainment allowance or any other emoluments whatever;"
                },
                {
                    "representation": "(b)",
                    "description": "service under the East Africa High Commission, the East African Railways and Harbours Administration, the East African   Posts and Telecommunications Administration or the East African Common Services Organisation;"
                },
                {
                    "representation": "(c)",
                    "description": "service which is pensionable"
                },
                {
                    "representation": "(d)",
                    "description": "except for the purposes of computation of a pension or gratuity and of section 12 of this Act, service in respect of which a pension may be granted under the Governors Pensions Act, 1957, of the United Kingdom;"
                },
                {
                    "representation": "(e)",
                    "description": "service as the holder of the office of President, Vice- President, Justice of Appeal, Registrar, officer or servant of the Court of Appeal for Eastern Africa established by the Eastern Africa Court of Appeal Order in Council, 1961, of the United Kingdom;"
                },
                {
                    "representation": "(f)",
                    "description": "service in the service of the Interim Commissioner for the West Indies; and"
                },
                {
                    "representation": "(g)",
                    "description": "any other service that the Minister has determined to be public service for the purpose of this Act;  the Regulations means the regulations contained in the Schedule;  salary means the salary attached to an office;  service  of  Guyana  means  service  in  a  civil  capacity  under the Government of Guyana."
                }
            ]
        }
    },
    {
        "act": "PENSIONS ACT",
        "source": "https://mola.gov.gy/laws-of-guyana",
        "type": {
            "name": "section",
            "representation": "3",
            "title": "Grant of pensions, etc., regulated by Act. ",
            "context": "PENSIONS ACT under Grant of pensions, etc., regulated by Act. 3. The grant by the President of pensions, gratuities and other allowances to persons to whom this Act applies or of a gratuity to the personal representatives of any such person shall be regulated by this Act.",
            "description": "The grant by the President of pensions, gratuities and other allowances to persons to whom this Act applies or of a gratuity to the personal representatives of any such person shall be regulated by this Act."
        }
    },
    {
        "act": "PENSIONS ACT",
        "source": "https://mola.gov.gy/laws-of-guyana",
        "type": {
            "name": "section",
            "representation": "4",
            "title": "Pensions not of right. ",
            "context": "PENSIONS ACT under Pensions not of right. 4. (1) No officer shall have an absolute right to compensation for past services or to pension, gratuity or LAWS OF GUYANA 8 27:02 Pensions  L.R.O. 1/2012 [12 of 1976]                         Preservation of pension rights.  [22 of 1968]        Service as Ombudsman to be pensionable service.         other allowance under this Act, nor shall anything herein or in such regulations contained limit the right of the State to dismiss any officer without compensation.  (2) Where it is established to the satisfaction of the President that an officer has been guilty of negligence, irregularity or misconduct the pension, gratuity or other allowance may, subject to article 214 of the Constitution, be reduced or altogether withheld.  (3) No officer shall be granted a pension, gratuity or other allowance under this Act without a certificate from the head of his department or, if he is himself the head of a department, from the Permanent   Secretary of his Ministry and, if he is the  head of  a department not under the control of a Minister or is a Permanent Secretary from the President, to the effect that he has discharged his office with such diligence and fidelity as to justify the grant to him of such pension, gratuity or other allowance.",
            "description": [
                {
                    "representation": "(1)",
                    "description": "No officer shall have an absolute right to compensation for past services or to pension, gratuity or LAWS OF GUYANA 8 27:02 Pensions  L.R.O. 1/2012 [12 of 1976]                         Preservation of pension rights.  [22 of 1968]        Service as Ombudsman to be pensionable service.         other allowance under this Act, nor shall anything herein or in such regulations contained limit the right of the State to dismiss any officer without compensation."
                },
                {
                    "representation": "(2)",
                    "description": "Where it is established to the satisfaction of the President that an officer has been guilty of negligence, irregularity or misconduct the pension, gratuity or other allowance may, subject to article 214 of the Constitution, be reduced or altogether withheld."
                },
                {
                    "representation": "(3)",
                    "description": "No officer shall be granted a pension, gratuity or other allowance under this Act without a certificate from the head of his department or, if he is himself the head of a department, from the Permanent   Secretary of his Ministry and, if he is the  head of  a department not under the control of a Minister or is a Permanent Secretary from the President, to the effect that he has discharged his office with such diligence and fidelity as to justify the grant to him of such pension, gratuity or other allowance."
                }
            ]
        }
    },
    {
        "act": "PENSIONS ACT",
        "source": "https://mola.gov.gy/laws-of-guyana",
        "type": {
            "name": "section",
            "representation": "5",
            "title": "Preservation of pension rights. ",
            "context": "PENSIONS ACT under Preservation of pension rights. 5. Where an officer is seconded or temporarily transferred for duty in the service of Guyana from a pensionable office, to an office or employment which would not entitle him to pension under this Act, the period during which he shall serve in such office or employment as aforesaid shall count for pension as if the officer had not been seconded or temporarily transferred unless the President shall in any case otherwise decide.",
            "description": "Where an officer is seconded or temporarily transferred for duty in the service of Guyana from a pensionable office, to an office or employment which would not entitle him to pension under this Act, the period during which he shall serve in such office or employment as aforesaid shall count for pension as if the officer had not been seconded or temporarily transferred unless the President shall in any case otherwise decide."
        }
    },
    {
        "act": "PENSIONS ACT",
        "source": "https://mola.gov.gy/laws-of-guyana",
        "type": {
            "name": "section",
            "representation": "6",
            "title": "Service as Ombudsman to be pensionable service. ",
            "context": "PENSIONS ACT under Service as Ombudsman to be pensionable service. 6. (1)  Where  an  officer  serving  in  a  pensionable  office is appointed to the office of Ombudsman, his service pursuant to such appointment, shall be deemed to be service in a pensionable office for all intents and purposes, the generality of which shall not be prejudiced by anything in the following provisions of this section; and, upon his retirement in circumstances in which a pension may accordingly be granted to him under this Act, or might be so granted but for any failure of the circumstances of his retirement mentioned in subsection (2) to otherwise LAWS OF GUYANA Pensions Cap. 27:02 9  L.R.O. 1/2012                                                 conform to the requirements of this Act, he shall be granted the pension in accordance with this Act, which shall be construed with such adaptations and modifications as are necessary for the purpose.  (2) In subsection (1), retirement includes relinquishment of the office of Ombudsman in circumstances where the officer appointed as aforesaid  (a) is not, at the expiration of his term of office as Ombudsman, prior to his attainment of the age of 65 years, reappointed to that office or appointed to any public or other office the conditions of which taken as a whole are no less  favourable  than  those  appertaining to the office of Ombudsman, although he is not disqualified by reason of infirmity of body or mind for either such appointment; or  (b) has, on or before the expiration of his term of office as Ombudsman, attained an age at which he may by virtue of this Act, apart from this section, be permitted to retire from the public service and he intimates in writing to the President that on the expiration of his term of office as Ombudsman he wishes neither to be reappointed to the office of Ombudsman nor to  be  considered  for  appointment  to  any public or other office but to so retire,   in which circumstances he shall, for the purposes of subsection (1), be deemed to have retired immediately after the date on which he so relinquished the office of LAWS OF GUYANA 10 27:02 Pensions  L.R.O. 1/2012          Service not qualifying for pension. [20 of 1971]                      Circumstances in which pensions may  be granted. [12 of 1976]           Ombudsman or on which any period of leave taken by him upon such relinquishment expired, whichever is later, and, in the case of circumstances mentioned in paragraph (a), after completing such length of service in pensionable office as is required for the granting to him of a maximum pension consistently with section 12(1).",
            "description": [
                {
                    "representation": "(1)",
                    "description": "Where  an  officer  serving  in  a  pensionable  office is appointed to the office of Ombudsman, his service pursuant to such appointment, shall be deemed to be service in a pensionable office for all intents and purposes, the generality of which shall not be prejudiced by anything in the following provisions of this section; and, upon his retirement in circumstances in which a pension may accordingly be granted to him under this Act, or might be so granted but for any failure of the circumstances of his retirement mentioned in subsection"
                },
                {
                    "representation": "(2)",
                    "description": "In subsection"
                },
                {
                    "representation": "(a)",
                    "description": "is not, at the expiration of his term of office as Ombudsman, prior to his attainment of the age of 65 years, reappointed to that office or appointed to any public or other office the conditions of which taken as a whole are no less  favourable  than  those  appertaining to the office of Ombudsman, although he is not disqualified by reason of infirmity of body or mind for either such appointment; or"
                },
                {
                    "representation": "(b)",
                    "description": "has, on or before the expiration of his term of office as Ombudsman, attained an age at which he may by virtue of this Act, apart from this section, be permitted to retire from the public service and he intimates in writing to the President that on the expiration of his term of office as Ombudsman he wishes neither to be reappointed to the office of Ombudsman nor to  be  considered  for  appointment  to  any public or other office but to so retire,   in which circumstances he shall, for the purposes of subsection"
                }
            ]
        }
    },
    {
        "act": "PENSIONS ACT",
        "source": "https://mola.gov.gy/laws-of-guyana",
        "type": {
            "name": "section",
            "representation": "7",
            "title": "Service not qualifying for pension. ",
            "context": "PENSIONS ACT under Service not qualifying for pension. 7. Save as otherwise provided in the Regulations no pension, gratuity or other allowance shall be granted to any officer in respect of any service  (a) while  on  probation  or  agreement  unless  without break of service he is confirmed in a pensionable office in Guyana or in an office in other public service which is at the time of confirmation pensionable under the pension law or regulations applicable to such service; or  (b) while under the age of eighteen years:  Provided that any break in service which may be disregarded under regulation 6 of the Regulations may likewise be disregarded in determining whether the officer is confirmed in a pensionable office without break of service.",
            "description": [
                {
                    "representation": "(a)",
                    "description": "while  on  probation  or  agreement  unless  without break of service he is confirmed in a pensionable office in Guyana or in an office in other public service which is at the time of confirmation pensionable under the pension law or regulations applicable to such service; or"
                },
                {
                    "representation": "(b)",
                    "description": "while under the age of eighteen years:  Provided that any break in service which may be disregarded under regulation 6 of the Regulations may likewise be disregarded in determining whether the officer is confirmed in a pensionable office without break of service."
                }
            ]
        }
    },
    {
        "act": "PENSIONS ACT",
        "source": "https://mola.gov.gy/laws-of-guyana",
        "type": {
            "name": "section",
            "representation": "8",
            "title": "Circumstances in which pensions may be granted. ",
            "context": "PENSIONS ACT under Circumstances in which pensions may be granted. 8. No pension, gratuity or other allowance shall be granted to any officer except on his retirement from the public service in one of the following cases  (a)  on or after attaining the age of fifty-five years or, in special cases with the approval of the Minister on or after attaining the age of fifty years or, in special cases as mentioned in the proviso to section 11, or in the case of transfer to other public service on or after  attaining  the  LAWS OF GUYANA Pensions Cap. 27:02 11  L.R.O. 1/2012                                                   age  at  which  an officer is permitted by the law or regulations of the service in which he is last employed to retire on pension or gratuity or on or after attaining the age of fifty-five years, whichever is earlier;  (b) on the abolition of his office; or  (c) on compulsory retirement for the purpose of facilitating improvement in the organisation of  the department to which he belongs by which greater efficiency or economy can be effected; or  (d) on  medical  evidence  to  the  satisfaction  of  the Minister that he is incapable  by reason of some infirmity of mind or body of discharging the duties of his office and that such infirmity is likely to be permanent; or  (e) on termination of employment in the public interest as provided in this Act:  Provided that  (a)    where an officer retires from the public service under paragraph (d) after completing ten years pensionable service (reckoned otherwise than in accordance with regulation 7(2)(b)) the pension, gratuity or other allowance granted to  him shall, save as otherwise provided under regulation 7, LAWS OF GUYANA 12 27:02 Pensions  L.R.O. 1/2012                             Terminating employment in the public interest. [2 of 1970]           Additional circumstances in which pension may be granted. be computed as though such officer had completed twenty years pensionable service  prior to retirement;  (b) after the enactment of the Pensions (Amendment) Act 1976, a gratuity may be granted in accordance with regulations 18 and 27 of the Pensions Regulations  1957  to  an  unmarried  female  officer who  is  in  the  public  service  at  the  time  of  the enactment of the said Act and who resigns from the public service on or with a view to marriage notwithstanding that she is not otherwise eligible under this section for the grant of any pension, gratuity or other allowance.",
            "description": [
                {
                    "representation": "(a)",
                    "description": "where an officer retires from the public service under paragraph"
                },
                {
                    "representation": "(b)",
                    "description": "after the enactment of the Pensions"
                },
                {
                    "representation": "(c)",
                    "description": "on compulsory retirement for the purpose of facilitating improvement in the organisation of  the department to which he belongs by which greater efficiency or economy can be effected; or"
                },
                {
                    "representation": "(d)",
                    "description": "after completing ten years pensionable service"
                },
                {
                    "representation": "(e)",
                    "description": "on termination of employment in the public interest as provided in this Act:  Provided that"
                }
            ]
        }
    },
    {
        "act": "PENSIONS ACT",
        "source": "https://mola.gov.gy/laws-of-guyana",
        "type": {
            "name": "section",
            "representation": "9",
            "title": "Terminating employment in the public interest. ",
            "context": "PENSIONS ACT under Terminating employment in the public interest. 9.  Where an officers service is terminated on the ground that, having regard to the conditions of the public service, the usefulness of the officer thereto and all the other circumstances of the case, such termination is desirable in the public interest, and a pension, gratuity or other allowance cannot otherwise be granted to him under this Act, the Minister may, if he thinks fit, grant such pension, gratuity or other allowance as he thinks just and proper, not exceeding in amount that for which the officer would be eligible if he had retired from the public service in the circumstances described in paragraph (b) or (c) of the last preceding section.",
            "description": [
                {
                    "representation": "(b)",
                    "description": "or"
                },
                {
                    "representation": "(c)",
                    "description": "of the last preceding section."
                }
            ]
        }
    },
    {
        "act": "PENSIONS ACT",
        "source": "https://mola.gov.gy/laws-of-guyana",
        "type": {
            "name": "section",
            "representation": "10",
            "title": "Additional circumstances in which pension may be granted. ",
            "context": "PENSIONS ACT under Additional circumstances in which pension may be granted. 10. Where the service of an officer who holds a pensionable office is terminated by virtue of his resignation from the public service, the Minister may, if he thinks fit having due regard to the special circumstances of the case, LAWS OF GUYANA Pensions Cap. 27:02 13  L.R.O. 1/2012 [22 of 1968]     Age for compulsory retirement.  [12 of 1976]         Maximum pension grantable. [6 of 1981 9 of 1990]                            grant him such pension, gratuity or other allowance as the Minister considers just and proper as if he were an officer to whom section 9 applies.",
            "description": "Where the service of an officer who holds a pensionable office is terminated by virtue of his resignation from the public service, the Minister may, if he thinks fit having due regard to the special circumstances of the case, LAWS OF GUYANA Pensions Cap. 27:02 13  L.R.O. 1/2012 [22 of 1968]     Age for compulsory retirement.  [12 of 1976]         Maximum pension grantable. [6 of 1981 9 of 1990]                            grant him such pension, gratuity or other allowance as the Minister considers just and proper as if he were an officer to whom section 9 applies."
        }
    },
    {
        "act": "PENSIONS ACT",
        "source": "https://mola.gov.gy/laws-of-guyana",
        "type": {
            "name": "section",
            "representation": "11",
            "title": "Age for compulsory retirement. ",
            "context": "PENSIONS ACT under Age for compulsory retirement. 11. The Public Service Commission may require an officer to retire from the service of Guyana on or after attaining the age of fifty- five years:  Provided that in special cases the Public Service Commission may require an officer to retire from the service of Guyana at any time on or after attaining the age of fifty years.",
            "description": "The Public Service Commission may require an officer to retire from the service of Guyana on or after attaining the age of fifty- five years:  Provided that in special cases the Public Service Commission may require an officer to retire from the service of Guyana at any time on or after attaining the age of fifty years."
        }
    },
    {
        "act": "PENSIONS ACT",
        "source": "https://mola.gov.gy/laws-of-guyana",
        "type": {
            "name": "section",
            "representation": "12",
            "title": "Maximum pension grantable. ",
            "context": "PENSIONS ACT under Maximum pension grantable. 12. (1) A pension granted to an officer under this Act shall not exceed two-thirds of the highest pensionable emoluments drawn by him at any time in the course of his service in Guyana.  (2) Where the officer has been or is granted a pension or pensions in respect of other public service he may be granted the full pension for which he is eligible in respect of his service in Guyana but  no  person  may  at  any  time  draw  from  the  public  funds  of Guyana an amount of pension which when added to the amount of any pension or pensions drawn in respect of other public service exceeds two-thirds of the highest pensionable emoluments drawn by such person at any time in the course of his service in Guyana or in other public service:  Provided that where such a person receives in respect of some period of public service both a gratuity and a pension the amount of such pension shall be deemed for the purpose of this subsection to be four-thirds of its actual amount.  (3) For the purpose of the preceding subsections an additional pension granted in respect of injury shall not be taken into account but where the officer is granted such an additional pension the amount of such additional pension LAWS OF GUYANA 14 27:02 Pensions  L.R.O. 1/2012                                                 which he may draw shall not exceed one-sixth of his highest pensionable emoluments at any time in the course of his public  service  by more than the sum by which the amount of his pension or pensions apart from such additional pension falls short of two-thirds of such highest emoluments.  (4) Where an officer continues in the public service after attaining the age of fifty-five years and where the Minister responsible for the public service certifies in writing that such continued  service  was  at  the  request  of  the  Government,  that officer  (a)  notwithstanding anything in the foregoing provisions of this section, may be granted a pension computed after taking into account the entire period of service rendered by him whether or not the pension so payable exceeds the limit described in those provisions:  Provided that the pension granted to him under this subsection shall not exceed the highest annual rate of salary payable to him at any time in a pensionable office in Guyana;  (b) although still in the service may, at his option exercisable in accordance with section 14 (without the right of revocation granted thereby), be paid an amount not exceeding the amount which would have been payable as gratuity to him under  that section if he had retired on attaining the age of fifty-five years, and any amount so paid shall be set off against the superannuation benefits granted to him on his LAWS OF GUYANA Pensions Cap. 27:02 15  L.R.O. 1/2012                                     9 of 1990            retirement or against any gratuity payable on his death to his legal personal representative.  (5) Subject to the provisions of subsections (6), (7) and (8), where   pension computed under regulation 16 of the Regulations exceeds the maximum pension specified in subsection (1), the officer referred to in that regulation (hereafter in this section referred to as the said officer) may, notwithstanding anything contained in that subsection, be granted the pension so computed:  Provided that the pension granted to the said officer for one year shall not exceed the highest annual rate of pensionable emoluments payable to him at any time in the course of his service in a pensionable office in the service of Guyana:  Provided further that subsections (2) and (3) shall apply in respect of the said officer as if the words two-thirds of, wherever they occur, were deleted.  (6) Subsection (5) shall not apply in the case of the said officer unless  (a) the   subsequent   retirement   referred   to   in regulation 16 of the Regulations has taken effect on or after the commencement of the Pensions (Amendment) Act 1990;  (b) the appropriate Minister certifies  (i) that the re-employment  was to maintain  or improve  the  efficiency of the Ministry or Department of the Government, or the other public service, in which the LAWS OF GUYANA 16 27:02 Pensions  L.R.O. 1/2012                                                 said officer was re-employed, or to provide service at an acceptable level; and (ii) that prompt efforts were made to find a person, who has not attained the age of fifty-five years and is suitably qualified therefor, for appointment to the  office  in  which  the  said officer was re-employed and the efforts were unsuccessful;  (c) notwithstanding that the pension granted to the said officer in respect of his service prior to the   re-employment has not been suspended under section 15(2) during the period of his re-employment, any sums received by him by way of such pension is refunded by him to the Government within such   time   as   may   be   specified   by   the Minister:  Provided that where the re-employment was before the date of  the  enactment  of  the  Pensions  (Amendment)  Act  1990,  the Minister may direct that this paragraph shall not apply to the said officer;  (d) any gratuity paid to the said officer in respect of his service in the office he held in the service of Guyana, prior to the date of his re-employment referred to in regulation 16 of the Regulations, shall be set off against the superannuation benefits granted to LAWS OF GUYANA Pensions Cap. 27:02 17  L.R.O. 1/2012                                              Officers with service as teachers. c. 39:05 [7 of 1979] him on his subsequent retirement from the service of Guyana referred to in that regulation or against any gratuity payable on his death to his legal personal representative.  (7) For the purpose of computing any gratuity and reduced pension payable, under section 14, to an officer referred to in regulation 16 of the Regulations, the reference in the opening part of subsection (1) of that section to pension granted under this Act shall be deemed to be a reference to a pension computed in accordance with subsection (5) of this section, read with that regulation.  (8) In subsection (6) appropriate Minister means,  (a) where the re-employment referred to in that subsection was prior to the date of the enactment of the Pensions (Amendment) Act 1990, the Minister assigned responsibility for the Ministry or Department of the Government, or the other public service, in which the said officer was re-employed; and  (b) where the re-employment referred to in that subsection was   on or after the date of the enactment of the Pensions (Amendment) Act 1990, the  Minister  assigned  responsibility for the Public Service Ministry.",
            "description": [
                {
                    "representation": "(1)",
                    "description": "of that section to pension granted under this Act shall be deemed to be a reference to a pension computed in accordance with subsection"
                },
                {
                    "representation": "(2)",
                    "description": "and"
                },
                {
                    "representation": "(3)",
                    "description": "shall apply in respect of the said officer as if the words two-thirds of, wherever they occur, were deleted."
                },
                {
                    "representation": "(4)",
                    "description": "Where an officer continues in the public service after attaining the age of fifty-five years and where the Minister responsible for the public service certifies in writing that such continued  service  was  at  the  request  of  the  Government,  that officer"
                },
                {
                    "representation": "(a)",
                    "description": "where the re-employment referred to in that subsection was prior to the date of the enactment of the Pensions"
                },
                {
                    "representation": "(b)",
                    "description": "where the re-employment referred to in that subsection was   on or after the date of the enactment of the Pensions"
                },
                {
                    "representation": "(5)",
                    "description": "of this section, read with that regulation."
                },
                {
                    "representation": "(7)",
                    "description": "For the purpose of computing any gratuity and reduced pension payable, under section 14, to an officer referred to in regulation 16 of the Regulations, the reference in the opening part of subsection"
                },
                {
                    "representation": "(6)",
                    "description": "appropriate Minister means,"
                },
                {
                    "representation": "(i)",
                    "description": "that the re-employment  was to maintain  or improve  the  efficiency of the Ministry or Department of the Government, or the other public service, in which the LAWS OF GUYANA 16 27:02 Pensions  L.R.O. 1/2012                                                 said officer was re-employed, or to provide service at an acceptable level; and"
                },
                {
                    "representation": "(c)",
                    "description": "notwithstanding that the pension granted to the said officer in respect of his service prior to the   re-employment has not been suspended under section 15(2) during the period of his re-employment, any sums received by him by way of such pension is refunded by him to the Government within such   time   as   may   be   specified   by   the Minister:  Provided that where the re-employment was before the date of  the  enactment  of  the  Pensions"
                },
                {
                    "representation": "(d)",
                    "description": "any gratuity paid to the said officer in respect of his service in the office he held in the service of Guyana, prior to the date of his re-employment referred to in regulation 16 of the Regulations, shall be set off against the superannuation benefits granted to LAWS OF GUYANA Pensions Cap. 27:02 17  L.R.O. 1/2012                                              Officers with service as teachers. c. 39:05 [7 of 1979] him on his subsequent retirement from the service of Guyana referred to in that regulation or against any gratuity payable on his death to his legal personal representative."
                },
                {
                    "representation": "(8)",
                    "description": "In subsection"
                }
            ]
        }
    },
    {
        "act": "PENSIONS ACT",
        "source": "https://mola.gov.gy/laws-of-guyana",
        "type": {
            "name": "section",
            "representation": "13",
            "title": "Officers with service as teachers. ",
            "context": "PENSIONS ACT under Officers with service as teachers. 13. Where the service of a public officer has been preceded by  service  as  a  teacher  in  a  school  within  the  meaning  of  the Teachers Pensions Act, such service as a teacher shall be taken into account in computing pension or gratuity under this Act: LAWS OF GUYANA 18 27:02 Pensions  L.R.O. 1/2012                           Option to take reduced pension with gratuity.                     Provided that  (a) where such service as a teacher has not immediately preceded service as a public officer, such service as a teacher shall not be taken into account in computing pension or gratuity under this Act, except with the approval of the Minister;  (b) such service  as  a  teacher  is  not  reckoned  in  the computation of pension or gratuity payable to the officer under the Teachers Pensions Act.",
            "description": [
                {
                    "representation": "(a)",
                    "description": "where such service as a teacher has not immediately preceded service as a public officer, such service as a teacher shall not be taken into account in computing pension or gratuity under this Act, except with the approval of the Minister;"
                },
                {
                    "representation": "(b)",
                    "description": "such service  as  a  teacher  is  not  reckoned  in  the computation of pension or gratuity payable to the officer under the Teachers Pensions Act."
                }
            ]
        }
    },
    {
        "act": "PENSIONS ACT",
        "source": "https://mola.gov.gy/laws-of-guyana",
        "type": {
            "name": "section",
            "representation": "14",
            "title": "Option to take reduced pension with gratuity. ",
            "context": "PENSIONS ACT under Option to take reduced pension with gratuity. 14. (1) An officer to whom a pension is granted under this Act may, at his option exercisable as hereinafter provided, be paid in lieu of such pension a pension at the rate of three-fourths of such pension together with a gratuity equal to twelve and one-half times the amount by which such pension is reduced:  Provided that in the application of this section to cases where the limitation prescribed by section 12(2) operates, the words such pension shall mean the amount of pension which the officer might have drawn from the public funds of Guyana if he had not exercised his option under this section.  (2) An option exercisable in accordance   with   this section  (a) shall  be  exercised  or  revoked  by  notice in writing addressed to the Minister or, in the case  of  officers  in other  public  services  to the Crown Agents for Overseas Governments and Administrations; LAWS OF GUYANA Pensions Cap. 27:02 19  L.R.O. 1/2012                       Liability of pensioners to be called upon to take further employment, and suspension of pension on re-employment. [9 of 1990]              (b) shall be deemed to have been exercised or revoked on the date on which such notice is received;  (c) shall be exercisable, and if exercised, may be revoked, on or before the date of the officers retirement  or,  with  the  permission  of  the Minister, at any time between that date and the date of the final award of the pension granted to him under this Act.  (3) An option for a gratuity and a reduced pension under this Act exercised, or deemed to have been exercised, in accordance with any provisions in force before the enactment of this section shall be deemed to have been exercised in accordance with this section and may be revoked accordingly.",
            "description": [
                {
                    "representation": "(1)",
                    "description": "An officer to whom a pension is granted under this Act may, at his option exercisable as hereinafter provided, be paid in lieu of such pension a pension at the rate of three-fourths of such pension together with a gratuity equal to twelve and one-half times the amount by which such pension is reduced:  Provided that in the application of this section to cases where the limitation prescribed by section 12(2) operates, the words such pension shall mean the amount of pension which the officer might have drawn from the public funds of Guyana if he had not exercised his option under this section."
                },
                {
                    "representation": "(2)",
                    "description": "An option exercisable in accordance   with   this section"
                },
                {
                    "representation": "(a)",
                    "description": "shall  be  exercised  or  revoked  by  notice in writing addressed to the Minister or, in the case  of  officers  in other  public  services  to the Crown Agents for Overseas Governments and Administrations; LAWS OF GUYANA Pensions Cap. 27:02 19  L.R.O. 1/2012                       Liability of pensioners to be called upon to take further employment, and suspension of pension on re-employment. [9 of 1990]"
                },
                {
                    "representation": "(b)",
                    "description": "shall be deemed to have been exercised or revoked on the date on which such notice is received;"
                },
                {
                    "representation": "(c)",
                    "description": "shall be exercisable, and if exercised, may be revoked, on or before the date of the officers retirement  or,  with  the  permission  of  the Minister, at any time between that date and the date of the final award of the pension granted to him under this Act."
                },
                {
                    "representation": "(3)",
                    "description": "An option for a gratuity and a reduced pension under this Act exercised, or deemed to have been exercised, in accordance with any provisions in force before the enactment of this section shall be deemed to have been exercised in accordance with this section and may be revoked accordingly."
                }
            ]
        }
    },
    {
        "act": "PENSIONS ACT",
        "source": "https://mola.gov.gy/laws-of-guyana",
        "type": {
            "name": "section",
            "representation": "15",
            "title": "Liability of pensioners to be called upon to take further employment, and suspension of pension on re-employment. ",
            "context": "PENSIONS ACT under Liability of pensioners to be called upon to take further employment, and suspension of pension on re-employment. 15. (1) Save as otherwise provided in the Regulations, every pension  granted  to  an  officer  shall  be  subject  to  the  following condition:  Unless or until he has attained the age of fifty years, he may, if physically fit for service, be called upon to accept, in lieu of his pension, an office in the public service, not less in value, due regard being had to all the circumstances, than the office which he had at the date of the grant of his pension.  If a pensioner so called upon declines to accept the office for which he has been selected by the appropriate   Commission, the payment of his pension may be suspended until he has attained the age of fifty years.  (2)  If  an  officer  to  whom  a  pension  has  been  granted under this Act is re-employed in the same or another LAWS OF GUYANA 20 27:02 Pensions  L.R.O. 1/2012                              Gratuity affected by re- employment. [12 of 1976]           Pensions, etc., not to be assignable.          Pensions, etc., to cease on bankruptcy.                 office in the public service, the  payment  of  his  pension  may,  if  the  President thinks fit,  be suspended during the period of his re-employment.  (3) For the avoidance of doubt it is hereby declared that subsection (2) shall apply whether or not the re-employment was consequent upon being called upon, under subsection (1), to accept such re-employment in the circumstances mentioned therein.",
            "description": [
                {
                    "representation": "(1)",
                    "description": "Save as otherwise provided in the Regulations, every pension  granted  to  an  officer  shall  be  subject  to  the  following condition:  Unless or until he has attained the age of fifty years, he may, if physically fit for service, be called upon to accept, in lieu of his pension, an office in the public service, not less in value, due regard being had to all the circumstances, than the office which he had at the date of the grant of his pension.  If a pensioner so called upon declines to accept the office for which he has been selected by the appropriate   Commission, the payment of his pension may be suspended until he has attained the age of fifty years."
                },
                {
                    "representation": "(2)",
                    "description": "shall apply whether or not the re-employment was consequent upon being called upon, under subsection"
                },
                {
                    "representation": "(3)",
                    "description": "For the avoidance of doubt it is hereby declared that subsection"
                }
            ]
        }
    },
    {
        "act": "PENSIONS ACT",
        "source": "https://mola.gov.gy/laws-of-guyana",
        "type": {
            "name": "section",
            "representation": "16",
            "title": "Gratuity affected by re-employment. ",
            "context": "PENSIONS ACT under Gratuity affected by re-employment. 16. If any officer to whom a gratuity without pension has been granted under this Act is re-appointed to any office in the service of Guyana or in other public service his previous service may be taken into account for the purposes of pension if he refunds the gratuity on such re-appointment, or later with the permission of the Minister.",
            "description": "If any officer to whom a gratuity without pension has been granted under this Act is re-appointed to any office in the service of Guyana or in other public service his previous service may be taken into account for the purposes of pension if he refunds the gratuity on such re-appointment, or later with the permission of the Minister."
        }
    },
    {
        "act": "PENSIONS ACT",
        "source": "https://mola.gov.gy/laws-of-guyana",
        "type": {
            "name": "section",
            "representation": "17",
            "title": "Pensions, etc., not to be assignable. ",
            "context": "PENSIONS ACT under Pensions, etc., not to be assignable. 17. No pension, gratuity or other allowance granted under this Act shall be assignable or transferable or liable to be attached, sequestered or levied upon for or in respect of any debt or claim whatsoever other than a debt due to the Government at the time of the  officers retirement.",
            "description": "No pension, gratuity or other allowance granted under this Act shall be assignable or transferable or liable to be attached, sequestered or levied upon for or in respect of any debt or claim whatsoever other than a debt due to the Government at the time of the  officers retirement."
        }
    },
    {
        "act": "PENSIONS ACT",
        "source": "https://mola.gov.gy/laws-of-guyana",
        "type": {
            "name": "section",
            "representation": "18",
            "title": "Pensions, etc., to cease on bankruptcy. ",
            "context": "PENSIONS ACT under Pensions, etc., to cease on bankruptcy. 18. If any officer to whom a pension or other allowance has been granted under this Act is adjudicated a bankrupt or is declared insolvent then the pension or allowance shall forthwith cease:  Provided always that in any case where a pension or allowance ceases by reason of the bankruptcy or insolvency of the pensioner, the President from time to time during the remainder of the pensioners life or  during such shorter period or periods either continuous  or  discontinuous  as  the  President  shall  think  fit  may cause all or any part of the moneys to which the pensioner would have  been  entitled  by  way  of  pension  or  allowance  had  he  not become bankrupt or insolvent to be paid to or applied for the maintenance and personal support or benefit of all or any to the exclusion of the other or others of the following persons LAWS OF GUYANA Pensions Cap. 27:02 21  L.R.O. 1/2012        Pension, etc., to cease on conviction.                                                 Pensions, etc., to cease on accepting certain namely, the pensioner and any wife, child or children of his in such proportions and manner as the President as the case may be thinks proper.",
            "description": "If any officer to whom a pension or other allowance has been granted under this Act is adjudicated a bankrupt or is declared insolvent then the pension or allowance shall forthwith cease:  Provided always that in any case where a pension or allowance ceases by reason of the bankruptcy or insolvency of the pensioner, the President from time to time during the remainder of the pensioners life or  during such shorter period or periods either continuous  or  discontinuous  as  the  President  shall  think  fit  may cause all or any part of the moneys to which the pensioner would have  been  entitled  by  way  of  pension  or  allowance  had  he  not become bankrupt or insolvent to be paid to or applied for the maintenance and personal support or benefit of all or any to the exclusion of the other or others of the following persons LAWS OF GUYANA Pensions Cap. 27:02 21  L.R.O. 1/2012        Pension, etc., to cease on conviction.                                                 Pensions, etc., to cease on accepting certain namely, the pensioner and any wife, child or children of his in such proportions and manner as the President as the case may be thinks proper."
        }
    },
    {
        "act": "PENSIONS ACT",
        "source": "https://mola.gov.gy/laws-of-guyana",
        "type": {
            "name": "section",
            "representation": "19",
            "title": "Pensions, etc., to cease on conviction. ",
            "context": "PENSIONS ACT under Pensions, etc., to cease on conviction. 19. If any officer to whom a pension or other allowance has been granted under this Act is sentenced to a term of imprisonment by any competent Court whether within or without Guyana for any crime or offence then in every such case the President may order that the pension or allowance shall forthwith cease and after the order the pension or allowance shall not be paid:  Provided that  (a) the pension  or  allowance  shall  be  restored  with retrospective  effect  in  the  case  of  a  person  who after conviction at any time receives a free pardon;  (b) where a pension or allowance ceases for the reason aforesaid the President may cause all or any part of the  moneys  to  which  the  pensioner  would  have been entitled by way of pension or allowance to be paid to or applied for the benefit of any wife, child or children of the pensioner or after the expiration of his sentence also for the benefit of the pensioner himself in the same manner precisely and subject to the  same  qualifications and restrictions as in the case of bankruptcy or insolvency hereinbefore provided.",
            "description": [
                {
                    "representation": "(a)",
                    "description": "the pension  or  allowance  shall  be  restored  with retrospective  effect  in  the  case  of  a  person  who after conviction at any time receives a free pardon;"
                },
                {
                    "representation": "(b)",
                    "description": "where a pension or allowance ceases for the reason aforesaid the President may cause all or any part of the  moneys  to  which  the  pensioner  would  have been entitled by way of pension or allowance to be paid to or applied for the benefit of any wife, child or children of the pensioner or after the expiration of his sentence also for the benefit of the pensioner himself in the same manner precisely and subject to the  same  qualifications and restrictions as in the case of bankruptcy or insolvency hereinbefore provided."
                }
            ]
        }
    },
    {
        "act": "PENSIONS ACT",
        "source": "https://mola.gov.gy/laws-of-guyana",
        "type": {
            "name": "section",
            "representation": "20",
            "title": "Pensions, etc., to cease on accepting certain appointments. ",
            "context": "PENSIONS ACT under Pensions, etc., to cease on accepting certain appointments. 20. If any officer to whom a pension or other allowance has been granted under this Act becomes either a director of any company the principal part of whose business LAWS OF GUYANA 22 27:02 Pensions  L.R.O. 1/2012 appointments.                     Gratuity where  an officer dies  in the service or after retirement.                       is in any way directly concerned  with  Guyana or an officer  or  servant  employed  in Guyana by any such company without in every such case the permission of the President in writing first had and obtained then in every such case the President may direct that the pension or allowance shall forthwith cease:  Provided always that the President on being satisfied that the person in respect of whose pension or allowance any such direction shall have been given has ceased to be a director of the company or to be employed as an officer or servant of the company in  Guyana  as  the  case  may  be,  may  give  directions  for  the restoration of the pension or allowance with retrospective effect if he shall see fit to such a date as he shall specify.",
            "description": "If any officer to whom a pension or other allowance has been granted under this Act becomes either a director of any company the principal part of whose business LAWS OF GUYANA 22 27:02 Pensions  L.R.O. 1/2012 appointments.                     Gratuity where  an officer dies  in the service or after retirement.                       is in any way directly concerned  with  Guyana or an officer  or  servant  employed  in Guyana by any such company without in every such case the permission of the President in writing first had and obtained then in every such case the President may direct that the pension or allowance shall forthwith cease:  Provided always that the President on being satisfied that the person in respect of whose pension or allowance any such direction shall have been given has ceased to be a director of the company or to be employed as an officer or servant of the company in  Guyana  as  the  case  may  be,  may  give  directions  for  the restoration of the pension or allowance with retrospective effect if he shall see fit to such a date as he shall specify."
        }
    },
    {
        "act": "PENSIONS ACT",
        "source": "https://mola.gov.gy/laws-of-guyana",
        "type": {
            "name": "section",
            "representation": "21",
            "title": "Gratuity where an officer dies in the service or after retirement. ",
            "context": "PENSIONS ACT under Gratuity where an officer dies in the service or after retirement. 21. (l)  (a) Where an officer holding a pensionable office who is not on probation or agreement, or an officer holding a non-pensionable office to which he has been transferred from a pensionable  office  in  which  he  has  been confirmed,   dies  while  in  the   service   of Guyana, it shall be lawful for the  President to grant to his legal personal representative a gratuity of an amount not exceeding either his annual pensionable emoluments, or his commuted pension gratuity if any, whichever is the greater.  (b) For the purposes of this section  (i) annual pensionable emoluments means the emoluments  which would be taken for the purpose of computing any pension or gratuity granted to the officer if he had retired  at the date of his death in the circumstances described in section 8(d); (ii) commuted pension gratuity means the gratuity,  if  any,  LAWS OF GUYANA Pensions Cap. 27:02 23  L.R.O. 1/2012                               Pensions to dependants when an officer is killed on duty. [4 of 1972 12 of 1976 19 of 1990]             which  might  have been granted to the officer under section  14  if  his  public  service  had been wholly in Guyana and  if  he  had retired  at  the  date  of  his  death  in the circumstances described in section 8(d)   and  had  elected   to  receive a gratuity and reduced pension.  (2)  Where any such officer to whom a pension, gratuity or other allowance has been granted under this Act dies after retirement from the service of Guyana and the sums paid or payable at his death on account of any pension, gratuity or other allowance in respect of any public service  are less than the amount of the annual pensionable   emoluments enjoyed   by   him   at   the   date   of   his retirement, it shall be lawful for the President to grant to his legal personal representatives a gratuity equal to the deficiency.",
            "description": [
                {
                    "representation": "(l)",
                    "description": ""
                },
                {
                    "representation": "(a)",
                    "description": "Where an officer holding a pensionable office who is not on probation or agreement, or an officer holding a non-pensionable office to which he has been transferred from a pensionable  office  in  which  he  has  been confirmed,   dies  while  in  the   service   of Guyana, it shall be lawful for the  President to grant to his legal personal representative a gratuity of an amount not exceeding either his annual pensionable emoluments, or his commuted pension gratuity if any, whichever is the greater."
                },
                {
                    "representation": "(b)",
                    "description": "For the purposes of this section"
                },
                {
                    "representation": "(i)",
                    "description": "annual pensionable emoluments means the emoluments  which would be taken for the purpose of computing any pension or gratuity granted to the officer if he had retired  at the date of his death in the circumstances described in section 8(d);"
                },
                {
                    "representation": "(d)",
                    "description": "and  had  elected   to  receive a gratuity and reduced pension."
                },
                {
                    "representation": "(2)",
                    "description": "Where any such officer to whom a pension, gratuity or other allowance has been granted under this Act dies after retirement from the service of Guyana and the sums paid or payable at his death on account of any pension, gratuity or other allowance in respect of any public service  are less than the amount of the annual pensionable   emoluments enjoyed   by   him   at   the   date   of   his retirement, it shall be lawful for the President to grant to his legal personal representatives a gratuity equal to the deficiency."
                }
            ]
        }
    },
    {
        "act": "PENSIONS ACT",
        "source": "https://mola.gov.gy/laws-of-guyana",
        "type": {
            "name": "section",
            "representation": "22",
            "title": "Pensions to dependants when an officer is killed on duty. ",
            "context": "PENSIONS ACT under Pensions to dependants when an officer is killed on duty. 22. (1) Where an officer dies as a result of injuries received   (a) in the actual discharge of his or her duty; and   (b) without his or her own default; and   (c) on   account   of   circumstances   specifically attributable to the nature of his or her duty,   while in the service of Guyana, it shall be lawful for the President to grant,  in  addition, to  the  grant, if  any,  made to  his or her  legal personal representative under section 21 LAWS OF GUYANA 24 27:02 Pensions  L.R.O. 1/2012                                                 (i) if the deceased officer leaves a spouse, a pension  to that spouse, while unmarried, at a rate not exceeding ten- sixtieths of that officers annual pensionable emoluments at the date of the injury or two hundred and sixteen dollars   a   year, whichever is the greater; (ii) if the deceased officer leaves a spouse to whom a pension is granted under the preceding paragraph and a child or children, a pension in respect of each child until such child attains the age of eighteen years, of an amount not exceeding one-eighth of the pension prescribed by the preceding paragraph; (iii) if the deceased officer leaves a child or children, but does not leave a spouse or no pension is granted to the spouse, a pension in respect of each child until such child attains the age  of eighteen years, of double the amount prescribed by the last preceding paragraph; (iv) if the deceased officer leaves a child or children and a spouse to whom a pension  is  granted  under  paragraph (i), and the spouse subsequently dies, a pension in respect of each child as from the date of the death of the spouse until such child attains the age of eighteen years, of   double   the amount LAWS OF GUYANA Pensions Cap. 27:02 25  L.R.O. 1/2012                                                 prescribed by paragraph (ii); (v) if the deceased officer does not leave a spouse, or if no pension is granted to that officers spouse, and if that officers mother or father or both were wholly or mainly dependent on him or her for support, a pension to the mother or   father or both, while without adequate means of support of an amount not exceeding the pension which might have been granted to the officers spouse, such pension being equally divided between the mother and father where payable to both; (vi) [Deleted by 19 of 1990] (vii) if the deceased officer does not leave a child or children who is or are eligible for a pension under the provisions of this section, and if any brother or sister were wholly mainly dependent on him or her for support, a pension to any such brother or sister until he or she attains the age of eighteen years while without adequate means of support, of an amount not exceeding the pension which might have been granted under paragraphs (ii) and (iii):  Provided that  (a) pension  shall not be  payable under this subsection at any time in respect LAWS OF GUYANA 26 27:02 Pensions  L.R.O. 1/2012                                                 of more than six children; and  (b)  in the case of a pension granted under paragraph (v) of this subsection, if the mother is a widow at the time of the grant of the pension and   subsequently remarries such pension shall cease as from the date of remarriage; and if it appears to the Minister at any time that the mother is adequately provided with other means of support, such pension shall cease as from such date as the Minister may determine.  (c) [Deleted by 19 of 1990]  (2) In the case of an officer not holding a pensionable office, the expression pensionable emoluments in the preceding subsection shall mean the emoluments enjoyed by him or her which would have been pensionable emoluments if the office held by him or her had been a pensionable office.  (3) For the purposes of this section  (a) the word child shall include  (i) a posthumous child; (ii) a stepchild, or a child born out of lawful wedlock before the  date of the injury, and wholly or mainly dependent upon the deceased officer for support; (iii) an adopted child adopted in a manner recognised by law before the date of injury and dependent as aforesaid;  LAWS OF GUYANA Pensions Cap. 27:02 27  L.R.O. 1/2012                                                 (b) father  includes  any  person  who,  for  the purpose of establishing that the relationship of father and child existed between himself and an officer, produces evidence to the satisfaction of the  Minister that during the lifetime of the officer he had acknowledged that he was the father of the officer;  (c) widow includes  (i) a widower; (ii) a single  woman  or  widow  who  was living with a single officer or with a widower who was an officer as his reputed wife at the date of the injury and whom the Minister treats as if she were  in  law  his  widow, and  for  the purposes of this subparagraph widower shall be construed accordingly.  (4)  If an officer proceeding by a route approved by the President to or from Guyana at the commencement or termination of his service therein, or of a period of leave therefrom, dies as a result of damage to the vessel or vehicle in which he is travelling, or of any act of violence directed against such vessel or vehicle, and the President is satisfied that such damage or act is attributable to circumstances arising out of any war in which the Government of Guyana may be engaged, such officer shall be deemed, for the purposes of this section, to have died in the circumstances described in subsection (1).  (5) An officer who dies as a result of injuries received while travelling by air in pursuance of official LAWS OF GUYANA 28 27:02 Pensions  L.R.O. 1/2012                 Pensions of officers with service in certain Health Services, etc.  [2 of 1975 12 of 1976]                           instructions shall be deemed to have died in the circumstances detailed in subsection (l)(a) and (c); provided that in such a case and if the provisions of paragraph (b) are also satisfied the rates of pension prescribed in subparagraphs (i) and (ii) of that subsection shall be fifteen- sixtieths  and one-sixth respectively.  (6) This section shall apply to an officer notwithstanding the fact that by reason of his injury or death he or his dependants as defined under the National Insurance and Social Security Act are entitled to benefits under that Act.",
            "description": [
                {
                    "representation": "(1)",
                    "description": "Where an officer dies as a result of injuries received"
                },
                {
                    "representation": "(a)",
                    "description": "and"
                },
                {
                    "representation": "(b)",
                    "description": "are also satisfied the rates of pension prescribed in subparagraphs"
                },
                {
                    "representation": "(c)",
                    "description": "widow includes"
                },
                {
                    "representation": "(i)",
                    "description": "and"
                },
                {
                    "representation": "(v)",
                    "description": "of this subsection, if the mother is a widow at the time of the grant of the pension and   subsequently remarries such pension shall cease as from the date of remarriage; and if it appears to the Minister at any time that the mother is adequately provided with other means of support, such pension shall cease as from such date as the Minister may determine."
                },
                {
                    "representation": "(2)",
                    "description": "In the case of an officer not holding a pensionable office, the expression pensionable emoluments in the preceding subsection shall mean the emoluments enjoyed by him or her which would have been pensionable emoluments if the office held by him or her had been a pensionable office."
                },
                {
                    "representation": "(3)",
                    "description": "For the purposes of this section"
                },
                {
                    "representation": "(4)",
                    "description": "If an officer proceeding by a route approved by the President to or from Guyana at the commencement or termination of his service therein, or of a period of leave therefrom, dies as a result of damage to the vessel or vehicle in which he is travelling, or of any act of violence directed against such vessel or vehicle, and the President is satisfied that such damage or act is attributable to circumstances arising out of any war in which the Government of Guyana may be engaged, such officer shall be deemed, for the purposes of this section, to have died in the circumstances described in subsection"
                },
                {
                    "representation": "(5)",
                    "description": "An officer who dies as a result of injuries received while travelling by air in pursuance of official LAWS OF GUYANA 28 27:02 Pensions  L.R.O. 1/2012                 Pensions of officers with service in certain Health Services, etc.  [2 of 1975 12 of 1976]                           instructions shall be deemed to have died in the circumstances detailed in subsection"
                },
                {
                    "representation": "(6)",
                    "description": "This section shall apply to an officer notwithstanding the fact that by reason of his injury or death he or his dependants as defined under the National Insurance and Social Security Act are entitled to benefits under that Act."
                }
            ]
        }
    },
    {
        "act": "PENSIONS ACT",
        "source": "https://mola.gov.gy/laws-of-guyana",
        "type": {
            "name": "section",
            "representation": "23",
            "title": "Pensions of officers with service in certain Health Services, etc. ",
            "context": "PENSIONS ACT under Pensions of officers with service in certain Health Services, etc. 23. (1)  In computing for the purposes of this Act the pension of any officer who has, in addition to his public service, served in  (a) the Society for the Prevention and Treatment of Tuberculosis; or  (b) the Infant Welfare and Maternity League; or  (c) (before the 1st January, 1953) the New Amsterdam Fire Service Unit; or  (d) the service of the Mayor and Town Council of Georgetown before 1st July, 1948 and retires 31st January, 1975 from the public service or the service in which he was last employed, his service in the said Society or in the said League, or (before the 1st January, 1953) in the said Fire Service Unit,  or in the service of the Mayor and  Town Council of Georgetown as  aforesaid, as the  case  may be, shall be taken   into account as if it had been service of Guyana. LAWS OF GUYANA Pensions Cap. 27:02 29  L.R.O. 1/2012                   Settlement of questions arising under the Act.    (2) The Minister may, by order which shall be subject to negative resolution of the National Assembly, designate service in any institution or organisation as service which may be taken into account  as  if  it  had  been  service  of  Guyana  for  the  purposes of subsection (1) and an order made under this subsection may be expressed to apply to service given in an institution or organisation prior to the enactment of this Act.",
            "description": [
                {
                    "representation": "(1)",
                    "description": "and an order made under this subsection may be expressed to apply to service given in an institution or organisation prior to the enactment of this Act."
                },
                {
                    "representation": "(a)",
                    "description": "the Society for the Prevention and Treatment of Tuberculosis; or"
                },
                {
                    "representation": "(b)",
                    "description": "the Infant Welfare and Maternity League; or"
                },
                {
                    "representation": "(c)",
                    "description": "(before the 1st January, 1953) the New Amsterdam Fire Service Unit; or"
                },
                {
                    "representation": "(d)",
                    "description": "the service of the Mayor and Town Council of Georgetown before 1st July, 1948 and retires 31st January, 1975 from the public service or the service in which he was last employed, his service in the said Society or in the said League, or"
                },
                {
                    "representation": "(2)",
                    "description": "The Minister may, by order which shall be subject to negative resolution of the National Assembly, designate service in any institution or organisation as service which may be taken into account  as  if  it  had  been  service  of  Guyana  for  the  purposes of subsection"
                }
            ]
        }
    },
    {
        "act": "PENSIONS ACT",
        "source": "https://mola.gov.gy/laws-of-guyana",
        "type": {
            "name": "section",
            "representation": "24",
            "title": "[Omitted] ",
            "context": "PENSIONS ACT under [Omitted] 24. [Omitted]",
            "description": "[Omitted]"
        }
    },
    {
        "act": "PENSIONS ACT",
        "source": "https://mola.gov.gy/laws-of-guyana",
        "type": {
            "name": "section",
            "representation": "25",
            "title": "Settlement of questions arising under the Act.       LAWS OF GUYANA 4 27:02 Pensions  L.R.O. 1/2012 CHAPTER 27:02  PENSIONS ACT   _______________________________________________________ 38  of 1957 An Act to amend and consolidate the Law relating to the award of Pensions, Gratuities and other Allowances to Civil Servants in respect of service in Guyana.  [10th AUGUST, 1957] Short title.     Interpretation. [15 of 1962 15 of 1963 8 of 1966A 12 of 1976]                            ",
            "context": "PENSIONS ACT under Settlement of questions arising under the Act.       LAWS OF GUYANA 4 27:02 Pensions  L.R.O. 1/2012 CHAPTER 27:02  PENSIONS ACT   _______________________________________________________ 38  of 1957 An Act to amend and consolidate the Law relating to the award of Pensions, Gratuities and other Allowances to Civil Servants in respect of service in Guyana.  [10th AUGUST, 1957] Short title.     Interpretation. [15 of 1962 15 of 1963 8 of 1966A 12 of 1976]                            25. The President shall have full power and authority to decide all questions that may arise in respect of or in connection with the administration of this Act.  _________________________                      LAWS OF GUYANA 30 27:02 Pensions  L.R.O. 1/2012 SUBSIDIARY LEGISLATION ______________   PENSIONS REGULATIONS  ARRANGEMENT OF REGULATIONS REGULATION PART I PRELIMINARY",
            "description": "The President shall have full power and authority to decide all questions that may arise in respect of or in connection with the administration of this Act.  _________________________                      LAWS OF GUYANA 30 27:02 Pensions  L.R.O. 1/2012 SUBSIDIARY LEGISLATION ______________   PENSIONS REGULATIONS  ARRANGEMENT OF REGULATIONS REGULATION PART I PRELIMINARY"
        }
    },
    {
        "act": "PENSIONS ACT",
        "source": "https://mola.gov.gy/laws-of-guyana",
        "type": {
            "name": "section",
            "representation": "26",
            "title": "Officers transferred to other public service and retiring after less than 12 ",
            "context": "PENSIONS ACT under Officers transferred to other public service and retiring after less than 12 26. Where an officer who is transferred to other public service is not granted a pension or gratuity in respect of his employment in the service in which he is last employed solely by reason of the fact that he has not completed twelve months service therein he shall not on that account be disqualified from receiving a pension or gratuity from the public funds of Guyana if otherwise eligible therefor. 61 Pensions LAWS OF GUYANA Cap. 27:02 [Subsidiary] Pensions Regulations  L.R.O. 1/2012 last service.      Retirement of transferred officers on account of marriage. [12 of 1976]                                   reg. 2 [O. 67/1958 70/1959 15/1963]",
            "description": "Where an officer who is transferred to other public service is not granted a pension or gratuity in respect of his employment in the service in which he is last employed solely by reason of the fact that he has not completed twelve months service therein he shall not on that account be disqualified from receiving a pension or gratuity from the public funds of Guyana if otherwise eligible therefor. 61 Pensions LAWS OF GUYANA Cap. 27:02 [Subsidiary] Pensions Regulations  L.R.O. 1/2012 last service.      Retirement of transferred officers on account of marriage. [12 of 1976]                                   reg. 2 [O. 67/1958 70/1959 15/1963]"
        }
    }
]