[
    {
        "act": "CONSTITUTIONAL OFFICES   (REMUNERATION OF HOLDERS) ACT",
        "source": "https://mola.gov.gy/laws-of-guyana",
        "type": {
            "name": "section",
            "representation": "1",
            "title": "Short title. ",
            "context": "CONSTITUTIONAL OFFICES   (REMUNERATION OF HOLDERS) ACT under Short title. 1. This Act may be cited as the Constitutional Offices (Remuneration of Holders) Act.",
            "description": "This Act may be cited as the Constitutional Offices (Remuneration of Holders) Act."
        }
    },
    {
        "act": "CONSTITUTIONAL OFFICES   (REMUNERATION OF HOLDERS) ACT",
        "source": "https://mola.gov.gy/laws-of-guyana",
        "type": {
            "name": "section",
            "representation": "2",
            "title": "Salaries prescribed. ",
            "context": "CONSTITUTIONAL OFFICES   (REMUNERATION OF HOLDERS) ACT under Salaries prescribed. 2. (1) The amounts specified in the Schedule in relation to the persons holding the offices specified therein, are hereby prescribed as the salaries payable annually to the said persons.  (2) The amounts aforesaid shall grow due and become payable monthly on the last day of each month in the year:  Provided that LAWS OF GUYANA 4 Cap. 27:11 Constitutional Offices (Remuneration of Holders)  L.R.O. 1/2012                                                   Allowances. Schedule.             Exemption from customs duties of goods imported by the President.  Power to amend  (a)   the amounts so to be paid for or in respect of each month shall not exceed the aggregate amount of all such salaries for the month,  the monthly salary of a person holding an office aforesaid being one-twelfth of his annual salary;  (b)  where a person is appointed to be a member of more than one Service Commission, he shall only be entitled to be paid salary as prescribed in respect of his membership of one Service Commission, and where the amount of salary prescribed for members of the respective Service Commissions is not the same, the said person shall be entitled to be paid whichever amount of salary is greater or greatest, as the case may be.  (3) In this section, the expression Service Commission means the Judicial Service Commission or the Public Service Commission or the Police Service Commission established under the Constitution.",
            "description": [
                {
                    "representation": "(1)",
                    "description": "The amounts specified in the Schedule in relation to the persons holding the offices specified therein, are hereby prescribed as the salaries payable annually to the said persons."
                },
                {
                    "representation": "(2)",
                    "description": "The amounts aforesaid shall grow due and become payable monthly on the last day of each month in the year:  Provided that LAWS OF GUYANA 4 Cap. 27:11 Constitutional Offices"
                },
                {
                    "representation": "(a)",
                    "description": "the amounts so to be paid for or in respect of each month shall not exceed the aggregate amount of all such salaries for the month,  the monthly salary of a person holding an office aforesaid being one-twelfth of his annual salary;"
                },
                {
                    "representation": "(b)",
                    "description": "where a person is appointed to be a member of more than one Service Commission, he shall only be entitled to be paid salary as prescribed in respect of his membership of one Service Commission, and where the amount of salary prescribed for members of the respective Service Commissions is not the same, the said person shall be entitled to be paid whichever amount of salary is greater or greatest, as the case may be."
                },
                {
                    "representation": "(3)",
                    "description": "In this section, the expression Service Commission means the Judicial Service Commission or the Public Service Commission or the Police Service Commission established under the Constitution."
                }
            ]
        }
    },
    {
        "act": "CONSTITUTIONAL OFFICES   (REMUNERATION OF HOLDERS) ACT",
        "source": "https://mola.gov.gy/laws-of-guyana",
        "type": {
            "name": "section",
            "representation": "3",
            "title": "Allowances. ",
            "context": "CONSTITUTIONAL OFFICES   (REMUNERATION OF HOLDERS) ACT under Allowances. 3. There shall be paid to the holder of any office specified in the Schedule such allowances as may from time to time be prescribed by order of the Minister responsible for finance (hereinafter referred to as the Minister).",
            "description": "There shall be paid to the holder of any office specified in the Schedule such allowances as may from time to time be prescribed by order of the Minister responsible for finance (hereinafter referred to as the Minister)."
        }
    },
    {
        "act": "CONSTITUTIONAL OFFICES   (REMUNERATION OF HOLDERS) ACT",
        "source": "https://mola.gov.gy/laws-of-guyana",
        "type": {
            "name": "section",
            "representation": "4",
            "title": "Exemption from customs duties of goods imported by the President. ",
            "context": "CONSTITUTIONAL OFFICES   (REMUNERATION OF HOLDERS) ACT under Exemption from customs duties of goods imported by the President. 4. No customs duties or bill of entry tax shall be charged, levied or paid on goods imported by or on behalf of the President for his personal use.",
            "description": "No customs duties or bill of entry tax shall be charged, levied or paid on goods imported by or on behalf of the President for his personal use."
        }
    },
    {
        "act": "CONSTITUTIONAL OFFICES   (REMUNERATION OF HOLDERS) ACT",
        "source": "https://mola.gov.gy/laws-of-guyana",
        "type": {
            "name": "section",
            "representation": "5",
            "title": "Power to amend Schedule. ",
            "context": "CONSTITUTIONAL OFFICES   (REMUNERATION OF HOLDERS) ACT under Power to amend Schedule. 5.   SCHEDULESalaries prescribed  __________________________ 26 of 1962 An Act to prescribe the salaries and allowances payable to the holders of certain offices under the Constitution.   [31ST DECEMBER, 1962]    Short title. [O. 38/1966A]   Salaries prescribed. Schedule.",
            "description": "SCHEDULESalaries prescribed  __________________________ 26 of 1962 An Act to prescribe the salaries and allowances payable to the holders of certain offices under the Constitution.   [31ST DECEMBER, 1962]    Short title. [O. 38/1966A]   Salaries prescribed. Schedule."
        }
    },
    {
        "act": "CONSTITUTIONAL OFFICES   (REMUNERATION OF HOLDERS) ACT",
        "source": "https://mola.gov.gy/laws-of-guyana",
        "type": {
            "name": "section",
            "representation": "6",
            "title": "Retrospective operation of orders made under section 3 or ",
            "context": "CONSTITUTIONAL OFFICES   (REMUNERATION OF HOLDERS) ACT under Retrospective operation of orders made under section 3 or 6.  Any order made under section 3 or 5 may contain provisions authorising the payment of the allowance or salary from a date earlier than the date on which the order is published in the Gazette, and such earlier date may be a date prior to the commencement of this Act.  ___________   SCHEDULE  The President Salary.................................  Judges of the Supreme Court of Judicature  (a) The ChancellorSalary..............................  (b) The Chief JusticeSalary............................  (c) Every Justice of AppealSalary................  (d) Every Puisne JudgeSalary......................  The OmbudsmanSalary  The Director of Public ProsecutionsSalary.........  The Chairman of the Elections Commission Salary ...................................   $30,000    $25,000   $24,000   $21,600   $18,000  $21,600   $21,600   $18,000  LAWS OF GUYANA 6 Cap. 27:11 Constitutional Offices (Remuneration of Holders)  L.R.O. 1/2012 Every other member of the Elections Commission Salary ...................................  The Chairman of the Public Service Commission Salary ...................................  The Deputy Chairman of the Public Service Commission and every member, other than the Chairman, performing full-time duties with the CommissionSalary ..........................  Every other member of the Public Service Commission performing part-time duties with the CommissionSalary ..........................  Every appointed member of the Judicial Service Commission who is not a Judge of the Supreme Court of JudicatureSalary ................................................................................  Every appointed member of the Police Service Commission  Salary...............................  The Director of AuditSalary ..........................  The Commissioner of Police  Salary ..............  $ 4,200   $15,000     $ 9,000    $ 6,000     $ 6,000   $ 1,200  $18,000   $15,000  ____________ LAWS OF GUYANA                                 Constitutional Offices (Remuneration of Holders)  Cap. 27:11      7                                                                                                                 L.R.O. 1/2012  SUBSIDIARY LEGISLATION  _________________   O.14/1963,  38/1965, 26/1966A 38/1966A 4/1966B 59/1968 2/1969 15/1969 51/1971 15/1972 29/1972 56/1972 71/1973 127/1973 45/1974 57/1974 61/1974 62/1975 110/1975    3/1980    Citation  [O.38/1968A]   Interpretation.     Presidents  Allowances. [O.15/1969 71/1973  45/1974] Duty  Allowances.  [71/1973 3/1980]   CONSTITUTIONAL OFFICES (HOLDERS ALLOWANCES) ORDER  made under section 3",
            "description": [
                {
                    "representation": "(a)",
                    "description": "The ChancellorSalary.............................."
                },
                {
                    "representation": "(b)",
                    "description": "The Chief JusticeSalary............................"
                },
                {
                    "representation": "(c)",
                    "description": "Every Justice of AppealSalary................"
                },
                {
                    "representation": "(d)",
                    "description": "Every Puisne JudgeSalary......................  The OmbudsmanSalary  The Director of Public ProsecutionsSalary.........  The Chairman of the Elections Commission Salary ...................................   $30,000    $25,000   $24,000   $21,600   $18,000  $21,600   $21,600   $18,000  LAWS OF GUYANA 6 Cap. 27:11 Constitutional Offices"
                }
            ]
        }
    },
    {
        "act": "CONSTITUTIONAL OFFICES   (REMUNERATION OF HOLDERS) ACT",
        "source": "https://mola.gov.gy/laws-of-guyana",
        "type": {
            "name": "section",
            "representation": "",
            "title": "27.11      Constitutional Offices (Remuneration of Holders)  [Subsidiary]                Constitutional Offices (Holders' Allowances) Order   L.R.O. 1/2012           Allowances for chauffeurs.  [",
            "context": "CONSTITUTIONAL OFFICES   (REMUNERATION OF HOLDERS) ACT under 27.11      Constitutional Offices (Remuneration of Holders)  [Subsidiary]                Constitutional Offices (Holders' Allowances) Order   L.R.O. 1/2012           Allowances for chauffeurs.  [27.11 9 [Subsidiary]                            Constitutional Offices (Holders' Allowances) Order  L.R.O. 1/2012                                    Entertainment allowance. [3/1980]   Telephone allowances. [3/1980]   House allowances. [O. 26/1966A 4/1966B 59/1968 2/1969 29/1972 71/1973 3/1980]        Commission and the Commissioner of Police, shall be paid subsistence allowance at the rate of $",
            "description": "27.11 9 [Subsidiary]                            Constitutional Offices (Holders' Allowances) Order  L.R.O. 1/2012                                    Entertainment allowance. [3/1980]   Telephone allowances. [3/1980]   House allowances. [O. 26/1966A 4/1966B 59/1968 2/1969 29/1972 71/1973 3/1980]        Commission and the Commissioner of Police, shall be paid subsistence allowance at the rate of $"
        }
    }
]