[
    {
        "act": "VALUATION FOR RATING PURPOSES ACT",
        "source": "https://mola.gov.gy/laws-of-guyana",
        "type": {
            "name": "section",
            "representation": "1",
            "title": "Short title. ",
            "context": "VALUATION FOR RATING PURPOSES ACT under Short title. 1. This Act may be cited as the Valuation for Rating Purposes Act.",
            "description": "This Act may be cited as the Valuation for Rating Purposes Act."
        }
    },
    {
        "act": "VALUATION FOR RATING PURPOSES ACT",
        "source": "https://mola.gov.gy/laws-of-guyana",
        "type": {
            "name": "section",
            "representation": "2",
            "title": "Interpretation. ",
            "context": "VALUATION FOR RATING PURPOSES ACT under Interpretation. 2.  In this Act  appeals committee means a local rating valuation appeals committee;   appeals panel means a local rating valuation appeals panel;   assessed value means the value of any property as shown in a draft list or valuation list;  City means the City of Georgetown;  City Council means the municipal council in and for the    City;   clerk means the chief executive officer of a local authority;  Court means the High Court;  draft list means the list which the Valuation Officer is LAWS OF GUYANA 6 Cap. 28:04 Valuation for Rating Purposes   L.R.O. 1/2012            c. 28:02                                      required to prepare under section 10;  Judge means a judge of the Court;  local authority  means  the  Georgetown  City  Council,  the  New Amsterdam Town Council and any local authority constituted under the Local Government Act and includes any local authority which may hereafter be constituted under any law relating to local government;  objection means an objection to a draft list or to a proposal;  owner means the person for the time being receiving the rent of the lands, buildings or erections in connection with which the word is used, whether on his own account or as agent or trustee for any other person, or who would so receive that rent if the lands, houses, buildings  or  erections were let at a rent, and where the lands, houses, buildings or erections are not let includes any person in possession of the lands, houses, buildings or erections;  property means any separate parcel of land, or any house or building or other erection, where such parcel of land, house, building or other  erection  is  either  owned  or  capable  of  being  owned separately and includes plant, machinery and equipment;  proposal means a proposal for the amendment of a valuation list;   rate means any rate which may be levied by a local authority pursuant to any law;  Registrar means the Registrar of the Court;  Town means  the Town of New Amsterdam,  or any other LAWS OF GUYANA Valuation for Rating Purposes Cap. 28:04 7  L.R.O. 1/2012          Chief Valuation Officer etc.        [8 of 1971]             Preparation of valuation lists. [8 of 1971 9 of 2005]                   area declared to be a Town by order of the Minister for the purposes of this Act;  valuation list means a valuation list as settled in accordance with section 13 and amended under any other provisions of this Act.",
            "description": "In this Act  appeals committee means a local rating valuation appeals committee;   appeals panel means a local rating valuation appeals panel;   assessed value means the value of any property as shown in a draft list or valuation list;  City means the City of Georgetown;  City Council means the municipal council in and for the    City;   clerk means the chief executive officer of a local authority;  Court means the High Court;  draft list means the list which the Valuation Officer is LAWS OF GUYANA 6 Cap. 28:04 Valuation for Rating Purposes   L.R.O. 1/2012            c. 28:02                                      required to prepare under section 10;  Judge means a judge of the Court;  local authority  means  the  Georgetown  City  Council,  the  New Amsterdam Town Council and any local authority constituted under the Local Government Act and includes any local authority which may hereafter be constituted under any law relating to local government;  objection means an objection to a draft list or to a proposal;  owner means the person for the time being receiving the rent of the lands, buildings or erections in connection with which the word is used, whether on his own account or as agent or trustee for any other person, or who would so receive that rent if the lands, houses, buildings  or  erections were let at a rent, and where the lands, houses, buildings or erections are not let includes any person in possession of the lands, houses, buildings or erections;  property means any separate parcel of land, or any house or building or other erection, where such parcel of land, house, building or other  erection  is  either  owned  or  capable  of  being  owned separately and includes plant, machinery and equipment;  proposal means a proposal for the amendment of a valuation list;   rate means any rate which may be levied by a local authority pursuant to any law;  Registrar means the Registrar of the Court;  Town means  the Town of New Amsterdam,  or any other LAWS OF GUYANA Valuation for Rating Purposes Cap. 28:04 7  L.R.O. 1/2012          Chief Valuation Officer etc.        [8 of 1971]             Preparation of valuation lists. [8 of 1971 9 of 2005]                   area declared to be a Town by order of the Minister for the purposes of this Act;  valuation list means a valuation list as settled in accordance with section 13 and amended under any other provisions of this Act."
        }
    },
    {
        "act": "VALUATION FOR RATING PURPOSES ACT",
        "source": "https://mola.gov.gy/laws-of-guyana",
        "type": {
            "name": "section",
            "representation": "3",
            "title": "Chief Valuation Officer etc.  PART II VALUATION  ",
            "context": "VALUATION FOR RATING PURPOSES ACT under Chief Valuation Officer etc.  PART II VALUATION  3. (1) There shall be a Chief Valuation Officer, a Deputy Chief Valuation Officer and such number of valuers as may be requisite for the purposes of this Act.  (2) The functions of the Chief Valuation Officer under this Act may, subject to any instructions he may give, be exercised by the Deputy Chief Valuation Officer or any valuer.  PART II VALUATION",
            "description": [
                {
                    "representation": "(1)",
                    "description": "There shall be a Chief Valuation Officer, a Deputy Chief Valuation Officer and such number of valuers as may be requisite for the purposes of this Act."
                },
                {
                    "representation": "(2)",
                    "description": "The functions of the Chief Valuation Officer under this Act may, subject to any instructions he may give, be exercised by the Deputy Chief Valuation Officer or any valuer.  PART II VALUATION"
                }
            ]
        }
    },
    {
        "act": "VALUATION FOR RATING PURPOSES ACT",
        "source": "https://mola.gov.gy/laws-of-guyana",
        "type": {
            "name": "section",
            "representation": "4",
            "title": "Preparation of valuation lists. ",
            "context": "VALUATION FOR RATING PURPOSES ACT under Preparation of valuation lists. 4.  (1) The Minister may, by order, direct the Chief Valuation Officer to prepare a valuation list in any area of Guyana administered by a local authority and he may in such order appoint a day when the preparation of the valuation list shall commence; and he may, by a further order, appoint a day on which the valuation list shall come into force.  (2) The Minister shall by order fix, in respect of any and every valuation of property in any area as aforesaid, a date at which all property in that area shall be valued:  Provided that if the Minister deems it necessary or expedient to do so he may alter, from time to time, any dates fixed by him under this subsection.  (3) The Minister may by the first-mentioned order in subsection (1) or any subsequent order designate any area that is not for the time being administered by a local LAWS OF GUYANA 8 Cap. 28:04 Valuation for Rating Purposes   L.R.O. 1/2012                                         c. 28:09     Information and returns.    [8 of 1971 9 of 2005] authority, as an area proposed to be amalgamated with a local authority to be named in the order and with effect from the coming into force of such an order the area so designated shall for the purposes of subsection (1) be deemed to be part of the area administered by the local authority.  (4)  Where an area has been designated under subsection (3), the references in sections 10, 11, 12, 13, 14, 15, 22, 24 and 25 to a local authority shall be construed as references to the Regional Executive Officer within whose district the area so designated is situated.  (5)  Subsequent valuation lists in respect of any such area shall be prepared by the Chief Valuation Officer and shall come into force on the 1st January in every fifth year after the year in which the list for the area has come into force pursuant to subsection (1).  (6)  The Minister may, by order, extend the period during which a valuation list may remain in force:  Provided that no such order shall have the effect of extending the period during which a list shall remain in force beyond ten years from the day on which it first came into force.  (7)  Every valuation list shall remain in force until it is superseded by a new list.  (8)  In subsection (4), the word district means the district administered by a Regional Executive Officer under the Local Democratic Organs Act.",
            "description": [
                {
                    "representation": "(1)",
                    "description": "be deemed to be part of the area administered by the local authority."
                },
                {
                    "representation": "(2)",
                    "description": "The Minister shall by order fix, in respect of any and every valuation of property in any area as aforesaid, a date at which all property in that area shall be valued:  Provided that if the Minister deems it necessary or expedient to do so he may alter, from time to time, any dates fixed by him under this subsection."
                },
                {
                    "representation": "(3)",
                    "description": "The Minister may by the first-mentioned order in subsection"
                },
                {
                    "representation": "(4)",
                    "description": "Where an area has been designated under subsection"
                },
                {
                    "representation": "(5)",
                    "description": "Subsequent valuation lists in respect of any such area shall be prepared by the Chief Valuation Officer and shall come into force on the 1st January in every fifth year after the year in which the list for the area has come into force pursuant to subsection"
                },
                {
                    "representation": "(6)",
                    "description": "The Minister may, by order, extend the period during which a valuation list may remain in force:  Provided that no such order shall have the effect of extending the period during which a list shall remain in force beyond ten years from the day on which it first came into force."
                },
                {
                    "representation": "(7)",
                    "description": "Every valuation list shall remain in force until it is superseded by a new list."
                },
                {
                    "representation": "(8)",
                    "description": "In subsection"
                }
            ]
        }
    },
    {
        "act": "VALUATION FOR RATING PURPOSES ACT",
        "source": "https://mola.gov.gy/laws-of-guyana",
        "type": {
            "name": "section",
            "representation": "5",
            "title": "Information and returns. ",
            "context": "VALUATION FOR RATING PURPOSES ACT under Information and returns. 5. (1) In every case where a valuation list is to be made under this Act for any area, the Chief Valuation Officer may serve a notice on the owner, lessee or occupier of any property in the area, or on any one or more of them requiring LAWS OF GUYANA Valuation for Rating Purposes Cap. 28:04 9  L.R.O. 1/2012                                               him or them to make a return containing such particulars as may be reasonably required for the purpose of enabling the Chief Valuation Officer accurately to compile the list.  (2) The Chief Valuation Officer may at any time require the landlord, tenant or any other person in possession of receipts, rent books or other books of account or any other document relating to the rents paid or received, the expenses incurred in the administration of any property or the purchase price of any property or any other matter connected with any property to produce those receipts, books or other documents for inspection; and any such person who without reasonable excuse refuses to produce any of those receipts, books or any other such document when so required shall be guilty of an offence.  (3) The owner of any property in or upon which is installed any plant, machinery or equipment shall include in the return required to be made a full and complete statement of all such plant, machinery and equipment.  (4) The Chief Valuation Officer may at any time, in connection with a proposal, serve a notice on the owner, lessee or occupier of any property in the area, or on any one or more of them, requiring him or them to make a return containing such particulars as may be reasonably required for the purpose of enabling the Chief Valuation Officer to decide whether or not to make, or, as the case may be, to object to the proposal.  (5) Every person upon whom a notice to make a return is served in pursuance of this section shall within twenty-one days after the date of the service of the notice, or within such extended period as the Chief Valuation Officer may in any particular case authorise, make and deliver to the Chief Valuation Officer a return in the form required by the notice. LAWS OF GUYANA 10 Cap. 28:04 Valuation for Rating Purposes   L.R.O. 1/2012                                   Supply of information by Registrar of Deeds and Commissioner of Lands. [8 of 1971]  Power of entry. [9 of 2005]      (6) If any person on whom a notice has been served under this section fails without reasonable excuse to comply with the notice, he shall be liable on summary conviction to a fine of eight thousand dollars and to a further penalty of eight hundred dollars for each day during which the default continues after such conviction.  (7) If any person knowingly makes or causes to be made a return required under this section which is false in any material particular, he shall be liable on summary conviction to a fine of forty thousand dollars or to imprisonment for six months.  (8) For the purposes of this section a return of particulars shall be deemed to include a plan if so required by the Chief Valuation Officer.  (9) The local authority shall by its officers give such assistance to the Chief Valuation Officer with regard to the delivery and collection of returns  as  he may request, and in default thereof any expenses incurred by the Chief Valuation Officer in performing such functions shall be payable by the local authority.",
            "description": [
                {
                    "representation": "(1)",
                    "description": "In every case where a valuation list is to be made under this Act for any area, the Chief Valuation Officer may serve a notice on the owner, lessee or occupier of any property in the area, or on any one or more of them requiring LAWS OF GUYANA Valuation for Rating Purposes Cap. 28:04 9  L.R.O. 1/2012                                               him or them to make a return containing such particulars as may be reasonably required for the purpose of enabling the Chief Valuation Officer accurately to compile the list."
                },
                {
                    "representation": "(2)",
                    "description": "The Chief Valuation Officer may at any time require the landlord, tenant or any other person in possession of receipts, rent books or other books of account or any other document relating to the rents paid or received, the expenses incurred in the administration of any property or the purchase price of any property or any other matter connected with any property to produce those receipts, books or other documents for inspection; and any such person who without reasonable excuse refuses to produce any of those receipts, books or any other such document when so required shall be guilty of an offence."
                },
                {
                    "representation": "(3)",
                    "description": "The owner of any property in or upon which is installed any plant, machinery or equipment shall include in the return required to be made a full and complete statement of all such plant, machinery and equipment."
                },
                {
                    "representation": "(4)",
                    "description": "The Chief Valuation Officer may at any time, in connection with a proposal, serve a notice on the owner, lessee or occupier of any property in the area, or on any one or more of them, requiring him or them to make a return containing such particulars as may be reasonably required for the purpose of enabling the Chief Valuation Officer to decide whether or not to make, or, as the case may be, to object to the proposal."
                },
                {
                    "representation": "(5)",
                    "description": "Every person upon whom a notice to make a return is served in pursuance of this section shall within twenty-one days after the date of the service of the notice, or within such extended period as the Chief Valuation Officer may in any particular case authorise, make and deliver to the Chief Valuation Officer a return in the form required by the notice. LAWS OF GUYANA 10 Cap. 28:04 Valuation for Rating Purposes   L.R.O. 1/2012                                   Supply of information by Registrar of Deeds and Commissioner of Lands. [8 of 1971]  Power of entry. [9 of 2005]"
                },
                {
                    "representation": "(6)",
                    "description": "If any person on whom a notice has been served under this section fails without reasonable excuse to comply with the notice, he shall be liable on summary conviction to a fine of eight thousand dollars and to a further penalty of eight hundred dollars for each day during which the default continues after such conviction."
                },
                {
                    "representation": "(7)",
                    "description": "If any person knowingly makes or causes to be made a return required under this section which is false in any material particular, he shall be liable on summary conviction to a fine of forty thousand dollars or to imprisonment for six months."
                },
                {
                    "representation": "(8)",
                    "description": "For the purposes of this section a return of particulars shall be deemed to include a plan if so required by the Chief Valuation Officer."
                },
                {
                    "representation": "(9)",
                    "description": "The local authority shall by its officers give such assistance to the Chief Valuation Officer with regard to the delivery and collection of returns  as  he may request, and in default thereof any expenses incurred by the Chief Valuation Officer in performing such functions shall be payable by the local authority."
                }
            ]
        }
    },
    {
        "act": "VALUATION FOR RATING PURPOSES ACT",
        "source": "https://mola.gov.gy/laws-of-guyana",
        "type": {
            "name": "section",
            "representation": "6",
            "title": "Supply of information by Registrar of Deeds and Commissioner of Lands. ",
            "context": "VALUATION FOR RATING PURPOSES ACT under Supply of information by Registrar of Deeds and Commissioner of Lands. 6.  The Registrar of Deeds and the Commissioner of Lands shall furnish to the Chief Valuation Officer such information as he may require for the purposes of this Act.",
            "description": "The Registrar of Deeds and the Commissioner of Lands shall furnish to the Chief Valuation Officer such information as he may require for the purposes of this Act."
        }
    },
    {
        "act": "VALUATION FOR RATING PURPOSES ACT",
        "source": "https://mola.gov.gy/laws-of-guyana",
        "type": {
            "name": "section",
            "representation": "7",
            "title": "Powers of entry. ",
            "context": "VALUATION FOR RATING PURPOSES ACT under Powers of entry. 7. (1) The  Chief  Valuation  Officer  shall  have  power  at  all reasonable times after giving not less than forty-eight hours notice in writing to the owner or occupier to enter on and survey or inspect any property in any area in respect of which he has been directed to prepare a valuation list pursuant to section",
            "description": [
                {
                    "representation": "(1)",
                    "description": "The  Chief  Valuation  Officer  shall  have  power  at  all reasonable times after giving not less than forty-eight hours notice in writing to the owner or occupier to enter on and survey or inspect any property in any area in respect of which he has been directed to prepare a valuation list pursuant to section"
                }
            ]
        }
    },
    {
        "act": "VALUATION FOR RATING PURPOSES ACT",
        "source": "https://mola.gov.gy/laws-of-guyana",
        "type": {
            "name": "section",
            "representation": "8",
            "title": "Apportionment of property between areas. ",
            "context": "VALUATION FOR RATING PURPOSES ACT under Apportionment of property between areas. 8. Where  property  in  respect  of  which  one  valuation  would otherwise have been made under this Act is situated partly in one area and  partly in another area, the valuation shall first be made of the property as a whole and the value so determined shall be apportioned between the  respective areas in such ratio as the Chief Valuation Officer may, after consultation with the local authorities administering the respective areas, determine.",
            "description": "Where  property  in  respect  of  which  one  valuation  would otherwise have been made under this Act is situated partly in one area and  partly in another area, the valuation shall first be made of the property as a whole and the value so determined shall be apportioned between the  respective areas in such ratio as the Chief Valuation Officer may, after consultation with the local authorities administering the respective areas, determine."
        }
    },
    {
        "act": "VALUATION FOR RATING PURPOSES ACT",
        "source": "https://mola.gov.gy/laws-of-guyana",
        "type": {
            "name": "section",
            "representation": "9",
            "title": "Property to be included in one valuation.  PART III VALUATION PROCEDURE \u2014 OBJECTIONS AND PROPOSALS  ",
            "context": "VALUATION FOR RATING PURPOSES ACT under Property to be included in one valuation.  PART III VALUATION PROCEDURE  OBJECTIONS AND PROPOSALS  9. (1)  Unless the Chief Valuation Officer otherwise directs, there shall  be  included  in  one  valuation  several  properties  which  are contiguous to each other and are owned by the same person.  (2) Plant, machinery and equipment situated on one or more properties may be aggregated for the purposes of valuation if the plant, machinery and equipment and the properties on which they are situated are contiguous, in the ownership of the same person and form part of one industrial unit.  PART III VALUATION  PROCEDURE  OBJECTIONS  AND PROPOSALS",
            "description": [
                {
                    "representation": "(1)",
                    "description": "Unless the Chief Valuation Officer otherwise directs, there shall  be  included  in  one  valuation  several  properties  which  are contiguous to each other and are owned by the same person."
                },
                {
                    "representation": "(2)",
                    "description": "Plant, machinery and equipment situated on one or more properties may be aggregated for the purposes of valuation if the plant, machinery and equipment and the properties on which they are situated are contiguous, in the ownership of the same person and form part of one industrial unit.  PART III VALUATION  PROCEDURE  OBJECTIONS  AND PROPOSALS"
                }
            ]
        }
    },
    {
        "act": "VALUATION FOR RATING PURPOSES ACT",
        "source": "https://mola.gov.gy/laws-of-guyana",
        "type": {
            "name": "section",
            "representation": "10",
            "title": "Draft list. ",
            "context": "VALUATION FOR RATING PURPOSES ACT under Draft list. 10. (1) Where a valuation list is to be made for an area, the Chief Valuation Officer shall not later than six months prior to the day on which the list is to come into operation  (a)    if the list is for the City or a Town, or part thereof, prepare a draft list of the LAWS OF GUYANA 12 Cap. 28:04 Valuation for Rating Purposes   L.R.O. 1/2012     Schedule.                                  Schedule.                   properties therein and the capital value of such  properties   determined in accordance  with  the  Schedule:  Provided that where property, in respect of which one valuation has been made, has more than one part and parts are used for different purposes, the Chief Valuation Officer shall apportion the value among the respective parts in such proportion as the Chief Valuation Officer after consultation with the City Council may determine;  (b)     if the list is for any other area than is mentioned in paragraph (a), prepare a draft list of the properties therein and the capital value of such properties determined in accordance with the  Schedule;  (c)    transmit three copies of the draft list when completed to the appropriate local authority;  (d)    forthwith publish notice that the draft list has been completed.  (2) For the period beginning with the date on which the copies of the completed draft list are received by the local authority and ending twenty-one days after the date on which the notice of the completion of the draft list is published as aforesaid, one of the said copies shall be open to public inspection at all reasonable hours at the offices of the LAWS OF GUYANA Valuation for Rating Purposes Cap. 28:04 13  L.R.O. 1/2012     Objection to draft list. [8 of 1971]                                        local authority, and the said notice shall include a statement of the right of objection under section",
            "description": [
                {
                    "representation": "(1)",
                    "description": "Where a valuation list is to be made for an area, the Chief Valuation Officer shall not later than six months prior to the day on which the list is to come into operation"
                },
                {
                    "representation": "(a)",
                    "description": "if the list is for the City or a Town, or part thereof, prepare a draft list of the LAWS OF GUYANA 12 Cap. 28:04 Valuation for Rating Purposes   L.R.O. 1/2012     Schedule.                                  Schedule.                   properties therein and the capital value of such  properties   determined in accordance  with  the  Schedule:  Provided that where property, in respect of which one valuation has been made, has more than one part and parts are used for different purposes, the Chief Valuation Officer shall apportion the value among the respective parts in such proportion as the Chief Valuation Officer after consultation with the City Council may determine;"
                },
                {
                    "representation": "(b)",
                    "description": "if the list is for any other area than is mentioned in paragraph"
                },
                {
                    "representation": "(c)",
                    "description": "transmit three copies of the draft list when completed to the appropriate local authority;"
                },
                {
                    "representation": "(d)",
                    "description": "forthwith publish notice that the draft list has been completed."
                },
                {
                    "representation": "(2)",
                    "description": "For the period beginning with the date on which the copies of the completed draft list are received by the local authority and ending twenty-one days after the date on which the notice of the completion of the draft list is published as aforesaid, one of the said copies shall be open to public inspection at all reasonable hours at the offices of the LAWS OF GUYANA Valuation for Rating Purposes Cap. 28:04 13  L.R.O. 1/2012     Objection to draft list. [8 of 1971]                                        local authority, and the said notice shall include a statement of the right of objection under section"
                }
            ]
        }
    },
    {
        "act": "VALUATION FOR RATING PURPOSES ACT",
        "source": "https://mola.gov.gy/laws-of-guyana",
        "type": {
            "name": "section",
            "representation": "11",
            "title": "Objection to draft list. ",
            "context": "VALUATION FOR RATING PURPOSES ACT under Objection to draft list. 11.",
            "description": "11."
        }
    },
    {
        "act": "VALUATION FOR RATING PURPOSES ACT",
        "source": "https://mola.gov.gy/laws-of-guyana",
        "type": {
            "name": "section",
            "representation": "12",
            "title": "Revision of draft list. ",
            "context": "VALUATION FOR RATING PURPOSES ACT under Revision of draft list. 12. (1) After the expiration of the period limited for the lodging of notices of objection to a draft list the Chief Valuation Officer shall, after considering the objections submitted to him, revise the draft list and may, on that revision, make such alterations in the draft list as he thinks proper, whether for the purpose of meeting an objection or for any other reason.  (2) Where, on his revision, the Chief Valuation Officer makes an alteration in the draft list, he shall forthwith serve notice of the alteration on the owner of the property to which the alteration relates and on the person who lodged the objection if not the owner thereof; and if no alteration is made, he shall inform such owner and such person accordingly.  (3) The Chief Valuation Officer shall give notice to the local authority of all alterations made by him in respect of any property.  (4) Any notice served under this section shall be in the prescribed form and shall include a statement of the rights of appeal conferred by section 22 and shall be accompanied by a prescribed form of appeal.   LAWS OF GUYANA Valuation for Rating Purposes Cap. 28:04 15  L.R.O. 1/2012 Settling of the valuation list. [8 of 1971]",
            "description": [
                {
                    "representation": "(1)",
                    "description": "After the expiration of the period limited for the lodging of notices of objection to a draft list the Chief Valuation Officer shall, after considering the objections submitted to him, revise the draft list and may, on that revision, make such alterations in the draft list as he thinks proper, whether for the purpose of meeting an objection or for any other reason."
                },
                {
                    "representation": "(2)",
                    "description": "Where, on his revision, the Chief Valuation Officer makes an alteration in the draft list, he shall forthwith serve notice of the alteration on the owner of the property to which the alteration relates and on the person who lodged the objection if not the owner thereof; and if no alteration is made, he shall inform such owner and such person accordingly."
                },
                {
                    "representation": "(3)",
                    "description": "The Chief Valuation Officer shall give notice to the local authority of all alterations made by him in respect of any property."
                },
                {
                    "representation": "(4)",
                    "description": "Any notice served under this section shall be in the prescribed form and shall include a statement of the rights of appeal conferred by section 22 and shall be accompanied by a prescribed form of appeal.   LAWS OF GUYANA Valuation for Rating Purposes Cap. 28:04 15  L.R.O. 1/2012 Settling of the valuation list. [8 of 1971]"
                }
            ]
        }
    },
    {
        "act": "VALUATION FOR RATING PURPOSES ACT",
        "source": "https://mola.gov.gy/laws-of-guyana",
        "type": {
            "name": "section",
            "representation": "13",
            "title": "Settling of the valuation list. ",
            "context": "VALUATION FOR RATING PURPOSES ACT under Settling of the valuation list. 13. (1) The Chief Valuation Officer shall, not later than twenty-one days before the day on which a valuation list is to come into operation, settle, sign and transmit the list to the local authority and shall at the same time notify the clerk of the appeals panel that the list has been settled, signed and transmitted to the local authority.  (2) Before settling and signing the valuation list, the Chief Valuation Officer shall make such alterations therein as are necessary to give effect to any decisions pursuant to an appeal under section 22 and where a  notice of appeal has been withdrawn as the result of an agreement made between the Chief Valuation Officer, the appellant and any other person entitled to be heard on the appeal, he shall include such alterations in the valuation list as are necessary to give effect to the agreement.  (3) Save as aforesaid, and subject to any alterations made for the purpose of correcting any clerical or arithmetical error, the valuation list as settled and signed shall be identical with the draft list revised as herein before provided.  (4) The Chief Valuation Officer shall not be required to await the hearing and determination of all appeals pursuant to section 22 before settling and signing the valuation list, and if any such appeal is not heard and determined before the valuation list is settled and signed, it shall, unless withdrawn, be heard and determined as  soon  as  possible thereafter and the decision shall be deemed to have had effect from the day on which the list came into operation.  (5) The valuation list as transmitted to the local authority shall as from the date when it comes into operation and subject to any alterations made in accordance with this Act be the valuation list for the area to which it relates and any failure on the part of the Chief Valuation Officer to LAWS OF GUYANA 16 Cap. 28:04 Valuation for Rating Purposes   L.R.O. 1/2012                            Duty of local authority as respects valuation list. [8 of 1971]       Proposals for alteration of valuation list. [8 of 1971]                complete any proceedings with respect to the preparation and settling of the valuation list within the time required by this Act or the omission from the list of any matters required by this Act to be included therein or the non-compliance with any of the provisions of this Act shall not of itself render the valuation list, or the levy of any rate upon the assessed values of the properties inserted therein invalid.  (6) The Chief Valuation Officer shall give notice of the settling of the valuation list and the notice shall state that a copy thereof is on deposit at the offices of the local authority for public inspection.",
            "description": [
                {
                    "representation": "(1)",
                    "description": "The Chief Valuation Officer shall, not later than twenty-one days before the day on which a valuation list is to come into operation, settle, sign and transmit the list to the local authority and shall at the same time notify the clerk of the appeals panel that the list has been settled, signed and transmitted to the local authority."
                },
                {
                    "representation": "(2)",
                    "description": "Before settling and signing the valuation list, the Chief Valuation Officer shall make such alterations therein as are necessary to give effect to any decisions pursuant to an appeal under section 22 and where a  notice of appeal has been withdrawn as the result of an agreement made between the Chief Valuation Officer, the appellant and any other person entitled to be heard on the appeal, he shall include such alterations in the valuation list as are necessary to give effect to the agreement."
                },
                {
                    "representation": "(3)",
                    "description": "Save as aforesaid, and subject to any alterations made for the purpose of correcting any clerical or arithmetical error, the valuation list as settled and signed shall be identical with the draft list revised as herein before provided."
                },
                {
                    "representation": "(4)",
                    "description": "The Chief Valuation Officer shall not be required to await the hearing and determination of all appeals pursuant to section 22 before settling and signing the valuation list, and if any such appeal is not heard and determined before the valuation list is settled and signed, it shall, unless withdrawn, be heard and determined as  soon  as  possible thereafter and the decision shall be deemed to have had effect from the day on which the list came into operation."
                },
                {
                    "representation": "(5)",
                    "description": "The valuation list as transmitted to the local authority shall as from the date when it comes into operation and subject to any alterations made in accordance with this Act be the valuation list for the area to which it relates and any failure on the part of the Chief Valuation Officer to LAWS OF GUYANA 16 Cap. 28:04 Valuation for Rating Purposes   L.R.O. 1/2012                            Duty of local authority as respects valuation list. [8 of 1971]       Proposals for alteration of valuation list. [8 of 1971]                complete any proceedings with respect to the preparation and settling of the valuation list within the time required by this Act or the omission from the list of any matters required by this Act to be included therein or the non-compliance with any of the provisions of this Act shall not of itself render the valuation list, or the levy of any rate upon the assessed values of the properties inserted therein invalid."
                },
                {
                    "representation": "(6)",
                    "description": "The Chief Valuation Officer shall give notice of the settling of the valuation list and the notice shall state that a copy thereof is on deposit at the offices of the local authority for public inspection."
                }
            ]
        }
    },
    {
        "act": "VALUATION FOR RATING PURPOSES ACT",
        "source": "https://mola.gov.gy/laws-of-guyana",
        "type": {
            "name": "section",
            "representation": "14",
            "title": "Duty of local authority as respects valuation list. ",
            "context": "VALUATION FOR RATING PURPOSES ACT under Duty of local authority as respects valuation list. 14. (1) A local authority on receiving a valuation list shall deposit it in its offices.   (2) The local authority shall give effect to any directions which the Chief Valuation Officer may give pursuant to this Act authorising or requiring the Chief Valuation Officer to make alterations in a valuation list.",
            "description": [
                {
                    "representation": "(1)",
                    "description": "A local authority on receiving a valuation list shall deposit it in its offices."
                },
                {
                    "representation": "(2)",
                    "description": "The local authority shall give effect to any directions which the Chief Valuation Officer may give pursuant to this Act authorising or requiring the Chief Valuation Officer to make alterations in a valuation list."
                }
            ]
        }
    },
    {
        "act": "VALUATION FOR RATING PURPOSES ACT",
        "source": "https://mola.gov.gy/laws-of-guyana",
        "type": {
            "name": "section",
            "representation": "15",
            "title": "Proposals for alteration of valuation list. ",
            "context": "VALUATION FOR RATING PURPOSES ACT under Proposals for alteration of valuation list. 15.(1) Any person, who, being the owner of any property included in the valuation list, is aggrieved by any value ascribed in such list to his property may make a proposal  (a)   after  such  list has been in force                               for not less than two years;  (b)     at any time by reason of an alteration   to any house, building or other erection constituting such property or by reason of a material change of use of such property;  LAWS OF GUYANA Valuation for Rating Purposes Cap. 28:04 17  L.R.O. 1/2012                               Proceedings on proposals. [8 of 1971]                              (c)   at any time by reason of any sub-division of property which may necessitate the apportionment of the assessed value of that property.  (2) The Chief Valuation Officer may at any time make a proposal in respect of any property.  (3) A local authority may at any time make a proposal in respect of any property not owned by it.",
            "description": [
                {
                    "representation": "(1)",
                    "description": "Any person, who, being the owner of any property included in the valuation list, is aggrieved by any value ascribed in such list to his property may make a proposal"
                },
                {
                    "representation": "(a)",
                    "description": "after  such  list has been in force                               for not less than two years;"
                },
                {
                    "representation": "(b)",
                    "description": "at any time by reason of an alteration   to any house, building or other erection constituting such property or by reason of a material change of use of such property;  LAWS OF GUYANA Valuation for Rating Purposes Cap. 28:04 17  L.R.O. 1/2012                               Proceedings on proposals. [8 of 1971]"
                },
                {
                    "representation": "(c)",
                    "description": "at any time by reason of any sub-division of property which may necessitate the apportionment of the assessed value of that property."
                },
                {
                    "representation": "(2)",
                    "description": "The Chief Valuation Officer may at any time make a proposal in respect of any property."
                },
                {
                    "representation": "(3)",
                    "description": "A local authority may at any time make a proposal in respect of any property not owned by it."
                }
            ]
        }
    },
    {
        "act": "VALUATION FOR RATING PURPOSES ACT",
        "source": "https://mola.gov.gy/laws-of-guyana",
        "type": {
            "name": "section",
            "representation": "16",
            "title": "Proceedings on proposals. ",
            "context": "VALUATION FOR RATING PURPOSES ACT under Proceedings on proposals. 16. (1) Every proposal shall  (a)      be made in accordance with paragraph (c) and, except where it is made by the Chief Valuation Officer, be served on the Chief Valuation Officer;  (b)   specify the grounds on which the           proposal is based;  (c)     comply with  the requirements of any            regulations made by  the  Minister with respect to the form of proposals   or otherwise with respect to the making thereof.  (2) The Chief Valuation Officer shall within seven days after the date on which a proposal is made by or served on him transmit a copy thereof together with a statement in writing of their rights of objection to each of the following parties not being the maker of the proposal  (a)      the owner of the property to which            the proposal relates;  LAWS OF GUYANA 18 Cap. 28:04 Valuation for Rating Purposes   L.R.O. 1/2012                                                (b)      the local authority.  (3) The owner of the property to which a proposal relates or the local authority, not being the person making the proposal, may within twenty-one days from the date on which a copy of a notice is served under subsection (2) serve on the Chief Valuation Officer a notice of objection to the proposal in the prescribed form together with such number of copies as may be prescribed; and the Chief Valuation Officer shall within seven days thereafter serve one copy on the maker of the proposal.  (4) Where the proposal is made otherwise than by the Chief Valuation Officer, the Chief Valuation Officer may, within twenty-one days from the date on which the proposal is served on him, serve on the maker of the proposal notice of objection in the prescribed form to the proposal.  (5) Upon the expiration of the times limited by subsections (3) and (4), if a notice of objection in the prescribed form has not been served or if a notice after being served is unconditionally withdrawn, the Chief Valuation Officer shall cause such alteration to be made in the valuation list as will give effect to the proposal.  (6) No alteration shall be made in the valuation list in pursuance of a proposal where notice of objection has been given and not been withdrawn under subsection (5) unless the matter has been referred to the appeals committee under section 23 and then only either  (i)     in pursuance  of  the  decision of the appeals committee or arbitrator or of the Court or of the Court of Appeal on an appeal from such committee; or LAWS OF GUYANA Valuation for Rating Purposes Cap. 28:04 19  L.R.O. 1/2012          Effect of alterations made in pursuance of proposals. [8 of 1971]                                    (ii)     by agreement  between  all the persons to be entitled heard by the appeals committee.",
            "description": [
                {
                    "representation": "(1)",
                    "description": "Every proposal shall"
                },
                {
                    "representation": "(a)",
                    "description": "the owner of the property to which            the proposal relates;  LAWS OF GUYANA 18 Cap. 28:04 Valuation for Rating Purposes   L.R.O. 1/2012"
                },
                {
                    "representation": "(c)",
                    "description": "comply with  the requirements of any            regulations made by  the  Minister with respect to the form of proposals   or otherwise with respect to the making thereof."
                },
                {
                    "representation": "(b)",
                    "description": "the local authority."
                },
                {
                    "representation": "(2)",
                    "description": "serve on the Chief Valuation Officer a notice of objection to the proposal in the prescribed form together with such number of copies as may be prescribed; and the Chief Valuation Officer shall within seven days thereafter serve one copy on the maker of the proposal."
                },
                {
                    "representation": "(3)",
                    "description": "and"
                },
                {
                    "representation": "(4)",
                    "description": "Where the proposal is made otherwise than by the Chief Valuation Officer, the Chief Valuation Officer may, within twenty-one days from the date on which the proposal is served on him, serve on the maker of the proposal notice of objection in the prescribed form to the proposal."
                },
                {
                    "representation": "(5)",
                    "description": "unless the matter has been referred to the appeals committee under section 23 and then only either"
                },
                {
                    "representation": "(6)",
                    "description": "No alteration shall be made in the valuation list in pursuance of a proposal where notice of objection has been given and not been withdrawn under subsection"
                },
                {
                    "representation": "(i)",
                    "description": "in pursuance  of  the  decision of the appeals committee or arbitrator or of the Court or of the Court of Appeal on an appeal from such committee; or LAWS OF GUYANA Valuation for Rating Purposes Cap. 28:04 19  L.R.O. 1/2012          Effect of alterations made in pursuance of proposals. [8 of 1971]"
                }
            ]
        }
    },
    {
        "act": "VALUATION FOR RATING PURPOSES ACT",
        "source": "https://mola.gov.gy/laws-of-guyana",
        "type": {
            "name": "section",
            "representation": "17",
            "title": "Effect of alterations made in pursuance of proposals.  ",
            "context": "VALUATION FOR RATING PURPOSES ACT under Effect of alterations made in pursuance of proposals.  17.(1) Subject to this section, an alteration made in the valuation list in pursuance of a proposal shall in relation to any rate current on the day when the proposal in pursuance of which the alteration so made was served on the Chief Valuation Officer, or where the proposal was made by the Chief Valuation Officer, current at the date when notice of the proposal was served on the owner of the property in question, be deemed to have had effect as from the commencement of the period in respect of which the rate was made, and shall subject to the provisions of this section, have effect for the purposes of any subsequent rate.  (2) Notwithstanding anything to the contrary in subsection (1), an alteration in the valuation list which either  (a)      arises from the inclusion in the list of a newly erected or reconstructed property; or            (b)    is made by reason of a change in the             value of a property caused by the making of structural alterations or by the total or   partial destruction of any building or other  erection by fire or any other physical cause;             (c)    is made by reason of the changes in value of a property from any other cause,  LAWS OF GUYANA 20 Cap. 28:04 Valuation for Rating Purposes   L.R.O. 1/2012                            Clerical and arithmetical errors. [8 of 1971]                      Appeals panels.   shall have effect only as from such day as the Chief Valuation Officer is satisfied is the day when the new or altered property is completed or occupied, or as from such day as he is satisfied is the day when the event occurred by reason of which the alteration is made, as the case may be.  (3)  Where in pursuance of a proposal an alteration is made in the valuation list which affects the amount of any rate levied in respect of any property in accordance with such list, the difference, if too much has been paid, shall be repaid or allowed or, if too little has been paid, shall be paid and may be recovered as if it were arrears of the rate whether or not the year in respect of which the rate is levied has expired.",
            "description": [
                {
                    "representation": "(1)",
                    "description": "Subject to this section, an alteration made in the valuation list in pursuance of a proposal shall in relation to any rate current on the day when the proposal in pursuance of which the alteration so made was served on the Chief Valuation Officer, or where the proposal was made by the Chief Valuation Officer, current at the date when notice of the proposal was served on the owner of the property in question, be deemed to have had effect as from the commencement of the period in respect of which the rate was made, and shall subject to the provisions of this section, have effect for the purposes of any subsequent rate."
                },
                {
                    "representation": "(2)",
                    "description": "Notwithstanding anything to the contrary in subsection"
                },
                {
                    "representation": "(a)",
                    "description": "arises from the inclusion in the list of a newly erected or reconstructed property; or"
                },
                {
                    "representation": "(b)",
                    "description": "is made by reason of a change in the             value of a property caused by the making of structural alterations or by the total or   partial destruction of any building or other  erection by fire or any other physical cause;"
                },
                {
                    "representation": "(c)",
                    "description": "is made by reason of the changes in value of a property from any other cause,  LAWS OF GUYANA 20 Cap. 28:04 Valuation for Rating Purposes   L.R.O. 1/2012                            Clerical and arithmetical errors. [8 of 1971]                      Appeals panels.   shall have effect only as from such day as the Chief Valuation Officer is satisfied is the day when the new or altered property is completed or occupied, or as from such day as he is satisfied is the day when the event occurred by reason of which the alteration is made, as the case may be."
                },
                {
                    "representation": "(3)",
                    "description": "Where in pursuance of a proposal an alteration is made in the valuation list which affects the amount of any rate levied in respect of any property in accordance with such list, the difference, if too much has been paid, shall be repaid or allowed or, if too little has been paid, shall be paid and may be recovered as if it were arrears of the rate whether or not the year in respect of which the rate is levied has expired."
                }
            ]
        }
    },
    {
        "act": "VALUATION FOR RATING PURPOSES ACT",
        "source": "https://mola.gov.gy/laws-of-guyana",
        "type": {
            "name": "section",
            "representation": "18",
            "title": "Clerical and arithmetical errors.  LAWS OF GUYANA 4 Cap. 28:04 Valuation for Rating Purposes   L.R.O. 1/2012  SECTION PART IV APPEALS  ",
            "context": "VALUATION FOR RATING PURPOSES ACT under Clerical and arithmetical errors.  LAWS OF GUYANA 4 Cap. 28:04 Valuation for Rating Purposes   L.R.O. 1/2012  SECTION PART IV APPEALS  18. The Chief Valuation Officer may at any time make or cause to be made any alteration in a valuation list which may be necessary to correct any clerical or arithmetical error therein and the list shall have effect and be deemed always to have had effect accordingly; but if the alteration is made in respect of any matter other than totals, the Chief Valuation Officer shall, before making or causing any such alterations to be made, send notice thereof to the owner of the property and to the local authority not being the owner and shall allow fourteen days to elapse during which period the owner of  the property or the local authority may object to the proposed alteration in the same manner as if the objection had been an objection to a proposal under section 16 and it shall be dealt with accordingly.  PART IV APPEALS",
            "description": "The Chief Valuation Officer may at any time make or cause to be made any alteration in a valuation list which may be necessary to correct any clerical or arithmetical error therein and the list shall have effect and be deemed always to have had effect accordingly; but if the alteration is made in respect of any matter other than totals, the Chief Valuation Officer shall, before making or causing any such alterations to be made, send notice thereof to the owner of the property and to the local authority not being the owner and shall allow fourteen days to elapse during which period the owner of  the property or the local authority may object to the proposed alteration in the same manner as if the objection had been an objection to a proposal under section 16 and it shall be dealt with accordingly.  PART IV APPEALS"
        }
    },
    {
        "act": "VALUATION FOR RATING PURPOSES ACT",
        "source": "https://mola.gov.gy/laws-of-guyana",
        "type": {
            "name": "section",
            "representation": "19",
            "title": "Appeals panels. ",
            "context": "VALUATION FOR RATING PURPOSES ACT under Appeals panels. 19.(1) The Minister shall from time to time establish such number of local rating valuation appeals panels as he considers necessary and shall determine LAWS OF GUYANA Valuation for Rating Purposes Cap. 28:04 21  L.R.O. 1/2012                                               (a)     the area which shall be served by any  such panel;   (b)    the number of members of each such panel;  (c)      the tenure of office of members.  (2) The Minister shall appoint the members of the appeals panels and may at any time revoke such appointments.  (3) The Minister may grant leave of absence to any member of an appeals panel and may appoint any person to act in place of a member who has been granted leave of absence.  (4) The Minister shall appoint one of the members of an appeals panel to be the chairman thereof and may, at any time, revoke such appointment; and where the chairman is on leave or temporarily absent or incapable by reason of any provision of section 37(1), of acting in any proceedings under this Act, the Minister may appoint a person whether or not a member of the appeals panel to act as chairman for such period as he may determine, and if the person so appointed is not a member he shall be deemed to be a member for such period.  (5) An appeals panel shall meet at such time and place as the chairman may deem expedient for the purpose of selecting members to sit on appeals committees and for the consideration of any other relevant matters.  (6) Any matter on which a vote is taken at a meeting of an appeals panel shall be decided by a majority of the votes of those present and voting, and where the vote is LAWS OF GUYANA 22 Cap. 28:04 Valuation for Rating Purposes   L.R.O. 1/2012                          Appeals committees.                    Staff and expenses of appeals panels and commit- tees. equal the chairman shall have a second or casting vote.  (7) No member of an appeals panel shall without the approval of the Minister receive remuneration in respect of his services, but he shall be entitled to be paid a subsistence allowance and a travelling allowance to meet expenses actually incurred by reason of his attendance at meetings of the appeals panel or of an appeals committee, and such allowances shall be as prescribed by the Minister.  (8) No appeal against the decision of an appeals committee shall fail by reason of any vacancy in the appeals panel from which the members of the appeals committee were selected.",
            "description": [
                {
                    "representation": "(1)",
                    "description": "The Minister shall from time to time establish such number of local rating valuation appeals panels as he considers necessary and shall determine LAWS OF GUYANA Valuation for Rating Purposes Cap. 28:04 21  L.R.O. 1/2012"
                },
                {
                    "representation": "(a)",
                    "description": "the area which shall be served by any  such panel;"
                },
                {
                    "representation": "(b)",
                    "description": "the number of members of each such panel;"
                },
                {
                    "representation": "(c)",
                    "description": "the tenure of office of members."
                },
                {
                    "representation": "(2)",
                    "description": "The Minister shall appoint the members of the appeals panels and may at any time revoke such appointments."
                },
                {
                    "representation": "(3)",
                    "description": "The Minister may grant leave of absence to any member of an appeals panel and may appoint any person to act in place of a member who has been granted leave of absence."
                },
                {
                    "representation": "(4)",
                    "description": "The Minister shall appoint one of the members of an appeals panel to be the chairman thereof and may, at any time, revoke such appointment; and where the chairman is on leave or temporarily absent or incapable by reason of any provision of section 37(1), of acting in any proceedings under this Act, the Minister may appoint a person whether or not a member of the appeals panel to act as chairman for such period as he may determine, and if the person so appointed is not a member he shall be deemed to be a member for such period."
                },
                {
                    "representation": "(5)",
                    "description": "An appeals panel shall meet at such time and place as the chairman may deem expedient for the purpose of selecting members to sit on appeals committees and for the consideration of any other relevant matters."
                },
                {
                    "representation": "(6)",
                    "description": "Any matter on which a vote is taken at a meeting of an appeals panel shall be decided by a majority of the votes of those present and voting, and where the vote is LAWS OF GUYANA 22 Cap. 28:04 Valuation for Rating Purposes   L.R.O. 1/2012                          Appeals committees.                    Staff and expenses of appeals panels and commit- tees. equal the chairman shall have a second or casting vote."
                },
                {
                    "representation": "(7)",
                    "description": "No member of an appeals panel shall without the approval of the Minister receive remuneration in respect of his services, but he shall be entitled to be paid a subsistence allowance and a travelling allowance to meet expenses actually incurred by reason of his attendance at meetings of the appeals panel or of an appeals committee, and such allowances shall be as prescribed by the Minister."
                },
                {
                    "representation": "(8)",
                    "description": "No appeal against the decision of an appeals committee shall fail by reason of any vacancy in the appeals panel from which the members of the appeals committee were selected."
                }
            ]
        }
    },
    {
        "act": "VALUATION FOR RATING PURPOSES ACT",
        "source": "https://mola.gov.gy/laws-of-guyana",
        "type": {
            "name": "section",
            "representation": "20",
            "title": "Appeals committees. ",
            "context": "VALUATION FOR RATING PURPOSES ACT under Appeals committees. 20. (1) Local rating valuation appeals committees constituted as provided in this section shall be convened as often as may be necessary for the purpose of hearing and determining appeals against draft lists and in respect of objections to proposals.  (2) The  appeals  committee  which  hears  and  determines  an appeal with respect to a property shall consist of members of an appeals panel constituted under subsection (3) being the panel for the area within which that property is situated.  (3) Every appeals committee shall consist of the chairman of the appeals panel and two members thereof to be selected by the panel.",
            "description": [
                {
                    "representation": "(1)",
                    "description": "Local rating valuation appeals committees constituted as provided in this section shall be convened as often as may be necessary for the purpose of hearing and determining appeals against draft lists and in respect of objections to proposals."
                },
                {
                    "representation": "(2)",
                    "description": "The  appeals  committee  which  hears  and  determines  an appeal with respect to a property shall consist of members of an appeals panel constituted under subsection"
                },
                {
                    "representation": "(3)",
                    "description": "Every appeals committee shall consist of the chairman of the appeals panel and two members thereof to be selected by the panel."
                }
            ]
        }
    },
    {
        "act": "VALUATION FOR RATING PURPOSES ACT",
        "source": "https://mola.gov.gy/laws-of-guyana",
        "type": {
            "name": "section",
            "representation": "21",
            "title": "Staff and expenses of appeals panels and committees. ",
            "context": "VALUATION FOR RATING PURPOSES ACT under Staff and expenses of appeals panels and committees. 21. (1) The Minister shall appoint a person to be clerk of the appeals panel who shall assist the chairman thereof and the appeals committees in the performance of their functions under this Act. LAWS OF GUYANA Valuation for Rating Purposes Cap. 28:04 23  L.R.O. 1/2012       Appeal against draft list. [8 of 1971 9 of 2005]                            Objection to proposal to be determined by appeals committee. [8 of 1971]       (2) The expenses of every appeals panel including the expenses of appeals committees shall be defrayed out of moneys provided by Parliament.",
            "description": [
                {
                    "representation": "(1)",
                    "description": "The Minister shall appoint a person to be clerk of the appeals panel who shall assist the chairman thereof and the appeals committees in the performance of their functions under this Act. LAWS OF GUYANA Valuation for Rating Purposes Cap. 28:04 23  L.R.O. 1/2012       Appeal against draft list. [8 of 1971 9 of 2005]                            Objection to proposal to be determined by appeals committee. [8 of 1971]"
                },
                {
                    "representation": "(2)",
                    "description": "The expenses of every appeals panel including the expenses of appeals committees shall be defrayed out of moneys provided by Parliament."
                }
            ]
        }
    },
    {
        "act": "VALUATION FOR RATING PURPOSES ACT",
        "source": "https://mola.gov.gy/laws-of-guyana",
        "type": {
            "name": "section",
            "representation": "22",
            "title": "Appeal against draft list. ",
            "context": "VALUATION FOR RATING PURPOSES ACT under Appeal against draft list. 22.(1) Any person on whom a notice is served under section 12 (2), and the local authority within whose area the property is situated, may appeal to an appeals committee with respect to the property in question; and the Chief Valuation Officer shall be the respondent to the appeal.  (2) A notice of appeal under this section shall be in the prescribed form and shall be delivered to the clerk of the appeals panel for the area, together with such number of copies as may be prescribed, not later than fourteen days after service of the notice under section 12(2) and shall, where the appellant is neither the owner of the property to which the appeal relates nor the local authority, be accompanied by a sum of two thousand dollars as security for costs.  (3) A notice of appeal under this section shall contain a statement of the grounds of appeal relied upon, and except with the leave of the appeals committee, it shall not be competent for the appellant to rely on any grounds of appeal not set out therein, or where the appellant was the objector, any grounds other than those in the objection.",
            "description": [
                {
                    "representation": "(1)",
                    "description": "Any person on whom a notice is served under section 12"
                },
                {
                    "representation": "(2)",
                    "description": "A notice of appeal under this section shall be in the prescribed form and shall be delivered to the clerk of the appeals panel for the area, together with such number of copies as may be prescribed, not later than fourteen days after service of the notice under section 12(2) and shall, where the appellant is neither the owner of the property to which the appeal relates nor the local authority, be accompanied by a sum of two thousand dollars as security for costs."
                },
                {
                    "representation": "(3)",
                    "description": "A notice of appeal under this section shall contain a statement of the grounds of appeal relied upon, and except with the leave of the appeals committee, it shall not be competent for the appellant to rely on any grounds of appeal not set out therein, or where the appellant was the objector, any grounds other than those in the objection."
                }
            ]
        }
    },
    {
        "act": "VALUATION FOR RATING PURPOSES ACT",
        "source": "https://mola.gov.gy/laws-of-guyana",
        "type": {
            "name": "section",
            "representation": "23",
            "title": "Objection to proposal to be determined by appeals committee. ",
            "context": "VALUATION FOR RATING PURPOSES ACT under Objection to proposal to be determined by appeals committee. 23. (1) Where notice of objection to a proposal is given under section 16(3) or (4) and such notice is not unconditionally withdrawn, the Chief Valuation Officer shall refer the matter to the appeals committee with a request for hearing and determination, and in such a case the person making the proposal shall be the appellant and the person objecting to such proposal shall be the respondent.  (2) A request under this section shall be in the prescribed form and shall be delivered to the clerk of the LAWS OF GUYANA 24 Cap. 28:04 Valuation for Rating Purposes   L.R.O. 1/2012              Service of notice of appeal on persons entitled to be heard.                Hearing and determination of appeals. [8 of 1971 9 of 2005]                 c. 5:03          c. 7:01         appeals panel for the area, together with such number of copies as may be prescribed, within twenty-one days after the day when notice of objection was served under section 16(3) or (4).",
            "description": [
                {
                    "representation": "(1)",
                    "description": "Where notice of objection to a proposal is given under section 16(3) or"
                },
                {
                    "representation": "(4)",
                    "description": "and such notice is not unconditionally withdrawn, the Chief Valuation Officer shall refer the matter to the appeals committee with a request for hearing and determination, and in such a case the person making the proposal shall be the appellant and the person objecting to such proposal shall be the respondent."
                },
                {
                    "representation": "(2)",
                    "description": "A request under this section shall be in the prescribed form and shall be delivered to the clerk of the LAWS OF GUYANA 24 Cap. 28:04 Valuation for Rating Purposes   L.R.O. 1/2012              Service of notice of appeal on persons entitled to be heard.                Hearing and determination of appeals. [8 of 1971 9 of 2005]                 c. 5:03          c. 7:01         appeals panel for the area, together with such number of copies as may be prescribed, within twenty-one days after the day when notice of objection was served under section 16(3) or"
                }
            ]
        }
    },
    {
        "act": "VALUATION FOR RATING PURPOSES ACT",
        "source": "https://mola.gov.gy/laws-of-guyana",
        "type": {
            "name": "section",
            "representation": "24",
            "title": "Service of notice of appeal on persons entitled to be heard. ",
            "context": "VALUATION FOR RATING PURPOSES ACT under Service of notice of appeal on persons entitled to be heard. 24.  The clerk of the appeals panel shall not later than seven days after delivery to him of a notice of appeal or a request, under section 22 or section 23, respectively, transmit a copy to each of the persons (other than the appellant) entitled under section 25(3) to be heard on the appeal.",
            "description": [
                {
                    "representation": "(3)",
                    "description": "to be heard on the appeal."
                }
            ]
        }
    },
    {
        "act": "VALUATION FOR RATING PURPOSES ACT",
        "source": "https://mola.gov.gy/laws-of-guyana",
        "type": {
            "name": "section",
            "representation": "25",
            "title": "Hearing and determination of appeals. ",
            "context": "VALUATION FOR RATING PURPOSES ACT under Hearing and determination of appeals. 25.(1) Where notice of appeal under section 22 or a request under section 23 is delivered to the clerk of an appeals panel, he shall notify the chairman of the panel who shall convene an appeals committee and the clerk of the appeals panel shall send to the appellant and to the persons entitled under subsection (3) of this section to be heard, not less than three days before such day as shall be fixed for the hearing, notice of the time and place appointed for the hearing of the appeal.  (2) The appeals committee shall hear the appeal and may adjourn the hearing from time to time until it has disposed of all the appeals lodged and for that purpose shall be deemed to be a court within the meaning of the  Evidence Act and shall have the same power of summoning witnesses,  enforcing their attendance and compelling them to give evidence and produce documents as has a magistrates court under the Summary Jurisdiction (Petty Debt) Act and any rules in force in that court; and every such committee shall, unless the committee otherwise orders, on the application of any party to the appeal and upon being satisfied that the interests of either party would be prejudicially affected, sit in public.  LAWS OF GUYANA Valuation for Rating Purposes Cap. 28:04 25  L.R.O. 1/2012                                               (3) At the hearing of an appeal by an appeals committee              (a)      the appellant;  (b)      the Chief Valuation Officer;  (c) the owner of the property to which the  appeal  relates  (when he is not  the appellant);  (d)    the  local  authority  for  the  area  in which the property is situated (when that local authority is not the appellant); and   (e)     in   case of  an appeal against a draft list, the objector (when he is not one of the persons previously mentioned in this subsection),  is entitled to appear and be heard, either personally or by counsel or solicitor, and to call witnesses.  (4) After hearing the persons mentioned in subsection (3) or such of them as desire to be heard, the appeals committee shall give such directions with respect to the manner in which the property in question is to be treated in the draft list or the valuation list, as the case may be, as appears to it to be necessary to give effect to the contention of the appellant if and so far as that contention appears to the committee to be well founded and the Chief Valuation Officer shall cause the draft list or the valuation list, as the case may be, to be altered accordingly.  (5) Where on an appeal the decision of an appeals LAWS OF GUYANA 26 Cap. 28:04 Valuation for Rating Purposes   L.R.O. 1/2012          c. 7:01                                   Arbitration.            c. 7:03      committee is not unanimous the decision of the committee is the decision of the majority of the members thereof.  (6) The costs of the appeals shall be awarded in such manner as the committee determines and shall be recoverable in the manner provided by section 35 of the Summary Jurisdiction (Petty Debt) Act.  (7) The appeals committee shall cause notice of every decision to be published at the offices of the local authority of the area in which the property is situated and a copy thereof to be sent to the Chief Valuation Officer.  (8) Any person entitled to appeal from the decision of an appeals committee under section 22 or section 23 shall on payment of a fee of one thousand dollars per folio of one hundred and twenty words be entitled to receive from the clerk of the appeals panel a copy of the record of the proceedings of the appeals committee including the notes of evidence taken and the memorandum of reasons for the committees decision.",
            "description": [
                {
                    "representation": "(1)",
                    "description": "Where notice of appeal under section 22 or a request under section 23 is delivered to the clerk of an appeals panel, he shall notify the chairman of the panel who shall convene an appeals committee and the clerk of the appeals panel shall send to the appellant and to the persons entitled under subsection"
                },
                {
                    "representation": "(3)",
                    "description": "or such of them as desire to be heard, the appeals committee shall give such directions with respect to the manner in which the property in question is to be treated in the draft list or the valuation list, as the case may be, as appears to it to be necessary to give effect to the contention of the appellant if and so far as that contention appears to the committee to be well founded and the Chief Valuation Officer shall cause the draft list or the valuation list, as the case may be, to be altered accordingly."
                },
                {
                    "representation": "(2)",
                    "description": "The appeals committee shall hear the appeal and may adjourn the hearing from time to time until it has disposed of all the appeals lodged and for that purpose shall be deemed to be a court within the meaning of the  Evidence Act and shall have the same power of summoning witnesses,  enforcing their attendance and compelling them to give evidence and produce documents as has a magistrates court under the Summary Jurisdiction"
                },
                {
                    "representation": "(a)",
                    "description": "the appellant;"
                },
                {
                    "representation": "(b)",
                    "description": "the Chief Valuation Officer;"
                },
                {
                    "representation": "(c)",
                    "description": "the owner of the property to which the  appeal  relates"
                },
                {
                    "representation": "(d)",
                    "description": "the  local  authority  for  the  area  in which the property is situated"
                },
                {
                    "representation": "(e)",
                    "description": "in   case of  an appeal against a draft list, the objector"
                },
                {
                    "representation": "(4)",
                    "description": "After hearing the persons mentioned in subsection"
                },
                {
                    "representation": "(5)",
                    "description": "Where on an appeal the decision of an appeals LAWS OF GUYANA 26 Cap. 28:04 Valuation for Rating Purposes   L.R.O. 1/2012          c. 7:01                                   Arbitration.            c. 7:03      committee is not unanimous the decision of the committee is the decision of the majority of the members thereof."
                },
                {
                    "representation": "(6)",
                    "description": "The costs of the appeals shall be awarded in such manner as the committee determines and shall be recoverable in the manner provided by section 35 of the Summary Jurisdiction"
                },
                {
                    "representation": "(7)",
                    "description": "The appeals committee shall cause notice of every decision to be published at the offices of the local authority of the area in which the property is situated and a copy thereof to be sent to the Chief Valuation Officer."
                },
                {
                    "representation": "(8)",
                    "description": "Any person entitled to appeal from the decision of an appeals committee under section 22 or section 23 shall on payment of a fee of one thousand dollars per folio of one hundred and twenty words be entitled to receive from the clerk of the appeals panel a copy of the record of the proceedings of the appeals committee including the notes of evidence taken and the memorandum of reasons for the committees decision."
                }
            ]
        }
    },
    {
        "act": "VALUATION FOR RATING PURPOSES ACT",
        "source": "https://mola.gov.gy/laws-of-guyana",
        "type": {
            "name": "section",
            "representation": "26",
            "title": "Arbitration. ",
            "context": "VALUATION FOR RATING PURPOSES ACT under Arbitration. 26. (1) Notwithstanding anything in the preceding provisions of this Act, the persons who would be entitled to appear and be heard before an appeals committee may by agreement in writing refer to arbitration any matter which would but for the agreement fall to be heard or determined by that appeals committee and the matter shall be referred to arbitration accordingly.  (2) The Arbitration Act applies, mutatis mutandis, to any such arbitration.  (3) The award in any such arbitration may include any directions including directions as to costs which might LAWS OF GUYANA Valuation for Rating Purposes Cap. 28:04 27  L.R.O. 1/2012       Appeal to the Court. [8 of 1971 9 of 2005]                                      under this Act have been given by the appeals committee and effect shall be given to those directions as if they had been given by that committee.",
            "description": [
                {
                    "representation": "(1)",
                    "description": "Notwithstanding anything in the preceding provisions of this Act, the persons who would be entitled to appear and be heard before an appeals committee may by agreement in writing refer to arbitration any matter which would but for the agreement fall to be heard or determined by that appeals committee and the matter shall be referred to arbitration accordingly."
                },
                {
                    "representation": "(2)",
                    "description": "The Arbitration Act applies, mutatis mutandis, to any such arbitration."
                },
                {
                    "representation": "(3)",
                    "description": "The award in any such arbitration may include any directions including directions as to costs which might LAWS OF GUYANA Valuation for Rating Purposes Cap. 28:04 27  L.R.O. 1/2012       Appeal to the Court. [8 of 1971 9 of 2005]                                      under this Act have been given by the appeals committee and effect shall be given to those directions as if they had been given by that committee."
                }
            ]
        }
    },
    {
        "act": "VALUATION FOR RATING PURPOSES ACT",
        "source": "https://mola.gov.gy/laws-of-guyana",
        "type": {
            "name": "section",
            "representation": "27",
            "title": "Appeal to the Court.  PART V MISCELLANEOUS AND TRANSITIONAL  ",
            "context": "VALUATION FOR RATING PURPOSES ACT under Appeal to the Court.  PART V MISCELLANEOUS AND TRANSITIONAL  27. (1) Any person who in pursuance of section 25 appears before an appeals committee on the hearing of an appeal and is aggrieved by a decision of such committee may appeal to the Court in the manner and subject to the conditions hereinafter provided.  (2) The appellant shall within fourteen days after the decision of the appeals committee has been published in accordance with section 25(7) deliver to the clerk of the appeals panel a written notice of appeal setting out the grounds therefor, and where the appellant is not the local authority or the owner of the property to which the appeal relates or the Chief Valuation Officer, shall lodge with the clerk of the appeals panel the sum of two thousand dollars as security for costs.  (3) Within twenty-one days after receipt of the notice of appeal, the clerk of the appeals panel shall lodge with the Registrar  (a)    one copy of the evidence given before the appeals committee;  (b)   a  copy  of  the  decision of the committee and the reasons therefore signed by the chairman;  (c)       the notice of appeal;  (d)    any sum  deposited  as  security for costs.  LAWS OF GUYANA 28 Cap. 28:04 Valuation for Rating Purposes   L.R.O. 1/2012                                                (4) The Registrar shall, not less than three days before such day as shall be fixed for the hearing, cause notice of the day and the hour fixed for the hearing of the appeal to be sent by registered post to the persons who appeared as parties to the proceedings before the appeals committee.  (5) Every appeal under this section shall be heard by a Judge sitting in chambers who shall have power  (a)      to  order  that  evidence be adduced on a day to be fixed for the purpose;  (b)  to refer the matter to the appeals committee to make a fresh investigation subject to such            direction of law, if any, as the Judge thinks fit to give; and  (c)   to confirm, increase or decrease the  assessed  valuation.  (6) The decision of the Judge shall be endorsed on the record of the decision of the appeals committee together with the date of the decision of the Judge, and shall be signed by the Registrar.  (7) The Registrar shall transmit to the Chief Valuation Officer one copy of the decision endorsed and signed in accordance with subsection (6).  (8) In any appeal under this section the award of costs, if any, and the amount of any such award shall be in the discretion of the Judge hearing the appeal:  Provided that costs shall not be awarded against any LAWS OF GUYANA Valuation for Rating Purposes Cap. 28:04 29  L.R.O. 1/2012                       Expenses of Valuation Officer. [8 of 1971]           Contributions by local authorities.      Premises. [8 of 1971]           person to whom notice is given under subsection (4) who prior to the day of hearing gives notice to the Registrar that he does not propose to oppose the appeal.  (9) An appeal shall lie on any question of law from an order of the Judge hearing the appeal to the Court of Appeal in accordance with any law for the time being having application in that behalf.  PART V MISCELLANEOUS AND TRANSITIONAL",
            "description": [
                {
                    "representation": "(1)",
                    "description": "Any person who in pursuance of section 25 appears before an appeals committee on the hearing of an appeal and is aggrieved by a decision of such committee may appeal to the Court in the manner and subject to the conditions hereinafter provided."
                },
                {
                    "representation": "(2)",
                    "description": "The appellant shall within fourteen days after the decision of the appeals committee has been published in accordance with section 25(7) deliver to the clerk of the appeals panel a written notice of appeal setting out the grounds therefor, and where the appellant is not the local authority or the owner of the property to which the appeal relates or the Chief Valuation Officer, shall lodge with the clerk of the appeals panel the sum of two thousand dollars as security for costs."
                },
                {
                    "representation": "(3)",
                    "description": "Within twenty-one days after receipt of the notice of appeal, the clerk of the appeals panel shall lodge with the Registrar"
                },
                {
                    "representation": "(a)",
                    "description": "to  order  that  evidence be adduced on a day to be fixed for the purpose;"
                },
                {
                    "representation": "(b)",
                    "description": "to refer the matter to the appeals committee to make a fresh investigation subject to such            direction of law, if any, as the Judge thinks fit to give; and"
                },
                {
                    "representation": "(c)",
                    "description": "to confirm, increase or decrease the  assessed  valuation."
                },
                {
                    "representation": "(d)",
                    "description": "any sum  deposited  as  security for costs.  LAWS OF GUYANA 28 Cap. 28:04 Valuation for Rating Purposes   L.R.O. 1/2012"
                },
                {
                    "representation": "(4)",
                    "description": "who prior to the day of hearing gives notice to the Registrar that he does not propose to oppose the appeal."
                },
                {
                    "representation": "(5)",
                    "description": "Every appeal under this section shall be heard by a Judge sitting in chambers who shall have power"
                },
                {
                    "representation": "(6)",
                    "description": "The decision of the Judge shall be endorsed on the record of the decision of the appeals committee together with the date of the decision of the Judge, and shall be signed by the Registrar."
                },
                {
                    "representation": "(7)",
                    "description": "The Registrar shall transmit to the Chief Valuation Officer one copy of the decision endorsed and signed in accordance with subsection"
                },
                {
                    "representation": "(8)",
                    "description": "In any appeal under this section the award of costs, if any, and the amount of any such award shall be in the discretion of the Judge hearing the appeal:  Provided that costs shall not be awarded against any LAWS OF GUYANA Valuation for Rating Purposes Cap. 28:04 29  L.R.O. 1/2012                       Expenses of Valuation Officer. [8 of 1971]           Contributions by local authorities.      Premises. [8 of 1971]           person to whom notice is given under subsection"
                },
                {
                    "representation": "(9)",
                    "description": "An appeal shall lie on any question of law from an order of the Judge hearing the appeal to the Court of Appeal in accordance with any law for the time being having application in that behalf.  PART V MISCELLANEOUS AND TRANSITIONAL"
                }
            ]
        }
    },
    {
        "act": "VALUATION FOR RATING PURPOSES ACT",
        "source": "https://mola.gov.gy/laws-of-guyana",
        "type": {
            "name": "section",
            "representation": "28",
            "title": "Expenses of Valuation Officer. ",
            "context": "VALUATION FOR RATING PURPOSES ACT under Expenses of Valuation Officer. 28. (1) All expenses incurred by the Chief Valuation Officer in the performance of his functions under this Act (including the costs of any appeal awarded against or incurred by him) shall be payable out of moneys provided by Parliament.  (2) Any costs of appeal awarded to the Chief Valuation Officer shall be paid to the State.",
            "description": [
                {
                    "representation": "(1)",
                    "description": "All expenses incurred by the Chief Valuation Officer in the performance of his functions under this Act"
                },
                {
                    "representation": "(2)",
                    "description": "Any costs of appeal awarded to the Chief Valuation Officer shall be paid to the State."
                }
            ]
        }
    },
    {
        "act": "VALUATION FOR RATING PURPOSES ACT",
        "source": "https://mola.gov.gy/laws-of-guyana",
        "type": {
            "name": "section",
            "representation": "29",
            "title": "Contributions by local authorities. ",
            "context": "VALUATION FOR RATING PURPOSES ACT under Contributions by local authorities. 29. The Minister may fix charges according to a scale which shall be paid by a local authority as a contribution to the State towards the expenses incurred under this Act within the area administered by the local authority.",
            "description": "The Minister may fix charges according to a scale which shall be paid by a local authority as a contribution to the State towards the expenses incurred under this Act within the area administered by the local authority."
        }
    },
    {
        "act": "VALUATION FOR RATING PURPOSES ACT",
        "source": "https://mola.gov.gy/laws-of-guyana",
        "type": {
            "name": "section",
            "representation": "30",
            "title": "Premises. ",
            "context": "VALUATION FOR RATING PURPOSES ACT under Premises. 30. (1) The Chief Valuation Officer may request the use by him of premises belonging to the local authority and the local authority shall not unreasonably refuse the request.   (2) The chairman of any appeals panel may request the use of premises belonging to the local authority for a meeting of the appeals panel or of any appeals committee constituted from members of such panel or for the use by himself or the clerk of the panel and the local authority shall not unreasonably refuse the request. LAWS OF GUYANA 30 Cap. 28:04 Valuation for Rating Purposes   L.R.O. 1/2012              Notification of need to alter valuation list. [8 of 1971]      Service of notices. [8 of 1971]                        (3) Where a request is made under subsection (1) or subsection (2), any dispute as to whether the request has been unreasonably refused shall be determined by the Minister.  (4) Where premises are made available under subsections (1) and (2) the local authority shall not make any charge for the use of such premises.",
            "description": [
                {
                    "representation": "(1)",
                    "description": "and"
                },
                {
                    "representation": "(2)",
                    "description": "the local authority shall not make any charge for the use of such premises."
                },
                {
                    "representation": "(3)",
                    "description": "Where a request is made under subsection"
                },
                {
                    "representation": "(4)",
                    "description": "Where premises are made available under subsections"
                }
            ]
        }
    },
    {
        "act": "VALUATION FOR RATING PURPOSES ACT",
        "source": "https://mola.gov.gy/laws-of-guyana",
        "type": {
            "name": "section",
            "representation": "31",
            "title": "Notification of need to alter valuation list. ",
            "context": "VALUATION FOR RATING PURPOSES ACT under Notification of need to alter valuation list. 31. When in the course of the exercise of any of its functions any information comes to the notice of a local authority that a valuation list requires alteration in respect of a property, it shall be the duty of that local authority to inform the Chief Valuation Officer.",
            "description": "When in the course of the exercise of any of its functions any information comes to the notice of a local authority that a valuation list requires alteration in respect of a property, it shall be the duty of that local authority to inform the Chief Valuation Officer."
        }
    },
    {
        "act": "VALUATION FOR RATING PURPOSES ACT",
        "source": "https://mola.gov.gy/laws-of-guyana",
        "type": {
            "name": "section",
            "representation": "32",
            "title": "Service of notices. ",
            "context": "VALUATION FOR RATING PURPOSES ACT under Service of notices. 32.(1) Any notice or other document required or authorised to be given to or served on any person under this Act may be given or served either  (a)      by delivering it to the person; or  (b)   by  leaving  it  at the usual or last known   residence of that person, or in the case of a company at its registered office; or   (c)    by  forwarding  it  by registered post            addressed to that person at his usual or last known residence, or in the case of a  company at its registered office; or  (d)     by delivering it to some person at the            premises to which it relates or if there is no person on the premises to whom LAWS OF GUYANA Valuation for Rating Purposes Cap. 28:04 31  L.R.O. 1/2012                                               it can be so delivered, then by affixing it to some conspicuous part of the premises; or  (e)   without prejudice to the foregoing            provisions of this subsection, where the  property to which the document is to be    sent is a place of business of the person to or  on whom it is to be  given, or served, by leaving it, or forwarding it by registered post addressed to that person, at the said place of  business.  (2) If it is not practicable after reasonable inquiry to ascertain the name and address of the person to or on whom it should be given or served, any notice or other document by this Act required or authorised to be given or served on the owner, lessee or occupier of any premises may be addressed  to  the person concerned by the description of owner, lessee or occupier of the premises, as the case may require, and delivered to some person on the premises or if there is no person on the premises to whom it can be delivered by affixing it to some conspicuous part of the premises.  (3)  Any notice or other document required or authorised by or under this Act to be given to or served on a local authority, an appeals panel, an appeals committee or the Chief Valuation Officer shall be deemed to be duly given or served if in writing and delivered or sent by registered post  (a)    in the case of a local authority to the clerk thereof;  (b)   in the case of an appeals panel or LAWS OF GUYANA 32 Cap. 28:04 Valuation for Rating Purposes   L.R.O. 1/2012          Authentication of notices and other documents. [8 of 1971]                       Evidence of lists. [8 of 1971]            Inclusion in one proceeding of separate properties. appeals  committee to the clerk of the appeals panel;  (c)    in the  case  of the Chief Valuation Officer to  the Chief Valuation Officer.",
            "description": [
                {
                    "representation": "(1)",
                    "description": "Any notice or other document required or authorised to be given to or served on any person under this Act may be given or served either"
                },
                {
                    "representation": "(a)",
                    "description": "in the case of a local authority to the clerk thereof;"
                },
                {
                    "representation": "(b)",
                    "description": "in the case of an appeals panel or LAWS OF GUYANA 32 Cap. 28:04 Valuation for Rating Purposes   L.R.O. 1/2012          Authentication of notices and other documents. [8 of 1971]                       Evidence of lists. [8 of 1971]            Inclusion in one proceeding of separate properties. appeals  committee to the clerk of the appeals panel;"
                },
                {
                    "representation": "(c)",
                    "description": "in the  case  of the Chief Valuation Officer to  the Chief Valuation Officer."
                },
                {
                    "representation": "(d)",
                    "description": "by delivering it to some person at the            premises to which it relates or if there is no person on the premises to whom LAWS OF GUYANA Valuation for Rating Purposes Cap. 28:04 31  L.R.O. 1/2012                                               it can be so delivered, then by affixing it to some conspicuous part of the premises; or"
                },
                {
                    "representation": "(e)",
                    "description": "without prejudice to the foregoing            provisions of this subsection, where the  property to which the document is to be    sent is a place of business of the person to or  on whom it is to be  given, or served, by leaving it, or forwarding it by registered post addressed to that person, at the said place of  business."
                },
                {
                    "representation": "(2)",
                    "description": "If it is not practicable after reasonable inquiry to ascertain the name and address of the person to or on whom it should be given or served, any notice or other document by this Act required or authorised to be given or served on the owner, lessee or occupier of any premises may be addressed  to  the person concerned by the description of owner, lessee or occupier of the premises, as the case may require, and delivered to some person on the premises or if there is no person on the premises to whom it can be delivered by affixing it to some conspicuous part of the premises."
                },
                {
                    "representation": "(3)",
                    "description": "Any notice or other document required or authorised by or under this Act to be given to or served on a local authority, an appeals panel, an appeals committee or the Chief Valuation Officer shall be deemed to be duly given or served if in writing and delivered or sent by registered post"
                }
            ]
        }
    },
    {
        "act": "VALUATION FOR RATING PURPOSES ACT",
        "source": "https://mola.gov.gy/laws-of-guyana",
        "type": {
            "name": "section",
            "representation": "33",
            "title": "Authentication of notices and other documents. ",
            "context": "VALUATION FOR RATING PURPOSES ACT under Authentication of notices and other documents. 33. Any notice or other document or any extract therefrom required by or under this Act to be given to or served by a local authority, an appeals panel, an appeals committee or the Chief Valuation Officer shall be sufficiently authenticated if signed  (a)     in the case of a local authority, by the clerk thereof;  (b)     in  the  case of an  appeals  panel  or               committee, by the clerk of the appeals        panel;   (c)   in the  case  of the Chief Valuation Officer, by  the Chief Valuation  Officer.",
            "description": [
                {
                    "representation": "(a)",
                    "description": "in the case of a local authority, by the clerk thereof;"
                },
                {
                    "representation": "(b)",
                    "description": "in  the  case of an  appeals  panel  or               committee, by the clerk of the appeals        panel;"
                },
                {
                    "representation": "(c)",
                    "description": "in the  case  of the Chief Valuation Officer, by  the Chief Valuation  Officer."
                }
            ]
        }
    },
    {
        "act": "VALUATION FOR RATING PURPOSES ACT",
        "source": "https://mola.gov.gy/laws-of-guyana",
        "type": {
            "name": "section",
            "representation": "34",
            "title": "Evidence of lists. ",
            "context": "VALUATION FOR RATING PURPOSES ACT under Evidence of lists. 34. Any valuation list in force or any extract therefrom, may be proved by the production of a copy of the list or of an extract therefrom, purporting to be certified by the Chief Valuation Officer as a true copy or extract; and the certificate shall state that all alterations required to be made in pursuance of this Act in such list or in the part of such list extracted have been correctly made in the copy or extract so produced.",
            "description": "Any valuation list in force or any extract therefrom, may be proved by the production of a copy of the list or of an extract therefrom, purporting to be certified by the Chief Valuation Officer as a true copy or extract; and the certificate shall state that all alterations required to be made in pursuance of this Act in such list or in the part of such list extracted have been correctly made in the copy or extract so produced."
        }
    },
    {
        "act": "VALUATION FOR RATING PURPOSES ACT",
        "source": "https://mola.gov.gy/laws-of-guyana",
        "type": {
            "name": "section",
            "representation": "35",
            "title": "Inclusion in one proceeding of separate properties. ",
            "context": "VALUATION FOR RATING PURPOSES ACT under Inclusion in one proceeding of separate properties. 35. Any person may include in the same objection, appeal, proposal or other proceeding under this Act all or any properties of which he is the owner and which are attached or LAWS OF GUYANA Valuation for Rating Purposes Cap. 28:04 33  L.R.O. 1/2012                           Publication of notices.        Performance of duties not to be dis- qualification.  [8 of 1971]                   Valuation of State property. [12 of 1982]      adjacent to or contiguous with each other and particulars of which are inserted in the draft list or valuation list notwithstanding that the properties are separately assessed in the list.",
            "description": "Any person may include in the same objection, appeal, proposal or other proceeding under this Act all or any properties of which he is the owner and which are attached or LAWS OF GUYANA Valuation for Rating Purposes Cap. 28:04 33  L.R.O. 1/2012                           Publication of notices.        Performance of duties not to be dis- qualification.  [8 of 1971]                   Valuation of State property. [12 of 1982]      adjacent to or contiguous with each other and particulars of which are inserted in the draft list or valuation list notwithstanding that the properties are separately assessed in the list."
        }
    },
    {
        "act": "VALUATION FOR RATING PURPOSES ACT",
        "source": "https://mola.gov.gy/laws-of-guyana",
        "type": {
            "name": "section",
            "representation": "36",
            "title": "Publication of notices. ",
            "context": "VALUATION FOR RATING PURPOSES ACT under Publication of notices. 36. Unless otherwise provided in this Act any notice or other matter required to be published under this Act shall be published by affixing the said notice or matter at the offices of the local authority and it may also be published in such other manner, if any, as is, in the opinion of the person required to publish it, expedient to give publicity thereto.",
            "description": "Unless otherwise provided in this Act any notice or other matter required to be published under this Act shall be published by affixing the said notice or matter at the offices of the local authority and it may also be published in such other manner, if any, as is, in the opinion of the person required to publish it, expedient to give publicity thereto."
        }
    },
    {
        "act": "VALUATION FOR RATING PURPOSES ACT",
        "source": "https://mola.gov.gy/laws-of-guyana",
        "type": {
            "name": "section",
            "representation": "37",
            "title": "Performance of duties not to be disqualification. ",
            "context": "VALUATION FOR RATING PURPOSES ACT under Performance of duties not to be disqualification. 37.(1) A member of an appeals panel or appeals committee or a Judge of the Supreme Court of Judicature shall not be incapable of acting in any proceedings on appeal or otherwise brought or taken pursuant to this Act by reason only of the fact that he is the owner of or interested in any property included in a draft list or valuation list other than that which is the subject of the proceedings.  (2) The Chief Valuation Officer shall not be incapable of fixing the value of any property, or of including such value in a draft list, or of making a proposal in respect of such property, by reason only of the fact that either he or his wife is the owner of the property or has any financial interest therein, but in any such case the Chief Valuation Officer shall give written notice thereof to the local authority when transmitting to it the draft list or the proposal.",
            "description": [
                {
                    "representation": "(1)",
                    "description": "A member of an appeals panel or appeals committee or a Judge of the Supreme Court of Judicature shall not be incapable of acting in any proceedings on appeal or otherwise brought or taken pursuant to this Act by reason only of the fact that he is the owner of or interested in any property included in a draft list or valuation list other than that which is the subject of the proceedings."
                },
                {
                    "representation": "(2)",
                    "description": "The Chief Valuation Officer shall not be incapable of fixing the value of any property, or of including such value in a draft list, or of making a proposal in respect of such property, by reason only of the fact that either he or his wife is the owner of the property or has any financial interest therein, but in any such case the Chief Valuation Officer shall give written notice thereof to the local authority when transmitting to it the draft list or the proposal."
                }
            ]
        }
    },
    {
        "act": "VALUATION FOR RATING PURPOSES ACT",
        "source": "https://mola.gov.gy/laws-of-guyana",
        "type": {
            "name": "section",
            "representation": "38",
            "title": "Valuation of State property. ",
            "context": "VALUATION FOR RATING PURPOSES ACT under Valuation of State property. 38. (1) Subject to this Act, any property of the State shall be valued in like manner to any other property and the State shall enjoy the same rights under this Act as any other owner.  (2) For the purposes of this Act any reference therein to an owner shall, in the case of any property being LAWS OF GUYANA 34 Cap. 28:04 Valuation for Rating Purposes   L.R.O. 1/2012              Special provision concerning stellings.   Power of Minister to remove difficulties.              Power to make regulations.           Forfeiture of security for costs in certain the property of the State, be deemed to be a reference to the Chief Buildings Officer:  Provided that, in exercise of any duties under this section, the Chief Buildings Officer is not liable to incur any penalty imposed under this Act.",
            "description": [
                {
                    "representation": "(1)",
                    "description": "Subject to this Act, any property of the State shall be valued in like manner to any other property and the State shall enjoy the same rights under this Act as any other owner."
                },
                {
                    "representation": "(2)",
                    "description": "For the purposes of this Act any reference therein to an owner shall, in the case of any property being LAWS OF GUYANA 34 Cap. 28:04 Valuation for Rating Purposes   L.R.O. 1/2012              Special provision concerning stellings.   Power of Minister to remove difficulties.              Power to make regulations.           Forfeiture of security for costs in certain the property of the State, be deemed to be a reference to the Chief Buildings Officer:  Provided that, in exercise of any duties under this section, the Chief Buildings Officer is not liable to incur any penalty imposed under this Act."
                }
            ]
        }
    },
    {
        "act": "VALUATION FOR RATING PURPOSES ACT",
        "source": "https://mola.gov.gy/laws-of-guyana",
        "type": {
            "name": "section",
            "representation": "39",
            "title": "Special provision concerning stellings. ",
            "context": "VALUATION FOR RATING PURPOSES ACT under Special provision concerning stellings. 39. For  the  purpose  of  determining  the  assessed  value  of  any property abutting a stelling, the stelling together with the buildings or other erections thereon shall be deemed to be part of the property.",
            "description": "For  the  purpose  of  determining  the  assessed  value  of  any property abutting a stelling, the stelling together with the buildings or other erections thereon shall be deemed to be part of the property."
        }
    },
    {
        "act": "VALUATION FOR RATING PURPOSES ACT",
        "source": "https://mola.gov.gy/laws-of-guyana",
        "type": {
            "name": "section",
            "representation": "40",
            "title": "Power of Minister to remove difficulties.       ",
            "context": "VALUATION FOR RATING PURPOSES ACT under Power of Minister to remove difficulties.       40. (1) If at any time any difficulty arises in connection with the application of this Act or the preparation of the valuation lists or in bringing into operation any of the provisions of this Act, the Minister may, by order, make such provision as appears to him to be necessary or expedient for securing the due preparation of the said lists or for otherwise applying the provisions of this Act.  (2) Any such order may modify the provisions of this Act in respect of any particular matter or occasion so far as may appear to the Minister to be necessary or expedient for carrying the order into effect.",
            "description": [
                {
                    "representation": "(1)",
                    "description": "If at any time any difficulty arises in connection with the application of this Act or the preparation of the valuation lists or in bringing into operation any of the provisions of this Act, the Minister may, by order, make such provision as appears to him to be necessary or expedient for securing the due preparation of the said lists or for otherwise applying the provisions of this Act."
                },
                {
                    "representation": "(2)",
                    "description": "Any such order may modify the provisions of this Act in respect of any particular matter or occasion so far as may appear to the Minister to be necessary or expedient for carrying the order into effect."
                }
            ]
        }
    },
    {
        "act": "VALUATION FOR RATING PURPOSES ACT",
        "source": "https://mola.gov.gy/laws-of-guyana",
        "type": {
            "name": "section",
            "representation": "41",
            "title": "Power to make regulations. ",
            "context": "VALUATION FOR RATING PURPOSES ACT under Power to make regulations. 41. Subject to negative resolution of the National Assembly, the Minister may make regulations generally for carrying this Act into effect and also for prescribing anything which by this Act is to be prescribed including the form of any return, list, objection, proposal or other document which is required or authorised to be used for the purposes of this Act.",
            "description": "Subject to negative resolution of the National Assembly, the Minister may make regulations generally for carrying this Act into effect and also for prescribing anything which by this Act is to be prescribed including the form of any return, list, objection, proposal or other document which is required or authorised to be used for the purposes of this Act."
        }
    },
    {
        "act": "VALUATION FOR RATING PURPOSES ACT",
        "source": "https://mola.gov.gy/laws-of-guyana",
        "type": {
            "name": "section",
            "representation": "42",
            "title": "Forfeiture of security for costs in certain cases.       ",
            "context": "VALUATION FOR RATING PURPOSES ACT under Forfeiture of security for costs in certain cases.       42. Where under the provisions of this Act an appeal is made either to an appeals committee or to the Court and LAWS OF GUYANA Valuation for Rating Purposes Cap. 28:04 35  L.R.O. 1/2012 cases.           Prosecutions.  [9 of 2005]            Savings and transitional provisions.      [8 of 1971 41 of 1974]              c. 28:02              Cap. 154 1953 Ed. such appeal is withdrawn otherwise than by agreement between all the parties entitled to be heard on such appeal or not prosecuted by the appellant before the appeals committee or Court, as the case may be, the sum deposited as security for costs shall be forfeited and shall be paid to the Government.",
            "description": "Where under the provisions of this Act an appeal is made either to an appeals committee or to the Court and LAWS OF GUYANA Valuation for Rating Purposes Cap. 28:04 35  L.R.O. 1/2012 cases.           Prosecutions.  [9 of 2005]            Savings and transitional provisions.      [8 of 1971 41 of 1974]              c. 28:02              Cap. 154 1953 Ed. such appeal is withdrawn otherwise than by agreement between all the parties entitled to be heard on such appeal or not prosecuted by the appellant before the appeals committee or Court, as the case may be, the sum deposited as security for costs shall be forfeited and shall be paid to the Government."
        }
    },
    {
        "act": "VALUATION FOR RATING PURPOSES ACT",
        "source": "https://mola.gov.gy/laws-of-guyana",
        "type": {
            "name": "section",
            "representation": "43",
            "title": "Prosecutions.       ",
            "context": "VALUATION FOR RATING PURPOSES ACT under Prosecutions.       43. (1) Save as otherwise expressly provided, all offences against this Act or against any regulations made under this Act shall be prosecuted under the Summary Jurisdiction Acts.    (2) A person guilty of an offence against this Act for which no special penalty is provided shall be liable to a fine of twenty thousand dollars or to imprisonment for three months.",
            "description": [
                {
                    "representation": "(1)",
                    "description": "Save as otherwise expressly provided, all offences against this Act or against any regulations made under this Act shall be prosecuted under the Summary Jurisdiction Acts."
                },
                {
                    "representation": "(2)",
                    "description": "A person guilty of an offence against this Act for which no special penalty is provided shall be liable to a fine of twenty thousand dollars or to imprisonment for three months."
                }
            ]
        }
    },
    {
        "act": "VALUATION FOR RATING PURPOSES ACT",
        "source": "https://mola.gov.gy/laws-of-guyana",
        "type": {
            "name": "section",
            "representation": "44",
            "title": "Savings and transitional provisions.       ",
            "context": "VALUATION FOR RATING PURPOSES ACT under Savings and transitional provisions.       44.(1) Notwithstanding the repeal of sections 96 to 104 (inclusive) of the Local Government Act, a local authority may, in accordance with the provisions of the said sections which shall apply mutatis mutandis for the purpose, appraise or reappraise lots and buildings or lots or buildings in  the area administered by the local authority; and any appraisement or  re-appraisement of lots and buildings or of lots or buildings made under the Local Government Act in relation to that area or part thereof and in force immediately before the commencement of this Act shall continue in force and have effect in relation to that area or part thereof until it is superseded by a subsequent appraisement or re-appraisement of lots and buildings or of lots or buildings made by virtue of this subsection, or by a valuation list for that area prepared pursuant to this Act.  (2) Notwithstanding the repeal of sections 3 to 27 (inclusive) and sections 31 to 44 (inclusive) of the Georgetown (Valuation and Rating) Ordinance, the valuation list (including any supplementary list) made under   that   LAWS OF GUYANA 36 Cap. 28:04 Valuation for Rating Purposes   L.R.O. 1/2012                                                Ordinance   and   in   force   immediately   before   the commencement of this Act shall continue in force and may be amended from time to time as if this Act had not been enacted and shall have effect until a valuation list for the City prepared pursuant to this Act comes into operation subject to the following modification, that is to say, the repeal of subsections (2) and (3) of section 100 of the Local Government Ordinance (in  operation at 30th December, 1973 by virtue of this section) and the substitution therefore of the following subsections  (2) Notice of the completion of the appraisement shall be published in the Gazette as soon as practicable after the appraisement has been received by the overseer and on such           publication the assessment book shall,     subject to subsection (3), be kept open to inspection, without any charge, by any proprietor during the hours of business of the office of the local authority and he may make copies of any part of the appraisement therein recorded.     (3)   The local authority may if it deems fit post up in a conspicuous position in the village or  country district at such places as may be designated by the local authority copies of the appraisement signed by the Chairman thereof and on such posting up the   requirement, in respect of that appraisement, to keep the assessment book open imposed  by subsection (2) LAWS OF GUYANA Valuation for Rating Purposes Cap. 28:04 37  L.R.O. 1/2012       Cap. 161 1953 Ed.             c. 28:02 Cap. 154 1953 Ed.       Cap. 161 1953 Ed.                               5 of 1959     shall cease to apply.  (3) Notwithstanding the repeal of sections 136 to 142 (inclusive) of the New Amsterdam Town Council Ordinance, the Town Council of New Amsterdam may, appraise or reappraise lots and buildings or lots or buildings as if this Act had not been enacted, and any appraisement or reappraisement made under that Ordinance in force immediately before the commencement of this Act shall continue in force and have effect  until  it   is   superseded  by  a  subsequent  appraisement  or reappraisement of lots and buildings or of lots or buildings made by virtue of this subsection or a valuation list for the Town prepared pursuant to this Act comes into operation.  (4) The   provisions of the Local Government Act, the Georgetown (Valuation and Rating) Ordinance and the New Amsterdam Town Council Ordinance, as the case may be, shall, for the purpose of the assessment, levying and raising of taxes and rates, apply to a valuation list prepared pursuant to this Act and in force in any area.  (5) Notwithstanding the repeals effected by this Act, any regulations or orders made under any of the enactments so repealed and in operation at the commencement of this Act shall, in so far as they are not inconsistent with this Act, continue in operation until revoked by regulations made under this Act.  (6) Any return made to the Valuation Officer pursuant to section 8 of the Local Government (Valuation of Property) Ordinance, 1959, shall have effect as if it were a return made to the Chief Valuation Officer pursuant to this Act, notwithstanding the revocation of any order made under section 5 of that Ordinance prior to the commencement of this Act. LAWS OF GUYANA 38 Cap. 28:04 Valuation for Rating Purposes   L.R.O. 1/2012    Transfer of records. [8 of 1973]  Cap. 152 1953 Ed.   Cap. 154 1953 Ed.                           [9 of 2005]                 Chief Valuation Officer to determine capital value.   Definition of assessed value.    Definition of capital value.",
            "description": [
                {
                    "representation": "(1)",
                    "description": "Notwithstanding the repeal of sections 96 to 104"
                },
                {
                    "representation": "(2)",
                    "description": "LAWS OF GUYANA Valuation for Rating Purposes Cap. 28:04 37  L.R.O. 1/2012       Cap. 161 1953 Ed.             c. 28:02 Cap. 154 1953 Ed.       Cap. 161 1953 Ed.                               5 of 1959     shall cease to apply."
                },
                {
                    "representation": "(3)",
                    "description": "Notwithstanding the repeal of sections 136 to 142"
                },
                {
                    "representation": "(4)",
                    "description": "The   provisions of the Local Government Act, the Georgetown"
                },
                {
                    "representation": "(5)",
                    "description": "Notwithstanding the repeals effected by this Act, any regulations or orders made under any of the enactments so repealed and in operation at the commencement of this Act shall, in so far as they are not inconsistent with this Act, continue in operation until revoked by regulations made under this Act."
                },
                {
                    "representation": "(6)",
                    "description": "Any return made to the Valuation Officer pursuant to section 8 of the Local Government"
                }
            ]
        }
    },
    {
        "act": "VALUATION FOR RATING PURPOSES ACT",
        "source": "https://mola.gov.gy/laws-of-guyana",
        "type": {
            "name": "section",
            "representation": "45",
            "title": "Transfer of records. SCHEDULE\u2014 Rules for the determination of capital value. _________________________ LAWS OF GUYANA Valuation for Rating Purposes Cap. 28:04 5  L.R.O. 1/2012            11 of 1969 CHAPTER 28:04  VALUATION FOR RATING PURPOSES ACT  An Act to make provision for the Valuation of Property for Rating Purposes and for matters connected therewith.                                                                                 [1ST JULY, 1969]      Short title.             Interpretation.                         PART I PRELIMINARY  ",
            "context": "VALUATION FOR RATING PURPOSES ACT under Transfer of records. SCHEDULE Rules for the determination of capital value. _________________________ LAWS OF GUYANA Valuation for Rating Purposes Cap. 28:04 5  L.R.O. 1/2012            11 of 1969 CHAPTER 28:04  VALUATION FOR RATING PURPOSES ACT  An Act to make provision for the Valuation of Property for Rating Purposes and for matters connected therewith.                                                                                 [1ST JULY, 1969]      Short title.             Interpretation.                         PART I PRELIMINARY  45.(1) On the commencement of this Act, all records, plans and information relating to valuation for the purpose of town taxes or rating within  the boundaries of the City of Georgetown as defined in the Georgetown Town Council Ordinance in the custody of the City Council or of the  assessment committee appointed under section 3 of the Georgetown (Valuation and Rating) Ordinance shall be handed over to and be under the control of the Chief Valuation Officer who may use any information therein for the purpose of the preparation of the valuation list.  (2) On the making of an order under section 4 for the preparation of a valuation list for any area, all records, plans and information relating to valuation for rating purposes in such area, in the custody of a local authority shall be handed over to and be under the custody of the Chief Valuation Officer who may use any information therein for the purposes of the preparation of the valuation list.                                            SCHEDULE  RULES FOR THE DETERMINATION OF CAPITAL VALUE",
            "description": [
                {
                    "representation": "(1)",
                    "description": "On the commencement of this Act, all records, plans and information relating to valuation for the purpose of town taxes or rating within  the boundaries of the City of Georgetown as defined in the Georgetown Town Council Ordinance in the custody of the City Council or of the  assessment committee appointed under section 3 of the Georgetown"
                },
                {
                    "representation": "(2)",
                    "description": "On the making of an order under section 4 for the preparation of a valuation list for any area, all records, plans and information relating to valuation for rating purposes in such area, in the custody of a local authority shall be handed over to and be under the custody of the Chief Valuation Officer who may use any information therein for the purposes of the preparation of the valuation list.                                            SCHEDULE  RULES FOR THE DETERMINATION OF CAPITAL VALUE"
                }
            ]
        }
    },
    {
        "act": "VALUATION FOR RATING PURPOSES ACT",
        "source": "https://mola.gov.gy/laws-of-guyana",
        "type": {
            "name": "section",
            "representation": "",
            "title": "672.07 ft. to the northern boundary of Block 30 for a distance of 3,",
            "context": "VALUATION FOR RATING PURPOSES ACT under 672.07 ft. to the northern boundary of Block 30 for a distance of 3,672.07 ft. to the northern boundary of Block 30; thence along the northern boundary of Block 30 for a distance of 7,",
            "description": "672.07 ft. to the northern boundary of Block 30; thence along the northern boundary of Block 30 for a distance of 7,"
        }
    },
    {
        "act": "VALUATION FOR RATING PURPOSES ACT",
        "source": "https://mola.gov.gy/laws-of-guyana",
        "type": {
            "name": "section",
            "representation": "2002",
            "title": "SCHEDULE   BOUNDARIES OF THE TOWN OF ROSE HALL  Being all that area situate in the County of Berbice and bounded as follows;   On the North --- By the Atlantic Ocean    On the South ---  By the southern boundary     of Grant 2914   On the East ---  By the common boundary     between Rose Hall and Port     Mourant and its   LAWS OF GUYANA 72 Cap. 28:04 Valuation for Rating Purposes  [Subsidiary] Valuation for Rating Purposes (Preparation of Valuation List)( Rose Hall Town ) Order   L.R.O. 1/2012                O. 3/2002                     prolongation southwards to     the south-eastern boundary     of Grant ",
            "context": "VALUATION FOR RATING PURPOSES ACT under SCHEDULE   BOUNDARIES OF THE TOWN OF ROSE HALL  Being all that area situate in the County of Berbice and bounded as follows;   On the North --- By the Atlantic Ocean    On the South ---  By the southern boundary     of Grant 2914   On the East ---  By the common boundary     between Rose Hall and Port     Mourant and its   LAWS OF GUYANA 72 Cap. 28:04 Valuation for Rating Purposes  [Subsidiary] Valuation for Rating Purposes (Preparation of Valuation List)( Rose Hall Town ) Order   L.R.O. 1/2012                O. 3/2002                     prolongation southwards to     the south-eastern boundary     of Grant 2002.  LAWS OF GUYANA Valuation for Rating Purposes Cap. 28:04 73 [Subsidiary] Valuation for Rating Purposes (Preparation of Valuation Lists) (Georgetown) Order  (Georgetown)  Order  SCHEDULE   BOUNDARIES OF THE CITY OF GEORGETOWN  Being all that area situate in the County of Demerara and bounded as follows;   On the North --- By the Atlantic Ocean   On the South ---  The southern boundary of     Georgetown, being the     southern Boundary of     Plantation Rome   On the East ---  The eastern boundary of     Georgetown, being the     eastern Boundary of the     company path on the     eastern side of Plantation     Cummings Lodge,       Plantation Houston, and     Plantation Rome.   On the West --- By the Demerara River.                            ____________________         L.R.O. 1/2012 LAWS OF GUYANA 74 Cap. 28:04  Valuation for Rating Purposes [Subsidiary] Valuation for Rating Purposes (Preparation of Valuation List) getown) Order   L.R.O. 1/2012  (Corriverton)   Order O. 9/2002 VALUATION FOR RATING PURPOSES (PREPARATION OF VALUATION LIST) (CORRIVERTON TOWN) ORDER  made under section 4",
            "description": "LAWS OF GUYANA Valuation for Rating Purposes Cap. 28:04 73 [Subsidiary] Valuation for Rating Purposes (Preparation of Valuation Lists) (Georgetown) Order  (Georgetown)  Order  SCHEDULE   BOUNDARIES OF THE CITY OF GEORGETOWN  Being all that area situate in the County of Demerara and bounded as follows;   On the North --- By the Atlantic Ocean   On the South ---  The southern boundary of     Georgetown, being the     southern Boundary of     Plantation Rome   On the East ---  The eastern boundary of     Georgetown, being the     eastern Boundary of the     company path on the     eastern side of Plantation     Cummings Lodge,       Plantation Houston, and     Plantation Rome.   On the West --- By the Demerara River.                            ____________________         L.R.O. 1/2012 LAWS OF GUYANA 74 Cap. 28:04  Valuation for Rating Purposes [Subsidiary] Valuation for Rating Purposes (Preparation of Valuation List) getown) Order   L.R.O. 1/2012  (Corriverton)   Order O. 9/2002 VALUATION FOR RATING PURPOSES (PREPARATION OF VALUATION LIST) (CORRIVERTON TOWN) ORDER  made under section 4"
        }
    },
    {
        "act": "VALUATION FOR RATING PURPOSES ACT",
        "source": "https://mola.gov.gy/laws-of-guyana",
        "type": {
            "name": "section",
            "representation": "2914",
            "title": "On the West --- By the eastern boundary of     the Ketting between     Williamsburg and Rose     Hall and its prolongation     southwards to the south -     western boundary of Grant     ",
            "context": "VALUATION FOR RATING PURPOSES ACT under On the West --- By the eastern boundary of     the Ketting between     Williamsburg and Rose     Hall and its prolongation     southwards to the south -     western boundary of Grant     2914.   ___________________  VALUATION FOR RATING PURPOSES (PREPARATION OF VALUATION LIST) (GEORGETOWN) ORDER  made under section 4",
            "description": "___________________  VALUATION FOR RATING PURPOSES (PREPARATION OF VALUATION LIST) (GEORGETOWN) ORDER  made under section 4"
        }
    }
]