[
    {
        "act": "MEDICAL PRACTITIONERS ACT",
        "source": "https://mola.gov.gy/laws-of-guyana",
        "type": {
            "name": "section",
            "representation": "1",
            "title": "Short title. ",
            "context": "MEDICAL PRACTITIONERS ACT under Short title. 1. This Act may be cited as the Medical Practitioners Act.",
            "description": "This Act may be cited as the Medical Practitioners Act."
        }
    },
    {
        "act": "MEDICAL PRACTITIONERS ACT",
        "source": "https://mola.gov.gy/laws-of-guyana",
        "type": {
            "name": "section",
            "representation": "2",
            "title": "Interpretation.  PART II          ESTABLISHMENT AND FUNCTIONS OF MEDICAL COUNCIL OF GUYANA  ",
            "context": "MEDICAL PRACTITIONERS ACT under Interpretation.  PART II          ESTABLISHMENT AND FUNCTIONS OF MEDICAL COUNCIL OF GUYANA  2.  In this Act   Council means the Medical Council of Guyana established by section 3;  Form means a form in the Second Schedule;   former  ordinance  means  the Medical  Service  Ordinance  or the Medical Practitioners Ordinance;  medical practitioner means a person qualified to practise medicine or surgery, who is duly registered as a medical practitioner under this Act and whose name appears in the register;  Member State has the same meaning assigned to it in the Revised Treaty of Chaguaramas establishing the Caribbean Community (CARICOM),  including  the  CARICOM  Single  Market  and Economy signed at Nassau, The Bahamas, on 5th July, 2001;  national means a person who   (a)       is a citizen of a Member State; or  (b)       has a connection with a Member State of a  kind which entitles him to be regarded as belonging to or, if it be so expressed, as being a native or resident of the State for the purposes of the laws thereof relating to immigration; LAWS OF GUYANA 6 Cap. 32:02 Medical Practitioners   L.R.O. 1/2012                     Establishment of Medical Council of Guyana.   First Schedule.      Functions of Council.                 register means the appropriate register required to be kept by the  Secretary under this Act;  Secretary means the Secretary to the Board;  specialist means a medical practitioner who has had higher medical or surgical training and is registered to practise in that higher specialist skill under this Act.   PART II ESTABLISHMENT  AND FUNCTIONS  OF  MEDICAL  COUNCIL OF  GUYANA",
            "description": [
                {
                    "representation": "(a)",
                    "description": "is a citizen of a Member State; or"
                },
                {
                    "representation": "(b)",
                    "description": "has a connection with a Member State of a  kind which entitles him to be regarded as belonging to or, if it be so expressed, as being a native or resident of the State for the purposes of the laws thereof relating to immigration; LAWS OF GUYANA 6 Cap. 32:02 Medical Practitioners   L.R.O. 1/2012                     Establishment of Medical Council of Guyana.   First Schedule.      Functions of Council.                 register means the appropriate register required to be kept by the  Secretary under this Act;  Secretary means the Secretary to the Board;  specialist means a medical practitioner who has had higher medical or surgical training and is registered to practise in that higher specialist skill under this Act.   PART II ESTABLISHMENT  AND FUNCTIONS  OF  MEDICAL  COUNCIL OF  GUYANA"
                }
            ]
        }
    },
    {
        "act": "MEDICAL PRACTITIONERS ACT",
        "source": "https://mola.gov.gy/laws-of-guyana",
        "type": {
            "name": "section",
            "representation": "3",
            "title": "Establishment of Medical Council of Guyana. ",
            "context": "MEDICAL PRACTITIONERS ACT under Establishment of Medical Council of Guyana. 3. (1) There is hereby established a Council to be known as the Medical Council of Guyana which shall be a body corporate.  (2) The provisions of the First Schedule shall have effect as to the constitution and proceedings of the Council and otherwise in relation thereto.",
            "description": [
                {
                    "representation": "(1)",
                    "description": "There is hereby established a Council to be known as the Medical Council of Guyana which shall be a body corporate."
                },
                {
                    "representation": "(2)",
                    "description": "The provisions of the First Schedule shall have effect as to the constitution and proceedings of the Council and otherwise in relation thereto."
                }
            ]
        }
    },
    {
        "act": "MEDICAL PRACTITIONERS ACT",
        "source": "https://mola.gov.gy/laws-of-guyana",
        "type": {
            "name": "section",
            "representation": "4",
            "title": "Functions of Council.  PART III MEDICAL  PRACTITIONERS  ",
            "context": "MEDICAL PRACTITIONERS ACT under Functions of Council.  PART III MEDICAL  PRACTITIONERS  4. (1) The functions of the Council shall be   (a)      to register medical practitioners;  (b) to appoint examiners and to            conduct examinations in respect  of  persons  applying  for  registration  as  medical practitioners as may from time to time be necessary under the provisions of this Act;  (c)    to   ensure   the   maintenance   of   proper   standards established by the Council of professional conduct by LAWS OF GUYANA Medical Practitioners Cap. 32:02 7  L.R.O. 1/2012                         L.R.O. 1/2012                                       Register of Medical Practitioners. Form 1 Second Schedule.     medical practitioners and when necessary to take disciplinary action;   (d)   to  advise  the Minister  where necessary  on matters relating to medical services in Guyana and the performance of those services by medical practitioners;  (e)    to  deal with matters referred to it by the Minister; and  (f)        to perform such other functions as are              entrusted to it by or under this Act or any other law.  (2) The Council may, subject to the regulations, charge fees for conducting examinations,   issuing certificates,   registering   medical practitioners and for any other services rendered by it, and all such fees shall form part of the funds of the Council.  (3) All expenditure incurred by the Council in carrying out the purposes of this Act shall be defrayed out of the funds of the Council.  PART III MEDICAL  PRACTITIONERS",
            "description": [
                {
                    "representation": "(1)",
                    "description": "The functions of the Council shall be"
                },
                {
                    "representation": "(a)",
                    "description": "to register medical practitioners;"
                },
                {
                    "representation": "(b)",
                    "description": "to appoint examiners and to            conduct examinations in respect  of  persons  applying  for  registration  as  medical practitioners as may from time to time be necessary under the provisions of this Act;"
                },
                {
                    "representation": "(c)",
                    "description": "to   ensure   the   maintenance   of   proper   standards established by the Council of professional conduct by LAWS OF GUYANA Medical Practitioners Cap. 32:02 7  L.R.O. 1/2012                         L.R.O. 1/2012                                       Register of Medical Practitioners. Form 1 Second Schedule.     medical practitioners and when necessary to take disciplinary action;"
                },
                {
                    "representation": "(d)",
                    "description": "to  advise  the Minister  where necessary  on matters relating to medical services in Guyana and the performance of those services by medical practitioners;"
                },
                {
                    "representation": "(e)",
                    "description": "to  deal with matters referred to it by the Minister; and"
                },
                {
                    "representation": "(f)",
                    "description": "to perform such other functions as are              entrusted to it by or under this Act or any other law."
                },
                {
                    "representation": "(2)",
                    "description": "The Council may, subject to the regulations, charge fees for conducting examinations,   issuing certificates,   registering   medical practitioners and for any other services rendered by it, and all such fees shall form part of the funds of the Council."
                },
                {
                    "representation": "(3)",
                    "description": "All expenditure incurred by the Council in carrying out the purposes of this Act shall be defrayed out of the funds of the Council.  PART III MEDICAL  PRACTITIONERS"
                }
            ]
        }
    },
    {
        "act": "MEDICAL PRACTITIONERS ACT",
        "source": "https://mola.gov.gy/laws-of-guyana",
        "type": {
            "name": "section",
            "representation": "5",
            "title": "Register of Medical Practitioners. ",
            "context": "MEDICAL PRACTITIONERS ACT under Register of Medical Practitioners. 5. (1) The Secretary shall keep and maintain a register in Form 1 to be  known  as  the  Register  of  Medical  Practitioners  in  which  the Secretary shall cause to be entered the name and other particulars of every person registered as a medical practitioner under this Act.  (2) Subject to subsection (3), a person whose name is not entered in the register shall be deemed not to be LAWS OF GUYANA 8 Cap. 32:02 Medical Practitioners   L.R.O. 1/2012                                                registered. (3) All persons who were registered as medical practitioners under the former Ordinances immediately prior to the commencement of this Act are entitled to be registered under this Act without application on the part of such persons, and pending the entry of their names in the register they shall be deemed to be duly registered.  (4) The register shall at all reasonable times be open to inspection at the office of the Council by any medical practitioner or other person authorised by the Minister.  (5) The Secretary shall, from time to time, make such alterations as  directed  by the  Council  in  the  qualifications  and  addresses  as necessary of medical practitioners and shall remove from the register the name of a  medical practitioner who is deceased or is no longer entitled to practise medicine or surgery, or whose whereabouts are not known, or who has been continually absent from Guyana for more than three years, not on training, secondment or other purpose approved by the Council:  Provided that the Council may restore a medical practitioners name on the register upon his again fulfilling the requirements for registration in the opinion of the Council.  (6) Any medical practitioner who changes his address shall immediately notify the Secretary of his new address.  (7) When a medical practitioners name has been removed from or restored to the register, the Secretary shall cause such removal or restoration to be published in the Gazette.    LAWS OF GUYANA Medical Practitioners Cap. 32:02 9  L.R.O. 1/2012                         L.R.O. 1/2012 Registration of medical practitioners. [7 of 2006]                          Form 2 Second Schedule.",
            "description": [
                {
                    "representation": "(1)",
                    "description": "The Secretary shall keep and maintain a register in Form 1 to be  known  as  the  Register  of  Medical  Practitioners  in  which  the Secretary shall cause to be entered the name and other particulars of every person registered as a medical practitioner under this Act."
                },
                {
                    "representation": "(2)",
                    "description": "Subject to subsection"
                },
                {
                    "representation": "(3)",
                    "description": "All persons who were registered as medical practitioners under the former Ordinances immediately prior to the commencement of this Act are entitled to be registered under this Act without application on the part of such persons, and pending the entry of their names in the register they shall be deemed to be duly registered."
                },
                {
                    "representation": "(4)",
                    "description": "The register shall at all reasonable times be open to inspection at the office of the Council by any medical practitioner or other person authorised by the Minister."
                },
                {
                    "representation": "(5)",
                    "description": "The Secretary shall, from time to time, make such alterations as  directed  by the  Council  in  the  qualifications  and  addresses  as necessary of medical practitioners and shall remove from the register the name of a  medical practitioner who is deceased or is no longer entitled to practise medicine or surgery, or whose whereabouts are not known, or who has been continually absent from Guyana for more than three years, not on training, secondment or other purpose approved by the Council:  Provided that the Council may restore a medical practitioners name on the register upon his again fulfilling the requirements for registration in the opinion of the Council."
                },
                {
                    "representation": "(6)",
                    "description": "Any medical practitioner who changes his address shall immediately notify the Secretary of his new address."
                },
                {
                    "representation": "(7)",
                    "description": "When a medical practitioners name has been removed from or restored to the register, the Secretary shall cause such removal or restoration to be published in the Gazette.    LAWS OF GUYANA Medical Practitioners Cap. 32:02 9  L.R.O. 1/2012                         L.R.O. 1/2012 Registration of medical practitioners. [7 of 2006]                          Form 2 Second Schedule."
                }
            ]
        }
    },
    {
        "act": "MEDICAL PRACTITIONERS ACT",
        "source": "https://mola.gov.gy/laws-of-guyana",
        "type": {
            "name": "section",
            "representation": "6",
            "title": "Registration of medical practitioners. ",
            "context": "MEDICAL PRACTITIONERS ACT under Registration of medical practitioners. 6. (1) Any person, who applies to the Council to be registered as a medical practitioner and who satisfies the Council that he  (a)       is a citizen of Guyana, the spouse of a        citizen of Guyana, is resident in Guyana or is a national of a Member State;  (b)   can  communicate  satisfactorily in English;  (c)       is of good character;  (d)   holds  a   diploma  or   certificate  obtained by examination after attending a medical school approved by the Council;  (e)     is qualified  to practise independently  in the country where he obtained his Diploma or Certificate,  shall, upon submission of the sworn declaration in Form 2 in the Second Schedule, and  on  payment  of  the  prescribed  fee,  be entitled  with approval of the Council to be registered as a medical practitioner.  (2) The  Council  may  require  any  person  who  applies  for registration as a medical practitioner under this Act and who does not, in accordance with the criteria of the Council whether prescribed or not, fulfil the requirement of subsections (1) (b), (d) or (e) to submit to such examination as the Council thinks necessary.  (3) Where the Council is satisfied that an applicant   for registration fulfils the requirements specified in subsection LAWS OF GUYANA 10 Cap. 32:02 Medical Practitioners   L.R.O. 1/2012     Form 3 Second Schedule.    Registration of higher or additional qualification or training.           Form 4 Second Schedule.   Annual registration of medical practitioners. [ 6 of 1997 4 of 2009] Form 5     Form 6           (1) the Secretary shall register the applicant.  (4) The Secretary shall issue to every person registered as a medical practitioner under this Act a certificate of registration in Form",
            "description": [
                {
                    "representation": "(1)",
                    "description": "the Secretary shall register the applicant."
                },
                {
                    "representation": "(a)",
                    "description": "is a citizen of Guyana, the spouse of a        citizen of Guyana, is resident in Guyana or is a national of a Member State;"
                },
                {
                    "representation": "(b)",
                    "description": "can  communicate  satisfactorily in English;"
                },
                {
                    "representation": "(c)",
                    "description": "is of good character;"
                },
                {
                    "representation": "(d)",
                    "description": "or"
                },
                {
                    "representation": "(e)",
                    "description": "to submit to such examination as the Council thinks necessary."
                },
                {
                    "representation": "(2)",
                    "description": "The  Council  may  require  any  person  who  applies  for registration as a medical practitioner under this Act and who does not, in accordance with the criteria of the Council whether prescribed or not, fulfil the requirement of subsections"
                },
                {
                    "representation": "(3)",
                    "description": "Where the Council is satisfied that an applicant   for registration fulfils the requirements specified in subsection LAWS OF GUYANA 10 Cap. 32:02 Medical Practitioners   L.R.O. 1/2012     Form 3 Second Schedule.    Registration of higher or additional qualification or training.           Form 4 Second Schedule.   Annual registration of medical practitioners. [ 6 of 1997 4 of 2009] Form 5     Form 6"
                },
                {
                    "representation": "(4)",
                    "description": "The Secretary shall issue to every person registered as a medical practitioner under this Act a certificate of registration in Form"
                }
            ]
        }
    },
    {
        "act": "MEDICAL PRACTITIONERS ACT",
        "source": "https://mola.gov.gy/laws-of-guyana",
        "type": {
            "name": "section",
            "representation": "7",
            "title": "Registration of higher or additional qualification or training. ",
            "context": "MEDICAL PRACTITIONERS ACT under Registration of higher or additional qualification or training. 7. (1) A medical practitioner who obtains qualification or training approved by the Council higher than or additional to that in respect of which he is registered shall be entitled with the approval of the Council to have such higher or additional qualification or training entered by the Secretary to his name in the register.  (2) The Secretary shall issue to such medical practitioner a certificate for the higher or additional qualification or training in Form 4 in substitution for or in addition to, as the case may be, the qualification in respect of which he is registered.",
            "description": [
                {
                    "representation": "(1)",
                    "description": "A medical practitioner who obtains qualification or training approved by the Council higher than or additional to that in respect of which he is registered shall be entitled with the approval of the Council to have such higher or additional qualification or training entered by the Secretary to his name in the register."
                },
                {
                    "representation": "(2)",
                    "description": "The Secretary shall issue to such medical practitioner a certificate for the higher or additional qualification or training in Form 4 in substitution for or in addition to, as the case may be, the qualification in respect of which he is registered."
                }
            ]
        }
    },
    {
        "act": "MEDICAL PRACTITIONERS ACT",
        "source": "https://mola.gov.gy/laws-of-guyana",
        "type": {
            "name": "section",
            "representation": "8",
            "title": "Annual registration of medical practitioners. ",
            "context": "MEDICAL PRACTITIONERS ACT under Annual registration of medical practitioners. 8. (1) The Secretary shall keep a register in Form 5 to be known as the Annual Register of Medical Practitioners,  and enter therein the names and other particulars of all persons entitled to practise medicine or surgery in each year.  (2) A medical practitioner who desires to practise as such in Guyana in any year shall, in the month of January of that year, cause his name to be registered in the Annual Register of Medical Practitioners and obtain a licence of such registration in Form 6, from the Secretary on payment of the prescribed fee.  (3) In order to be registered  under subsection  (2) a medical practitioner must submit evidence of having attended a minimum of twelve academic sessions of which a maximum of four academic credits could be on-line CME offered by a recognised agency, institution or professional body, recognised by the Council during the preceding year, LAWS OF GUYANA Medical Practitioners Cap. 32:02 11  L.R.O. 1/2012                         L.R.O. 1/2012                     Publication of list of medical practitioners.                    Internship, institutional, full registration.  but where a medical practitioner is being registered for the first time he shall at that time be required to obtain a licence of annual registration on payment to the Secretary of the prescribed fee:  Provided that the Council may waive the requirement of attendance at   academic  sessions  where  the  Council  is  satisfied  that  it  was impracticable for the medical practitioner to attend such sessions.  (4) A person who practises as a medical practitioner without having been registered under this section shall be guilty of an offence punishable on summary conviction by a fine of thirty thousand dollars and a further fine of fifteen hundred dollars for each day he so practises.",
            "description": [
                {
                    "representation": "(1)",
                    "description": "The Secretary shall keep a register in Form 5 to be known as the Annual Register of Medical Practitioners,  and enter therein the names and other particulars of all persons entitled to practise medicine or surgery in each year."
                },
                {
                    "representation": "(2)",
                    "description": "a medical practitioner must submit evidence of having attended a minimum of twelve academic sessions of which a maximum of four academic credits could be on-line CME offered by a recognised agency, institution or professional body, recognised by the Council during the preceding year, LAWS OF GUYANA Medical Practitioners Cap. 32:02 11  L.R.O. 1/2012                         L.R.O. 1/2012                     Publication of list of medical practitioners.                    Internship, institutional, full registration.  but where a medical practitioner is being registered for the first time he shall at that time be required to obtain a licence of annual registration on payment to the Secretary of the prescribed fee:  Provided that the Council may waive the requirement of attendance at   academic  sessions  where  the  Council  is  satisfied  that  it  was impracticable for the medical practitioner to attend such sessions."
                },
                {
                    "representation": "(3)",
                    "description": "In order to be registered  under subsection"
                },
                {
                    "representation": "(4)",
                    "description": "A person who practises as a medical practitioner without having been registered under this section shall be guilty of an offence punishable on summary conviction by a fine of thirty thousand dollars and a further fine of fifteen hundred dollars for each day he so practises."
                }
            ]
        }
    },
    {
        "act": "MEDICAL PRACTITIONERS ACT",
        "source": "https://mola.gov.gy/laws-of-guyana",
        "type": {
            "name": "section",
            "representation": "9",
            "title": "Publication of list of medical practitioners. ",
            "context": "MEDICAL PRACTITIONERS ACT under Publication of list of medical practitioners. 9. (1) The Secretary shall cause to be published in the Gazette in the month of February in each year an alphabetical list, surname first, of persons and their qualifications  (a) who have been registered as            medical practitioners under section 6; and  (b)    who  have,  at  the  31st  January  in  that  year,  been registered pursuant to section",
            "description": [
                {
                    "representation": "(1)",
                    "description": "The Secretary shall cause to be published in the Gazette in the month of February in each year an alphabetical list, surname first, of persons and their qualifications"
                },
                {
                    "representation": "(a)",
                    "description": "who have been registered as            medical practitioners under section 6; and"
                },
                {
                    "representation": "(b)",
                    "description": "who  have,  at  the  31st  January  in  that  year,  been registered pursuant to section"
                }
            ]
        }
    },
    {
        "act": "MEDICAL PRACTITIONERS ACT",
        "source": "https://mola.gov.gy/laws-of-guyana",
        "type": {
            "name": "section",
            "representation": "10",
            "title": "Internship, institutional, full registration. ",
            "context": "MEDICAL PRACTITIONERS ACT under Internship, institutional, full registration. 10.(1) Notwithstanding the provisions of section 6, the Secretary with the approval of the Council may  (a)    grant internship  registration  to any LAWS OF GUYANA 12 Cap. 32:02 Medical Practitioners   L.R.O. 1/2012         Third Schedule.   Form 7 Second Schedule.       Form 8 Second Schedule.                     Third Schedule.    person,  who  has satisfied the requirements of section 6 (1), (a), (b), (c) and (d) and is employed as an intern in any hospital or other institution in Guyana, approved by the Council as set out in the Third Schedule, for a period of not less than one year and furnish him with a licence of internship in Form 7 on payment of the prescribed fees; or  (b)     grant institutional registration for not more than three years  to  any  person  and  furnish  him  with  a  licence  of registration in Form 8, on payment of the prescribed fee, if such person  (i)      does  not  fulfil  the requirement of  section 6 (1) (a), (b), (d) or (e) but whose qualification is recognised for the time being by the Council as furnishing sufficient evidence of the possession of the requisite knowledge and skill for the efficient practice of medicine or surgery; and (ii)     satisfies the  Council  that  he is               employed  or  has been selected for employment in any institution in the Government specified by the Minister or in any hospital mentioned in the Third Schedule;  (c)      grant   full registration to any   person who has satisfactorily completed the LAWS OF GUYANA Medical Practitioners Cap. 32:02 13  L.R.O. 1/2012                         L.R.O. 1/2012    Form 9   Second Schedule.  Form 10 Second Schedule.               Validity of certificate issued by medical practitioner.      Fraudulently attempting to register. [6 of 1997]        period of institutional or internship registration and furnish him with a certificate of registration in Form 9 on payment of the prescribed fee;  (d)     grant a licence in Form 10 for a period not exceeding nine months to  any person  who  satisfies the requirements  of section 6 (1) (c), (d) and (e), but not (a) and (b), on payment to the Secretary of the prescribed fee which may be waived by the  Chairman  of the Council  provided  that  no fee is accepted by  the person for all medical  services rendered under this licence.  (2) No person shall be entitled to possess at any time more than one certificate of registration.",
            "description": [
                {
                    "representation": "(1)",
                    "description": "(c),"
                },
                {
                    "representation": "(a)",
                    "description": "and"
                },
                {
                    "representation": "(c)",
                    "description": "grant   full registration to any   person who has satisfactorily completed the LAWS OF GUYANA Medical Practitioners Cap. 32:02 13  L.R.O. 1/2012                         L.R.O. 1/2012    Form 9   Second Schedule.  Form 10 Second Schedule.               Validity of certificate issued by medical practitioner.      Fraudulently attempting to register. [6 of 1997]        period of institutional or internship registration and furnish him with a certificate of registration in Form 9 on payment of the prescribed fee;"
                },
                {
                    "representation": "(d)",
                    "description": "and"
                },
                {
                    "representation": "(b)",
                    "description": "grant institutional registration for not more than three years  to  any  person  and  furnish  him  with  a  licence  of registration in Form 8, on payment of the prescribed fee, if such person"
                },
                {
                    "representation": "(i)",
                    "description": "does  not  fulfil  the requirement of  section 6"
                },
                {
                    "representation": "(e)",
                    "description": "but whose qualification is recognised for the time being by the Council as furnishing sufficient evidence of the possession of the requisite knowledge and skill for the efficient practice of medicine or surgery; and"
                },
                {
                    "representation": "(2)",
                    "description": "No person shall be entitled to possess at any time more than one certificate of registration."
                }
            ]
        }
    },
    {
        "act": "MEDICAL PRACTITIONERS ACT",
        "source": "https://mola.gov.gy/laws-of-guyana",
        "type": {
            "name": "section",
            "representation": "11",
            "title": "Validity of certificate issued by medical practitioner.  PART IV OFFENCES  ",
            "context": "MEDICAL PRACTITIONERS ACT under Validity of certificate issued by medical practitioner.  PART IV OFFENCES  11. Subject to any other law, no certificate required to be signed by a medical practitioner shall be valid unless the person signing it is a medical practitioner registered under this Act.  PART IV OFFENCES",
            "description": "Subject to any other law, no certificate required to be signed by a medical practitioner shall be valid unless the person signing it is a medical practitioner registered under this Act.  PART IV OFFENCES"
        }
    },
    {
        "act": "MEDICAL PRACTITIONERS ACT",
        "source": "https://mola.gov.gy/laws-of-guyana",
        "type": {
            "name": "section",
            "representation": "12",
            "title": "Fraudulently attempting to register. ",
            "context": "MEDICAL PRACTITIONERS ACT under Fraudulently attempting to register. 12. A person who  (a)    wilfully   procures   or  attempts  to  procure  registration under this Act for himself or for any other person by making or producing or causing to be made or produced, any false or fraudulent representation  or declaration,  either verbally, in LAWS OF GUYANA 14 Cap. 32:02 Medical Practitioners   L.R.O. 1/2012                        Improper use of medical title. [6 of 1997]                                  writing or otherwise; or  (b)     aids   or   assists  any person therein,   shall be guilty of an offence under this Act and liable on summary conviction to a fine of one hundred and fifty thousand dollars and to imprisonment for two years.",
            "description": [
                {
                    "representation": "(a)",
                    "description": "wilfully   procures   or  attempts  to  procure  registration under this Act for himself or for any other person by making or producing or causing to be made or produced, any false or fraudulent representation  or declaration,  either verbally, in LAWS OF GUYANA 14 Cap. 32:02 Medical Practitioners   L.R.O. 1/2012                        Improper use of medical title. [6 of 1997]                                  writing or otherwise; or"
                },
                {
                    "representation": "(b)",
                    "description": "aids   or   assists  any person therein,   shall be guilty of an offence under this Act and liable on summary conviction to a fine of one hundred and fifty thousand dollars and to imprisonment for two years."
                }
            ]
        }
    },
    {
        "act": "MEDICAL PRACTITIONERS ACT",
        "source": "https://mola.gov.gy/laws-of-guyana",
        "type": {
            "name": "section",
            "representation": "13",
            "title": "Improper use of medical title. ",
            "context": "MEDICAL PRACTITIONERS ACT under Improper use of medical title. 13.(1) Any person, not being a medical practitioner who  (a)      takes  or  uses the name, title, addition or description implying or calculated to imply that he is registered as a medical practitioner under this Act or that he is recognised by law as a person authorised or qualified to practise medicine or surgery;  (b)   assumes   or   uses   any   affix   indicative   of   any occupational designation relating to the practice of medicine or surgery; or  (c)       pretends  to be or holds himself out as, whether directly or by implication, a person practising or authorised or qualified to practise medicine or surgery,  shall be guilty of an offence and liable on summary conviction to a fine of two hundred and twenty-five thousand dollars and to imprisonment for eighteen months.  (2) The provisions of subsection (1) shall not apply to the practice of medicine or surgery by any person  LAWS OF GUYANA Medical Practitioners Cap. 32:02 15  L.R.O. 1/2012                         L.R.O. 1/2012                                               (a)     acting  under  the  direct  supervision  of  a  medical practitioner;  (b)       having internship or institutional              registration;  (c)     registered, licensed or enrolled under any written law, who  under the authority thereof performs or provides any service  which  he is authorised  or entitled  to perform  or provide; or  (d)   who renders first aid to the sick or injured,  or who as a duly registered chemist and druggist exercises what is known as counter prescribing in the ordinary course of his business and under the conditions determined by the Council.  (3) Any person registered as a medical practitioner under this Act who  (a)      uses  on  any letter-head or sign-board at his premises or clinic,  any  name,  title,  addition  or  description  reasonably calculated to suggest that he is a specialist or an expert or possesses any professional status or qualification higher than a  professional  status  or  qualification,  which  he  in  fact possesses and which is entered in the register; or  (b)  advertises in connection with his practice, except under the  conditions  LAWS OF GUYANA 16 Cap. 32:02 Medical Practitioners   L.R.O. 1/2012                    Molestation of medical practitioners in execution of duty. [6 of 1997]            General penalty. [6 of 1997]         Medical districts.                 Disciplinary proceedings. prescribed  by  regulations  governing  the advertising by a medical practitioner,  shall be guilty of an offence under this Act and liable on summary conviction to a fine of one hundred and fifty thousand dollars and to imprisonment for eighteen months, and a further fine of six thousand dollars for each day that the offence continues.",
            "description": [
                {
                    "representation": "(1)",
                    "description": "shall not apply to the practice of medicine or surgery by any person  LAWS OF GUYANA Medical Practitioners Cap. 32:02 15  L.R.O. 1/2012                         L.R.O. 1/2012"
                },
                {
                    "representation": "(a)",
                    "description": "uses  on  any letter-head or sign-board at his premises or clinic,  any  name,  title,  addition  or  description  reasonably calculated to suggest that he is a specialist or an expert or possesses any professional status or qualification higher than a  professional  status  or  qualification,  which  he  in  fact possesses and which is entered in the register; or"
                },
                {
                    "representation": "(b)",
                    "description": "advertises in connection with his practice, except under the  conditions  LAWS OF GUYANA 16 Cap. 32:02 Medical Practitioners   L.R.O. 1/2012                    Molestation of medical practitioners in execution of duty. [6 of 1997]            General penalty. [6 of 1997]         Medical districts.                 Disciplinary proceedings. prescribed  by  regulations  governing  the advertising by a medical practitioner,  shall be guilty of an offence under this Act and liable on summary conviction to a fine of one hundred and fifty thousand dollars and to imprisonment for eighteen months, and a further fine of six thousand dollars for each day that the offence continues."
                },
                {
                    "representation": "(c)",
                    "description": "registered, licensed or enrolled under any written law, who  under the authority thereof performs or provides any service  which  he is authorised  or entitled  to perform  or provide; or"
                },
                {
                    "representation": "(2)",
                    "description": "The provisions of subsection"
                },
                {
                    "representation": "(d)",
                    "description": "who renders first aid to the sick or injured,  or who as a duly registered chemist and druggist exercises what is known as counter prescribing in the ordinary course of his business and under the conditions determined by the Council."
                },
                {
                    "representation": "(3)",
                    "description": "Any person registered as a medical practitioner under this Act who"
                }
            ]
        }
    },
    {
        "act": "MEDICAL PRACTITIONERS ACT",
        "source": "https://mola.gov.gy/laws-of-guyana",
        "type": {
            "name": "section",
            "representation": "14",
            "title": "Molestation of medical practitioners in execution of duty.   LAWS OF GUYANA 4 Cap. 32:02 Medical Practitioners   L.R.O. 1/2012  SECTION ",
            "context": "MEDICAL PRACTITIONERS ACT under Molestation of medical practitioners in execution of duty.   LAWS OF GUYANA 4 Cap. 32:02 Medical Practitioners   L.R.O. 1/2012  SECTION 14. Any  person  who  molests,  hinders,  or opposes  any  medical practitioner during the exercise of any function under this Act or any other written law shall be guilty of an offence and liable on summary conviction to a fine of thirty thousand dollars and to imprisonment for twelve months.",
            "description": "Any  person  who  molests,  hinders,  or opposes  any  medical practitioner during the exercise of any function under this Act or any other written law shall be guilty of an offence and liable on summary conviction to a fine of thirty thousand dollars and to imprisonment for twelve months."
        }
    },
    {
        "act": "MEDICAL PRACTITIONERS ACT",
        "source": "https://mola.gov.gy/laws-of-guyana",
        "type": {
            "name": "section",
            "representation": "15",
            "title": "General penalty.  PART V MISCELLANEOUS  ",
            "context": "MEDICAL PRACTITIONERS ACT under General penalty.  PART V MISCELLANEOUS  15. Any  person  who  is  in  breach  of  any  of  the  restrictions, requirements or conditions imposed by this Act or regulations, for which no  specific  penalty  has been  provided,  shall  be liable  on summary conviction to a fine of sixty thousand dollars and to imprisonment for two years.  PART V MISCELLANEOUS",
            "description": "Any  person  who  is  in  breach  of  any  of  the  restrictions, requirements or conditions imposed by this Act or regulations, for which no  specific  penalty  has been  provided,  shall  be liable  on summary conviction to a fine of sixty thousand dollars and to imprisonment for two years.  PART V MISCELLANEOUS"
        }
    },
    {
        "act": "MEDICAL PRACTITIONERS ACT",
        "source": "https://mola.gov.gy/laws-of-guyana",
        "type": {
            "name": "section",
            "representation": "16",
            "title": "Medical districts. ",
            "context": "MEDICAL PRACTITIONERS ACT under Medical districts. 16. (1) The Minister may by order specify any part of Guyana to be a medical district and may, from time to time, likewise alter or revoke any order so made, or alter the limits of any medical district, including those referred to in subsection (2).  (2) Subject to subsection (1), the medical districts existing at the commencement of this Act shall be deemed to have been specified under this section.",
            "description": [
                {
                    "representation": "(1)",
                    "description": "The Minister may by order specify any part of Guyana to be a medical district and may, from time to time, likewise alter or revoke any order so made, or alter the limits of any medical district, including those referred to in subsection"
                },
                {
                    "representation": "(2)",
                    "description": "Subject to subsection"
                }
            ]
        }
    },
    {
        "act": "MEDICAL PRACTITIONERS ACT",
        "source": "https://mola.gov.gy/laws-of-guyana",
        "type": {
            "name": "section",
            "representation": "17",
            "title": "Disciplinary proceedings. ",
            "context": "MEDICAL PRACTITIONERS ACT under Disciplinary proceedings. 17.  (1) A medical practitioner who is   LAWS OF GUYANA Medical Practitioners Cap. 32:02 17  L.R.O. 1/2012                         L.R.O. 1/2012                                               (a)   convicted  of  an  offence  outside  Guyana  which  if committed in Guyana would be punishable on indictment;  (b)      convicted  of such offence in Guyana; or  (c)     guilty  of  professional misconduct or malpractice,   shall be subject to disciplinary proceedings.  (2) Where it shall appear, or be represented, to the Council that a  medical  practitioner  may be guilty of professional  misconduct  or malpractice  the  Council  shall  afford  the  practitioner  a  reasonable opportunity of answering the complaint.  (3) Where in any proceedings under this section the Council is satisfied that a medical practitioner was convicted of an offence under subsection (1) (a) or (b) or is found guilty of professional misconduct or malpractice, it may  (a)      censure him;  (b)   suspend  his registration  for such period as may be determined by the Council and approved by the Minister;  (c)    direct the  Secretary  to remove  his name  from  the register.  (4) When the name of any person is removed from the register, the  Council  may,  in writing,  require  such  LAWS OF GUYANA 18 Cap. 32:02 Medical Practitioners   L.R.O. 1/2012           Restoration of name to register.             Appeals.                     Councils discretionary power of erasure in registers.           person  to return  to the Secretary  his certificate of registration and such person shall comply with that requirement.",
            "description": [
                {
                    "representation": "(1)",
                    "description": "(a) or"
                },
                {
                    "representation": "(a)",
                    "description": "censure him;"
                },
                {
                    "representation": "(b)",
                    "description": "suspend  his registration  for such period as may be determined by the Council and approved by the Minister;"
                },
                {
                    "representation": "(c)",
                    "description": "direct the  Secretary  to remove  his name  from  the register."
                },
                {
                    "representation": "(2)",
                    "description": "Where it shall appear, or be represented, to the Council that a  medical  practitioner  may be guilty of professional  misconduct  or malpractice  the  Council  shall  afford  the  practitioner  a  reasonable opportunity of answering the complaint."
                },
                {
                    "representation": "(3)",
                    "description": "Where in any proceedings under this section the Council is satisfied that a medical practitioner was convicted of an offence under subsection"
                },
                {
                    "representation": "(4)",
                    "description": "When the name of any person is removed from the register, the  Council  may,  in writing,  require  such  LAWS OF GUYANA 18 Cap. 32:02 Medical Practitioners   L.R.O. 1/2012           Restoration of name to register.             Appeals.                     Councils discretionary power of erasure in registers.           person  to return  to the Secretary  his certificate of registration and such person shall comply with that requirement."
                }
            ]
        }
    },
    {
        "act": "MEDICAL PRACTITIONERS ACT",
        "source": "https://mola.gov.gy/laws-of-guyana",
        "type": {
            "name": "section",
            "representation": "18",
            "title": "Restoration of name to register. ",
            "context": "MEDICAL PRACTITIONERS ACT under Restoration of name to register. 18.(1) The Council may at any time, and shall upon a decision on an appeal under section 19 that the name of a practitioner shall be restored to the register, direct the Secretary to restore to the register any name removed therefrom under section 17(3).  (2) The Council shall, as soon as practicable after suspending the registration of a medical practitioner under section 17(3) or after the restoration of the name of any person to the register under subsection (l), cause notice thereof to be published in the Gazette .",
            "description": [
                {
                    "representation": "(1)",
                    "description": "The Council may at any time, and shall upon a decision on an appeal under section 19 that the name of a practitioner shall be restored to the register, direct the Secretary to restore to the register any name removed therefrom under section 17(3)."
                },
                {
                    "representation": "(2)",
                    "description": "The Council shall, as soon as practicable after suspending the registration of a medical practitioner under section 17(3) or after the restoration of the name of any person to the register under subsection"
                }
            ]
        }
    },
    {
        "act": "MEDICAL PRACTITIONERS ACT",
        "source": "https://mola.gov.gy/laws-of-guyana",
        "type": {
            "name": "section",
            "representation": "19",
            "title": "Appeals. ",
            "context": "MEDICAL PRACTITIONERS ACT under Appeals. 19. Any person who is aggrieved by the refusal of the Council to register him under this Act or by its decision to censure him or suspend his registration or cause his name to be removed from the register may within six weeks of the communication to him of the decision of the Council appeal to a Judge of the High Court in Chambers, who shall give such directions in the matter as he may think proper, including a direction as to the costs of the appeal.",
            "description": "Any person who is aggrieved by the refusal of the Council to register him under this Act or by its decision to censure him or suspend his registration or cause his name to be removed from the register may within six weeks of the communication to him of the decision of the Council appeal to a Judge of the High Court in Chambers, who shall give such directions in the matter as he may think proper, including a direction as to the costs of the appeal."
        }
    },
    {
        "act": "MEDICAL PRACTITIONERS ACT",
        "source": "https://mola.gov.gy/laws-of-guyana",
        "type": {
            "name": "section",
            "representation": "20",
            "title": "Council\u2019s discretionary power of erasure in registers. ",
            "context": "MEDICAL PRACTITIONERS ACT under Councils discretionary power of erasure in registers. 20. (1) The Council shall cause to be removed from any of the registers kept under this Act any entry which has been incorrectly or fraudulently made.  (2) Where the Council directs the removal from any of the registers of the name of any person, or of any other entry the name of that person or entry shall not again be entered in the register, except by direction of the Council.  (3) If the Council thinks fit in any case, it may direct the Secretary to restore to any of the registers, any name or entry erased there from, either without fee or on LAWS OF GUYANA Medical Practitioners Cap. 32:02 19  L.R.O. 1/2012                           L.R.O. 1/2012                 Evidence of registration.               Recovery of fees.               Regulations. [12 of 2001]      payment of the prescribed fee, and the Secretary shall restore the same accordingly.  (4) The name of any person removed from any of the registers at the request of such person or with his consent shall, unless it was liable to be erased by order of the Council, be restored to the register from which it was erased on his application therefor and on payment of the prescribed fee.",
            "description": [
                {
                    "representation": "(1)",
                    "description": "The Council shall cause to be removed from any of the registers kept under this Act any entry which has been incorrectly or fraudulently made."
                },
                {
                    "representation": "(2)",
                    "description": "Where the Council directs the removal from any of the registers of the name of any person, or of any other entry the name of that person or entry shall not again be entered in the register, except by direction of the Council."
                },
                {
                    "representation": "(3)",
                    "description": "If the Council thinks fit in any case, it may direct the Secretary to restore to any of the registers, any name or entry erased there from, either without fee or on LAWS OF GUYANA Medical Practitioners Cap. 32:02 19  L.R.O. 1/2012                           L.R.O. 1/2012                 Evidence of registration.               Recovery of fees.               Regulations. [12 of 2001]      payment of the prescribed fee, and the Secretary shall restore the same accordingly."
                },
                {
                    "representation": "(4)",
                    "description": "The name of any person removed from any of the registers at the request of such person or with his consent shall, unless it was liable to be erased by order of the Council, be restored to the register from which it was erased on his application therefor and on payment of the prescribed fee."
                }
            ]
        }
    },
    {
        "act": "MEDICAL PRACTITIONERS ACT",
        "source": "https://mola.gov.gy/laws-of-guyana",
        "type": {
            "name": "section",
            "representation": "21",
            "title": "Evidence of registration. ",
            "context": "MEDICAL PRACTITIONERS ACT under Evidence of registration. 21. Copies of the registers for the time being published in the Gazette in  accordance with the provisions of this Act shall be prima facie evidence  in all cases, that the persons and the qualifications  therein specified are registered under this Act:  Provided that in the case of a person whose name does not appear in the Gazette, a certified statement under the hand of the Secretary of the entry of his name or qualification in any particular register shall be conclusive evidence thereof.",
            "description": "Copies of the registers for the time being published in the Gazette in  accordance with the provisions of this Act shall be prima facie evidence  in all cases, that the persons and the qualifications  therein specified are registered under this Act:  Provided that in the case of a person whose name does not appear in the Gazette, a certified statement under the hand of the Secretary of the entry of his name or qualification in any particular register shall be conclusive evidence thereof."
        }
    },
    {
        "act": "MEDICAL PRACTITIONERS ACT",
        "source": "https://mola.gov.gy/laws-of-guyana",
        "type": {
            "name": "section",
            "representation": "22",
            "title": "Recovery of fees. ",
            "context": "MEDICAL PRACTITIONERS ACT under Recovery of fees. 22.(1) A registered medical practitioner shall be entitled to demand and recover reasonable charges for professional services rendered and the cost of any medicines or medical or surgical appliance supplied by him to his patients.  (2) No person shall be entitled to recover any fees or other charges in a court for rendering medical services or for prescribing and supplying medicines, unless he is duly registered under this Act.",
            "description": [
                {
                    "representation": "(1)",
                    "description": "A registered medical practitioner shall be entitled to demand and recover reasonable charges for professional services rendered and the cost of any medicines or medical or surgical appliance supplied by him to his patients."
                },
                {
                    "representation": "(2)",
                    "description": "No person shall be entitled to recover any fees or other charges in a court for rendering medical services or for prescribing and supplying medicines, unless he is duly registered under this Act."
                }
            ]
        }
    },
    {
        "act": "MEDICAL PRACTITIONERS ACT",
        "source": "https://mola.gov.gy/laws-of-guyana",
        "type": {
            "name": "section",
            "representation": "23",
            "title": "Regulations. ",
            "context": "MEDICAL PRACTITIONERS ACT under Regulations. 23.(1) The  Minister  on  the  advice  of  the  Council  may  make regulations which are necessary for carrying out the purposes of this Act.  (2) In particular and without prejudice to the generality of the power conferred by subsection (1) such LAWS OF GUYANA 20 Cap. 32:02 Medical Practitioners   L.R.O. 1/2012                                                regulations may provide for  (a)    keeping   of  the   registers  and  the making of entries and erasures therein;  (b)    determining   professional   conduct   and general  fitness to practise medicine or surgery;  (c)  instituting disciplinary proceedings  against a medical practitioner in relation to any charge under section 17 and the manner in which such proceedings are to be conducted;  (d)     the  criteria  by  which  to   determine  the  eligibility  for registration  of  persons   who  do  not  possess   the  required qualifications and the fees for such examinations;  (e)    prescribing the fees to be paid to the Council by medical practitioners, or any other person for any certificate or other document issued or other services performed by the Council;  (f)       prescribing fees for registration;  (g) specifying conditions governing advertising by medical practitioners;  (h)   determining   the  conditions under which any person may obtain the benefit of the   professional services of a government medical officer; LAWS OF GUYANA Medical Practitioners Cap. 32:02 21  L.R.O. 1/2012                         L.R.O. 1/2012            First Schedule                     Power to amend Schedules.   Repeal and savings.          (i)  specifying the circumstances when giving of  information to the patient as to the diagnosis of his illness and the   medication  prescribed  by  the  medical  practitioner  is prohibited;  (j)    prescribing  the  procedure  for the conduct of elections to the Council of those members referred to in paragraph 1 (c) of the First Schedule:   Provided that regulations for the purpose of the first elections of such members shall be made by the Minister within thirty days of the coming into operation of this paragraph and such regulations shall be deemed to have been made by the Minister on the advice of the Council;  (k)      prescribing anything which is required to be or may be prescribed by this Act.",
            "description": [
                {
                    "representation": "(1)",
                    "description": "such LAWS OF GUYANA 20 Cap. 32:02 Medical Practitioners   L.R.O. 1/2012                                                regulations may provide for"
                },
                {
                    "representation": "(2)",
                    "description": "In particular and without prejudice to the generality of the power conferred by subsection"
                },
                {
                    "representation": "(a)",
                    "description": "keeping   of  the   registers  and  the making of entries and erasures therein;"
                },
                {
                    "representation": "(b)",
                    "description": "determining   professional   conduct   and general  fitness to practise medicine or surgery;"
                },
                {
                    "representation": "(c)",
                    "description": "of the First Schedule:   Provided that regulations for the purpose of the first elections of such members shall be made by the Minister within thirty days of the coming into operation of this paragraph and such regulations shall be deemed to have been made by the Minister on the advice of the Council;"
                },
                {
                    "representation": "(d)",
                    "description": "the  criteria  by  which  to   determine  the  eligibility  for registration  of  persons   who  do  not  possess   the  required qualifications and the fees for such examinations;"
                },
                {
                    "representation": "(e)",
                    "description": "prescribing the fees to be paid to the Council by medical practitioners, or any other person for any certificate or other document issued or other services performed by the Council;"
                },
                {
                    "representation": "(f)",
                    "description": "prescribing fees for registration;"
                },
                {
                    "representation": "(g)",
                    "description": "specifying conditions governing advertising by medical practitioners;"
                },
                {
                    "representation": "(h)",
                    "description": "determining   the  conditions under which any person may obtain the benefit of the   professional services of a government medical officer; LAWS OF GUYANA Medical Practitioners Cap. 32:02 21  L.R.O. 1/2012                         L.R.O. 1/2012            First Schedule                     Power to amend Schedules.   Repeal and savings."
                },
                {
                    "representation": "(i)",
                    "description": "specifying the circumstances when giving of  information to the patient as to the diagnosis of his illness and the   medication  prescribed  by  the  medical  practitioner  is prohibited;"
                },
                {
                    "representation": "(j)",
                    "description": "prescribing  the  procedure  for the conduct of elections to the Council of those members referred to in paragraph 1"
                },
                {
                    "representation": "(k)",
                    "description": "prescribing anything which is required to be or may be prescribed by this Act."
                }
            ]
        }
    },
    {
        "act": "MEDICAL PRACTITIONERS ACT",
        "source": "https://mola.gov.gy/laws-of-guyana",
        "type": {
            "name": "section",
            "representation": "24",
            "title": "Power to amend Schedules. ",
            "context": "MEDICAL PRACTITIONERS ACT under Power to amend Schedules. 24.  The Minister may, on the advice of the Council, amend the Second and Third Schedules.",
            "description": "The Minister may, on the advice of the Council, amend the Second and Third Schedules."
        }
    },
    {
        "act": "MEDICAL PRACTITIONERS ACT",
        "source": "https://mola.gov.gy/laws-of-guyana",
        "type": {
            "name": "section",
            "representation": "25",
            "title": "Repeal and savings. ",
            "context": "MEDICAL PRACTITIONERS ACT under Repeal and savings. 25. (1) The following laws are hereby repealed   (a) the Medical Service Ordinance, except in so far as it relates to dentists, sick nurses and dispensers and osteopaths;  (b) the Medical Practitioners (Temporary Registration) Ordinance;   LAWS OF GUYANA 22 Cap. 32:02 Medical Practitioners   L.R.O. 1/2012                      Members to vacate office on constitution of new Council. [12 of 2001]                Constitution of the Council [12 of 2001]       (c) the Medical Practitioners Ordinance; and  (d) the Medical Practitioners (Registration) Ordinance,",
            "description": [
                {
                    "representation": "(1)",
                    "description": "The following laws are hereby repealed"
                },
                {
                    "representation": "(a)",
                    "description": "the Medical Service Ordinance, except in so far as it relates to dentists, sick nurses and dispensers and osteopaths;"
                },
                {
                    "representation": "(b)",
                    "description": "the Medical Practitioners"
                },
                {
                    "representation": "(c)",
                    "description": "the Medical Practitioners Ordinance; and"
                },
                {
                    "representation": "(d)",
                    "description": "the Medical Practitioners"
                }
            ]
        }
    },
    {
        "act": "MEDICAL PRACTITIONERS ACT",
        "source": "https://mola.gov.gy/laws-of-guyana",
        "type": {
            "name": "section",
            "representation": "26",
            "title": "Members to vacate office on constitution of new Council.   FIRST SCHEDULE\u2014Constitution and proceedings of the Council   SECOND SCHEDULE\u2014Forms  THIRD SCHEDULE\u2014Hospitals  or institutions  approved  by  the Council  __________________________  CHAPTER 32:02  MEDICAL PRACTITIONERS ACT   16 of 1991 An Act to make new provision for the registration of medical practitioners and for matters connected therewith.  [27TH SEPTEMBER, 1991   LAWS OF GUYANA Medical Practitioners Cap. 32:02 5  L.R.O. 1/2012                         L.R.O. 1/2012 PART I PRELIMINARY Short title.       Interpretation. [7 of 2006]                                       ",
            "context": "MEDICAL PRACTITIONERS ACT under Members to vacate office on constitution of new Council.   FIRST SCHEDULEConstitution and proceedings of the Council   SECOND SCHEDULEForms  THIRD SCHEDULEHospitals  or institutions  approved  by  the Council  __________________________  CHAPTER 32:02  MEDICAL PRACTITIONERS ACT   16 of 1991 An Act to make new provision for the registration of medical practitioners and for matters connected therewith.  [27TH SEPTEMBER, 1991   LAWS OF GUYANA Medical Practitioners Cap. 32:02 5  L.R.O. 1/2012                         L.R.O. 1/2012 PART I PRELIMINARY Short title.       Interpretation. [7 of 2006]                                       26.(1)  The  Chief  Medical  Officer  shall  be responsible  for  the conduct of the election of the members of the Council referred to in paragraph 1 (c) of  the  First  Schedule,  in  accordance  with  the regulations made under section 23 (2) (j), within sixty days from the commencement of the said regulations.  (2) The members of a Council shall vacate office when the new Council is constituted, and the members thereof enter upon the duties of their office.   FIRST SCHEDULE  CONSTITUTION AND PROCEEDINGS OF THE COUNCIL",
            "description": [
                {
                    "representation": "(1)",
                    "description": "The  Chief  Medical  Officer  shall  be responsible  for  the conduct of the election of the members of the Council referred to in paragraph 1"
                },
                {
                    "representation": "(c)",
                    "description": "of  the  First  Schedule,  in  accordance  with  the regulations made under section 23"
                },
                {
                    "representation": "(2)",
                    "description": "The members of a Council shall vacate office when the new Council is constituted, and the members thereof enter upon the duties of their office.   FIRST SCHEDULE  CONSTITUTION AND PROCEEDINGS OF THE COUNCIL"
                }
            ]
        }
    },
    {
        "act": "MEDICAL PRACTITIONERS ACT",
        "source": "https://mola.gov.gy/laws-of-guyana",
        "type": {
            "name": "section",
            "representation": "1959",
            "title": "LAWS OF GUYANA Medical Practitioners Cap. 32:02 3  L.R.O. 1/2012                         L.R.O. 1/2012 CHAPTER 32:02  MEDICAL PRACTITIONERS ACT  ARRANGEMENT OF SECTIONS  SECTION PART I PRELIMINARY  ",
            "context": "MEDICAL PRACTITIONERS ACT under LAWS OF GUYANA Medical Practitioners Cap. 32:02 3  L.R.O. 1/2012                         L.R.O. 1/2012 CHAPTER 32:02  MEDICAL PRACTITIONERS ACT  ARRANGEMENT OF SECTIONS  SECTION PART I PRELIMINARY  1959.   (2) In relation to any other written law and the unrepealed provisions of the Medical Service Ordinance, every reference to the Board or an officer of the Board shall be construed as a reference to the Council, established by this Act or any officer of the Council, and the Council or an officer of the Council shall have and may discharge the functions of the Board or an officer of the Board respectively.",
            "description": [
                {
                    "representation": "(2)",
                    "description": "In relation to any other written law and the unrepealed provisions of the Medical Service Ordinance, every reference to the Board or an officer of the Board shall be construed as a reference to the Council, established by this Act or any officer of the Council, and the Council or an officer of the Council shall have and may discharge the functions of the Board or an officer of the Board respectively."
                }
            ]
        }
    }
]