[
    {
        "act": "DENTAL REGISTRATION ACT",
        "source": "https://mola.gov.gy/laws-of-guyana",
        "type": {
            "name": "section",
            "representation": "1",
            "title": "Short title. ",
            "context": "DENTAL REGISTRATION ACT under Short title. 1.  This Act may be cited as the Dental Registration Act.",
            "description": "This Act may be cited as the Dental Registration Act."
        }
    },
    {
        "act": "DENTAL REGISTRATION ACT",
        "source": "https://mola.gov.gy/laws-of-guyana",
        "type": {
            "name": "section",
            "representation": "2",
            "title": "Interpretation.  PART II ESTABLISHMENT AND FUNCTION OF DENTAL COUNCIL  ",
            "context": "DENTAL REGISTRATION ACT under Interpretation.  PART II ESTABLISHMENT AND FUNCTION OF DENTAL COUNCIL  2.  In this Act  Council means the Dental Council established by section 3;  dental practitioner means a person who is duly qualified and registered as a dental practitioner;  dental technician means a person who is duly qualified and registered as a dental technician under Part V;  dentist extender means a person who is duly registered as a dentist extender and is employed in the public service to perform limited dental service as defined in section 19;  dentistry  means  any professional  service  performed  by a dental practitioner and includes  LAWS OF GUYANA 6 Cap. 32:03 Dental Registration   L.R.O. 1/2012                                  c. 32:",
            "description": "In this Act  Council means the Dental Council established by section 3;  dental practitioner means a person who is duly qualified and registered as a dental practitioner;  dental technician means a person who is duly qualified and registered as a dental technician under Part V;  dentist extender means a person who is duly registered as a dentist extender and is employed in the public service to perform limited dental service as defined in section 19;  dentistry  means  any professional  service  performed  by a dental practitioner and includes  LAWS OF GUYANA 6 Cap. 32:03 Dental Registration   L.R.O. 1/2012                                  c. 32:"
        }
    },
    {
        "act": "DENTAL REGISTRATION ACT",
        "source": "https://mola.gov.gy/laws-of-guyana",
        "type": {
            "name": "section",
            "representation": "3",
            "title": "Establishment of Dental Council. ",
            "context": "DENTAL REGISTRATION ACT under Establishment of Dental Council. 3.  (1) For the purposes of this Act there is hereby established a Council to be known as the Dental Council of Guyana which shall be a body corporate.  (2) The provisions of the First Schedule shall have effect with respect to the constitution of the Council and otherwise in relation thereto.  LAWS OF GUYANA 8 Cap. 32:03 Dental Registration   L.R.O. 1/2012  Function of Dental Council.                                   Dental Register. Second",
            "description": [
                {
                    "representation": "(1)",
                    "description": "For the purposes of this Act there is hereby established a Council to be known as the Dental Council of Guyana which shall be a body corporate."
                },
                {
                    "representation": "(2)",
                    "description": "The provisions of the First Schedule shall have effect with respect to the constitution of the Council and otherwise in relation thereto.  LAWS OF GUYANA 8 Cap. 32:03 Dental Registration   L.R.O. 1/2012  Function of Dental Council.                                   Dental Register. Second"
                }
            ]
        }
    },
    {
        "act": "DENTAL REGISTRATION ACT",
        "source": "https://mola.gov.gy/laws-of-guyana",
        "type": {
            "name": "section",
            "representation": "4",
            "title": "Function of Dental Council.  PART III DENTAL PRACTITIONERS  ",
            "context": "DENTAL REGISTRATION ACT under Function of Dental Council.  PART III DENTAL PRACTITIONERS  4.  It shall be the function of the Council  (a)  to undertake responsibility for the registration of dental practitioners, dentist extenders and dental technicians;  (b)   to  advise  the  Minister  where necessary  on matters relating to  (i)      dental  services in Guyana and to the performance of those services by dental practitioners, dentist extenders and dental technicians;  (ii)     the establishment of a suitable training programme for persons to perform the services of dentist extenders and dental technicians for the maintenance of a good standard for those services.  PART III DENTAL PRACTITIONERS",
            "description": [
                {
                    "representation": "(a)",
                    "description": "to undertake responsibility for the registration of dental practitioners, dentist extenders and dental technicians;"
                },
                {
                    "representation": "(b)",
                    "description": "to  advise  the  Minister  where necessary  on matters relating to"
                },
                {
                    "representation": "(i)",
                    "description": "dental  services in Guyana and to the performance of those services by dental practitioners, dentist extenders and dental technicians;"
                }
            ]
        }
    },
    {
        "act": "DENTAL REGISTRATION ACT",
        "source": "https://mola.gov.gy/laws-of-guyana",
        "type": {
            "name": "section",
            "representation": "5",
            "title": "Dental Register. ",
            "context": "DENTAL REGISTRATION ACT under Dental Register. 5.",
            "description": "5."
        }
    },
    {
        "act": "DENTAL REGISTRATION ACT",
        "source": "https://mola.gov.gy/laws-of-guyana",
        "type": {
            "name": "section",
            "representation": "6",
            "title": "Registration of existing dental practitioners. ",
            "context": "DENTAL REGISTRATION ACT under Registration of existing dental practitioners. 6. The Secretary shall immediately upon the commencement of this Act cause to be entered in the register, LAWS OF GUYANA 10 Cap. 32:03 Dental Registration   L.R.O. 1/2012  Second Schedule. Form",
            "description": "The Secretary shall immediately upon the commencement of this Act cause to be entered in the register, LAWS OF GUYANA 10 Cap. 32:03 Dental Registration   L.R.O. 1/2012  Second Schedule. Form"
        }
    },
    {
        "act": "DENTAL REGISTRATION ACT",
        "source": "https://mola.gov.gy/laws-of-guyana",
        "type": {
            "name": "section",
            "representation": "7",
            "title": "First registration of dental practitioners. ",
            "context": "DENTAL REGISTRATION ACT under First registration of dental practitioners. 7. (1) A person who applies to the Council to be registered as a dental practitioner and who satisfies the Council that he    (a)   is  a citizen of Guyana, or is a national of a Member State, the spouse of a citizen of Guyana or is resident in Guyana;  (b)  can communicate satisfactorily in English;  (c)       is of good character;  (d)   holds   a   diploma,   degree   or  certificate  obtained  by examination  after  attending  a  recognised  dental  school approved by the Council;  (e)       is qualified to practice independently  in the country where he obtained his diploma, degree or certificate,  shall, upon submission of a sworn declaration in Form 2 in the Second Schedule together with the particulars mentioned in subsection (2), and on  payment of the prescribed fee, be entitled, with approval of the Council, to be registered as a dental practitioner and thereupon be issued with a certificate of registration in Form 3 in the Second Schedule.  ScheduleSecond Form 3Form 2 the particulars specified in Form 1, in the second schedule of LAWS OF GUYANA Dental Registration Cap. 32:03 11  L.R.O. 1/2012                                         Additional qualifications.          (2) An applicant for registration shall furnish to the Secretary   (a)      evidence of his qualification;  (b)      proof of his identity; and  (c)     such further or other information as the Council requires in respect of the matters specified in subsection (1) (a) and (b).  (3) The  Council  may  require  any  person  who  applies  for registration as a dental practitioner under this Act, and who does not, in accordance with the criteria of the Council whether prescribed or not, fulfil the requirements of subsection (1) (b), (d) or (e) to submit to such examination as the Council thinks necessary.  (4) Notwithstanding anything in subsections (1), (2) and (3), the Council may grant a licence in Form 4 in the Second Schedule for a period not exceeding twelve months to any person who satisfies the requirements of subsection (1) (c), (d), and (e) on the payment to the Secretary of the prescribed fee, but where the person charges no fee for all dental services rendered under the licence, the Chairman of the Council may waive the prescribed fee.",
            "description": [
                {
                    "representation": "(1)",
                    "description": "(c),"
                },
                {
                    "representation": "(a)",
                    "description": "evidence of his qualification;"
                },
                {
                    "representation": "(b)",
                    "description": "proof of his identity; and"
                },
                {
                    "representation": "(c)",
                    "description": "such further or other information as the Council requires in respect of the matters specified in subsection"
                },
                {
                    "representation": "(d)",
                    "description": "or"
                },
                {
                    "representation": "(e)",
                    "description": "on the payment to the Secretary of the prescribed fee, but where the person charges no fee for all dental services rendered under the licence, the Chairman of the Council may waive the prescribed fee."
                },
                {
                    "representation": "(2)",
                    "description": "and"
                },
                {
                    "representation": "(3)",
                    "description": "The  Council  may  require  any  person  who  applies  for registration as a dental practitioner under this Act, and who does not, in accordance with the criteria of the Council whether prescribed or not, fulfil the requirements of subsection"
                },
                {
                    "representation": "(4)",
                    "description": "Notwithstanding anything in subsections"
                }
            ]
        }
    },
    {
        "act": "DENTAL REGISTRATION ACT",
        "source": "https://mola.gov.gy/laws-of-guyana",
        "type": {
            "name": "section",
            "representation": "8",
            "title": "Additional qualifications. ",
            "context": "DENTAL REGISTRATION ACT under Additional qualifications. 8. Where a dental practitioner obtains a qualification approved by the Council which is higher than or additional to that in respect of which he is registered, he is entitled, without the payment of any fee, to have that higher or additional qualification entered by the Secretary in the register in substitution for, or in addition to, the qualification in respect of which he is registered.   Form 4LAWS OF GUYANA 12 Cap. 32:03 Dental Registration   L.R.O. 1/2012  Annual registration of dental practitioners. Form",
            "description": "Where a dental practitioner obtains a qualification approved by the Council which is higher than or additional to that in respect of which he is registered, he is entitled, without the payment of any fee, to have that higher or additional qualification entered by the Secretary in the register in substitution for, or in addition to, the qualification in respect of which he is registered.   Form 4LAWS OF GUYANA 12 Cap. 32:03 Dental Registration   L.R.O. 1/2012  Annual registration of dental practitioners. Form"
        }
    },
    {
        "act": "DENTAL REGISTRATION ACT",
        "source": "https://mola.gov.gy/laws-of-guyana",
        "type": {
            "name": "section",
            "representation": "9",
            "title": "Annual registration of dental practitioners. ",
            "context": "DENTAL REGISTRATION ACT under Annual registration of dental practitioners. 9.              Practise of dentistry by unregistered persons prohibited.                  Temporary registration of",
            "description": "Practise of dentistry by unregistered persons prohibited.                  Temporary registration of"
        }
    },
    {
        "act": "DENTAL REGISTRATION ACT",
        "source": "https://mola.gov.gy/laws-of-guyana",
        "type": {
            "name": "section",
            "representation": "10",
            "title": "Practice of dentistry by unregistered persons prohibited.   PART IV TEMPORARY REGISTRATION  ",
            "context": "DENTAL REGISTRATION ACT under Practice of dentistry by unregistered persons prohibited.   PART IV TEMPORARY REGISTRATION  10.",
            "description": "10."
        }
    },
    {
        "act": "DENTAL REGISTRATION ACT",
        "source": "https://mola.gov.gy/laws-of-guyana",
        "type": {
            "name": "section",
            "representation": "11",
            "title": "Temporary registration of certain persons in separate part of register. ",
            "context": "DENTAL REGISTRATION ACT under Temporary registration of certain persons in separate part of register. 11.  Anything in Part III to the contrary notwithstanding, the Council may grant a licence in Form 4 in LAWS OF GUYANA Dental Registration Cap. 32:03 13  L.R.O. 1/2012 certain persons in separate part of register. Form",
            "description": "Anything in Part III to the contrary notwithstanding, the Council may grant a licence in Form 4 in LAWS OF GUYANA Dental Registration Cap. 32:03 13  L.R.O. 1/2012 certain persons in separate part of register. Form"
        }
    },
    {
        "act": "DENTAL REGISTRATION ACT",
        "source": "https://mola.gov.gy/laws-of-guyana",
        "type": {
            "name": "section",
            "representation": "12",
            "title": "Persons to whom section 11 applies. ",
            "context": "DENTAL REGISTRATION ACT under Persons to whom section 11 applies. 12. Section 11 shall apply to any person who is not eligible for registration as a dental practitioner under the preceding provisions of this Act or by virtue of any other law and who satisfies the Council  (a)      that he is of good character;  (b)     that he holds a diploma granted in a country other than Guyana by virtue of which he would be entitled to practise in that country as a dental practitioner without supervision and recognised for the time being by the Council for the purposes of  this  Act,  as  furnishing  a  sufficient  guarantee  of  the possession  of  the  requisite  knowledge  and  skill  for  the efficient practise of dentistry;  (c)     that   he    is   employed,   or   has   been   selected   for employment in an approved institution such as the National Dental Centre, any public hospital or any government dental clinic.",
            "description": [
                {
                    "representation": "(a)",
                    "description": "that he is of good character;"
                },
                {
                    "representation": "(b)",
                    "description": "that he holds a diploma granted in a country other than Guyana by virtue of which he would be entitled to practise in that country as a dental practitioner without supervision and recognised for the time being by the Council for the purposes of  this  Act,  as  furnishing  a  sufficient  guarantee  of  the possession  of  the  requisite  knowledge  and  skill  for  the efficient practise of dentistry;"
                },
                {
                    "representation": "(c)",
                    "description": "that   he    is   employed,   or   has   been   selected   for employment in an approved institution such as the National Dental Centre, any public hospital or any government dental clinic."
                }
            ]
        }
    },
    {
        "act": "DENTAL REGISTRATION ACT",
        "source": "https://mola.gov.gy/laws-of-guyana",
        "type": {
            "name": "section",
            "representation": "13",
            "title": "Transfer of names of persons registered under section ",
            "context": "DENTAL REGISTRATION ACT under Transfer of names of persons registered under section 13. (1) Where on the application of any person registered by virtue of section 11, it is shown to the satisfaction of the Council that such person has, while so registered, practised efficiently as a dental practitioner for a period of not more than twelve months in any approved government institution under the direct or indirect supervision of a person registered as a dental practitioner LAWS OF GUYANA 14 Cap. 32:03 Dental Registration   L.R.O. 1/2012                         Registration of existing temporary dental practitioners. Form",
            "description": [
                {
                    "representation": "(1)",
                    "description": "Where on the application of any person registered by virtue of section 11, it is shown to the satisfaction of the Council that such person has, while so registered, practised efficiently as a dental practitioner for a period of not more than twelve months in any approved government institution under the direct or indirect supervision of a person registered as a dental practitioner LAWS OF GUYANA 14 Cap. 32:03 Dental Registration   L.R.O. 1/2012                         Registration of existing temporary dental practitioners. Form"
                }
            ]
        }
    },
    {
        "act": "DENTAL REGISTRATION ACT",
        "source": "https://mola.gov.gy/laws-of-guyana",
        "type": {
            "name": "section",
            "representation": "14",
            "title": "Registration of existing temporary dental practitioners.   15 Appeal against refusal of temporary registration. ",
            "context": "DENTAL REGISTRATION ACT under Registration of existing temporary dental practitioners.   15 Appeal against refusal of temporary registration. 14. The Secretary shall immediately upon the commencement of this Act enter in Form 5 in the Second Schedule the requisite particulars of those persons who immediately before such commencement were registered under the Dental Practitioners (Temporary Registration) Act, without application on the part of those persons, and without payment of a fee, and pending such entry those persons shall be deemed to be temporary dental practitioners.",
            "description": "The Secretary shall immediately upon the commencement of this Act enter in Form 5 in the Second Schedule the requisite particulars of those persons who immediately before such commencement were registered under the Dental Practitioners (Temporary Registration) Act, without application on the part of those persons, and without payment of a fee, and pending such entry those persons shall be deemed to be temporary dental practitioners."
        }
    },
    {
        "act": "DENTAL REGISTRATION ACT",
        "source": "https://mola.gov.gy/laws-of-guyana",
        "type": {
            "name": "section",
            "representation": "16",
            "title": "Effect of registration. LAWS OF GUYANA 4 Cap. 32:03 Dental Registration   L.R.O. 1/2012  SECTION PART V DENTIST EXTENDERS AND DENTAL TECHNICIANS                         ",
            "context": "DENTAL REGISTRATION ACT under Effect of registration. LAWS OF GUYANA 4 Cap. 32:03 Dental Registration   L.R.O. 1/2012  SECTION PART V DENTIST EXTENDERS AND DENTAL TECHNICIANS                         16.(1) The provisions of any law relating to persons registered under Part III, save in so far as they are inconsistent with the provisions of this Part, shall apply to every person registered as a dental practitioner by virtue of the provisions of this Part:  Provided that nothing in this section shall be construed as entitling any person registered by virtue of the provisions of section 11 to demand or recover any personal charge for rendering or giving dental service, aid,  advice  or  attendance,  or  performing  any  dental  operation,  or supplying or prescribing any medicines or dental appliances, otherwise than in the course of his employment in an approved institution or as authorising any such person to LAWS OF GUYANA Dental Registration Cap. 32:03 15  L.R.O. 1/2012                  Registers of dentist extenders and dental technicians. Form",
            "description": [
                {
                    "representation": "(1)",
                    "description": "The provisions of any law relating to persons registered under Part III, save in so far as they are inconsistent with the provisions of this Part, shall apply to every person registered as a dental practitioner by virtue of the provisions of this Part:  Provided that nothing in this section shall be construed as entitling any person registered by virtue of the provisions of section 11 to demand or recover any personal charge for rendering or giving dental service, aid,  advice  or  attendance,  or  performing  any  dental  operation,  or supplying or prescribing any medicines or dental appliances, otherwise than in the course of his employment in an approved institution or as authorising any such person to LAWS OF GUYANA Dental Registration Cap. 32:03 15  L.R.O. 1/2012                  Registers of dentist extenders and dental technicians. Form"
                }
            ]
        }
    },
    {
        "act": "DENTAL REGISTRATION ACT",
        "source": "https://mola.gov.gy/laws-of-guyana",
        "type": {
            "name": "section",
            "representation": "17",
            "title": "Registers of dentist extenders and dental technicians. ",
            "context": "DENTAL REGISTRATION ACT under Registers of dentist extenders and dental technicians. 17.  The Secretary shall keep the following  (a)      a register in the form set out in Form 6 in  the Second Schedule to be known as the register of dentist extenders;   (b)       a register in the form set out in Form 7 in the Second Schedule to be known as the register of dental technicians.",
            "description": [
                {
                    "representation": "(a)",
                    "description": "a register in the form set out in Form 6 in  the Second Schedule to be known as the register of dentist extenders;"
                },
                {
                    "representation": "(b)",
                    "description": "a register in the form set out in Form 7 in the Second Schedule to be known as the register of dental technicians."
                }
            ]
        }
    },
    {
        "act": "DENTAL REGISTRATION ACT",
        "source": "https://mola.gov.gy/laws-of-guyana",
        "type": {
            "name": "section",
            "representation": "18",
            "title": "First registration of dentist extenders and dental technicians. ",
            "context": "DENTAL REGISTRATION ACT under First registration of dentist extenders and dental technicians. 18.(1) The Secretary  shall  cause  to be entered  in the relevant register  the name of every person  entitled  under section  20 to be registered as a dentist extender or dental technician together with the following particulars in respect of each such person  (a)      his full name and address;   (b)      the date of his registration;  (c)  a description and the date of qualification in respect of which he is registered and the dental services that may be performed by him.  (2) A person registered under this Part as a dentist LAWS OF GUYANA 16 Cap. 32:03 Dental Registration   L.R.O. 1/2012     Form",
            "description": [
                {
                    "representation": "(1)",
                    "description": "The Secretary  shall  cause  to be entered  in the relevant register  the name of every person  entitled  under section  20 to be registered as a dentist extender or dental technician together with the following particulars in respect of each such person"
                },
                {
                    "representation": "(a)",
                    "description": "his full name and address;"
                },
                {
                    "representation": "(b)",
                    "description": "the date of his registration;"
                },
                {
                    "representation": "(c)",
                    "description": "a description and the date of qualification in respect of which he is registered and the dental services that may be performed by him."
                },
                {
                    "representation": "(2)",
                    "description": "A person registered under this Part as a dentist LAWS OF GUYANA 16 Cap. 32:03 Dental Registration   L.R.O. 1/2012     Form"
                }
            ]
        }
    },
    {
        "act": "DENTAL REGISTRATION ACT",
        "source": "https://mola.gov.gy/laws-of-guyana",
        "type": {
            "name": "section",
            "representation": "19",
            "title": "Application of section ",
            "context": "DENTAL REGISTRATION ACT under Application of section 19.(1) Subsections (2) and (3) of section 5 shall mutatis mutandis apply to and in relation to a register required to be kept by the Secretary under section",
            "description": [
                {
                    "representation": "(1)",
                    "description": "Subsections"
                },
                {
                    "representation": "(2)",
                    "description": "and"
                },
                {
                    "representation": "(3)",
                    "description": "of section 5 shall mutatis mutandis apply to and in relation to a register required to be kept by the Secretary under section"
                }
            ]
        }
    },
    {
        "act": "DENTAL REGISTRATION ACT",
        "source": "https://mola.gov.gy/laws-of-guyana",
        "type": {
            "name": "section",
            "representation": "20",
            "title": "Persons entitled to be registered as dentist extenders and  dental technicians. ",
            "context": "DENTAL REGISTRATION ACT under Persons entitled to be registered as dentist extenders and  dental technicians. 20.(1) A person who, after the commencement of this Act, applies to the Council to be registered as a dentist extender or dental technician and who satisfies the Council that he is (a)    a  citizen  of Guyana or spouse of a citizen of Guyana  or a resident in Guyana qualified to be so registered;  (b)      able to communicate satisfactorily in             English;  (c)      a fit and proper person to perform the             services of a dentist extender or dental technician,  is entitled upon compliance with the requirements of this Part and on payment of the prescribed fee to be registered as such under this Part.  (2) For the purposes of subsection (1), a person is qualified to be registered as a dentist extender or dental technician who has completed a  course  of training  approved  by the  Council  and  has  passed  the approved examination.   LAWS OF GUYANA Dental Registration Cap. 32:03 17  L.R.O. 1/2012 Services a dentist extender may perform.                                       Services dental technicians may perform.",
            "description": [
                {
                    "representation": "(1)",
                    "description": "A person who, after the commencement of this Act, applies to the Council to be registered as a dentist extender or dental technician and who satisfies the Council that he is"
                },
                {
                    "representation": "(a)",
                    "description": "a  citizen  of Guyana or spouse of a citizen of Guyana  or a resident in Guyana qualified to be so registered;"
                },
                {
                    "representation": "(b)",
                    "description": "able to communicate satisfactorily in             English;"
                },
                {
                    "representation": "(c)",
                    "description": "a fit and proper person to perform the             services of a dentist extender or dental technician,  is entitled upon compliance with the requirements of this Part and on payment of the prescribed fee to be registered as such under this Part."
                },
                {
                    "representation": "(2)",
                    "description": "For the purposes of subsection"
                }
            ]
        }
    },
    {
        "act": "DENTAL REGISTRATION ACT",
        "source": "https://mola.gov.gy/laws-of-guyana",
        "type": {
            "name": "section",
            "representation": "21",
            "title": "Services dentist extenders may perform. ",
            "context": "DENTAL REGISTRATION ACT under Services dentist extenders may perform. 21. A dentist extender may, in addition to such dental services, as may be prescribed, perform on a child who has not attained eighteen years the following services provided such treatment is undertaken in health  establishments  operated  by  the  government  and  under  the supervision of a registered government dental practitioner  (a)   extraction  of  teeth, including preparation and after  care;   (b)       administration of local anaesthetic;  (c)    fillings  not  involving  exposure  of  dental  pulp  and preparation for such fillings;  (d)      scaling, cleaning and polishing teeth;  (e)    topical application of anticariogenic agents to teeth;  (f)      exposure and processing of dental X-ray films;  (g)   teaching and giving advice on oral hygiene and mouth care.",
            "description": [
                {
                    "representation": "(a)",
                    "description": "extraction  of  teeth, including preparation and after  care;"
                },
                {
                    "representation": "(b)",
                    "description": "administration of local anaesthetic;"
                },
                {
                    "representation": "(c)",
                    "description": "fillings  not  involving  exposure  of  dental  pulp  and preparation for such fillings;"
                },
                {
                    "representation": "(d)",
                    "description": "scaling, cleaning and polishing teeth;"
                },
                {
                    "representation": "(e)",
                    "description": "topical application of anticariogenic agents to teeth;"
                },
                {
                    "representation": "(f)",
                    "description": "exposure and processing of dental X-ray films;"
                },
                {
                    "representation": "(g)",
                    "description": "teaching and giving advice on oral hygiene and mouth care."
                }
            ]
        }
    },
    {
        "act": "DENTAL REGISTRATION ACT",
        "source": "https://mola.gov.gy/laws-of-guyana",
        "type": {
            "name": "section",
            "representation": "22",
            "title": "Services dental technicians may perform.  PART VI MISCELLANEOUS  ",
            "context": "DENTAL REGISTRATION ACT under Services dental technicians may perform.  PART VI MISCELLANEOUS  22. (1) A dental technician may be permitted to fabricate dental appliances, that is to say, dentures, bridges, obturators and orthodontic appliances.  (2) Nothing in subsection (1) shall be construed as permitting a dental technician to perform any work to be done in the mouth of any person.   LAWS OF GUYANA 18 Cap. 32:03 Dental Registration   L.R.O. 1/2012     Use of titles and description.                         Publication of list dental practitioners, dentist extenders and dental technicians.             MISCELLANEOUS",
            "description": [
                {
                    "representation": "(1)",
                    "description": "shall be construed as permitting a dental technician to perform any work to be done in the mouth of any person.   LAWS OF GUYANA 18 Cap. 32:03 Dental Registration   L.R.O. 1/2012     Use of titles and description.                         Publication of list dental practitioners, dentist extenders and dental technicians.             MISCELLANEOUS"
                },
                {
                    "representation": "(2)",
                    "description": "Nothing in subsection"
                }
            ]
        }
    },
    {
        "act": "DENTAL REGISTRATION ACT",
        "source": "https://mola.gov.gy/laws-of-guyana",
        "type": {
            "name": "section",
            "representation": "23",
            "title": "Use of titles and descriptions. ",
            "context": "DENTAL REGISTRATION ACT under Use of titles and descriptions. 23. A person registered as a dental practitioner, dentist extender or dental technician under this Act  (a)      shall, by virtue of being so registered, be entitled to take and use the title dentist, dental surgeon or dental practitioner, dentist extender or dental technician respectively; (b)     shall not take or use, affix to or use in connection with his premises, any title or description reasonably calculated to suggest  that  he  possesses   any  professional   status   or qualification other than a professional status or qualification which  he  in  fact  possesses  and  which  is  indicated  by particulars entered in the register in respect of him.",
            "description": [
                {
                    "representation": "(a)",
                    "description": "shall, by virtue of being so registered, be entitled to take and use the title dentist, dental surgeon or dental practitioner, dentist extender or dental technician respectively;"
                },
                {
                    "representation": "(b)",
                    "description": "shall not take or use, affix to or use in connection with his premises, any title or description reasonably calculated to suggest  that  he  possesses   any  professional   status   or qualification other than a professional status or qualification which  he  in  fact  possesses  and  which  is  indicated  by particulars entered in the register in respect of him."
                }
            ]
        }
    },
    {
        "act": "DENTAL REGISTRATION ACT",
        "source": "https://mola.gov.gy/laws-of-guyana",
        "type": {
            "name": "section",
            "representation": "24",
            "title": "Publication of list of dental practitioners, dentist extenders  and  dental technicians. ",
            "context": "DENTAL REGISTRATION ACT under Publication of list of dental practitioners, dentist extenders  and  dental technicians. 24.(1) The Secretary shall cause to be published in the Gazette   (a)      in the month of February in each year alphabetical  lists  of persons who are registered as dental practitioners, dentist extenders and dental technicians as required by sections 5 and 17;  (b)       the  name of any person who registers his name as a dental practitioner, dentist extender or dental technician after the 31st January in any year, as soon as practicable after any such registration.  PART VI LAWS OF GUYANA Dental Registration Cap. 32:03 19  L.R.O. 1/2012                 Disciplinary proceedings.                                   (2) A copy of the Gazette containing the list referred to in paragraph (a) of subsection (1) or the name of any person published pursuant to paragraph (b) of that subsection is prima facie evidence in any court of the registration and qualifications of any person mentioned in the list of that person, and such list is prima facie evidence that any person whose name does not appear therein is not registered.",
            "description": [
                {
                    "representation": "(1)",
                    "description": "or the name of any person published pursuant to paragraph"
                },
                {
                    "representation": "(a)",
                    "description": "of subsection"
                },
                {
                    "representation": "(b)",
                    "description": "of that subsection is prima facie evidence in any court of the registration and qualifications of any person mentioned in the list of that person, and such list is prima facie evidence that any person whose name does not appear therein is not registered."
                },
                {
                    "representation": "(2)",
                    "description": "A copy of the Gazette containing the list referred to in paragraph"
                }
            ]
        }
    },
    {
        "act": "DENTAL REGISTRATION ACT",
        "source": "https://mola.gov.gy/laws-of-guyana",
        "type": {
            "name": "section",
            "representation": "25",
            "title": "Disciplinary proceedings. ",
            "context": "DENTAL REGISTRATION ACT under Disciplinary proceedings. 25. (1) Any person who is  (a)     convicted  of  an indictable offence in Guyana;  (b)    convicted  of  an  indictable  offence  outside  Guyana which is also an indictable offence in Guyana;  (c)   alleged to be guilty of professional           misconduct,   is subject to disciplinary proceedings.  (2) Where it shall appear, or be represented, to the Council that a dental practitioner, dentist extender or dental technician may be guilty of professional misconduct or malpractice the Council shall afford him a reasonable opportunity of answering the complaint.  (3) If, in any proceedings under subsection (1), the Council is satisfied that  a person  who  is registered  under  this Act  has  been convicted of an offence under paragraph (a) or (b) or that he is guilty of professional misconduct, it may (a)      censure him;  (b)   suspend  his registration  for  any period not exceeding one year; or LAWS OF GUYANA 20 Cap. 32:03 Dental Registration   L.R.O. 1/2012              Suspension from practice pending disciplinary proceedings.       Restoration of name to register and publication in Gazette.                  Application by dental practitioner, dentist extender or dental technician for restoration of name to register.   (c)     direct that  his  name be removed from the register.",
            "description": [
                {
                    "representation": "(1)",
                    "description": "Any person who is"
                },
                {
                    "representation": "(a)",
                    "description": "censure him;"
                },
                {
                    "representation": "(b)",
                    "description": "suspend  his registration  for  any period not exceeding one year; or LAWS OF GUYANA 20 Cap. 32:03 Dental Registration   L.R.O. 1/2012              Suspension from practice pending disciplinary proceedings.       Restoration of name to register and publication in Gazette.                  Application by dental practitioner, dentist extender or dental technician for restoration of name to register."
                },
                {
                    "representation": "(c)",
                    "description": "direct that  his  name be removed from the register."
                },
                {
                    "representation": "(2)",
                    "description": "Where it shall appear, or be represented, to the Council that a dental practitioner, dentist extender or dental technician may be guilty of professional misconduct or malpractice the Council shall afford him a reasonable opportunity of answering the complaint."
                },
                {
                    "representation": "(3)",
                    "description": "If, in any proceedings under subsection"
                }
            ]
        }
    },
    {
        "act": "DENTAL REGISTRATION ACT",
        "source": "https://mola.gov.gy/laws-of-guyana",
        "type": {
            "name": "section",
            "representation": "26",
            "title": "Suspension from practice pending disciplinary proceedings. ",
            "context": "DENTAL REGISTRATION ACT under Suspension from practice pending disciplinary proceedings. 26. If, in the opinion of the Council, it is against the public interest or not in the interest of the health of a patient that a person who is registered under this Act continues to practise dentistry or perform dental services, as the case may be, pending the determination of disciplinary proceedings, the Council may suspend the registration of that person.",
            "description": "If, in the opinion of the Council, it is against the public interest or not in the interest of the health of a patient that a person who is registered under this Act continues to practise dentistry or perform dental services, as the case may be, pending the determination of disciplinary proceedings, the Council may suspend the registration of that person."
        }
    },
    {
        "act": "DENTAL REGISTRATION ACT",
        "source": "https://mola.gov.gy/laws-of-guyana",
        "type": {
            "name": "section",
            "representation": "27",
            "title": "Restoration of name to register and publication in Gazette . ",
            "context": "DENTAL REGISTRATION ACT under Restoration of name to register and publication in Gazette . 27. (1) The Council may, at any time, direct the Secretary to restore to the register the name of any person that has been removed therefrom under section 23(3).  (2) Where the name of a person is removed from the register the Council may in writing require that person to return to the Secretary of the Council his certificate of registration, and that person shall comply with the requirement.  (3) The Council shall. as soon as practicable after suspending the registration of a dental practitioner, dentist extender or dental technician under section 25 or 26, or under subsection (1) after the restoration of the name of any person to a register, cause notice thereof to be published in the Gazette .",
            "description": [
                {
                    "representation": "(1)",
                    "description": "after the restoration of the name of any person to a register, cause notice thereof to be published in the Gazette ."
                },
                {
                    "representation": "(2)",
                    "description": "Where the name of a person is removed from the register the Council may in writing require that person to return to the Secretary of the Council his certificate of registration, and that person shall comply with the requirement."
                },
                {
                    "representation": "(3)",
                    "description": "The Council shall. as soon as practicable after suspending the registration of a dental practitioner, dentist extender or dental technician under section 25 or 26, or under subsection"
                }
            ]
        }
    },
    {
        "act": "DENTAL REGISTRATION ACT",
        "source": "https://mola.gov.gy/laws-of-guyana",
        "type": {
            "name": "section",
            "representation": "28",
            "title": "Application by dental practitioner, dentist  extender  or   dental technician for restoration of name to register. ",
            "context": "DENTAL REGISTRATION ACT under Application by dental practitioner, dentist  extender  or   dental technician for restoration of name to register. 28.(1) A dental practitioner, dentist extender or dental technician, whose name has been removed from the register may at any time after the expiration of one year after the date of such removal apply to the Council for the restoration of his name to the register.  (2) Where  the  Council  is  satisfied  that  an  applicant  under subsection  (1)  has  established  sufficient  grounds  to  support  his application, it may direct the LAWS OF GUYANA Dental Registration Cap. 32:03 21  L.R.O. 1/2012     Secretary to notify person affected by a decision of the Council.                                Appeals.                        Secretary of the Council to restore his name to the  register  as a dental  practitioner,  dentist  extender  or dental technician.",
            "description": [
                {
                    "representation": "(1)",
                    "description": "has  established  sufficient  grounds  to  support  his application, it may direct the LAWS OF GUYANA Dental Registration Cap. 32:03 21  L.R.O. 1/2012     Secretary to notify person affected by a decision of the Council.                                Appeals.                        Secretary of the Council to restore his name to the  register  as a dental  practitioner,  dentist  extender  or dental technician."
                },
                {
                    "representation": "(2)",
                    "description": "Where  the  Council  is  satisfied  that  an  applicant  under subsection"
                }
            ]
        }
    },
    {
        "act": "DENTAL REGISTRATION ACT",
        "source": "https://mola.gov.gy/laws-of-guyana",
        "type": {
            "name": "section",
            "representation": "29",
            "title": "Secretary to notify person affected by a decision of the  Council. ",
            "context": "DENTAL REGISTRATION ACT under Secretary to notify person affected by a decision of the  Council. 29.  Where the Council  (a)       refuses to approve the registration of a person under this Act  as  a  dental  practitioner,  dentist  extender  or  dental technician; or  (b)      suspends  the  registration  or  directs the removal of the name of any such person from the register,  the Secretary shall, within seven days after the date of such refusal, suspension  or  direction,  give  written  notice  thereof  to  the  person affected.",
            "description": [
                {
                    "representation": "(a)",
                    "description": "refuses to approve the registration of a person under this Act  as  a  dental  practitioner,  dentist  extender  or  dental technician; or"
                },
                {
                    "representation": "(b)",
                    "description": "suspends  the  registration  or  directs the removal of the name of any such person from the register,  the Secretary shall, within seven days after the date of such refusal, suspension  or  direction,  give  written  notice  thereof  to  the  person affected."
                }
            ]
        }
    },
    {
        "act": "DENTAL REGISTRATION ACT",
        "source": "https://mola.gov.gy/laws-of-guyana",
        "type": {
            "name": "section",
            "representation": "30",
            "title": "Appeals. ",
            "context": "DENTAL REGISTRATION ACT under Appeals. 30. (1) Subject to subsection (4) any person who is aggrieved by the refusal of the Council to register him under this Act, except Part IV, or by its decision to censure him or suspend his registration or cause his name to be removed from the register may within three months after the receipt by him of any such notice, appeal to a Judge in Chambers.  (2) The Council may, pending an appeal under subsection (1) of any person aggrieved by its decision to suspend his registration or cause his name to be removed from the register, on the application of that person   suspend   the   operation   of   any   such   decision   until   the determination of the appeal.  (3) The Judge may  (a)       on hearing  an appeal  against  refusal  of registration, dismiss the appeal, or allow the appeal and direct the LAWS OF GUYANA 22 Cap. 32:03 Dental Registration   L.R.O. 1/2012                                         Regulations.           Council to cause the registration to be effected;  (b)      on hearing  an appeal,  other than an appeal  against refusal of registration  (i)       dismiss the appeal and confirm the decision of the Council; (ii)    allow the appeal and set aside the decision of the Council; (iii)   allow  the  appeal  and  direct  that the disciplinary proceedings in respect of which the decision of the Council is made be re-conducted by the Council; or (iv) set aside  the penalty imposed by the Council and impose in substitution therefor such other penalty under section 25(3) as he thinks fit.  (4) Notwithstanding subsection (1), no appeal shall be made under this section against the refusal of an application for registration where the registration is conditional upon the applicant satisfying the Council that he is qualified to be registered under this Act.",
            "description": [
                {
                    "representation": "(1)",
                    "description": "of any person aggrieved by its decision to suspend his registration or cause his name to be removed from the register, on the application of that person   suspend   the   operation   of   any   such   decision   until   the determination of the appeal."
                },
                {
                    "representation": "(4)",
                    "description": "Notwithstanding subsection"
                },
                {
                    "representation": "(2)",
                    "description": "The Council may, pending an appeal under subsection"
                },
                {
                    "representation": "(3)",
                    "description": "as he thinks fit."
                },
                {
                    "representation": "(a)",
                    "description": "on hearing  an appeal  against  refusal  of registration, dismiss the appeal, or allow the appeal and direct the LAWS OF GUYANA 22 Cap. 32:03 Dental Registration   L.R.O. 1/2012                                         Regulations.           Council to cause the registration to be effected;"
                },
                {
                    "representation": "(b)",
                    "description": "on hearing  an appeal,  other than an appeal  against refusal of registration"
                },
                {
                    "representation": "(i)",
                    "description": "dismiss the appeal and confirm the decision of the Council;"
                }
            ]
        }
    },
    {
        "act": "DENTAL REGISTRATION ACT",
        "source": "https://mola.gov.gy/laws-of-guyana",
        "type": {
            "name": "section",
            "representation": "31",
            "title": "Regulations. ",
            "context": "DENTAL REGISTRATION ACT under Regulations. 31. (1) The Minister may make regulations generally for carrying out the provisions of this Act.   (2) Without prejudice to the generality of subsection (1) the Council may, with the approval of the Minister, make regulations for  (a)  the determination  of professional conduct and general fitness to practice LAWS OF GUYANA Dental Registration Cap. 32:03 23  L.R.O. 1/2012                 Recognition of places of training for dentist extenders or dental technicians.        Offences.                           dentistry or to perform dental services;  (b) the institution of disciplinary proceedings in relation to any charge under section 25 and the manner in which those proceedings are to be conducted.",
            "description": [
                {
                    "representation": "(1)",
                    "description": "the Council may, with the approval of the Minister, make regulations for"
                },
                {
                    "representation": "(2)",
                    "description": "Without prejudice to the generality of subsection"
                },
                {
                    "representation": "(a)",
                    "description": "the determination  of professional conduct and general fitness to practice LAWS OF GUYANA Dental Registration Cap. 32:03 23  L.R.O. 1/2012                 Recognition of places of training for dentist extenders or dental technicians.        Offences.                           dentistry or to perform dental services;"
                },
                {
                    "representation": "(b)",
                    "description": "the institution of disciplinary proceedings in relation to any charge under section 25 and the manner in which those proceedings are to be conducted."
                }
            ]
        }
    },
    {
        "act": "DENTAL REGISTRATION ACT",
        "source": "https://mola.gov.gy/laws-of-guyana",
        "type": {
            "name": "section",
            "representation": "32",
            "title": "Recognition of places of training for dentist extenders or  dental technicians. 33 .   Offences. ",
            "context": "DENTAL REGISTRATION ACT under Recognition of places of training for dentist extenders or  dental technicians. 33 .   Offences. 32. The Council may, with the approval of the Minister, recognise any place, institution or school as a place of training or affiliated place of training for dentist extenders or dental technicians.",
            "description": "The Council may, with the approval of the Minister, recognise any place, institution or school as a place of training or affiliated place of training for dentist extenders or dental technicians."
        }
    },
    {
        "act": "DENTAL REGISTRATION ACT",
        "source": "https://mola.gov.gy/laws-of-guyana",
        "type": {
            "name": "section",
            "representation": "34",
            "title": "Possession or control of dental appliances or supplies. ",
            "context": "DENTAL REGISTRATION ACT under Possession or control of dental appliances or supplies. 34.(1) Subject to subsection (3), a person who, for the purposes of practising dentistry or performing dental services, has in his possession or control dental appliances or supplies is guilty of an offence and liable on summary conviction to a fine of one hundred thousand dollars and to imprisonment for up to five years.  (2) For the purposes of subsection (1), possession or control of dental appliances or supplies by a person is prima facie evidence that the possession or control is for the purpose of practising dentistry or performing  dental  services  by that  person  in contravention  of  this section.  (3) Subsection (1) does not apply to the possession or control of dental appliances or supplies by  (a)     a person registered under this Act;  (b)     a person dealing in dental appliances or supplies; or  (c)      a  person  permitted  by  the  Council  to  have such possession or control.",
            "description": [
                {
                    "representation": "(1)",
                    "description": "does not apply to the possession or control of dental appliances or supplies by"
                },
                {
                    "representation": "(2)",
                    "description": "For the purposes of subsection"
                },
                {
                    "representation": "(3)",
                    "description": "Subsection"
                },
                {
                    "representation": "(a)",
                    "description": "a person registered under this Act;"
                },
                {
                    "representation": "(b)",
                    "description": "a person dealing in dental appliances or supplies; or"
                },
                {
                    "representation": "(c)",
                    "description": "a  person  permitted  by  the  Council  to  have such possession or control."
                }
            ]
        }
    },
    {
        "act": "DENTAL REGISTRATION ACT",
        "source": "https://mola.gov.gy/laws-of-guyana",
        "type": {
            "name": "section",
            "representation": "35",
            "title": "Fees to be retained by Council.  FIRST SCHEDULE - Constitution of the Council.   SECOND SCHEDULE - Forms __________________________ LAWS OF GUYANA Dental Registration Cap. 32:03 5  L.R.O. 1/2012  CHAPTER 32:03  DENTAL REGISTRATION ACT  16 of 1996 An Act to provide for the registration of dental practitioners, dentist extenders and dental technicians and for purposes connected therewith.   [3RD OCTOBER, 1997] PART I PRELIMINARY  Short title.      Interpretation. [7 of 2006]                      ",
            "context": "DENTAL REGISTRATION ACT under Fees to be retained by Council.  FIRST SCHEDULE - Constitution of the Council.   SECOND SCHEDULE - Forms __________________________ LAWS OF GUYANA Dental Registration Cap. 32:03 5  L.R.O. 1/2012  CHAPTER 32:03  DENTAL REGISTRATION ACT  16 of 1996 An Act to provide for the registration of dental practitioners, dentist extenders and dental technicians and for purposes connected therewith.   [3RD OCTOBER, 1997] PART I PRELIMINARY  Short title.      Interpretation. [7 of 2006]                      35. All fees collected by the Secretary of the Council under this Act shall be retained by the Council.  LAWS OF GUYANA Dental Registration Cap. 32:03 25  L.R.O. 1/2012           Members of the Council.                       Term of office.                   FIRST SCHEDULE  CONSTITUTION OF THE COUNCIL",
            "description": "All fees collected by the Secretary of the Council under this Act shall be retained by the Council.  LAWS OF GUYANA Dental Registration Cap. 32:03 25  L.R.O. 1/2012           Members of the Council.                       Term of office.                   FIRST SCHEDULE  CONSTITUTION OF THE COUNCIL"
        }
    }
]