[
    {
        "act": "PUBLIC HEALTH (SCHOOL CHILDREN)   IMMUNISATION ACT",
        "source": "https://mola.gov.gy/laws-of-guyana",
        "type": {
            "name": "section",
            "representation": "1",
            "title": "Short title. ",
            "context": "PUBLIC HEALTH (SCHOOL CHILDREN)   IMMUNISATION ACT under Short title. 1. This Act may be cited as the Public Health (School Children) Immunisation Act.",
            "description": "This Act may be cited as the Public Health (School Children) Immunisation Act."
        }
    },
    {
        "act": "PUBLIC HEALTH (SCHOOL CHILDREN)   IMMUNISATION ACT",
        "source": "https://mola.gov.gy/laws-of-guyana",
        "type": {
            "name": "section",
            "representation": "2",
            "title": "Interpretation. ",
            "context": "PUBLIC HEALTH (SCHOOL CHILDREN)   IMMUNISATION ACT under Interpretation. 2. In this Act  certificate of immunisation means a certificate signed by a   Health Officer certifying that the person named therein is immune from a communicable disease, that LAWS OF GUYANA 4 Cap. 35:02 Public Health (School Children) Immunisation   L.R.O. 1/2012             Schedule.                                Production of certificate of immunisation before is to say, the person has  (a)       been inoculated with serum and has had a successful vaccination; or  (b)      suffered from a communicable disease and acquired his own immunity;  communicable disease means any disease specified in the Schedule;  day-care centre means any premises, other than premises used mainly as a private dwelling, where children above the age of six months are received and taken care of for a day or part thereof;  Health  Officer  means  a  duly  qualified  medical  practitioner   registered under any law for the time being in force in Guyana and includes any person authorised by the Ministry to   administer vaccines;  parent includes a guardian;  school means an establishment or institution established for persons who have attained the age of three years, but have not attained the age of eighteen years;  Supervisor means a person who is directly responsible for the  management, control and supervision of a day-care centre during the hours when children are admitted and cared for therein.",
            "description": [
                {
                    "representation": "(a)",
                    "description": "been inoculated with serum and has had a successful vaccination; or"
                },
                {
                    "representation": "(b)",
                    "description": "suffered from a communicable disease and acquired his own immunity;  communicable disease means any disease specified in the Schedule;  day-care centre means any premises, other than premises used mainly as a private dwelling, where children above the age of six months are received and taken care of for a day or part thereof;  Health  Officer  means  a  duly  qualified  medical  practitioner   registered under any law for the time being in force in Guyana and includes any person authorised by the Ministry to   administer vaccines;  parent includes a guardian;  school means an establishment or institution established for persons who have attained the age of three years, but have not attained the age of eighteen years;  Supervisor means a person who is directly responsible for the  management, control and supervision of a day-care centre during the hours when children are admitted and cared for therein."
                }
            ]
        }
    },
    {
        "act": "PUBLIC HEALTH (SCHOOL CHILDREN)   IMMUNISATION ACT",
        "source": "https://mola.gov.gy/laws-of-guyana",
        "type": {
            "name": "section",
            "representation": "3",
            "title": "Production of certificate of immunisation before admission to  school or day-care centre. ",
            "context": "PUBLIC HEALTH (SCHOOL CHILDREN)   IMMUNISATION ACT under Production of certificate of immunisation before admission to  school or day-care centre. 3. (1) Subject to subsection (2), no person shall be admitted to a school or day-care centre unless that person produces a certificate of immunisation to the Head Teacher or Principal of the school, or the Supervisor, as the case may be. mainly for  the purpose of providingeducation suitable LAWS OF GUYANA Public Health (School Children)  Immunisation Cap. 35:02 5  L.R.O. 1/2012 admission to school or day- care centre.                 Powers of the Minister.                 Penalties.             (2) If a person produces a certificate signed by a Health Officer certifying that immunisation against any communicable disease is not advisable on medical grounds, a certificate of immunisation is not required for the purpose of subsection (1).  (3) Where the production of a certificate of immunisation is not required with respect to a person by virtue of subsection (2), the Head Teacher or Principal of the school, or the Supervisor, as the case may be, shall enter the name of that person in a register kept for the purpose.",
            "description": [
                {
                    "representation": "(1)",
                    "description": "Subject to subsection"
                },
                {
                    "representation": "(2)",
                    "description": "If a person produces a certificate signed by a Health Officer certifying that immunisation against any communicable disease is not advisable on medical grounds, a certificate of immunisation is not required for the purpose of subsection"
                },
                {
                    "representation": "(3)",
                    "description": "Where the production of a certificate of immunisation is not required with respect to a person by virtue of subsection"
                }
            ]
        }
    },
    {
        "act": "PUBLIC HEALTH (SCHOOL CHILDREN)   IMMUNISATION ACT",
        "source": "https://mola.gov.gy/laws-of-guyana",
        "type": {
            "name": "section",
            "representation": "4",
            "title": "Powers of the Minister. ",
            "context": "PUBLIC HEALTH (SCHOOL CHILDREN)   IMMUNISATION ACT under Powers of the Minister. 4. If  any  communicable  disease  becomes  epidemic,  or  if  an epidemic of any such disease is threatened the Minister may, notwithstanding section 3(2), by notice  (a)   suspend persons whose names are recorded in the register in pursuance of section 3(3) from attending any school or day-care centre; and  (b)     direct that admission to any school or day-care centre shall be refused to every person who does not comply with the provisions of section 3(1).",
            "description": [
                {
                    "representation": "(a)",
                    "description": "suspend persons whose names are recorded in the register in pursuance of section 3(3) from attending any school or day-care centre; and"
                },
                {
                    "representation": "(b)",
                    "description": "direct that admission to any school or day-care centre shall be refused to every person who does not comply with the provisions of section 3(1)."
                }
            ]
        }
    },
    {
        "act": "PUBLIC HEALTH (SCHOOL CHILDREN)   IMMUNISATION ACT",
        "source": "https://mola.gov.gy/laws-of-guyana",
        "type": {
            "name": "section",
            "representation": "5",
            "title": "Penalties. ",
            "context": "PUBLIC HEALTH (SCHOOL CHILDREN)   IMMUNISATION ACT under Penalties. 5. Every Head Teacher or  Principal  of  a  school,  and  every Supervisor, who contravenes the provisions of  (a)     section  3(1)  or  section  4  is  liable  on  summary conviction  to  a  fine  of  nineteen  thousand  five hundred dollars;  (b)  section 3(3) is liable on summary conviction to a fine of six thousand  five hundred dollars. LAWS OF GUYANA 6 Cap. 35:02 Public Health (School Children) Immunisation   L.R.O. 1/2012  Power to amend the Schedule.     Regulations.     This Act to prevail over the Education Act. c. 39:01    s. 2",
            "description": [
                {
                    "representation": "(a)",
                    "description": "section  3(1)  or  section  4  is  liable  on  summary conviction  to  a  fine  of  nineteen  thousand  five hundred dollars;"
                },
                {
                    "representation": "(b)",
                    "description": "section 3(3) is liable on summary conviction to a fine of six thousand  five hundred dollars. LAWS OF GUYANA 6 Cap. 35:02 Public Health"
                }
            ]
        }
    },
    {
        "act": "PUBLIC HEALTH (SCHOOL CHILDREN)   IMMUNISATION ACT",
        "source": "https://mola.gov.gy/laws-of-guyana",
        "type": {
            "name": "section",
            "representation": "6",
            "title": "Power to amend the Schedule. ",
            "context": "PUBLIC HEALTH (SCHOOL CHILDREN)   IMMUNISATION ACT under Power to amend the Schedule. 6. The Minister may, by order, vary or amend the Schedule or substitute a new Schedule in place thereof.",
            "description": "The Minister may, by order, vary or amend the Schedule or substitute a new Schedule in place thereof."
        }
    },
    {
        "act": "PUBLIC HEALTH (SCHOOL CHILDREN)   IMMUNISATION ACT",
        "source": "https://mola.gov.gy/laws-of-guyana",
        "type": {
            "name": "section",
            "representation": "7",
            "title": "Regulations. ",
            "context": "PUBLIC HEALTH (SCHOOL CHILDREN)   IMMUNISATION ACT under Regulations. 7. The Minister may make Regulations for the purpose of carrying out the provisions of this Act.",
            "description": "The Minister may make Regulations for the purpose of carrying out the provisions of this Act."
        }
    }
]