[
    {
        "act": "NATIONAL INSURANCE AND   SOCIAL SECURITY ACT",
        "source": "https://mola.gov.gy/laws-of-guyana",
        "type": {
            "name": "section",
            "representation": "1",
            "title": "Short title. ",
            "context": "NATIONAL INSURANCE AND   SOCIAL SECURITY ACT under Short title. 1.  This Act may be cited as the National Insurance and Social Security Act.",
            "description": "This Act may be cited as the National Insurance and Social Security Act."
        }
    },
    {
        "act": "NATIONAL INSURANCE AND   SOCIAL SECURITY ACT",
        "source": "https://mola.gov.gy/laws-of-guyana",
        "type": {
            "name": "section",
            "representation": "2",
            "title": "Interpretation.  PART II  ",
            "context": "NATIONAL INSURANCE AND   SOCIAL SECURITY ACT under Interpretation.  PART II  2.  In this Act  the Administration means the Co-operative Finance Administration established by section 3 of the Co-operative Financial Institutions Act;  benefit means benefit which is payable under this Act;  the Board  means  the  National  Insurance  Board  established  by section 3;  contribution means a contribution payable pursuant to this Act;  contribution period means the prescribed period in respect of which a contribution is payable;  disease includes personal injury not caused by accident and any condition which has resulted from a disease or LAWS OF GUYANA 8 Cap. 36:01 National Insurance and Social Security   L.R.O. 1/2012                           Schedule.                      Establishment and personal injury;  employed person means any person who is insured under this Act by virtue of section 11(1);  the Fund means the National Insurance Fund established by section 33;  incapable of work means incapable of work by reason of some specific disease or bodily or mental disablement or deemed in accordance with regulations to be so incapable;   insurable employment means subject to section 11 (2) any employment specified in the Schedule;  insured person means a person insured under this Act;  loss of faculty means the partial or total loss of the normal use of an organ or part of the body or the destruction or impairment of any bodily or mental function (including disfigurement whether or not accompanied by any actual loss of function);  prescribed means prescribed by regulations;  self-employed  person  means  a  person  gainfully  occupied   in employment in Guyana who is not an employed person;  wages includes salary or any other pecuniary remuneration as may be prescribed.  PART II THE  NATIONAL  INSURANCE  BOARD",
            "description": [
                {
                    "representation": "(2)",
                    "description": "any employment specified in the Schedule;  insured person means a person insured under this Act;  loss of faculty means the partial or total loss of the normal use of an organ or part of the body or the destruction or impairment of any bodily or mental function"
                }
            ]
        }
    },
    {
        "act": "NATIONAL INSURANCE AND   SOCIAL SECURITY ACT",
        "source": "https://mola.gov.gy/laws-of-guyana",
        "type": {
            "name": "section",
            "representation": "3",
            "title": "Establishment and constitution of National Insurance Board. ",
            "context": "NATIONAL INSURANCE AND   SOCIAL SECURITY ACT under Establishment and constitution of National Insurance Board. 3. (1) There is established for the purposes of this Act a body to be called the National Insurance Board. LAWS OF GUYANA National Insurance and Social Security Cap. 36:01 9  L.R.O. 1/2012 constitution of National Insurance Board. [9 of 1981]                              Incorporation.         Affixing of seal and authentication of documents.    (2) The Board shall consist of the following  (a)     a chairman who shall be appointed by the Minister;  (b)     the General Manager of the Board, ex-officio, who shall be the Deputy Chairman;  (c)     seven other  members  appointed  by the Minister from among persons appearing to him to be qualified as having experience of, and shown capacity in, such matters which he considers will be beneficial to the functioning of the Board.  (3) Subject to the provisions of this Act, the term of office and other conditions of appointment of the members of the Board, other than  the General Manager of the Board, shall be such as may be determined by the Minister.  (4) The Board shall function subject to the supervision and control of the Administration.",
            "description": [
                {
                    "representation": "(1)",
                    "description": "There is established for the purposes of this Act a body to be called the National Insurance Board. LAWS OF GUYANA National Insurance and Social Security Cap. 36:01 9  L.R.O. 1/2012 constitution of National Insurance Board. [9 of 1981]                              Incorporation.         Affixing of seal and authentication of documents."
                },
                {
                    "representation": "(2)",
                    "description": "The Board shall consist of the following"
                },
                {
                    "representation": "(a)",
                    "description": "a chairman who shall be appointed by the Minister;"
                },
                {
                    "representation": "(b)",
                    "description": "the General Manager of the Board, ex-officio, who shall be the Deputy Chairman;"
                },
                {
                    "representation": "(c)",
                    "description": "seven other  members  appointed  by the Minister from among persons appearing to him to be qualified as having experience of, and shown capacity in, such matters which he considers will be beneficial to the functioning of the Board."
                },
                {
                    "representation": "(3)",
                    "description": "Subject to the provisions of this Act, the term of office and other conditions of appointment of the members of the Board, other than  the General Manager of the Board, shall be such as may be determined by the Minister."
                },
                {
                    "representation": "(4)",
                    "description": "The Board shall function subject to the supervision and control of the Administration."
                }
            ]
        }
    },
    {
        "act": "NATIONAL INSURANCE AND   SOCIAL SECURITY ACT",
        "source": "https://mola.gov.gy/laws-of-guyana",
        "type": {
            "name": "section",
            "representation": "4",
            "title": "Incorporation. ",
            "context": "NATIONAL INSURANCE AND   SOCIAL SECURITY ACT under Incorporation. 4. (1) The Board shall be a body corporate.  (2) Service  upon  the  Board  of  any  notice,  order  or  other document of whatsoever kind shall be executed by delivering the same to or sending it by registered post addressed to the chairman at the principal office of the Board.",
            "description": [
                {
                    "representation": "(1)",
                    "description": "The Board shall be a body corporate."
                },
                {
                    "representation": "(2)",
                    "description": "Service  upon  the  Board  of  any  notice,  order  or  other document of whatsoever kind shall be executed by delivering the same to or sending it by registered post addressed to the chairman at the principal office of the Board."
                }
            ]
        }
    },
    {
        "act": "NATIONAL INSURANCE AND   SOCIAL SECURITY ACT",
        "source": "https://mola.gov.gy/laws-of-guyana",
        "type": {
            "name": "section",
            "representation": "5",
            "title": "Affixing of seal and authentication of documents. ",
            "context": "NATIONAL INSURANCE AND   SOCIAL SECURITY ACT under Affixing of seal and authentication of documents. 5. (1)  The seal of the Board shall be kept in the custody of the chairman or deputy chairman or such officer of the Board as the Board may  approve,  and  may  be  affixed  to  instruments  pursuant  to  a resolution of the Board and in the presence of the Chairman or deputy chairman and one other member. members, namely - LAWS OF GUYANA 10 Cap. 36:01 National Insurance and Social Security   L.R.O. 1/2012                      Meetings of the Board and procedure. [14 of 1971 9 of 1981]                                     (2) The seal of the Board shall be authenticated by the signature of the chairman or deputy chairman and such other member, and such seal shall be officially and judicially noticed.",
            "description": [
                {
                    "representation": "(1)",
                    "description": "The seal of the Board shall be kept in the custody of the chairman or deputy chairman or such officer of the Board as the Board may  approve,  and  may  be  affixed  to  instruments  pursuant  to  a resolution of the Board and in the presence of the Chairman or deputy chairman and one other member. members, namely - LAWS OF GUYANA 10 Cap. 36:01 National Insurance and Social Security   L.R.O. 1/2012                      Meetings of the Board and procedure. [14 of 1971 9 of 1981]"
                },
                {
                    "representation": "(2)",
                    "description": "The seal of the Board shall be authenticated by the signature of the chairman or deputy chairman and such other member, and such seal shall be officially and judicially noticed."
                }
            ]
        }
    },
    {
        "act": "NATIONAL INSURANCE AND   SOCIAL SECURITY ACT",
        "source": "https://mola.gov.gy/laws-of-guyana",
        "type": {
            "name": "section",
            "representation": "6",
            "title": "Meetings of the Board and procedure. ",
            "context": "NATIONAL INSURANCE AND   SOCIAL SECURITY ACT under Meetings of the Board and procedure. 6. (1)  The Board shall meet at such times as may be necessary or expedient for the transaction of business and such meetings shall be held  at such places and times and on such days as the Board may determine.  (2) The chairman, or in the event of his being absent from Guyana  or  for  any  reason  whatsoever  unable  to  act,  the  deputy chairman, may at any time call a special meeting of the Board and shall call  a  special meeting within seven days of a requisition for that purpose addressed to him in writing by any four members.  (3) The chairman or in his absence the deputy chairman shall preside at all meetings of the Board.  (4) The chairman or in his absence, the deputy chairman and four other members shall form a quorum.  (5) The decision of the Board shall be by a majority of votes and in addition to an original vote in any case in which the voting is equal the chairman or deputy chairman presiding at the meeting shall have a casting vote.  (6) Minutes in proper form of each meeting shall be kept by such officer of the Board as the Board may appoint for the purpose and shall be confirmed by the Board at the next meeting and signed by the chairman or the deputy chairman as the case may be.  (7) The Board may co-opt any one or more persons to attend any particular meeting of the Board for the purpose of assisting or advising the Board in any matter with which the Board is dealing, but no co-opted person shall have the LAWS OF GUYANA National Insurance and Social Security Cap. 36:01 11  L.R.O. 1/2012                    Power to appoint committees.             Power to delegate.           Remuneration of members, co-opted persons and committee members. [14 of 1971 9 of 1981] right to vote.  (8) The Secretary of the Administration is entitled to receive notices of all meetings of the Board and to attend thereat without the right to vote and he is entitled to be furnished with copies of the records of the proceedings at the meetings showing the matters discussed and the conclusions reached by the Board thereat.  (9) Subject to the provisions of this Act, the Board has the power to regulate its own proceedings.",
            "description": [
                {
                    "representation": "(1)",
                    "description": "The Board shall meet at such times as may be necessary or expedient for the transaction of business and such meetings shall be held  at such places and times and on such days as the Board may determine."
                },
                {
                    "representation": "(2)",
                    "description": "The chairman, or in the event of his being absent from Guyana  or  for  any  reason  whatsoever  unable  to  act,  the  deputy chairman, may at any time call a special meeting of the Board and shall call  a  special meeting within seven days of a requisition for that purpose addressed to him in writing by any four members."
                },
                {
                    "representation": "(3)",
                    "description": "The chairman or in his absence the deputy chairman shall preside at all meetings of the Board."
                },
                {
                    "representation": "(4)",
                    "description": "The chairman or in his absence, the deputy chairman and four other members shall form a quorum."
                },
                {
                    "representation": "(5)",
                    "description": "The decision of the Board shall be by a majority of votes and in addition to an original vote in any case in which the voting is equal the chairman or deputy chairman presiding at the meeting shall have a casting vote."
                },
                {
                    "representation": "(6)",
                    "description": "Minutes in proper form of each meeting shall be kept by such officer of the Board as the Board may appoint for the purpose and shall be confirmed by the Board at the next meeting and signed by the chairman or the deputy chairman as the case may be."
                },
                {
                    "representation": "(7)",
                    "description": "The Board may co-opt any one or more persons to attend any particular meeting of the Board for the purpose of assisting or advising the Board in any matter with which the Board is dealing, but no co-opted person shall have the LAWS OF GUYANA National Insurance and Social Security Cap. 36:01 11  L.R.O. 1/2012                    Power to appoint committees.             Power to delegate.           Remuneration of members, co-opted persons and committee members. [14 of 1971 9 of 1981] right to vote."
                },
                {
                    "representation": "(8)",
                    "description": "The Secretary of the Administration is entitled to receive notices of all meetings of the Board and to attend thereat without the right to vote and he is entitled to be furnished with copies of the records of the proceedings at the meetings showing the matters discussed and the conclusions reached by the Board thereat."
                },
                {
                    "representation": "(9)",
                    "description": "Subject to the provisions of this Act, the Board has the power to regulate its own proceedings."
                }
            ]
        }
    },
    {
        "act": "NATIONAL INSURANCE AND   SOCIAL SECURITY ACT",
        "source": "https://mola.gov.gy/laws-of-guyana",
        "type": {
            "name": "section",
            "representation": "7",
            "title": "Power to appoint committees. ",
            "context": "NATIONAL INSURANCE AND   SOCIAL SECURITY ACT under Power to appoint committees. 7. (1)  Subject to the provisions of this Act, the Board may appoint such committees of the Board as the Board shall think fit:  Provided that any committee so appointed shall include not less than two members of the Board, and may include persons who are not members of the Board.  (2) Subject to the provisions of this Act, the constitution and functions of a committee of the Board shall be determined by the Board.",
            "description": [
                {
                    "representation": "(1)",
                    "description": "Subject to the provisions of this Act, the Board may appoint such committees of the Board as the Board shall think fit:  Provided that any committee so appointed shall include not less than two members of the Board, and may include persons who are not members of the Board."
                },
                {
                    "representation": "(2)",
                    "description": "Subject to the provisions of this Act, the constitution and functions of a committee of the Board shall be determined by the Board."
                }
            ]
        }
    },
    {
        "act": "NATIONAL INSURANCE AND   SOCIAL SECURITY ACT",
        "source": "https://mola.gov.gy/laws-of-guyana",
        "type": {
            "name": "section",
            "representation": "8",
            "title": "Power to delegate. ",
            "context": "NATIONAL INSURANCE AND   SOCIAL SECURITY ACT under Power to delegate. 8. (1) Subject to the provisions of this Act, the Board may delegate to any member or committee or officer or employee of the Board the power  to carry out on its behalf such functions as the Board may determine.  (2) Every delegation under this section shall be revocable by the Board and no delegation shall prevent the exercise by the Board of any function.",
            "description": [
                {
                    "representation": "(1)",
                    "description": "Subject to the provisions of this Act, the Board may delegate to any member or committee or officer or employee of the Board the power  to carry out on its behalf such functions as the Board may determine."
                },
                {
                    "representation": "(2)",
                    "description": "Every delegation under this section shall be revocable by the Board and no delegation shall prevent the exercise by the Board of any function."
                }
            ]
        }
    },
    {
        "act": "NATIONAL INSURANCE AND   SOCIAL SECURITY ACT",
        "source": "https://mola.gov.gy/laws-of-guyana",
        "type": {
            "name": "section",
            "representation": "9",
            "title": "Remuneration of members, co-opted persons and committee members. ",
            "context": "NATIONAL INSURANCE AND   SOCIAL SECURITY ACT under Remuneration of members, co-opted persons and committee members. 9.  The Board shall pay  (a) to each member in respect of his office, such remuneration and allowances (if any) as the Administration may  determine  and  LAWS OF GUYANA 12 Cap. 36:01 National Insurance and Social Security   L.R.O. 1/2012                             Protection of Board and its members.                        to  the  chairman  and  to  the  deputy chairman in respect of his office, such remuneration and allowances (if any) in addition to any remuneration or allowances to which he may be entitled in respect of his office as a member as may be so determined;  (b)      to any person co-opted under section 6 (7) and to any person  not  being  a  member  of  the Board  serving  on  a committee appointed under section 7 such remuneration and allowances (if any) as the Board with the approval of the Administration may by resolution declare.",
            "description": [
                {
                    "representation": "(a)",
                    "description": "to each member in respect of his office, such remuneration and allowances"
                },
                {
                    "representation": "(b)",
                    "description": "to any person co-opted under section 6"
                },
                {
                    "representation": "(7)",
                    "description": "and to any person  not  being  a  member  of  the Board  serving  on  a committee appointed under section 7 such remuneration and allowances"
                }
            ]
        }
    },
    {
        "act": "NATIONAL INSURANCE AND   SOCIAL SECURITY ACT",
        "source": "https://mola.gov.gy/laws-of-guyana",
        "type": {
            "name": "section",
            "representation": "10",
            "title": "Protection of Board and its members.  PART III INSURED PERSONS AND CONTRIBUTIONS  ",
            "context": "NATIONAL INSURANCE AND   SOCIAL SECURITY ACT under Protection of Board and its members.  PART III INSURED PERSONS AND CONTRIBUTIONS  10.(1)  No act done or proceedings taken under this Act shall be questioned on the ground  (a)    of the existence of any vacancy in the membership, or any defect in the constitution of the Board; or  (b)     of any omission, defect or irregularity not affecting the merits of the case.  (2) No action, suit, prosecution or other  proceedings shall be brought or instituted personally against any member of the Board in respect of any act done bona fide in pursuance or execution or intended execution of this Act.  (3) Where any member of the Board is exempt from liability by reason only of the provisions of this section the Board shall be liable to the extent that it would be if such member was a servant or agent of the Board.   LAWS OF GUYANA National Insurance and Social Security Cap. 36:01 13  L.R.O. 1/2012                Persons to be insured. [11 of 1977]                                           PART III INSURED  PERSONS  AND  CONTRIBUTIONS",
            "description": [
                {
                    "representation": "(1)",
                    "description": "No act done or proceedings taken under this Act shall be questioned on the ground"
                },
                {
                    "representation": "(a)",
                    "description": "of the existence of any vacancy in the membership, or any defect in the constitution of the Board; or"
                },
                {
                    "representation": "(b)",
                    "description": "of any omission, defect or irregularity not affecting the merits of the case."
                },
                {
                    "representation": "(2)",
                    "description": "No action, suit, prosecution or other  proceedings shall be brought or instituted personally against any member of the Board in respect of any act done bona fide in pursuance or execution or intended execution of this Act."
                },
                {
                    "representation": "(3)",
                    "description": "Where any member of the Board is exempt from liability by reason only of the provisions of this section the Board shall be liable to the extent that it would be if such member was a servant or agent of the Board.   LAWS OF GUYANA National Insurance and Social Security Cap. 36:01 13  L.R.O. 1/2012                Persons to be insured. [11 of 1977]                                           PART III INSURED  PERSONS  AND  CONTRIBUTIONS"
                }
            ]
        }
    },
    {
        "act": "NATIONAL INSURANCE AND   SOCIAL SECURITY ACT",
        "source": "https://mola.gov.gy/laws-of-guyana",
        "type": {
            "name": "section",
            "representation": "11",
            "title": "Persons to be insured. ",
            "context": "NATIONAL INSURANCE AND   SOCIAL SECURITY ACT under Persons to be insured. 11. (1)  Subject  to  this  Act,  every  person  who on or after the 29th day of September, 1969 is  (a)      sixteen years of age or over and under sixty years of age; and  (b) gainfully occupied in insurable employment, shall be insured under this Act and shall remain so insured for life.   (2) Regulations may provide  (a)  for treating as employment as an employed person any employment   outside   Guyana   in   continuation   of   any insurable employment;  (b)     for treating as not being employment as an employed person or for disregarding  (i)   employment  which  in  the opinion of the Minister is of a  casual  or  subsidiary  nature  or  in  which  the  person concerned is engaged only to an inconsiderable extent;  (ii)     employment  in  the  service, or for the purpose of the trade or business, or as a partner, of a relative of the person concerned; (iii)     employment by a relative in the              common home of the person concerned and the employer; LAWS OF GUYANA 14 Cap. 36:01 National Insurance and Social Security   L.R.O. 1/2012                             Insurance of self-employed persons, of persons under sixteen years of age and of sixty years or upwards. [11 of 1977]      Source of  funds.          (iv)    such employment in the service of, or in the service of a person employed with, such international organisations or countries other than Guyana as may be prescribed;  (c)     for  treating  for  the purposes of this Act or of such provisions thereof as may be prescribed the employment of any person as  (i)   continuing during periods of holiday, incapacity for work or such other circumstances as may be prescribed;  (ii)      ceasing  in  such  circumstances as may be prescribed.",
            "description": [
                {
                    "representation": "(1)",
                    "description": "Subject  to  this  Act,  every  person  who on or after the 29th day of September, 1969 is"
                },
                {
                    "representation": "(a)",
                    "description": "for treating as employment as an employed person any employment   outside   Guyana   in   continuation   of   any insurable employment;"
                },
                {
                    "representation": "(b)",
                    "description": "for treating as not being employment as an employed person or for disregarding"
                },
                {
                    "representation": "(2)",
                    "description": "Regulations may provide"
                },
                {
                    "representation": "(i)",
                    "description": "continuing during periods of holiday, incapacity for work or such other circumstances as may be prescribed;"
                },
                {
                    "representation": "(c)",
                    "description": "for  treating  for  the purposes of this Act or of such provisions thereof as may be prescribed the employment of any person as"
                }
            ]
        }
    },
    {
        "act": "NATIONAL INSURANCE AND   SOCIAL SECURITY ACT",
        "source": "https://mola.gov.gy/laws-of-guyana",
        "type": {
            "name": "section",
            "representation": "12",
            "title": "Insurance of self-employed persons, of persons under sixteen years of age and of sixty years or upwards. ",
            "context": "NATIONAL INSURANCE AND   SOCIAL SECURITY ACT under Insurance of self-employed persons, of persons under sixteen years of age and of sixty years or upwards. 12. The Minister may by regulations provide for the insurance under this Act of self-employed persons, of persons under sixteen years of age and of persons sixty years or upwards in respect of any of the several contingencies in relation to which benefits are provided under  this  Act  and  any  such  regulations  may  provide  for  such modifications of the provisions of this Act or may make such other provision as may be necessary for the purpose of giving effect to this section.",
            "description": "The Minister may by regulations provide for the insurance under this Act of self-employed persons, of persons under sixteen years of age and of persons sixty years or upwards in respect of any of the several contingencies in relation to which benefits are provided under  this  Act  and  any  such  regulations  may  provide  for  such modifications of the provisions of this Act or may make such other provision as may be necessary for the purpose of giving effect to this section."
        }
    },
    {
        "act": "NATIONAL INSURANCE AND   SOCIAL SECURITY ACT",
        "source": "https://mola.gov.gy/laws-of-guyana",
        "type": {
            "name": "section",
            "representation": "13",
            "title": "Source of funds. ",
            "context": "NATIONAL INSURANCE AND   SOCIAL SECURITY ACT under Source of funds. 13.(1) For the purposes of this Act, contributions shall, subject to this Act, be payable by insured persons and by employers.  (2) Regulations shall provide for fixing, from time to time, the rates of contribution to be paid by such different categories of insured persons and employers as may be prescribed.  LAWS OF GUYANA National Insurance and Social Security Cap. 36:01 15  L.R.O. 1/2012 Exceptions from liability for, and crediting of contributions.                     Voluntary contributions.                   Contributions of employed persons and employers.",
            "description": [
                {
                    "representation": "(1)",
                    "description": "For the purposes of this Act, contributions shall, subject to this Act, be payable by insured persons and by employers."
                },
                {
                    "representation": "(2)",
                    "description": "Regulations shall provide for fixing, from time to time, the rates of contribution to be paid by such different categories of insured persons and employers as may be prescribed.  LAWS OF GUYANA National Insurance and Social Security Cap. 36:01 15  L.R.O. 1/2012 Exceptions from liability for, and crediting of contributions.                     Voluntary contributions.                   Contributions of employed persons and employers."
                }
            ]
        }
    },
    {
        "act": "NATIONAL INSURANCE AND   SOCIAL SECURITY ACT",
        "source": "https://mola.gov.gy/laws-of-guyana",
        "type": {
            "name": "section",
            "representation": "14",
            "title": "Exceptions from liability for, and crediting of contributions. ",
            "context": "NATIONAL INSURANCE AND   SOCIAL SECURITY ACT under Exceptions from liability for, and crediting of contributions. 14.  Regulations may provide for  (a)   excepting  insured  persons  from liability to pay contributions  for  such  periods  as  may be  prescribed  or without prejudice  to the generality of the foregoing for periods  (i)        of incapacity for work; or (ii)    of full time unpaid apprentice-ship;  (b)  crediting contributions to insured persons for periods for  which such persons are excepted from liability to pay contributions under paragraph (a).",
            "description": [
                {
                    "representation": "(a)",
                    "description": "excepting  insured  persons  from liability to pay contributions  for  such  periods  as  may be  prescribed  or without prejudice  to the generality of the foregoing for periods"
                },
                {
                    "representation": "(i)",
                    "description": "of incapacity for work; or"
                },
                {
                    "representation": "(b)",
                    "description": "crediting contributions to insured persons for periods for  which such persons are excepted from liability to pay contributions under paragraph"
                }
            ]
        }
    },
    {
        "act": "NATIONAL INSURANCE AND   SOCIAL SECURITY ACT",
        "source": "https://mola.gov.gy/laws-of-guyana",
        "type": {
            "name": "section",
            "representation": "15",
            "title": "Voluntary contributions. ",
            "context": "NATIONAL INSURANCE AND   SOCIAL SECURITY ACT under Voluntary contributions. 15.(1) Any insured person who is not liable to pay contributions under this Act shall be entitled on making application to the Board within such time and in such manner as may be prescribed to receive a certificate  of  voluntary  insurance  if  he  satisfies  the  prescribed conditions.  (2) An  insured  person  holding  a  certificate  of  voluntary insurance granted under subsection (1) may pay within such time and in such manner as may be prescribed, the contribution at the prescribed rate  for  any contribution period in which he is not liable to pay a contribution under this Act as an insured person, and regulations may prescribe  the  circumstances  in  which  such  a  certificate  may  be cancelled in default of payment of contributions within the prescribed time.",
            "description": [
                {
                    "representation": "(1)",
                    "description": "may pay within such time and in such manner as may be prescribed, the contribution at the prescribed rate  for  any contribution period in which he is not liable to pay a contribution under this Act as an insured person, and regulations may prescribe  the  circumstances  in  which  such  a  certificate  may  be cancelled in default of payment of contributions within the prescribed time."
                },
                {
                    "representation": "(2)",
                    "description": "An  insured  person  holding  a  certificate  of  voluntary insurance granted under subsection"
                }
            ]
        }
    },
    {
        "act": "NATIONAL INSURANCE AND   SOCIAL SECURITY ACT",
        "source": "https://mola.gov.gy/laws-of-guyana",
        "type": {
            "name": "section",
            "representation": "16",
            "title": "Contributions of employed persons and employers.   THE NATIONAL INSURANCE BOARD LAWS OF GUYANA National Insurance and Social Security Cap. 36:01 5  L.R.O. 1/2012 SECTION  ",
            "context": "NATIONAL INSURANCE AND   SOCIAL SECURITY ACT under Contributions of employed persons and employers.   THE NATIONAL INSURANCE BOARD LAWS OF GUYANA National Insurance and Social Security Cap. 36:01 5  L.R.O. 1/2012 SECTION  16.(1) Except where regulations otherwise provide, an employer liable to pay a contribution in respect of a person employed by him shall in the first instance be liable to pay also on behalf of and to the exclusion of such person any contribution payable by such person for the  same  LAWS OF GUYANA 16 Cap. 36:01 National Insurance and Social Security   L.R.O. 1/2012                           General provisions as to the payment and collection of contributions, etc. [15 of 1989 28 of 1997]                contribution  period  and  for  the  purposes  of  this  Act contributions so paid by an employer on behalf of such person shall be deemed to be contributions by such person.  (2) Notwithstanding any contract to the contrary, an employer shall not be entitled to deduct from the wages of a person employed by him or otherwise to recover from such person the contribution of the employer in respect of such person.  (3) An employer shall be entitled, subject to and in accordance with regulations, to recover from a person employed by him the amount of any contribution paid or to be paid by him on behalf of such person, and   notwithstanding anything in any enactment,   such regulations may authorise such recovery to be made by deductions from the wages of such person.",
            "description": [
                {
                    "representation": "(1)",
                    "description": "Except where regulations otherwise provide, an employer liable to pay a contribution in respect of a person employed by him shall in the first instance be liable to pay also on behalf of and to the exclusion of such person any contribution payable by such person for the  same  LAWS OF GUYANA 16 Cap. 36:01 National Insurance and Social Security   L.R.O. 1/2012                           General provisions as to the payment and collection of contributions, etc. [15 of 1989 28 of 1997]                contribution  period  and  for  the  purposes  of  this  Act contributions so paid by an employer on behalf of such person shall be deemed to be contributions by such person."
                },
                {
                    "representation": "(2)",
                    "description": "Notwithstanding any contract to the contrary, an employer shall not be entitled to deduct from the wages of a person employed by him or otherwise to recover from such person the contribution of the employer in respect of such person."
                },
                {
                    "representation": "(3)",
                    "description": "An employer shall be entitled, subject to and in accordance with regulations, to recover from a person employed by him the amount of any contribution paid or to be paid by him on behalf of such person, and   notwithstanding anything in any enactment,   such regulations may authorise such recovery to be made by deductions from the wages of such person."
                }
            ]
        }
    },
    {
        "act": "NATIONAL INSURANCE AND   SOCIAL SECURITY ACT",
        "source": "https://mola.gov.gy/laws-of-guyana",
        "type": {
            "name": "section",
            "representation": "17",
            "title": "General   provisions as to   the   payment   and collection of contributions, etc. 17A. Records of contributions and annual compliance reports. ",
            "context": "NATIONAL INSURANCE AND   SOCIAL SECURITY ACT under General   provisions as to   the   payment   and collection of contributions, etc. 17A. Records of contributions and annual compliance reports. 17.(1)  Regulations may provide  (a)  for the payment and collection of            contributions;  (b)   for treating for the purposes of any right to benefit, contributions paid after the due dates as paid on such dates or on such later dates as may be prescribed or as not having been paid;  (c)    for  treating for the purposes of any right to benefit, contributions  payable  by  an  employer  on  behalf  of  an insured person but not paid as paid where the failure to pay is shown not to have been with the consent or connivance of or attributable to any negligence on the part of such person;  LAWS OF GUYANA National Insurance and Social Security Cap. 36:01 17  L.R.O. 1/2012                                    Records of contributions and annual compliance reports. [33 of 2009]     Persons to be treated as employers.           (d)      for treating contributions of the wrong class or at the wrong rate as paid on account of the contributions properly payable;  (e)    for the return of contributions paid in error.  (2) [Deleted by 15/1989]  (3) Where regulations permit contributions to be paid at the option of the person liable to pay by a method other than by means of cash   or   cheque  and  that  method  involves  greater  expense  in administration to the Fund than would be incurred if the contributions were paid by means of cash or cheque such regulations may provide for the payment to the Fund by any person who adopts such method, and for the recovery on behalf of the Fund, of the prescribed fees in respect of the difference in the expense in administration.  17A. (1) The General Manager shall submit records of contributions to employees promptly and the records are to be known as annual contribution statements. (2) The General Manager shall provide to employers annual compliance reports of their payments of contributions on behalf of their employees.",
            "description": [
                {
                    "representation": "(1)",
                    "description": "The General Manager shall submit records of contributions to employees promptly and the records are to be known as annual contribution statements."
                },
                {
                    "representation": "(a)",
                    "description": "for the payment and collection of            contributions;"
                },
                {
                    "representation": "(b)",
                    "description": "for treating for the purposes of any right to benefit, contributions paid after the due dates as paid on such dates or on such later dates as may be prescribed or as not having been paid;"
                },
                {
                    "representation": "(c)",
                    "description": "for  treating for the purposes of any right to benefit, contributions  payable  by  an  employer  on  behalf  of  an insured person but not paid as paid where the failure to pay is shown not to have been with the consent or connivance of or attributable to any negligence on the part of such person;  LAWS OF GUYANA National Insurance and Social Security Cap. 36:01 17  L.R.O. 1/2012                                    Records of contributions and annual compliance reports. [33 of 2009]     Persons to be treated as employers."
                },
                {
                    "representation": "(d)",
                    "description": "for treating contributions of the wrong class or at the wrong rate as paid on account of the contributions properly payable;"
                },
                {
                    "representation": "(e)",
                    "description": "for the return of contributions paid in error."
                },
                {
                    "representation": "(2)",
                    "description": "The General Manager shall provide to employers annual compliance reports of their payments of contributions on behalf of their employees."
                },
                {
                    "representation": "(3)",
                    "description": "Where regulations permit contributions to be paid at the option of the person liable to pay by a method other than by means of cash   or   cheque  and  that  method  involves  greater  expense  in administration to the Fund than would be incurred if the contributions were paid by means of cash or cheque such regulations may provide for the payment to the Fund by any person who adopts such method, and for the recovery on behalf of the Fund, of the prescribed fees in respect of the difference in the expense in administration.  17A."
                }
            ]
        }
    },
    {
        "act": "NATIONAL INSURANCE AND   SOCIAL SECURITY ACT",
        "source": "https://mola.gov.gy/laws-of-guyana",
        "type": {
            "name": "section",
            "representation": "18",
            "title": "Persons to be treated as employers.  PART IV BENEFITS  ",
            "context": "NATIONAL INSURANCE AND   SOCIAL SECURITY ACT under Persons to be treated as employers.  PART IV BENEFITS  18.  In relation to persons who  (a)  are employed by more than one  employer  in any contribution period; or  (b)  work under the general control or            management of some person other and in relation to any other cases for than their immediate employer,  which it appears to LAWS OF GUYANA 18 Cap. 36:01 National Insurance and Social Security   L.R.O. 1/2012                       Description of benefits. [11 of 1977 6 of 1981 15 of 1989 27 of 1992 28 of 1997]                        PART IV BENEFITS",
            "description": [
                {
                    "representation": "(a)",
                    "description": "are employed by more than one  employer  in any contribution period; or"
                },
                {
                    "representation": "(b)",
                    "description": "work under the general control or            management of some person other and in relation to any other cases for than their immediate employer,  which it appears to LAWS OF GUYANA 18 Cap. 36:01 National Insurance and Social Security   L.R.O. 1/2012                       Description of benefits. [11 of 1977 6 of 1981 15 of 1989 27 of 1992 28 of 1997]                        PART IV BENEFITS"
                }
            ]
        }
    },
    {
        "act": "NATIONAL INSURANCE AND   SOCIAL SECURITY ACT",
        "source": "https://mola.gov.gy/laws-of-guyana",
        "type": {
            "name": "section",
            "representation": "19",
            "title": "Description of benefits. ",
            "context": "NATIONAL INSURANCE AND   SOCIAL SECURITY ACT under Description of benefits. 19. (l) (a) Benefits shall be of the following kinds only  (i)        old age benefit, that is to say, a              payment or periodical payments to an insured person who has reached sixty years of age; (ii)    invalidity  benefit,  that  is  to  say,  a  payment  or periodical payments to an insured person who is rendered permanently incapable of work otherwise than as a result of employment injury; (iii)   survivors  benefit,  that  is  to  say,  a  payment  or periodical payments made in respect of an insured person who  dies  and  who  immediately  before  his  death  was receiving old age benefit or invalidity benefit or in respect of an insured person persons employed. the Minister that special provision is  needed, regulations mayprovide that for the purposes  of this Act   the prescribed person shall be treated as their   employer;   and   such        further provide for   adjusting the regulations      may rights between themselves of the     person      prescribed  as    the employer,        the immediate employer and the LAWS OF GUYANA National Insurance and Social Security Cap. 36:01 19  L.R.O. 1/2012                                                 who dies otherwise than as a result of employment injury; (iv)    sickness  benefit, that is to say, in addition to such free medical   care   and   attention   as   may   be   prescribed, periodical payments to an insured person who is rendered temporarily incapable of work otherwise than as a result of employment injury; (v)    maternity  benefit,  that  is  to  say,  a payment  or periodical  payments  to  an  insured  person  or  to  the uninsured spouse of an insured person in the case of her pregnancy or confinement; (vi)      funeral benefit, that is to say, a              payment on the death of an insured person or of a person in such relationship to an insured person as may be prescribed; (vii)   child care benefit, that is to say, in addition to free medical  care,  a  payment  or  periodical  payments  to  a mother  who  has  been  absent  from  work  for  the  sole purpose of caring for her sick child; (viii) constant attendance  benefit,  that  is  to  say,  a payment or periodical payments to an invalid or disabled person who is in receipt of a pension under this Act.   (b)      In this subsection, the expression            employment injury means such LAWS OF GUYANA 20 Cap. 36:01 National Insurance and Social Security   L.R.O. 1/2012     Cap. 111 1953 Ed.                                           injury as before the 1st day of January, 1970 attracts compensation under the Workmens Compensation Ordinance or on or after such day attracts industrial benefit under this Act.   (a)   injury  benefit,  that is  to say, in addition to such free medical care and attention, as may be prescribed, periodical payments to an insured person who suffers personal injury which is caused by an accident arising out of and in the course  of  his  insurable  employment  or  develops  any prescribed disease being a disease due to the nature of such employment;  (b)    disablement benefit, that is to say, in addition to such free  medical care and attention, as may be prescribed, a payment or periodical payments to an insured person who as a result of such injury or disease as is referred to in paragraph (a) suffers loss of faculty;  (c)     death benefit, that is to say, periodical payments in respect of an insured person who dies as a result of such injury or disease as is referred to in paragraph (a):  Provided that, subject to section 47, industrial benefit shall not be payable in respect of an accident happening or a shall be in addition to the benefits specified in subsection (1) (2)       On or after the 1st day of January, 1970, thereindustrial benefit which shall comprise - LAWS OF GUYANA National Insurance and Social Security Cap. 36:01 21  L.R.O. 1/2012         Rates of benefits.                 Regulations with regard to payment of benefits and as respects persons abroad or in prison, persons unable to act and deceased persons.                  prescribed disease developing while the insured person is outside Guyana.",
            "description": [
                {
                    "representation": "(l)",
                    "description": "(a) Benefits shall be of the following kinds only"
                },
                {
                    "representation": "(i)",
                    "description": "old age benefit, that is to say, a              payment or periodical payments to an insured person who has reached sixty years of age;"
                },
                {
                    "representation": "(v)",
                    "description": "maternity  benefit,  that  is  to  say,  a payment  or periodical  payments  to  an  insured  person  or  to  the uninsured spouse of an insured person in the case of her pregnancy or confinement;"
                },
                {
                    "representation": "(b)",
                    "description": "disablement benefit, that is to say, in addition to such free  medical care and attention, as may be prescribed, a payment or periodical payments to an insured person who as a result of such injury or disease as is referred to in paragraph"
                },
                {
                    "representation": "(a)",
                    "description": "suffers loss of faculty;"
                },
                {
                    "representation": "(c)",
                    "description": "death benefit, that is to say, periodical payments in respect of an insured person who dies as a result of such injury or disease as is referred to in paragraph"
                },
                {
                    "representation": "(1)",
                    "description": "(2)       On or after the 1st day of January, 1970, thereindustrial benefit which shall comprise - LAWS OF GUYANA National Insurance and Social Security Cap. 36:01 21  L.R.O. 1/2012         Rates of benefits.                 Regulations with regard to payment of benefits and as respects persons abroad or in prison, persons unable to act and deceased persons.                  prescribed disease developing while the insured person is outside Guyana."
                }
            ]
        }
    },
    {
        "act": "NATIONAL INSURANCE AND   SOCIAL SECURITY ACT",
        "source": "https://mola.gov.gy/laws-of-guyana",
        "type": {
            "name": "section",
            "representation": "20",
            "title": "Rates of benefits. ",
            "context": "NATIONAL INSURANCE AND   SOCIAL SECURITY ACT under Rates of benefits. 20.  Regulations shall provide for  (a)   the rates or amounts of benefit and            the variation of such rates or amounts in  different or special circumstances;  (b)      the  conditions  subject  to  which  and the periods for which benefit may be granted; and  (c)   the date as from which benefit is provided.",
            "description": [
                {
                    "representation": "(a)",
                    "description": "the rates or amounts of benefit and            the variation of such rates or amounts in  different or special circumstances;"
                },
                {
                    "representation": "(b)",
                    "description": "the  conditions  subject  to  which  and the periods for which benefit may be granted; and"
                },
                {
                    "representation": "(c)",
                    "description": "the date as from which benefit is provided."
                }
            ]
        }
    },
    {
        "act": "NATIONAL INSURANCE AND   SOCIAL SECURITY ACT",
        "source": "https://mola.gov.gy/laws-of-guyana",
        "type": {
            "name": "section",
            "representation": "21",
            "title": "Regulations with regard to payment of benefits and as respects persons abroad   or   in prison,  persons  unable  to act and deceased  persons. ",
            "context": "NATIONAL INSURANCE AND   SOCIAL SECURITY ACT under Regulations with regard to payment of benefits and as respects persons abroad   or   in prison,  persons  unable  to act and deceased  persons. 21.  Regulations may provide  (a)   for the time and manner of paying benefit and as to the information and evidence to be furnished by persons when applying  for   payment,   and   without   prejudice   to   the generality of the foregoing and notwithstanding anything in this Act, for adjusting the commencement and termination of benefit so that except in the case of sickness benefit or injury  benefit  payments shall not be made in respect of periods less than a contribution period or at different rates for   different  parts  of   a   contribution   period  and  for extinguishing the right to any sum payable by way of benefit where payment thereof is not obtained within six months or such shorter period as may be prescribed from the time at which such sum is receivable in accordance with the LAWS OF GUYANA 22 Cap. 36:01 National Insurance and Social Security   L.R.O. 1/2012                                                 regulations;   (b)      for the prevention of the receipt of two              benefits for the same period and the adjustment of benefits in the case of any special circumstances;  (c) for the circumstances in which and the time for which a person shall be disqualified for or disentitled to receipt of benefit or benefit may be forfeited or suspended and without prejudice  to   the  generality  of  the  foregoing  for  the suspension of payment of benefit to or in respect of any person during any period when he is  (i) absent from Guyana, or (ii) undergoing  imprisonment  or              detention  in  legal custody,   and for authorising a person so entitled to exercise  under this Act, the claimant or beneficiary may be being to act, any right or power which be or become unable for the time beneficiary who is a child or who may to exercise, on behalf of a claimant or (d)    for enabling a person to be appointed   and   the   manner  in which  payment and  for the  circumstances  in which of   the  whole   or   any   part  of   the  benefit  may    instead    of   being    sosuspended    be   made   during    any   such period  to or for the maintenanceof such  persons as may be specified  in    the   regulations,    being   personsnominated   by the  person  entitled to person;of the Director are dependants of that to the  benefit or who   in th e  opinion LAWS OF GUYANA National Insurance and Social Security Cap. 36:01 23  L.R.O. 1/2012                                     Presumption and general provisions relating to accidents.              appointed to receive and deal with any sum payable by way of benefit on behalf of the claimant or beneficiary;  (e)   in connection with the death of any person, for enabling a claim for benefit to be made or proceeded with in his name, for  authorising  payment  or  distribution  of  benefit  to  or amongst persons claiming as his personal representatives, legatees, next of kin or creditors (or, in cases of illegitimacy of   deceased   persons,  to  or  amongst  others)  and  for dispensing  with  strict  proof  of  the  title  of  persons  so claiming; and  (f)   for such other matters as may be necessary for the proper administration of benefits, including the obligations of   persons   claiming   any   benefit,   beneficiaries   and employers.",
            "description": [
                {
                    "representation": "(a)",
                    "description": "for the time and manner of paying benefit and as to the information and evidence to be furnished by persons when applying  for   payment,   and   without   prejudice   to   the generality of the foregoing and notwithstanding anything in this Act, for adjusting the commencement and termination of benefit so that except in the case of sickness benefit or injury  benefit  payments shall not be made in respect of periods less than a contribution period or at different rates for   different  parts  of   a   contribution   period  and  for extinguishing the right to any sum payable by way of benefit where payment thereof is not obtained within six months or such shorter period as may be prescribed from the time at which such sum is receivable in accordance with the LAWS OF GUYANA 22 Cap. 36:01 National Insurance and Social Security   L.R.O. 1/2012                                                 regulations;"
                },
                {
                    "representation": "(b)",
                    "description": "for the prevention of the receipt of two              benefits for the same period and the adjustment of benefits in the case of any special circumstances;"
                },
                {
                    "representation": "(c)",
                    "description": "for the circumstances in which and the time for which a person shall be disqualified for or disentitled to receipt of benefit or benefit may be forfeited or suspended and without prejudice  to   the  generality  of  the  foregoing  for  the suspension of payment of benefit to or in respect of any person during any period when he is"
                },
                {
                    "representation": "(i)",
                    "description": "absent from Guyana, or"
                },
                {
                    "representation": "(d)",
                    "description": "for enabling a person to be appointed   and   the   manner  in which  payment and  for the  circumstances  in which of   the  whole   or   any   part  of   the  benefit  may    instead    of   being    sosuspended    be   made   during    any   such period  to or for the maintenanceof such  persons as may be specified  in    the   regulations,    being   personsnominated   by the  person  entitled to person;of the Director are dependants of that to the  benefit or who   in th e  opinion LAWS OF GUYANA National Insurance and Social Security Cap. 36:01 23  L.R.O. 1/2012                                     Presumption and general provisions relating to accidents.              appointed to receive and deal with any sum payable by way of benefit on behalf of the claimant or beneficiary;"
                },
                {
                    "representation": "(e)",
                    "description": "in connection with the death of any person, for enabling a claim for benefit to be made or proceeded with in his name, for  authorising  payment  or  distribution  of  benefit  to  or amongst persons claiming as his personal representatives, legatees, next of kin or creditors"
                },
                {
                    "representation": "(f)",
                    "description": "for such other matters as may be necessary for the proper administration of benefits, including the obligations of   persons   claiming   any   benefit,   beneficiaries   and employers."
                }
            ]
        }
    },
    {
        "act": "NATIONAL INSURANCE AND   SOCIAL SECURITY ACT",
        "source": "https://mola.gov.gy/laws-of-guyana",
        "type": {
            "name": "section",
            "representation": "22",
            "title": "Presumption and general provisions relating to accidents. ",
            "context": "NATIONAL INSURANCE AND   SOCIAL SECURITY ACT under Presumption and general provisions relating to accidents. 22.  For the purposes of this Act an accident  (a)   arising  out  of employment of an insured person shall be presumed unless the contrary is shown to have occurred in the  course  of  the  employment  and  where  the  accident occurred  in  the  course  of  the  employment,  it  shall  be presumed, unless the contrary is shown, to have arisen out of the employment;  (b)      shall be deemed to arise out of and in the course of the employment of an LAWS OF GUYANA 24 Cap. 36:01 National Insurance and Social Security   L.R.O. 1/2012                                                 insured person, notwithstanding that he is at the time of the accident acting in contravention of any statutory or other regulations applicable to his employment, or of any orders given by or on behalf of his employers, or that he is acting without instructions from his employer, if the act is done for the purpose of and in connection with the trade or business of the employer;  (c)      happening while an insured person is, with the express or implied  permission  of  his  employer,  travelling  as  a passenger by any vehicle, ship, vessel or aircraft to or from his place of work shall, notwithstanding that he is under no obligation to his employer to travel by such vehicle, ship, vessel or aircraft be deemed to arise out of and in the course of his employment, if  (i)   the accident would have been deemed so to have arisen had he been under such an obligation; and (ii)    at the time of the accident, the vehicle, ship, vessel or aircraft is being operated by or on behalf of his employer or some other person by whom it is provided in pursuance of arrangements made with his employer and is not being operated  in  the  ordinary  course  of  a  public  transport LAWS OF GUYANA National Insurance and Social Security Cap. 36:01 25  L.R.O. 1/2012                              Prescription of diseases.                          service;  (d)    happening  to  an  insured  person  in  or  about  any premises  at  which  he  is  for  the  time  employed  for  the purposes of the trade or business of his employer shall be deemed to arise out of and in the course of his employment if  it  happens  while  he  is  taking  steps,  or  an  actual  or supposed emergency at those premises, to rescue, succour or protect persons who are, or are thought to be or possibly to be,  injured or imperilled, or to avert or minimise serious damage to property.",
            "description": [
                {
                    "representation": "(a)",
                    "description": "arising  out  of employment of an insured person shall be presumed unless the contrary is shown to have occurred in the  course  of  the  employment  and  where  the  accident occurred  in  the  course  of  the  employment,  it  shall  be presumed, unless the contrary is shown, to have arisen out of the employment;"
                },
                {
                    "representation": "(b)",
                    "description": "shall be deemed to arise out of and in the course of the employment of an LAWS OF GUYANA 24 Cap. 36:01 National Insurance and Social Security   L.R.O. 1/2012                                                 insured person, notwithstanding that he is at the time of the accident acting in contravention of any statutory or other regulations applicable to his employment, or of any orders given by or on behalf of his employers, or that he is acting without instructions from his employer, if the act is done for the purpose of and in connection with the trade or business of the employer;"
                },
                {
                    "representation": "(c)",
                    "description": "happening while an insured person is, with the express or implied  permission  of  his  employer,  travelling  as  a passenger by any vehicle, ship, vessel or aircraft to or from his place of work shall, notwithstanding that he is under no obligation to his employer to travel by such vehicle, ship, vessel or aircraft be deemed to arise out of and in the course of his employment, if"
                },
                {
                    "representation": "(i)",
                    "description": "the accident would have been deemed so to have arisen had he been under such an obligation; and"
                },
                {
                    "representation": "(d)",
                    "description": "happening  to  an  insured  person  in  or  about  any premises  at  which  he  is  for  the  time  employed  for  the purposes of the trade or business of his employer shall be deemed to arise out of and in the course of his employment if  it  happens  while  he  is  taking  steps,  or  an  actual  or supposed emergency at those premises, to rescue, succour or protect persons who are, or are thought to be or possibly to be,  injured or imperilled, or to avert or minimise serious damage to property."
                }
            ]
        }
    },
    {
        "act": "NATIONAL INSURANCE AND   SOCIAL SECURITY ACT",
        "source": "https://mola.gov.gy/laws-of-guyana",
        "type": {
            "name": "section",
            "representation": "23",
            "title": "Prescription of diseases. ",
            "context": "NATIONAL INSURANCE AND   SOCIAL SECURITY ACT under Prescription of diseases. 23.  A disease may be prescribed for the purposes of this Act, in relation to any insured persons if the Minister is satisfied that  (a)   it ought to be so prescribed having regard to its causes and  incidence and any other relevant considerations, as a risk of their occupations and not as a risk common to all persons; and  (b)      it is such that, in the absence of special circumstances, the attribution of particular cases to the nature of the employment   can   be   established   or   presumed   with reasonable certainty,   and regulations prescribing any such disease may provide that a person who developed the disease on or at any time after a date specified in the regulations, being a date before stthe regulations come into force but not before 1         day    of January, 1970, shall be treated for the purposes of this Act, LAWS OF GUYANA 26 Cap. 36:01 National Insurance and Social Security   L.R.O. 1/2012           Regulations relating to diseases and medical officers and boards.                                       subject to any prescribed modifications, as if the regulations had been in force when he developed the disease.",
            "description": [
                {
                    "representation": "(a)",
                    "description": "it ought to be so prescribed having regard to its causes and  incidence and any other relevant considerations, as a risk of their occupations and not as a risk common to all persons; and"
                },
                {
                    "representation": "(b)",
                    "description": "it is such that, in the absence of special circumstances, the attribution of particular cases to the nature of the employment   can   be   established   or   presumed   with reasonable certainty,   and regulations prescribing any such disease may provide that a person who developed the disease on or at any time after a date specified in the regulations, being a date before stthe regulations come into force but not before 1         day    of January, 1970, shall be treated for the purposes of this Act, LAWS OF GUYANA 26 Cap. 36:01 National Insurance and Social Security   L.R.O. 1/2012           Regulations relating to diseases and medical officers and boards.                                       subject to any prescribed modifications, as if the regulations had been in force when he developed the disease."
                }
            ]
        }
    },
    {
        "act": "NATIONAL INSURANCE AND   SOCIAL SECURITY ACT",
        "source": "https://mola.gov.gy/laws-of-guyana",
        "type": {
            "name": "section",
            "representation": "24",
            "title": "Regulations  relating   to  diseases   and  medical  officers  and boards. ",
            "context": "NATIONAL INSURANCE AND   SOCIAL SECURITY ACT under Regulations  relating   to  diseases   and  medical  officers  and boards. 24.  Regulations may provide for  (a)   determining  the  time  at which a person is to be treated for  the  purposes  of  this  Act  as  having  developed  any prescribed disease and the circumstances in which any such disease is,  where  the  person  in question  has  previously suffered therefrom, to be treated as having recrudesced or having been developed afresh;  (b)      presuming any prescribed disease  (i)       to be due, unless the contrary is             proved, to the nature of the employment of any person where he was employed in any prescribed occupation at the time when, or within a prescribed  length  of time (whether  continuous  or  not) before, he developed the disease; (ii)     not  to  be due to the nature of the employment of any person  unless  he  was  employed  in  some  prescribed occupation at the time when, or within a prescribed length of time (whether continuous or not) before he developed the disease;  LAWS OF GUYANA National Insurance and Social Security Cap. 36:01 27  L.R.O. 1/2012               Payment of medical officers and medical boards.        Accidents or diseases in course of illegal employment.                     (c)    the    appointment    of    medical   officers and the establishment of medical boards for the purpose of this Act; and  (d)   such matters  as   appear  to the Minister to be incidental to or consequential on provisions included in the regulations by virtue of the foregoing provisions of this section.",
            "description": [
                {
                    "representation": "(a)",
                    "description": "determining  the  time  at which a person is to be treated for  the  purposes  of  this  Act  as  having  developed  any prescribed disease and the circumstances in which any such disease is,  where  the  person  in question  has  previously suffered therefrom, to be treated as having recrudesced or having been developed afresh;"
                },
                {
                    "representation": "(b)",
                    "description": "presuming any prescribed disease"
                },
                {
                    "representation": "(i)",
                    "description": "to be due, unless the contrary is             proved, to the nature of the employment of any person where he was employed in any prescribed occupation at the time when, or within a prescribed  length  of time"
                },
                {
                    "representation": "(c)",
                    "description": "the    appointment    of    medical   officers and the establishment of medical boards for the purpose of this Act; and"
                },
                {
                    "representation": "(d)",
                    "description": "such matters  as   appear  to the Minister to be incidental to or consequential on provisions included in the regulations by virtue of the foregoing provisions of this section."
                }
            ]
        }
    },
    {
        "act": "NATIONAL INSURANCE AND   SOCIAL SECURITY ACT",
        "source": "https://mola.gov.gy/laws-of-guyana",
        "type": {
            "name": "section",
            "representation": "25",
            "title": "Payment of medical officers and medical boards. ",
            "context": "NATIONAL INSURANCE AND   SOCIAL SECURITY ACT under Payment of medical officers and medical boards. 25.  There  shall  be  paid  out  of  the  Fund  to  a  medical  officer appointed under regulations made under section 24(c) and to a member of a medical board established in accordance with such regulations, such salary or other remuneration as the Board with the prior approval of the Administration may determine and such expenses incurred in connection with the work of such medical officer or member as may be so determined.",
            "description": [
                {
                    "representation": "(c)",
                    "description": "and to a member of a medical board established in accordance with such regulations, such salary or other remuneration as the Board with the prior approval of the Administration may determine and such expenses incurred in connection with the work of such medical officer or member as may be so determined."
                }
            ]
        }
    },
    {
        "act": "NATIONAL INSURANCE AND   SOCIAL SECURITY ACT",
        "source": "https://mola.gov.gy/laws-of-guyana",
        "type": {
            "name": "section",
            "representation": "26",
            "title": "Accidents or diseases in course of illegal employment. ",
            "context": "NATIONAL INSURANCE AND   SOCIAL SECURITY ACT under Accidents or diseases in course of illegal employment. 26. (1) Where a claim for industrial benefit is made under this Act in respect of any accident or of any prescribed disease the Minister may direct that for the purposes of this Act the relevant employment shall in relation to that accident or disease be treated as having been insurable employment notwithstanding that by reason of a contravention of or non-compliance  with some provision contained in or having effect under  any   enactment   passed  for  the  protection  of  persons  in employment or any class of such persons, the contract purporting to govern the  employment was void or the person employed was not lawfully employed therein at the time when or in the place where the accident happened or the disease developed.  (2) In this section the expression relevant employment means, in relation to an accident, the employment out of and in the course of which the accident arises and in relation to a prescribed disease the employment to the nature of which the disease is due. [22 of 1973 9 of 1981]LAWS OF GUYANA 28 Cap. 36:01 National Insurance and Social Security   L.R.O. 1/2012   Benefit where disease is personal injury by accident.         Repayment of benefit improperly received.              Benefits to be inalienable.               Officers and employees of the Board.  [14 of 1971 22 of 1973 9 of 1981 28 of 1997",
            "description": [
                {
                    "representation": "(1)",
                    "description": "Where a claim for industrial benefit is made under this Act in respect of any accident or of any prescribed disease the Minister may direct that for the purposes of this Act the relevant employment shall in relation to that accident or disease be treated as having been insurable employment notwithstanding that by reason of a contravention of or non-compliance  with some provision contained in or having effect under  any   enactment   passed  for  the  protection  of  persons  in employment or any class of such persons, the contract purporting to govern the  employment was void or the person employed was not lawfully employed therein at the time when or in the place where the accident happened or the disease developed."
                },
                {
                    "representation": "(2)",
                    "description": "In this section the expression relevant employment means, in relation to an accident, the employment out of and in the course of which the accident arises and in relation to a prescribed disease the employment to the nature of which the disease is due. [22 of 1973 9 of 1981]LAWS OF GUYANA 28 Cap. 36:01 National Insurance and Social Security   L.R.O. 1/2012   Benefit where disease is personal injury by accident.         Repayment of benefit improperly received.              Benefits to be inalienable.               Officers and employees of the Board.  [14 of 1971 22 of 1973 9 of 1981 28 of 1997"
                }
            ]
        }
    },
    {
        "act": "NATIONAL INSURANCE AND   SOCIAL SECURITY ACT",
        "source": "https://mola.gov.gy/laws-of-guyana",
        "type": {
            "name": "section",
            "representation": "27",
            "title": "Benefit where disease is personal injury by accident. ",
            "context": "NATIONAL INSURANCE AND   SOCIAL SECURITY ACT under Benefit where disease is personal injury by accident. 27.  Nothing in this Part shall affect the right of any person to benefit in respect of a disease which is a personal injury by accident within the meaning of this Act, except that a person shall not be entitled to benefit in respect of a disease as being an injury by accident arising out of and in the course of any employment if at the time of the accident the disease is in relation to him a prescribed disease by virtue of the occupation in which he is engaged in that employment.",
            "description": "Nothing in this Part shall affect the right of any person to benefit in respect of a disease which is a personal injury by accident within the meaning of this Act, except that a person shall not be entitled to benefit in respect of a disease as being an injury by accident arising out of and in the course of any employment if at the time of the accident the disease is in relation to him a prescribed disease by virtue of the occupation in which he is engaged in that employment."
        }
    },
    {
        "act": "NATIONAL INSURANCE AND   SOCIAL SECURITY ACT",
        "source": "https://mola.gov.gy/laws-of-guyana",
        "type": {
            "name": "section",
            "representation": "28",
            "title": "Repayment of benefit improperly received. ",
            "context": "NATIONAL INSURANCE AND   SOCIAL SECURITY ACT under Repayment of benefit improperly received. 28.(1)  If it is found that any person by reason of the non-disclosure or  misrepresentation by him of a material fact (whether the non-disclosure  or  misrepresentation  was  or  was  not  fraudulent)  has received any sum by way of benefit while he was not entitled to that benefit, he shall be liable to repay the sum so received by him.  (2) Where any person is liable to repay any sum received by him by way of benefit, that sum may be recovered without prejudice to any other remedy by means of deductions from any benefit to which he thereafter becomes entitled.",
            "description": [
                {
                    "representation": "(1)",
                    "description": "If it is found that any person by reason of the non-disclosure or  misrepresentation by him of a material fact"
                },
                {
                    "representation": "(2)",
                    "description": "Where any person is liable to repay any sum received by him by way of benefit, that sum may be recovered without prejudice to any other remedy by means of deductions from any benefit to which he thereafter becomes entitled."
                }
            ]
        }
    },
    {
        "act": "NATIONAL INSURANCE AND   SOCIAL SECURITY ACT",
        "source": "https://mola.gov.gy/laws-of-guyana",
        "type": {
            "name": "section",
            "representation": "29",
            "title": "Benefits to be inalienable.  PART V ADMINISTRATION, FINANCE   AND  LEGAL  PROCEEDINGS  ",
            "context": "NATIONAL INSURANCE AND   SOCIAL SECURITY ACT under Benefits to be inalienable.  PART V ADMINISTRATION, FINANCE   AND  LEGAL  PROCEEDINGS  29. Every assignment of or charge on benefit and every agreement to assign or charge benefit shall be void and on the bankruptcy of a beneficiary the benefit shall not pass to any trustee or other person acting on behalf of his creditors.   PART V ADMINISTRATION, FINANCE   AND  LEGAL  PROCEEDINGS",
            "description": "Every assignment of or charge on benefit and every agreement to assign or charge benefit shall be void and on the bankruptcy of a beneficiary the benefit shall not pass to any trustee or other person acting on behalf of his creditors.   PART V ADMINISTRATION, FINANCE   AND  LEGAL  PROCEEDINGS"
        }
    },
    {
        "act": "NATIONAL INSURANCE AND   SOCIAL SECURITY ACT",
        "source": "https://mola.gov.gy/laws-of-guyana",
        "type": {
            "name": "section",
            "representation": "30",
            "title": "Officers and employees of the Board. ",
            "context": "NATIONAL INSURANCE AND   SOCIAL SECURITY ACT under Officers and employees of the Board. 30. (1)    (a)  There shall be a General Manager of the Board who shall be appointed by the Administration at such remuneration and on such terms and conditions (including the payment of pension, gratuity or other like benefit LAWS OF GUYANA National Insurance and Social Security Cap. 36:01 29  L.R.O. 1/2012 33 of 2009]                       c. 27:02         c. 27:02 Sub. Leg.               by reference to his service) as the Administration thinks fit.  (b)  With the approval of the Administration, the Board may   employ   such   officers   and   employees   at   such remuneration and on such terms and conditions (including the payment of pensions, gratuities or other like benefits by reference to the service of its officers and employees) as it thinks fit for the proper conduct of its business.   (2) Where with the approval of the Public Service Commission an officer in the public service is seconded or temporarily transferred for duty to an office with the Board from a pensionable office within the meaning of the Pensions Act, section 5 of that Act shall apply to him as if his service in such office were service in a civil capacity under the Government of Guyana.  (3) Where with the approval of the Public Service Commission an officer in the public service has been transferred to any office with the Board, the provisions of regulation 21 of the Pensions Regulations (as contained in the Schedule of the Pensions Act), shall apply to him as if such service were other public service within the meaning of that Act and the provisions of the Pensions Act shall apply to him as if such service were other public service within the meaning of that Act, not being service under any of the Scheduled Governments as defined in regulation 2 of the Pensions Regulations, and regulation 21 of those Regulations shall apply accordingly to the person transferred.  (4) Except for the purpose of the performance of his functions or when lawfully required to do so by any court or under the provisions of any law no member, officer or employee of the Board shall disclose to  any   person  any  LAWS OF GUYANA 30 Cap. 36:01 National Insurance and Social Security   L.R.O. 1/2012                   Designation and power of inspectors.  [22 of 1973]                              information  which  he  has  acquired  in  the performance of his functions under this Act as such member, officer, or employee.  (5) Any person who contravenes the provisions of subsection (4) or who in the purported performance of duties under this Act obtains or seeks to obtain information which he is not authorised to obtain shall be liable on summary conviction to a fine of fifty thousand dollars and to imprisonment for a term of six months.",
            "description": [
                {
                    "representation": "(1)",
                    "description": ""
                },
                {
                    "representation": "(a)",
                    "description": "There shall be a General Manager of the Board who shall be appointed by the Administration at such remuneration and on such terms and conditions"
                },
                {
                    "representation": "(b)",
                    "description": "With the approval of the Administration, the Board may   employ   such   officers   and   employees   at   such remuneration and on such terms and conditions"
                },
                {
                    "representation": "(2)",
                    "description": "Where with the approval of the Public Service Commission an officer in the public service is seconded or temporarily transferred for duty to an office with the Board from a pensionable office within the meaning of the Pensions Act, section 5 of that Act shall apply to him as if his service in such office were service in a civil capacity under the Government of Guyana."
                },
                {
                    "representation": "(3)",
                    "description": "Where with the approval of the Public Service Commission an officer in the public service has been transferred to any office with the Board, the provisions of regulation 21 of the Pensions Regulations"
                },
                {
                    "representation": "(4)",
                    "description": "or who in the purported performance of duties under this Act obtains or seeks to obtain information which he is not authorised to obtain shall be liable on summary conviction to a fine of fifty thousand dollars and to imprisonment for a term of six months."
                },
                {
                    "representation": "(5)",
                    "description": "Any person who contravenes the provisions of subsection"
                }
            ]
        }
    },
    {
        "act": "NATIONAL INSURANCE AND   SOCIAL SECURITY ACT",
        "source": "https://mola.gov.gy/laws-of-guyana",
        "type": {
            "name": "section",
            "representation": "31",
            "title": "Designation and powers of inspectors. ",
            "context": "NATIONAL INSURANCE AND   SOCIAL SECURITY ACT under Designation and powers of inspectors. 31.(1)  The Board may designate such officers in its service as it thinks  fit to be inspectors for the purpose of giving effect to the provisions of this Act.  (2) An inspector shall for the purposes of the execution of this Act have power to do all or any of the following things, that is to say  (a)   to enter at all reasonable times any premises or place liable to inspection under this section;  (b)     to make examination and enquiry as may be necessary for ascertaining whether the provisions of this Act are being or have been complied with in any such premises or place;   (c)  to examine either alone or in the presence of any other person as he thinks fit with respect to any matters under this Act on which he may reasonably require information, every person whom he  finds in any such premises or place, or whom he has reasonable cause to believe to be or to have been an insured person, and to LAWS OF GUYANA National Insurance and Social Security Cap. 36:01 31  L.R.O. 1/2012                                                           require every such person to be so examined; and  (d)    to exercise such other powers as may be necessary for carrying this Act into effect.  (3) The occupier of any premises or place liable to inspection under this section and any person who is or has been employing any person, and the servants or agents of any such occupier or other person, and   any  insured  person  shall  furnish  to  an  inspector  all  such information and produce  for inspection all such documents as the inspector  may reasonably  require  for  the  purpose  of  ascertaining whether contributions are or have been payable or have been duly paid by or in respect of any person, or whether benefit is or was so payable to or  in  respect of any person and the inspector if he considers it necessary may make copies of, or extracts from, the documents so produced, and for that purpose he shall have power to take possession of the documents.  (4) Every inspector shall be furnished with a certificate of his appointment and on applying for admission to any premises or place for  the  purposes of this Act shall if so required produce the said certificate.  (5) The premises and places liable to inspection under this section are any premises or places where an inspector has reasonable grounds for supposing that any persons are employed except that they do not include any private dwelling house not used by or by permission of the occupier for the purposes of a trade or business.  (6) No person shall be required under this section to answer any questions or to give any evidence tending to incriminate himself.   LAWS OF GUYANA 32 Cap. 36:01 National Insurance and Social Security   L.R.O. 1/2012  Proceedings against officers and employees of the Board under this Act.    Establishment of Fund. [14 of 1971 9 of 1981]",
            "description": [
                {
                    "representation": "(1)",
                    "description": "The Board may designate such officers in its service as it thinks  fit to be inspectors for the purpose of giving effect to the provisions of this Act."
                },
                {
                    "representation": "(2)",
                    "description": "An inspector shall for the purposes of the execution of this Act have power to do all or any of the following things, that is to say"
                },
                {
                    "representation": "(a)",
                    "description": "to enter at all reasonable times any premises or place liable to inspection under this section;"
                },
                {
                    "representation": "(b)",
                    "description": "to make examination and enquiry as may be necessary for ascertaining whether the provisions of this Act are being or have been complied with in any such premises or place;"
                },
                {
                    "representation": "(c)",
                    "description": "to examine either alone or in the presence of any other person as he thinks fit with respect to any matters under this Act on which he may reasonably require information, every person whom he  finds in any such premises or place, or whom he has reasonable cause to believe to be or to have been an insured person, and to LAWS OF GUYANA National Insurance and Social Security Cap. 36:01 31  L.R.O. 1/2012                                                           require every such person to be so examined; and"
                },
                {
                    "representation": "(d)",
                    "description": "to exercise such other powers as may be necessary for carrying this Act into effect."
                },
                {
                    "representation": "(3)",
                    "description": "The occupier of any premises or place liable to inspection under this section and any person who is or has been employing any person, and the servants or agents of any such occupier or other person, and   any  insured  person  shall  furnish  to  an  inspector  all  such information and produce  for inspection all such documents as the inspector  may reasonably  require  for  the  purpose  of  ascertaining whether contributions are or have been payable or have been duly paid by or in respect of any person, or whether benefit is or was so payable to or  in  respect of any person and the inspector if he considers it necessary may make copies of, or extracts from, the documents so produced, and for that purpose he shall have power to take possession of the documents."
                },
                {
                    "representation": "(4)",
                    "description": "Every inspector shall be furnished with a certificate of his appointment and on applying for admission to any premises or place for  the  purposes of this Act shall if so required produce the said certificate."
                },
                {
                    "representation": "(5)",
                    "description": "The premises and places liable to inspection under this section are any premises or places where an inspector has reasonable grounds for supposing that any persons are employed except that they do not include any private dwelling house not used by or by permission of the occupier for the purposes of a trade or business."
                },
                {
                    "representation": "(6)",
                    "description": "No person shall be required under this section to answer any questions or to give any evidence tending to incriminate himself.   LAWS OF GUYANA 32 Cap. 36:01 National Insurance and Social Security   L.R.O. 1/2012  Proceedings against officers and employees of the Board under this Act.    Establishment of Fund. [14 of 1971 9 of 1981]"
                }
            ]
        }
    },
    {
        "act": "NATIONAL INSURANCE AND   SOCIAL SECURITY ACT",
        "source": "https://mola.gov.gy/laws-of-guyana",
        "type": {
            "name": "section",
            "representation": "32",
            "title": "Proceedings against officers and employees of the Board under this Act. ",
            "context": "NATIONAL INSURANCE AND   SOCIAL SECURITY ACT under Proceedings against officers and employees of the Board under this Act. 32. Subject to the provisions of any other enactment, in any action or other legal proceedings brought against any officer or employee of the Board in respect of any act done in pursuance or execution or intended execution of this Act the plaintiff shall not recover unless he alleges in his pleading and proves at the trial that such act was done either maliciously or without reasonable and probable cause.",
            "description": "Subject to the provisions of any other enactment, in any action or other legal proceedings brought against any officer or employee of the Board in respect of any act done in pursuance or execution or intended execution of this Act the plaintiff shall not recover unless he alleges in his pleading and proves at the trial that such act was done either maliciously or without reasonable and probable cause."
        }
    },
    {
        "act": "NATIONAL INSURANCE AND   SOCIAL SECURITY ACT",
        "source": "https://mola.gov.gy/laws-of-guyana",
        "type": {
            "name": "section",
            "representation": "33",
            "title": "Establishment of Fund. ",
            "context": "NATIONAL INSURANCE AND   SOCIAL SECURITY ACT under Establishment of Fund. 33. (1) For the purposes of this Act, there shall be established under the control and management of the Board a fund called The National Insurance Fund.  (2) There shall be paid into the Fund  (a)      all contributions;  (b)      all  rent,  interest  on  investments,  or  other  income derived from the assets of the Fund;  (c)     all  sums  recovered  under  this  Act,  as  fines,  fees, penalties or costs;  (d)    all  sums  properly  accruing  to the Fund under this Act including,  without  prejudice  to  the  generality  of  the foregoing, the repayment of benefit; and  (e)     such other sums as may from time to time be provided by the National Assembly for any of the purposes of this Act or as may from time to time be received and accepted by the Board on behalf of the Fund.  (3) There shall be paid or met out of the Fund  LAWS OF GUYANA National Insurance and Social Security Cap. 36:01 33  L.R.O. 1/2012                               Defrayment of initial expenditure and meeting of temporary insufficiency in Fund. [22 of 1973]         Expenses   of Post  Office.  [13 of 1976]   (a)     all claims for benefits;  (b)      refunds of contributions paid in error;  (c)    all expenses properly incurred in the administration of this Act, including disbursements by way of remuneration, allowances and expenses payable under sections 9, 25 and 40 and the remuneration and allowances (if any) payable to officers and employees of the Board.  (4) Accounts of the Fund shall be prepared in such form in such manner and at such times as the Administration may direct and an auditor nominated by the Administration shall examine and certify every such account.  (5) Any moneys forming part of the Fund may from time to time be invested by the Board in such securities as may be approved of by the Administration.",
            "description": [
                {
                    "representation": "(1)",
                    "description": "For the purposes of this Act, there shall be established under the control and management of the Board a fund called The National Insurance Fund."
                },
                {
                    "representation": "(2)",
                    "description": "There shall be paid into the Fund"
                },
                {
                    "representation": "(a)",
                    "description": "all claims for benefits;"
                },
                {
                    "representation": "(b)",
                    "description": "refunds of contributions paid in error;"
                },
                {
                    "representation": "(c)",
                    "description": "all expenses properly incurred in the administration of this Act, including disbursements by way of remuneration, allowances and expenses payable under sections 9, 25 and 40 and the remuneration and allowances"
                },
                {
                    "representation": "(d)",
                    "description": "all  sums  properly  accruing  to the Fund under this Act including,  without  prejudice  to  the  generality  of  the foregoing, the repayment of benefit; and"
                },
                {
                    "representation": "(e)",
                    "description": "such other sums as may from time to time be provided by the National Assembly for any of the purposes of this Act or as may from time to time be received and accepted by the Board on behalf of the Fund."
                },
                {
                    "representation": "(3)",
                    "description": "There shall be paid or met out of the Fund  LAWS OF GUYANA National Insurance and Social Security Cap. 36:01 33  L.R.O. 1/2012                               Defrayment of initial expenditure and meeting of temporary insufficiency in Fund. [22 of 1973]         Expenses   of Post  Office.  [13 of 1976]"
                },
                {
                    "representation": "(4)",
                    "description": "Accounts of the Fund shall be prepared in such form in such manner and at such times as the Administration may direct and an auditor nominated by the Administration shall examine and certify every such account."
                },
                {
                    "representation": "(5)",
                    "description": "Any moneys forming part of the Fund may from time to time be invested by the Board in such securities as may be approved of by the Administration."
                }
            ]
        }
    },
    {
        "act": "NATIONAL INSURANCE AND   SOCIAL SECURITY ACT",
        "source": "https://mola.gov.gy/laws-of-guyana",
        "type": {
            "name": "section",
            "representation": "34",
            "title": "Defrayment  of  initial  expenditure and meeting of temporary insufficiency in Fund. ",
            "context": "NATIONAL INSURANCE AND   SOCIAL SECURITY ACT under Defrayment  of  initial  expenditure and meeting of temporary insufficiency in Fund. 34. (1) The initial expenditure incurred in carrying this Act into effect shall be defrayed out of such moneys as Parliament may provide for the purpose.  (2) Any temporary insufficiency in the assets of the Fund to meet the liabilities of the Fund under this Act shall be met from such moneys as Parliament may advance for the purpose.  (3) Any sums advanced by Parliament pursuant to subsection (1) or pursuant to subsection (2) shall be repaid out of the Fund as soon as may be practicable.",
            "description": [
                {
                    "representation": "(1)",
                    "description": "or pursuant to subsection"
                },
                {
                    "representation": "(2)",
                    "description": "shall be repaid out of the Fund as soon as may be practicable."
                },
                {
                    "representation": "(3)",
                    "description": "Any sums advanced by Parliament pursuant to subsection"
                }
            ]
        }
    },
    {
        "act": "NATIONAL INSURANCE AND   SOCIAL SECURITY ACT",
        "source": "https://mola.gov.gy/laws-of-guyana",
        "type": {
            "name": "section",
            "representation": "35",
            "title": "Expenses of Post Office. ",
            "context": "NATIONAL INSURANCE AND   SOCIAL SECURITY ACT under Expenses of Post Office. 35. There shall be paid to the Post Office out of the Fund at such times and in such manner as the Cabinet may direct, such sums as the Cabinet may estimate to be the amount of the expenses of the Post Office in carrying this Act LAWS OF GUYANA 34 Cap. 36:01 National Insurance and Social Security   L.R.O. 1/2012          Report and accounts to be submitted to Minister. [14 of 1971 9 of 1981]                           Review of operation of Act.           into effect.",
            "description": "There shall be paid to the Post Office out of the Fund at such times and in such manner as the Cabinet may direct, such sums as the Cabinet may estimate to be the amount of the expenses of the Post Office in carrying this Act LAWS OF GUYANA 34 Cap. 36:01 National Insurance and Social Security   L.R.O. 1/2012          Report and accounts to be submitted to Minister. [14 of 1971 9 of 1981]                           Review of operation of Act.           into effect."
        }
    },
    {
        "act": "NATIONAL INSURANCE AND   SOCIAL SECURITY ACT",
        "source": "https://mola.gov.gy/laws-of-guyana",
        "type": {
            "name": "section",
            "representation": "36",
            "title": "Report and accounts to be submitted to Minister. ",
            "context": "NATIONAL INSURANCE AND   SOCIAL SECURITY ACT under Report and accounts to be submitted to Minister. 36.(1)  The Board shall  (a)     in each  year  prepare  a report on its activities in the last preceding year and shall furnish such report to the Minister not later than the thirtieth day of June;  (b)       submit to the Minister every account,              certified by the nominated auditor pursuant to section 33(4) together with the report of the nominated auditor therein, within one month of such certification; and  (c)       submit  annually to  the  Minister  an               account of the securities in which moneys forming part of the Fund are for the time being invested.  (2) The Minister shall cause a copy of every report or account submitted to him pursuant to this section to be submitted to the Administration and to be laid before the National Assembly.",
            "description": [
                {
                    "representation": "(1)",
                    "description": "The Board shall"
                },
                {
                    "representation": "(a)",
                    "description": "in each  year  prepare  a report on its activities in the last preceding year and shall furnish such report to the Minister not later than the thirtieth day of June;"
                },
                {
                    "representation": "(b)",
                    "description": "submit to the Minister every account,              certified by the nominated auditor pursuant to section 33(4) together with the report of the nominated auditor therein, within one month of such certification; and"
                },
                {
                    "representation": "(c)",
                    "description": "submit  annually to  the  Minister  an               account of the securities in which moneys forming part of the Fund are for the time being invested."
                },
                {
                    "representation": "(2)",
                    "description": "The Minister shall cause a copy of every report or account submitted to him pursuant to this section to be submitted to the Administration and to be laid before the National Assembly."
                }
            ]
        }
    },
    {
        "act": "NATIONAL INSURANCE AND   SOCIAL SECURITY ACT",
        "source": "https://mola.gov.gy/laws-of-guyana",
        "type": {
            "name": "section",
            "representation": "37",
            "title": "Review of operation of Act. ",
            "context": "NATIONAL INSURANCE AND   SOCIAL SECURITY ACT under Review of operation of Act. 37.(1) The Board shall with the assistance of an actuary approved by  the Minister review the operation of this Act during the period ending the thirty-first day of December 1973 and thereafter during the period ending with the thirty-first day of December in every fifth year, and on each such review make a report to the Minister on the financial condition of the Fund and the adequacy or otherwise of contributions to support benefits having regard to its other liabilities under this Act:  Provided that the Minister may at any time direct that the LAWS OF GUYANA National Insurance and Social Security Cap. 36:01 35  L.R.O. 1/2012              Determination of claims and questions. [22 of 1973]                                  period to be covered by the review and report under this subsection shall be reduced and that the making of that and subsequent reviews and reports under this subsection shall be accelerated accordingly.   (2) The Minister shall cause a copy of every report made to him under this section to be laid before the National Assembly.",
            "description": [
                {
                    "representation": "(1)",
                    "description": "The Board shall with the assistance of an actuary approved by  the Minister review the operation of this Act during the period ending the thirty-first day of December 1973 and thereafter during the period ending with the thirty-first day of December in every fifth year, and on each such review make a report to the Minister on the financial condition of the Fund and the adequacy or otherwise of contributions to support benefits having regard to its other liabilities under this Act:  Provided that the Minister may at any time direct that the LAWS OF GUYANA National Insurance and Social Security Cap. 36:01 35  L.R.O. 1/2012              Determination of claims and questions. [22 of 1973]                                  period to be covered by the review and report under this subsection shall be reduced and that the making of that and subsequent reviews and reports under this subsection shall be accelerated accordingly."
                },
                {
                    "representation": "(2)",
                    "description": "The Minister shall cause a copy of every report made to him under this section to be laid before the National Assembly."
                }
            ]
        }
    },
    {
        "act": "NATIONAL INSURANCE AND   SOCIAL SECURITY ACT",
        "source": "https://mola.gov.gy/laws-of-guyana",
        "type": {
            "name": "section",
            "representation": "38",
            "title": "Determination of claims and questions. ",
            "context": "NATIONAL INSURANCE AND   SOCIAL SECURITY ACT under Determination of claims and questions. 38.",
            "description": "38."
        }
    },
    {
        "act": "NATIONAL INSURANCE AND   SOCIAL SECURITY ACT",
        "source": "https://mola.gov.gy/laws-of-guyana",
        "type": {
            "name": "section",
            "representation": "39",
            "title": "Interim payments, arrears and repayments.  LAWS OF GUYANA 6 Cap. 36:01 National Insurance and Social Security   L.R.O. 1/2012  SECTION ",
            "context": "NATIONAL INSURANCE AND   SOCIAL SECURITY ACT under Interim payments, arrears and repayments.  LAWS OF GUYANA 6 Cap. 36:01 National Insurance and Social Security   L.R.O. 1/2012  SECTION 39.(1)  Regulations may provide as respects matters arising  (a)    pending the determination under this Act (whether in the  first instance or on appeal or reference, and whether originally or on review) of any claim for benefit or of any question affecting the right of any person to benefit or to the receipt  thereof  or  of  the  liability  of  any  person  for contributions; or  (b)   out  of  the  revision on appeal or review of any decision under this Act on any such claim or question.  (2) Without  prejudice  to  the  generality  of  subsection  (1), regulations thereunder may include provision  (a)        for the suspension of benefit where it              appears to the General Manager that there is or may be a question whether the conditions for receipt thereof in accordance with an award are or were fulfilled or whether the award ought to be revised;  (b)      as to the date from which any decision on a review is to have effect or to be deemed to have had effect;  (c)   for treating any benefit paid to any person under an award or by virtue of any provision of the regulations LAWS OF GUYANA 38 Cap. 36:01 National Insurance and Social Security   L.R.O. 1/2012                                                         Payment of persons and tribunals appointed or constituted under section which it is subsequently decided was not payable as properly paid or as paid on account of any other benefit which it is decided was payable to him or for the repayment of any such benefit and the recovery thereof by deduction from other benefit or otherwise;  (d)     for treating benefit paid to one person in respect of another as being a child of the family, or the wife or husband, or  an  adult dependant,  of the first mentioned person as having been properly paid for any period, notwithstanding that under regulations relating to overlapping benefits it is not  payable  for  that  period  by  reason  of  a  subsequent decision either  (i)   that   such  other person  is himself entitled to benefit for that period; or (ii)     that a third person is entitled to benefit for that period in  respect of such  other person in priority to the first mentioned",
            "description": [
                {
                    "representation": "(1)",
                    "description": "Regulations may provide as respects matters arising"
                },
                {
                    "representation": "(a)",
                    "description": "for the suspension of benefit where it              appears to the General Manager that there is or may be a question whether the conditions for receipt thereof in accordance with an award are or were fulfilled or whether the award ought to be revised;"
                },
                {
                    "representation": "(b)",
                    "description": "as to the date from which any decision on a review is to have effect or to be deemed to have had effect;"
                },
                {
                    "representation": "(2)",
                    "description": "Without  prejudice  to  the  generality  of  subsection"
                },
                {
                    "representation": "(c)",
                    "description": "for treating any benefit paid to any person under an award or by virtue of any provision of the regulations LAWS OF GUYANA 38 Cap. 36:01 National Insurance and Social Security   L.R.O. 1/2012                                                         Payment of persons and tribunals appointed or constituted under section which it is subsequently decided was not payable as properly paid or as paid on account of any other benefit which it is decided was payable to him or for the repayment of any such benefit and the recovery thereof by deduction from other benefit or otherwise;"
                },
                {
                    "representation": "(d)",
                    "description": "for treating benefit paid to one person in respect of another as being a child of the family, or the wife or husband, or  an  adult dependant,  of the first mentioned person as having been properly paid for any period, notwithstanding that under regulations relating to overlapping benefits it is not  payable  for  that  period  by  reason  of  a  subsequent decision either"
                },
                {
                    "representation": "(i)",
                    "description": "that   such  other person  is himself entitled to benefit for that period; or"
                }
            ]
        }
    },
    {
        "act": "NATIONAL INSURANCE AND   SOCIAL SECURITY ACT",
        "source": "https://mola.gov.gy/laws-of-guyana",
        "type": {
            "name": "section",
            "representation": "40",
            "title": "Payment  of persons and tribunals appointed or constituted under section ",
            "context": "NATIONAL INSURANCE AND   SOCIAL SECURITY ACT under Payment  of persons and tribunals appointed or constituted under section 40.  There shall be paid out of the Fund to a person appointed under regulations made under section 38(1) and to a member of a tribunal constituted in accordance with such regulations, such salary or other remuneration   as   the   Board   with   the   prior   approval   of   the Administration person,   that period by virtue of the subsequent decision. and   for      reducing  or   withholdingaccordingly  any  arrears  payable  forLAWS OF GUYANA National Insurance and Social Security Cap. 36:01 39  L.R.O. 1/2012",
            "description": [
                {
                    "representation": "(1)",
                    "description": "and to a member of a tribunal constituted in accordance with such regulations, such salary or other remuneration   as   the   Board   with   the   prior   approval   of   the Administration person,   that period by virtue of the subsequent decision. and   for      reducing  or   withholdingaccordingly  any  arrears  payable  forLAWS OF GUYANA National Insurance and Social Security Cap. 36:01 39  L.R.O. 1/2012"
                }
            ]
        }
    },
    {
        "act": "NATIONAL INSURANCE AND   SOCIAL SECURITY ACT",
        "source": "https://mola.gov.gy/laws-of-guyana",
        "type": {
            "name": "section",
            "representation": "41",
            "title": "Offences and penalties. ",
            "context": "NATIONAL INSURANCE AND   SOCIAL SECURITY ACT under Offences and penalties. 41. (1) Any insured person or employer who fails to pay at or within the time prescribed for the purpose any contribution which he is liable to pay pursuant to this Act, shall for each such failure be liable on summary conviction to Commercial Banks on over drafts in respect of contributions not submitted and in default of such payment to imprisonment for a term not exceeding three months.  (2) Any person who  (a)  wilfully  delays or  obstructs an inspector in  the exercise of any power  under section 31; or  (b)   refuses or neglects to answer any question or to furnish any information or to produce any documents when required so to do under section 31,  shall be liable on summary conviction to a fine of thirty thousand dollars in the case of a first offence and of fifty thousand dollars in the case of a second or subsequent offence.  (3) Any employer who deducts or attempts to deduct or otherwise recovers or attempts to recover the whole or any part of the contribution of the employer in respect of any person from the wages of such person shall be liable on summary conviction to a fine of seventy-five thousand dollars.  (4) Any person who  (a)  [Deleted by 15 of 1989] a fine of one per cent greater than the rate charged by the LAWS OF GUYANA 40 Cap. 36:01 National Insurance and Social Security   L.R.O. 1/2012                                       General provisions as to prosecutions under Act. [O. 80/1980] c. 1:01                 (b)  [Deleted by 15 of 1989]  (c) for the purpose of obtaining any benefit or other  payment under this Act, whether for himself or some other person, or for any other purpose connected with this Act  (i)     knowingly makes any false statement or  false representation; or  (ii)       produces or furnishes, or causes or              knowingly allows to be produced or furnished, any document or information which he knows to be false in a material particular,  shall be liable on summary conviction to a fine of one hundred thousand dollars and imprisonment for six months.",
            "description": [
                {
                    "representation": "(1)",
                    "description": "Any insured person or employer who fails to pay at or within the time prescribed for the purpose any contribution which he is liable to pay pursuant to this Act, shall for each such failure be liable on summary conviction to Commercial Banks on over drafts in respect of contributions not submitted and in default of such payment to imprisonment for a term not exceeding three months."
                },
                {
                    "representation": "(2)",
                    "description": "Any person who"
                },
                {
                    "representation": "(a)",
                    "description": "[Deleted by 15 of 1989] a fine of one per cent greater than the rate charged by the LAWS OF GUYANA 40 Cap. 36:01 National Insurance and Social Security   L.R.O. 1/2012                                       General provisions as to prosecutions under Act. [O. 80/1980] c. 1:01"
                },
                {
                    "representation": "(b)",
                    "description": "[Deleted by 15 of 1989]"
                },
                {
                    "representation": "(3)",
                    "description": "Any employer who deducts or attempts to deduct or otherwise recovers or attempts to recover the whole or any part of the contribution of the employer in respect of any person from the wages of such person shall be liable on summary conviction to a fine of seventy-five thousand dollars."
                },
                {
                    "representation": "(4)",
                    "description": "Any person who"
                },
                {
                    "representation": "(c)",
                    "description": "for the purpose of obtaining any benefit or other  payment under this Act, whether for himself or some other person, or for any other purpose connected with this Act"
                },
                {
                    "representation": "(i)",
                    "description": "knowingly makes any false statement or  false representation; or"
                }
            ]
        }
    },
    {
        "act": "NATIONAL INSURANCE AND   SOCIAL SECURITY ACT",
        "source": "https://mola.gov.gy/laws-of-guyana",
        "type": {
            "name": "section",
            "representation": "42",
            "title": "General provisions as to prosecutions under Act. ",
            "context": "NATIONAL INSURANCE AND   SOCIAL SECURITY ACT under General provisions as to prosecutions under Act. 42. (1) Subject to the provisions of article 187 of the Constitution, proceedings for an offence under this Act shall not be instituted except by or with the consent of the Board or by an inspector or other officer authorised in that behalf by special or general directions of the Board.  (2) Any such inspector or other officer may although not of attorney-at-law prosecute or conduct before a court of summary jurisdiction any such proceedings as aforesaid.  (3) Notwithstanding any provision in any enactment prescribing   the   period   within   which   summary   proceedings   may   be commenced,  proceedings  for  an  offence  under  this  Act  may  be commenced at any time within the period of three months from the date on which evidence sufficient in the opinion of the Board to LAWS OF GUYANA National Insurance and Social Security Cap. 36:01 41  L.R.O. 1/2012                                       Recovery of contributions on prosecu- tions under Act. [15 of 1989 28 of 1997]          justify a prosecution for the offence comes to its knowledge or within the period of  twelve months after the commission of the offence whichever period last expires and for the purposes of this subsection a certificate purporting to be signed on behalf of the Board as to the date on which such evidence came to the knowledge of the Board shall be conclusive evidence thereof.  (4) In any proceedings for an offence under this Act, the wife or husband of the accused shall be competent to give evidence, whether for or against the accused:  Provided that the wife or husband shall not be compellable either to give evidence or in giving evidence to disclose any communication made to her or him during the marriage by the accused.  (5) Where an offence under this Act which has been committed by a body corporate is proved to have been committed with the consent or connivance of, or to be attributable to any negligence on the part of any director, manager, secretary or other officer of the body corporate, he as well as the body corporate shall be deemed to be guilty of that offence and shall be liable to be proceeded against and punished accordingly.",
            "description": [
                {
                    "representation": "(1)",
                    "description": "Subject to the provisions of article 187 of the Constitution, proceedings for an offence under this Act shall not be instituted except by or with the consent of the Board or by an inspector or other officer authorised in that behalf by special or general directions of the Board."
                },
                {
                    "representation": "(2)",
                    "description": "Any such inspector or other officer may although not of attorney-at-law prosecute or conduct before a court of summary jurisdiction any such proceedings as aforesaid."
                },
                {
                    "representation": "(3)",
                    "description": "Notwithstanding any provision in any enactment prescribing   the   period   within   which   summary   proceedings   may   be commenced,  proceedings  for  an  offence  under  this  Act  may  be commenced at any time within the period of three months from the date on which evidence sufficient in the opinion of the Board to LAWS OF GUYANA National Insurance and Social Security Cap. 36:01 41  L.R.O. 1/2012                                       Recovery of contributions on prosecu- tions under Act. [15 of 1989 28 of 1997]          justify a prosecution for the offence comes to its knowledge or within the period of  twelve months after the commission of the offence whichever period last expires and for the purposes of this subsection a certificate purporting to be signed on behalf of the Board as to the date on which such evidence came to the knowledge of the Board shall be conclusive evidence thereof."
                },
                {
                    "representation": "(4)",
                    "description": "In any proceedings for an offence under this Act, the wife or husband of the accused shall be competent to give evidence, whether for or against the accused:  Provided that the wife or husband shall not be compellable either to give evidence or in giving evidence to disclose any communication made to her or him during the marriage by the accused."
                },
                {
                    "representation": "(5)",
                    "description": "Where an offence under this Act which has been committed by a body corporate is proved to have been committed with the consent or connivance of, or to be attributable to any negligence on the part of any director, manager, secretary or other officer of the body corporate, he as well as the body corporate shall be deemed to be guilty of that offence and shall be liable to be proceeded against and punished accordingly."
                }
            ]
        }
    },
    {
        "act": "NATIONAL INSURANCE AND   SOCIAL SECURITY ACT",
        "source": "https://mola.gov.gy/laws-of-guyana",
        "type": {
            "name": "section",
            "representation": "43",
            "title": "Recovery of contributions on prosecutions under Act. ",
            "context": "NATIONAL INSURANCE AND   SOCIAL SECURITY ACT under Recovery of contributions on prosecutions under Act. 43.(1)  In any case where any person has been convicted of the offence under section 41(1) of failing to pay a contribution he shall be liable to pay to the Fund a sum equal to the amount which he failed to pay.  (2) [Deleted by 15 of 1981]  (3) On any such conviction as is mentioned in subsection (1), if notice of intention to do so has been served with the summons or warrant, evidence may be given  (a)   of the  failure on the  part of the convicted person to pay at or within LAWS OF GUYANA 42 Cap. 36:01 National Insurance and Social Security   L.R.O. 1/2012                                         c. 10:02                 the time prescribed for the purpose on behalf or in  respect of the same insured person other contributions under this Act during the two years preceding the date of the offence; and  (b)       in the case of any such conviction as is mentioned in the said subsection (1), of the failure on the part of the said person so to pay on behalf or in respect of any other person employed by him any contributions under this Act on that date or during these two years;  and on proof of such failure the convicted person shall be liable to pay to the Fund a sum equal to the total of all the contributions under this Act  which he is so proved to have failed to pay and which remain unpaid at the date of the conviction.  (4) Where the person charged with such offence as is mentioned in  subsection (1) of this section is convicted of that offence in his absence under section 13(2) of the Summary Jurisdiction (Procedure) Act, then if  (a)    it is proved to the satisfaction of the Court, on oath or in the prescribed manner, that such a notice as is mentioned in subsection  (3)  of  this  section  has  been  duly  served specifying the other contributions in respect of which the prosecutor intends to give evidence; and  (b)   the clerk of the court has received a statement in writing purporting to be made by the accused or by counsel LAWS OF GUYANA National Insurance and Social Security Cap. 36:01 43  L.R.O. 1/2012                 c. 11:",
            "description": [
                {
                    "representation": "(1)",
                    "description": "of this section is convicted of that offence in his absence under section 13(2) of the Summary Jurisdiction"
                },
                {
                    "representation": "(2)",
                    "description": "[Deleted by 15 of 1981]"
                },
                {
                    "representation": "(3)",
                    "description": "of  this  section  has  been  duly  served specifying the other contributions in respect of which the prosecutor intends to give evidence; and"
                },
                {
                    "representation": "(a)",
                    "description": "it is proved to the satisfaction of the Court, on oath or in the prescribed manner, that such a notice as is mentioned in subsection"
                },
                {
                    "representation": "(b)",
                    "description": "the clerk of the court has received a statement in writing purporting to be made by the accused or by counsel LAWS OF GUYANA National Insurance and Social Security Cap. 36:01 43  L.R.O. 1/2012                 c. 11:"
                },
                {
                    "representation": "(4)",
                    "description": "Where the person charged with such offence as is mentioned in  subsection"
                }
            ]
        }
    },
    {
        "act": "NATIONAL INSURANCE AND   SOCIAL SECURITY ACT",
        "source": "https://mola.gov.gy/laws-of-guyana",
        "type": {
            "name": "section",
            "representation": "44",
            "title": "Civil proceedings to recover sums due to Fund. ",
            "context": "NATIONAL INSURANCE AND   SOCIAL SECURITY ACT under Civil proceedings to recover sums due to Fund. 44.(1)   All  sums  due  to  the  Fund  by  way  of  contributions,  unless regulations otherwise provide shall bear interest at the rate which is one  per  cent  greater  than the  rate  charged  by commercial  banks  on overdrafts  or  such  other  rate  and  as  from  such  date  as  may  be prescribed  and  shall  be  recoverable  as  debts  due  to  the  Fund,  and without prejudice to any other remedy, may be recovered on behalf of the Fund summarily in a magistrates court, without limit of amount, as a civil debt.  (2) Proceedings for summary recovery of sums due to the Fund may  notwithstanding anything in any enactment to the contrary be brought at any time after the matter complained of arose, whether or not  by  virtue  of  this  subsection,  prior  to 25th July, 1981, or by virtue of the provisions  of  the  Limitation  Act  such  sums  would  have  been irrecoverable immediately prior thereto.  (3) Proceedings for the summary recovery as civil debts of sums due to the Fund may be instituted by an inspector or other officer authorised in that behalf by special or general directions of the Board and any such inspector or officer may although not of counsel or a solicitor conduct such proceedings.  (4) The  Board  may,  if  in  its  opinion  the  delay  in  paying contributions due to the Fund was caused by an error and was not a deliberate act on the part of the employer, waive the interest chargeable or determine the rate at which such interest shall be paid.",
            "description": [
                {
                    "representation": "(1)",
                    "description": "All  sums  due  to  the  Fund  by  way  of  contributions,  unless regulations otherwise provide shall bear interest at the rate which is one  per  cent  greater  than the  rate  charged  by commercial  banks  on overdrafts  or  such  other  rate  and  as  from  such  date  as  may  be prescribed  and  shall  be  recoverable  as  debts  due  to  the  Fund,  and without prejudice to any other remedy, may be recovered on behalf of the Fund summarily in a magistrates court, without limit of amount, as a civil debt."
                },
                {
                    "representation": "(2)",
                    "description": "Proceedings for summary recovery of sums due to the Fund may  notwithstanding anything in any enactment to the contrary be brought at any time after the matter complained of arose, whether or not  by  virtue  of  this  subsection,  prior  to 25th July, 1981, or by virtue of the provisions  of  the  Limitation  Act  such  sums  would  have  been irrecoverable immediately prior thereto."
                },
                {
                    "representation": "(3)",
                    "description": "Proceedings for the summary recovery as civil debts of sums due to the Fund may be instituted by an inspector or other officer authorised in that behalf by special or general directions of the Board and any such inspector or officer may although not of counsel or a solicitor conduct such proceedings."
                },
                {
                    "representation": "(4)",
                    "description": "The  Board  may,  if  in  its  opinion  the  delay  in  paying contributions due to the Fund was caused by an error and was not a deliberate act on the part of the employer, waive the interest chargeable or determine the rate at which such interest shall be paid."
                }
            ]
        }
    },
    {
        "act": "NATIONAL INSURANCE AND   SOCIAL SECURITY ACT",
        "source": "https://mola.gov.gy/laws-of-guyana",
        "type": {
            "name": "section",
            "representation": "45",
            "title": "Proceedings against employer for benefit lost by employer\u2019s default. 45A.   Saving.  PART VI MISCELLANEOUS  ",
            "context": "NATIONAL INSURANCE AND   SOCIAL SECURITY ACT under Proceedings against employer for benefit lost by employers default. 45A.   Saving.  PART VI MISCELLANEOUS  45.(1)  Where an employer has failed or neglected  (a)     to pay any contributions which under this Act he is liable to pay in respect of or on behalf of any insured person in his employment; or  LAWS OF GUYANA National Insurance and Social Security Cap. 36:01 45  L.R.O. 1/2012                                       c. 7:02     Savings. [6 of 1981]         State servants.    (b)   to comply in relation to any such  person with the requirements  of  this  Act  relating  to  the  payment  and collection of contributions;   and by reason thereof that person or any other person to whom benefit under this Act may have been payable has lost in whole or in part the benefit to which he would have been entitled, that person or that other person as the case may be shall be entitled to recover summarily in a magistrates court from the employer as a civil debt a sum equal to the amount of the benefit so lost, irrespective of the amount.  (2) Proceedings may be taken under this section notwithstanding that proceedings have been taken under any other section of this Act in respect of the same failure or neglect (3) Proceedings under this section may notwithstanding any enactment to the contrary be brought at any time after the date on which the  employed person but for the failure or neglect of the employer would have been entitled to receive the benefit lost, whether or not by virtue of this subsection, prior to the 25th July, 1981, or by virtue of the provisions of the Limitation  Act the sum equal to the amount of the benefit lost would have been irrecoverable immediately prior thereto.  45A. Nothing in sections 44 and 45 shall enable proceedings to be brought in respect of a claim which was the subject matter of proceedings instituted and determined prior to the 25th July,",
            "description": [
                {
                    "representation": "(1)",
                    "description": "Where an employer has failed or neglected"
                },
                {
                    "representation": "(a)",
                    "description": "to pay any contributions which under this Act he is liable to pay in respect of or on behalf of any insured person in his employment; or  LAWS OF GUYANA National Insurance and Social Security Cap. 36:01 45  L.R.O. 1/2012                                       c. 7:02     Savings. [6 of 1981]         State servants."
                },
                {
                    "representation": "(b)",
                    "description": "to comply in relation to any such  person with the requirements  of  this  Act  relating  to  the  payment  and collection of contributions;   and by reason thereof that person or any other person to whom benefit under this Act may have been payable has lost in whole or in part the benefit to which he would have been entitled, that person or that other person as the case may be shall be entitled to recover summarily in a magistrates court from the employer as a civil debt a sum equal to the amount of the benefit so lost, irrespective of the amount."
                },
                {
                    "representation": "(2)",
                    "description": "Proceedings may be taken under this section notwithstanding that proceedings have been taken under any other section of this Act in respect of the same failure or neglect"
                },
                {
                    "representation": "(3)",
                    "description": "Proceedings under this section may notwithstanding any enactment to the contrary be brought at any time after the date on which the  employed person but for the failure or neglect of the employer would have been entitled to receive the benefit lost, whether or not by virtue of this subsection, prior to the 25th July, 1981, or by virtue of the provisions of the Limitation  Act the sum equal to the amount of the benefit lost would have been irrecoverable immediately prior thereto.  45A. Nothing in sections 44 and 45 shall enable proceedings to be brought in respect of a claim which was the subject matter of proceedings instituted and determined prior to the 25th July,"
                }
            ]
        }
    },
    {
        "act": "NATIONAL INSURANCE AND   SOCIAL SECURITY ACT",
        "source": "https://mola.gov.gy/laws-of-guyana",
        "type": {
            "name": "section",
            "representation": "46",
            "title": "State servants. ",
            "context": "NATIONAL INSURANCE AND   SOCIAL SECURITY ACT under State servants. 46.  This Act shall apply to persons employed by or under the State in  like  manner  as  if  the  State  were  a  private  person  with  such modifications as may be made therein by regulations for the purpose of adapting the LAWS OF GUYANA 46 Cap. 36:01 National Insurance and Social Security   L.R.O. 1/2012             Persons employed on board ships, vessels or aircraft.                                   provisions of this Act to the case of such persons:  Provided that regulations may provide that any employment under the State shall not be insurable employment.",
            "description": "This Act shall apply to persons employed by or under the State in  like  manner  as  if  the  State  were  a  private  person  with  such modifications as may be made therein by regulations for the purpose of adapting the LAWS OF GUYANA 46 Cap. 36:01 National Insurance and Social Security   L.R.O. 1/2012             Persons employed on board ships, vessels or aircraft.                                   provisions of this Act to the case of such persons:  Provided that regulations may provide that any employment under the State shall not be insurable employment."
        }
    },
    {
        "act": "NATIONAL INSURANCE AND   SOCIAL SECURITY ACT",
        "source": "https://mola.gov.gy/laws-of-guyana",
        "type": {
            "name": "section",
            "representation": "47",
            "title": "Persons employed on board ships, vessels or aircraft. ",
            "context": "NATIONAL INSURANCE AND   SOCIAL SECURITY ACT under Persons employed on board ships, vessels or aircraft. 47.(1)  Without prejudice to the generality of any other power to make regulations, the Minister may make regulations modifying in such  manner as he thinks proper the provisions of this Act in their application in relation to persons who are or have been employed on board any ship, vessel or aircraft.  (2) Without  prejudice  to  the  generality  of  subsection  (1), regulations thereunder may in particular provide  (a)   for the insurance under this Act of persons who are or have been employed on or after the 29th day of September, 1969 or the 1st day of January, 1970 on board  ships, vessels   or aircraft notwithstanding that they do not fulfil the conditions of section 11;  (b)     for  excepting  from  insurance  under this Act or from liability to  pay  contributions  as  employed  persons,  any persons employed as aforesaid who neither are domiciled nor have a place of residence in Guyana;  (c)   for  the  taking of evidence for the purpose of any claim to benefit in any place outside Guyana;  (d)   for enabling persons on board ships, LAWS OF GUYANA National Insurance and Social Security Cap. 36:01 47  L.R.O. 1/2012                                    Insured persons outside Guyana.              vessels or aircraft to authorise the payment of the whole or any part of any benefit to which they are or may become entitled to such of their dependants as may be prescribed;  (e)      for the payment of industrial benefit to or in respect of mariners and airmen in respect of accidents happening and prescribed  diseases  developed  while  they  are  outside Guyana;  (f)     for treating as accidents arising out of and in the course of   the  employment  of  a  mariner  or  airman  accidents happening while he is proceeding to or from his ship, vessel or aircraft or in any other prescribed circumstances; and  (g)    for withholding any benefit that may be payable to a mariner for any period during which the owner of his ship or vessel is under a statutory obligation to pay him wages.",
            "description": [
                {
                    "representation": "(1)",
                    "description": "Without prejudice to the generality of any other power to make regulations, the Minister may make regulations modifying in such  manner as he thinks proper the provisions of this Act in their application in relation to persons who are or have been employed on board any ship, vessel or aircraft."
                },
                {
                    "representation": "(2)",
                    "description": "Without  prejudice  to  the  generality  of  subsection"
                },
                {
                    "representation": "(a)",
                    "description": "for the insurance under this Act of persons who are or have been employed on or after the 29th day of September, 1969 or the 1st day of January, 1970 on board  ships, vessels   or aircraft notwithstanding that they do not fulfil the conditions of section 11;"
                },
                {
                    "representation": "(b)",
                    "description": "for  excepting  from  insurance  under this Act or from liability to  pay  contributions  as  employed  persons,  any persons employed as aforesaid who neither are domiciled nor have a place of residence in Guyana;"
                },
                {
                    "representation": "(c)",
                    "description": "for  the  taking of evidence for the purpose of any claim to benefit in any place outside Guyana;"
                },
                {
                    "representation": "(d)",
                    "description": "for enabling persons on board ships, LAWS OF GUYANA National Insurance and Social Security Cap. 36:01 47  L.R.O. 1/2012                                    Insured persons outside Guyana.              vessels or aircraft to authorise the payment of the whole or any part of any benefit to which they are or may become entitled to such of their dependants as may be prescribed;"
                },
                {
                    "representation": "(e)",
                    "description": "for the payment of industrial benefit to or in respect of mariners and airmen in respect of accidents happening and prescribed  diseases  developed  while  they  are  outside Guyana;"
                },
                {
                    "representation": "(f)",
                    "description": "for treating as accidents arising out of and in the course of   the  employment  of  a  mariner  or  airman  accidents happening while he is proceeding to or from his ship, vessel or aircraft or in any other prescribed circumstances; and"
                },
                {
                    "representation": "(g)",
                    "description": "for withholding any benefit that may be payable to a mariner for any period during which the owner of his ship or vessel is under a statutory obligation to pay him wages."
                }
            ]
        }
    },
    {
        "act": "NATIONAL INSURANCE AND   SOCIAL SECURITY ACT",
        "source": "https://mola.gov.gy/laws-of-guyana",
        "type": {
            "name": "section",
            "representation": "48",
            "title": "Insured persons outside Guyana. ",
            "context": "NATIONAL INSURANCE AND   SOCIAL SECURITY ACT under Insured persons outside Guyana. 48. (1)  Without prejudice to the generality of any other power to make regulations, the Minister may subject to subsection (2) make regulations  modifying  in  such  manner  as  he  thinks  proper  the provisions of this Act in their application in relation to persons who are or have been outside Guyana while insured under this Act.  (2) Regulations under this section shall provide that where an insured person is throughout any contribution period outside Guyana and is not in that period an employed person he shall not be liable to pay any contribution as an insured person for such period.  LAWS OF GUYANA 48 Cap. 36:01 National Insurance and Social Security   L.R.O. 1/2012  Reciprocal agreements with other parts of the Common- wealth or with foreign countries.                                                Exemption from stamp duty.",
            "description": [
                {
                    "representation": "(1)",
                    "description": "Without prejudice to the generality of any other power to make regulations, the Minister may subject to subsection"
                },
                {
                    "representation": "(2)",
                    "description": "Regulations under this section shall provide that where an insured person is throughout any contribution period outside Guyana and is not in that period an employed person he shall not be liable to pay any contribution as an insured person for such period.  LAWS OF GUYANA 48 Cap. 36:01 National Insurance and Social Security   L.R.O. 1/2012  Reciprocal agreements with other parts of the Common- wealth or with foreign countries.                                                Exemption from stamp duty."
                }
            ]
        }
    },
    {
        "act": "NATIONAL INSURANCE AND   SOCIAL SECURITY ACT",
        "source": "https://mola.gov.gy/laws-of-guyana",
        "type": {
            "name": "section",
            "representation": "49",
            "title": "Reciprocal agreements with other parts of the Commonwealth or with foreign countries. ",
            "context": "NATIONAL INSURANCE AND   SOCIAL SECURITY ACT under Reciprocal agreements with other parts of the Commonwealth or with foreign countries. 49.(1) For the purpose of giving effect to any agreement with the government of any other part of the Commonwealth or the government of  any  foreign  country,  being  an  agreement  which  provides  for reciprocity in matters of social security it shall be lawful for the Minister, by order, to make provision for modifying or adapting this Act in its application to cases affected by the agreement.  (2) The modification of this Act which may be made by virtue of subsection (1) shall include provision  (a)    for securing that acts, omissions and events having any effect for the purposes of the law of the country in respect of which the agreement is made shall have a corresponding effect for the purposes of this Act (but not so far as to confer a right to double benefit);  (b)     for determining in cases where rights accrue both under this Act and under the law of the said country which of these rights shall be available to the person concerned;  (c)   for   making   provision   as   to             administration and enforcement contained in this Act applicable also for the law of the said country;  (d)   for making any necessary financial            adjustments by payments into or out of the Fund.",
            "description": [
                {
                    "representation": "(1)",
                    "description": "shall include provision"
                },
                {
                    "representation": "(2)",
                    "description": "The modification of this Act which may be made by virtue of subsection"
                },
                {
                    "representation": "(a)",
                    "description": "for securing that acts, omissions and events having any effect for the purposes of the law of the country in respect of which the agreement is made shall have a corresponding effect for the purposes of this Act"
                },
                {
                    "representation": "(b)",
                    "description": "for determining in cases where rights accrue both under this Act and under the law of the said country which of these rights shall be available to the person concerned;"
                },
                {
                    "representation": "(c)",
                    "description": "for   making   provision   as   to             administration and enforcement contained in this Act applicable also for the law of the said country;"
                },
                {
                    "representation": "(d)",
                    "description": "for making any necessary financial            adjustments by payments into or out of the Fund."
                }
            ]
        }
    },
    {
        "act": "NATIONAL INSURANCE AND   SOCIAL SECURITY ACT",
        "source": "https://mola.gov.gy/laws-of-guyana",
        "type": {
            "name": "section",
            "representation": "50",
            "title": "Exemption from stamp duty. ",
            "context": "NATIONAL INSURANCE AND   SOCIAL SECURITY ACT under Exemption from stamp duty. 50. Stamp duty shall not be chargeable upon any draft or order or receipt given in respect of benefit or upon any receipt given in respect of any other payment out of the Fund LAWS OF GUYANA National Insurance and Social Security Cap. 36:01 49  L.R.O. 1/2012      Regulations.                                          pursuant to section 33(3) or upon any receipt given by an officer of the Board for or in respect of any sum payable into the Fund.",
            "description": [
                {
                    "representation": "(3)",
                    "description": "or upon any receipt given by an officer of the Board for or in respect of any sum payable into the Fund."
                }
            ]
        }
    },
    {
        "act": "NATIONAL INSURANCE AND   SOCIAL SECURITY ACT",
        "source": "https://mola.gov.gy/laws-of-guyana",
        "type": {
            "name": "section",
            "representation": "51",
            "title": "Regulations. ",
            "context": "NATIONAL INSURANCE AND   SOCIAL SECURITY ACT under Regulations. 51.(1)  The Minister may make regulations required by this Act to be made, or for the purpose of modifying or affecting the operation of any provision of this Act, or as the Minister may consider necessary or  desirable  generally  for  the  better  carrying  into  effect  of  the provisions of this Act. (2) Without prejudice to the generality of subsection (1), the Minister may by such regulations  (a)      prescribe any matter which may be or is required to be prescribed under the provisions of this Act;  (b)      require any employer  (i)       to submit returns of persons              employed by him at such intervals and in such manner as may be prescribed; (ii)     to   take   reasonable   steps   to   investigate   the circumstances of every accident or disease of which notice is given to him; (iii)    to  give  the Board such notices or returns as may be thereby required of any accident or disease whether fatal or not which has occurred in his place of employment;  (c)  except such categories of insured persons as may be specified therein from liability to pay contributions for such periods as may be prescribed;  (d) provide for determining the 33 od 2009][28 of 1997 LAWS OF GUYANA 50 Cap. 36:01 National Insurance and Social Security   L.R.O. 1/2012                                                 circumstances  in which a person is or is not to be deemed for the purposes of this Act to be wholly or partially maintaining another person.  (3) Regulations  may provide  for  the  recovery on  summary conviction of monetary penalties in respect of any offence under this Act being a contravention of or failure to comply with regulations, so however, that such penalties shall not exceed thirty thousand dollars for each  offence or where the offence consists of continuing any such contravention or failure after conviction thereof thirty thousand dollars together with a further five thousand dollars for each day on which it is so continued.  (4) Any power conferred by this Act to make regulations may be exercised  (a)     either in relation to all cases to which the power extends or in relation to all such cases subject to specified exceptions or in relation to any specified cases or classes of case; and   (b)    so as to make as respects the cases in relation to which it is exercised  (i)       the full provisions to which the              power extends or any less provision (whether by way of exception or otherwise);  (ii)    the same provision for all cases in relation to which the power is exercised or different provision for different cases or classes of case or different provision as respects the same case or class of case for LAWS OF GUYANA National Insurance and Social Security Cap. 36:01 51  L.R.O. 1/2012                         Regulations subject to negative resolution.  Workmens Compensation Ordinance not to apply to persons entitled to industrial benefit. c. 111 1953 Ed.       Measure of damages where section 53 applies.  c. 111 1953 Ed.              different purposes of this Act; (iii) any such provision either            unconditionally or subject to any specified condition.  (5) Without prejudice to any specific provision in this Act, any regulations may contain such incidental or supplementary provisions as appear to the Minister to be expedient for the purposes of the regulations.",
            "description": [
                {
                    "representation": "(1)",
                    "description": "The Minister may make regulations required by this Act to be made, or for the purpose of modifying or affecting the operation of any provision of this Act, or as the Minister may consider necessary or  desirable  generally  for  the  better  carrying  into  effect  of  the provisions of this Act."
                },
                {
                    "representation": "(2)",
                    "description": "Without prejudice to the generality of subsection"
                },
                {
                    "representation": "(a)",
                    "description": "either in relation to all cases to which the power extends or in relation to all such cases subject to specified exceptions or in relation to any specified cases or classes of case; and"
                },
                {
                    "representation": "(b)",
                    "description": "so as to make as respects the cases in relation to which it is exercised"
                },
                {
                    "representation": "(i)",
                    "description": "the full provisions to which the              power extends or any less provision"
                },
                {
                    "representation": "(c)",
                    "description": "except such categories of insured persons as may be specified therein from liability to pay contributions for such periods as may be prescribed;"
                },
                {
                    "representation": "(d)",
                    "description": "provide for determining the 33 od 2009][28 of 1997 LAWS OF GUYANA 50 Cap. 36:01 National Insurance and Social Security   L.R.O. 1/2012                                                 circumstances  in which a person is or is not to be deemed for the purposes of this Act to be wholly or partially maintaining another person."
                },
                {
                    "representation": "(3)",
                    "description": "Regulations  may provide  for  the  recovery on  summary conviction of monetary penalties in respect of any offence under this Act being a contravention of or failure to comply with regulations, so however, that such penalties shall not exceed thirty thousand dollars for each  offence or where the offence consists of continuing any such contravention or failure after conviction thereof thirty thousand dollars together with a further five thousand dollars for each day on which it is so continued."
                },
                {
                    "representation": "(4)",
                    "description": "Any power conferred by this Act to make regulations may be exercised"
                },
                {
                    "representation": "(5)",
                    "description": "Without prejudice to any specific provision in this Act, any regulations may contain such incidental or supplementary provisions as appear to the Minister to be expedient for the purposes of the regulations."
                }
            ]
        }
    },
    {
        "act": "NATIONAL INSURANCE AND   SOCIAL SECURITY ACT",
        "source": "https://mola.gov.gy/laws-of-guyana",
        "type": {
            "name": "section",
            "representation": "52",
            "title": "Regulations subject to negative resolution. ",
            "context": "NATIONAL INSURANCE AND   SOCIAL SECURITY ACT under Regulations subject to negative resolution. 52. All regulations shall be subject to negative resolution of the National Assembly.",
            "description": "All regulations shall be subject to negative resolution of the National Assembly."
        }
    },
    {
        "act": "NATIONAL INSURANCE AND   SOCIAL SECURITY ACT",
        "source": "https://mola.gov.gy/laws-of-guyana",
        "type": {
            "name": "section",
            "representation": "53",
            "title": "Workmen\u2019s Compensation Ordinance not to apply to persons entitled to industrial benefit. ",
            "context": "NATIONAL INSURANCE AND   SOCIAL SECURITY ACT under Workmens Compensation Ordinance not to apply to persons entitled to industrial benefit. 53. From and after the 1st day of January, 1970 an insured person who if he suffers any such personal injury or develops any such disease as entitles him to industrial benefit shall not in relation to such injury or disease be regarded as a workman for the purposes of the Workmens Compensation Ordinance.",
            "description": "From and after the 1st day of January, 1970 an insured person who if he suffers any such personal injury or develops any such disease as entitles him to industrial benefit shall not in relation to such injury or disease be regarded as a workman for the purposes of the Workmens Compensation Ordinance."
        }
    },
    {
        "act": "NATIONAL INSURANCE AND   SOCIAL SECURITY ACT",
        "source": "https://mola.gov.gy/laws-of-guyana",
        "type": {
            "name": "section",
            "representation": "54",
            "title": "Measure of damages where section 53 applies. ",
            "context": "NATIONAL INSURANCE AND   SOCIAL SECURITY ACT under Measure of damages where section 53 applies. 54.(1)  Where,  consequent  on  the  provisions  of  section  53,  in relation to personal injury or death an insured person is not regarded as a   workman  for  the  purposes  of  the  Workmens  Compensation Ordinance the following provisions  of this section shall  apply as respects such insured person.  (2) In an action for damages for personal injuries (including any such  action arising out of a contract) there shall in assessing such damages be taken into account against any loss of wages or profits which has accrued or probably will accrue to the insured person from the injuries, one-half of the value of any rights which have accrued or probably will accrue to him therefrom in respect of injury benefit or disablement benefit for the five years beginning with the time LAWS OF GUYANA 52 Cap. 36:01 National Insurance and Social Security   L.R.O. 1/2012                                                     when the cause of action accrued; but this  subsection shall not be taken as requiring both the gross amount of the damages before taking into account such rights and the net amount after taking them into account to be found separately.  (3) The reference in subsection (2) to assessing the damages for personal injuries shall, in cases where damages otherwise recoverable are  subject  to  reduction  under  the  law  relating  to  contributory negligence or are limited by or under any enactment or by contract, be taken  as  referring  to  the  total  damages  which  would  have  been recoverable apart from the reduction or limitation.  (4) In assessing damages in respect of the death of a person in any   action  under  Part  IV  of  the  Law  Reform  (Miscellaneous Provisions) Ordinance or the Carriage by Air Act, 1932, of the United Kingdom as extended to Guyana by the Carriage by Air (Colonies, Protectorates and Trust Territories) Order, 1953, and the Carriage by Air  (Non-international  Carriage)(Colonies, Protectorates and Trust Territories) Order, 1953, there shall not be taken into account any right to benefit resulting from the death of such person.  (5) For the purposes of this section  (a)       the   expression   personal   injury             includes any disease  and  any  impairment  of  the  physical  or  mental condition, of a person and the expression injured shall be construed accordingly;  (b)  any  payment  on  account  of disablement benefit shall be treated as benefit for the period taken into account by the assessment of the extent of the disablement in respect of which it is payable. LAWS OF GUYANA National Insurance and Social Security Cap. 36:01 53  L.R.O. 1/2012 Compliance certificates when tendering for Government contracts.  [33 of 2009] c.73:05        s. 2",
            "description": [
                {
                    "representation": "(1)",
                    "description": "Where,  consequent  on  the  provisions  of  section  53,  in relation to personal injury or death an insured person is not regarded as a   workman  for  the  purposes  of  the  Workmens  Compensation Ordinance the following provisions  of this section shall  apply as respects such insured person."
                },
                {
                    "representation": "(2)",
                    "description": "to assessing the damages for personal injuries shall, in cases where damages otherwise recoverable are  subject  to  reduction  under  the  law  relating  to  contributory negligence or are limited by or under any enactment or by contract, be taken  as  referring  to  the  total  damages  which  would  have  been recoverable apart from the reduction or limitation."
                },
                {
                    "representation": "(3)",
                    "description": "The reference in subsection"
                },
                {
                    "representation": "(4)",
                    "description": "In assessing damages in respect of the death of a person in any   action  under  Part  IV  of  the  Law  Reform"
                },
                {
                    "representation": "(5)",
                    "description": "For the purposes of this section"
                },
                {
                    "representation": "(a)",
                    "description": "the   expression   personal   injury             includes any disease  and  any  impairment  of  the  physical  or  mental condition, of a person and the expression injured shall be construed accordingly;"
                },
                {
                    "representation": "(b)",
                    "description": "any  payment  on  account  of disablement benefit shall be treated as benefit for the period taken into account by the assessment of the extent of the disablement in respect of which it is payable. LAWS OF GUYANA National Insurance and Social Security Cap. 36:01 53  L.R.O. 1/2012 Compliance certificates when tendering for Government contracts.  [33 of 2009] c.73:05        s. 2"
                }
            ]
        }
    },
    {
        "act": "NATIONAL INSURANCE AND   SOCIAL SECURITY ACT",
        "source": "https://mola.gov.gy/laws-of-guyana",
        "type": {
            "name": "section",
            "representation": "55",
            "title": "Compliance certificates when tendering for government contracts. SCHEDULE\u2014 Insurable employments.  __________________________  CHAPTER 36:01  NATIONAL INSURANCE AND SOCIAL SECURITY ACT   15 of 1969 An Act to establish a system of national insurance and social security providing pecuniary payments by way of old age benefit, invalidity benefit, survivor\u2019s benefit, sickness benefit, maternity benefit and funeral benefit, LAWS OF GUYANA National Insurance and Social Security Cap. 36:01 7  L.R.O. 1/2012 and to substitute for compensation under  the Workmen\u2019s  Compensation Ordinance a system of insurance against injury or death caused by accident arising out of and in the course of employment or resulting from disease due to the nature of employment; to establish  a  National  Insurance  Fund;  and  to provide  for matters connected with or incidental thereto.   [All sections except section 19(2)..... 29TH SEPTEMBER, 1969 Section 19(2)..... 1ST JANUARY, 1970]      Short title.    Interpretation. [14 of 1971 9 of 1981 15 of 1989 28 of 1997]  c. 75:01                   PART I PRELIMINARY  ",
            "context": "NATIONAL INSURANCE AND   SOCIAL SECURITY ACT under Compliance certificates when tendering for government contracts. SCHEDULE Insurable employments.  __________________________  CHAPTER 36:01  NATIONAL INSURANCE AND SOCIAL SECURITY ACT   15 of 1969 An Act to establish a system of national insurance and social security providing pecuniary payments by way of old age benefit, invalidity benefit, survivors benefit, sickness benefit, maternity benefit and funeral benefit, LAWS OF GUYANA National Insurance and Social Security Cap. 36:01 7  L.R.O. 1/2012 and to substitute for compensation under  the Workmens  Compensation Ordinance a system of insurance against injury or death caused by accident arising out of and in the course of employment or resulting from disease due to the nature of employment; to establish  a  National  Insurance  Fund;  and  to provide  for matters connected with or incidental thereto.   [All sections except section 19(2)..... 29TH SEPTEMBER, 1969 Section 19(2)..... 1ST JANUARY, 1970]      Short title.    Interpretation. [14 of 1971 9 of 1981 15 of 1989 28 of 1997]  c. 75:01                   PART I PRELIMINARY  55. Every employer or self- employed person who tenders for a government contract shall in pursuance of section 5 (1) (iv) of the Procurement Act, when submitting his Schedule A in respect of employers and in Form 2 in the said Schedule in respect of self-employed persons, issued by the General Manager to the effect that he has complied with this Act in relation to the collection and payment of contributions.   SCHEDULE  INSURABLE EMPLOYMENTS",
            "description": [
                {
                    "representation": "(1)",
                    "description": "(iv) of the Procurement Act, when submitting his Schedule A in respect of employers and in Form 2 in the said Schedule in respect of self-employed persons, issued by the General Manager to the effect that he has complied with this Act in relation to the collection and payment of contributions.   SCHEDULE  INSURABLE EMPLOYMENTS"
                }
            ]
        }
    },
    {
        "act": "NATIONAL INSURANCE AND   SOCIAL SECURITY ACT",
        "source": "https://mola.gov.gy/laws-of-guyana",
        "type": {
            "name": "section",
            "representation": "60",
            "title": "",
            "context": "NATIONAL INSURANCE AND   SOCIAL SECURITY ACT under 60. [11/1977]                      Time of payment of contributions. [Reg. 3/ 1971 11/1997]                had not followed such abnormal practice, but had followed a practice normal for the employment in question.",
            "description": "[11/1977]                      Time of payment of contributions. [Reg. 3/ 1971 11/1997]                had not followed such abnormal practice, but had followed a practice normal for the employment in question."
        }
    }
]