[
    {
        "act": "EQUAL RIGHTS ACT",
        "source": "https://mola.gov.gy/laws-of-guyana",
        "type": {
            "name": "section",
            "representation": "1",
            "title": "Short title. ",
            "context": "EQUAL RIGHTS ACT under Short title. 1. This Act may be cited as the Equal Rights Act.",
            "description": "This Act may be cited as the Equal Rights Act."
        }
    },
    {
        "act": "EQUAL RIGHTS ACT",
        "source": "https://mola.gov.gy/laws-of-guyana",
        "type": {
            "name": "section",
            "representation": "2",
            "title": "Equal rights and opportunities for women and men. ",
            "context": "EQUAL RIGHTS ACT under Equal rights and opportunities for women and men. 2. (1) Women and men have equal rights and the same legal status in all spheres of political, economic and social life.  (2) All forms of discrimination against women or men on the basis of their sex or marital status are illegal.  (3) Women and men shall be paid equal remuneration for the same work or work of the same nature.  (4) No person shall be ineligible for, or discriminated against in respect of, any employment, appointment or promotion in, or to, any office or position on the ground only of sex.  LAWS OF GUYANA 4 Cap. 38:01 Equal Rights  L.R.O. 1/ 2012                                                 (5) No person shall, on the ground only of sex, be denied  (a) access to academic, vocational and professional training; or  (b) equal opportunities in social, political or cultural activity.  (6) Without prejudice to the generality of the foregoing provisions of this section it shall be discriminatory against women where in relation to employment  (a) in arrangements made for the purpose of determining who should be offered employment;  (b) in the terms on which employment is offered;  (c) by the refusal or deliberate omission to offer employment;  (d)  in the way access is afforded to opportunities for promotion, transfer or training or to any other benefits, facilities or services.,  men are afforded more favourable opportunities or conditions than women or preference is given to men.  (7) Nothing in this section shall be deemed to prevent any employer from making special labour and health protection measures for women, or from making provision for conditions enabling mothers to work or for material and moral support for mothers and children, including paid leave and other benefits for mothers and expectant mothers.  LAWS OF GUYANA Equal Rights Cap. 38:01 5  L.R.O. 1/2012                         Amendment of enactments. Schedule.   Penalty; civil liability.         Power to make regulations.          (8) Where any written law makes provision for the search of any person, a woman shall be searched only by another woman and a man shall be searched only by another man.  (9) This section shall have effect notwithstanding anything contained in any other written law or contract to the contrary.  (10) In this section remuneration means any money or other thing, whether called salary, wage, allowance or by any other name, had or contracted to be paid, delivered or give as a recompense, reward or remuneration for any work or labour done or to be done, whether within a certain time or to a certain amount, or for a time or an amount uncertain, and includes merit increment or other increment in such remuneration.",
            "description": [
                {
                    "representation": "(1)",
                    "description": "Women and men have equal rights and the same legal status in all spheres of political, economic and social life."
                },
                {
                    "representation": "(2)",
                    "description": "All forms of discrimination against women or men on the basis of their sex or marital status are illegal."
                },
                {
                    "representation": "(3)",
                    "description": "Women and men shall be paid equal remuneration for the same work or work of the same nature."
                },
                {
                    "representation": "(4)",
                    "description": "No person shall be ineligible for, or discriminated against in respect of, any employment, appointment or promotion in, or to, any office or position on the ground only of sex.  LAWS OF GUYANA 4 Cap. 38:01 Equal Rights  L.R.O. 1/ 2012"
                },
                {
                    "representation": "(5)",
                    "description": "No person shall, on the ground only of sex, be denied"
                },
                {
                    "representation": "(a)",
                    "description": "in arrangements made for the purpose of determining who should be offered employment;"
                },
                {
                    "representation": "(b)",
                    "description": "in the terms on which employment is offered;"
                },
                {
                    "representation": "(6)",
                    "description": "Without prejudice to the generality of the foregoing provisions of this section it shall be discriminatory against women where in relation to employment"
                },
                {
                    "representation": "(c)",
                    "description": "by the refusal or deliberate omission to offer employment;"
                },
                {
                    "representation": "(d)",
                    "description": "in the way access is afforded to opportunities for promotion, transfer or training or to any other benefits, facilities or services.,  men are afforded more favourable opportunities or conditions than women or preference is given to men."
                },
                {
                    "representation": "(7)",
                    "description": "Nothing in this section shall be deemed to prevent any employer from making special labour and health protection measures for women, or from making provision for conditions enabling mothers to work or for material and moral support for mothers and children, including paid leave and other benefits for mothers and expectant mothers.  LAWS OF GUYANA Equal Rights Cap. 38:01 5  L.R.O. 1/2012                         Amendment of enactments. Schedule.   Penalty; civil liability.         Power to make regulations."
                },
                {
                    "representation": "(8)",
                    "description": "Where any written law makes provision for the search of any person, a woman shall be searched only by another woman and a man shall be searched only by another man."
                },
                {
                    "representation": "(9)",
                    "description": "This section shall have effect notwithstanding anything contained in any other written law or contract to the contrary."
                }
            ]
        }
    },
    {
        "act": "EQUAL RIGHTS ACT",
        "source": "https://mola.gov.gy/laws-of-guyana",
        "type": {
            "name": "section",
            "representation": "3",
            "title": "Amendment of enactments. ",
            "context": "EQUAL RIGHTS ACT under Amendment of enactments. 3. The enactments specified in the first column of the Schedule are hereby amended in the manner specified in the corresponding entry in the second column of that Schedule.",
            "description": "The enactments specified in the first column of the Schedule are hereby amended in the manner specified in the corresponding entry in the second column of that Schedule."
        }
    },
    {
        "act": "EQUAL RIGHTS ACT",
        "source": "https://mola.gov.gy/laws-of-guyana",
        "type": {
            "name": "section",
            "representation": "4",
            "title": "Penalty; civil liability. ",
            "context": "EQUAL RIGHTS ACT under Penalty; civil liability. 4. Any person who contravenes section 2(2), (3), (4), (5), (6) or (8) shall, without prejudice to any civil liability, be liable on summary conviction to a fine of five thousand dollars and imprisonment for six months and in the case of a continuing offence to a further fine of five hundred dollars for each day, after the first day, during which the offence continues.",
            "description": [
                {
                    "representation": "(6)",
                    "description": "or"
                },
                {
                    "representation": "(8)",
                    "description": "shall, without prejudice to any civil liability, be liable on summary conviction to a fine of five thousand dollars and imprisonment for six months and in the case of a continuing offence to a further fine of five hundred dollars for each day, after the first day, during which the offence continues."
                }
            ]
        }
    }
]