[
    {
        "act": "GUYANA MANAGEMENT INSTITUTE ACT",
        "source": "https://mola.gov.gy/laws-of-guyana",
        "type": {
            "name": "section",
            "representation": "1",
            "title": "Short title. ",
            "context": "GUYANA MANAGEMENT INSTITUTE ACT under Short title. 1. This Act may be cited as the Guyana Management Institute Act. LAWS OF GUYANA 4 Cap. 39:09 Guyana Management Institute  L.R.O. 1/2012 Interpretation.                    Establishment and incorporation of the Institute.   Board of Directors. Schedule.    Functions of the Institute.",
            "description": "This Act may be cited as the Guyana Management Institute Act. LAWS OF GUYANA 4 Cap. 39:09 Guyana Management Institute  L.R.O. 1/2012 Interpretation.                    Establishment and incorporation of the Institute.   Board of Directors. Schedule.    Functions of the Institute."
        }
    },
    {
        "act": "GUYANA MANAGEMENT INSTITUTE ACT",
        "source": "https://mola.gov.gy/laws-of-guyana",
        "type": {
            "name": "section",
            "representation": "2",
            "title": "Interpretation. ",
            "context": "GUYANA MANAGEMENT INSTITUTE ACT under Interpretation. 2. In this Act   Board means the Board of Directors referred to in section 4;   Chairman means the Chairman of the Board;  Director means the Director of the Institute referred to in section 8;  Institute means the Guyana Management Institute established under section 3;  member means any member of the Board;   Secretary means the Secretary to the Institute.",
            "description": "In this Act   Board means the Board of Directors referred to in section 4;   Chairman means the Chairman of the Board;  Director means the Director of the Institute referred to in section 8;  Institute means the Guyana Management Institute established under section 3;  member means any member of the Board;   Secretary means the Secretary to the Institute."
        }
    },
    {
        "act": "GUYANA MANAGEMENT INSTITUTE ACT",
        "source": "https://mola.gov.gy/laws-of-guyana",
        "type": {
            "name": "section",
            "representation": "3",
            "title": "Establishment and incorporation of Institute. ",
            "context": "GUYANA MANAGEMENT INSTITUTE ACT under Establishment and incorporation of Institute. 3. There is hereby established a body corporate to be known as the Guyana Management Institute.",
            "description": "There is hereby established a body corporate to be known as the Guyana Management Institute."
        }
    },
    {
        "act": "GUYANA MANAGEMENT INSTITUTE ACT",
        "source": "https://mola.gov.gy/laws-of-guyana",
        "type": {
            "name": "section",
            "representation": "4",
            "title": "Board of Directors. ",
            "context": "GUYANA MANAGEMENT INSTITUTE ACT under Board of Directors. 4. The affairs of the Institute shall be managed by a Board of Directors, and the provisions of the Schedule shall have effect as to the constitution and proceedings of, and otherwise in relation to, the Board.",
            "description": "The affairs of the Institute shall be managed by a Board of Directors, and the provisions of the Schedule shall have effect as to the constitution and proceedings of, and otherwise in relation to, the Board."
        }
    },
    {
        "act": "GUYANA MANAGEMENT INSTITUTE ACT",
        "source": "https://mola.gov.gy/laws-of-guyana",
        "type": {
            "name": "section",
            "representation": "5",
            "title": "Functions of the Institute. ",
            "context": "GUYANA MANAGEMENT INSTITUTE ACT under Functions of the Institute. 5. (1) The Institute shall be responsible for promoting the training of managers and the development of management systems which will continuously upgrade technological practices and which will provide conditions for the continuous improvement of social relations at work.  (2) Without prejudice to the generality of subsection (1) the functions of the Institute shall be  (a) to rationalise public sector management systems, to upgrade the capabilities of public sector managers and to improve management systems LAWS OF GUYANA Guyana Management Institute Cap. 39:09 5  L.R.O. 1/2012                                                 in such a way that duplication and waste are avoided;  (b) to provide courses in the training of managers and to develop courses and seminars in functional management sciences for all levels of management in the public sector, whether on an on-going or on a special basis and whether through the Institute itself or through arrangements made with the assistance of external organisations;  (c) to assist, where necessary, in the improvement of existing management training and development programmes;   (d) to initiate and to assist in the development of internal training and development programmes within public sector organisations;  (e) to provide an objective basis for, and to assist in, management succession planning within public sector organisations;  (f) to give advice and guidance to all agencies, enterprises and institutions in the public sector in the development of systems of management that will promote the progressive improvement of social relations and that will be systematically applied to processes for continuous upgrading of appropriate technological practices; LAWS OF GUYANA 6 Cap. 39:09 Guyana Management Institute  L.R.O. 1/2012                            Powers of the Institute.                        (g) to establish and maintain links with external management training and development institutions and organisations;  (h) to undertake consultancy work and to provide training courses and other services in the field of management training and development for private enterprises at their request, and to enter into arrangements with regional and extra regional agencies and other management development agencies to provide such services; and  (i) generally to carry out the provisions of this Act.",
            "description": [
                {
                    "representation": "(1)",
                    "description": "the functions of the Institute shall be"
                },
                {
                    "representation": "(2)",
                    "description": "Without prejudice to the generality of subsection"
                },
                {
                    "representation": "(a)",
                    "description": "to rationalise public sector management systems, to upgrade the capabilities of public sector managers and to improve management systems LAWS OF GUYANA Guyana Management Institute Cap. 39:09 5  L.R.O. 1/2012                                                 in such a way that duplication and waste are avoided;"
                },
                {
                    "representation": "(b)",
                    "description": "to provide courses in the training of managers and to develop courses and seminars in functional management sciences for all levels of management in the public sector, whether on an on-going or on a special basis and whether through the Institute itself or through arrangements made with the assistance of external organisations;"
                },
                {
                    "representation": "(c)",
                    "description": "to assist, where necessary, in the improvement of existing management training and development programmes;"
                },
                {
                    "representation": "(d)",
                    "description": "to initiate and to assist in the development of internal training and development programmes within public sector organisations;"
                },
                {
                    "representation": "(e)",
                    "description": "to provide an objective basis for, and to assist in, management succession planning within public sector organisations;"
                },
                {
                    "representation": "(f)",
                    "description": "to give advice and guidance to all agencies, enterprises and institutions in the public sector in the development of systems of management that will promote the progressive improvement of social relations and that will be systematically applied to processes for continuous upgrading of appropriate technological practices; LAWS OF GUYANA 6 Cap. 39:09 Guyana Management Institute  L.R.O. 1/2012                            Powers of the Institute."
                },
                {
                    "representation": "(g)",
                    "description": "to establish and maintain links with external management training and development institutions and organisations;"
                },
                {
                    "representation": "(h)",
                    "description": "to undertake consultancy work and to provide training courses and other services in the field of management training and development for private enterprises at their request, and to enter into arrangements with regional and extra regional agencies and other management development agencies to provide such services; and"
                },
                {
                    "representation": "(i)",
                    "description": "generally to carry out the provisions of this Act."
                }
            ]
        }
    },
    {
        "act": "GUYANA MANAGEMENT INSTITUTE ACT",
        "source": "https://mola.gov.gy/laws-of-guyana",
        "type": {
            "name": "section",
            "representation": "6",
            "title": "Powers of the Institute. ",
            "context": "GUYANA MANAGEMENT INSTITUTE ACT under Powers of the Institute. 6. The Institute shall have power for the purpose of the discharge of its functions under section 5  (a) to devise and, if approved by the Minister, to implement and co-ordinate national policy in management training and development in the public sector;  (b) to initiate within any part of the public sector management training programmes and to restructure existing ones where necessary;   (c) to require, where necessary, for the purpose of ensuring consistency and relevance, the submission of public sector management training programmes for its approval; LAWS OF GUYANA Guyana Management Institute Cap. 39:09 7  L.R.O. 1/2012                                                  (d) to require, where necessary, the submission of proposals for the recruitment of management consultants in the public sector for its approval;  (e) to require public sector organisations to consult it for the purpose of obtaining its recommendations  (i) to improve their organisation structures; (ii) to ensure unambiguous demarcation of functions and activities; and (iii) to effect, where the span of control will permit, mergers and groupings that will lead to reduced overlap, higher output or lower costs;  (f) to establish an appropriate scale of fees in respect of training courses and consultancy work undertaken for public and private enterprises, and to reduce or waive the fees in any particular case, as may be considered appropriate;  (g) to carry on all activities the carrying on of which appears to be necessary, advantageous or convenient for the proper discharge of its functions;  (h) to carry on any such activities in association with other bodies or persons including Government LAWS OF GUYANA 8 Cap. 39:09 Guyana Management Institute  L.R.O. 1/2012                          Management Training Centres.   Appointment of officers and employees of the Institute.                    authorities or as managing agents for such persons, bodies and authorities; and  (i) to do anything and to enter into any transaction (whether or not involving expenditure, borrowing, or investment of money in accordance with the provisions of this Act in that behalf, the acquisition of any property or rights, or the disposal of any property or rights) which in the opinion of the Institute is calculated to facilitate the proper discharge of its functions or is incidental or conducive thereto.",
            "description": [
                {
                    "representation": "(a)",
                    "description": "to devise and, if approved by the Minister, to implement and co-ordinate national policy in management training and development in the public sector;"
                },
                {
                    "representation": "(b)",
                    "description": "to initiate within any part of the public sector management training programmes and to restructure existing ones where necessary;"
                },
                {
                    "representation": "(c)",
                    "description": "to require, where necessary, for the purpose of ensuring consistency and relevance, the submission of public sector management training programmes for its approval; LAWS OF GUYANA Guyana Management Institute Cap. 39:09 7  L.R.O. 1/2012"
                },
                {
                    "representation": "(d)",
                    "description": "to require, where necessary, the submission of proposals for the recruitment of management consultants in the public sector for its approval;"
                },
                {
                    "representation": "(e)",
                    "description": "to require public sector organisations to consult it for the purpose of obtaining its recommendations"
                },
                {
                    "representation": "(i)",
                    "description": "to do anything and to enter into any transaction"
                },
                {
                    "representation": "(f)",
                    "description": "to establish an appropriate scale of fees in respect of training courses and consultancy work undertaken for public and private enterprises, and to reduce or waive the fees in any particular case, as may be considered appropriate;"
                },
                {
                    "representation": "(g)",
                    "description": "to carry on all activities the carrying on of which appears to be necessary, advantageous or convenient for the proper discharge of its functions;"
                },
                {
                    "representation": "(h)",
                    "description": "to carry on any such activities in association with other bodies or persons including Government LAWS OF GUYANA 8 Cap. 39:09 Guyana Management Institute  L.R.O. 1/2012                          Management Training Centres.   Appointment of officers and employees of the Institute.                    authorities or as managing agents for such persons, bodies and authorities; and"
                }
            ]
        }
    },
    {
        "act": "GUYANA MANAGEMENT INSTITUTE ACT",
        "source": "https://mola.gov.gy/laws-of-guyana",
        "type": {
            "name": "section",
            "representation": "7",
            "title": "Management Training Centres. ",
            "context": "GUYANA MANAGEMENT INSTITUTE ACT under Management Training Centres. 7. The Board may designate buildings to be used as Management Training Centres.",
            "description": "The Board may designate buildings to be used as Management Training Centres."
        }
    },
    {
        "act": "GUYANA MANAGEMENT INSTITUTE ACT",
        "source": "https://mola.gov.gy/laws-of-guyana",
        "type": {
            "name": "section",
            "representation": "8",
            "title": "Appointment of officers and employees of the Institute. ",
            "context": "GUYANA MANAGEMENT INSTITUTE ACT under Appointment of officers and employees of the Institute. 8. (l) The Board may employ at such remuneration and on such other terms and conditions as it thinks fit (including the payment of pensions, gratuities or other like benefits by reference to the service of its officers and other employees) a Director of the Institute, a Secretary, such officers and employees as it considers necessary for the purpose of carrying out the functions of the Institute:  Provided that   (a) no salary in excess of such amount as may be specified in directions issued by the Minister shall be assigned to any office without the prior approval of the Minister;  (b) no appointment shall be made to any office to which a salary in excess of LAWS OF GUYANA Guyana Management Institute Cap. 39:09 9  L.R.O. 1/2012                              Secondment or transfer of employees of the Institute. c. 27:02                     c. 39:05  such amount as may be specified in such directions is assigned without the prior approval of the Minister;  (c) no provisions shall be made for the payment of any pensions, gratuities or other like benefits to the officers and other employees of the Institute by reference to their service, without the approval of the Minister.  (2) The Director shall be the chief executive officer of the Institute and, subject to any general or special directions of the Board, shall be responsible for the execution of the policy of the Institute and answerable therefor to the Board.  (3) The Board may, at any time, retain the services of experts and other professional persons and may pay such remuneration in respect thereof as the Board, with the approval of the Minister, may determine.",
            "description": [
                {
                    "representation": "(l)",
                    "description": "The Board may employ at such remuneration and on such other terms and conditions as it thinks fit"
                },
                {
                    "representation": "(a)",
                    "description": "no salary in excess of such amount as may be specified in directions issued by the Minister shall be assigned to any office without the prior approval of the Minister;"
                },
                {
                    "representation": "(b)",
                    "description": "no appointment shall be made to any office to which a salary in excess of LAWS OF GUYANA Guyana Management Institute Cap. 39:09 9  L.R.O. 1/2012                              Secondment or transfer of employees of the Institute. c. 27:02                     c. 39:05  such amount as may be specified in such directions is assigned without the prior approval of the Minister;"
                },
                {
                    "representation": "(c)",
                    "description": "no provisions shall be made for the payment of any pensions, gratuities or other like benefits to the officers and other employees of the Institute by reference to their service, without the approval of the Minister."
                },
                {
                    "representation": "(2)",
                    "description": "The Director shall be the chief executive officer of the Institute and, subject to any general or special directions of the Board, shall be responsible for the execution of the policy of the Institute and answerable therefor to the Board."
                },
                {
                    "representation": "(3)",
                    "description": "The Board may, at any time, retain the services of experts and other professional persons and may pay such remuneration in respect thereof as the Board, with the approval of the Minister, may determine."
                }
            ]
        }
    },
    {
        "act": "GUYANA MANAGEMENT INSTITUTE ACT",
        "source": "https://mola.gov.gy/laws-of-guyana",
        "type": {
            "name": "section",
            "representation": "9",
            "title": "Secondment or transfer of employees of the Institute. ",
            "context": "GUYANA MANAGEMENT INSTITUTE ACT under Secondment or transfer of employees of the Institute. 9. (1) Where a public officer is seconded or temporarily transferred from a pensionable office within the meaning of the Pensions Act to an office with the Institute section 5 of that Act shall apply to him as if his service with the Institute were service in a public office.  (2) Where a public officer is appointed to an office with the Institute, his service with the Institute shall be other public service within the meaning of, and for the purpose of such provisions applicable in relation thereto as are contained in, the Pensions Act (including the Pensions Regulations 1957).  (3) Subsections (1) and (2) shall, as they apply in relation to a public officer, apply mutatis mutandis in relation to a teacher to whom the Teachers Pensions Act applies and LAWS OF GUYANA 10 Cap. 39:09 Guyana Management Institute  L.R.O. 1/2012    Funds and resources of the Institute.                                Application of revenue.           who is employed by the Institute.",
            "description": [
                {
                    "representation": "(1)",
                    "description": "and"
                },
                {
                    "representation": "(2)",
                    "description": "shall, as they apply in relation to a public officer, apply mutatis mutandis in relation to a teacher to whom the Teachers Pensions Act applies and LAWS OF GUYANA 10 Cap. 39:09 Guyana Management Institute  L.R.O. 1/2012    Funds and resources of the Institute.                                Application of revenue.           who is employed by the Institute."
                },
                {
                    "representation": "(3)",
                    "description": "Subsections"
                }
            ]
        }
    },
    {
        "act": "GUYANA MANAGEMENT INSTITUTE ACT",
        "source": "https://mola.gov.gy/laws-of-guyana",
        "type": {
            "name": "section",
            "representation": "10",
            "title": "Funds and resources of the Institute. ",
            "context": "GUYANA MANAGEMENT INSTITUTE ACT under Funds and resources of the Institute. 10. The funds of the Institute shall consist of  (a) such moneys as may from time to time be voted by Parliament for the purposes of this Act;  (b) moneys paid to the Institute by way of fees for training or consultancy activities, and from sale of publications;  (c) sums earned or arising from any property, investments, mortgages or debentures acquired by or vested in the Institute;  (d) sums borrowed by the Institute for the purpose of meeting any of its obligations or discharging any of its functions; and  (e) all other sums or property that may in any manner become payable to or vested in the Institute in respect of any matter incidental to its powers and duties.",
            "description": [
                {
                    "representation": "(a)",
                    "description": "such moneys as may from time to time be voted by Parliament for the purposes of this Act;"
                },
                {
                    "representation": "(b)",
                    "description": "moneys paid to the Institute by way of fees for training or consultancy activities, and from sale of publications;"
                },
                {
                    "representation": "(c)",
                    "description": "sums earned or arising from any property, investments, mortgages or debentures acquired by or vested in the Institute;"
                },
                {
                    "representation": "(d)",
                    "description": "sums borrowed by the Institute for the purpose of meeting any of its obligations or discharging any of its functions; and"
                },
                {
                    "representation": "(e)",
                    "description": "all other sums or property that may in any manner become payable to or vested in the Institute in respect of any matter incidental to its powers and duties."
                }
            ]
        }
    },
    {
        "act": "GUYANA MANAGEMENT INSTITUTE ACT",
        "source": "https://mola.gov.gy/laws-of-guyana",
        "type": {
            "name": "section",
            "representation": "11",
            "title": "Application of revenue. ",
            "context": "GUYANA MANAGEMENT INSTITUTE ACT under Application of revenue. 11. (1) The revenue of the Institute for any financial year shall be applied in defraying the following charges  (a) the remuneration, fees and allowances of the members or of any committee of the Institute;   (b) the salaries, fees, remuneration and gratuities (including payments for the LAWS OF GUYANA Guyana Management Institute Cap. 39:09 11  L.R.O. 1/2012                                                 maintenance of any pension scheme) of the officers and employees and technical and other advisers of the Institute;  (c) working operations and establishment expenses and expenditure, on or provision for, the maintenance of the property of the Institute, and the insurance of the same and the discharge of the functions of the Institute properly chargeable to revenue account;  (d) interest on any debenture and debenture stock or other security issued, and on any loan raised by the Institute;  (e) sums required to be transferred to a sinking fund or otherwise set aside for the purpose of making provision for the redemption of debentures or debenture stock or other security or the payment of other borrowed money;  (f) such sums as it may be deemed appropriate to set aside in respect of depreciation on any property of the Institute having regard to the amount set aside out of the revenue under paragraph (e); and  (g) any other expenditure authorised by the Board and properly chargeable to revenue account.  LAWS OF GUYANA 12 Cap. 39:09 Guyana Management Institute  L.R.O. 1/2012             Authorised investments.           Borrowing powers of the Institute.        Guarantee by the Minister responsible for finance of borrowing by the Institute and repayment of sums paid to meet guarantees.                        (2) The balance of the revenue of the Institute shall be applied to the creation of reserve funds to finance future development and to such other purposes as the Minister may approve.",
            "description": [
                {
                    "representation": "(1)",
                    "description": "The revenue of the Institute for any financial year shall be applied in defraying the following charges"
                },
                {
                    "representation": "(a)",
                    "description": "the remuneration, fees and allowances of the members or of any committee of the Institute;"
                },
                {
                    "representation": "(b)",
                    "description": "the salaries, fees, remuneration and gratuities"
                },
                {
                    "representation": "(c)",
                    "description": "working operations and establishment expenses and expenditure, on or provision for, the maintenance of the property of the Institute, and the insurance of the same and the discharge of the functions of the Institute properly chargeable to revenue account;"
                },
                {
                    "representation": "(d)",
                    "description": "interest on any debenture and debenture stock or other security issued, and on any loan raised by the Institute;"
                },
                {
                    "representation": "(e)",
                    "description": "sums required to be transferred to a sinking fund or otherwise set aside for the purpose of making provision for the redemption of debentures or debenture stock or other security or the payment of other borrowed money;"
                },
                {
                    "representation": "(f)",
                    "description": "such sums as it may be deemed appropriate to set aside in respect of depreciation on any property of the Institute having regard to the amount set aside out of the revenue under paragraph"
                },
                {
                    "representation": "(g)",
                    "description": "any other expenditure authorised by the Board and properly chargeable to revenue account.  LAWS OF GUYANA 12 Cap. 39:09 Guyana Management Institute  L.R.O. 1/2012             Authorised investments.           Borrowing powers of the Institute.        Guarantee by the Minister responsible for finance of borrowing by the Institute and repayment of sums paid to meet guarantees."
                },
                {
                    "representation": "(2)",
                    "description": "The balance of the revenue of the Institute shall be applied to the creation of reserve funds to finance future development and to such other purposes as the Minister may approve."
                }
            ]
        }
    },
    {
        "act": "GUYANA MANAGEMENT INSTITUTE ACT",
        "source": "https://mola.gov.gy/laws-of-guyana",
        "type": {
            "name": "section",
            "representation": "12",
            "title": "Authorised investments. ",
            "context": "GUYANA MANAGEMENT INSTITUTE ACT under Authorised investments. 12. Funds of the Institute not immediately required to be expended in the meeting of any obligations or the discharge of any functions of the Institute may be invested from time to time in securities approved by the Minister for investment by the Institute.",
            "description": "Funds of the Institute not immediately required to be expended in the meeting of any obligations or the discharge of any functions of the Institute may be invested from time to time in securities approved by the Minister for investment by the Institute."
        }
    },
    {
        "act": "GUYANA MANAGEMENT INSTITUTE ACT",
        "source": "https://mola.gov.gy/laws-of-guyana",
        "type": {
            "name": "section",
            "representation": "13",
            "title": "Borrowing powers of the Institute. ",
            "context": "GUYANA MANAGEMENT INSTITUTE ACT under Borrowing powers of the Institute. 13. The Institute may, with the approval of the Minister responsible for finance, borrow any moneys required by it for meeting any of its obligations or discharging any of its functions.",
            "description": "The Institute may, with the approval of the Minister responsible for finance, borrow any moneys required by it for meeting any of its obligations or discharging any of its functions."
        }
    },
    {
        "act": "GUYANA MANAGEMENT INSTITUTE ACT",
        "source": "https://mola.gov.gy/laws-of-guyana",
        "type": {
            "name": "section",
            "representation": "14",
            "title": "Guarantee by the Minister responsible for finance of borrowing by the Institute and repayment of sums paid to meet guarantees. ",
            "context": "GUYANA MANAGEMENT INSTITUTE ACT under Guarantee by the Minister responsible for finance of borrowing by the Institute and repayment of sums paid to meet guarantees. 14. (1) With the approval of the National Assembly, the Minister responsible for finance may guarantee, in such manner and on such conditions as he may think fit, the payment of the principal and interest on any authorised borrowings of the Institute.   (2) Where the Minister responsible for finance is satisfied that there has been default in the repayment of any principal moneys or interest guaranteed under this section, he shall direct the repayment out of the revenues of Guyana of the amount in respect of which there has been such default.  (3) The Institute shall make to the Accountant General, at such time and in such manner as the Minister responsible for finance may direct, payments of such amounts as may be so directed in or towards repayment of any such sum issued in fulfilment of any guarantee given under this section, and payments of interest on what is outstanding for the time being in respect of any sums so issued at such rate as the Minister responsible for  finance may direct, and different rates of interest may be directed as  respects different sums and as respects interest for different periods. LAWS OF GUYANA Guyana Management Institute Cap. 39:09 13  L.R.O. 1/2012 Accounts and audit. [6 of 1997]",
            "description": [
                {
                    "representation": "(1)",
                    "description": "With the approval of the National Assembly, the Minister responsible for finance may guarantee, in such manner and on such conditions as he may think fit, the payment of the principal and interest on any authorised borrowings of the Institute."
                },
                {
                    "representation": "(2)",
                    "description": "Where the Minister responsible for finance is satisfied that there has been default in the repayment of any principal moneys or interest guaranteed under this section, he shall direct the repayment out of the revenues of Guyana of the amount in respect of which there has been such default."
                },
                {
                    "representation": "(3)",
                    "description": "The Institute shall make to the Accountant General, at such time and in such manner as the Minister responsible for finance may direct, payments of such amounts as may be so directed in or towards repayment of any such sum issued in fulfilment of any guarantee given under this section, and payments of interest on what is outstanding for the time being in respect of any sums so issued at such rate as the Minister responsible for  finance may direct, and different rates of interest may be directed as  respects different sums and as respects interest for different periods. LAWS OF GUYANA Guyana Management Institute Cap. 39:09 13  L.R.O. 1/2012 Accounts and audit. [6 of 1997]"
                }
            ]
        }
    },
    {
        "act": "GUYANA MANAGEMENT INSTITUTE ACT",
        "source": "https://mola.gov.gy/laws-of-guyana",
        "type": {
            "name": "section",
            "representation": "15",
            "title": "Accounts and audit. ",
            "context": "GUYANA MANAGEMENT INSTITUTE ACT under Accounts and audit. 15. (1) The Institute shall keep accounts of its transactions to the satisfaction of the Minister and such accounts shall be audited annually by an auditor appointed by the Minister.  (2) The Minister may, at any time, appoint an auditor to examine the accounts of the Institute and to report thereon to the Minister.  (3) The members, officers and other employees of the Institute shall grant to the auditor appointed to audit the accounts of the Institute under subsection (1) or (2) access to all books, documents, cash and securities of the Institute and shall give to him on request such information as may be within their knowledge in relation to the operations of the Institute.  (4) An auditor appointed under this section shall have power to summon and examine all persons whom he shall think fit to examine for the purpose of obtaining information in connection with the examination and audit of the accounts of the Institute and respecting all other matters and things whatever necessary for the due performance of the functions vested in him; and if any person summoned as aforesaid is not a public officer or an officer or other employee of the Institute he shall be entitled to payment for his attendance as if he were a witness attending a legal proceeding in obedience to a summons issued at the instance of the State.  (5) Any person summoned under subsection (4) who, without reasonable excuse, makes default in obeying the summons is liable on summary conviction to a fine of two thousand seven hundred and fifty dollars, or, in default of payment, to imprisonment for one month.  (6) The Institute may write off bad debts.   LAWS OF GUYANA 14 Cap. 39:09 Guyana Management Institute  L.R.O. 1/2012 Exemption from taxes, and duties.       Power of the Minister to give directions to the Institute.                   Annual Report.                   Regulations.",
            "description": [
                {
                    "representation": "(1)",
                    "description": "or"
                },
                {
                    "representation": "(2)",
                    "description": "access to all books, documents, cash and securities of the Institute and shall give to him on request such information as may be within their knowledge in relation to the operations of the Institute."
                },
                {
                    "representation": "(3)",
                    "description": "The members, officers and other employees of the Institute shall grant to the auditor appointed to audit the accounts of the Institute under subsection"
                },
                {
                    "representation": "(4)",
                    "description": "who, without reasonable excuse, makes default in obeying the summons is liable on summary conviction to a fine of two thousand seven hundred and fifty dollars, or, in default of payment, to imprisonment for one month."
                },
                {
                    "representation": "(5)",
                    "description": "Any person summoned under subsection"
                },
                {
                    "representation": "(6)",
                    "description": "The Institute may write off bad debts.   LAWS OF GUYANA 14 Cap. 39:09 Guyana Management Institute  L.R.O. 1/2012 Exemption from taxes, and duties.       Power of the Minister to give directions to the Institute.                   Annual Report.                   Regulations."
                }
            ]
        }
    },
    {
        "act": "GUYANA MANAGEMENT INSTITUTE ACT",
        "source": "https://mola.gov.gy/laws-of-guyana",
        "type": {
            "name": "section",
            "representation": "16",
            "title": "Exemption from taxes and duties. ",
            "context": "GUYANA MANAGEMENT INSTITUTE ACT under Exemption from taxes and duties. 16. The Institute shall be exempt from the payment of customs duty, capital gains tax, corporation tax, income tax, property tax and purchase tax.",
            "description": "The Institute shall be exempt from the payment of customs duty, capital gains tax, corporation tax, income tax, property tax and purchase tax."
        }
    },
    {
        "act": "GUYANA MANAGEMENT INSTITUTE ACT",
        "source": "https://mola.gov.gy/laws-of-guyana",
        "type": {
            "name": "section",
            "representation": "17",
            "title": "Power of the Minister to give directions to the Institute. ",
            "context": "GUYANA MANAGEMENT INSTITUTE ACT under Power of the Minister to give directions to the Institute. 17. (1) The Minister may give to the Institute directions of a general character as to the policy to be followed by the Institute in the performance of its functions and the Institute shall give effect to those directions.  (2) The  Institute shall afford to the Minister information requested by him with respect to the functioning of the Institute and shall furnish him with annual estimates, and such returns and reports as he may require.  (3) The Institute shall provide the Minister with such facilities as will enable him to verify the information furnished in pursuance of this section.",
            "description": [
                {
                    "representation": "(1)",
                    "description": "The Minister may give to the Institute directions of a general character as to the policy to be followed by the Institute in the performance of its functions and the Institute shall give effect to those directions."
                },
                {
                    "representation": "(2)",
                    "description": "The  Institute shall afford to the Minister information requested by him with respect to the functioning of the Institute and shall furnish him with annual estimates, and such returns and reports as he may require."
                },
                {
                    "representation": "(3)",
                    "description": "The Institute shall provide the Minister with such facilities as will enable him to verify the information furnished in pursuance of this section."
                }
            ]
        }
    },
    {
        "act": "GUYANA MANAGEMENT INSTITUTE ACT",
        "source": "https://mola.gov.gy/laws-of-guyana",
        "type": {
            "name": "section",
            "representation": "18",
            "title": "Annual Report. ",
            "context": "GUYANA MANAGEMENT INSTITUTE ACT under Annual Report. 18. (1) The Board shall as soon as practicable after the end of each financial year of the Institute make and transmit to the Minister a report dealing generally with the activities  of the Institute during the preceding financial year and containing such information relating to the operations and policy of the Institute as the Minister may from time to time direct.  (2) The Minister shall cause a copy of every such report to be laid on the table of the National Assembly.  l9. The Board may, with the approval of the Minister, make regulations which, in the opinion of the Institute, are necessary or expedient for the carrying into effect of the purposes of this Act.  _________________    LAWS OF GUYANA Guyana Management Institute Cap. 39:09 15  L.R.O. 1/2012 s. 4   Constitution of the Board.                                              Gazetting of appointment. SCHEDULE  l. (1) The Board shall consist of (a) the Director;  (b) one person appointed by the Minister after he has consulted such organisation or other body of persons as in his opinion is most representative of workers;  (c) one person appointed by the Minister after he has consulted such organisation or other body of persons as in his opinion is most representative of employers; and  (d) not less than six nor more than twelve persons appointed by the Minister from among such persons as, in his opinion, are qualified for appointment by reason of their experience of, and capacity in, matters relating to the functions of the Institute or matters which will be advantageous to the Institute in the performance of its functions.  (2) The Chairman of the Board shall be appointed by the Minister from among the members.  (3) A member, not being the Director or a person in the service of the State, may at any time resign his membership by instrument in writing addressed to the Minister.",
            "description": [
                {
                    "representation": "(1)",
                    "description": "The Board shall consist of"
                },
                {
                    "representation": "(2)",
                    "description": "The Chairman of the Board shall be appointed by the Minister from among the members."
                },
                {
                    "representation": "(a)",
                    "description": "the Director;"
                },
                {
                    "representation": "(b)",
                    "description": "one person appointed by the Minister after he has consulted such organisation or other body of persons as in his opinion is most representative of workers;"
                },
                {
                    "representation": "(c)",
                    "description": "one person appointed by the Minister after he has consulted such organisation or other body of persons as in his opinion is most representative of employers; and"
                },
                {
                    "representation": "(d)",
                    "description": "not less than six nor more than twelve persons appointed by the Minister from among such persons as, in his opinion, are qualified for appointment by reason of their experience of, and capacity in, matters relating to the functions of the Institute or matters which will be advantageous to the Institute in the performance of its functions."
                },
                {
                    "representation": "(3)",
                    "description": "A member, not being the Director or a person in the service of the State, may at any time resign his membership by instrument in writing addressed to the Minister."
                }
            ]
        }
    }
]