[
    {
        "act": "NATIONAL ARCHIVES OF GUYANA ACT",
        "source": "https://mola.gov.gy/laws-of-guyana",
        "type": {
            "name": "section",
            "representation": "1",
            "title": "Short title. ",
            "context": "NATIONAL ARCHIVES OF GUYANA ACT under Short title. 1. This Act may be cited as the National Archives of Guyana Act",
            "description": "This Act may be cited as the National Archives of Guyana Act"
        }
    },
    {
        "act": "NATIONAL ARCHIVES OF GUYANA ACT",
        "source": "https://mola.gov.gy/laws-of-guyana",
        "type": {
            "name": "section",
            "representation": "2",
            "title": "Interpretation. ",
            "context": "NATIONAL ARCHIVES OF GUYANA ACT under Interpretation. 2.  In this Act  authorised  officer  means  an  officer  of  the  National  Archives authorised in writing by the Archivist to perform functions under the Act;  Committee means the Advisory Committee appointed by the Minister under section 5;  judicial records means any records of proceedings before a court, tribunal, commission, board of inquiry or other judicial or quasi- judicial body or person which  (a) are in the custody of  (i)  such court, tribunal, commission, board, body or person; (ii)  any Ministry, department or public office; or (iii)  any person lawfully committed with such custody; or  (b)  stand  transferred  or  have  been  transferred  to  the National Archives by or LAWS OF GUYANA National Archives of Guyana Cap. 40:03 5  L.R.O. 1/2012                                                 under this Act;  National  Archives  means  the  National  Archives  of  Guyana established by section 3;  public archives means  (a) all public records which  (i)  are specified by the Archivist as being of enduring or historical value; and (ii)  stand transferred or have been transferred to the National Archives by or under this Act;  (b)  any records acquired by the Archivist or deposited with the National Archives under sections 14 and 15;  public office means any office, institution or agency financed from public funds and under the responsibility of a Minister and includes a local government office, a public corporation and a corporate body in which the controlling interest is vested in the State or in any agency on behalf of the State;  public records means  (a)  any records of the Government or of a public office which   (i)  are in the custody of the Government or the public office; or (ii)  stand transferred or have been transferred to the National Archives by or under this Act;  (b)  any judicial record; LAWS OF GUYANA 6 Cap. 40:03 National Archives of Guyana  L.R.O. 1/2012                Establishment of the National Archives of Guyana.       Archivist and his functions.                     C. 21:01  records  includes  any  manuscript,  newspaper,  picture,  painting, document, register, printed material, book, map, plan, drawing, photograph, negative and positive pictures, photocopy, microfilm, cinematograph film, video tape, magnetic tape, gramophone record or other transcription of language, picture or music recorded by any means capable of reproduction and regardless of physical form and characteristics.",
            "description": [
                {
                    "representation": "(a)",
                    "description": "any records of the Government or of a public office which"
                },
                {
                    "representation": "(i)",
                    "description": "are in the custody of the Government or the public office; or"
                },
                {
                    "representation": "(b)",
                    "description": "any judicial record; LAWS OF GUYANA 6 Cap. 40:03 National Archives of Guyana  L.R.O. 1/2012                Establishment of the National Archives of Guyana.       Archivist and his functions.                     C. 21:01  records  includes  any  manuscript,  newspaper,  picture,  painting, document, register, printed material, book, map, plan, drawing, photograph, negative and positive pictures, photocopy, microfilm, cinematograph film, video tape, magnetic tape, gramophone record or other transcription of language, picture or music recorded by any means capable of reproduction and regardless of physical form and characteristics."
                }
            ]
        }
    },
    {
        "act": "NATIONAL ARCHIVES OF GUYANA ACT",
        "source": "https://mola.gov.gy/laws-of-guyana",
        "type": {
            "name": "section",
            "representation": "3",
            "title": "Establishment of the National Archives of Guyana. ",
            "context": "NATIONAL ARCHIVES OF GUYANA ACT under Establishment of the National Archives of Guyana. 3. (1) The National Archives of Guyana is hereby established as a department and shall consist of the Archivist and such other persons as may be requisite for the purpose of carrying out the provisions of this Act.  (2) The National Archives shall be the place of deposit for the storage and preservation of public archives.",
            "description": [
                {
                    "representation": "(1)",
                    "description": "The National Archives of Guyana is hereby established as a department and shall consist of the Archivist and such other persons as may be requisite for the purpose of carrying out the provisions of this Act."
                },
                {
                    "representation": "(2)",
                    "description": "The National Archives shall be the place of deposit for the storage and preservation of public archives."
                }
            ]
        }
    },
    {
        "act": "NATIONAL ARCHIVES OF GUYANA ACT",
        "source": "https://mola.gov.gy/laws-of-guyana",
        "type": {
            "name": "section",
            "representation": "4",
            "title": "Archivist and his functions. ",
            "context": "NATIONAL ARCHIVES OF GUYANA ACT under Archivist and his functions. 4.  (1) The Archivist shall, subject to such directions as may be given by the Minister, be the principal administrative officer in charge of the National Archives and shall be the custodian of the public archives.  (2) Subject to such directions as may be given by the Minister the Archivist shall  (a)  direct, manage and control the National Archives;  (b)  preserve,  describe,  classify  and  arrange  all  public archives;  (c)  exercise, perform and discharge any power, duty or function conferred or imposed upon the Archivist by or under the Publication and Newspapers Act, any other written law, or any other provisions of this Act. LAWS OF GUYANA National Archives of Guyana Cap. 40:03 7  L.R.O. 1/2012                                                  (3) In particular and without prejudice to the generality of subsection (2) the Archivist may  (a)  subject to section 16, reproduce or publish or cause to be reproduced or published such public archives as he may deem fit;  (b)  lend, with the consent of the Minister, any public archives  for  display  at  commemorative,  trade,  art  or international exhibitions or for any other special purpose approved by the Minister subject to such conditions as the Minister may impose with respect to such loan;  (c)  promote the advancement of historical and cultural knowledge by drawing up lists of public archives and undertaking historical and archival research, by publishing indices and guides to public archives, by opening to inspection public archives, and by organising exhibitions;  (d)  promote the national advancement by ensuring that Government  officials  and  the  general  public  are  kept constantly supplied with information which is of benefit to the cause of national progress;  (e)  apply  modern  records  management  principles  and techniques to reduce the quantity and improve the quality of records, with particular attention to correspondence, reports, directives and to office equipment and supplies;  (f)  establish and run an oral archives programme; LAWS OF GUYANA 8 Cap. 40:03 National Archives of Guyana  L.R.O. 1/2012                                                  (g)  give advice on all questions of a general nature regarding public archives;  (h)  decide all matters relating to the purchase, transfer, loan and exchange of records and authorise the destruction of records in the custody of the National Archives; (i)   with respect to public records, inspect them and assess all proposals to destroy or remove material from ownership of the State and to ensure the transfer to the National Archives of such records as are required for deposit therein;  (j)   plan and publish periodically publications on public archives, monographs, calendars and collection of records;  (k)  exercise his right to recover records;  (l)   ensure the restitution to the National Archives of public records in the possession of unauthorised persons;  (m)  verify and declare the major historical interest of records owned, possessed or held by private bodies and individuals and encourage their voluntary deposit in the National Archives;  (n)  make arrangements for the general and professional training of the staff of the National Archives in such manner as may be prescribed; and  (o)  establish links with national institutions devoted to similar objectives and co-operate in the organisation and operation of a LAWS OF GUYANA National Archives of Guyana Cap. 40:03 9  L.R.O. 1/2012   Advisory Committee.                            Seal.            Secrecy. [ 6 of 1997]       national information system.",
            "description": [
                {
                    "representation": "(1)",
                    "description": "The Archivist shall, subject to such directions as may be given by the Minister, be the principal administrative officer in charge of the National Archives and shall be the custodian of the public archives."
                },
                {
                    "representation": "(2)",
                    "description": "the Archivist may"
                },
                {
                    "representation": "(a)",
                    "description": "subject to section 16, reproduce or publish or cause to be reproduced or published such public archives as he may deem fit;"
                },
                {
                    "representation": "(b)",
                    "description": "lend, with the consent of the Minister, any public archives  for  display  at  commemorative,  trade,  art  or international exhibitions or for any other special purpose approved by the Minister subject to such conditions as the Minister may impose with respect to such loan;"
                },
                {
                    "representation": "(c)",
                    "description": "promote the advancement of historical and cultural knowledge by drawing up lists of public archives and undertaking historical and archival research, by publishing indices and guides to public archives, by opening to inspection public archives, and by organising exhibitions;"
                },
                {
                    "representation": "(3)",
                    "description": "In particular and without prejudice to the generality of subsection"
                },
                {
                    "representation": "(d)",
                    "description": "promote the national advancement by ensuring that Government  officials  and  the  general  public  are  kept constantly supplied with information which is of benefit to the cause of national progress;"
                },
                {
                    "representation": "(e)",
                    "description": "apply  modern  records  management  principles  and techniques to reduce the quantity and improve the quality of records, with particular attention to correspondence, reports, directives and to office equipment and supplies;"
                },
                {
                    "representation": "(f)",
                    "description": "establish and run an oral archives programme; LAWS OF GUYANA 8 Cap. 40:03 National Archives of Guyana  L.R.O. 1/2012"
                },
                {
                    "representation": "(g)",
                    "description": "give advice on all questions of a general nature regarding public archives;"
                },
                {
                    "representation": "(h)",
                    "description": "decide all matters relating to the purchase, transfer, loan and exchange of records and authorise the destruction of records in the custody of the National Archives;"
                },
                {
                    "representation": "(i)",
                    "description": "with respect to public records, inspect them and assess all proposals to destroy or remove material from ownership of the State and to ensure the transfer to the National Archives of such records as are required for deposit therein;"
                },
                {
                    "representation": "(j)",
                    "description": "plan and publish periodically publications on public archives, monographs, calendars and collection of records;"
                },
                {
                    "representation": "(k)",
                    "description": "exercise his right to recover records;"
                },
                {
                    "representation": "(l)",
                    "description": "ensure the restitution to the National Archives of public records in the possession of unauthorised persons;"
                },
                {
                    "representation": "(m)",
                    "description": "verify and declare the major historical interest of records owned, possessed or held by private bodies and individuals and encourage their voluntary deposit in the National Archives;"
                },
                {
                    "representation": "(n)",
                    "description": "make arrangements for the general and professional training of the staff of the National Archives in such manner as may be prescribed; and"
                },
                {
                    "representation": "(o)",
                    "description": "establish links with national institutions devoted to similar objectives and co-operate in the organisation and operation of a LAWS OF GUYANA National Archives of Guyana Cap. 40:03 9  L.R.O. 1/2012   Advisory Committee.                            Seal.            Secrecy. [ 6 of 1997]       national information system."
                }
            ]
        }
    },
    {
        "act": "NATIONAL ARCHIVES OF GUYANA ACT",
        "source": "https://mola.gov.gy/laws-of-guyana",
        "type": {
            "name": "section",
            "representation": "5",
            "title": "Advisory Committee. ",
            "context": "NATIONAL ARCHIVES OF GUYANA ACT under Advisory Committee. 5.  (1) There shall be appointed by the Minister by instrument in writing, from amongst persons appearing to the Minister to be qualified and experienced in matters   relating to the identification, custody, preservation and exploitation  of public archives and records, an Advisory Committee consisting of not less than nine nor more than twelve members who shall hold office for two years from the date of appointment.  (2) The Committee shall advise the Minister on matters of general archival policy and review the work and progress of the National Archives.  (3) The Archivist or his nominee shall be the Chairman of the Committee which shall meet half yearly.  (4) The Committee may regulate its own procedure.  (5) There shall be paid to the members of the Committee such remuneration, if any, (whether by way of travelling or other allowances) as the Minister may determine.",
            "description": [
                {
                    "representation": "(1)",
                    "description": "There shall be appointed by the Minister by instrument in writing, from amongst persons appearing to the Minister to be qualified and experienced in matters   relating to the identification, custody, preservation and exploitation  of public archives and records, an Advisory Committee consisting of not less than nine nor more than twelve members who shall hold office for two years from the date of appointment."
                },
                {
                    "representation": "(2)",
                    "description": "The Committee shall advise the Minister on matters of general archival policy and review the work and progress of the National Archives."
                },
                {
                    "representation": "(3)",
                    "description": "The Archivist or his nominee shall be the Chairman of the Committee which shall meet half yearly."
                },
                {
                    "representation": "(4)",
                    "description": "The Committee may regulate its own procedure."
                },
                {
                    "representation": "(5)",
                    "description": "There shall be paid to the members of the Committee such remuneration, if any,"
                }
            ]
        }
    },
    {
        "act": "NATIONAL ARCHIVES OF GUYANA ACT",
        "source": "https://mola.gov.gy/laws-of-guyana",
        "type": {
            "name": "section",
            "representation": "6",
            "title": "Seal. ",
            "context": "NATIONAL ARCHIVES OF GUYANA ACT under Seal. 6. (1) There shall be an official seal of the National Archives of a design approved by the Minister.       (2) The seal of the National Archives shall be kept in the custody of the Archivist and may be used for the purposes of the National Archives.     (3) The official seal shall be judicially noticed.",
            "description": [
                {
                    "representation": "(1)",
                    "description": "There shall be an official seal of the National Archives of a design approved by the Minister."
                },
                {
                    "representation": "(2)",
                    "description": "The seal of the National Archives shall be kept in the custody of the Archivist and may be used for the purposes of the National Archives."
                },
                {
                    "representation": "(3)",
                    "description": "The official seal shall be judicially noticed."
                }
            ]
        }
    },
    {
        "act": "NATIONAL ARCHIVES OF GUYANA ACT",
        "source": "https://mola.gov.gy/laws-of-guyana",
        "type": {
            "name": "section",
            "representation": "7",
            "title": "Secrecy.    ",
            "context": "NATIONAL ARCHIVES OF GUYANA ACT under Secrecy.    7.  (1) Every person appointed or employed for the purpose of carrying out the provisions of this Act shall regard and deal with all public records which are secret or confidential or to which access may be restricted as secret.  (2) Every person who is appointed or employed for LAWS OF GUYANA 10 Cap. 40:03 National Archives of Guyana  L.R.O. 1/2012                Records in the custody of the Archivist before the       commencement of this Act.   Selection, preservation and transfer to the National Archives of       public records.                    the purpose of carrying out the provisions of this Act shall make and subscribe before a magistrate a declaration of secrecy in the prescribed form.  (3) Any person who in contravention of the declaration of secrecy made by him under subsection (2) discloses to any unauthorised person any information contained in any public record referred to in subsection (1) or permits any unauthorised person to have access to any such record shall be liable on summary conviction to a fine of fifty-five thousand dollars.",
            "description": [
                {
                    "representation": "(1)",
                    "description": "or permits any unauthorised person to have access to any such record shall be liable on summary conviction to a fine of fifty-five thousand dollars."
                },
                {
                    "representation": "(2)",
                    "description": "discloses to any unauthorised person any information contained in any public record referred to in subsection"
                },
                {
                    "representation": "(3)",
                    "description": "Any person who in contravention of the declaration of secrecy made by him under subsection"
                }
            ]
        }
    },
    {
        "act": "NATIONAL ARCHIVES OF GUYANA ACT",
        "source": "https://mola.gov.gy/laws-of-guyana",
        "type": {
            "name": "section",
            "representation": "8",
            "title": "Records in the custody of the Archivist before the        commencement of this Act. ",
            "context": "NATIONAL ARCHIVES OF GUYANA ACT under Records in the custody of the Archivist before the        commencement of this Act. 8. All records in the custody of the Archivist immediately before the commencement of this Act shall on the commencement of this Act stand transferred to the National Archives.",
            "description": "All records in the custody of the Archivist immediately before the commencement of this Act shall on the commencement of this Act stand transferred to the National Archives."
        }
    },
    {
        "act": "NATIONAL ARCHIVES OF GUYANA ACT",
        "source": "https://mola.gov.gy/laws-of-guyana",
        "type": {
            "name": "section",
            "representation": "9",
            "title": "Selection, preservation and transfer to the National Archives of       public records. ",
            "context": "NATIONAL ARCHIVES OF GUYANA ACT under Selection, preservation and transfer to the National Archives of       public records. 9.  (1) The Archivist or any authorised officer may examine public records which have not been transferred to the National Archives and select those which in his opinion should be preserved and transferred thereto.  (2) The Archivist or any authorised officer shall not, without the permission of the relevant permanent secretary or the relevant head of any public office, as the case may be, examine any public records when such records are classified as secret or confidential.  (3) Every person responsible for having the custody of public records which have not been transferred to the National Archives shall  (a)  afford   the   Archivist   or   any   authorised   officer appropriate facilities for examination and selection under subsection (1); and  (b)  provide for  safekeeping  in  accordance  with  any regulations made under this Act LAWS OF GUYANA National Archives of Guyana Cap. 40:03 11  L.R.O. 1/2012                             Destruction of public archives and public records. [ 6 of 1997]                or the directions of the Archivist, of such public records as are selected for deposit and  preservation in the National Archives pending their transfer to and deposit therein.  (4) Public  records  selected  under  subsection  (1)  shall  be transferred to the National Archives:  Provided that with the approval of the Minister, the transfer may be withheld for the time being if in the opinion of the person having the custody  thereof  the  said  records  are  required  for  administrative purposes or ought to be detained for any other special reason and appropriate provision will be made for the preservation of such records.  (5) In this section and section 10 relevant  permanent secretary and relevant head of public office mean the permanent secretary or head of public office having supervision over the Ministry, department or public office in charge of the public record dealt with.",
            "description": [
                {
                    "representation": "(1)",
                    "description": "shall  be transferred to the National Archives:  Provided that with the approval of the Minister, the transfer may be withheld for the time being if in the opinion of the person having the custody  thereof  the  said  records  are  required  for  administrative purposes or ought to be detained for any other special reason and appropriate provision will be made for the preservation of such records."
                },
                {
                    "representation": "(2)",
                    "description": "The Archivist or any authorised officer shall not, without the permission of the relevant permanent secretary or the relevant head of any public office, as the case may be, examine any public records when such records are classified as secret or confidential."
                },
                {
                    "representation": "(3)",
                    "description": "Every person responsible for having the custody of public records which have not been transferred to the National Archives shall"
                },
                {
                    "representation": "(a)",
                    "description": "afford   the   Archivist   or   any   authorised   officer appropriate facilities for examination and selection under subsection"
                },
                {
                    "representation": "(b)",
                    "description": "provide for  safekeeping  in  accordance  with  any regulations made under this Act LAWS OF GUYANA National Archives of Guyana Cap. 40:03 11  L.R.O. 1/2012                             Destruction of public archives and public records. [ 6 of 1997]                or the directions of the Archivist, of such public records as are selected for deposit and  preservation in the National Archives pending their transfer to and deposit therein."
                },
                {
                    "representation": "(4)",
                    "description": "Public  records  selected  under  subsection"
                },
                {
                    "representation": "(5)",
                    "description": "In this section and section 10 relevant  permanent secretary and relevant head of public office mean the permanent secretary or head of public office having supervision over the Ministry, department or public office in charge of the public record dealt with."
                }
            ]
        }
    },
    {
        "act": "NATIONAL ARCHIVES OF GUYANA ACT",
        "source": "https://mola.gov.gy/laws-of-guyana",
        "type": {
            "name": "section",
            "representation": "10",
            "title": "Destruction of public archives and public records. ",
            "context": "NATIONAL ARCHIVES OF GUYANA ACT under Destruction of public archives and public records. 10.  (1) Subject to subsection (2), no person shall destroy or otherwise dispose of, or authorise the destruction of or other disposal of, any public records in his custody except with the written permission of the Archivist.  (2) If it appears to the Archivist that any public archives or public records selected for preservation are duplicated or no longer need be preserved, the Archivist, shall authorise the destruction of such archives or records or dispose of them in any other way:  Provided that nothing in this section shall authorise the destruction of any records obtained by gift, during the lifetime of the donor without his consent.  (3) The Archivist may authorise the immediate destruction or the destruction after the expiration of such LAWS OF GUYANA 12 Cap. 40:03 National Archives of Guyana  L.R.O. 1/2012                            Inspection of public archives. [ 6 of 1997]                   specified period as may be agreed upon by the Archivist and the relevant permanent secretary or relevant head of public office of any public records that  (a)  by reason of their number, kind or routine nature do not in his opinion possess any enduring or historical value for preservation as public archives; and  (b)  are not required for reference after action is completed or after the expiration of such period of years from the date on which action on them is completed as may be agreed upon between the Archivist and such permanent secretary or head of public office.  (4) Any person who destroys or otherwise disposes or authorises the disposal of any public archives or public records in contravention of this section shall be liable on summary conviction to a fine of fifty-five thousand dollars.",
            "description": [
                {
                    "representation": "(1)",
                    "description": "Subject to subsection"
                },
                {
                    "representation": "(2)",
                    "description": "If it appears to the Archivist that any public archives or public records selected for preservation are duplicated or no longer need be preserved, the Archivist, shall authorise the destruction of such archives or records or dispose of them in any other way:  Provided that nothing in this section shall authorise the destruction of any records obtained by gift, during the lifetime of the donor without his consent."
                },
                {
                    "representation": "(3)",
                    "description": "The Archivist may authorise the immediate destruction or the destruction after the expiration of such LAWS OF GUYANA 12 Cap. 40:03 National Archives of Guyana  L.R.O. 1/2012                            Inspection of public archives. [ 6 of 1997]                   specified period as may be agreed upon by the Archivist and the relevant permanent secretary or relevant head of public office of any public records that"
                },
                {
                    "representation": "(a)",
                    "description": "by reason of their number, kind or routine nature do not in his opinion possess any enduring or historical value for preservation as public archives; and"
                },
                {
                    "representation": "(b)",
                    "description": "are not required for reference after action is completed or after the expiration of such period of years from the date on which action on them is completed as may be agreed upon between the Archivist and such permanent secretary or head of public office."
                },
                {
                    "representation": "(4)",
                    "description": "Any person who destroys or otherwise disposes or authorises the disposal of any public archives or public records in contravention of this section shall be liable on summary conviction to a fine of fifty-five thousand dollars."
                }
            ]
        }
    },
    {
        "act": "NATIONAL ARCHIVES OF GUYANA ACT",
        "source": "https://mola.gov.gy/laws-of-guyana",
        "type": {
            "name": "section",
            "representation": "11",
            "title": "Inspection of public archives. ",
            "context": "NATIONAL ARCHIVES OF GUYANA ACT under Inspection of public archives. 11. (1) Public archives may be made available for inspection by all persons thirty years after the conclusion of the matter to which they refer, with the exception of  (a)  judicial records in criminal proceedings which may be made available fifty years after the conclusion of the trial;  (b)  records concerning the private lives of individuals which may  be made available fifty years after the death of the individuals;  (c)  public records from the Ministries of Foreign Affairs and Defence which shall be subject to the special provisions of section",
            "description": [
                {
                    "representation": "(1)",
                    "description": "Public archives may be made available for inspection by all persons thirty years after the conclusion of the matter to which they refer, with the exception of"
                },
                {
                    "representation": "(a)",
                    "description": "judicial records in criminal proceedings which may be made available fifty years after the conclusion of the trial;"
                },
                {
                    "representation": "(b)",
                    "description": "records concerning the private lives of individuals which may  be made available fifty years after the death of the individuals;"
                },
                {
                    "representation": "(c)",
                    "description": "public records from the Ministries of Foreign Affairs and Defence which shall be subject to the special provisions of section"
                }
            ]
        }
    },
    {
        "act": "NATIONAL ARCHIVES OF GUYANA ACT",
        "source": "https://mola.gov.gy/laws-of-guyana",
        "type": {
            "name": "section",
            "representation": "12",
            "title": "Records of the Ministries of Foreign Affairs and Defence. ",
            "context": "NATIONAL ARCHIVES OF GUYANA ACT under Records of the Ministries of Foreign Affairs and Defence. 12.  (2) Notwithstanding  the  provisions  of  subsection  LAWS OF GUYANA National Archives of Guyana Cap. 40:03 13  L.R.O. 1/2012                             Records of the Ministries of Foreign Affairs and Defence.                 (1),  the Archivist or any authorised officer may issue special permission authorising the consultation for research purposes of certain classes of public archives other than those referred to in paragraph (c) of that subsection,  before the expiration of the periods specified in that subsection.  (3) The Archivist shall provide reasonable facilities at such time, place and on the payment of such fees as may be prescribed for the public to inspect public archives or obtain copies thereof or extracts therefrom:  Provided that no fee shall be charged for the inspection of public archives for research purposes.  (4) No person, not being an officer of the National Archives, shall remove any public archives from any prescribed place of inspection.  (5) Any person who contravenes subsection (4) shall be liable on summary conviction to a fine of fifty-five thousand dollars.",
            "description": [
                {
                    "representation": "(2)",
                    "description": "Notwithstanding  the  provisions  of  subsection  LAWS OF GUYANA National Archives of Guyana Cap. 40:03 13  L.R.O. 1/2012                             Records of the Ministries of Foreign Affairs and Defence."
                },
                {
                    "representation": "(c)",
                    "description": "of that subsection,  before the expiration of the periods specified in that subsection."
                },
                {
                    "representation": "(3)",
                    "description": "The Archivist shall provide reasonable facilities at such time, place and on the payment of such fees as may be prescribed for the public to inspect public archives or obtain copies thereof or extracts therefrom:  Provided that no fee shall be charged for the inspection of public archives for research purposes."
                },
                {
                    "representation": "(4)",
                    "description": "shall be liable on summary conviction to a fine of fifty-five thousand dollars."
                },
                {
                    "representation": "(5)",
                    "description": "Any person who contravenes subsection"
                }
            ]
        }
    },
    {
        "act": "NATIONAL ARCHIVES OF GUYANA ACT",
        "source": "https://mola.gov.gy/laws-of-guyana",
        "type": {
            "name": "section",
            "representation": "13",
            "title": "Declaration of historical records. ",
            "context": "NATIONAL ARCHIVES OF GUYANA ACT under Declaration of historical records. 13.  (1) The Archivist may declare to be of major historical interest any record which is owned, held or possessed by any person.  (2) Such declaration shall be by notice published in the Gazette or by writing under his hand served on the person having the custody of the record, and such record shall not be exported from Guyana except under and in accordance with a permit issued by the Archivist under this section.   (3) A permit issued under this section shall contain a description of the record sufficient to identify it and may contain such conditions as to the custody, use, preservation and return of the record as the Archivist deems fit.  (4) Any person who  (a)  exports or attempts to export a record LAWS OF GUYANA National Archives of Guyana Cap. 40:03 15  L.R.O. 1/2012                      Gifts, bequests, deposits.                       Purchases.   declared under subsection (1) to be of major historical interest from Guyana without a permit issued under this section; or  (b)  fails to comply with any condition of such permit,  shall be liable on summary conviction to a fine of fifty-five thousand dollars and to imprisonment for six months.  (5) Any person aggrieved by a declaration under subsection (1) may appeal to the Minister against such declaration within twenty-eight days from the date of the publication of the notice in the Gazette or its service, as the case may be, and the decision of the Minister on such appeal shall be final.",
            "description": [
                {
                    "representation": "(1)",
                    "description": "may appeal to the Minister against such declaration within twenty-eight days from the date of the publication of the notice in the Gazette or its service, as the case may be, and the decision of the Minister on such appeal shall be final."
                },
                {
                    "representation": "(2)",
                    "description": "Such declaration shall be by notice published in the Gazette or by writing under his hand served on the person having the custody of the record, and such record shall not be exported from Guyana except under and in accordance with a permit issued by the Archivist under this section."
                },
                {
                    "representation": "(3)",
                    "description": "A permit issued under this section shall contain a description of the record sufficient to identify it and may contain such conditions as to the custody, use, preservation and return of the record as the Archivist deems fit."
                },
                {
                    "representation": "(4)",
                    "description": "Any person who"
                },
                {
                    "representation": "(a)",
                    "description": "exports or attempts to export a record LAWS OF GUYANA National Archives of Guyana Cap. 40:03 15  L.R.O. 1/2012                      Gifts, bequests, deposits.                       Purchases.   declared under subsection"
                },
                {
                    "representation": "(b)",
                    "description": "fails to comply with any condition of such permit,  shall be liable on summary conviction to a fine of fifty-five thousand dollars and to imprisonment for six months."
                },
                {
                    "representation": "(5)",
                    "description": "Any person aggrieved by a declaration under subsection"
                }
            ]
        }
    },
    {
        "act": "NATIONAL ARCHIVES OF GUYANA ACT",
        "source": "https://mola.gov.gy/laws-of-guyana",
        "type": {
            "name": "section",
            "representation": "14",
            "title": "Gifts, bequests, deposits. ",
            "context": "NATIONAL ARCHIVES OF GUYANA ACT under Gifts, bequests, deposits. 14. (1) The Archivist may, on behalf of the Government, receive gifts and bequests of records which are of major historical interest.  (2) Persons having custody of records of major historical interest may with the permission of the Archivist deposit them with the National Archives.  (3) Persons who have gifted or bequeathed to or deposited with the National Archives any records under this section shall have the right to consult them and to make copies of them free of charge.  (4) The Archivist may, on behalf of the Government, receive gifts made to the National Archives in cash or in kind and, subject to any directions given by the Minister, shall utilise those gifts for such purposes may be specified by the donor.",
            "description": [
                {
                    "representation": "(1)",
                    "description": "The Archivist may, on behalf of the Government, receive gifts and bequests of records which are of major historical interest."
                },
                {
                    "representation": "(2)",
                    "description": "Persons having custody of records of major historical interest may with the permission of the Archivist deposit them with the National Archives."
                },
                {
                    "representation": "(3)",
                    "description": "Persons who have gifted or bequeathed to or deposited with the National Archives any records under this section shall have the right to consult them and to make copies of them free of charge."
                },
                {
                    "representation": "(4)",
                    "description": "The Archivist may, on behalf of the Government, receive gifts made to the National Archives in cash or in kind and, subject to any directions given by the Minister, shall utilise those gifts for such purposes may be specified by the donor."
                }
            ]
        }
    },
    {
        "act": "NATIONAL ARCHIVES OF GUYANA ACT",
        "source": "https://mola.gov.gy/laws-of-guyana",
        "type": {
            "name": "section",
            "representation": "15",
            "title": "Purchases. ",
            "context": "NATIONAL ARCHIVES OF GUYANA ACT under Purchases. 15.  The Archivist may, on behalf of the Government, purchase records of major historical interest.  LAWS OF GUYANA 16 Cap. 40:03 National Archives of Guyana  L.R.O. 1/2012       Special requirements concerning deposits, gifts, bequests and        purchases of records.               Report to be submitted to the Minister.    Compilation and sale of publications.     Copyright. [ 6 of 1997]",
            "description": "The Archivist may, on behalf of the Government, purchase records of major historical interest.  LAWS OF GUYANA 16 Cap. 40:03 National Archives of Guyana  L.R.O. 1/2012       Special requirements concerning deposits, gifts, bequests and        purchases of records.               Report to be submitted to the Minister.    Compilation and sale of publications.     Copyright. [ 6 of 1997]"
        }
    },
    {
        "act": "NATIONAL ARCHIVES OF GUYANA ACT",
        "source": "https://mola.gov.gy/laws-of-guyana",
        "type": {
            "name": "section",
            "representation": "16",
            "title": "Special requirements concerning deposits, gifts, bequests and         purchases of records. ",
            "context": "NATIONAL ARCHIVES OF GUYANA ACT under Special requirements concerning deposits, gifts, bequests and         purchases of records. 16.  (1) Any donor, depositor, vendor or other person who donates, bequeaths, devises, deposits or sells records to or with the National Archives may reserve the right to obtain reproduction thereof without payment and to prohibit reproductions by any other person until fifty years have elapsed after their transfer to the National Archives, of the whole or any portion of any such records which he regards as secret.  (2) The prohibition on reproduction shall not apply to any person designated by such donor, depositor, vendor or other person as is referred to in subsection (1) nor, where the records relate to property devolving on an heir or successor in title of such donor, depositor, vendor or other person, to such heir or successor in title. Such heir or successor in title may, in addition, make copies of such records without payment.",
            "description": [
                {
                    "representation": "(1)",
                    "description": "nor, where the records relate to property devolving on an heir or successor in title of such donor, depositor, vendor or other person, to such heir or successor in title. Such heir or successor in title may, in addition, make copies of such records without payment."
                },
                {
                    "representation": "(2)",
                    "description": "The prohibition on reproduction shall not apply to any person designated by such donor, depositor, vendor or other person as is referred to in subsection"
                }
            ]
        }
    },
    {
        "act": "NATIONAL ARCHIVES OF GUYANA ACT",
        "source": "https://mola.gov.gy/laws-of-guyana",
        "type": {
            "name": "section",
            "representation": "17",
            "title": "Report to be submitted to the Minister. ",
            "context": "NATIONAL ARCHIVES OF GUYANA ACT under Report to be submitted to the Minister. 17.  The Archivist shall, not later than the 30th June in each year, prepare and submit to the Minister a report on the activities of the National Archives during the last preceding calendar year.",
            "description": "The Archivist shall, not later than the 30th June in each year, prepare and submit to the Minister a report on the activities of the National Archives during the last preceding calendar year."
        }
    },
    {
        "act": "NATIONAL ARCHIVES OF GUYANA ACT",
        "source": "https://mola.gov.gy/laws-of-guyana",
        "type": {
            "name": "section",
            "representation": "18",
            "title": "Compilation and sale of publications. ",
            "context": "NATIONAL ARCHIVES OF GUYANA ACT under Compilation and sale of publications. 18.  The Archivist shall be entitled to compile and publish for sale or cause  to be compiled or published for sale specialised catalogues, publications  of  sources  of  a  national  character,  monographs  and research papers.   The proceeds of such sales shall be paid into the Consolidated Fund.",
            "description": "The Archivist shall be entitled to compile and publish for sale or cause  to be compiled or published for sale specialised catalogues, publications  of  sources  of  a  national  character,  monographs  and research papers.   The proceeds of such sales shall be paid into the Consolidated Fund."
        }
    },
    {
        "act": "NATIONAL ARCHIVES OF GUYANA ACT",
        "source": "https://mola.gov.gy/laws-of-guyana",
        "type": {
            "name": "section",
            "representation": "19",
            "title": "Copyright. ",
            "context": "NATIONAL ARCHIVES OF GUYANA ACT under Copyright. 19.  (1) Copyright shall not be deemed infringed by the Archivist making or supplying to any person any copy or reproduction of any public archives made available for public inspection.  (2) The Archivist shall not be liable for infringement by third parties of literary property right or analogous rights arising out of the use of the materials for display, inspection, research, reproduction or other purposes.  (3) Where any person desires to publish any work LAWS OF GUYANA National Archives of Guyana Cap. 40:03 17  L.R.O. 1/2012             Legal validity of public records.    Authentication of copies.         Regulations.                    containing any passage from any public archives, he shall first obtain the permission of the Archivist and he shall in that publication acknowledge the source from which that passage is taken.   (4) Any person who contravenes subsection (3) shall be liable on summary conviction to a fine of fifty-five thousand dollars.",
            "description": [
                {
                    "representation": "(1)",
                    "description": "Copyright shall not be deemed infringed by the Archivist making or supplying to any person any copy or reproduction of any public archives made available for public inspection."
                },
                {
                    "representation": "(2)",
                    "description": "The Archivist shall not be liable for infringement by third parties of literary property right or analogous rights arising out of the use of the materials for display, inspection, research, reproduction or other purposes."
                },
                {
                    "representation": "(3)",
                    "description": "shall be liable on summary conviction to a fine of fifty-five thousand dollars."
                },
                {
                    "representation": "(4)",
                    "description": "Any person who contravenes subsection"
                }
            ]
        }
    },
    {
        "act": "NATIONAL ARCHIVES OF GUYANA ACT",
        "source": "https://mola.gov.gy/laws-of-guyana",
        "type": {
            "name": "section",
            "representation": "20",
            "title": "Legal validity of public records. ",
            "context": "NATIONAL ARCHIVES OF GUYANA ACT under Legal validity of public records. 20.  Where it is a requirement of the validity of any public record that it should be kept in or produced from legal custody, the validity of such record shall not be affected by its transfer to the National Archives.",
            "description": "Where it is a requirement of the validity of any public record that it should be kept in or produced from legal custody, the validity of such record shall not be affected by its transfer to the National Archives."
        }
    },
    {
        "act": "NATIONAL ARCHIVES OF GUYANA ACT",
        "source": "https://mola.gov.gy/laws-of-guyana",
        "type": {
            "name": "section",
            "representation": "21",
            "title": "Authentication of copies. ",
            "context": "NATIONAL ARCHIVES OF GUYANA ACT under Authentication of copies. 21.  A copy of or an extract from any record in the National Archives purporting to be certified as true and authentic by the Archivist or any authorised officer and authenticated by having impressed thereon the official seal of the National Archives shall be admissible in evidence if the original record would have been admissible in evidence in any proceedings.",
            "description": "A copy of or an extract from any record in the National Archives purporting to be certified as true and authentic by the Archivist or any authorised officer and authenticated by having impressed thereon the official seal of the National Archives shall be admissible in evidence if the original record would have been admissible in evidence in any proceedings."
        }
    }
]