[
    {
        "act": "MOTOR VEHICLES INSURANCE (THIRD PARTY RISKS) ACT",
        "source": "https://mola.gov.gy/laws-of-guyana",
        "type": {
            "name": "section",
            "representation": "1",
            "title": "Short title. ",
            "context": "MOTOR VEHICLES INSURANCE (THIRD PARTY RISKS) ACT under Short title. 1. This Act may be cited as the Motor Vehicles Insurance (Third Party Risks) Act.",
            "description": "This Act may be cited as the Motor Vehicles Insurance (Third Party Risks) Act."
        }
    },
    {
        "act": "MOTOR VEHICLES INSURANCE (THIRD PARTY RISKS) ACT",
        "source": "https://mola.gov.gy/laws-of-guyana",
        "type": {
            "name": "section",
            "representation": "2",
            "title": "Interpretation. ",
            "context": "MOTOR VEHICLES INSURANCE (THIRD PARTY RISKS) ACT under Interpretation. 2. In this Act  authorised insurer shall have the meaning assigned to insurer in section 2 of the Insurance Act;  Commissioner means the Commissioner of Police;  driver where a separate person acts as steersman of a motor vehicle, includes that person as well as any other person engaged in the driving of the vehicle, and the expression drive shall be construed accordingly;  Government includes the Transport and Harbours Department;   motor vehicle means a mechanically propelled vehicle intended or adapted for use on roads, but does not include a steam traction engine, a steam roller or a vehicle constructed and intended for use exclusively on rails;  owner in relation to a vehicle which is the subject of a hiring agreement or a  hire-purchase agreement, means the person in possession under that agreement; MOTOR VEHICLES INSURANCE (THIRD PARTY RISKS) ACT LAWS OF GUYANA Motor Vehicles Insurance (Third Party Risks) Cap. 51:03 5  L.R.O. 1/2012           Users of motor vehicles to be insured against third party  risks. [6 of 1959 29 of 1961 6 of 1985 16 of 1997 17 of 1998]           c. 51:02                  policy of insurance means a policy issued by an authorised insurer and includes a covering note;  public road means any highway and any other road to which the public has access, and includes bridges over which a road passes, and any wharf, stelling or part of the foreshore to which the public has access.",
            "description": "In this Act  authorised insurer shall have the meaning assigned to insurer in section 2 of the Insurance Act;  Commissioner means the Commissioner of Police;  driver where a separate person acts as steersman of a motor vehicle, includes that person as well as any other person engaged in the driving of the vehicle, and the expression drive shall be construed accordingly;  Government includes the Transport and Harbours Department;   motor vehicle means a mechanically propelled vehicle intended or adapted for use on roads, but does not include a steam traction engine, a steam roller or a vehicle constructed and intended for use exclusively on rails;  owner in relation to a vehicle which is the subject of a hiring agreement or a  hire-purchase agreement, means the person in possession under that agreement; MOTOR VEHICLES INSURANCE (THIRD PARTY RISKS) ACT LAWS OF GUYANA Motor Vehicles Insurance (Third Party Risks) Cap. 51:03 5  L.R.O. 1/2012           Users of motor vehicles to be insured against third party  risks. [6 of 1959 29 of 1961 6 of 1985 16 of 1997 17 of 1998]           c. 51:02                  policy of insurance means a policy issued by an authorised insurer and includes a covering note;  public road means any highway and any other road to which the public has access, and includes bridges over which a road passes, and any wharf, stelling or part of the foreshore to which the public has access."
        }
    },
    {
        "act": "MOTOR VEHICLES INSURANCE (THIRD PARTY RISKS) ACT",
        "source": "https://mola.gov.gy/laws-of-guyana",
        "type": {
            "name": "section",
            "representation": "3",
            "title": "Users of motor vehicles to be insured against third party risks. ",
            "context": "MOTOR VEHICLES INSURANCE (THIRD PARTY RISKS) ACT under Users of motor vehicles to be insured against third party risks. 3. (1) Subject to this Act, it shall not be lawful for any person to use or to cause or permit any other person to use a motor vehicle on a public road unless there is in force in relation to the user of the vehicle, by that person or that other person, as the case may be, such a policy of insurance in respect of third party risks as complies with the requirements of this Act.  (2) If a person acts in contravention of this section he shall be liable to a fine of not less than twenty-five thousand dollars nor more than fifty thousand dollars and to imprisonment for six months, and a person convicted of an offence under this section shall (unless the court thinks fit to order otherwise and without prejudice to the power of the court to order a longer period of disqualification) be disqualified for holding or obtaining a drivers licence under the Motor Vehicles and Road Traffic Act for a period of twelve months from the date of the conviction.  (3) Notwithstanding any enactment prescribing the time in which proceedings may be brought before a court of summary jurisdiction, proceedings for an offence under this section may be brought  (a)      within a period of six months from the date of the commission of the alleged offence; or  (b)     within a period which exceeds neither three months from the date on which LAWS OF GUYANA 6 Cap. 51:03 Motor Vehicles Insurance (Third Party Risks)  L.R.O. 1/2012                                     c. 3:04      Requirements in respect of policies. [6 of 1985]            it came to the knowledge of the prosecutor that the offence had been committed nor one year from the date of the commission of the alleged offence,  whichever period is the longer.  (4) This section shall not apply to any motor vehicle owned by Government or by the Georgetown City Council or the New Amsterdam Town  Council  when  such  motor  vehicle  is  used  and  employed exclusively upon Government or Municipal service or to any vehicle at any time when it is being driven for police purposes by or under the direction of a member of the police force or when it is being driven by a certifying officer in exercise of his duties under the Motor Vehicles and Road Traffic Act.  (5) A person who by virtue of an order of a court under this section is disqualified from holding or obtaining a drivers licence may appeal against the order in the same manner as against a conviction, and the court may, if it thinks fit, notwithstanding the provisions of the Summary Jurisdiction (Appeals) Act, declare that the disqualification shall operate until the appeal is finally determined.",
            "description": [
                {
                    "representation": "(1)",
                    "description": "Subject to this Act, it shall not be lawful for any person to use or to cause or permit any other person to use a motor vehicle on a public road unless there is in force in relation to the user of the vehicle, by that person or that other person, as the case may be, such a policy of insurance in respect of third party risks as complies with the requirements of this Act."
                },
                {
                    "representation": "(2)",
                    "description": "If a person acts in contravention of this section he shall be liable to a fine of not less than twenty-five thousand dollars nor more than fifty thousand dollars and to imprisonment for six months, and a person convicted of an offence under this section shall"
                },
                {
                    "representation": "(3)",
                    "description": "Notwithstanding any enactment prescribing the time in which proceedings may be brought before a court of summary jurisdiction, proceedings for an offence under this section may be brought"
                },
                {
                    "representation": "(a)",
                    "description": "within a period of six months from the date of the commission of the alleged offence; or"
                },
                {
                    "representation": "(b)",
                    "description": "within a period which exceeds neither three months from the date on which LAWS OF GUYANA 6 Cap. 51:03 Motor Vehicles Insurance"
                },
                {
                    "representation": "(4)",
                    "description": "This section shall not apply to any motor vehicle owned by Government or by the Georgetown City Council or the New Amsterdam Town  Council  when  such  motor  vehicle  is  used  and  employed exclusively upon Government or Municipal service or to any vehicle at any time when it is being driven for police purposes by or under the direction of a member of the police force or when it is being driven by a certifying officer in exercise of his duties under the Motor Vehicles and Road Traffic Act."
                },
                {
                    "representation": "(5)",
                    "description": "A person who by virtue of an order of a court under this section is disqualified from holding or obtaining a drivers licence may appeal against the order in the same manner as against a conviction, and the court may, if it thinks fit, notwithstanding the provisions of the Summary Jurisdiction"
                }
            ]
        }
    },
    {
        "act": "MOTOR VEHICLES INSURANCE (THIRD PARTY RISKS) ACT",
        "source": "https://mola.gov.gy/laws-of-guyana",
        "type": {
            "name": "section",
            "representation": "4",
            "title": "Requirements in respect of policies. of third party risks. parties. of liability in respect of passengers carried for hire or reward. insurance. arising from the use of motor vehicles on public roads. for, emergency treatment.   __________________________     MOTOR VEHICLES INSURANCE (THIRD PARTY RISKS) ACT ",
            "context": "MOTOR VEHICLES INSURANCE (THIRD PARTY RISKS) ACT under Requirements in respect of policies. of third party risks. parties. of liability in respect of passengers carried for hire or reward. insurance. arising from the use of motor vehicles on public roads. for, emergency treatment.   __________________________     MOTOR VEHICLES INSURANCE (THIRD PARTY RISKS) ACT 4. (1) In order to comply with the requirements of this Act a policy of insurance must be a policy which  (a)   is issued by a person who is an authorised insurer; and   (b)   insures such person, persons, or classes of persons as may be specified in the policy in respect of any liability which may be incurred by him or them in respect of the death of or bodily injury to or damage to the LAWS OF GUYANA Motor Vehicles Insurance (Third Party Risks) Cap. 51:03 7  L.R.O. 1/2012                                                 property of any person caused by or arising out of the use of the motor vehicle on a public road:  Provided that in the case of death or of bodily injury such policy shall not be required to cover  (i)      liability in respect of the death arising out of and in the course of his employment of a person in the employment of a person insured by the policy or of bodily injury sustained by  such a person arising out of and in the course of his employment; or (ii)      except  in  the  case  of  a  motor  vehicle  in  which passengers are carried for hire or reward or by reason of or in pursuance of a contract of employment, liability in respect of the death of or bodily injury to persons being carried in or upon or entering or getting on to or alighting from the motor vehicle at the time of the occurrence of the event out of which the claims arise; (iii)      any contractual liability; (iv)   liability in respect of the first twenty-five dollars of any claim by any one person; (v)      liability in respect of any sum in excess of twenty-five thousand dollars arising out of any one claim by any one person; (vi)     liability in respect of any sum in LAWS OF GUYANA 8 Cap. 51:03 Motor Vehicles Insurance (Third Party Risks)  L.R.O. 1/2012                                                  excess of one hundred and  twenty-five thousand dollars arising out of the total claims for any one accident for each vehicle concerned.  (1A) For the purposes of this Act, property does not include   (a)   property carried in or on a motor vehicle;  (b)     property belonging to or held in trust by or in the custody or control of the person insured; or  (c)   any bridge, weighbridge, viaduct or road or anything beneath the bridge, weighbridge, viaduct or road which has been damaged by vibration caused by the weight of the motor vehicle or of the load carried by the motor vehicle.  (1B) In the case of damage to property, a policy of insurance shall not be required to cover liability in respect of any sum in excess of  (a)   twenty thousand dollars where the liability arises out of any one claim by any one person;  (b)    one hundred thousand dollars where the liability arises out of the total claims for any one accident.  (1C) Sections 6 and 14 shall not apply to damage to property. LAWS OF GUYANA Motor Vehicles Insurance (Third Party Risks) Cap. 51:03 9  L.R.O. 1/2012                                                 (2) Where any payment is made by an authorised insurer under a policy issued under this Act in respect of the death of or bodily injury to any person arising out of the use of a motor vehicle on a public road and the person who has so died or been bodily injured has to the knowledge of the authorised insurer received treatment in a hospital in respect of the fatal or other bodily injury so arising, there shall also be paid by the authorised insurer to such hospital the expenses reasonably incurred by the hospital in affording such treatment to an amount not exceeding five hundred dollars for each person so treated.  For the purposes of this subsection the expression hospital means an institution which provides medical or surgical treatment for in-patients, and the expression expenses reasonably incurred means, in relation to a person who receives treatment in a hospital, an amount for each day such person is maintained in such hospital representing the approximate actual daily cost of such a patient to the hospital in relation to the maintenance of the hospital and the staff thereof:  Provided that in any case where a charge has been made by the hospital in addition to expenses reasonably incurred in respect of such treatment there shall be paid by the authorised insurer to such hospital only that portion of any such charge as represents the approximate actual daily cost of such a patient to the hospital.  (3) Notwithstanding anything in any enactment, a person issuing a policy of insurance under this section shall be liable to indemnify the persons or classes of persons specified in the policy in respect of any liability which the policy purports to cover in the case of those persons or classes of persons.  (4) A policy shall be of no effect for the purposes of this Act unless and until there is issued by the authorised LAWS OF GUYANA 10 Cap. 51:03 Motor Vehicles Insurance (Third Party Risks)  L.R.O. 1/2012                   Certain conditions to policies to be of no effect. [6 of 1985]                  Requirements as to production of certificate of insurance. [6 of 1985]           insurer in favour of the person by whom the policy is effected a certificate (hereinafter referred to as a certificate of insurance) in the prescribed form and containing such particulars of any conditions subject to which the policy is issued and of any other matters as may be prescribed, and different forms and different particulars may be prescribed in relation to different cases or circumstances.",
            "description": [
                {
                    "representation": "(1)",
                    "description": "In order to comply with the requirements of this Act a policy of insurance must be a policy which"
                },
                {
                    "representation": "(a)",
                    "description": "twenty thousand dollars where the liability arises out of any one claim by any one person;"
                },
                {
                    "representation": "(b)",
                    "description": "one hundred thousand dollars where the liability arises out of the total claims for any one accident."
                },
                {
                    "representation": "(i)",
                    "description": "liability in respect of the death arising out of and in the course of his employment of a person in the employment of a person insured by the policy or of bodily injury sustained by  such a person arising out of and in the course of his employment; or"
                },
                {
                    "representation": "(v)",
                    "description": "liability in respect of any sum in excess of twenty-five thousand dollars arising out of any one claim by any one person;"
                },
                {
                    "representation": "(c)",
                    "description": "any bridge, weighbridge, viaduct or road or anything beneath the bridge, weighbridge, viaduct or road which has been damaged by vibration caused by the weight of the motor vehicle or of the load carried by the motor vehicle."
                },
                {
                    "representation": "(2)",
                    "description": "Where any payment is made by an authorised insurer under a policy issued under this Act in respect of the death of or bodily injury to any person arising out of the use of a motor vehicle on a public road and the person who has so died or been bodily injured has to the knowledge of the authorised insurer received treatment in a hospital in respect of the fatal or other bodily injury so arising, there shall also be paid by the authorised insurer to such hospital the expenses reasonably incurred by the hospital in affording such treatment to an amount not exceeding five hundred dollars for each person so treated.  For the purposes of this subsection the expression hospital means an institution which provides medical or surgical treatment for in-patients, and the expression expenses reasonably incurred means, in relation to a person who receives treatment in a hospital, an amount for each day such person is maintained in such hospital representing the approximate actual daily cost of such a patient to the hospital in relation to the maintenance of the hospital and the staff thereof:  Provided that in any case where a charge has been made by the hospital in addition to expenses reasonably incurred in respect of such treatment there shall be paid by the authorised insurer to such hospital only that portion of any such charge as represents the approximate actual daily cost of such a patient to the hospital."
                },
                {
                    "representation": "(3)",
                    "description": "Notwithstanding anything in any enactment, a person issuing a policy of insurance under this section shall be liable to indemnify the persons or classes of persons specified in the policy in respect of any liability which the policy purports to cover in the case of those persons or classes of persons."
                },
                {
                    "representation": "(4)",
                    "description": "A policy shall be of no effect for the purposes of this Act unless and until there is issued by the authorised LAWS OF GUYANA 10 Cap. 51:03 Motor Vehicles Insurance"
                }
            ]
        }
    },
    {
        "act": "MOTOR VEHICLES INSURANCE (THIRD PARTY RISKS) ACT",
        "source": "https://mola.gov.gy/laws-of-guyana",
        "type": {
            "name": "section",
            "representation": "5",
            "title": "[Repealed by Act No. 6 of 1985] ",
            "context": "MOTOR VEHICLES INSURANCE (THIRD PARTY RISKS) ACT under [Repealed by Act No. 6 of 1985] 5.  [Repealed by Act No. 6 of 1985]",
            "description": "[Repealed by Act No. 6 of 1985]"
        }
    },
    {
        "act": "MOTOR VEHICLES INSURANCE (THIRD PARTY RISKS) ACT",
        "source": "https://mola.gov.gy/laws-of-guyana",
        "type": {
            "name": "section",
            "representation": "6",
            "title": "Certain conditions to policies to be of no effect. ",
            "context": "MOTOR VEHICLES INSURANCE (THIRD PARTY RISKS) ACT under Certain conditions to policies to be of no effect. 6. Any condition in a policy issued for the purposes of this Act, providing that no liability shall arise under the policy or that any liability so arising shall cease, in the event of some specified thing being done or omitted to be done after the happening of the event giving rise to a claim under the policy shall be of no effect in connection with such claims as are mentioned in section 4 (1) (b):  Provided that nothing in this section shall be taken to render void any provision in a policy requiring the person insured to repay to the authorised insurer any sums which the latter may have become liable to pay under the policy and which have been applied to the satisfaction of the claims of third parties.",
            "description": [
                {
                    "representation": "(1)",
                    "description": "(b):  Provided that nothing in this section shall be taken to render void any provision in a policy requiring the person insured to repay to the authorised insurer any sums which the latter may have become liable to pay under the policy and which have been applied to the satisfaction of the claims of third parties."
                }
            ]
        }
    },
    {
        "act": "MOTOR VEHICLES INSURANCE (THIRD PARTY RISKS) ACT",
        "source": "https://mola.gov.gy/laws-of-guyana",
        "type": {
            "name": "section",
            "representation": "7",
            "title": "Requirements as to production of certificate of insurance. ",
            "context": "MOTOR VEHICLES INSURANCE (THIRD PARTY RISKS) ACT under Requirements as to production of certificate of insurance. 7. (1) Any person driving a motor vehicle on a public road shall, on being so required by any member of the police force, give his name and address and the name and address of the owner of the motor vehicle and produce his certificate and if he fails so to do he shall be guilty of an offence:  Provided that, if the driver of a motor vehicle within five days after the date on which the production of his certificate was so required, produces the certificate in person at such police station as may have been specified by him at the time its production was required, he shall not be convicted under this subsection of the offence of failing to produce his certificate. LAWS OF GUYANA Motor Vehicles Insurance (Third Party Risks) Cap. 51:03 11  L.R.O. 1/2012                                         Duty of insurers to satisfy judgments against persons insured in respect of third party risks. (2) It shall be the duty of the owner of a motor vehicle to give such information as he may be required by or on behalf of any police officer not below the rank of an assistant superintendent to give as to the identity of the driver of a motor vehicle on any occasion when the driver was required under subsection (1) to produce the certificate, and if the owner fails to do so he shall be guilty of an offence.  (3) If in any case where, owing to the presence of a motor vehicle on a public road, an accident occurs involving personal injury to another person, the driver of the vehicle does not at the time produce his certificate to a member of the police force or to some person, who, having reasonable grounds for so doing, has required its production, the driver shall report the accident at a police station as soon as possible, and in any case within twenty-four hours of the occurrence of the accident, and there produce his certificate and if he fails so to do, he shall be guilty of an offence:  Provided that a person shall not be convicted under this subsection of the offence of failing to produce his certificate if, within five days after the occurrence of the accident, he produces the certificate in person at such police station as may be specified by him at the time the accident was reported.  (4) In this section the expression produce his certificate means produce for examination the relevant certificate of insurance or such other evidence that the motor vehicle is not or was not being driven in contravention of section 3 as may be prescribed.",
            "description": [
                {
                    "representation": "(1)",
                    "description": "to produce the certificate, and if the owner fails to do so he shall be guilty of an offence."
                },
                {
                    "representation": "(2)",
                    "description": "It shall be the duty of the owner of a motor vehicle to give such information as he may be required by or on behalf of any police officer not below the rank of an assistant superintendent to give as to the identity of the driver of a motor vehicle on any occasion when the driver was required under subsection"
                },
                {
                    "representation": "(3)",
                    "description": "If in any case where, owing to the presence of a motor vehicle on a public road, an accident occurs involving personal injury to another person, the driver of the vehicle does not at the time produce his certificate to a member of the police force or to some person, who, having reasonable grounds for so doing, has required its production, the driver shall report the accident at a police station as soon as possible, and in any case within twenty-four hours of the occurrence of the accident, and there produce his certificate and if he fails so to do, he shall be guilty of an offence:  Provided that a person shall not be convicted under this subsection of the offence of failing to produce his certificate if, within five days after the occurrence of the accident, he produces the certificate in person at such police station as may be specified by him at the time the accident was reported."
                },
                {
                    "representation": "(4)",
                    "description": "In this section the expression produce his certificate means produce for examination the relevant certificate of insurance or such other evidence that the motor vehicle is not or was not being driven in contravention of section 3 as may be prescribed."
                }
            ]
        }
    },
    {
        "act": "MOTOR VEHICLES INSURANCE (THIRD PARTY RISKS) ACT",
        "source": "https://mola.gov.gy/laws-of-guyana",
        "type": {
            "name": "section",
            "representation": "8",
            "title": "Duty of insurers to satisfy judgments against persons insured in respect ",
            "context": "MOTOR VEHICLES INSURANCE (THIRD PARTY RISKS) ACT under Duty of insurers to satisfy judgments against persons insured in respect 8. (1)  If after a certificate of insurance has been issued under section 4(4), to the person by whom a policy has been effected, judgment in respect of any such liability as is required to be covered by a policy under section 4(1)(b) (being a liability covered by the terms of the policy) is obtained against any person insured by  the policy, then, LAWS OF GUYANA 12 Cap. 51:03 Motor Vehicles Insurance (Third Party Risks)  L.R.O. 1/2012                                                  notwithstanding that the authorised insurer may be entitled to avoid or cancel or may have avoided or cancelled the policy, the authorised insurer shall, subject to this section, and subject to any limitations on the total amount payable under the policy in pursuance of the fourth, fifth and sixth provisos to section 4(1)(b) pay to the persons entitled to the benefit of the judgment any sum payable thereunder in respect of the liability, including any amount payable in respect of costs any sum payable in respect of interest on that sum by virtue of any enactment relating to interest on judgments.  (2) No sum shall be payable by an authorised insurer under the foregoing provisions of this section  (a)     in respect of any judgment, unless before or within seven days after the commencement of the proceedings in which the judgment was given, the authorised insurer had notice of the bringing of the proceedings; or  (b)     in respect of any judgment, so long as execution thereon is stayed pending an appeal; or  (c)    in connection with any liability, if before the happening of the event which was the cause of the death or bodily injury giving rise to the liability, the policy was cancelled by mutual consent or by virtue of any provision contained therein, and either  (i)     before the happening of the said event the certificate was surrendered to the authorised insurer, or the person to whom LAWS OF GUYANA Motor Vehicles Insurance (Third Party Risks) Cap. 51:03 13  L.R.O. 1/2012                                                 the certificate was issued made and delivered to the authorised  insurer a statutory declaration stating that the certificate had been lost or destroyed, or (ii)    after the happening of the said event, but before the expiration of a period of fourteen days from the taking effect of   the cancellation of the policy, the  certificate  was surrendered to the authorised insurer, or the person to whom the certificate was issued made such a statutory declaration as aforesaid, or (iii)  either before or after the happening of the said event, but within the said period of fourteen days, the authorised insurer  has commenced proceedings  under this Act in respect of the failure to surrender the certificate.  (3) No sum shall be payable by an authorised insurer under the foregoing provisions of this section, if, in an action commenced before, or within three months after, the commencement of the proceedings in which the judgment was given, he has obtained a declaration that, apart from any provision contained in the policy, he is entitled to avoid it on the ground that it was obtained by the non-disclosure of a material fact, or by a representation of fact which was false in some material particular, or, if he has avoided the policy on that ground, that he was entitled so to do apart from any provision contained in it:  Provided that an authorised insurer who has obtained LAWS OF GUYANA 14 Cap. 51:03 Motor Vehicles Insurance (Third Party Risks)  L.R.O. 1/2012                                                  Preservation of rights in case of death of an such a declaration as aforesaid in an action shall not thereby become entitled to the benefit of this subsection as respects any judgment obtained in proceedings commenced before the commencement of that action, unless before or within seven days after the commencement of that action he has given notice thereof to the person who is the plaintiff in the said proceedings specifying the non-disclosure or false representation on which he proposes to rely, and any person to whom notice of such an action is so given shall be entitled, if he thinks fit, to be made a party thereto.  (4) If the amount which an authorised insurer becomes liable under this section to pay in respect of a liability of a person insured by a policy exceeds the amount for which he would, apart from the provisions of this section, be liable under the policy in respect of that liability, he shall be entitled to recover the excess from that person.  (5) In this section the expression material means of such a nature as to influence the judgment of a prudent insurer in determining whether he will take the risk, and, if so, at what premium and on what conditions, and the expression liability covered by the terms of the policy means a liability which is covered by the policy or which would be so covered but for the fact that the authorised insurer is entitled to avoid or cancel, or has avoided or cancelled, the policy.  (6) In this Act references to a certificate of insurance in any provisions relating to the surrender, or the loss or destruction, of a certificate of insurance shall, in relation to policies under which more than one certificate is issued, be construed as references to all the certificates, and shall, where any copy has been issued of any certificate, be construed as including a reference to that copy.",
            "description": [
                {
                    "representation": "(1)",
                    "description": "If after a certificate of insurance has been issued under section 4(4), to the person by whom a policy has been effected, judgment in respect of any such liability as is required to be covered by a policy under section 4(1)(b)"
                },
                {
                    "representation": "(b)",
                    "description": "in respect of any judgment, so long as execution thereon is stayed pending an appeal; or"
                },
                {
                    "representation": "(2)",
                    "description": "No sum shall be payable by an authorised insurer under the foregoing provisions of this section"
                },
                {
                    "representation": "(a)",
                    "description": "in respect of any judgment, unless before or within seven days after the commencement of the proceedings in which the judgment was given, the authorised insurer had notice of the bringing of the proceedings; or"
                },
                {
                    "representation": "(c)",
                    "description": "in connection with any liability, if before the happening of the event which was the cause of the death or bodily injury giving rise to the liability, the policy was cancelled by mutual consent or by virtue of any provision contained therein, and either"
                },
                {
                    "representation": "(i)",
                    "description": "before the happening of the said event the certificate was surrendered to the authorised insurer, or the person to whom LAWS OF GUYANA Motor Vehicles Insurance"
                },
                {
                    "representation": "(3)",
                    "description": "No sum shall be payable by an authorised insurer under the foregoing provisions of this section, if, in an action commenced before, or within three months after, the commencement of the proceedings in which the judgment was given, he has obtained a declaration that, apart from any provision contained in the policy, he is entitled to avoid it on the ground that it was obtained by the non-disclosure of a material fact, or by a representation of fact which was false in some material particular, or, if he has avoided the policy on that ground, that he was entitled so to do apart from any provision contained in it:  Provided that an authorised insurer who has obtained LAWS OF GUYANA 14 Cap. 51:03 Motor Vehicles Insurance"
                },
                {
                    "representation": "(4)",
                    "description": "If the amount which an authorised insurer becomes liable under this section to pay in respect of a liability of a person insured by a policy exceeds the amount for which he would, apart from the provisions of this section, be liable under the policy in respect of that liability, he shall be entitled to recover the excess from that person."
                },
                {
                    "representation": "(5)",
                    "description": "In this section the expression material means of such a nature as to influence the judgment of a prudent insurer in determining whether he will take the risk, and, if so, at what premium and on what conditions, and the expression liability covered by the terms of the policy means a liability which is covered by the policy or which would be so covered but for the fact that the authorised insurer is entitled to avoid or cancel, or has avoided or cancelled, the policy."
                },
                {
                    "representation": "(6)",
                    "description": "In this Act references to a certificate of insurance in any provisions relating to the surrender, or the loss or destruction, of a certificate of insurance shall, in relation to policies under which more than one certificate is issued, be construed as references to all the certificates, and shall, where any copy has been issued of any certificate, be construed as including a reference to that copy."
                }
            ]
        }
    },
    {
        "act": "MOTOR VEHICLES INSURANCE (THIRD PARTY RISKS) ACT",
        "source": "https://mola.gov.gy/laws-of-guyana",
        "type": {
            "name": "section",
            "representation": "9",
            "title": "Preservation of rights in case of death of an insured. ",
            "context": "MOTOR VEHICLES INSURANCE (THIRD PARTY RISKS) ACT under Preservation of rights in case of death of an insured. 9. The rights of any person in respect of any liability incurred by an insured shall, in the event of the death of the LAWS OF GUYANA Motor Vehicles Insurance (Third Party Risks) Cap. 51:03 15  L.R.O. 1/2012 insured. [6 of 1985]                  Rights of third parties against insurers on insolvency, etc., of the insured.                             insured, and notwithstanding any enactment, rule of law or the common law to the contrary, be preserved to and be enforceable by such person against the personal representatives of the insured in the same manner and to the same extent as such rights would have been enforceable against the insured if he had survived and section 4 (3) shall apply accordingly.  In this section the word insured means a person who is insured under a contract of insurance against liabilities to third parties in accordance with this Act.",
            "description": [
                {
                    "representation": "(3)",
                    "description": "shall apply accordingly.  In this section the word insured means a person who is insured under a contract of insurance against liabilities to third parties in accordance with this Act."
                }
            ]
        }
    },
    {
        "act": "MOTOR VEHICLES INSURANCE (THIRD PARTY RISKS) ACT",
        "source": "https://mola.gov.gy/laws-of-guyana",
        "type": {
            "name": "section",
            "representation": "",
            "title": "10.Rights of third parties against insurers on insolvency, etc., of the insured. LAWS OF GUYANA 4 Cap. 51:03 Motor Vehicles Insurance (Third Party Risks)  L.R.O. 1/2012     1953 Ed. c. 281 _______________________________________________________22 of 1937  CHAPTER 51:03   An Act to make provision against third party risks arising out of the use of motor vehicles.  [1ST APRIL, 1938]  Short title.       Interpretation. [6 of 1959 4 of 1972 6 of 1985] c. 91:02                          ",
            "context": "MOTOR VEHICLES INSURANCE (THIRD PARTY RISKS) ACT under 10.Rights of third parties against insurers on insolvency, etc., of the insured. LAWS OF GUYANA 4 Cap. 51:03 Motor Vehicles Insurance (Third Party Risks)  L.R.O. 1/2012     1953 Ed. c. 281 _______________________________________________________22 of 1937  CHAPTER 51:03   An Act to make provision against third party risks arising out of the use of motor vehicles.  [1ST APRIL, 1938]  Short title.       Interpretation. [6 of 1959 4 of 1972 6 of 1985] c. 91:02                          10. (1) Where under any contract of insurance a person (hereinafter referred to as the insured) is insured against liabilities to third parties which he may incur, then  (a)     in the event of the insured becoming insolvent or making a composition or arrangement with his creditors; or  (b)    in the case of the insured being a company, in the event of a  winding-up order being made, or a resolution for a voluntary winding-up  being passed, with respect to the company, or of a receiver or manager of the companys business or undertaking being duly appointed, or of possession being taken, by or on behalf of the holders of any debentures secured by a floating charge, of any property comprised in or subject to the charge,  if, either before or after that event, any such liability as aforesaid is incurred by the insured, his rights against the insurer under the contract in respect of the liability shall, notwithstanding anything in any Act or rule of law to the LAWS OF GUYANA 16 Cap. 51:03 Motor Vehicles Insurance (Third Party Risks)  L.R.O. 1/2012               c. 12:21                          c. 12:21                     contrary, be transferred to and vest in the third party to whom the liability was so incurred.  (2) Where an order is made under section 108 of the Insolvency Act for the administration of the estate of a deceased debtor according to the law of insolvency, then, if any debt provable in insolvency is owing by the deceased in respect of a liability against which he was insured under a contract of insurance as being a liability to a third party, the deceased debtors rights  against  the insurer  under the  contract  in respect of that liability shall, notwithstanding anything in the said Act, be transferred to and vest in the person to whom the debt is owing.  (3) In so far as any contract of insurance  made  after  the commencement of this Act in respect of any liability of the insured to third parties purports, whether directly or indirectly, to avoid the contract or to alter the rights of the parties thereunder upon the happening to the insured of any of the events specified in subsection (l)(a) or (b) of this section or upon the  making of an order under section 108 of the Insolvency Act, in respect of his estate, the contract shall be of no effect.  (4) Upon a transfer under subsection (1) or subsection (2) of this section, the insurer shall, subject to section 12, be under the same liability to the third party as he would have been under to the insured, but  (a)   if the liability of the insurer to the insured exceeds the liability of the insured to the third party, nothing in this Act shall affect the rights of the insured against the insurer in respect of the excess; and  (b)   if the liability of the insurer to the insured is less than the liability of the LAWS OF GUYANA Motor Vehicles Insurance (Third Party Risks) Cap. 51:03 17  L.R.O. 1/2012                         Cap. 111 1953 Ed.      Duty to give necessary information to third parties. c. 12:21                 insured to the third party, nothing in this Act shall affect  the rights of the third party against the insured in respect of the balance.  (5) For the purposes of this Act the expression liabilities to third parties, in relation to a person insured under any contract of insurance, shall not include any liability of that person in the capacity of insurer under some other contract of insurance.  (6) This Act shall not apply  (a)  where a company is wound up voluntarily merely for the purposes of reconstruction or of amalgamation with another company; or  (b)      to any case to which section 28(1) and (2) of the Workmens Compensation Act apply.",
            "description": [
                {
                    "representation": "(1)",
                    "description": "or subsection"
                },
                {
                    "representation": "(a)",
                    "description": "where a company is wound up voluntarily merely for the purposes of reconstruction or of amalgamation with another company; or"
                },
                {
                    "representation": "(b)",
                    "description": "to any case to which section 28(1) and"
                },
                {
                    "representation": "(2)",
                    "description": "of the Workmens Compensation Act apply."
                },
                {
                    "representation": "(3)",
                    "description": "In so far as any contract of insurance  made  after  the commencement of this Act in respect of any liability of the insured to third parties purports, whether directly or indirectly, to avoid the contract or to alter the rights of the parties thereunder upon the happening to the insured of any of the events specified in subsection"
                },
                {
                    "representation": "(4)",
                    "description": "Upon a transfer under subsection"
                },
                {
                    "representation": "(5)",
                    "description": "For the purposes of this Act the expression liabilities to third parties, in relation to a person insured under any contract of insurance, shall not include any liability of that person in the capacity of insurer under some other contract of insurance."
                },
                {
                    "representation": "(6)",
                    "description": "This Act shall not apply"
                }
            ]
        }
    },
    {
        "act": "MOTOR VEHICLES INSURANCE (THIRD PARTY RISKS) ACT",
        "source": "https://mola.gov.gy/laws-of-guyana",
        "type": {
            "name": "section",
            "representation": "11",
            "title": "Duty to give necessary information to third parties. ",
            "context": "MOTOR VEHICLES INSURANCE (THIRD PARTY RISKS) ACT under Duty to give necessary information to third parties. 11. (1) In the event of any person becoming insolvent or making a composition or arrangement with his creditors or in the event of an order being made under section 108 of the Insolvency Act, in respect of the estate of any person, or in the event of a winding-up order being made, or a resolution for a voluntarily winding-up order being passed, with respect to any company or of a receiver or manager of the companys business or undertaking being duly appointed or of possession being taken by a floating charge of any property comprised in or subject to the charge it shall be the  duty of the insolvent, debtor, personal representative of the deceased debtor or company, and, as the case may be, of the trustee in insolvency, trustee, liquidator, receiver, or manager, or person in possession of the property to give at the request of any person claiming that the insolvent, debtor, deceased debtor, or company is under a liability to him, such LAWS OF GUYANA 18 Cap. 51:03 Motor Vehicles Insurance (Third Party Risks)  L.R.O. 1/2012                               Settlement between insurers and insured persons.               Insolvency, etc., information as may reasonably be required by him for the purpose of ascertaining whether any rights have been transferred to and vested in him by this Act and for the purpose of enforcing such rights, if any, and any contract of insurance, in so far as it purports, whether directly or indirectly, to avoid the contract or to alter the rights of the parties thereunder  upon the giving of any such information in the events aforesaid or otherwise to prohibit or prevent the giving thereof in the said events, shall be of no effect.  (2) If the information given to any person in pursuance of subsection (1) discloses reasonable ground for supposing that there have or may have been transferred to him under this Act rights against any particular insurer, that insurer shall be subject to the same duty as is imposed by the said subsection on the persons therein mentioned.  (3) The duty to give information imposed by this section shall include a duty to allow all contracts of insurance, receipts for premiums, and other relevant documents in the possession or power of the person on whom the duty is so imposed to be inspected and copies thereof to be taken.",
            "description": [
                {
                    "representation": "(1)",
                    "description": "discloses reasonable ground for supposing that there have or may have been transferred to him under this Act rights against any particular insurer, that insurer shall be subject to the same duty as is imposed by the said subsection on the persons therein mentioned."
                },
                {
                    "representation": "(2)",
                    "description": "If the information given to any person in pursuance of subsection"
                },
                {
                    "representation": "(3)",
                    "description": "The duty to give information imposed by this section shall include a duty to allow all contracts of insurance, receipts for premiums, and other relevant documents in the possession or power of the person on whom the duty is so imposed to be inspected and copies thereof to be taken."
                }
            ]
        }
    },
    {
        "act": "MOTOR VEHICLES INSURANCE (THIRD PARTY RISKS) ACT",
        "source": "https://mola.gov.gy/laws-of-guyana",
        "type": {
            "name": "section",
            "representation": "12",
            "title": "Settlement between insurers and insured persons. ",
            "context": "MOTOR VEHICLES INSURANCE (THIRD PARTY RISKS) ACT under Settlement between insurers and insured persons. 12. Where the insured has become insolvent or where, in the case of the insured being a company a winding-up order has been made or a resolution for a voluntary winding-up has been passed, with respect to the company, no agreement made between the insurer and the insured after liability has been incurred to a third  party and after the commencement of the insolvency or winding-up, as the case may be, nor any waiver, assignment, or other disposition made by, or payment made to the insured after the commencement aforesaid shall be effective to defeat or affect the rights transferred to the third party under this Act, but those rights shall be the same as if no such agreement, waiver, assignment, disposition or payment had been made.",
            "description": "Where the insured has become insolvent or where, in the case of the insured being a company a winding-up order has been made or a resolution for a voluntary winding-up has been passed, with respect to the company, no agreement made between the insurer and the insured after liability has been incurred to a third  party and after the commencement of the insolvency or winding-up, as the case may be, nor any waiver, assignment, or other disposition made by, or payment made to the insured after the commencement aforesaid shall be effective to defeat or affect the rights transferred to the third party under this Act, but those rights shall be the same as if no such agreement, waiver, assignment, disposition or payment had been made."
        }
    },
    {
        "act": "MOTOR VEHICLES INSURANCE (THIRD PARTY RISKS) ACT",
        "source": "https://mola.gov.gy/laws-of-guyana",
        "type": {
            "name": "section",
            "representation": "13",
            "title": "Insolvency, etc., of insured persons not to affect certain claims by third ",
            "context": "MOTOR VEHICLES INSURANCE (THIRD PARTY RISKS) ACT under Insolvency, etc., of insured persons not to affect certain claims by third 13. Where a certificate of insurance has been issued LAWS OF GUYANA Motor Vehicles Insurance (Third Party Risks) Cap. 51:03 19  L.R.O. 1/2012 of insured persons not to affect certain claims by third parties.             Avoidance of restrictions on scope of policies, and of contracts restrictive of liability in respect of passengers carried for hire or reward.                          under section 4(4) to the person by whom a policy has been effected, the happening in relation to any person insured by the policy of any such event as is mentioned in section 10(1) and (2) shall, notwithstanding anything contained in that section or in sections 11 and 12, not affect any such liability of that person as is required to be covered by a policy under section 4(1)(b), but nothing in this section shall affect any rights against the authorised insurer conferred by this Act on the person to whom the liability was incurred.",
            "description": [
                {
                    "representation": "(4)",
                    "description": "to the person by whom a policy has been effected, the happening in relation to any person insured by the policy of any such event as is mentioned in section 10(1) and"
                },
                {
                    "representation": "(2)",
                    "description": "shall, notwithstanding anything contained in that section or in sections 11 and 12, not affect any such liability of that person as is required to be covered by a policy under section 4(1)(b), but nothing in this section shall affect any rights against the authorised insurer conferred by this Act on the person to whom the liability was incurred."
                }
            ]
        }
    },
    {
        "act": "MOTOR VEHICLES INSURANCE (THIRD PARTY RISKS) ACT",
        "source": "https://mola.gov.gy/laws-of-guyana",
        "type": {
            "name": "section",
            "representation": "14",
            "title": "Avoidance of restrictions on scope of policies, and of contracts restrictive ",
            "context": "MOTOR VEHICLES INSURANCE (THIRD PARTY RISKS) ACT under Avoidance of restrictions on scope of policies, and of contracts restrictive 14. (1) Where a certificate of insurance has been issued  under section 4(7) to the person by whom a policy has been effected, so much of the policy as purports to restrict the insurance of the persons insured thereby by reference to any of the following matters:  (a)    the age or physical or mental condition of persons driving the vehicle; or  (b)      the condition of the vehicle; or  (c)     the number of persons that the vehicle carries; or  (d)    the weight or physical characteristics of the goods that the vehicle carries; or  (e)       the times at which or the areas within which the vehicle is used; or  (f)     the horse power or value of the vehicle; or  (g)   the carrying on the vehicle of any particular apparatus; or   LAWS OF GUYANA 20 Cap. 51:03 Motor Vehicles Insurance (Third Party Risks)  L.R.O. 1/2012       c. 51:02                               Duty of persons against whom claims are made to give information as to insurance.       (h)   the carrying on the vehicle of any particular means of identification other than any means of identification required to be carried by or under the Motor Vehicles and Road Traffic Act,  shall, as respects such liabilities as are required to be covered by a policy under section 4(1)(b), be of no effect:  Provided that nothing in this subsection shall require an authorised insurer to pay any sum in respect of the liability of any person otherwise than in or towards the discharge of that liability, and any sum paid by an authorised insurer in or towards the discharge of any liability of any person which is covered by the policy by virtue only of this section shall be recoverable by the authorised insurer from that person.  (2) Any contract for the conveyance of a passenger in a motor vehicle in which passengers are carried for hire or reward shall, so far as it purports to negative or to restrict the liability of any person in respect of any claim which may be made against that person in respect of the death of, or bodily injury to, the passenger while being carried in or upon or entering or getting on to or alighting from the motor vehicle or purports to impose any conditions with respect to the enforcement of any such liability be void.",
            "description": [
                {
                    "representation": "(1)",
                    "description": "Where a certificate of insurance has been issued  under section 4(7) to the person by whom a policy has been effected, so much of the policy as purports to restrict the insurance of the persons insured thereby by reference to any of the following matters:"
                },
                {
                    "representation": "(a)",
                    "description": "the age or physical or mental condition of persons driving the vehicle; or"
                },
                {
                    "representation": "(b)",
                    "description": "the condition of the vehicle; or"
                },
                {
                    "representation": "(c)",
                    "description": "the number of persons that the vehicle carries; or"
                },
                {
                    "representation": "(d)",
                    "description": "the weight or physical characteristics of the goods that the vehicle carries; or"
                },
                {
                    "representation": "(e)",
                    "description": "the times at which or the areas within which the vehicle is used; or"
                },
                {
                    "representation": "(f)",
                    "description": "the horse power or value of the vehicle; or"
                },
                {
                    "representation": "(g)",
                    "description": "the carrying on the vehicle of any particular apparatus; or   LAWS OF GUYANA 20 Cap. 51:03 Motor Vehicles Insurance"
                },
                {
                    "representation": "(h)",
                    "description": "the carrying on the vehicle of any particular means of identification other than any means of identification required to be carried by or under the Motor Vehicles and Road Traffic Act,  shall, as respects such liabilities as are required to be covered by a policy under section 4(1)(b), be of no effect:  Provided that nothing in this subsection shall require an authorised insurer to pay any sum in respect of the liability of any person otherwise than in or towards the discharge of that liability, and any sum paid by an authorised insurer in or towards the discharge of any liability of any person which is covered by the policy by virtue only of this section shall be recoverable by the authorised insurer from that person."
                },
                {
                    "representation": "(2)",
                    "description": "Any contract for the conveyance of a passenger in a motor vehicle in which passengers are carried for hire or reward shall, so far as it purports to negative or to restrict the liability of any person in respect of any claim which may be made against that person in respect of the death of, or bodily injury to, the passenger while being carried in or upon or entering or getting on to or alighting from the motor vehicle or purports to impose any conditions with respect to the enforcement of any such liability be void."
                }
            ]
        }
    },
    {
        "act": "MOTOR VEHICLES INSURANCE (THIRD PARTY RISKS) ACT",
        "source": "https://mola.gov.gy/laws-of-guyana",
        "type": {
            "name": "section",
            "representation": "15",
            "title": "Duty of persons against whom claims are made to give information as to ",
            "context": "MOTOR VEHICLES INSURANCE (THIRD PARTY RISKS) ACT under Duty of persons against whom claims are made to give information as to 15. (1) Any person against whom a claim is made in respect of any such liability as is required to be covered by a policy under section 4(1)(b) shall, on demand by or on behalf of the person making the claim, state whether or not he was insured in respect of that liability by any policy having effect for the purposes of this Act, or would have been so insured if the authorised insurer had not avoided or cancelled the policy, and if he was or would have been so insured, give such particulars with respect to that policy as were specified in the certificate of insurance issued in respect thereof under LAWS OF GUYANA Motor Vehicles Insurance (Third Party Risks) Cap. 51:03 21  L.R.O. 1/2012          Duty to surrender certificate on cancellation of policy.                Payments and insurance in respect of emergency treatment of injuries arising from the use of motor vehicles on public roads. [6 of 1985]             section 4(4).  (2) If, without reasonable excuse, any person fails to comply with this section, or wilfully makes any false statement in reply to any such demand as aforesaid, he shall be guilty of an offence.",
            "description": [
                {
                    "representation": "(1)",
                    "description": "Any person against whom a claim is made in respect of any such liability as is required to be covered by a policy under section 4(1)(b) shall, on demand by or on behalf of the person making the claim, state whether or not he was insured in respect of that liability by any policy having effect for the purposes of this Act, or would have been so insured if the authorised insurer had not avoided or cancelled the policy, and if he was or would have been so insured, give such particulars with respect to that policy as were specified in the certificate of insurance issued in respect thereof under LAWS OF GUYANA Motor Vehicles Insurance"
                },
                {
                    "representation": "(2)",
                    "description": "If, without reasonable excuse, any person fails to comply with this section, or wilfully makes any false statement in reply to any such demand as aforesaid, he shall be guilty of an offence."
                }
            ]
        }
    },
    {
        "act": "MOTOR VEHICLES INSURANCE (THIRD PARTY RISKS) ACT",
        "source": "https://mola.gov.gy/laws-of-guyana",
        "type": {
            "name": "section",
            "representation": "16",
            "title": "Duty to surrender certificate on cancellation of policy. ",
            "context": "MOTOR VEHICLES INSURANCE (THIRD PARTY RISKS) ACT under Duty to surrender certificate on cancellation of policy. 16. Where a certificate of insurance has been issued under section 4(4) to the person by whom a policy has been effected and the policy is cancelled by mutual consent or by virtue of any provision in the policy, the person to whom the certificate was issued shall, within seven days from the taking effect of the cancellation, surrender the certificate to the authorised insurer or, if it has been lost or destroyed, make and deliver to the authorised insurer a statutory declaration to that effect, and if he fails so to do he shall be guilty of an offence.",
            "description": [
                {
                    "representation": "(4)",
                    "description": "to the person by whom a policy has been effected and the policy is cancelled by mutual consent or by virtue of any provision in the policy, the person to whom the certificate was issued shall, within seven days from the taking effect of the cancellation, surrender the certificate to the authorised insurer or, if it has been lost or destroyed, make and deliver to the authorised insurer a statutory declaration to that effect, and if he fails so to do he shall be guilty of an offence."
                }
            ]
        }
    },
    {
        "act": "MOTOR VEHICLES INSURANCE (THIRD PARTY RISKS) ACT",
        "source": "https://mola.gov.gy/laws-of-guyana",
        "type": {
            "name": "section",
            "representation": "17",
            "title": "[Repealed by Act No. 6 of 1985]",
            "context": "MOTOR VEHICLES INSURANCE (THIRD PARTY RISKS) ACT under [Repealed by Act No. 6 of 1985]17. [Repealed by Act No. 6 of 1985]",
            "description": "[Repealed by Act No. 6 of 1985]"
        }
    },
    {
        "act": "MOTOR VEHICLES INSURANCE (THIRD PARTY RISKS) ACT",
        "source": "https://mola.gov.gy/laws-of-guyana",
        "type": {
            "name": "section",
            "representation": "18",
            "title": "Payments and insurance in respect of emergency treatment of injuries ",
            "context": "MOTOR VEHICLES INSURANCE (THIRD PARTY RISKS) ACT under Payments and insurance in respect of emergency treatment of injuries 18. (1) Where medical or surgical treatment or examination  is immediately required as a result of bodily injury (including fatal injury) to any person caused by, or arising out of, the use of a motor vehicle on a public  road, and the treatment or examination so required (in this section referred to as emergency treatment) is  effected by a registered medical practitioner, the person who was using the vehicle at the time of the event out of which the bodily injury arose shall, on a claim being made in accordance with the next succeeding section, pay to the practitioner, or, where emergency treatment is effected by more than one practitioner, to the practitioner by whom it is first effected  (a)     a fee of twenty-five dollars in respect of each person in whose case the emergency treatment is effected by him; and   LAWS OF GUYANA 22 Cap. 51:03 Motor Vehicles Insurance (Third Party Risks)  L.R.O. 1/2012                                                Provisions as to claims for and supplementary provisions as to payments for, emergency (b)   a sum, in respect of any distance in excess of two miles which he must cover in order to proceed from the place whence he is summoned to the place where the emergency treatment is carried out by him and to return to the first- mentioned place, equal to one dollar for every complete mile and additional part of a mile of that distance.  (2) Where emergency treatment is first effected in a hospital (that is to say, an institution which provides medical or surgical treatment of in-patients) the provisions of the foregoing subsection with respect to the payment of a fee shall, so far as applicable, have effect with the substitution of references to the hospital for references to a registered medical practitioner.  (3) Liability incurred under this section by the person using a vehicle shall, where the event out of which it arose was caused by the wrongful act of another person, be treated for the purposes of any claim to recover damage by reason of that wrongful act as damage sustained by the person using the vehicle.  (4) In section 4(1)(b), the reference to liability in respect of death or bodily injury shall be deemed to include a reference to liability to make a payment under this section in respect of emergency treatment required as a result of bodily injury, and the proviso to that paragraph shall not have effect as respects liability to make a payment under this section.",
            "description": [
                {
                    "representation": "(1)",
                    "description": "Where medical or surgical treatment or examination  is immediately required as a result of bodily injury"
                },
                {
                    "representation": "(a)",
                    "description": "a fee of twenty-five dollars in respect of each person in whose case the emergency treatment is effected by him; and   LAWS OF GUYANA 22 Cap. 51:03 Motor Vehicles Insurance"
                },
                {
                    "representation": "(b)",
                    "description": "a sum, in respect of any distance in excess of two miles which he must cover in order to proceed from the place whence he is summoned to the place where the emergency treatment is carried out by him and to return to the first- mentioned place, equal to one dollar for every complete mile and additional part of a mile of that distance."
                },
                {
                    "representation": "(2)",
                    "description": "Where emergency treatment is first effected in a hospital"
                },
                {
                    "representation": "(3)",
                    "description": "Liability incurred under this section by the person using a vehicle shall, where the event out of which it arose was caused by the wrongful act of another person, be treated for the purposes of any claim to recover damage by reason of that wrongful act as damage sustained by the person using the vehicle."
                },
                {
                    "representation": "(4)",
                    "description": "In section 4(1)(b), the reference to liability in respect of death or bodily injury shall be deemed to include a reference to liability to make a payment under this section in respect of emergency treatment required as a result of bodily injury, and the proviso to that paragraph shall not have effect as respects liability to make a payment under this section."
                }
            ]
        }
    },
    {
        "act": "MOTOR VEHICLES INSURANCE (THIRD PARTY RISKS) ACT",
        "source": "https://mola.gov.gy/laws-of-guyana",
        "type": {
            "name": "section",
            "representation": "19",
            "title": "Provisions as to claims for, and supplementary provisions as to payments ",
            "context": "MOTOR VEHICLES INSURANCE (THIRD PARTY RISKS) ACT under Provisions as to claims for, and supplementary provisions as to payments 19. (1) The Commissioner shall, if so requested by a person who alleges that he is entitled to claim a payment under the last foregoing section, furnish to that person any information at his disposal as to the identification marks of any motor vehicle which that person alleges to be a vehicle LAWS OF GUYANA Motor Vehicles Insurance (Third Party Risks) Cap. 51:03 23  L.R.O. 1/2012 treatment.                                                out of the use of which the bodily injury arose, and as to the identity and address of the person who was using the vehicle at the time of the event out of which it arose.  (2) A claim for a payment under the last foregoing section may be made at the time when the emergency treatment is effected, by oral request to the person who was using the vehicle, and if not so made must be made by request in writing served on him within seven days from the day on which the emergency treatment was effected.  (3) A request in writing must be signed by the claimant or, in the case of a hospital, by an executive officer thereof, and must state the name and address of the claimant, the circumstances in which the emergency treatment was effected, and that it was first effected by the claimant, or in the case of a hospital, in the hospital.  (4) A request in writing may be served by delivering it to the person who was using the vehicle, or by sending it in a pre-paid registered letter addressed to him at his usual or last-known address.  (5) A sum payable under the last foregoing section shall be recoverable as if it were a simple contract debt due from the person who was using the vehicle to the practitioner or the hospital.  (6) A payment made under the last foregoing section to a practitioner or hospital shall operate as a discharge, to the extent of the amount paid, of any liability of the person who was using the vehicle, or of any other person, to pay any sum in respect of the expenses or remuneration of the practitioner or hospital of or for effecting the emergency treatment.  (7) A payment under the last foregoing section shall not be deemed to be a payment by an authorised insurer LAWS OF GUYANA 24 Cap. 51:03 Motor Vehicles Insurance (Third Party Risks)  L.R.O. 1/2012       Forgery, etc. of certificates.  [6 of 1985 16 of 1997] [17 of 1998]                                       or owner for the purposes of section 4(2).",
            "description": [
                {
                    "representation": "(1)",
                    "description": "The Commissioner shall, if so requested by a person who alleges that he is entitled to claim a payment under the last foregoing section, furnish to that person any information at his disposal as to the identification marks of any motor vehicle which that person alleges to be a vehicle LAWS OF GUYANA Motor Vehicles Insurance"
                },
                {
                    "representation": "(2)",
                    "description": "A claim for a payment under the last foregoing section may be made at the time when the emergency treatment is effected, by oral request to the person who was using the vehicle, and if not so made must be made by request in writing served on him within seven days from the day on which the emergency treatment was effected."
                },
                {
                    "representation": "(3)",
                    "description": "A request in writing must be signed by the claimant or, in the case of a hospital, by an executive officer thereof, and must state the name and address of the claimant, the circumstances in which the emergency treatment was effected, and that it was first effected by the claimant, or in the case of a hospital, in the hospital."
                },
                {
                    "representation": "(4)",
                    "description": "A request in writing may be served by delivering it to the person who was using the vehicle, or by sending it in a pre-paid registered letter addressed to him at his usual or last-known address."
                },
                {
                    "representation": "(5)",
                    "description": "A sum payable under the last foregoing section shall be recoverable as if it were a simple contract debt due from the person who was using the vehicle to the practitioner or the hospital."
                },
                {
                    "representation": "(6)",
                    "description": "A payment made under the last foregoing section to a practitioner or hospital shall operate as a discharge, to the extent of the amount paid, of any liability of the person who was using the vehicle, or of any other person, to pay any sum in respect of the expenses or remuneration of the practitioner or hospital of or for effecting the emergency treatment."
                },
                {
                    "representation": "(7)",
                    "description": "A payment under the last foregoing section shall not be deemed to be a payment by an authorised insurer LAWS OF GUYANA 24 Cap. 51:03 Motor Vehicles Insurance"
                }
            ]
        }
    },
    {
        "act": "MOTOR VEHICLES INSURANCE (THIRD PARTY RISKS) ACT",
        "source": "https://mola.gov.gy/laws-of-guyana",
        "type": {
            "name": "section",
            "representation": "20",
            "title": "Repealed by Act No. 6 of 1985 ",
            "context": "MOTOR VEHICLES INSURANCE (THIRD PARTY RISKS) ACT under Repealed by Act No. 6 of 1985 20. [Repealed by Act No. 6 of 1985]",
            "description": "[Repealed by Act No. 6 of 1985]"
        }
    },
    {
        "act": "MOTOR VEHICLES INSURANCE (THIRD PARTY RISKS) ACT",
        "source": "https://mola.gov.gy/laws-of-guyana",
        "type": {
            "name": "section",
            "representation": "21",
            "title": "Forgery, etc., of certificates. ",
            "context": "MOTOR VEHICLES INSURANCE (THIRD PARTY RISKS) ACT under Forgery, etc., of certificates. 21. (1) If, with intent to deceive, any person  (a)     forges or alters or uses or lends to or allows to be used by any other person a certificate of insurance under this Act; or  (b)  makes or has in possession any document so closely resembling such a certificate as to be calculated to deceive,   he shall be guilty of a misdemeanour and shall be liable  (i)     on conviction on indictment to imprisonment for four years; (ii)      on summary conviction to a fine of not less than forty thousand dollars nor more than eighty thousand dollars and to imprisonment for eight months.  (2) If any person for the purpose of obtaining a licence for any motor vehicle or the issue of a certificate of insurance under this Act makes any false statement or withholds any material information, he shall be liable to a fine of not less than twenty-five thousand dollars nor more than fifty thousand dollars and to imprisonment for twelve months.  (3) If any person issues a certificate of insurance which is to his knowledge false in any material particular, he shall be liable to a fine of not less than fifty thousand dollars nor more than one hundred thousand dollars and to LAWS OF GUYANA Motor Vehicles Insurance (Third Party Risks) Cap. 51:03 25  L.R.O. 1/2012                                        Prosecutions.                    Refusing to give name or address or giving false name or address.          Offences and general penalty. imprisonment for twelve months.  (4) If any member of the police force has reasonable cause to believe that any certificate of insurance produced to him in pursuance of this Act by the driver of a motor vehicle is a document in relation to which an offence under this section has been committed, he may seize the document and when any document is seized under this section, the person from whom it was taken shall, unless the document has been previously returned to him or he has previously been charged with an offence under this section, be summoned before a court of summary jurisdiction to account for his possession of the said document and the court shall make such order respecting the disposal of the said document and award such costs as the justice of the case may require.  (5) In this section the expression certificate of insurance includes any document issued under regulations made by the Minister in pursuance of his power under this Act to prescribe documents which may be produced in lieu of a certificate of insurance.",
            "description": [
                {
                    "representation": "(1)",
                    "description": "If, with intent to deceive, any person"
                },
                {
                    "representation": "(a)",
                    "description": "forges or alters or uses or lends to or allows to be used by any other person a certificate of insurance under this Act; or"
                },
                {
                    "representation": "(b)",
                    "description": "makes or has in possession any document so closely resembling such a certificate as to be calculated to deceive,   he shall be guilty of a misdemeanour and shall be liable"
                },
                {
                    "representation": "(i)",
                    "description": "on conviction on indictment to imprisonment for four years;"
                },
                {
                    "representation": "(2)",
                    "description": "If any person for the purpose of obtaining a licence for any motor vehicle or the issue of a certificate of insurance under this Act makes any false statement or withholds any material information, he shall be liable to a fine of not less than twenty-five thousand dollars nor more than fifty thousand dollars and to imprisonment for twelve months."
                },
                {
                    "representation": "(3)",
                    "description": "If any person issues a certificate of insurance which is to his knowledge false in any material particular, he shall be liable to a fine of not less than fifty thousand dollars nor more than one hundred thousand dollars and to LAWS OF GUYANA Motor Vehicles Insurance"
                },
                {
                    "representation": "(4)",
                    "description": "If any member of the police force has reasonable cause to believe that any certificate of insurance produced to him in pursuance of this Act by the driver of a motor vehicle is a document in relation to which an offence under this section has been committed, he may seize the document and when any document is seized under this section, the person from whom it was taken shall, unless the document has been previously returned to him or he has previously been charged with an offence under this section, be summoned before a court of summary jurisdiction to account for his possession of the said document and the court shall make such order respecting the disposal of the said document and award such costs as the justice of the case may require."
                },
                {
                    "representation": "(5)",
                    "description": "In this section the expression certificate of insurance includes any document issued under regulations made by the Minister in pursuance of his power under this Act to prescribe documents which may be produced in lieu of a certificate of insurance."
                }
            ]
        }
    },
    {
        "act": "MOTOR VEHICLES INSURANCE (THIRD PARTY RISKS) ACT",
        "source": "https://mola.gov.gy/laws-of-guyana",
        "type": {
            "name": "section",
            "representation": "22",
            "title": "Prosecutions. ",
            "context": "MOTOR VEHICLES INSURANCE (THIRD PARTY RISKS) ACT under Prosecutions. 22. Save as otherwise expressly provided all offences under this Act shall be prosecuted under the Summary Jurisdiction Acts.",
            "description": "Save as otherwise expressly provided all offences under this Act shall be prosecuted under the Summary Jurisdiction Acts."
        }
    },
    {
        "act": "MOTOR VEHICLES INSURANCE (THIRD PARTY RISKS) ACT",
        "source": "https://mola.gov.gy/laws-of-guyana",
        "type": {
            "name": "section",
            "representation": "23",
            "title": "Refusing to give name or address or giving false name or address. ",
            "context": "MOTOR VEHICLES INSURANCE (THIRD PARTY RISKS) ACT under Refusing to give name or address or giving false name or address. 23. If the driver of any motor vehicle who commits an offence under this Act or any regulations made thereunder, refuses to give his name and address or gives a false name or address he shall be guilty of an offence; and it shall be the duty of the owner of the motor vehicle if required to give any information which it is within his power to give and which may lead to the identification and apprehension of the driver and if the owner fails to do so he shall be guilty of an offence.",
            "description": "If the driver of any motor vehicle who commits an offence under this Act or any regulations made thereunder, refuses to give his name and address or gives a false name or address he shall be guilty of an offence; and it shall be the duty of the owner of the motor vehicle if required to give any information which it is within his power to give and which may lead to the identification and apprehension of the driver and if the owner fails to do so he shall be guilty of an offence."
        }
    },
    {
        "act": "MOTOR VEHICLES INSURANCE (THIRD PARTY RISKS) ACT",
        "source": "https://mola.gov.gy/laws-of-guyana",
        "type": {
            "name": "section",
            "representation": "24",
            "title": "Offences and general penalty. ",
            "context": "MOTOR VEHICLES INSURANCE (THIRD PARTY RISKS) ACT under Offences and general penalty. 24. (1) Any person who by any act or omission contravenes or fails to comply with this Act shall, unless a LAWS OF GUYANA 26 Cap. 51:03 Motor Vehicles Insurance (Third Party Risks)  L.R.O. 1/2012  [16 of 1997 17 of 1998]                                       Regulations. [6 of 1985 16 of 1997 17 of 1998]  penalty is otherwise specifically provided, be liable on summary conviction to a fine of  not less than fifteen thousand dollars nor more than thirty thousand dollars or to imprisonment for six months.  (2) Where a person is, by virtue of any power contained in this Act or in any regulations made thereunder, required to do or to abstain from doing any act or thing and makes default in complying with any such requisition, it shall be lawful for a magistrate on conviction, in addition to any other penalty which he may impose, to order such person to comply with such requisition and to annex to any such order any condition as to time or mode of action or otherwise which he may think necessary to enforce compliance therewith.  (3) Every person who makes default in complying with any such order of the magistrate may, in the discretion of the court, be ordered to pay a sum not exceeding two thousand dollars for every day during which he is thereafter in default or to be imprisoned until he has remedied his default:  Provided that any such person shall not for such non-compliance be liable to the payment of any sums amounting in the aggregate to more than thirty thousand dollars or to imprisonment  for any periods amounting in the aggregate to more than four months in addition to any other fine or term of imprisonment to which he may otherwise be liable.",
            "description": [
                {
                    "representation": "(1)",
                    "description": "Any person who by any act or omission contravenes or fails to comply with this Act shall, unless a LAWS OF GUYANA 26 Cap. 51:03 Motor Vehicles Insurance"
                },
                {
                    "representation": "(2)",
                    "description": "Where a person is, by virtue of any power contained in this Act or in any regulations made thereunder, required to do or to abstain from doing any act or thing and makes default in complying with any such requisition, it shall be lawful for a magistrate on conviction, in addition to any other penalty which he may impose, to order such person to comply with such requisition and to annex to any such order any condition as to time or mode of action or otherwise which he may think necessary to enforce compliance therewith."
                },
                {
                    "representation": "(3)",
                    "description": "Every person who makes default in complying with any such order of the magistrate may, in the discretion of the court, be ordered to pay a sum not exceeding two thousand dollars for every day during which he is thereafter in default or to be imprisoned until he has remedied his default:  Provided that any such person shall not for such non-compliance be liable to the payment of any sums amounting in the aggregate to more than thirty thousand dollars or to imprisonment  for any periods amounting in the aggregate to more than four months in addition to any other fine or term of imprisonment to which he may otherwise be liable."
                }
            ]
        }
    },
    {
        "act": "MOTOR VEHICLES INSURANCE (THIRD PARTY RISKS) ACT",
        "source": "https://mola.gov.gy/laws-of-guyana",
        "type": {
            "name": "section",
            "representation": "25",
            "title": "Regulations. ",
            "context": "MOTOR VEHICLES INSURANCE (THIRD PARTY RISKS) ACT under Regulations. 25. (1) The Minister may make regulations for prescribing anything which may be prescribed under this Act and generally for the purpose of carrying this Act into effect, and in particular, but without prejudice to the generality of the foregoing provisions, may make regulations  (a)   as to the forms to be used for the purposes of this Act;  LAWS OF GUYANA Motor Vehicles Insurance (Third Party Risks) Cap. 51:03 27  L.R.O. 1/2012 (b)     as to applications for and the issue of certificates of insurance and any other documents which may be prescribed and as to the keeping of records of    documents and the furnishing of particulars thereof or the giving of information with respect thereto to the Minister or Commissioner or Commissioner of Insurance;         (c)    as to the issue of copies of any such certificates or of other documents which are lost or destroyed;  (d)  as to the custody, production, cancellation and surrender of any such certificates or other documents;  (e)    for providing that any provisions of this Act shall, in relation to motor vehicles brought into Guyana by persons making only a temporary stay therein, have effect subject to such modifications and adaptations as may be prescribed;  (f)   with respect to applications for the payment of deposits, the investment thereof or dealing therewith, the deposit of securities in lieu of money, the payment of the interest or dividends from time to time accruing due on any securities, in which deposits are  for the time being invested, and the withdrawal and transfer of deposits.  LAWS OF GUYANA 28 Cap. 51:03 Motor Vehicles Insurance (Third Party Risks)  L.R.O. 1/2012  (2) If any person acts in contravention of or fails to comply with any regulation under this Act he shall, for each offence, be liable to such maximum penalty not exceeding a fine of thirty thousand dollars as may be prescribed by the regulations.                         ____________________     LAWS OF GUYANA                                       Motor Vehicles Insurance (Third Party Risks) Cap. 51:03 29  SUBSIDIARY LEGISLATION  _________________   [Reg. 7/12/1937 7/1997] MOTOR VEHICLES (THIRD-PARTY RISKS) REGULATIONS  made under section 25   ARRANGEMENT OF REGULATIONS                                 REGULATION  PART I",
            "description": [
                {
                    "representation": "(1)",
                    "description": "The Minister may make regulations for prescribing anything which may be prescribed under this Act and generally for the purpose of carrying this Act into effect, and in particular, but without prejudice to the generality of the foregoing provisions, may make regulations"
                },
                {
                    "representation": "(a)",
                    "description": "as to the forms to be used for the purposes of this Act;  LAWS OF GUYANA Motor Vehicles Insurance"
                },
                {
                    "representation": "(b)",
                    "description": "as to applications for and the issue of certificates of insurance and any other documents which may be prescribed and as to the keeping of records of    documents and the furnishing of particulars thereof or the giving of information with respect thereto to the Minister or Commissioner or Commissioner of Insurance;"
                },
                {
                    "representation": "(c)",
                    "description": "as to the issue of copies of any such certificates or of other documents which are lost or destroyed;"
                },
                {
                    "representation": "(d)",
                    "description": "as to the custody, production, cancellation and surrender of any such certificates or other documents;"
                },
                {
                    "representation": "(e)",
                    "description": "for providing that any provisions of this Act shall, in relation to motor vehicles brought into Guyana by persons making only a temporary stay therein, have effect subject to such modifications and adaptations as may be prescribed;"
                },
                {
                    "representation": "(f)",
                    "description": "with respect to applications for the payment of deposits, the investment thereof or dealing therewith, the deposit of securities in lieu of money, the payment of the interest or dividends from time to time accruing due on any securities, in which deposits are  for the time being invested, and the withdrawal and transfer of deposits.  LAWS OF GUYANA 28 Cap. 51:03 Motor Vehicles Insurance"
                },
                {
                    "representation": "(2)",
                    "description": "If any person acts in contravention of or fails to comply with any regulation under this Act he shall, for each offence, be liable to such maximum penalty not exceeding a fine of thirty thousand dollars as may be prescribed by the regulations.                         ____________________     LAWS OF GUYANA                                       Motor Vehicles Insurance"
                }
            ]
        }
    }
]