[
    {
        "act": "GUYANA WATER AUTHORITY ACT",
        "source": "https://mola.gov.gy/laws-of-guyana",
        "type": {
            "name": "section",
            "representation": "1",
            "title": "Short title. ",
            "context": "GUYANA WATER AUTHORITY ACT under Short title. 1. This Act may be cited as the Guyana Water Authority Act.",
            "description": "This Act may be cited as the Guyana Water Authority Act."
        }
    },
    {
        "act": "GUYANA WATER AUTHORITY ACT",
        "source": "https://mola.gov.gy/laws-of-guyana",
        "type": {
            "name": "section",
            "representation": "2",
            "title": "Interpretation. ",
            "context": "GUYANA WATER AUTHORITY ACT under Interpretation. 2. In this Act-  appointed day means the day appointed by order of the Minister pursuant to section 1;  collecting sewer means the common drain into which is discharged the sewage from two or more premises and which conveys that sewage to a street sewer, and includes all  appliances and accessories thereto;  collecting sewer system means a collecting sewer together with all the house-sewers by which sewage is conveyed into the collecting sewer;  house sewer means any drain or pipe for the drainage of the sewage from a house or building, its areas, water closets, baths, offices, and stables, to a street sewer or to a collecting sewer, and includes gully traps, sinks, approved traps and other accessories;  local authority has the meaning assigned to that expression by section 2 of the Local Authorities (Elections) Act;  member of the Authority includes the chairman, the deputy chairman, and any temporary member of the Authority; LAWS OF GUYANA Guyana Water Authority Cap. 55:01 5  L.R.O. 1/2012                                           Establishment and incorporation of the Guyana Water Authority.  owner means the person for the time being receiving the rent of the premises in connection with which the word is used, whether on his own account or as agent or trustee for any other person or who would so receive the rent if the premises were let, and where the premises are not let includes any person in possession thereof;  premises includes land;  sewage includes drainage, storm water, domestic water, domestic wastes, commercial wastes and industrial wastes;  sewage service means the acceptance, collection, transmission, storage, treatment and disposal of sewage, or any one or more of them;  sewage works means any works for the collection, transmission, treatment and disposal of sewage, or any part of any such works, but does not include plumbing or other works to which regulations made pursuant to section 28(1)(e) apply;  water service means the taking, collection, production, treatment, storage, supply, transmission, distribution, sale, purchase and use of water or any one or more of them;  waterworks means any works for the collection, transmission, treatment, storage, supply and distribution of water, or any part of any such works, but does not include plumbing or other works to which regulations made under section 28(1)(e) apply.",
            "description": [
                {
                    "representation": "(e)",
                    "description": "apply;  water service means the taking, collection, production, treatment, storage, supply, transmission, distribution, sale, purchase and use of water or any one or more of them;  waterworks means any works for the collection, transmission, treatment, storage, supply and distribution of water, or any part of any such works, but does not include plumbing or other works to which regulations made under section 28(1)(e) apply."
                }
            ]
        }
    },
    {
        "act": "GUYANA WATER AUTHORITY ACT",
        "source": "https://mola.gov.gy/laws-of-guyana",
        "type": {
            "name": "section",
            "representation": "3",
            "title": "Establishment and incorporation of the Guyana Water Authority. ",
            "context": "GUYANA WATER AUTHORITY ACT under Establishment and incorporation of the Guyana Water Authority. 3. There is established a body to be called the Guyana Water Authority (hereinafter referred to as the Authority) which shall be a body corporate.  LAWS OF GUYANA 6 Cap. 55:01 Guyana Water Authority   Constitution of the Authority. [27 of 1974 5 of 1995]  Application of certain provisions of the Public Corporations Act to the Authority. [27 of 1974] c. 19:05        Power of the Minister to give directions to the Authority. [27 of 1974]",
            "description": "There is established a body to be called the Guyana Water Authority (hereinafter referred to as the Authority) which shall be a body corporate.  LAWS OF GUYANA 6 Cap. 55:01 Guyana Water Authority   Constitution of the Authority. [27 of 1974 5 of 1995]  Application of certain provisions of the Public Corporations Act to the Authority. [27 of 1974] c. 19:05        Power of the Minister to give directions to the Authority. [27 of 1974]"
        }
    },
    {
        "act": "GUYANA WATER AUTHORITY ACT",
        "source": "https://mola.gov.gy/laws-of-guyana",
        "type": {
            "name": "section",
            "representation": "4",
            "title": "Constitution of the Authority. ",
            "context": "GUYANA WATER AUTHORITY ACT under Constitution of the Authority. 4. The Authority shall consist of such number of persons being not less than twelve nor more than fifteen members as may be appointed by the Minister.",
            "description": "The Authority shall consist of such number of persons being not less than twelve nor more than fifteen members as may be appointed by the Minister."
        }
    },
    {
        "act": "GUYANA WATER AUTHORITY ACT",
        "source": "https://mola.gov.gy/laws-of-guyana",
        "type": {
            "name": "section",
            "representation": "5",
            "title": "Application of certain provisions of the Public Corporations Act to the Authority. ",
            "context": "GUYANA WATER AUTHORITY ACT under Application of certain provisions of the Public Corporations Act to the Authority. 5.  Sections 17 (other than subsection (1) thereof), 18, 19 (other than subsection (9)), sections 20 to 26 (inclusive), 30 to 45 (inclusive), 49, 52, 53, 55, 56 and 58 to 61 (inclusive) of the Public Corporations Act shall, as the same apply in relation to a public corporation established under that Act, apply mutatis mutandis in relation to the Authority, subject to the following modifications, namely, as if for every reference to the Guyana State Corporation in sections 22, 23, 26, 31, 33, 38, 44 and 45 there had been substituted a reference to the Minister.",
            "description": [
                {
                    "representation": "(1)",
                    "description": "thereof), 18, 19"
                }
            ]
        }
    },
    {
        "act": "GUYANA WATER AUTHORITY ACT",
        "source": "https://mola.gov.gy/laws-of-guyana",
        "type": {
            "name": "section",
            "representation": "6",
            "title": "Power of the Minister to give directions to the Authority. ",
            "context": "GUYANA WATER AUTHORITY ACT under Power of the Minister to give directions to the Authority. 6. (l) The Minister may give to the Authority directions of a general character as to the policy to be followed by the Authority in the performance of their functions under this Act and the Authority shall give effect to any such directions.  (2) In carrying out such measures of re-organisation or such works of development as involve substantial outlay on capital account, the Authority shall act in accordance with a general programme approved by the Minister.  (3) In the exercise of their functions in relation to training, education and research, the Authority shall act in accordance with a general programme approved as aforesaid.  (4) The Authority shall afford to the Minister facilities for obtaining information with respect to the business of the Authority and shall furnish annual estimates and such returns and other information as the Minister may require.  (5) The Authority shall provide such facilities to L.R.O. 1/2012 LAWS OF GUYANA Guyana Water Authority Cap. 55:01 7  L.R.O. 1/2012              Functions of the Authority. [27 of 1974 6 of 1997]                                 the Minister as will enable the verification of information furnished in pursuance of this section.  (6) The power of the Minister to give directions to the Authority shall extend to the giving to them of specific directions as to the disposal of capital assets or the application of the proceeds of such disposals, and any direction so given may require the whole or any part of the revenues of the Authority to be paid into the Consolidated Fund.",
            "description": [
                {
                    "representation": "(l)",
                    "description": "The Minister may give to the Authority directions of a general character as to the policy to be followed by the Authority in the performance of their functions under this Act and the Authority shall give effect to any such directions."
                },
                {
                    "representation": "(2)",
                    "description": "In carrying out such measures of re-organisation or such works of development as involve substantial outlay on capital account, the Authority shall act in accordance with a general programme approved by the Minister."
                },
                {
                    "representation": "(3)",
                    "description": "In the exercise of their functions in relation to training, education and research, the Authority shall act in accordance with a general programme approved as aforesaid."
                },
                {
                    "representation": "(4)",
                    "description": "The Authority shall afford to the Minister facilities for obtaining information with respect to the business of the Authority and shall furnish annual estimates and such returns and other information as the Minister may require."
                },
                {
                    "representation": "(5)",
                    "description": "The Authority shall provide such facilities to L.R.O. 1/2012 LAWS OF GUYANA Guyana Water Authority Cap. 55:01 7  L.R.O. 1/2012              Functions of the Authority. [27 of 1974 6 of 1997]                                 the Minister as will enable the verification of information furnished in pursuance of this section."
                },
                {
                    "representation": "(6)",
                    "description": "The power of the Minister to give directions to the Authority shall extend to the giving to them of specific directions as to the disposal of capital assets or the application of the proceeds of such disposals, and any direction so given may require the whole or any part of the revenues of the Authority to be paid into the Consolidated Fund."
                }
            ]
        }
    },
    {
        "act": "GUYANA WATER AUTHORITY ACT",
        "source": "https://mola.gov.gy/laws-of-guyana",
        "type": {
            "name": "section",
            "representation": "7",
            "title": "Functions of the Authority. ",
            "context": "GUYANA WATER AUTHORITY ACT under Functions of the Authority. 7. (1) Subject to this Act, it is the function of the Authority   (a) to control and regulate the collection,  production, treatment, storage, transmission, distribution and use of water (including the supervision of surface waters and ground waters in Guyana), and to make orders with respect thereto;   (b) to construct, acquire, provide, operate and maintain waterworks and to develop and make available supplies of water to the public;  (c) to construct, acquire, provide, operate and maintain sewage works and to receive, treat and dispose of sewage;   (d) to make agreements with any person with respect to the supply of water, or the reception, treatment and disposal of sewage;  (e) to conduct research programmes for the purpose of their functions under this Act; LAWS OF GUYANA 8 Cap. 55:01 Guyana Water Authority  L.R.O. 1/2012                                               Exclusive right of Authority to provide  sewage and water services.   (f) to disseminate information and advice with respect to the collection, production, transmission, treatment, storage, supplies  and distribution of water or sewerage and to charge fees in respect thereof;  (g) to advise the Minister on matters relating to the collection, production, transmission,  treatment, storage, supply and distribution of water, and to the treatment and disposal of sewage;  (h) to perform such other functions, not inconsistent with this Act, as may be assigned to them, from time to time, by the Minister;  (i) to carry on such other activities as may appear to the Authority requisite, advantageous or conducive for or in connection with the performance of their functions under this Act.  (2) Every person who contravenes, or fails to comply with, an order made by the Authority pursuant to subsection (l)(a) is liable on summary conviction to a fine of thirty-two thousand five hundred dollars and, in addition to a further penalty of three thousand two hundred and fifty dollars for every day during which the offence continues.",
            "description": [
                {
                    "representation": "(1)",
                    "description": "Subject to this Act, it is the function of the Authority"
                },
                {
                    "representation": "(a)",
                    "description": "is liable on summary conviction to a fine of thirty-two thousand five hundred dollars and, in addition to a further penalty of three thousand two hundred and fifty dollars for every day during which the offence continues."
                },
                {
                    "representation": "(b)",
                    "description": "to construct, acquire, provide, operate and maintain waterworks and to develop and make available supplies of water to the public;"
                },
                {
                    "representation": "(c)",
                    "description": "to construct, acquire, provide, operate and maintain sewage works and to receive, treat and dispose of sewage;"
                },
                {
                    "representation": "(d)",
                    "description": "to make agreements with any person with respect to the supply of water, or the reception, treatment and disposal of sewage;"
                },
                {
                    "representation": "(e)",
                    "description": "to conduct research programmes for the purpose of their functions under this Act; LAWS OF GUYANA 8 Cap. 55:01 Guyana Water Authority  L.R.O. 1/2012                                               Exclusive right of Authority to provide  sewage and water services."
                },
                {
                    "representation": "(f)",
                    "description": "to disseminate information and advice with respect to the collection, production, transmission, treatment, storage, supplies  and distribution of water or sewerage and to charge fees in respect thereof;"
                },
                {
                    "representation": "(g)",
                    "description": "to advise the Minister on matters relating to the collection, production, transmission,  treatment, storage, supply and distribution of water, and to the treatment and disposal of sewage;"
                },
                {
                    "representation": "(h)",
                    "description": "to perform such other functions, not inconsistent with this Act, as may be assigned to them, from time to time, by the Minister;"
                },
                {
                    "representation": "(i)",
                    "description": "to carry on such other activities as may appear to the Authority requisite, advantageous or conducive for or in connection with the performance of their functions under this Act."
                },
                {
                    "representation": "(2)",
                    "description": "Every person who contravenes, or fails to comply with, an order made by the Authority pursuant to subsection"
                }
            ]
        }
    },
    {
        "act": "GUYANA WATER AUTHORITY ACT",
        "source": "https://mola.gov.gy/laws-of-guyana",
        "type": {
            "name": "section",
            "representation": "8",
            "title": "Exclusive right of Authority to provide sewage and water services. ",
            "context": "GUYANA WATER AUTHORITY ACT under Exclusive right of Authority to provide sewage and water services. 8. (1) Subject to this Act, the Authority has the exclusive right to provide sewage services and water services  (a) in those areas of Guyana provided with sewage services and water LAWS OF GUYANA Guyana Water Authority Cap. 55:01 9  L.R.O. 1/2012                                             Disclosure of interest. [27 of 1974 6 of 1997]      services or either of such services by the Pure Water Supply Division of the Ministry of Works, Hydraulics and Supply immediately before the commencement of this Act; and  (b) in those other areas of Guyana which, immediately before the commencement of  this Act, were not being provided with sewage services and water services or either of such services by any statutory body.  (2) The Authority shall, within the areas mentioned in subsection (1), provide sewage services and water services or either of such services for any person requiring the provision of those services upon such terms and conditions as the Authority may determine except that until such time as the Authority are able to provide any such area with sewage services and water services they may in exercise of their powers under section 10 authorise any local authority or other body to provide those services on their behalf.  (3) Subject to this Act, the Authority, within the areas provided with sewage services and water services by the Authority, have the exclusive right to make connections of premises with the nearest water main or sewer in the roads of those areas, and any renewal of those connections and all repairs thereto, at any time the Authority find it necessary to do so.",
            "description": [
                {
                    "representation": "(1)",
                    "description": "Subject to this Act, the Authority has the exclusive right to provide sewage services and water services"
                },
                {
                    "representation": "(a)",
                    "description": "in those areas of Guyana provided with sewage services and water LAWS OF GUYANA Guyana Water Authority Cap. 55:01 9  L.R.O. 1/2012                                             Disclosure of interest. [27 of 1974 6 of 1997]      services or either of such services by the Pure Water Supply Division of the Ministry of Works, Hydraulics and Supply immediately before the commencement of this Act; and"
                },
                {
                    "representation": "(b)",
                    "description": "in those other areas of Guyana which, immediately before the commencement of  this Act, were not being provided with sewage services and water services or either of such services by any statutory body."
                },
                {
                    "representation": "(2)",
                    "description": "The Authority shall, within the areas mentioned in subsection"
                },
                {
                    "representation": "(3)",
                    "description": "Subject to this Act, the Authority, within the areas provided with sewage services and water services by the Authority, have the exclusive right to make connections of premises with the nearest water main or sewer in the roads of those areas, and any renewal of those connections and all repairs thereto, at any time the Authority find it necessary to do so."
                }
            ]
        }
    },
    {
        "act": "GUYANA WATER AUTHORITY ACT",
        "source": "https://mola.gov.gy/laws-of-guyana",
        "type": {
            "name": "section",
            "representation": "9",
            "title": "Disclosure of interest. ",
            "context": "GUYANA WATER AUTHORITY ACT under Disclosure of interest. 9. (1) A member of the Authority, who is in any way, whether directly or indirectly, interested in a contract or proposed contract with the Authority shall disclose to the Authority the fact and nature of his interest at the first meeting of the Authority at which it is practicable for him to do so and shall not take part in any deliberation or decision of the Authority relating to the contract; and the disclosure shall LAWS OF GUYANA 10 Cap. 55:01 Guyana Water Authority  L.R.O. 1/2012                                                  be recorded in the minutes of the Authority.  (2) This section does not apply to   (a) an interest in a contract which a member of the Authority may have by reason of making payments to the Authority in respect of water service or sewage service provided by the Authority; or  (b) an interest in any matter relating to the terms on which the right to participate in any service provided by the Authority, is offered to the public.  (3) For the purpose of this section, a person   (a) who, or any nominee of whom, is a shareholder or partner in a company or other body of persons (other than a statutory authority), or  (b) who is an employee thereof,  shall be treated as having indirectly a pecuniary interest in a contract, if such company or other body of persons is a party to the contract or proposed contract under consideration.  (4) Nothing in subsection (3) applies to any person who, but for the provisions of subsection (3), would not fail to be treated as having indirectly a pecuniary interest in a contract if the total value of his shareholding or other interest does not exceed the amount of the total nominal value of the issued share capital of the company or body as may be prescribed by order of the Minister.  (5) Without prejudice to subsection (6), the LAWS OF GUYANA Guyana Water Authority Cap. 55:01 11  L.R.O. 1/2012               Authority may delegate their functions to other bodies.            Power of Authority to give directions to other bodies. [6 of 1997]               Minister may terminate the appointment of any member of the Authority appointed by him who fails to comply with this section.   (6) A person who fails to comply with this section is liable on summary conviction to a fine of sixteen thousand two hundred and fifty dollars for every offence, unless he proves that he did not know that a contract or proposed contract in which he had a pecuniary interest was the subject of consideration at the meeting.",
            "description": [
                {
                    "representation": "(1)",
                    "description": "A member of the Authority, who is in any way, whether directly or indirectly, interested in a contract or proposed contract with the Authority shall disclose to the Authority the fact and nature of his interest at the first meeting of the Authority at which it is practicable for him to do so and shall not take part in any deliberation or decision of the Authority relating to the contract; and the disclosure shall LAWS OF GUYANA 10 Cap. 55:01 Guyana Water Authority  L.R.O. 1/2012                                                  be recorded in the minutes of the Authority."
                },
                {
                    "representation": "(2)",
                    "description": "This section does not apply to"
                },
                {
                    "representation": "(a)",
                    "description": "who, or any nominee of whom, is a shareholder or partner in a company or other body of persons"
                },
                {
                    "representation": "(b)",
                    "description": "who is an employee thereof,  shall be treated as having indirectly a pecuniary interest in a contract, if such company or other body of persons is a party to the contract or proposed contract under consideration."
                },
                {
                    "representation": "(3)",
                    "description": "applies to any person who, but for the provisions of subsection"
                },
                {
                    "representation": "(4)",
                    "description": "Nothing in subsection"
                },
                {
                    "representation": "(5)",
                    "description": "Without prejudice to subsection"
                },
                {
                    "representation": "(6)",
                    "description": "A person who fails to comply with this section is liable on summary conviction to a fine of sixteen thousand two hundred and fifty dollars for every offence, unless he proves that he did not know that a contract or proposed contract in which he had a pecuniary interest was the subject of consideration at the meeting."
                }
            ]
        }
    },
    {
        "act": "GUYANA WATER AUTHORITY ACT",
        "source": "https://mola.gov.gy/laws-of-guyana",
        "type": {
            "name": "section",
            "representation": "10",
            "title": "Authority may delegate their functions to other bodies. ",
            "context": "GUYANA WATER AUTHORITY ACT under Authority may delegate their functions to other bodies. 10. (1) The Authority may, if they think fit, by order delegate to any local authority or other body the power to carry out on their behalf in the area administered by the local authority or such other area as may be specified in the order, as the case may be, such of the functions of the Authority as may be specified in the order.  (2) Where the Authority delegate any of their functions pursuant to subsection (1), the local authority or other body shall, notwithstanding the provisions of any other law, have power to perform the functions so delegated.",
            "description": [
                {
                    "representation": "(1)",
                    "description": "The Authority may, if they think fit, by order delegate to any local authority or other body the power to carry out on their behalf in the area administered by the local authority or such other area as may be specified in the order, as the case may be, such of the functions of the Authority as may be specified in the order."
                },
                {
                    "representation": "(2)",
                    "description": "Where the Authority delegate any of their functions pursuant to subsection"
                }
            ]
        }
    },
    {
        "act": "GUYANA WATER AUTHORITY ACT",
        "source": "https://mola.gov.gy/laws-of-guyana",
        "type": {
            "name": "section",
            "representation": "11",
            "title": "Power of Authority to give directions to other bodies. ",
            "context": "GUYANA WATER AUTHORITY ACT under Power of Authority to give directions to other bodies. 11. (1) The Authority have power to give directions of a general or special character to any statutory or other body as to the exercise by the statutory or other body of their functions by virtue of any enactment or otherwise, in connection with the provision of sewage services and water services as appear to the Authority to be requisite in the public interest and, anything in any such enactment or in any instrument conferring functions on such other body to the contrary notwithstanding, the statutory or other body shall give effect to any such directions.  (2) Where a statutory or other body fails or neglects to give effect to any direction given by the Authority pursuant to subsection (1), the Authority may themselves perform the necessary functions and any expenditure thereby LAWS OF GUYANA 12 Cap. 55:01 Guyana Water Authority  L.R.O. 1/2012                           Public stand- pipes.        Pressure of water.          Recovery of charges.  incurred by the Authority is recoverable from the statutory or other body by action as a civil debt in a court of competent jurisdiction and the payment of any such expenditure shall be a purpose for which the statutory or other body may borrow money in accordance with the statutory or other  provisions relating to borrowing by the statutory authority or other body.  (3) Without prejudice to the remedy provided by subsection (2), any statutory or other body which fails or neglects to give effect to any direction given by the Authority pursuant to subsection (1) is liable on summary conviction to a fine of one hundred and thirty thousand dollars.  (4) Every statutory or other body shall afford to the Authority facilities for obtaining information with respect to their activities and shall furnish them with returns, accounts and other information with respect thereto in such manner and at such times as the Authority may require.",
            "description": [
                {
                    "representation": "(1)",
                    "description": "is liable on summary conviction to a fine of one hundred and thirty thousand dollars."
                },
                {
                    "representation": "(2)",
                    "description": "Where a statutory or other body fails or neglects to give effect to any direction given by the Authority pursuant to subsection"
                },
                {
                    "representation": "(3)",
                    "description": "Without prejudice to the remedy provided by subsection"
                },
                {
                    "representation": "(4)",
                    "description": "Every statutory or other body shall afford to the Authority facilities for obtaining information with respect to their activities and shall furnish them with returns, accounts and other information with respect thereto in such manner and at such times as the Authority may require."
                }
            ]
        }
    },
    {
        "act": "GUYANA WATER AUTHORITY ACT",
        "source": "https://mola.gov.gy/laws-of-guyana",
        "type": {
            "name": "section",
            "representation": "12",
            "title": "Public stand-pipes. ",
            "context": "GUYANA WATER AUTHORITY ACT under Public stand-pipes. 12. The Authority may erect, maintain and supply with water in such places within Guyana as they think fit, public stand-pipes for the public use, and may remove any such stand-pipe which, in their opinion, is no longer required, and may make regulations as to the use of and payment for water from public stand-pipes.",
            "description": "The Authority may erect, maintain and supply with water in such places within Guyana as they think fit, public stand-pipes for the public use, and may remove any such stand-pipe which, in their opinion, is no longer required, and may make regulations as to the use of and payment for water from public stand-pipes."
        }
    },
    {
        "act": "GUYANA WATER AUTHORITY ACT",
        "source": "https://mola.gov.gy/laws-of-guyana",
        "type": {
            "name": "section",
            "representation": "13",
            "title": "Pressure of water. ",
            "context": "GUYANA WATER AUTHORITY ACT under Pressure of water. 13. The Authority shall not be required to provide water services at any specific pressure but those persons requiring the provision of water services at a greater amount of pressure than that made available by the Authority, shall provide themselves at their expense with the means for that purpose; any device, equipment, apparatus or installation to be used by any person in connection therewith requires the prior approval of the Authority.",
            "description": "The Authority shall not be required to provide water services at any specific pressure but those persons requiring the provision of water services at a greater amount of pressure than that made available by the Authority, shall provide themselves at their expense with the means for that purpose; any device, equipment, apparatus or installation to be used by any person in connection therewith requires the prior approval of the Authority."
        }
    },
    {
        "act": "GUYANA WATER AUTHORITY ACT",
        "source": "https://mola.gov.gy/laws-of-guyana",
        "type": {
            "name": "section",
            "representation": "14",
            "title": "Recovery of charges. ",
            "context": "GUYANA WATER AUTHORITY ACT under Recovery of charges. 14. (1) Subject to section 15, the charges made by the Authority for the provision of sewage services and water LAWS OF GUYANA Guyana Water Authority Cap. 55:01 13  L.R.O. 1/2012                                            c. 7:01                services shall be payable and recoverable in accordance with the provisions of this section.  (2) Where water is supplied in bulk to any person by the Authority any moneys payable to the Authority for the water so supplied shall be recoverable by the Authority from the person to whom the water has been supplied in bulk.  (3) The charges for any service rendered by the Authority on any premises in connection with any installation or apparatus used in connection with the provision of sewage services and water services, or any other service (including the cost of replacing any installation or apparatus) shall be borne by the owner of the premises and shall be recoverable from him by the Authority.  (4) Except where an owner of premises who is not himself the occupier thereof is liable by or under any law, or by agreement with the Authority, to pay the charges for the provision of sewage services and water services, those charges shall be payable by the occupier of the premises.  (5) The charges payable by any person may, after the demand therefor, be recovered from the person liable therefor by the Authority by action as a civil debt, irrespective of the amount, under the Summary Jurisdiction (Petty Debt) Act against the person liable for the payment of the charges.  (6) Subject as hereinafter provided in this section, where a person fails to pay within seven days after a demand therefor any charges payable by him by virtue of this Act for the water services or sewage services the Authority may cut off the supply of water to the premises and recover the expenses reasonably incurred in so doing in the same manner as the charges due, save that if, before the expiration of the said seven days, notice in writing is given to them that there is a dispute as to the amount due in respect of the charges, the Authority shall not cut off the supply of water until the LAWS OF GUYANA 14 Cap. 55:01 Guyana Water Authority  L.R.O. 1/2012                                                  dispute has, on the application of either party, been settled by a court of summary jurisdiction, but only if the occupier tenders the amount due in respect of the charges, without prejudice to the dispute.  (7) Where at the date when any charges in respect of any premises become due, the owner of the premises is liable by or under any enactment, or by agreement with the Authority, to pay the charges for the provision of sewage or water services and is not himself the occupier thereof, the Authority shall not cut off the supply of water to the premises for a failure by him to pay any such charges, but the charges, without prejudice to the right of the Authority to enforce payment thereof by him, may be recovered by the Authority either from the owner for the time being, or, subject as hereinafter provided, from the occupier for the time being, of the premises in the manner in which charges for the provision of sewage services or water services are recoverable.  (8) Where the occupier of the premises is not the owner thereof   (a) proceedings shall not be commenced under subsection (7) against the occupier until notice has been served on him requiring him to pay the amount due or which may thereafter become due, from him, and he has failed to comply with the notice;  (b) no greater sum shall be recoverable at any one time from the occupier than the amount of rent, which is owing by him, or which has accrued since such notice as aforesaid was served on him; and  (c)  if the occupier, as between himself LAWS OF GUYANA Guyana Water Authority Cap. 55:01 15  L.R.O. 1/2012          Transitional provisions relating to charges.        Limitation Act not to apply to the Authority.  c. 7:02          Provisions for securing the supply of pure and wholesome water. [27 of 1974]           Power to open streets and roads.          and the owner of the premises, is not liable to pay the charges he is entitled to deduct from the rent payable by him any sum paid by him in compliance with the notice or so recovered from him.",
            "description": [
                {
                    "representation": "(1)",
                    "description": "Subject to section 15, the charges made by the Authority for the provision of sewage services and water LAWS OF GUYANA Guyana Water Authority Cap. 55:01 13  L.R.O. 1/2012                                            c. 7:01                services shall be payable and recoverable in accordance with the provisions of this section."
                },
                {
                    "representation": "(2)",
                    "description": "Where water is supplied in bulk to any person by the Authority any moneys payable to the Authority for the water so supplied shall be recoverable by the Authority from the person to whom the water has been supplied in bulk."
                },
                {
                    "representation": "(3)",
                    "description": "The charges for any service rendered by the Authority on any premises in connection with any installation or apparatus used in connection with the provision of sewage services and water services, or any other service"
                },
                {
                    "representation": "(4)",
                    "description": "Except where an owner of premises who is not himself the occupier thereof is liable by or under any law, or by agreement with the Authority, to pay the charges for the provision of sewage services and water services, those charges shall be payable by the occupier of the premises."
                },
                {
                    "representation": "(5)",
                    "description": "The charges payable by any person may, after the demand therefor, be recovered from the person liable therefor by the Authority by action as a civil debt, irrespective of the amount, under the Summary Jurisdiction"
                },
                {
                    "representation": "(6)",
                    "description": "Subject as hereinafter provided in this section, where a person fails to pay within seven days after a demand therefor any charges payable by him by virtue of this Act for the water services or sewage services the Authority may cut off the supply of water to the premises and recover the expenses reasonably incurred in so doing in the same manner as the charges due, save that if, before the expiration of the said seven days, notice in writing is given to them that there is a dispute as to the amount due in respect of the charges, the Authority shall not cut off the supply of water until the LAWS OF GUYANA 14 Cap. 55:01 Guyana Water Authority  L.R.O. 1/2012                                                  dispute has, on the application of either party, been settled by a court of summary jurisdiction, but only if the occupier tenders the amount due in respect of the charges, without prejudice to the dispute."
                },
                {
                    "representation": "(7)",
                    "description": "against the occupier until notice has been served on him requiring him to pay the amount due or which may thereafter become due, from him, and he has failed to comply with the notice;"
                },
                {
                    "representation": "(8)",
                    "description": "Where the occupier of the premises is not the owner thereof"
                },
                {
                    "representation": "(a)",
                    "description": "proceedings shall not be commenced under subsection"
                },
                {
                    "representation": "(b)",
                    "description": "no greater sum shall be recoverable at any one time from the occupier than the amount of rent, which is owing by him, or which has accrued since such notice as aforesaid was served on him; and"
                },
                {
                    "representation": "(c)",
                    "description": "if the occupier, as between himself LAWS OF GUYANA Guyana Water Authority Cap. 55:01 15  L.R.O. 1/2012          Transitional provisions relating to charges.        Limitation Act not to apply to the Authority.  c. 7:02          Provisions for securing the supply of pure and wholesome water. [27 of 1974]           Power to open streets and roads.          and the owner of the premises, is not liable to pay the charges he is entitled to deduct from the rent payable by him any sum paid by him in compliance with the notice or so recovered from him."
                }
            ]
        }
    },
    {
        "act": "GUYANA WATER AUTHORITY ACT",
        "source": "https://mola.gov.gy/laws-of-guyana",
        "type": {
            "name": "section",
            "representation": "15",
            "title": "Transitional provisions relating to charges. ",
            "context": "GUYANA WATER AUTHORITY ACT under Transitional provisions relating to charges. 15. Notwithstanding any agreement or rule of law to the contrary, where any premises is at the commencement of this Act, provided with sewage services or water services by the Authority, until the owner thereof gives notice in writing to the Authority of the name of the occupier and the Authority make demand on the occupier therefor, the charges in respect of such premises is payable by the owner thereof.",
            "description": "Notwithstanding any agreement or rule of law to the contrary, where any premises is at the commencement of this Act, provided with sewage services or water services by the Authority, until the owner thereof gives notice in writing to the Authority of the name of the occupier and the Authority make demand on the occupier therefor, the charges in respect of such premises is payable by the owner thereof."
        }
    },
    {
        "act": "GUYANA WATER AUTHORITY ACT",
        "source": "https://mola.gov.gy/laws-of-guyana",
        "type": {
            "name": "section",
            "representation": "16",
            "title": "Limitation Act not to apply to Authority. ",
            "context": "GUYANA WATER AUTHORITY ACT under Limitation Act not to apply to Authority. 16. Nothing in the Limitation Act in any way affects any right of the Authority in respect of the recovery of any moneys due and payable to the Authority.",
            "description": "Nothing in the Limitation Act in any way affects any right of the Authority in respect of the recovery of any moneys due and payable to the Authority."
        }
    },
    {
        "act": "GUYANA WATER AUTHORITY ACT",
        "source": "https://mola.gov.gy/laws-of-guyana",
        "type": {
            "name": "section",
            "representation": "17",
            "title": "Provisions for securing the supply of pure and wholesome water. ",
            "context": "GUYANA WATER AUTHORITY ACT under Provisions for securing the supply of pure and wholesome water. 17. (1) The Authority shall cause to be made physical, chemical, bacteriological, biological and other examinations of, and experiment as to the condition of, the water to be supplied by them.  (2) The Authority shall make available to the Minister the reports of any examinations or experiments mentioned in subsection (1) as may be required from time to time by him.",
            "description": [
                {
                    "representation": "(1)",
                    "description": "as may be required from time to time by him."
                },
                {
                    "representation": "(2)",
                    "description": "The Authority shall make available to the Minister the reports of any examinations or experiments mentioned in subsection"
                }
            ]
        }
    },
    {
        "act": "GUYANA WATER AUTHORITY ACT",
        "source": "https://mola.gov.gy/laws-of-guyana",
        "type": {
            "name": "section",
            "representation": "18",
            "title": "Power to open streets and roads. ",
            "context": "GUYANA WATER AUTHORITY ACT under Power to open streets and roads. 18. For the purpose of laying down, extending, inspecting, maintaining, altering, renewing or repairing any water main, sewer, or any branch thereof, or any pipes or works in connection therewith, the Authority may open or break up any street or road or portion thereof subject to the following conditions    (a) the Authority shall give to the local authority in whose area the street or LAWS OF GUYANA 16 Cap. 55:01 Guyana Water Authority  L.R.O. 1/2012                                                Drilling and boring of wells prohibited in certain areas. [6 of 1997]    road is situate or such other person in whom the maintenance of the street or road is vested, not less than two days notice of the intention of opening or breaking up the street or road, specifying the time of beginning and the portion of street or road to be opened or broken up; but in cases of urgency the Authority may open or break up a street or road and shall forthwith inform the local authority or other person of the fact;  (b) until the street or road is restored, the place where it is opened or broken up shall be adequately fenced, and lighted in such manner as to give proper warning to the public during the period between six oclock in the evening of any day and five oclock in the morning of the following day;  (c) the Authority shall not, without the consent of the local authority or other person, open or break at any one time a greater length than one hundred yards of a street or road;  (d) the Authority shall restore the street or road to the satisfaction of the local authority or other person.",
            "description": [
                {
                    "representation": "(a)",
                    "description": "the Authority shall give to the local authority in whose area the street or LAWS OF GUYANA 16 Cap. 55:01 Guyana Water Authority  L.R.O. 1/2012                                                Drilling and boring of wells prohibited in certain areas. [6 of 1997]    road is situate or such other person in whom the maintenance of the street or road is vested, not less than two days notice of the intention of opening or breaking up the street or road, specifying the time of beginning and the portion of street or road to be opened or broken up; but in cases of urgency the Authority may open or break up a street or road and shall forthwith inform the local authority or other person of the fact;"
                },
                {
                    "representation": "(b)",
                    "description": "until the street or road is restored, the place where it is opened or broken up shall be adequately fenced, and lighted in such manner as to give proper warning to the public during the period between six oclock in the evening of any day and five oclock in the morning of the following day;"
                },
                {
                    "representation": "(c)",
                    "description": "the Authority shall not, without the consent of the local authority or other person, open or break at any one time a greater length than one hundred yards of a street or road;"
                },
                {
                    "representation": "(d)",
                    "description": "the Authority shall restore the street or road to the satisfaction of the local authority or other person."
                }
            ]
        }
    },
    {
        "act": "GUYANA WATER AUTHORITY ACT",
        "source": "https://mola.gov.gy/laws-of-guyana",
        "type": {
            "name": "section",
            "representation": "19",
            "title": "Drilling and boring of wells prohibited in certain areas. ",
            "context": "GUYANA WATER AUTHORITY ACT under Drilling and boring of wells prohibited in certain areas. 19. (1) No person shall make a well or hole in the ground for the purpose of obtaining water, except by digging, in any area designated by the regulations without a permit issued by the Authority.  (2) A permit issued under subsection (1) may be LAWS OF GUYANA Guyana Water Authority Cap. 55:01 17  L.R.O. 1/2012                   Licence for carrying on the business of boring or drilling wells. [6 of 1997]                         Power of Authority to grant licences to plumbers.  [6 of 1997]   issued subject to such terms and conditions as the Authority may deem fit to impose and may be revoked at any time by the Authority.  (3) Every person who contravenes subsection (1) or any of the terms and conditions of a permit is liable on summary conviction to a fine of thirty-two thousand five hundred dollars and to imprisonment for six months.",
            "description": [
                {
                    "representation": "(1)",
                    "description": "or any of the terms and conditions of a permit is liable on summary conviction to a fine of thirty-two thousand five hundred dollars and to imprisonment for six months."
                },
                {
                    "representation": "(2)",
                    "description": "A permit issued under subsection"
                },
                {
                    "representation": "(3)",
                    "description": "Every person who contravenes subsection"
                }
            ]
        }
    },
    {
        "act": "GUYANA WATER AUTHORITY ACT",
        "source": "https://mola.gov.gy/laws-of-guyana",
        "type": {
            "name": "section",
            "representation": "20",
            "title": "Licence for carrying on the business of boring or drilling wells. ",
            "context": "GUYANA WATER AUTHORITY ACT under Licence for carrying on the business of boring or drilling wells. 20. (1) No person shall carry on the business of boring or drilling wells for water unless he is the holder of a licence therefor from the Authority.  (2) Upon application therefor in the prescribed form and upon payment of the prescribed fee, the Authority may issue or renew, as the case may be, a licence to carry on the business of boring or drilling wells for water.  (3) Subject to subsection (4), every such licence expires on the 31st December in every year.  (4) The Authority may suspend or revoke a licence at any time.   (5) Every person to whom a licence has been issued under this section shall, within one month after the boring or drilling of a well for water, make a return to the Authority in the manner required by the Authority.  (6) Every person who contravenes this section is liable on summary conviction to a fine of thirty-two thousand five hundred dollars and to imprisonment for six months.",
            "description": [
                {
                    "representation": "(1)",
                    "description": "No person shall carry on the business of boring or drilling wells for water unless he is the holder of a licence therefor from the Authority."
                },
                {
                    "representation": "(2)",
                    "description": "Upon application therefor in the prescribed form and upon payment of the prescribed fee, the Authority may issue or renew, as the case may be, a licence to carry on the business of boring or drilling wells for water."
                },
                {
                    "representation": "(3)",
                    "description": "Subject to subsection"
                },
                {
                    "representation": "(4)",
                    "description": "The Authority may suspend or revoke a licence at any time."
                },
                {
                    "representation": "(5)",
                    "description": "Every person to whom a licence has been issued under this section shall, within one month after the boring or drilling of a well for water, make a return to the Authority in the manner required by the Authority."
                },
                {
                    "representation": "(6)",
                    "description": "Every person who contravenes this section is liable on summary conviction to a fine of thirty-two thousand five hundred dollars and to imprisonment for six months."
                }
            ]
        }
    },
    {
        "act": "GUYANA WATER AUTHORITY ACT",
        "source": "https://mola.gov.gy/laws-of-guyana",
        "type": {
            "name": "section",
            "representation": "21",
            "title": "Power of Authority to grant licences to plumbers. ",
            "context": "GUYANA WATER AUTHORITY ACT under Power of Authority to grant licences to plumbers. 21. (1) The Authority may grant licences authorising persons (to be known as licensed plumbers) to construct, execute, repair or perform work in connection with the provision of water and sewage services to any premises from water works and sewage works as the Authority think fit. LAWS OF GUYANA 18 Cap. 55:01 Guyana Water Authority  L.R.O. 1/2012                                                c. 30:01      (2) It shall be the duty of licensed plumbers to act in accordance with this Act and to carry out the orders of the Authority or any person authorised by the Authority; licensed plumbers are responsible for the acts and omissions of all those persons employed by them.  (3) The Authority may by regulations made under section 28 prescribe the fees to be paid for examination and licences of plumbers.  (4) The Authority may, in their discretion, suspend or cancel the licence of a licensed plumber who is guilty of misconduct in the performance of his duties under this Act.  (5) The grant, suspension or cancellation of a licence shall be published in the Gazette and a newspaper circulating in Guyana.  (6) No person other than a licensed plumber may do any act mentioned in subsection (1), and an unlicensed person who does any such act or a person who causes it to be done by the unlicensed person is liable on summary conviction to a fine of sixteen thousand two hundred and fifty dollars except that a person employed by the Authority shall be deemed to be a licensed plumber with regard to the work done by him that is authorised by the Authority.  (7) Nothing in this section affects a licence to execute any work mentioned in subsection (l) granted by the Georgetown Sewerage and Water Commissioners under section 26 of the Georgetown Sewerage and Water Commissioners Act, or by the Mayor and Town Council of New Amsterdam, and in force at the commencement of this Act.  (8) Notwithstanding the provisions of any other law, no licence to execute any work mentioned in subsection (1) shall be granted by a person other than the Authority after LAWS OF GUYANA Guyana Water Authority Cap. 55:01 19  L.R.O. 1/2012       Approval of plans for sewage works and water works. [6 of 1997]                                     Entry on premises.  the commencement of this Act without the approval of the Authority.",
            "description": [
                {
                    "representation": "(1)",
                    "description": "shall be granted by a person other than the Authority after LAWS OF GUYANA Guyana Water Authority Cap. 55:01 19  L.R.O. 1/2012       Approval of plans for sewage works and water works. [6 of 1997]                                     Entry on premises.  the commencement of this Act without the approval of the Authority."
                },
                {
                    "representation": "(2)",
                    "description": "It shall be the duty of licensed plumbers to act in accordance with this Act and to carry out the orders of the Authority or any person authorised by the Authority; licensed plumbers are responsible for the acts and omissions of all those persons employed by them."
                },
                {
                    "representation": "(3)",
                    "description": "The Authority may by regulations made under section 28 prescribe the fees to be paid for examination and licences of plumbers."
                },
                {
                    "representation": "(4)",
                    "description": "The Authority may, in their discretion, suspend or cancel the licence of a licensed plumber who is guilty of misconduct in the performance of his duties under this Act."
                },
                {
                    "representation": "(5)",
                    "description": "The grant, suspension or cancellation of a licence shall be published in the Gazette and a newspaper circulating in Guyana."
                },
                {
                    "representation": "(6)",
                    "description": "No person other than a licensed plumber may do any act mentioned in subsection"
                },
                {
                    "representation": "(7)",
                    "description": "Nothing in this section affects a licence to execute any work mentioned in subsection"
                },
                {
                    "representation": "(l)",
                    "description": "granted by the Georgetown Sewerage and Water Commissioners under section 26 of the Georgetown Sewerage and Water Commissioners Act, or by the Mayor and Town Council of New Amsterdam, and in force at the commencement of this Act."
                },
                {
                    "representation": "(8)",
                    "description": "Notwithstanding the provisions of any other law, no licence to execute any work mentioned in subsection"
                }
            ]
        }
    },
    {
        "act": "GUYANA WATER AUTHORITY ACT",
        "source": "https://mola.gov.gy/laws-of-guyana",
        "type": {
            "name": "section",
            "representation": "22",
            "title": "Approval of plans for sewage works and water works. ",
            "context": "GUYANA WATER AUTHORITY ACT under Approval of plans for sewage works and water works. 22. (1) Notwithstanding anything in any other law to the contrary no person shall construct any sewage works or water works, or extend or alter any sewage works or water works unless the plans, specifications and an engineers report of the works to be undertaken, together with such other information as the Authority may require, have been submitted to the Authority for their approval, and no such works shall be undertaken or proceeded with without the approval of the Authority.  (2) The approval of the Authority may be granted subject to such terms and conditions as the Authority deem necessary.  (3) Where a person undertakes or proceeds with the establishment of any sewage works or water works, or the extension or alteration of any sewage works or water works, without first obtaining the approval of the Authority, the Authority may order that person to afford at his own expense such facilities as the Authority may deem necessary for  the investigation of the works and may direct such changes to be made in the works as the Authority may deem necessary, and any changes directed by the Authority to be made in the works shall be carried out by the person at his own expense.  (4) Every person who contravenes subsection (1), or fails to comply with any term or condition imposed by the Authority pursuant to subsection (2), or fails to comply with any direction given by the Authority under subsection (3), is liable on summary conviction to a fine of one hundred and thirty thousand dollars and to imprisonment for twelve months.",
            "description": [
                {
                    "representation": "(1)",
                    "description": "Notwithstanding anything in any other law to the contrary no person shall construct any sewage works or water works, or extend or alter any sewage works or water works unless the plans, specifications and an engineers report of the works to be undertaken, together with such other information as the Authority may require, have been submitted to the Authority for their approval, and no such works shall be undertaken or proceeded with without the approval of the Authority."
                },
                {
                    "representation": "(2)",
                    "description": "The approval of the Authority may be granted subject to such terms and conditions as the Authority deem necessary."
                },
                {
                    "representation": "(3)",
                    "description": "Where a person undertakes or proceeds with the establishment of any sewage works or water works, or the extension or alteration of any sewage works or water works, without first obtaining the approval of the Authority, the Authority may order that person to afford at his own expense such facilities as the Authority may deem necessary for  the investigation of the works and may direct such changes to be made in the works as the Authority may deem necessary, and any changes directed by the Authority to be made in the works shall be carried out by the person at his own expense."
                },
                {
                    "representation": "(4)",
                    "description": "Every person who contravenes subsection"
                }
            ]
        }
    },
    {
        "act": "GUYANA WATER AUTHORITY ACT",
        "source": "https://mola.gov.gy/laws-of-guyana",
        "type": {
            "name": "section",
            "representation": "23",
            "title": "Entry on premises. ",
            "context": "GUYANA WATER AUTHORITY ACT under Entry on premises. 23. It shall be lawful for the Authority, their agents, officers and employees so authorised by the Authority, at any LAWS OF GUYANA 20 Cap. 55:01 Guyana Water Authority  L.R.O. 1/2012           Obstructing members of the Authority and other persons. [6 of 1997]          Unauthorised taking of water an offence. [6 of 1997]      Owner or occupier of premises disposing of water supplied by the Authority. [6 of 1997]   Offences by corporate bodies.         time for their purposes to enter into any premises provided with water services and sewage services or either of such services by the Authority for the purpose of examining the pipes or means by which the premises are provided with such services, or any apparatus or thing used on the premises in connection therewith.",
            "description": "It shall be lawful for the Authority, their agents, officers and employees so authorised by the Authority, at any LAWS OF GUYANA 20 Cap. 55:01 Guyana Water Authority  L.R.O. 1/2012           Obstructing members of the Authority and other persons. [6 of 1997]          Unauthorised taking of water an offence. [6 of 1997]      Owner or occupier of premises disposing of water supplied by the Authority. [6 of 1997]   Offences by corporate bodies.         time for their purposes to enter into any premises provided with water services and sewage services or either of such services by the Authority for the purpose of examining the pipes or means by which the premises are provided with such services, or any apparatus or thing used on the premises in connection therewith."
        }
    },
    {
        "act": "GUYANA WATER AUTHORITY ACT",
        "source": "https://mola.gov.gy/laws-of-guyana",
        "type": {
            "name": "section",
            "representation": "24",
            "title": "Obstructing members of the Authority and other persons. ",
            "context": "GUYANA WATER AUTHORITY ACT under Obstructing members of the Authority and other persons. 24. Any person who assaults, molests, obstructs or in any other manner whatever hinders a member of the Authority or an authorised agent, officer or employee of the Authority, in the exercise of the functions conferred upon them by this Act, is liable on summary conviction to a fine of sixteen thousand two hundred and fifty dollars or to imprisonment for three months.",
            "description": "Any person who assaults, molests, obstructs or in any other manner whatever hinders a member of the Authority or an authorised agent, officer or employee of the Authority, in the exercise of the functions conferred upon them by this Act, is liable on summary conviction to a fine of sixteen thousand two hundred and fifty dollars or to imprisonment for three months."
        }
    },
    {
        "act": "GUYANA WATER AUTHORITY ACT",
        "source": "https://mola.gov.gy/laws-of-guyana",
        "type": {
            "name": "section",
            "representation": "25",
            "title": "Unauthorised taking of water an offence. ",
            "context": "GUYANA WATER AUTHORITY ACT under Unauthorised taking of water an offence. 25. A person who not being supplied with water by the Authority takes water from any installation operated by or on behalf of the Authority, other than such as may have been provided for the use of the public, is liable on summary conviction to a fine of sixteen thousand two hundred and fifty dollars and to imprisonment for a term of three months.",
            "description": "A person who not being supplied with water by the Authority takes water from any installation operated by or on behalf of the Authority, other than such as may have been provided for the use of the public, is liable on summary conviction to a fine of sixteen thousand two hundred and fifty dollars and to imprisonment for a term of three months."
        }
    },
    {
        "act": "GUYANA WATER AUTHORITY ACT",
        "source": "https://mola.gov.gy/laws-of-guyana",
        "type": {
            "name": "section",
            "representation": "26",
            "title": "Owner or occupier of premises disposing of water supplied by the Authority. ",
            "context": "GUYANA WATER AUTHORITY ACT under Owner or occupier of premises disposing of water supplied by the Authority. 26. The owner or occupier of any premises supplied with water by the Authority who uses the water or permits the same to be used for the purposes of any other premises or who supplies or disposes of the water to any other person is liable on summary conviction to a fine of six thousand five hundred dollars.",
            "description": "The owner or occupier of any premises supplied with water by the Authority who uses the water or permits the same to be used for the purposes of any other premises or who supplies or disposes of the water to any other person is liable on summary conviction to a fine of six thousand five hundred dollars."
        }
    },
    {
        "act": "GUYANA WATER AUTHORITY ACT",
        "source": "https://mola.gov.gy/laws-of-guyana",
        "type": {
            "name": "section",
            "representation": "27",
            "title": "Offences by corporate bodies. ",
            "context": "GUYANA WATER AUTHORITY ACT under Offences by corporate bodies. 27. Where a person convicted of an offence against this Act is a body corporate, every person who at the time of the commission of the offence was a director or officer of the body corporate is guilty of that offence unless he proves that the offence was committed without his knowledge, or that he exercised all due diligence to prevent the commission of the offence.  LAWS OF GUYANA Guyana Water Authority Cap. 55:01 21  L.R.O. 1/2012 Regulations.  [6 of 1997]",
            "description": "Where a person convicted of an offence against this Act is a body corporate, every person who at the time of the commission of the offence was a director or officer of the body corporate is guilty of that offence unless he proves that the offence was committed without his knowledge, or that he exercised all due diligence to prevent the commission of the offence.  LAWS OF GUYANA Guyana Water Authority Cap. 55:01 21  L.R.O. 1/2012 Regulations.  [6 of 1997]"
        }
    },
    {
        "act": "GUYANA WATER AUTHORITY ACT",
        "source": "https://mola.gov.gy/laws-of-guyana",
        "type": {
            "name": "section",
            "representation": "28",
            "title": "Regulations. ",
            "context": "GUYANA WATER AUTHORITY ACT under Regulations. 28. (1) The Authority, with the approval of the Minister, may make regulations for giving effect to and for carrying out the provisions of this Act and, without prejudice to the generality of the foregoing the regulations may    (a) prescribe the charges to be made for the provision of sewage services and water services by the Authority;  (b) make provision for the inspection, testing and maintenance of installations and apparatus and in respect of the fixing, testing and renting of meters, and of any other services rendered by the Authority in pursuance of their functions under this Act; (c) prescribe the charges to be made by the Authority for the laying and construction of house sewers (not being part of a collecting sewer system) and of the requisite appliances and accessories thereto;  (d) prescribe the form of application for the provision of sewage services and water services;  (e) regulate the types of fittings that may be used;  (f) prescribe the conditions for the discontinuance of the supply of water in cases otherwise than as provided in this Act;  (g) regulate the use of water from public LAWS OF GUYANA 22 Cap. 55:01 Guyana Water Authority  L.R.O. 1/2012                              Acquisition of other under- takings in the public interest.                       stand-pipes;  (h) provide for the proper use and conservation of water, including the prevention of waste, contamination or pollution of  water.  (2) Nothing in subsection (1) prevents the Authority from charging by special agreement other charges where the charges prescribed pursuant to subsection (1) are inapplicable.  (3) There may be annexed to any regulation for a breach thereof a fine on summary conviction of thirteen thousand dollars and imprisonment for a term of three months.",
            "description": [
                {
                    "representation": "(1)",
                    "description": "are inapplicable."
                },
                {
                    "representation": "(a)",
                    "description": "prescribe the charges to be made for the provision of sewage services and water services by the Authority;"
                },
                {
                    "representation": "(b)",
                    "description": "make provision for the inspection, testing and maintenance of installations and apparatus and in respect of the fixing, testing and renting of meters, and of any other services rendered by the Authority in pursuance of their functions under this Act;"
                },
                {
                    "representation": "(c)",
                    "description": "prescribe the charges to be made by the Authority for the laying and construction of house sewers"
                },
                {
                    "representation": "(d)",
                    "description": "prescribe the form of application for the provision of sewage services and water services;"
                },
                {
                    "representation": "(e)",
                    "description": "regulate the types of fittings that may be used;"
                },
                {
                    "representation": "(f)",
                    "description": "prescribe the conditions for the discontinuance of the supply of water in cases otherwise than as provided in this Act;"
                },
                {
                    "representation": "(g)",
                    "description": "regulate the use of water from public LAWS OF GUYANA 22 Cap. 55:01 Guyana Water Authority  L.R.O. 1/2012                              Acquisition of other under- takings in the public interest.                       stand-pipes;"
                },
                {
                    "representation": "(h)",
                    "description": "provide for the proper use and conservation of water, including the prevention of waste, contamination or pollution of  water."
                },
                {
                    "representation": "(2)",
                    "description": "Nothing in subsection"
                },
                {
                    "representation": "(3)",
                    "description": "There may be annexed to any regulation for a breach thereof a fine on summary conviction of thirteen thousand dollars and imprisonment for a term of three months."
                }
            ]
        }
    },
    {
        "act": "GUYANA WATER AUTHORITY ACT",
        "source": "https://mola.gov.gy/laws-of-guyana",
        "type": {
            "name": "section",
            "representation": "29",
            "title": "Acquisition of other undertakings in the public interest. ",
            "context": "GUYANA WATER AUTHORITY ACT under Acquisition of other undertakings in the public interest. 29. (1) Where any person other than the Authority (hereinafter referred to as the undertaker) provides sewage and water services in any area of Guyana and the Minister considers it to be in the public interest that the undertaking carried on by the undertaker in so far as it relates to the provision of sewage and water services should be acquired by the Authority, the Minister may, by order, declare that with effect from such day, being not earlier than one month after the date of the making of the order as may be specified in the order (hereinafter in this section referred to as the vesting day) the said undertaking shall be transferred to and vested in the Authority.  (2) An order made under subsection (1) may contain    (a) such provisions relating to the vesting of property, transfer of assets and liabilities, the employment of persons employed by the undertaker, monetary arrangements, the LAWS OF GUYANA Guyana Water Authority Cap. 55:01 23  L.R.O. 1/2012                     c. 1:01                Power to make the Authority subject to the supervision and control of the Guyana State Corporation. [27 of 1974] c. 27:02    preservation of rights and liabilities existing immediately before the vesting day;  (b) provision amending, modifying or repealing any enactment which in the opinion of the Minister is necessary to give effect to the order;  (c) such other provisions as the Minister may consider necessary or expedient for the purpose of giving effect to the order.  (3) To such extent, if any, as may be required by article 8 of the Constitution, provision is hereby made in terms of paragraph (1) (a) and (b) of that article in relation to any undertaking (including any interest in or right over such undertaking) acquired by the Authority by virtue of an order made by the Minister under subsection (1).  (4) Where the Authority acquire the undertaking of any undertaker under this section or otherwise, the Authority have the exclusive right to provide sewage services and water services in the area provided with such services by the undertaker immediately before the acquisition of the undertaking by the Authority.",
            "description": [
                {
                    "representation": "(1)",
                    "description": "(a) and"
                },
                {
                    "representation": "(2)",
                    "description": "An order made under subsection"
                },
                {
                    "representation": "(a)",
                    "description": "such provisions relating to the vesting of property, transfer of assets and liabilities, the employment of persons employed by the undertaker, monetary arrangements, the LAWS OF GUYANA Guyana Water Authority Cap. 55:01 23  L.R.O. 1/2012                     c. 1:01                Power to make the Authority subject to the supervision and control of the Guyana State Corporation. [27 of 1974] c. 27:02    preservation of rights and liabilities existing immediately before the vesting day;"
                },
                {
                    "representation": "(b)",
                    "description": "of that article in relation to any undertaking"
                },
                {
                    "representation": "(c)",
                    "description": "such other provisions as the Minister may consider necessary or expedient for the purpose of giving effect to the order."
                },
                {
                    "representation": "(3)",
                    "description": "To such extent, if any, as may be required by article 8 of the Constitution, provision is hereby made in terms of paragraph"
                },
                {
                    "representation": "(4)",
                    "description": "Where the Authority acquire the undertaking of any undertaker under this section or otherwise, the Authority have the exclusive right to provide sewage services and water services in the area provided with such services by the undertaker immediately before the acquisition of the undertaking by the Authority."
                }
            ]
        }
    },
    {
        "act": "GUYANA WATER AUTHORITY ACT",
        "source": "https://mola.gov.gy/laws-of-guyana",
        "type": {
            "name": "section",
            "representation": "30",
            "title": "Power to make the Authority subject to the supervision and control of the Guyana State Corporation. __________________________  LAWS OF GUYANA 4 Cap. 55:01 Guyana Water Authority  L.R.O. 1/2012                  3 of 1972 CHAPTER 55:01  GUYANA WATER AUTHORITY ACT  An Act to provide for the Establishment of the Guyana Water Authority and for matters connected therewith.  [1ST OCTOBER, 1972]  Short title.    Interpretation. [27 of 1974]                          c. 28:03     ",
            "context": "GUYANA WATER AUTHORITY ACT under Power to make the Authority subject to the supervision and control of the Guyana State Corporation. __________________________  LAWS OF GUYANA 4 Cap. 55:01 Guyana Water Authority  L.R.O. 1/2012                  3 of 1972 CHAPTER 55:01  GUYANA WATER AUTHORITY ACT  An Act to provide for the Establishment of the Guyana Water Authority and for matters connected therewith.  [1ST OCTOBER, 1972]  Short title.    Interpretation. [27 of 1974]                          c. 28:03     30. The Minister may, if he considers it to be in the public interest, by order which shall be subject to negative resolution, appoint a date with effect from which the Authority shall become subject to the supervision and control of the Guyana State Corporation and, with effect from that date, sections 2 to 5 (inclusive) of the Guyana Water Authority (Amendment) Act 1974 shall cease to have effect and this Act shall thereafter be construed and have effect as if those sections had not been enacted. ___________________ LAWS OF GUYANA 24 Cap. 55:01 Guyana Water Authority  L.R.O. 1/2012                          SUBSIDIARY LEGISLATION  _________________  O. 123/1974 19/1977 GUYANA WATER AUTHORITY (ACQUISITION) (LA RECONNAISSANCE-MON REPOS, SOESDYKE) ORDER   made under section 27  Citation.     Interpretation.    c. 69:03                       Undertaking of Committee to vest in Authority.  Property vests in Authority Schedule.",
            "description": "The Minister may, if he considers it to be in the public interest, by order which shall be subject to negative resolution, appoint a date with effect from which the Authority shall become subject to the supervision and control of the Guyana State Corporation and, with effect from that date, sections 2 to 5 (inclusive) of the Guyana Water Authority (Amendment) Act 1974 shall cease to have effect and this Act shall thereafter be construed and have effect as if those sections had not been enacted. ___________________ LAWS OF GUYANA 24 Cap. 55:01 Guyana Water Authority  L.R.O. 1/2012                          SUBSIDIARY LEGISLATION  _________________  O. 123/1974 19/1977 GUYANA WATER AUTHORITY (ACQUISITION) (LA RECONNAISSANCE-MON REPOS, SOESDYKE) ORDER   made under section 27  Citation.     Interpretation.    c. 69:03                       Undertaking of Committee to vest in Authority.  Property vests in Authority Schedule."
        }
    }
]