[
    {
        "act": "ELECTRICITY SECTOR REFORM ACT",
        "source": "https://mola.gov.gy/laws-of-guyana",
        "type": {
            "name": "section",
            "representation": "1",
            "title": "Short title. PART II L.R.O. 1/2012 LAWS OF GUYANA 4 Cap. 56:01 Electricity Sector Reform               SECTION ",
            "context": "ELECTRICITY SECTOR REFORM ACT under Short title. PART II L.R.O. 1/2012 LAWS OF GUYANA 4 Cap. 56:01 Electricity Sector Reform               SECTION 1.  (1) This Act may be cited as the Electricity Sector Reform Act.",
            "description": [
                {
                    "representation": "(1)",
                    "description": "This Act may be cited as the Electricity Sector Reform Act."
                }
            ]
        }
    },
    {
        "act": "ELECTRICITY SECTOR REFORM ACT",
        "source": "https://mola.gov.gy/laws-of-guyana",
        "type": {
            "name": "section",
            "representation": "02",
            "title": "L.R.O. 1/2012 of the Companies Act, Cap. 89:01) Order Electricity Sector Reform (Exemptions from Specified Provisions  Subsidiary Legislation Page123LAWS OF GUYANA Electricity Sector Reform Cap. 56:01 3  CHAPTER 56:01  ELECTRICITY SECTOR REFORM ACT  ARRANGEMENT OF SECTIONS  PART I  PRELIMINARY SECTION ",
            "context": "ELECTRICITY SECTOR REFORM ACT under L.R.O. 1/2012 of the Companies Act, Cap. 89:01) Order Electricity Sector Reform (Exemptions from Specified Provisions  Subsidiary Legislation Page123LAWS OF GUYANA Electricity Sector Reform Cap. 56:01 3  CHAPTER 56:01  ELECTRICITY SECTOR REFORM ACT  ARRANGEMENT OF SECTIONS  PART I  PRELIMINARY SECTION 2. Interpretation.   ELECTRICITY SUPPLY",
            "description": "Interpretation.   ELECTRICITY SUPPLY"
        }
    },
    {
        "act": "ELECTRICITY SECTOR REFORM ACT",
        "source": "https://mola.gov.gy/laws-of-guyana",
        "type": {
            "name": "section",
            "representation": "3",
            "title": "Requirement for a licence and exemption therefrom. ",
            "context": "ELECTRICITY SECTOR REFORM ACT under Requirement for a licence and exemption therefrom. 3. (1) Subject to subsections (2) and (4), a person shall not supply electricity to any other person, or to any premises or geographical area, except under and in accordance with the terms of a licence granted under section",
            "description": [
                {
                    "representation": "(1)",
                    "description": "Subject to subsections"
                },
                {
                    "representation": "(2)",
                    "description": "and"
                }
            ]
        }
    },
    {
        "act": "ELECTRICITY SECTOR REFORM ACT",
        "source": "https://mola.gov.gy/laws-of-guyana",
        "type": {
            "name": "section",
            "representation": "4",
            "title": "Authority to grant licences for supply of electricity. ",
            "context": "ELECTRICITY SECTOR REFORM ACT under Authority to grant licences for supply of electricity. 4.  (2) Subsection (1) shall not apply to the use of or supply of electricity from any electricity generation capacity and equipment therefrom. L.R.O. 1/2012 LAWS OF GUYANA 10 Cap. 56:01 Electricity Sector Reform                                                  (a) was installed prior to the appointed day and which is used by a person for the purpose of supplying electricity to himself and any other person;  (b) is, notwithstanding the repeal of the Electric Lighting Act, authorised by a licence granted prior to the appointed day under the said Act;  (c) is authorised by a licence granted prior to the appointed day under any law remaining in force on that day; or  (d) is electricity generation capacity of a class or description as may be prescribed by the Minister by order for the purposes of exempting it from subsection (1):  Provided that no order made under this subsection shall contravene or nullify the provisions of a licence granted under section 4:  Provided further that, as to electricity generation capacity and equipment actually installed and in operation prior to the appointed day, the exemptions contained in this subsection shall apply to any replacement equipment of the same electricity generation capacity sought to be installed or placed into operation after the appointed day, so long as such equipment and its installation comply with all applicable laws and regulations and continue to be used for the same purposes.  (3)      (a) With regard to any electricity generation capacity which was installed prior to the which - L.R.O. 1/2012 c. 56:02 appointed day, any person claiming  an LAWS OF GUYANA Electricity Sector Reform Cap. 56:01 11                                                  exemption under this section shall, within ninety days of the appointed day or within such longer period as the Minister may by order prescribe, give written notification to the Minister of such claim and the basis therefor in accordance with subsection (2);  (b) With regard to any electricity generation capacity which a person is desirous of installing after the appointed day, any person claiming an exemption under subsection (2) shall, no later than ninety days prior to such installation, give written notification to the Minister and to the Agency of such claim, the basis therefor in accordance with subsection (2), and the technical specifications of the electricity generation equipment which such person is desirous of installing;  (c)       The failure of a person to give notification to the Minister under paragraph (a) or (b), or to the Agency under paragraph (b), shall subject such person to the penalties provided for in section 53;  notification from any person under paragraph (a) or (b) and after consulting with the Agency in the case of a notification under paragraph (b), the Minister shall notify such person whether, in the Minister's opinion, such person qualifies for the exemption claimed, and, if so, grant the exemption claimed upon terms and conditions specified in the exemption:  Provided that no exemption granted under this paragraph shall (d) Within twenty-one days after receiving L.R.O. 1/2012 LAWS OF GUYANA 12 Cap. 56:01 Electricity Sector Reform                     Authority to grant licences for supply of electricity.            c. 56:04              contravene or nullify the provisions of a licence granted under section",
            "description": [
                {
                    "representation": "(2)",
                    "description": "shall, no later than ninety days prior to such installation, give written notification to the Minister and to the Agency of such claim, the basis therefor in accordance with subsection"
                },
                {
                    "representation": "(1)",
                    "description": "shall not apply to the use of or supply of electricity from any electricity generation capacity and equipment therefrom. L.R.O. 1/2012 LAWS OF GUYANA 10 Cap. 56:01 Electricity Sector Reform"
                },
                {
                    "representation": "(a)",
                    "description": "or"
                },
                {
                    "representation": "(b)",
                    "description": "and after consulting with the Agency in the case of a notification under paragraph"
                },
                {
                    "representation": "(c)",
                    "description": "The failure of a person to give notification to the Minister under paragraph"
                },
                {
                    "representation": "(d)",
                    "description": "Within twenty-one days after receiving L.R.O. 1/2012 LAWS OF GUYANA 12 Cap. 56:01 Electricity Sector Reform                     Authority to grant licences for supply of electricity.            c. 56:04              contravene or nullify the provisions of a licence granted under section"
                },
                {
                    "representation": "(3)",
                    "description": ""
                }
            ]
        }
    },
    {
        "act": "ELECTRICITY SECTOR REFORM ACT",
        "source": "https://mola.gov.gy/laws-of-guyana",
        "type": {
            "name": "section",
            "representation": "5",
            "title": "Terms and conditions of licences to supply electricity. ",
            "context": "ELECTRICITY SECTOR REFORM ACT under Terms and conditions of licences to supply electricity. 5. A licence granted by the Minister under section 4 may include- (a)  the activities in which the licensee is    permitted to engage, that is, the generation, storage, transmission, distribution, furnishing or sale of electricity; L.R.O. 1/2012 LAWS OF GUYANA Electricity Sector Reform Cap. 56:01 15                                                   (b)    such limits within which, and conditions under which, electricity is to be supplied, including Standard Terms and Conditions forming and governing the contractual relationship between consumers and the public supplier;  (c)   in the case of a licence for the supply of electricity for public purposes, the authorised area within which the public supplier may supply electricity;  (d)   in the case of a licence for the supply of electricity for private purposes, the person or persons, or the premises, to which the licensee may supply electricity;  (e)      provisions for enforcing the performance by a licensee of its duties in relation to the supply of electricity by the imposition of penalties, and for the revocation of the licence;  (f)   the limitation on, or a mechanism of the calculation of, the prices to be charged by the licensee for the supply of electricity from time to time;  (g)     provisions authorising inspection and inquiry from time to time by the Minister and the relevant local Government authorities;  (h)   conditions requiring the licensee to render payment on the granting of the licence, or payment during the validity of the licence, or both, in such amounts as may be specified in the licence;  L.R.O. 1/2012 LAWS OF GUYANA 16 Cap. 56:01 Electricity Sector Reform                                                  (i)     where, in any area or part of an area in which any person is authorised to supply electricity under any licence, the person is not himself the local Government authority, any provisions and restrictions deemed expedient by the Minister for enabling the local Government authority within whose jurisdiction that area or part of an area is, to exercise any of the powers of the person licensed under section 4 with respect to the breaking up of any street repairable by the local Government authority within the area or part of an area and the alteration of the position of any pipes or wires under the street, and not being the pipes or wires of the licensed person, and of limiting the powers and liabilities of the licensed person in relation thereto;  licence in which the licensee is not a local Government authority, a local Government authority a right of first refusal for the purchase of the undertaking and works of the licensee, and the procedures and principles governing such a purchase, upon expiration, revocation or termination of the licence;   the Minister may think fit:  Provided that - (j)   provisions granting the Government or, in any revocation or termination of the licence; (1)    generally such other provisions and conditions as L.R.O. 1/2012 (k)       any other provisions relative to the undertaking              and works of the licensee upon expiration, LAWS OF GUYANA Electricity Sector Reform Cap. 56:01 17                                  Procedures for licence applications.               (a) the Minister may make regulations necessary for the implementation of national energy policy;  (b) any regulations so made by the Minister, to the extent that they do not contravene the terms and conditions of a licence, shall have the like effect in every respect as though they had been originally inserted in every licence authorising the supply of electricity; and  any liability or penalty incurred in respect proceeding or remedy in relation thereto:  Provided further that any local Government authority within whose boundaries electricity is supplied under a licence may, subject to the prior approval of the Minister, make by-laws for further securing the safety of the public, and there may be annexed to such by-laws such penalties, not exceeding fifty thousand dollars, as the local Government authority may think necessary for any breach of the by-laws, and paragraph (b), insofar as it is applicable, shall",
            "description": [
                {
                    "representation": "(a)",
                    "description": "the Minister may make regulations necessary for the implementation of national energy policy;"
                },
                {
                    "representation": "(b)",
                    "description": "any regulations so made by the Minister, to the extent that they do not contravene the terms and conditions of a licence, shall have the like effect in every respect as though they had been originally inserted in every licence authorising the supply of electricity; and  any liability or penalty incurred in respect proceeding or remedy in relation thereto:  Provided further that any local Government authority within whose boundaries electricity is supplied under a licence may, subject to the prior approval of the Minister, make by-laws for further securing the safety of the public, and there may be annexed to such by-laws such penalties, not exceeding fifty thousand dollars, as the local Government authority may think necessary for any breach of the by-laws, and paragraph"
                },
                {
                    "representation": "(c)",
                    "description": "in the case of a licence for the supply of electricity for public purposes, the authorised area within which the public supplier may supply electricity;"
                },
                {
                    "representation": "(d)",
                    "description": "in the case of a licence for the supply of electricity for private purposes, the person or persons, or the premises, to which the licensee may supply electricity;"
                },
                {
                    "representation": "(e)",
                    "description": "provisions for enforcing the performance by a licensee of its duties in relation to the supply of electricity by the imposition of penalties, and for the revocation of the licence;"
                },
                {
                    "representation": "(f)",
                    "description": "the limitation on, or a mechanism of the calculation of, the prices to be charged by the licensee for the supply of electricity from time to time;"
                },
                {
                    "representation": "(g)",
                    "description": "provisions authorising inspection and inquiry from time to time by the Minister and the relevant local Government authorities;"
                },
                {
                    "representation": "(h)",
                    "description": "conditions requiring the licensee to render payment on the granting of the licence, or payment during the validity of the licence, or both, in such amounts as may be specified in the licence;  L.R.O. 1/2012 LAWS OF GUYANA 16 Cap. 56:01 Electricity Sector Reform"
                },
                {
                    "representation": "(i)",
                    "description": "where, in any area or part of an area in which any person is authorised to supply electricity under any licence, the person is not himself the local Government authority, any provisions and restrictions deemed expedient by the Minister for enabling the local Government authority within whose jurisdiction that area or part of an area is, to exercise any of the powers of the person licensed under section 4 with respect to the breaking up of any street repairable by the local Government authority within the area or part of an area and the alteration of the position of any pipes or wires under the street, and not being the pipes or wires of the licensed person, and of limiting the powers and liabilities of the licensed person in relation thereto;  licence in which the licensee is not a local Government authority, a local Government authority a right of first refusal for the purchase of the undertaking and works of the licensee, and the procedures and principles governing such a purchase, upon expiration, revocation or termination of the licence;   the Minister may think fit:  Provided that -"
                },
                {
                    "representation": "(j)",
                    "description": "provisions granting the Government or, in any revocation or termination of the licence;"
                },
                {
                    "representation": "(1)",
                    "description": "generally such other provisions and conditions as L.R.O. 1/2012"
                },
                {
                    "representation": "(k)",
                    "description": "any other provisions relative to the undertaking              and works of the licensee upon expiration, LAWS OF GUYANA Electricity Sector Reform Cap. 56:01 17                                  Procedures for licence applications."
                }
            ]
        }
    },
    {
        "act": "ELECTRICITY SECTOR REFORM ACT",
        "source": "https://mola.gov.gy/laws-of-guyana",
        "type": {
            "name": "section",
            "representation": "6",
            "title": "Procedures for licence applications. ",
            "context": "ELECTRICITY SECTOR REFORM ACT under Procedures for licence applications. 6. (1) An application for a licence shall be made in the manner, and shall be accompanied by such evidence and such fee (if any), as the Minister may by regulation prescribe.  (2) No licence shall authorise the supply of electricity by any person within the jurisdiction of any local Government authority, not being itself the person applying for the licence to supply electricity, unless notice that that licence has been granted, or is intended to be applied for, has been given to the local Government authority by the applicant in the manner directed or approved by the Minister.  (c)    any such regulation repealed shall not affect L.R.O. 1/2012 thereof prior to the date of the repeal, or any  mutatis mutandis apply to the making of such by-laws. LAWS OF GUYANA 18 Cap. 56:01 Electricity Sector Reform                c. 56:04                          Notice of granting of licence.      (3) Every person applying for a licence shall, at his own expense, publish in a daily newspaper a notice of his application in the manner and including the particulars determined by the Minister.  (4) The licence shall not be granted by the Minister until opportunity has been given to all parties likely to be affected by the granting or refusal to grant such licence to make representations or objections to the Minister with reference to the application, and until the Minister has requested and received the advice of the Agency in accordance with section 6 of the Guyana Energy Agency Act, and in no case shall it be granted before the expiration of six weeks from the date of publication of the advertisement required under subsection (3).  (5) If, after the application for the licence is made and before it is granted by the Minister, a petition is presented against its being granted, the petitioner shall be allowed to appear before the Minister and oppose its being granted.  (6) On receipt of a petition opposing the granting of a licence or the advice of the Agency that the licence be refused, the Minister shall notify the applicant accordingly and shall afford the applicant an opportunity to show cause why the licence should be granted.  (7) Within fourteen days after the opportunity to be heard provided for in subsections (4) to (6), inclusive, the Minister, bearing in mind the guidelines specified in section 65, shall make a determination whether to grant or refuse the licence, and shall promptly notify the applicant of his determination.",
            "description": [
                {
                    "representation": "(1)",
                    "description": "An application for a licence shall be made in the manner, and shall be accompanied by such evidence and such fee"
                },
                {
                    "representation": "(2)",
                    "description": "No licence shall authorise the supply of electricity by any person within the jurisdiction of any local Government authority, not being itself the person applying for the licence to supply electricity, unless notice that that licence has been granted, or is intended to be applied for, has been given to the local Government authority by the applicant in the manner directed or approved by the Minister."
                },
                {
                    "representation": "(c)",
                    "description": "any such regulation repealed shall not affect L.R.O. 1/2012 thereof prior to the date of the repeal, or any  mutatis mutandis apply to the making of such by-laws. LAWS OF GUYANA 18 Cap. 56:01 Electricity Sector Reform                c. 56:04                          Notice of granting of licence."
                },
                {
                    "representation": "(3)",
                    "description": "Every person applying for a licence shall, at his own expense, publish in a daily newspaper a notice of his application in the manner and including the particulars determined by the Minister."
                },
                {
                    "representation": "(4)",
                    "description": "to"
                },
                {
                    "representation": "(5)",
                    "description": "If, after the application for the licence is made and before it is granted by the Minister, a petition is presented against its being granted, the petitioner shall be allowed to appear before the Minister and oppose its being granted."
                },
                {
                    "representation": "(6)",
                    "description": "On receipt of a petition opposing the granting of a licence or the advice of the Agency that the licence be refused, the Minister shall notify the applicant accordingly and shall afford the applicant an opportunity to show cause why the licence should be granted."
                },
                {
                    "representation": "(7)",
                    "description": "Within fourteen days after the opportunity to be heard provided for in subsections"
                }
            ]
        }
    },
    {
        "act": "ELECTRICITY SECTOR REFORM ACT",
        "source": "https://mola.gov.gy/laws-of-guyana",
        "type": {
            "name": "section",
            "representation": "7",
            "title": "Notice of granting of licence. ",
            "context": "ELECTRICITY SECTOR REFORM ACT under Notice of granting of licence. 7. As soon as practicable after granting a licence, the Minister shall publish a licence notice of such grant in a daily newspaper and shall send a copy of the licence to the Agency, to the Commission and   L.R.O. 1/2012 LAWS OF GUYANA Electricity Sector Reform Cap. 56:01 19                         Disposition of charges licences.   Power to grant licences to local Government authorities.    Effectiveness of licences.      Prohibition on cessation of licenced operations.  (a)      to the licensee;   (b) in the case of a licence for the generation of electricity by an independent power producer, to any licensee whose authorised area encompasses the area in which the independent power producer is authorised to generate electricity and to any licensee to whom the independent power producer is authorised by its licence to sell electricity; and  (c) in the case of a licence for the supply of electricity for private purposes, to any licensee in whose authorised area the persons or premises to which the person is authorised to supply electricity for private purposes are located.",
            "description": [
                {
                    "representation": "(a)",
                    "description": "to the licensee;"
                },
                {
                    "representation": "(b)",
                    "description": "in the case of a licence for the generation of electricity by an independent power producer, to any licensee whose authorised area encompasses the area in which the independent power producer is authorised to generate electricity and to any licensee to whom the independent power producer is authorised by its licence to sell electricity; and"
                },
                {
                    "representation": "(c)",
                    "description": "in the case of a licence for the supply of electricity for private purposes, to any licensee in whose authorised area the persons or premises to which the person is authorised to supply electricity for private purposes are located."
                }
            ]
        }
    },
    {
        "act": "ELECTRICITY SECTOR REFORM ACT",
        "source": "https://mola.gov.gy/laws-of-guyana",
        "type": {
            "name": "section",
            "representation": "8",
            "title": "Disposition of charges for licences. ",
            "context": "ELECTRICITY SECTOR REFORM ACT under Disposition of charges for licences. 8. Any sums received by the Minister for applications for licences or in accordance with the provisions of any licence shall be paid into the Consolidated Fund.",
            "description": "Any sums received by the Minister for applications for licences or in accordance with the provisions of any licence shall be paid into the Consolidated Fund."
        }
    },
    {
        "act": "ELECTRICITY SECTOR REFORM ACT",
        "source": "https://mola.gov.gy/laws-of-guyana",
        "type": {
            "name": "section",
            "representation": "9",
            "title": "Power to grant licences to Local Government Authorities. ",
            "context": "ELECTRICITY SECTOR REFORM ACT under Power to grant licences to Local Government Authorities. 9.  Subject to this Act, a licence may be granted to a local Government authority, authorising it to supply electricity within any area not already being the authorised area in an exclusive licence granted to a public supplier, although the area or some part thereof may not be included within the local Government authority's own district.",
            "description": "Subject to this Act, a licence may be granted to a local Government authority, authorising it to supply electricity within any area not already being the authorised area in an exclusive licence granted to a public supplier, although the area or some part thereof may not be included within the local Government authority's own district."
        }
    },
    {
        "act": "ELECTRICITY SECTOR REFORM ACT",
        "source": "https://mola.gov.gy/laws-of-guyana",
        "type": {
            "name": "section",
            "representation": "10",
            "title": "Effectiveness of licences. ",
            "context": "ELECTRICITY SECTOR REFORM ACT under Effectiveness of licences. 10. A licence shall be in writing and, unless revoked in accordance with any condition contained in the licence and section 16, shall continue in force and effect in accordance with its terms and conditions for such period as may be specified in the licence.",
            "description": "A licence shall be in writing and, unless revoked in accordance with any condition contained in the licence and section 16, shall continue in force and effect in accordance with its terms and conditions for such period as may be specified in the licence."
        }
    },
    {
        "act": "ELECTRICITY SECTOR REFORM ACT",
        "source": "https://mola.gov.gy/laws-of-guyana",
        "type": {
            "name": "section",
            "representation": "11",
            "title": "Prohibition on cessation of licensed operations. ",
            "context": "ELECTRICITY SECTOR REFORM ACT under Prohibition on cessation of licensed operations. 11. Except where a licence expires or is revoked, suspended, cancelled or terminated in accordance with its conditions, no public supplier shall cease its licensed operations within its authorised area L.R.O. 1/2012 LAWS OF GUYANA 20 Cap. 56:01 Electricity Sector Reform      Activities requiring prior consent of the Minister.                                        or any part thereof without first obtaining the permission of the Minister and the Commission.",
            "description": "Except where a licence expires or is revoked, suspended, cancelled or terminated in accordance with its conditions, no public supplier shall cease its licensed operations within its authorised area L.R.O. 1/2012 LAWS OF GUYANA 20 Cap. 56:01 Electricity Sector Reform      Activities requiring prior consent of the Minister.                                        or any part thereof without first obtaining the permission of the Minister and the Commission."
        }
    },
    {
        "act": "ELECTRICITY SECTOR REFORM ACT",
        "source": "https://mola.gov.gy/laws-of-guyana",
        "type": {
            "name": "section",
            "representation": "12",
            "title": "Activities requiring prior consent of the Minister. ",
            "context": "ELECTRICITY SECTOR REFORM ACT under Activities requiring prior consent of the Minister. 12. The following conditions shall be included in every licence granted and shall be deemed to have been agreed upon by the licensee -  (a)      (i)        a licensee shall not, without the prior consent in writing of the Minister, acquire, by purchase or otherwise, the licence or the business of, or for the purpose of supplying electricity associate itself with, any person supplying, or intending to supply, electricity under any other licence;  shall give not less than one month's notice of its intention to apply for such consent to the Agency, and the Agency may present its views, orally or in writing, to the Minister on the proposed acquisition or association within thirty days of the licensee's notice:  Provided that nothing in these conditions shall be construed as requiring the consent of the Minister for the purchase of electricity by a public supplier from an independent power producer licensed under this Act to sell electricity to such public supplier, or for any other purchase provided for in a licence,  (b) a licensee shall not assign or encumber its licence, or transfer, or divest itself of, its rights or obligations under a licence, or any part thereof, without the prior consent in writing of the Minister, which consent shall not be unreasonably withheld;    (ii)    before applying for such consent, the licensee L.R.O. 1/2012 LAWS OF GUYANA Electricity Sector Reform Cap. 56:01 21                                                  (c)       except as otherwise provided in a licence, no public supplier may, without the prior consent in writing of the Minister, lend funds or give credit to any of its officers or directors or to any company (except a public supplier subject to the regulatory powers of the Minister) if the company holds, directly or indirectly through any chain of ownership, five percent or more of the voting stock of the public supplier or renders any managerial, supervisory, engineering, legal, accounting or financial service to the public supplier, by   (i)   becoming surety, guarantor or endorser upon any obligations, contingent or otherwise, of such officer, director or company;  (ii)     loaning funds, securities or other like assets to such officer, director or company;  (iii)    purchasing in the open market, or otherwise, any obligation upon which the officer, director or company may be liable solely or jointly with others;  (d) unless permitted under the terms of a licence, any agreement relating to any transaction of the nature described in this section, unless made with or subject to the consent of the Minister, shall be void;  (e) unless otherwise provided by the Minister in writing, this section shall extend to the renewal or extension of agreements existing L.R.O. 1/2012 LAWS OF GUYANA 22 Cap. 56:01 Electricity Sector Reform                                Extensions of licences.                on the appointed day.",
            "description": [
                {
                    "representation": "(a)",
                    "description": ""
                },
                {
                    "representation": "(i)",
                    "description": "becoming surety, guarantor or endorser upon any obligations, contingent or otherwise, of such officer, director or company;"
                },
                {
                    "representation": "(b)",
                    "description": "a licensee shall not assign or encumber its licence, or transfer, or divest itself of, its rights or obligations under a licence, or any part thereof, without the prior consent in writing of the Minister, which consent shall not be unreasonably withheld;"
                },
                {
                    "representation": "(c)",
                    "description": "except as otherwise provided in a licence, no public supplier may, without the prior consent in writing of the Minister, lend funds or give credit to any of its officers or directors or to any company"
                },
                {
                    "representation": "(d)",
                    "description": "unless permitted under the terms of a licence, any agreement relating to any transaction of the nature described in this section, unless made with or subject to the consent of the Minister, shall be void;"
                },
                {
                    "representation": "(e)",
                    "description": "unless otherwise provided by the Minister in writing, this section shall extend to the renewal or extension of agreements existing L.R.O. 1/2012 LAWS OF GUYANA 22 Cap. 56:01 Electricity Sector Reform                                Extensions of licences.                on the appointed day."
                }
            ]
        }
    },
    {
        "act": "ELECTRICITY SECTOR REFORM ACT",
        "source": "https://mola.gov.gy/laws-of-guyana",
        "type": {
            "name": "section",
            "representation": "13",
            "title": "Modifications of licences. ",
            "context": "ELECTRICITY SECTOR REFORM ACT under Modifications of licences. 13. (1) Subject to the first and second provisos to section 5 and this section, the Minister, after seeking the Agency's advice, may modify the terms and conditions of a licence if the holder of the licence consents to the modifications in writing.  (2) Before concluding any modifications to which the Minister and the licensee have agreed, the Minister shall give notice  (a)  stating that he proposes to make such modifications and setting out their effect; (b) stating the reasons why he proposes to make the modifications; and (c) specifying the period (not being less than thirty days from the date of publication of the notice) within which representations or objections with respect to the proposed modifications may be made, and shall consider any representations or objections which are duly made.    (3) A notice under subsection (2) shall be given by publishing it in a daily newspaper.  grant an extension of the licence for a period not exceeding fifteen years, at any time within one year previous to the expiry of the licence or any extension thereof or in accordance with the terms of the licence governing extensions, as the case may be.  (2) Section 13 (2) and (3), governing the procedure for proceedings for extensions under this section.    (3) Subject to subsection (2) and within three months of Modificationsof licences.",
            "description": [
                {
                    "representation": "(1)",
                    "description": "Subject to the first and second provisos to section 5 and this section, the Minister, after seeking the Agency's advice, may modify the terms and conditions of a licence if the holder of the licence consents to the modifications in writing."
                },
                {
                    "representation": "(2)",
                    "description": "and within three months of Modificationsof licences."
                },
                {
                    "representation": "(a)",
                    "description": "stating that he proposes to make such modifications and setting out their effect;"
                },
                {
                    "representation": "(b)",
                    "description": "stating the reasons why he proposes to make the modifications; and"
                },
                {
                    "representation": "(c)",
                    "description": "specifying the period"
                },
                {
                    "representation": "(3)",
                    "description": "Subject to subsection"
                }
            ]
        }
    },
    {
        "act": "ELECTRICITY SECTOR REFORM ACT",
        "source": "https://mola.gov.gy/laws-of-guyana",
        "type": {
            "name": "section",
            "representation": "14",
            "title": "Extensions of licences. ",
            "context": "ELECTRICITY SECTOR REFORM ACT under Extensions of licences. 14. (1) The Minister, upon the application of any licensee, may L.R.O. 1/2012 modifications of licences, shall apply mutatis    mutandis  to LAWS OF GUYANA Electricity Sector Reform Cap. 56:01 23      Securing compliance with conditions of licences.                          Suspension and revocation of licences.           receiving an application for an extension of a licence, the Minister shall determine whether to extend the licence and, within the same three month period, shall serve a notice of his determination upon the licensee.",
            "description": [
                {
                    "representation": "(1)",
                    "description": "The Minister, upon the application of any licensee, may L.R.O. 1/2012 modifications of licences, shall apply mutatis    mutandis  to LAWS OF GUYANA Electricity Sector Reform Cap. 56:01 23      Securing compliance with conditions of licences.                          Suspension and revocation of licences.           receiving an application for an extension of a licence, the Minister shall determine whether to extend the licence and, within the same three month period, shall serve a notice of his determination upon the licensee."
                }
            ]
        }
    },
    {
        "act": "ELECTRICITY SECTOR REFORM ACT",
        "source": "https://mola.gov.gy/laws-of-guyana",
        "type": {
            "name": "section",
            "representation": "15",
            "title": "Securing compliance with conditions of licences. ",
            "context": "ELECTRICITY SECTOR REFORM ACT under Securing compliance with conditions of licences. 15. (1) Where the Minister, acting reasonably, is satisfied that a licensee has contravened or is likely to contravene a condition of its licence, he may, by notice in writing served on the licensee, require the licensee, within such period as shall be specified in the notice -    (a)    to take such steps as the Minister considers necessary to secure compliance with that condition or to avoid the likely contravention of that condition and, where there is a contravention of a condition, to make good any direct loss or damage in consequence of the contravention of that condition;  (b)   to lodge with the Accountant General such security as shall be specified in the notice for the due observance of that condition.   (2) A notice under subsection (1) shall state the relevant condition of the licence in respect of which it is to be served and the acts or omissions which, in the opinion of the Minister, constitute or are likely to constitute a contravention of that condition, and such notice shall be effective upon service on the licensee.",
            "description": [
                {
                    "representation": "(1)",
                    "description": "shall state the relevant condition of the licence in respect of which it is to be served and the acts or omissions which, in the opinion of the Minister, constitute or are likely to constitute a contravention of that condition, and such notice shall be effective upon service on the licensee."
                },
                {
                    "representation": "(a)",
                    "description": "to take such steps as the Minister considers necessary to secure compliance with that condition or to avoid the likely contravention of that condition and, where there is a contravention of a condition, to make good any direct loss or damage in consequence of the contravention of that condition;"
                },
                {
                    "representation": "(b)",
                    "description": "to lodge with the Accountant General such security as shall be specified in the notice for the due observance of that condition."
                },
                {
                    "representation": "(2)",
                    "description": "A notice under subsection"
                }
            ]
        }
    },
    {
        "act": "ELECTRICITY SECTOR REFORM ACT",
        "source": "https://mola.gov.gy/laws-of-guyana",
        "type": {
            "name": "section",
            "representation": "16",
            "title": "Suspension and revocation of licences. ",
            "context": "ELECTRICITY SECTOR REFORM ACT under Suspension and revocation of licences. 16.(1) Subject to subsections (2) and (3) and except as otherwise provided in a licence, the Minister may, by notice in writing served on a licensee in accordance with the terms of its licence or section 67, as the case may be, suspend or revoke the licence on any of the following grounds   (a) in the case of a licence for the supply of electricity for public purposes, that the licensee, in the opinion of the Minister, acting L.R.O. 1/2012 LAWS OF GUYANA 24 Cap. 56:01 Electricity Sector Reform                                                  reasonably, is not providing consumers in its authorised area with a regular and efficient supply of electricity in accordance with the provisions of this Act and the licence;  (b) in the case of a licence for the supply of electricity for private purposes that the licensee is using the electricity supply facilities in a manner not authorised by the terms and conditions of its licence or in a manner that is constituting, or is likely to constitute, a nuisance;  (c) that the licensee has contravened, or failed to carry out within a reasonable time or discontinued the performance of, the terms or conditions of its licence, or has contravened the provisions of this Act or regulations made thereunder, or is supplying electricity in a manner not authorised by its licence;  (d) that the licensee has failed to pay any sum due and payable under the licence to the Accountant General and, after written notice, for a period of thirty days has not cured such failure;  (e) that the licensee has become bankrupt or compounds with its creditors or, in the opinion of the Minister, acting reasonably, the licensee's financial position causes it to be unable fully and efficiently to discharge the duties and obligations imposed on it by its licence;  L.R.O. 1/2012 LAWS OF GUYANA Electricity Sector Reform Cap. 56:01 25                                                  (f) that the licensee has failed to comply with a notice under section 15 (1) or an order of the High Court under section 4 18 (4) (b) for securing compliance with any condition of the licence;  (g) that the licence was obtained by fraud; or  (h) any other ground specified in the licence.  (2) Before serving a licensee with a final notice of suspension or revocation under subsection (1), the Minister shall serve on the licensee an initial notice in writing and publish the initial notice in a daily newspaper, stating   (a) that he is considering serving a final notice of suspension or revocation on the licensee on the grounds specified under subsection (1); and (b) that the licensee and any person likely to be affected by a suspension or revocation may, within the period of thirty days from the date of the service of such initial notice on the licensee, make written and, if the licensee or affected person so desires, oral representations to the Minister.  (3) The Minister shall consider any representations made by a licensee and any person likely to be affected by a suspension or revocation in response to an initial notice under subsection (2) before serving a final notice of suspension or revocation of the licence.  (4) After serving a final notice of suspension or revocation in respect to a public supplier's licence, the Minister shall publish notice of it in a daily newspaper and in such other way as appears to him expedient for notifying consumers in the authorised area to which the licence relates.  (5) A final notice of suspension or revocation shall be L.R.O. 1/2012 LAWS OF GUYANA 26 Cap. 56:01 Electricity Sector Reform                 Considera-tions for giving a notice of compliance, suspension or revocation.               Appeal procedures.          effective on the expiration of thirty days from the date of service of the notice.  (6) A public supplier to whom a final notice of suspension or revocation of a licence has been given under this section shall be liable upon summary conviction for a penalty of not less than one million dollars nor more than forty million dollars, depending upon the degree of harm to the public caused by the acts or omissions that formed the grounds upon which such licence was revoked or suspended.",
            "description": [
                {
                    "representation": "(1)",
                    "description": "or an order of the High Court under section 4 18"
                },
                {
                    "representation": "(2)",
                    "description": "before serving a final notice of suspension or revocation of the licence."
                },
                {
                    "representation": "(3)",
                    "description": "The Minister shall consider any representations made by a licensee and any person likely to be affected by a suspension or revocation in response to an initial notice under subsection"
                },
                {
                    "representation": "(a)",
                    "description": "that he is considering serving a final notice of suspension or revocation on the licensee on the grounds specified under subsection"
                },
                {
                    "representation": "(b)",
                    "description": "that the licensee and any person likely to be affected by a suspension or revocation may, within the period of thirty days from the date of the service of such initial notice on the licensee, make written and, if the licensee or affected person so desires, oral representations to the Minister."
                },
                {
                    "representation": "(c)",
                    "description": "that the licensee has contravened, or failed to carry out within a reasonable time or discontinued the performance of, the terms or conditions of its licence, or has contravened the provisions of this Act or regulations made thereunder, or is supplying electricity in a manner not authorised by its licence;"
                },
                {
                    "representation": "(d)",
                    "description": "that the licensee has failed to pay any sum due and payable under the licence to the Accountant General and, after written notice, for a period of thirty days has not cured such failure;"
                },
                {
                    "representation": "(e)",
                    "description": "that the licensee has become bankrupt or compounds with its creditors or, in the opinion of the Minister, acting reasonably, the licensee's financial position causes it to be unable fully and efficiently to discharge the duties and obligations imposed on it by its licence;  L.R.O. 1/2012 LAWS OF GUYANA Electricity Sector Reform Cap. 56:01 25"
                },
                {
                    "representation": "(f)",
                    "description": "that the licensee has failed to comply with a notice under section 15"
                },
                {
                    "representation": "(4)",
                    "description": "After serving a final notice of suspension or revocation in respect to a public supplier's licence, the Minister shall publish notice of it in a daily newspaper and in such other way as appears to him expedient for notifying consumers in the authorised area to which the licence relates."
                },
                {
                    "representation": "(g)",
                    "description": "that the licence was obtained by fraud; or"
                },
                {
                    "representation": "(h)",
                    "description": "any other ground specified in the licence."
                },
                {
                    "representation": "(5)",
                    "description": "A final notice of suspension or revocation shall be L.R.O. 1/2012 LAWS OF GUYANA 26 Cap. 56:01 Electricity Sector Reform                 Considera-tions for giving a notice of compliance, suspension or revocation.               Appeal procedures.          effective on the expiration of thirty days from the date of service of the notice."
                },
                {
                    "representation": "(6)",
                    "description": "A public supplier to whom a final notice of suspension or revocation of a licence has been given under this section shall be liable upon summary conviction for a penalty of not less than one million dollars nor more than forty million dollars, depending upon the degree of harm to the public caused by the acts or omissions that formed the grounds upon which such licence was revoked or suspended."
                }
            ]
        }
    },
    {
        "act": "ELECTRICITY SECTOR REFORM ACT",
        "source": "https://mola.gov.gy/laws-of-guyana",
        "type": {
            "name": "section",
            "representation": "17",
            "title": "Considerations for giving a notice of compliance, suspension or revocation. ",
            "context": "ELECTRICITY SECTOR REFORM ACT under Considerations for giving a notice of compliance, suspension or revocation. 17. With regard to any notice contemplated under section 15 (1) or section 16 (1), the Minister shall not give such notice to a licensee if he is satisfied    (a) that the duties imposed on him by section 65 preclude the giving of the notice;  (b) that the licensee has agreed to take and is taking all such steps as it appears to the Minister to be appropriate for the licensee to take for the purpose of curing the contravention, failure or violation in question; or  (c) that the contravention, failure or violation in question is of a trivial or immaterial nature.",
            "description": [
                {
                    "representation": "(1)",
                    "description": "or section 16"
                },
                {
                    "representation": "(a)",
                    "description": "that the duties imposed on him by section 65 preclude the giving of the notice;"
                },
                {
                    "representation": "(b)",
                    "description": "that the licensee has agreed to take and is taking all such steps as it appears to the Minister to be appropriate for the licensee to take for the purpose of curing the contravention, failure or violation in question; or"
                },
                {
                    "representation": "(c)",
                    "description": "that the contravention, failure or violation in question is of a trivial or immaterial nature."
                }
            ]
        }
    },
    {
        "act": "ELECTRICITY SECTOR REFORM ACT",
        "source": "https://mola.gov.gy/laws-of-guyana",
        "type": {
            "name": "section",
            "representation": "18",
            "title": "Appeal procedures. ",
            "context": "ELECTRICITY SECTOR REFORM ACT under Appeal procedures. 18.(1) A licensee may appeal to the High Court against a notice under section 15 (1) or section 16 (1).  (2) An appeal under subsection (1) shall be instituted by a licensee within the period of fourteen days from the effective date of the notice under section 15 (2) or 16 (5).  L.R.O. 1/2012 LAWS OF GUYANA Electricity Sector Reform Cap. 56:01 27                                           Purchase of undertaking.      (3) The Attorney General shall be the respondent to every appeal instituted under subsection (1).  (4) On an appeal instituted under subsection (1), the High Court may, by order   (a) quash or confirm the notice against which the appeal is brought; or (b) where the notice is a notice under section 15 (1), vary the requirements imposed by the notice; (c) where the notice is a notice under Section 16(1) and the High Court is satisfied that the appellant has contravened or is likely to contravene any of the conditions of its licence, but that such contravention does not warrant suspension or revocation of the licence, quash the notice and order the appellant   (i)    to take such steps as the High Court considers necessary to secure compliance with that condition and to make good any direct loss or damage in consequence of a contravention of that condition;  (ii) to lodge with the Accountant General such security as shall be specified in the order for the due observance of that condition.",
            "description": [
                {
                    "representation": "(1)",
                    "description": "shall be instituted by a licensee within the period of fourteen days from the effective date of the notice under section 15"
                },
                {
                    "representation": "(2)",
                    "description": "or 16"
                },
                {
                    "representation": "(3)",
                    "description": "The Attorney General shall be the respondent to every appeal instituted under subsection"
                },
                {
                    "representation": "(4)",
                    "description": "On an appeal instituted under subsection"
                },
                {
                    "representation": "(a)",
                    "description": "quash or confirm the notice against which the appeal is brought; or"
                },
                {
                    "representation": "(b)",
                    "description": "where the notice is a notice under section 15"
                },
                {
                    "representation": "(c)",
                    "description": "where the notice is a notice under Section 16(1) and the High Court is satisfied that the appellant has contravened or is likely to contravene any of the conditions of its licence, but that such contravention does not warrant suspension or revocation of the licence, quash the notice and order the appellant"
                },
                {
                    "representation": "(i)",
                    "description": "to take such steps as the High Court considers necessary to secure compliance with that condition and to make good any direct loss or damage in consequence of a contravention of that condition;"
                }
            ]
        }
    },
    {
        "act": "ELECTRICITY SECTOR REFORM ACT",
        "source": "https://mola.gov.gy/laws-of-guyana",
        "type": {
            "name": "section",
            "representation": "19",
            "title": "Purchase of undertaking. ",
            "context": "ELECTRICITY SECTOR REFORM ACT under Purchase of undertaking. 19. (1) Unless otherwise provided in the licence of a public supplier, where the Minister declines to extend the term of the licence of the public supplier under section 14 or revokes the licence of the public supplier under section 16, and after any appeal by the L.R.O. 1/2012 LAWS OF GUYANA 28 Cap. 56:01 Electricity Sector Reform                                                  public 4 supplier of any such decision by the Minister has been finally determined confirming the Minister's decision, the following provisions shall have effect, namely   (a)      for a period of twenty-one days following             the Minister's service of his decision or the final determination of an appeal upholding the Minister's decision, the Government shall have a right of first refusal to purchase the undertaking of the public supplier and, if the Government elects to purchase such undertaking, it shall, by written notice given to the public supplier within ten days of the expiration of the aforesaid twenty-one days of the Government's decision to effect such purchase, require the public supplier to sell its undertaking to the Government at a price to be determined and paid in accordance with subsection (3);  (b) if the Government does not elect to purchase the undertaking of the public supplier and if any other person is willing to purchase such undertaking, the Government may, by notice in writing given to the public supplier within ten days of the expiration of the aforesaid twenty-one days of the Government's decision not to effect such a purchase, require the public supplier to sell its undertaking to such other person at a price to be determined and paid in accordance with subsection (3);  (c) where the Government issues any notice under paragraph (b) requiring a public supplier to sell its undertaking, it may by L.R.O. 1/2012 LAWS OF GUYANA Electricity Sector Reform Cap. 56:01 29                                                  such notice require the public supplier to deliver, and thereupon the public supplier shall deliver on the date specified in the notice, its undertaking, including all works, to the designated purchaser pending the determination and payment of the purchase price of the undertaking in accordance with subsection (3):  Provided that in any such case, the purchaser shall pay to the public supplier interest at the prevailing rate payable by commercial banks at the time of delivery, plus one percent per annum, on the purchase price of the undertaking for the period from the date of subsection requiring a public supplier to sell its undertaking or where for any other reason no sale of the undertaking has been effected under this section, the public supplier shall have the option of selling or otherwise disposing of its undertaking in such manner and at such price as it may think fit:  Provided that, if the public supplier does not exercise such option within thirty days from the expiration of the ten day period hereinbefore referred to in this subsection, the Government may forthwith cause the works of the public supplier on, in, under, over, along, or across any land or street to be removed and every such street to be reinstated, and may recover the cost of such removal and reinstatement from the public supplier.  (2) Unless otherwise agreed to by the public supplier and the purchaser, and with the consent of the Minister in instances in which the Government is not the purchaser, where the undertaking of a public supplier is sold under subsection (1) (b), then upon the completion of the sale or on the date on which the undertaking is delivered to the intending purchaser under subsection (1) (c)  (d) where no notice has been issued under this delivery to the date of payment of the purchase price; L.R.O. 1/2012 LAWS OF GUYANA 30 Cap. 56:01 Electricity Sector Reform                                                   (a) the undertaking, including title or leasehold to all works and the liabilities of the undertaking, shall vest in the purchaser or the intending purchaser, as the case may be;  (b) the rights, powers, authorities, duties and obligations of the public supplier under its licence shall stand transferred to the purchaser, with any modifications that may .be agreed between the purchaser and the Minister in accordance with section 13, and such purchaser shall be deemed to be the licensee: Provided that where the undertaking is sold or delivered to the Government, the licence shall cease to have further operation.  (3) The following provisions shall have effect as to the determination and payment of the purchase price for the undertaking of a public supplier pursuant to this section, namely -   (a)  where, after the revocation of a public supplier's licence under section 16, the undertaking of the public supplier is sold to the Government under subsection (1) (a) or to a person designated by the Government under subsection (1) (b), the purchase price to be paid by the Government or such person designated by the Government, as the case may, be, shall be the fair market value of the undertaking, determined and paid in accordance with paragraphs (c) to (f), inclusive;  (b)      within ten days after the Government's             service of a notice upon a public supplier L.R.O. 1/2012 LAWS OF GUYANA Electricity Sector Reform Cap. 56:01 31                                                  under subsection (1) (a) or (b), the Government, or the purchaser designated by the Government under subsection (1) (b), as the case may be, and the public supplier shall agree upon an independent and qualified valuator to determine the fair market value of the undertaking;  (c)    the valuator appointed under paragraph (b) shall prepare and submit a report on the fair market value of the shares and submit copies of the same to the public supplier, the shareholders or other owners of the public supplier's undertaking, the Minister, and, if the Government has designated a purchaser, to such designated purchaser;  (d)      the expenses incurred in determining the fair market value of an undertaking under the procedure set forth in paragraph (c) shall be borne by the public supplier and the purchaser of the undertaking equally;  (e) for purposes of this section, \"fair market value\" means, and shall be determined as, the value of the net assets sold, whether of the various equity shares of the undertaking or of the undertaking itself, in an open and unrestricted market immediately prior to the Minister's service of notice of the revocation or non-extension of the licence, and determined without reference to any minority interests that may exist or any controlling shareholders so as to provide a comprehensive value, and determined with reference to the capitalization of future earnings of the undertaking on a going concern basis or with reference to the net fair L.R.O. 1/2012 LAWS OF GUYANA 32 Cap. 56:01 Electricity Sector Reform                             General  licensees.            value of the undertaking's assets and liabilities;  (f) the purchase price for the sale of the undertaking of a public supplier shall be determined and paid in full to the public supplier within such time and in such manner as may be agreed upon between the public supplier and the purchaser and, where there is no such agreement, no later than twelve months after the Minister's service of written notice upon the public supplier under subsection (1) requiring such public supplier to sell its undertaking to the Government or to a person designated by the Government, as the case may be.  (4) Any difference or dispute regarding the determination and date for payment of a purchase price or any other matter arising under this section shall be determined by arbitration in the manner provided in section 64 (2).",
            "description": [
                {
                    "representation": "(1)",
                    "description": "requiring such public supplier to sell its undertaking to the Government or to a person designated by the Government, as the case may be."
                },
                {
                    "representation": "(a)",
                    "description": "where, after the revocation of a public supplier's licence under section 16, the undertaking of the public supplier is sold to the Government under subsection"
                },
                {
                    "representation": "(b)",
                    "description": "shall prepare and submit a report on the fair market value of the shares and submit copies of the same to the public supplier, the shareholders or other owners of the public supplier's undertaking, the Minister, and, if the Government has designated a purchaser, to such designated purchaser;"
                },
                {
                    "representation": "(c)",
                    "description": "shall be borne by the public supplier and the purchaser of the undertaking equally;"
                },
                {
                    "representation": "(2)",
                    "description": "Unless otherwise agreed to by the public supplier and the purchaser, and with the consent of the Minister in instances in which the Government is not the purchaser, where the undertaking of a public supplier is sold under subsection"
                },
                {
                    "representation": "(d)",
                    "description": "the expenses incurred in determining the fair market value of an undertaking under the procedure set forth in paragraph"
                },
                {
                    "representation": "(3)",
                    "description": "The following provisions shall have effect as to the determination and payment of the purchase price for the undertaking of a public supplier pursuant to this section, namely -"
                },
                {
                    "representation": "(e)",
                    "description": "for purposes of this section, \"fair market value\" means, and shall be determined as, the value of the net assets sold, whether of the various equity shares of the undertaking or of the undertaking itself, in an open and unrestricted market immediately prior to the Minister's service of notice of the revocation or non-extension of the licence, and determined without reference to any minority interests that may exist or any controlling shareholders so as to provide a comprehensive value, and determined with reference to the capitalization of future earnings of the undertaking on a going concern basis or with reference to the net fair L.R.O. 1/2012 LAWS OF GUYANA 32 Cap. 56:01 Electricity Sector Reform                             General  licensees.            value of the undertaking's assets and liabilities;"
                },
                {
                    "representation": "(f)",
                    "description": "the purchase price for the sale of the undertaking of a public supplier shall be determined and paid in full to the public supplier within such time and in such manner as may be agreed upon between the public supplier and the purchaser and, where there is no such agreement, no later than twelve months after the Minister's service of written notice upon the public supplier under subsection"
                },
                {
                    "representation": "(4)",
                    "description": "Any difference or dispute regarding the determination and date for payment of a purchase price or any other matter arising under this section shall be determined by arbitration in the manner provided in section 64"
                }
            ]
        }
    },
    {
        "act": "ELECTRICITY SECTOR REFORM ACT",
        "source": "https://mola.gov.gy/laws-of-guyana",
        "type": {
            "name": "section",
            "representation": "20",
            "title": "General powers and duties of licensees. ",
            "context": "ELECTRICITY SECTOR REFORM ACT under General powers and duties of licensees. 20.(1) It shall be the duty of a public supplier to develop and of electricity supply, and to facilitate the use of alternative forms of electricity generation using renewable resources wherever commercially feasible.  (2) Subject to section 46, and except as otherwise provided in a licence granted under section 4 or an exemption granted under section 3, it shall be the duty of each public supplier to facilitate competition in the generation of electricity.  (3) Except as otherwise provided in a licence granted under section 4 or an exemption granted under section 3, a public supplier may, in the course of its supply of electricity, locate and L.R.O. 1/2012  maintain an duties of efficient, co-ordinated and economical system powers and duties ofLAWS OF GUYANA Electricity Sector Reform Cap. 56:01 33              Supply of electricity by public suppliers.               Notice of requirement of a supply            operate, outside its uthorised area, its generating or power stations and any other facilities as it may consider necessary for providing the supply of electricity within its authorised area as required by the terms of its licence.  (4) Subject to the provisions of this Act, of any regulations made thereunder, and of any licence granted under this Act, a public supplier may, for the purpose of supplying electricity under its licence, acquire lands by agreement, construct works, acquire licences for the use of any patented or protected processes, inventions, machinery, apparatus, methods, materials, or other things, enter into contracts, and generally do all acts and things necessary and incidental to those authorised purposes.",
            "description": [
                {
                    "representation": "(1)",
                    "description": "It shall be the duty of a public supplier to develop and of electricity supply, and to facilitate the use of alternative forms of electricity generation using renewable resources wherever commercially feasible."
                },
                {
                    "representation": "(2)",
                    "description": "Subject to section 46, and except as otherwise provided in a licence granted under section 4 or an exemption granted under section 3, it shall be the duty of each public supplier to facilitate competition in the generation of electricity."
                },
                {
                    "representation": "(3)",
                    "description": "Except as otherwise provided in a licence granted under section 4 or an exemption granted under section 3, a public supplier may, in the course of its supply of electricity, locate and L.R.O. 1/2012  maintain an duties of efficient, co-ordinated and economical system powers and duties ofLAWS OF GUYANA Electricity Sector Reform Cap. 56:01 33              Supply of electricity by public suppliers.               Notice of requirement of a supply            operate, outside its uthorised area, its generating or power stations and any other facilities as it may consider necessary for providing the supply of electricity within its authorised area as required by the terms of its licence."
                },
                {
                    "representation": "(4)",
                    "description": "Subject to the provisions of this Act, of any regulations made thereunder, and of any licence granted under this Act, a public supplier may, for the purpose of supplying electricity under its licence, acquire lands by agreement, construct works, acquire licences for the use of any patented or protected processes, inventions, machinery, apparatus, methods, materials, or other things, enter into contracts, and generally do all acts and things necessary and incidental to those authorised purposes."
                }
            ]
        }
    },
    {
        "act": "ELECTRICITY SECTOR REFORM ACT",
        "source": "https://mola.gov.gy/laws-of-guyana",
        "type": {
            "name": "section",
            "representation": "21",
            "title": "Supply of electricity by public suppliers. ",
            "context": "ELECTRICITY SECTOR REFORM ACT under Supply of electricity by public suppliers. 21. Subject to the provisions of this Act and any regulations made thereunder, a public supplier shall, upon being requested to do so by the owner or occupier of any premises (hereinafter referred to as a \"consumer\") within such public supplier's authorised area    (a) provide a new or increased supply of electricity to those premises; and (b) provide electric lines, meters and other apparatus as are necessary to supply electricity to the point of entry to those premises.",
            "description": [
                {
                    "representation": "(a)",
                    "description": "provide a new or increased supply of electricity to those premises; and"
                },
                {
                    "representation": "(b)",
                    "description": "provide electric lines, meters and other apparatus as are necessary to supply electricity to the point of entry to those premises."
                }
            ]
        }
    },
    {
        "act": "ELECTRICITY SECTOR REFORM ACT",
        "source": "https://mola.gov.gy/laws-of-guyana",
        "type": {
            "name": "section",
            "representation": "22",
            "title": "Notice of requirement of a supply of electricity. ",
            "context": "ELECTRICITY SECTOR REFORM ACT under Notice of requirement of a supply of electricity. 22. Where any consumer requires a supply of electricity  as provided in section 21, he shall give to the public supplier a notice in writing specifying   (a) the premises for which the supply is required; (b) the day on which the supply is required to commence; (c) the maximum power which may be required at any time; and (d) the minimum period for which the supply is of  electricity. L.R.O. 1/2012 LAWS OF GUYANA 34 Cap. 56:01 Electricity Sector Reform     Contract for supply of electricity.                              Third Schedule     c. 25:01       required to be given.",
            "description": [
                {
                    "representation": "(a)",
                    "description": "the premises for which the supply is required;"
                },
                {
                    "representation": "(b)",
                    "description": "the day on which the supply is required to commence;"
                },
                {
                    "representation": "(c)",
                    "description": "the maximum power which may be required at any time; and"
                },
                {
                    "representation": "(d)",
                    "description": "the minimum period for which the supply is of  electricity. L.R.O. 1/2012 LAWS OF GUYANA 34 Cap. 56:01 Electricity Sector Reform     Contract for supply of electricity.                              Third Schedule     c. 25:01       required to be given."
                }
            ]
        }
    },
    {
        "act": "ELECTRICITY SECTOR REFORM ACT",
        "source": "https://mola.gov.gy/laws-of-guyana",
        "type": {
            "name": "section",
            "representation": "23",
            "title": "Contract for supply of electricity. ",
            "context": "ELECTRICITY SECTOR REFORM ACT under Contract for supply of electricity. 23. Where a public supplier receives a notice from a consumer a notice that   (a) states the extent to which the proposals specified in the consumer's notice are acceptable to the public by the public supplier;   (b) states whether the rates to be charged by the public supplier will be determined under sections 26 to 28, inclusive, or by a special agreement between the public supplier and the consumer under section 29, and specifies the rates to be charged or the proposed terms of the agreement;  (c) specifies any payment which that consumer will be required to make for the public supplier's provision of electric lines, meters or other apparatus as permitted under section 26 (4);  (d) specifies any security deposit which the consumer will be required to give under section 28;   (e) specifies any other terms which that consumer will be required to accept under section 25 and the Third Schedule; and  (f) states the procedures for the resolution of any disputes between the public supplier and the consumer as provided for in Part X of the Public Utilities Commission Act,  and the written acceptance of such notice by the consumer requiring consumer under section 22, the public supplier shall give to that L.R.O. 1/2012 supplier and specifies any counter proposals made LAWS OF GUYANA Electricity Sector Reform Cap. 56:01 35  L.R.O. 1/2012public supplier to be required to do so; or [17 of 2010]electricity. steps to prevent such breach or violation;   (c) it is not reasonable in all the circumstances for the licence granted to it, and it has taken all reasonable this Act, the regulations made thereunder, or of the (b) the public supplier might or would be in breach of circumstances not within its control; (a) the public supplier is prevented from doing so by  supply electricity to any premises if and to the extent that",
            "description": [
                {
                    "representation": "(a)",
                    "description": "the public supplier is prevented from doing so by  supply electricity to any premises if and to the extent that"
                },
                {
                    "representation": "(b)",
                    "description": "the public supplier might or would be in breach of circumstances not within its control;"
                },
                {
                    "representation": "(c)",
                    "description": "it is not reasonable in all the circumstances for the licence granted to it, and it has taken all reasonable this Act, the regulations made thereunder, or of the"
                },
                {
                    "representation": "(d)",
                    "description": "specifies any security deposit which the consumer will be required to give under section 28;"
                },
                {
                    "representation": "(e)",
                    "description": "specifies any other terms which that consumer will be required to accept under section 25 and the Third Schedule; and"
                },
                {
                    "representation": "(f)",
                    "description": "states the procedures for the resolution of any disputes between the public supplier and the consumer as provided for in Part X of the Public Utilities Commission Act,  and the written acceptance of such notice by the consumer requiring consumer under section 22, the public supplier shall give to that L.R.O. 1/2012 supplier and specifies any counter proposals made LAWS OF GUYANA Electricity Sector Reform Cap. 56:01 35  L.R.O. 1/2012public supplier to be required to do so; or [17 of 2010]electricity. steps to prevent such breach or violation;"
                }
            ]
        }
    },
    {
        "act": "ELECTRICITY SECTOR REFORM ACT",
        "source": "https://mola.gov.gy/laws-of-guyana",
        "type": {
            "name": "section",
            "representation": "24",
            "title": "Exceptions to requirement to supply electricity. ",
            "context": "ELECTRICITY SECTOR REFORM ACT under Exceptions to requirement to supply electricity. 24. Nothing in this Act shall require a public supplier to  with this Act and any regulations made thereunder. and the public supplier for the supply of electricity in accordance pursuant thereto shall constitute a contract between such consumer a supply of electricity and the public supplier's supply of electricity             to supply requirement Exceptions to     Provided that different rates may be prescribed for different  against, any consumer or class of consumers similarly situated: supplier shall not show undue preference for, or unduly discriminate (2) Subject to section 29, the rates to be charged by a public  Commission Act. Commission in accordance with this Act and the Public Utilities accordance with such rates as may be fixed from time to time by the by a public supplier for the supply of electricity by it shall be in",
            "description": [
                {
                    "representation": "(2)",
                    "description": "Subject to section 29, the rates to be charged by a public  Commission Act. Commission in accordance with this Act and the Public Utilities accordance with such rates as may be fixed from time to time by the by a public supplier for the supply of electricity by it shall be in"
                }
            ]
        }
    },
    {
        "act": "ELECTRICITY SECTOR REFORM ACT",
        "source": "https://mola.gov.gy/laws-of-guyana",
        "type": {
            "name": "section",
            "representation": "25",
            "title": "Power to require acceptance of restrictions upon supply of electricity. ",
            "context": "ELECTRICITY SECTOR REFORM ACT under Power to require acceptance of restrictions upon supply of electricity. 25. A public supplier may require any consumer who                c. 25:01 provisions. general electricity: supply of Rates for the   of electricity. upon supply restrictions acceptance of require Power to to any offence involving the use of electricity under Act, the regulations made thereunder, or with regard been convicted of three or more offences under this (d)      the person requesting the supply of electricity has any other wirtten law. LAWS OF GUYANA 36 Cap. 56:01 Electricity Sector Reform  L.R.O. 1/2012 ScheduleThird c. 25:01  (4) Subject to the Third Schedule and section 30, where any  consumer's electric load. unsatisfactory power factor of the (g) may include a charge in respect of  exchange rate; and cost of fuel and variations in the foreign (f)       may include adjustments for variations in the  electricity; supplier on the premises to which it supplies apparatus or fitting provided by the public of any electricity meter or other electrical (e)       may include a rent or other charge in respect  vary to the extent that the supply is taken up; availability of a supply of electricity and may (d)  may include a charge in respect of the  the charge for the actual electricity supplied; (c)     may include a standing charge in addition to  (b)      shall be published in a daily newspaper;  charged; made as well as the prices which are to be the principles on which the charges are to be             show the methods or formulae by which and (a)       shall be disclosed in such a manner as to   (2) and the Public Utilities Commission Act a public supplier, fixed by the Commission under subsections (1) and (3) Subject to section 27, a rate for the supply of electricity by  electricity is taken up, or to any other relevant circumstance.                                                classes of consumers, whether by reference to the different purposes for which electricity is supplied, the different times of the day at which electricity is supplied, the different areas of supply or different parts of such areas, the extent to which the supply of LAWS OF GUYANA Electricity Sector Reform Cap. 56:01 37       Rates for the supply of electricity: Guyana Electricity Corporation and Guyana Power & Light, Inc. Second Schedule First Schedule        Power to require security for the payment of sums due for the supply of electricity.                electric line or other electrical apparatus is provided by a public supplier pursuant to a request by any consumer for a supply of electricity, the public supplier may require any expenses reasonably incurred or estimated to be incurred in providing such supply of electricity to be defrayed by the consumer requiring the supply.",
            "description": [
                {
                    "representation": "(d)",
                    "description": "may include a charge in respect of the  the charge for the actual electricity supplied;"
                },
                {
                    "representation": "(4)",
                    "description": "Subject to the Third Schedule and section 30, where any  consumer's electric load. unsatisfactory power factor of the"
                },
                {
                    "representation": "(g)",
                    "description": "may include a charge in respect of  exchange rate; and cost of fuel and variations in the foreign"
                },
                {
                    "representation": "(f)",
                    "description": "may include adjustments for variations in the  electricity; supplier on the premises to which it supplies apparatus or fitting provided by the public of any electricity meter or other electrical"
                },
                {
                    "representation": "(e)",
                    "description": "may include a rent or other charge in respect  vary to the extent that the supply is taken up; availability of a supply of electricity and may"
                },
                {
                    "representation": "(c)",
                    "description": "may include a standing charge in addition to"
                },
                {
                    "representation": "(b)",
                    "description": "shall be published in a daily newspaper;  charged; made as well as the prices which are to be the principles on which the charges are to be             show the methods or formulae by which and"
                },
                {
                    "representation": "(a)",
                    "description": "shall be disclosed in such a manner as to"
                },
                {
                    "representation": "(2)",
                    "description": "and the Public Utilities Commission Act a public supplier, fixed by the Commission under subsections"
                },
                {
                    "representation": "(1)",
                    "description": "and"
                },
                {
                    "representation": "(3)",
                    "description": "Subject to section 27, a rate for the supply of electricity by  electricity is taken up, or to any other relevant circumstance.                                                classes of consumers, whether by reference to the different purposes for which electricity is supplied, the different times of the day at which electricity is supplied, the different areas of supply or different parts of such areas, the extent to which the supply of LAWS OF GUYANA Electricity Sector Reform Cap. 56:01 37       Rates for the supply of electricity: Guyana Electricity Corporation and Guyana Power & Light, Inc. Second Schedule First Schedule        Power to require security for the payment of sums due for the supply of electricity.                electric line or other electrical apparatus is provided by a public supplier pursuant to a request by any consumer for a supply of electricity, the public supplier may require any expenses reasonably incurred or estimated to be incurred in providing such supply of electricity to be defrayed by the consumer requiring the supply."
                }
            ]
        }
    },
    {
        "act": "ELECTRICITY SECTOR REFORM ACT",
        "source": "https://mola.gov.gy/laws-of-guyana",
        "type": {
            "name": "section",
            "representation": "26",
            "title": "Rates for the supply of electricity: general provisions. ",
            "context": "ELECTRICITY SECTOR REFORM ACT under Rates for the supply of electricity: general provisions. 26.(1) Subject to provisions of this Act, the rates to be charged  thereunder, and the terms of the licence granted to it.  public supplier to comply with this Act, the regulations made restrictions that must be imposed for the purpose of enabling the requests a supply of electricity to accept in respect of the supply any",
            "description": [
                {
                    "representation": "(1)",
                    "description": "Subject to provisions of this Act, the rates to be charged  thereunder, and the terms of the licence granted to it.  public supplier to comply with this Act, the regulations made restrictions that must be imposed for the purpose of enabling the requests a supply of electricity to accept in respect of the supply any"
                }
            ]
        }
    },
    {
        "act": "ELECTRICITY SECTOR REFORM ACT",
        "source": "https://mola.gov.gy/laws-of-guyana",
        "type": {
            "name": "section",
            "representation": "27",
            "title": "Rates for the supply of electricity: Guyana Electricity Corporation and Guyana Power & Light, Inc. ",
            "context": "ELECTRICITY SECTOR REFORM ACT under Rates for the supply of electricity: Guyana Electricity Corporation and Guyana Power & Light, Inc. 27.(1) Prior to and on January 1, 2001, the headline rates, actual rates and basic rates to be charged by the Guyana Electricity Corporation and Guyana Power & Light, Inc., for the supply of electricity and services shall be those determined in accordance with the Second Schedule.   (2) After January 1, 2001, the First Schedule and the licence granted by the Minister to Guyana Power & Light, Inc. under section 42 shall govern the rates for the supply of electricity and services at any time charged and to be charged by Guyana Power & Light, Inc., and the mechanisms, formulae, principles and procedures whereby such rates shall be calculated and determined for all",
            "description": [
                {
                    "representation": "(1)",
                    "description": "Prior to and on January 1, 2001, the headline rates, actual rates and basic rates to be charged by the Guyana Electricity Corporation and Guyana Power & Light, Inc., for the supply of electricity and services shall be those determined in accordance with the Second Schedule."
                },
                {
                    "representation": "(2)",
                    "description": "After January 1, 2001, the First Schedule and the licence granted by the Minister to Guyana Power & Light, Inc. under section 42 shall govern the rates for the supply of electricity and services at any time charged and to be charged by Guyana Power & Light, Inc., and the mechanisms, formulae, principles and procedures whereby such rates shall be calculated and determined for all"
                }
            ]
        }
    },
    {
        "act": "ELECTRICITY SECTOR REFORM ACT",
        "source": "https://mola.gov.gy/laws-of-guyana",
        "type": {
            "name": "section",
            "representation": "28",
            "title": "Power to require security for the payment of sums due for the supply of electricity. ",
            "context": "ELECTRICITY SECTOR REFORM ACT under Power to require security for the payment of sums due for the supply of electricity. 28. (1) Subject to this section, a public supplier may require any consumer who requests a supply of electricity to give reasonable security for the payment of any sums which may become due in respect of the supply or any electric line or other electrical apparatus provided by the public supplier, and if such consumer fails to give such security, the public supplier may, if it thinks fit, refuse to provide the supply of electricity or such electric line or other electrical apparatus.  (2) Where any consumer has not given the security provided for in subsection (1), or where the security given by any consumer has become invalid or insufficient    (a) the public supplier may by notice require that consumer, within ten days of the date of the notice, to give the public supplier reasonable security for the payment of any purposes under this Act and the Public Utilities Commission Act. L.R.O. 1/2012 LAWS OF GUYANA 38 Cap. 56:01 Electricity Sector Reform               c. 25:01        c. 25:01                       sum which may become due to it in respect of the supply; and (b) if that consumer fails to give such security the public supplier may, if it thinks fit, discontinue the supply for so long as the failure continues:  Provided that any notice given by a public supplier under this subsection shall include an explanation of the dispute resolution procedure provided for in Part X of the Public Utilities Commission Act.  (3) Where any security is deposited with a public supplier in accordance with this section, the public supplier shall pay compound interest thereon at the rate of seven percent per annum:  Provided that no interest shall be payable by a public supplier under this subsection or under the Public Utilities Commission Act  on any sum held by the public supplier for a period of less than six months.  (4) A security deposit shall be returned to the consumer who made it on the termination of the supply of electricity by the public supplier, subject to any deduction therefrom of any amounts due to the public supplier by that consumer.  (5) A public supplier shall not be entitled to require security under this section in respect of the supply of electricity if the consumer is supplied through a pre-payment meter:  Provided that this restriction does not limit the right of the public supplier to require a customer contribution in respect of any electric line or other electrical apparatus provided by the public supplier.",
            "description": [
                {
                    "representation": "(1)",
                    "description": "Subject to this section, a public supplier may require any consumer who requests a supply of electricity to give reasonable security for the payment of any sums which may become due in respect of the supply or any electric line or other electrical apparatus provided by the public supplier, and if such consumer fails to give such security, the public supplier may, if it thinks fit, refuse to provide the supply of electricity or such electric line or other electrical apparatus."
                },
                {
                    "representation": "(2)",
                    "description": "Where any consumer has not given the security provided for in subsection"
                },
                {
                    "representation": "(a)",
                    "description": "the public supplier may by notice require that consumer, within ten days of the date of the notice, to give the public supplier reasonable security for the payment of any purposes under this Act and the Public Utilities Commission Act. L.R.O. 1/2012 LAWS OF GUYANA 38 Cap. 56:01 Electricity Sector Reform               c. 25:01        c. 25:01                       sum which may become due to it in respect of the supply; and"
                },
                {
                    "representation": "(b)",
                    "description": "if that consumer fails to give such security the public supplier may, if it thinks fit, discontinue the supply for so long as the failure continues:  Provided that any notice given by a public supplier under this subsection shall include an explanation of the dispute resolution procedure provided for in Part X of the Public Utilities Commission Act."
                },
                {
                    "representation": "(3)",
                    "description": "Where any security is deposited with a public supplier in accordance with this section, the public supplier shall pay compound interest thereon at the rate of seven percent per annum:  Provided that no interest shall be payable by a public supplier under this subsection or under the Public Utilities Commission Act  on any sum held by the public supplier for a period of less than six months."
                },
                {
                    "representation": "(4)",
                    "description": "A security deposit shall be returned to the consumer who made it on the termination of the supply of electricity by the public supplier, subject to any deduction therefrom of any amounts due to the public supplier by that consumer."
                },
                {
                    "representation": "(5)",
                    "description": "A public supplier shall not be entitled to require security under this section in respect of the supply of electricity if the consumer is supplied through a pre-payment meter:  Provided that this restriction does not limit the right of the public supplier to require a customer contribution in respect of any electric line or other electrical apparatus provided by the public supplier."
                }
            ]
        }
    },
    {
        "act": "ELECTRICITY SECTOR REFORM ACT",
        "source": "https://mola.gov.gy/laws-of-guyana",
        "type": {
            "name": "section",
            "representation": "29",
            "title": "Special agreements for the supply of electricity. ",
            "context": "ELECTRICITY SECTOR REFORM ACT under Special agreements for the supply of electricity. 29.(1) Notwithstanding anything in sections 21 to 28, supply of for the agreements Special L.R.O. 1/2012 LAWS OF GUYANA Electricity Sector Reform Cap. 56:01 39  electricity. Third Schedule c. 25:01           Third Schedule           Schedules   Regulations for the supply of electricity to the public. Third Schedule          inclusive, and the Third Schedule, a consumer who requires a supply of electricity may enter into a special agreement with a public supplier for the supply on such terms as may be specified in the agreement, and, upon approval by the Commission of such special agreement pursuant to section 40 (2) of the Public Utilities Commission Act, the public supplier may demand and receive money from such consumer in accordance with the terms of the special agreement.   (2) So long as a special agreement concluded and approved in accordance with subsection (1) is effective, the rights and liabilities of the parties to the agreement shall be those arising under the agreement and, to the extent that any provision of sections 21 to 28, inclusive, or the Third Schedule conflict with the terms of the special agreement, the special agreement shall prevail.  (3) Any consumer who is a party to a special agreement with a public supplier under this section may give the public supplier a notice under section 22 requesting that, on the day on which the special agreement ceases to be effective, the public supplier commence providing such consumer with a supply of electricity in accordance with sections 21 to 28, inclusive, and the Schedules.",
            "description": [
                {
                    "representation": "(1)",
                    "description": "is effective, the rights and liabilities of the parties to the agreement shall be those arising under the agreement and, to the extent that any provision of sections 21 to 28, inclusive, or the Third Schedule conflict with the terms of the special agreement, the special agreement shall prevail."
                },
                {
                    "representation": "(2)",
                    "description": "So long as a special agreement concluded and approved in accordance with subsection"
                },
                {
                    "representation": "(3)",
                    "description": "Any consumer who is a party to a special agreement with a public supplier under this section may give the public supplier a notice under section 22 requesting that, on the day on which the special agreement ceases to be effective, the public supplier commence providing such consumer with a supply of electricity in accordance with sections 21 to 28, inclusive, and the Schedules."
                }
            ]
        }
    },
    {
        "act": "ELECTRICITY SECTOR REFORM ACT",
        "source": "https://mola.gov.gy/laws-of-guyana",
        "type": {
            "name": "section",
            "representation": "30",
            "title": "Regulations for the supply of electricity to the public. ",
            "context": "ELECTRICITY SECTOR REFORM ACT under Regulations for the supply of electricity to the public. 30. The provisions of sections 21 to 29, inclusive, the Third Schedule and the regulations made under this Act shall have effect, subject to such restrictions, exceptions, modifications and conditions as may be included by the Minister in a licence, in relation to every licence granted to a public supplier under this Act:  Provided that, where in a licence separate provision is made in substitution of any of the provisions mentioned, such substituted provisions shall apply in respect of the licence in lieu thereof.",
            "description": "The provisions of sections 21 to 29, inclusive, the Third Schedule and the regulations made under this Act shall have effect, subject to such restrictions, exceptions, modifications and conditions as may be included by the Minister in a licence, in relation to every licence granted to a public supplier under this Act:  Provided that, where in a licence separate provision is made in substitution of any of the provisions mentioned, such substituted provisions shall apply in respect of the licence in lieu thereof."
        }
    },
    {
        "act": "ELECTRICITY SECTOR REFORM ACT",
        "source": "https://mola.gov.gy/laws-of-guyana",
        "type": {
            "name": "section",
            "representation": "31",
            "title": "Technical standards and powers applicable to public suppliers.  ",
            "context": "ELECTRICITY SECTOR REFORM ACT under Technical standards and powers applicable to public suppliers.  31. North American or European technical standards shall apply to every licence granted under this Act, subject to such restrictions, exceptions, modifications and conditions as may be suppliers. public applicable to and powers standards Technical L.R.O. 1/2012 LAWS OF GUYANA 40 Cap. 56:01 Electricity Sector Reform     Acquisition of lands. c. 62:05                                           included by the Minister in a licence or embodied in regulations made under this Act.",
            "description": "North American or European technical standards shall apply to every licence granted under this Act, subject to such restrictions, exceptions, modifications and conditions as may be suppliers. public applicable to and powers standards Technical L.R.O. 1/2012 LAWS OF GUYANA 40 Cap. 56:01 Electricity Sector Reform     Acquisition of lands. c. 62:05                                           included by the Minister in a licence or embodied in regulations made under this Act."
        }
    },
    {
        "act": "ELECTRICITY SECTOR REFORM ACT",
        "source": "https://mola.gov.gy/laws-of-guyana",
        "type": {
            "name": "section",
            "representation": "32",
            "title": "Acquisition of lands. ",
            "context": "ELECTRICITY SECTOR REFORM ACT under Acquisition of lands. 32.(1) The Minister may in accordance with the Public Purposes Act compulsorily acquire land for and on behalf of a public supplier for the purpose of the proper and effectual exercise of a licence granted to the public supplier under section 4 or an exemption granted under section",
            "description": [
                {
                    "representation": "(1)",
                    "description": "The Minister may in accordance with the Public Purposes Act compulsorily acquire land for and on behalf of a public supplier for the purpose of the proper and effectual exercise of a licence granted to the public supplier under section 4 or an exemption granted under section"
                }
            ]
        }
    },
    {
        "act": "ELECTRICITY SECTOR REFORM ACT",
        "source": "https://mola.gov.gy/laws-of-guyana",
        "type": {
            "name": "section",
            "representation": "33",
            "title": "Conditions under which a public supplier may break up streets, etc.. ",
            "context": "ELECTRICITY SECTOR REFORM ACT under Conditions under which a public supplier may break up streets, etc.. 33. (1) A public supplier from time to time for the purpose of electric lines duly authorised, or any part or parts thereof, or for the purpose of erecting, removing, repairing or maintaining pillars or poles for stringing wires to convey electricity, may open and break up the soil and pavement of any road, street, bridge, lane or public place along the routes of those electric lines and may erect pillars,  (a) the public supplier shall give to the road authority notice of its intention, specifying the time at which it will begin to do so and the portion of the road, street or bridge L.R.O. 1/2012 poles, lamps and works therein subject to the following conditions- supplierunder which a public constructing,           maintaining           and         renewing         any LAWS OF GUYANA Electricity Sector Reform Cap. 56:01 43                                                  proposed to be opened or broken up, the notice to be given seven days at least before the commencement of the work unless the work is to remedy a dangerous situation or a situation that has interrupted or imminently threatens to interrupt the supply of electricity, in which case notice may be dispensed with;  (b) the public supplier shall not open or break up the soil and pavement of any road, street, bridge, lane or public place except under the superintendence and to the reasonable satisfaction of the road authority, unless that authority refuses or neglects to give superintendence at the time specified in the notice, or discontinues it during the work, or unless the work is to remedy a dangerous situation or a situation that has interrupted or imminently threatens to interrupt the supply of electricity, in which case superintendence may be dispensed with;  (c) the public supplier shall not erect any pillar or pole in a position to which the road authority reasonably objects; (d) the public supplier shall pay all reasonable expenses to which the road authority is put on account of superintendence;  (e)   the public supplier shall not, without the consent of the road authority, open or break up any road, street, bridge, lane or public place without providing reasonable facilities for the passage of the ordinary traffic on that road, street or bridge, to the satisfaction of the road authority.  L.R.O. 1/2012 LAWS OF GUYANA 44 Cap. 56:01 Electricity Sector Reform   L.R.O. 1/2011                                             (2) When the public supplier has opened or broken up any portion of the road, street, bridge, lane or public place, it shall be under the following further obligations   (a) it shall with all convenient speed, and in all cases within four weeks at the most (unless the road authority otherwise consents in writing), complete the work on account of which it opened or broke up the road, street, bridge, lane or public place (subject to the construction, maintenance or removal of electric lines), and fill in the ground and make good the surface and, to the reasonable satisfaction of the road authority, restore the portion of the road, street, bridge, lane or public place, to as good condition as that in which it was before it was opened or broken up, and clear away all surplus paving, or other material or rubbish, occasioned thereby;  (b) it shall in the meantime cause the place where the road, street, bridge, lane or public place is opened or broken up to be protected at night.  (3) If the public supplier aforesaid fails to comply in any respect with this section, it shall for each offence (without prejudice to the enforcement of specific performance of the requirements of this Act or to any other remedy against it) be liable to a fine often thousand dollars, and to a further fine of five thousand dollars for each day during which the failure to comply continues after the first day on which notice to comply therewith has been served on the public supplier.",
            "description": [
                {
                    "representation": "(1)",
                    "description": "A public supplier from time to time for the purpose of electric lines duly authorised, or any part or parts thereof, or for the purpose of erecting, removing, repairing or maintaining pillars or poles for stringing wires to convey electricity, may open and break up the soil and pavement of any road, street, bridge, lane or public place along the routes of those electric lines and may erect pillars,"
                },
                {
                    "representation": "(a)",
                    "description": "it shall with all convenient speed, and in all cases within four weeks at the most"
                },
                {
                    "representation": "(b)",
                    "description": "it shall in the meantime cause the place where the road, street, bridge, lane or public place is opened or broken up to be protected at night."
                },
                {
                    "representation": "(c)",
                    "description": "the public supplier shall not erect any pillar or pole in a position to which the road authority reasonably objects;"
                },
                {
                    "representation": "(d)",
                    "description": "the public supplier shall pay all reasonable expenses to which the road authority is put on account of superintendence;"
                },
                {
                    "representation": "(e)",
                    "description": "the public supplier shall not, without the consent of the road authority, open or break up any road, street, bridge, lane or public place without providing reasonable facilities for the passage of the ordinary traffic on that road, street or bridge, to the satisfaction of the road authority.  L.R.O. 1/2012 LAWS OF GUYANA 44 Cap. 56:01 Electricity Sector Reform   L.R.O. 1/2011"
                },
                {
                    "representation": "(2)",
                    "description": "When the public supplier has opened or broken up any portion of the road, street, bridge, lane or public place, it shall be under the following further obligations"
                },
                {
                    "representation": "(3)",
                    "description": "If the public supplier aforesaid fails to comply in any respect with this section, it shall for each offence"
                }
            ]
        }
    },
    {
        "act": "ELECTRICITY SECTOR REFORM ACT",
        "source": "https://mola.gov.gy/laws-of-guyana",
        "type": {
            "name": "section",
            "representation": "34",
            "title": "Consent of local Government authority. ",
            "context": "ELECTRICITY SECTOR REFORM ACT under Consent of local Government authority. 34. Notwithstanding anything in this Act or in any written Government local Consent of LAWS OF GUYANA Electricity Sector Reform Cap. 56:01 45  authority.                     Conditions alter position of pipes and wires.           Mode of effecting alteration of position of \"obstruction.\"        law, a public supplier shall not be authorised to place any electric line along, over, under or across any road, street, bridge, lane or other public place without the express consent of the local Government authority, which consent shall not be unreasonably withheld, and the local Government authority may require the public supplier to remove forthwith any electric line placed by it contrary to this section; and where any electric line has been placed by the public supplier in any position, the Commission, upon complaint made, if it is of the reasonable opinion that that line is or is likely to become dangerous to the public safety, may, notwithstanding any such consent as aforesaid, make an order directing and authorising the removal of the line by the public supplier and upon any terms it thinks fit;  Provided that no local Government authority may remove, or require the removal of, any electric line that was put into place by a public supplier more than six months after such electric line was installed, or that was in place on the appointed day.",
            "description": "Notwithstanding anything in this Act or in any written Government local Consent of LAWS OF GUYANA Electricity Sector Reform Cap. 56:01 45  authority.                     Conditions alter position of pipes and wires.           Mode of effecting alteration of position of \"obstruction.\"        law, a public supplier shall not be authorised to place any electric line along, over, under or across any road, street, bridge, lane or other public place without the express consent of the local Government authority, which consent shall not be unreasonably withheld, and the local Government authority may require the public supplier to remove forthwith any electric line placed by it contrary to this section; and where any electric line has been placed by the public supplier in any position, the Commission, upon complaint made, if it is of the reasonable opinion that that line is or is likely to become dangerous to the public safety, may, notwithstanding any such consent as aforesaid, make an order directing and authorising the removal of the line by the public supplier and upon any terms it thinks fit;  Provided that no local Government authority may remove, or require the removal of, any electric line that was put into place by a public supplier more than six months after such electric line was installed, or that was in place on the appointed day."
        }
    },
    {
        "act": "ELECTRICITY SECTOR REFORM ACT",
        "source": "https://mola.gov.gy/laws-of-guyana",
        "type": {
            "name": "section",
            "representation": "35",
            "title": "Conditions under which a public supplier may alter position of pipes and wires. ",
            "context": "ELECTRICITY SECTOR REFORM ACT under Conditions under which a public supplier may alter position of pipes and wires. 35. Subject to the provisions of this Act, a licence or any written law a public authorising a public supplier to supply electricity, and to any regulations made under this Act, a public supplier may alter the position of any pipes or wires, being under or upon any street or place authorised to be broken up by them, which may interfere with the exercise of its powers under this Act, on previously making or securing such compensation to the owners of the pipes, or wires, and on complying with such conditions as to the mode of making the alterations as are, before the commencement of the alterations, agreed between the public supplier and the owners.",
            "description": "Subject to the provisions of this Act, a licence or any written law a public authorising a public supplier to supply electricity, and to any regulations made under this Act, a public supplier may alter the position of any pipes or wires, being under or upon any street or place authorised to be broken up by them, which may interfere with the exercise of its powers under this Act, on previously making or securing such compensation to the owners of the pipes, or wires, and on complying with such conditions as to the mode of making the alterations as are, before the commencement of the alterations, agreed between the public supplier and the owners."
        }
    },
    {
        "act": "ELECTRICITY SECTOR REFORM ACT",
        "source": "https://mola.gov.gy/laws-of-guyana",
        "type": {
            "name": "section",
            "representation": "36",
            "title": "Mode of effecting alteration of position of \"obstruction\" ",
            "context": "ELECTRICITY SECTOR REFORM ACT under Mode of effecting alteration of position of \"obstruction\" 36.(1) If a public supplier, in operating its works, considers that the position of any water or sewage main, drain, water-course, culvert, subway, defence, tube, wire, apparatus for telegraphic or other purposes (in this section referred to as \"obstruction\"), or of any other existing matter or thing, is likely to cause frequent interruption of such public supplier's undertaking by repairs or renewals and ought to be altered, the public supplier, in operating its works, shall not alter the position of any obstruction, but shall give notice to the L.R.O. 1/2012 under which a publicsupplier mayLAWS OF GUYANA 46 Cap. 56:01 Electricity Sector Reform                         Cutting trees, boughs vegetation.                  Sustainability    person, body or local Government authority to whom any obstruction belongs, or under whose control any obstruction is, that the public supplier is of the opinion that the position of any obstruction should be altered, and if the person, body or local Government authority is unable to agree with the public supplier as to the necessity for, or the manner of, any alteration of the position of the obstruction, the matter shall be determined by arbitration.   (2) If the person, body or local Government authority agrees upon, or the award in an arbitration directs, the alteration of the position of any obstruction, the work of the alteration shall be immediately carried out by the person, body or local Government authority concerned.  (3) A work of alteration shall be carried out in accordance with any plan agreed upon or directed by the award in the arbitration.",
            "description": [
                {
                    "representation": "(1)",
                    "description": "If a public supplier, in operating its works, considers that the position of any water or sewage main, drain, water-course, culvert, subway, defence, tube, wire, apparatus for telegraphic or other purposes"
                },
                {
                    "representation": "(2)",
                    "description": "If the person, body or local Government authority agrees upon, or the award in an arbitration directs, the alteration of the position of any obstruction, the work of the alteration shall be immediately carried out by the person, body or local Government authority concerned."
                },
                {
                    "representation": "(3)",
                    "description": "A work of alteration shall be carried out in accordance with any plan agreed upon or directed by the award in the arbitration."
                }
            ]
        }
    },
    {
        "act": "ELECTRICITY SECTOR REFORM ACT",
        "source": "https://mola.gov.gy/laws-of-guyana",
        "type": {
            "name": "section",
            "representation": "37",
            "title": "Cutting trees, boughs and other vegetation. ",
            "context": "ELECTRICITY SECTOR REFORM ACT under Cutting trees, boughs and other vegetation. 37.(1) In the course of constructing and for the more effective working of and other its undertaking, a public supplier shall have power, by officers and servants duly authorised for that purpose in writing, to cut and remove from any street and to enter upon and to cut and remove from any private or public land any tree or other vegetation, or any branch, bough or other part thereof, growing on such land within one hundred feet of any supply line and which may tend to interfere with, endanger or otherwise prejudicially affect the working of its undertaking.  (2) A public supplier shall make compensation to the owner of any tree or other vegetation so cut for any damage suffered by the owner in respect thereof, and the amount of such compensation shall, in the event of disagreement, be determined by arbitration.",
            "description": [
                {
                    "representation": "(1)",
                    "description": "In the course of constructing and for the more effective working of and other its undertaking, a public supplier shall have power, by officers and servants duly authorised for that purpose in writing, to cut and remove from any street and to enter upon and to cut and remove from any private or public land any tree or other vegetation, or any branch, bough or other part thereof, growing on such land within one hundred feet of any supply line and which may tend to interfere with, endanger or otherwise prejudicially affect the working of its undertaking."
                },
                {
                    "representation": "(2)",
                    "description": "A public supplier shall make compensation to the owner of any tree or other vegetation so cut for any damage suffered by the owner in respect thereof, and the amount of such compensation shall, in the event of disagreement, be determined by arbitration."
                }
            ]
        }
    },
    {
        "act": "ELECTRICITY SECTOR REFORM ACT",
        "source": "https://mola.gov.gy/laws-of-guyana",
        "type": {
            "name": "section",
            "representation": "38",
            "title": "Sustainability programmes. ",
            "context": "ELECTRICITY SECTOR REFORM ACT under Sustainability programmes. 38.(1) Every public supplier shall, in accordance with the provisions of its licence, develop and maintain  L.R.O. 1/2012 programmes. [17 of 2010]LAWS OF GUYANA Electricity Sector Reform Cap. 56:01 47                                                   (b) a five-year sustainability programme that is revised on an annual basis, containing the L.R.O. 1/2012 information required by subsection (2); and (e) the sources and amounts of revenues  of the programmes; (d)     the operating costs and capital expenditures  to be provided to consumers; develop and expand its facilities and services through which the public supplier will setting forth the plans and projections (c)   a development and expansion programme the rationale therefor; the implementation of the programmes, and maintained, by the public utility as a result of technical standards to be achieved and service rendered, and the engineering and (b)      the benefits to be accrued to consumers of the  licence; supply of electricity under the terms of its efficient, co-ordinated and economical standards necessary for the public supplier's customer service, engineering and technical public supplier will achieve and sustain the (a)     the plans and projections through which the and data on - maintained by a public supplier shall contain detailed descriptions of (2) The sustainability programmes developed and  sustainability programmes. public suppliers one-and five-year be included in, and be consistent with, the shall be revised on an annual basis and shall plans to address it, which forecast and plans summary of the public suppliers long-term (c)    a fifteen-year rolling demand forecast, and a (a) an annual sustainability programme; and LAWS OF GUYANA 48 Cap. 56:01 Electricity Sector Reform                                                L.R.O. 1/2012            the Minister may direct; the commercial feasibility thereof;  (j)       any other aspect of the programmes which    generation using renewable resources and the use of alternative forms of electricity (i) the extent to which the programmes facilitate  environment; to have upon the natural and social (h) the impact that the programmes are expected issued; will, or are anticipated to, be offered or programmes and the persons to whom they public utility for the financing of the            issuance of securities contemplated by the (g)      the timing, amounts and terms of any   implementing the programmes;  maintained by the public supplier in (f) the debt to equity ratio tolerances to be  supplier; anticipated to be, received by the public programmes and any bids actually, or commitments necessary to carry out the and sources of any debt or equity financing  necessary to finance the programmes, including the proposed or actual costs, terms  project; and (o)      a cost-benefit analysis for each investment  and redevelopment projects in urban areas; (n)      plans for providing electricity for development  (m)     plans to regain industrial customers;  (l)       loss reduction strategies;  capacity; (k)      planned acquisition of new generation  LAWS OF GUYANA Electricity Sector Reform Cap. 56:01 49 L.R.O. 1/2012 c. 25:01 development and expansion programme information required to be contained in a programmes of a public supplier, the                        approve the development and expansion (4)       (a)      Where the Commission is required to   Minister and to the Agency. provide copies of such programmes to the the Commission, a public supplier shall            development and expansion programmes to (b)      Concurrently with submission of its  Act. Part VI1 of the Public Utilities Commission                      (3)     (a)      Except as otherwise provided in the terms of its licence, every public supplier shall, no later than sixty days prior to the end of each of its financial years, submit seven copies of its annual development and expansion programme and a current version of its five-year development and expansion programme, as approved by the governing body of the public supplier, to the Commission for approval in accordance with  the Commission, after receiving the views of under subsection (2) shall be considered by required under the regulations. compliance with any technical standards (iii)      a report on the public suppliers consumers; and consumption of electricity by supply of electricity and in the technical efficiency and economy in its (ii)      a programme for the promotion of upgrade of the public suppliers works; inspection, repair, replacement and (i)       a maintenance programme for the following items  (p)     consistent with any applicable regulations, the  LAWS OF GUYANA 50 Cap. 56:01 Electricity Sector Reform  L.R.O. 1/2011  supplier shall comply with the provisions of its licence with respect Provided that, prior to making such an amendment, the public  American or European electric utilities: commercially reasonable practices of North its financial integrity, in accordance with service standards, and the need to preserve supplier's growth plans, its operating and (c) maintain the balance between the public commercially prudent manner; and licence granted to the public supplier, in a supply electricity under the terms of the (b) implement the programme or otherwise to exercise of due care; supplier and cannot be avoided by the which are outside the control of the public (a) address operational emergencies or causes                                      required to  amend the programme to the extent that such amendment is development and expansion programme, a public supplier may (5) During the course of its implementation of a  expansion programmes of a public utility. modifications in the development and whether to approve, reject or require assessment of costs in making its decision engineering standards and a reasonable                   c. 25:01           the Minister and the Agency, if any, in the Commission's determination of whether to approve, reject or require modifications in the programmes submitted by a public utility, as provided in section 28 (2) of the Public  Utilities Commission Act.   (b)     In addition to the specific criteria mentioned in subsection (2) and section 28 (2) of the Commission shall take into account prudent Public    Utilities    Commission   Act ,  the LAWS OF GUYANA Electricity Sector Reform Cap. 56:01 51       L.R.O. 1/2012 (i)   projecting, in terms of indicators c. 89:01  Companies Act and Schedules thereto.  sections    153     to    186,     inclusive,    of  the requirements. Accounting   and other technical performance, customer service and engineering as to financial, investment,  paragraph (a), a report  in a report or statement prepared under (b) to the extent not otherwise expressly set forth documents required to be submitted under report, and other reports, information and (a)   the audited financial statements, auditor's  Minister  where circumstances so justify, a public supplier shall deliver to the within such longer period as may be determined by the Minister,",
            "description": [
                {
                    "representation": "(1)",
                    "description": "Every public supplier shall, in accordance with the provisions of its licence, develop and maintain  L.R.O. 1/2012 programmes. [17 of 2010]LAWS OF GUYANA Electricity Sector Reform Cap. 56:01 47"
                },
                {
                    "representation": "(b)",
                    "description": "to the extent not otherwise expressly set forth documents required to be submitted under report, and other reports, information and"
                },
                {
                    "representation": "(e)",
                    "description": "the sources and amounts of revenues  of the programmes;"
                },
                {
                    "representation": "(d)",
                    "description": "the operating costs and capital expenditures  to be provided to consumers; develop and expand its facilities and services through which the public supplier will setting forth the plans and projections"
                },
                {
                    "representation": "(c)",
                    "description": "maintain the balance between the public commercially prudent manner; and licence granted to the public supplier, in a supply electricity under the terms of the"
                },
                {
                    "representation": "(a)",
                    "description": "the audited financial statements, auditor's  Minister  where circumstances so justify, a public supplier shall deliver to the within such longer period as may be determined by the Minister,"
                },
                {
                    "representation": "(2)",
                    "description": "of the Commission shall take into account prudent Public    Utilities    Commission   Act ,  the LAWS OF GUYANA Electricity Sector Reform Cap. 56:01 51       L.R.O. 1/2012"
                },
                {
                    "representation": "(j)",
                    "description": "any other aspect of the programmes which    generation using renewable resources and the use of alternative forms of electricity"
                },
                {
                    "representation": "(i)",
                    "description": "projecting, in terms of indicators c. 89:01  Companies Act and Schedules thereto.  sections    153     to    186,     inclusive,    of  the requirements. Accounting   and other technical performance, customer service and engineering as to financial, investment,  paragraph"
                },
                {
                    "representation": "(h)",
                    "description": "the impact that the programmes are expected issued; will, or are anticipated to, be offered or programmes and the persons to whom they public utility for the financing of the            issuance of securities contemplated by the"
                },
                {
                    "representation": "(g)",
                    "description": "the timing, amounts and terms of any   implementing the programmes;  maintained by the public supplier in"
                },
                {
                    "representation": "(f)",
                    "description": "the debt to equity ratio tolerances to be  supplier; anticipated to be, received by the public programmes and any bids actually, or commitments necessary to carry out the and sources of any debt or equity financing  necessary to finance the programmes, including the proposed or actual costs, terms  project; and"
                },
                {
                    "representation": "(o)",
                    "description": "a cost-benefit analysis for each investment  and redevelopment projects in urban areas;"
                },
                {
                    "representation": "(n)",
                    "description": "plans for providing electricity for development"
                },
                {
                    "representation": "(m)",
                    "description": "plans to regain industrial customers;"
                },
                {
                    "representation": "(l)",
                    "description": "loss reduction strategies;  capacity;"
                },
                {
                    "representation": "(k)",
                    "description": "planned acquisition of new generation  LAWS OF GUYANA Electricity Sector Reform Cap. 56:01 49 L.R.O. 1/2012 c. 25:01 development and expansion programme information required to be contained in a programmes of a public supplier, the                        approve the development and expansion"
                },
                {
                    "representation": "(4)",
                    "description": ""
                },
                {
                    "representation": "(3)",
                    "description": ""
                },
                {
                    "representation": "(p)",
                    "description": "consistent with any applicable regulations, the  LAWS OF GUYANA 50 Cap. 56:01 Electricity Sector Reform  L.R.O. 1/2011  supplier shall comply with the provisions of its licence with respect Provided that, prior to making such an amendment, the public  American or European electric utilities: commercially reasonable practices of North its financial integrity, in accordance with service standards, and the need to preserve supplier's growth plans, its operating and"
                },
                {
                    "representation": "(5)",
                    "description": "During the course of its implementation of a  expansion programmes of a public utility. modifications in the development and whether to approve, reject or require assessment of costs in making its decision engineering standards and a reasonable                   c. 25:01           the Minister and the Agency, if any, in the Commission's determination of whether to approve, reject or require modifications in the programmes submitted by a public utility, as provided in section 28"
                }
            ]
        }
    },
    {
        "act": "ELECTRICITY SECTOR REFORM ACT",
        "source": "https://mola.gov.gy/laws-of-guyana",
        "type": {
            "name": "section",
            "representation": "39",
            "title": "Keeping and rendering books, accounts, papers and other records. ",
            "context": "ELECTRICITY SECTOR REFORM ACT under Keeping and rendering books, accounts, papers and other records. 39. Except as otherwise provided in its licence, a public   Commission for approval. to the approval of such amendment, and shall notify the Commission of the amendment and the reason therefor and receive if necessaiy under the terms of its licence, shall obtain the Commission's approval, which approval shall not be unreasonably withheld and, in the case of an amendment under paragraph (a), shall be granted or denied within twenty-four hours of notification:  Provided further that, if necessary under the terms of its licence, the public supplier shall include an explanation of, and relevant information and data on, such amendment in the development and expansion programme that the public supplier next submits to the  LAWS OF GUYANA 52 Cap. 56:01 Electricity Sector Reform                                                L.R.O. 1/2012 information that may aid a competitor of the third party confidential information, or information that constitutes a trade secret, publicly available under subsection (2) any of the submissions that it is required to make (b)      A public supplier may omit from the copies  supplier in that regard. Agency shall cooperate with the public the public supplier, and the Minister and the or information that may aid a competitor of secret, third party confidential information, such submissions that constitutes a trade confidence any information contained in Agency shall have a duty to maintain in made thereunder, the Minister and the Minister under this Act and any regulations information and documents submitted to the (3) (a)   With regard to the reports, statements,  (1) (a). statements, information and documents prepared under subsection exceeding the actual cost of printing, copies of the reports, make available, and shall sell to any applicant for a price not (2) Subject to subsection (3) (b), a public supplier shall  by regulation prescribe. (c) any other information that the Minister may  the performance of the public supplier and its subsidiaries, if any, for the current financial year;   (ii)  in terms of such indicators, comparing the performance projected in such report for the financial year just ended, with the actual performance of the public utility and its subsidiaries, if any, for the financial year just ended; and LAWS OF GUYANA Electricity Sector Reform Cap. 56:01 53  L.R.O. 1/2012 [17 of 2010]c. 89:01 provisions. by private to be provided    Companies Act ,  and  by the  issuance of a  certificate of  (3) With effect from the appointed day   the Registrar of Companies. shall file the documents required under section 3 (2) of that Act with shares on the appointed day, and the Guyana Electricity Corporation Guyana Electricity Corporation into a public company limited by Conversion into Public Companies) Act for the conversion of the order under section 3 (1) of the Corporations (Provision for (2) Prior to the appointed day, the Minister shall make an  incorporation.  incorporation and the other documents that are required under the the submission to the Registrar of Companies of the articles of public company limited by shares on or before the appointed day by",
            "description": [
                {
                    "representation": "(2)",
                    "description": "Prior to the appointed day, the Minister shall make an  incorporation.  incorporation and the other documents that are required under the the submission to the Registrar of Companies of the articles of public company limited by shares on or before the appointed day by"
                },
                {
                    "representation": "(b)",
                    "description": "A public supplier may omit from the copies  supplier in that regard. Agency shall cooperate with the public the public supplier, and the Minister and the or information that may aid a competitor of secret, third party confidential information, such submissions that constitutes a trade confidence any information contained in Agency shall have a duty to maintain in made thereunder, the Minister and the Minister under this Act and any regulations information and documents submitted to the"
                },
                {
                    "representation": "(3)",
                    "description": "With effect from the appointed day   the Registrar of Companies. shall file the documents required under section 3"
                },
                {
                    "representation": "(1)",
                    "description": "of the Corporations"
                },
                {
                    "representation": "(c)",
                    "description": "any other information that the Minister may  the performance of the public supplier and its subsidiaries, if any, for the current financial year;"
                }
            ]
        }
    },
    {
        "act": "ELECTRICITY SECTOR REFORM ACT",
        "source": "https://mola.gov.gy/laws-of-guyana",
        "type": {
            "name": "section",
            "representation": "40",
            "title": "Accounting and information reporting requirements. ",
            "context": "ELECTRICITY SECTOR REFORM ACT under Accounting and information reporting requirements. 40.(1) Within four months after the end of its financial year or                                       reporting information and supplier   shall keep  and  render   its   books, accounts,   papers   and Keeping and rendering books,accounts, papers and other records. c. 25:01   Utilities Commission Act, and with any other applicable law. other records in accordance with sections 48, 49 and 83 of the Public",
            "description": [
                {
                    "representation": "(1)",
                    "description": "Within four months after the end of its financial year or                                       reporting information and supplier   shall keep  and  render   its   books, accounts,   papers   and Keeping and rendering books,accounts, papers and other records. c. 25:01   Utilities Commission Act, and with any other applicable law. other records in accordance with sections 48, 49 and 83 of the Public"
                }
            ]
        }
    },
    {
        "act": "ELECTRICITY SECTOR REFORM ACT",
        "source": "https://mola.gov.gy/laws-of-guyana",
        "type": {
            "name": "section",
            "representation": "41",
            "title": "Information and reports to be provided by private suppliers.  PART III  REFORM OF THE ELECTRICITY SECTOR  ",
            "context": "ELECTRICITY SECTOR REFORM ACT under Information and reports to be provided by private suppliers.  PART III  REFORM OF THE ELECTRICITY SECTOR  41. A private supplier shall provide the Minister with such  Guyana in matters involving electricity. carrying out of the national energy policy of (c) otherwise to assist in the formulation and           c. 85:08     and related Light, Inc. Power & Guyana Creation of     suppliers. and reports Information     public supplier.  (4) It shall be the duty of the Minister to require public suppliers to provide, and a public supplier shall have a duty to provide, such additional information as the Minister finds necessary   (a)     to provide consumers and other members of the public with adequate information on the public supplier as such information affects their interests; (b) to perform his duties and discharge his functions under this Act; and  LAWS OF GUYANA 54 Cap. 56:01 Electricity Sector Reform                                                  L.R.O. 1/2012 (d)   all of the persons who were directors of the c. 56:01  State; or other entity on behalf of the vested in the State or any agency which the controlling interest is entities owned by the State or in Lochaber Limited and other Sugar Corporation Limited, the Government, the Guyana Electricity Corporation held by undertaking of the Guyana (A) assets relating to the (ii)   the following   said order; and specified by the Minister in the Electricity Corporation as may be to the undertaking of the Guyana (i)    such assets and liabilities related  vesting order with respect to the transfer and vesting of  (4) (a) The Minister is hereby empowered to make a  directors of that company. before the appointed day shall cease to be Guyana Electricity Corporation immediately  Light, Inc.; and  application therefor from Guyana Power & Inc., under section 4 without the need for any issue a licence to Guyana Power & Light, stand terminated, and the Minister shall Corporation under the Electricity Act shall (c)      the   exclusive   right   to   supply    electricity             granted to the Guyana Electricity  Act shall stand repealed; (b)     the Electricity Act and the Electric Lighting  shares; deemed to be a public company limited by (a)    the Guyana Electricity Corporation shall be     c. 56:02 c. 56:",
            "description": [
                {
                    "representation": "(c)",
                    "description": "the   exclusive   right   to   supply    electricity             granted to the Guyana Electricity  Act shall stand repealed;"
                },
                {
                    "representation": "(4)",
                    "description": "(a) The Minister is hereby empowered to make a  directors of that company. before the appointed day shall cease to be Guyana Electricity Corporation immediately  Light, Inc.; and  application therefor from Guyana Power & Inc., under section 4 without the need for any issue a licence to Guyana Power & Light, stand terminated, and the Minister shall Corporation under the Electricity Act shall"
                },
                {
                    "representation": "(a)",
                    "description": "the Guyana Electricity Corporation shall be     c. 56:02 c. 56:"
                },
                {
                    "representation": "(b)",
                    "description": "the Electricity Act and the Electric Lighting  shares; deemed to be a public company limited by"
                },
                {
                    "representation": "(d)",
                    "description": "all of the persons who were directors of the c. 56:01  State; or other entity on behalf of the vested in the State or any agency which the controlling interest is entities owned by the State or in Lochaber Limited and other Sugar Corporation Limited, the Government, the Guyana Electricity Corporation held by undertaking of the Guyana"
                },
                {
                    "representation": "(A)",
                    "description": "assets relating to the"
                },
                {
                    "representation": "(i)",
                    "description": "such assets and liabilities related  vesting order with respect to the transfer and vesting of"
                }
            ]
        }
    },
    {
        "act": "ELECTRICITY SECTOR REFORM ACT",
        "source": "https://mola.gov.gy/laws-of-guyana",
        "type": {
            "name": "section",
            "representation": "42",
            "title": "Creation of Guyana Power & Light, Inc. and related provisions. ",
            "context": "ELECTRICITY SECTOR REFORM ACT under Creation of Guyana Power & Light, Inc. and related provisions. 42. (1) Guyana Power & Light, Inc. shall be constituted as a  REFORM OF THE ELECTRICITY SECTOR  PART III  Minister may determine or may prescribe. information and to be provided by reports, in such form, as the",
            "description": [
                {
                    "representation": "(1)",
                    "description": "Guyana Power & Light, Inc. shall be constituted as a  REFORM OF THE ELECTRICITY SECTOR  PART III  Minister may determine or may prescribe. information and to be provided by reports, in such form, as the"
                }
            ]
        }
    },
    {
        "act": "ELECTRICITY SECTOR REFORM ACT",
        "source": "https://mola.gov.gy/laws-of-guyana",
        "type": {
            "name": "section",
            "representation": "43",
            "title": "Transitional orders; no requirement for a licence for Guyana Electricity Corporation, Inc. ",
            "context": "ELECTRICITY SECTOR REFORM ACT under Transitional orders; no requirement for a licence for Guyana Electricity Corporation, Inc. 43. (1) The Minister may, at the request of the Board of Directors of Guyana Power & Light, Inc., by order make such other provisions as are necessary or expedient to facilitate the transfer of the agreed upon assets, liabilities and undertaking of the Guyana Electricity Corporation or the Guyana Electricity Corporation, Inc., and to effect the transaction provided for in section",
            "description": [
                {
                    "representation": "(1)",
                    "description": "The Minister may, at the request of the Board of Directors of Guyana Power & Light, Inc., by order make such other provisions as are necessary or expedient to facilitate the transfer of the agreed upon assets, liabilities and undertaking of the Guyana Electricity Corporation or the Guyana Electricity Corporation, Inc., and to effect the transaction provided for in section"
                }
            ]
        }
    },
    {
        "act": "ELECTRICITY SECTOR REFORM ACT",
        "source": "https://mola.gov.gy/laws-of-guyana",
        "type": {
            "name": "section",
            "representation": "44",
            "title": "Applicability of the Act and commercial principles to operations of Guyana Power & Light, Inc. ",
            "context": "ELECTRICITY SECTOR REFORM ACT under Applicability of the Act and commercial principles to operations of Guyana Power & Light, Inc. 44. With effect from the appointed day, Guyana Power & Light, Inc. shall be   (a)      subject to the provisions of this Act; and  (b)  operated in accordance with commercial principles, including but not limited to commercial procurement principles.",
            "description": [
                {
                    "representation": "(a)",
                    "description": "subject to the provisions of this Act; and"
                },
                {
                    "representation": "(b)",
                    "description": "operated in accordance with commercial principles, including but not limited to commercial procurement principles."
                }
            ]
        }
    },
    {
        "act": "ELECTRICITY SECTOR REFORM ACT",
        "source": "https://mola.gov.gy/laws-of-guyana",
        "type": {
            "name": "section",
            "representation": "45",
            "title": "Employees. ",
            "context": "ELECTRICITY SECTOR REFORM ACT under Employees. 45. With effect from the appointed day   (a) for the purposes of every law, determination or agreement relating to the employment of each of the employees of the Guyana Electricity Corporation transferred to Guyana Power & Light, Inc. in accordance with the vesting order made section 42 (4), such employment shall be deemed to have been unbroken and the period of service of each such employee with the Guyana Electricity Corporation, and every other period of service of that employee that is recognised as continuous service with the Guyana Electricity Corporation, shall be deemed to have been a period of service with Guyana Power & Light, Inc.;  (b) the terms and conditions of employment of each employee referred to in paragraph (a) shall, until varied, be identical with the terms and conditions of that employee's employment with the Guyana Electricity L.R.O. 1/2012 LAWS OF GUYANA Electricity Sector Reform Cap. 56:01 65                                              Corporation immediately before the appointed day and be capable of variation in the same manner;  (c) no such employee shall be entitled to receive any payment or other benefit by reason of this Act; and  (d) any property held in trust or vested in any person under any provident, benefit, superannuation, or retirement or pension fund or scheme for the employees of the Guyana Electricity Corporation or their dependants or other persons immediately before the appointed day shall, on and after the appointed day, be deemed to be held in trust or vested in that person for those employees in their capacity as employees of Guyana Power & Light, Inc. or their dependants or other persons on the same terms and conditions; and every reference in any instrument constituting that fund or scheme to the Guyana Electricity Corporation or an employee of the Guyana Electricity Corporation or a dependant of that employee or any other person shall be read and construed as a reference to Guyana Power & Light, Inc. or an employee of Guyana Power & Light, Inc., or a dependant of that employee or any other person, as the case may be; and any pension scheme that was, immediately before the appointed day, a registered pension scheme within the meaning of the law shall continue to be a registered pension scheme on and after the appointed day.",
            "description": [
                {
                    "representation": "(a)",
                    "description": "shall, until varied, be identical with the terms and conditions of that employee's employment with the Guyana Electricity L.R.O. 1/2012 LAWS OF GUYANA Electricity Sector Reform Cap. 56:01 65                                              Corporation immediately before the appointed day and be capable of variation in the same manner;"
                },
                {
                    "representation": "(b)",
                    "description": "the terms and conditions of employment of each employee referred to in paragraph"
                },
                {
                    "representation": "(c)",
                    "description": "no such employee shall be entitled to receive any payment or other benefit by reason of this Act; and"
                },
                {
                    "representation": "(d)",
                    "description": "any property held in trust or vested in any person under any provident, benefit, superannuation, or retirement or pension fund or scheme for the employees of the Guyana Electricity Corporation or their dependants or other persons immediately before the appointed day shall, on and after the appointed day, be deemed to be held in trust or vested in that person for those employees in their capacity as employees of Guyana Power & Light, Inc. or their dependants or other persons on the same terms and conditions; and every reference in any instrument constituting that fund or scheme to the Guyana Electricity Corporation or an employee of the Guyana Electricity Corporation or a dependant of that employee or any other person shall be read and construed as a reference to Guyana Power & Light, Inc. or an employee of Guyana Power & Light, Inc., or a dependant of that employee or any other person, as the case may be; and any pension scheme that was, immediately before the appointed day, a registered pension scheme within the meaning of the law shall continue to be a registered pension scheme on and after the appointed day."
                }
            ]
        }
    },
    {
        "act": "ELECTRICITY SECTOR REFORM ACT",
        "source": "https://mola.gov.gy/laws-of-guyana",
        "type": {
            "name": "section",
            "representation": "46",
            "title": "Projects for the generation of electricity. ",
            "context": "ELECTRICITY SECTOR REFORM ACT under Projects for the generation of electricity. 46. Subject to sections 4 (c) and 49, except as otherwise electricity. generation of the Projects for L.R.O. 1/2012 LAWS OF GUYANA 66 Cap. 56:01 Electricity Sector Reform                   Savings of effect of section 47(2) of the Electricity Sector Reform Act",
            "description": [
                {
                    "representation": "(c)",
                    "description": "and 49, except as otherwise electricity. generation of the Projects for L.R.O. 1/2012 LAWS OF GUYANA 66 Cap. 56:01 Electricity Sector Reform                   Savings of effect of section 47(2) of the Electricity Sector Reform Act"
                }
            ]
        }
    },
    {
        "act": "ELECTRICITY SECTOR REFORM ACT",
        "source": "https://mola.gov.gy/laws-of-guyana",
        "type": {
            "name": "section",
            "representation": "47",
            "title": "Savings of effect of section 47 (2) of the Electricity Sector Reform Act ",
            "context": "ELECTRICITY SECTOR REFORM ACT under Savings of effect of section 47 (2) of the Electricity Sector Reform Act 47. Notwithstanding section 71, where any person has been granted a licence under section 47 (2) of the Electricity Sector Reform Act 1997, such licence shall, with effect from the appointed day, remain in force and effect in accordance with its terms and shall be construed as a licence issued under and subject to this Act.",
            "description": [
                {
                    "representation": "(2)",
                    "description": "of the Electricity Sector Reform Act 1997, such licence shall, with effect from the appointed day, remain in force and effect in accordance with its terms and shall be construed as a licence issued under and subject to this Act."
                }
            ]
        }
    },
    {
        "act": "ELECTRICITY SECTOR REFORM ACT",
        "source": "https://mola.gov.gy/laws-of-guyana",
        "type": {
            "name": "section",
            "representation": "48",
            "title": "Construction or expansion of installations or capacity for electricity generation. SECTION  ",
            "context": "ELECTRICITY SECTOR REFORM ACT under Construction or expansion of installations or capacity for electricity generation. SECTION  48. Except as otherwise provided in a licence granted pursuant to this Act, consent of the Minister shall b required for the new construction of the expansion of any installation or capacity for the generation of electricity.",
            "description": "Except as otherwise provided in a licence granted pursuant to this Act, consent of the Minister shall b required for the new construction of the expansion of any installation or capacity for the generation of electricity."
        }
    },
    {
        "act": "ELECTRICITY SECTOR REFORM ACT",
        "source": "https://mola.gov.gy/laws-of-guyana",
        "type": {
            "name": "section",
            "representation": "49",
            "title": "Rural electrification programmes. ",
            "context": "ELECTRICITY SECTOR REFORM ACT under Rural electrification programmes. 49.(1) The Minister may, subject to the terms and conditions of a public supplier's licence, request a public supplier to implement rural electrification programmes from time to time for any premises or geographical area within the authorised area of such public supplier, and the public supplier shall accede to any such request, on terms and conditions agreeable to both the Minister and the public supplier:  L.R.O. 1/2012 LAWS OF GUYANA Electricity Sector Reform Cap. 56:01 67                corporate form and location of headquarters and books and records in Guyana.  c. 89:01           Liability and immunities of suppliers and others.          Provided that the public supplier may not unreasonably reject terms and conditions proposed by the Minister:   Provided further that if the Government and the public supplier cannot agree on terms and conditions within one hundred and eighty days of the commencement of negotiations on a rural electrification programme, the Government may conclude an agreement on the same terms and conditions proposed to such public supplier for such programme with another public supplier.  (2) The Minister may include in a licence such additional provisions governing rural electrification programmes as may be agreed to between the Minister and the public supplier.",
            "description": [
                {
                    "representation": "(1)",
                    "description": "The Minister may, subject to the terms and conditions of a public supplier's licence, request a public supplier to implement rural electrification programmes from time to time for any premises or geographical area within the authorised area of such public supplier, and the public supplier shall accede to any such request, on terms and conditions agreeable to both the Minister and the public supplier:  L.R.O. 1/2012 LAWS OF GUYANA Electricity Sector Reform Cap. 56:01 67                corporate form and location of headquarters and books and records in Guyana.  c. 89:01           Liability and immunities of suppliers and others.          Provided that the public supplier may not unreasonably reject terms and conditions proposed by the Minister:   Provided further that if the Government and the public supplier cannot agree on terms and conditions within one hundred and eighty days of the commencement of negotiations on a rural electrification programme, the Government may conclude an agreement on the same terms and conditions proposed to such public supplier for such programme with another public supplier."
                },
                {
                    "representation": "(2)",
                    "description": "The Minister may include in a licence such additional provisions governing rural electrification programmes as may be agreed to between the Minister and the public supplier."
                }
            ]
        }
    },
    {
        "act": "ELECTRICITY SECTOR REFORM ACT",
        "source": "https://mola.gov.gy/laws-of-guyana",
        "type": {
            "name": "section",
            "representation": "50",
            "title": "Requirements for corporate form and location of headquarters and books and records in Guyana.  PART IV  MISCELLANEOUS AND SUPPLEMENTAL PROVISIONS.  ",
            "context": "ELECTRICITY SECTOR REFORM ACT under Requirements for corporate form and location of headquarters and books and records in Guyana.  PART IV  MISCELLANEOUS AND SUPPLEMENTAL PROVISIONS.  50.(1) Every public supplier licensed to supply electricity pursuant to this Act shall be established and exist as a company under the Companies Act:  Provided that a public supplier that is wholly or majority-owned by the Government shall not be subject to this requirement.  (2) Every public supplier shall have its headquarters and shall maintain its books and records in Guyana.   PART IV  MISCELLANEOUS AND SUPPLEMENTAL PROVISIONS",
            "description": [
                {
                    "representation": "(1)",
                    "description": "Every public supplier licensed to supply electricity pursuant to this Act shall be established and exist as a company under the Companies Act:  Provided that a public supplier that is wholly or majority-owned by the Government shall not be subject to this requirement."
                },
                {
                    "representation": "(2)",
                    "description": "Every public supplier shall have its headquarters and shall maintain its books and records in Guyana.   PART IV  MISCELLANEOUS AND SUPPLEMENTAL PROVISIONS"
                }
            ]
        }
    },
    {
        "act": "ELECTRICITY SECTOR REFORM ACT",
        "source": "https://mola.gov.gy/laws-of-guyana",
        "type": {
            "name": "section",
            "representation": "51",
            "title": "Liabilities and immunities of suppliers and others. ",
            "context": "ELECTRICITY SECTOR REFORM ACT under Liabilities and immunities of suppliers and others. 51.(1) Except as otherwise provided in this Act or any regulations made thereunder, a supplier shall, in the exercise of its powers pursuant to this Act or a licence or exemption granted thereunder, cause as little detriment and inconvenience, and do as little damage, as may be possible, and shall make full compensation to any person for direct damage, loss or injury caused by the wilful or negligent act or default of the supplier in the exercise of those powers and, in the case of a public supplier, for any direct damage, loss or injury suffered by any consumer due to such public supplier's Requirementsfor L.R.O. 1/2012 LAWS OF GUYANA 68 Cap. 56:01 Electricity Sector Reform                                   Immunity of works and sewerage systems.     Penalty for electricity.    failure to comply with section 25 of the Public Utilities Commission Act.  (2) A supplier shall save harmless all persons by whom any street is repairable, and the officers and servants (if any) of such persons, from all damage and costs in respect of any direct damage, loss or injury referred to in subsection (1).  (3) Except as otherwise provided in this Act, any regulations made thereunder, or in any written contract to which the supplier is a party, a supplier shall not be liable in any suit, action, indictment, or other proceeding or to any penalty whatsoever in respect of any damage, loss or injury occurring by reason of the vibration or noise of any reciprocating engine, steam turbine or generating unit which is lawfully used by the supplier, unless that damage, loss or injury is due to the wilful or negligent acts or defaults of the supplier or its servant or agents.  (4) Subject to subsection (3), nothing in this Act shall exonerate a supplier from any indictment, action or other proceeding for nuisance in the event of any nuisance being caused by its negligent act or default.  (5) Any dispute or difference arising under this section shall be determined by arbitration in accordance with section",
            "description": [
                {
                    "representation": "(1)",
                    "description": "Except as otherwise provided in this Act or any regulations made thereunder, a supplier shall, in the exercise of its powers pursuant to this Act or a licence or exemption granted thereunder, cause as little detriment and inconvenience, and do as little damage, as may be possible, and shall make full compensation to any person for direct damage, loss or injury caused by the wilful or negligent act or default of the supplier in the exercise of those powers and, in the case of a public supplier, for any direct damage, loss or injury suffered by any consumer due to such public supplier's Requirementsfor L.R.O. 1/2012 LAWS OF GUYANA 68 Cap. 56:01 Electricity Sector Reform                                   Immunity of works and sewerage systems.     Penalty for electricity.    failure to comply with section 25 of the Public Utilities Commission Act."
                },
                {
                    "representation": "(2)",
                    "description": "A supplier shall save harmless all persons by whom any street is repairable, and the officers and servants"
                },
                {
                    "representation": "(3)",
                    "description": "Except as otherwise provided in this Act, any regulations made thereunder, or in any written contract to which the supplier is a party, a supplier shall not be liable in any suit, action, indictment, or other proceeding or to any penalty whatsoever in respect of any damage, loss or injury occurring by reason of the vibration or noise of any reciprocating engine, steam turbine or generating unit which is lawfully used by the supplier, unless that damage, loss or injury is due to the wilful or negligent acts or defaults of the supplier or its servant or agents."
                },
                {
                    "representation": "(4)",
                    "description": "Subject to subsection"
                },
                {
                    "representation": "(5)",
                    "description": "Any dispute or difference arising under this section shall be determined by arbitration in accordance with section"
                }
            ]
        }
    },
    {
        "act": "ELECTRICITY SECTOR REFORM ACT",
        "source": "https://mola.gov.gy/laws-of-guyana",
        "type": {
            "name": "section",
            "representation": "52",
            "title": "Immunity of persons operating water works and sewerage systems.  ",
            "context": "ELECTRICITY SECTOR REFORM ACT under Immunity of persons operating water works and sewerage systems.  52. No person with authority over the operation of a water works or a sewerage system shall be liable in any suit, action, or other proceeding whatsoever at the instance of anyone in respect of damage to property or other loss occasioned by failure or deficiency in the operation of such water works or sewerage system by reason of failure or deficiency in the supply of electricity by any supplier.",
            "description": "No person with authority over the operation of a water works or a sewerage system shall be liable in any suit, action, or other proceeding whatsoever at the instance of anyone in respect of damage to property or other loss occasioned by failure or deficiency in the operation of such water works or sewerage system by reason of failure or deficiency in the supply of electricity by any supplier."
        }
    },
    {
        "act": "ELECTRICITY SECTOR REFORM ACT",
        "source": "https://mola.gov.gy/laws-of-guyana",
        "type": {
            "name": "section",
            "representation": "53",
            "title": "Penalty for the unauthorised supply of electricity. ",
            "context": "ELECTRICITY SECTOR REFORM ACT under Penalty for the unauthorised supply of electricity. 53.(1) A person who generates, stores, transmits, transforms, distributes, furnishes, sells, resells or otherwise supplies electricity to any other person, premises or area shall be guilty of an offense c. 25:01 L.R.O. 1/2012 persons operatingwaterunauthorized supply ofLAWS OF GUYANA Electricity Sector Reform Cap. 56:01 69                   Penalty for unauthorized electric lines or other apparatus or installations.         Penalty for obstruction of public suppliers activities.      Penalty for unauthorized cessation of operations.  unless he is authorised to do so by a licence or any exemption granted pursuant to this Act.  (2) A person guilty of an offence under this section shall be liable upon summary conviction to a fine of one million dollars and to imprisonment for a term of six months; and if the offence of which he is convicted is continued after conviction, he shall be guilty of a further offence and liable to a fine of fifty thousand dollars for every day on which the offence is continued, and the Minister shall take such steps and employ such persons as may be necessary to forcibly or otherwise enter upon, seize, take possession and cease the operations of any works utilised by such person for the unauthorised generation, storage, transmission, transformation, distribution, furnishing, sale, resale or other supply of electricity.",
            "description": [
                {
                    "representation": "(1)",
                    "description": "A person who generates, stores, transmits, transforms, distributes, furnishes, sells, resells or otherwise supplies electricity to any other person, premises or area shall be guilty of an offense c. 25:01 L.R.O. 1/2012 persons operatingwaterunauthorized supply ofLAWS OF GUYANA Electricity Sector Reform Cap. 56:01 69                   Penalty for unauthorized electric lines or other apparatus or installations.         Penalty for obstruction of public suppliers activities.      Penalty for unauthorized cessation of operations.  unless he is authorised to do so by a licence or any exemption granted pursuant to this Act."
                },
                {
                    "representation": "(2)",
                    "description": "A person guilty of an offence under this section shall be liable upon summary conviction to a fine of one million dollars and to imprisonment for a term of six months; and if the offence of which he is convicted is continued after conviction, he shall be guilty of a further offence and liable to a fine of fifty thousand dollars for every day on which the offence is continued, and the Minister shall take such steps and employ such persons as may be necessary to forcibly or otherwise enter upon, seize, take possession and cease the operations of any works utilised by such person for the unauthorised generation, storage, transmission, transformation, distribution, furnishing, sale, resale or other supply of electricity."
                }
            ]
        }
    },
    {
        "act": "ELECTRICITY SECTOR REFORM ACT",
        "source": "https://mola.gov.gy/laws-of-guyana",
        "type": {
            "name": "section",
            "representation": "54",
            "title": "Penalty for unauthorised electric lines or other apparatus or installations. ",
            "context": "ELECTRICITY SECTOR REFORM ACT under Penalty for unauthorised electric lines or other apparatus or installations. 54. Except in pursuance of the powers granted to a public supplier by section 20(3), any person who lays down any electric line or premises in or on which it is authorised to supply electricity by a licence or an exemption granted pursuant to this Act shall be guilty of an offence and shall be liable upon summary conviction to a fine of five hundred thousand dollars; and if the offence of which he is convicted is continued after conviction, he shall be guilty of a further offence and liable to a fine of thirty thousand dollars for every day on which the offence is continued.",
            "description": "Except in pursuance of the powers granted to a public supplier by section 20(3), any person who lays down any electric line or premises in or on which it is authorised to supply electricity by a licence or an exemption granted pursuant to this Act shall be guilty of an offence and shall be liable upon summary conviction to a fine of five hundred thousand dollars; and if the offence of which he is convicted is continued after conviction, he shall be guilty of a further offence and liable to a fine of thirty thousand dollars for every day on which the offence is continued."
        }
    },
    {
        "act": "ELECTRICITY SECTOR REFORM ACT",
        "source": "https://mola.gov.gy/laws-of-guyana",
        "type": {
            "name": "section",
            "representation": "55",
            "title": "Penalty for obstruction of public suppliers' activities. ",
            "context": "ELECTRICITY SECTOR REFORM ACT under Penalty for obstruction of public suppliers' activities. 55. Except as otherwise provided in this Act or any regulations made thereunder, any person who without due cause obstructs or attempts to obstruct a public supplier in the performance of any of the powers or obligations conferred or imposed upon it by this Act or any regulations made thereunder or a licence shall be guilty of an offence and liable on summary conviction to a fine not exceeding fifty thousand dollars and to imprisonment for a period not exceeding six months.",
            "description": "Except as otherwise provided in this Act or any regulations made thereunder, any person who without due cause obstructs or attempts to obstruct a public supplier in the performance of any of the powers or obligations conferred or imposed upon it by this Act or any regulations made thereunder or a licence shall be guilty of an offence and liable on summary conviction to a fine not exceeding fifty thousand dollars and to imprisonment for a period not exceeding six months."
        }
    },
    {
        "act": "ELECTRICITY SECTOR REFORM ACT",
        "source": "https://mola.gov.gy/laws-of-guyana",
        "type": {
            "name": "section",
            "representation": "56",
            "title": "Penalty for unauthorised cessation of operations. ",
            "context": "ELECTRICITY SECTOR REFORM ACT under Penalty for unauthorised cessation of operations. 56. Any public supplier who ceases its operations or any part thereof in violation of section 11 shall be guilty of an offence and liable upon summary conviction to a fine of ten million dollars.  L.R.O. 1/2012 or apparatus or constructs any electrical installation outside the area LAWS OF GUYANA 70 Cap. 56:01 Electricity Sector Reform       Penalty for failing to maintain sustainability programmes and to maintain and submit development and expansion programmes.   Penalty for failure to maintain or provide documents, reports and other information.",
            "description": "Any public supplier who ceases its operations or any part thereof in violation of section 11 shall be guilty of an offence and liable upon summary conviction to a fine of ten million dollars.  L.R.O. 1/2012 or apparatus or constructs any electrical installation outside the area LAWS OF GUYANA 70 Cap. 56:01 Electricity Sector Reform       Penalty for failing to maintain sustainability programmes and to maintain and submit development and expansion programmes.   Penalty for failure to maintain or provide documents, reports and other information."
        }
    },
    {
        "act": "ELECTRICITY SECTOR REFORM ACT",
        "source": "https://mola.gov.gy/laws-of-guyana",
        "type": {
            "name": "section",
            "representation": "57",
            "title": "Penalty for unauthorised transactions. ",
            "context": "ELECTRICITY SECTOR REFORM ACT under Penalty for unauthorised transactions. 57. Any licensee who violates, or any director, treasurer or other officer or agent of a public supplier who makes or votes to authorise a transaction in violation of, section 12 shall be guilty of an offence and upon summary conviction shall be subject to a fine not exceeding one hundred thousand dollars.",
            "description": "Any licensee who violates, or any director, treasurer or other officer or agent of a public supplier who makes or votes to authorise a transaction in violation of, section 12 shall be guilty of an offence and upon summary conviction shall be subject to a fine not exceeding one hundred thousand dollars."
        }
    },
    {
        "act": "ELECTRICITY SECTOR REFORM ACT",
        "source": "https://mola.gov.gy/laws-of-guyana",
        "type": {
            "name": "section",
            "representation": "58",
            "title": "Penalty for failing to maintain sustainability programmes and to maintain and submit development and expansion programmes. ",
            "context": "ELECTRICITY SECTOR REFORM ACT under Penalty for failing to maintain sustainability programmes and to maintain and submit development and expansion programmes. 58. Any public supplier who fails to maintain the sustainability programmes and to maintain and submit the development and expansion programmes in the manner prescribed under section 38 and its licence shall be guilty of an offence and upon summary conviction shall be subject to a fine not exceeding five hundred thousand dollars.",
            "description": "Any public supplier who fails to maintain the sustainability programmes and to maintain and submit the development and expansion programmes in the manner prescribed under section 38 and its licence shall be guilty of an offence and upon summary conviction shall be subject to a fine not exceeding five hundred thousand dollars."
        }
    },
    {
        "act": "ELECTRICITY SECTOR REFORM ACT",
        "source": "https://mola.gov.gy/laws-of-guyana",
        "type": {
            "name": "section",
            "representation": "59",
            "title": "Penalty for failure to maintain or provide documents, reports and other information. ",
            "context": "ELECTRICITY SECTOR REFORM ACT under Penalty for failure to maintain or provide documents, reports and other information. 59.(1) A licensee who fails to maintain or provide the documents and other information required under sections 40 and 41 shall be guilty of an offence and shall be liable to a fine not exceeding one hundred thousand dollars, and if the offence of which it is convicted is continued after conviction, it shall be guilty of a further offence and liable to a fine of twenty thousand dollars for every day on which the offence is continued.   (2) Any person who fails to file the report required under section 3 (4) with the Minister and the public supplier in whose authorised area such person is supplying electricity to himself shall be guilty of an offence and shall be liable to a fine not exceeding one hundred thousand dollars, and if the offence of which he is convicted is continued after conviction, he shall be guilty of a further offence and liable to a fine of ten thousand dollars for every day on which the offence is continued. transactions. Penalty for unauthorized L.R.O. 1/2012   stealing penalties for Enhanced",
            "description": [
                {
                    "representation": "(1)",
                    "description": "A licensee who fails to maintain or provide the documents and other information required under sections 40 and 41 shall be guilty of an offence and shall be liable to a fine not exceeding one hundred thousand dollars, and if the offence of which it is convicted is continued after conviction, it shall be guilty of a further offence and liable to a fine of twenty thousand dollars for every day on which the offence is continued."
                },
                {
                    "representation": "(2)",
                    "description": "Any person who fails to file the report required under section 3"
                },
                {
                    "representation": "(4)",
                    "description": "with the Minister and the public supplier in whose authorised area such person is supplying electricity to himself shall be guilty of an offence and shall be liable to a fine not exceeding one hundred thousand dollars, and if the offence of which he is convicted is continued after conviction, he shall be guilty of a further offence and liable to a fine of ten thousand dollars for every day on which the offence is continued. transactions. Penalty for unauthorized L.R.O. 1/2012   stealing penalties for Enhanced"
                }
            ]
        }
    },
    {
        "act": "ELECTRICITY SECTOR REFORM ACT",
        "source": "https://mola.gov.gy/laws-of-guyana",
        "type": {
            "name": "section",
            "representation": "60",
            "title": "Enhanced penalties for stealing electricity, meter tampering; illegal connection; compensation. LAWS OF GUYANA 6 Cap. 56:01 Electricity Sector Reform               c. 56:04               c. 25:01     PART I  PRELIMINARY ",
            "context": "ELECTRICITY SECTOR REFORM ACT under Enhanced penalties for stealing electricity, meter tampering; illegal connection; compensation. LAWS OF GUYANA 6 Cap. 56:01 Electricity Sector Reform               c. 56:04               c. 25:01     PART I  PRELIMINARY 60. (1) Any person who dishonestly, fraudulently   or by culpable negligence  electricity;  meter(a)    taps, or otherwise makes or causes to be made LAWS OF GUYANA   L.R.O. 1/2012 commit, or to aid or abet him in committing, agent or representative, or other person, to official, employee, contractor, subcontractor, purpose of influencing or inducing any such public supplier, or to any other person, for the subcontractor, agent or representative of a any official, employee, contractor, (e)    gives, offers or promises anything of value to  benefit of himself; or in the name of the other person but for the electricity or to apply for a supply of electricity any other person to restore, a supply of permitted by law, himself restores, or procures electricity by a public supplier for any reason (d)    after the disconnection of his supply of  of electricity; interfere with the proper or accurate metering them to be so damaged  or destroyed, so as to public supplier, or causes or allows any of other electric apparatus or any other works of a (c)     damages or destroys any meter, electric line,  or used; abstracted, diverted, stolen, wasted, consumed constitutes a manner whereby electricity is metering of electric current or otherwise accurate or proper registration, calibration or device or method which interferes with the public supplier, loop connection, or any other tampered meter, any meter not supplied by a by a public supplier, or installs or uses a amount of electricity supplied to any premises registration of a meter used for measuring the (b)   tampers with or otherwise alters the  any electricity; diverted, steals, consumes or otherwise uses, other manner abstracts, causes to be wasted or works of a public supplier, or otherwise in any any connection with, any electric line or other         c. 10:02                                          [17 of 2010] compensation. connection; tampering; illegal Cap. 56:01 71  Electricity Sector Reform   L.R.O. 1/2012 million dollars; and thousand dollars and not more than one fine of not less than five hundred (B)      upon conviction of a second offence, to a hundred thousand dollars; thousand dollars and not more than five fine of not less than one hundred (A)     upon conviction for a first offence, to a tariff purposes, for the following penalties  industrial premises or as street lighting for would be classified, as business, commercial or where no relevant supply agreement exists (ii)   in the case of premises that are classified, or  dollars; and  dollars and not more than one million of not less than five hundred thousand than one year and, in addition, to a fine not less than six months and not more offence, for mandatory imprisonment of (C)      upon conviction of a third or subsequent hundred thousand dollars; and thousand dollars and not more than five fine of not less than one hundred (B)      upon conviction of a second offence, to a thousand dollars; dollars and not more than one hundred fine of not less than fifty thousand (A)     upon conviction for a first offence, to a tariff purposes, for the following penalties  would be classified, as residential premises for where no relevant supply agreement exists (i)     in the case of premises that are classified, or  or any other law, on summary conviction shall be liable  to 40 or any other provisions of the Summary Jurisdiction (Procedure) Act shall be guilty of an offence and, notwithstanding anything in sections 38  any offence under this subsection,  Cap. 56:01 LAWS OF GUYANA 72 Electricity Sector Reform   L.R.O. 1/2012 (2)   In addition to and not in derogation of any other provision  two million dollars. one million dollars and not more than and, in addition, to a fine of not less than months and not more than one year, imprisonment of not less than six subsequent offence, for mandatory  whichever is applicable. fines and imprisonment provided for in subparagraph (1)(i) or (ii), representative of a public supplier, the person shall be liable for double the current or former official, employee, contractor, subcontractor, agent or              Provided that, where a person convicted under this subsection is a  (1)(i) or (ii) as such subparagraph would apply to the principal offenders conviction, and shall be liable for the penalties provided in subsection conspirator, or before or after the principal offenders or co-conspirators for that offence, either together with the principal offender or co-under subsection (1) shall be liable to be proceeded against and convicted  offence,  any offence; or commit, or to collude in, or allow, the commission of other entity, for the purpose of being influenced to or accept anything of value personally, or for any (b)    demands, seeks, receives, accepts or agrees to receive  commission of any offence;  of any other law, any person who                             c. 10:02        Electricity Sector Reform Cap. 56:01  LAWS OF GUYANA 73 (a)   aids, abets, counsels, causes, or procures the(C)        upon      conviction      of     a     third      or(c)       conspires with any other person to commit anyor co-conspirators tariff category or imputed tariff category:   L.R.O. 1/2012 (c)    notwithstanding anything in this section,  subsection (1) (i) (B) or (1) (ii) (B); and  of the imposition of penalties under fine in full, whichever is earlier, in the case than six months, or until payment of the (b)    not less than three months and not more  subsection (1) (i) (A) or (1) (ii) (A); case of the imposition of penalties under fine in full, whichever is the earlier, in the than three months, or until payment of the (a)    not less than one month and not more   the Magistrates Court imposing the fine, shall be imprisoned for a term of does not pay any fine imposed thereunder in full on the date ordered by meted out the penalties provided for in subsection (1)(i) or (ii), but who (1) or (2), a person convicted of an offence under subsection (1) or (2) and Summary Jurisdiction (Procedure) Act or any other law, or in subsection (3)    Notwithstanding anything in sections 38 to 40 of the  penalties provided for in subsections (1) and (2); liable to be proceeded against and punished with the such offence shall be deemed guilty thereof and shall be eighteen years occupying such premises at the time of any residential premises, every person over the age of established that any offence thereunder occurred as to (4) (a)   Where, in any proceeding under subsection (1) or (2), it is  subsection (1) (i) (C) or (1) (ii) (C). mandatory sentence imposed under exceeding six months, in addition to the accumulated number of days not imposition by the Magistrates Court, the fine remains unpaid after the day of its one additional day for each day that such LAWS OF GUYANA Cap. 56:01 74 Electricity Sector Reform      L.R.O. 1/2012 contemporaneous with the conviction, to pay for the amount of electricity in addition to the penalty imposed for the offence, he shall be ordered, (5)    Where a person has been convicted under subsection (1),  commission of such offence. or that he had exercised all due diligence to prevent the that the offence was committed without his knowledge render any such person liable to punishment if he proves Provided that nothing in this paragraph shall  (1) and (2): punished with the penalties provided for in subsections offence and shall be liable to be proceeded against and shall be deemed to be guilty of having committed the company or other body corporate or incorporate itself, company or other body corporate or incorporate, and the individual responsible for the management of the an individual acting under a power-of-attorney, or other manager, corporate secretary, sole proprietor, partner, time the offence was committed was a director, officer, body corporate or incorporate, every person who at the (1) or (2) has been committed by a company or other provision of any law, where an offence under subsection  provided for in subsections (1) and (2). to be proceeded against and punished with the penalties of the offence, such person shall be the sole person liable and such person was occupying the premises at the time person with regard to the relevant residential premises, agreement in effect between the public supplier and a Provided that, where there is a supply  no more than thirty days from the date of such order  charges to be paid directly by the convicted person to the public supplier would have been assigned to such person for the relevant premises), such had a supply contract with the public supplier, per tariff category that charges per tariff category for the relevant premises (or if such person had otherwise used in the amount of the following standard back-billing abstracted, diverted, stolen, wasted, consumed, improperly registered or LAWS OF GUYANA  Cap. 56:01  Electricity Sector Reform 75  (bIn addition to and not in derogation of any other    L.R.O. 1/2012 such land, shall not be liable to any owner or occupant demonstrate his right of ownership or occupancy of reliance upon any document provided by a person to private land to connect a supply of electricity in powers under paragraph (a), or enters any public or (b)      A public supplier that, in good faith, exercises its  other equipment or apparatus.  remove any such electric line, wire, pole, meter, or permitted to enter the land for such purposes and to land, and every person on, in or otherwise in control of local governmental authority with authority over such owner of such land or the relevant national, regional or land, or that has not been duly authorised by the with or convicted of any such conduct as to which regardless of whether any person has been charged conduct prohibited under subsection (1) or (2), may be, is being or has been used in furtherance of any equipment or apparatus of any kind whatsoever that or replace any electric line, wire, pole, meter, or other authority, enter any public or private land and remove of some duly authenticated document showing his authorised by a public supplier may, on the production suppliers Standard Terms and Conditions, any official supplier under this Act, the regulations or the public (6)(a)        In addition to any other power granted to a public  subparagraph. the relevant standard back-billing charge provided for in this consumed, improperly registered or otherwise used was actually less than that the amount of electricity abstracted, diverted, stolen, wasted, Provided that the person convicted shall have a right to prove  (iii)   Commercial and small industrial (capacity      Cap. 56:01 LAWS OF GUYANA  76 Electricity Sector Reform (ii)     Small business (capacity up to",
            "description": [
                {
                    "representation": "(1)",
                    "description": "or"
                },
                {
                    "representation": "(e)",
                    "description": "gives, offers or promises anything of value to  benefit of himself; or in the name of the other person but for the electricity or to apply for a supply of electricity any other person to restore, a supply of permitted by law, himself restores, or procures electricity by a public supplier for any reason"
                },
                {
                    "representation": "(d)",
                    "description": "after the disconnection of his supply of  of electricity; interfere with the proper or accurate metering them to be so damaged  or destroyed, so as to public supplier, or causes or allows any of other electric apparatus or any other works of a"
                },
                {
                    "representation": "(c)",
                    "description": "notwithstanding anything in this section,  subsection"
                },
                {
                    "representation": "(b)",
                    "description": "A public supplier that, in good faith, exercises its  other equipment or apparatus.  remove any such electric line, wire, pole, meter, or permitted to enter the land for such purposes and to land, and every person on, in or otherwise in control of local governmental authority with authority over such owner of such land or the relevant national, regional or land, or that has not been duly authorised by the with or convicted of any such conduct as to which regardless of whether any person has been charged conduct prohibited under subsection"
                },
                {
                    "representation": "(B)",
                    "description": "or"
                },
                {
                    "representation": "(A)",
                    "description": "or"
                },
                {
                    "representation": "(C)",
                    "description": "or"
                },
                {
                    "representation": "(i)",
                    "description": "or"
                },
                {
                    "representation": "(2)",
                    "description": "has been committed by a company or other provision of any law, where an offence under subsection  provided for in subsections"
                },
                {
                    "representation": "(a)",
                    "description": "In addition to any other power granted to a public  subparagraph. the relevant standard back-billing charge provided for in this consumed, improperly registered or otherwise used was actually less than that the amount of electricity abstracted, diverted, stolen, wasted, Provided that the person convicted shall have a right to prove"
                },
                {
                    "representation": "(3)",
                    "description": "Notwithstanding anything in sections 38 to 40 of the  penalties provided for in subsections"
                },
                {
                    "representation": "(4)",
                    "description": "(a)   Where, in any proceeding under subsection"
                },
                {
                    "representation": "(5)",
                    "description": "Where a person has been convicted under subsection"
                }
            ]
        }
    },
    {
        "act": "ELECTRICITY SECTOR REFORM ACT",
        "source": "https://mola.gov.gy/laws-of-guyana",
        "type": {
            "name": "section",
            "representation": "61",
            "title": "Persons who may bring proceedings, penalties continuing offences.",
            "context": "ELECTRICITY SECTOR REFORM ACT under Persons who may bring proceedings, penalties continuing offences.61. (1)   Except as otherwise provided in this Act or any regulations  negligence or wilful misconduct of the public supplier. any duly authorised occupant of such land by the gross for any damage caused to the property of the owner or of such land for trespass or any other ground, except Act, and the reference to arbitration shall be deemed to be a  c. 7:03  bring proceedings, penalties for continuing offences. [17 of 2010] Persons  who mayElectricity Sector Reform 77 LAWS OF GUYANA Cap. 56:01 L.R.O. 1/2012            arbitrator, be determined by three arbitrators, one of whom shall be appointed by the Government, or by the person designated by the Government under section 19 (l)(b), as the case may be, and another by                   Duties of the Minister.                the public supplier, and those two arbitrators shall appoint the third arbitrator, but in case those two cannot agree upon the appointment of a third arbitrator, that arbitrator shall be appointed by the Chancellor of the Judiciary.   meaning of the Arbitration Act, which, except as expressly varied by paragraph (a), shall apply to such arbitration, except as otherwise expressly provided in a licence or exemption granted under this Act.",
            "description": [
                {
                    "representation": "(1)",
                    "description": "Except as otherwise provided in this Act or any regulations  negligence or wilful misconduct of the public supplier. any duly authorised occupant of such land by the gross for any damage caused to the property of the owner or of such land for trespass or any other ground, except Act, and the reference to arbitration shall be deemed to be a  c. 7:03  bring proceedings, penalties for continuing offences. [17 of 2010] Persons  who mayElectricity Sector Reform 77 LAWS OF GUYANA Cap. 56:01 L.R.O. 1/2012            arbitrator, be determined by three arbitrators, one of whom shall be appointed by the Government, or by the person designated by the Government under section 19"
                }
            ]
        }
    },
    {
        "act": "ELECTRICITY SECTOR REFORM ACT",
        "source": "https://mola.gov.gy/laws-of-guyana",
        "type": {
            "name": "section",
            "representation": "62",
            "title": "Payment of penalties. ",
            "context": "ELECTRICITY SECTOR REFORM ACT under Payment of penalties. 62. Any fines paid under this Act shall be paid to the     undertaking. purchase of concerning disputes general; Arbitration:     specified. penalties not Recovery of   penalties. Payment of  arbitrator, to be appointed in the manner provided in the Arbitration determined by an engineer or other fit and competent person as   Prosecutions, the Police, or a public supplier. may be instituted by the Minister, the Director of Public                         (b)   Proceedings in respect of any offence under section 60  on behalf of the Minister. shall be instituted in respect of an offence except by or Act or the regulations made thereunder, no proceedings                   (2) (a)    Except as provided in paragraph (b) or otherwise in this  which the offence is continued. offence and liable to a fine of twenty thousand dollars for every day on continued by such person after conviction, he shall be guilty of a further made thereunder, if any offence of which a person is convicted is",
            "description": [
                {
                    "representation": "(b)",
                    "description": "or otherwise in this  which the offence is continued. offence and liable to a fine of twenty thousand dollars for every day on continued by such person after conviction, he shall be guilty of a further made thereunder, if any offence of which a person is convicted is"
                },
                {
                    "representation": "(2)",
                    "description": "(a)    Except as provided in paragraph"
                }
            ]
        }
    },
    {
        "act": "ELECTRICITY SECTOR REFORM ACT",
        "source": "https://mola.gov.gy/laws-of-guyana",
        "type": {
            "name": "section",
            "representation": "63",
            "title": "Recovery of penalties not specified. ",
            "context": "ELECTRICITY SECTOR REFORM ACT under Recovery of penalties not specified. 63. All penalties imposed by or under this Act or any  Accountant General.",
            "description": "All penalties imposed by or under this Act or any  Accountant General."
        }
    },
    {
        "act": "ELECTRICITY SECTOR REFORM ACT",
        "source": "https://mola.gov.gy/laws-of-guyana",
        "type": {
            "name": "section",
            "representation": "64",
            "title": "Arbitration: general; disputes concerning purchase of undertaking. ",
            "context": "ELECTRICITY SECTOR REFORM ACT under Arbitration: general; disputes concerning purchase of undertaking. 64.",
            "description": "64."
        }
    },
    {
        "act": "ELECTRICITY SECTOR REFORM ACT",
        "source": "https://mola.gov.gy/laws-of-guyana",
        "type": {
            "name": "section",
            "representation": "65",
            "title": "Duties of the Minister. ",
            "context": "ELECTRICITY SECTOR REFORM ACT under Duties of the Minister. 65. In carrying out the provisions of this Act, the Minister shall have the duty to act in a manner best calculated   (a) to secure a regular, efficient, coordinated and economical supply of electricity and to ensure that all reasonable demands for electricity are satisfied;  (b) to protect the interests of consumers of electricity supplied by persons authorised by licences to supply electricity in respect of-  (b)      The reference to arbitration in section 19 shall be  deemed  to  be  a  submission  within  the                   submission within the meaning of the Arbitration Act which shall apply to such arbitration, except as otherwise expressly provided.  (2)   (a)    Unless otherwise provided in a licence or exemption granted under this Act, any difference or dispute arising under section 19 78 Electricity Sector Reform LAWS OF GUYANA Cap. 56:01                                              L.R.O. 1/2012    supply of electricity;  regard to activities connected with the protection of the physical environment with (g) to take into account the effect on and  from the supply of electricity; (f) to protect the public from dangers arising  consumers; (e) to promote the efficient use of electricity by  resources wherever commercially feasible; electricity generation using renewable to, promotion of alternative forms of supply electricity, including, but not limited part of persons authorised by licences to (d) to promote efficiency and economy on the  reasonable rate of return on capital invested; licence or such written agreement, to obtain a or, if no rate of return is provided for in a or a written agreement with the Government, return, if any, provided for in their licences licences to carry on, and to obtain the rate of activities that they are authorised by their Act, public suppliers are able to finance the electricity granted to him pursuant to this regarding licences for the supply of (c) to ensure that, in relation to the powers  areas; (iv) the provision of electricity in rural (i)   the prices charged and other terms of supply;  (ii) the continuity of supply;  (iii) the quality of the electricity supply services provided; and    Electricity Sector Reform 79 LAWS OF GUYANA Cap. 56:01        L.R.O. 1/2012    of registry.  Maintenance (a) by delivering it to him or by leaving it at his  by virtue of this Act to be served on any person may be served  under this Act, any notice or other document required or authorised",
            "description": [
                {
                    "representation": "(a)",
                    "description": "by delivering it to him or by leaving it at his  by virtue of this Act to be served on any person may be served  under this Act, any notice or other document required or authorised"
                },
                {
                    "representation": "(b)",
                    "description": "The reference to arbitration in section 19 shall be  deemed  to  be  a  submission  within  the                   submission within the meaning of the Arbitration Act which shall apply to such arbitration, except as otherwise expressly provided."
                },
                {
                    "representation": "(2)",
                    "description": ""
                },
                {
                    "representation": "(g)",
                    "description": "to take into account the effect on and  from the supply of electricity;"
                },
                {
                    "representation": "(f)",
                    "description": "to protect the public from dangers arising  consumers;"
                },
                {
                    "representation": "(e)",
                    "description": "to promote the efficient use of electricity by  resources wherever commercially feasible; electricity generation using renewable to, promotion of alternative forms of supply electricity, including, but not limited part of persons authorised by licences to"
                },
                {
                    "representation": "(d)",
                    "description": "to promote efficiency and economy on the  reasonable rate of return on capital invested; licence or such written agreement, to obtain a or, if no rate of return is provided for in a or a written agreement with the Government, return, if any, provided for in their licences licences to carry on, and to obtain the rate of activities that they are authorised by their Act, public suppliers are able to finance the electricity granted to him pursuant to this regarding licences for the supply of"
                },
                {
                    "representation": "(c)",
                    "description": "to ensure that, in relation to the powers  areas;"
                },
                {
                    "representation": "(i)",
                    "description": "the prices charged and other terms of supply;"
                }
            ]
        }
    },
    {
        "act": "ELECTRICITY SECTOR REFORM ACT",
        "source": "https://mola.gov.gy/laws-of-guyana",
        "type": {
            "name": "section",
            "representation": "66",
            "title": "Maintenance of registry. ",
            "context": "ELECTRICITY SECTOR REFORM ACT under Maintenance of registry. 66.(1) The Minister shall, at such premises and in such form          Notices.                                  (h) to enforce the provisions of this Act and any licence or exemption granted pursuant to this Act; and  (i) to carry out national energy policy. 80 Electricity Sector Reform LAWS OF GUYANA Cap. 56:01   L.R.O. 1/2012 except that - c. 2:01 corporate secretary of  that body; or  the Interpretation and General Clauses Act. as his proper address for the purposes of this section and section 9 of behalf will accept such documents, that address shall also be treated pursuant to subsection (2)) as the one at which he or someone on his address within Guyana other than his proper address (as determined notice or other document by another has specified to that other an (3) If a person to be served by virtue of this Act with any  Guyana is its principal office within Guyana.  partnership carrying on business outside registered outside Guyana or of a subsection the principal office of a company the partnership, and for the purpose of this shall be the address of the principal office of management of a partnership business, it partner or a person having the control or (b) in the case of service on a partnership or a  registered or principal office of the body; its secretary, it shall be the address of the (a) in the case of service on a body corporate or  or other document is to be served shall be his last known address, under this Act, the proper address of any person on whom a notice section and unless otherwise provided in a licence or exemption Interpretation and General Clauses Act in its application to this (2) For the purposes of this section and section 9 of the   management of the partnership business. or a person having the control or accordance with paragraph (a) on a partner (c) if the person is a partnership, by serving it in  it in accordance with paragraph (a) on the (b) if the person is a body corporate, by serving    c. 2:01                                          post to him at that address; or proper address or by sending it by registered Electricity Sector Reform 81LAWS OF GUYANA Cap. 56:01                     Savings.  Third Schedule.            c. 56:01         c. 56:01    (4) If the name or address of any owner or occupier of premises on whom a notice or other document is to be served cannot, after reasonable inquiry, be ascertained, such document may be served by-   (a)   addressing it to him by the description of premises shall be specified or described in the address; and (b)      either leaving it in the hands of a person who is or appears to be resident or employed on the premises or leaving it conspicuously affixed to a building on the premises.   (5) This provision shall not apply to any notice or document, the service of which is provided for by rules of court.",
            "description": [
                {
                    "representation": "(1)",
                    "description": "The Minister shall, at such premises and in such form          Notices."
                },
                {
                    "representation": "(h)",
                    "description": "to enforce the provisions of this Act and any licence or exemption granted pursuant to this Act; and"
                },
                {
                    "representation": "(i)",
                    "description": "to carry out national energy policy. 80 Electricity Sector Reform LAWS OF GUYANA Cap. 56:01   L.R.O. 1/2012 except that - c. 2:01 corporate secretary of  that body; or  the Interpretation and General Clauses Act. as his proper address for the purposes of this section and section 9 of behalf will accept such documents, that address shall also be treated pursuant to subsection"
                },
                {
                    "representation": "(3)",
                    "description": "If a person to be served by virtue of this Act with any  Guyana is its principal office within Guyana.  partnership carrying on business outside registered outside Guyana or of a subsection the principal office of a company the partnership, and for the purpose of this shall be the address of the principal office of management of a partnership business, it partner or a person having the control or"
                },
                {
                    "representation": "(b)",
                    "description": "either leaving it in the hands of a person who is or appears to be resident or employed on the premises or leaving it conspicuously affixed to a building on the premises."
                },
                {
                    "representation": "(a)",
                    "description": "addressing it to him by the description of premises shall be specified or described in the address; and"
                },
                {
                    "representation": "(2)",
                    "description": "For the purposes of this section and section 9 of the   management of the partnership business. or a person having the control or accordance with paragraph"
                },
                {
                    "representation": "(c)",
                    "description": "if the person is a partnership, by serving it in  it in accordance with paragraph"
                },
                {
                    "representation": "(4)",
                    "description": "If the name or address of any owner or occupier of premises on whom a notice or other document is to be served cannot, after reasonable inquiry, be ascertained, such document may be served by-"
                },
                {
                    "representation": "(5)",
                    "description": "This provision shall not apply to any notice or document, the service of which is provided for by rules of court."
                }
            ]
        }
    },
    {
        "act": "ELECTRICITY SECTOR REFORM ACT",
        "source": "https://mola.gov.gy/laws-of-guyana",
        "type": {
            "name": "section",
            "representation": "67",
            "title": "Notices. ",
            "context": "ELECTRICITY SECTOR REFORM ACT under Notices. 67.(1) Except as otherwise provided in a licence granted   might aid a competitor, of a public supplier. maintaining the confidentiality of trade secrets and information that affect the interests of that person, including the interest in might, in the opinion of the Minister, seriously and prejudicially the affairs of any person, where publication of that matter would or excluding, so far as that is practicable, any matter which relates to subsection (1), the Minister shall have regard to the need for (2) In making an entry in the register as provided for in  during normal working hours. shall be open for inspection by any person Minister under this Act, and such register of such notices and orders, made by the (d) every notice or order, and every revocation  this Act; determination made by the Minister under (c) every direction or consent given or  revocation of a licence; (b) every modification, suspension, or  to any person; (a) every licence and every exemption granted  as he may determine, maintain a register of",
            "description": [
                {
                    "representation": "(1)",
                    "description": "Except as otherwise provided in a licence granted   might aid a competitor, of a public supplier. maintaining the confidentiality of trade secrets and information that affect the interests of that person, including the interest in might, in the opinion of the Minister, seriously and prejudicially the affairs of any person, where publication of that matter would or excluding, so far as that is practicable, any matter which relates to subsection"
                },
                {
                    "representation": "(2)",
                    "description": "In making an entry in the register as provided for in  during normal working hours. shall be open for inspection by any person Minister under this Act, and such register of such notices and orders, made by the"
                },
                {
                    "representation": "(d)",
                    "description": "every notice or order, and every revocation  this Act; determination made by the Minister under"
                },
                {
                    "representation": "(c)",
                    "description": "every direction or consent given or  revocation of a licence;"
                },
                {
                    "representation": "(b)",
                    "description": "every modification, suspension, or  to any person;"
                },
                {
                    "representation": "(a)",
                    "description": "every licence and every exemption granted  as he may determine, maintain a register of"
                }
            ]
        }
    },
    {
        "act": "ELECTRICITY SECTOR REFORM ACT",
        "source": "https://mola.gov.gy/laws-of-guyana",
        "type": {
            "name": "section",
            "representation": "68",
            "title": "Savings. ",
            "context": "ELECTRICITY SECTOR REFORM ACT under Savings. 68.(1) Notwithstanding the repeal of any Act by section 42 and except to the extent inconsistent with the provisions of section 31, the Third Schedule, or a licence granted under section 4 or an exemption granted under section 3, the following subsidiary legislation made thereunder shall continue in force as if they were regulations made under section 69 of this Act to the extent that their continuance is necessary for the administration of this Act, in particular for public suppliers to conduct authorised activities under section 3 or 4 or otherwise to fulfill their obligations under this Act, until amended or revoked under the aforesaid section 69 -  (a) the Electricity Regulations made under section 36 of the Electricity Act;  (b) the Electricity Order made under the Georgetown Electric Supply Ordinance, Cap. 238, 1953 Ed.) (now repealed) on 27th May, 1927 (see 1953 Ed. Vol 5 p. 2395) and continued in force by section 37 of the Electricity Act; and L.R.O. 1/2012 \"owner\" or \"occupier\" of the premises, which 82 Electricity Sector Reform LAWS OF GUYANA Cap. 56:01             Authority to make regulations.                                    (c) the Electric Installation Regulations made under section 7 of the Electric Lighting Act.  (2) Subject to the first proviso to section 5, within the ninety days following the issuance of shares provided for in section 42 (6), the Minister shall commence the preparation of new regulations to replace the regulations set forth in subsection (1), and, thereby, to bring the technical, engineering, inspection and other standards applicable to public suppliers in line with section 31:  Provided that, in the course of the preparation of such regulations and prior to their making, the Minister shall consult with and give due consideration to the views of any public supplier that may be affected by such regulations.",
            "description": [
                {
                    "representation": "(1)",
                    "description": "Notwithstanding the repeal of any Act by section 42 and except to the extent inconsistent with the provisions of section 31, the Third Schedule, or a licence granted under section 4 or an exemption granted under section 3, the following subsidiary legislation made thereunder shall continue in force as if they were regulations made under section 69 of this Act to the extent that their continuance is necessary for the administration of this Act, in particular for public suppliers to conduct authorised activities under section 3 or 4 or otherwise to fulfill their obligations under this Act, until amended or revoked under the aforesaid section 69 -"
                },
                {
                    "representation": "(a)",
                    "description": "the Electricity Regulations made under section 36 of the Electricity Act;"
                },
                {
                    "representation": "(b)",
                    "description": "the Electricity Order made under the Georgetown Electric Supply Ordinance, Cap. 238, 1953 Ed.)"
                },
                {
                    "representation": "(c)",
                    "description": "the Electric Installation Regulations made under section 7 of the Electric Lighting Act."
                },
                {
                    "representation": "(2)",
                    "description": "Subject to the first proviso to section 5, within the ninety days following the issuance of shares provided for in section 42"
                }
            ]
        }
    },
    {
        "act": "ELECTRICITY SECTOR REFORM ACT",
        "source": "https://mola.gov.gy/laws-of-guyana",
        "type": {
            "name": "section",
            "representation": "69",
            "title": "Authority to make regulations. ",
            "context": "ELECTRICITY SECTOR REFORM ACT under Authority to make regulations. 69. The Minister may make regulations for giving effect to this Act with regard to   (a) the promotion of efficiency and economy on the part of persons authorised by licences or exemptions to supply electricity; (b) the use of alternative forms of electricity generation using renewable resources wherever commercially feasible; (c) the promotion of the efficient use of electricity by consumers; (d) the protection of the public and property from dangers arising from the supply of electricity, including   (i)   the safety of the public from personal injury or from fire or otherwise; (ii)  the protection of persons and property by reason of contact with or the proximity of, or by reason of the defective or L.R.O. 1/2012 c. 56:02 Electricity Sector Reform 83LAWS OF GUYANA Cap. 56:01                                                  dangerous condition of, any appliance, apparatus or installation used in the supply of electricity;  (iii) the reporting and investigation of electricity-related accidents and damage, and failures to supply electricity;  (iv) the methods of wiring of premises;  (v) the types of electrical apparatus and installations that may be used;  (vi) the qualifications, examination, licensing and registration to be required of electricians and electrical engineers, technicians and inspectors;  (vii) the inspection, testing and maintenance of works, supply lines, meters, accumulators, fittings, installations, supply lines, and apparatus constructed and placed on any public land or private premises;  (viii) the prevention of any telephone, other telecommunications or electric signaling line, or the current in such line, from being injuriously affected by any L.R.O. 1/2012 84 Electricity Sector Reform LAWS OF GUYANA Cap. 56:01                                                  appliance, apparatus or installation used in the supply of electricity;  (ix) the units or standards for the measurement of electricity and the limits of error; and  (x) the frequency, type of current and voltage of electricity to be generated or supplied.  (e) in addition to the information required under sections 40 and 41, the information that a licensee, or persons exempt from the licencing requirements of this Act, must provide to the Minister or to consumers;  (f) the engineering, operational and other technical standards applicable to public suppliers;  (g) the creation, maintenance and disposition of any funding provided by the Government for the supply of electricity to low income or disabled persons;  (h) the effect on and protection of the physical environment with regard to activities connected with the supply of electricity;  (i) the supply of electricity for private purposes;  (j)  any matter concerning application for and the granting, modification, extension, revocation, and suspension of licences for the supply of electricity and concerning exemptions from the requirement to obtain a L.R.O. 1/2012 Electricity Sector Reform 85 LAWS OF GUYANA Cap. 56:01                Amendment of Schedules.                                 licence for the supply of electricity; (k)    the keeping, by persons authorised by a licence or by exemption to supply electricity, of maps, plans and other drawings, diagrams and schematics and their production for inspection or copying;  (l)       the mitigation of any natural disaster or other civil emergency that disrupts or is likely to disrupt the supply of electricity;  (m)   subject to the provisions of this Act, the reform of the electricity sector;  (n)  the penalties for contravention of any regulation made under this section; and  (o)     any other matter necessary to establish and carry out national policy on matters involving electricity or for the administration of this Act.",
            "description": [
                {
                    "representation": "(a)",
                    "description": "the promotion of efficiency and economy on the part of persons authorised by licences or exemptions to supply electricity;"
                },
                {
                    "representation": "(b)",
                    "description": "the use of alternative forms of electricity generation using renewable resources wherever commercially feasible;"
                },
                {
                    "representation": "(c)",
                    "description": "the promotion of the efficient use of electricity by consumers;"
                },
                {
                    "representation": "(d)",
                    "description": "the protection of the public and property from dangers arising from the supply of electricity, including"
                },
                {
                    "representation": "(i)",
                    "description": "the supply of electricity for private purposes;"
                },
                {
                    "representation": "(v)",
                    "description": "the types of electrical apparatus and installations that may be used;"
                },
                {
                    "representation": "(x)",
                    "description": "the frequency, type of current and voltage of electricity to be generated or supplied."
                },
                {
                    "representation": "(e)",
                    "description": "in addition to the information required under sections 40 and 41, the information that a licensee, or persons exempt from the licencing requirements of this Act, must provide to the Minister or to consumers;"
                },
                {
                    "representation": "(f)",
                    "description": "the engineering, operational and other technical standards applicable to public suppliers;"
                },
                {
                    "representation": "(g)",
                    "description": "the creation, maintenance and disposition of any funding provided by the Government for the supply of electricity to low income or disabled persons;"
                },
                {
                    "representation": "(h)",
                    "description": "the effect on and protection of the physical environment with regard to activities connected with the supply of electricity;"
                },
                {
                    "representation": "(j)",
                    "description": "any matter concerning application for and the granting, modification, extension, revocation, and suspension of licences for the supply of electricity and concerning exemptions from the requirement to obtain a L.R.O. 1/2012 Electricity Sector Reform 85 LAWS OF GUYANA Cap. 56:01                Amendment of Schedules.                                 licence for the supply of electricity;"
                },
                {
                    "representation": "(k)",
                    "description": "the keeping, by persons authorised by a licence or by exemption to supply electricity, of maps, plans and other drawings, diagrams and schematics and their production for inspection or copying;"
                },
                {
                    "representation": "(l)",
                    "description": "the mitigation of any natural disaster or other civil emergency that disrupts or is likely to disrupt the supply of electricity;"
                },
                {
                    "representation": "(m)",
                    "description": "subject to the provisions of this Act, the reform of the electricity sector;"
                },
                {
                    "representation": "(n)",
                    "description": "the penalties for contravention of any regulation made under this section; and"
                },
                {
                    "representation": "(o)",
                    "description": "any other matter necessary to establish and carry out national policy on matters involving electricity or for the administration of this Act."
                }
            ]
        }
    },
    {
        "act": "ELECTRICITY SECTOR REFORM ACT",
        "source": "https://mola.gov.gy/laws-of-guyana",
        "type": {
            "name": "section",
            "representation": "70",
            "title": "Amendment of Schedules.   SCHEDULES First Schedule - Parts A and B  Second Schedule  Third Schedule  ",
            "context": "ELECTRICITY SECTOR REFORM ACT under Amendment of Schedules.   SCHEDULES First Schedule - Parts A and B  Second Schedule  Third Schedule  70. The Minister may by regulations, which shall be subject to affirmative resolution of the National Assembly, amend any of the Schedules.             L.R.O. 1/2012 86 Electricity Sector Reform LAWS OF GUYANA Cap. 56:01                           c. 25:01                       FIRST SCHEDULE  Rates for the Supply of Electricity and Services and Rate Adjustment Mechanism  Guyana Power& Light, Inc.   Part A   Preliminary",
            "description": "The Minister may by regulations, which shall be subject to affirmative resolution of the National Assembly, amend any of the Schedules.             L.R.O. 1/2012 86 Electricity Sector Reform LAWS OF GUYANA Cap. 56:01                           c. 25:01                       FIRST SCHEDULE  Rates for the Supply of Electricity and Services and Rate Adjustment Mechanism  Guyana Power& Light, Inc.   Part A   Preliminary"
        }
    },
    {
        "act": "ELECTRICITY SECTOR REFORM ACT",
        "source": "https://mola.gov.gy/laws-of-guyana",
        "type": {
            "name": "section",
            "representation": "",
            "title": "795.38",
            "context": "ELECTRICITY SECTOR REFORM ACT under 795.38795.38",
            "description": "795.38"
        }
    },
    {
        "act": "ELECTRICITY SECTOR REFORM ACT",
        "source": "https://mola.gov.gy/laws-of-guyana",
        "type": {
            "name": "section",
            "representation": "",
            "title": "819.48",
            "context": "ELECTRICITY SECTOR REFORM ACT under 819.48819.48",
            "description": "819.48"
        }
    },
    {
        "act": "ELECTRICITY SECTOR REFORM ACT",
        "source": "https://mola.gov.gy/laws-of-guyana",
        "type": {
            "name": "section",
            "representation": "",
            "title": "844.31",
            "context": "ELECTRICITY SECTOR REFORM ACT under 844.31844.31",
            "description": "844.31"
        }
    },
    {
        "act": "ELECTRICITY SECTOR REFORM ACT",
        "source": "https://mola.gov.gy/laws-of-guyana",
        "type": {
            "name": "section",
            "representation": "",
            "title": "915.60Note 1",
            "context": "ELECTRICITY SECTOR REFORM ACT under 915.60Note 1915.60Note 1",
            "description": "915.60Note 1"
        }
    },
    {
        "act": "ELECTRICITY SECTOR REFORM ACT",
        "source": "https://mola.gov.gy/laws-of-guyana",
        "type": {
            "name": "section",
            "representation": "",
            "title": "922.52",
            "context": "ELECTRICITY SECTOR REFORM ACT under 922.52922.52",
            "description": "922.52"
        }
    },
    {
        "act": "ELECTRICITY SECTOR REFORM ACT",
        "source": "https://mola.gov.gy/laws-of-guyana",
        "type": {
            "name": "section",
            "representation": "1997",
            "title": "L.R.O. 1/2012 LAWS OF GUYANA Electricity Sector Reform Cap. 56:01 5  L.R.O. 1/2011 ",
            "context": "ELECTRICITY SECTOR REFORM ACT under L.R.O. 1/2012 LAWS OF GUYANA Electricity Sector Reform Cap. 56:01 5  L.R.O. 1/2011 1997. No.30 of 1997  Construction or expansion of installations or capacity for electricity generation  Rural electrification programmes.           provided in a licence granted in accordance with section 4 or an agreement between the Government and the Strategic Investor, independent power production projects for the generation of electricity may be developed in and licensed for the area in which Guyana Power & Light, Inc. is authorised by section 42 (3) (c) to transmit and distribute electricity only if the governing bodies of Guyana Power & Light, Inc. and the independent power producer have first approved the terms and conditions upon which such electricity will be purchased by Guyana Power & Light, Inc., and such terms and conditions insofar as they relate to rates have further been approved by the Commission, and the Minister is satisfied that the criteria of 4 (1) (c) (ii) will be met by the proposed independent power production project.",
            "description": [
                {
                    "representation": "(3)",
                    "description": "(c) to transmit and distribute electricity only if the governing bodies of Guyana Power & Light, Inc. and the independent power producer have first approved the terms and conditions upon which such electricity will be purchased by Guyana Power & Light, Inc., and such terms and conditions insofar as they relate to rates have further been approved by the Commission, and the Minister is satisfied that the criteria of 4"
                },
                {
                    "representation": "(1)",
                    "description": "(c)"
                }
            ]
        }
    },
    {
        "act": "ELECTRICITY SECTOR REFORM ACT",
        "source": "https://mola.gov.gy/laws-of-guyana",
        "type": {
            "name": "section",
            "representation": "1999",
            "title": "\"authorised area\" means the geographical area within which a public supplier is authorised to supply electricity as set forth in a licence granted under section 4 or an exemption granted under section 3 to that public supplier;  \"Commission\" has the same meaning as in section 3 of the Public Utilities Commission Act;  \"competitor\" or \"competition,\" in relation to any licensee, means respectively any person other than the licensee, or the activities  st                 [All other sections 1  October, ",
            "context": "ELECTRICITY SECTOR REFORM ACT under \"authorised area\" means the geographical area within which a public supplier is authorised to supply electricity as set forth in a licence granted under section 4 or an exemption granted under section 3 to that public supplier;  \"Commission\" has the same meaning as in section 3 of the Public Utilities Commission Act;  \"competitor\" or \"competition,\" in relation to any licensee, means respectively any person other than the licensee, or the activities  st                 [All other sections 1  October, 1999.] th[s 42 (2) and (3) (a) and (d)10  OCTOBER, 1999]  thereto or connected therewith. economical supply of electricity and for matters incidental An Act to provide for the regular, efficient, coordinated and    11 of 1999 ELECTRICITY SECTOR REFORM ACT  CHAPTER 56:01 Short title.  L.R.O. 1/2012 Interpretation.[17 of 2010]LAWS OF GUYANA Electricity Sector Reform Cap. 56:01 7                    of any such person, authorised by a licence granted under section 4 or an exemption granted under section 3 to supply electricity;  \"consumer\" means any owner or occupier of premises to which a public supplier supplies, or has been requested to supply, electricity, or whose premises are connected, directly or indirectly, with any electric line or other electrical apparatus or installation of a public supplier through which electricity is, or is capable of being, supplied;  electricity for the purpose of selling it to another public supplier \"independent power producer\" means any person who generates L.R.O. 1/2012 c. 2:01  \"private purposes\" means the supplying of electricity by any person  wherever situated; \"premises\" means any land or any building or other erection  Act has been assigned;  \"Minister\" means the Minister to whom the administration of this  the Interpretation and General Clauses Act; \"local Government authority\" has the same meaning as in section 5 of  electricity; section 4 or an exemption granted under section 3 to supply \"licensee\" means any person authorised by a licence granted under  Interpretation and General Clauses Act; or the State, or both, each as defined in section 5 of the \"Government\" means, as appropriate in the context, the Government  having the ultimate authority in the case of any other entity; Ministry or a Government department, or the person or persons corporate body, the responsible Minister in the case of a \"governing body\" means the board of directors in the case of a                    c.  2:01           distribution or sale to consumers; be supplied by the person to a public supplier for transmission, principal business and not more than 10 MW of electricity would include any person for whom the generation of electricity is not its for transmission, distribution or sale to consumers, but shall not LAWS OF GUYANA 8 Cap. 56:01 Electricity Sector Reform                                 Third Schedule                to himself or any other person, or to premises, other than for public purposes, specified in a licence granted under section 4 or an exemption granted under section 3; \"private supplier\" means any person who supplies electricity for private purposes;  \"public supplier\" means any person who supplies electricity for public purposes, which includes an independent power producer;  \"public purposes\" means supplying electricity to consumers within an authorised area;  \"rural electrification programme\" means a programme for extending electricity service to an area located outside the area that can be economically served by the then existing facilities of the public supplier;  \"shares\" means the ordinary shares and preference shares representing the equity capital of a public supplier;  \"Standard Terms and Conditions\" means such terms and conditions governing the relationship between a public supplier and consumers as may be included in a licence and modified from time to time in accordance with paragraph 33 of the Third Schedule;  \"Strategic Investor\" means a company or consortium that invests in Guyana Power & Light, Inc. pursuant to a Share Subscription Agreement and a Shareholders' Agreement between the Government and such company or consortium;   \"supplier\" means any person supplying electricity;  \"supply,\" whether used as a noun or a verb, includes the generation, storage, transmission, distribution, furnishing or sale of electricity; L.R.O. 1/2012 LAWS OF GUYANA Electricity Sector Reform Cap. 56:01 9                    c. 25:01                     Requirement for a licence and exemption      \"sustainability programme\" means both an annual and a rolling five-year plan which sets out, in the detail required under section 38, the manner in which a public supplier is to achieve and sustain the customer service, engineering and technical standards necessary for an efficient, co-ordinated and economical supply of electricity under a licence granted to such public supplier under section 4 or an exemption granted to such public supplier under section 3; and \"development and expansion programme\" means that portion of a sustainability programme which sets out the manner through which the public supplier will develop and expand its facilities and services to be provided to consumers and which, subject to the provisions of this Act and the terms of a licence or exemption, shall be deemed to be a development and expansion programme under the Public Utilities Commission Act;  \"undertaking\" means the assets and liabilities relating to the business of a public supplier;  \"works\" means land, buildings, machinery, equipment, inventory, electric lines, poles, apparatus, fittings, appliances, and any other matter, thing, right, interest or property, including movable, tangible and intangible property and intellectual property rights, owned or leased by a person and used by him, directly or indirectly, to supply electricity.  PART II   ELECTRICITY SUPPLY",
            "description": [
                {
                    "representation": "(2)",
                    "description": "and"
                },
                {
                    "representation": "(3)",
                    "description": "(a) and"
                }
            ]
        }
    },
    {
        "act": "ELECTRICITY SECTOR REFORM ACT",
        "source": "https://mola.gov.gy/laws-of-guyana",
        "type": {
            "name": "section",
            "representation": "",
            "title": "46126.00",
            "context": "ELECTRICITY SECTOR REFORM ACT under 46126.0046126.00",
            "description": "46126.00"
        }
    },
    {
        "act": "ELECTRICITY SECTOR REFORM ACT",
        "source": "https://mola.gov.gy/laws-of-guyana",
        "type": {
            "name": "section",
            "representation": "",
            "title": "92252.00",
            "context": "ELECTRICITY SECTOR REFORM ACT under 92252.0092252.00",
            "description": "92252.00"
        }
    }
]