[
    {
        "act": "GUYANA LANDS AND SURVEYS COMMISSION ACT",
        "source": "https://mola.gov.gy/laws-of-guyana",
        "type": {
            "name": "section",
            "representation": "1",
            "title": "Short title. ",
            "context": "GUYANA LANDS AND SURVEYS COMMISSION ACT under Short title. 1. This Act may be cited as the Guyana Lands and Surveys Commission Act.",
            "description": "This Act may be cited as the Guyana Lands and Surveys Commission Act."
        }
    },
    {
        "act": "GUYANA LANDS AND SURVEYS COMMISSION ACT",
        "source": "https://mola.gov.gy/laws-of-guyana",
        "type": {
            "name": "section",
            "representation": "2",
            "title": "Interpretation.  PART II ESTABLISHMENT AND FUNCTIONS OF THE GUYANA LANDS AND SURVEYS COMMISSION  ",
            "context": "GUYANA LANDS AND SURVEYS COMMISSION ACT under Interpretation.  PART II ESTABLISHMENT AND FUNCTIONS OF THE GUYANA LANDS AND SURVEYS COMMISSION  2. In this Act   Board  means  the  Board  of  Directors of the Lands and Surveys Commission established by section 7;  commencement date means the date for the coming into operation of this Act;  Commissioner means the Commissioner of Lands and Surveys;   land includes land covered by water and the seabed within the outer limits of the territorial waters of Guyana;  GUYANA LANDS AND SURVEYS COMMISSION ACT  CHAPTER 59:05 LAWS OF GUYANA 6 Cap. 59:05 Guyana Lands and Surveys Commission   L.R.O. 1/2012      c. 59:01 c. 62:01         Establishment  of the Guyana Lands and Surveys Commission.  Functions of the Commission.                           land surveys includes hydrographic surveys;  public Lands means all Government lands within the meaning of the Lands Department Act and all State lands within the meaning of the State Lands Act.  PART II ESTABLISHMENT AND FUNCTIONS OF THE GUYANA LANDS AND SURVEYS COMMISSION",
            "description": "In this Act   Board  means  the  Board  of  Directors of the Lands and Surveys Commission established by section 7;  commencement date means the date for the coming into operation of this Act;  Commissioner means the Commissioner of Lands and Surveys;   land includes land covered by water and the seabed within the outer limits of the territorial waters of Guyana;  GUYANA LANDS AND SURVEYS COMMISSION ACT  CHAPTER 59:05 LAWS OF GUYANA 6 Cap. 59:05 Guyana Lands and Surveys Commission   L.R.O. 1/2012      c. 59:01 c. 62:01         Establishment  of the Guyana Lands and Surveys Commission.  Functions of the Commission.                           land surveys includes hydrographic surveys;  public Lands means all Government lands within the meaning of the Lands Department Act and all State lands within the meaning of the State Lands Act.  PART II ESTABLISHMENT AND FUNCTIONS OF THE GUYANA LANDS AND SURVEYS COMMISSION"
        }
    },
    {
        "act": "GUYANA LANDS AND SURVEYS COMMISSION ACT",
        "source": "https://mola.gov.gy/laws-of-guyana",
        "type": {
            "name": "section",
            "representation": "3",
            "title": "Establishment of the Guyana Lands and Surveys Commission. ",
            "context": "GUYANA LANDS AND SURVEYS COMMISSION ACT under Establishment of the Guyana Lands and Surveys Commission. 3. There is hereby established a body corporate to be known as the Guyana Lands and Surveys Commission (hereafter in this Act referred to as the Commission).",
            "description": "There is hereby established a body corporate to be known as the Guyana Lands and Surveys Commission (hereafter in this Act referred to as the Commission)."
        }
    },
    {
        "act": "GUYANA LANDS AND SURVEYS COMMISSION ACT",
        "source": "https://mola.gov.gy/laws-of-guyana",
        "type": {
            "name": "section",
            "representation": "4",
            "title": "Functions of the Commission. ",
            "context": "GUYANA LANDS AND SURVEYS COMMISSION ACT under Functions of the Commission. 4. (1) The functions of the Commission are -  (a)      to have charge of and act as guardian over all public lands, rivers and creeks of Guyana;  (b)  to execute   or   cause   to   be   executed geodetic, topographic, hydrographic  and  cadastral  surveys  in relation to the land and water resources of Guyana;  (c) to prepare and publish maps and charts of Guyana or parts thereof;  (d) to establish and maintain the national survey control system, set standards for the collection of photogrametric data and specify the technical requirements for land surveys;  (e) to check, approve, record and, where LAWS OF GUYANA Guyana Lands and Surveys Commission Cap. 59:05 7  L.R.O. 1/2012                                                 required, certify all land surveys carried out in relation to any land in Guyana;  (f) to provide access to land survey records and related information to any land surveyor or any other person, class or classes of persons;  (g) to  receive  and  evaluate  offers  to  purchase  or  let public lands and to issue, for and on behalf of the President, grants, leases and permits to occupy such lands,  in  accordance   with  any  law regulating  the administration and disposition of public lands;  (h) to set, monitor and enforce the terms and conditions subject to which public land is sold or let;  (i) to make and maintain such records concerning public lands as are required by law;  (j) to collect and account for all purchase monies and rents, payable in relation to the sale or lease of public lands, and such rates, taxes, fees, fines and charges as the Minister may direct or as may be prescribed by law;  (k)     to  undertake  land  valuation  of public  land  for the purposes of classifying public land in relation to setting   reserve prices for the sale LAWS OF GUYANA 8 Cap. 59:05 Guyana Lands and Surveys Commission   L.R.O. 1/2012                                                 thereof or rental rates for the letting thereof; (l) to provide to the general public access to information from land records made and maintained in relation to public lands;  (m)   to  establish  and  maintain  liaison  between  all  the agencies involved in the registration and storage of records   relating   to   public   land   in   any   tenure, including the registration of deeds and title to land;  (n)    to formulate policy on geographic and  land information and set standards in relation to digital data, establish the framework for a national network of  geographic information systems and develop and maintain a parcel-based land information system;  (o) to initiate studies into and formulate policy on the development of public lands, including the feasibility of specific land development projects;  (p) to establish and maintain liaison with the responsible agencies to promote and monitor, in relation to public lands, the provision and maintenance of drainage and irrigation systems, access roads and other infrastructure,  through  such  measures  as  may  be appropriate;  LAWS OF GUYANA Guyana Lands and Surveys Commission Cap. 59:05 9                  c. 20:01                      Delegation of functions by the Commission.        Relationship with other authorities. (q) to compile and maintain an inventory of all the land resources of Guyana, their quality, degree, pattern of utilisation and related matters;  (r)     to prepare land use plans for Guyana or any part of Guyana, except any municipality which is subject to a planning scheme (or interim development  control pending the preparation of a planning scheme) under the Town and Country Planning Act;  (s) to advise the Government on policy relating to public lands, land surveys   and any other matters related to the functions of the Commission;  (t) to administer and enforce all laws relating to public lands and land  surveys.  (2) The Commission may, with the prior approval of the Minister, do all such acts as may appear to it expedient for the purposes of   discharging the functions specified in subsection (1).",
            "description": [
                {
                    "representation": "(1)",
                    "description": "The functions of the Commission are -"
                },
                {
                    "representation": "(a)",
                    "description": "to have charge of and act as guardian over all public lands, rivers and creeks of Guyana;"
                },
                {
                    "representation": "(b)",
                    "description": "to execute   or   cause   to   be   executed geodetic, topographic, hydrographic  and  cadastral  surveys  in relation to the land and water resources of Guyana;"
                },
                {
                    "representation": "(c)",
                    "description": "to prepare and publish maps and charts of Guyana or parts thereof;"
                },
                {
                    "representation": "(d)",
                    "description": "to establish and maintain the national survey control system, set standards for the collection of photogrametric data and specify the technical requirements for land surveys;"
                },
                {
                    "representation": "(e)",
                    "description": "to check, approve, record and, where LAWS OF GUYANA Guyana Lands and Surveys Commission Cap. 59:05 7  L.R.O. 1/2012                                                 required, certify all land surveys carried out in relation to any land in Guyana;"
                },
                {
                    "representation": "(f)",
                    "description": "to provide access to land survey records and related information to any land surveyor or any other person, class or classes of persons;"
                },
                {
                    "representation": "(g)",
                    "description": "to  receive  and  evaluate  offers  to  purchase  or  let public lands and to issue, for and on behalf of the President, grants, leases and permits to occupy such lands,  in  accordance   with  any  law regulating  the administration and disposition of public lands;"
                },
                {
                    "representation": "(h)",
                    "description": "to set, monitor and enforce the terms and conditions subject to which public land is sold or let;"
                },
                {
                    "representation": "(i)",
                    "description": "to make and maintain such records concerning public lands as are required by law;"
                },
                {
                    "representation": "(j)",
                    "description": "to collect and account for all purchase monies and rents, payable in relation to the sale or lease of public lands, and such rates, taxes, fees, fines and charges as the Minister may direct or as may be prescribed by law;"
                },
                {
                    "representation": "(k)",
                    "description": "to  undertake  land  valuation  of public  land  for the purposes of classifying public land in relation to setting   reserve prices for the sale LAWS OF GUYANA 8 Cap. 59:05 Guyana Lands and Surveys Commission   L.R.O. 1/2012                                                 thereof or rental rates for the letting thereof;"
                },
                {
                    "representation": "(l)",
                    "description": "to provide to the general public access to information from land records made and maintained in relation to public lands;"
                },
                {
                    "representation": "(m)",
                    "description": "to  establish  and  maintain  liaison  between  all  the agencies involved in the registration and storage of records   relating   to   public   land   in   any   tenure, including the registration of deeds and title to land;"
                },
                {
                    "representation": "(n)",
                    "description": "to formulate policy on geographic and  land information and set standards in relation to digital data, establish the framework for a national network of  geographic information systems and develop and maintain a parcel-based land information system;"
                },
                {
                    "representation": "(o)",
                    "description": "to initiate studies into and formulate policy on the development of public lands, including the feasibility of specific land development projects;"
                },
                {
                    "representation": "(p)",
                    "description": "to establish and maintain liaison with the responsible agencies to promote and monitor, in relation to public lands, the provision and maintenance of drainage and irrigation systems, access roads and other infrastructure,  through  such  measures  as  may  be appropriate;  LAWS OF GUYANA Guyana Lands and Surveys Commission Cap. 59:05 9                  c. 20:01                      Delegation of functions by the Commission.        Relationship with other authorities."
                },
                {
                    "representation": "(q)",
                    "description": "to compile and maintain an inventory of all the land resources of Guyana, their quality, degree, pattern of utilisation and related matters;"
                },
                {
                    "representation": "(r)",
                    "description": "to prepare land use plans for Guyana or any part of Guyana, except any municipality which is subject to a planning scheme"
                },
                {
                    "representation": "(s)",
                    "description": "to advise the Government on policy relating to public lands, land surveys   and any other matters related to the functions of the Commission;"
                },
                {
                    "representation": "(t)",
                    "description": "to administer and enforce all laws relating to public lands and land  surveys."
                },
                {
                    "representation": "(2)",
                    "description": "The Commission may, with the prior approval of the Minister, do all such acts as may appear to it expedient for the purposes of   discharging the functions specified in subsection"
                }
            ]
        }
    },
    {
        "act": "GUYANA LANDS AND SURVEYS COMMISSION ACT",
        "source": "https://mola.gov.gy/laws-of-guyana",
        "type": {
            "name": "section",
            "representation": "5",
            "title": "Delegation of functions by the Commission. ",
            "context": "GUYANA LANDS AND SURVEYS COMMISSION ACT under Delegation of functions by the Commission. 5. The Commission may, subject to such conditions as it may think fit, by writing under its common seal delegate any of its functions under this Part to any Government department or official, or any person acting under contract with the Commission.",
            "description": "The Commission may, subject to such conditions as it may think fit, by writing under its common seal delegate any of its functions under this Part to any Government department or official, or any person acting under contract with the Commission."
        }
    },
    {
        "act": "GUYANA LANDS AND SURVEYS COMMISSION ACT",
        "source": "https://mola.gov.gy/laws-of-guyana",
        "type": {
            "name": "section",
            "representation": "6",
            "title": "Relationship with other authorities.  PART III  THE BOARD  ",
            "context": "GUYANA LANDS AND SURVEYS COMMISSION ACT under Relationship with other authorities.  PART III  THE BOARD  6.  In the discharge of its functions under this Act, the Commission shall, subject to the provisions of this Act, so far as practicable, co-operate fully with all Ministries, L.R.O. 1/2012 LAWS OF GUYANA 10 Cap. 59:05 Guyana Lands and Surveys Commission   L.R.O. 1/2012          The Board.             Schedule.     Committee of the Board.          The Commissioner.                 Government departments and agencies and other public authorities. PART III  THE BOARD",
            "description": "In the discharge of its functions under this Act, the Commission shall, subject to the provisions of this Act, so far as practicable, co-operate fully with all Ministries, L.R.O. 1/2012 LAWS OF GUYANA 10 Cap. 59:05 Guyana Lands and Surveys Commission   L.R.O. 1/2012          The Board.             Schedule.     Committee of the Board.          The Commissioner.                 Government departments and agencies and other public authorities. PART III  THE BOARD"
        }
    },
    {
        "act": "GUYANA LANDS AND SURVEYS COMMISSION ACT",
        "source": "https://mola.gov.gy/laws-of-guyana",
        "type": {
            "name": "section",
            "representation": "7",
            "title": "The Board. ",
            "context": "GUYANA LANDS AND SURVEYS COMMISSION ACT under The Board. 7. (1) The governing body of the Commission shall be the Board which shall be responsible for the discharge of the functions of the Commission.  (2) The provisions of the Schedule shall have effect as to the constitution and procedure of the Board and otherwise in relation thereto.",
            "description": [
                {
                    "representation": "(1)",
                    "description": "The governing body of the Commission shall be the Board which shall be responsible for the discharge of the functions of the Commission."
                },
                {
                    "representation": "(2)",
                    "description": "The provisions of the Schedule shall have effect as to the constitution and procedure of the Board and otherwise in relation thereto."
                }
            ]
        }
    },
    {
        "act": "GUYANA LANDS AND SURVEYS COMMISSION ACT",
        "source": "https://mola.gov.gy/laws-of-guyana",
        "type": {
            "name": "section",
            "representation": "8",
            "title": "Committees of the Board.  PART IV MANAGEMENT AND STAFF OF THE COMMISSION  ",
            "context": "GUYANA LANDS AND SURVEYS COMMISSION ACT under Committees of the Board.  PART IV MANAGEMENT AND STAFF OF THE COMMISSION  8. The Board may, for the discharge of the functions of the Commission, appoint Committees of the Board comprising members of the Board or non-members and may assign to them   such functions as the Board may determine.  PART IV  MANAGEMENT AND STAFF OF THE COMMISSION",
            "description": "The Board may, for the discharge of the functions of the Commission, appoint Committees of the Board comprising members of the Board or non-members and may assign to them   such functions as the Board may determine.  PART IV  MANAGEMENT AND STAFF OF THE COMMISSION"
        }
    },
    {
        "act": "GUYANA LANDS AND SURVEYS COMMISSION ACT",
        "source": "https://mola.gov.gy/laws-of-guyana",
        "type": {
            "name": "section",
            "representation": "9",
            "title": "The Commissioner. ",
            "context": "GUYANA LANDS AND SURVEYS COMMISSION ACT under The Commissioner. 9. (1) The Commissioner, to be appointed by the Minister, shall be the Chief Executive Officer of the Commission and, subject to any general or special directions of the Board    (a)     shall be responsible for the execution of the policy of the Commission and answerable therefor to the Board; and  (b)     shall be charged with the direction of the day-to-day business of the Commission and of its administration and the organisation and control of all the employees of the Commission. LAWS OF GUYANA Guyana Lands and Surveys Commission Cap. 59:05 11  L.R.O. 1/2012              Staff of the Commission.                 Board members not to sponsor appointments.         Secretary.             (2) The Commissioner may delegate to an officer of the Commission any of his functions under this Act and may impose such conditions with respect to the exercise of such delegated functions as he may think fit, but nothing in this subsection shall be construed so as to absolve the Commissioner from ultimate responsibility for any act done by such officer in pursuance of any such delegation.",
            "description": [
                {
                    "representation": "(1)",
                    "description": "The Commissioner, to be appointed by the Minister, shall be the Chief Executive Officer of the Commission and, subject to any general or special directions of the Board"
                },
                {
                    "representation": "(a)",
                    "description": "shall be responsible for the execution of the policy of the Commission and answerable therefor to the Board; and"
                },
                {
                    "representation": "(b)",
                    "description": "shall be charged with the direction of the day-to-day business of the Commission and of its administration and the organisation and control of all the employees of the Commission. LAWS OF GUYANA Guyana Lands and Surveys Commission Cap. 59:05 11  L.R.O. 1/2012              Staff of the Commission.                 Board members not to sponsor appointments.         Secretary."
                },
                {
                    "representation": "(2)",
                    "description": "The Commissioner may delegate to an officer of the Commission any of his functions under this Act and may impose such conditions with respect to the exercise of such delegated functions as he may think fit, but nothing in this subsection shall be construed so as to absolve the Commissioner from ultimate responsibility for any act done by such officer in pursuance of any such delegation."
                }
            ]
        }
    },
    {
        "act": "GUYANA LANDS AND SURVEYS COMMISSION ACT",
        "source": "https://mola.gov.gy/laws-of-guyana",
        "type": {
            "name": "section",
            "representation": "10",
            "title": "Staff of the Commission. ",
            "context": "GUYANA LANDS AND SURVEYS COMMISSION ACT under Staff of the Commission. 10.  (1) The Commission may, from time to time, engage such employees as may  be  necessary  for  the  proper  and  efficient  discharge  of the functions  of  the Commission.   (2) The Commission may engage the services of such consultants and advisers as the Board may, upon the recommendations of the Commissioner, determine.  (3) The employees, consultants and advisers of the Commission shall be engaged on such terms and conditions as the Board may, on the recommendations of the Commissioner, determine.",
            "description": [
                {
                    "representation": "(1)",
                    "description": "The Commission may, from time to time, engage such employees as may  be  necessary  for  the  proper  and  efficient  discharge  of the functions  of  the Commission."
                },
                {
                    "representation": "(2)",
                    "description": "The Commission may engage the services of such consultants and advisers as the Board may, upon the recommendations of the Commissioner, determine."
                },
                {
                    "representation": "(3)",
                    "description": "The employees, consultants and advisers of the Commission shall be engaged on such terms and conditions as the Board may, on the recommendations of the Commissioner, determine."
                }
            ]
        }
    },
    {
        "act": "GUYANA LANDS AND SURVEYS COMMISSION ACT",
        "source": "https://mola.gov.gy/laws-of-guyana",
        "type": {
            "name": "section",
            "representation": "11",
            "title": "Board members not to sponsor appointments. ",
            "context": "GUYANA LANDS AND SURVEYS COMMISSION ACT under Board members not to sponsor appointments. 11. No member of the Board shall personally sponsor or recommend any application for the employment of any person under this Act and any Board member who infringes this section shall be liable to be removed from the Board.",
            "description": "No member of the Board shall personally sponsor or recommend any application for the employment of any person under this Act and any Board member who infringes this section shall be liable to be removed from the Board."
        }
    },
    {
        "act": "GUYANA LANDS AND SURVEYS COMMISSION ACT",
        "source": "https://mola.gov.gy/laws-of-guyana",
        "type": {
            "name": "section",
            "representation": "12",
            "title": "Secretary. ",
            "context": "GUYANA LANDS AND SURVEYS COMMISSION ACT under Secretary. 12. (1) There shall be a Secretary of the Board.   (2) The Secretary shall act as Secretary to the Board at its meetings and shall, subject to the directions of the Board, arrange the business for and cause to be recorded and kept the minutes of the meetings of the Board.  (3) The Secretary shall also perform such functions as the Board may by writing direct or as the Commissioner  may by writing delegate to him and shall be assisted in his LAWS OF GUYANA 12 Cap. 59:05 Guyana Lands and Surveys Commission   L.R.O. 1/2012       Internal Auditor.                                           Private work by surveyors employed by  the Commission.     functions by such of the employees of the Commission as the Board may, on the recommendations of the Commissioner, direct.",
            "description": [
                {
                    "representation": "(1)",
                    "description": "There shall be a Secretary of the Board."
                },
                {
                    "representation": "(2)",
                    "description": "The Secretary shall act as Secretary to the Board at its meetings and shall, subject to the directions of the Board, arrange the business for and cause to be recorded and kept the minutes of the meetings of the Board."
                },
                {
                    "representation": "(3)",
                    "description": "The Secretary shall also perform such functions as the Board may by writing direct or as the Commissioner  may by writing delegate to him and shall be assisted in his LAWS OF GUYANA 12 Cap. 59:05 Guyana Lands and Surveys Commission   L.R.O. 1/2012       Internal Auditor.                                           Private work by surveyors employed by  the Commission.     functions by such of the employees of the Commission as the Board may, on the recommendations of the Commissioner, direct."
                }
            ]
        }
    },
    {
        "act": "GUYANA LANDS AND SURVEYS COMMISSION ACT",
        "source": "https://mola.gov.gy/laws-of-guyana",
        "type": {
            "name": "section",
            "representation": "13",
            "title": "Internal Auditor. ",
            "context": "GUYANA LANDS AND SURVEYS COMMISSION ACT under Internal Auditor. 13. (1) The Commission shall have an Internal Auditor.  (2) Subject to the provisions of this Act, the Internal Auditor shall be responsible to the Commissioner for the performance of his functions.  (3) As part of his functions under this Act, the Internal Auditor shall, at intervals of three months, prepare a report on the internal audit work carried out by him during the period of three months immediately preceding the preparation of the report, and submit the report to the Commissioner.  (4) Without prejudice to the provisions of subsection (3), the Internal Auditor shall make in each report such observations as appear to him necessary as to the conduct of the financial affairs of the Commission during the period to which the report relates.  (5) The Internal Auditor shall send a copy of each report prepared by him under this section to the Minister and also to the Minister of Finance, the Auditor-General and the Chairman and each of the other members of the Board.",
            "description": [
                {
                    "representation": "(1)",
                    "description": "The Commission shall have an Internal Auditor."
                },
                {
                    "representation": "(2)",
                    "description": "Subject to the provisions of this Act, the Internal Auditor shall be responsible to the Commissioner for the performance of his functions."
                },
                {
                    "representation": "(3)",
                    "description": "As part of his functions under this Act, the Internal Auditor shall, at intervals of three months, prepare a report on the internal audit work carried out by him during the period of three months immediately preceding the preparation of the report, and submit the report to the Commissioner."
                },
                {
                    "representation": "(4)",
                    "description": "Without prejudice to the provisions of subsection"
                },
                {
                    "representation": "(5)",
                    "description": "The Internal Auditor shall send a copy of each report prepared by him under this section to the Minister and also to the Minister of Finance, the Auditor-General and the Chairman and each of the other members of the Board."
                }
            ]
        }
    },
    {
        "act": "GUYANA LANDS AND SURVEYS COMMISSION ACT",
        "source": "https://mola.gov.gy/laws-of-guyana",
        "type": {
            "name": "section",
            "representation": "14",
            "title": "Private work by surveyors employed by the Commission. ",
            "context": "GUYANA LANDS AND SURVEYS COMMISSION ACT under Private work by surveyors employed by the Commission. 14. (1) A land surveyor employed by the Commission may with the approval of the Commission, make a survey of land for any private person during any time outside his normal working hours for which the land surveyor shall not claim payment from the Commission.   (2) Where   the   Commissioner   of   Inland   LAWS OF GUYANA Guyana Lands and Surveys Commission Cap. 59:05 13  L.R.O. 1/2012          Officers not to engage in business when on duty.             Funds and resources of the Commission.                         Revenue   so   directs,   the Commission shall furnish to the Commissioner of Inland Revenue any information from its records concerning private land surveys carried out by a land surveyor employed  by the Commission pursuant to subsection (1).",
            "description": [
                {
                    "representation": "(1)",
                    "description": "A land surveyor employed by the Commission may with the approval of the Commission, make a survey of land for any private person during any time outside his normal working hours for which the land surveyor shall not claim payment from the Commission."
                },
                {
                    "representation": "(2)",
                    "description": "Where   the   Commissioner   of   Inland   LAWS OF GUYANA Guyana Lands and Surveys Commission Cap. 59:05 13  L.R.O. 1/2012          Officers not to engage in business when on duty.             Funds and resources of the Commission.                         Revenue   so   directs,   the Commission shall furnish to the Commissioner of Inland Revenue any information from its records concerning private land surveys carried out by a land surveyor employed  by the Commission pursuant to subsection"
                }
            ]
        }
    },
    {
        "act": "GUYANA LANDS AND SURVEYS COMMISSION ACT",
        "source": "https://mola.gov.gy/laws-of-guyana",
        "type": {
            "name": "section",
            "representation": "15",
            "title": "Officers not to engage in business when on duty.   LAWS OF GUYANA 4 Cap. 59:05 Guyana Lands and Surveys Commission   L.R.O. 1/2012  SECTION PART V  FINANCIAL PROVISIONS                ",
            "context": "GUYANA LANDS AND SURVEYS COMMISSION ACT under Officers not to engage in business when on duty.   LAWS OF GUYANA 4 Cap. 59:05 Guyana Lands and Surveys Commission   L.R.O. 1/2012  SECTION PART V  FINANCIAL PROVISIONS                15. Subject to section (14), a land surveyor or any other officer or employee of the Commission may not undertake any other work or receive a fee for any other work executed during any time or times in relation to which that land surveyor, officer or employee claims payment or is in receipt of remuneration from the Commission.  PART V  FINANCIAL PROVISIONS",
            "description": "Subject to section (14), a land surveyor or any other officer or employee of the Commission may not undertake any other work or receive a fee for any other work executed during any time or times in relation to which that land surveyor, officer or employee claims payment or is in receipt of remuneration from the Commission.  PART V  FINANCIAL PROVISIONS"
        }
    },
    {
        "act": "GUYANA LANDS AND SURVEYS COMMISSION ACT",
        "source": "https://mola.gov.gy/laws-of-guyana",
        "type": {
            "name": "section",
            "representation": "16",
            "title": "Funds and resources of the Commission. ",
            "context": "GUYANA LANDS AND SURVEYS COMMISSION ACT under Funds and resources of the Commission. 16. (1) The funds and resources of the Commission shall consist of   (a)     any sums appropriated by Parliament for the purposes of the Commission;  (b) any  sums  donated  to  the  Commission  by  way  of grants, gifts, bequests, donations by foreign    States, International Organisations, multilateral funding agencies, private individuals, foundations, corporations or other entities;  (c) any  money  paid  to  the  Commission  by  way  of  proceeds from the sale or rental of public lands, or by way of administrative fees, service charges, penalties or fines and all other revenues which may become payable to the Commission  pursuant  LAWS OF GUYANA 14 Cap. 59:05 Guyana Lands and Surveys Commission   L.R.O. 1/2012                                                 to the provisions  of any written law;  (d)      any sums allocated to the Commission  from loan funds;  (e) all trading income or monies earned or arising from any property,  investments, mortgages and debentures acquired by or vested in the Commission;  (f) any  sums  borrowed  by  the  Commission  for  the purpose  of meeting   any  of  its  obligations   or discharging any of its functions under this Act;  (g) all other sums payable or property which may in any manner become payable to or vested in the Commission in respect of any matter incidental to its functions.  (2) Where there is a deficiency in the funds of the Commission that deficiency shall be met out of monies provided by Parliament.  (3) No grant, gift, bequest or donation shall be accepted by the commission without the approval of the Minister.  (4) The charges on any amount which may be allocated to the Commission from loan funds shall be met by the Commission except that all or any part of such charges may be met out of monies provided by Parliament.  LAWS OF GUYANA Guyana Lands and Surveys Commission Cap. 59:05 15  L.R.O. 1/2012       Financial duties as to the conduct of activities.       Estimates and income of expenditure.      General fund.                Capital reserve fund.     Reserve fund.          (5) In this section loan funds means any sums made available from time to time to the Government by way of a loan.",
            "description": [
                {
                    "representation": "(1)",
                    "description": "The funds and resources of the Commission shall consist of"
                },
                {
                    "representation": "(a)",
                    "description": "any sums appropriated by Parliament for the purposes of the Commission;"
                },
                {
                    "representation": "(b)",
                    "description": "any  sums  donated  to  the  Commission  by  way  of grants, gifts, bequests, donations by foreign    States, International Organisations, multilateral funding agencies, private individuals, foundations, corporations or other entities;"
                },
                {
                    "representation": "(c)",
                    "description": "any  money  paid  to  the  Commission  by  way  of  proceeds from the sale or rental of public lands, or by way of administrative fees, service charges, penalties or fines and all other revenues which may become payable to the Commission  pursuant  LAWS OF GUYANA 14 Cap. 59:05 Guyana Lands and Surveys Commission   L.R.O. 1/2012                                                 to the provisions  of any written law;"
                },
                {
                    "representation": "(d)",
                    "description": "any sums allocated to the Commission  from loan funds;"
                },
                {
                    "representation": "(e)",
                    "description": "all trading income or monies earned or arising from any property,  investments, mortgages and debentures acquired by or vested in the Commission;"
                },
                {
                    "representation": "(f)",
                    "description": "any  sums  borrowed  by  the  Commission  for  the purpose  of meeting   any  of  its  obligations   or discharging any of its functions under this Act;"
                },
                {
                    "representation": "(g)",
                    "description": "all other sums payable or property which may in any manner become payable to or vested in the Commission in respect of any matter incidental to its functions."
                },
                {
                    "representation": "(2)",
                    "description": "Where there is a deficiency in the funds of the Commission that deficiency shall be met out of monies provided by Parliament."
                },
                {
                    "representation": "(3)",
                    "description": "No grant, gift, bequest or donation shall be accepted by the commission without the approval of the Minister."
                },
                {
                    "representation": "(4)",
                    "description": "The charges on any amount which may be allocated to the Commission from loan funds shall be met by the Commission except that all or any part of such charges may be met out of monies provided by Parliament.  LAWS OF GUYANA Guyana Lands and Surveys Commission Cap. 59:05 15  L.R.O. 1/2012       Financial duties as to the conduct of activities.       Estimates and income of expenditure.      General fund.                Capital reserve fund.     Reserve fund."
                },
                {
                    "representation": "(5)",
                    "description": "In this section loan funds means any sums made available from time to time to the Government by way of a loan."
                }
            ]
        }
    },
    {
        "act": "GUYANA LANDS AND SURVEYS COMMISSION ACT",
        "source": "https://mola.gov.gy/laws-of-guyana",
        "type": {
            "name": "section",
            "representation": "17",
            "title": "Financial duties as to the conduct of activities. ",
            "context": "GUYANA LANDS AND SURVEYS COMMISSION ACT under Financial duties as to the conduct of activities. 17. The Commission shall conduct its affairs so as to secure that its revenues become at the earliest possible date, and continue  thereafter, at least sufficient to enable it to meet its obligations and to discharge its functions under this Act and to derive surplus revenues.",
            "description": "The Commission shall conduct its affairs so as to secure that its revenues become at the earliest possible date, and continue  thereafter, at least sufficient to enable it to meet its obligations and to discharge its functions under this Act and to derive surplus revenues."
        }
    },
    {
        "act": "GUYANA LANDS AND SURVEYS COMMISSION ACT",
        "source": "https://mola.gov.gy/laws-of-guyana",
        "type": {
            "name": "section",
            "representation": "18",
            "title": "Estimates and income of expenditure. ",
            "context": "GUYANA LANDS AND SURVEYS COMMISSION ACT under Estimates and income of expenditure. 18. The Commission shall prepare and submit estimates of its projected revenues and expenditure for the next following financial year to the Minister who shall submit them to the Minister of Finance with such modifications thereto, if any, as he considers necessary.",
            "description": "The Commission shall prepare and submit estimates of its projected revenues and expenditure for the next following financial year to the Minister who shall submit them to the Minister of Finance with such modifications thereto, if any, as he considers necessary."
        }
    },
    {
        "act": "GUYANA LANDS AND SURVEYS COMMISSION ACT",
        "source": "https://mola.gov.gy/laws-of-guyana",
        "type": {
            "name": "section",
            "representation": "19",
            "title": "General fund. ",
            "context": "GUYANA LANDS AND SURVEYS COMMISSION ACT under General fund. 19. The Commission shall maintain a general fund into which shall be paid all such monies as may, from time to time, be placed at the disposal of the Commission for the purposes of this Act by Parliament, and   any   other   monies   lawfully   paid   to   the Commission; and out of this fund shall be met all the expenses incurred by the Commission in carrying out its functions under this Act and all other liabilities properly incurred by the Commission.",
            "description": "The Commission shall maintain a general fund into which shall be paid all such monies as may, from time to time, be placed at the disposal of the Commission for the purposes of this Act by Parliament, and   any   other   monies   lawfully   paid   to   the Commission; and out of this fund shall be met all the expenses incurred by the Commission in carrying out its functions under this Act and all other liabilities properly incurred by the Commission."
        }
    },
    {
        "act": "GUYANA LANDS AND SURVEYS COMMISSION ACT",
        "source": "https://mola.gov.gy/laws-of-guyana",
        "type": {
            "name": "section",
            "representation": "20",
            "title": "Capital Reserve Fund. ",
            "context": "GUYANA LANDS AND SURVEYS COMMISSION ACT under Capital Reserve Fund. 20. The Commission shall maintain in a capital reserve fund a  sum equal to the capital value of the assets transferred to and vested in the Commission pursuant to section 42 (1).",
            "description": "The Commission shall maintain in a capital reserve fund a  sum equal to the capital value of the assets transferred to and vested in the Commission pursuant to section 42 (1)."
        }
    },
    {
        "act": "GUYANA LANDS AND SURVEYS COMMISSION ACT",
        "source": "https://mola.gov.gy/laws-of-guyana",
        "type": {
            "name": "section",
            "representation": "21",
            "title": "Reserve fund. ",
            "context": "GUYANA LANDS AND SURVEYS COMMISSION ACT under Reserve fund. 21. (1) The Commission shall maintain a reserve fund and shall, out of the net surplus for each financial year, transfer to that fund a sum equal to not less than such sum as may be fixed by the Minister.  (2) Subject to subsection (3), if the reserve fund is in any year insufficient to cover any net loss of the Commission recorded in its Profit and Loss Account, an LAWS OF GUYANA 16 Cap. 59:05 Guyana Lands and Surveys Commission   L.R.O. 1/2012                                 Estimates of expenditure.                amount equal to the deficiency is hereby charged on the Consolidated Fund.  (3) If in any succeeding year any net surplus accrues to the Commission, there shall be paid into the Consolidated Fund by the Commission, from time to time, a sum agreed with the Minister of Finance, together with interest thereon at a rate to be determined by the Minister of Finance until the amount is fully repaid.  (4) For the purposes of this section, net surplus shall be determined by deducting from gross income all expenses together with allowances for depreciation of assets, contributions to staff benefit funds, provision for bad and doubtful debts and the other contingencies and accounting provisions that are usually made by comparable institutions.  (5) If the reserve fund in any financial  year  exceeds a sum that may be fixed by the Minister,  the Minister  of Finance  may, by order, subject to affirmative resolution of the National Assembly, require the whole or any part of the excess to be paid into the Consolidated Fund.",
            "description": [
                {
                    "representation": "(1)",
                    "description": "The Commission shall maintain a reserve fund and shall, out of the net surplus for each financial year, transfer to that fund a sum equal to not less than such sum as may be fixed by the Minister."
                },
                {
                    "representation": "(2)",
                    "description": "Subject to subsection"
                },
                {
                    "representation": "(3)",
                    "description": "If in any succeeding year any net surplus accrues to the Commission, there shall be paid into the Consolidated Fund by the Commission, from time to time, a sum agreed with the Minister of Finance, together with interest thereon at a rate to be determined by the Minister of Finance until the amount is fully repaid."
                },
                {
                    "representation": "(4)",
                    "description": "For the purposes of this section, net surplus shall be determined by deducting from gross income all expenses together with allowances for depreciation of assets, contributions to staff benefit funds, provision for bad and doubtful debts and the other contingencies and accounting provisions that are usually made by comparable institutions."
                },
                {
                    "representation": "(5)",
                    "description": "If the reserve fund in any financial  year  exceeds a sum that may be fixed by the Minister,  the Minister  of Finance  may, by order, subject to affirmative resolution of the National Assembly, require the whole or any part of the excess to be paid into the Consolidated Fund."
                }
            ]
        }
    },
    {
        "act": "GUYANA LANDS AND SURVEYS COMMISSION ACT",
        "source": "https://mola.gov.gy/laws-of-guyana",
        "type": {
            "name": "section",
            "representation": "22",
            "title": "Estimates of expenditure. ",
            "context": "GUYANA LANDS AND SURVEYS COMMISSION ACT under Estimates of expenditure. 22. The Commission may from its funds make payments to meet all expenses properly incurred by it for the purposes of the exercise or discharge of its functions and may without prejudice to the generality of the  foregoing, pay for -  (a)  the recurrent  expenses of the Commission including the remuneration of members of the Board and personnel thereof; and  (b)     the capital expenses, including  the cost of purchasing, maintenance and   insurance  of movable and immovable LAWS OF GUYANA Guyana Lands and Surveys Commission Cap. 59:05 17  L.R.O. 1/2012     Rules for financial operations.                                             property of, or under the control of the Commission.",
            "description": [
                {
                    "representation": "(a)",
                    "description": "the recurrent  expenses of the Commission including the remuneration of members of the Board and personnel thereof; and"
                },
                {
                    "representation": "(b)",
                    "description": "the capital expenses, including  the cost of purchasing, maintenance and   insurance  of movable and immovable LAWS OF GUYANA Guyana Lands and Surveys Commission Cap. 59:05 17  L.R.O. 1/2012     Rules for financial operations.                                             property of, or under the control of the Commission."
                }
            ]
        }
    },
    {
        "act": "GUYANA LANDS AND SURVEYS COMMISSION ACT",
        "source": "https://mola.gov.gy/laws-of-guyana",
        "type": {
            "name": "section",
            "representation": "23",
            "title": "Rules for financial operations. ",
            "context": "GUYANA LANDS AND SURVEYS COMMISSION ACT under Rules for financial operations. 23. (1) For the purposes of regulating and controlling the financial operations of the  Commission,  the  Board  may,  with  the  approval  of the  Minister,  make  rules generally with respect to matters necessary for the proper keeping   and control of the finances of the Commission.  (2) Without  prejudice  to the  generality  of subsection  (1), rules  made thereunder may   (a) prescribe  the manner in which and the officers by whom payments are to be approved;  (b) indicate   the   bank   into   which   monies   of the Commission are to be paid and the designation of any account with the bank;  (c) prescribe the sum to be  retained by the accounting officer to meet petty disbursements  and immediate payments  and  the  maximum  sum that may be so disbursed for any one payment;  (d) prescribe the method to  be adopted in making payments out of the funds of the Commission; and  (e) prescribe the level of authority required to write off bad and doubtful debts.   LAWS OF GUYANA 18 Cap. 59:05 Guyana Lands and Surveys Commission   L.R.O. 1/2012  Borrowing powers.                   Treasury guarantees of loans.",
            "description": [
                {
                    "representation": "(1)",
                    "description": "For the purposes of regulating and controlling the financial operations of the  Commission,  the  Board  may,  with  the  approval  of the  Minister,  make  rules generally with respect to matters necessary for the proper keeping   and control of the finances of the Commission."
                },
                {
                    "representation": "(2)",
                    "description": "Without  prejudice  to the  generality  of subsection"
                },
                {
                    "representation": "(a)",
                    "description": "prescribe  the manner in which and the officers by whom payments are to be approved;"
                },
                {
                    "representation": "(b)",
                    "description": "indicate   the   bank   into   which   monies   of the Commission are to be paid and the designation of any account with the bank;"
                },
                {
                    "representation": "(c)",
                    "description": "prescribe the sum to be  retained by the accounting officer to meet petty disbursements  and immediate payments  and  the  maximum  sum that may be so disbursed for any one payment;"
                },
                {
                    "representation": "(d)",
                    "description": "prescribe the method to  be adopted in making payments out of the funds of the Commission; and"
                },
                {
                    "representation": "(e)",
                    "description": "prescribe the level of authority required to write off bad and doubtful debts.   LAWS OF GUYANA 18 Cap. 59:05 Guyana Lands and Surveys Commission   L.R.O. 1/2012  Borrowing powers.                   Treasury guarantees of loans."
                }
            ]
        }
    },
    {
        "act": "GUYANA LANDS AND SURVEYS COMMISSION ACT",
        "source": "https://mola.gov.gy/laws-of-guyana",
        "type": {
            "name": "section",
            "representation": "24",
            "title": "Borrowing powers. ",
            "context": "GUYANA LANDS AND SURVEYS COMMISSION ACT under Borrowing powers. 24. (1) The Commission may, with the approval of the Minister of Finance, borrow on the security of its assets any sums required by the Commission for meeting its current obligations or carrying out any of its functions under this Act.  (2) The Commission may, from time to time, borrow by way of overdraft or unsecured borrowings for periods not exceeding twelve months any sums required for meeting  its obligations  or discharging  its functions under this Act, provided that the Commission shall  not exceed  any  limit of borrowings  under  this  subsection  that  is imposed by the Minister of Finance.",
            "description": [
                {
                    "representation": "(1)",
                    "description": "The Commission may, with the approval of the Minister of Finance, borrow on the security of its assets any sums required by the Commission for meeting its current obligations or carrying out any of its functions under this Act."
                },
                {
                    "representation": "(2)",
                    "description": "The Commission may, from time to time, borrow by way of overdraft or unsecured borrowings for periods not exceeding twelve months any sums required for meeting  its obligations  or discharging  its functions under this Act, provided that the Commission shall  not exceed  any  limit of borrowings  under  this  subsection  that  is imposed by the Minister of Finance."
                }
            ]
        }
    },
    {
        "act": "GUYANA LANDS AND SURVEYS COMMISSION ACT",
        "source": "https://mola.gov.gy/laws-of-guyana",
        "type": {
            "name": "section",
            "representation": "25",
            "title": "Treasury guarantees of loans. ",
            "context": "GUYANA LANDS AND SURVEYS COMMISSION ACT under Treasury guarantees of loans. 25. (1) The  Minister  of  Finance  may,  with  the  approval  of  the  National Assembly, guarantee in a manner and on any conditions as the Minister  of  Finance  may think fit the payment of the principal and interest on any authorised borrowings of the Commission.  (2) Where the Minister of Finance is satisfied that there has been a default in the payment of any principal monies or interest guaranteed under this section, he shall direct the repayment out of the revenues of Guyana of the amount in respect of which there has been such default.  (3) The Commission shall make to the Accountant General at the time and in the manner that the Minister of Finance may direct, payments of any amounts as may be so directed in or towards repayment of any sum issued in fulfilment of any guarantee given under this section, and payments of interest on what is outstanding for the time being in respect of any sums so issued at the rate that the Minister of Finance may direct and different rates of interests may be directed as respects different sums and as respects interest for different periods.  LAWS OF GUYANA Guyana Lands and Surveys Commission Cap. 59:05 19  L.R.O. 1/2012 Investment of funds.             Exemption  from taxation.      Accounts and audit.",
            "description": [
                {
                    "representation": "(1)",
                    "description": "The  Minister  of  Finance  may,  with  the  approval  of  the  National Assembly, guarantee in a manner and on any conditions as the Minister  of  Finance  may think fit the payment of the principal and interest on any authorised borrowings of the Commission."
                },
                {
                    "representation": "(2)",
                    "description": "Where the Minister of Finance is satisfied that there has been a default in the payment of any principal monies or interest guaranteed under this section, he shall direct the repayment out of the revenues of Guyana of the amount in respect of which there has been such default."
                },
                {
                    "representation": "(3)",
                    "description": "The Commission shall make to the Accountant General at the time and in the manner that the Minister of Finance may direct, payments of any amounts as may be so directed in or towards repayment of any sum issued in fulfilment of any guarantee given under this section, and payments of interest on what is outstanding for the time being in respect of any sums so issued at the rate that the Minister of Finance may direct and different rates of interests may be directed as respects different sums and as respects interest for different periods.  LAWS OF GUYANA Guyana Lands and Surveys Commission Cap. 59:05 19  L.R.O. 1/2012 Investment of funds.             Exemption  from taxation.      Accounts and audit."
                }
            ]
        }
    },
    {
        "act": "GUYANA LANDS AND SURVEYS COMMISSION ACT",
        "source": "https://mola.gov.gy/laws-of-guyana",
        "type": {
            "name": "section",
            "representation": "26",
            "title": "Investment of funds. ",
            "context": "GUYANA LANDS AND SURVEYS COMMISSION ACT under Investment of funds. 26. Funds of the Commission not immediately required to be expended in the meeting of any obligations or the discharge of any functions of the Commission under this Act may be invested, from time to time, in securities approved by the Minister of Finance for investment by the Commission and the Commission may, from time to time, with the like approval, sell any or all of those securities.",
            "description": "Funds of the Commission not immediately required to be expended in the meeting of any obligations or the discharge of any functions of the Commission under this Act may be invested, from time to time, in securities approved by the Minister of Finance for investment by the Commission and the Commission may, from time to time, with the like approval, sell any or all of those securities."
        }
    },
    {
        "act": "GUYANA LANDS AND SURVEYS COMMISSION ACT",
        "source": "https://mola.gov.gy/laws-of-guyana",
        "type": {
            "name": "section",
            "representation": "27",
            "title": "Exemption from taxation. ",
            "context": "GUYANA LANDS AND SURVEYS COMMISSION ACT under Exemption from taxation. 27. The Commission shall be exempt from, the payment of customs duty, consumption tax, capital gains tax, corporation tax, income tax, property tax, purchase tax or any other duty or tax whatever.",
            "description": "The Commission shall be exempt from, the payment of customs duty, consumption tax, capital gains tax, corporation tax, income tax, property tax, purchase tax or any other duty or tax whatever."
        }
    },
    {
        "act": "GUYANA LANDS AND SURVEYS COMMISSION ACT",
        "source": "https://mola.gov.gy/laws-of-guyana",
        "type": {
            "name": "section",
            "representation": "28",
            "title": "Accounts and audit. ",
            "context": "GUYANA LANDS AND SURVEYS COMMISSION ACT under Accounts and audit. 28. (1) The Commission shall keep proper books of account and records and such books and records shall be in such form as the Auditor-General may determine.   (2) The books and accounts of the Commission shall, within three months after the end of each financial year of the Commission, be audited by the Auditor-General or by an auditor authorised by him.  (3) The  members  of  the  Board,  officers  and  other  employees  of  the Commission shall  grant to the Auditor-General or the auditor appointed  to audit the accounts of the Commission under subsection  (2) access to all books, documents, cash and securities of the Commission and shall give to the Auditor-General or the auditor on request all  information  within  their  knowledge  in relation  to the  operations  of  the Commission.  (4) The Auditor-General or an auditor appointed under this section shall have power to summon and examine all persons whom the Auditor-General or the auditor thinks fit to examine for the purposes of obtaining information in connection with the examination and audit of the accounts of the Commission and respecting all other matters and things LAWS OF GUYANA 20 Cap. 59:05 Guyana Lands and Surveys Commission   L.R.O. 1/2012                             Bad and doubtful debts.           Powers of the Minister to give directions to the Commission.            whatever necessary for the due performance of the functions vested in the Auditor-General or the auditor.  (5) Where a person summoned under subsection (4) is not a public officer or an officer or other employee of the Commission such person shall be entitled to payment for attendance upon the Auditor-General or the auditor as if he were a witness attending a legal proceeding in obedience to a summons issued at the instance of the State.  (6) Any person summoned under subsection (4) who, without reasonable excuse, makes default in obeying the summons commits an offence under this Act and is liable on summary conviction to a fine of not less than twenty thousand dollars nor more than forty thousand dollars or to imprisonment for eighteen months.",
            "description": [
                {
                    "representation": "(1)",
                    "description": "The Commission shall keep proper books of account and records and such books and records shall be in such form as the Auditor-General may determine."
                },
                {
                    "representation": "(2)",
                    "description": "access to all books, documents, cash and securities of the Commission and shall give to the Auditor-General or the auditor on request all  information  within  their  knowledge  in relation  to the  operations  of  the Commission."
                },
                {
                    "representation": "(3)",
                    "description": "The  members  of  the  Board,  officers  and  other  employees  of  the Commission shall  grant to the Auditor-General or the auditor appointed  to audit the accounts of the Commission under subsection"
                },
                {
                    "representation": "(4)",
                    "description": "who, without reasonable excuse, makes default in obeying the summons commits an offence under this Act and is liable on summary conviction to a fine of not less than twenty thousand dollars nor more than forty thousand dollars or to imprisonment for eighteen months."
                },
                {
                    "representation": "(5)",
                    "description": "Where a person summoned under subsection"
                },
                {
                    "representation": "(6)",
                    "description": "Any person summoned under subsection"
                }
            ]
        }
    },
    {
        "act": "GUYANA LANDS AND SURVEYS COMMISSION ACT",
        "source": "https://mola.gov.gy/laws-of-guyana",
        "type": {
            "name": "section",
            "representation": "29",
            "title": "Bad and doubtful debts.  PART VI  GENERAL  ",
            "context": "GUYANA LANDS AND SURVEYS COMMISSION ACT under Bad and doubtful debts.  PART VI  GENERAL  29. The Commission may write off bad and doubtful debts.  PART VI  GENERAL",
            "description": "The Commission may write off bad and doubtful debts.  PART VI  GENERAL"
        }
    },
    {
        "act": "GUYANA LANDS AND SURVEYS COMMISSION ACT",
        "source": "https://mola.gov.gy/laws-of-guyana",
        "type": {
            "name": "section",
            "representation": "30",
            "title": "Powers of the Minister to give directions to the Commission. ",
            "context": "GUYANA LANDS AND SURVEYS COMMISSION ACT under Powers of the Minister to give directions to the Commission. 30. (1) The Minister may give to the Commission in writing directions of a general character not being inconsistent with the provisions of this Act or with the contractual or other legal obligations of the Commission relating to the exercise by the Commission of its functions under this Act and the Commission shall give effect to such directions.   (2) In  carrying  out  measures  of  re-organisation  or development  works which  involve  a  substantial  outlay  on capital  account,  the  Commission  shall  act  in accordance with a general programme approved, from time to time, by the Minister. LAWS OF GUYANA Guyana Lands and Surveys Commission Cap. 59:05 21  L.R.O. 1/2012                                Participation in commercial operations.                              (3) The Commission shall furnish to the Minister any information the Minister may request with respect to the business of the Commission and such returns as the Minister may require.  (4) The Commission shall also furnish to the Minister such facilities as to enable the verification of information furnished pursuant to this section.  (5) The power of the Minister to give directions to the Commission under this section shall extend to giving the Commission directions as to   (a) the disposal of capital assets; and  (b) the application of the proceeds of such disposal,  and any direction given under this subsection may require the whole or any part of the revenues of the Commission to be paid into the Consolidated Fund.",
            "description": [
                {
                    "representation": "(1)",
                    "description": "The Minister may give to the Commission in writing directions of a general character not being inconsistent with the provisions of this Act or with the contractual or other legal obligations of the Commission relating to the exercise by the Commission of its functions under this Act and the Commission shall give effect to such directions."
                },
                {
                    "representation": "(2)",
                    "description": "In  carrying  out  measures  of  re-organisation  or development  works which  involve  a  substantial  outlay  on capital  account,  the  Commission  shall  act  in accordance with a general programme approved, from time to time, by the Minister. LAWS OF GUYANA Guyana Lands and Surveys Commission Cap. 59:05 21  L.R.O. 1/2012                                Participation in commercial operations."
                },
                {
                    "representation": "(3)",
                    "description": "The Commission shall furnish to the Minister any information the Minister may request with respect to the business of the Commission and such returns as the Minister may require."
                },
                {
                    "representation": "(4)",
                    "description": "The Commission shall also furnish to the Minister such facilities as to enable the verification of information furnished pursuant to this section."
                },
                {
                    "representation": "(5)",
                    "description": "The power of the Minister to give directions to the Commission under this section shall extend to giving the Commission directions as to"
                },
                {
                    "representation": "(a)",
                    "description": "the disposal of capital assets; and"
                },
                {
                    "representation": "(b)",
                    "description": "the application of the proceeds of such disposal,  and any direction given under this subsection may require the whole or any part of the revenues of the Commission to be paid into the Consolidated Fund."
                }
            ]
        }
    },
    {
        "act": "GUYANA LANDS AND SURVEYS COMMISSION ACT",
        "source": "https://mola.gov.gy/laws-of-guyana",
        "type": {
            "name": "section",
            "representation": "31",
            "title": "Participation in commercial operations. ",
            "context": "GUYANA LANDS AND SURVEYS COMMISSION ACT under Participation in commercial operations. 31. The Commission may, with the approval of the Minister, enter into commercial operations regarding its land or buildings    (a)    any service developed in connection  with;  (b)   any product or by-product resulting from; and  (c) any intellectual property resulting from,  the exercise of its functions under this Act;  LAWS OF GUYANA 22 Cap. 59:05 Guyana Lands and Surveys Commission   L.R.O. 1/2012  Annual report.                                          Duty to provide information.         Information,  etc, obtained as member or co-opted member of Board, an",
            "description": [
                {
                    "representation": "(a)",
                    "description": "any service developed in connection  with;"
                },
                {
                    "representation": "(b)",
                    "description": "any product or by-product resulting from; and"
                },
                {
                    "representation": "(c)",
                    "description": "any intellectual property resulting from,  the exercise of its functions under this Act;  LAWS OF GUYANA 22 Cap. 59:05 Guyana Lands and Surveys Commission   L.R.O. 1/2012  Annual report.                                          Duty to provide information.         Information,  etc, obtained as member or co-opted member of Board, an"
                }
            ]
        }
    },
    {
        "act": "GUYANA LANDS AND SURVEYS COMMISSION ACT",
        "source": "https://mola.gov.gy/laws-of-guyana",
        "type": {
            "name": "section",
            "representation": "32",
            "title": "Annual report. ",
            "context": "GUYANA LANDS AND SURVEYS COMMISSION ACT under Annual report. 32. (1) The Commission shall, as soon as possible after the expiration of each financial year of the Commission but within six months after the termination of that year, cause to be submitted  to the  Minister  an  annual  report  of the  Commission  dealing generally with the operations of the Commission within that year which shall, without prejudice to the generality of the foregoing, include   (a) a copy of the audited accounts of the Commission together with the Auditor- Generals report thereon;  (b) a statement of all directions given to the Commission under section 30;  (c) each report submitted by the Internal Auditor under section 13 in relation to that financial year; and  (d)      such other information as the Minister may request.   (2) A copy of the annual report shall be forwarded by the Commission to the Minister who shall, as soon as possible after receiving the annual report, cause it to be laid before the National Assembly.",
            "description": [
                {
                    "representation": "(1)",
                    "description": "The Commission shall, as soon as possible after the expiration of each financial year of the Commission but within six months after the termination of that year, cause to be submitted  to the  Minister  an  annual  report  of the  Commission  dealing generally with the operations of the Commission within that year which shall, without prejudice to the generality of the foregoing, include"
                },
                {
                    "representation": "(a)",
                    "description": "a copy of the audited accounts of the Commission together with the Auditor- Generals report thereon;"
                },
                {
                    "representation": "(b)",
                    "description": "a statement of all directions given to the Commission under section 30;"
                },
                {
                    "representation": "(c)",
                    "description": "each report submitted by the Internal Auditor under section 13 in relation to that financial year; and"
                },
                {
                    "representation": "(d)",
                    "description": "such other information as the Minister may request."
                },
                {
                    "representation": "(2)",
                    "description": "A copy of the annual report shall be forwarded by the Commission to the Minister who shall, as soon as possible after receiving the annual report, cause it to be laid before the National Assembly."
                }
            ]
        }
    },
    {
        "act": "GUYANA LANDS AND SURVEYS COMMISSION ACT",
        "source": "https://mola.gov.gy/laws-of-guyana",
        "type": {
            "name": "section",
            "representation": "33",
            "title": "Duty to provide information. ",
            "context": "GUYANA LANDS AND SURVEYS COMMISSION ACT under Duty to provide information. 33. Where information is stored by means of a mechanical, electronic or other device, any duty imposed upon the Commission by this Act or any other written law to produce the document recording that information shall be construed as a duty to provide a document containing a clear written or graphical reproduction of the information.",
            "description": "Where information is stored by means of a mechanical, electronic or other device, any duty imposed upon the Commission by this Act or any other written law to produce the document recording that information shall be construed as a duty to provide a document containing a clear written or graphical reproduction of the information."
        }
    },
    {
        "act": "GUYANA LANDS AND SURVEYS COMMISSION ACT",
        "source": "https://mola.gov.gy/laws-of-guyana",
        "type": {
            "name": "section",
            "representation": "34",
            "title": "Information, etc, obtained as member or co-opted member  of  Board, an officer or employee of Commission or person  who has rendered or is rendering service to  Commission as  consultant or  agent to be secret and confidential. ",
            "context": "GUYANA LANDS AND SURVEYS COMMISSION ACT under Information, etc, obtained as member or co-opted member  of  Board, an officer or employee of Commission or person  who has rendered or is rendering service to  Commission as  consultant or  agent to be secret and confidential. 34. (1) A member or co-opted member of the Board, an officer or employee of the Commission or a person who has rendered or is rendering service to the Commission as consultant or agent   LAWS OF GUYANA Guyana Lands and Surveys Commission Cap. 59:05 23  L.R.O. 1/2012 officer or employee of Commission or person who has rendered or is rendering service to Commission as consultant or agent to be secret and confidential.                                     (a)    shall regard, and deal with, as secret and confidential all information, documents or matters which, or knowledge of which, he may obtain; and  (b)      shall not make use of any information, documents or matters which, or knowledge of which, he may obtain for  the  benefit  of himself  or  any other  person  or otherwise than for the purpose of his duties,  as such  member  or  co-opted member  of the Board,  an officer  or employee  of the Commission or a person who has rendered or is rendering service to the Commission as consultant or agent.  (2) Nothing in subsection (1) shall be deemed to prevent-  (a)    a member or co-opted member of the Board;   (b) an officer or employee of the Commission; or  (c) a person who has rendered or is rendering service to the Commission  as consultant or agent,  referred to in subsection (1) from disclosing, or to entitle such member or co-opted member of the Board, an officer or employee of the Commission or a person who has rendered or is rendering service to the Commission as consultant or agent to refuse to disclose to any person the information, documents or matters referred to in subsection (1) for the purpose of the exercise or performance of his functions or when lawfully required to do so by any court or under any LAWS OF GUYANA 24 Cap. 59:05 Guyana Lands and Surveys Commission   L.R.O. 1/2012                 Penalty for furnishing false or misleading information.                       Human resources policy.   Minutes of meetings of the Board. law.  (3) A member or co-opted member of the Board, an officer or employee of the Commission or a person who has rendered or is rendering service to the Commission as consultant or agent referred to in subsection (1) who contravenes any provision of this section shall on summary conviction be liable to a fine of not less than twenty thousand dollars nor more than forty thousand dollars and to imprisonment for eighteen months.",
            "description": [
                {
                    "representation": "(1)",
                    "description": "who contravenes any provision of this section shall on summary conviction be liable to a fine of not less than twenty thousand dollars nor more than forty thousand dollars and to imprisonment for eighteen months."
                },
                {
                    "representation": "(a)",
                    "description": "a member or co-opted member of the Board;"
                },
                {
                    "representation": "(b)",
                    "description": "an officer or employee of the Commission; or"
                },
                {
                    "representation": "(2)",
                    "description": "Nothing in subsection"
                },
                {
                    "representation": "(c)",
                    "description": "a person who has rendered or is rendering service to the Commission  as consultant or agent,  referred to in subsection"
                },
                {
                    "representation": "(3)",
                    "description": "A member or co-opted member of the Board, an officer or employee of the Commission or a person who has rendered or is rendering service to the Commission as consultant or agent referred to in subsection"
                }
            ]
        }
    },
    {
        "act": "GUYANA LANDS AND SURVEYS COMMISSION ACT",
        "source": "https://mola.gov.gy/laws-of-guyana",
        "type": {
            "name": "section",
            "representation": "35",
            "title": "Penalty for furnishing false or misleading information. ",
            "context": "GUYANA LANDS AND SURVEYS COMMISSION ACT under Penalty for furnishing false or misleading information. 35.  A member or co-opted member of the Board, an officer or employee of the Commission or a person who has rendered or is rendering service to the Commission as consultant or agent who, being required by or under any provision of this Act to furnish any information with respect to any matter or any return to any person or authority -  (a)  knowingly or negligently furnishes information  with respect to that matter; or  (b) furnishes a return containing  information,  which is false or misleading in any material particular shall, without prejudice to any other liability that he may incur thereby, be liable on summary conviction to a fine of not less than fifteen thousand dollars nor more than thirty thousand dollars and to imprisonment for twelve months.",
            "description": [
                {
                    "representation": "(a)",
                    "description": "knowingly or negligently furnishes information  with respect to that matter; or"
                },
                {
                    "representation": "(b)",
                    "description": "furnishes a return containing  information,  which is false or misleading in any material particular shall, without prejudice to any other liability that he may incur thereby, be liable on summary conviction to a fine of not less than fifteen thousand dollars nor more than thirty thousand dollars and to imprisonment for twelve months."
                }
            ]
        }
    },
    {
        "act": "GUYANA LANDS AND SURVEYS COMMISSION ACT",
        "source": "https://mola.gov.gy/laws-of-guyana",
        "type": {
            "name": "section",
            "representation": "36",
            "title": "Human resources policy. ",
            "context": "GUYANA LANDS AND SURVEYS COMMISSION ACT under Human resources policy. 36. The Commission shall institute and operate a human resources policy for the fair and considerate treatment of employees in all facets of their employment.",
            "description": "The Commission shall institute and operate a human resources policy for the fair and considerate treatment of employees in all facets of their employment."
        }
    },
    {
        "act": "GUYANA LANDS AND SURVEYS COMMISSION ACT",
        "source": "https://mola.gov.gy/laws-of-guyana",
        "type": {
            "name": "section",
            "representation": "37",
            "title": "Minutes of meetings of the Board. ",
            "context": "GUYANA LANDS AND SURVEYS COMMISSION ACT under Minutes of meetings of the Board. 37. The minutes of meetings of the Board shall, if duly signed by    LAWS OF GUYANA Guyana Lands and Surveys Commission Cap. 59:05 25  L.R.O. 1/2012                 Exclusion of Limitation Act.  c. 7:",
            "description": "The minutes of meetings of the Board shall, if duly signed by    LAWS OF GUYANA Guyana Lands and Surveys Commission Cap. 59:05 25  L.R.O. 1/2012                 Exclusion of Limitation Act.  c. 7:"
        }
    },
    {
        "act": "GUYANA LANDS AND SURVEYS COMMISSION ACT",
        "source": "https://mola.gov.gy/laws-of-guyana",
        "type": {
            "name": "section",
            "representation": "38",
            "title": "Exclusion of Limitation Act. ",
            "context": "GUYANA LANDS AND SURVEYS COMMISSION ACT under Exclusion of Limitation Act. 38. The Limitation Act shall not apply to proceedings instituted by the Commission for the recovery of monies due to the Commission or any other property to which a claim is made by the Commission.",
            "description": "The Limitation Act shall not apply to proceedings instituted by the Commission for the recovery of monies due to the Commission or any other property to which a claim is made by the Commission."
        }
    },
    {
        "act": "GUYANA LANDS AND SURVEYS COMMISSION ACT",
        "source": "https://mola.gov.gy/laws-of-guyana",
        "type": {
            "name": "section",
            "representation": "39",
            "title": "Regulations. ",
            "context": "GUYANA LANDS AND SURVEYS COMMISSION ACT under Regulations. 39.  The  Commission  may,  with  the  approval  of the  Minister,  make  regulations which, in the opinion of the Board, are necessary or expedient for carrying into effect the purposes of this Act.",
            "description": "The  Commission  may,  with  the  approval  of the  Minister,  make  regulations which, in the opinion of the Board, are necessary or expedient for carrying into effect the purposes of this Act."
        }
    },
    {
        "act": "GUYANA LANDS AND SURVEYS COMMISSION ACT",
        "source": "https://mola.gov.gy/laws-of-guyana",
        "type": {
            "name": "section",
            "representation": "40",
            "title": "General penalties. ",
            "context": "GUYANA LANDS AND SURVEYS COMMISSION ACT under General penalties. 40. Any person guilty of an offence under this Act for which no penalty is provided is liable on summary conviction to a fine of not less than twenty thousand dollars nor more than forty thousand dollars and to imprisonment for eighteen months.",
            "description": "Any person guilty of an offence under this Act for which no penalty is provided is liable on summary conviction to a fine of not less than twenty thousand dollars nor more than forty thousand dollars and to imprisonment for eighteen months."
        }
    },
    {
        "act": "GUYANA LANDS AND SURVEYS COMMISSION ACT",
        "source": "https://mola.gov.gy/laws-of-guyana",
        "type": {
            "name": "section",
            "representation": "41",
            "title": "Commission to be successor to Lands and Surveys  Department. ",
            "context": "GUYANA LANDS AND SURVEYS COMMISSION ACT under Commission to be successor to Lands and Surveys  Department. 41.  The Commission established by section 3 shall be the successor to the body hitherto known as the Lands and Surveys Department (hereafter in this Part referred to as the Department) existing immediately before the coming into operation of this Act.",
            "description": "The Commission established by section 3 shall be the successor to the body hitherto known as the Lands and Surveys Department (hereafter in this Part referred to as the Department) existing immediately before the coming into operation of this Act."
        }
    },
    {
        "act": "GUYANA LANDS AND SURVEYS COMMISSION ACT",
        "source": "https://mola.gov.gy/laws-of-guyana",
        "type": {
            "name": "section",
            "representation": "42",
            "title": "Transfer of assets and liabilities. LAWS OF GUYANA Guyana Lands and Surveys Commission Cap. 59:05 5  L.R.O. 1/2012 SECTION ",
            "context": "GUYANA LANDS AND SURVEYS COMMISSION ACT under Transfer of assets and liabilities. LAWS OF GUYANA Guyana Lands and Surveys Commission Cap. 59:05 5  L.R.O. 1/2012 SECTION 42. (l) The movable and immovable property of the Department (including rights and interests), and of any offices of the Regional Democratic Councils hitherto utilised exclusively for lands and surveys functions are hereby transferred to the Commission and shall, without further assurance, vest in the Commission.  (2) Liabilities incurred by the Government LAWS OF GUYANA 26 Cap. 59:05 Guyana Lands and Surveys Commission   L.R.O. 1/2012                   Transfer of records.                   Effect of  existing arrangements.                    Continuance of exclusively for the purposes of the Department or incurred therefor under agreements duly contracted in the carrying out of its functions by the Department before the commencement date shall, in so far as may be, discharged by, and enforceable against, the Commission as if the liabilities had been incurred by the Commission.  (3) Nothing in subsection (1) or (2) applies to rights or liabilities under any contract of service.",
            "description": [
                {
                    "representation": "(l)",
                    "description": "The movable and immovable property of the Department"
                },
                {
                    "representation": "(2)",
                    "description": "applies to rights or liabilities under any contract of service."
                },
                {
                    "representation": "(3)",
                    "description": "Nothing in subsection"
                },
                {
                    "representation": "(1)",
                    "description": "or"
                }
            ]
        }
    },
    {
        "act": "GUYANA LANDS AND SURVEYS COMMISSION ACT",
        "source": "https://mola.gov.gy/laws-of-guyana",
        "type": {
            "name": "section",
            "representation": "43",
            "title": "Transfer of records. ",
            "context": "GUYANA LANDS AND SURVEYS COMMISSION ACT under Transfer of records. 43. (1) All documents, maps, survey plans, registers, books and other records of the Department (however compiled, recorded or stored) relating to the operations of the Department, and any tape, disc or other device of medium relating to such records, are hereby transferred to and shall become the property of the Commission.   (2) All documents, maps, survey plans, registers, books and other records of the Department  held by or on behalf  of any regional  or subregional  office  of a Regional Democratic Council shall, on the commencement date, be deemed to be records of the Department for the purposes of subsection (1).",
            "description": [
                {
                    "representation": "(1)",
                    "description": "All documents, maps, survey plans, registers, books and other records of the Department"
                },
                {
                    "representation": "(2)",
                    "description": "All documents, maps, survey plans, registers, books and other records of the Department  held by or on behalf  of any regional  or subregional  office  of a Regional Democratic Council shall, on the commencement date, be deemed to be records of the Department for the purposes of subsection"
                }
            ]
        }
    },
    {
        "act": "GUYANA LANDS AND SURVEYS COMMISSION ACT",
        "source": "https://mola.gov.gy/laws-of-guyana",
        "type": {
            "name": "section",
            "representation": "44",
            "title": "Effect of existing agreements. ",
            "context": "GUYANA LANDS AND SURVEYS COMMISSION ACT under Effect of existing agreements. 44. (1) On the commencement date, all contracts, agreements or undertakings made by the Department and in force immediately before that date shall have effect as contracts, agreements or undertakings by and with the Commission and may be enforced by and against the Commission accordingly.      (2) For the purposes of giving effect to the provisions of this Part in relation to contractual rights and liabilities, all such contracts shall, as from the commencement date, be construed with all due adaptations and modifications.",
            "description": [
                {
                    "representation": "(1)",
                    "description": "On the commencement date, all contracts, agreements or undertakings made by the Department and in force immediately before that date shall have effect as contracts, agreements or undertakings by and with the Commission and may be enforced by and against the Commission accordingly."
                },
                {
                    "representation": "(2)",
                    "description": "For the purposes of giving effect to the provisions of this Part in relation to contractual rights and liabilities, all such contracts shall, as from the commencement date, be construed with all due adaptations and modifications."
                }
            ]
        }
    },
    {
        "act": "GUYANA LANDS AND SURVEYS COMMISSION ACT",
        "source": "https://mola.gov.gy/laws-of-guyana",
        "type": {
            "name": "section",
            "representation": "45",
            "title": "Continuance of pending proceedings. ",
            "context": "GUYANA LANDS AND SURVEYS COMMISSION ACT under Continuance of pending proceedings. 45. Any proceedings commenced prior to the LAWS OF GUYANA Guyana Lands and Surveys Commission Cap. 59:05 27  L.R.O. 1/2012 pending proceedings.           Officers and employees of the Commission.                                        commencement date for the enforcement  of  any  rights  or  liabilities  which  are  transferred  or  attached  to  the Commission by virtue of the provisions of this Part may be continued by or against the Commission and such proceedings may be amended accordingly.",
            "description": "Any proceedings commenced prior to the LAWS OF GUYANA Guyana Lands and Surveys Commission Cap. 59:05 27  L.R.O. 1/2012 pending proceedings.           Officers and employees of the Commission.                                        commencement date for the enforcement  of  any  rights  or  liabilities  which  are  transferred  or  attached  to  the Commission by virtue of the provisions of this Part may be continued by or against the Commission and such proceedings may be amended accordingly."
        }
    },
    {
        "act": "GUYANA LANDS AND SURVEYS COMMISSION ACT",
        "source": "https://mola.gov.gy/laws-of-guyana",
        "type": {
            "name": "section",
            "representation": "46",
            "title": "Officers and employees of the Commission. ",
            "context": "GUYANA LANDS AND SURVEYS COMMISSION ACT under Officers and employees of the Commission. 46. (1) Before  the  commencement   of  this  Act  the  Government  and  the Commission  shall,  with  the  approval  of the  Public  Service  Commission,  notify the officers and employees of the Department that the Commission wishes to retain them as officers and  employees  after  the commencement  of this  Act and  such officers  and employees shall be engaged on terms and conditions as may be agreed upon between the Commission and each person so employed  and, which taken as a whole, are no less favourable  than  those  applicable   to  him  immediately   before  that  date,  and  the Commission shall,  in respect  of the persons  so employed,  be the successor  to the Government with regard  to such officers  and employees  leave  and  superannuation rights and benefits, whether accrued, earned, inchoate or contingent.  (2) For the purposes of every law, determination or agreement relating to the employment of each of the officers and employees of the Department retained under subsection  (1), including the determination of and right to receive  superannuation benefits, such employment shall be deemed to have been uninterrupted and the period of service of each such officer or employee with the Department, and every other period of service of that officer or employee that is recognised as continuous employment with the Government, shall be deemed to have been a period of service with the Commission.  (3) No officer or employee retained under subsection (1) shall be entitled to receive any payment or other benefit by reason of this Act.",
            "description": [
                {
                    "representation": "(1)",
                    "description": "shall be entitled to receive any payment or other benefit by reason of this Act."
                },
                {
                    "representation": "(2)",
                    "description": "For the purposes of every law, determination or agreement relating to the employment of each of the officers and employees of the Department retained under subsection"
                },
                {
                    "representation": "(3)",
                    "description": "No officer or employee retained under subsection"
                }
            ]
        }
    },
    {
        "act": "GUYANA LANDS AND SURVEYS COMMISSION ACT",
        "source": "https://mola.gov.gy/laws-of-guyana",
        "type": {
            "name": "section",
            "representation": "47",
            "title": "References in existing written laws.  SCHEDULE- CONSTITUTION AND PROCEDURE OF THE BOARD AND OTHER RELATED MATTERS.   __________________________   15 of  1999 An Act to provide for the establishment of the Guyana Lands and Surveys Commission, to provide for its functions and for other purposes connected therewith.  [16th JUNE, 2001] PART I PRELIMINARY Short title.       Interpretation.                  ",
            "context": "GUYANA LANDS AND SURVEYS COMMISSION ACT under References in existing written laws.  SCHEDULE- CONSTITUTION AND PROCEDURE OF THE BOARD AND OTHER RELATED MATTERS.   __________________________   15 of  1999 An Act to provide for the establishment of the Guyana Lands and Surveys Commission, to provide for its functions and for other purposes connected therewith.  [16th JUNE, 2001] PART I PRELIMINARY Short title.       Interpretation.                  47. Any reference  to the Department  or the  References in LAWS OF GUYANA 28 Cap. 59:05 Guyana Lands and Surveys Commission   L.R.O. 1/2012  existing written laws.        s. 7(2)       Constitution of the Board.    Tenure of office of members of the Board.                       Commissioner  in any  written  law, including the Forests Act and the National Trust Act or in any instrument or document of any kind, subsisting or in  force  on  the   commencement   date shall,  after the commencement date, be construed and have effect as a reference to the Commission or the Commissioner, respectively.                                                            SCHEDULE  CONSTITUTION AND PROCEDURE OF THE BOARD AND  OTHER RELATED MATTERS",
            "description": [
                {
                    "representation": "(2)",
                    "description": "Constitution of the Board.    Tenure of office of members of the Board.                       Commissioner  in any  written  law, including the Forests Act and the National Trust Act or in any instrument or document of any kind, subsisting or in  force  on  the   commencement   date shall,  after the commencement date, be construed and have effect as a reference to the Commission or the Commissioner, respectively.                                                            SCHEDULE  CONSTITUTION AND PROCEDURE OF THE BOARD AND  OTHER RELATED MATTERS"
                }
            ]
        }
    }
]