[
    {
        "act": "LAND BONDS ACT",
        "source": "https://mola.gov.gy/laws-of-guyana",
        "type": {
            "name": "section",
            "representation": "1",
            "title": "Short title. ",
            "context": "LAND BONDS ACT under Short title. 1.  This Act may be cited as the Land Bonds Act.",
            "description": "This Act may be cited as the Land Bonds Act."
        }
    },
    {
        "act": "LAND BONDS ACT",
        "source": "https://mola.gov.gy/laws-of-guyana",
        "type": {
            "name": "section",
            "representation": "2",
            "title": "Interpretation. ",
            "context": "LAND BONDS ACT under Interpretation. 2.  In this Act acquisition means acquisition in the exercise of powers LAWS OF GUYANA 4 Cap. 62:07 Land Bonds   L.R.O. 1/2012         c. 62:06   c. 5:01        Payment in land bonds  with consent of vendor.        Payment in  land bonds at discretion of Minister.         Persons not required to accept land bonds. c. 62:06  conferred by any law for the time being in force in relation to the compulsory acquisition of land;  land settlement scheme has the meaning assigned to that expression by section 2 of the Acquisition of Land (Land Settlement) Act;  statutory claims has the meaning assigned to that expression by section 2 of the Deeds Registry Act;  vendor  means  any  person  to  whom  any  purchase  price  or compensation is payable in respect of the purchase or acquisition of any land.",
            "description": "In this Act acquisition means acquisition in the exercise of powers LAWS OF GUYANA 4 Cap. 62:07 Land Bonds   L.R.O. 1/2012         c. 62:06   c. 5:01        Payment in land bonds  with consent of vendor.        Payment in  land bonds at discretion of Minister.         Persons not required to accept land bonds. c. 62:06  conferred by any law for the time being in force in relation to the compulsory acquisition of land;  land settlement scheme has the meaning assigned to that expression by section 2 of the Acquisition of Land (Land Settlement) Act;  statutory claims has the meaning assigned to that expression by section 2 of the Deeds Registry Act;  vendor  means  any  person  to  whom  any  purchase  price  or compensation is payable in respect of the purchase or acquisition of any land."
        }
    },
    {
        "act": "LAND BONDS ACT",
        "source": "https://mola.gov.gy/laws-of-guyana",
        "type": {
            "name": "section",
            "representation": "3",
            "title": "Payment in land bonds with consent of vendor. ",
            "context": "LAND BONDS ACT under Payment in land bonds with consent of vendor. 3.  Where any land is purchased or acquired by the Government the purchase price or compensation payable to any vendor in respect of such land may by agreement between such vendor and the Government be paid either in whole or in part by the issue to such vendor of land bonds to a nominal amount equal to the whole of the purchase price or compensation or to such part thereof as may have been agreed to be so paid, as the case may be.",
            "description": "Where any land is purchased or acquired by the Government the purchase price or compensation payable to any vendor in respect of such land may by agreement between such vendor and the Government be paid either in whole or in part by the issue to such vendor of land bonds to a nominal amount equal to the whole of the purchase price or compensation or to such part thereof as may have been agreed to be so paid, as the case may be."
        }
    },
    {
        "act": "LAND BONDS ACT",
        "source": "https://mola.gov.gy/laws-of-guyana",
        "type": {
            "name": "section",
            "representation": "4",
            "title": "Payment in land bonds at discretion of Minister. ",
            "context": "LAND BONDS ACT under Payment in land bonds at discretion of Minister. 04.",
            "description": "04."
        }
    },
    {
        "act": "LAND BONDS ACT",
        "source": "https://mola.gov.gy/laws-of-guyana",
        "type": {
            "name": "section",
            "representation": "5",
            "title": "Persons not required to accept land bonds. ",
            "context": "LAND BONDS ACT under Persons not required to accept land bonds. 5. (1) Nothing in this Act shall be deemed to require a vendor to accept compensation in land bonds in respect of any land or part of any land   unless   commissioners   appointed   under   section   7  of  the Acquisition  of  Land  LAWS OF GUYANA Land Bonds Cap. 62:07 5  L.R.O. 1/2012                                                 c. 19:03 (Land  Settlement)  Act  have  reported  to  the Minister that such land or part thereof is not beneficially occupied or utilised for agriculture.  (2) No vendor being a mortgagee shall be required to accept payment of compensation in land bonds in respect of the whole or any part of the mortgage debt unless  (a) the Minister, by notice published in the Gazette, issues a Commission appointing one or more commissioners to determine whether or not the mortgage was executed by the mortgagor in contemplation of proceedings being taken to acquire  the  land  the  subject  of  the  mortgage  or  in contemplation  of  the  enactment  of  this  Act  and  the mortgagee knew or had reason to suspect at the time of the execution of the mortgage that such was the case, and to report to the Minister in relation thereto; and  (b)  such commissioners report to the Minister that the mortgage was executed by the mortgagor in contemplation of proceedings being taken to acquire the land the subject of the mortgage or in contemplation of the enactment of this Act and that the mortgagee knew or had reason to suspect at the time of the execution of the mortgage that such was the case.  (3) Commissioners appointed under subsection (1) shall have all the powers, privileges, duties and obligations of, and shall for all purposes be deemed to be, commissioners appointed under the Commissions of Inquiry Act. power under section 24A of the Acquisition of Lands for (3) Where  the  Minister  has  determined  in  accordance with this section 4 of this Act that any compensation should be paid whether in whole or in part by the issue of land bonds and were it not for the exercise of  his Public Purposes Act section 24 would have applied to the payment of such compensation section 24 aforesaid shall have no effect in relation thereto, but the Minister shall issue a warrant to the Accountant General requiring him to pay such compensation in whole or in part as the case may be by the issue to such persons as the High Court may direct of land bonds of the type determined by the Minister to a nominal value equal to the whole of  the  compensation  or  to  such  part  thereof  as  may  have  been determined by the Minister (2) There shall not be outstanding at any one time land bonds to a nominal value in excess of one hundred  million dollars or such greater value as may be appointed by resolution of the National Assembly. For the purposes of this subsection the outstanding value of any annuity bond shall be the surrender value as set out in the bond.  LAWS OF GUYANA 6 Cap. 62:07 Land Bonds   L.R.O. 1/2012           c. 62:05   Issue of land bonds. [35 of 1975]                   c. 62:05              (4) Any person whose interests are or may be prejudicially affected shall be entitled to be heard by himself or by counsel before any such commissioners.  (5) Nothing in this Act shall be deemed to require any person entitled to compensation under section 11 or section 16(3) of the Acquisition of Lands for Public Purposes Act to accept such compensation in land bonds.",
            "description": [
                {
                    "representation": "(1)",
                    "description": "shall have all the powers, privileges, duties and obligations of, and shall for all purposes be deemed to be, commissioners appointed under the Commissions of Inquiry Act. power under section 24A of the Acquisition of Lands for"
                },
                {
                    "representation": "(2)",
                    "description": "There shall not be outstanding at any one time land bonds to a nominal value in excess of one hundred  million dollars or such greater value as may be appointed by resolution of the National Assembly. For the purposes of this subsection the outstanding value of any annuity bond shall be the surrender value as set out in the bond.  LAWS OF GUYANA 6 Cap. 62:07 Land Bonds   L.R.O. 1/2012           c. 62:05   Issue of land bonds. [35 of 1975]                   c. 62:05"
                },
                {
                    "representation": "(a)",
                    "description": "the Minister, by notice published in the Gazette, issues a Commission appointing one or more commissioners to determine whether or not the mortgage was executed by the mortgagor in contemplation of proceedings being taken to acquire  the  land  the  subject  of  the  mortgage  or  in contemplation  of  the  enactment  of  this  Act  and  the mortgagee knew or had reason to suspect at the time of the execution of the mortgage that such was the case, and to report to the Minister in relation thereto; and"
                },
                {
                    "representation": "(b)",
                    "description": "such commissioners report to the Minister that the mortgage was executed by the mortgagor in contemplation of proceedings being taken to acquire the land the subject of the mortgage or in contemplation of the enactment of this Act and that the mortgagee knew or had reason to suspect at the time of the execution of the mortgage that such was the case."
                },
                {
                    "representation": "(3)",
                    "description": "Where  the  Minister  has  determined  in  accordance with this section 4 of this Act that any compensation should be paid whether in whole or in part by the issue of land bonds and were it not for the exercise of  his Public Purposes Act section 24 would have applied to the payment of such compensation section 24 aforesaid shall have no effect in relation thereto, but the Minister shall issue a warrant to the Accountant General requiring him to pay such compensation in whole or in part as the case may be by the issue to such persons as the High Court may direct of land bonds of the type determined by the Minister to a nominal value equal to the whole of  the  compensation  or  to  such  part  thereof  as  may  have  been determined by the Minister"
                },
                {
                    "representation": "(4)",
                    "description": "Any person whose interests are or may be prejudicially affected shall be entitled to be heard by himself or by counsel before any such commissioners."
                },
                {
                    "representation": "(5)",
                    "description": "Nothing in this Act shall be deemed to require any person entitled to compensation under section 11 or section 16(3) of the Acquisition of Lands for Public Purposes Act to accept such compensation in land bonds."
                }
            ]
        }
    },
    {
        "act": "LAND BONDS ACT",
        "source": "https://mola.gov.gy/laws-of-guyana",
        "type": {
            "name": "section",
            "representation": "6",
            "title": "Issue of land bonds. ",
            "context": "LAND BONDS ACT under Issue of land bonds. 6. (1) For   the   purposes   of   paying   any   purchase   price   or compensation which may be paid under this Act by the issue of land bonds, the Accountant General shall, subject to this section, create and issue when  and as required land bonds in such form and of such denominations as may be prescribed.  LAWS OF GUYANA Land Bonds Cap. 62:07 7  L.R.O. 1/2012     Description and redemption of land bonds.                                      Interest of land bonds.   and, subject to this Act, the Accountant General  shall  issue  such  land  bonds  or  pay  such  compensation accordingly.",
            "description": [
                {
                    "representation": "(1)",
                    "description": "For   the   purposes   of   paying   any   purchase   price   or compensation which may be paid under this Act by the issue of land bonds, the Accountant General shall, subject to this section, create and issue when  and as required land bonds in such form and of such denominations as may be prescribed.  LAWS OF GUYANA Land Bonds Cap. 62:07 7  L.R.O. 1/2012     Description and redemption of land bonds.                                      Interest of land bonds.   and, subject to this Act, the Accountant General  shall  issue  such  land  bonds  or  pay  such  compensation accordingly."
                }
            ]
        }
    },
    {
        "act": "LAND BONDS ACT",
        "source": "https://mola.gov.gy/laws-of-guyana",
        "type": {
            "name": "section",
            "representation": "7",
            "title": "Description and redemption of land bonds. ",
            "context": "LAND BONDS ACT under Description and redemption of land bonds. 7. (1) Land bonds may be of the following types   (a) fixed-date bonds,  (b)      drawing bonds,  (c)       annuity bonds.  (2) Subject to section 10  (a)     fixed-date bonds shall be redeemable at par on a fixed date to be declared on the issue of the bonds:  Provided that the Minister may reserve the option to redeem the bonds before such date on such conditions as may be declared at the time of issue;  (b) drawing bonds shall be redeemable by annual drawings at par to be made in the manner hereinafter provided, or, at the option of the Minister by purchase in the market;  (c) annuity bonds shall be redeemable by equated half- yearly payments covering both principal and interest:  Provided that all land bonds shall be redeemed not later than twenty years from the date of issue.",
            "description": [
                {
                    "representation": "(1)",
                    "description": "Land bonds may be of the following types"
                },
                {
                    "representation": "(a)",
                    "description": "fixed-date bonds shall be redeemable at par on a fixed date to be declared on the issue of the bonds:  Provided that the Minister may reserve the option to redeem the bonds before such date on such conditions as may be declared at the time of issue;"
                },
                {
                    "representation": "(b)",
                    "description": "drawing bonds shall be redeemable by annual drawings at par to be made in the manner hereinafter provided, or, at the option of the Minister by purchase in the market;"
                },
                {
                    "representation": "(c)",
                    "description": "annuity bonds shall be redeemable by equated half- yearly payments covering both principal and interest:  Provided that all land bonds shall be redeemed not later than twenty years from the date of issue."
                },
                {
                    "representation": "(2)",
                    "description": "Subject to section 10"
                }
            ]
        }
    },
    {
        "act": "LAND BONDS ACT",
        "source": "https://mola.gov.gy/laws-of-guyana",
        "type": {
            "name": "section",
            "representation": "8",
            "title": "Interest on land bonds. ",
            "context": "LAND BONDS ACT under Interest on land bonds. 8.  (1) Land bonds shall bear  interest at such rate as the  Minister shall determine. . LAWS OF GUYANA 8 Cap. 62:07 Land Bonds   L.R.O. 1/2012            Application of sections 16, 17, 18, 19, 20  and 21 of cap. 74:",
            "description": [
                {
                    "representation": "(1)",
                    "description": "Land bonds shall bear  interest at such rate as the  Minister shall determine. . LAWS OF GUYANA 8 Cap. 62:07 Land Bonds   L.R.O. 1/2012            Application of sections 16, 17, 18, 19, 20  and 21 of cap. 74:"
                }
            ]
        }
    },
    {
        "act": "LAND BONDS ACT",
        "source": "https://mola.gov.gy/laws-of-guyana",
        "type": {
            "name": "section",
            "representation": "9",
            "title": "Application of sections 16, 17, 18, 19, 20 and 21 of Cap. 74:",
            "context": "LAND BONDS ACT under Application of sections 16, 17, 18, 19, 20 and 21 of Cap. 74:9. (1) Sections 16, 17, 18, 19, 20 and 21 of the General Local Loan Act  shall  apply  to  fixed-date  and  drawing  bonds  as  they  apply respectively to fixed-date and drawing debentures issued under that Act subject to the following modifications:  (a) as if for the debenture or debentures there were substituted in the first line of section 16 the words fixed- date or drawing bonds and elsewhere the word bond or bonds as the case may be;  (b)   as if for the word loan there was substituted the word bonds; and  (c)     as if for the words commencing with that specified in the Act authorising the loan, in section 16(2) there were substituted the words but not earlier than six months after the date on which interest on the said bonds commences to run.  (2) So  long  as  any  annuity  bonds  remain  outstanding  the Minister shall in each half year ending with the date on which any equated payment of principal and interest in respect of such bonds falls due appropriate out of the Consolidated Fund a sum equal to the total amount of  _______________ prescribed and generally for giving effect to this Act. such matters as are by this Act required or permitted to be Assembly, the Minister may make regulations prescribing",
            "description": [
                {
                    "representation": "(1)",
                    "description": "Sections 16, 17, 18, 19, 20 and 21 of the General Local Loan Act  shall  apply  to  fixed-date  and  drawing  bonds  as  they  apply respectively to fixed-date and drawing debentures issued under that Act subject to the following modifications:"
                },
                {
                    "representation": "(a)",
                    "description": "as if for the debenture or debentures there were substituted in the first line of section 16 the words fixed- date or drawing bonds and elsewhere the word bond or bonds as the case may be;"
                },
                {
                    "representation": "(b)",
                    "description": "as if for the word loan there was substituted the word bonds; and"
                },
                {
                    "representation": "(c)",
                    "description": "as if for the words commencing with that specified in the Act authorising the loan, in section 16(2) there were substituted the words but not earlier than six months after the date on which interest on the said bonds commences to run."
                },
                {
                    "representation": "(2)",
                    "description": "So  long  as  any  annuity  bonds  remain  outstanding  the Minister shall in each half year ending with the date on which any equated payment of principal and interest in respect of such bonds falls due appropriate out of the Consolidated Fund a sum equal to the total amount of  _______________ prescribed and generally for giving effect to this Act. such matters as are by this Act required or permitted to be Assembly, the Minister may make regulations prescribing"
                }
            ]
        }
    },
    {
        "act": "LAND BONDS ACT",
        "source": "https://mola.gov.gy/laws-of-guyana",
        "type": {
            "name": "section",
            "representation": "10",
            "title": "Surrender of land bonds. ",
            "context": "LAND BONDS ACT under Surrender of land bonds. 10. (1) The Accountant General may authorise the  such payment as aforesaid.    [4 of 1972] Regulation.                of land bonds. negotiability and Registration      bonds. Service of land             land bonds. Surrender of  L.R.O. 1/2012  Cap. 62:07 Land Bonds 9 LAWS OF GUYANA  LAWS OF GUYANA Cap. 62:07  L.R.O. 1/2012  SUBSIDIARY LEGISLATION  _________________   Reg. 9/1985 LAND BOND REGULATIONS  made under section 13   Citation.    Domination of land bonds.   Form of land bonds.",
            "description": [
                {
                    "representation": "(1)",
                    "description": "The Accountant General may authorise the  such payment as aforesaid.    [4 of 1972] Regulation.                of land bonds. negotiability and Registration      bonds. Service of land             land bonds. Surrender of  L.R.O. 1/2012  Cap. 62:07 Land Bonds 9 LAWS OF GUYANA  LAWS OF GUYANA Cap. 62:07  L.R.O. 1/2012  SUBSIDIARY LEGISLATION  _________________   Reg. 9/1985 LAND BOND REGULATIONS  made under section 13   Citation.    Domination of land bonds.   Form of land bonds."
                }
            ]
        }
    },
    {
        "act": "LAND BONDS ACT",
        "source": "https://mola.gov.gy/laws-of-guyana",
        "type": {
            "name": "section",
            "representation": "11",
            "title": "Service of land bonds. ",
            "context": "LAND BONDS ACT under Service of land bonds. 11. All moneys for the payment of interest on land  bond. shall be redeemed at the surrender value as set out in each shall be redeemed at par.  Annuity bonds so surrendered (2) Fixed-date and drawing bonds so surrendered  make arrangements therefor. purchase or acquisition of which they were issued and may satisfaction of any statutory claims upon the land for the immediate redemption of land bonds to be surrendered in",
            "description": [
                {
                    "representation": "(2)",
                    "description": "Fixed-date and drawing bonds so surrendered  make arrangements therefor. purchase or acquisition of which they were issued and may satisfaction of any statutory claims upon the land for the immediate redemption of land bonds to be surrendered in"
                }
            ]
        }
    },
    {
        "act": "LAND BONDS ACT",
        "source": "https://mola.gov.gy/laws-of-guyana",
        "type": {
            "name": "section",
            "representation": "12",
            "title": "Registration and negotiability of land bonds. ",
            "context": "LAND BONDS ACT under Registration and negotiability of land bonds. 12. (1) The Accountant General shall keep in the  charged on the Consolidated Fund. or incidental to the redemption of such bonds are hereby bonds or for the redemption of the same and all expenses of",
            "description": [
                {
                    "representation": "(1)",
                    "description": "The Accountant General shall keep in the  charged on the Consolidated Fund. or incidental to the redemption of such bonds are hereby bonds or for the redemption of the same and all expenses of"
                }
            ]
        }
    },
    {
        "act": "LAND BONDS ACT",
        "source": "https://mola.gov.gy/laws-of-guyana",
        "type": {
            "name": "section",
            "representation": "13",
            "title": "Regulations.  __________________________  21 of 1959 An Act to make provision for the satisfaction of the whole or any part of the purchase money or of the compensation payable by the Government of Guyana in respect of the purchase or compulsory acquisition of any land by the issue of bonds, and for the issue, negotiability and redemption of such bonds, and the payment of interest thereon and for matters incidental to or connected with any of the foregoing purposes.  [5th DECEMBER, 1959]  Short title.  Interpretation.   ",
            "context": "LAND BONDS ACT under Regulations.  __________________________  21 of 1959 An Act to make provision for the satisfaction of the whole or any part of the purchase money or of the compensation payable by the Government of Guyana in respect of the purchase or compulsory acquisition of any land by the issue of bonds, and for the issue, negotiability and redemption of such bonds, and the payment of interest thereon and for matters incidental to or connected with any of the foregoing purposes.  [5th DECEMBER, 1959]  Short title.  Interpretation.   13.  Subject to negative resolution of the National  transferred in such manner as may be prescribed (3) Land bonds shall be capable of being  which the payment is made. shown in the register as the holder of the bonds in respect of section 10 shall be paid except to the person for the time being annuity bond or upon surrender or any land bond under or by way of payment of principal and interest on any fixed-date or drawing bonds or upon redemption of the same (2) No sum payable by way of interest upon any  issued under this Act. prescribed form and manner a register of all land bonds",
            "description": [
                {
                    "representation": "(3)",
                    "description": "Land bonds shall be capable of being  which the payment is made. shown in the register as the holder of the bonds in respect of section 10 shall be paid except to the person for the time being annuity bond or upon surrender or any land bond under or by way of payment of principal and interest on any fixed-date or drawing bonds or upon redemption of the same"
                },
                {
                    "representation": "(2)",
                    "description": "No sum payable by way of interest upon any  issued under this Act. prescribed form and manner a register of all land bonds"
                }
            ]
        }
    },
    {
        "act": "LAND BONDS ACT",
        "source": "https://mola.gov.gy/laws-of-guyana",
        "type": {
            "name": "section",
            "representation": "",
            "title": "20.......  ",
            "context": "LAND BONDS ACT under 20.......  20.......... upon presentation and surrender of the bond at the office of the Accountant General by the registered holder or his duly authorised agent.",
            "description": "20.......... upon presentation and surrender of the bond at the office of the Accountant General by the registered holder or his duly authorised agent."
        }
    }
]