[
    {
        "act": "ACQUISITION OF LANDS (NOT BENEFICIALLY  OCCUPIED) ACT",
        "source": "https://mola.gov.gy/laws-of-guyana",
        "type": {
            "name": "section",
            "representation": "1",
            "title": "Short title. ",
            "context": "ACQUISITION OF LANDS (NOT BENEFICIALLY  OCCUPIED) ACT under Short title. 1.  This  Act  may  be  cited  as  the  Acquisition  of  Lands  (Not Beneficially Occupied) Act.",
            "description": "This  Act  may  be  cited  as  the  Acquisition  of  Lands  (Not Beneficially Occupied) Act."
        }
    },
    {
        "act": "ACQUISITION OF LANDS (NOT BENEFICIALLY  OCCUPIED) ACT",
        "source": "https://mola.gov.gy/laws-of-guyana",
        "type": {
            "name": "section",
            "representation": "2",
            "title": "Interpretation. ",
            "context": "ACQUISITION OF LANDS (NOT BENEFICIALLY  OCCUPIED) ACT under Interpretation. 2.  In this Act Commissioner means the Commissioner of Lands;  land includes all buildings thereon and all land whether covered with water or otherwise, other than State Land or Government Land.",
            "description": "In this Act Commissioner means the Commissioner of Lands;  land includes all buildings thereon and all land whether covered with water or otherwise, other than State Land or Government Land."
        }
    },
    {
        "act": "ACQUISITION OF LANDS (NOT BENEFICIALLY  OCCUPIED) ACT",
        "source": "https://mola.gov.gy/laws-of-guyana",
        "type": {
            "name": "section",
            "representation": "3",
            "title": "Commissioner to inspect land not beneficially occupied. ",
            "context": "ACQUISITION OF LANDS (NOT BENEFICIALLY  OCCUPIED) ACT under Commissioner to inspect land not beneficially occupied. 3. (1) The Commissioner is hereby empowered to enter upon any land, which he has reason to believe is not beneficially occupied, for the purpose  of examining it to ascertain whether it is beneficially occupied.  (2) In exercise of the powers conferred upon the Commissioner under subsection (1) he may, subject to subsection (3), enter upon any land together with his agents, servants or workmen and do all acts necessary to ascertain whether the land is beneficially occupied.  (3) The Commissioner shall, not less than seven days prior to his entering upon the land under subsection (2), serve by registered post on the owner at his last known place of residence a notice of his intention to do so and specifying LAWS OF GUYANA Acquisition of Lands (Not Beneficially Occupied)   Cap. 62:09 09 5  L.R.O. 1/2012                Minister to  issue notice.                                the date and time of his entry and, if his address is not known to him or if he cannot by reasonable efforts be found, the Commissioner shall, not less than seven days prior to his entering upon the land, affix such notice on a conspicuous part of the land.  (4) The Commissioner may authorise in writing any public officer to exercise the powers conferred upon him under this section and the public officer so authorised may exercise all the powers conferred upon the Commissioner under this section.",
            "description": [
                {
                    "representation": "(1)",
                    "description": "he may, subject to subsection"
                },
                {
                    "representation": "(2)",
                    "description": "In exercise of the powers conferred upon the Commissioner under subsection"
                },
                {
                    "representation": "(3)",
                    "description": "The Commissioner shall, not less than seven days prior to his entering upon the land under subsection"
                },
                {
                    "representation": "(4)",
                    "description": "The Commissioner may authorise in writing any public officer to exercise the powers conferred upon him under this section and the public officer so authorised may exercise all the powers conferred upon the Commissioner under this section."
                }
            ]
        }
    },
    {
        "act": "ACQUISITION OF LANDS (NOT BENEFICIALLY  OCCUPIED) ACT",
        "source": "https://mola.gov.gy/laws-of-guyana",
        "type": {
            "name": "section",
            "representation": "4",
            "title": "Minister to issue notice. ",
            "context": "ACQUISITION OF LANDS (NOT BENEFICIALLY  OCCUPIED) ACT under Minister to issue notice. 4.  (1) Where the Minister has reason to believe, either on information provided by the Commissioner or otherwise, that any land is not beneficially occupied, he may declare by a notice that, if such land is not beneficially occupied in such manner, and within such period, not exceeding one year, as may be stated in the notice, the land will be compulsorily acquired by the State under this Act.  (2) A notice under subsection (1) shall  (a)   contain a description of the land by physical metes and  bounds or by natural features or by reference to any document of title under which it is held, so as to enable it to be identified clearly;  (b)   state the manner in which and the period within which the land is required to be beneficially occupied;  (c)      be published once in the Gazette and in one local newspaper circulating in the area in which the land is situate;   (d)     be affixed upon a conspicuous part of LAWS OF GUYANA 6 Cap. 62:09 Acquisition of Lands (Not Beneficially Occupied)  L.R.O. 1/2012                              Minister to authorise Commissioner or any public officer to  inspect land.              the land;  (e)      where  the  owner  can  by  reasonable  efforts  be ascertained and is resident in Guyana, be served on him by post at his last known place of residence.  (3) For the purpose of subsection (2) (e) any notice addressed to the owner at his last known place of residence shall be deemed to be served at the time when in due course of post it would be delivered at that address.  (4) The Minister, if sufficient cause is shown to him, by any person having or claiming to have a right, title or interest to or in the land in respect of which a notice has been published under subsection (2), within thirty days after the publication of the notice in the Gazette or the service of the notice on him, whichever is the later, may, by a notice  published,  affixed  and  served  in  the  manner  specified  in subsection (2) (c), (d) and (e), revoke the first mentioned notice and thereupon further proceedings under this Act in relation to that land shall cease.",
            "description": [
                {
                    "representation": "(1)",
                    "description": "shall"
                },
                {
                    "representation": "(2)",
                    "description": "(c),"
                },
                {
                    "representation": "(a)",
                    "description": "contain a description of the land by physical metes and  bounds or by natural features or by reference to any document of title under which it is held, so as to enable it to be identified clearly;"
                },
                {
                    "representation": "(b)",
                    "description": "state the manner in which and the period within which the land is required to be beneficially occupied;"
                },
                {
                    "representation": "(c)",
                    "description": "be published once in the Gazette and in one local newspaper circulating in the area in which the land is situate;"
                },
                {
                    "representation": "(d)",
                    "description": "and"
                },
                {
                    "representation": "(e)",
                    "description": "where  the  owner  can  by  reasonable  efforts  be ascertained and is resident in Guyana, be served on him by post at his last known place of residence."
                },
                {
                    "representation": "(3)",
                    "description": "For the purpose of subsection"
                },
                {
                    "representation": "(4)",
                    "description": "The Minister, if sufficient cause is shown to him, by any person having or claiming to have a right, title or interest to or in the land in respect of which a notice has been published under subsection"
                }
            ]
        }
    },
    {
        "act": "ACQUISITION OF LANDS (NOT BENEFICIALLY  OCCUPIED) ACT",
        "source": "https://mola.gov.gy/laws-of-guyana",
        "type": {
            "name": "section",
            "representation": "5",
            "title": "Minister to authorise Commissioner or any public officer to inspect land. ",
            "context": "ACQUISITION OF LANDS (NOT BENEFICIALLY  OCCUPIED) ACT under Minister to authorise Commissioner or any public officer to inspect land. 5.  (1) After the expiration of the period stated in a notice under section  4(1),  the  Minister  shall,  where  such  notice  has  not  been revoked under section 4(4), authorise in writing the Commissioner or any public officer to enter upon any land described in the notice for the purpose of examining it to ascertain whether it is beneficially occupied in the manner stated in the notice.  (2) Any person authorised by the Minister under subsection (1) may exercise all the powers conferred upon the Commissioner under section",
            "description": [
                {
                    "representation": "(1)",
                    "description": "may exercise all the powers conferred upon the Commissioner under section"
                },
                {
                    "representation": "(2)",
                    "description": "Any person authorised by the Minister under subsection"
                }
            ]
        }
    },
    {
        "act": "ACQUISITION OF LANDS (NOT BENEFICIALLY  OCCUPIED) ACT",
        "source": "https://mola.gov.gy/laws-of-guyana",
        "type": {
            "name": "section",
            "representation": "6",
            "title": "Minister may extend the period stated in a notice. ",
            "context": "ACQUISITION OF LANDS (NOT BENEFICIALLY  OCCUPIED) ACT under Minister may extend the period stated in a notice. 6. (1) If on the report submitted under section 5(3), the Minister is satisfied  (a)      that reasonable efforts have been taken to occupy the land beneficially; or  (b)   that the land is not beneficially occupied for cause which appears to him to be reasonable,  the Minister may by a notice published, affixed and served in the manner specified in section 4(2) (c), (d) and (e) extend the period stated in  the   notice  under  section  4(1)  for  beneficially  occupying  it, notwithstanding that the aggregate of the periods specified in the aforesaid notices exceeds the upper limit specified in section 4(1).  (2) Where  the  Minister  acts  under  subsection  (1),  he  may, having regard to all the circumstances of the case, including any request made in that behalf by the owner, if he considers it reasonable, vary the manner stated in the notice under section 4(1) in which the land is required to be beneficially occupied.  (3) Where the Minister under subsection (1) extends the period, he shall after the expiration of the period as so extended authorise in writing  the  Commissioner  or  a  public  officer  to  enter  upon  and examine the land and make a report of his findings to him and the provisions of section 5(2) and (3)  shall apply to such authorisation, entry, examination and report.   LAWS OF GUYANA 8 Cap. 62:09 Acquisition of Lands (Not Beneficially Occupied)  L.R.O. 1/2012 Decision of the Minister.                             Notification of order and suspension of dealings with the land.",
            "description": [
                {
                    "representation": "(1)",
                    "description": "extends the period, he shall after the expiration of the period as so extended authorise in writing  the  Commissioner  or  a  public  officer  to  enter  upon  and examine the land and make a report of his findings to him and the provisions of section 5(2) and"
                },
                {
                    "representation": "(a)",
                    "description": "that reasonable efforts have been taken to occupy the land beneficially; or"
                },
                {
                    "representation": "(b)",
                    "description": "that the land is not beneficially occupied for cause which appears to him to be reasonable,  the Minister may by a notice published, affixed and served in the manner specified in section 4(2)"
                },
                {
                    "representation": "(d)",
                    "description": "and"
                },
                {
                    "representation": "(e)",
                    "description": "extend the period stated in  the   notice  under  section  4(1)  for  beneficially  occupying  it, notwithstanding that the aggregate of the periods specified in the aforesaid notices exceeds the upper limit specified in section 4(1)."
                },
                {
                    "representation": "(2)",
                    "description": "Where  the  Minister  acts  under  subsection"
                },
                {
                    "representation": "(3)",
                    "description": "shall apply to such authorisation, entry, examination and report.   LAWS OF GUYANA 8 Cap. 62:09 Acquisition of Lands"
                }
            ]
        }
    },
    {
        "act": "ACQUISITION OF LANDS (NOT BENEFICIALLY  OCCUPIED) ACT",
        "source": "https://mola.gov.gy/laws-of-guyana",
        "type": {
            "name": "section",
            "representation": "7",
            "title": "Decision of the Minister. ",
            "context": "ACQUISITION OF LANDS (NOT BENEFICIALLY  OCCUPIED) ACT under Decision of the Minister. 7. (1) Where the Minister is satisfied on a consideration of the report under section 5 or 6, as the case may be, and the representations recorded under those sections that the land referred to in the report is   (a)     beneficially occupied, he shall declare by a notice published, affixed and served in the manner specified in section 4(2) (c), (d) and (e) that further proceedings under this Act in relation to that land shall cease;  (b)  not beneficially occupied, he shall, where he does not act under section 6, by order, direct that the land shall, at the expiration of such period as may be specified in the order, vest in the State.  (2) Where the Minister makes an order under subsection (1) (b), the land shall, at the expiration of the period specified in the order, vest in the State free of all encumbrances.",
            "description": [
                {
                    "representation": "(1)",
                    "description": "(b), the land shall, at the expiration of the period specified in the order, vest in the State free of all encumbrances."
                },
                {
                    "representation": "(a)",
                    "description": "beneficially occupied, he shall declare by a notice published, affixed and served in the manner specified in section 4(2)"
                },
                {
                    "representation": "(d)",
                    "description": "and"
                },
                {
                    "representation": "(e)",
                    "description": "that further proceedings under this Act in relation to that land shall cease;"
                },
                {
                    "representation": "(b)",
                    "description": "not beneficially occupied, he shall, where he does not act under section 6, by order, direct that the land shall, at the expiration of such period as may be specified in the order, vest in the State."
                },
                {
                    "representation": "(2)",
                    "description": "Where the Minister makes an order under subsection"
                }
            ]
        }
    },
    {
        "act": "ACQUISITION OF LANDS (NOT BENEFICIALLY  OCCUPIED) ACT",
        "source": "https://mola.gov.gy/laws-of-guyana",
        "type": {
            "name": "section",
            "representation": "8",
            "title": "Notification of order and suspension of dealings with the land. ",
            "context": "ACQUISITION OF LANDS (NOT BENEFICIALLY  OCCUPIED) ACT under Notification of order and suspension of dealings with the land. 8.  (1) Where an order is made under section 7(1)(b) notice thereof shall be published in the Gazette and served by post on the owner or his attorney, if his appointment has been notified to the Minister, if either is resident in Guyana, at his last known place of residence and, if both are not so resident or cannot by reasonable efforts be found shall be considered served if it is published and affixed in the manner specified in section 4(2) (c) and (d).  (2) From the date of service of the notice under subsection (1), no person shall sell, transfer, lease, mortgage or otherwise alienate or encumber any right, title or interest to or in the land described in the order or enter into any contract relating to that land, until the date of vesting of the land in the LAWS OF GUYANA Acquisition of Lands (Not Beneficially Occupied)   Cap. 62:09 09 9  L.R.O. 1/2012             Certified copy  of order to be deposited in deeds registry.  c. 5:02          Certain provisions of  the Acquisition of Lands for Public Purposes Act, to apply. c. 62:05         Power to deal with land acquired under this Act.  State.  (3) Any sale, transfer, lease, mortgage, alienation,  encumbrance or contract made or entered into contrary to this Act shall be null and void.",
            "description": [
                {
                    "representation": "(1)",
                    "description": "Where an order is made under section 7(1)(b) notice thereof shall be published in the Gazette and served by post on the owner or his attorney, if his appointment has been notified to the Minister, if either is resident in Guyana, at his last known place of residence and, if both are not so resident or cannot by reasonable efforts be found shall be considered served if it is published and affixed in the manner specified in section 4(2)"
                },
                {
                    "representation": "(c)",
                    "description": "and"
                },
                {
                    "representation": "(2)",
                    "description": "From the date of service of the notice under subsection"
                },
                {
                    "representation": "(3)",
                    "description": "Any sale, transfer, lease, mortgage, alienation,  encumbrance or contract made or entered into contrary to this Act shall be null and void."
                }
            ]
        }
    },
    {
        "act": "ACQUISITION OF LANDS (NOT BENEFICIALLY  OCCUPIED) ACT",
        "source": "https://mola.gov.gy/laws-of-guyana",
        "type": {
            "name": "section",
            "representation": "9",
            "title": "Certified copy of order to be deposited in deeds registry or land registry. ",
            "context": "ACQUISITION OF LANDS (NOT BENEFICIALLY  OCCUPIED) ACT under Certified copy of order to be deposited in deeds registry or land registry. 9.  Where any order is made under section 7(1)(b), the Minister shall cause a certified copy of it to be deposited in the deeds registry or where the land in respect of which the order is made is subject to the provisions of the Land Registry Act, in the land registry of the district in  which the land is situate, and from the expiration of the period specified in the order, that certified copy shall be conclusive evidence that the land described in the order is vested in the State. The Registrar of Deeds or the Registrar of Lands, as the case may be, shall file the same and shall make such annotations on the records or the register as may be necessary.",
            "description": "Where any order is made under section 7(1)(b), the Minister shall cause a certified copy of it to be deposited in the deeds registry or where the land in respect of which the order is made is subject to the provisions of the Land Registry Act, in the land registry of the district in  which the land is situate, and from the expiration of the period specified in the order, that certified copy shall be conclusive evidence that the land described in the order is vested in the State. The Registrar of Deeds or the Registrar of Lands, as the case may be, shall file the same and shall make such annotations on the records or the register as may be necessary."
        }
    },
    {
        "act": "ACQUISITION OF LANDS (NOT BENEFICIALLY  OCCUPIED) ACT",
        "source": "https://mola.gov.gy/laws-of-guyana",
        "type": {
            "name": "section",
            "representation": "10",
            "title": "Certain provisions of the Acquisition  of  Lands  for  Public  Purposes Act to apply. ",
            "context": "ACQUISITION OF LANDS (NOT BENEFICIALLY  OCCUPIED) ACT under Certain provisions of the Acquisition  of  Lands  for  Public  Purposes Act to apply. 10.  (1) Sections 13, 14, 15, 16, 17, 18, 19, 21, 22, 23, 24, 24A, 25, 26, and 27 of the Acquisition of Lands for Public Purposes Act shall mutatis mutandis apply in relation to the assessment and award of compensation for land acquired under this Act as they apply in relation to the assessment and award of compensation for land acquired under that Act.  (2) For the purposes of subsection (1), section 18(1) (vi) of the Acquisition of Lands for Public Purposes Act shall have effect as if the words required for the public purpose for which it has been were deleted therefrom.",
            "description": [
                {
                    "representation": "(1)",
                    "description": "(vi) of the Acquisition of Lands for Public Purposes Act shall have effect as if the words required for the public purpose for which it has been were deleted therefrom."
                },
                {
                    "representation": "(2)",
                    "description": "For the purposes of subsection"
                }
            ]
        }
    },
    {
        "act": "ACQUISITION OF LANDS (NOT BENEFICIALLY  OCCUPIED) ACT",
        "source": "https://mola.gov.gy/laws-of-guyana",
        "type": {
            "name": "section",
            "representation": "11",
            "title": "Power to deal with land acquired under this Act. ",
            "context": "ACQUISITION OF LANDS (NOT BENEFICIALLY  OCCUPIED) ACT under Power to deal with land acquired under this Act. 11.  Land acquired under this Act may be sold, leased or otherwise dealt with in all respects in the same manner in which State land is sold, leased or otherwise dealt with from time to time by any law, practice or procedure.",
            "description": "Land acquired under this Act may be sold, leased or otherwise dealt with in all respects in the same manner in which State land is sold, leased or otherwise dealt with from time to time by any law, practice or procedure."
        }
    },
    {
        "act": "ACQUISITION OF LANDS (NOT BENEFICIALLY  OCCUPIED) ACT",
        "source": "https://mola.gov.gy/laws-of-guyana",
        "type": {
            "name": "section",
            "representation": "12",
            "title": "Obstructing public officer or other person in the execution of functions under this Act. ",
            "context": "ACQUISITION OF LANDS (NOT BENEFICIALLY  OCCUPIED) ACT under Obstructing public officer or other person in the execution of functions under this Act. 12.  Any person who obstructs a public officer or other person in the execution of his functions under this Act or aids or abets any person in so doing shall be liable on summary execution of in the or other person public officer Obstructing  LAWS OF GUYANA 10 Cap. 62:09 Acquisition of Lands (Not Beneficially Occupied)  L.R.O. 1/2012 functions under this Act. [6 of 1997]   Protection of persons acting under this Act. c. 5:07  High Court to issue writ of possession.  conviction to a fine of forty-one thousand two hundred and fifty dollars, and in default of payment to imprisonment for six months.",
            "description": "Any person who obstructs a public officer or other person in the execution of his functions under this Act or aids or abets any person in so doing shall be liable on summary execution of in the or other person public officer Obstructing  LAWS OF GUYANA 10 Cap. 62:09 Acquisition of Lands (Not Beneficially Occupied)  L.R.O. 1/2012 functions under this Act. [6 of 1997]   Protection of persons acting under this Act. c. 5:07  High Court to issue writ of possession.  conviction to a fine of forty-one thousand two hundred and fifty dollars, and in default of payment to imprisonment for six months."
        }
    },
    {
        "act": "ACQUISITION OF LANDS (NOT BENEFICIALLY  OCCUPIED) ACT",
        "source": "https://mola.gov.gy/laws-of-guyana",
        "type": {
            "name": "section",
            "representation": "13",
            "title": "Protection of persons acting under this Act. ",
            "context": "ACQUISITION OF LANDS (NOT BENEFICIALLY  OCCUPIED) ACT under Protection of persons acting under this Act. 13.  Any  person  acting  under  this  Act  shall  be  entitled  to  the protection afforded by the Justices Protection Act.",
            "description": "Any  person  acting  under  this  Act  shall  be  entitled  to  the protection afforded by the Justices Protection Act."
        }
    }
]