[
    {
        "act": "BLASTING OPERATIONS ACT",
        "source": "https://mola.gov.gy/laws-of-guyana",
        "type": {
            "name": "section",
            "representation": "1",
            "title": "Short title. ",
            "context": "BLASTING OPERATIONS ACT under Short title. 1.  This Act may be cited as the Blasting Operations Act.",
            "description": "This Act may be cited as the Blasting Operations Act."
        }
    },
    {
        "act": "BLASTING OPERATIONS ACT",
        "source": "https://mola.gov.gy/laws-of-guyana",
        "type": {
            "name": "section",
            "representation": "2",
            "title": "Interpretation. ",
            "context": "BLASTING OPERATIONS ACT under Interpretation. 2.  In this Act, the expression explosive has the same meaning as that given to it in section 2 of the Explosives Act.",
            "description": "In this Act, the expression explosive has the same meaning as that given to it in section 2 of the Explosives Act."
        }
    },
    {
        "act": "BLASTING OPERATIONS ACT",
        "source": "https://mola.gov.gy/laws-of-guyana",
        "type": {
            "name": "section",
            "representation": "3",
            "title": "Authority to blast. ",
            "context": "BLASTING OPERATIONS ACT under Authority to blast. 3. (1) No person shall lay, tamp or fire a charge for any blasting operation unless he holds a certificate of competency as a blaster under this Act.  (2) Any person not holding such a certificate who LAWS OF GUYANA 4 Cap. 65:03 Blasting Operations   L.R.O. 1/2012       Certificate of competency.  [18 of 1952 1 of 1972 4 of 1972 6 of 1997]                                Schedule.     lays, tamps or fires a charge shall be liable on summary conviction to a fine of nineteen thousand five hundred dollars.",
            "description": [
                {
                    "representation": "(1)",
                    "description": "No person shall lay, tamp or fire a charge for any blasting operation unless he holds a certificate of competency as a blaster under this Act."
                },
                {
                    "representation": "(2)",
                    "description": "Any person not holding such a certificate who LAWS OF GUYANA 4 Cap. 65:03 Blasting Operations   L.R.O. 1/2012       Certificate of competency.  [18 of 1952 1 of 1972 4 of 1972 6 of 1997]                                Schedule.     lays, tamps or fires a charge shall be liable on summary conviction to a fine of nineteen thousand five hundred dollars."
                }
            ]
        }
    },
    {
        "act": "BLASTING OPERATIONS ACT",
        "source": "https://mola.gov.gy/laws-of-guyana",
        "type": {
            "name": "section",
            "representation": "4",
            "title": "Certificate of competency. ",
            "context": "BLASTING OPERATIONS ACT under Certificate of competency. 4. (1) The  Commissioner  of  Geological  Surveys  and  Mines (hereinafter referred to as the Commissioner) may grant a certificate of competency as a blaster to any person above the age of twenty years applying  therefor  who,  after  examination  by  such  person  as  the Commissioner may appoint in that behalf, appears   to   the Commissioner to be  practically conversant with the safe use and handling of explosives and the laying, tamping and firing of charges. Any person holding an examination shall report in writing the result thereof to the Commissioner.  (2) Where the holder of a certificate of competency by reason of any emergency is unable to perform his duties, the manager of such concession or other undertaking may, if authorised in writing by the Commissioner so to do, issue an emergency certificate of competency to any fit and proper person authorising such person to lay, tamp or fire charges for any blasting  operations on such mining concession or undertaking:  Provided that   no   emergency   certificate   issued   under   this subsection shall have effect when the emergency in respect of which it was issued has ceased to exist.  (3) Every person applying for the grant of a certificate of competency under subsection (1) shall pay into the office of the Commissioner an examination fee of six hundred and fifty dollars and any certificate of competency issued under subsection (1) or (2) shall be in the form set out in the Schedule, and shall be valid for such period not exceeding thirty days as may be stated therein.  (4) Any manager of a mining concession or LAWS OF GUYANA Blasting Operations Cap. 65:03 5  L.R.O. 1/2012                   Cancellation   or suspension of certificate.  [18 of 1952]    Register of holders of certificates. [18 of 1952]  Regulations. [1 of 1972 6 of 1997]                 undertaking who   (a)   issues  an  emergency  certificate  of  competency otherwise than in accordance with subsections (2) and (3); or  (b)    knowingly permits any person on any area under his control, to contravene section 3,  shall be liable on summary conviction to a fine of ninety-seven thousand dollars.",
            "description": [
                {
                    "representation": "(1)",
                    "description": "or"
                },
                {
                    "representation": "(2)",
                    "description": "and"
                },
                {
                    "representation": "(3)",
                    "description": "Every person applying for the grant of a certificate of competency under subsection"
                },
                {
                    "representation": "(4)",
                    "description": "Any manager of a mining concession or LAWS OF GUYANA Blasting Operations Cap. 65:03 5  L.R.O. 1/2012                   Cancellation   or suspension of certificate.  [18 of 1952]    Register of holders of certificates. [18 of 1952]  Regulations. [1 of 1972 6 of 1997]                 undertaking who"
                },
                {
                    "representation": "(a)",
                    "description": "issues  an  emergency  certificate  of  competency otherwise than in accordance with subsections"
                },
                {
                    "representation": "(b)",
                    "description": "knowingly permits any person on any area under his control, to contravene section 3,  shall be liable on summary conviction to a fine of ninety-seven thousand dollars."
                }
            ]
        }
    },
    {
        "act": "BLASTING OPERATIONS ACT",
        "source": "https://mola.gov.gy/laws-of-guyana",
        "type": {
            "name": "section",
            "representation": "5",
            "title": "Cancellation or suspension of certificate. ",
            "context": "BLASTING OPERATIONS ACT under Cancellation or suspension of certificate. 5.  The Commissioner may, in his discretion, cancel or suspend at any time any certificate of competency granted by him on any ground of incompetency or negligence on the part of the holder thereof.",
            "description": "The Commissioner may, in his discretion, cancel or suspend at any time any certificate of competency granted by him on any ground of incompetency or negligence on the part of the holder thereof."
        }
    },
    {
        "act": "BLASTING OPERATIONS ACT",
        "source": "https://mola.gov.gy/laws-of-guyana",
        "type": {
            "name": "section",
            "representation": "6",
            "title": "Register of holders of certificates. ",
            "context": "BLASTING OPERATIONS ACT under Register of holders of certificates. 6.  The Commissioner shall cause to be kept a register of all holders of certificates of competency.",
            "description": "The Commissioner shall cause to be kept a register of all holders of certificates of competency."
        }
    },
    {
        "act": "BLASTING OPERATIONS ACT",
        "source": "https://mola.gov.gy/laws-of-guyana",
        "type": {
            "name": "section",
            "representation": "7",
            "title": "Regulations.  SCHEDULE- Certificate of Competency          Emergency Certificate of Competency.   __________________________  1953 Ed. c. 197 _______________________________________________________ 27 of 1930 An Act to provide for the regulation of persons engaged in blasting operations.  [2nd AUGUST, 1930]  Short Title.    Interpretation. c 16:06   Authority to blast. [6 of 1997]    ",
            "context": "BLASTING OPERATIONS ACT under Regulations.  SCHEDULE- Certificate of Competency          Emergency Certificate of Competency.   __________________________  1953 Ed. c. 197 _______________________________________________________ 27 of 1930 An Act to provide for the regulation of persons engaged in blasting operations.  [2nd AUGUST, 1930]  Short Title.    Interpretation. c 16:06   Authority to blast. [6 of 1997]    7. (1) The Minister responsible for national security may make regulations which shall be subject to negative resolution, for the safe handling, use, storage and transport of explosives for use in blasting operations.  (2) There may be annexed to any regulations for the breach thereof a penalty not exceeding sixty-five thousand dollars.   ____________________     LAWS OF GUYANA 6 Cap. 65:03 Blasting Operations   L.R.O. 1/2012    s. 4  1 of 1972    SCHEDULE   CERTIFICATE OF COMPETENCY  Under section  4  of  the  Blasting  Operations  Act  a  certificate  of competency as a blaster is hereby granted to _________________________________________________               Commissioner of Geological Surveys       Dated thisday of19  __________    EMERGENCY CERTIFICATE OF COMPETENCY  Under section 4 of the Blasting Operations Act a provisional certificate of competency as a blaster for the period ...................day of .....................................",
            "description": [
                {
                    "representation": "(1)",
                    "description": "The Minister responsible for national security may make regulations which shall be subject to negative resolution, for the safe handling, use, storage and transport of explosives for use in blasting operations."
                },
                {
                    "representation": "(2)",
                    "description": "There may be annexed to any regulations for the breach thereof a penalty not exceeding sixty-five thousand dollars.   ____________________     LAWS OF GUYANA 6 Cap. 65:03 Blasting Operations   L.R.O. 1/2012    s. 4  1 of 1972    SCHEDULE   CERTIFICATE OF COMPETENCY  Under section  4  of  the  Blasting  Operations  Act  a  certificate  of competency as a blaster is hereby granted to _________________________________________________               Commissioner of Geological Surveys       Dated thisday of19  __________    EMERGENCY CERTIFICATE OF COMPETENCY  Under section 4 of the Blasting Operations Act a provisional certificate of competency as a blaster for the period ...................day of ....................................."
                }
            ]
        }
    },
    {
        "act": "BLASTING OPERATIONS ACT",
        "source": "https://mola.gov.gy/laws-of-guyana",
        "type": {
            "name": "section",
            "representation": "",
            "title": "19.....................,to.................................day of ",
            "context": "BLASTING OPERATIONS ACT under 19.....................,to.................................day of 19..., is hereby granted to..............................  Dated this ............................... day of. ....................",
            "description": "19..., is hereby granted to..............................  Dated this ............................... day of. ...................."
        }
    }
]