[
    {
        "act": "GUYANA GOLD BOARD ACT",
        "source": "https://mola.gov.gy/laws-of-guyana",
        "type": {
            "name": "section",
            "representation": "1",
            "title": "Short title. ",
            "context": "GUYANA GOLD BOARD ACT under Short title. 1. This Act may be cited as the Guyana Gold Board Act.",
            "description": "This Act may be cited as the Guyana Gold Board Act."
        }
    },
    {
        "act": "GUYANA GOLD BOARD ACT",
        "source": "https://mola.gov.gy/laws-of-guyana",
        "type": {
            "name": "section",
            "representation": "2",
            "title": "Interpretation. ",
            "context": "GUYANA GOLD BOARD ACT under Interpretation. 2. In this Act   Board means the Board established by section 3;   claim has the meaning assigned to it by the Mining Act;  gold means raw gold, and includes unrefined gold amalgam, slimes and scrapings  containing  gold,  and  smelted  gold  that  is  not manufactured into any article of commerce;  producer includes  (a) any holder or licensee of a claim;  (b) any holder of a prospecting licence who has obtained gold during prospecting operations; or  (c) any tributor who has lawfully obtained gold from a claim on which he is working under a contract whereby all or part of any gold won by him becomes his property.",
            "description": [
                {
                    "representation": "(a)",
                    "description": "any holder or licensee of a claim;"
                },
                {
                    "representation": "(b)",
                    "description": "any holder of a prospecting licence who has obtained gold during prospecting operations; or"
                },
                {
                    "representation": "(c)",
                    "description": "any tributor who has lawfully obtained gold from a claim on which he is working under a contract whereby all or part of any gold won by him becomes his property."
                }
            ]
        }
    },
    {
        "act": "GUYANA GOLD BOARD ACT",
        "source": "https://mola.gov.gy/laws-of-guyana",
        "type": {
            "name": "section",
            "representation": "3",
            "title": "Establishment of the Board. ",
            "context": "GUYANA GOLD BOARD ACT under Establishment of the Board. 3. There is hereby established the Guyana Gold Board which shall be a body corporate and the provisions of the First Schedule shall have effect as  to  the constitution of the Board and otherwise in relation thereto.",
            "description": "There is hereby established the Guyana Gold Board which shall be a body corporate and the provisions of the First Schedule shall have effect as  to  the constitution of the Board and otherwise in relation thereto."
        }
    },
    {
        "act": "GUYANA GOLD BOARD ACT",
        "source": "https://mola.gov.gy/laws-of-guyana",
        "type": {
            "name": "section",
            "representation": "4",
            "title": "Functions of the Board. ",
            "context": "GUYANA GOLD BOARD ACT under Functions of the Board. 4. It shall be the function of the Board  LAWS OF GUYANA Guyana Gold Board Cap. 66:01 5  L.R.O. 1/2012                        Fixing the price of gold.    Producers to sell gold to the Board. [5 of 1994]                  (a) to carry on the business of trading in gold;  (b) to secure at all times an adequate supply of gold and to ensure its equitable distribution in Guyana at fair prices;  (c) subject to this Act, to purchase all gold produced in Guyana;  (d) subject to this Act, to sell all gold in Guyana and to sell gold outside Guyana;  (e) to engage in other related commercial or industrial activities.",
            "description": [
                {
                    "representation": "(a)",
                    "description": "to carry on the business of trading in gold;"
                },
                {
                    "representation": "(b)",
                    "description": "to secure at all times an adequate supply of gold and to ensure its equitable distribution in Guyana at fair prices;"
                },
                {
                    "representation": "(c)",
                    "description": "subject to this Act, to purchase all gold produced in Guyana;"
                },
                {
                    "representation": "(d)",
                    "description": "subject to this Act, to sell all gold in Guyana and to sell gold outside Guyana;"
                },
                {
                    "representation": "(e)",
                    "description": "to engage in other related commercial or industrial activities."
                }
            ]
        }
    },
    {
        "act": "GUYANA GOLD BOARD ACT",
        "source": "https://mola.gov.gy/laws-of-guyana",
        "type": {
            "name": "section",
            "representation": "5",
            "title": "Fixing the price of gold. ",
            "context": "GUYANA GOLD BOARD ACT under Fixing the price of gold. 5. The Board shall, from time to time, with the approval of the Minister, by notice in the Gazette, fix the price at which the Board shall purchase or sell gold in Guyana.",
            "description": "The Board shall, from time to time, with the approval of the Minister, by notice in the Gazette, fix the price at which the Board shall purchase or sell gold in Guyana."
        }
    },
    {
        "act": "GUYANA GOLD BOARD ACT",
        "source": "https://mola.gov.gy/laws-of-guyana",
        "type": {
            "name": "section",
            "representation": "6",
            "title": "Producers to sell gold to the Board. ",
            "context": "GUYANA GOLD BOARD ACT under Producers to sell gold to the Board. 6. (1) Every producer who possesses gold, won or obtained during operations as a producer, before the date of coming into operation of the Guyana Gold Board (Amendment) Act, shall sell such gold to the Board or to any agent authorised in writing by the Board in that behalf within twenty-eight days of the said date.  (2) Every producer who wins or obtains gold during operations as a producer shall, within twenty-eight days after his winning or obtaining such  gold and within twenty-four hours of conveying such gold to Georgetown or any other place determined by the Minister by notice in the Gazette, or such longer period as the Board may allow, sell such gold to the Board or to any agent authorised in writing by the Board in that behalf:  Provided that if the office of the Board is closed when the LAWS OF GUYANA 6 Cap. 66:01 Guyana Gold Board  L.R.O. 1/2012             Other persons in possession of gold. [5 of 1994]                       c. 80:01           producer brings such gold to Georgetown or other place, the producer shall sell such gold to the Board on the first day following when the office of the Board is open:  Provided further that where an application is made to the Board by a producer in the manner determined by the Board, the Board may authorise that producer to retain such quantity of gold as it deems fit for his personal use and not for trade.",
            "description": [
                {
                    "representation": "(1)",
                    "description": "Every producer who possesses gold, won or obtained during operations as a producer, before the date of coming into operation of the Guyana Gold Board"
                },
                {
                    "representation": "(2)",
                    "description": "Every producer who wins or obtains gold during operations as a producer shall, within twenty-eight days after his winning or obtaining such  gold and within twenty-four hours of conveying such gold to Georgetown or any other place determined by the Minister by notice in the Gazette, or such longer period as the Board may allow, sell such gold to the Board or to any agent authorised in writing by the Board in that behalf:  Provided that if the office of the Board is closed when the LAWS OF GUYANA 6 Cap. 66:01 Guyana Gold Board  L.R.O. 1/2012             Other persons in possession of gold. [5 of 1994]                       c. 80:01           producer brings such gold to Georgetown or other place, the producer shall sell such gold to the Board on the first day following when the office of the Board is open:  Provided further that where an application is made to the Board by a producer in the manner determined by the Board, the Board may authorise that producer to retain such quantity of gold as it deems fit for his personal use and not for trade."
                }
            ]
        }
    },
    {
        "act": "GUYANA GOLD BOARD ACT",
        "source": "https://mola.gov.gy/laws-of-guyana",
        "type": {
            "name": "section",
            "representation": "7",
            "title": "Other persons in possession of gold. ",
            "context": "GUYANA GOLD BOARD ACT under Other persons in possession of gold. 7. (1) Every person, not being a producer, who has gold in his possession shall, within twenty-eight days after the coming into operation of this Act sell such gold to the Board or to any agent authorised in writing by the Board in that behalf.  (2) It shall be unlawful for any person, not being a producer, to have any quantity of gold in his possession.  (3) Every person, not being a producer, who has any quantity of gold in his possession on the date of the coming into operation of the Guyana Gold Board (Amendment) Act shall, within twenty-eight days of the  said date, sell such gold to the Board or to any agent authorised in writing by the Board in that behalf:  Provided that this section shall not apply to any person who  (a) is lawfully in possession of gold as the holder of a goldsmiths licence under section 59 of the Tax Act or as a duly registered dentist under any law for the time being in force in Guyana; or  (b) is in possession of gold not obtained in Guyana and who in transit in Guyana, the onus of proof thereof being on the person in possession of such gold. LAWS OF GUYANA Guyana Gold Board Cap. 66:01 7  L.R.O. 1/2012   Gold to be sold to and purchased from the Board.  Exemptions.  [5 of 1994]           c. 65:01  c. 80:01",
            "description": [
                {
                    "representation": "(1)",
                    "description": "Every person, not being a producer, who has gold in his possession shall, within twenty-eight days after the coming into operation of this Act sell such gold to the Board or to any agent authorised in writing by the Board in that behalf."
                },
                {
                    "representation": "(2)",
                    "description": "It shall be unlawful for any person, not being a producer, to have any quantity of gold in his possession."
                },
                {
                    "representation": "(3)",
                    "description": "Every person, not being a producer, who has any quantity of gold in his possession on the date of the coming into operation of the Guyana Gold Board"
                },
                {
                    "representation": "(a)",
                    "description": "is lawfully in possession of gold as the holder of a goldsmiths licence under section 59 of the Tax Act or as a duly registered dentist under any law for the time being in force in Guyana; or"
                },
                {
                    "representation": "(b)",
                    "description": "is in possession of gold not obtained in Guyana and who in transit in Guyana, the onus of proof thereof being on the person in possession of such gold. LAWS OF GUYANA Guyana Gold Board Cap. 66:01 7  L.R.O. 1/2012   Gold to be sold to and purchased from the Board.  Exemptions.  [5 of 1994]           c. 65:01  c. 80:01"
                }
            ]
        }
    },
    {
        "act": "GUYANA GOLD BOARD ACT",
        "source": "https://mola.gov.gy/laws-of-guyana",
        "type": {
            "name": "section",
            "representation": "8",
            "title": "Gold to be sold to and purchased from the Board. ",
            "context": "GUYANA GOLD BOARD ACT under Gold to be sold to and purchased from the Board. 8. No person shall sell any gold to, or purchase any gold from, any person other than the Board or any agent authorised in writing by the Board or export any gold.",
            "description": "No person shall sell any gold to, or purchase any gold from, any person other than the Board or any agent authorised in writing by the Board or export any gold."
        }
    },
    {
        "act": "GUYANA GOLD BOARD ACT",
        "source": "https://mola.gov.gy/laws-of-guyana",
        "type": {
            "name": "section",
            "representation": "9",
            "title": "Exemptions. ",
            "context": "GUYANA GOLD BOARD ACT under Exemptions. 9. (1) Notwithstanding the provisions of sections 7 and 8, where application is made to the Board by any person in the prescribed manner the Board may authorise that person to have in his possession or to sell or export such quantity of gold as the Board may allow subject to such conditions as the Board may think fit to impose.  (2) Nothing in this Act shall be construed as prohibiting any transaction in a mining district within the meaning of the Mining Act whereby a person who is duly authorised under the Tax Act to sell, barter or expose for sale goods at any place in the mining district (hereinafter in this section referred to as the licensee) advances money or supplies goods on credit to a miner in consideration of payment being made therefor with gold won or obtained in the course of prospecting for, exploiting and processing, gold and precious stones:  Provided that the licensee shall  (a) within ten days of receipt thereof inform the Board of such receipt, and  (b) on demand sell all gold so received to the Board at the price fixed under section",
            "description": [
                {
                    "representation": "(1)",
                    "description": "Notwithstanding the provisions of sections 7 and 8, where application is made to the Board by any person in the prescribed manner the Board may authorise that person to have in his possession or to sell or export such quantity of gold as the Board may allow subject to such conditions as the Board may think fit to impose."
                },
                {
                    "representation": "(2)",
                    "description": "Nothing in this Act shall be construed as prohibiting any transaction in a mining district within the meaning of the Mining Act whereby a person who is duly authorised under the Tax Act to sell, barter or expose for sale goods at any place in the mining district"
                },
                {
                    "representation": "(a)",
                    "description": "within ten days of receipt thereof inform the Board of such receipt, and"
                },
                {
                    "representation": "(b)",
                    "description": "on demand sell all gold so received to the Board at the price fixed under section"
                }
            ]
        }
    },
    {
        "act": "GUYANA GOLD BOARD ACT",
        "source": "https://mola.gov.gy/laws-of-guyana",
        "type": {
            "name": "section",
            "representation": "10",
            "title": "Authority to purchase gold. ",
            "context": "GUYANA GOLD BOARD ACT under Authority to purchase gold. 10. (1) Notwithstanding the provisions of sections 7 and 8 any person who is duly authorised under the Tax Act to sell, barter or expose for sale goods at any place in a mining district (hereinafter in this section referred to as the licensee) is hereby authorised by the Board to purchase gold:  Provided that  (a) within fourteen days of the purchase of such gold the licensee shall inform the Board of such purchase; and  (b) on demand sell all gold in his possession to the Board at the price fixed under section",
            "description": [
                {
                    "representation": "(1)",
                    "description": "Notwithstanding the provisions of sections 7 and 8 any person who is duly authorised under the Tax Act to sell, barter or expose for sale goods at any place in a mining district"
                },
                {
                    "representation": "(a)",
                    "description": "within fourteen days of the purchase of such gold the licensee shall inform the Board of such purchase; and"
                },
                {
                    "representation": "(b)",
                    "description": "on demand sell all gold in his possession to the Board at the price fixed under section"
                }
            ]
        }
    },
    {
        "act": "GUYANA GOLD BOARD ACT",
        "source": "https://mola.gov.gy/laws-of-guyana",
        "type": {
            "name": "section",
            "representation": "11",
            "title": "Disclosure of interest by member of the Board. ",
            "context": "GUYANA GOLD BOARD ACT under Disclosure of interest by member of the Board. 11. (1) Any member of the Board whose interest is likely to be affected whether directly or indirectly by a decision of the Board on any matter whatsoever, shall disclose the nature of the interest at the first meeting of the Board at which he is present after the relevant facts have come to his knowledge.  (2) A disclosure under subsection (1) shall be recorded in the minutes of the Board, and after the disclosure, the member of the Board making the disclosure shall, unless the Board otherwise directs, not be present or take part in the deliberation or vote at any meeting during the time when such matter is being decided by the Board.  (3) For the purposes of this section, where the interest of parents, spouse or children of any member of the Board is likely to be affected directly or indirectly by a decision of the Board on any matter, such interest shall be deemed to be the interest of that member.  (4) The Minister may revoke the appointment of any member who contravenes or fails to comply with the provisions of this section.",
            "description": [
                {
                    "representation": "(1)",
                    "description": "shall be recorded in the minutes of the Board, and after the disclosure, the member of the Board making the disclosure shall, unless the Board otherwise directs, not be present or take part in the deliberation or vote at any meeting during the time when such matter is being decided by the Board."
                },
                {
                    "representation": "(2)",
                    "description": "A disclosure under subsection"
                },
                {
                    "representation": "(3)",
                    "description": "For the purposes of this section, where the interest of parents, spouse or children of any member of the Board is likely to be affected directly or indirectly by a decision of the Board on any matter, such interest shall be deemed to be the interest of that member."
                },
                {
                    "representation": "(4)",
                    "description": "The Minister may revoke the appointment of any member who contravenes or fails to comply with the provisions of this section."
                }
            ]
        }
    },
    {
        "act": "GUYANA GOLD BOARD ACT",
        "source": "https://mola.gov.gy/laws-of-guyana",
        "type": {
            "name": "section",
            "representation": "12",
            "title": "Employment of officers and other employees of the Board. ",
            "context": "GUYANA GOLD BOARD ACT under Employment of officers and other employees of the Board. 12. (1) The Board may, with the approval of the Minister, appoint a General Manager, a Secretary and such other officers and other employees at such remuneration and on such other terms and conditions as the Board, with the approval of the Minister, may determine.  LAWS OF GUYANA 10 Cap. 66:01 Guyana Gold Board  L.R.O. 1/2012          c. 27:02              c. 39:05                          (2) The Board may, at any time, retain the services of experts and other professional persons and may pay such remuneration in respect thereof as the Board, with the approval of the Minister, may determine.  (3) Where a public officer is seconded or temporarily transferred from a pensionable office within the meaning of the Pensions Act to an office with the Board, section 5 of that Act shall apply to him as if his service with the Board were service in a public office.  (4) Where a public officer is appointed to an office with the Board, his service with the Board shall be other public service within the meaning of, and for the purpose of such provisions applicable in relation thereto as are contained in the Pensions Act (including the Pensions Regulations 1957).  (5) Where a teacher who has done qualifying service within the meaning of the Teachers Pensions Act is, with the approval of the appropriate authority  (a) seconded or temporarily transferred from his office as a teacher to an office the power of appointment to which is vested by this Act in the Board, section 5 of the Pensions Act (as applied to a teacher by section 7C of the Teachers Pensions Act) shall apply to him;  (b) transferred from his office as a teacher to a substantive appointment in an office the power of appointment to which is vested by this Act in the Board, his service with the Board shall be treated as if it were other public service within the meaning of, and for the purposes of such provisions applicable in relation thereto as are LAWS OF GUYANA Guyana Gold Board Cap. 66:01 11  L.R.O. 1/2012                 Funds of the Board.             Borrowing powers of the Board.     Investments.        Audit and accounts of the Board. [6 of 1997]   contained in, the Pensions Act (including the Pensions Regulations 1957) and as if the teacher were an officer to whom the Pensions Act applies.  (6) In this section, appropriate authority means the person or authority vested by law with power to appoint the officer to the pensionable office held by him (and to which the Pensions Act applies) or to appoint the teacher to the office held by him as a teacher, as the case may be.",
            "description": [
                {
                    "representation": "(1)",
                    "description": "The Board may, with the approval of the Minister, appoint a General Manager, a Secretary and such other officers and other employees at such remuneration and on such other terms and conditions as the Board, with the approval of the Minister, may determine.  LAWS OF GUYANA 10 Cap. 66:01 Guyana Gold Board  L.R.O. 1/2012          c. 27:02              c. 39:05"
                },
                {
                    "representation": "(2)",
                    "description": "The Board may, at any time, retain the services of experts and other professional persons and may pay such remuneration in respect thereof as the Board, with the approval of the Minister, may determine."
                },
                {
                    "representation": "(3)",
                    "description": "Where a public officer is seconded or temporarily transferred from a pensionable office within the meaning of the Pensions Act to an office with the Board, section 5 of that Act shall apply to him as if his service with the Board were service in a public office."
                },
                {
                    "representation": "(4)",
                    "description": "Where a public officer is appointed to an office with the Board, his service with the Board shall be other public service within the meaning of, and for the purpose of such provisions applicable in relation thereto as are contained in the Pensions Act"
                },
                {
                    "representation": "(5)",
                    "description": "Where a teacher who has done qualifying service within the meaning of the Teachers Pensions Act is, with the approval of the appropriate authority"
                },
                {
                    "representation": "(a)",
                    "description": "seconded or temporarily transferred from his office as a teacher to an office the power of appointment to which is vested by this Act in the Board, section 5 of the Pensions Act"
                },
                {
                    "representation": "(b)",
                    "description": "transferred from his office as a teacher to a substantive appointment in an office the power of appointment to which is vested by this Act in the Board, his service with the Board shall be treated as if it were other public service within the meaning of, and for the purposes of such provisions applicable in relation thereto as are LAWS OF GUYANA Guyana Gold Board Cap. 66:01 11  L.R.O. 1/2012                 Funds of the Board.             Borrowing powers of the Board.     Investments.        Audit and accounts of the Board. [6 of 1997]   contained in, the Pensions Act"
                },
                {
                    "representation": "(6)",
                    "description": "In this section, appropriate authority means the person or authority vested by law with power to appoint the officer to the pensionable office held by him"
                }
            ]
        }
    },
    {
        "act": "GUYANA GOLD BOARD ACT",
        "source": "https://mola.gov.gy/laws-of-guyana",
        "type": {
            "name": "section",
            "representation": "13",
            "title": "Funds of the Board. ",
            "context": "GUYANA GOLD BOARD ACT under Funds of the Board. 13. (1) The Board shall maintain a fund into which shall be paid all such monies as may, from time to time, be appropriated for its purpose by Parliament and such other monies as may lawfully be paid to the Board, and out of the fund shall be paid all expenses incurred by the Board in carrying out its functions under this Act and all other liabilities properly incurred by the Board.  (2) The Board shall manage, administer and keep proper accounts of the fund.",
            "description": [
                {
                    "representation": "(1)",
                    "description": "The Board shall maintain a fund into which shall be paid all such monies as may, from time to time, be appropriated for its purpose by Parliament and such other monies as may lawfully be paid to the Board, and out of the fund shall be paid all expenses incurred by the Board in carrying out its functions under this Act and all other liabilities properly incurred by the Board."
                },
                {
                    "representation": "(2)",
                    "description": "The Board shall manage, administer and keep proper accounts of the fund."
                }
            ]
        }
    },
    {
        "act": "GUYANA GOLD BOARD ACT",
        "source": "https://mola.gov.gy/laws-of-guyana",
        "type": {
            "name": "section",
            "representation": "14",
            "title": "Borrowing powers of the Board. ",
            "context": "GUYANA GOLD BOARD ACT under Borrowing powers of the Board. 14. The Board may, with the approval of the Minister responsible for finance, borrow sums required by the Board for meeting any of its obligations or discharging any of its functions.",
            "description": "The Board may, with the approval of the Minister responsible for finance, borrow sums required by the Board for meeting any of its obligations or discharging any of its functions."
        }
    },
    {
        "act": "GUYANA GOLD BOARD ACT",
        "source": "https://mola.gov.gy/laws-of-guyana",
        "type": {
            "name": "section",
            "representation": "15",
            "title": "Investments. ",
            "context": "GUYANA GOLD BOARD ACT under Investments. 15. Monies standing to the credit of the Board may, from time to time be invested in securities approved either generally or specifically by the Minister, and the Board may from time to time with the like approval sell all or any of such securities.",
            "description": "Monies standing to the credit of the Board may, from time to time be invested in securities approved either generally or specifically by the Minister, and the Board may from time to time with the like approval sell all or any of such securities."
        }
    },
    {
        "act": "GUYANA GOLD BOARD ACT",
        "source": "https://mola.gov.gy/laws-of-guyana",
        "type": {
            "name": "section",
            "representation": "16",
            "title": "Audit and accounts of the Board. ",
            "context": "GUYANA GOLD BOARD ACT under Audit and accounts of the Board. 16. (1) The accounts of the Board shall be audited annually by an auditor appointed by the Minister.  (2) The Minister may at any time appoint an auditor to examine the accounts of the Board and to report LAWS OF GUYANA 12 Cap. 66:01 Guyana Gold Board  L.R.O. 1/2012                                   Annual report.               thereon to him.  (3) The members, officers and other employees of the Board shall grant to the auditor so appointed access to all books, documents, cash and securities of the Board and shall give to him on request all such information  as  may be within  their  knowledge  in relation  to the operations of the Board.   (4) An auditor appointed under this section has power to summon and examine all persons whom he shall think fit to examine for the purpose of obtaining information in connection with the examination and audit of the accounts of the Board and respecting all other matters and things whatever necessary for the due performance of the functions vested in him; and if any person summoned as aforesaid is not a public officer or a member or any officer or other employee of the Board he is entitled to be paid for his attendance as if he were a witness attending a legal proceeding in obedience to the summons issued at the instance of the State.  (5) Any person summoned under subsection (4) who, without reasonable excuse, makes default in obeying such summons is liable on summary conviction to a fine of two thousand seven hundred and fifty dollars or, in default of payment thereof, to imprisonment for one month.",
            "description": [
                {
                    "representation": "(1)",
                    "description": "The accounts of the Board shall be audited annually by an auditor appointed by the Minister."
                },
                {
                    "representation": "(2)",
                    "description": "The Minister may at any time appoint an auditor to examine the accounts of the Board and to report LAWS OF GUYANA 12 Cap. 66:01 Guyana Gold Board  L.R.O. 1/2012                                   Annual report.               thereon to him."
                },
                {
                    "representation": "(3)",
                    "description": "The members, officers and other employees of the Board shall grant to the auditor so appointed access to all books, documents, cash and securities of the Board and shall give to him on request all such information  as  may be within  their  knowledge  in relation  to the operations of the Board."
                },
                {
                    "representation": "(4)",
                    "description": "who, without reasonable excuse, makes default in obeying such summons is liable on summary conviction to a fine of two thousand seven hundred and fifty dollars or, in default of payment thereof, to imprisonment for one month."
                },
                {
                    "representation": "(5)",
                    "description": "Any person summoned under subsection"
                }
            ]
        }
    },
    {
        "act": "GUYANA GOLD BOARD ACT",
        "source": "https://mola.gov.gy/laws-of-guyana",
        "type": {
            "name": "section",
            "representation": "17",
            "title": "Annual report. ",
            "context": "GUYANA GOLD BOARD ACT under Annual report. 17. (1) The Board shall, not later than six months after the end of each calendar year, submit to the Minister a report containing  (a) an account of its transactions throughout the preceding calendar year in such detail as the Minister may direct; and   (b) a statement of the accounts of the Board audited in accordance with section",
            "description": [
                {
                    "representation": "(1)",
                    "description": "The Board shall, not later than six months after the end of each calendar year, submit to the Minister a report containing"
                },
                {
                    "representation": "(a)",
                    "description": "an account of its transactions throughout the preceding calendar year in such detail as the Minister may direct; and"
                },
                {
                    "representation": "(b)",
                    "description": "a statement of the accounts of the Board audited in accordance with section"
                }
            ]
        }
    },
    {
        "act": "GUYANA GOLD BOARD ACT",
        "source": "https://mola.gov.gy/laws-of-guyana",
        "type": {
            "name": "section",
            "representation": "18",
            "title": "Power of the Minister to give directions to the Board. ",
            "context": "GUYANA GOLD BOARD ACT under Power of the Minister to give directions to the Board. 18. (1) The Minister may, after consultation with the Board, give to the Board directions of a general or special character as to the policy to be followed by the Board in the performance of its functions as appears to the Minister to be requisite in the public interest, and the Board shall give effect to any such directions.  (2) The Board shall afford to the Minister facilities for obtaining information with respect to the property and activities of the Board and furnish him with returns, accounts and other information with respect thereto in such manner and at such times as he may require.",
            "description": [
                {
                    "representation": "(1)",
                    "description": "The Minister may, after consultation with the Board, give to the Board directions of a general or special character as to the policy to be followed by the Board in the performance of its functions as appears to the Minister to be requisite in the public interest, and the Board shall give effect to any such directions."
                },
                {
                    "representation": "(2)",
                    "description": "The Board shall afford to the Minister facilities for obtaining information with respect to the property and activities of the Board and furnish him with returns, accounts and other information with respect thereto in such manner and at such times as he may require."
                }
            ]
        }
    },
    {
        "act": "GUYANA GOLD BOARD ACT",
        "source": "https://mola.gov.gy/laws-of-guyana",
        "type": {
            "name": "section",
            "representation": "19",
            "title": "Exclusion of application of Limitation Act. ",
            "context": "GUYANA GOLD BOARD ACT under Exclusion of application of Limitation Act. 19. The Limitation Act does not apply to proceedings instituted by the Board.",
            "description": "The Limitation Act does not apply to proceedings instituted by the Board."
        }
    },
    {
        "act": "GUYANA GOLD BOARD ACT",
        "source": "https://mola.gov.gy/laws-of-guyana",
        "type": {
            "name": "section",
            "representation": "20",
            "title": "Parate execution. ",
            "context": "GUYANA GOLD BOARD ACT under Parate execution. 20. Monies due to the Board may be recovered by parate execution without prejudice to any other right of recovery available to the Board by virtue of any other law.",
            "description": "Monies due to the Board may be recovered by parate execution without prejudice to any other right of recovery available to the Board by virtue of any other law."
        }
    },
    {
        "act": "GUYANA GOLD BOARD ACT",
        "source": "https://mola.gov.gy/laws-of-guyana",
        "type": {
            "name": "section",
            "representation": "21",
            "title": "Search of premises and persons. ",
            "context": "GUYANA GOLD BOARD ACT under Search of premises and persons. 21.  (1) If any officer has reasonable cause to suspect that an offence against section 6, 7, 8, 9 or 10 has been or is being committed and that evidence of the commission of the offence is to be found at any premises or other place then, upon oath made by the officer before a magistrate or justice of the peace of the fact of the suspicion, the magistrate or justice of the  peace may, by warrant under his hand, authorise the officer, with all necessary assistance and by force if required and at any hour of the day or night, to enter the said premises or other place at any time within one month after the date of the warrant and to search the said premises or other place.  (2) A person authorised by any warrant as aforesaid to search any premises or other place may search LAWS OF GUYANA 14 Cap. 66:01 Guyana Gold Board  L.R.O. 1/2012                                        Power to order amnesty. [2 of 1987]        every person found therein or whom he has reasonable cause to believe to have recently left those premises or that other place and may seize any gold found therein or on any such person and any other article which he has reasonable cause to believe to be evidence of the commission of any offence against this Act:  Provided that no female shall be searched in pursuance of any warrant issued under this section, except by a female.  (3) Any officer who has reasonable cause to suspect that any person is unlawfully in possession of, or removing, any gold may stop and search that person and any vehicle or other conveyance in his possession or under his control, or in which he is, and any package under his control, and if any gold is found upon him or in any such vehicle, conveyance or package may seize and detain the same and arrest and detain the person until he can be brought before a magistrate and dealt with according to law:   Provided that no female shall be searched except by a female.  (4) In this section officer means every justice of the peace, customs officer, officer of the Department of Geological Surveys and Mines or of the Geology and Mines Commission, every member of the Police Force, every mines officer under the Mining Act and every person employed by the Board and authorised in writing for the purpose of this section by the General Manager of the Board.",
            "description": [
                {
                    "representation": "(1)",
                    "description": "If any officer has reasonable cause to suspect that an offence against section 6, 7, 8, 9 or 10 has been or is being committed and that evidence of the commission of the offence is to be found at any premises or other place then, upon oath made by the officer before a magistrate or justice of the peace of the fact of the suspicion, the magistrate or justice of the  peace may, by warrant under his hand, authorise the officer, with all necessary assistance and by force if required and at any hour of the day or night, to enter the said premises or other place at any time within one month after the date of the warrant and to search the said premises or other place."
                },
                {
                    "representation": "(2)",
                    "description": "A person authorised by any warrant as aforesaid to search any premises or other place may search LAWS OF GUYANA 14 Cap. 66:01 Guyana Gold Board  L.R.O. 1/2012                                        Power to order amnesty. [2 of 1987]        every person found therein or whom he has reasonable cause to believe to have recently left those premises or that other place and may seize any gold found therein or on any such person and any other article which he has reasonable cause to believe to be evidence of the commission of any offence against this Act:  Provided that no female shall be searched in pursuance of any warrant issued under this section, except by a female."
                },
                {
                    "representation": "(3)",
                    "description": "Any officer who has reasonable cause to suspect that any person is unlawfully in possession of, or removing, any gold may stop and search that person and any vehicle or other conveyance in his possession or under his control, or in which he is, and any package under his control, and if any gold is found upon him or in any such vehicle, conveyance or package may seize and detain the same and arrest and detain the person until he can be brought before a magistrate and dealt with according to law:   Provided that no female shall be searched except by a female."
                },
                {
                    "representation": "(4)",
                    "description": "In this section officer means every justice of the peace, customs officer, officer of the Department of Geological Surveys and Mines or of the Geology and Mines Commission, every member of the Police Force, every mines officer under the Mining Act and every person employed by the Board and authorised in writing for the purpose of this section by the General Manager of the Board."
                }
            ]
        }
    },
    {
        "act": "GUYANA GOLD BOARD ACT",
        "source": "https://mola.gov.gy/laws-of-guyana",
        "type": {
            "name": "section",
            "representation": "22",
            "title": "Power to order amnesty. ",
            "context": "GUYANA GOLD BOARD ACT under Power to order amnesty. 22. No person who sells all gold in his possession to the Board during the period commencing on 2nd September, 1986 and ending on 31st December 1986 or during such other period as may be prescribed by order of the Minister, and otherwise in accordance with such order, shall be prosecuted under this Act for conveying, purchasing or otherwise acquiring or possessing such gold in contravention of the provisions of this Act, or in the case of the licensee referred to LAWS OF GUYANA Guyana Gold Board Cap. 66:01 15  L.R.O. 1/2012     Offences and penalties. [5 of 1994 6 of 1997]                                   Power to accept compensation for offence. [5 of 1994]    in section 9 for not maintaining the book required to be kept by him by that section in respect of such gold.",
            "description": "No person who sells all gold in his possession to the Board during the period commencing on 2nd September, 1986 and ending on 31st December 1986 or during such other period as may be prescribed by order of the Minister, and otherwise in accordance with such order, shall be prosecuted under this Act for conveying, purchasing or otherwise acquiring or possessing such gold in contravention of the provisions of this Act, or in the case of the licensee referred to LAWS OF GUYANA Guyana Gold Board Cap. 66:01 15  L.R.O. 1/2012     Offences and penalties. [5 of 1994 6 of 1997]                                   Power to accept compensation for offence. [5 of 1994]    in section 9 for not maintaining the book required to be kept by him by that section in respect of such gold."
        }
    },
    {
        "act": "GUYANA GOLD BOARD ACT",
        "source": "https://mola.gov.gy/laws-of-guyana",
        "type": {
            "name": "section",
            "representation": "23",
            "title": "Offences and penalties. ",
            "context": "GUYANA GOLD BOARD ACT under Offences and penalties. 23.  Any person who  (a) contravenes or fails to comply with the provisions of section 6, 7, 8, 9 or 10; or  (b) obstructs any officer of the Board, or any other person authorised by the Board to perform any function on its behalf in the exercise of his functions under this Act; or  (c) breaches any condition imposed by the. Board under section 9 (1), shall be liable on summary conviction  (i) to a fine of seventy-five thousand dollars for the first conviction; (ii) to a fine of seventy-five thousand dollars and to imprisonment for five years on the second or any subsequent conviction:  Provided that the Court may for any special reasons to be recorded in writing impose any lesser sentence, and to forfeiture of the gold in respect of which the offence was committed.",
            "description": [
                {
                    "representation": "(a)",
                    "description": "contravenes or fails to comply with the provisions of section 6, 7, 8, 9 or 10; or"
                },
                {
                    "representation": "(b)",
                    "description": "obstructs any officer of the Board, or any other person authorised by the Board to perform any function on its behalf in the exercise of his functions under this Act; or"
                },
                {
                    "representation": "(c)",
                    "description": "breaches any condition imposed by the. Board under section 9"
                },
                {
                    "representation": "(i)",
                    "description": "to a fine of seventy-five thousand dollars for the first conviction;"
                }
            ]
        }
    },
    {
        "act": "GUYANA GOLD BOARD ACT",
        "source": "https://mola.gov.gy/laws-of-guyana",
        "type": {
            "name": "section",
            "representation": "24",
            "title": "Power to accept compensation for offence. ",
            "context": "GUYANA GOLD BOARD ACT under Power to accept compensation for offence. 24. Notwithstanding any other provision of this Act, the Minister may in any case he deems proper and in substitution for any proceedings in a court,  accept on behalf of the Board a sum of money by way of compensation from any person reasonably suspected of a contravention of this Act or any regulation made thereunder: LAWS OF GUYANA 16 Cap. 66:01 Guyana Gold Board  L.R.O. 1/2012       Second Schedule.    Regulations.  Provided that such compensation shall be accepted only where the person reasonably suspected of such contravention has expressed his willingness in a duly completed form in the Second Schedule that the contravention as aforesaid shall be so dealt with.",
            "description": "Notwithstanding any other provision of this Act, the Minister may in any case he deems proper and in substitution for any proceedings in a court,  accept on behalf of the Board a sum of money by way of compensation from any person reasonably suspected of a contravention of this Act or any regulation made thereunder: LAWS OF GUYANA 16 Cap. 66:01 Guyana Gold Board  L.R.O. 1/2012       Second Schedule.    Regulations.  Provided that such compensation shall be accepted only where the person reasonably suspected of such contravention has expressed his willingness in a duly completed form in the Second Schedule that the contravention as aforesaid shall be so dealt with."
        }
    },
    {
        "act": "GUYANA GOLD BOARD ACT",
        "source": "https://mola.gov.gy/laws-of-guyana",
        "type": {
            "name": "section",
            "representation": "25",
            "title": "Regulations.   FIRST SCHEDULE  SECOND SCHEDULE  ___________________________ 12 of 1981 An Act to provide for the establishment, constitution, and functions of the Guyana Gold Board and for matters connected therewith. LAWS OF GUYANA 4 Cap. 66:01 Guyana Gold Board  L.R.O. 1/2012  [31ST DECEMBER, 1981]  Short title.    Interpretation. [5 of 1994]    c. 65:01                           Establishment of the Board. First Schedule.     Functions of the Board.  ",
            "context": "GUYANA GOLD BOARD ACT under Regulations.   FIRST SCHEDULE  SECOND SCHEDULE  ___________________________ 12 of 1981 An Act to provide for the establishment, constitution, and functions of the Guyana Gold Board and for matters connected therewith. LAWS OF GUYANA 4 Cap. 66:01 Guyana Gold Board  L.R.O. 1/2012  [31ST DECEMBER, 1981]  Short title.    Interpretation. [5 of 1994]    c. 65:01                           Establishment of the Board. First Schedule.     Functions of the Board.  25. The Minister may make regulations for the purpose of carrying out the provisions of this Act.  __________   s. 8     Constitution of the Board.        Gazetting of appointments.    Seal of the Board.           FIRST SCHEDULE   CONSTITUTION",
            "description": "The Minister may make regulations for the purpose of carrying out the provisions of this Act.  __________   s. 8     Constitution of the Board.        Gazetting of appointments.    Seal of the Board.           FIRST SCHEDULE   CONSTITUTION"
        }
    }
]