[
    {
        "act": "RICE FARMERS (SECURITY OF TENURE) ACT",
        "source": "https://mola.gov.gy/laws-of-guyana",
        "type": {
            "name": "section",
            "representation": "1",
            "title": "Short title. ",
            "context": "RICE FARMERS (SECURITY OF TENURE) ACT under Short title. 1.  This Act may be cited as the Rice Farmers (Security of Tenure) Act.",
            "description": "This Act may be cited as the Rice Farmers (Security of Tenure) Act."
        }
    },
    {
        "act": "RICE FARMERS (SECURITY OF TENURE) ACT",
        "source": "https://mola.gov.gy/laws-of-guyana",
        "type": {
            "name": "section",
            "representation": "2",
            "title": "Interpretation. ",
            "context": "RICE FARMERS (SECURITY OF TENURE) ACT under Interpretation. 2.  (1) In this Act  agent means a person who lets rice lands on behalf of a landlord or collects rent in respect of rice lands on behalf of the landlord or is authorised in writing so to do;  agreement   of  tenancy or agreement means a letting of or agreement for letting rice lands;  assessment committee or committee means an assessment committee constituted under section 8 for the area in which the holding in question is situate;  basic rent shall have the meaning assigned to it by section 4;   chairman  means the chairman of an assessment committee;  clay soil means soil which, on a mechanical analysis contains not less than 40 per cent clay with less than 5 per cent organic matter in the top 15 centimetres depth and pH value greater than 4;  LAWS OF GUYANA 6 Cap. 69:02 Rice Farmers (Security of Tenure)   L.R.O. 1/2012                                                 holding means any rice land held by a tenant;  landlord means any person  other than the State,  the Guyana  Rice Development Board or MARDS Rice Milling Complex Ltd.  for the time being entitled to receive the rent or to take possession of any rice lands and includes a sub-landlord, the executors, administrators,  assignees,  legatee  or  trustee  in  insolvency  of  a landlord;  maximum rent means the sum obtained by the addition to the basic rent of any holding to which this Act applies of the increases permitted under section 23;  per cent of organic carbon (corresponding to",
            "description": [
                {
                    "representation": "(1)",
                    "description": "In this Act  agent means a person who lets rice lands on behalf of a landlord or collects rent in respect of rice lands on behalf of the landlord or is authorised in writing so to do;  agreement   of  tenancy or agreement means a letting of or agreement for letting rice lands;  assessment committee or committee means an assessment committee constituted under section 8 for the area in which the holding in question is situate;  basic rent shall have the meaning assigned to it by section 4;   chairman  means the chairman of an assessment committee;  clay soil means soil which, on a mechanical analysis contains not less than 40 per cent clay with less than 5 per cent organic matter in the top 15 centimetres depth and pH value greater than 4;  LAWS OF GUYANA 6 Cap. 69:02 Rice Farmers"
                }
            ]
        }
    },
    {
        "act": "RICE FARMERS (SECURITY OF TENURE) ACT",
        "source": "https://mola.gov.gy/laws-of-guyana",
        "type": {
            "name": "section",
            "representation": "3",
            "title": "Security of tenure of rice lands. ",
            "context": "RICE FARMERS (SECURITY OF TENURE) ACT under Security of tenure of rice lands. 3.8 or less; 75 per cent or more of its cation exchange capacity saturated  with aluminium  extractable  by a neutral  salt solution;  and water  soluble  sulphate  content  of 2,000 parts  per million or more;  a year means the twelve calendar months commencing on the first day of May; and annual shall be construed accordingly.  (2) In determining the type of soil, that is to say, whether the soil is clay soil, pegasse soil, saline soil or toxic soil, the procedure set out in the Third Schedule shall be followed.",
            "description": [
                {
                    "representation": "(2)",
                    "description": "In determining the type of soil, that is to say, whether the soil is clay soil, pegasse soil, saline soil or toxic soil, the procedure set out in the Third Schedule shall be followed."
                }
            ]
        }
    },
    {
        "act": "RICE FARMERS (SECURITY OF TENURE) ACT",
        "source": "https://mola.gov.gy/laws-of-guyana",
        "type": {
            "name": "section",
            "representation": "4",
            "title": "Determination of basic rent. ",
            "context": "RICE FARMERS (SECURITY OF TENURE) ACT under Determination of basic rent. 4.  (1) For the purposes of this Act the guidelines set out in the First Schedule shall be used to facilitate the determination by the assessment committees  of the basic rent chargeable  in respect of any holding to which this Act applies:  LAWS OF GUYANA Rice Farmers (Security of Tenure)  Cap. 69:02 9  L.R.O. 1/2012                          Implied conditions   in agreement of tenancy. [17 of 1996]              Second Schedule.    Provided that where a contract of tenancy has been entered into in respect of land intended to be used for the cultivation of paddy, but not yet cleared and made fit for the cultivation of paddy according to normal agricultural standards, the basic rent chargeable in respect of such land shall as from the 1st day of May, 1956, not exceed such rate per acre during the first five years after the commencement  of the tenancy as may from time to time be fixed by the assessment committee upon the application of either the landlord or the tenant.  (2) The Minister may from time to time by order amend any of the matters set out in the First Schedule.  (3) The Minister may establish a committee comprising five persons knowledgeable in the field of agriculture to advise the Minister in the determination of the basic rent chargeable in respect of rice lands to which this Act applies.",
            "description": [
                {
                    "representation": "(1)",
                    "description": "For the purposes of this Act the guidelines set out in the First Schedule shall be used to facilitate the determination by the assessment committees  of the basic rent chargeable  in respect of any holding to which this Act applies:  LAWS OF GUYANA Rice Farmers"
                },
                {
                    "representation": "(2)",
                    "description": "The Minister may from time to time by order amend any of the matters set out in the First Schedule."
                },
                {
                    "representation": "(3)",
                    "description": "The Minister may establish a committee comprising five persons knowledgeable in the field of agriculture to advise the Minister in the determination of the basic rent chargeable in respect of rice lands to which this Act applies."
                }
            ]
        }
    },
    {
        "act": "RICE FARMERS (SECURITY OF TENURE) ACT",
        "source": "https://mola.gov.gy/laws-of-guyana",
        "type": {
            "name": "section",
            "representation": "5",
            "title": "Implied conditions in agreement of tenancy. ",
            "context": "RICE FARMERS (SECURITY OF TENURE) ACT under Implied conditions in agreement of tenancy. 5.0 per cent of organic matter), and the carbon: nitrogen ratio of the organic matter is greater than",
            "description": "5.0 per cent of organic matter), and the carbon: nitrogen ratio of the organic matter is greater than"
        }
    },
    {
        "act": "RICE FARMERS (SECURITY OF TENURE) ACT",
        "source": "https://mola.gov.gy/laws-of-guyana",
        "type": {
            "name": "section",
            "representation": "6",
            "title": "Keeping of register of tenancies. ",
            "context": "RICE FARMERS (SECURITY OF TENURE) ACT under Keeping of register of tenancies. 6.  [Repealed by Act No. 19 of 1996]",
            "description": "[Repealed by Act No. 19 of 1996]"
        }
    },
    {
        "act": "RICE FARMERS (SECURITY OF TENURE) ACT",
        "source": "https://mola.gov.gy/laws-of-guyana",
        "type": {
            "name": "section",
            "representation": "7",
            "title": "Establishment of assessment committees. ",
            "context": "RICE FARMERS (SECURITY OF TENURE) ACT under Establishment of assessment committees. 7. (1) It shall be the duty of a landlord other than a landlord of rice lands not exceeding in the aggregate five acres, the proof whereof shall lie  on him,  to keep  an annual  register  (hereinafter  called  the annual register  of tenancies)  in the form prescribed  in the Fourth Schedule, wherein he  shall record all agreements of tenancy, transfers, bequests and determination of all agreements of tenancy.  (2) A landlord shall make the register of tenancies available for inspection by the Regional Executive Officer or by any person authorised in writing in that behalf by the Regional Executive Officer.  (3) Where a landlord fails to keep a register of LAWS OF GUYANA Rice Farmers (Security of Tenure)  Cap. 69:02 11  L.R.O. 1/2012                   Establish-ment of assessment committees. [6 of 1971 12 of 1984]                         tenancies as is required under this section, or fails to keep such register up to date, or fails to produce the register when requested so to do under this Act, he shall be liable to a fine of five thousand dollars and in relation to any period during which such failure subsisted or continues he is not entitled to any of the privileges, benefits or protection conferred upon a landlord by this Act.  (4) Every person who wilfully obstructs a Regional Executive Officer or any person authorised under subsection (2) acting under this section or any person acting in their aid shall be liable on summary conviction to a fine of five thousand dollars.",
            "description": [
                {
                    "representation": "(1)",
                    "description": "It shall be the duty of a landlord other than a landlord of rice lands not exceeding in the aggregate five acres, the proof whereof shall lie  on him,  to keep  an annual  register"
                },
                {
                    "representation": "(2)",
                    "description": "acting under this section or any person acting in their aid shall be liable on summary conviction to a fine of five thousand dollars."
                },
                {
                    "representation": "(3)",
                    "description": "Where a landlord fails to keep a register of LAWS OF GUYANA Rice Farmers"
                },
                {
                    "representation": "(4)",
                    "description": "Every person who wilfully obstructs a Regional Executive Officer or any person authorised under subsection"
                }
            ]
        }
    },
    {
        "act": "RICE FARMERS (SECURITY OF TENURE) ACT",
        "source": "https://mola.gov.gy/laws-of-guyana",
        "type": {
            "name": "section",
            "representation": "8",
            "title": "Meetings of assessment committees. ",
            "context": "RICE FARMERS (SECURITY OF TENURE) ACT under Meetings of assessment committees. 8.  (1) The Minister may establish for the purposes of this Act, as many assessment committees as he thinks fit and shall specify in relation to  each  committee  the  area  in regard  to  which  it  may exercise  the powers conferred and duties imposed by this Act.  (2) Each committee shall be appointed by the Minister and shall consist of  (a)    a chairman who shall be a magistrate, or a person having such qualifications  as may be prescribed by the Minister by regulations made in consultation with the Judicial Service Commission;  (b)   one person who is an agricultural officer not below the rank of an agricultural   field assistant in the Ministry responsible for agriculture;  (c)    two persons who are landlords of rice lands in the area in respect of which the committee is appointed;  LAWS OF GUYANA 12 Cap. 69:02 Rice Farmers (Security of Tenure)   L.R.O. 1/2012                             Meetings   of assessment committees.  [17 of 1996]                 (d)   two persons who are tenants of rice lands in the area in respect of which the committee is appointed:  Provided that where the Minister appoints any person other than a magistrate as a chairman, such appointment shall be made by him acting in accordance with the advice of the Judicial Service Commission.  (3) Each member of each committee shall, subject to subsection (5), hold office for such period, not exceeding two years, as the Minister may determine, but shall be eligible for re-appointment.   (4) Any member of a committee other than a public officer may by writing under his hand addressed to the Minister at any time resign his office.  (5) The appointment, removal, death, departure from Guyana or resignation  of  any  member  of  a  committee  shall  be  notified  in  the Gazette .",
            "description": [
                {
                    "representation": "(1)",
                    "description": "The Minister may establish for the purposes of this Act, as many assessment committees as he thinks fit and shall specify in relation to  each  committee  the  area  in regard  to  which  it  may exercise  the powers conferred and duties imposed by this Act."
                },
                {
                    "representation": "(2)",
                    "description": "Each committee shall be appointed by the Minister and shall consist of"
                },
                {
                    "representation": "(a)",
                    "description": "a chairman who shall be a magistrate, or a person having such qualifications  as may be prescribed by the Minister by regulations made in consultation with the Judicial Service Commission;"
                },
                {
                    "representation": "(b)",
                    "description": "one person who is an agricultural officer not below the rank of an agricultural   field assistant in the Ministry responsible for agriculture;"
                },
                {
                    "representation": "(c)",
                    "description": "two persons who are landlords of rice lands in the area in respect of which the committee is appointed;  LAWS OF GUYANA 12 Cap. 69:02 Rice Farmers"
                },
                {
                    "representation": "(d)",
                    "description": "two persons who are tenants of rice lands in the area in respect of which the committee is appointed:  Provided that where the Minister appoints any person other than a magistrate as a chairman, such appointment shall be made by him acting in accordance with the advice of the Judicial Service Commission."
                },
                {
                    "representation": "(3)",
                    "description": "Each member of each committee shall, subject to subsection"
                },
                {
                    "representation": "(4)",
                    "description": "Any member of a committee other than a public officer may by writing under his hand addressed to the Minister at any time resign his office."
                },
                {
                    "representation": "(5)",
                    "description": "The appointment, removal, death, departure from Guyana or resignation  of  any  member  of  a  committee  shall  be  notified  in  the Gazette ."
                }
            ]
        }
    },
    {
        "act": "RICE FARMERS (SECURITY OF TENURE) ACT",
        "source": "https://mola.gov.gy/laws-of-guyana",
        "type": {
            "name": "section",
            "representation": "9",
            "title": "Appointment of officers, servants and payment of allowances and expenses to members of assessment committees. ",
            "context": "RICE FARMERS (SECURITY OF TENURE) ACT under Appointment of officers, servants and payment of allowances and expenses to members of assessment committees. 9.  (1) Each assessment committee shall meet so often, at such time and at such place as the chairman may deem expedient.  (2) Three members of a committee, including the chairman or acting chairman shall form a quorum.  (3) A member of an assessment committee shall be disqualified from membership of that committee  for the hearing of any matter in which  he  is  personally  interested,  or  in  the  case  of a  company  so interested, if he is directly or indirectly interested in its affairs, or if he is the servant or agent of any such person or company.  (4) For the purpose of securing the attendance of any witness, every committee shall have power to issue LAWS OF GUYANA Rice Farmers (Security of Tenure)  Cap. 69:02 13  L.R.O. 1/2012 Form 3 Schedule.  c. 7:01                                     Appointment of officers, servants and payment of allowances and expenses to members of assessment committees. summonses in Form 3 in the Schedule to the Summary Jurisdiction (Petty Debt) Act, subject to any adaptation necessary, and section 15 of the aforesaid Act shall mutatis mutandis apply to any person served with such a summons.  (5) Any person who without lawful excuse fails or neglects  to attend any meeting of a committee in obedience to any summons or fails to answer any question material to the subject of the investigation put to him  by  the  committee  or  any  member  thereof  or  to  produce  any document, production of which is required by the committee or to supply any information required by the committee shall be liable on summary conviction to a fine of five thousand dollars.  (6) Any person who wilfully gives a false answer to any question material to the subject of investigation which may be put to him during the course of any proceedings before a committee shall be liable on summary conviction to a fine of ten thousand dollars and to imprisonment for twelve months.  (7) The chairman of each committee shall keep or cause to be kept a record of all proceedings brought before the committee and of the evidence taken and of the decision arrived at by the committee and of the names of the members taking part in the proceedings.  (8) Subject to this Act, each committee shall have power to regulate its own proceedings.",
            "description": [
                {
                    "representation": "(1)",
                    "description": "Each assessment committee shall meet so often, at such time and at such place as the chairman may deem expedient."
                },
                {
                    "representation": "(2)",
                    "description": "Three members of a committee, including the chairman or acting chairman shall form a quorum."
                },
                {
                    "representation": "(3)",
                    "description": "A member of an assessment committee shall be disqualified from membership of that committee  for the hearing of any matter in which  he  is  personally  interested,  or  in  the  case  of a  company  so interested, if he is directly or indirectly interested in its affairs, or if he is the servant or agent of any such person or company."
                },
                {
                    "representation": "(4)",
                    "description": "For the purpose of securing the attendance of any witness, every committee shall have power to issue LAWS OF GUYANA Rice Farmers"
                },
                {
                    "representation": "(5)",
                    "description": "Any person who without lawful excuse fails or neglects  to attend any meeting of a committee in obedience to any summons or fails to answer any question material to the subject of the investigation put to him  by  the  committee  or  any  member  thereof  or  to  produce  any document, production of which is required by the committee or to supply any information required by the committee shall be liable on summary conviction to a fine of five thousand dollars."
                },
                {
                    "representation": "(6)",
                    "description": "Any person who wilfully gives a false answer to any question material to the subject of investigation which may be put to him during the course of any proceedings before a committee shall be liable on summary conviction to a fine of ten thousand dollars and to imprisonment for twelve months."
                },
                {
                    "representation": "(7)",
                    "description": "The chairman of each committee shall keep or cause to be kept a record of all proceedings brought before the committee and of the evidence taken and of the decision arrived at by the committee and of the names of the members taking part in the proceedings."
                },
                {
                    "representation": "(8)",
                    "description": "Subject to this Act, each committee shall have power to regulate its own proceedings."
                }
            ]
        }
    },
    {
        "act": "RICE FARMERS (SECURITY OF TENURE) ACT",
        "source": "https://mola.gov.gy/laws-of-guyana",
        "type": {
            "name": "section",
            "representation": "10",
            "title": "Powers and duties of committees. ",
            "context": "RICE FARMERS (SECURITY OF TENURE) ACT under Powers and duties of committees. 10.1;  rice land means any land which is let or agreed to be let the subject of an agreement of tenancy which is used either wholly or mainly for the cultivation of paddy, such land being at the time of letting fit for the cultivation  of  paddy according to normal  agricultural standards;  rules  of good  estate  management  means,  so far as is practicable, having regard to the character and position of the rice lands and to modern agricultural methods and standards   (a) the erection and maintenance of  essential  structures, and the construction, clearing and maintenance  of  dams, canals, drains and koker runs; and   (b) where the lands are within a Drainage or Irrigation area or  within any other area affected by a drainage or irrigation scheme established or maintained, by Government, or a local authority,  the  execution  and  pegasse soil means soil which contains not less than",
            "description": [
                {
                    "representation": "(a)",
                    "description": "the erection and maintenance of  essential  structures, and the construction, clearing and maintenance  of  dams, canals, drains and koker runs; and"
                },
                {
                    "representation": "(b)",
                    "description": "where the lands are within a Drainage or Irrigation area or  within any other area affected by a drainage or irrigation scheme established or maintained, by Government, or a local authority,  the  execution  and  pegasse soil means soil which contains not less than"
                }
            ]
        }
    },
    {
        "act": "RICE FARMERS (SECURITY OF TENURE) ACT",
        "source": "https://mola.gov.gy/laws-of-guyana",
        "type": {
            "name": "section",
            "representation": "11",
            "title": "Application for ascertainment of maximum rent. ",
            "context": "RICE FARMERS (SECURITY OF TENURE) ACT under Application for ascertainment of maximum rent. 11.  Upon the filing of any application under this Act a committee shall have  in relation  to the  area  in respect  of which  it  is  appointed  the following powers and duties:  (a)     to assess, fix and certify the maximum rent to be paid and received in respect of any holding to which this Act applies;   (b)   if the landlord and the tenant of a holding to which this Act   applies  are  unable  to  agree  as  to  the  amount  of compensation to be paid under this Act, on the application of either of them, to determine the amount of such compensation to be paid;  (c )    to  assess,  fix  and  certify  the  amount  to  be  paid  as damages by a landlord to his tenant for non-observance of any of the conditions of good estate management in respect to any holding to which this Act applies;  (d)    to grant certificates of non-observance of rules of good estate management or of good husbandry;  (e)     to grant leave to landlords to re-allocate their holdings;   (f)     to grant leave to landlords to resume possession of rice lands in order that the land may be used for any purpose LAWS OF GUYANA Rice Farmers (Security of Tenure)  Cap. 69:02 15  L.R.O. 1/2012                                               Application for other than for the cultivation of paddy;  (g)     to grant  leave  to  landlords  to reduce  the  size  of  his tenants holding;  (h)   to hear and determine an application for the recovery of a holding to which this Act applies;  (i)     to hear applications for the transfer of tenancies;  (j)    to grant leave to a tenant to serve a landlord notice under section 42(1);  (k)    any other power or duty conferred by this Act or under any other Act;  (l)     to hear and determine an application for re-instatement by a  tenant who  alleges that he has been unlawfully dispossessed of his holding by a landlord or his agent and to award damages whether in lieu of or in addition to an order for  re-instatement;  (m)   to hear an application for and certify any amount due to a landlord as rent by a tenant;  (n)   any power or duty incidental to the carrying out of any such power and duties.",
            "description": [
                {
                    "representation": "(a)",
                    "description": "to assess, fix and certify the maximum rent to be paid and received in respect of any holding to which this Act applies;"
                },
                {
                    "representation": "(b)",
                    "description": "if the landlord and the tenant of a holding to which this Act   applies  are  unable  to  agree  as  to  the  amount  of compensation to be paid under this Act, on the application of either of them, to determine the amount of such compensation to be paid;"
                },
                {
                    "representation": "(d)",
                    "description": "to grant certificates of non-observance of rules of good estate management or of good husbandry;"
                },
                {
                    "representation": "(e)",
                    "description": "to grant leave to landlords to re-allocate their holdings;"
                },
                {
                    "representation": "(f)",
                    "description": "to grant leave to landlords to resume possession of rice lands in order that the land may be used for any purpose LAWS OF GUYANA Rice Farmers"
                },
                {
                    "representation": "(g)",
                    "description": "to grant  leave  to  landlords  to reduce  the  size  of  his tenants holding;"
                },
                {
                    "representation": "(h)",
                    "description": "to hear and determine an application for the recovery of a holding to which this Act applies;"
                },
                {
                    "representation": "(i)",
                    "description": "to hear applications for the transfer of tenancies;"
                },
                {
                    "representation": "(j)",
                    "description": "to grant leave to a tenant to serve a landlord notice under section 42(1);"
                },
                {
                    "representation": "(k)",
                    "description": "any other power or duty conferred by this Act or under any other Act;"
                },
                {
                    "representation": "(l)",
                    "description": "to hear and determine an application for re-instatement by a  tenant who  alleges that he has been unlawfully dispossessed of his holding by a landlord or his agent and to award damages whether in lieu of or in addition to an order for  re-instatement;"
                },
                {
                    "representation": "(m)",
                    "description": "to hear an application for and certify any amount due to a landlord as rent by a tenant;"
                },
                {
                    "representation": "(n)",
                    "description": "any power or duty incidental to the carrying out of any such power and duties."
                }
            ]
        }
    },
    {
        "act": "RICE FARMERS (SECURITY OF TENURE) ACT",
        "source": "https://mola.gov.gy/laws-of-guyana",
        "type": {
            "name": "section",
            "representation": "12",
            "title": "Evidence on application. ",
            "context": "RICE FARMERS (SECURITY OF TENURE) ACT under Evidence on application. 12.  (1) Any tenant, or any landlord, of any holding to LAWS OF GUYANA 16 Cap. 69:02 Rice Farmers (Security of Tenure)   L.R.O. 1/2012 ascertainment of maximum rent.                                              which this Act applies may make application to the committee for the area in which the holding is situate to have the maximum rent of the holding assessed, fixed and  certified.  (2) When  an  application  is  made  under  subsection  (1),  the committee shall cause notice of the date, time and place fixed for the holding of the investigation of the application to be given, by registered post, to the tenant and to the landlord:  Provided that where the application is made by the tenant, the committee may, if it thinks fit direct that the notice required under this subsection to be given to the landlord shall be given to the agent of the landlord.  (3) Where on the day and at the time fixed for the holding of the investigation the tenant and the landlord, or the tenant and the agent of the landlord, as the case may be, appear, the committee shall proceed to hold the investigation and shall, for such purpose, have the power to direct such adjournments and postponements as it may from time to time think proper.  (4) Where notice under subsection (2) has been received by the tenant and the landlord, or by the tenant and the agent of the landlord, as the case may be, and the tenant, or the landlord or his agent, fails to appear  on  the  date  and  at  the  time  fixed  for  the  holding  of  the investigation, the committee may proceed with the holding of the investigation, or may postpone it as the committee thinks fit.  (5) Where notice under subsection (2) has been received by the tenant,  the  committee   may,  notwithstanding   that  no  notice  under subsection (2) was received by the landlord or his agent, proceed with the holding of the investigation  LAWS OF GUYANA Rice Farmers (Security of Tenure)  Cap. 69:02 17  L.R.O. 1/2012                   Evidence on application.                   c. 5:03       Hearing of application.  (a)  where delivery of the notice under subsection (2) was refused by the landlord or his agent, as the case may be; or   (b)   where the address in Guyana of the landlord and the address in Guyana of the agent (if any) are not known to the tenant and cannot be ascertained by the committee; or  (c)    where the landlord resides elsewhere than in Guyana.",
            "description": [
                {
                    "representation": "(1)",
                    "description": "Any tenant, or any landlord, of any holding to LAWS OF GUYANA 16 Cap. 69:02 Rice Farmers"
                },
                {
                    "representation": "(2)",
                    "description": "was refused by the landlord or his agent, as the case may be; or"
                },
                {
                    "representation": "(3)",
                    "description": "Where on the day and at the time fixed for the holding of the investigation the tenant and the landlord, or the tenant and the agent of the landlord, as the case may be, appear, the committee shall proceed to hold the investigation and shall, for such purpose, have the power to direct such adjournments and postponements as it may from time to time think proper."
                },
                {
                    "representation": "(4)",
                    "description": "Where notice under subsection"
                },
                {
                    "representation": "(5)",
                    "description": "Where notice under subsection"
                },
                {
                    "representation": "(a)",
                    "description": "where delivery of the notice under subsection"
                },
                {
                    "representation": "(b)",
                    "description": "where the address in Guyana of the landlord and the address in Guyana of the agent"
                },
                {
                    "representation": "(c)",
                    "description": "where the landlord resides elsewhere than in Guyana."
                }
            ]
        }
    },
    {
        "act": "RICE FARMERS (SECURITY OF TENURE) ACT",
        "source": "https://mola.gov.gy/laws-of-guyana",
        "type": {
            "name": "section",
            "representation": "13",
            "title": "Hearing of application. ",
            "context": "RICE FARMERS (SECURITY OF TENURE) ACT under Hearing of application. 13.  (1) The  landlord  or  his  agent  may  give  evidence,  produce documents and call witnesses,  and the tenant  shall have the right to cross-examine the landlord or his agent or any such witness.  (2) The tenant may give evidence, produce documents and call witnesses, and the landlord or his agent shall have the right to cross- examine the tenant or any such witness.  (3) The committee may require the landlord, the tenant, or any other person to give evidence for the purpose of ascertaining all the relevant facts, and the landlord or his agent, and the tenant shall have the right to cross-examine any such witness.   (4) Subject to the Evidence Act, all oral evidence given before a committee on the investigation of an application made under section 12(1) of this Act shall be given upon oath, and the chairman or the acting chairman of the committee is hereby authorised to administer such oath.",
            "description": [
                {
                    "representation": "(1)",
                    "description": "The  landlord  or  his  agent  may  give  evidence,  produce documents and call witnesses,  and the tenant  shall have the right to cross-examine the landlord or his agent or any such witness."
                },
                {
                    "representation": "(2)",
                    "description": "The tenant may give evidence, produce documents and call witnesses, and the landlord or his agent shall have the right to cross- examine the tenant or any such witness."
                },
                {
                    "representation": "(3)",
                    "description": "The committee may require the landlord, the tenant, or any other person to give evidence for the purpose of ascertaining all the relevant facts, and the landlord or his agent, and the tenant shall have the right to cross-examine any such witness."
                },
                {
                    "representation": "(4)",
                    "description": "Subject to the Evidence Act, all oral evidence given before a committee on the investigation of an application made under section 12(1) of this Act shall be given upon oath, and the chairman or the acting chairman of the committee is hereby authorised to administer such oath."
                }
            ]
        }
    },
    {
        "act": "RICE FARMERS (SECURITY OF TENURE) ACT",
        "source": "https://mola.gov.gy/laws-of-guyana",
        "type": {
            "name": "section",
            "representation": "14",
            "title": "Inspection of holding. ",
            "context": "RICE FARMERS (SECURITY OF TENURE) ACT under Inspection of holding. 14.  (1) The proceedings at every investigation by the committee for the purpose of ascertaining and fixing the LAWS OF GUYANA 18 Cap. 69:02 Rice Farmers (Security of Tenure)   L.R.O. 1/2012                             Inspection of holding. [6 of 1971]        Fixing and certifying maximum rent in the absence of evidence of landlord or his agent.    maximum rent shall be open to the public.  (2) The landlord and the tenant and any other interested party may be represented before the committee by a legal practitioner.  (3) The landlord may be represented before the committee by his agent.  (4) The  committee  may  take  into  consideration  any relevant facts which were found to be proved in some investigation under section 12, notwithstanding the absence of formal proof of such facts:  Provided that before any such facts are taken into consideration by the committee the party or parties present before the committee shall be informed of the substance of such facts, the committee shall make or cause to be made a note of all such relevant facts, and the party or parties present shall be given an opportunity, if he or they so desire, of adducing evidence in regard thereto.",
            "description": [
                {
                    "representation": "(1)",
                    "description": "The proceedings at every investigation by the committee for the purpose of ascertaining and fixing the LAWS OF GUYANA 18 Cap. 69:02 Rice Farmers"
                },
                {
                    "representation": "(2)",
                    "description": "The landlord and the tenant and any other interested party may be represented before the committee by a legal practitioner."
                },
                {
                    "representation": "(3)",
                    "description": "The landlord may be represented before the committee by his agent."
                },
                {
                    "representation": "(4)",
                    "description": "The  committee  may  take  into  consideration  any relevant facts which were found to be proved in some investigation under section 12, notwithstanding the absence of formal proof of such facts:  Provided that before any such facts are taken into consideration by the committee the party or parties present before the committee shall be informed of the substance of such facts, the committee shall make or cause to be made a note of all such relevant facts, and the party or parties present shall be given an opportunity, if he or they so desire, of adducing evidence in regard thereto."
                }
            ]
        }
    },
    {
        "act": "RICE FARMERS (SECURITY OF TENURE) ACT",
        "source": "https://mola.gov.gy/laws-of-guyana",
        "type": {
            "name": "section",
            "representation": "15",
            "title": "Fixing and certifying maximum rent in the absence of evidence of landlord or his agent. ",
            "context": "RICE FARMERS (SECURITY OF TENURE) ACT under Fixing and certifying maximum rent in the absence of evidence of landlord or his agent. 15.  Where an application to the committee has been made under this Act the committee may require the tenant to permit the committee to enter  the  holding  and,  where  necessary,  the  landlord  to  grant  the committee access thereto, for the purpose of inspecting the holding and the committee shall record or cause to be recorded the results of such inspection.",
            "description": "Where an application to the committee has been made under this Act the committee may require the tenant to permit the committee to enter  the  holding  and,  where  necessary,  the  landlord  to  grant  the committee access thereto, for the purpose of inspecting the holding and the committee shall record or cause to be recorded the results of such inspection."
        }
    },
    {
        "act": "RICE FARMERS (SECURITY OF TENURE) ACT",
        "source": "https://mola.gov.gy/laws-of-guyana",
        "type": {
            "name": "section",
            "representation": "16",
            "title": "Witness expenses; costs. ",
            "context": "RICE FARMERS (SECURITY OF TENURE) ACT under Witness expenses; costs. 16.  A committee  may  (a)   where the landlord or his agent fails without reasonable cause to attend before the committee on the date and at the time and place fixed in the notice given under section 12(2) and received by the landlord or his agent, LAWS OF GUYANA Rice Farmers (Security of Tenure)  Cap. 69:02 19  L.R.O. 1/2012                             Witness expenses; costs. [6 of 1971]              Record of committees decision. or on any date on which the holding of the investigation may be adjourned or postponed, or  (b)    where the landlord or his agent declines to give evidence, or declines to give evidence on any point which in the opinion of the committee is relevant to the investigation, or (c)    where the landlord or his agent is for any reason unable to  prove any fact required to be proved for the purpose of ascertaining or fixing the maximum rent, or  (d)    where the investigation is held under section 12(5), assess, fix and certify a maximum rent, in respect of the holding to which an application under section 12(1) relates in accordance with this Act.",
            "description": [
                {
                    "representation": "(a)",
                    "description": "where the landlord or his agent fails without reasonable cause to attend before the committee on the date and at the time and place fixed in the notice given under section 12(2) and received by the landlord or his agent, LAWS OF GUYANA Rice Farmers"
                },
                {
                    "representation": "(b)",
                    "description": "where the landlord or his agent declines to give evidence, or declines to give evidence on any point which in the opinion of the committee is relevant to the investigation, or"
                },
                {
                    "representation": "(c)",
                    "description": "where the landlord or his agent is for any reason unable to  prove any fact required to be proved for the purpose of ascertaining or fixing the maximum rent, or"
                },
                {
                    "representation": "(d)",
                    "description": "where the investigation is held under section 12(5), assess, fix and certify a maximum rent, in respect of the holding to which an application under section 12(1) relates in accordance with this Act."
                }
            ]
        }
    },
    {
        "act": "RICE FARMERS (SECURITY OF TENURE) ACT",
        "source": "https://mola.gov.gy/laws-of-guyana",
        "type": {
            "name": "section",
            "representation": "17",
            "title": "Record of committee\u2019s decision.  Certificate of maximum rent. ",
            "context": "RICE FARMERS (SECURITY OF TENURE) ACT under Record of committees decision.  Certificate of maximum rent. 17.  (1) The chairman may direct that out-of-pocket expenses of any witness shall be paid by such of the parties as he thinks fit:  Provided that no such direction shall be given in the case of a witness called by or on behalf of the tenant where the maximum rent fixed on the  application  of the tenant is the same as, or greater than the rent actually paid by the tenant before the investigation.  (2) Except as provided in subsection (1), no costs shall be awarded to any party, and no fee shall be allowed to any witness, to an investigation by the committee.",
            "description": [
                {
                    "representation": "(1)",
                    "description": "The chairman may direct that out-of-pocket expenses of any witness shall be paid by such of the parties as he thinks fit:  Provided that no such direction shall be given in the case of a witness called by or on behalf of the tenant where the maximum rent fixed on the  application  of the tenant is the same as, or greater than the rent actually paid by the tenant before the investigation."
                },
                {
                    "representation": "(2)",
                    "description": "Except as provided in subsection"
                }
            ]
        }
    },
    {
        "act": "RICE FARMERS (SECURITY OF TENURE) ACT",
        "source": "https://mola.gov.gy/laws-of-guyana",
        "type": {
            "name": "section",
            "representation": "18",
            "title": "Effective date of certificate. ",
            "context": "RICE FARMERS (SECURITY OF TENURE) ACT under Effective date of certificate. 18.  Where the committee  has ascertained,  assessed and fixed the maximum rent of any holding, the chairman LAWS OF GUYANA 20 Cap. 69:02 Rice Farmers (Security of Tenure)   L.R.O. 1/2012 Certificate of maximum rent.                       Effective date of certificate.    Effective date of first certificate.   Re-opening of investigation.       Cancellation of certificate obtained by fraud,   shall  (a)  cause to be recorded, filed and preserved the reasons for the committees  decision;  (b)   cause a certificate  of the maximum  rent, one for the landlord  and  one  for  every  tenant  who  is  a  party  to  the application under section 12(1) to be completed in the form prescribed by regulations made under this Act;  (c )      sign such certificate;  and  (d)    issue the certificate by causing it to be sent by registered post to the landlord and to each tenant who was a party to the application.",
            "description": [
                {
                    "representation": "(a)",
                    "description": "cause to be recorded, filed and preserved the reasons for the committees  decision;"
                },
                {
                    "representation": "(b)",
                    "description": "cause a certificate  of the maximum  rent, one for the landlord  and  one  for  every  tenant  who  is  a  party  to  the application under section 12(1) to be completed in the form prescribed by regulations made under this Act;"
                },
                {
                    "representation": "(d)",
                    "description": "issue the certificate by causing it to be sent by registered post to the landlord and to each tenant who was a party to the application."
                }
            ]
        }
    },
    {
        "act": "RICE FARMERS (SECURITY OF TENURE) ACT",
        "source": "https://mola.gov.gy/laws-of-guyana",
        "type": {
            "name": "section",
            "representation": "19",
            "title": "Effective date of first certificate. ",
            "context": "RICE FARMERS (SECURITY OF TENURE) ACT under Effective date of first certificate. 19.  Subject to section 20 a certificate issued under section 18 shall come into force on the date of the certificate or on such date as may be specified in the certificate.",
            "description": "Subject to section 20 a certificate issued under section 18 shall come into force on the date of the certificate or on such date as may be specified in the certificate."
        }
    },
    {
        "act": "RICE FARMERS (SECURITY OF TENURE) ACT",
        "source": "https://mola.gov.gy/laws-of-guyana",
        "type": {
            "name": "section",
            "representation": "20",
            "title": "Re-opening of investigation. ",
            "context": "RICE FARMERS (SECURITY OF TENURE) ACT under Re-opening of investigation. 20.  The first certificate issued under section 18 shall come into force on the 1st day of May, 1956, or on such later date as may be specified in the certificate.",
            "description": "The first certificate issued under section 18 shall come into force on the 1st day of May, 1956, or on such later date as may be specified in the certificate."
        }
    },
    {
        "act": "RICE FARMERS (SECURITY OF TENURE) ACT",
        "source": "https://mola.gov.gy/laws-of-guyana",
        "type": {
            "name": "section",
            "representation": "21",
            "title": "Cancellation of certificate obtained by fraud, misrepresentation or collusion. ",
            "context": "RICE FARMERS (SECURITY OF TENURE) ACT under Cancellation of certificate obtained by fraud, misrepresentation or collusion. 21.  Where a certificate of the maximum rent is issued under section 18, the committee may, on the application in writing of the landlord or his agent, re-open the investigation, and the maximum rent, if varied on such re-investigation, shall have effect as provided in section",
            "description": "Where a certificate of the maximum rent is issued under section 18, the committee may, on the application in writing of the landlord or his agent, re-open the investigation, and the maximum rent, if varied on such re-investigation, shall have effect as provided in section"
        }
    },
    {
        "act": "RICE FARMERS (SECURITY OF TENURE) ACT",
        "source": "https://mola.gov.gy/laws-of-guyana",
        "type": {
            "name": "section",
            "representation": "22",
            "title": "Permitted additions to basic rent. ",
            "context": "RICE FARMERS (SECURITY OF TENURE) ACT under Permitted additions to basic rent. 22.  Any certificate issued under section 18 may upon the application of the tenant be cancelled by the committee where the certificate has been obtained by fraud, misrepresentation or collusion. LAWS OF GUYANA Rice Farmers (Security of Tenure)  Cap. 69:02 21  L.R.O. 1/2012 mis- representation  or collusion.  Permitted additions to basic rent.  [8 of 1981 17 of 1996]              c. 64:03       c.  55:03 c.  50:05      c.",
            "description": "Any certificate issued under section 18 may upon the application of the tenant be cancelled by the committee where the certificate has been obtained by fraud, misrepresentation or collusion. LAWS OF GUYANA Rice Farmers (Security of Tenure)  Cap. 69:02 21  L.R.O. 1/2012 mis- representation  or collusion.  Permitted additions to basic rent.  [8 of 1981 17 of 1996]              c. 64:03       c.  55:03 c.  50:05      c."
        }
    },
    {
        "act": "RICE FARMERS (SECURITY OF TENURE) ACT",
        "source": "https://mola.gov.gy/laws-of-guyana",
        "type": {
            "name": "section",
            "representation": "23",
            "title": "Issue of new certificate. ",
            "context": "RICE FARMERS (SECURITY OF TENURE) ACT under Issue of new certificate. 23.  Subject to this Act, the following amounts may be added to the basic rent per acre payable by a tenant on or after the 1st day of May, 1956:  (a)    an amount equivalent to the amount per acre payable by the landlord in respect of the holding by way of rates under any Act providing for local government;  (b)    an amount equivalent to the amount per acre payable by the landlord in respect of the holding by way of rates under the Drainage and Irrigation Act;  (c)    an amount equivalent to the amount per acre payable by the landlord in respect of the holding by way of rates under the East  Demerara  Water  Conservancy  Act  or  the  Boerasirie Creek  Act:  Provided that in computing the amounts which may be added to the basic rent under this subsection in respect of a holding to which the Rent Control  (Special Provisions) Act  applied  and  which  was  the  subject matter of a tenancy at 31st December, 1980, in respect of any period after that date, any increase made in respect of the period when that Act was  in  force,  in  the  amounts  referred  to  in  paragraphs  (a)  to  (c) (inclusive) over the corresponding amounts paid or payable in respect of the  yearly period which included the 31st December,  1973, shall be excluded.",
            "description": [
                {
                    "representation": "(a)",
                    "description": "to"
                },
                {
                    "representation": "(b)",
                    "description": "an amount equivalent to the amount per acre payable by the landlord in respect of the holding by way of rates under the Drainage and Irrigation Act;"
                },
                {
                    "representation": "(c)",
                    "description": "(inclusive) over the corresponding amounts paid or payable in respect of the  yearly period which included the 31st December,  1973, shall be excluded."
                }
            ]
        }
    },
    {
        "act": "RICE FARMERS (SECURITY OF TENURE) ACT",
        "source": "https://mola.gov.gy/laws-of-guyana",
        "type": {
            "name": "section",
            "representation": "24",
            "title": "Effect of certificate. ",
            "context": "RICE FARMERS (SECURITY OF TENURE) ACT under Effect of certificate. 24. (1) Where the maximum rent payable becomes LAWS OF GUYANA 22 Cap. 69:02 Rice Farmers (Security of Tenure)   L.R.O. 1/2012                    Effect of certificate.                            liable to variation by virtue of the operation of section 23 an application may be made to the assessment committee by the landlord or tenant for the issue of a new certificate under section",
            "description": [
                {
                    "representation": "(1)",
                    "description": "Where the maximum rent payable becomes LAWS OF GUYANA 22 Cap. 69:02 Rice Farmers"
                }
            ]
        }
    },
    {
        "act": "RICE FARMERS (SECURITY OF TENURE) ACT",
        "source": "https://mola.gov.gy/laws-of-guyana",
        "type": {
            "name": "section",
            "representation": "25",
            "title": "Appeal from assessment committees. ",
            "context": "RICE FARMERS (SECURITY OF TENURE) ACT under Appeal from assessment committees. 25. (1) A certificate issued by a committee under section 18 or under section 24 shall, in all courts of law and before every assessment committee  (a)     be conclusive evidence as between the landlord and the tenant who were parties to the investigation;  (b)   be conclusive evidence  notwithstanding  any change of landlord, for or against  the tenant  who was a party to the investigation; and  (c)   be prima facie evidence in all other cases,  that the maximum rent of the premises described in the certificate is as stated  therein.  (2) Payment of the maximum rent stated in such certificate may be enforced notwithstanding an appeal under section 26, but where, on such appeal, it is decided that the rent stated in the certificate is less or more than the rent which LAWS OF GUYANA Rice Farmers (Security of Tenure)  Cap. 69:02 23  L.R.O. 1/2012       Appeal from assessment committees.  [6 of 1971 17 of 1996]                                      ought to have been so stated, the tenant or the landlord shall be liable to pay the difference to the landlord or the tenant as the case may be, and such difference may be recovered as a debt due to the landlord or tenant as the case may be.",
            "description": [
                {
                    "representation": "(1)",
                    "description": "A certificate issued by a committee under section 18 or under section 24 shall, in all courts of law and before every assessment committee"
                },
                {
                    "representation": "(a)",
                    "description": "be conclusive evidence as between the landlord and the tenant who were parties to the investigation;"
                },
                {
                    "representation": "(b)",
                    "description": "be conclusive evidence  notwithstanding  any change of landlord, for or against  the tenant  who was a party to the investigation; and"
                },
                {
                    "representation": "(c)",
                    "description": "be prima facie evidence in all other cases,  that the maximum rent of the premises described in the certificate is as stated  therein."
                },
                {
                    "representation": "(2)",
                    "description": "Payment of the maximum rent stated in such certificate may be enforced notwithstanding an appeal under section 26, but where, on such appeal, it is decided that the rent stated in the certificate is less or more than the rent which LAWS OF GUYANA Rice Farmers"
                }
            ]
        }
    },
    {
        "act": "RICE FARMERS (SECURITY OF TENURE) ACT",
        "source": "https://mola.gov.gy/laws-of-guyana",
        "type": {
            "name": "section",
            "representation": "26",
            "title": "Statement as to basic rent and maximum rent to be supplied. ",
            "context": "RICE FARMERS (SECURITY OF TENURE) ACT under Statement as to basic rent and maximum rent to be supplied. 26.  (1) Any landlord or any tenant who is dissatisfied with a decision of  an assessment  committee  under  this Act,  other  than  where  such decision is in this Act stated to be final, may appeal therefrom to the High Court in the manner and subject to the conditions hereinafter provided.  (2) An appellant shall, within twenty-one days after the date of the receipt by him of the certificate sent to him under section 18 or within a like period after the judgment or order in any other case  (a)   pay to the  clerk  of court  for  the  Magisterial District where the holding is situate  on account of the Accountant General the sum of two hundred dollars;  (b)  lodge with the chairman of the committee written notice of appeal and the receipt for the sum paid to the clerk of court under  paragraph (a);  (c)   send by registered post a copy of such written notice of appeal to the opposite party.  (3) Where the appellant has complied with the requirements of subsection (2) (b) within the time therein specified, the chairman of the committee shall,  within  twenty-one  days  after  the  written  notice  of appeal was lodged with him, transmit to the Registrar of the Supreme Court  LAWS OF GUYANA 24 Cap. 69:02 Rice Farmers (Security of Tenure)   L.R.O. 1/2012                                                 (a)   one copy of the evidence recorded under this Act, and duly authenticated  by the signature of the chairman of the committee;  (b)      two copies of the certificates  issued by the chairman duly authenticated by his signature;  (c)   one copy of the reasons for decision duly authenticated by the signature of the chairman;  (d)     the original  notice  of appeal  together  with the receipt lodged with him.   (4) The Registrar shall cause notice of the day and hour fixed for the hearing of the appeal to be sent, by registered post, to the appellant and the opposite party.  (5) Every appeal under this section shall be heard by the Full Court of the High Court which shall have power  (a)   to order that evidence be adduced before the Court on a day to be fixed for that purpose;  (b)   to refer the matter to the assessment committee to make a fresh investigation subject to such direction of law, if any, as the Court thinks fit to give;  (c)  to affirm, increase or decrease the maximum rent;  (d)   to affirm, vary or reverse the order or LAWS OF GUYANA Rice Farmers (Security of Tenure)  Cap. 69:02 25  L.R.O. 1/2012                               Statement as to basic rent and maximum rent to be supplied. [17 of 1996]            decision of the assessment  committee.  (6) Where upon appeal the maximum rent is either increased or decreased the rent as determined on appeal shall become effective as from the date on which the certificate of the committee took effect.  (7)(a)  Such decision shall in the case of an appeal brought from the decision of a committee under section 18, be endorsed on the back of the certificates together with the date of the decision on appeal and shall be authenticated by the signature of the Registrar.  (b)  The Registrar shall transmit to the chairman of the committee one copy of the certificate endorsed and authenticated in accordance with paragraph (a) of this subsection.  (8) In an appeal under this section, the award of costs, if any, and the amount of any such award shall be in the discretion of the Court hearing the appeal.",
            "description": [
                {
                    "representation": "(1)",
                    "description": "Any landlord or any tenant who is dissatisfied with a decision of  an assessment  committee  under  this Act,  other  than  where  such decision is in this Act stated to be final, may appeal therefrom to the High Court in the manner and subject to the conditions hereinafter provided."
                },
                {
                    "representation": "(2)",
                    "description": "(b) within the time therein specified, the chairman of the committee shall,  within  twenty-one  days  after  the  written  notice  of appeal was lodged with him, transmit to the Registrar of the Supreme Court  LAWS OF GUYANA 24 Cap. 69:02 Rice Farmers"
                },
                {
                    "representation": "(a)",
                    "description": "of this subsection."
                },
                {
                    "representation": "(b)",
                    "description": "The Registrar shall transmit to the chairman of the committee one copy of the certificate endorsed and authenticated in accordance with paragraph"
                },
                {
                    "representation": "(c)",
                    "description": "to affirm, increase or decrease the maximum rent;"
                },
                {
                    "representation": "(3)",
                    "description": "Where the appellant has complied with the requirements of subsection"
                },
                {
                    "representation": "(d)",
                    "description": "to affirm, vary or reverse the order or LAWS OF GUYANA Rice Farmers"
                },
                {
                    "representation": "(4)",
                    "description": "The Registrar shall cause notice of the day and hour fixed for the hearing of the appeal to be sent, by registered post, to the appellant and the opposite party."
                },
                {
                    "representation": "(5)",
                    "description": "Every appeal under this section shall be heard by the Full Court of the High Court which shall have power"
                },
                {
                    "representation": "(6)",
                    "description": "Where upon appeal the maximum rent is either increased or decreased the rent as determined on appeal shall become effective as from the date on which the certificate of the committee took effect."
                },
                {
                    "representation": "(8)",
                    "description": "In an appeal under this section, the award of costs, if any, and the amount of any such award shall be in the discretion of the Court hearing the appeal."
                }
            ]
        }
    },
    {
        "act": "RICE FARMERS (SECURITY OF TENURE) ACT",
        "source": "https://mola.gov.gy/laws-of-guyana",
        "type": {
            "name": "section",
            "representation": "27",
            "title": "Termination of tenancy by tenant. ",
            "context": "RICE FARMERS (SECURITY OF TENURE) ACT under Termination of tenancy by tenant. 27.  (1) The landlord of any holding to which this Act applies shall within thirty days from the date on which this Act comes into operation supply the tenant with a statement in writing of the basic rent together with the additions thereto under section 22 claimed by the landlord as the rent payable in respect of the holding. Thereafter, the landlord shall, not later than the 30th day of April, in each calendar year, supply the tenant with such a statement in respect of the rent so claimed for the next ensuing year of the tenancy.  (2) Any such landlord who  (a)  without reasonable excuse fails to comply in any year with subsection LAWS OF GUYANA 26 Cap. 69:02 Rice Farmers (Security of Tenure)   L.R.O. 1/2012                               Termination of tenancy by tenant. [17 of 1996]   Application for termination of  tenancy by landlord. [6 of 1971 10 of 1974 17 of 1996]     (1) within the time specified therein; or  (b)     supplies  a  statement  which  is  false  in  any  material particular, shall be liable on summary conviction to a fine of two thousand five hundred dollars.  (3) Payment of the rent claimed by the landlord in a statement supplied in accordance with subsection (1) may be enforced as the rent of a holding in respect of which there is not then in force any certificate issued by a committee under section 18 or section 24, notwithstanding any application by the tenant under section 12 or section 24 to have the maximum rent of the holding assessed, fixed and certified; but where, in any such case, upon the hearing of an application under section 18 or section 24, the maximum rent stated in the certificate issued under either of such sections is less or more than the rent claimed as aforesaid and paid by the tenant, the landlord or the tenant shall be liable to pay the difference to the tenant or the landlord as the case may be, and such difference may be recovered as a debt due to the tenant or the landlord as the case may be.",
            "description": [
                {
                    "representation": "(1)",
                    "description": "may be enforced as the rent of a holding in respect of which there is not then in force any certificate issued by a committee under section 18 or section 24, notwithstanding any application by the tenant under section 12 or section 24 to have the maximum rent of the holding assessed, fixed and certified; but where, in any such case, upon the hearing of an application under section 18 or section 24, the maximum rent stated in the certificate issued under either of such sections is less or more than the rent claimed as aforesaid and paid by the tenant, the landlord or the tenant shall be liable to pay the difference to the tenant or the landlord as the case may be, and such difference may be recovered as a debt due to the tenant or the landlord as the case may be."
                },
                {
                    "representation": "(2)",
                    "description": "Any such landlord who"
                },
                {
                    "representation": "(a)",
                    "description": "without reasonable excuse fails to comply in any year with subsection LAWS OF GUYANA 26 Cap. 69:02 Rice Farmers"
                },
                {
                    "representation": "(b)",
                    "description": "supplies  a  statement  which  is  false  in  any  material particular, shall be liable on summary conviction to a fine of two thousand five hundred dollars."
                },
                {
                    "representation": "(3)",
                    "description": "Payment of the rent claimed by the landlord in a statement supplied in accordance with subsection"
                }
            ]
        }
    },
    {
        "act": "RICE FARMERS (SECURITY OF TENURE) ACT",
        "source": "https://mola.gov.gy/laws-of-guyana",
        "type": {
            "name": "section",
            "representation": "28",
            "title": "Application for termination of tenancy by landlord. ",
            "context": "RICE FARMERS (SECURITY OF TENURE) ACT under Application for termination of tenancy by landlord. 28.  A tenant may terminate his agreement of tenancy relating to rice land by giving to the landlord not less than six months notice in writing expiring on the thirtieth day of June or thirty-first day of December in any year.",
            "description": "A tenant may terminate his agreement of tenancy relating to rice land by giving to the landlord not less than six months notice in writing expiring on the thirtieth day of June or thirty-first day of December in any year."
        }
    },
    {
        "act": "RICE FARMERS (SECURITY OF TENURE) ACT",
        "source": "https://mola.gov.gy/laws-of-guyana",
        "type": {
            "name": "section",
            "representation": "29",
            "title": "Adjournment of hearing of  application;  stay  of  execution  of order. ",
            "context": "RICE FARMERS (SECURITY OF TENURE) ACT under Adjournment of hearing of  application;  stay  of  execution  of order. 29. (1) A landlord may apply to the assessment committee for the possession of any holding to which this Act applies.   (2) No order or judgment for the recovery of possession of any holding  to  which  this  Act  applies,  or  for  the  ejectment  of  a  tenant therefrom  shall,  whether  in respect  of a notice  given  or proceedings commenced before or after the commencement of this Act, be made or given LAWS OF GUYANA Rice Farmers (Security of Tenure)  Cap. 69:02 27  L.R.O. 1/2012                                                 unless  (a)     the tenant fails to pay the rent due by him by the time and in the manner it becomes due;  (b)    the tenant has given notice to quit and in consequence of that notice, the landlord has contracted to sell or let the holding or has taken any other steps as a result of which he would, in the  opinion of the committee,  be seriously prejudiced  if he could not obtain possession;  (c)  the tenant without any reasonable excuse fails to use the holding wholly or mainly for the cultivation of paddy, and to cultivate at least one paddy crop in any year;  (d)     where  a landlord  has  constructed  or maintained  any fence, dam, canal, drain or koker run, the tenant by any wilful or negligent act or omission causes damage to any such work;   (e)   the tenant is convicted of any offence involving fraud or dishonesty in respect of any agricultural produce or livestock, or  if  the  tenant  is  convicted  of  having  caused  malicious damage to the property of the landlord, or of other tenants of the landlord in the same zone;  (f)    the   holding   or   any   portions   thereof   have   been compulsorily LAWS OF GUYANA 28 Cap. 69:02 Rice Farmers (Security of Tenure)   L.R.O. 1/2012                                                 acquired  under  the  Acquisition  of  Lands  for Public Purposes Act or the Housing Act or are required for the purposes of an approved scheme under the Housing Act or the Town and Country Planning Act;  (g)  the holding is required for public purposes;  (h)   the  tenant  sublets  or assigns  the  holding  without  the consent of the landlord previously obtained in writing;  (i)    the tenant has committed a breach of the rules of good husbandry and the committee has granted the landlord leave to determine his tenancy;  (j)    the committee has given the landlord leave to re-allocate the scattered holdings of his tenants, and the landlord has duly complied with section 39;  (k)   the   landlord   has  been   granted   permission   by  the committee to resume possession of the land and the landlord has duly complied with section 40(2);  (l)     the landlord has been granted leave by the committee under section 41 to reduce the size of his tenants holding; or   (m)    the landlord of rice lands not LAWS OF GUYANA Rice Farmers (Security of Tenure)  Cap. 69:02 29  L.R.O. 1/2012                                                 exceeding in the aggregate one hundred acres, the proof whereof shall lie on him, and who is not a tenant requires the land for his own use in the cultivation of paddy,  and in any such case as aforesaid the committee considers it reasonable to make the order or give the judgment:  Provided that no order or judgment for the recovery of possession or for the ejectment of a tenant shall be made or given  (a)     by reason of the non-payment  of rent if the tenants failure to do so has been occasioned by a total failure of his crop on account of an act of God, the proof whereof shall lie on the tenant; or  (b)  under paragraph  (m) unless the committee  is satisfied that the landlord would suffer greater hardship than his tenant unless  he is granted  possession  and for that purpose  shall, having regard to all relevant circumstances consider whether other rice lands are available to the tenant or under cultivation by  him and,  if so, whether  any undue  economic  hardship would ensue to the landlord should an order be refused, save however,   where  such  an  order  is  made  under  the  said paragraph section 32 mutatis mutandis applies.  (3) An order or judgment for the recovery of possession of any holding  to  which  this  Act  applies  or  for  LAWS OF GUYANA 30 Cap. 69:02 Rice Farmers (Security of Tenure)   L.R.O. 1/2012                              Adjournment of hearing of application; stay of execution of order.              the  ejectment  of  a  tenant therefrom may be enforced as if it were an order for possession made by a magistrate under section 46 of the Landlord and Tenant Act.   (4) The  Minister,   where  he  is  satisfied   that  the  prevailing circumstances in Guyana or any part thereof require additional relief to be   provided  to  tenants  therein  by  reason  of  their  being  affected adversely by circumstances beyond their control, may by order, declare Guyana or that part thereof to be an agricultural emergency area.  (5) Notwithstanding  anything  to the contrary contained  in any law, during the continuance in force of any Order made under subsection (4), no application by a landlord under subsection (1) or under section 37(1) may be made to, or be entertained by, a committee in respect of any  holding situate within the area to which the Order applies, where such application is for possession of the holding by reason of the non- payment of rent or for the issue of a certificate that the tenant is not observing the rules of good husbandry, as the case may be.",
            "description": [
                {
                    "representation": "(1)",
                    "description": "or under section 37(1) may be made to, or be entertained by, a committee in respect of any  holding situate within the area to which the Order applies, where such application is for possession of the holding by reason of the non- payment of rent or for the issue of a certificate that the tenant is not observing the rules of good husbandry, as the case may be."
                },
                {
                    "representation": "(2)",
                    "description": "No order or judgment for the recovery of possession of any holding  to  which  this  Act  applies,  or  for  the  ejectment  of  a  tenant therefrom  shall,  whether  in respect  of a notice  given  or proceedings commenced before or after the commencement of this Act, be made or given LAWS OF GUYANA Rice Farmers"
                },
                {
                    "representation": "(a)",
                    "description": "by reason of the non-payment  of rent if the tenants failure to do so has been occasioned by a total failure of his crop on account of an act of God, the proof whereof shall lie on the tenant; or"
                },
                {
                    "representation": "(b)",
                    "description": "under paragraph"
                },
                {
                    "representation": "(c)",
                    "description": "the tenant without any reasonable excuse fails to use the holding wholly or mainly for the cultivation of paddy, and to cultivate at least one paddy crop in any year;"
                },
                {
                    "representation": "(d)",
                    "description": "where  a landlord  has  constructed  or maintained  any fence, dam, canal, drain or koker run, the tenant by any wilful or negligent act or omission causes damage to any such work;"
                },
                {
                    "representation": "(e)",
                    "description": "the tenant is convicted of any offence involving fraud or dishonesty in respect of any agricultural produce or livestock, or  if  the  tenant  is  convicted  of  having  caused  malicious damage to the property of the landlord, or of other tenants of the landlord in the same zone;"
                },
                {
                    "representation": "(f)",
                    "description": "the   holding   or   any   portions   thereof   have   been compulsorily LAWS OF GUYANA 28 Cap. 69:02 Rice Farmers"
                },
                {
                    "representation": "(g)",
                    "description": "the holding is required for public purposes;"
                },
                {
                    "representation": "(h)",
                    "description": "the  tenant  sublets  or assigns  the  holding  without  the consent of the landlord previously obtained in writing;"
                },
                {
                    "representation": "(i)",
                    "description": "the tenant has committed a breach of the rules of good husbandry and the committee has granted the landlord leave to determine his tenancy;"
                },
                {
                    "representation": "(j)",
                    "description": "the committee has given the landlord leave to re-allocate the scattered holdings of his tenants, and the landlord has duly complied with section 39;"
                },
                {
                    "representation": "(k)",
                    "description": "the   landlord   has  been   granted   permission   by  the committee to resume possession of the land and the landlord has duly complied with section 40(2);"
                },
                {
                    "representation": "(l)",
                    "description": "the landlord has been granted leave by the committee under section 41 to reduce the size of his tenants holding; or"
                },
                {
                    "representation": "(m)",
                    "description": "unless the committee  is satisfied that the landlord would suffer greater hardship than his tenant unless  he is granted  possession  and for that purpose  shall, having regard to all relevant circumstances consider whether other rice lands are available to the tenant or under cultivation by  him and,  if so, whether  any undue  economic  hardship would ensue to the landlord should an order be refused, save however,   where  such  an  order  is  made  under  the  said paragraph section 32 mutatis mutandis applies."
                },
                {
                    "representation": "(3)",
                    "description": "An order or judgment for the recovery of possession of any holding  to  which  this  Act  applies  or  for  LAWS OF GUYANA 30 Cap. 69:02 Rice Farmers"
                },
                {
                    "representation": "(4)",
                    "description": "The  Minister,   where  he  is  satisfied   that  the  prevailing circumstances in Guyana or any part thereof require additional relief to be   provided  to  tenants  therein  by  reason  of  their  being  affected adversely by circumstances beyond their control, may by order, declare Guyana or that part thereof to be an agricultural emergency area."
                },
                {
                    "representation": "(5)",
                    "description": "Notwithstanding  anything  to the contrary contained  in any law, during the continuance in force of any Order made under subsection"
                }
            ]
        }
    },
    {
        "act": "RICE FARMERS (SECURITY OF TENURE) ACT",
        "source": "https://mola.gov.gy/laws-of-guyana",
        "type": {
            "name": "section",
            "representation": "30",
            "title": "Tenant to be granted time to reap crop. LAWS OF GUYANA 4 Cap. 69:02 Rice Farmers (Security of Tenure)   L.R.O. 1/2012 SECTION   ",
            "context": "RICE FARMERS (SECURITY OF TENURE) ACT under Tenant to be granted time to reap crop. LAWS OF GUYANA 4 Cap. 69:02 Rice Farmers (Security of Tenure)   L.R.O. 1/2012 SECTION   30.  (1) Where application is made to the committee under section 28 (1) the committee may  (a)     adjourn the hearing of the application from time to time,   (b)    stay or suspend execution of the order or judgment or postpone the date of possession for such period as it thinks fit, and from time to time grant further stays or suspensions of execution   and   further   postponements of the date of  possession.  LAWS OF GUYANA Rice Farmers (Security of Tenure)  Cap. 69:02 31  L.R.O. 1/2012          Tenant to be granted time to reap crop. [6 of 1971 17 of 1996]     Compensa-tion.                Sub-tenancy to continue notwithstand -ing order, etc. for  possession. [6 of 1971]       (2) Any such adjournment,  stay, suspension  or postponement may be granted subject to such conditions, if any, as the committee thinks fit, and if such conditions are complied with and the order has been made or the judgment given, the committee may discharge or rescind the order or judgment.",
            "description": [
                {
                    "representation": "(1)",
                    "description": "the committee may"
                },
                {
                    "representation": "(a)",
                    "description": "adjourn the hearing of the application from time to time,"
                },
                {
                    "representation": "(b)",
                    "description": "stay or suspend execution of the order or judgment or postpone the date of possession for such period as it thinks fit, and from time to time grant further stays or suspensions of execution   and   further   postponements of the date of  possession.  LAWS OF GUYANA Rice Farmers"
                },
                {
                    "representation": "(2)",
                    "description": "Any such adjournment,  stay, suspension  or postponement may be granted subject to such conditions, if any, as the committee thinks fit, and if such conditions are complied with and the order has been made or the judgment given, the committee may discharge or rescind the order or judgment."
                }
            ]
        }
    },
    {
        "act": "RICE FARMERS (SECURITY OF TENURE) ACT",
        "source": "https://mola.gov.gy/laws-of-guyana",
        "type": {
            "name": "section",
            "representation": "31",
            "title": "Compensation ",
            "context": "RICE FARMERS (SECURITY OF TENURE) ACT under Compensation 31.   In granting an order or giving judgment under section 28, the committee shall not require the tenant to quit the holding until the crop then growing thereon has been reaped, or until after the date when the crop would normally be reaped in that zone and if no crop has been planted, then on 30th June next.",
            "description": "In granting an order or giving judgment under section 28, the committee shall not require the tenant to quit the holding until the crop then growing thereon has been reaped, or until after the date when the crop would normally be reaped in that zone and if no crop has been planted, then on 30th June next."
        }
    },
    {
        "act": "RICE FARMERS (SECURITY OF TENURE) ACT",
        "source": "https://mola.gov.gy/laws-of-guyana",
        "type": {
            "name": "section",
            "representation": "32",
            "title": "Sub-tenancy to continue notwithstanding order, etc.  for possession. ",
            "context": "RICE FARMERS (SECURITY OF TENURE) ACT under Sub-tenancy to continue notwithstanding order, etc.  for possession. 32.  (1) Where an order has been made on any of the grounds set out in section 29(2)(k) or (1), the assessment committee may award the tenant and any sub-tenant such compensation as it may consider just in the  circumstances.  (2) Where after a landlord has obtained an order or judgment for possession or ejectment under section 29, it is subsequently made to appear to the committee that the order was obtained by misrepresentation or the concealment of material facts, the committee may order the landlord to pay to any former tenant such sum as appears sufficient as compensation for damage or loss sustained by the tenant as a result of the order or judgment.",
            "description": [
                {
                    "representation": "(1)",
                    "description": "Where an order has been made on any of the grounds set out in section 29(2)(k) or"
                },
                {
                    "representation": "(2)",
                    "description": "Where after a landlord has obtained an order or judgment for possession or ejectment under section 29, it is subsequently made to appear to the committee that the order was obtained by misrepresentation or the concealment of material facts, the committee may order the landlord to pay to any former tenant such sum as appears sufficient as compensation for damage or loss sustained by the tenant as a result of the order or judgment."
                }
            ]
        }
    },
    {
        "act": "RICE FARMERS (SECURITY OF TENURE) ACT",
        "source": "https://mola.gov.gy/laws-of-guyana",
        "type": {
            "name": "section",
            "representation": "33",
            "title": "Termination of tenancy by mutual consent. ",
            "context": "RICE FARMERS (SECURITY OF TENURE) ACT under Termination of tenancy by mutual consent. 33. (1) Notwithstanding an order or judgment under section 29 a sub-tenant shall be entitled to remain in possession of his holding in terms of his sub-tenancy as from the date of the order or judgment as aforesaid.  (2) Where a sub-tenant remains in possession of a holding in accordance with subsection (1), this Act shall apply as if he were the tenant of the landlord in whose favour the order or judgment was given:  LAWS OF GUYANA 32 Cap. 69:02 Rice Farmers (Security of Tenure)   L.R.O. 1/2012      Termination of tenancy by mutual consent. [6 of 1971 17 of 1996]                         Subletting of holding.            Provided that the provisions of subsection (1) shall not apply in the case of an order or judgment made on any of the grounds set out in section 29(2)(f ), (g), (h), (i), ( j), (k), (l) or (m).",
            "description": [
                {
                    "representation": "(1)",
                    "description": "shall not apply in the case of an order or judgment made on any of the grounds set out in section 29(2)(f ),"
                },
                {
                    "representation": "(2)",
                    "description": "Where a sub-tenant remains in possession of a holding in accordance with subsection"
                },
                {
                    "representation": "(l)",
                    "description": "or"
                }
            ]
        }
    },
    {
        "act": "RICE FARMERS (SECURITY OF TENURE) ACT",
        "source": "https://mola.gov.gy/laws-of-guyana",
        "type": {
            "name": "section",
            "representation": "34",
            "title": "Sub-letting of holding. ",
            "context": "RICE FARMERS (SECURITY OF TENURE) ACT under Sub-letting of holding. 34.  (1) Nothing in this Act shall prevent a landlord and a tenant from terminating an agreement of tenancy by mutual consent in writing signed in the presence of two witnesses one of whom shall, in the case of a tenant being unable to sign his name, be a justice of the peace or a member of the local government authority for the area where the holding in question is situated.  (2) Where a tenant has been dispossessed  of his holding by a landlord, otherwise than as provided in this Act, a committee may, upon an application by the tenant and on proof of such dispossession, order that the tenant be re-instated and, whether in addition thereto or in lieu thereof,   issue  a  certificate   awarding  such  sum  as  the  committee considers  reasonable  as damages.  (3) Without  prejudice  to  the  provisions  of  subsection  (2)  a landlord who dispossesses, or causes to be dispossessed, a tenant of his holding,  otherwise  than  as  provided  in  this  Act,  shall  be  liable  on summary conviction to a fine of fifteen thousand dollars and, in addition, to a fine of three hundred dollars for each day the tenant is kept out of possession.",
            "description": [
                {
                    "representation": "(1)",
                    "description": "Nothing in this Act shall prevent a landlord and a tenant from terminating an agreement of tenancy by mutual consent in writing signed in the presence of two witnesses one of whom shall, in the case of a tenant being unable to sign his name, be a justice of the peace or a member of the local government authority for the area where the holding in question is situated."
                },
                {
                    "representation": "(2)",
                    "description": "a landlord who dispossesses, or causes to be dispossessed, a tenant of his holding,  otherwise  than  as  provided  in  this  Act,  shall  be  liable  on summary conviction to a fine of fifteen thousand dollars and, in addition, to a fine of three hundred dollars for each day the tenant is kept out of possession."
                },
                {
                    "representation": "(3)",
                    "description": "Without  prejudice  to  the  provisions  of  subsection"
                }
            ]
        }
    },
    {
        "act": "RICE FARMERS (SECURITY OF TENURE) ACT",
        "source": "https://mola.gov.gy/laws-of-guyana",
        "type": {
            "name": "section",
            "representation": "35",
            "title": "Transfer of agreement of tenancy. ",
            "context": "RICE FARMERS (SECURITY OF TENURE) ACT under Transfer of agreement of tenancy. 35.  (1) A tenant of a holding shall not sub-let the holding without the consent of the landlord previously obtained in writing.  (2) Such consent shall not be unreasonably withheld by the landlord.  (3) Every tenant who desires to sub-let any such holding shall, if required so to do by the landlord  LAWS OF GUYANA Rice Farmers (Security of Tenure)  Cap. 69:02 33  L.R.O. 1/2012                              Transfer of agreement of tenancy. [6 of 1971]                 (a)    disclose  to  the  landlord  the  terms  upon  which  he proposes to sub-let the holding; and  (b)     render  it  a  term  of  any  sub-tenancy  of  the  holding created by him that the sub-tenant shall pay to the landlord the full amount of the rent payable by the tenant in respect of such holding.  (4) Where a tenant  claims  that the landlord  has unreasonably withheld his consent to the sub-tenancy of any such holding, he may make application in writing to the assessment committee of the district in  which  the  holding  is  situate  for  its  consent  and  the  assessment committee  shall,  if it considers  that  the consent  of the landlord  has unreasonably been withheld, give its consent to the sub-letting and the consent of the assessment committee shall have effect as if it were the consent of the landlord previously obtained in writing.",
            "description": [
                {
                    "representation": "(1)",
                    "description": "A tenant of a holding shall not sub-let the holding without the consent of the landlord previously obtained in writing."
                },
                {
                    "representation": "(2)",
                    "description": "Such consent shall not be unreasonably withheld by the landlord."
                },
                {
                    "representation": "(3)",
                    "description": "Every tenant who desires to sub-let any such holding shall, if required so to do by the landlord  LAWS OF GUYANA Rice Farmers"
                },
                {
                    "representation": "(a)",
                    "description": "disclose  to  the  landlord  the  terms  upon  which  he proposes to sub-let the holding; and"
                },
                {
                    "representation": "(b)",
                    "description": "render  it  a  term  of  any  sub-tenancy  of  the  holding created by him that the sub-tenant shall pay to the landlord the full amount of the rent payable by the tenant in respect of such holding."
                },
                {
                    "representation": "(4)",
                    "description": "Where a tenant  claims  that the landlord  has unreasonably withheld his consent to the sub-tenancy of any such holding, he may make application in writing to the assessment committee of the district in  which  the  holding  is  situate  for  its  consent  and  the  assessment committee  shall,  if it considers  that  the consent  of the landlord  has unreasonably been withheld, give its consent to the sub-letting and the consent of the assessment committee shall have effect as if it were the consent of the landlord previously obtained in writing."
                }
            ]
        }
    },
    {
        "act": "RICE FARMERS (SECURITY OF TENURE) ACT",
        "source": "https://mola.gov.gy/laws-of-guyana",
        "type": {
            "name": "section",
            "representation": "36",
            "title": "Bequest of agreement of tenancy. ",
            "context": "RICE FARMERS (SECURITY OF TENURE) ACT under Bequest of agreement of tenancy. 36.23          Issue of new certificate.",
            "description": "36.23          Issue of new certificate."
        }
    },
    {
        "act": "RICE FARMERS (SECURITY OF TENURE) ACT",
        "source": "https://mola.gov.gy/laws-of-guyana",
        "type": {
            "name": "section",
            "representation": "37",
            "title": "Certificate of non-observance of rules of good estate management or good husbandry. ",
            "context": "RICE FARMERS (SECURITY OF TENURE) ACT under Certificate of non-observance of rules of good estate management or good husbandry. 37.  (1) Where a tenant of any holding, by will or other testamentary writing, bequeaths his interest in any agreement of tenancy to any person (in this section referred to as the legatee), such bequest shall, be subject to the following provisions:  (a)   the legatee or the executor shall notify the landlord in writing of the testamentary  bequest within twenty-one days after the death of the tenant, unless they are prevented by some unavoidable cause from notifying him within that time, and in that event they shall notify him as soon as possible thereafter;  (b)    the transfer to give effect to the bequest shall be subject to the consent of the landlord which said consent shall not be unreasonably refused;  (c)    if  under  this  section  a  landlord  refuses  to  grant  his consent he shall, in writing, so inform the legatee and shall state the reasons for his refusal of consent;  (d)    any legatee who is aggrieved by any refusal of consent by a landlord under this section may appeal to the assessment committee of the district in which the holding is situate and the LAWS OF GUYANA Rice Farmers (Security of Tenure)  Cap. 69:02 35  L.R.O. 1/2012                                    Certificate of non- observance of rules of good estate management or of good husbandry. [6 of 1971]     decision of the said committee shall be final.  (2) In the event of a tenant dying intestate  (a)   the widow or widower who was residing with the tenant at the time of death; or  (b)   where there is no such widow or widower the reputed spouse of the tenant with whom the tenant at the time of his death had his home established for not less than one year prior thereto; or  (c)   where  there  is  no  such  widow,  widower  or  reputed spouse, such member of the tenants family or household as was residing with, and dependent upon, the tenant at the time of his death,  shall  within  six months  of the date  of death  be entitled  to make  an application for a transfer of the tenancy if the landlord is or appears to be  unwilling  to give  his consent  for the  transfer  and subsection  (1) mutatis  mutandis applies.",
            "description": [
                {
                    "representation": "(1)",
                    "description": "mutatis  mutandis applies."
                },
                {
                    "representation": "(a)",
                    "description": "the widow or widower who was residing with the tenant at the time of death; or"
                },
                {
                    "representation": "(b)",
                    "description": "where there is no such widow or widower the reputed spouse of the tenant with whom the tenant at the time of his death had his home established for not less than one year prior thereto; or"
                },
                {
                    "representation": "(c)",
                    "description": "where  there  is  no  such  widow,  widower  or  reputed spouse, such member of the tenants family or household as was residing with, and dependent upon, the tenant at the time of his death,  shall  within  six months  of the date  of death  be entitled  to make  an application for a transfer of the tenancy if the landlord is or appears to be  unwilling  to give  his consent  for the  transfer  and subsection"
                },
                {
                    "representation": "(d)",
                    "description": "any legatee who is aggrieved by any refusal of consent by a landlord under this section may appeal to the assessment committee of the district in which the holding is situate and the LAWS OF GUYANA Rice Farmers"
                },
                {
                    "representation": "(2)",
                    "description": "In the event of a tenant dying intestate"
                }
            ]
        }
    },
    {
        "act": "RICE FARMERS (SECURITY OF TENURE) ACT",
        "source": "https://mola.gov.gy/laws-of-guyana",
        "type": {
            "name": "section",
            "representation": "38",
            "title": "Re-allocation of lands by landlord. ",
            "context": "RICE FARMERS (SECURITY OF TENURE) ACT under Re-allocation of lands by landlord. 38.  (1) If any question or difference arises with respect to the non- observance by a landlord  of any holding  of the rules  of good estate management or by a tenant thereof of the rules of good husbandry, the tenant or the landlord, as the case may be, may apply to the assessment committee of the area in which his holding is situate for a certificate that the  landlord  or the tenant  is not observing  the rules of good estate management or the rules of good husbandry, as the case may be.  LAWS OF GUYANA 36 Cap. 69:02 Rice Farmers (Security of Tenure)   L.R.O. 1/2012                                                 (2) On any such application being made, the assessment committee  after giving the landlord and the tenant an opportunity of being heard, shall, if it thinks fit, either grant or refuse the certificate:  Provided that if the committee considers that the breach by the tenant of the rules of good husbandry is of such a nature that an order for the payment of damages by the tenant to the landlord in lieu of the issue of a certificate would be just and reasonable the committee shall assess and fix the amount to be paid on such terms and conditions as it may determine.  (3) A certificate granted under this section to a landlord shall entitle him to determine the tenancy by notice to the tenant to quit the holding given in accordance with the terms of the certificate and the time within which such notice is to be given and the period of notice to be given shall be stated in the certificate which shall be signed by the chairman of the committee.  (4) Where land has been broken in for the cultivation of paddy by, or at the expense of, the tenant and the landlord has been granted a certificate under this section, the landlord shall pay to the tenant such sum as may be assessed by the committee which sum shall be specified in the certificate granted to the landlord. In assessing such sum to be paid, the committee shall take into account any improvement in the value of the land resulting from such breaking in of the land.  (5) A certificate  granted  under  this  section  to  a  tenant  shall specify the amount assessed and fixed by the assessment committee as damages to be paid by the landlord to the tenant for non-observance by the landlord of the rules of good estate management.  (6) Where at the hearing of an application by a LAWS OF GUYANA Rice Farmers (Security of Tenure)  Cap. 69:02 37  L.R.O. 1/2012                                      Re-allocation of lands by landlord. [6 of 1971]        tenant under this section it is alleged by the landlord that, but for the unreasonable refusal of a local government authority to permit him to carry out certain works, he would observe the rules of good estate management, the committee may adjourn the hearing of the application and by notice to that authority require it to be represented before the committee on the date specified in such notice.  (7) Where the authority appears, or fails to be represented, on the specified date the committee may proceed to hear the application and if it is satisfied that the landlord would not have committed a breach of the  rules of good estate management but for the unreasonable refusal of the  authority the committee  shall so state in the certificate  issued under this section and any damages to be paid by a landlord pursuant to such a certificate may be recovered by him from the authority and the provisions of section 51 shall mutatis mutandis apply.  (8) The procedure set out in section 11 shall mutatis mutandis apply to an application made under this section.   (9) The  provisions  of  section  25  (regarding  an  appeal  by  a landlord or tenant) shall mutatis mutandis apply to a local government authority dissatisfied with a decision of a committee  under subsection (7), and in any such appeal by the authority, the tenant and the landlord in  the  proceedings  before  the  committee  from  which  the  appeal  is brought shall be the respondents to the appeal.",
            "description": [
                {
                    "representation": "(1)",
                    "description": "If any question or difference arises with respect to the non- observance by a landlord  of any holding  of the rules  of good estate management or by a tenant thereof of the rules of good husbandry, the tenant or the landlord, as the case may be, may apply to the assessment committee of the area in which his holding is situate for a certificate that the  landlord  or the tenant  is not observing  the rules of good estate management or the rules of good husbandry, as the case may be.  LAWS OF GUYANA 36 Cap. 69:02 Rice Farmers"
                },
                {
                    "representation": "(2)",
                    "description": "On any such application being made, the assessment committee  after giving the landlord and the tenant an opportunity of being heard, shall, if it thinks fit, either grant or refuse the certificate:  Provided that if the committee considers that the breach by the tenant of the rules of good husbandry is of such a nature that an order for the payment of damages by the tenant to the landlord in lieu of the issue of a certificate would be just and reasonable the committee shall assess and fix the amount to be paid on such terms and conditions as it may determine."
                },
                {
                    "representation": "(3)",
                    "description": "A certificate granted under this section to a landlord shall entitle him to determine the tenancy by notice to the tenant to quit the holding given in accordance with the terms of the certificate and the time within which such notice is to be given and the period of notice to be given shall be stated in the certificate which shall be signed by the chairman of the committee."
                },
                {
                    "representation": "(4)",
                    "description": "Where land has been broken in for the cultivation of paddy by, or at the expense of, the tenant and the landlord has been granted a certificate under this section, the landlord shall pay to the tenant such sum as may be assessed by the committee which sum shall be specified in the certificate granted to the landlord. In assessing such sum to be paid, the committee shall take into account any improvement in the value of the land resulting from such breaking in of the land."
                },
                {
                    "representation": "(5)",
                    "description": "A certificate  granted  under  this  section  to  a  tenant  shall specify the amount assessed and fixed by the assessment committee as damages to be paid by the landlord to the tenant for non-observance by the landlord of the rules of good estate management."
                },
                {
                    "representation": "(6)",
                    "description": "Where at the hearing of an application by a LAWS OF GUYANA Rice Farmers"
                },
                {
                    "representation": "(7)",
                    "description": "Where the authority appears, or fails to be represented, on the specified date the committee may proceed to hear the application and if it is satisfied that the landlord would not have committed a breach of the  rules of good estate management but for the unreasonable refusal of the  authority the committee  shall so state in the certificate  issued under this section and any damages to be paid by a landlord pursuant to such a certificate may be recovered by him from the authority and the provisions of section 51 shall mutatis mutandis apply."
                },
                {
                    "representation": "(8)",
                    "description": "The procedure set out in section 11 shall mutatis mutandis apply to an application made under this section."
                },
                {
                    "representation": "(9)",
                    "description": "The  provisions  of  section  25"
                }
            ]
        }
    },
    {
        "act": "RICE FARMERS (SECURITY OF TENURE) ACT",
        "source": "https://mola.gov.gy/laws-of-guyana",
        "type": {
            "name": "section",
            "representation": "39",
            "title": "Resumption of lands by landlord. ",
            "context": "RICE FARMERS (SECURITY OF TENURE) ACT under Resumption of lands by landlord. 39.  (1) A  landlord  who  desires  to  re-allocate  the  holdings  of  his tenants  into  single  blocks  may  make  application  in  writing  to  the assessment committee of the area in which the holdings are situate for leave to re-allocate the holdings.  The assessment committee, subject to this  section, and after giving any other tenant of the said landlord an opportunity of making any representations he may desire to make, may, if it is satisfied that the application is made in LAWS OF GUYANA 38 Cap. 69:02 Rice Farmers (Security of Tenure)   L.R.O. 1/2012                          Resumption of lands by landlord. [6 of 1971 17 of 1996]                   good faith and that, having regard   to   the   scattered   nature   of   the   holdings   and   any   other consideration which  the assessment  committee  considers  relevant,  it ought to be granted, give leave to the landlord to re-allocate the holdings aforesaid. (2) No such leave shall be given unless  (a)    the re-allocation applies to land  already  under  paddy cultivation,  or in a fit state according to normal agricultural standards, for such cultivation; and  (b)      the landlord has made available for the tenant other lands suitable according to normal agricultural standards for paddy cultivation.",
            "description": [
                {
                    "representation": "(1)",
                    "description": "A  landlord  who  desires  to  re-allocate  the  holdings  of  his tenants  into  single  blocks  may  make  application  in  writing  to  the assessment committee of the area in which the holdings are situate for leave to re-allocate the holdings.  The assessment committee, subject to this  section, and after giving any other tenant of the said landlord an opportunity of making any representations he may desire to make, may, if it is satisfied that the application is made in LAWS OF GUYANA 38 Cap. 69:02 Rice Farmers"
                },
                {
                    "representation": "(2)",
                    "description": "No such leave shall be given unless"
                },
                {
                    "representation": "(a)",
                    "description": "the re-allocation applies to land  already  under  paddy cultivation,  or in a fit state according to normal agricultural standards, for such cultivation; and"
                },
                {
                    "representation": "(b)",
                    "description": "the landlord has made available for the tenant other lands suitable according to normal agricultural standards for paddy cultivation."
                }
            ]
        }
    },
    {
        "act": "RICE FARMERS (SECURITY OF TENURE) ACT",
        "source": "https://mola.gov.gy/laws-of-guyana",
        "type": {
            "name": "section",
            "representation": "40",
            "title": "Reduction of size of holding by landlord. ",
            "context": "RICE FARMERS (SECURITY OF TENURE) ACT under Reduction of size of holding by landlord. 40.",
            "description": "40."
        }
    },
    {
        "act": "RICE FARMERS (SECURITY OF TENURE) ACT",
        "source": "https://mola.gov.gy/laws-of-guyana",
        "type": {
            "name": "section",
            "representation": "41",
            "title": "Tenant desiring to secure additional land for cultivation of paddy. ",
            "context": "RICE FARMERS (SECURITY OF TENURE) ACT under Tenant desiring to secure additional land for cultivation of paddy. 41.  (1) A landlord who desires to reduce the size of the holding of a tenant whose holding is larger than he can efficiently cultivate may make application in writing to the assessment committee for leave to give his tenant notice to give up possession of a portion of the holding and the assessment  committee  after  giving  to  the  tenant  an  opportunity  of making any representations he desires to make, may grant the landlord leave to reduce the holding to such size as may be stated in the order or judgment, if it is satisfied that having regard to all the circumstances of the case no substantial hardship would be caused by granting such leave, and  that  leave  ought  to  be  granted  for  the  purposes  of  increased production.  (2) The landlord shall forthwith make available by way of sale or letting for the purposes of paddy cultivation any land of which a tenant is deprived of possession in pursuance of an order or judgment of the assessment committee made under subsection (1).  If the committee is of opinion that the landlord has failed to make the land available as aforesaid, the committee may as agent of the landlord let the said land to any person it considers suitable and who desires to cultivate paddy on the said land and who is either not cultivating rice land or is not cultivating rice land of a sufficient size for his needs.  (3) The procedure in the case of an investigation of an application under subsection (1), shall mutatis mutandis be the same as in the case of an application under section 11(1).",
            "description": [
                {
                    "representation": "(1)",
                    "description": "A landlord who desires to reduce the size of the holding of a tenant whose holding is larger than he can efficiently cultivate may make application in writing to the assessment committee for leave to give his tenant notice to give up possession of a portion of the holding and the assessment  committee  after  giving  to  the  tenant  an  opportunity  of making any representations he desires to make, may grant the landlord leave to reduce the holding to such size as may be stated in the order or judgment, if it is satisfied that having regard to all the circumstances of the case no substantial hardship would be caused by granting such leave, and  that  leave  ought  to  be  granted  for  the  purposes  of  increased production."
                },
                {
                    "representation": "(2)",
                    "description": "The landlord shall forthwith make available by way of sale or letting for the purposes of paddy cultivation any land of which a tenant is deprived of possession in pursuance of an order or judgment of the assessment committee made under subsection"
                },
                {
                    "representation": "(3)",
                    "description": "The procedure in the case of an investigation of an application under subsection"
                }
            ]
        }
    },
    {
        "act": "RICE FARMERS (SECURITY OF TENURE) ACT",
        "source": "https://mola.gov.gy/laws-of-guyana",
        "type": {
            "name": "section",
            "representation": "42",
            "title": "Orders obtained under section 39 or ",
            "context": "RICE FARMERS (SECURITY OF TENURE) ACT under Orders obtained under section 39 or 42. (1) Any tenant who desires to secure additional land for the cultivation of paddy may apply to the assessment committee in writing for leave to give his landlord notice to make available to him as rice land any land or any portion of LAWS OF GUYANA 40 Cap. 69:02 Rice Farmers (Security of Tenure)   L.R.O. 1/2012 cultivation of  paddy. [17 of 1996]                             Orders obtained  under section 39 or",
            "description": [
                {
                    "representation": "(1)",
                    "description": "Any tenant who desires to secure additional land for the cultivation of paddy may apply to the assessment committee in writing for leave to give his landlord notice to make available to him as rice land any land or any portion of LAWS OF GUYANA 40 Cap. 69:02 Rice Farmers"
                }
            ]
        }
    },
    {
        "act": "RICE FARMERS (SECURITY OF TENURE) ACT",
        "source": "https://mola.gov.gy/laws-of-guyana",
        "type": {
            "name": "section",
            "representation": "43",
            "title": "Service of notices. ",
            "context": "RICE FARMERS (SECURITY OF TENURE) ACT under Service of notices. 43.  (1) Whenever a landlord has obtained an order or judgment for possession of any holding on any ground specified in section 39 or 40 and the order or judgment is executed or the tenant voluntarily gives up his tenancy in consequence of that order or judgment, the landlord shall be guilty of an offence  (a)     if,  within  five  years  of  such  order  or  judgment,  the landlord   without   first   obtaining   the   permission   of   the committee sells or otherwise disposes of the holding, or uses, or permits to be used, or lets, the holding for any purpose other than that which L.R.O. 1/2012 performed by the appellant shall be so (a)    the acts required by section 26(2) to be Provided that  shall apply to an appeal from such a decision: decision within the meaning of section 26(1), and that section terms  or conditions, of any such application, shall be a (4) The  grant  or  refusal,  or  the  grant  subject  to   of his order thereon. sent by registered post, to the landlord and the tenant a copy the chairman of the assessment committee shall cause to be (3) On the determination of any such application  same  as  in  the  case  of  an application under section 12(1). holding for any other purpose  shall  mutatis  mutandis  be  the  an application by  a landlord for permission to use or let such (2) The procedure in the case of an investigation of  respect of which the order was made. of five hundred dollars for every acre in excess of five acres in thousand five hundred dollars and, in addition thereto, a sum and shall be liable on summary conviction to a fine of seven   have attached to that permission, which  the assessment committee may any  of  the  terms  or  conditions  aforesaid,  he fails to comply  with  (c)   if having obtained permission  as possession; or purpose for which he resumed holding use the said holding for the after obtaining possession of the (b)     if he does not within a reasonable time  given; order was made or the judgment was constituted the ground on which the                                                  Cap. 69:02 Rice Farmers (Security of Tenure)  41 LAWS OF GUYANA LAWS OF GUYANA 42 Cap. 69:02 Rice Farmers (Security of Tenure)   L.R.O. 1/2012        performed by him within fourteen days after  he  receives  from  the  chairman  of  the  assessment committee a notification of the committees decision;  (b)   section 26(3)(b), (6) and (7) shall not apply to any appeal under this section; and  (c)    the  Registrar  shall  transmit  to  the  chairman  of  the assessment committee a copy of any order entered pursuant to  the  disposal  of  the  appeal  duly  authenticated  by  the signature of the Registrar.  (5) For the purposes of the provisions of this",
            "description": [
                {
                    "representation": "(1)",
                    "description": "Whenever a landlord has obtained an order or judgment for possession of any holding on any ground specified in section 39 or 40 and the order or judgment is executed or the tenant voluntarily gives up his tenancy in consequence of that order or judgment, the landlord shall be guilty of an offence"
                },
                {
                    "representation": "(a)",
                    "description": "the acts required by section 26(2) to be Provided that  shall apply to an appeal from such a decision: decision within the meaning of section 26(1), and that section terms  or conditions, of any such application, shall be a"
                },
                {
                    "representation": "(4)",
                    "description": "The  grant  or  refusal,  or  the  grant  subject  to   of his order thereon. sent by registered post, to the landlord and the tenant a copy the chairman of the assessment committee shall cause to be"
                },
                {
                    "representation": "(3)",
                    "description": "On the determination of any such application  same  as  in  the  case  of  an application under section 12(1). holding for any other purpose  shall  mutatis  mutandis  be  the  an application by  a landlord for permission to use or let such"
                },
                {
                    "representation": "(2)",
                    "description": "The procedure in the case of an investigation of  respect of which the order was made. of five hundred dollars for every acre in excess of five acres in thousand five hundred dollars and, in addition thereto, a sum and shall be liable on summary conviction to a fine of seven   have attached to that permission, which  the assessment committee may any  of  the  terms  or  conditions  aforesaid,  he fails to comply  with"
                },
                {
                    "representation": "(c)",
                    "description": "the  Registrar  shall  transmit  to  the  chairman  of  the assessment committee a copy of any order entered pursuant to  the  disposal  of  the  appeal  duly  authenticated  by  the signature of the Registrar."
                },
                {
                    "representation": "(b)",
                    "description": "section 26(3)(b),"
                },
                {
                    "representation": "(6)",
                    "description": "and"
                },
                {
                    "representation": "(7)",
                    "description": "shall not apply to any appeal under this section; and"
                },
                {
                    "representation": "(5)",
                    "description": "For the purposes of the provisions of this"
                }
            ]
        }
    },
    {
        "act": "RICE FARMERS (SECURITY OF TENURE) ACT",
        "source": "https://mola.gov.gy/laws-of-guyana",
        "type": {
            "name": "section",
            "representation": "44",
            "title": "Irrigation water supplied by landlord by mechanical means to be subject to separate contract. ",
            "context": "RICE FARMERS (SECURITY OF TENURE) ACT under Irrigation water supplied by landlord by mechanical means to be subject to separate contract. 44.  (1) Service of a notice to quit under this Act by a (2) Subject to subsection (1), where notice is",
            "description": [
                {
                    "representation": "(1)",
                    "description": "Service of a notice to quit under this Act by a"
                },
                {
                    "representation": "(2)",
                    "description": "Subject to subsection"
                }
            ]
        }
    },
    {
        "act": "RICE FARMERS (SECURITY OF TENURE) ACT",
        "source": "https://mola.gov.gy/laws-of-guyana",
        "type": {
            "name": "section",
            "representation": "45",
            "title": "Agents of landlords. ",
            "context": "RICE FARMERS (SECURITY OF TENURE) ACT under Agents of landlords. 45.  As from the commencement  of this Act, in any area where a landlord is able and willing to provide a tenants  by registered post. made for the giving of such notice, such notice shall be given required by this Act to be given, and provision has not been  shall be deemed to be service on the tenant. notice served on  the chairman of the assessment committee  known place of abode, and the service of the copy of the sending the notice by registered post to the tenant at his last district in which the holding lies with a copy of the notice and serving  the  chairman  of  the  assessment committee of the whereabouts are unknown to the landlord,  be  effected  by  landlord on any of his tenants may, where the tenants  landlord shall include the agent of the landlord. section in regard to offences against this Act the expression supplied by water Irrigation                  notices. Service of                    LAWS OF GUYANA Rice Farmers (Security of Tenure)  Cap. 69:02 43  L.R.O. 1/2012 landlord by mechanical means to be subject to separate contract.    Agents of landlords.     Validity of agreements, etc.            Contracting out of Act.     Extent of damages and penalties recoverable.          rice land with water by mechanical means and the tenant desires such service, the landlord shall inform  such  tenant  in  writing  of  the  charge  and  conditions  for  this service, and if the tenant agrees with such terms and so informs the landlord  in  writing,  such  agreement  shall  notwithstanding  this  Act, constitute a valid and lawful contract.",
            "description": "As from the commencement  of this Act, in any area where a landlord is able and willing to provide a tenants  by registered post. made for the giving of such notice, such notice shall be given required by this Act to be given, and provision has not been  shall be deemed to be service on the tenant. notice served on  the chairman of the assessment committee  known place of abode, and the service of the copy of the sending the notice by registered post to the tenant at his last district in which the holding lies with a copy of the notice and serving  the  chairman  of  the  assessment committee of the whereabouts are unknown to the landlord,  be  effected  by  landlord on any of his tenants may, where the tenants  landlord shall include the agent of the landlord. section in regard to offences against this Act the expression supplied by water Irrigation                  notices. Service of                    LAWS OF GUYANA Rice Farmers (Security of Tenure)  Cap. 69:02 43  L.R.O. 1/2012 landlord by mechanical means to be subject to separate contract.    Agents of landlords.     Validity of agreements, etc.            Contracting out of Act.     Extent of damages and penalties recoverable.          rice land with water by mechanical means and the tenant desires such service, the landlord shall inform  such  tenant  in  writing  of  the  charge  and  conditions  for  this service, and if the tenant agrees with such terms and so informs the landlord  in  writing,  such  agreement  shall  notwithstanding  this  Act, constitute a valid and lawful contract."
        }
    },
    {
        "act": "RICE FARMERS (SECURITY OF TENURE) ACT",
        "source": "https://mola.gov.gy/laws-of-guyana",
        "type": {
            "name": "section",
            "representation": "46",
            "title": "Validity of agreements, etc. ",
            "context": "RICE FARMERS (SECURITY OF TENURE) ACT under Validity of agreements, etc. 46.  Anything which by or under this Act is required or authorised to be done to, by, or, in respect of the landlord of a holding may be done to, by,  or,  in respect of any agent of the landlord duly authorised in that behalf.",
            "description": "Anything which by or under this Act is required or authorised to be done to, by, or, in respect of the landlord of a holding may be done to, by,  or,  in respect of any agent of the landlord duly authorised in that behalf."
        }
    },
    {
        "act": "RICE FARMERS (SECURITY OF TENURE) ACT",
        "source": "https://mola.gov.gy/laws-of-guyana",
        "type": {
            "name": "section",
            "representation": "47",
            "title": "Contracting out of Act. ",
            "context": "RICE FARMERS (SECURITY OF TENURE) ACT under Contracting out of Act. 47.  Without prejudice to any proceedings which may be taken under any Act imposing stamp duties on the execution of instruments, it shall be no objection to any agreement, transfer or authorisation which may be made under this Act by reason only that the agreement, transfer or authorisation is not stamped or is not sufficiently stamped or, in the case of  an agreement  (other  than  an agreement containing a specified condition), that the agreement or some memorandum or note thereof is not in writing and signed by the party to be charged.",
            "description": "Without prejudice to any proceedings which may be taken under any Act imposing stamp duties on the execution of instruments, it shall be no objection to any agreement, transfer or authorisation which may be made under this Act by reason only that the agreement, transfer or authorisation is not stamped or is not sufficiently stamped or, in the case of  an agreement  (other  than  an agreement containing a specified condition), that the agreement or some memorandum or note thereof is not in writing and signed by the party to be charged."
        }
    },
    {
        "act": "RICE FARMERS (SECURITY OF TENURE) ACT",
        "source": "https://mola.gov.gy/laws-of-guyana",
        "type": {
            "name": "section",
            "representation": "48",
            "title": "Extent of damages and penalties recoverable. ",
            "context": "RICE FARMERS (SECURITY OF TENURE) ACT under Extent of damages and penalties recoverable. 48.  Any provision in any agreement between a landlord and a tenant whereby the tenant purports to contract himself out of the provisions of this Act shall be null and void.",
            "description": "Any provision in any agreement between a landlord and a tenant whereby the tenant purports to contract himself out of the provisions of this Act shall be null and void."
        }
    },
    {
        "act": "RICE FARMERS (SECURITY OF TENURE) ACT",
        "source": "https://mola.gov.gy/laws-of-guyana",
        "type": {
            "name": "section",
            "representation": "49",
            "title": "Restriction on premiums. ",
            "context": "RICE FARMERS (SECURITY OF TENURE) ACT under Restriction on premiums. 49.  Notwithstanding   any  provision  in  an  agreement   of  tenancy making either  the landlord  or the tenant  liable  to pay any liquidated damages or any penalty in the event of any breach or non-fulfilment of any of the terms or conditions in the agreement, neither party shall be entitled to recover any sum in consequence of any such breach or non- fulfilment   in  excess  of  the  damage  actually   suffered  by  him  in consequence of the breach or non-fulfilment  of any of the terms or conditions in the agreement.  LAWS OF GUYANA 44 Cap. 69:02 Rice Farmers (Security of Tenure)   L.R.O. 1/2012 Restriction on premiums. [17 of 1996]                       Procedure.  c. 7:01 [6 of 1971 17 of 1996]",
            "description": "Notwithstanding   any  provision  in  an  agreement   of  tenancy making either  the landlord  or the tenant  liable  to pay any liquidated damages or any penalty in the event of any breach or non-fulfilment of any of the terms or conditions in the agreement, neither party shall be entitled to recover any sum in consequence of any such breach or non- fulfilment   in  excess  of  the  damage  actually   suffered  by  him  in consequence of the breach or non-fulfilment  of any of the terms or conditions in the agreement.  LAWS OF GUYANA 44 Cap. 69:02 Rice Farmers (Security of Tenure)   L.R.O. 1/2012 Restriction on premiums. [17 of 1996]                       Procedure.  c. 7:01 [6 of 1971 17 of 1996]"
        }
    },
    {
        "act": "RICE FARMERS (SECURITY OF TENURE) ACT",
        "source": "https://mola.gov.gy/laws-of-guyana",
        "type": {
            "name": "section",
            "representation": "50",
            "title": "Procedure. ",
            "context": "RICE FARMERS (SECURITY OF TENURE) ACT under Procedure. 50.  (1) No  person  shall, as a condition  of  the  grant,  renewal  or continuance of a tenancy or sub-tenancy of any holding to which this Act applies, require the payment of any fine, premium, or other like sum, or the giving of any consideration, in addition to the rent.  (2) Where subsequent to the commencement of this Act any such payment or consideration has been made or given the amount or value thereof shall be recoverable by the person by whom it was made or given.  (3) A person requiring any payment or the giving of any consideration in contravention of this section shall be liable on summary conviction to a fine of ten thousand dollars and the court by which he is convicted may order the amount paid or the value of the consideration to be repaid to the person by whom it was made or given, but such order shall be in lieu of any other method of recovery prescribed by this Act.",
            "description": [
                {
                    "representation": "(1)",
                    "description": "No  person  shall, as a condition  of  the  grant,  renewal  or continuance of a tenancy or sub-tenancy of any holding to which this Act applies, require the payment of any fine, premium, or other like sum, or the giving of any consideration, in addition to the rent."
                },
                {
                    "representation": "(2)",
                    "description": "Where subsequent to the commencement of this Act any such payment or consideration has been made or given the amount or value thereof shall be recoverable by the person by whom it was made or given."
                },
                {
                    "representation": "(3)",
                    "description": "A person requiring any payment or the giving of any consideration in contravention of this section shall be liable on summary conviction to a fine of ten thousand dollars and the court by which he is convicted may order the amount paid or the value of the consideration to be repaid to the person by whom it was made or given, but such order shall be in lieu of any other method of recovery prescribed by this Act."
                }
            ]
        }
    },
    {
        "act": "RICE FARMERS (SECURITY OF TENURE) ACT",
        "source": "https://mola.gov.gy/laws-of-guyana",
        "type": {
            "name": "section",
            "representation": "51",
            "title": "Recovery of compensation and damages. ",
            "context": "RICE FARMERS (SECURITY OF TENURE) ACT under Recovery of compensation and damages. 51.  (1) Subject to section 3(3) of the Summary Jurisdiction (Petty Debt) Act, any claim or other proceedings (not being proceedings before the assessment committee as such) arising out of this Act shall be made or instituted in the magistrates court:  Provided that  (a)    where an equitable remedy is sought (whether or not in conjunction with any other remedy) such claim or other proceedings may be made or instituted in the High Court;  (b)   any sum due as rent by a tenant in respect of rice lands may only be sued for upon a certificate of a committee issued pursuant   to   an   LAWS OF GUYANA Rice Farmers (Security of Tenure)  Cap. 69:02 45  L.R.O. 1/2012                           c. 61:01     Recovery of compensation and damages.  c. 7:01           Limitation of prosecutions.  application   under  section  10(m),  such certificate being prima facie evidence of the amount due at the date of issue;  (c)  notwithstanding anything to the contrary in any law the State may institute a claim for such an amount in like manner without any such certificate.  (2) A Committee shall have full powers to rehear any application and to revise any decision in any case in which, in its opinion, altered circumstances make it just that it should exercise such powers.  (3) The law and practice of the magistrates court shall, subject to the necessary modifications, apply to any claim or other proceedings made or instituted under this Act.  (4) Anything contained in the Landlord and Tenant Act to the contrary notwithstanding, the jurisdiction of a magistrate under this Act, shall extend to all holdings irrespective of the amount of the rent.",
            "description": [
                {
                    "representation": "(1)",
                    "description": "Subject to section 3(3) of the Summary Jurisdiction"
                },
                {
                    "representation": "(a)",
                    "description": "where an equitable remedy is sought"
                },
                {
                    "representation": "(b)",
                    "description": "any sum due as rent by a tenant in respect of rice lands may only be sued for upon a certificate of a committee issued pursuant   to   an   LAWS OF GUYANA Rice Farmers"
                },
                {
                    "representation": "(c)",
                    "description": "notwithstanding anything to the contrary in any law the State may institute a claim for such an amount in like manner without any such certificate."
                },
                {
                    "representation": "(2)",
                    "description": "A Committee shall have full powers to rehear any application and to revise any decision in any case in which, in its opinion, altered circumstances make it just that it should exercise such powers."
                },
                {
                    "representation": "(3)",
                    "description": "The law and practice of the magistrates court shall, subject to the necessary modifications, apply to any claim or other proceedings made or instituted under this Act."
                },
                {
                    "representation": "(4)",
                    "description": "Anything contained in the Landlord and Tenant Act to the contrary notwithstanding, the jurisdiction of a magistrate under this Act, shall extend to all holdings irrespective of the amount of the rent."
                }
            ]
        }
    },
    {
        "act": "RICE FARMERS (SECURITY OF TENURE) ACT",
        "source": "https://mola.gov.gy/laws-of-guyana",
        "type": {
            "name": "section",
            "representation": "52",
            "title": "Limitation of prosecutions. ",
            "context": "RICE FARMERS (SECURITY OF TENURE) ACT under Limitation of prosecutions. 52.  (1) Any amount assessed, fixed, certified or ordered by a committee to be paid as compensation or damages under this Act may be recovered as a debt due under the Summary Jurisdiction (Petty Debt) Act.  (2) A certificate in which is stated the amount of compensation or damages payable under this Act issued by a committee under the hand of  the  chairman  thereof  shall,  in  any proceedings  in any court,  be conclusive  evidence  of the amount  of compensation  or damages  so payable.",
            "description": [
                {
                    "representation": "(1)",
                    "description": "Any amount assessed, fixed, certified or ordered by a committee to be paid as compensation or damages under this Act may be recovered as a debt due under the Summary Jurisdiction"
                },
                {
                    "representation": "(2)",
                    "description": "A certificate in which is stated the amount of compensation or damages payable under this Act issued by a committee under the hand of  the  chairman  thereof  shall,  in  any proceedings  in any court,  be conclusive  evidence  of the amount  of compensation  or damages  so payable."
                }
            ]
        }
    },
    {
        "act": "RICE FARMERS (SECURITY OF TENURE) ACT",
        "source": "https://mola.gov.gy/laws-of-guyana",
        "type": {
            "name": "section",
            "representation": "53",
            "title": "Protection of persons acting under this Act. ",
            "context": "RICE FARMERS (SECURITY OF TENURE) ACT under Protection of persons acting under this Act. 53.  A complaint in respect of an offence under this Act shall be made within six months from the time when the LAWS OF GUYANA 46 Cap. 69:02 Rice Farmers (Security of Tenure)   L.R.O. 1/2012   Protection of persons acting under this Act. c. 5:07  Regulations.  [12 of 1984]                        Right of tenant to keep oxen on his  holding.  [6 of 1971 17 of 1996]           matter of the complaint arose.",
            "description": "A complaint in respect of an offence under this Act shall be made within six months from the time when the LAWS OF GUYANA 46 Cap. 69:02 Rice Farmers (Security of Tenure)   L.R.O. 1/2012   Protection of persons acting under this Act. c. 5:07  Regulations.  [12 of 1984]                        Right of tenant to keep oxen on his  holding.  [6 of 1971 17 of 1996]           matter of the complaint arose."
        }
    },
    {
        "act": "RICE FARMERS (SECURITY OF TENURE) ACT",
        "source": "https://mola.gov.gy/laws-of-guyana",
        "type": {
            "name": "section",
            "representation": "54",
            "title": "Regulations. ",
            "context": "RICE FARMERS (SECURITY OF TENURE) ACT under Regulations. 54.  Every member, officer or servant of a committee acting under this Act shall be entitled to the protection of the Justices Protection Act.",
            "description": "Every member, officer or servant of a committee acting under this Act shall be entitled to the protection of the Justices Protection Act."
        }
    },
    {
        "act": "RICE FARMERS (SECURITY OF TENURE) ACT",
        "source": "https://mola.gov.gy/laws-of-guyana",
        "type": {
            "name": "section",
            "representation": "55",
            "title": "Right of tenant to keep oxen on his holding. ",
            "context": "RICE FARMERS (SECURITY OF TENURE) ACT under Right of tenant to keep oxen on his holding. 55.  The Minister may make regulations  (a)     prescribing the manner and the form in which   applications may be made to the assessment committee under this Act;  (b)     prescribing forms for the purposes of this Act;  (bb)    in consultation with the Judicial Service Commission, prescribing the qualifications for the appointment of a person, other than a magistrate, to be a chairman;  (c)  generally, for carrying out the provisions of this Act.",
            "description": [
                {
                    "representation": "(a)",
                    "description": "prescribing the manner and the form in which   applications may be made to the assessment committee under this Act;"
                },
                {
                    "representation": "(b)",
                    "description": "prescribing forms for the purposes of this Act;"
                },
                {
                    "representation": "(c)",
                    "description": "generally, for carrying out the provisions of this Act."
                }
            ]
        }
    },
    {
        "act": "RICE FARMERS (SECURITY OF TENURE) ACT",
        "source": "https://mola.gov.gy/laws-of-guyana",
        "type": {
            "name": "section",
            "representation": "56",
            "title": "General savings of rights.  FIRST SCHEDULE\u2014Rental Guidelines.  SECOND SCHEDULE\u2014Form of receipt. THIRD SCHEDULE\u2014Method of Soil Analysis and Interpretation of    Results. FOURTH  SCHEDULE\u2014Annual   register.  _________________________ LAWS OF GUYANA Rice Farmers (Security of Tenure)  Cap. 69:02 5  L.R.O. 1/2012    31 of 1956                                  CHAPTER 69:02  RICE FARMERS (SECURITY OF TENURE) ACT  An Act to provide better security of tenure for tenant rice farmers; to limit the rent payable for the letting of rice lands; and for purposes connected with the matters aforesaid.  [1st OCTOBER, 1956]  Short Title.    Interpretation. [6 of 1971 17 of 1996]                          ",
            "context": "RICE FARMERS (SECURITY OF TENURE) ACT under General savings of rights.  FIRST SCHEDULERental Guidelines.  SECOND SCHEDULEForm of receipt. THIRD SCHEDULEMethod of Soil Analysis and Interpretation of    Results. FOURTH  SCHEDULEAnnual   register.  _________________________ LAWS OF GUYANA Rice Farmers (Security of Tenure)  Cap. 69:02 5  L.R.O. 1/2012    31 of 1956                                  CHAPTER 69:02  RICE FARMERS (SECURITY OF TENURE) ACT  An Act to provide better security of tenure for tenant rice farmers; to limit the rent payable for the letting of rice lands; and for purposes connected with the matters aforesaid.  [1st OCTOBER, 1956]  Short Title.    Interpretation. [6 of 1971 17 of 1996]                          56.  (1) The landlord of any holding to which this Act applies shall permit the tenant thereof to keep free of charge and use on the holding such number of cattle (not exceeding eight heads for the first ten acres or part thereof and not more than four for each additional five acres) for that period of the year during which no crop is planted for the purpose of the cultivation of the land and the reaping and threshing of the paddy produced  thereon and, with respect to oxen so kept and used by the tenant, no order or judgment for the recovery by the landlord from the tenant of any additional rent, agistment fee or other charge shall be made or given.  (2) Any landlord who contravenes subsection (1) LAWS OF GUYANA Rice Farmers (Security of Tenure)  Cap. 69:02 47  L.R.O. 1/2012                General savings of rights.                               shall be liable on summary conviction to a fine of five thousand dollars.  (3) Any tenant who by any wilful or negligent act or omission permits any cattle kept and used on his holding in accordance with the provisions of subsection (1) to damage the property of the landlord, or retains such cattle on his holding during a period otherwise as permitted by that subsection, after having been notified in writing by the landlord to remove such cattle, shall on summary conviction be liable to a fine of three thousand dollars.",
            "description": [
                {
                    "representation": "(1)",
                    "description": "to damage the property of the landlord, or retains such cattle on his holding during a period otherwise as permitted by that subsection, after having been notified in writing by the landlord to remove such cattle, shall on summary conviction be liable to a fine of three thousand dollars."
                },
                {
                    "representation": "(2)",
                    "description": "Any landlord who contravenes subsection"
                },
                {
                    "representation": "(3)",
                    "description": "Any tenant who by any wilful or negligent act or omission permits any cattle kept and used on his holding in accordance with the provisions of subsection"
                }
            ]
        }
    }
]