[
    {
        "act": "CANE FARMERS SPECIAL FUNDS ACT",
        "source": "https://mola.gov.gy/laws-of-guyana",
        "type": {
            "name": "section",
            "representation": "1",
            "title": "Short title. ",
            "context": "CANE FARMERS SPECIAL FUNDS ACT under Short title. 1.  This Act may be cited as the Cane Farmers Special Funds Act.",
            "description": "This Act may be cited as the Cane Farmers Special Funds Act."
        }
    },
    {
        "act": "CANE FARMERS SPECIAL FUNDS ACT",
        "source": "https://mola.gov.gy/laws-of-guyana",
        "type": {
            "name": "section",
            "representation": "2",
            "title": "Interpretation. ",
            "context": "CANE FARMERS SPECIAL FUNDS ACT under Interpretation. 2.  In this Act  Committee  and  manufacturer  have  the  respective  meanings assigned to them in the National Cane Farming Committee Act;  farmer means any person engaged in the cultivation of sugar cane for sale to a manufacturer and pursuant to which sale the terms of the contract relating thereto permit, when computing the price to be paid thereunder, LAWS OF GUYANA 4 Cap. 69:09 Cane Farmers Special Funds  L.R.O. 1/2012    c. 69:03      Establishment  of the Cane Farmers Rehabilitation Fund. [17 of 1991]    Source  of  the Cane  Farmers Rehabilitation Fund. [17 of 1991]     c. 69:03              Establishment  of the Cane Farmers Price Stabilisation Fund. [17 of 1991] c. 69:03   Source of the Cane Farmers Price Stabilisation the taking into account of payments to be made by an exporter under the Sugar Industry Special Funds Act;  the Funds means the funds established under sections 3",
            "description": "In this Act  Committee  and  manufacturer  have  the  respective  meanings assigned to them in the National Cane Farming Committee Act;  farmer means any person engaged in the cultivation of sugar cane for sale to a manufacturer and pursuant to which sale the terms of the contract relating thereto permit, when computing the price to be paid thereunder, LAWS OF GUYANA 4 Cap. 69:09 Cane Farmers Special Funds  L.R.O. 1/2012    c. 69:03      Establishment  of the Cane Farmers Rehabilitation Fund. [17 of 1991]    Source  of  the Cane  Farmers Rehabilitation Fund. [17 of 1991]     c. 69:03              Establishment  of the Cane Farmers Price Stabilisation Fund. [17 of 1991] c. 69:03   Source of the Cane Farmers Price Stabilisation the taking into account of payments to be made by an exporter under the Sugar Industry Special Funds Act;  the Funds means the funds established under sections 3"
        }
    },
    {
        "act": "CANE FARMERS SPECIAL FUNDS ACT",
        "source": "https://mola.gov.gy/laws-of-guyana",
        "type": {
            "name": "section",
            "representation": "3",
            "title": "Establishment of the Cane Farmers Rehabilitation Fund. ",
            "context": "CANE FARMERS SPECIAL FUNDS ACT under Establishment of the Cane Farmers Rehabilitation Fund. 3. There is hereby established a Fund to be known as the Cane Farmers Rehabilitation Fund to which, upon the coming into operation of this Act, there shall be transferred by the Secretary to the Treasury from the Sugar Industry Rehabilitation Fund established under the Sugar Industry Special Funds Act, the sum of five hundred thousand dollars.  consist of  (a)  the sum transferred thereto pursuant to section 3;  (b)    such other sums as may from time to time, be received pursuant to the Sugar Industry Special Funds Act; and  (c)  sums accruing by way of interest on or investments of moneys of the fund deposited or invested.  4A. There is hereby established a fund to be known as the Cane Farmers Price Stabilisation Fund to which, upon the coming into operation of this Act, there shall be transferred by the Secretary to the Treasury from the Sugar Industry Price Stabilisation Fund established under the Sugar Industry Special Funds Act the sum of $382,",
            "description": [
                {
                    "representation": "(a)",
                    "description": "the sum transferred thereto pursuant to section 3;"
                },
                {
                    "representation": "(b)",
                    "description": "such other sums as may from time to time, be received pursuant to the Sugar Industry Special Funds Act; and"
                },
                {
                    "representation": "(c)",
                    "description": "sums accruing by way of interest on or investments of moneys of the fund deposited or invested.  4A. There is hereby established a fund to be known as the Cane Farmers Price Stabilisation Fund to which, upon the coming into operation of this Act, there shall be transferred by the Secretary to the Treasury from the Sugar Industry Price Stabilisation Fund established under the Sugar Industry Special Funds Act the sum of $382,"
                }
            ]
        }
    },
    {
        "act": "CANE FARMERS SPECIAL FUNDS ACT",
        "source": "https://mola.gov.gy/laws-of-guyana",
        "type": {
            "name": "section",
            "representation": "4",
            "title": "Source of the Cane Farmers Rehabilitation Fund.    4A.     Establishment of the Cane Farmers Price Stabilisation Fund.     4B. Source of the Cane Farmers Price Stabilisation Fund. ",
            "context": "CANE FARMERS SPECIAL FUNDS ACT under Source of the Cane Farmers Rehabilitation Fund.    4A.     Establishment of the Cane Farmers Price Stabilisation Fund.     4B. Source of the Cane Farmers Price Stabilisation Fund. 4. The   Cane  Farmers  Rehabilitation  Fund  shall LAWS OF GUYANA Cane Farmers Special Funds Cap. 69:09 5  L.R.O. 1/2012 Fund. [17 of 1991]          Regulations.    [17 of 1991]                                    (b)    such other sums as may from time to time, be received pursuant to the Sugar Industry Special Funds Act; and  (c)  sums accruing by way of interest on investments of monies of the fund deposited or invested.",
            "description": [
                {
                    "representation": "(b)",
                    "description": "such other sums as may from time to time, be received pursuant to the Sugar Industry Special Funds Act; and"
                },
                {
                    "representation": "(c)",
                    "description": "sums accruing by way of interest on investments of monies of the fund deposited or invested."
                }
            ]
        }
    },
    {
        "act": "CANE FARMERS SPECIAL FUNDS ACT",
        "source": "https://mola.gov.gy/laws-of-guyana",
        "type": {
            "name": "section",
            "representation": "5",
            "title": "Regulations. ",
            "context": "CANE FARMERS SPECIAL FUNDS ACT under Regulations. 5. (1) The Committee may, with the approval of the Minister, make regulations to provide for the following matters  (a)  the purposes to which the sums standing to the credit of the Funds may be applied;  (b)  the basis and the conditions on which disbursements from the Funds shall be allowed and authorised, and the procedure  which shall govern the making of such disbursements;  (c)  the keeping of proper records and the keeping and rendering of detailed accounts by the Committee in relation to the Funds;  (d) the rendering by the Comptroller of Customs to the Committee of such information as relates to the amount, destination and purchase price of sugar exported by each exporter for any specified period; (e)   the rendering by each manufacturer of  detailed information for any specified period relating to the quantity of sugar cane purchased from farmers and the quantity of LAWS OF GUYANA 6 Cap. 69:09 Cane Farmers Special Funds  L.R.O. 1/2012          Sub-leg. c. 69:04           Report. [17 of 1991]                 Exemption from income tax. [17 of 1991] c. 81:01  sugar produced therefrom; and  (f)   the rendering by each manufacturer of information as to the sums deducted  during  any specified period in accordance with rule 11(2) of the Cane Farmers Contract (General Conditions) Rules or pursuant to any terms of sale of like effect as such rule between a farmer and a manufacturer.  (2) Any regulations made under subsection (1) may provide for such qualifications, exceptions and conditions as the Committee may think fit.",
            "description": [
                {
                    "representation": "(1)",
                    "description": "may provide for such qualifications, exceptions and conditions as the Committee may think fit."
                },
                {
                    "representation": "(a)",
                    "description": "the purposes to which the sums standing to the credit of the Funds may be applied;"
                },
                {
                    "representation": "(b)",
                    "description": "the basis and the conditions on which disbursements from the Funds shall be allowed and authorised, and the procedure  which shall govern the making of such disbursements;"
                },
                {
                    "representation": "(c)",
                    "description": "the keeping of proper records and the keeping and rendering of detailed accounts by the Committee in relation to the Funds;"
                },
                {
                    "representation": "(d)",
                    "description": "the rendering by the Comptroller of Customs to the Committee of such information as relates to the amount, destination and purchase price of sugar exported by each exporter for any specified period;"
                },
                {
                    "representation": "(e)",
                    "description": "the rendering by each manufacturer of  detailed information for any specified period relating to the quantity of sugar cane purchased from farmers and the quantity of LAWS OF GUYANA 6 Cap. 69:09 Cane Farmers Special Funds  L.R.O. 1/2012          Sub-leg. c. 69:04           Report. [17 of 1991]                 Exemption from income tax. [17 of 1991] c. 81:01  sugar produced therefrom; and"
                },
                {
                    "representation": "(f)",
                    "description": "the rendering by each manufacturer of information as to the sums deducted  during  any specified period in accordance with rule 11(2) of the Cane Farmers Contract"
                },
                {
                    "representation": "(2)",
                    "description": "Any regulations made under subsection"
                }
            ]
        }
    },
    {
        "act": "CANE FARMERS SPECIAL FUNDS ACT",
        "source": "https://mola.gov.gy/laws-of-guyana",
        "type": {
            "name": "section",
            "representation": "6",
            "title": "Report. ",
            "context": "CANE FARMERS SPECIAL FUNDS ACT under Report. 6. The Committee shall not later than six months after the end of each calendar year submit to the Minister a report containing  (a) a statement of all of their transactions throughout the year in such detail as the Minister may direct;  (b)    a statement of the accounts of the Committee in respect of the Funds audited as prescribed together with such other reports as may be required by the Minister.",
            "description": [
                {
                    "representation": "(a)",
                    "description": "a statement of all of their transactions throughout the year in such detail as the Minister may direct;"
                },
                {
                    "representation": "(b)",
                    "description": "a statement of the accounts of the Committee in respect of the Funds audited as prescribed together with such other reports as may be required by the Minister."
                }
            ]
        }
    }
]