[
    {
        "act": "SLAUGHTER OF CATTLE (CONTROL) ACT",
        "source": "https://mola.gov.gy/laws-of-guyana",
        "type": {
            "name": "section",
            "representation": "1",
            "title": "Short title. ",
            "context": "SLAUGHTER OF CATTLE (CONTROL) ACT under Short title. 1.  This Act may be cited as the Slaughter of Cattle (Control) Act.",
            "description": "This Act may be cited as the Slaughter of Cattle (Control) Act."
        }
    },
    {
        "act": "SLAUGHTER OF CATTLE (CONTROL) ACT",
        "source": "https://mola.gov.gy/laws-of-guyana",
        "type": {
            "name": "section",
            "representation": "2",
            "title": "Interpretation. ",
            "context": "SLAUGHTER OF CATTLE (CONTROL) ACT under Interpretation. 2.  In this Act  cattle means any bull, ox, steer, cow, heifer or calf;  veterinary officer means the Principal Veterinary Officer and includes any veterinary officer, livestock officer or livestock assistant of the Department of Agriculture authorised in writing by the Principal Veterinary Officer to perform the functions of the Principal Veterinary Officer.  LAWS OF GUYANA 4 Cap. 71:09 Slaughter of Cattle (Control)  L.R.O. 1/2012 Prohibition.              Skin and skeleton of the head to be retained.         Powers of entry of veterinary officer and police constable.                    Seizure and detention of carcass, etc.",
            "description": "In this Act  cattle means any bull, ox, steer, cow, heifer or calf;  veterinary officer means the Principal Veterinary Officer and includes any veterinary officer, livestock officer or livestock assistant of the Department of Agriculture authorised in writing by the Principal Veterinary Officer to perform the functions of the Principal Veterinary Officer.  LAWS OF GUYANA 4 Cap. 71:09 Slaughter of Cattle (Control)  L.R.O. 1/2012 Prohibition.              Skin and skeleton of the head to be retained.         Powers of entry of veterinary officer and police constable.                    Seizure and detention of carcass, etc."
        }
    },
    {
        "act": "SLAUGHTER OF CATTLE (CONTROL) ACT",
        "source": "https://mola.gov.gy/laws-of-guyana",
        "type": {
            "name": "section",
            "representation": "3",
            "title": "Prohibition. ",
            "context": "SLAUGHTER OF CATTLE (CONTROL) ACT under Prohibition. 3. No person shall, without the permission in  writing  of  a veterinary officer, slaughter or caused to be slaughtered  (a)   any cattle with less than one permanent incisor tooth; or  (b)      any cattle of the female sex.",
            "description": [
                {
                    "representation": "(a)",
                    "description": "any cattle with less than one permanent incisor tooth; or"
                },
                {
                    "representation": "(b)",
                    "description": "any cattle of the female sex."
                }
            ]
        }
    },
    {
        "act": "SLAUGHTER OF CATTLE (CONTROL) ACT",
        "source": "https://mola.gov.gy/laws-of-guyana",
        "type": {
            "name": "section",
            "representation": "4",
            "title": "Skin and skeleton of the head to be retained. ",
            "context": "SLAUGHTER OF CATTLE (CONTROL) ACT under Skin and skeleton of the head to be retained. 4. Where a person slaughters or causes to be slaughtered any cattle he shall retain the skin and skeleton of the head (including the horns) of the cattle for forty-eight hours after it has been slaughtered and during that time he shall, if so required, produce the skin and skeleton of the head (including the horns) to a veterinary officer or a police constable.",
            "description": "Where a person slaughters or causes to be slaughtered any cattle he shall retain the skin and skeleton of the head (including the horns) of the cattle for forty-eight hours after it has been slaughtered and during that time he shall, if so required, produce the skin and skeleton of the head (including the horns) to a veterinary officer or a police constable."
        }
    },
    {
        "act": "SLAUGHTER OF CATTLE (CONTROL) ACT",
        "source": "https://mola.gov.gy/laws-of-guyana",
        "type": {
            "name": "section",
            "representation": "5",
            "title": "Powers of entry of veterinary officer and police constable. ",
            "context": "SLAUGHTER OF CATTLE (CONTROL) ACT under Powers of entry of veterinary officer and police constable. 5. (1) A veterinary officer or a police constable may, at any time, enter a place where he reasonably believes that there is a carcass or other thing in connection with which this Act applies and examine the carcass or other thing found therein and take samples thereof.  (2) A veterinary officer shall be furnished with a prescribed identification card and on entering any place pursuant to subsection (1) shall, if so required, produce the card to the owner or occupier thereof.  (3) The owner or occupier of a place entered by a veterinary officer or a police constable pursuant to subsection (1) and every person  found therein shall give the veterinary officer or a police constable all reasonable assistance in his power and furnish him with such information as he may reasonably require.",
            "description": [
                {
                    "representation": "(1)",
                    "description": "and every person  found therein shall give the veterinary officer or a police constable all reasonable assistance in his power and furnish him with such information as he may reasonably require."
                },
                {
                    "representation": "(2)",
                    "description": "A veterinary officer shall be furnished with a prescribed identification card and on entering any place pursuant to subsection"
                },
                {
                    "representation": "(3)",
                    "description": "The owner or occupier of a place entered by a veterinary officer or a police constable pursuant to subsection"
                }
            ]
        }
    },
    {
        "act": "SLAUGHTER OF CATTLE (CONTROL) ACT",
        "source": "https://mola.gov.gy/laws-of-guyana",
        "type": {
            "name": "section",
            "representation": "6",
            "title": "Seizure and detention of carcass, etc. ",
            "context": "SLAUGHTER OF CATTLE (CONTROL) ACT under Seizure and detention of carcass, etc. 6. (1) Whenever a veterinary officer or a police constable believes on reasonable grounds that this Act has been contravened he may seize the carcass and other thing in connection with which he reasonably believes the LAWS OF GUYANA Slaughter of Cattle (Control) Cap. 71:09 5  L.R.O. 1/2012               Compensation to owner.            Forfeiture.           Obstruction of veterinary officer and police constable.         Offence and contravention was committed.  (2) The carcass and other thing seized pursuant to subsection (1) shall not be detained after the expiration of fourteen days from the day of seizure, unless before that time proceedings have been instituted in respect of the contravention in which event, the carcass or other thing may be detained until the proceedings are finally determined.",
            "description": [
                {
                    "representation": "(1)",
                    "description": "shall not be detained after the expiration of fourteen days from the day of seizure, unless before that time proceedings have been instituted in respect of the contravention in which event, the carcass or other thing may be detained until the proceedings are finally determined."
                },
                {
                    "representation": "(2)",
                    "description": "The carcass and other thing seized pursuant to subsection"
                }
            ]
        }
    },
    {
        "act": "SLAUGHTER OF CATTLE (CONTROL) ACT",
        "source": "https://mola.gov.gy/laws-of-guyana",
        "type": {
            "name": "section",
            "representation": "7",
            "title": "Compensation to owner. ",
            "context": "SLAUGHTER OF CATTLE (CONTROL) ACT under Compensation to owner. 7. Where a veterinary officer or a police constable in exercise of his powers under this Act has taken a sample of anything and it appears from any examination or investigation by the veterinary officer or the police constable that there has been no contravention of this Act in respect of the sample, the owner of the sample shall be entitled to compensation from the veterinary officer or the police constable for the sample if it cannot be returned to the owner without prejudice to the owner.",
            "description": "Where a veterinary officer or a police constable in exercise of his powers under this Act has taken a sample of anything and it appears from any examination or investigation by the veterinary officer or the police constable that there has been no contravention of this Act in respect of the sample, the owner of the sample shall be entitled to compensation from the veterinary officer or the police constable for the sample if it cannot be returned to the owner without prejudice to the owner."
        }
    },
    {
        "act": "SLAUGHTER OF CATTLE (CONTROL) ACT",
        "source": "https://mola.gov.gy/laws-of-guyana",
        "type": {
            "name": "section",
            "representation": "8",
            "title": "Forfeiture. ",
            "context": "SLAUGHTER OF CATTLE (CONTROL) ACT under Forfeiture. 8.  Where a person has been convicted of an offence against this Act, the court may order that the carcass and any other thing in connection with which the offence was committed be forfeited to the State and upon such order being made the carcass and other thing may be disposed of as the Minister may direct.",
            "description": "Where a person has been convicted of an offence against this Act, the court may order that the carcass and any other thing in connection with which the offence was committed be forfeited to the State and upon such order being made the carcass and other thing may be disposed of as the Minister may direct."
        }
    },
    {
        "act": "SLAUGHTER OF CATTLE (CONTROL) ACT",
        "source": "https://mola.gov.gy/laws-of-guyana",
        "type": {
            "name": "section",
            "representation": "9",
            "title": "Obstruction of veterinary officer and police constable. ",
            "context": "SLAUGHTER OF CATTLE (CONTROL) ACT under Obstruction of veterinary officer and police constable. 9. (1) No person shall obstruct a veterinary officer or a police constable in the exercise of his functions under this Act.  (2) No person shall make any false or misleading statement either verbally or in writing to a veterinary officer or a police constable engaged in the exercise of his functions under this Act.",
            "description": [
                {
                    "representation": "(1)",
                    "description": "No person shall obstruct a veterinary officer or a police constable in the exercise of his functions under this Act."
                },
                {
                    "representation": "(2)",
                    "description": "No person shall make any false or misleading statement either verbally or in writing to a veterinary officer or a police constable engaged in the exercise of his functions under this Act."
                }
            ]
        }
    }
]