[
    {
        "act": "GUYANA RICE DEVELOPMENT BOARD ACT",
        "source": "https://mola.gov.gy/laws-of-guyana",
        "type": {
            "name": "section",
            "representation": "1",
            "title": "Short title. ",
            "context": "GUYANA RICE DEVELOPMENT BOARD ACT under Short title. 1.   This   Act   may   be   cited   as   the   Guyana  Rice Development Board Act.",
            "description": "This   Act   may   be   cited   as   the   Guyana  Rice Development Board Act."
        }
    },
    {
        "act": "GUYANA RICE DEVELOPMENT BOARD ACT",
        "source": "https://mola.gov.gy/laws-of-guyana",
        "type": {
            "name": "section",
            "representation": "2",
            "title": "Interpretation  PART I PRELIMINARY PART II ESTABLISHMENT, MANAGEMENT, POWERS AND FUNCTIONS OF THE BOARD  ",
            "context": "GUYANA RICE DEVELOPMENT BOARD ACT under Interpretation  PART I PRELIMINARY PART II ESTABLISHMENT, MANAGEMENT, POWERS AND FUNCTIONS OF THE BOARD  2.  In this Act  accounting  year,  in  relation  to  the  Board,  means  the accounting year referred to in section 30;  appointed   day   means   the   date   on   which   this   Act comes into operation;  Authority means the Guyana Rice Milling and Marketing Authority established by section 8 of the Rice (Regulation of Manufacturing and Marketing) Act 1985;  Board means the Guyana Rice Development Board established by section 3;  Centre   means   the   National   Padi   and   Rice   Grading Centre established by section 3 of the Rice (Regulation of Manufacturing and Marketing) Act 1985;L.R.O. 1/2012  LAWS OF GUYANA  Guyana Rice Development Board              Cap. 72:01                7    Export   Board   means   the   Guyana   Rice   Export   Board established by section  14  of  the  Rice  (Regulation  of Manufacturing and Marketing) Act 1985;  licensed grader means a person who is issued a licence by the Board under section 35 (2) to grade padi or rice or both;  manufacturer  means  any  person  who  operates  a  rice factory;  region means any of the regions into which Guyana has been divided under the Local Democratic Organs Act;  regional grading and export office means a regional padi and rice grading and export office established under section 14(2);  rice factory means any premises in which padi is manufactured into rice   by   mechanical power, and includes any place,  building, machinery or  equipment used in connection with or in relation to such premises for the storage of padi or rice or the manufacture of rice;  rice land, for  the  purpose of  paragraph (m), means any land, which is let or agreed to be let, the subject of an agreement of  tenancy, which is used either wholly or mainly for the cultivation of padi, such land being at the time of letting fit for the cultivation of padi according to normal agricultural standards;  rice producer means  (a)        any rice farmer who cultivates his own land or any rice land let or leased to him which is otherwise lawfully occupied by him;  (b)     any manufacturer;L.R.O. 1/2012  LAWS OF GUYANA  8              Cap. 72:01            Guyana Rice Development Board     c. 82:01        Establishment of Guyana Rice Development Board. ship, aircraft and export having same meaning as in the Customs Act.  PART II ESTABLISHMENT, MANAGEMENT, POWERS  AND FUNCTION OF THE BOARD",
            "description": [
                {
                    "representation": "(2)",
                    "description": "to grade padi or rice or both;  manufacturer  means  any  person  who  operates  a  rice factory;  region means any of the regions into which Guyana has been divided under the Local Democratic Organs Act;  regional grading and export office means a regional padi and rice grading and export office established under section 14(2);  rice factory means any premises in which padi is manufactured into rice   by   mechanical power, and includes any place,  building, machinery or  equipment used in connection with or in relation to such premises for the storage of padi or rice or the manufacture of rice;  rice land, for  the  purpose of  paragraph"
                },
                {
                    "representation": "(a)",
                    "description": "any rice farmer who cultivates his own land or any rice land let or leased to him which is otherwise lawfully occupied by him;"
                },
                {
                    "representation": "(b)",
                    "description": "any manufacturer;L.R.O. 1/2012  LAWS OF GUYANA  8              Cap. 72:01            Guyana Rice Development Board     c. 82:01        Establishment of Guyana Rice Development Board. ship, aircraft and export having same meaning as in the Customs Act.  PART II ESTABLISHMENT, MANAGEMENT, POWERS  AND FUNCTION OF THE BOARD"
                }
            ]
        }
    },
    {
        "act": "GUYANA RICE DEVELOPMENT BOARD ACT",
        "source": "https://mola.gov.gy/laws-of-guyana",
        "type": {
            "name": "section",
            "representation": "3",
            "title": "Establishment of Guyana Rice Development Board. ",
            "context": "GUYANA RICE DEVELOPMENT BOARD ACT under Establishment of Guyana Rice Development Board. 3. (1) There is hereby established a body corporate to be known as the Guyana Rice Development Board.  (2) The Board shall consist of the following members  (a)     the general manager of the Board;  (b)      such number of members as may be appointed by the Minister    from among   persons   appearing   to   him to be   qualified   as   having   had experience of, and shown capacity in, matters relating to export trade, particularly relating to export  of rice and other products of padi, the production, manufacture,  grading or marketing of rice, cultivation of padi, rice research activities, administration or commerce.  (3) The  Minister  shall  appoint  a  member  of  the Board   as chairman and the Board shall appoint one of its members (other than the chairman) as deputy chairman.  (4) The total number of the members of the Board shall not exceed thirteen:  Provided that   there   shall   be   three   members representing   the  Guyana Rice  Producers Association, two members representing the Guyana Rice Millers and ExportersL.R.O. 1/2012  LAWS OF GUYANA  Guyana Rice Development Board              Cap. 72:01                9    Development  Association  and   one   member   representing consumers.  (5)The remuneration or allowance payable to the chairman and each of the other members of the Board and the other terms and conditions of their appointment shall be such as may be determined by the Minister.  (6) Every change in the membership of the Board shall be published in the Gazette. Functions of Board.",
            "description": [
                {
                    "representation": "(1)",
                    "description": "There is hereby established a body corporate to be known as the Guyana Rice Development Board."
                },
                {
                    "representation": "(2)",
                    "description": "The Board shall consist of the following members"
                },
                {
                    "representation": "(a)",
                    "description": "the general manager of the Board;"
                },
                {
                    "representation": "(b)",
                    "description": "such number of members as may be appointed by the Minister    from among   persons   appearing   to   him to be   qualified   as   having   had experience of, and shown capacity in, matters relating to export trade, particularly relating to export  of rice and other products of padi, the production, manufacture,  grading or marketing of rice, cultivation of padi, rice research activities, administration or commerce."
                },
                {
                    "representation": "(3)",
                    "description": "The  Minister  shall  appoint  a  member  of  the Board   as chairman and the Board shall appoint one of its members"
                },
                {
                    "representation": "(4)",
                    "description": "The total number of the members of the Board shall not exceed thirteen:  Provided that   there   shall   be   three   members representing   the  Guyana Rice  Producers Association, two members representing the Guyana Rice Millers and ExportersL.R.O. 1/2012  LAWS OF GUYANA  Guyana Rice Development Board              Cap. 72:01                9    Development  Association  and   one   member   representing consumers."
                },
                {
                    "representation": "(6)",
                    "description": "Every change in the membership of the Board shall be published in the Gazette. Functions of Board."
                }
            ]
        }
    },
    {
        "act": "GUYANA RICE DEVELOPMENT BOARD ACT",
        "source": "https://mola.gov.gy/laws-of-guyana",
        "type": {
            "name": "section",
            "representation": "4",
            "title": "Functions of Board. ",
            "context": "GUYANA RICE DEVELOPMENT BOARD ACT under Functions of Board. 4. (1) The functions of the Board shall be  (a)      to   develop   the   rice   industry   in Guyana and to promote the expansion of   the   export   trade   in   the   said industry;  (b)      to establish facilities for the conduct of research, and to    conduct   research, relating to rice   and extend   to rice farmers  through  an  established system the benefits derived from such research;  (c)     to engage in such promotional and developmental activities which the Board  deems  necessary  for  the purpose of developing    the rice industry.  (2)  Without prejudice to  the  generality of subsection (1), the functions of the Board in relation to padi and rice grading, shall be  (a)      to grade and certify the grades of all padi received into,  or proposed to  be delivered,     to  a  rice     factory  forL.R.O. 1/2012  LAWS OF GUYANA  10            Cap. 72:01            Guyana Rice Development Board    milling;  (b)      to grade and certify the grades of all rice intended for sale in Guyana;  (c)      to grade and certify the grades of all padi and rice intended for export;  (d)      to collect and make available to  the rice industry relevant data relating to grading and quality of padi and rice;  (e)      to train persons to grade padi or rice or both and to certify and license persons who are in the opinion of the Board qualified to grade padi or rice or both;  (f)       to exercise and perform in relation to rice factories the functions, under the Rice Factories Act, of the Centre as defined in that Act;  (g)   to  determine  suitable  types  of packaging for sale in Guyana, and for exportation, of rice and padi;  (h)      to lay  down  and  maintain  technical standards, consistent with international classifications, for grading padi and rice.  (3) The Board may determine different classifications of grades in respect of rice to  be purchased from a manufacturer, to be sold for consumption in Guyana and to be exported out of Guyana.  (4) The grades of padi and rice determined by theL.R.O. 1/2012  LAWS OF GUYANA  Guyana Rice Development Board              Cap. 72:01              11     Board, and the standards laid down by the Board for fixing the grades, shall be notified in the Gazette, and in at least one newspaper having circulation in Guyana, and in such other manner, if any, as may be prescribed by the Minister by regulations.  (5)  Without prejudice to  the  generality of subsection (1), the functions of the Board in relation to the export of padi and rice, shall be  (a)      to  promote  the  expansion of  export trade in padi, rice and       other products    of    padi,    and    products of   rice, manufactured or produced in Guyana;  (b)      subject to the provisions of this Act, to facilitate the export of padi and rice and other products of padi produced or manufactured in Guyana;  (c)        to establish mechanisms and systems to assist rice producers to export and for that purpose provide assistance in negotiating  and  entering  into contracts  with  foreign governments, agencies or persons for the export of padi or rice or other products of rice;  (d) to   license   manufacturers   or   other persons to export padi  or rice or any other product of padi; (e)      to   examine   and   certify   as   to   the quantity  or  quality  or  both  of  padi and rice proposed to be exported by exporters,  and  to  advise  such exporters on their suitability for export;L.R.O. 1/2012  LAWS OF GUYANA  12            Cap. 72:01            Guyana Rice Development Board     (f)       to  engage    in    marketing    research and     analysis  pertaining  to  export potential for rice and other products of  padi,  padi  and  products  of  rice, with a view to collecting information adequate  for   strategic  planning  of their production and export;  (g)   to   monitor   and   guide   the development of the rice industry having   regard   to   changes   in   the export markets for rice and other products of padi, padi and products of rice;  (h)      to advise the Government and the rice industry as regards marketing prospects for  the  export of  rice and other products of padi, padi and products of rice;  (i)       to  engage  in  such  activities  which appear to the Board to be necessary for the purpose of increasing the export of rice and other products of padi, and products of rice. Custody of seal, etc.",
            "description": [
                {
                    "representation": "(1)",
                    "description": "The functions of the Board shall be"
                },
                {
                    "representation": "(a)",
                    "description": "to  promote  the  expansion of  export trade in padi, rice and       other products    of    padi,    and    products of   rice, manufactured or produced in Guyana;"
                },
                {
                    "representation": "(b)",
                    "description": "subject to the provisions of this Act, to facilitate the export of padi and rice and other products of padi produced or manufactured in Guyana;"
                },
                {
                    "representation": "(c)",
                    "description": "to establish mechanisms and systems to assist rice producers to export and for that purpose provide assistance in negotiating  and  entering  into contracts  with  foreign governments, agencies or persons for the export of padi or rice or other products of rice;"
                },
                {
                    "representation": "(2)",
                    "description": "Without prejudice to  the  generality of subsection"
                },
                {
                    "representation": "(d)",
                    "description": "to   license   manufacturers   or   other persons to export padi  or rice or any other product of padi;"
                },
                {
                    "representation": "(e)",
                    "description": "to   examine   and   certify   as   to   the quantity  or  quality  or  both  of  padi and rice proposed to be exported by exporters,  and  to  advise  such exporters on their suitability for export;L.R.O. 1/2012  LAWS OF GUYANA  12            Cap. 72:01            Guyana Rice Development Board"
                },
                {
                    "representation": "(f)",
                    "description": "to  engage    in    marketing    research and     analysis  pertaining  to  export potential for rice and other products of  padi,  padi  and  products  of  rice, with a view to collecting information adequate  for   strategic  planning  of their production and export;"
                },
                {
                    "representation": "(g)",
                    "description": "to   monitor   and   guide   the development of the rice industry having   regard   to   changes   in   the export markets for rice and other products of padi, padi and products of rice;"
                },
                {
                    "representation": "(h)",
                    "description": "to advise the Government and the rice industry as regards marketing prospects for  the  export of  rice and other products of padi, padi and products of rice;"
                },
                {
                    "representation": "(3)",
                    "description": "The Board may determine different classifications of grades in respect of rice to  be purchased from a manufacturer, to be sold for consumption in Guyana and to be exported out of Guyana."
                },
                {
                    "representation": "(4)",
                    "description": "The grades of padi and rice determined by theL.R.O. 1/2012  LAWS OF GUYANA  Guyana Rice Development Board              Cap. 72:01              11     Board, and the standards laid down by the Board for fixing the grades, shall be notified in the Gazette, and in at least one newspaper having circulation in Guyana, and in such other manner, if any, as may be prescribed by the Minister by regulations."
                },
                {
                    "representation": "(5)",
                    "description": "Without prejudice to  the  generality of subsection"
                },
                {
                    "representation": "(i)",
                    "description": "to  engage  in  such  activities  which appear to the Board to be necessary for the purpose of increasing the export of rice and other products of padi, and products of rice. Custody of seal, etc."
                }
            ]
        }
    },
    {
        "act": "GUYANA RICE DEVELOPMENT BOARD ACT",
        "source": "https://mola.gov.gy/laws-of-guyana",
        "type": {
            "name": "section",
            "representation": "5",
            "title": "Custody of seal, etc. ",
            "context": "GUYANA RICE DEVELOPMENT BOARD ACT under Custody of seal, etc. 5. (1) The seal of the Board shall be kept in the custody of the chairman or the deputy chairman or the secretary thereof and shall  be  authenticated by  the  signature of  the chairman, or the deputy chairman, and the secretary of the Board.  (2)  Every  document  purporting  to  be  an instrument duly executed under the seal of the Board shall be received in evidence and deemed, without further proof to be so executed unless the contrary is proved.L.R.O. 1/2012  LAWS OF GUYANA  Guyana Rice Development Board              Cap. 72:01              13      (3) All documents, other than those required by law to be under seal, made by, and all decisions of the Board may  be  signified  under  the  hand  of  the  chairman  or  the deputy chairman or the secretary of the Board. Members of Board not to participate in certain decisions      Co-option of persons at meetings of Board.      Power to appoin committees.                   Power to delegate.",
            "description": [
                {
                    "representation": "(1)",
                    "description": "The seal of the Board shall be kept in the custody of the chairman or the deputy chairman or the secretary thereof and shall  be  authenticated by  the  signature of  the chairman, or the deputy chairman, and the secretary of the Board."
                },
                {
                    "representation": "(2)",
                    "description": "Every  document  purporting  to  be  an instrument duly executed under the seal of the Board shall be received in evidence and deemed, without further proof to be so executed unless the contrary is proved.L.R.O. 1/2012  LAWS OF GUYANA  Guyana Rice Development Board              Cap. 72:01              13"
                },
                {
                    "representation": "(3)",
                    "description": "All documents, other than those required by law to be under seal, made by, and all decisions of the Board may  be  signified  under  the  hand  of  the  chairman  or  the deputy chairman or the secretary of the Board. Members of Board not to participate in certain decisions      Co-option of persons at meetings of Board.      Power to appoin committees.                   Power to delegate."
                }
            ]
        }
    },
    {
        "act": "GUYANA RICE DEVELOPMENT BOARD ACT",
        "source": "https://mola.gov.gy/laws-of-guyana",
        "type": {
            "name": "section",
            "representation": "6",
            "title": "Members of Board not to participate in certain decisions. ",
            "context": "GUYANA RICE DEVELOPMENT BOARD ACT under Members of Board not to participate in certain decisions. 6.   A member of the Board shall not take part in or vote on, the decision of any matter with respect to any transaction between the Board and himself or any person in whose business he is pecuniarily interested, whether directly or indirectly, or where as a result of the decision of the matter he is likely to gain any profit or suffer any loss.",
            "description": "A member of the Board shall not take part in or vote on, the decision of any matter with respect to any transaction between the Board and himself or any person in whose business he is pecuniarily interested, whether directly or indirectly, or where as a result of the decision of the matter he is likely to gain any profit or suffer any loss."
        }
    },
    {
        "act": "GUYANA RICE DEVELOPMENT BOARD ACT",
        "source": "https://mola.gov.gy/laws-of-guyana",
        "type": {
            "name": "section",
            "representation": "7",
            "title": "Co-option of persons at meetings of Board. ",
            "context": "GUYANA RICE DEVELOPMENT BOARD ACT under Co-option of persons at meetings of Board. 7.  The Board may co-opt one or more persons having special knowledge with respect to any matter relevant to its functions to attend any of its meetings at which it is dealing with the  particular matter, for  the  purpose of  assisting or advising it, but no such co-opted person shall have any right to vote at meetings.",
            "description": "The Board may co-opt one or more persons having special knowledge with respect to any matter relevant to its functions to attend any of its meetings at which it is dealing with the  particular matter, for  the  purpose of  assisting or advising it, but no such co-opted person shall have any right to vote at meetings."
        }
    },
    {
        "act": "GUYANA RICE DEVELOPMENT BOARD ACT",
        "source": "https://mola.gov.gy/laws-of-guyana",
        "type": {
            "name": "section",
            "representation": "8",
            "title": "Power to appoint committees. ",
            "context": "GUYANA RICE DEVELOPMENT BOARD ACT under Power to appoint committees. 8.  (1) The Board may appoint such committees, as it thinks fit.  (2)  A  committee appointed by  the  Board  under subsection (1) may consist only of the members of the Board, or may consist of such members and other persons.  (3)  Subject to  the  provisions of  this  section, the constitution, functions and procedure of a committee appointed under subsection (1) by the Board shall be determined by the Board.  (4) The provisions of this section shall be without prejudice to the other provisions of this Act.",
            "description": [
                {
                    "representation": "(1)",
                    "description": "by the Board shall be determined by the Board."
                },
                {
                    "representation": "(2)",
                    "description": "A  committee appointed by  the  Board  under subsection"
                },
                {
                    "representation": "(3)",
                    "description": "Subject to  the  provisions of  this  section, the constitution, functions and procedure of a committee appointed under subsection"
                },
                {
                    "representation": "(4)",
                    "description": "The provisions of this section shall be without prejudice to the other provisions of this Act."
                }
            ]
        }
    },
    {
        "act": "GUYANA RICE DEVELOPMENT BOARD ACT",
        "source": "https://mola.gov.gy/laws-of-guyana",
        "type": {
            "name": "section",
            "representation": "9",
            "title": "Power to delegate. ",
            "context": "GUYANA RICE DEVELOPMENT BOARD ACT under Power to delegate. 9.   Without prejudice to the other provisions of this Act, the Board may delegate to any of its members or to any committee constituted by it under section 8 (1) the power andL.R.O. 1/2012  LAWS OF GUYANA  14            Cap. 72:01            Guyana Rice Development Board    authority to carry out on its behalf such of its functions as it may determine. Regulation of procedure and business of Board.           Receipt of minutes in evidence.          Protection of members of Board or any committee thereof.",
            "description": [
                {
                    "representation": "(1)",
                    "description": "the power andL.R.O. 1/2012  LAWS OF GUYANA  14            Cap. 72:01            Guyana Rice Development Board    authority to carry out on its behalf such of its functions as it may determine. Regulation of procedure and business of Board.           Receipt of minutes in evidence.          Protection of members of Board or any committee thereof."
                }
            ]
        }
    },
    {
        "act": "GUYANA RICE DEVELOPMENT BOARD ACT",
        "source": "https://mola.gov.gy/laws-of-guyana",
        "type": {
            "name": "section",
            "representation": "10",
            "title": "Regulation of procedure and business of Board. ",
            "context": "GUYANA RICE DEVELOPMENT BOARD ACT under Regulation of procedure and business of Board. 10.  (1)  Subject  to  the  provisions  of  this  Act,  the Minister may make regulations to regulate the procedure and business of  the  Board, including the intervals at which the meetings of the Board shall be held and the quorum for its meetings.  (2) Subject to the provisions of this Act and regulations made by  the  Minister,  the  Board  may  regulate its own procedure and business and may make rules for that purpose.",
            "description": [
                {
                    "representation": "(1)",
                    "description": "Subject  to  the  provisions  of  this  Act,  the Minister may make regulations to regulate the procedure and business of  the  Board, including the intervals at which the meetings of the Board shall be held and the quorum for its meetings."
                },
                {
                    "representation": "(2)",
                    "description": "Subject to the provisions of this Act and regulations made by  the  Minister,  the  Board  may  regulate its own procedure and business and may make rules for that purpose."
                }
            ]
        }
    },
    {
        "act": "GUYANA RICE DEVELOPMENT BOARD ACT",
        "source": "https://mola.gov.gy/laws-of-guyana",
        "type": {
            "name": "section",
            "representation": "11",
            "title": "Receipt of minutes in evidence. ",
            "context": "GUYANA RICE DEVELOPMENT BOARD ACT under Receipt of minutes in evidence. 11. Any minutes made of a meeting of the Board shall, if duly signed  by  the  chairman  thereof  or  other  person presiding  at   the meeting,  without  further  proof  of  any other matter or thing, be receivable in all legal proceedings as prima facie evidence of the proceedings of the Board, of which the minutes have been made and of the meeting of the Board, in respect of the proceedings of which the minutes have been so made, having been duly convened and held.",
            "description": "Any minutes made of a meeting of the Board shall, if duly signed  by  the  chairman  thereof  or  other  person presiding  at   the meeting,  without  further  proof  of  any other matter or thing, be receivable in all legal proceedings as prima facie evidence of the proceedings of the Board, of which the minutes have been made and of the meeting of the Board, in respect of the proceedings of which the minutes have been so made, having been duly convened and held."
        }
    },
    {
        "act": "GUYANA RICE DEVELOPMENT BOARD ACT",
        "source": "https://mola.gov.gy/laws-of-guyana",
        "type": {
            "name": "section",
            "representation": "12",
            "title": "Protection of members of Board or any committee thereof. ",
            "context": "GUYANA RICE DEVELOPMENT BOARD ACT under Protection of members of Board or any committee thereof. 12. (1) Subject to subsection (2), no action, suit, prosecution   or   other   proceedings   shall   be   brought   or instituted personally against a member of the Board or any committee constituted by or under this Act in respect of any act done bona fide in pursuance of the execution or intended execution of his duties under this Act.  (2)   Where   a   member   of   the   Board   or   any committee  referred  to  in  subsection  (1)  is  exempt  from liability by reason only of subsection (1), the Board or the committee, as the case may be, shall be liable to the extent that it would be if such member was a servant or agent of the Board, or the committee, so, however, that if in any case the Board or the   committee,   is   not   liable   for   any   above- mentioned   act,    then  subsection   (1)  does not  operate toL.R.O. 1/2012  LAWS OF GUYANA  Guyana Rice Development Board              Cap. 72:01              15     exempt such member as therein stated. Minister entitled to attend meetings of the Board.             Headquarters and regional offices of Board.       Management and functions of regional grading and export office.",
            "description": [
                {
                    "representation": "(1)",
                    "description": "does not  operate toL.R.O. 1/2012  LAWS OF GUYANA  Guyana Rice Development Board              Cap. 72:01              15     exempt such member as therein stated. Minister entitled to attend meetings of the Board.             Headquarters and regional offices of Board.       Management and functions of regional grading and export office."
                },
                {
                    "representation": "(2)",
                    "description": "Where   a   member   of   the   Board   or   any committee  referred  to  in  subsection"
                }
            ]
        }
    },
    {
        "act": "GUYANA RICE DEVELOPMENT BOARD ACT",
        "source": "https://mola.gov.gy/laws-of-guyana",
        "type": {
            "name": "section",
            "representation": "13",
            "title": "Minister entitled to attend meetings of the Board. ",
            "context": "GUYANA RICE DEVELOPMENT BOARD ACT under Minister entitled to attend meetings of the Board. 13.  (1)  The  Minister    shall    be  entitled    to  receive notices of all meetings of the Board and to  attend thereat without the right to vote and he shall be entitled to be furnished by the secretary of the Board or such other person authorised in that behalf by the Board, with copies of the proceedings  of  the  meetings  of  the  Board  showing  the matters discussed, and the conclusions reached, by the Board thereat.  (2) Where the Minister attends a meeting of the Board he may preside at the meeting.",
            "description": [
                {
                    "representation": "(1)",
                    "description": "The  Minister    shall    be  entitled    to  receive notices of all meetings of the Board and to  attend thereat without the right to vote and he shall be entitled to be furnished by the secretary of the Board or such other person authorised in that behalf by the Board, with copies of the proceedings  of  the  meetings  of  the  Board  showing  the matters discussed, and the conclusions reached, by the Board thereat."
                },
                {
                    "representation": "(2)",
                    "description": "Where the Minister attends a meeting of the Board he may preside at the meeting."
                }
            ]
        }
    },
    {
        "act": "GUYANA RICE DEVELOPMENT BOARD ACT",
        "source": "https://mola.gov.gy/laws-of-guyana",
        "type": {
            "name": "section",
            "representation": "14",
            "title": "Headquarters and regional offices of Board. ",
            "context": "GUYANA RICE DEVELOPMENT BOARD ACT under Headquarters and regional offices of Board. 14.  (1) The headquarters of the Board shall be in such place in Guyana as may be determined by the Minister.  (2) The Board may, with the approval of the Minister, establish for any region a regional grading and export office.",
            "description": [
                {
                    "representation": "(1)",
                    "description": "The headquarters of the Board shall be in such place in Guyana as may be determined by the Minister."
                },
                {
                    "representation": "(2)",
                    "description": "The Board may, with the approval of the Minister, establish for any region a regional grading and export office."
                }
            ]
        }
    },
    {
        "act": "GUYANA RICE DEVELOPMENT BOARD ACT",
        "source": "https://mola.gov.gy/laws-of-guyana",
        "type": {
            "name": "section",
            "representation": "15",
            "title": "Management and functions of regional grading and export office. ",
            "context": "GUYANA RICE DEVELOPMENT BOARD ACT under Management and functions of regional grading and export office. 15. (1) The affairs and business of a regional grading and export office  may  be  managed  by  the  Board  through its    officers    or    a  committee    appointed  by  the  Board consisting of such number of members, not exceeding six, as it  thinks fit  from  among  persons who  are  qualified to  be appointed as members of the Board.  (2) A member of the Board may be appointed as a member of a committee appointed under subsection (1).  (3) Every change in the membership of any committee appointed under subsection (1) shall be published in the Gazette.  (4) The remuneration or allowance payable to the chairman and each of the other members of a committee appointed  under  subsection  (1)  and  the  other  terms  andL.R.O. 1/2012  LAWS OF GUYANA  16            Cap. 72:01            Guyana Rice Development Board    conditions  of  their  appointment  shall  be  such  as  may  be determined by the Board with the approval of the Minister.  (5)   Subject   to   any   regulations   made   by   the Minister, the Board may make rules to regulate the procedure and business of a committee appointed under subsection (1), including the intervals at which its meetings shall be held and the quorum for its meetings, and subject to such rules, the committee may regulate its own procedure and business and may make rules for that purpose.  (6) A regional grading and export office shall, within the region in which it is established and subject to the supervision and control of the Board, manage such business of the Board and may, in the name and on behalf of the Board, exercise and perform such functions of the Board under this Act as may be delegated to it in writing by the Board. Information obtained as member or officer of Board to be secret and confidential.",
            "description": [
                {
                    "representation": "(1)",
                    "description": "and  the  other  terms  andL.R.O. 1/2012  LAWS OF GUYANA  16            Cap. 72:01            Guyana Rice Development Board    conditions  of  their  appointment  shall  be  such  as  may  be determined by the Board with the approval of the Minister."
                },
                {
                    "representation": "(2)",
                    "description": "A member of the Board may be appointed as a member of a committee appointed under subsection"
                },
                {
                    "representation": "(3)",
                    "description": "Every change in the membership of any committee appointed under subsection"
                },
                {
                    "representation": "(4)",
                    "description": "The remuneration or allowance payable to the chairman and each of the other members of a committee appointed  under  subsection"
                },
                {
                    "representation": "(5)",
                    "description": "Subject   to   any   regulations   made   by   the Minister, the Board may make rules to regulate the procedure and business of a committee appointed under subsection"
                },
                {
                    "representation": "(6)",
                    "description": "A regional grading and export office shall, within the region in which it is established and subject to the supervision and control of the Board, manage such business of the Board and may, in the name and on behalf of the Board, exercise and perform such functions of the Board under this Act as may be delegated to it in writing by the Board. Information obtained as member or officer of Board to be secret and confidential."
                }
            ]
        }
    },
    {
        "act": "GUYANA RICE DEVELOPMENT BOARD ACT",
        "source": "https://mola.gov.gy/laws-of-guyana",
        "type": {
            "name": "section",
            "representation": "16",
            "title": "Information obtained as member or officer of Board, to be secret and confidential.  PART III OFFICERS AND EMPLOYEES  ",
            "context": "GUYANA RICE DEVELOPMENT BOARD ACT under Information obtained as member or officer of Board, to be secret and confidential.  PART III OFFICERS AND EMPLOYEES  16.    (1)  Every  member  of  the  Board,  a  committee appointed under  section  15  (1)  to  manage  the  affairs  and business of  a  regional  grading  and    export  office,  or  any committee of the Board and the general manager  and other officers and employees   of the Board and the officers and other employees of any committee of the Board, including a committee appointed under section 15 (1)  (a)      shall regard and deal with as secret and confidential all information, documents and   matters    which,   or knowledge   of which he may obtain as such member or general manager or other officer or employee; and  (b)      shall not make use of any document, matter or information which, or knowledge of which, he may obtain as such member or general manager or other officer or employee, for theL.R.O. 1/2012  LAWS OF GUYANA  Guyana Rice Development Board              Cap. 72:01              17     benefit of himself or any other person, or otherwise than for the purposes of his duties as such member or general manager or other officer or employee, and shall make and subscribe before a commissioner of oaths or a justice of the  peace  a  statutory  declaration to that effect.  (2) No fee or stamp duty shall be payable or chargeable in respect of any declaration made under subsection (1).  PART III OFFICERS AND EMPLOYEES Appointment of general manager and other officers and other employees of Board.",
            "description": [
                {
                    "representation": "(1)",
                    "description": "to  manage  the  affairs  and business of  a  regional  grading  and    export  office,  or  any committee of the Board and the general manager  and other officers and employees   of the Board and the officers and other employees of any committee of the Board, including a committee appointed under section 15"
                },
                {
                    "representation": "(a)",
                    "description": "shall regard and deal with as secret and confidential all information, documents and   matters    which,   or knowledge   of which he may obtain as such member or general manager or other officer or employee; and"
                },
                {
                    "representation": "(b)",
                    "description": "shall not make use of any document, matter or information which, or knowledge of which, he may obtain as such member or general manager or other officer or employee, for theL.R.O. 1/2012  LAWS OF GUYANA  Guyana Rice Development Board              Cap. 72:01              17     benefit of himself or any other person, or otherwise than for the purposes of his duties as such member or general manager or other officer or employee, and shall make and subscribe before a commissioner of oaths or a justice of the  peace  a  statutory  declaration to that effect."
                },
                {
                    "representation": "(2)",
                    "description": "No fee or stamp duty shall be payable or chargeable in respect of any declaration made under subsection"
                }
            ]
        }
    },
    {
        "act": "GUYANA RICE DEVELOPMENT BOARD ACT",
        "source": "https://mola.gov.gy/laws-of-guyana",
        "type": {
            "name": "section",
            "representation": "17",
            "title": "Appointment of general manager and other officers and other employees of Board.L.R.O. 1/2012  LAWS OF GUYANA  4              Cap. 72:01            Guyana Rice Development Board   SECTION ",
            "context": "GUYANA RICE DEVELOPMENT BOARD ACT under Appointment of general manager and other officers and other employees of Board.L.R.O. 1/2012  LAWS OF GUYANA  4              Cap. 72:01            Guyana Rice Development Board   SECTION 17. (1) The Board shall have a general manager.  (2) The power to appoint the general manager and the power to remove,  and  to  exercise  disciplinary  control over, any person so appointed shall be vested in the Board subject to the approval of the Minister.  (3) Subject to the other provisions of this Act, the Board may employ a secretary, and such other officers and employees as the Board may require for the purpose of carrying out its functions under this Act, and the power to remove and to exercise disciplinary control over any person so employed shall be vested in the Board.  (4) Subject to the other provisions of this Act, the remuneration and other terms and conditions of appointment (including the payment of pension, gratuity or other like benefits by reference to their service) of the general manager, the secretary and other officers and employees employed by the Board shall be such as may be determined by the Board.  (5) The officers and other employees required by aL.R.O. 1/2012  LAWS OF GUYANA  18            Cap. 72:01            Guyana Rice Development Board    regional grading and export office shall be provided by the Board   from   among   the   officers   and   other   employees employed by it. Application of certain provisions of section 17 to employment under section 58(6)      Services of professional persons.    Superannuation benefits.  c. 27:02",
            "description": [
                {
                    "representation": "(1)",
                    "description": "The Board shall have a general manager."
                },
                {
                    "representation": "(2)",
                    "description": "The power to appoint the general manager and the power to remove,  and  to  exercise  disciplinary  control over, any person so appointed shall be vested in the Board subject to the approval of the Minister."
                },
                {
                    "representation": "(3)",
                    "description": "Subject to the other provisions of this Act, the Board may employ a secretary, and such other officers and employees as the Board may require for the purpose of carrying out its functions under this Act, and the power to remove and to exercise disciplinary control over any person so employed shall be vested in the Board."
                },
                {
                    "representation": "(4)",
                    "description": "Subject to the other provisions of this Act, the remuneration and other terms and conditions of appointment"
                },
                {
                    "representation": "(5)",
                    "description": "The officers and other employees required by aL.R.O. 1/2012  LAWS OF GUYANA  18            Cap. 72:01            Guyana Rice Development Board    regional grading and export office shall be provided by the Board   from   among   the   officers   and   other   employees employed by it. Application of certain provisions of section 17 to employment under section 58(6)      Services of professional persons.    Superannuation benefits.  c. 27:02"
                }
            ]
        }
    },
    {
        "act": "GUYANA RICE DEVELOPMENT BOARD ACT",
        "source": "https://mola.gov.gy/laws-of-guyana",
        "type": {
            "name": "section",
            "representation": "18",
            "title": "Application of certain provisions of section 17 to employment under section 58 (6). ",
            "context": "GUYANA RICE DEVELOPMENT BOARD ACT under Application of certain provisions of section 17 to employment under section 58 (6). 18. (1) Any employment, other than that of the general manager, effected pursuant to the proviso to section 58 (6), shall be deemed to be effected under, and subject to section 17 (3).  (2) Employment of the general manager effected pursuant to the proviso to section 58 (6), shall be deemed to be effected under, and subject to, section 17 (3).",
            "description": [
                {
                    "representation": "(1)",
                    "description": "Any employment, other than that of the general manager, effected pursuant to the proviso to section 58"
                },
                {
                    "representation": "(2)",
                    "description": "Employment of the general manager effected pursuant to the proviso to section 58"
                }
            ]
        }
    },
    {
        "act": "GUYANA RICE DEVELOPMENT BOARD ACT",
        "source": "https://mola.gov.gy/laws-of-guyana",
        "type": {
            "name": "section",
            "representation": "19",
            "title": "Services of professional persons. ",
            "context": "GUYANA RICE DEVELOPMENT BOARD ACT under Services of professional persons. 19. The Board may at any time retain the services of professional persons and may pay such remuneration or fees in respect of their services   as   the   Board   may,   with   the approval of the Minister, determine.",
            "description": "The Board may at any time retain the services of professional persons and may pay such remuneration or fees in respect of their services   as   the   Board   may,   with   the approval of the Minister, determine."
        }
    },
    {
        "act": "GUYANA RICE DEVELOPMENT BOARD ACT",
        "source": "https://mola.gov.gy/laws-of-guyana",
        "type": {
            "name": "section",
            "representation": "20",
            "title": "Superannuation benefits.  PART IV FINANCIAL PROVISIONS  ",
            "context": "GUYANA RICE DEVELOPMENT BOARD ACT under Superannuation benefits.  PART IV FINANCIAL PROVISIONS  20. (1) Where, with the approval of the appropriate authority, an officer  (a)   is    seconded    or    temporarily transferred      from      a  pensionable office within the meaning of the Pensions Act to an office with the Board,  section  5  of  that  Act  shall apply to him as if his service in the office with the Board were service in a public office;  (b)      is   transferred   from   a   pensionable office within the meaning of the Pensions Act to a substantive appointment in an office with the Board, his service with the Board shall be other   public service within the meaning of, and for the purposes  of, such  provisions  in  relation  theretoL.R.O. 1/2012  LAWS OF GUYANA  Guyana Rice Development Board              Cap. 72:01              19     as are contained in the Pensions Act.  (2) Where a teacher who has done qualifying service within the meaning of the Teachers Pensions Act is, with the approval of the appropriate authority  (a)     seconded or temporarily transferred from   his   pensionable   office   as   a teacher to  an office  with the  Board, section 5 of the Pensions Act (as it applies mutatis mutandis to a  teacher under section 7C of the Teachers Pensions (Amendment) Act 1971 shall apply to him as it applies in the case of a public officer;  (b)      transferred    from    his    pensionable office as a teacher to a substantive appointment in an office with the Board, his service with the Board shall be treated as if it were other public service within the meaning of, and for the purposes of, such provisions in relation thereto as are contained in the Pensions Act as if he were a public officer to whom the Pensions Act applies.  (3) In subsections (1) and (2) appropriate authority means the person or authority vested by law with power to appoint the officer to the pensionable office held by him (and to which the Pensions Act applies) or to appoint a teacher to the office held by him as a teacher, as the case may be. (4) The Board may, with the approval of the Minister, make such provision as it thinks appropriate for the payment of pension, gratuity or other allowance in respect of the  service  of  its  officers  and  other  employees  on  theirL.R.O. 1/2012  LAWS OF GUYANA  20            Cap. 72:01            Guyana Rice Development Board    retirement therefrom.  PART IV FINANCIAL PROVISIONS Charging of fees by Board.         Funds and resources of Board.",
            "description": [
                {
                    "representation": "(1)",
                    "description": "and"
                },
                {
                    "representation": "(a)",
                    "description": "seconded or temporarily transferred from   his   pensionable   office   as   a teacher to  an office  with the  Board, section 5 of the Pensions Act"
                },
                {
                    "representation": "(b)",
                    "description": "transferred    from    his    pensionable office as a teacher to a substantive appointment in an office with the Board, his service with the Board shall be treated as if it were other public service within the meaning of, and for the purposes of, such provisions in relation thereto as are contained in the Pensions Act as if he were a public officer to whom the Pensions Act applies."
                },
                {
                    "representation": "(2)",
                    "description": "appropriate authority means the person or authority vested by law with power to appoint the officer to the pensionable office held by him"
                },
                {
                    "representation": "(3)",
                    "description": "In subsections"
                },
                {
                    "representation": "(4)",
                    "description": "The Board may, with the approval of the Minister, make such provision as it thinks appropriate for the payment of pension, gratuity or other allowance in respect of the  service  of  its  officers  and  other  employees  on  theirL.R.O. 1/2012  LAWS OF GUYANA  20            Cap. 72:01            Guyana Rice Development Board    retirement therefrom.  PART IV FINANCIAL PROVISIONS Charging of fees by Board.         Funds and resources of Board."
                }
            ]
        }
    },
    {
        "act": "GUYANA RICE DEVELOPMENT BOARD ACT",
        "source": "https://mola.gov.gy/laws-of-guyana",
        "type": {
            "name": "section",
            "representation": "21",
            "title": "Charging of fees by Board. ",
            "context": "GUYANA RICE DEVELOPMENT BOARD ACT under Charging of fees by Board. 21.(1) The Board may, with the approval of the Minister, charge fees  for the grading by it of padi or rice or for any other service rendered by it.  (2) The Minister may make regulations regarding the procedure relating to the levy and collection of such fees.",
            "description": [
                {
                    "representation": "(1)",
                    "description": "The Board may, with the approval of the Minister, charge fees  for the grading by it of padi or rice or for any other service rendered by it."
                },
                {
                    "representation": "(2)",
                    "description": "The Minister may make regulations regarding the procedure relating to the levy and collection of such fees."
                }
            ]
        }
    },
    {
        "act": "GUYANA RICE DEVELOPMENT BOARD ACT",
        "source": "https://mola.gov.gy/laws-of-guyana",
        "type": {
            "name": "section",
            "representation": "22",
            "title": "Funds and resources of Board. ",
            "context": "GUYANA RICE DEVELOPMENT BOARD ACT under Funds and resources of Board. 22.   (1) The funds and resources of the Board shall consist of  (a)      such assets of the Centre and Export Board  as  may  be  transferred to  the Board by or under the provisions of this Act;  (b)      fees payable to the Board under the provisions of this Act;  (c)      such sums as may be provided to the Board by or under an appropriation law;  (d)  such sums as may be allocated to the Board from time to time from loan funds;  (e)     monies earned or arising from any property or investment of the Board: (f)       all other sums or property which may in any manner be received by or become payable to, or be  vested in, the  Board  in  the  performance of  its functions or in respect of any matterL.R.O. 1/2012  LAWS OF GUYANA  Guyana Rice Development Board              Cap. 72:01              21     incidental thereto.  (2) For the purposes of this section, the expression loan funds means such sums as may be made available, from time to time, by the Government by way of loan. Opening and operation of accounts by Board.    Copies of agreement, etc., to be laid before Minister.   Authorised capital of Board.",
            "description": [
                {
                    "representation": "(1)",
                    "description": "The funds and resources of the Board shall consist of"
                },
                {
                    "representation": "(a)",
                    "description": "such assets of the Centre and Export Board  as  may  be  transferred to  the Board by or under the provisions of this Act;"
                },
                {
                    "representation": "(b)",
                    "description": "fees payable to the Board under the provisions of this Act;"
                },
                {
                    "representation": "(c)",
                    "description": "such sums as may be provided to the Board by or under an appropriation law;"
                },
                {
                    "representation": "(d)",
                    "description": "such sums as may be allocated to the Board from time to time from loan funds;"
                },
                {
                    "representation": "(e)",
                    "description": "monies earned or arising from any property or investment of the Board:"
                },
                {
                    "representation": "(f)",
                    "description": "all other sums or property which may in any manner be received by or become payable to, or be  vested in, the  Board  in  the  performance of  its functions or in respect of any matterL.R.O. 1/2012  LAWS OF GUYANA  Guyana Rice Development Board              Cap. 72:01              21     incidental thereto."
                },
                {
                    "representation": "(2)",
                    "description": "For the purposes of this section, the expression loan funds means such sums as may be made available, from time to time, by the Government by way of loan. Opening and operation of accounts by Board.    Copies of agreement, etc., to be laid before Minister.   Authorised capital of Board."
                }
            ]
        }
    },
    {
        "act": "GUYANA RICE DEVELOPMENT BOARD ACT",
        "source": "https://mola.gov.gy/laws-of-guyana",
        "type": {
            "name": "section",
            "representation": "23",
            "title": "Opening and operation of accounts by Board. ",
            "context": "GUYANA RICE DEVELOPMENT BOARD ACT under Opening and operation of accounts by Board. 23.  The Board may, for the purposes of carrying out its functions under this Act, open and operate any current, savings bank or any other type of account or accounts with any bank or banks in Guyana.",
            "description": "The Board may, for the purposes of carrying out its functions under this Act, open and operate any current, savings bank or any other type of account or accounts with any bank or banks in Guyana."
        }
    },
    {
        "act": "GUYANA RICE DEVELOPMENT BOARD ACT",
        "source": "https://mola.gov.gy/laws-of-guyana",
        "type": {
            "name": "section",
            "representation": "24",
            "title": "Copies of agreement, etc., to be laid before Minister. ",
            "context": "GUYANA RICE DEVELOPMENT BOARD ACT under Copies of agreement, etc., to be laid before Minister. 24.  As soon as practicable after the execution of any agreement, instrument, deed or mortgage under section 26, the general manager of the Board shall cause a copy thereof to be laid before the Minister.",
            "description": "As soon as practicable after the execution of any agreement, instrument, deed or mortgage under section 26, the general manager of the Board shall cause a copy thereof to be laid before the Minister."
        }
    },
    {
        "act": "GUYANA RICE DEVELOPMENT BOARD ACT",
        "source": "https://mola.gov.gy/laws-of-guyana",
        "type": {
            "name": "section",
            "representation": "25",
            "title": "Authorised capital of Board. ",
            "context": "GUYANA RICE DEVELOPMENT BOARD ACT under Authorised capital of Board. 25.(1) The Minister may, by order, prescribe the authorised capital of the  Board and such authorised capital may  in  like  manner  be  increased  or    decreased  by  the Minister  at  the  request  of,  or  after consultation with, the Board.  (2)  Any   order   under   subsection   (1)   shall   also prescribe the number and value of the shares into which the authorised  capital  or  increased  authorised  capital  of  the Board,   shall   be   divided   or   the  manner  in  which  the authorised capital, prescribed from time to time, of the Board shall be decreased.  (3) The whole, or such portion of the authorised capital prescribed by the Minister by order under subsection (1), of the  Board  as  may  be  specified  by  the  Minister  by  the aforesaid order, shall be subscribed by the Government and the  remaining  portion,  if  any,  of  such  authorised  capital shall be subscribed by such persons, and to such extent, as may be specified by the Minister by the aforesaid order.L.R.O. 1/2012  LAWS OF GUYANA  22            Cap. 72:01            Guyana Rice Development Board    (4) The shares of the Board shall be registered in the books of the Board, and shall be transferable only with the approval of the Board, which approval shall not be given if the  transfer  is  likely  to  result in the contravention of any order made by the Minister under any other provision of this section.  (5) Any  order  under  this  section  may  make  such incidental provision  as  may  be  necessary  or  expedient  to give full effect to it including provisions for the subscription for shares by instalments and the voting rights of the holders of shares so subscribed, at meetings of the shareholders of the Board.  (6) The assets of the Centre and Export Board being immovable property and cash transferred to the Board by or under the provisions of this Act shall be deemed to be capital subscribed by the Government to the Board. Power of Board to acquire, encumber and dispose of property,  etc",
            "description": [
                {
                    "representation": "(1)",
                    "description": "shall   also prescribe the number and value of the shares into which the authorised  capital  or  increased  authorised  capital  of  the Board,   shall   be   divided   or   the  manner  in  which  the authorised capital, prescribed from time to time, of the Board shall be decreased."
                },
                {
                    "representation": "(2)",
                    "description": "Any   order   under   subsection"
                },
                {
                    "representation": "(3)",
                    "description": "The whole, or such portion of the authorised capital prescribed by the Minister by order under subsection"
                },
                {
                    "representation": "(4)",
                    "description": "The shares of the Board shall be registered in the books of the Board, and shall be transferable only with the approval of the Board, which approval shall not be given if the  transfer  is  likely  to  result in the contravention of any order made by the Minister under any other provision of this section."
                },
                {
                    "representation": "(5)",
                    "description": "Any  order  under  this  section  may  make  such incidental provision  as  may  be  necessary  or  expedient  to give full effect to it including provisions for the subscription for shares by instalments and the voting rights of the holders of shares so subscribed, at meetings of the shareholders of the Board."
                },
                {
                    "representation": "(6)",
                    "description": "The assets of the Centre and Export Board being immovable property and cash transferred to the Board by or under the provisions of this Act shall be deemed to be capital subscribed by the Government to the Board. Power of Board to acquire, encumber and dispose of property,  etc"
                }
            ]
        }
    },
    {
        "act": "GUYANA RICE DEVELOPMENT BOARD ACT",
        "source": "https://mola.gov.gy/laws-of-guyana",
        "type": {
            "name": "section",
            "representation": "26",
            "title": "Power of Board to acquire, encumber and dispose of property etc. ",
            "context": "GUYANA RICE DEVELOPMENT BOARD ACT under Power of Board to acquire, encumber and dispose of property etc. 26.     (1)  The  Board  may,  for  the  purposes  of  its business under this Act  (a)     purchase any property movable or immovable;  (b)      accept  mortgages  and  bills  of  sale, and assignments or transfers thereof;  (c)    acquire by State grant, transport, execution  sale, lease, transfer of lease or  otherwise, any  property movable or immovable; (d)     erect, repair and maintain buildings; (e)        sell, lease, transport, transfer, dispose of, mortgage or otherwise encumber any property of the Board;L.R.O. 1/2012  LAWS OF GUYANA  Guyana Rice Development Board              Cap. 72:01              23      (f)       open and operate any current, savings bank or any other type of account or accounts  with  any  bank  or  banks within Guyana;  (g)      with    the approval of  the Minister assigned   responsibility  for   finance, open and operate any current, savings bank or any other type of account or accounts  with  any  bank  or  banks outside Guyana.  (2)      the Board may, for the purposes of its business under this Act, purchase agricultural   machinery,   equipment and supply, and sell or hire   such agricultural   machinery,   equipment and supply, to rice producers on such terms as the Board may think fit. Borrowing power of Board.",
            "description": [
                {
                    "representation": "(1)",
                    "description": "The  Board  may,  for  the  purposes  of  its business under this Act"
                },
                {
                    "representation": "(a)",
                    "description": "purchase any property movable or immovable;"
                },
                {
                    "representation": "(b)",
                    "description": "accept  mortgages  and  bills  of  sale, and assignments or transfers thereof;"
                },
                {
                    "representation": "(c)",
                    "description": "acquire by State grant, transport, execution  sale, lease, transfer of lease or  otherwise, any  property movable or immovable;"
                },
                {
                    "representation": "(d)",
                    "description": "erect, repair and maintain buildings;"
                },
                {
                    "representation": "(e)",
                    "description": "sell, lease, transport, transfer, dispose of, mortgage or otherwise encumber any property of the Board;L.R.O. 1/2012  LAWS OF GUYANA  Guyana Rice Development Board              Cap. 72:01              23"
                },
                {
                    "representation": "(f)",
                    "description": "open and operate any current, savings bank or any other type of account or accounts  with  any  bank  or  banks within Guyana;"
                },
                {
                    "representation": "(g)",
                    "description": "with    the approval of  the Minister assigned   responsibility  for   finance, open and operate any current, savings bank or any other type of account or accounts  with  any  bank  or  banks outside Guyana."
                },
                {
                    "representation": "(2)",
                    "description": "the Board may, for the purposes of its business under this Act, purchase agricultural   machinery,   equipment and supply, and sell or hire   such agricultural   machinery,   equipment and supply, to rice producers on such terms as the Board may think fit. Borrowing power of Board."
                }
            ]
        }
    },
    {
        "act": "GUYANA RICE DEVELOPMENT BOARD ACT",
        "source": "https://mola.gov.gy/laws-of-guyana",
        "type": {
            "name": "section",
            "representation": "27",
            "title": "Borrowing power of Board. ",
            "context": "GUYANA RICE DEVELOPMENT BOARD ACT under Borrowing power of Board. 27. (1) The Board may borrow such sums as may be required   by   it   for   meeting   any   of   its   obligations   or discharging any of its functions.  (2)  The  power  of  the  Board  to  borrow shall  be exercisable only with the approval of the Minister, as to the amount, the  sources of  the  borrowing and  other  terms in which the borrowing may be effected and approval given in any respect for the purposes of this subsection may be either general or limited to a particular borrowing or otherwise and may be either unconditional or subject to conditions.  (3) The power of the Board to borrow shall include the power to execute in favour of a bank, by instrument in writing, a floating charge on all or any buildings, structures and other erections, padi and rice and other     products   of padi,   agricultural   machinery   and   equipment, packagingL.R.O. 1/2012  LAWS OF GUYANA  24            Cap. 72:01            Guyana Rice Development Board    materials, office and warehouse equipment and machinery, bags, thread and twine, from time to time in its ownership, as security for sums advanced to it by the bank, and any interest, commission and charges that may be due thereon.  (4) The principal sum secured by a charge under subsection   (3)   may   be   either   a   specific   amount,   or   a fluctuating amount advanced by way of overdraft on current account, the total outstanding amount of which shall not at any time exceed such amount (if any) as may be specified in the charge, and in the latter case the charge shall not be deemed to be redeemed by reason only of the current account having ceased to be in debit.  (5) The instrument in writing referred to in subsection (3) and executed by the Board may be in the form set  out  in  the  Schedule or  to  the  like effect, and  shall  be deemed to confer in favour of the bank, a first charge on all buildings, structures and other erections, padi and rice and other  products  of  padi,  agricultural  machinery  and equipment, packaging materials, office and warehouse equipment and machinery, bags, thread and twine then or thereafter in the ownership of the Board, at the place or places therein mentioned and shall rank prior to all other claims against the Board,   not secured by mortgage of any specific property of the Board. Guarantee by the Government of borrowing by Board. c. 77:01",
            "description": [
                {
                    "representation": "(1)",
                    "description": "The Board may borrow such sums as may be required   by   it   for   meeting   any   of   its   obligations   or discharging any of its functions."
                },
                {
                    "representation": "(2)",
                    "description": "The  power  of  the  Board  to  borrow shall  be exercisable only with the approval of the Minister, as to the amount, the  sources of  the  borrowing and  other  terms in which the borrowing may be effected and approval given in any respect for the purposes of this subsection may be either general or limited to a particular borrowing or otherwise and may be either unconditional or subject to conditions."
                },
                {
                    "representation": "(3)",
                    "description": "and executed by the Board may be in the form set  out  in  the  Schedule or  to  the  like effect, and  shall  be deemed to confer in favour of the bank, a first charge on all buildings, structures and other erections, padi and rice and other  products  of  padi,  agricultural  machinery  and equipment, packaging materials, office and warehouse equipment and machinery, bags, thread and twine then or thereafter in the ownership of the Board, at the place or places therein mentioned and shall rank prior to all other claims against the Board,   not secured by mortgage of any specific property of the Board. Guarantee by the Government of borrowing by Board. c. 77:01"
                },
                {
                    "representation": "(4)",
                    "description": "The principal sum secured by a charge under subsection"
                },
                {
                    "representation": "(5)",
                    "description": "The instrument in writing referred to in subsection"
                }
            ]
        }
    },
    {
        "act": "GUYANA RICE DEVELOPMENT BOARD ACT",
        "source": "https://mola.gov.gy/laws-of-guyana",
        "type": {
            "name": "section",
            "representation": "28",
            "title": "Guarantee by the Government of borrowing by Board. ",
            "context": "GUYANA RICE DEVELOPMENT BOARD ACT under Guarantee by the Government of borrowing by Board. 28. The Government may guarantee, in such manner and on such conditions as may be agreed to between it and the lender, the payment of any sum borrowed by the Board and the interest and other charges payable thereon, and the provisions of the Guarantee of Loans (Public Corporations and Companies) Act shall mutatis mutandis apply to, and in relation to, any   guarantee given by the Government under this section as if it is a  guarantee given under that Act subject to   the   modification   that   references   in   that   Act   to   a corporation, as defined in that Act, shall be construed as references to the Board.L.R.O. 1/2012  LAWS OF GUYANA  Guyana Rice Development Board              Cap. 72:01              25     Profits and losse of Board.  fund.",
            "description": "The Government may guarantee, in such manner and on such conditions as may be agreed to between it and the lender, the payment of any sum borrowed by the Board and the interest and other charges payable thereon, and the provisions of the Guarantee of Loans (Public Corporations and Companies) Act shall mutatis mutandis apply to, and in relation to, any   guarantee given by the Government under this section as if it is a  guarantee given under that Act subject to   the   modification   that   references   in   that   Act   to   a corporation, as defined in that Act, shall be construed as references to the Board.L.R.O. 1/2012  LAWS OF GUYANA  Guyana Rice Development Board              Cap. 72:01              25     Profits and losse of Board.  fund."
        }
    },
    {
        "act": "GUYANA RICE DEVELOPMENT BOARD ACT",
        "source": "https://mola.gov.gy/laws-of-guyana",
        "type": {
            "name": "section",
            "representation": "29",
            "title": "Profits and losses of Board. ",
            "context": "GUYANA RICE DEVELOPMENT BOARD ACT under Profits and losses of Board. 29.  (1)  The  Board  shall  establish  a  general  reserve (2)  The  ascertained  profits  of  the  Board  of  any accounting year in   which there is an excess of income over expenditure shall be transferred to the general reserve fund established by the Board:  Provided that if so advised by the Minister, such portion of the ascertained profits of the Board, of the aforesaid accounting year, shall be utilised for such purposes as may be determined by the Board in consultation with the Minister.  (3) The ascertained loss, of the Board, of any accounting year in which there is an excess of expenditure over  income  shall  be  met  by  an  appropriation  from  the general reserve fund established by the Board of such amount as may be necessary to cover such loss. Accounting year of Board.      Investments by Board.       Exemptions of Board from tax, duty, etc. c. 81:01 c. 82:01 c. 80:02",
            "description": [
                {
                    "representation": "(1)",
                    "description": "The  Board  shall  establish  a  general  reserve"
                },
                {
                    "representation": "(2)",
                    "description": "The  ascertained  profits  of  the  Board  of  any accounting year in   which there is an excess of income over expenditure shall be transferred to the general reserve fund established by the Board:  Provided that if so advised by the Minister, such portion of the ascertained profits of the Board, of the aforesaid accounting year, shall be utilised for such purposes as may be determined by the Board in consultation with the Minister."
                },
                {
                    "representation": "(3)",
                    "description": "The ascertained loss, of the Board, of any accounting year in which there is an excess of expenditure over  income  shall  be  met  by  an  appropriation  from  the general reserve fund established by the Board of such amount as may be necessary to cover such loss. Accounting year of Board.      Investments by Board.       Exemptions of Board from tax, duty, etc. c. 81:01 c. 82:01 c. 80:02"
                }
            ]
        }
    },
    {
        "act": "GUYANA RICE DEVELOPMENT BOARD ACT",
        "source": "https://mola.gov.gy/laws-of-guyana",
        "type": {
            "name": "section",
            "representation": "30",
            "title": "Accounting year of Board. ",
            "context": "GUYANA RICE DEVELOPMENT BOARD ACT under Accounting year of Board. 30. The accounting year of the Board shall be the period of twelve months commencing on the 1st January, or such other date as may be specified by the Minister, each year.",
            "description": "The accounting year of the Board shall be the period of twelve months commencing on the 1st January, or such other date as may be specified by the Minister, each year."
        }
    },
    {
        "act": "GUYANA RICE DEVELOPMENT BOARD ACT",
        "source": "https://mola.gov.gy/laws-of-guyana",
        "type": {
            "name": "section",
            "representation": "31",
            "title": "Investments by Board. ",
            "context": "GUYANA RICE DEVELOPMENT BOARD ACT under Investments by Board. 31. Monies standing to the credit of the Board may, from time to time, be invested in securities approved either generally or specifically by the  Minister, and the Board may, from time to time, with like approval sell any or all of such securities.",
            "description": "Monies standing to the credit of the Board may, from time to time, be invested in securities approved either generally or specifically by the  Minister, and the Board may, from time to time, with like approval sell any or all of such securities."
        }
    },
    {
        "act": "GUYANA RICE DEVELOPMENT BOARD ACT",
        "source": "https://mola.gov.gy/laws-of-guyana",
        "type": {
            "name": "section",
            "representation": "32",
            "title": "Exemption of Board from tax, duty, etc. ",
            "context": "GUYANA RICE DEVELOPMENT BOARD ACT under Exemption of Board from tax, duty, etc. 32. (1) The Board shall be exempt from payment of income tax under the Income Tax Act, import or export duties of customs under the Customs Act and consumption tax, in respect of goods imported by it into Guyana, under the Consumption Tax Act.  (2) The Minister assigned responsibility for financeL.R.O. 1/2012  LAWS OF GUYANA  26            Cap. 72:01            Guyana Rice Development Board    may, by order, which shall be subject to negative resolution of the National Assembly, exempt the Board from payment wholly or partly of any tax or duty, not being a tax or duty referred to in subsection (1), or rate, levy or other charge, payable under any law for the time being in force. Accounts and audit.                  Regulations regarding financial procedure.",
            "description": [
                {
                    "representation": "(1)",
                    "description": "The Board shall be exempt from payment of income tax under the Income Tax Act, import or export duties of customs under the Customs Act and consumption tax, in respect of goods imported by it into Guyana, under the Consumption Tax Act."
                },
                {
                    "representation": "(2)",
                    "description": "The Minister assigned responsibility for financeL.R.O. 1/2012  LAWS OF GUYANA  26            Cap. 72:01            Guyana Rice Development Board    may, by order, which shall be subject to negative resolution of the National Assembly, exempt the Board from payment wholly or partly of any tax or duty, not being a tax or duty referred to in subsection"
                }
            ]
        }
    },
    {
        "act": "GUYANA RICE DEVELOPMENT BOARD ACT",
        "source": "https://mola.gov.gy/laws-of-guyana",
        "type": {
            "name": "section",
            "representation": "33",
            "title": "Accounts and audit. ",
            "context": "GUYANA RICE DEVELOPMENT BOARD ACT under Accounts and audit. 33.   (1)   The   Board   shall   keep   accounts   of   its transactions  to  the  satisfaction  of  the  Minister  and  the accounts shall be audited annually by the Auditor General.  (2) The members, officers and other employees of the Board shall grant to  the Auditor General access to  all books, documents, cash and securities of the Board and shall give  to  him  on  request  all  such information    as    may  be within  their  knowledge  in relation  to  the operation of the Board.  (3)  The  Board  may,  with  the  approval  of  the Minister, write off bad debts.",
            "description": [
                {
                    "representation": "(1)",
                    "description": "The   Board   shall   keep   accounts   of   its transactions  to  the  satisfaction  of  the  Minister  and  the accounts shall be audited annually by the Auditor General."
                },
                {
                    "representation": "(2)",
                    "description": "The members, officers and other employees of the Board shall grant to  the Auditor General access to  all books, documents, cash and securities of the Board and shall give  to  him  on  request  all  such information    as    may  be within  their  knowledge  in relation  to  the operation of the Board."
                },
                {
                    "representation": "(3)",
                    "description": "The  Board  may,  with  the  approval  of  the Minister, write off bad debts."
                }
            ]
        }
    },
    {
        "act": "GUYANA RICE DEVELOPMENT BOARD ACT",
        "source": "https://mola.gov.gy/laws-of-guyana",
        "type": {
            "name": "section",
            "representation": "34",
            "title": "Regulations regarding financial procedure.  PART V REGULATION OF RICE FACTORIES AND MANUFACTURING OF RICE  ",
            "context": "GUYANA RICE DEVELOPMENT BOARD ACT under Regulations regarding financial procedure.  PART V REGULATION OF RICE FACTORIES AND MANUFACTURING OF RICE  34. The Minister may make regulations relating to the procedure to be followed by the Board with respect to its financial business and, without prejudice to the generality of the foregoing, such regulations may in particular provide for all or any of the following matters -  (a)      the books and accounts that are to be kept by the Board and the form in which such books and accounts shall be kept;  (b)    the preparation of balance sheets, financial statements and abstracts of accounts and the forms therefor;  (c)      the   procedure   in   relation   to   the purchase  of  stores  and  equipment; and the custody and  issue of storesL.R.O. 1/2012  LAWS OF GUYANA  Guyana Rice Development Board              Cap. 72:01              27     and equipment;  (d) the   receipt,   transmission   and   safe custody of cash; and  (e)       the procedure in relation to tendering and entering into contracts.  PART V REGULATION OF RICE FACTORIES AND MANUFACTURING OF RICE Amendment of Rice Factories Act.                        Receipts or acknowledge- ments to be given on payment of milling fees.",
            "description": [
                {
                    "representation": "(a)",
                    "description": "the books and accounts that are to be kept by the Board and the form in which such books and accounts shall be kept;"
                },
                {
                    "representation": "(b)",
                    "description": "the preparation of balance sheets, financial statements and abstracts of accounts and the forms therefor;"
                },
                {
                    "representation": "(c)",
                    "description": "the   procedure   in   relation   to   the purchase  of  stores  and  equipment; and the custody and  issue of storesL.R.O. 1/2012  LAWS OF GUYANA  Guyana Rice Development Board              Cap. 72:01              27     and equipment;"
                },
                {
                    "representation": "(d)",
                    "description": "the   receipt,   transmission   and   safe custody of cash; and"
                },
                {
                    "representation": "(e)",
                    "description": "the procedure in relation to tendering and entering into contracts.  PART V REGULATION OF RICE FACTORIES AND MANUFACTURING OF RICE Amendment of Rice Factories Act.                        Receipts or acknowledge- ments to be given on payment of milling fees."
                }
            ]
        }
    },
    {
        "act": "GUYANA RICE DEVELOPMENT BOARD ACT",
        "source": "https://mola.gov.gy/laws-of-guyana",
        "type": {
            "name": "section",
            "representation": "35",
            "title": "Amendment of Rice Factories Act. ",
            "context": "GUYANA RICE DEVELOPMENT BOARD ACT under Amendment of Rice Factories Act. 35. On and after the commencement of this Act the functions conferred by the Rice Factories Act upon the Centre shall, subject to the provision of this section, be exercised and performed by the board and accordingly  (a)      the   Rice   Factories   Act   is   hereby amended by the substitution, for the word Centre wherever it occurs in the provisions of that Act, other than section 2, of the word Board.  (b)      section 2  of  the  Rice  Factory Act  is hereby amended by  the  substitution for the definition of Centre, for the following definition  Board means the Guyana Rice Development Board established by section 3 of the Guyana Rice Development Board Act;",
            "description": [
                {
                    "representation": "(a)",
                    "description": "the   Rice   Factories   Act   is   hereby amended by the substitution, for the word Centre wherever it occurs in the provisions of that Act, other than section 2, of the word Board."
                },
                {
                    "representation": "(b)",
                    "description": "section 2  of  the  Rice  Factory Act  is hereby amended by  the  substitution for the definition of Centre, for the following definition  Board means the Guyana Rice Development Board established by section 3 of the Guyana Rice Development Board Act;"
                }
            ]
        }
    },
    {
        "act": "GUYANA RICE DEVELOPMENT BOARD ACT",
        "source": "https://mola.gov.gy/laws-of-guyana",
        "type": {
            "name": "section",
            "representation": "36",
            "title": "Receipts or acknowledgements to be given on payment of milling fees.  PART VI REGULATION OF MARKETING AND EXPORT OF PADI, RICE, ETC.  ",
            "context": "GUYANA RICE DEVELOPMENT BOARD ACT under Receipts or acknowledgements to be given on payment of milling fees.  PART VI REGULATION OF MARKETING AND EXPORT OF PADI, RICE, ETC.  36.",
            "description": "36."
        }
    },
    {
        "act": "GUYANA RICE DEVELOPMENT BOARD ACT",
        "source": "https://mola.gov.gy/laws-of-guyana",
        "type": {
            "name": "section",
            "representation": "37",
            "title": "Licensing of persons for grading padi and rice. ",
            "context": "GUYANA RICE DEVELOPMENT BOARD ACT under Licensing of persons for grading padi and rice. 37. (1) The Board may train persons to grade padi or rice or both.  (2) The Board may issue a licence to any person who, according to the Board is qualified to grade padi or rice or both, and such licence shall specify whether the person is licensed to grade padi or rice or both.  (3) A licence issued under subsection (2) shall be in such   form   and   subject   to   such   conditions  as   may   be prescribed by the Minister by regulations.  (4) The Board may levy such fees as may be prescribed by the Minister by regulations for the issue of a licence under subsection (2).",
            "description": [
                {
                    "representation": "(1)",
                    "description": "The Board may train persons to grade padi or rice or both."
                },
                {
                    "representation": "(2)",
                    "description": "shall be in such   form   and   subject   to   such   conditions  as   may   be prescribed by the Minister by regulations."
                },
                {
                    "representation": "(3)",
                    "description": "A licence issued under subsection"
                },
                {
                    "representation": "(4)",
                    "description": "The Board may levy such fees as may be prescribed by the Minister by regulations for the issue of a licence under subsection"
                }
            ]
        }
    },
    {
        "act": "GUYANA RICE DEVELOPMENT BOARD ACT",
        "source": "https://mola.gov.gy/laws-of-guyana",
        "type": {
            "name": "section",
            "representation": "38",
            "title": "Grading of padi and rice. ",
            "context": "GUYANA RICE DEVELOPMENT BOARD ACT under Grading of padi and rice. 38.(1)  Every rice  producer shall,  before  selling any quantity of padi or rice, have it graded at any office of the Board or the regional grading and   export office established for the region in which the padi was grown or the rice was manufactured.  (2) Notwithstanding   anything   contained   in subsection (l), where a manufacturer has employed a licensed grader,   any   quantity   of   padi   or   rice   delivered   to,   orL.R.O. 1/2012  LAWS OF GUYANA  Guyana Rice Development Board              Cap. 72:01              29     manufactured by, the manufacturer may be graded  by  such licensed     grader,     and     where     the     manufacturer     is purchasing padi, the seller of such padi may, if he so desires, request and obtain  the  presence  of a representative  for the Guyana  Rice Producers Association  at the grading of such padi, and where the quantity of padi or rice is graded by the licensed grader, it shall not be required to be graded by the Board:  Provided that any grade given by any such licensed grader shall not be binding on the Board. Appeal against grade given by licensed grader employed by manufacturer.",
            "description": [
                {
                    "representation": "(1)",
                    "description": "Every rice  producer shall,  before  selling any quantity of padi or rice, have it graded at any office of the Board or the regional grading and   export office established for the region in which the padi was grown or the rice was manufactured."
                },
                {
                    "representation": "(2)",
                    "description": "Notwithstanding   anything   contained   in subsection"
                }
            ]
        }
    },
    {
        "act": "GUYANA RICE DEVELOPMENT BOARD ACT",
        "source": "https://mola.gov.gy/laws-of-guyana",
        "type": {
            "name": "section",
            "representation": "39",
            "title": "Appeal against grade given by licensed grader employed by manufacturer. ",
            "context": "GUYANA RICE DEVELOPMENT BOARD ACT under Appeal against grade given by licensed grader employed by manufacturer. 39.  (1)  Where  any  licensed  grader  employed  by  a manufacturer has graded any quantity of padi or rice and the seller of the padi or the purchaser of the rice is aggrieved by the grade given by the licensed grader, he may appeal to the Board.  (2) The Board shall inform the appellant and the concerned manufacturer and licensed grader of the date of hearing of the appeal and, after hearing such of the aforesaid persons or their legal or other representative as may appear before it on the date of hearing of the appeal as may desire to be  heard,  either  confirm  the  grade  given  by  the  licensed grader to the quantity of padi or rice or give the quantity of padi a higher  grade or the quantity of rice a lower grade; and the   decision   of   the   Board   shall   be   binding   on   the manufacturer, and the seller or purchaser, as the case may be, of the padi or rice.  (3) Every appeal made to the Board under subsection (1) shall be heard by the Board within forty-eight hours of the date on which it was made.  (4) Where the Board is of the opinion that the appeal is frivolous it may direct the appellant to pay the costs of the person or persons contesting the appeal.L.R.O. 1/2012  LAWS OF GUYANA  30            Cap. 72:01            Guyana Rice Development Board    (5) An appeal under subsection (1) shall be in such form and shall be made subject to such conditions, including payment of fees, and   within   such   time   as   may   be prescribed by the Minister by regulations. Samples of padi or rice for appeal.              Sale by rice producer  of rice or padi.",
            "description": [
                {
                    "representation": "(1)",
                    "description": "shall be in such form and shall be made subject to such conditions, including payment of fees, and   within   such   time   as   may   be prescribed by the Minister by regulations. Samples of padi or rice for appeal.              Sale by rice producer  of rice or padi."
                },
                {
                    "representation": "(2)",
                    "description": "The Board shall inform the appellant and the concerned manufacturer and licensed grader of the date of hearing of the appeal and, after hearing such of the aforesaid persons or their legal or other representative as may appear before it on the date of hearing of the appeal as may desire to be  heard,  either  confirm  the  grade  given  by  the  licensed grader to the quantity of padi or rice or give the quantity of padi a higher  grade or the quantity of rice a lower grade; and the   decision   of   the   Board   shall   be   binding   on   the manufacturer, and the seller or purchaser, as the case may be, of the padi or rice."
                },
                {
                    "representation": "(3)",
                    "description": "Every appeal made to the Board under subsection"
                },
                {
                    "representation": "(4)",
                    "description": "Where the Board is of the opinion that the appeal is frivolous it may direct the appellant to pay the costs of the person or persons contesting the appeal.L.R.O. 1/2012  LAWS OF GUYANA  30            Cap. 72:01            Guyana Rice Development Board"
                },
                {
                    "representation": "(5)",
                    "description": "An appeal under subsection"
                }
            ]
        }
    },
    {
        "act": "GUYANA RICE DEVELOPMENT BOARD ACT",
        "source": "https://mola.gov.gy/laws-of-guyana",
        "type": {
            "name": "section",
            "representation": "40",
            "title": "Samples of padi or rice for appeal. ",
            "context": "GUYANA RICE DEVELOPMENT BOARD ACT under Samples of padi or rice for appeal. 40. Where any person disputes any grade given by a licensed grader employed by a manufacturer to any quantity of padi or rice under section 38 (2) and intends to appeal under section 39 (1) against the grade given, he shall be entitled to request the manufacturer to take three samples of the padi or rice, as the case may be, in sealed containers, one of the   samples to be kept by the manufacturer, the second sample to be given to the seller of the padi or the purchaser of the rice, as the case may be, and the third sample to be sent by the manufacturer to the Board and where any such request is made, the manufacturer shall forthwith act accordingly.",
            "description": [
                {
                    "representation": "(2)",
                    "description": "and intends to appeal under section 39"
                },
                {
                    "representation": "(1)",
                    "description": "against the grade given, he shall be entitled to request the manufacturer to take three samples of the padi or rice, as the case may be, in sealed containers, one of the   samples to be kept by the manufacturer, the second sample to be given to the seller of the padi or the purchaser of the rice, as the case may be, and the third sample to be sent by the manufacturer to the Board and where any such request is made, the manufacturer shall forthwith act accordingly."
                }
            ]
        }
    },
    {
        "act": "GUYANA RICE DEVELOPMENT BOARD ACT",
        "source": "https://mola.gov.gy/laws-of-guyana",
        "type": {
            "name": "section",
            "representation": "41",
            "title": "Sale by rice producer of rice or padi.L.R.O. 1/2012  LAWS OF GUYANA  Guyana Rice Development Board              Cap. 72:01                5   SECTION  ",
            "context": "GUYANA RICE DEVELOPMENT BOARD ACT under Sale by rice producer of rice or padi.L.R.O. 1/2012  LAWS OF GUYANA  Guyana Rice Development Board              Cap. 72:01                5   SECTION  41.(1) It  shall  be  lawful  for  a  rice  producer,  not being a manufacturer, to  (a)      sell padi to a manufacturer; or  (b)   enter  into  a  contract  with  a manufacturer to mill padi, delivered by him to the manufacturer, into rice and for the manufacturer or the rice producer to sell the said rice.  (2) A rice producer may sell or deliver quantities of rice to persons in Guyana for the purposes of  (a)      their own domestic consumption;  (b)      resale to the general public, in the case of licensed shopkeepers; and  (c)      export, under  sections 42  and  43  of this Act.L.R.O. 1/2012  LAWS OF GUYANA  Guyana Rice Development Board              Cap. 72:01              31      (3) Every rice producer shall keep a proper record of all sales of rice and padi which shall be made available for inspection by the Board at all reasonable times. Licence for export of padi or rice or other product of padi.                Approval of contracts for export of padi or rice or other product of padi.",
            "description": [
                {
                    "representation": "(1)",
                    "description": "It  shall  be  lawful  for  a  rice  producer,  not being a manufacturer, to"
                },
                {
                    "representation": "(a)",
                    "description": "their own domestic consumption;"
                },
                {
                    "representation": "(b)",
                    "description": "resale to the general public, in the case of licensed shopkeepers; and"
                },
                {
                    "representation": "(2)",
                    "description": "A rice producer may sell or deliver quantities of rice to persons in Guyana for the purposes of"
                },
                {
                    "representation": "(c)",
                    "description": "export, under  sections 42  and  43  of this Act.L.R.O. 1/2012  LAWS OF GUYANA  Guyana Rice Development Board              Cap. 72:01              31"
                },
                {
                    "representation": "(3)",
                    "description": "Every rice producer shall keep a proper record of all sales of rice and padi which shall be made available for inspection by the Board at all reasonable times. Licence for export of padi or rice or other product of padi.                Approval of contracts for export of padi or rice or other product of padi."
                }
            ]
        }
    },
    {
        "act": "GUYANA RICE DEVELOPMENT BOARD ACT",
        "source": "https://mola.gov.gy/laws-of-guyana",
        "type": {
            "name": "section",
            "representation": "42",
            "title": "Licence for export of padi or rice or other product of padi. ",
            "context": "GUYANA RICE DEVELOPMENT BOARD ACT under Licence for export of padi or rice or other product of padi. 42. (1) The Board may, on the payment of such fees as may be prescribed by the Minister by regulations, grant a licence to any manufacturer,   or any other   person who proposes  to carry on the business of export of padi or rice or any other product of padi, to carry on that business.  (2) The licence shall be in such form and subject to such terms and conditions, as may be prescribed by the Minister by regulations.  (3)  No  person shall,  export  padi  or  rice  or  any other product of padi unless he is the holder of a licence granted by the Board under this section for carrying on the business of its export.",
            "description": [
                {
                    "representation": "(1)",
                    "description": "The Board may, on the payment of such fees as may be prescribed by the Minister by regulations, grant a licence to any manufacturer,   or any other   person who proposes  to carry on the business of export of padi or rice or any other product of padi, to carry on that business."
                },
                {
                    "representation": "(2)",
                    "description": "The licence shall be in such form and subject to such terms and conditions, as may be prescribed by the Minister by regulations."
                },
                {
                    "representation": "(3)",
                    "description": "No  person shall,  export  padi  or  rice  or  any other product of padi unless he is the holder of a licence granted by the Board under this section for carrying on the business of its export."
                }
            ]
        }
    },
    {
        "act": "GUYANA RICE DEVELOPMENT BOARD ACT",
        "source": "https://mola.gov.gy/laws-of-guyana",
        "type": {
            "name": "section",
            "representation": "43",
            "title": "Approval of contracts for export of padi or rice or other product of padi. ",
            "context": "GUYANA RICE DEVELOPMENT BOARD ACT under Approval of contracts for export of padi or rice or other product of padi. 43. (1) Every  manufacturer  or  other  person  holding a  licence granted under section 42(1) shall, before he enters into any contract for, or involving, the export of padi or rice or any other product of padi, submit the contract to the Board for   approval   and   he   shall   make   the   contract   only   in accordance with the terms and conditions approved by the Board.  (2) Every manufacturer or other person, holding  a licence granted under section 42(1) may, from the quantity of padi or rice or any other product of padi in his possession, export the quantity of padi or rice or any other product of padi, of the appropriate quality, required to be exported  by him in pursuance of a contract made by him in accordance with   subsection (1) and shall not otherwise export any quantity of padi or rice or any other product of padi.L.R.O. 1/2012  LAWS OF GUYANA  32            Cap. 72:01            Guyana Rice Development Board   Provision of export storage facilities.                           Certification of quality or quantity of rice proposed to be exported.            Contravention of section 16 by members and employees of Board, etc. [6 of 1997]",
            "description": [
                {
                    "representation": "(1)",
                    "description": "and shall not otherwise export any quantity of padi or rice or any other product of padi.L.R.O. 1/2012  LAWS OF GUYANA  32            Cap. 72:01            Guyana Rice Development Board   Provision of export storage facilities.                           Certification of quality or quantity of rice proposed to be exported.            Contravention of section 16 by members and employees of Board, etc. [6 of 1997]"
                },
                {
                    "representation": "(2)",
                    "description": "Every manufacturer or other person, holding  a licence granted under section 42(1) may, from the quantity of padi or rice or any other product of padi in his possession, export the quantity of padi or rice or any other product of padi, of the appropriate quality, required to be exported  by him in pursuance of a contract made by him in accordance with   subsection"
                }
            ]
        }
    },
    {
        "act": "GUYANA RICE DEVELOPMENT BOARD ACT",
        "source": "https://mola.gov.gy/laws-of-guyana",
        "type": {
            "name": "section",
            "representation": "44",
            "title": "Provision of export storage facilities. ",
            "context": "GUYANA RICE DEVELOPMENT BOARD ACT under Provision of export storage facilities. 44. (1) The Board may for the purposes of carrying out its  functions establish depots, in  such of  the  regions as  it thinks fit, for storage of rice or any other product of padi or padi to facilitate the storage of padi, rice and by products for export.  (2) The Board may permit any person engaged in the export of padi and rice or any other product of padi to make use of the storage facilities of the Board on payment to the Board of such storage fees and other fees as may be determined by the Board.  (3)  Where  any  exporter  uses  his  own  storage facility for the storage of padi or rice or any other product of padi proposed to be exported by him, the Board shall advise the exporter in respect of matters relating to the management, organisation, accommodation and sanitary condition of the storage facility so as to ensure that the quality of the padi or rice or any other product of padi will be preserved and it is not infested with insect pests or fungi and any such direction shall be complied with by the exporter.",
            "description": [
                {
                    "representation": "(1)",
                    "description": "The Board may for the purposes of carrying out its  functions establish depots, in  such of  the  regions as  it thinks fit, for storage of rice or any other product of padi or padi to facilitate the storage of padi, rice and by products for export."
                },
                {
                    "representation": "(2)",
                    "description": "The Board may permit any person engaged in the export of padi and rice or any other product of padi to make use of the storage facilities of the Board on payment to the Board of such storage fees and other fees as may be determined by the Board."
                },
                {
                    "representation": "(3)",
                    "description": "Where  any  exporter  uses  his  own  storage facility for the storage of padi or rice or any other product of padi proposed to be exported by him, the Board shall advise the exporter in respect of matters relating to the management, organisation, accommodation and sanitary condition of the storage facility so as to ensure that the quality of the padi or rice or any other product of padi will be preserved and it is not infested with insect pests or fungi and any such direction shall be complied with by the exporter."
                }
            ]
        }
    },
    {
        "act": "GUYANA RICE DEVELOPMENT BOARD ACT",
        "source": "https://mola.gov.gy/laws-of-guyana",
        "type": {
            "name": "section",
            "representation": "45",
            "title": "Certification of quality or quantity of rice proposed to be exported.  PART VII OFFENCES, PENALTIES AND PROCEDURE  ",
            "context": "GUYANA RICE DEVELOPMENT BOARD ACT under Certification of quality or quantity of rice proposed to be exported.  PART VII OFFENCES, PENALTIES AND PROCEDURE  45. (1) The Minister may by order direct that no quantity of rice shall be exported by any person, unless its quality or quantity or both is or are certified by the Board or a licensed grader.  (2) The Board may, with the approval of the Minister, charge fees for certifying the quality, quantity or both of any quantity of rice under subsection (1).  PART VII OFFENCES, PENALTIES AND PROCEDURE",
            "description": [
                {
                    "representation": "(1)",
                    "description": "The Minister may by order direct that no quantity of rice shall be exported by any person, unless its quality or quantity or both is or are certified by the Board or a licensed grader."
                },
                {
                    "representation": "(2)",
                    "description": "The Board may, with the approval of the Minister, charge fees for certifying the quality, quantity or both of any quantity of rice under subsection"
                }
            ]
        }
    },
    {
        "act": "GUYANA RICE DEVELOPMENT BOARD ACT",
        "source": "https://mola.gov.gy/laws-of-guyana",
        "type": {
            "name": "section",
            "representation": "46",
            "title": "Contravention of section 16 by members and employees of Board, etc. ",
            "context": "GUYANA RICE DEVELOPMENT BOARD ACT under Contravention of section 16 by members and employees of Board, etc. 46.   Any member of the Board, or a committee appointed under section 15(1), or of any committee of the Board, the general manager or any other officer or employee of  the  Board,  or  any  officer  or  other  employee  of    anyL.R.O. 1/2012  LAWS OF GUYANA  Guyana Rice Development Board              Cap. 72:01              33     committee of  the  Board  (including a  committee appointed under     section  15(1),  who  contravenes  the  provisions  of section 16(l) shall be liable to a fine of thirty thousand dollars and to imprisonment for six months. Contravention of section",
            "description": [
                {
                    "representation": "(l)",
                    "description": "shall be liable to a fine of thirty thousand dollars and to imprisonment for six months. Contravention of section"
                }
            ]
        }
    },
    {
        "act": "GUYANA RICE DEVELOPMENT BOARD ACT",
        "source": "https://mola.gov.gy/laws-of-guyana",
        "type": {
            "name": "section",
            "representation": "47",
            "title": "Contravention of section ",
            "context": "GUYANA RICE DEVELOPMENT BOARD ACT under Contravention of section 47.    Any    manufacturer,    who    contravenes    any provision contained in section 36, shall be liable to a fine of fifteen thousand dollars and to imprisonment for six months.",
            "description": "Any    manufacturer,    who    contravenes    any provision contained in section 36, shall be liable to a fine of fifteen thousand dollars and to imprisonment for six months."
        }
    },
    {
        "act": "GUYANA RICE DEVELOPMENT BOARD ACT",
        "source": "https://mola.gov.gy/laws-of-guyana",
        "type": {
            "name": "section",
            "representation": "48",
            "title": "Selling padi or rice which is not graded under this Act. ",
            "context": "GUYANA RICE DEVELOPMENT BOARD ACT under Selling padi or rice which is not graded under this Act. 48.  Any rice producer, who sells any quantity of padi or rice which is not graded in accordance with the provisions of this Act, shall be liable to fine of thirty thousand dollars and to imprisonment for one year.",
            "description": "Any rice producer, who sells any quantity of padi or rice which is not graded in accordance with the provisions of this Act, shall be liable to fine of thirty thousand dollars and to imprisonment for one year."
        }
    },
    {
        "act": "GUYANA RICE DEVELOPMENT BOARD ACT",
        "source": "https://mola.gov.gy/laws-of-guyana",
        "type": {
            "name": "section",
            "representation": "49",
            "title": "Export of padi or rice or other products of padi by unauthorised persons. ",
            "context": "GUYANA RICE DEVELOPMENT BOARD ACT under Export of padi or rice or other products of padi by unauthorised persons. 49. Any person, who  (a)     not being the holder of a licence granted therefor by the Board under section 42(1), exports, or makes a contract for the export of padi or rice or any other product of padi;  (b)      being the holder of a licence granted under section 42(1) makes a contract for or involving the export of padi or rice or any other product of padi  (i)       without obtaining the approval of the Board for the contract; or  (ii)      not in accordance with the terms and conditions approved by the Board;  (c)      being the holder of a licence granted under section  42(1),  exports  padi  or  rice  or  any other product of padi otherwise   than   in pursuance  of  a  contract  made  in accordance with section 43,L.R.O. 1/2012  LAWS OF GUYANA  34            Cap. 72:01            Guyana Rice Development Board    shall be  liable  to  a  fine  of  seventy-five  thousand  dollars and  to imprisonment for two years and the padi or rice, or other product of padi in respect of which the offence is committed shall be forfeited. General penalty. [6 of 1997] c. 82:01     Prosecution of offences.        Power of Minister to give directions.                Limitation provisions excluded.   Protection of officers etc., of Board.",
            "description": [
                {
                    "representation": "(a)",
                    "description": "not being the holder of a licence granted therefor by the Board under section 42(1), exports, or makes a contract for the export of padi or rice or any other product of padi;"
                },
                {
                    "representation": "(b)",
                    "description": "being the holder of a licence granted under section 42(1) makes a contract for or involving the export of padi or rice or any other product of padi"
                },
                {
                    "representation": "(i)",
                    "description": "without obtaining the approval of the Board for the contract; or"
                },
                {
                    "representation": "(c)",
                    "description": "being the holder of a licence granted under section  42(1),  exports  padi  or  rice  or  any other product of padi otherwise   than   in pursuance  of  a  contract  made  in accordance with section 43,L.R.O. 1/2012  LAWS OF GUYANA  34            Cap. 72:01            Guyana Rice Development Board    shall be  liable  to  a  fine  of  seventy-five  thousand  dollars and  to imprisonment for two years and the padi or rice, or other product of padi in respect of which the offence is committed shall be forfeited. General penalty. [6 of 1997] c. 82:01     Prosecution of offences.        Power of Minister to give directions.                Limitation provisions excluded.   Protection of officers etc., of Board."
                }
            ]
        }
    },
    {
        "act": "GUYANA RICE DEVELOPMENT BOARD ACT",
        "source": "https://mola.gov.gy/laws-of-guyana",
        "type": {
            "name": "section",
            "representation": "50",
            "title": "General penalty. ",
            "context": "GUYANA RICE DEVELOPMENT BOARD ACT under General penalty. 50. Everyone who is guilty of the contravention of any provision of this Act for which no penalty is otherwise expressly provided by this Act or the Customs Act shall be liable to a fine of fifteen thousand dollars or to imprisonment for one year.",
            "description": "Everyone who is guilty of the contravention of any provision of this Act for which no penalty is otherwise expressly provided by this Act or the Customs Act shall be liable to a fine of fifteen thousand dollars or to imprisonment for one year."
        }
    },
    {
        "act": "GUYANA RICE DEVELOPMENT BOARD ACT",
        "source": "https://mola.gov.gy/laws-of-guyana",
        "type": {
            "name": "section",
            "representation": "51",
            "title": "Prosecution of offences.  PART VIII MISCELLANEOUS  ",
            "context": "GUYANA RICE DEVELOPMENT BOARD ACT under Prosecution of offences.  PART VIII MISCELLANEOUS  51. Any offences created or penalty imposed by this Act may be prosecuted or recovered under the Summary Jurisdiction Acts.  PART VIII MISCELLANEOUS",
            "description": "Any offences created or penalty imposed by this Act may be prosecuted or recovered under the Summary Jurisdiction Acts.  PART VIII MISCELLANEOUS"
        }
    },
    {
        "act": "GUYANA RICE DEVELOPMENT BOARD ACT",
        "source": "https://mola.gov.gy/laws-of-guyana",
        "type": {
            "name": "section",
            "representation": "52",
            "title": "Power of Minister to give directions. ",
            "context": "GUYANA RICE DEVELOPMENT BOARD ACT under Power of Minister to give directions. 52.  (1) The Minister may give to the Board directions of a general character as to the policy to be followed by   it in the exercise and performance of its functions and the Board shall give effect to any such directions.  (2) The Board shall provide such facilities to the Minister as will enable him to verify any information furnished by it in pursuance of this section.  (3) The power of the Minister to give directions to the Board extends to the giving to it of specific directions as to the disposal of capital assets or as to the application of the proceeds of such disposals.",
            "description": [
                {
                    "representation": "(1)",
                    "description": "The Minister may give to the Board directions of a general character as to the policy to be followed by   it in the exercise and performance of its functions and the Board shall give effect to any such directions."
                },
                {
                    "representation": "(2)",
                    "description": "The Board shall provide such facilities to the Minister as will enable him to verify any information furnished by it in pursuance of this section."
                },
                {
                    "representation": "(3)",
                    "description": "The power of the Minister to give directions to the Board extends to the giving to it of specific directions as to the disposal of capital assets or as to the application of the proceeds of such disposals."
                }
            ]
        }
    },
    {
        "act": "GUYANA RICE DEVELOPMENT BOARD ACT",
        "source": "https://mola.gov.gy/laws-of-guyana",
        "type": {
            "name": "section",
            "representation": "53",
            "title": "Limitation provisions excluded. ",
            "context": "GUYANA RICE DEVELOPMENT BOARD ACT under Limitation provisions excluded. 53.  No statute of limitation shall apply to any action or suit brought by the Board or in respect of any property owned by it.",
            "description": "No statute of limitation shall apply to any action or suit brought by the Board or in respect of any property owned by it."
        }
    },
    {
        "act": "GUYANA RICE DEVELOPMENT BOARD ACT",
        "source": "https://mola.gov.gy/laws-of-guyana",
        "type": {
            "name": "section",
            "representation": "54",
            "title": "Protection of officers etc., of Board. ",
            "context": "GUYANA RICE DEVELOPMENT BOARD ACT under Protection of officers etc., of Board. 54.  Any officer or other employee of the Board, any person acting under the direction or authority of any suchL.R.O. 1/2012  LAWS OF GUYANA  Guyana Rice Development Board              Cap. 72:01              35     officer or other employee, or any other person, not being a member of  the  Board or  any committee constituted by  or under this Act exercising or purporting to exercise any function conferred by or under this Act, shall be entitled to the protection afforded by the Justices Protection Act. Annual report.                          Power to make regulations.",
            "description": "Any officer or other employee of the Board, any person acting under the direction or authority of any suchL.R.O. 1/2012  LAWS OF GUYANA  Guyana Rice Development Board              Cap. 72:01              35     officer or other employee, or any other person, not being a member of  the  Board or  any committee constituted by  or under this Act exercising or purporting to exercise any function conferred by or under this Act, shall be entitled to the protection afforded by the Justices Protection Act. Annual report.                          Power to make regulations."
        }
    },
    {
        "act": "GUYANA RICE DEVELOPMENT BOARD ACT",
        "source": "https://mola.gov.gy/laws-of-guyana",
        "type": {
            "name": "section",
            "representation": "55",
            "title": "Annual report. ",
            "context": "GUYANA RICE DEVELOPMENT BOARD ACT under Annual report. 55.  (1) The Board shall, not later than six months after the expiry of each accounting year, submit to the Minister a report containing  (a)   an  account  of  its  functioning throughout the preceding accounting year  in  such  detail  as  the  Minister may direct;  (b)      a  statement  of  the  accounts  of  the Board, audited in accordance with section",
            "description": [
                {
                    "representation": "(1)",
                    "description": "The Board shall, not later than six months after the expiry of each accounting year, submit to the Minister a report containing"
                },
                {
                    "representation": "(a)",
                    "description": "an  account  of  its  functioning throughout the preceding accounting year  in  such  detail  as  the  Minister may direct;"
                },
                {
                    "representation": "(b)",
                    "description": "a  statement  of  the  accounts  of  the Board, audited in accordance with section"
                }
            ]
        }
    },
    {
        "act": "GUYANA RICE DEVELOPMENT BOARD ACT",
        "source": "https://mola.gov.gy/laws-of-guyana",
        "type": {
            "name": "section",
            "representation": "56",
            "title": "Power to make regulations. ",
            "context": "GUYANA RICE DEVELOPMENT BOARD ACT under Power to make regulations. 56.   (1)   The   Minister   may   make   regulations   for carrying into effect the purposes of this Act.  (2) Without prejudice to the generality of the foregoing and in particular, the regulations may provide for all or any of the following matters (a)      the   manner   of   publication   under section 4 (4) of the grades of padi and rice and the standards for fixing the grades;  (b)      the  procedure  and  business  of  the Board,     or     of     any      committeeL.R.O. 1/2012  LAWS OF GUYANA  36            Cap. 72:01            Guyana Rice Development Board    constituted by or under any provision of this Act including the intervals at which its meetings shall be held and the quorum for its meetings;  (c)       the procedure relating to the levy and collection of fees by the Board under sections 21 and 45;  (d) the form in which and the conditions subject to which a licence may be issued  under  section  37(2),  and  the fees   payable  for   the   issue   of   the licence;  (e)       the form in which and the conditions, including the payment of fees, subject to which an appeal may be made under   section   39(1)   and   the   time within   which   the   appeal   may   be made;  (f) the form in which and the condition subject to which a   licence may be granted under section 42 and the fees payable for the grant of the licence;  (g)      any other matter which is required to be, or which may   be prescribed by the Minister by regulations made under this Act.  (3) The provisions of this section shall be without prejudice to the provisions of section",
            "description": [
                {
                    "representation": "(1)",
                    "description": "The   Minister   may   make   regulations   for carrying into effect the purposes of this Act."
                },
                {
                    "representation": "(2)",
                    "description": "Without prejudice to the generality of the foregoing and in particular, the regulations may provide for all or any of the following matters"
                },
                {
                    "representation": "(a)",
                    "description": "the   manner   of   publication   under section 4"
                },
                {
                    "representation": "(4)",
                    "description": "of the grades of padi and rice and the standards for fixing the grades;"
                },
                {
                    "representation": "(b)",
                    "description": "the  procedure  and  business  of  the Board,     or     of     any      committeeL.R.O. 1/2012  LAWS OF GUYANA  36            Cap. 72:01            Guyana Rice Development Board    constituted by or under any provision of this Act including the intervals at which its meetings shall be held and the quorum for its meetings;"
                },
                {
                    "representation": "(c)",
                    "description": "the procedure relating to the levy and collection of fees by the Board under sections 21 and 45;"
                },
                {
                    "representation": "(d)",
                    "description": "the form in which and the conditions subject to which a licence may be issued  under  section  37(2),  and  the fees   payable  for   the   issue   of   the licence;"
                },
                {
                    "representation": "(e)",
                    "description": "the form in which and the conditions, including the payment of fees, subject to which an appeal may be made under   section   39(1)   and   the   time within   which   the   appeal   may   be made;"
                },
                {
                    "representation": "(f)",
                    "description": "the form in which and the condition subject to which a   licence may be granted under section 42 and the fees payable for the grant of the licence;"
                },
                {
                    "representation": "(g)",
                    "description": "any other matter which is required to be, or which may   be prescribed by the Minister by regulations made under this Act."
                },
                {
                    "representation": "(3)",
                    "description": "The provisions of this section shall be without prejudice to the provisions of section"
                }
            ]
        }
    },
    {
        "act": "GUYANA RICE DEVELOPMENT BOARD ACT",
        "source": "https://mola.gov.gy/laws-of-guyana",
        "type": {
            "name": "section",
            "representation": "57",
            "title": "Power of Board to make rules.  PART IX TRANSITIONAL PROVISIONS SECTION  ",
            "context": "GUYANA RICE DEVELOPMENT BOARD ACT under Power of Board to make rules.  PART IX TRANSITIONAL PROVISIONS SECTION  57.  (1) The  Board  may,  subject to this  Act  and  any regulations made thereunder, make rules to provide for all or any of the following mattersL.R.O. 1/2012  LAWS OF GUYANA  Guyana Rice Development Board              Cap. 72:01              37      (a)      the   procedure   and   business   of   a committee appointed under    section 15 (1), including the intervals at which its  meetings  shall  be  held  and  the quorum for its meetings;  (b)      the  procedure  and  business  of  the Board.  (2) The Board may, subject to  this Act and any regulations made thereunder, make rules to provide for the procedure and business of the Board.  PART IX TRANSITIONAL PROVISIONS Dissolution of Export Board and Centre and transitional provisions in relation thereto. [1 of 1985]",
            "description": [
                {
                    "representation": "(1)",
                    "description": "The  Board  may,  subject to this  Act  and  any regulations made thereunder, make rules to provide for all or any of the following mattersL.R.O. 1/2012  LAWS OF GUYANA  Guyana Rice Development Board              Cap. 72:01              37"
                },
                {
                    "representation": "(a)",
                    "description": "the   procedure   and   business   of   a committee appointed under    section 15"
                },
                {
                    "representation": "(b)",
                    "description": "the  procedure  and  business  of  the Board."
                },
                {
                    "representation": "(2)",
                    "description": "The Board may, subject to  this Act and any regulations made thereunder, make rules to provide for the procedure and business of the Board.  PART IX TRANSITIONAL PROVISIONS Dissolution of Export Board and Centre and transitional provisions in relation thereto. [1 of 1985]"
                }
            ]
        }
    },
    {
        "act": "GUYANA RICE DEVELOPMENT BOARD ACT",
        "source": "https://mola.gov.gy/laws-of-guyana",
        "type": {
            "name": "section",
            "representation": "58",
            "title": "Dissolution of Export Board and Centre and transitional provisions in relation thereto. ",
            "context": "GUYANA RICE DEVELOPMENT BOARD ACT under Dissolution of Export Board and Centre and transitional provisions in relation thereto. 58. (1) From the appointment day the Export Board and the Centre shall stand dissolved and the provisions of the Rice  (Regulation of  Manufacturing   and    Marketing)    Act 1985 referred to in section 59(1) repealed.  (2) All property whether movable or immovable (including rights and interests therein) of the Centre and Export  Board  is  hereby  vested  in  the  Board  from  the appointed day and in respect of such immovable property so vested in the Board, the Registrar of Deeds shall take due notice thereof and shall make such annotations in the records as may be necessary.  (3)The liabilities incurred   by the   Export   Board and Centre prior to, and subsisting immediately before, the appointed day shall be  discharged  by,  and  be  enforceable against,   the   Board   as   if   the   said liabilities had been incurred by the Board.  (4) All contacts, deeds, bonds, overdrafts, guarantees,   agreements   or   other   instruments   or   otherL.R.O. 1/2012  LAWS OF GUYANA  38            Cap. 72:01            Guyana Rice Development Board    documents, which  were  subsisting immediately before  the appointed and relating to the assets and liabilities of Export Board and Centre, shall be of full force and effect against or in favour  of   the   Board,  and   be   enforceable  as   fully  and effectually as if, instead of the Export Board and the Centre, the  Board  had  been  named  therein  or  had  been  a  party thereto.  (5) All actions or other proceedings commenced before the appointed day, for the enforcement of any right relating to any asset or liability which is transferred to the Board by this Act, and to which the Centre or the   Export Board is a party, may be continued by or against the Board, and such actions or other proceedings may be amended accordingly.  (6) Notwithstanding anything contained in this Act or any  other written law or contract, the appointments of all the officers and employees employed  by  the  Export  Board and  the  Centre  immediately before  the appointed day shall stand terminated with effect from that day:  Provided that the Board may if it is of the opinion that it is necessary for the purpose of carrying out the functions conferred upon it by this Act, employ from the appointed day, any of the persons, whose appointment is so terminated, as in its opinion are qualified and other wise suitable for such employment, on terms and conditions as may be agreed upon between the Board and the person so employed, and, which taken as a whole are no less favourable than those applicable to him immediately before that date and shall in respect of any person so  employed be the successor of the Centre and Export Board with   regard to his   level or superannuation rights or benefits whether accrued, earned, inchoate or contingent. Repeal and savings. [1 of 1985 3 of 2007]",
            "description": [
                {
                    "representation": "(1)",
                    "description": "repealed."
                },
                {
                    "representation": "(2)",
                    "description": "All property whether movable or immovable"
                },
                {
                    "representation": "(4)",
                    "description": "All contacts, deeds, bonds, overdrafts, guarantees,   agreements   or   other   instruments   or   otherL.R.O. 1/2012  LAWS OF GUYANA  38            Cap. 72:01            Guyana Rice Development Board    documents, which  were  subsisting immediately before  the appointed and relating to the assets and liabilities of Export Board and Centre, shall be of full force and effect against or in favour  of   the   Board,  and   be   enforceable  as   fully  and effectually as if, instead of the Export Board and the Centre, the  Board  had  been  named  therein  or  had  been  a  party thereto."
                },
                {
                    "representation": "(5)",
                    "description": "All actions or other proceedings commenced before the appointed day, for the enforcement of any right relating to any asset or liability which is transferred to the Board by this Act, and to which the Centre or the   Export Board is a party, may be continued by or against the Board, and such actions or other proceedings may be amended accordingly."
                },
                {
                    "representation": "(6)",
                    "description": "Notwithstanding anything contained in this Act or any  other written law or contract, the appointments of all the officers and employees employed  by  the  Export  Board and  the  Centre  immediately before  the appointed day shall stand terminated with effect from that day:  Provided that the Board may if it is of the opinion that it is necessary for the purpose of carrying out the functions conferred upon it by this Act, employ from the appointed day, any of the persons, whose appointment is so terminated, as in its opinion are qualified and other wise suitable for such employment, on terms and conditions as may be agreed upon between the Board and the person so employed, and, which taken as a whole are no less favourable than those applicable to him immediately before that date and shall in respect of any person so  employed be the successor of the Centre and Export Board with   regard to his   level or superannuation rights or benefits whether accrued, earned, inchoate or contingent. Repeal and savings. [1 of 1985 3 of 2007]"
                }
            ]
        }
    },
    {
        "act": "GUYANA RICE DEVELOPMENT BOARD ACT",
        "source": "https://mola.gov.gy/laws-of-guyana",
        "type": {
            "name": "section",
            "representation": "59",
            "title": "Repeal and savings. ",
            "context": "GUYANA RICE DEVELOPMENT BOARD ACT under Repeal and savings. 59.  (1)  The  provisions  of  the  Rice  (Regulation  of Manufacturing and  Marketing) Act  1985 in  so  far  as  theyL.R.O. 1/2012  LAWS OF GUYANA  Guyana Rice Development Board              Cap. 72:01              39     relate to the National Padi and Rice Grading Centre and the Guyana Rice Export Board are hereby repealed.  (2)   [Repealed by Act No. 3 of 2007]   (3)   The   Minister  may   by   order,  dissolve  the Authority   and   transfer   its   assets   and   liabilities   to   a corporation incorporated under the Public Corporations Act 1988 or to any other corporate body, including a company incorporated under the Companies Act, in which the controlling interest is vested in the State or in any agency on behalf of the State, and such order may contain such provisions relating to monetary arrangements, the preservation of rights and liabilities existing immediately before  the dissolution as  well  as  such  other  provisions  as the   Minister   considers necessary or expedient to give full effect to the dissolution, and upon the coming into force of such an order, the Authority shall stand dissolved and the provisions  of  the  Rice  (Regulations of  Manufacturing and Marketing) Act 1985 in so far as they relate to the Authority, repealed.  (4)    Where    immovable    property    has    been transferred under subsection (3), the Registrar of Deeds shall take due notice thereof and shall make such annotations on the records as may be necessary.   Construction of references to Centre or Export Board in any other written law.",
            "description": [
                {
                    "representation": "(1)",
                    "description": "The  provisions  of  the  Rice"
                },
                {
                    "representation": "(2)",
                    "description": "[Repealed by Act No. 3 of 2007]"
                },
                {
                    "representation": "(3)",
                    "description": "The   Minister  may   by   order,  dissolve  the Authority   and   transfer   its   assets   and   liabilities   to   a corporation incorporated under the Public Corporations Act 1988 or to any other corporate body, including a company incorporated under the Companies Act, in which the controlling interest is vested in the State or in any agency on behalf of the State, and such order may contain such provisions relating to monetary arrangements, the preservation of rights and liabilities existing immediately before  the dissolution as  well  as  such  other  provisions  as the   Minister   considers necessary or expedient to give full effect to the dissolution, and upon the coming into force of such an order, the Authority shall stand dissolved and the provisions  of  the  Rice"
                },
                {
                    "representation": "(4)",
                    "description": "Where    immovable    property    has    been transferred under subsection"
                }
            ]
        }
    },
    {
        "act": "GUYANA RICE DEVELOPMENT BOARD ACT",
        "source": "https://mola.gov.gy/laws-of-guyana",
        "type": {
            "name": "section",
            "representation": "60",
            "title": "Construction of references to Centre or Export Board in any other written law. ",
            "context": "GUYANA RICE DEVELOPMENT BOARD ACT under Construction of references to Centre or Export Board in any other written law. 60. A reference in any other written law to the Centre or the Export Board shall be construed as a reference to the Board. Power to remove difficulties. [ 1 of 1985]",
            "description": "A reference in any other written law to the Centre or the Export Board shall be construed as a reference to the Board. Power to remove difficulties. [ 1 of 1985]"
        }
    },
    {
        "act": "GUYANA RICE DEVELOPMENT BOARD ACT",
        "source": "https://mola.gov.gy/laws-of-guyana",
        "type": {
            "name": "section",
            "representation": "61",
            "title": "Power to remove difficulties. SCHEDULEL.R.O. 1/2012  LAWS OF GUYANA  6              Cap. 72:01            Guyana Rice Development Board   CHAPTER 72:01  GUYANA RICE DEVELOPMENT BOARD ACT     15 of 1994              An Act to provide for the regulation of the manufacture and marketing of rice, for securing effectively the development of the rice industry through the establishment   of   the   Guyana   Rice   Development Board,  and  for  matters  connected therewith.  [10TH OCTOBER, 1994]  PART I PRELIMINARY   Short title. Interpretation. ",
            "context": "GUYANA RICE DEVELOPMENT BOARD ACT under Power to remove difficulties. SCHEDULEL.R.O. 1/2012  LAWS OF GUYANA  6              Cap. 72:01            Guyana Rice Development Board   CHAPTER 72:01  GUYANA RICE DEVELOPMENT BOARD ACT     15 of 1994              An Act to provide for the regulation of the manufacture and marketing of rice, for securing effectively the development of the rice industry through the establishment   of   the   Guyana   Rice   Development Board,  and  for  matters  connected therewith.  [10TH OCTOBER, 1994]  PART I PRELIMINARY   Short title. Interpretation. 61. The Minister may, for the purpose of removing any difficulty  in  giving  effect  to  the  provisions  of  this Act,   particularly   in relation to the transition from the provisions  of  the  Rice  (Regulation  of  Manufacturing  andL.R.O. 1/2012  LAWS OF GUYANA  40            Cap. 72:01            Guyana Rice Development Board     Marketing) Act 1985 to the provisions of this Act, make such order  or  give  such  direction,  not  inconsistent  with  the provisions of this Act, as appears to him to be necessary or expedient for the purpose of removing the difficulty:  Provided  that  no  such  order  or  direction  shall  be made or given after the expiry of one year from the commencement of this Act.       SCHEDULE  FLOATING CHARGE IN FAVOUR OF A BANK  In consideration of advances to be made from time to time by ...........................................................(hereinafter called the Bank) to the Guyana Rice Development Board (hereinafter called    the        Board)   to    an    amount    not    exceeding $.................................................................................................. .......... .............................................................................................................. .....................................or (by way of overdraft on current account   with the   Bank in such amounts as the Board may require, provided that the total outstanding amount of such overdraft shall not at any time exceed $...................) the Board, under and by virtue of section 27 of the Guyana Rice Development Board  Act,  hereby  assigns  to  and  in  favour of  the Bank all       buildings, structures or  other  erections, padi and rice and other products of padi, agricultural and other  machinery and equipment, bags, thread or twine now or which may hereafter be in the ownership of  the Board  at .................................................................................in the County of ...................................................................in Guyana.  Dated this                 day of      , 20L.R.O. 1/2012  LAWS OF GUYANA Guyana Rice Development Board Cap. 72:01              41     SUBSIDIARY LEGISLATION      Reg. 8/ 2007 1/2008 GUYANA RICE DEVELOPMENT BOARD (PADI AND RICE GRADING) REGULATIONS  made under section 56     ARRANGEMENT OF REGULATIONS REGULATION",
            "description": "The Minister may, for the purpose of removing any difficulty  in  giving  effect  to  the  provisions  of  this Act,   particularly   in relation to the transition from the provisions  of  the  Rice  (Regulation  of  Manufacturing  andL.R.O. 1/2012  LAWS OF GUYANA  40            Cap. 72:01            Guyana Rice Development Board     Marketing) Act 1985 to the provisions of this Act, make such order  or  give  such  direction,  not  inconsistent  with  the provisions of this Act, as appears to him to be necessary or expedient for the purpose of removing the difficulty:  Provided  that  no  such  order  or  direction  shall  be made or given after the expiry of one year from the commencement of this Act.       SCHEDULE  FLOATING CHARGE IN FAVOUR OF A BANK  In consideration of advances to be made from time to time by ...........................................................(hereinafter called the Bank) to the Guyana Rice Development Board (hereinafter called    the        Board)   to    an    amount    not    exceeding $.................................................................................................. .......... .............................................................................................................. .....................................or (by way of overdraft on current account   with the   Bank in such amounts as the Board may require, provided that the total outstanding amount of such overdraft shall not at any time exceed $...................) the Board, under and by virtue of section 27 of the Guyana Rice Development Board  Act,  hereby  assigns  to  and  in  favour of  the Bank all       buildings, structures or  other  erections, padi and rice and other products of padi, agricultural and other  machinery and equipment, bags, thread or twine now or which may hereafter be in the ownership of  the Board  at .................................................................................in the County of ...................................................................in Guyana.  Dated this                 day of      , 20L.R.O. 1/2012  LAWS OF GUYANA Guyana Rice Development Board Cap. 72:01              41     SUBSIDIARY LEGISLATION      Reg. 8/ 2007 1/2008 GUYANA RICE DEVELOPMENT BOARD (PADI AND RICE GRADING) REGULATIONS  made under section 56     ARRANGEMENT OF REGULATIONS REGULATION"
        }
    },
    {
        "act": "GUYANA RICE DEVELOPMENT BOARD ACT",
        "source": "https://mola.gov.gy/laws-of-guyana",
        "type": {
            "name": "section",
            "representation": "",
            "title": "300.00 Cargo Rice 25 ",
            "context": "GUYANA RICE DEVELOPMENT BOARD ACT under 300.00 Cargo Rice 25 300.00 Cargo Rice 50",
            "description": "300.00 Cargo Rice 50"
        }
    },
    {
        "act": "GUYANA RICE DEVELOPMENT BOARD ACT",
        "source": "https://mola.gov.gy/laws-of-guyana",
        "type": {
            "name": "section",
            "representation": "",
            "title": "500.00 Padi Dehulling ",
            "context": "GUYANA RICE DEVELOPMENT BOARD ACT under 500.00 Padi Dehulling 500.00 Milled Rice 25",
            "description": "500.00 Milled Rice 25"
        }
    },
    {
        "act": "GUYANA RICE DEVELOPMENT BOARD ACT",
        "source": "https://mola.gov.gy/laws-of-guyana",
        "type": {
            "name": "section",
            "representation": "",
            "title": "1000.00 Padi Analysis ",
            "context": "GUYANA RICE DEVELOPMENT BOARD ACT under 1000.00 Padi Analysis 1000.00 Cargo Rice 75",
            "description": "1000.00 Cargo Rice 75"
        }
    },
    {
        "act": "GUYANA RICE DEVELOPMENT BOARD ACT",
        "source": "https://mola.gov.gy/laws-of-guyana",
        "type": {
            "name": "section",
            "representation": "",
            "title": "1500.00 Cargo Rice ",
            "context": "GUYANA RICE DEVELOPMENT BOARD ACT under 1500.00 Cargo Rice 1500.00 Milled Rice",
            "description": "1500.00 Milled Rice"
        }
    }
]