[
    {
        "act": "GENERAL LOANS (INTERNATIONAL BANK) ACT",
        "source": "https://mola.gov.gy/laws-of-guyana",
        "type": {
            "name": "section",
            "representation": "1",
            "title": "Short title. ",
            "context": "GENERAL LOANS (INTERNATIONAL BANK) ACT under Short title. 1. This Act may be cited as the General Loans (International Bank) Act.",
            "description": "This Act may be cited as the General Loans (International Bank) Act."
        }
    },
    {
        "act": "GENERAL LOANS (INTERNATIONAL BANK) ACT",
        "source": "https://mola.gov.gy/laws-of-guyana",
        "type": {
            "name": "section",
            "representation": "2",
            "title": "Interpretation. ",
            "context": "GENERAL LOANS (INTERNATIONAL BANK) ACT under Interpretation. 2.  In this Act  Development Fund means the Fund established by section 15(1) of the Financial Administration and Audit Act;  International Bank means the International Bank for LAWS OF GUYANA 4 Cap. 74:06                                                               General Loans (International Bank)                                     L.R.O. 1/2012                Borrowing  from International Bank.                                  Reconstruction and Development;  loan allocation  means  that  amount  of  a  loan  which  has  been borrowed  under  the  powers  conferred  by  section  3(1)  for  the requirements of a statutory corporation;  statutory corporation means a body incorporated by Act.",
            "description": [
                {
                    "representation": "(1)",
                    "description": "for  the requirements of a statutory corporation;  statutory corporation means a body incorporated by Act."
                }
            ]
        }
    },
    {
        "act": "GENERAL LOANS (INTERNATIONAL BANK) ACT",
        "source": "https://mola.gov.gy/laws-of-guyana",
        "type": {
            "name": "section",
            "representation": "3",
            "title": "Borrowing from International Bank. ",
            "context": "GENERAL LOANS (INTERNATIONAL BANK) ACT under Borrowing from International Bank. 3. (1) Subject to this Act, the Minister may, in such manner and on such terms and subject to such conditions as he thinks fit, and in the name of the Government of Guyana, borrow from the International Bank   such   sums   as   may   be   required   by   the Government, the  Government  and  a  statutory  corporation,  or  a statutory corporation.  (2) Any sums borrowed in the name of the Government of Guyana under the powers conferred by subsection (1) for the requirements  of the  Government  are hereby  appropriated to  and shall be applied for the purposes for which they were borrowed as specified in any agreement concluded with the International Bank in respect of the sums so borrowed:  Provided that where any part of such sums cannot be applied to the purposes aforesaid, such part may be applied to such other purposes as may be approved of by the Minister and by the International Bank.  (3) The loan allocation of a statutory corporation shall be paid by the Accountant General to the statutory corporation out of the   Development   Fund,   which is  hereby   appropriated  to   the purpose.  (4) The power to borrow conferred by subsection (1) shall be in addition to the power to borrow conferred by any other Act. (5) A copy of any agreement concluded with the LAWS OF GUYANA                                                                                                                                                                                   General Loans (International Bank)                                 Cap. 74:06 5  L.R.O. 1/2012          Payments by a statutory corporation.         Sums borrowed and interest and other charges to be part of public debt. c. 1:01 [O. 80/1980]                   International Bank in respect of any sums borrowed under subsection (1) shall be laid  before  the  National  Assembly  within fourteen days of the  conclusion thereof  or,  if  the  National Assembly  is  not  then  sitting,  within  fourteen  days after the commencement of the next ensuing session.",
            "description": [
                {
                    "representation": "(1)",
                    "description": "shall be laid  before  the  National  Assembly  within fourteen days of the  conclusion thereof  or,  if  the  National Assembly  is  not  then  sitting,  within  fourteen  days after the commencement of the next ensuing session."
                },
                {
                    "representation": "(2)",
                    "description": "Any sums borrowed in the name of the Government of Guyana under the powers conferred by subsection"
                },
                {
                    "representation": "(3)",
                    "description": "The loan allocation of a statutory corporation shall be paid by the Accountant General to the statutory corporation out of the   Development   Fund,   which is  hereby   appropriated  to   the purpose."
                },
                {
                    "representation": "(4)",
                    "description": "The power to borrow conferred by subsection"
                },
                {
                    "representation": "(5)",
                    "description": "A copy of any agreement concluded with the LAWS OF GUYANA                                                                                                                                                                                   General Loans"
                }
            ]
        }
    },
    {
        "act": "GENERAL LOANS (INTERNATIONAL BANK) ACT",
        "source": "https://mola.gov.gy/laws-of-guyana",
        "type": {
            "name": "section",
            "representation": "4",
            "title": "Payments by a statutory corporation. ",
            "context": "GENERAL LOANS (INTERNATIONAL BANK) ACT under Payments by a statutory corporation. 4. A statutory corporation shall pay to the Accountant General in respect of its loan allocation its share of interest and the other charges payable thereon, and, if and when required to do so by the Minister its share of amortization charges in respect of the loan allocation.   Such share shall be calculated on the proportion which such loan allocation bears to the loan.",
            "description": "A statutory corporation shall pay to the Accountant General in respect of its loan allocation its share of interest and the other charges payable thereon, and, if and when required to do so by the Minister its share of amortization charges in respect of the loan allocation.   Such share shall be calculated on the proportion which such loan allocation bears to the loan."
        }
    },
    {
        "act": "GENERAL LOANS (INTERNATIONAL BANK) ACT",
        "source": "https://mola.gov.gy/laws-of-guyana",
        "type": {
            "name": "section",
            "representation": "5",
            "title": "Sums borrowed and interest and other charges to be part of public debt. ",
            "context": "GENERAL LOANS (INTERNATIONAL BANK) ACT under Sums borrowed and interest and other charges to be part of public debt. 5. (1) All sums borrowed under the powers conferred by section 3(1), and all interest and all other charges payable thereon respectively, shall be part of the public debt of Guyana within the meaning of article 221 of the Constitution.  (2) The Accountant General shall  (a)  repay out of the Consolidated Fund such sum or sums as  may  be  necessary  for  securing  repayment  of  any  sum  so borrowed  in  accordance  with  the  amortization  charges thereon; and   (b)  pay out of the Consolidated Fund such sum or sums as may be necessary for securing payment of interest on any sum so borrowed and of all other charges payable in respect thereof.",
            "description": [
                {
                    "representation": "(1)",
                    "description": "All sums borrowed under the powers conferred by section 3(1), and all interest and all other charges payable thereon respectively, shall be part of the public debt of Guyana within the meaning of article 221 of the Constitution."
                },
                {
                    "representation": "(2)",
                    "description": "The Accountant General shall"
                },
                {
                    "representation": "(a)",
                    "description": "repay out of the Consolidated Fund such sum or sums as  may  be  necessary  for  securing  repayment  of  any  sum  so borrowed  in  accordance  with  the  amortization  charges thereon; and"
                },
                {
                    "representation": "(b)",
                    "description": "pay out of the Consolidated Fund such sum or sums as may be necessary for securing payment of interest on any sum so borrowed and of all other charges payable in respect thereof."
                }
            ]
        }
    },
    {
        "act": "GENERAL LOANS (INTERNATIONAL BANK) ACT",
        "source": "https://mola.gov.gy/laws-of-guyana",
        "type": {
            "name": "section",
            "representation": "6",
            "title": "Payment to be made by statutory corporation to be charged on general revenues and assets of corporation. ",
            "context": "GENERAL LOANS (INTERNATIONAL BANK) ACT under Payment to be made by statutory corporation to be charged on general revenues and assets of corporation. 6. (1) All interest and all other charges payable in respect of any loan allocation which has been paid to a corporation to statutory made by Payment to be  LAWS OF GUYANA 6 Cap. 74:06                                                               General Loans (International Bank)                                     L.R.O. 1/2012  be charged on general revenues and assets of corporation.              Repayment of sums paid under guarantee. [O. 80/1980]                       statutory corporation together with any amortization charges in respect of such loan allocations that may be required to be paid in pursuance of section 4 are hereby charged on and shall be paid out of the general revenues and assets of the statutory corporation and any other revenues or assets which may be made available for the purpose.  (2) Without derogation from the provisions of subsection (1) and  notwithstanding  anything  contained  in  the  Act  by  which a statutory   corporation   is   established,   a   statutory   corporation may mortgage any  of  its property, whether movable or immovable, to secure any sums owing to the International Bank in respect of sums borrowed for its requirements under this Act.",
            "description": [
                {
                    "representation": "(1)",
                    "description": "and  notwithstanding  anything  contained  in  the  Act  by  which a statutory   corporation   is   established,   a   statutory   corporation may mortgage any  of  its property, whether movable or immovable, to secure any sums owing to the International Bank in respect of sums borrowed for its requirements under this Act."
                },
                {
                    "representation": "(2)",
                    "description": "Without derogation from the provisions of subsection"
                }
            ]
        }
    },
    {
        "act": "GENERAL LOANS (INTERNATIONAL BANK) ACT",
        "source": "https://mola.gov.gy/laws-of-guyana",
        "type": {
            "name": "section",
            "representation": "7",
            "title": "Repayment of sums paid under guarantee. ",
            "context": "GENERAL LOANS (INTERNATIONAL BANK) ACT under Repayment of sums paid under guarantee. 7. (1) Any sum paid out of the Consolidated Fund of the United Kingdom on account of any guarantee given in respect of any sum borrowed under the powers conferred by section 3(1), with interest thereon at such rates as the Treasury of the Government of the United Kingdom may fix in consultation with the Minister, shall be part of the public  debt of Guyana within the meaning of article 221  of  the  Constitution and  shall  be  repaid  by  the  Accountant General to the Treasury of the Government of the United Kingdom out of the said Consolidated Fund, which is hereby appropriated to the purpose.  (2) Any sum repaid to the Treasury of the Government of the United Kingdom out of the Consolidated Fund of Guyana in terms of subsection (1) in respect of any loan allotted to a statutory corporation in accordance with section 3(3) is hereby charged on and shall be repaid to the Accountant General out of the general revenues and assets of the statutory corporation and any other revenues or assets which may be made available for the purpose.",
            "description": [
                {
                    "representation": "(1)",
                    "description": "in respect of any loan allotted to a statutory corporation in accordance with section 3(3) is hereby charged on and shall be repaid to the Accountant General out of the general revenues and assets of the statutory corporation and any other revenues or assets which may be made available for the purpose."
                },
                {
                    "representation": "(2)",
                    "description": "Any sum repaid to the Treasury of the Government of the United Kingdom out of the Consolidated Fund of Guyana in terms of subsection"
                }
            ]
        }
    },
    {
        "act": "GENERAL LOANS (INTERNATIONAL BANK) ACT",
        "source": "https://mola.gov.gy/laws-of-guyana",
        "type": {
            "name": "section",
            "representation": "8",
            "title": "Power to issue instruments, including bonds. ",
            "context": "GENERAL LOANS (INTERNATIONAL BANK) ACT under Power to issue instruments, including bonds. 8. Notwithstanding anything contained in any Act, including bonds. instruments, Power to issue  LAWS OF GUYANA                                                                                                                                                                                   General Loans (International Bank)                                 Cap. 74:06 7  L.R.O. 1/2012      Implementa- tion of obligations under agreements.                  the Minister may issue such instruments, including bonds, as may be necessary for the purposes of any agreement which may be entered into with the International Bank in respect of the borrowing authorised by section 3(1).",
            "description": "Notwithstanding anything contained in any Act, including bonds. instruments, Power to issue  LAWS OF GUYANA                                                                                                                                                                                   General Loans (International Bank)                                 Cap. 74:06 7  L.R.O. 1/2012      Implementa- tion of obligations under agreements.                  the Minister may issue such instruments, including bonds, as may be necessary for the purposes of any agreement which may be entered into with the International Bank in respect of the borrowing authorised by section 3(1)."
        }
    }
]