[
    {
        "act": "STATE ENTERPRISES (GUARANTEE) ACT",
        "source": "https://mola.gov.gy/laws-of-guyana",
        "type": {
            "name": "section",
            "representation": "1",
            "title": "Short title. ",
            "context": "STATE ENTERPRISES (GUARANTEE) ACT under Short title. 1. This Act may be cited as the State Enterprises (Guarantee) Act.",
            "description": "This Act may be cited as the State Enterprises (Guarantee) Act."
        }
    },
    {
        "act": "STATE ENTERPRISES (GUARANTEE) ACT",
        "source": "https://mola.gov.gy/laws-of-guyana",
        "type": {
            "name": "section",
            "representation": "2",
            "title": "Interpretation. ",
            "context": "STATE ENTERPRISES (GUARANTEE) ACT under Interpretation. 2.  In this Act  lending agency means an international financial organisation or any bank, insurance company or other source of financing;  Minister means the Minister responsible for finance;  ordinary share capital means all the issued share capital by whatever name called, other than capital the holders whereof have right to a dividend at a fixed rate, but have LAWS OF GUYANA 4 Cap. 77:03                                                                                 State Enterprises (Guarantee)                                      L.R.O. 1/2012           c. 82:01     c. 88:01           Sums charged on  Consolidated Fund.                 Application of provisions of  the Guarantee  of Loans no other rights to share in the profits of the company;  regional  institution  means  any  institution  or  organisation  the members of which include Guyana and any of the other Member States of the Caribbean Community mentioned in Part II of the First Schedule to the Customs Act;  registered society means a co-operative society registered under the Co-operative Societies Act;  state enterprise means any public corporation as may be designated for  the purposes of this Act by order of the Minister or any company incorporated in Guyana in which the State through any of its agencies holds at least fifty-one per cent of the ordinary share capital thereof or any regional institution.",
            "description": "In this Act  lending agency means an international financial organisation or any bank, insurance company or other source of financing;  Minister means the Minister responsible for finance;  ordinary share capital means all the issued share capital by whatever name called, other than capital the holders whereof have right to a dividend at a fixed rate, but have LAWS OF GUYANA 4 Cap. 77:03                                                                                 State Enterprises (Guarantee)                                      L.R.O. 1/2012           c. 82:01     c. 88:01           Sums charged on  Consolidated Fund.                 Application of provisions of  the Guarantee  of Loans no other rights to share in the profits of the company;  regional  institution  means  any  institution  or  organisation  the members of which include Guyana and any of the other Member States of the Caribbean Community mentioned in Part II of the First Schedule to the Customs Act;  registered society means a co-operative society registered under the Co-operative Societies Act;  state enterprise means any public corporation as may be designated for  the purposes of this Act by order of the Minister or any company incorporated in Guyana in which the State through any of its agencies holds at least fifty-one per cent of the ordinary share capital thereof or any regional institution."
        }
    },
    {
        "act": "STATE ENTERPRISES (GUARANTEE) ACT",
        "source": "https://mola.gov.gy/laws-of-guyana",
        "type": {
            "name": "section",
            "representation": "3",
            "title": "Sums charged on the Consolidated Fund. ",
            "context": "STATE ENTERPRISES (GUARANTEE) ACT under Sums charged on the Consolidated Fund. 3. (1) Where the Government, acting under the authority of a resolution of the National Assembly, enters into an agreement with a lending agency guaranteeing the repayment to that agency of monies advanced or expended by that agency to or for the benefit of a state enterprise or a registered society, those monies shall be charged on the Consolidated Fund  if  they  become  payable  by  the  Government pursuant to the guarantee.  (2) Subsection (1) imposing a charge on the Consolidated Fund applies  to  any  monies  becoming  payable  by  the  Government  as principal obligor to a lending agency by virtue of an agreement entered into  between  that  agency  and  the  Government  acting  under  the authority of a resolution of the National Assembly.",
            "description": [
                {
                    "representation": "(1)",
                    "description": "imposing a charge on the Consolidated Fund applies  to  any  monies  becoming  payable  by  the  Government  as principal obligor to a lending agency by virtue of an agreement entered into  between  that  agency  and  the  Government  acting  under  the authority of a resolution of the National Assembly."
                },
                {
                    "representation": "(2)",
                    "description": "Subsection"
                }
            ]
        }
    },
    {
        "act": "STATE ENTERPRISES (GUARANTEE) ACT",
        "source": "https://mola.gov.gy/laws-of-guyana",
        "type": {
            "name": "section",
            "representation": "4",
            "title": "Application of provisions of the Guarantee of Loans (Public Corporations and Companies) Act. ",
            "context": "STATE ENTERPRISES (GUARANTEE) ACT under Application of provisions of the Guarantee of Loans (Public Corporations and Companies) Act. 4. Sections 5, 6(1) and 7 of the Guarantee of Loans (Public Corporations and Companies) Act, as they apply to a guarantee given under that Act, apply mutatis mutandis to a LAWS OF GUYANA                                                                                                                                                                                   State Enterprises (Guarantee)                                  Cap. 77:03 5  L.R.O. 1/2012  (Public Corporations and  Companies)  Act. [31 of 1975] c. 77:01  Regulations.      guarantee referred to in section 3 and for that purpose references in that Act to a Corporation shall be construed and have effect as references to a state enterprise (not being  a regional institution) or a registered society, as the case may be.",
            "description": [
                {
                    "representation": "(1)",
                    "description": "and 7 of the Guarantee of Loans"
                }
            ]
        }
    }
]