[
    {
        "act": "STATE PLANNING COMMISSION ACT",
        "source": "https://mola.gov.gy/laws-of-guyana",
        "type": {
            "name": "section",
            "representation": "1",
            "title": "Short title. ",
            "context": "STATE PLANNING COMMISSION ACT under Short title. 1.  This Act may be cited as the State Planning Commission Act.",
            "description": "This Act may be cited as the State Planning Commission Act."
        }
    },
    {
        "act": "STATE PLANNING COMMISSION ACT",
        "source": "https://mola.gov.gy/laws-of-guyana",
        "type": {
            "name": "section",
            "representation": "2",
            "title": "Interpretation. ",
            "context": "STATE PLANNING COMMISSION ACT under Interpretation. 2.  In this Act LAWS OF GUYANA 4 Cap. 78:02 State Planning Commission  L.R.O. 1/2012  [O. 80/1980]         Establishment  of a State Planning Commission as a body corporate. [3 of 1978]                  Functions of the Commission.  [3 of 1978]             authorised officer means any employee of the Commission who is duly authorised by the Commission to exact the performance of, or to perform, the act referred to;  the Commission means the State Planning Commission established pursuant to section",
            "description": "In this Act LAWS OF GUYANA 4 Cap. 78:02 State Planning Commission  L.R.O. 1/2012  [O. 80/1980]         Establishment  of a State Planning Commission as a body corporate. [3 of 1978]                  Functions of the Commission.  [3 of 1978]             authorised officer means any employee of the Commission who is duly authorised by the Commission to exact the performance of, or to perform, the act referred to;  the Commission means the State Planning Commission established pursuant to section"
        }
    },
    {
        "act": "STATE PLANNING COMMISSION ACT",
        "source": "https://mola.gov.gy/laws-of-guyana",
        "type": {
            "name": "section",
            "representation": "3",
            "title": "Establishment of  a  State  Planning  Commission  as  a  body corporate. ",
            "context": "STATE PLANNING COMMISSION ACT under Establishment of  a  State  Planning  Commission  as  a  body corporate. 3.",
            "description": "3."
        }
    },
    {
        "act": "STATE PLANNING COMMISSION ACT",
        "source": "https://mola.gov.gy/laws-of-guyana",
        "type": {
            "name": "section",
            "representation": "4",
            "title": "Functions of the Commission. ",
            "context": "STATE PLANNING COMMISSION ACT under Functions of the Commission. 4.  (1) The  Commission  shall  be  responsible  for  the  central planning  of  the  economy  within  the  framework  of  the  socialist philosophy and objectives of the Government.  (2) Without prejudice to the generality of subsection (1), the functions of the Commission shall be  (a)  to advise the Government on the planning of  (i) the orderly, balanced economic and social development of LAWS OF GUYANA State Planning Commission Cap. 78:02 5  L.R.O. 1/2012                                                 Guyana;  (ii) the most effective, efficient and rational utilisation of the human, material and financial resources of Guyana in order to achieve the most rapid economic growth consistent with the continuous improvement in the standard of living, the quality of life and the general material and cultural well-being of the nation;  (b)  to prepare, pursuant to the directions of the Minister, such development plans for Guyana in conformity with the general policies and objectives of the Government;  (c)  to monitor, review and evaluate the performance of the national development plans, of the planning mechanisms, procedures methodology and strategies and the performance of the national economy;  (d)  to pursue such research as may be necessary to enable it to perform its functions effectively;  (e)  to give advice, guidance and directions to all agencies, enterprises and institutions in the public, co-operative and private  sectors  so  as  to  ensure  their  efficient  operation within the framework of the national LAWS OF GUYANA 6 Cap. 78:02 State Planning Commission  L.R.O. 1/2012                 Power of Minister to give directions.                     Employment of Staff.         development plans;  (f) to perform such other functions relating to the planning of the development of the resources of Guyana as may be referred to it by the Minister;  (g)  generally to do all things necessary to ensure the effective discharge of its functions and responsibilities.",
            "description": [
                {
                    "representation": "(1)",
                    "description": "The  Commission  shall  be  responsible  for  the  central planning  of  the  economy  within  the  framework  of  the  socialist philosophy and objectives of the Government."
                },
                {
                    "representation": "(2)",
                    "description": "Without prejudice to the generality of subsection"
                },
                {
                    "representation": "(a)",
                    "description": "to advise the Government on the planning of"
                },
                {
                    "representation": "(i)",
                    "description": "the orderly, balanced economic and social development of LAWS OF GUYANA State Planning Commission Cap. 78:02 5  L.R.O. 1/2012                                                 Guyana;"
                },
                {
                    "representation": "(b)",
                    "description": "to prepare, pursuant to the directions of the Minister, such development plans for Guyana in conformity with the general policies and objectives of the Government;"
                },
                {
                    "representation": "(c)",
                    "description": "to monitor, review and evaluate the performance of the national development plans, of the planning mechanisms, procedures methodology and strategies and the performance of the national economy;"
                },
                {
                    "representation": "(d)",
                    "description": "to pursue such research as may be necessary to enable it to perform its functions effectively;"
                },
                {
                    "representation": "(e)",
                    "description": "to give advice, guidance and directions to all agencies, enterprises and institutions in the public, co-operative and private  sectors  so  as  to  ensure  their  efficient  operation within the framework of the national LAWS OF GUYANA 6 Cap. 78:02 State Planning Commission  L.R.O. 1/2012                 Power of Minister to give directions.                     Employment of Staff.         development plans;"
                },
                {
                    "representation": "(f)",
                    "description": "to perform such other functions relating to the planning of the development of the resources of Guyana as may be referred to it by the Minister;"
                },
                {
                    "representation": "(g)",
                    "description": "generally to do all things necessary to ensure the effective discharge of its functions and responsibilities."
                }
            ]
        }
    },
    {
        "act": "STATE PLANNING COMMISSION ACT",
        "source": "https://mola.gov.gy/laws-of-guyana",
        "type": {
            "name": "section",
            "representation": "5",
            "title": "Power of Minister to give directions. ",
            "context": "STATE PLANNING COMMISSION ACT under Power of Minister to give directions. 5.  (1) The Minister may give to the Commission directions of a general or special character as to the policy to be followed by the Commission in the exercise and performance of its functions and the Commission shall give effect to those directions.  (2) The Commission shall afford to the Minister facilities for obtaining   information   with   respect   to   the   functioning   of   the Commission and shall submit to the Minister not later than the 15th June in each year, or such other date as the Minister may in writing direct, for  his approval estimates of expenditure in relation to its operations for the ensuing financial year.  (3) The Commission shall submit to the Minister such reports, in such manner and form, as he may from time to time request.",
            "description": [
                {
                    "representation": "(1)",
                    "description": "The Minister may give to the Commission directions of a general or special character as to the policy to be followed by the Commission in the exercise and performance of its functions and the Commission shall give effect to those directions."
                },
                {
                    "representation": "(2)",
                    "description": "The Commission shall afford to the Minister facilities for obtaining   information   with   respect   to   the   functioning   of   the Commission and shall submit to the Minister not later than the 15th June in each year, or such other date as the Minister may in writing direct, for  his approval estimates of expenditure in relation to its operations for the ensuing financial year."
                },
                {
                    "representation": "(3)",
                    "description": "The Commission shall submit to the Minister such reports, in such manner and form, as he may from time to time request."
                }
            ]
        }
    },
    {
        "act": "STATE PLANNING COMMISSION ACT",
        "source": "https://mola.gov.gy/laws-of-guyana",
        "type": {
            "name": "section",
            "representation": "6",
            "title": "Employment of Staff. ",
            "context": "STATE PLANNING COMMISSION ACT under Employment of Staff. 6. (1) There shall be employed by the Commission such number of persons as the  Minister  considers  necessary  to  enable  the Commission to carry out the functions imposed upon it by this Act.  (2) The   order   establishing   the   Commission   may   make provision for the Commission or any of its organs or institutions to give effect to subsection (1). LAWS OF GUYANA State Planning Commission Cap. 78:02 7  L.R.O. 1/2012 Secondment or transfer of employees of the  Commission.                             Superannua- tion benefits of public officers and teachers employed in the service of the  Commission.  c. 19:05",
            "description": [
                {
                    "representation": "(1)",
                    "description": "There shall be employed by the Commission such number of persons as the  Minister  considers  necessary  to  enable  the Commission to carry out the functions imposed upon it by this Act."
                },
                {
                    "representation": "(2)",
                    "description": "The   order   establishing   the   Commission   may   make provision for the Commission or any of its organs or institutions to give effect to subsection"
                }
            ]
        }
    },
    {
        "act": "STATE PLANNING COMMISSION ACT",
        "source": "https://mola.gov.gy/laws-of-guyana",
        "type": {
            "name": "section",
            "representation": "7",
            "title": "Secondment or transfer of employees of the Commission. ",
            "context": "STATE PLANNING COMMISSION ACT under Secondment or transfer of employees of the Commission. 7.  (1) It shall be deemed a term of every contract of service of an employee of the Commission that such employee may be assigned duties in any area of Guyana or in any department of the Commission or that such  person is liable to be seconded or transferred by the Commission with the consent of the appropriate authority to service in such capacity, as may be agreed upon between the Commission and such authority, in any department, agency or institution of the State or with anybody corporate in which the controlling interest is vested in the State:  Provided  that   nothing  in  the  foregoing  provisions  of  the subsection shall render any person liable to suffer by reason of any assignment, secondment or transfer any loss in leave, or superannuation benefits enjoyed by him immediately prior to such assignment, secondment or transfer.  (2) In this section  appropriate authority means the respective authority duly vested with power to employ a person in the service of the respective department, agency or institution of the State or body corporate in which the controlling interest is vested in the State, as the case may be.",
            "description": [
                {
                    "representation": "(1)",
                    "description": "It shall be deemed a term of every contract of service of an employee of the Commission that such employee may be assigned duties in any area of Guyana or in any department of the Commission or that such  person is liable to be seconded or transferred by the Commission with the consent of the appropriate authority to service in such capacity, as may be agreed upon between the Commission and such authority, in any department, agency or institution of the State or with anybody corporate in which the controlling interest is vested in the State:  Provided  that   nothing  in  the  foregoing  provisions  of  the subsection shall render any person liable to suffer by reason of any assignment, secondment or transfer any loss in leave, or superannuation benefits enjoyed by him immediately prior to such assignment, secondment or transfer."
                },
                {
                    "representation": "(2)",
                    "description": "In this section  appropriate authority means the respective authority duly vested with power to employ a person in the service of the respective department, agency or institution of the State or body corporate in which the controlling interest is vested in the State, as the case may be."
                }
            ]
        }
    },
    {
        "act": "STATE PLANNING COMMISSION ACT",
        "source": "https://mola.gov.gy/laws-of-guyana",
        "type": {
            "name": "section",
            "representation": "8",
            "title": "Superannuation  benefits   of   public   officers   and   teachers employed in the service of the Commission. ",
            "context": "STATE PLANNING COMMISSION ACT under Superannuation  benefits   of   public   officers   and   teachers employed in the service of the Commission. 8.  (1) Sections 54 and 54A of the Public Corporations Act shall apply mutatis mutandis to the Commission as if the references in those sections to a public corporation were references to the Commission.  (2) Where are employee of the Commission, other than a person to  whom subsection  (1) applies,  is  seconded  or  transferred  from service with the Commission in respect of which a pension is payable to service as mentioned in section 7 (1), in computing the period of his last mentioned  service for the purpose of pension notwithstanding anything to the contrary in any other law there shall be reckoned his LAWS OF GUYANA 8 Cap. 78:02 State Planning Commission  L.R.O. 1/2012     Power to obtain information.                                        Powers of entry.    service with the Commission.",
            "description": [
                {
                    "representation": "(1)",
                    "description": "applies,  is  seconded  or  transferred  from service with the Commission in respect of which a pension is payable to service as mentioned in section 7"
                },
                {
                    "representation": "(2)",
                    "description": "Where are employee of the Commission, other than a person to  whom subsection"
                }
            ]
        }
    },
    {
        "act": "STATE PLANNING COMMISSION ACT",
        "source": "https://mola.gov.gy/laws-of-guyana",
        "type": {
            "name": "section",
            "representation": "9",
            "title": "Power to obtain information. ",
            "context": "STATE PLANNING COMMISSION ACT under Power to obtain information. 9.  (1) Subject to subsection (4) and notwithstanding anything to the contrary in any other law it shall be lawful for the Commission to request any person to supply to the Commission such information as the Commission deems necessary to carry out the functions imposed upon it by this Act either by such person being interviewed personally by an authorised officer or by way of the completion by that person of a form sent to his last known address by the Commission.  (2) Any person having the custody or charge of any public records or documents, or of the records or documents of any person from which in the opinion of any authorised officer of the Commission information necessary to the Commission for the carrying out of its functions can be obtained, shall grant to the authorised officer access to  such  records  or  documents  for  the  purpose  of obtaining  such information therefrom.  (3) A person shall not be required to supply information under this Act which involves the disclosure of any technical process or trade secret in or relating to the undertaking of which he is the owner or in the conduct or supervision of which he is engaged.  (4) Where a person to whom a request has been made under subsection (1) satisfies the Minister by representations made to him in writing within seven days of the receipt of such request that undue hardship is imposed upon him by reason of that request, the Minister may direct that such request be waived or be modified to such extent as he deems fit.",
            "description": [
                {
                    "representation": "(1)",
                    "description": "satisfies the Minister by representations made to him in writing within seven days of the receipt of such request that undue hardship is imposed upon him by reason of that request, the Minister may direct that such request be waived or be modified to such extent as he deems fit."
                },
                {
                    "representation": "(4)",
                    "description": "Where a person to whom a request has been made under subsection"
                },
                {
                    "representation": "(2)",
                    "description": "Any person having the custody or charge of any public records or documents, or of the records or documents of any person from which in the opinion of any authorised officer of the Commission information necessary to the Commission for the carrying out of its functions can be obtained, shall grant to the authorised officer access to  such  records  or  documents  for  the  purpose  of obtaining  such information therefrom."
                },
                {
                    "representation": "(3)",
                    "description": "A person shall not be required to supply information under this Act which involves the disclosure of any technical process or trade secret in or relating to the undertaking of which he is the owner or in the conduct or supervision of which he is engaged."
                }
            ]
        }
    },
    {
        "act": "STATE PLANNING COMMISSION ACT",
        "source": "https://mola.gov.gy/laws-of-guyana",
        "type": {
            "name": "section",
            "representation": "10",
            "title": "Powers of entry. ",
            "context": "STATE PLANNING COMMISSION ACT under Powers of entry. 10.  (1) Any authorised officer of the Commission may, for any purpose  connected  with  the  carrying  out  of  the  functions  of  the Commission, enter at all reasonable times any dwelling house or any premises  where  persons  LAWS OF GUYANA State Planning Commission Cap. 78:02 9  L.R.O. 1/2012               Restriction on Publication.                                 are  employed,  or  any premises  where  it appears to him likely that persons are employed, and may make such enquiries as may be necessary for the performance of his duties in relation to such functions.  (2) An authorised officer shall before exercising any of the powers  conferred  upon  him  by  this  Act  produce  his  written authorisation to such persons  as may be directly affected  by the proposed exercise by him of those powers.",
            "description": [
                {
                    "representation": "(1)",
                    "description": "Any authorised officer of the Commission may, for any purpose  connected  with  the  carrying  out  of  the  functions  of  the Commission, enter at all reasonable times any dwelling house or any premises  where  persons  LAWS OF GUYANA State Planning Commission Cap. 78:02 9  L.R.O. 1/2012               Restriction on Publication.                                 are  employed,  or  any premises  where  it appears to him likely that persons are employed, and may make such enquiries as may be necessary for the performance of his duties in relation to such functions."
                },
                {
                    "representation": "(2)",
                    "description": "An authorised officer shall before exercising any of the powers  conferred  upon  him  by  this  Act  produce  his  written authorisation to such persons  as may be directly affected  by the proposed exercise by him of those powers."
                }
            ]
        }
    },
    {
        "act": "STATE PLANNING COMMISSION ACT",
        "source": "https://mola.gov.gy/laws-of-guyana",
        "type": {
            "name": "section",
            "representation": "11",
            "title": "Restriction on publication. ",
            "context": "STATE PLANNING COMMISSION ACT under Restriction on publication. 11.  Except for the purposes of a prosecution under this Act  (a)  no  individual  return,  or  part  thereof,  made  for  the purposes of this Act;  (b)  no answer given to any question put for the purposes of this Act;  (c)  no  report,  abstract,  or  other  document,  containing particulars  comprised  in  any  such  return  or  answer  so arranged as to enable identification of such particulars with any person, undertaking or business,  shall be published or disclosed to any person not employed in the execution of a duty under this Act, unless the previous consent in writing thereto has been obtained from the person making such return or giving such answer, or, in the case of an undertaking or business, from the owner for the time being of the undertaking or business:  Provided that nothing in this section shall prevent or restrict the publication  or  disclosure  of  any  such  report,  abstract,  or  other document without such consent where LAWS OF GUYANA 10 Cap. 78:02 State Planning Commission  L.R.O. 1/2012                   Offences. [3 of 1978]                              (a)  the  particulars  in  such  report,  abstract  or  other document, enable identification merely by reason of the fact that  the particulars relate to the business activities of a person who is the only individual engaged in that category of business or activity; or  (b)  such publication or disclosure is lawfully required in any court or tribunal or under the provisions of any other law.",
            "description": [
                {
                    "representation": "(a)",
                    "description": "the  particulars  in  such  report,  abstract  or  other document, enable identification merely by reason of the fact that  the particulars relate to the business activities of a person who is the only individual engaged in that category of business or activity; or"
                },
                {
                    "representation": "(b)",
                    "description": "such publication or disclosure is lawfully required in any court or tribunal or under the provisions of any other law."
                },
                {
                    "representation": "(c)",
                    "description": "no  report,  abstract,  or  other  document,  containing particulars  comprised  in  any  such  return  or  answer  so arranged as to enable identification of such particulars with any person, undertaking or business,  shall be published or disclosed to any person not employed in the execution of a duty under this Act, unless the previous consent in writing thereto has been obtained from the person making such return or giving such answer, or, in the case of an undertaking or business, from the owner for the time being of the undertaking or business:  Provided that nothing in this section shall prevent or restrict the publication  or  disclosure  of  any  such  report,  abstract,  or  other document without such consent where LAWS OF GUYANA 10 Cap. 78:02 State Planning Commission  L.R.O. 1/2012                   Offences. [3 of 1978]"
                }
            ]
        }
    },
    {
        "act": "STATE PLANNING COMMISSION ACT",
        "source": "https://mola.gov.gy/laws-of-guyana",
        "type": {
            "name": "section",
            "representation": "12",
            "title": "Offences. ",
            "context": "STATE PLANNING COMMISSION ACT under Offences. 12.  (1) Any person being a person employed in the execution of any duty under this Act, who  (a)   by virtue of such employment becomes possessed of any information which might exert an influence upon or affect the market value of any movable or immovable property and before such   information  is  made  public  in  accordance  with  the provisions of this Act, directly or indirectly uses such information for personal gain; or  (b)   without lawful authority publishes or communicates to any  person  otherwise  than  in  the  ordinary  course  of  such employment any information acquired by him in the course of his employment, shall be guilty of an offence.  (2) Any  person  who  without  lawful  authority  seeks  the disclosure by an employee of the Commission of information obtained pursuant to this Act in excess of the LAWS OF GUYANA State Planning Commission Cap. 78:02 11  L.R.O. 1/2012                                                 authority of that employee shall be guilty of an offence.  (3) Any person, being in possession of any information which to his knowledge has been disclosed in contravention of this Act, who publishes or communicates such information to any person shall be guilty of an offence.  (4) Any person who  (a)  hinders  or  obstructs  any  authorised  officer  in  the exercise of any of his powers or the discharge of any of his duties under this Act; or  (b)  without lawful excuse refuses or fails to supply the particulars required in any return, form or other document lawfully left with or sent to him, or who refuses or fails to answer any question or enquiry addressed to him under the authority of this Act; or  (c)  without lawful excuse refuses or fails to comply with any directions issues by the Commission pursuant to section 4 (2) (e);  (d)  knowingly or recklessly makes in any return, form or other document completed or supplied pursuant to this Act in any answer to any questions asked him under the authority of this Act, any statement which is untrue in any material particular; or  (e)  without   lawful   authority   suppresses   from   the Commission LAWS OF GUYANA 12 Cap. 78:02 State Planning Commission  L.R.O. 1/2012                      Penalties. [6 of 1997]               Regulations.     Consolidated Fund. or, with intent to deprive the Commission of the  benefit  thereof,  destroys,  defaces,  or  mutilates,  any return,  form  or  other  document  containing  particulars collected or requested under this Act; or  (f) writes or makes on any return, form or other document issued  for  the  purpose  of this  Act  and  furnished  to  an authorised  officer,  any  indecent,  obscene  or  insulting remarks, drawing or other matter,  shall be guilty of an offence.",
            "description": [
                {
                    "representation": "(1)",
                    "description": "Any person being a person employed in the execution of any duty under this Act, who"
                },
                {
                    "representation": "(a)",
                    "description": "hinders  or  obstructs  any  authorised  officer  in  the exercise of any of his powers or the discharge of any of his duties under this Act; or"
                },
                {
                    "representation": "(b)",
                    "description": "without lawful excuse refuses or fails to supply the particulars required in any return, form or other document lawfully left with or sent to him, or who refuses or fails to answer any question or enquiry addressed to him under the authority of this Act; or"
                },
                {
                    "representation": "(2)",
                    "description": "(e);"
                },
                {
                    "representation": "(3)",
                    "description": "Any person, being in possession of any information which to his knowledge has been disclosed in contravention of this Act, who publishes or communicates such information to any person shall be guilty of an offence."
                },
                {
                    "representation": "(4)",
                    "description": "Any person who"
                },
                {
                    "representation": "(c)",
                    "description": "without lawful excuse refuses or fails to comply with any directions issues by the Commission pursuant to section 4"
                },
                {
                    "representation": "(d)",
                    "description": "knowingly or recklessly makes in any return, form or other document completed or supplied pursuant to this Act in any answer to any questions asked him under the authority of this Act, any statement which is untrue in any material particular; or"
                },
                {
                    "representation": "(e)",
                    "description": "without   lawful   authority   suppresses   from   the Commission LAWS OF GUYANA 12 Cap. 78:02 State Planning Commission  L.R.O. 1/2012                      Penalties. [6 of 1997]               Regulations.     Consolidated Fund. or, with intent to deprive the Commission of the  benefit  thereof,  destroys,  defaces,  or  mutilates,  any return,  form  or  other  document  containing  particulars collected or requested under this Act; or"
                },
                {
                    "representation": "(f)",
                    "description": "writes or makes on any return, form or other document issued  for  the  purpose  of this  Act  and  furnished  to  an authorised  officer,  any  indecent,  obscene  or  insulting remarks, drawing or other matter,  shall be guilty of an offence."
                }
            ]
        }
    },
    {
        "act": "STATE PLANNING COMMISSION ACT",
        "source": "https://mola.gov.gy/laws-of-guyana",
        "type": {
            "name": "section",
            "representation": "13",
            "title": "Penalties. ",
            "context": "STATE PLANNING COMMISSION ACT under Penalties. 13. Every person who is guilty of an offence under this Act or any regulations  made  thereunder  and  for  which  no special  penalty  is provided shall be liable on summary conviction therefor to a fine of not less than thirteen thousand dollars nor more than three hundred and twenty-five thousand dollars and to imprisonment for a term of not less than three months nor more than one year for each such offence, and in the event of a continuing offence to a further fine not exceeding thirty- two thousand five hundred dollars for each day on which the offence is continued after conviction.",
            "description": "Every person who is guilty of an offence under this Act or any regulations  made  thereunder  and  for  which  no special  penalty  is provided shall be liable on summary conviction therefor to a fine of not less than thirteen thousand dollars nor more than three hundred and twenty-five thousand dollars and to imprisonment for a term of not less than three months nor more than one year for each such offence, and in the event of a continuing offence to a further fine not exceeding thirty- two thousand five hundred dollars for each day on which the offence is continued after conviction."
        }
    },
    {
        "act": "STATE PLANNING COMMISSION ACT",
        "source": "https://mola.gov.gy/laws-of-guyana",
        "type": {
            "name": "section",
            "representation": "14",
            "title": "Regulations. ",
            "context": "STATE PLANNING COMMISSION ACT under Regulations. 14. The Minister may make regulations for the purpose of carrying out the provisions of this Act.",
            "description": "The Minister may make regulations for the purpose of carrying out the provisions of this Act."
        }
    },
    {
        "act": "STATE PLANNING COMMISSION ACT",
        "source": "https://mola.gov.gy/laws-of-guyana",
        "type": {
            "name": "section",
            "representation": "15",
            "title": "Consolidated Fund.   __________________________ 24 of 1977 An Act to establish a State Planning Commission and to provide for matters connected therewith.  [17TH NOVEMBER, 1977]  Short title.    Interpretation. ",
            "context": "STATE PLANNING COMMISSION ACT under Consolidated Fund.   __________________________ 24 of 1977 An Act to establish a State Planning Commission and to provide for matters connected therewith.  [17TH NOVEMBER, 1977]  Short title.    Interpretation. 15. There shall be defrayed out of monies provided by Parliament for the purpose all expenses incurred or arising under this Act in respect of the establishment of, or carrying out of its functions by, the Commission and not otherwise lawfully charged on the Consolidated Fund. ________________   LAWS OF GUYANA                                                              State Planning Commission  Cap. 78:02     13                                                                                                                 L.R.O. 1/2012  SUBSIDIARY LEGISLATION  _________________   O. 2/2000       Citation.    Interpretation.   First Schedule.           Second Schedule.        Establishment of the State Planning Commission.    STATE PLANNING COMMISSION (ESTABLISHMENT) ORDER  made under section 3",
            "description": "There shall be defrayed out of monies provided by Parliament for the purpose all expenses incurred or arising under this Act in respect of the establishment of, or carrying out of its functions by, the Commission and not otherwise lawfully charged on the Consolidated Fund. ________________   LAWS OF GUYANA                                                              State Planning Commission  Cap. 78:02     13                                                                                                                 L.R.O. 1/2012  SUBSIDIARY LEGISLATION  _________________   O. 2/2000       Citation.    Interpretation.   First Schedule.           Second Schedule.        Establishment of the State Planning Commission.    STATE PLANNING COMMISSION (ESTABLISHMENT) ORDER  made under section 3"
        }
    },
    {
        "act": "STATE PLANNING COMMISSION ACT",
        "source": "https://mola.gov.gy/laws-of-guyana",
        "type": {
            "name": "section",
            "representation": "",
            "title": "78.02                  State Planning Commission  [Subsidiary] State Planning Commission (Establishment) Order  L.R.O. 1/2012         .               State Planning Secretariat.                         (b) the State Planning Secretariat;  (c) the National Economic and Social Council; and  (d) the Technical Advisory Panel.  (2) For the purpose of enabling the Commission to carry out its functions the bodies establishing in the Ministerial regions and commonly known as the Regional Development Councils, the local government authorities constituted under the Municipal and District Councils Act, for the City of Georgetown, the Town of New Amsterdam and the Town of Linden, respectively, and the National Science Research Council shall be deemed to be associate organs of the Commission.  ",
            "context": "STATE PLANNING COMMISSION ACT under 78.02                  State Planning Commission  [Subsidiary] State Planning Commission (Establishment) Order  L.R.O. 1/2012         .               State Planning Secretariat.                         (b) the State Planning Secretariat;  (c) the National Economic and Social Council; and  (d) the Technical Advisory Panel.  (2) For the purpose of enabling the Commission to carry out its functions the bodies establishing in the Ministerial regions and commonly known as the Regional Development Councils, the local government authorities constituted under the Municipal and District Councils Act, for the City of Georgetown, the Town of New Amsterdam and the Town of Linden, respectively, and the National Science Research Council shall be deemed to be associate organs of the Commission.  78.02 15 [Subsidiary]                                     State Planning Commission (Establishment) Order  L.R.O. 1/2012               Functions of the Secretariat.                The National Economic and Social Council.              Functions of the Council.  to the Minister for ensuring that the Secretariat is efficiently organised and that it  discharges  its  responsibility  in  accordance  with  the general policy directions of the Minister and the provisions of the Act.  (4) The Chief Planning Officer shall be the principal professional executive and administrative officer of the Secretariat and shall be responsible to the Chairman of the Board the efficient day- to-day functioning of the Secretariat.",
            "description": [
                {
                    "representation": "(4)",
                    "description": "The Chief Planning Officer shall be the principal professional executive and administrative officer of the Secretariat and shall be responsible to the Chairman of the Board the efficient day- to-day functioning of the Secretariat."
                }
            ]
        }
    }
]