[
    {
        "act": "SEXUAL OFFENCES ACT",
        "source": "https://mola.gov.gy/laws-of-guyana",
        "type": {
            "name": "section",
            "representation": "1",
            "title": "Short title. ",
            "context": "SEXUAL OFFENCES ACT under Short title. 1. This Act may be cited as the Sexual Offences Act.",
            "description": "This Act may be cited as the Sexual Offences Act."
        }
    },
    {
        "act": "SEXUAL OFFENCES ACT",
        "source": "https://mola.gov.gy/laws-of-guyana",
        "type": {
            "name": "section",
            "representation": "2",
            "title": "Interpretation.  PART II OFFENCES   ",
            "context": "SEXUAL OFFENCES ACT under Interpretation.  PART II OFFENCES   2. In this Act    accused includes a defendant; LAWS OF GUYANA  Sexual Offences  Cap. 8:03 9  L.R.O. 1/2012                                                  child means a person under eighteen years of age;  consent means words or overt actions by a person who is competent to give informed consent indicating a freely given agreement to have sexual intercourse or other sexual contact;  HIV means the Human Immuno-deficiency Virus;  image means a moving or still image and includes an image produced by any means and, where the context permits, a three-dimensional image and references to an image of a person include references to an image of an imaginary person and references to observation (however expressed) are to observation whether direct or by looking at an image;  learning disability means a state of arrested or incomplete development of the mind which includes significant impairment of intelligence and social functioning; dependence on alcohol or drugs is not considered to be a disorder or disability of the mind;  mental disorder means any disorder or disability of the mind, including learning disability;  penetration means any intrusion, however slight and for however short a time, of any part of a person's body or of any object into the vagina or anus of another person, and  any  contact,  however  slight, and for however short a time, between the mouth of one person and the genitals or anus of another, including but not limited to sexual intercourse, cunnilingus, fellatio, anal intercourse and female to female genital contact; and    (i) where the penetration is by the penis, the emission of seminal fluid is not LAWS OF GUYANA 10 Cap. 8:03 Sexual Offences   L.R.O. 1/2012                                                  necessary to prove the penetration;  (ii) penetration is a continuing act from entry to withdrawal;  proceedings includes    (i) any proceeding relating to bail;  (ii) a paper committal;  (iii) where a person has previously been remanded in custody, any subsequent proceeding with   respect to the remand of the person in custody for the same offence;  (iv) any interlocutory proceeding held in connection with any criminal proceeding;  (v) any civil action or proceeding in    the High Court;  (vi) a trial or hearing of the charge;  (vii) a trial or a hearing of an appeal;  sexual includes penetration, touching or any other activity if a reasonable person would consider that    (i)  whatever its circumstances or any person's purpose in relation to it, it is because of its nature sexual; or  (ii)  because of its nature it may be sexual and because of its circumstances or the  purpose  of any person in relation to it (or both) it is sexual; LAWS OF GUYANA  Sexual Offences  Cap. 8:03 11  L.R.O. 1/2012                               Rape.                      sexual activity includes touching;  touching includes touching    (i) with any part of the body, which includes a part surgically constructed (in particular, through gender reassignment surgery);  (ii) with anything else;  (iii) through anything;  vagina includes vulva, meaning the region of the external genital organs of the female and in relation to an animal, references to the vagina or anus include references to any similar part.  PART II OFFENCES",
            "description": [
                {
                    "representation": "(i)",
                    "description": "with any part of the body, which includes a part surgically constructed"
                },
                {
                    "representation": "(v)",
                    "description": "any civil action or proceeding in    the High Court;"
                }
            ]
        }
    },
    {
        "act": "SEXUAL OFFENCES ACT",
        "source": "https://mola.gov.gy/laws-of-guyana",
        "type": {
            "name": "section",
            "representation": "03",
            "title": "Note on Revision Date  This Act has been revised up to March 1, ",
            "context": "SEXUAL OFFENCES ACT under Note on Revision Date  This Act has been revised up to March 1, 3. Rape.",
            "description": "Rape."
        }
    },
    {
        "act": "SEXUAL OFFENCES ACT",
        "source": "https://mola.gov.gy/laws-of-guyana",
        "type": {
            "name": "section",
            "representation": "4",
            "title": "Sexual Assault. ",
            "context": "SEXUAL OFFENCES ACT under Sexual Assault. 4. (1) A person (\"the accused\") commits the offence of sexual assault if    (a) the accused   (i) touches another person (the complainant ) in a sexual way;  (ii) causes the complainant to touch the accused in a sexual way;  (iii) causes the complainant to touch a third party in a sexual way; or  (iv) otherwise indecently assaults the complainant within the meaning  of any other law;  (b) the complainant does not consent to the touching or the act which would constitute sexual assault; and  (c) the accused does not reasonably believe that the complainant consents.  (2) Sections 7 and 8 (relating to presumptions as to consent) apply to an offence under this section.  (3) A person who commits an offence under subsection (1) is liable, on summary conviction, to LAWS OF GUYANA  Sexual Offences  Cap. 8:03 13  L.R.O. 1/2012                  Consent not inferred.                Belief in consent.                                    Evidential presumptions imprisonment for five years and on conviction on indictment, to imprisonment for ten years.",
            "description": [
                {
                    "representation": "(1)",
                    "description": "is liable, on summary conviction, to LAWS OF GUYANA  Sexual Offences  Cap. 8:03 13  L.R.O. 1/2012                  Consent not inferred.                Belief in consent.                                    Evidential presumptions imprisonment for five years and on conviction on indictment, to imprisonment for ten years."
                },
                {
                    "representation": "(a)",
                    "description": "the accused"
                },
                {
                    "representation": "(i)",
                    "description": "touches another person"
                },
                {
                    "representation": "(b)",
                    "description": "the complainant does not consent to the touching or the act which would constitute sexual assault; and"
                },
                {
                    "representation": "(c)",
                    "description": "the accused does not reasonably believe that the complainant consents."
                },
                {
                    "representation": "(2)",
                    "description": "Sections 7 and 8"
                },
                {
                    "representation": "(3)",
                    "description": "A person who commits an offence under subsection"
                }
            ]
        }
    },
    {
        "act": "SEXUAL OFFENCES ACT",
        "source": "https://mola.gov.gy/laws-of-guyana",
        "type": {
            "name": "section",
            "representation": "5",
            "title": "Consent not inferred. ",
            "context": "SEXUAL OFFENCES ACT under Consent not inferred. 5. Consent and belief in consent cannot be inferred by    (a) reason of silence or lack of physical resistance on the part of the complainant; or  (b) reason of sexual arousal including orgasm and ejaculation.",
            "description": [
                {
                    "representation": "(a)",
                    "description": "reason of silence or lack of physical resistance on the part of the complainant; or"
                },
                {
                    "representation": "(b)",
                    "description": "reason of sexual arousal including orgasm and ejaculation."
                }
            ]
        }
    },
    {
        "act": "SEXUAL OFFENCES ACT",
        "source": "https://mola.gov.gy/laws-of-guyana",
        "type": {
            "name": "section",
            "representation": "6",
            "title": "Belief in consent. ",
            "context": "SEXUAL OFFENCES ACT under Belief in consent. 6. (1) Where a defence of belief in consent is raised to the offence of rape or sexual assault, the belief must be objectively reasonable.  (2) Whether a belief is reasonable is to be determined having regard to all the circumstances, including any steps the accused has taken to ascertain whether the complainant or the third person consents.  (3) It is not a defence to a charge of rape that the accused reasonably believed that the complainant consented to the sexual activity that forms the subject matter of the charge, where    (a) the belief of the accused arose from the self-induced intoxication or reckless or wilful blindness of the accused; or  (b) the accused did not take reasonable steps, in the circumstances known to the accused at the time, to ascertain that the complainant was consenting.",
            "description": [
                {
                    "representation": "(1)",
                    "description": "Where a defence of belief in consent is raised to the offence of rape or sexual assault, the belief must be objectively reasonable."
                },
                {
                    "representation": "(2)",
                    "description": "Whether a belief is reasonable is to be determined having regard to all the circumstances, including any steps the accused has taken to ascertain whether the complainant or the third person consents."
                },
                {
                    "representation": "(3)",
                    "description": "It is not a defence to a charge of rape that the accused reasonably believed that the complainant consented to the sexual activity that forms the subject matter of the charge, where"
                },
                {
                    "representation": "(a)",
                    "description": "the belief of the accused arose from the self-induced intoxication or reckless or wilful blindness of the accused; or"
                },
                {
                    "representation": "(b)",
                    "description": "the accused did not take reasonable steps, in the circumstances known to the accused at the time, to ascertain that the complainant was consenting."
                }
            ]
        }
    },
    {
        "act": "SEXUAL OFFENCES ACT",
        "source": "https://mola.gov.gy/laws-of-guyana",
        "type": {
            "name": "section",
            "representation": "7",
            "title": "Evidential presumptions about consent. ",
            "context": "SEXUAL OFFENCES ACT under Evidential presumptions about consent. 7. (1) If in any proceedings for an offence under section 3 or 4 it is proved that   LAWS OF GUYANA 14 Cap. 8:03 Sexual Offences   L.R.O. 1/2012  about consent.                                                 (a) the accused did the sexual activity;  (b) any of the circumstances specified in subsection (2) existed; and  (c) the accused knew that those circumstances existed,   the complainant is to be taken not to have consented to the sexual activity unless prima facie evidence is adduced to raise an issue as to whether the complainant consented, and the accused is to be taken not to have reasonably believed that the complainant consented unless prima facie evidence is adduced to raise an issue as to whether the accused reasonably believed it.  (2) The circumstances referred to in subsection (1) are that    (a) any person was, at the time of the sexual activity or immediately before it began, using violence against the complainant or causing the complainant to fear that immediate violence would be used against the complainant;  (b) any person was, at the time of the sexual activity or immediately before it began, causing the complainant to fear that violence was being used, or that immediate violence would be used, against another person;  (c) the complainant was, and the accused was not, unlawfully detained at the time of the sexual activity;  LAWS OF GUYANA  Sexual Offences  Cap. 8:03 15  L.R.O. 1/2012                                                 (d) any person had administered to or caused to be taken by the complainant, without the complainant's consent, a substance which, having regard to when it was administered or taken, was capable of causing or enabling the complainant to be stupefied or overpowered at the time of the sexual activity;  (e) the presence of more than one person at the time of the sexual activity was used to intimidate the complainant;  (f) the complainant was asleep or otherwise unconscious at the time of the sexual activity;  (g) because of the complainant's physical disability, the complainant would not have been able at the time of the sexual activity to communicate to the accused whether the complainant consented;  (h)  (i) the complainant was, at the  time of the sexual activity,  unable to refuse because of or  for a reason related to a mental  disorder, and the accused  knew or could reasonably have  been expected to know this;  (ii) for the purposes of this subsection, the complainant was unable to refuse if the complainant lacks the capacity to choose whether to agree to the sexual activity (whether LAWS OF GUYANA 16 Cap. 8:03 Sexual Offences   L.R.O. 1/2012                                                  because the complainant lacks sufficient understanding of the nature or reasonably foreseeable consequences of what is being done, or for any other reason), or the complainant is unable to  communicate such a choice to the accused;  (i) the complainant was otherwise incapable of consenting to the sexual activity at the time of the sexual activity;  (j) agreement was expressed by the words or conduct of a person other than the complainant;  (k) abuse of a position of power or authority to the extent that the complainant could not resist at the time of the sexual activity;  (l) the complainant expressed at the time of the sexual activity a lack of agreement to engage in the sexual activity;  (m) the complainant, having consented to engage in the sexual activity, expressed, by words or conduct at the time of the sexual activity, a lack of agreement to continue to engage in the sexual activity.  (3) In subsection (2)(a) and (b), the reference to the time immediately before the sexual activity began is, in the case of an act which is one of a continuous series of sexual LAWS OF GUYANA  Sexual Offences  Cap. 8:03 17  L.R.O. 1/2012      Conclusive presumption about consent.                                       Non-consent offences.               activities, a reference to the time immediately before the first sexual activity began.",
            "description": [
                {
                    "representation": "(1)",
                    "description": "are that"
                },
                {
                    "representation": "(a)",
                    "description": "and"
                },
                {
                    "representation": "(b)",
                    "description": "any person was, at the time of the sexual activity or immediately before it began, causing the complainant to fear that violence was being used, or that immediate violence would be used, against another person;"
                },
                {
                    "representation": "(2)",
                    "description": "The circumstances referred to in subsection"
                },
                {
                    "representation": "(c)",
                    "description": "the complainant was, and the accused was not, unlawfully detained at the time of the sexual activity;  LAWS OF GUYANA  Sexual Offences  Cap. 8:03 15  L.R.O. 1/2012"
                },
                {
                    "representation": "(d)",
                    "description": "any person had administered to or caused to be taken by the complainant, without the complainant's consent, a substance which, having regard to when it was administered or taken, was capable of causing or enabling the complainant to be stupefied or overpowered at the time of the sexual activity;"
                },
                {
                    "representation": "(e)",
                    "description": "the presence of more than one person at the time of the sexual activity was used to intimidate the complainant;"
                },
                {
                    "representation": "(f)",
                    "description": "the complainant was asleep or otherwise unconscious at the time of the sexual activity;"
                },
                {
                    "representation": "(g)",
                    "description": "because of the complainant's physical disability, the complainant would not have been able at the time of the sexual activity to communicate to the accused whether the complainant consented;"
                },
                {
                    "representation": "(h)",
                    "description": ""
                },
                {
                    "representation": "(i)",
                    "description": "the complainant was otherwise incapable of consenting to the sexual activity at the time of the sexual activity;"
                },
                {
                    "representation": "(j)",
                    "description": "agreement was expressed by the words or conduct of a person other than the complainant;"
                },
                {
                    "representation": "(k)",
                    "description": "abuse of a position of power or authority to the extent that the complainant could not resist at the time of the sexual activity;"
                },
                {
                    "representation": "(l)",
                    "description": "the complainant expressed at the time of the sexual activity a lack of agreement to engage in the sexual activity;"
                },
                {
                    "representation": "(m)",
                    "description": "the complainant, having consented to engage in the sexual activity, expressed, by words or conduct at the time of the sexual activity, a lack of agreement to continue to engage in the sexual activity."
                },
                {
                    "representation": "(3)",
                    "description": "In subsection"
                }
            ]
        }
    },
    {
        "act": "SEXUAL OFFENCES ACT",
        "source": "https://mola.gov.gy/laws-of-guyana",
        "type": {
            "name": "section",
            "representation": "8",
            "title": "Conclusive presumptions about consent.  Non Consent Offences: Children and vulnerable adults  ",
            "context": "SEXUAL OFFENCES ACT under Conclusive presumptions about consent.  Non Consent Offences: Children and vulnerable adults  8. (1) If in any proceedings for an offence under section 3 or 4 it is proved that the accused did the sexual activity and that any of the circumstances specified in subsection (2) existed, it is to be conclusively presumed that    (a) the complainant did not consent to the sexual activity; and  (b) the accused did not believe that the complainant consented to the sexual activity.  (2) The circumstances referred to in subsection (1) are that    (a) the accused deceived the complainant as to the nature or purpose of the sexual activity;  (b) the accused induced the complainant to consent to the sexual activity by impersonating a person known personally to the complainant.   Non-consent offences: children and vulnerable adults",
            "description": [
                {
                    "representation": "(1)",
                    "description": "are that"
                },
                {
                    "representation": "(2)",
                    "description": "The circumstances referred to in subsection"
                },
                {
                    "representation": "(a)",
                    "description": "the accused deceived the complainant as to the nature or purpose of the sexual activity;"
                },
                {
                    "representation": "(b)",
                    "description": "the accused induced the complainant to consent to the sexual activity by impersonating a person known personally to the complainant.   Non-consent offences: children and vulnerable adults"
                }
            ]
        }
    },
    {
        "act": "SEXUAL OFFENCES ACT",
        "source": "https://mola.gov.gy/laws-of-guyana",
        "type": {
            "name": "section",
            "representation": "9",
            "title": "Non-consent offences.  Child Sex Offences  ",
            "context": "SEXUAL OFFENCES ACT under Non-consent offences.  Child Sex Offences  9. For offences under sections 10 to 26, unless expressly stated in any of the offences, it is not necessary for the prosecution to prove that the complainant did not consent, and belief in consent (whether reasonable or not) is not a defence.    LAWS OF GUYANA 18 Cap. 8:03 Sexual Offences   L.R.O. 1/2012      Rape of a child under 16 years.                               Sexual activity with a child under 16 years.                     Child Sex Offences",
            "description": "For offences under sections 10 to 26, unless expressly stated in any of the offences, it is not necessary for the prosecution to prove that the complainant did not consent, and belief in consent (whether reasonable or not) is not a defence.    LAWS OF GUYANA 18 Cap. 8:03 Sexual Offences   L.R.O. 1/2012      Rape of a child under 16 years.                               Sexual activity with a child under 16 years.                     Child Sex Offences"
        }
    },
    {
        "act": "SEXUAL OFFENCES ACT",
        "source": "https://mola.gov.gy/laws-of-guyana",
        "type": {
            "name": "section",
            "representation": "10",
            "title": "Rape of a child under 16 years. ",
            "context": "SEXUAL OFFENCES ACT under Rape of a child under 16 years. 10. (1) A person (\"the accused\") commits the offence of rape of a child under sixteen years of age (the complainant) if the accused    (a) engages in sexual penetration with the complainant; or  (b) causes the complainant to engage in sexual penetration with a third party.  (2) It is irrelevant whether at the time of the penetration the accused believed the complainant to be sixteen years of age or over.  (3) A person who commits an offence under subsection (1) is liable on conviction on indictment to imprisonment for life.",
            "description": [
                {
                    "representation": "(1)",
                    "description": "is liable on conviction on indictment to imprisonment for life."
                },
                {
                    "representation": "(a)",
                    "description": "engages in sexual penetration with the complainant; or"
                },
                {
                    "representation": "(b)",
                    "description": "causes the complainant to engage in sexual penetration with a third party."
                },
                {
                    "representation": "(2)",
                    "description": "It is irrelevant whether at the time of the penetration the accused believed the complainant to be sixteen years of age or over."
                },
                {
                    "representation": "(3)",
                    "description": "A person who commits an offence under subsection"
                }
            ]
        }
    },
    {
        "act": "SEXUAL OFFENCES ACT",
        "source": "https://mola.gov.gy/laws-of-guyana",
        "type": {
            "name": "section",
            "representation": "11",
            "title": "Sexual activity with a child under 16 years. ",
            "context": "SEXUAL OFFENCES ACT under Sexual activity with a child under 16 years. 11. (1) A person (the accused) commits the offence of sexual activity with a child under sixteen years of age if the accused    (a) engages in a sexual activity (not including sexual penetration) with a child who is under sixteen years of age (\"the complainant\");  (b) causes or incites the complainant to engage in a sexual activity with a third party; or  (c) causes the complainant to perform a sexual act including causing the complainant to masturbate.  (2) It is irrelevant whether at the time of the activity the accused believed the complainant to be sixteen LAWS OF GUYANA  Sexual Offences  Cap. 8:03 19  L.R.O. 1/2012                              Causing a child under 16 years to watch a sexual act.                                       years of age or over.  (3) A person who commits an offence under subsection (1) is liable on summary conviction to imprisonment for five years and on conviction on indictment to imprisonment for ten years.",
            "description": [
                {
                    "representation": "(1)",
                    "description": "is liable on summary conviction to imprisonment for five years and on conviction on indictment to imprisonment for ten years."
                },
                {
                    "representation": "(a)",
                    "description": "engages in a sexual activity"
                },
                {
                    "representation": "(b)",
                    "description": "causes or incites the complainant to engage in a sexual activity with a third party; or"
                },
                {
                    "representation": "(c)",
                    "description": "causes the complainant to perform a sexual act including causing the complainant to masturbate."
                },
                {
                    "representation": "(2)",
                    "description": "It is irrelevant whether at the time of the activity the accused believed the complainant to be sixteen LAWS OF GUYANA  Sexual Offences  Cap. 8:03 19  L.R.O. 1/2012                              Causing a child under 16 years to watch a sexual act.                                       years of age or over."
                },
                {
                    "representation": "(3)",
                    "description": "A person who commits an offence under subsection"
                }
            ]
        }
    },
    {
        "act": "SEXUAL OFFENCES ACT",
        "source": "https://mola.gov.gy/laws-of-guyana",
        "type": {
            "name": "section",
            "representation": "12",
            "title": "Causing a child under 16 years to watch a sexual act. ",
            "context": "SEXUAL OFFENCES ACT under Causing a child under 16 years to watch a sexual act. 12. (1) A person (the accused) commits the offence of causing a child to watch a sexual act if the accused causes a person, who is under sixteen years of age (the complainant), to watch the accused sexual or a third person engaging in a sexual activity or to look at an image of a person engaging in a sexual activity.  (2) A person who commits an offence under subsection (1) is liable on summary conviction, to a fine of one million dollars and to imprisonment for five years and on conviction on indictment, to imprisonment for ten years.  (3) A person (the accused) is not guilty of an offence under this section, if the accused acts for the purpose of   (a) protecting the complainant from a sexually transmitted infection;  (b) protecting the physical safety of the complainant;  (c) preventing the complainant from becoming pregnant; or  (d) promoting the complainant's emotional well-being by the giving of advice  and not for the purpose of obtaining sexual gratification or for the purpose of causing or encouraging the activity constituting the offence or the complainant's participation in it. LAWS OF GUYANA 20 Cap. 8:03 Sexual Offences   L.R.O. 1/2012  Meeting a child under 16 years following sexual grooming.",
            "description": [
                {
                    "representation": "(1)",
                    "description": "is liable on summary conviction, to a fine of one million dollars and to imprisonment for five years and on conviction on indictment, to imprisonment for ten years."
                },
                {
                    "representation": "(2)",
                    "description": "A person who commits an offence under subsection"
                },
                {
                    "representation": "(3)",
                    "description": "A person"
                },
                {
                    "representation": "(a)",
                    "description": "protecting the complainant from a sexually transmitted infection;"
                },
                {
                    "representation": "(b)",
                    "description": "protecting the physical safety of the complainant;"
                },
                {
                    "representation": "(c)",
                    "description": "preventing the complainant from becoming pregnant; or"
                },
                {
                    "representation": "(d)",
                    "description": "promoting the complainant's emotional well-being by the giving of advice  and not for the purpose of obtaining sexual gratification or for the purpose of causing or encouraging the activity constituting the offence or the complainant's participation in it. LAWS OF GUYANA 20 Cap. 8:03 Sexual Offences   L.R.O. 1/2012  Meeting a child under 16 years following sexual grooming."
                }
            ]
        }
    },
    {
        "act": "SEXUAL OFFENCES ACT",
        "source": "https://mola.gov.gy/laws-of-guyana",
        "type": {
            "name": "section",
            "representation": "13",
            "title": "Meeting a child under 16 years following sexual grooming. ",
            "context": "SEXUAL OFFENCES ACT under Meeting a child under 16 years following sexual grooming. 13. (1) A person eighteen years of age or over (the accused) commits the offence of meeting a child following sexual grooming if   (a) having met or communicated with another person (the complainant) on at least two earlier occasions, the accused    (i) meets the complainant; or   (ii)  travels with the intention of meeting the complainant in any part of the world;  (b) at the time, the accused intends to do anything to or in respect of the complainant, during or after the meeting and in any part of the world, which if done will involve the commission by the accused of an offence under this Act; and  (c) the complainant is under sixteen years of age and the accused does not reasonably believe that the complainant is sixteen years of age or over.  (2) In subsection (l)(a) the reference to the accused having met or communicated with the complainant is a reference to the accused having met the complainant in any part of the world or having communicated with the complainant by any means from, to or in any part of the world.  (3) A person who commits an offence under this section is liable   LAWS OF GUYANA  Sexual Offences  Cap. 8:03 21  L.R.O. 1/2012              Close in age defence: complaint  age 12 to",
            "description": [
                {
                    "representation": "(1)",
                    "description": "A person eighteen years of age or over"
                },
                {
                    "representation": "(a)",
                    "description": "the reference to the accused having met or communicated with the complainant is a reference to the accused having met the complainant in any part of the world or having communicated with the complainant by any means from, to or in any part of the world."
                },
                {
                    "representation": "(i)",
                    "description": "meets the complainant; or"
                },
                {
                    "representation": "(b)",
                    "description": "at the time, the accused intends to do anything to or in respect of the complainant, during or after the meeting and in any part of the world, which if done will involve the commission by the accused of an offence under this Act; and"
                },
                {
                    "representation": "(c)",
                    "description": "the complainant is under sixteen years of age and the accused does not reasonably believe that the complainant is sixteen years of age or over."
                },
                {
                    "representation": "(2)",
                    "description": "In subsection"
                },
                {
                    "representation": "(3)",
                    "description": "A person who commits an offence under this section is liable   LAWS OF GUYANA  Sexual Offences  Cap. 8:03 21  L.R.O. 1/2012              Close in age defence: complaint  age 12 to"
                }
            ]
        }
    },
    {
        "act": "SEXUAL OFFENCES ACT",
        "source": "https://mola.gov.gy/laws-of-guyana",
        "type": {
            "name": "section",
            "representation": "14",
            "title": "Close in age defence: complainant aged 12 to ",
            "context": "SEXUAL OFFENCES ACT under Close in age defence: complainant aged 12 to 14.",
            "description": "14."
        }
    },
    {
        "act": "SEXUAL OFFENCES ACT",
        "source": "https://mola.gov.gy/laws-of-guyana",
        "type": {
            "name": "section",
            "representation": "15",
            "title": "Close in age defence: complainant aged 14 to ",
            "context": "SEXUAL OFFENCES ACT under Close in age defence: complainant aged 14 to 15. Where an accused is charged with an offence under sections 10, 11, 12 or 13 in respect of a complainant who is fourteen years of age or over but under sixteen years of age, it is a defence that the complainant consented to the activity that forms the subject-matter of the charge if the accused    (a) is less than four years older than the complainant; and  (b) is not in a position of trust or authority towards the complainant LAWS OF GUYANA 22 Cap. 8:03 Sexual Offences   L.R.O. 1/2012               Sexual activity with a child family member.                                    within the meaning of section 19, is not a person with whom the complainant is in a relationship of dependency and is not in a relationship with the complainant that is exploitative of the complainant.",
            "description": [
                {
                    "representation": "(a)",
                    "description": "is less than four years older than the complainant; and"
                },
                {
                    "representation": "(b)",
                    "description": "is not in a position of trust or authority towards the complainant LAWS OF GUYANA 22 Cap. 8:03 Sexual Offences   L.R.O. 1/2012               Sexual activity with a child family member.                                    within the meaning of section 19, is not a person with whom the complainant is in a relationship of dependency and is not in a relationship with the complainant that is exploitative of the complainant."
                }
            ]
        }
    },
    {
        "act": "SEXUAL OFFENCES ACT",
        "source": "https://mola.gov.gy/laws-of-guyana",
        "type": {
            "name": "section",
            "representation": "16",
            "title": "",
            "context": "SEXUAL OFFENCES ACT under 16. Sexual activity with a child family member.",
            "description": "Sexual activity with a child family member."
        }
    },
    {
        "act": "SEXUAL OFFENCES ACT",
        "source": "https://mola.gov.gy/laws-of-guyana",
        "type": {
            "name": "section",
            "representation": "17",
            "title": "Family relationships. ",
            "context": "SEXUAL OFFENCES ACT under Family relationships. 17. (1) For the purposes of section 16, the relation of one person (the accused) to another (the complainant) is a family relation where    (a) one of them is the other's parent, grandparent, brother, sister, half-brother, half-sister, aunt or uncle, or the accused is or has been the complainants foster parent.  (b) the accused and the complainant live or have lived in the same household, or the accused is or has been regularly involved in caring for, training, supervising or being in sole charge of the complainant, and    (i) one of them is or has been the other's step-parent (whether through legal marriage or cohabitation);  (ii) the accused and the complainant are cousins;  (iii) one of them is or has been the other's stepbrother or stepsister, or  (iv) the parent or present or former foster parent of one of them is or has been the other's foster parent; LAWS OF GUYANA  Sexual Offences  Cap. 8:03 25  L.R.O. 1/2012                                                   Sexual activity with a child by abusing position of trust.           (c) the accused and the complainant live in the same household, and the accused is regularly involved in caring for, training, supervising or being in sole charge of the complainant.  (2) For the purposes of this section    (a) aunt means the sister or half-sister of a person's parent, and \"uncle\" has a corresponding meaning;  (b) cousin means the child of an aunt or uncle;  (c) a person is a child's foster parent if so deemed under any law, deed, agreement, arrangement or court order.  (d) stepbrother and stepsister include the child of any step-parent.  Abuse of position of trust: sexual activity with a child",
            "description": [
                {
                    "representation": "(1)",
                    "description": "For the purposes of section 16, the relation of one person"
                },
                {
                    "representation": "(a)",
                    "description": "aunt means the sister or half-sister of a person's parent, and \"uncle\" has a corresponding meaning;"
                },
                {
                    "representation": "(b)",
                    "description": "cousin means the child of an aunt or uncle;"
                },
                {
                    "representation": "(i)",
                    "description": "one of them is or has been the other's step-parent"
                },
                {
                    "representation": "(c)",
                    "description": "a person is a child's foster parent if so deemed under any law, deed, agreement, arrangement or court order."
                },
                {
                    "representation": "(2)",
                    "description": "For the purposes of this section"
                },
                {
                    "representation": "(d)",
                    "description": "stepbrother and stepsister include the child of any step-parent.  Abuse of position of trust: sexual activity with a child"
                }
            ]
        }
    },
    {
        "act": "SEXUAL OFFENCES ACT",
        "source": "https://mola.gov.gy/laws-of-guyana",
        "type": {
            "name": "section",
            "representation": "18",
            "title": "Sexual activity with a child by abusing a position of trust.   LAWS OF GUYANA 4 Cap. 8:03 Sexual Offences   L.R.O. 1/2012  SECTION  ",
            "context": "SEXUAL OFFENCES ACT under Sexual activity with a child by abusing a position of trust.   LAWS OF GUYANA 4 Cap. 8:03 Sexual Offences   L.R.O. 1/2012  SECTION  18. (1) A person (\"the accused\") commits the offence of sexual activity with a child under eighteen years of age by abusing a position of trust in relation to that child (\"the complainant\") if    (a) the accused    (i) engages in sexual activity with the complainant;  (ii) causes the complainant to engage in sexual activity with a LAWS OF GUYANA 26 Cap. 8:03 Sexual Offences   L.R.O. 1/2012                                                  third party; or  (iii) causes the complainant to perform sexual acts including causing the complainant to masturbate;  (b) the accused is in a position of trust in relation to the complainant by virtue of circumstances within section 19 (1) (a), (b) or (c), and is not in a position of trust by virtue of other circumstances; and  (c) the accused knows or could reasonably be expected to know of the circumstances by virtue of which the accused is in a position of trust in relation to the complainant.  (2) Where in proceedings for an offence under this section it is proved that the accused was in a position of trust in relation to the complainant by virtue of circumstances within section 19 (1) (a), (b) or (c), and  it is not proved that the accused was in a position of trust by virtue of other circumstances, it is to be taken that the accused knew or could reasonably have been expected to know of the circumstances by virtue of which the accused was in such a position of trust unless prima facie evidence is adduced to raise an issue as to whether the accused knew or could reasonably have been expected to know of those circumstances.  (3) A person who commits an offence under this section is liable    (a) where the sexual activity included sexual penetration, on conviction on indictment to imprisonment for life;  LAWS OF GUYANA  Sexual Offences  Cap. 8:03 27  L.R.O. 1/2012                                         Position of trust.        (b) in any other case    (i) on summary conviction,  to a fine of one million dollars and to imprisonment for five years;  (ii) on conviction on indictment, to imprisonment for ten years.  (4) A person (the accused) does not commit an offence under this section if    (a) at the time the complainant is sixteen years of age or over and the accused and the complainant are lawfully married; or  (b) immediately before the accused entered into a position of trust with the complainant, a sexual relationship existed between them.  (5) Subsection (4) (b) does not apply if at the time referred to in that subsection sexual intercourse between the accused and the complainant would have been unlawful.  (6) In proceedings for an offence under this section it is for the accused to prove the matters mentioned in subsections (4) (a) and (b).",
            "description": [
                {
                    "representation": "(1)",
                    "description": "(a),"
                },
                {
                    "representation": "(a)",
                    "description": "at the time the complainant is sixteen years of age or over and the accused and the complainant are lawfully married; or"
                },
                {
                    "representation": "(i)",
                    "description": "on summary conviction,  to a fine of one million dollars and to imprisonment for five years;"
                },
                {
                    "representation": "(b)",
                    "description": "immediately before the accused entered into a position of trust with the complainant, a sexual relationship existed between them."
                },
                {
                    "representation": "(c)",
                    "description": "the accused knows or could reasonably be expected to know of the circumstances by virtue of which the accused is in a position of trust in relation to the complainant."
                },
                {
                    "representation": "(2)",
                    "description": "Where in proceedings for an offence under this section it is proved that the accused was in a position of trust in relation to the complainant by virtue of circumstances within section 19"
                },
                {
                    "representation": "(3)",
                    "description": "A person who commits an offence under this section is liable"
                },
                {
                    "representation": "(4)",
                    "description": "(a) and"
                },
                {
                    "representation": "(5)",
                    "description": "Subsection"
                },
                {
                    "representation": "(6)",
                    "description": "In proceedings for an offence under this section it is for the accused to prove the matters mentioned in subsections"
                }
            ]
        }
    },
    {
        "act": "SEXUAL OFFENCES ACT",
        "source": "https://mola.gov.gy/laws-of-guyana",
        "type": {
            "name": "section",
            "representation": "19",
            "title": "Position of trust. ",
            "context": "SEXUAL OFFENCES ACT under Position of trust. 19. (1) For the purposes of sections 14, 15 and 18, the positions of trust in relation to the accused and the complainant include, where   (a) the accused looks after persons, including the complainant, detained in an institution by virtue of a Court order or under any law; LAWS OF GUYANA 28 Cap. 8:03 Sexual Offences   L.R.O. 1/2012                                                   (b) the accused looks after persons, including the complainant, who are accommodated and cared for in one of the following institutions    (i) a hospital;  (ii) an independent clinic;  (iii) a care home, residential care home or private hospital; or  (iv) a community home, voluntary home, children's home or orphanage;  (c) the accused looks after persons who are receiving education at an educational institution (whether in the role of teacher or in another role) and the complainant is receiving, and the accused is not receiving, education at that institution;  (d) the accused is the guardian of the complainant;  (e) the accused is not appointed to be guardian of the complainant but is the legal or reputed husband or wife of one of the complainant's parents or guardians;  (f) the complainant is in vocational training and the accused looks after the complainant on an individual basis; or  LAWS OF GUYANA  Sexual Offences  Cap. 8:03 29  L.R.O. 1/2012                                          Obstructing prosecution.          (g) the accused is a social worker, probation officer, coach, instructor, minister of religion, babysitter, child-minder or has a welfare position in relation to the complainant, and has regular unsupervised contact with the complainant.  (2) For the purposes of subsection (1)    (a) the accused looks after persons under eighteen years of age if the accused is regularly involved in caring for, training, supervising or being in sole charge of such persons;  (b) the accused looks after the complainant on an individual basis if    (i) the accused is regularly involved in caring for, training or supervising the complainant; and  (ii) in the course of the involvement, the accused regularly has unsupervised contact with the complainant (whether face to face or by any other means).",
            "description": [
                {
                    "representation": "(1)",
                    "description": ""
                },
                {
                    "representation": "(a)",
                    "description": "the accused looks after persons under eighteen years of age if the accused is regularly involved in caring for, training, supervising or being in sole charge of such persons;"
                },
                {
                    "representation": "(b)",
                    "description": "the accused looks after the complainant on an individual basis if"
                },
                {
                    "representation": "(i)",
                    "description": "the accused is regularly involved in caring for, training or supervising the complainant; and"
                },
                {
                    "representation": "(c)",
                    "description": "the accused looks after persons who are receiving education at an educational institution"
                },
                {
                    "representation": "(d)",
                    "description": "the accused is the guardian of the complainant;"
                },
                {
                    "representation": "(e)",
                    "description": "the accused is not appointed to be guardian of the complainant but is the legal or reputed husband or wife of one of the complainant's parents or guardians;"
                },
                {
                    "representation": "(f)",
                    "description": "the complainant is in vocational training and the accused looks after the complainant on an individual basis; or  LAWS OF GUYANA  Sexual Offences  Cap. 8:03 29  L.R.O. 1/2012                                          Obstructing prosecution."
                },
                {
                    "representation": "(g)",
                    "description": "the accused is a social worker, probation officer, coach, instructor, minister of religion, babysitter, child-minder or has a welfare position in relation to the complainant, and has regular unsupervised contact with the complainant."
                },
                {
                    "representation": "(2)",
                    "description": "For the purposes of subsection"
                }
            ]
        }
    },
    {
        "act": "SEXUAL OFFENCES ACT",
        "source": "https://mola.gov.gy/laws-of-guyana",
        "type": {
            "name": "section",
            "representation": "20",
            "title": "Obstructing prosecution. ",
            "context": "SEXUAL OFFENCES ACT under Obstructing prosecution. 20. (1) In proceedings relating to an offence under this Act, a person commits the offence of obstructing the prosecution if that person prevents a child from   (a) giving a statement to the police;  (b) giving evidence in any other way which would be admissible for the paper committal; or  LAWS OF GUYANA 30 Cap. 8:03 Sexual Offences   L.R.O. 1/2012          Arranging or facilitating the commission of child sex offence.                                    (c) testifying.  (2) A person who commits an offence under subsection (1) is liable on summary conviction to a fine of one million dollars and to imprisonment for five years.",
            "description": [
                {
                    "representation": "(1)",
                    "description": "is liable on summary conviction to a fine of one million dollars and to imprisonment for five years."
                },
                {
                    "representation": "(a)",
                    "description": "giving a statement to the police;"
                },
                {
                    "representation": "(b)",
                    "description": "giving evidence in any other way which would be admissible for the paper committal; or  LAWS OF GUYANA 30 Cap. 8:03 Sexual Offences   L.R.O. 1/2012          Arranging or facilitating the commission of child sex offence."
                },
                {
                    "representation": "(c)",
                    "description": "testifying."
                },
                {
                    "representation": "(2)",
                    "description": "A person who commits an offence under subsection"
                }
            ]
        }
    },
    {
        "act": "SEXUAL OFFENCES ACT",
        "source": "https://mola.gov.gy/laws-of-guyana",
        "type": {
            "name": "section",
            "representation": "21",
            "title": "Arranging or facilitating commission of child sex offence.  Vulnerable adults Sex with adult family member  ",
            "context": "SEXUAL OFFENCES ACT under Arranging or facilitating commission of child sex offence.  Vulnerable adults Sex with adult family member  21. (1) A person (the accused) commits the offence of arranging or facilitating the commission of a child sex offence if the accused intentionally arranges or facilitates something that the accused intends to do, intends another person to do, or believes that another person will do, in any part of the world, and doing it will involve the commission of an offence under section 10, 11, 12, 13, 16 or",
            "description": [
                {
                    "representation": "(1)",
                    "description": "A person"
                }
            ]
        }
    },
    {
        "act": "SEXUAL OFFENCES ACT",
        "source": "https://mola.gov.gy/laws-of-guyana",
        "type": {
            "name": "section",
            "representation": "22",
            "title": "Sex with adult family member. ",
            "context": "SEXUAL OFFENCES ACT under Sex with adult family member. 22. (1) A person (the accused) sixteen years of age or over commits the offence of sex with an adult family member if the accused    (a) engages in sexual penetration with another person (\"the complainant\") who is eighteen years of age or over;  (b) is related to the complainant as parent, grandparent, child, grandchild, brother, sister, half brother, half sister, uncle, aunt, nephew or niece; and   (c) knew or could reasonably be expected to have known that the accused was related to the complainant in a LAWS OF GUYANA 32 Cap. 8:03 Sexual Offences   L.R.O. 1/2012                                                 Obtaining sexual activity with a person with a mental  disorder by  inducement, threat or  deception.           manner specified in paragraph (b).  (2) Where in proceedings for an offence under this section it is proved that the accused was related to the complainant in any manner specified in subsection (1) (b), it is to be taken that the accused knew or could reasonably have been expected to know of the relationship between them unless prima facie evidence is adduced to raise an issue as to whether the accused knew or could reasonably have been expected to know of the relationship.  (3) A person who commits an offence under this section is liable    (a) on summary conviction, to a fine of five hundred thousand dollars and to imprisonment for two years;  (b) on conviction on indictment, to imprisonment for five years.   Obtaining sexual activity by inducement, threat, deception",
            "description": [
                {
                    "representation": "(1)",
                    "description": "(b), it is to be taken that the accused knew or could reasonably have been expected to know of the relationship between them unless prima facie evidence is adduced to raise an issue as to whether the accused knew or could reasonably have been expected to know of the relationship."
                },
                {
                    "representation": "(a)",
                    "description": "on summary conviction, to a fine of five hundred thousand dollars and to imprisonment for two years;"
                },
                {
                    "representation": "(b)",
                    "description": "on conviction on indictment, to imprisonment for five years.   Obtaining sexual activity by inducement, threat, deception"
                },
                {
                    "representation": "(c)",
                    "description": "knew or could reasonably be expected to have known that the accused was related to the complainant in a LAWS OF GUYANA 32 Cap. 8:03 Sexual Offences   L.R.O. 1/2012                                                 Obtaining sexual activity with a person with a mental  disorder by  inducement, threat or  deception.           manner specified in paragraph"
                },
                {
                    "representation": "(2)",
                    "description": "Where in proceedings for an offence under this section it is proved that the accused was related to the complainant in any manner specified in subsection"
                },
                {
                    "representation": "(3)",
                    "description": "A person who commits an offence under this section is liable"
                }
            ]
        }
    },
    {
        "act": "SEXUAL OFFENCES ACT",
        "source": "https://mola.gov.gy/laws-of-guyana",
        "type": {
            "name": "section",
            "representation": "23",
            "title": "Obtaining sexual activity with a person with a mental disorder by inducement, threat or deception. ",
            "context": "SEXUAL OFFENCES ACT under Obtaining sexual activity with a person with a mental disorder by inducement, threat or deception. 23. (1) A person (the accused) commits the offence of obtaining sexual activity with a person with a mental disorder by inducement, threat or deception if    (a) with the agreement of another person (\"the complainant\"), the accused    (i) engages in sexual activity with the complainant;  (ii) causes or incites the complainant to engage in sexual activity with a third party; or  LAWS OF GUYANA  Sexual Offences  Cap. 8:03 33  L.R.O. 1/2012                                        Causing a person with a mental disorder to watch a sexual act by inducement, threat or deception.       (iii) causes the complainant to perform sexual acts including but not limited to causing the complainant to masturbate;  (b) the accused obtains the complainant's agreement by means of an inducement offered or given, a threat made or a deception practised by the accused for that purpose; and  (c) the complainant has a mental disorder and the accused knows or could reasonably be expected to know that the complainant has a mental disorder.  (2) A person who commits an offence under this section, if sexual activity involved sexual penetration is liable, on conviction on indictment, to imprisonment for life.  (3) Unless subsection (2) applies, a person guilty of an offence under this section is liable on summary conviction to a fine of one million dollars and to imprisonment for five years, and on conviction on indictment to imprisonment for fourteen years.",
            "description": [
                {
                    "representation": "(1)",
                    "description": "A person"
                },
                {
                    "representation": "(a)",
                    "description": "with the agreement of another person"
                },
                {
                    "representation": "(i)",
                    "description": "engages in sexual activity with the complainant;"
                },
                {
                    "representation": "(b)",
                    "description": "the accused obtains the complainant's agreement by means of an inducement offered or given, a threat made or a deception practised by the accused for that purpose; and"
                },
                {
                    "representation": "(c)",
                    "description": "the complainant has a mental disorder and the accused knows or could reasonably be expected to know that the complainant has a mental disorder."
                },
                {
                    "representation": "(2)",
                    "description": "applies, a person guilty of an offence under this section is liable on summary conviction to a fine of one million dollars and to imprisonment for five years, and on conviction on indictment to imprisonment for fourteen years."
                },
                {
                    "representation": "(3)",
                    "description": "Unless subsection"
                }
            ]
        }
    },
    {
        "act": "SEXUAL OFFENCES ACT",
        "source": "https://mola.gov.gy/laws-of-guyana",
        "type": {
            "name": "section",
            "representation": "24",
            "title": "Causing a person with a mental disorder to watch a sexual act by inducement, threat or deception. ",
            "context": "SEXUAL OFFENCES ACT under Causing a person with a mental disorder to watch a sexual act by inducement, threat or deception. 24. (1) A person (the accused) commits the offence of causing a person with a mental disorder to watch a sexual act or to look at an image of a person engaging in a sexual activity if   (a) with the agreement of another person (the complainant), the accused causes the complainant to watch a third person engage in a sexual activity, or to look at an image of any person engaging in a sexual activity;  (b) the complainant agrees to watch or LAWS OF GUYANA 34 Cap. 8:03 Sexual Offences   L.R.O. 1/2012                                                  look because of an inducement offered or given, a threat made or a deception practised by the accused for the purpose of obtaining that agreement; and  (c) the complainant has a mental disorder and the accused knows or could reasonably be expected to know that the complainant has a mental disorder.  (2) A person who commits an offence under this section is liable on summary conviction to a fine of one million dollars and to imprisonment for five years and on conviction on indictment to imprisonment for ten years.  (3) A person (the accused) is not guilty of an offence under this section, if the accused acts for the purpose of    (a) protecting the complainant from a sexually transmitted infection;  (b) protecting the physical safety of the complainant;  (c) preventing the complainant from becoming pregnant; or  (d) promoting the complainant's emotional well-being by the giving of advice,  and not for the purpose of obtaining sexual gratification or for the purpose of causing or encouraging the activity constituting the offence or the complainant's participation in it.  LAWS OF GUYANA  Sexual Offences  Cap. 8:03 35  L.R.O. 1/2012                 are worker engaging in, causing or inciting sexual activity with a person with a mental disorder.                                       Care workers for persons with a mental disorder",
            "description": [
                {
                    "representation": "(1)",
                    "description": "A person"
                },
                {
                    "representation": "(a)",
                    "description": "protecting the complainant from a sexually transmitted infection;"
                },
                {
                    "representation": "(b)",
                    "description": "protecting the physical safety of the complainant;"
                },
                {
                    "representation": "(c)",
                    "description": "preventing the complainant from becoming pregnant; or"
                },
                {
                    "representation": "(2)",
                    "description": "A person who commits an offence under this section is liable on summary conviction to a fine of one million dollars and to imprisonment for five years and on conviction on indictment to imprisonment for ten years."
                },
                {
                    "representation": "(3)",
                    "description": "A person"
                },
                {
                    "representation": "(d)",
                    "description": "promoting the complainant's emotional well-being by the giving of advice,  and not for the purpose of obtaining sexual gratification or for the purpose of causing or encouraging the activity constituting the offence or the complainant's participation in it.  LAWS OF GUYANA  Sexual Offences  Cap. 8:03 35  L.R.O. 1/2012                 are worker engaging in, causing or inciting sexual activity with a person with a mental disorder.                                       Care workers for persons with a mental disorder"
                }
            ]
        }
    },
    {
        "act": "SEXUAL OFFENCES ACT",
        "source": "https://mola.gov.gy/laws-of-guyana",
        "type": {
            "name": "section",
            "representation": "25",
            "title": "Care worker engaging in, causing or inciting sexual activity with a person with a mental disorder. ",
            "context": "SEXUAL OFFENCES ACT under Care worker engaging in, causing or inciting sexual activity with a person with a mental disorder. 25. (1) A person (\"the accused\") who is a care worker, commits the offence of a care worker engaging in, causing or inciting sexual activity with a person (\"the complainant\") if    (a) the accused    (i) engages in sexual activity with the complainant;  (ii) causes or incites the complainant to engage in sexual activity with a third party; or  (iii) causes or incites the complainant to perform sexual acts including but not limited to causing the complainant to masturbate;  (b) the complainant has a mental disorder and the accused knows or could reasonably be expected to know that the complainant has a mental disorder; and  (c) the accused is involved in the complainant's care in a way that falls within section",
            "description": [
                {
                    "representation": "(1)",
                    "description": "A person"
                },
                {
                    "representation": "(a)",
                    "description": "the accused"
                },
                {
                    "representation": "(i)",
                    "description": "engages in sexual activity with the complainant;"
                },
                {
                    "representation": "(b)",
                    "description": "the complainant has a mental disorder and the accused knows or could reasonably be expected to know that the complainant has a mental disorder; and"
                },
                {
                    "representation": "(c)",
                    "description": "the accused is involved in the complainant's care in a way that falls within section"
                }
            ]
        }
    },
    {
        "act": "SEXUAL OFFENCES ACT",
        "source": "https://mola.gov.gy/laws-of-guyana",
        "type": {
            "name": "section",
            "representation": "26",
            "title": "Care worker causing a person with a mental disorder to watch a sexual act. ",
            "context": "SEXUAL OFFENCES ACT under Care worker causing a person with a mental disorder to watch a sexual act. 26. (1) A person (\"the accused\") commits the offence of a care worker causing a person with a mental disorder to watch a sexual act or to look at an image of any person engaging in a sexual activity if   (a) for the purpose of obtaining sexual gratification, the accused causes another person (\"the complainant\"),  to watch a third person engaging in a sexual activity or to look at an image of any person engaging in a sexual activity;  (b) the complainant has a mental disorder and the accused knows or could reasonably be expected to know that the complainant has a mental disorder; and  (c) the accused is involved in the complainant's care in a way that falls within section",
            "description": [
                {
                    "representation": "(1)",
                    "description": "A person"
                },
                {
                    "representation": "(a)",
                    "description": "for the purpose of obtaining sexual gratification, the accused causes another person"
                },
                {
                    "representation": "(b)",
                    "description": "the complainant has a mental disorder and the accused knows or could reasonably be expected to know that the complainant has a mental disorder; and"
                },
                {
                    "representation": "(c)",
                    "description": "the accused is involved in the complainant's care in a way that falls within section"
                }
            ]
        }
    },
    {
        "act": "SEXUAL OFFENCES ACT",
        "source": "https://mola.gov.gy/laws-of-guyana",
        "type": {
            "name": "section",
            "representation": "27",
            "title": "Interpretation of care worker.  Other Offences  ",
            "context": "SEXUAL OFFENCES ACT under Interpretation of care worker.  Other Offences  27.  (2) Where in proceedings for an offence under this section it is proved that the complainant had a mental disorder, it is to be taken that the accused knew or could reasonably have been expected to know that the complainant had a mental disorder unless prima facie evidence is adduced to raise an issue as to whether the accused knew or could reasonably have been expected to know it. LAWS OF GUYANA 36 Cap. 8:03 Sexual Offences   L.R.O. 1/2012                                                    (3) A person who commits an offence under this section, if the sexual activity involved sexual penetration, is liable, on conviction on indictment, to imprisonment for life.  (4) Unless subsection (3) applies, a person guilty of an offence under this section is liable    (a) on summary conviction, to a fine of one million dollars and to imprisonment for five years;  (b) on conviction on indictment, to imprisonment for ten years.  (5) A person (the accused) does not commit an offence under this section if    (a) at the time the complainant is eighteen years of age or over, and the accused and the complainant are lawfully married; or  (b) immediately before the accused became involved in the complainant's care in a way that falls within section 27, a sexual relationship existed between the accused and the complainant.  (6) Subsection (5) (b) does not apply if at that time sexual intercourse between the accused and the complainant would have been unlawful.  (7) In proceedings for an offence under this section it is for the accused to prove the matters mentioned in subsection (5) (a) and (b).   LAWS OF GUYANA  Sexual Offences  Cap. 8:03 37  L.R.O. 1/2012 Care worker causing a  person with a mental  disorder to watch a sexual act.",
            "description": [
                {
                    "representation": "(2)",
                    "description": "Where in proceedings for an offence under this section it is proved that the complainant had a mental disorder, it is to be taken that the accused knew or could reasonably have been expected to know that the complainant had a mental disorder unless prima facie evidence is adduced to raise an issue as to whether the accused knew or could reasonably have been expected to know it. LAWS OF GUYANA 36 Cap. 8:03 Sexual Offences   L.R.O. 1/2012"
                },
                {
                    "representation": "(3)",
                    "description": "applies, a person guilty of an offence under this section is liable"
                },
                {
                    "representation": "(4)",
                    "description": "Unless subsection"
                },
                {
                    "representation": "(a)",
                    "description": "at the time the complainant is eighteen years of age or over, and the accused and the complainant are lawfully married; or"
                },
                {
                    "representation": "(b)",
                    "description": "immediately before the accused became involved in the complainant's care in a way that falls within section 27, a sexual relationship existed between the accused and the complainant."
                },
                {
                    "representation": "(5)",
                    "description": "(a) and"
                },
                {
                    "representation": "(6)",
                    "description": "Subsection"
                },
                {
                    "representation": "(7)",
                    "description": "In proceedings for an offence under this section it is for the accused to prove the matters mentioned in subsection"
                }
            ]
        }
    },
    {
        "act": "SEXUAL OFFENCES ACT",
        "source": "https://mola.gov.gy/laws-of-guyana",
        "type": {
            "name": "section",
            "representation": "28",
            "title": "Exposure of genitals. ",
            "context": "SEXUAL OFFENCES ACT under Exposure of genitals. 28. (1) A person (the accused) commits the offence of exposure of the genitals if the accused   (a) intentionally exposes the genitals of the accused; and  (b) intends that someone will see the genitals of the accused and be caused alarm or distress.  (2) A person who commits an offence under this section is liable    (a) on summary conviction, to a fine of five hundred thousand dollars and to imprisonment for two years;  (b) on conviction on indictment, to imprisonment for five years.",
            "description": [
                {
                    "representation": "(1)",
                    "description": "A person"
                },
                {
                    "representation": "(a)",
                    "description": "on summary conviction, to a fine of five hundred thousand dollars and to imprisonment for two years;"
                },
                {
                    "representation": "(b)",
                    "description": "on conviction on indictment, to imprisonment for five years."
                },
                {
                    "representation": "(2)",
                    "description": "A person who commits an offence under this section is liable"
                }
            ]
        }
    },
    {
        "act": "SEXUAL OFFENCES ACT",
        "source": "https://mola.gov.gy/laws-of-guyana",
        "type": {
            "name": "section",
            "representation": "29",
            "title": "Voyeurism. ",
            "context": "SEXUAL OFFENCES ACT under Voyeurism. 29. (1) A person (the accused) commits the offence LAWS OF GUYANA  Sexual Offences  Cap. 8:03 41  L.R.O. 1/2012                                                 of voyeurism if   (a) for the purpose of obtaining sexual gratification, the accused observes another person (the complainant) doing a private act without the express consent of the complainant to being observed for sexual gratification;  (b) the accused installs equipment, or constructs or adapts a structure or part of a structure, with the intention of enabling himself or another person to commit an offence under paragraph (a);  (c) the accused operates equipment with the intention of enabling another person to observe, for the purpose of obtaining sexual gratification, a third person (the complainant) doing a private act without the express consent of the complainant to operating equipment with that intention; or  (d) the accused records another person (the complainant) doing a private act with the intention that the accused or a third person will, for the purpose of obtaining sexual gratification, look at an image of the complainant doing the act without the express consent of the complainant to record the act with that intention.  (2) A person who commits an offence under this section is liable   LAWS OF GUYANA 42 Cap. 8:03 Sexual Offences   L.R.O. 1/2012             Interpretation of voyeurism.                        Intercourse with an animal.              (a) on summary conviction, to a fine of five hundred thousand dollars and to imprisonment for two years;  (b) on conviction on indictment, to imprisonment for five years.",
            "description": [
                {
                    "representation": "(1)",
                    "description": "A person"
                },
                {
                    "representation": "(a)",
                    "description": "on summary conviction, to a fine of five hundred thousand dollars and to imprisonment for two years;"
                },
                {
                    "representation": "(b)",
                    "description": "on conviction on indictment, to imprisonment for five years."
                },
                {
                    "representation": "(c)",
                    "description": "the accused operates equipment with the intention of enabling another person to observe, for the purpose of obtaining sexual gratification, a third person"
                },
                {
                    "representation": "(d)",
                    "description": "the accused records another person"
                },
                {
                    "representation": "(2)",
                    "description": "A person who commits an offence under this section is liable   LAWS OF GUYANA 42 Cap. 8:03 Sexual Offences   L.R.O. 1/2012             Interpretation of voyeurism.                        Intercourse with an animal."
                }
            ]
        }
    },
    {
        "act": "SEXUAL OFFENCES ACT",
        "source": "https://mola.gov.gy/laws-of-guyana",
        "type": {
            "name": "section",
            "representation": "30",
            "title": "Interpretation of voyeurism. ",
            "context": "SEXUAL OFFENCES ACT under Interpretation of voyeurism. 30. (1) For the purposes of section 29, a person is doing a private act if the person is in a place which, in the circumstances, would reasonably be expected to provide privacy, and   (a) the person's genitals, buttocks or breasts are exposed or covered only with underwear;  (b) the person is using a lavatory; or  (c) the person is doing a sexual act that is not of a kind ordinarily done in public.  (2) In section 29, \"structure\" includes a tent, vehicle or vessel or other temporary or movable structure.",
            "description": [
                {
                    "representation": "(1)",
                    "description": "For the purposes of section 29, a person is doing a private act if the person is in a place which, in the circumstances, would reasonably be expected to provide privacy, and"
                },
                {
                    "representation": "(a)",
                    "description": "the person's genitals, buttocks or breasts are exposed or covered only with underwear;"
                },
                {
                    "representation": "(b)",
                    "description": "the person is using a lavatory; or"
                },
                {
                    "representation": "(c)",
                    "description": "the person is doing a sexual act that is not of a kind ordinarily done in public."
                },
                {
                    "representation": "(2)",
                    "description": "In section 29, \"structure\" includes a tent, vehicle or vessel or other temporary or movable structure."
                }
            ]
        }
    },
    {
        "act": "SEXUAL OFFENCES ACT",
        "source": "https://mola.gov.gy/laws-of-guyana",
        "type": {
            "name": "section",
            "representation": "31",
            "title": "Intercourse with an animal.  Preparatory offences  ",
            "context": "SEXUAL OFFENCES ACT under Intercourse with an animal.  Preparatory offences  31. (1) A person commits the offence of intercourse with an animal if he, with his penis penetrates the vagina or anus of a living animal, and he knows that, or is reckless as to whether, it is the vagina or anus of a living animal that is penetrated.  (2) A person commits an offence of intercourse with an animal if she causes, or allows, her vagina or anus to be penetrated by the penis of a living animal, and she knows that, or is reckless as to whether, it is the penis of an animal she is being penetrated by.  LAWS OF GUYANA  Sexual Offences  Cap. 8:03 43  L.R.O. 1/2012                 Administering a substance with intent.                                 Committing an offence with intent to commit a (3) A person who commits an offence under this section is liable   (a) on summary conviction, to a fine of one million dollars and to imprisonment for two years;  (b) on conviction on indictment, to imprisonment for five years.  Preparatory offences",
            "description": [
                {
                    "representation": "(1)",
                    "description": "A person commits the offence of intercourse with an animal if he, with his penis penetrates the vagina or anus of a living animal, and he knows that, or is reckless as to whether, it is the vagina or anus of a living animal that is penetrated."
                },
                {
                    "representation": "(2)",
                    "description": "A person commits an offence of intercourse with an animal if she causes, or allows, her vagina or anus to be penetrated by the penis of a living animal, and she knows that, or is reckless as to whether, it is the penis of an animal she is being penetrated by.  LAWS OF GUYANA  Sexual Offences  Cap. 8:03 43  L.R.O. 1/2012                 Administering a substance with intent.                                 Committing an offence with intent to commit a"
                },
                {
                    "representation": "(3)",
                    "description": "A person who commits an offence under this section is liable"
                },
                {
                    "representation": "(a)",
                    "description": "on summary conviction, to a fine of one million dollars and to imprisonment for two years;"
                },
                {
                    "representation": "(b)",
                    "description": "on conviction on indictment, to imprisonment for five years.  Preparatory offences"
                }
            ]
        }
    },
    {
        "act": "SEXUAL OFFENCES ACT",
        "source": "https://mola.gov.gy/laws-of-guyana",
        "type": {
            "name": "section",
            "representation": "32",
            "title": "Administering a substance with intent. ",
            "context": "SEXUAL OFFENCES ACT under Administering a substance with intent. 32. (1) A person (the accused) commits the offence of administering a substance with intent if the accused administers a substance to, or causes a substance to be taken by, another person (the complainant)   (a) knowing that the complainant does not consent; and  (b) with the intention of stupefying or overpowering the complainant, so as to enable any person to engage in a sexual activity that involves the complainant.  (2) A person who commits an offence under this section is liable   (a) on summary conviction, to a fine of one million dollars and to imprisonment for five years;  (b) on conviction on indictment, to imprisonment for ten years.",
            "description": [
                {
                    "representation": "(1)",
                    "description": "A person"
                },
                {
                    "representation": "(a)",
                    "description": "on summary conviction, to a fine of one million dollars and to imprisonment for five years;"
                },
                {
                    "representation": "(b)",
                    "description": "on conviction on indictment, to imprisonment for ten years."
                },
                {
                    "representation": "(2)",
                    "description": "A person who commits an offence under this section is liable"
                }
            ]
        }
    },
    {
        "act": "SEXUAL OFFENCES ACT",
        "source": "https://mola.gov.gy/laws-of-guyana",
        "type": {
            "name": "section",
            "representation": "33",
            "title": "Committing an offence with intent to commit a sexual offence. ",
            "context": "SEXUAL OFFENCES ACT under Committing an offence with intent to commit a sexual offence. 33. (1) A person commits the offence of committing an offence with intent to commit a sexual offence if the person commits any offence with the intention of committing a LAWS OF GUYANA 44 Cap. 8:03 Sexual Offences   L.R.O. 1/2012  sexual offence.                        Trespass with intent to commit a sexual offence.                        sexual offence under this Act.  (2) A person who commits an offence under this section is liable on conviction on indictment, where the offence is committed by kidnapping or false imprisonment, to imprisonment for life.  (3) Unless subsection (2) applies, a person guilty of an offence under this section is liable   (a) on summary conviction, to a fine of one million dollars and to imprisonment for five years;  (b) on conviction on indictment, to imprisonment for ten years.",
            "description": [
                {
                    "representation": "(1)",
                    "description": "A person commits the offence of committing an offence with intent to commit a sexual offence if the person commits any offence with the intention of committing a LAWS OF GUYANA 44 Cap. 8:03 Sexual Offences   L.R.O. 1/2012  sexual offence.                        Trespass with intent to commit a sexual offence.                        sexual offence under this Act."
                },
                {
                    "representation": "(2)",
                    "description": "applies, a person guilty of an offence under this section is liable"
                },
                {
                    "representation": "(3)",
                    "description": "Unless subsection"
                },
                {
                    "representation": "(a)",
                    "description": "on summary conviction, to a fine of one million dollars and to imprisonment for five years;"
                },
                {
                    "representation": "(b)",
                    "description": "on conviction on indictment, to imprisonment for ten years."
                }
            ]
        }
    },
    {
        "act": "SEXUAL OFFENCES ACT",
        "source": "https://mola.gov.gy/laws-of-guyana",
        "type": {
            "name": "section",
            "representation": "34",
            "title": "Trespass with intent to commit a sexual offence. ",
            "context": "SEXUAL OFFENCES ACT under Trespass with intent to commit a sexual offence. 34. (1) A person commits an offence of trespass with intent to commit a sexual offence if the  person   (a) is a trespasser on any premises;  (b) intends to commit a sexual offence under this Act on the premises; and  (c) knows that, or is reckless as to whether, the person is a trespasser.  (2) In this section   (a) premises includes a structure or part of a structure;  (b) structure includes a tent, vehicle or vessel or other temporary or movable structure.  (3) A person who commits an offence under this section is liable  LAWS OF GUYANA  Sexual Offences  Cap. 8:03 45  L.R.O. 1/2012           Offences outside Guyana.                                     (a) on summary conviction, to a fine of one million dollars and to imprisonment for five years;  (b) on conviction on indictment, to imprisonment for ten years.",
            "description": [
                {
                    "representation": "(1)",
                    "description": "A person commits an offence of trespass with intent to commit a sexual offence if the  person"
                },
                {
                    "representation": "(a)",
                    "description": "on summary conviction, to a fine of one million dollars and to imprisonment for five years;"
                },
                {
                    "representation": "(b)",
                    "description": "on conviction on indictment, to imprisonment for ten years."
                },
                {
                    "representation": "(c)",
                    "description": "knows that, or is reckless as to whether, the person is a trespasser."
                },
                {
                    "representation": "(2)",
                    "description": "In this section"
                },
                {
                    "representation": "(3)",
                    "description": "A person who commits an offence under this section is liable  LAWS OF GUYANA  Sexual Offences  Cap. 8:03 45  L.R.O. 1/2012           Offences outside Guyana."
                }
            ]
        }
    },
    {
        "act": "SEXUAL OFFENCES ACT",
        "source": "https://mola.gov.gy/laws-of-guyana",
        "type": {
            "name": "section",
            "representation": "35",
            "title": "Offences outside Guyana.  Conspiracy, attempt, incitement, aiding, etc.  ",
            "context": "SEXUAL OFFENCES ACT under Offences outside Guyana.  Conspiracy, attempt, incitement, aiding, etc.  35. (1) Any conduct or act done by a resident or citizen of Guyana in a country or territory outside Guyana shall be deemed to be a sexual offence under the law of Guyana if the conduct or act   (a) constituted an offence under the law in force in that country or territory; and  (b) would constitute a sexual offence under this Act  had it been committed in Guyana.  (2) For the purposes of this section, conduct or an act punishable under the law in force in any country or territory outside Guyana constitutes an offence under that law, however it is described in that law.  (3) The conduct or act referred to in subsection (1) shall be deemed to be an offence under this Act unless the person charged serves on the prosecution a notice, no later than rules of Court shall provide, that the conduct or act alleged does not constitute an offence and his reasons for so stating.  (4) The Court if it thinks fit, may require the prosecution to prove that the conduct or act constitutes an offence under this Act, whether or not the person charged serves such a notice.  (5) In the Court the question whether the conduct LAWS OF GUYANA 46 Cap. 8:03 Sexual Offences   L.R.O. 1/2012          Punishment of attempt to commit, etc. offence against this Act.                        Marital and other relationships.           Abolition of presumption that male  or act constitutes an offence under this Act shall be decided by the judge alone.  Conspiracy, attempt, incitement, aiding, etc.",
            "description": [
                {
                    "representation": "(1)",
                    "description": "shall be deemed to be an offence under this Act unless the person charged serves on the prosecution a notice, no later than rules of Court shall provide, that the conduct or act alleged does not constitute an offence and his reasons for so stating."
                },
                {
                    "representation": "(a)",
                    "description": "constituted an offence under the law in force in that country or territory; and"
                },
                {
                    "representation": "(b)",
                    "description": "would constitute a sexual offence under this Act  had it been committed in Guyana."
                },
                {
                    "representation": "(2)",
                    "description": "For the purposes of this section, conduct or an act punishable under the law in force in any country or territory outside Guyana constitutes an offence under that law, however it is described in that law."
                },
                {
                    "representation": "(3)",
                    "description": "The conduct or act referred to in subsection"
                },
                {
                    "representation": "(4)",
                    "description": "The Court if it thinks fit, may require the prosecution to prove that the conduct or act constitutes an offence under this Act, whether or not the person charged serves such a notice."
                },
                {
                    "representation": "(5)",
                    "description": "In the Court the question whether the conduct LAWS OF GUYANA 46 Cap. 8:03 Sexual Offences   L.R.O. 1/2012          Punishment of attempt to commit, etc. offence against this Act.                        Marital and other relationships.           Abolition of presumption that male  or act constitutes an offence under this Act shall be decided by the judge alone.  Conspiracy, attempt, incitement, aiding, etc."
                }
            ]
        }
    },
    {
        "act": "SEXUAL OFFENCES ACT",
        "source": "https://mola.gov.gy/laws-of-guyana",
        "type": {
            "name": "section",
            "representation": "36",
            "title": "Punishment of attempt to commit etc. offence against this Act.    LAWS OF GUYANA  Sexual Offences  Cap. 8:03 5  L.R.O. 1/2012  SECTION  Supplementary and general  ",
            "context": "SEXUAL OFFENCES ACT under Punishment of attempt to commit etc. offence against this Act.    LAWS OF GUYANA  Sexual Offences  Cap. 8:03 5  L.R.O. 1/2012  SECTION  Supplementary and general  36. Notwithstanding anything contained in any other written law, every person who   (a) attempts to commit;  (b) conspires with any other person to commit;  (c) solicits, incites, aids, abets or counsels or attempts to solicit, incite, aid, abet or counsel any other person to commit; or  (d) causes or procures, or attempts to cause or procure the commission of,  any offence, whether summary or indictable, against this Act may be charged with, tried, convicted and punished in all respects as if that person were a principal offender.  Supplementary and general",
            "description": [
                {
                    "representation": "(a)",
                    "description": "attempts to commit;"
                },
                {
                    "representation": "(b)",
                    "description": "conspires with any other person to commit;"
                },
                {
                    "representation": "(c)",
                    "description": "solicits, incites, aids, abets or counsels or attempts to solicit, incite, aid, abet or counsel any other person to commit; or"
                },
                {
                    "representation": "(d)",
                    "description": "causes or procures, or attempts to cause or procure the commission of,  any offence, whether summary or indictable, against this Act may be charged with, tried, convicted and punished in all respects as if that person were a principal offender.  Supplementary and general"
                }
            ]
        }
    },
    {
        "act": "SEXUAL OFFENCES ACT",
        "source": "https://mola.gov.gy/laws-of-guyana",
        "type": {
            "name": "section",
            "representation": "37",
            "title": "Marital and other relationships. ",
            "context": "SEXUAL OFFENCES ACT under Marital and other relationships. 37. (1) Unless where specifically stated in this Act, a marital or other relationship, previous or existing, is not a defence to a charge of any offence under this Act.  (2) A proposal of marriage, made by the accused or any other party, to the complainant is not a defence to, nor does it have any bearing on, a charge of any offence under this Act.",
            "description": [
                {
                    "representation": "(1)",
                    "description": "Unless where specifically stated in this Act, a marital or other relationship, previous or existing, is not a defence to a charge of any offence under this Act."
                },
                {
                    "representation": "(2)",
                    "description": "A proposal of marriage, made by the accused or any other party, to the complainant is not a defence to, nor does it have any bearing on, a charge of any offence under this Act."
                }
            ]
        }
    },
    {
        "act": "SEXUAL OFFENCES ACT",
        "source": "https://mola.gov.gy/laws-of-guyana",
        "type": {
            "name": "section",
            "representation": "38",
            "title": "Abolition of presumption that male under 14 years incapable of sexual intercourse. ",
            "context": "SEXUAL OFFENCES ACT under Abolition of presumption that male under 14 years incapable of sexual intercourse. 38. The presumption of criminal law that a male under fourteen years of age is incapable of sexual intercourse is abolished. LAWS OF GUYANA  Sexual Offences  Cap. 8:03 47  L.R.O. 1/2012 under 14 years incapable of sexual intercourse.  Charge laid under law in force when offence committed.                      Divestment of authority over child.                             Mandatory record and investigation.",
            "description": "The presumption of criminal law that a male under fourteen years of age is incapable of sexual intercourse is abolished. LAWS OF GUYANA  Sexual Offences  Cap. 8:03 47  L.R.O. 1/2012 under 14 years incapable of sexual intercourse.  Charge laid under law in force when offence committed.                      Divestment of authority over child.                             Mandatory record and investigation."
        }
    },
    {
        "act": "SEXUAL OFFENCES ACT",
        "source": "https://mola.gov.gy/laws-of-guyana",
        "type": {
            "name": "section",
            "representation": "39",
            "title": "Charge laid under law in force when offence committed.  ",
            "context": "SEXUAL OFFENCES ACT under Charge laid under law in force when offence committed.  39. A person who committed an offence before the commencement of this Act and which is an offence under this Act shall be charged, tried and punished under the law in force immediately before the coming into operation of this Act.",
            "description": "A person who committed an offence before the commencement of this Act and which is an offence under this Act shall be charged, tried and punished under the law in force immediately before the coming into operation of this Act."
        }
    },
    {
        "act": "SEXUAL OFFENCES ACT",
        "source": "https://mola.gov.gy/laws-of-guyana",
        "type": {
            "name": "section",
            "representation": "40",
            "title": "Divestment of authority over child.  PART III INVESTIGATION  ",
            "context": "SEXUAL OFFENCES ACT under Divestment of authority over child.  PART III INVESTIGATION  40. Where at the trial of any offence under this Act, it is proved to the satisfaction of the Court that an offence under this Act committed against a child has been caused, encouraged or favoured by the child's father, mother, guardian or any other person who has lawful care or charge of the child,  the Court may divest that person of all authority over the child and appoint any other suitable person willing to take charge of the child to be the guardian until the child becomes an adult, and the Court shall have power to vary from time to time or rescind or discharge such order.   PART III INVESTIGATION",
            "description": "Where at the trial of any offence under this Act, it is proved to the satisfaction of the Court that an offence under this Act committed against a child has been caused, encouraged or favoured by the child's father, mother, guardian or any other person who has lawful care or charge of the child,  the Court may divest that person of all authority over the child and appoint any other suitable person willing to take charge of the child to be the guardian until the child becomes an adult, and the Court shall have power to vary from time to time or rescind or discharge such order.   PART III INVESTIGATION"
        }
    },
    {
        "act": "SEXUAL OFFENCES ACT",
        "source": "https://mola.gov.gy/laws-of-guyana",
        "type": {
            "name": "section",
            "representation": "41",
            "title": "Mandatory record and investigation. ",
            "context": "SEXUAL OFFENCES ACT under Mandatory record and investigation. 41. (1) Where an offence under this Act is reported to the police, the police shall, in every case record the report and conduct an investigation.  (2) Within three months of a complaint being made under subsection (1)   (a) a charge shall be laid in respect of the report; or  (b) the file relating to the report and investigation shall be sent to the Director of Public Prosecutions for advice. LAWS OF GUYANA 48 Cap. 8:03 Sexual Offences   L.R.O. 1/2012          c.  17:01            Confrontation.                               Paper committals.    (3) Failure to comply with subsection (2) constitutes neglect of duty by the Investigating Rank and the Investigating Rank shall be liable to answer disciplinary charges in accordance with the Police (Discipline) Act.  (4) A person who makes a false complaint to the police may, on the advice of the Director of Public Prosecutions, be charged for the offence of making a false complaint and is liable on summary conviction to a fine of fifty thousand dollars and to imprisonment for three years.",
            "description": [
                {
                    "representation": "(1)",
                    "description": ""
                },
                {
                    "representation": "(2)",
                    "description": "constitutes neglect of duty by the Investigating Rank and the Investigating Rank shall be liable to answer disciplinary charges in accordance with the Police"
                },
                {
                    "representation": "(a)",
                    "description": "a charge shall be laid in respect of the report; or"
                },
                {
                    "representation": "(b)",
                    "description": "the file relating to the report and investigation shall be sent to the Director of Public Prosecutions for advice. LAWS OF GUYANA 48 Cap. 8:03 Sexual Offences   L.R.O. 1/2012          c.  17:01            Confrontation.                               Paper committals."
                },
                {
                    "representation": "(3)",
                    "description": "Failure to comply with subsection"
                },
                {
                    "representation": "(4)",
                    "description": "A person who makes a false complaint to the police may, on the advice of the Director of Public Prosecutions, be charged for the offence of making a false complaint and is liable on summary conviction to a fine of fifty thousand dollars and to imprisonment for three years."
                }
            ]
        }
    },
    {
        "act": "SEXUAL OFFENCES ACT",
        "source": "https://mola.gov.gy/laws-of-guyana",
        "type": {
            "name": "section",
            "representation": "42",
            "title": "Confrontation.   PART IV  PROCEDURE AT COURT  Procedure in Paper Committals   ",
            "context": "SEXUAL OFFENCES ACT under Confrontation.   PART IV  PROCEDURE AT COURT  Procedure in Paper Committals   42. (1) Where a report is made of an offence under this Act, at no point during the investigation shall the complainant be required to recount the complaint or any part of it, in the presence of the accused unless the complainant wants to do so.  (2) The complainant shall not be required to view or be in the presence of any person referred to in the complaint as having perpetrated any offence under this Act save for the purposes of an identification parade and then only   (a) by way of audio visual link;  (b) by way of a two way mirror; or  (c) in any other manner sensitive to the complainant's well-being.  PART IV PROCEDURE AT COURT  Procedure in Paper Committals",
            "description": [
                {
                    "representation": "(1)",
                    "description": "Where a report is made of an offence under this Act, at no point during the investigation shall the complainant be required to recount the complaint or any part of it, in the presence of the accused unless the complainant wants to do so."
                },
                {
                    "representation": "(2)",
                    "description": "The complainant shall not be required to view or be in the presence of any person referred to in the complaint as having perpetrated any offence under this Act save for the purposes of an identification parade and then only"
                },
                {
                    "representation": "(a)",
                    "description": "by way of audio visual link;"
                },
                {
                    "representation": "(b)",
                    "description": "by way of a two way mirror; or"
                },
                {
                    "representation": "(c)",
                    "description": "in any other manner sensitive to the complainant's well-being.  PART IV PROCEDURE AT COURT  Procedure in Paper Committals"
                }
            ]
        }
    },
    {
        "act": "SEXUAL OFFENCES ACT",
        "source": "https://mola.gov.gy/laws-of-guyana",
        "type": {
            "name": "section",
            "representation": "43",
            "title": "Paper committals. ",
            "context": "SEXUAL OFFENCES ACT under Paper committals. 43. Where a person is charged with an offence under this Act, there shall be no oral preliminary inquiry and instead a paper committal shall be held in accordance with LAWS OF GUYANA  Sexual Offences  Cap. 8:03 49  L.R.O. 1/2012 First       Schedule      Sex offences court.               Exclusion of public in  certain cases.                        Factors to be taken into account.           the procedure set out in the First Schedule.",
            "description": "Where a person is charged with an offence under this Act, there shall be no oral preliminary inquiry and instead a paper committal shall be held in accordance with LAWS OF GUYANA  Sexual Offences  Cap. 8:03 49  L.R.O. 1/2012 First       Schedule      Sex offences court.               Exclusion of public in  certain cases.                        Factors to be taken into account.           the procedure set out in the First Schedule."
        }
    },
    {
        "act": "SEXUAL OFFENCES ACT",
        "source": "https://mola.gov.gy/laws-of-guyana",
        "type": {
            "name": "section",
            "representation": "44",
            "title": "Sex offences court.  Exclusion of public from hearing  ",
            "context": "SEXUAL OFFENCES ACT under Sex offences court.  Exclusion of public from hearing  44. The National Task Force for Prevention of Sexual Violence, established under section 87, shall report to the Minister within one year of the date of commencement of this Act on proposals for a special court environment to try cases in relation to offences under this Act.  Exclusion of public from hearing",
            "description": "The National Task Force for Prevention of Sexual Violence, established under section 87, shall report to the Minister within one year of the date of commencement of this Act on proposals for a special court environment to try cases in relation to offences under this Act.  Exclusion of public from hearing"
        }
    },
    {
        "act": "SEXUAL OFFENCES ACT",
        "source": "https://mola.gov.gy/laws-of-guyana",
        "type": {
            "name": "section",
            "representation": "45",
            "title": "Exclusion of public in certain cases. ",
            "context": "SEXUAL OFFENCES ACT under Exclusion of public in certain cases. 45. In proceedings where the accused is charged with an offence under  this Act, the presiding judge or magistrate shall order the exclusion of members of the public (including the media) from the Court room for the duration of the proceedings, unless the judge or magistrate is of the opinion that such an order is not necessary in the interests of the proper administration of justice to   (a) ensure all relevant evidence is heard;    (b) ensure that the interests of witnesses under eighteen years of age are safeguarded in all proceedings; or  (c) ensure the justice system participants who are involved in the proceedings are protected.",
            "description": [
                {
                    "representation": "(a)",
                    "description": "ensure all relevant evidence is heard;"
                },
                {
                    "representation": "(b)",
                    "description": "ensure that the interests of witnesses under eighteen years of age are safeguarded in all proceedings; or"
                },
                {
                    "representation": "(c)",
                    "description": "ensure the justice system participants who are involved in the proceedings are protected."
                }
            ]
        }
    },
    {
        "act": "SEXUAL OFFENCES ACT",
        "source": "https://mola.gov.gy/laws-of-guyana",
        "type": {
            "name": "section",
            "representation": "46",
            "title": "Factors to be taken into account. ",
            "context": "SEXUAL OFFENCES ACT under Factors to be taken into account. 46. In making a determination under section 45, the Court shall take into account   (a) the nature of sexual offences and the consequences of public disclosure of the details of such offences on the life of the complainant in the particular case and on society's interest in encouraging the reporting of sexual offences in general;  LAWS OF GUYANA 50 Cap. 8:03 Sexual Offences   L.R.O. 1/2012                         Persons not excluded.          Reasons to be stated.                 Representations before determination.                     Public and jury excluded.            (b) the balance between the interests of justice in generally holding criminal proceedings in public, and the potential prejudice to the complainant's personal dignity and right of privacy of doing so in cases of sexual violence;  (c) the right of the complainant and of every individual to personal security and to the full protection and benefit of the law; and  (d) any other factor that the judge or magistrate considers relevant.",
            "description": [
                {
                    "representation": "(a)",
                    "description": "the nature of sexual offences and the consequences of public disclosure of the details of such offences on the life of the complainant in the particular case and on society's interest in encouraging the reporting of sexual offences in general;  LAWS OF GUYANA 50 Cap. 8:03 Sexual Offences   L.R.O. 1/2012                         Persons not excluded.          Reasons to be stated.                 Representations before determination.                     Public and jury excluded."
                },
                {
                    "representation": "(b)",
                    "description": "the balance between the interests of justice in generally holding criminal proceedings in public, and the potential prejudice to the complainant's personal dignity and right of privacy of doing so in cases of sexual violence;"
                },
                {
                    "representation": "(c)",
                    "description": "the right of the complainant and of every individual to personal security and to the full protection and benefit of the law; and"
                },
                {
                    "representation": "(d)",
                    "description": "any other factor that the judge or magistrate considers relevant."
                }
            ]
        }
    },
    {
        "act": "SEXUAL OFFENCES ACT",
        "source": "https://mola.gov.gy/laws-of-guyana",
        "type": {
            "name": "section",
            "representation": "47",
            "title": "Persons not excluded. ",
            "context": "SEXUAL OFFENCES ACT under Persons not excluded. 47. The accused, complainant, any support person and attorneys-at-law representing either party and any necessary interpreter shall not be excluded under section",
            "description": "The accused, complainant, any support person and attorneys-at-law representing either party and any necessary interpreter shall not be excluded under section"
        }
    },
    {
        "act": "SEXUAL OFFENCES ACT",
        "source": "https://mola.gov.gy/laws-of-guyana",
        "type": {
            "name": "section",
            "representation": "48",
            "title": "Reasons to be stated. ",
            "context": "SEXUAL OFFENCES ACT under Reasons to be stated. 48. If an accused is charged with an offence under this Act and the Court orders that the public shall not be excluded from the proceedings, the Court shall state, by reference to the circumstances of the case, the reason for making such an order.",
            "description": "If an accused is charged with an offence under this Act and the Court orders that the public shall not be excluded from the proceedings, the Court shall state, by reference to the circumstances of the case, the reason for making such an order."
        }
    },
    {
        "act": "SEXUAL OFFENCES ACT",
        "source": "https://mola.gov.gy/laws-of-guyana",
        "type": {
            "name": "section",
            "representation": "49",
            "title": "Representations before determination. ",
            "context": "SEXUAL OFFENCES ACT under Representations before determination. 49. The Court shall, at the first Court appearance, and may at any other stage, bring section 45 to the attention of the prosecution and ask the complainant directly if the              complainant wishes to give oral or written evidence on the question of whether the public should be excluded from the hearing before the judge or magistrate makes a determination.",
            "description": "The Court shall, at the first Court appearance, and may at any other stage, bring section 45 to the attention of the prosecution and ask the complainant directly if the              complainant wishes to give oral or written evidence on the question of whether the public should be excluded from the hearing before the judge or magistrate makes a determination."
        }
    },
    {
        "act": "SEXUAL OFFENCES ACT",
        "source": "https://mola.gov.gy/laws-of-guyana",
        "type": {
            "name": "section",
            "representation": "50",
            "title": "Public and jury excluded. ",
            "context": "SEXUAL OFFENCES ACT under Public and jury excluded. 50. The Court shall consider any representations on whether to make a determination under section 45 with the public and jury excluded.   LAWS OF GUYANA  Sexual Offences  Cap. 8:03 51  L.R.O. 1/2012 Passing of sentence in public.        Behaviour and reaction of complainant.               Special measures directions.",
            "description": "The Court shall consider any representations on whether to make a determination under section 45 with the public and jury excluded.   LAWS OF GUYANA  Sexual Offences  Cap. 8:03 51  L.R.O. 1/2012 Passing of sentence in public.        Behaviour and reaction of complainant.               Special measures directions."
        }
    },
    {
        "act": "SEXUAL OFFENCES ACT",
        "source": "https://mola.gov.gy/laws-of-guyana",
        "type": {
            "name": "section",
            "representation": "51",
            "title": "Passing of sentence in public.  Behaviour and reactions of complaint  ",
            "context": "SEXUAL OFFENCES ACT under Passing of sentence in public.  Behaviour and reactions of complaint  51. Where an order has been made under section 45 to exclude the public from the hearing the passing of sentence shall take place in public.  Behaviour and reaction of complaint",
            "description": "Where an order has been made under section 45 to exclude the public from the hearing the passing of sentence shall take place in public.  Behaviour and reaction of complaint"
        }
    },
    {
        "act": "SEXUAL OFFENCES ACT",
        "source": "https://mola.gov.gy/laws-of-guyana",
        "type": {
            "name": "section",
            "representation": "52",
            "title": "Behaviour and reactions of complainant.  LAWS OF GUYANA 6 Cap. 8:03 Sexual Offences   L.R.O. 1/2012  SECTION Special measures   ",
            "context": "SEXUAL OFFENCES ACT under Behaviour and reactions of complainant.  LAWS OF GUYANA 6 Cap. 8:03 Sexual Offences   L.R.O. 1/2012  SECTION Special measures   52. Where on the trial of an accused person for an offence under this Act evidence is given or a question is asked of a witness about the behaviour or reaction of the complainant during or after the alleged offence the judge shall inform the jury that complainants of sexual offences display a wide range of responses, and that the absence of behaviour that they might expect a complainant of a sexual offence to display should not be taken as evidence that the offence charged did not take place.  Special Measures",
            "description": "Where on the trial of an accused person for an offence under this Act evidence is given or a question is asked of a witness about the behaviour or reaction of the complainant during or after the alleged offence the judge shall inform the jury that complainants of sexual offences display a wide range of responses, and that the absence of behaviour that they might expect a complainant of a sexual offence to display should not be taken as evidence that the offence charged did not take place.  Special Measures"
        }
    },
    {
        "act": "SEXUAL OFFENCES ACT",
        "source": "https://mola.gov.gy/laws-of-guyana",
        "type": {
            "name": "section",
            "representation": "53",
            "title": "Special measures directions. ",
            "context": "SEXUAL OFFENCES ACT under Special measures directions. 53. (1) At any proceedings in relation to an offence under this Act, unless the complainant requests that no such protection be put in place, the Court shall direct that the complainant be protected when giving evidence by one or more of the special measures set out in sections 55 to",
            "description": [
                {
                    "representation": "(1)",
                    "description": "At any proceedings in relation to an offence under this Act, unless the complainant requests that no such protection be put in place, the Court shall direct that the complainant be protected when giving evidence by one or more of the special measures set out in sections 55 to"
                }
            ]
        }
    },
    {
        "act": "SEXUAL OFFENCES ACT",
        "source": "https://mola.gov.gy/laws-of-guyana",
        "type": {
            "name": "section",
            "representation": "54",
            "title": "Further provisions about directions. ",
            "context": "SEXUAL OFFENCES ACT under Further provisions about directions. 54. (1) Subject to subsection (2) a special measures direction has binding effect from the time it is made until the proceedings for the purposes of which it is made are either   (a) determined (by acquittal, conviction or otherwise); or  (b) withdrawn or not proceeded with,  in relation to the accused or (if there is more than one) in relation to each of the accused.  (2) The Court may discharge or vary (or further vary) a special measures direction if it appears to the Court to be in the interests of justice to do so, and may do so either   (a) on an application made by a party to the proceedings, if there has been a material change of circumstances since the relevant time; or  (b) of its own motion.  (3) In subsection (2) the relevant time means   (a) the time when the direction was given; or  (b) if a previous application has been made under that subsection, the time when the application (or last application) was made.  (4) The Court shall state in open Court its reasons for   (a) giving or varying;  (b) refusing an application for, or for the LAWS OF GUYANA  Sexual Offences  Cap. 8:03 53  L.R.O. 1/2012                                        Screening witness from accused.       variation or discharge of; or  (c) discharging,  a special measures direction and, if it is a magistrates' court, shall cause them to be entered in the record.  (5) Rules of Court may make provision   (a) for uncontested applications to be determined by the Court without a hearing;  (b) for preventing the renewal of an unsuccessful application for a special measures direction except where there has been a material change of circumstances;  (c) for expert evidence to be given in connection with an application for, or for the variation or discharge of such a direction;  (d) for the manner in which confidential or sensitive information is to be treated in connection with such an application and in particular as to its being disclosed to, or withheld from, a party to the proceedings.",
            "description": [
                {
                    "representation": "(1)",
                    "description": "Subject to subsection"
                },
                {
                    "representation": "(2)",
                    "description": "the relevant time means"
                },
                {
                    "representation": "(a)",
                    "description": "for uncontested applications to be determined by the Court without a hearing;"
                },
                {
                    "representation": "(b)",
                    "description": "for preventing the renewal of an unsuccessful application for a special measures direction except where there has been a material change of circumstances;"
                },
                {
                    "representation": "(3)",
                    "description": "In subsection"
                },
                {
                    "representation": "(4)",
                    "description": "The Court shall state in open Court its reasons for"
                },
                {
                    "representation": "(c)",
                    "description": "for expert evidence to be given in connection with an application for, or for the variation or discharge of such a direction;"
                },
                {
                    "representation": "(5)",
                    "description": "Rules of Court may make provision"
                },
                {
                    "representation": "(d)",
                    "description": "for the manner in which confidential or sensitive information is to be treated in connection with such an application and in particular as to its being disclosed to, or withheld from, a party to the proceedings."
                }
            ]
        }
    },
    {
        "act": "SEXUAL OFFENCES ACT",
        "source": "https://mola.gov.gy/laws-of-guyana",
        "type": {
            "name": "section",
            "representation": "55",
            "title": "Screening witness from accused. ",
            "context": "SEXUAL OFFENCES ACT under Screening witness from accused. 55. (1) A special measures direction may provide for the witness, while giving testimony or being sworn in Court, to be prevented by means of a screen or other arrangement from seeing the accused.  (2) The screen or other arrangement referred to in subsection (1) shall not prevent the witness from being able to see, and to be seen by  LAWS OF GUYANA 54 Cap. 8:03 Sexual Offences   L.R.O. 1/2012                          Evidence by audio visual link.               c.  5:03                     (a) the judge and jury or magistrate;  (b) attorneys-at-law acting in the proceedings; and  (c) any interpreter or other person appointed (in pursuance of the direction or otherwise) to assist the witness.  (3) Where two or more attorneys-at-law are acting for a party to the proceedings, subsection (2) (b) is to be regarded as satisfied in relation to those representatives if the witness is able at all material times to see and be seen by at least one of them.",
            "description": [
                {
                    "representation": "(1)",
                    "description": "shall not prevent the witness from being able to see, and to be seen by  LAWS OF GUYANA 54 Cap. 8:03 Sexual Offences   L.R.O. 1/2012                          Evidence by audio visual link.               c.  5:03"
                },
                {
                    "representation": "(2)",
                    "description": "(b) is to be regarded as satisfied in relation to those representatives if the witness is able at all material times to see and be seen by at least one of them."
                },
                {
                    "representation": "(a)",
                    "description": "the judge and jury or magistrate;"
                },
                {
                    "representation": "(b)",
                    "description": "attorneys-at-law acting in the proceedings; and"
                },
                {
                    "representation": "(c)",
                    "description": "any interpreter or other person appointed"
                },
                {
                    "representation": "(3)",
                    "description": "Where two or more attorneys-at-law are acting for a party to the proceedings, subsection"
                }
            ]
        }
    },
    {
        "act": "SEXUAL OFFENCES ACT",
        "source": "https://mola.gov.gy/laws-of-guyana",
        "type": {
            "name": "section",
            "representation": "56",
            "title": "Evidence by audio visual link.   ",
            "context": "SEXUAL OFFENCES ACT under Evidence by audio visual link.   56. (1) A special measures direction may provide for the witness to give evidence by means of audio visual link facilities.  (2) Where a special measures direction is given under subsection (1), sections 73A and 73B of the Evidence Act shall apply, except that   (a) section 73A (3) (b) shall not apply; and  (b) section 73A (5) (a) and (b) shall not apply, and shall be substituted for the purposes of application to proceedings for an offence under this Act, by the following   the person giving evidence to see and hear, and to be seen and heard by, the magistrate or judge, at least one attorney-at-law representing the prosecution and one the defence, and LAWS OF GUYANA  Sexual Offences  Cap. 8:03 55  L.R.O. 1/2012               Removal of gowns.           Examination  of witness through intermediary.                                           where the jury is present, the jury .",
            "description": [
                {
                    "representation": "(1)",
                    "description": "A special measures direction may provide for the witness to give evidence by means of audio visual link facilities."
                },
                {
                    "representation": "(2)",
                    "description": "Where a special measures direction is given under subsection"
                },
                {
                    "representation": "(a)",
                    "description": "section 73A"
                },
                {
                    "representation": "(3)",
                    "description": "(b) shall not apply; and"
                },
                {
                    "representation": "(b)",
                    "description": "shall not apply, and shall be substituted for the purposes of application to proceedings for an offence under this Act, by the following   the person giving evidence to see and hear, and to be seen and heard by, the magistrate or judge, at least one attorney-at-law representing the prosecution and one the defence, and LAWS OF GUYANA  Sexual Offences  Cap. 8:03 55  L.R.O. 1/2012               Removal of gowns.           Examination  of witness through intermediary.                                           where the jury is present, the jury ."
                },
                {
                    "representation": "(5)",
                    "description": "(a) and"
                }
            ]
        }
    },
    {
        "act": "SEXUAL OFFENCES ACT",
        "source": "https://mola.gov.gy/laws-of-guyana",
        "type": {
            "name": "section",
            "representation": "57",
            "title": "Removal of gowns. ",
            "context": "SEXUAL OFFENCES ACT under Removal of gowns. 57. A special measures direction may provide for the wearing of gowns to be dispensed with during the giving of the witness's evidence.",
            "description": "A special measures direction may provide for the wearing of gowns to be dispensed with during the giving of the witness's evidence."
        }
    },
    {
        "act": "SEXUAL OFFENCES ACT",
        "source": "https://mola.gov.gy/laws-of-guyana",
        "type": {
            "name": "section",
            "representation": "58",
            "title": "Examination of witness through intermediary. ",
            "context": "SEXUAL OFFENCES ACT under Examination of witness through intermediary. 58. (1) A special measures direction may provide for any examination of a child witness (however and wherever conducted) to be conducted through an interpreter or other person approved by the Court for the purposes of this section (an intermediary).  (2) The function of an intermediary is to communicate   (a) to the witness, questions put to the witness; and  (b) to any person asking such questions, the answers given by the witness in reply to them,  and to explain such questions or answers so far as necessary to enable them to be understood by the witness or person in question.  (3) Any examination of the witness in pursuance of subsection (1) shall take place in the presence of such persons as Rules of Court or the direction may provide, but in circumstances in which   (a) the judge or magistrate and legal representatives acting in the proceedings are able to see and hear the examination of the witness and to communicate with the intermediary; and  (b) the jury are able to see and hear the LAWS OF GUYANA 56 Cap. 8:03 Sexual Offences   L.R.O. 1/2012                   c. 8:01       Use of anatomically correct dolls.          Status of evidence given under special measures direction.                Opportunity for presentation of complainants views and concerns.       examination of the witness.  (4) Where two or more legal representatives are acting for a party to the proceedings, subsection (3) (a) is to be regarded as satisfied in relation to those representatives if at all material times it is satisfied in relation to at least one of them.  (5) A person may not act as an intermediary in a particular case except after being sworn or affirmed that the person will faithfully perform the function as intermediary.  (6) Sections 324 to 331 of the Criminal Law (Offences) Act shall apply to intermediaries under this section.",
            "description": [
                {
                    "representation": "(1)",
                    "description": "shall take place in the presence of such persons as Rules of Court or the direction may provide, but in circumstances in which"
                },
                {
                    "representation": "(2)",
                    "description": "The function of an intermediary is to communicate"
                },
                {
                    "representation": "(a)",
                    "description": "the judge or magistrate and legal representatives acting in the proceedings are able to see and hear the examination of the witness and to communicate with the intermediary; and"
                },
                {
                    "representation": "(b)",
                    "description": "the jury are able to see and hear the LAWS OF GUYANA 56 Cap. 8:03 Sexual Offences   L.R.O. 1/2012                   c. 8:01       Use of anatomically correct dolls.          Status of evidence given under special measures direction.                Opportunity for presentation of complainants views and concerns.       examination of the witness."
                },
                {
                    "representation": "(3)",
                    "description": "(a) is to be regarded as satisfied in relation to those representatives if at all material times it is satisfied in relation to at least one of them."
                },
                {
                    "representation": "(4)",
                    "description": "Where two or more legal representatives are acting for a party to the proceedings, subsection"
                },
                {
                    "representation": "(5)",
                    "description": "A person may not act as an intermediary in a particular case except after being sworn or affirmed that the person will faithfully perform the function as intermediary."
                },
                {
                    "representation": "(6)",
                    "description": "Sections 324 to 331 of the Criminal Law"
                }
            ]
        }
    },
    {
        "act": "SEXUAL OFFENCES ACT",
        "source": "https://mola.gov.gy/laws-of-guyana",
        "type": {
            "name": "section",
            "representation": "59",
            "title": "Use of anatomically correct dolls. ",
            "context": "SEXUAL OFFENCES ACT under Use of anatomically correct dolls. 59.  (2) A special measures direction shall specify particulars of the provision made by the direction in respect of each special measure which is to apply to the witness's evidence.  (3) In this Part \"special measures direction\" means a direction under this section.  (4) Nothing in this Part is to be regarded as affecting any power of a Court to make an order or give leave of any description (in the exercise of its inherent jurisdiction or otherwise) in relation to witnesses in proceedings for an offence under this Act.   LAWS OF GUYANA 52 Cap. 8:03 Sexual Offences   L.R.O. 1/2012  Further provisions about directions.",
            "description": [
                {
                    "representation": "(2)",
                    "description": "A special measures direction shall specify particulars of the provision made by the direction in respect of each special measure which is to apply to the witness's evidence."
                },
                {
                    "representation": "(3)",
                    "description": "In this Part \"special measures direction\" means a direction under this section."
                },
                {
                    "representation": "(4)",
                    "description": "Nothing in this Part is to be regarded as affecting any power of a Court to make an order or give leave of any description"
                }
            ]
        }
    },
    {
        "act": "SEXUAL OFFENCES ACT",
        "source": "https://mola.gov.gy/laws-of-guyana",
        "type": {
            "name": "section",
            "representation": "60",
            "title": "Status of evidence given under special measures direction.  Presentation of complainant's views and concerns  ",
            "context": "SEXUAL OFFENCES ACT under Status of evidence given under special measures direction.  Presentation of complainant's views and concerns  60. Where a statement is made by a witness in criminal proceedings in accordance with a special measures direction, and is not made by the witness in direct oral testimony in Court but forms part of the witness's evidence in those proceedings, the statement shall be treated as if made by the witness in direct oral testimony in Court.  Presentation of complaints view and concerns",
            "description": "Where a statement is made by a witness in criminal proceedings in accordance with a special measures direction, and is not made by the witness in direct oral testimony in Court but forms part of the witness's evidence in those proceedings, the statement shall be treated as if made by the witness in direct oral testimony in Court.  Presentation of complaints view and concerns"
        }
    },
    {
        "act": "SEXUAL OFFENCES ACT",
        "source": "https://mola.gov.gy/laws-of-guyana",
        "type": {
            "name": "section",
            "representation": "61",
            "title": "Opportunity for presentation of complainant's views and concerns.   Anonymity for the complainant  ",
            "context": "SEXUAL OFFENCES ACT under Opportunity for presentation of complainant's views and concerns.   Anonymity for the complainant  61. (1) The Court shall provide an opportunity to a complainant of an offence under this Act, if the complainant desires it, to present the complainant's views and concerns at appropriate stages of criminal proceedings against the accused, in a manner not prejudicial to the rights of the accused.  (2) For the purposes of subsection (1), appropriate stages of criminal proceedings include the bail hearing and before passing of sentence. LAWS OF GUYANA  Sexual Offences  Cap. 8:03 57  L.R.O. 1/2012     Anonymity for complainant in press reporting.                                           Anonymity for the complainant",
            "description": [
                {
                    "representation": "(1)",
                    "description": "The Court shall provide an opportunity to a complainant of an offence under this Act, if the complainant desires it, to present the complainant's views and concerns at appropriate stages of criminal proceedings against the accused, in a manner not prejudicial to the rights of the accused."
                },
                {
                    "representation": "(2)",
                    "description": "For the purposes of subsection"
                }
            ]
        }
    },
    {
        "act": "SEXUAL OFFENCES ACT",
        "source": "https://mola.gov.gy/laws-of-guyana",
        "type": {
            "name": "section",
            "representation": "62",
            "title": "Anonymity for complainant in press reporting. ",
            "context": "SEXUAL OFFENCES ACT under Anonymity for complainant in press reporting. 62. (1) The publication in any document, or the broadcasting, or transmission   in any way, of any information that could identify the complainant or witness to an offence under this Act is prohibited.  (2) This section does not apply in respect of the disclosure of information   (a) in the course of the administration of justice; or  (b) in the provision of medical services or psychological treatment to the complainant, when it is not the purpose of the disclosure to make the information known in the community.  (3) Every person who publishes in any document, or broadcasts, or transmits in any way, any information that could identify the complainant or a witness contrary to subsection (1) commits an offence and is liable on summary conviction to a fine of two million dollars.  (4) Where a person is charged with an offence under subsection (3) in respect of the publication in any document, or the broadcasting, or transmission in any way, of any information that could identify the complainant or a witness, it shall be a defence, subject to subsection (5), to prove that the publication, broadcast, or transmission in which the matter appeared was one in respect of which the complainant had given written consent.  (5) Written consent is not a defence if it is proved that any person interfered unreasonably with the complainants peace or comfort with intent to obtain the consent. LAWS OF GUYANA 58 Cap. 8:03 Sexual Offences   L.R.O. 1/2012    Anonymity for the complainant in Court.                      Competence of witness to give evidence.",
            "description": [
                {
                    "representation": "(1)",
                    "description": "commits an offence and is liable on summary conviction to a fine of two million dollars."
                },
                {
                    "representation": "(2)",
                    "description": "This section does not apply in respect of the disclosure of information"
                },
                {
                    "representation": "(a)",
                    "description": "in the course of the administration of justice; or"
                },
                {
                    "representation": "(b)",
                    "description": "in the provision of medical services or psychological treatment to the complainant, when it is not the purpose of the disclosure to make the information known in the community."
                },
                {
                    "representation": "(3)",
                    "description": "in respect of the publication in any document, or the broadcasting, or transmission in any way, of any information that could identify the complainant or a witness, it shall be a defence, subject to subsection"
                },
                {
                    "representation": "(4)",
                    "description": "Where a person is charged with an offence under subsection"
                },
                {
                    "representation": "(5)",
                    "description": "Written consent is not a defence if it is proved that any person interfered unreasonably with the complainants peace or comfort with intent to obtain the consent. LAWS OF GUYANA 58 Cap. 8:03 Sexual Offences   L.R.O. 1/2012    Anonymity for the complainant in Court.                      Competence of witness to give evidence."
                }
            ]
        }
    },
    {
        "act": "SEXUAL OFFENCES ACT",
        "source": "https://mola.gov.gy/laws-of-guyana",
        "type": {
            "name": "section",
            "representation": "63",
            "title": "Anonymity for the complainant in Court.  PART V EVIDENCE  Competence of witness and capacity to be sworn  ",
            "context": "SEXUAL OFFENCES ACT under Anonymity for the complainant in Court.  PART V EVIDENCE  Competence of witness and capacity to be sworn  63. When called to give evidence in Court the complainants name and address shall not be stated, and the Court shall advise the complainant before the complainant gives evidence that the complainant may not do so.   PART V EVIDENCE   Competence of witness and capacity to be sworn",
            "description": "When called to give evidence in Court the complainants name and address shall not be stated, and the Court shall advise the complainant before the complainant gives evidence that the complainant may not do so.   PART V EVIDENCE   Competence of witness and capacity to be sworn"
        }
    },
    {
        "act": "SEXUAL OFFENCES ACT",
        "source": "https://mola.gov.gy/laws-of-guyana",
        "type": {
            "name": "section",
            "representation": "64",
            "title": "Competence of witness to give evidence. ",
            "context": "SEXUAL OFFENCES ACT under Competence of witness to give evidence. 64. (1) Subject to subsections (2) and (3), at every stage in criminal proceedings under this Act all persons are competent to give evidence.  (2) A person is not competent to give evidence in criminal proceedings under this Act if it appears to the Court that the person is not a person who is able to    (a) understand questions put to the person as a witness; and  (b) give answers to them which can be understood.  (3) A person charged  with  an  offence under this Act is not competent to give evidence for the prosecution in the proceedings for the offence (whether the person is the only person, or is one of two or more persons, charged with the offence).  (4) In subsection (3) the reference to a person charged with an offence under this Act does not include a person who is not, or is no longer, liable to be convicted of any offence in the proceedings (whether as a result of pleading guilty or for any other reason).   LAWS OF GUYANA  Sexual Offences  Cap. 8:03 59  L.R.O. 1/2012 Determining competence of witness.",
            "description": [
                {
                    "representation": "(1)",
                    "description": "Subject to subsections"
                },
                {
                    "representation": "(2)",
                    "description": "A person is not competent to give evidence in criminal proceedings under this Act if it appears to the Court that the person is not a person who is able to"
                },
                {
                    "representation": "(a)",
                    "description": "understand questions put to the person as a witness; and"
                },
                {
                    "representation": "(b)",
                    "description": "give answers to them which can be understood."
                },
                {
                    "representation": "(3)",
                    "description": "the reference to a person charged with an offence under this Act does not include a person who is not, or is no longer, liable to be convicted of any offence in the proceedings"
                },
                {
                    "representation": "(4)",
                    "description": "In subsection"
                }
            ]
        }
    },
    {
        "act": "SEXUAL OFFENCES ACT",
        "source": "https://mola.gov.gy/laws-of-guyana",
        "type": {
            "name": "section",
            "representation": "65",
            "title": "Determining competence of witness. ",
            "context": "SEXUAL OFFENCES ACT under Determining competence of witness. 65. (1) Any question whether a witness in criminal proceedings under this Act is competent to give evidence in the proceedings shall be determined by the Court in accordance with this section, whether raised   (a) by a party to the proceedings; or  (b) by the Court of its own motion.  (2) It is for the party calling the witness to satisfy the Court that, on a balance of probabilities, the witness is competent to give evidence in the proceedings.  (3) In determining the question mentioned in subsection (1) the Court shall treat the witness as having the benefit of any directions under section 53 which the Court has given, or proposes to give, in relation to the witness.  (4) Any proceedings held for the determination of the question shall take place in the absence of the jury.  (5) Where the Court is in doubt as to whether the witness is competent, the Court may receive evidence from anyone it deems fit, including a social worker or duly qualified medical practitioner.  (6) Any questioning of the witness (where the Court considers that necessary) shall   (a) be conducted by the Court in the presence of the parties and any  social worker or support person accompanying the witness; and  (b) be conducted with the benefit of any special measures the Court deems necessary under sections 53 and",
            "description": [
                {
                    "representation": "(1)",
                    "description": "the Court shall treat the witness as having the benefit of any directions under section 53 which the Court has given, or proposes to give, in relation to the witness."
                },
                {
                    "representation": "(a)",
                    "description": "be conducted by the Court in the presence of the parties and any  social worker or support person accompanying the witness; and"
                },
                {
                    "representation": "(b)",
                    "description": "be conducted with the benefit of any special measures the Court deems necessary under sections 53 and"
                },
                {
                    "representation": "(2)",
                    "description": "It is for the party calling the witness to satisfy the Court that, on a balance of probabilities, the witness is competent to give evidence in the proceedings."
                },
                {
                    "representation": "(3)",
                    "description": "In determining the question mentioned in subsection"
                },
                {
                    "representation": "(4)",
                    "description": "Any proceedings held for the determination of the question shall take place in the absence of the jury."
                },
                {
                    "representation": "(5)",
                    "description": "Where the Court is in doubt as to whether the witness is competent, the Court may receive evidence from anyone it deems fit, including a social worker or duly qualified medical practitioner."
                },
                {
                    "representation": "(6)",
                    "description": "Any questioning of the witness"
                }
            ]
        }
    },
    {
        "act": "SEXUAL OFFENCES ACT",
        "source": "https://mola.gov.gy/laws-of-guyana",
        "type": {
            "name": "section",
            "representation": "66",
            "title": "Determining whether witness to be sworn. ",
            "context": "SEXUAL OFFENCES ACT under Determining whether witness to be sworn. 66. (1) Any question whether a witness in criminal proceedings under this Act may be sworn for the purpose of giving evidence on oath, shall be determined by the Court in accordance with this section, whether raised   (a) by a party to the proceeding; or  (b) by the Court of its own motion.  (2) The witness may not be sworn for that purpose unless the witness has a sufficient appreciation of the solemnity of the occasion and of the particular responsibility to tell the truth which is involved in taking an oath.  (3) The witness shall, if the witness is able to give intelligible testimony, be presumed to have a sufficient appreciation of those matters if no evidence tending to show the contrary is adduced.  (4) If any such evidence is adduced, it is for the party seeking to have the witness sworn to satisfy the Court that on a balance of probabilities, the witness has a sufficient appreciation of the matters mentioned in subsection (2).  (5) Any proceedings held for the determination of the question mentioned in subsection (1) shall take place in the absence of the jury.  (6) Where the Court is in doubt as to whether the witness can be sworn, the Court may receive evidence from anyone it deems fit, including a social worker or duly qualified medical practitioner.  (7) Any questioning of the witness (where the Court considers that necessary) shall   (a) be conducted by the Court in the presence of the parties and any   social worker or support person LAWS OF GUYANA  Sexual Offences  Cap. 8:03 61  L.R.O. 1/2012                         Reception of unsworn evidence.                            accompanying the witness; and  (b) be conducted with the benefit of any special measures the Court deems necessary under section",
            "description": [
                {
                    "representation": "(1)",
                    "description": "shall take place in the absence of the jury."
                },
                {
                    "representation": "(a)",
                    "description": "be conducted by the Court in the presence of the parties and any   social worker or support person LAWS OF GUYANA  Sexual Offences  Cap. 8:03 61  L.R.O. 1/2012                         Reception of unsworn evidence.                            accompanying the witness; and"
                },
                {
                    "representation": "(b)",
                    "description": "be conducted with the benefit of any special measures the Court deems necessary under section"
                },
                {
                    "representation": "(2)",
                    "description": "The witness may not be sworn for that purpose unless the witness has a sufficient appreciation of the solemnity of the occasion and of the particular responsibility to tell the truth which is involved in taking an oath."
                },
                {
                    "representation": "(3)",
                    "description": "The witness shall, if the witness is able to give intelligible testimony, be presumed to have a sufficient appreciation of those matters if no evidence tending to show the contrary is adduced."
                },
                {
                    "representation": "(4)",
                    "description": "If any such evidence is adduced, it is for the party seeking to have the witness sworn to satisfy the Court that on a balance of probabilities, the witness has a sufficient appreciation of the matters mentioned in subsection"
                },
                {
                    "representation": "(5)",
                    "description": "Any proceedings held for the determination of the question mentioned in subsection"
                },
                {
                    "representation": "(6)",
                    "description": "Where the Court is in doubt as to whether the witness can be sworn, the Court may receive evidence from anyone it deems fit, including a social worker or duly qualified medical practitioner."
                },
                {
                    "representation": "(7)",
                    "description": "Any questioning of the witness"
                }
            ]
        }
    },
    {
        "act": "SEXUAL OFFENCES ACT",
        "source": "https://mola.gov.gy/laws-of-guyana",
        "type": {
            "name": "section",
            "representation": "67",
            "title": "Reception of unsworn evidence. ",
            "context": "SEXUAL OFFENCES ACT under Reception of unsworn evidence. 67. (1) Subsections (2) and (3) apply to a person who is competent to give evidence in criminal proceedings under this Act, but (by virtue of section 66) is not permitted to be sworn for the purpose of giving evidence on oath in such proceedings.  (2) The evidence in criminal proceedings under this Act of a person to whom this subsection applies shall be given unsworn.  (3) A deposition of unsworn evidence given by a person to whom this subsection applies may be taken for the purposes of criminal proceedings under this Act as if that evidence had been given on oath.  (4) A Court in criminal proceedings under this Act shall accordingly receive in evidence any evidence given unsworn in pursuance of subsection (2) or (3).  (5) Where a person (the witness) who is competent to give evidence in criminal proceedings under this Act gives evidence in such proceedings unsworn, no conviction, verdict or finding in those proceedings shall be taken to be unsafe for the purposes of any statute or other law LAWS OF GUYANA 62 Cap. 8:03 Sexual Offences   L.R.O. 1/2012                         Penalty for giving false unsworn evidence.                                      Corroboration.        c.  5:03      Compellability.    by reason only that it appears to the Court of Appeal or any other Court that the witness was a person falling within section 66 (and should accordingly have given evidence on oath).",
            "description": [
                {
                    "representation": "(1)",
                    "description": "Subsections"
                },
                {
                    "representation": "(2)",
                    "description": "or"
                },
                {
                    "representation": "(3)",
                    "description": "A deposition of unsworn evidence given by a person to whom this subsection applies may be taken for the purposes of criminal proceedings under this Act as if that evidence had been given on oath."
                },
                {
                    "representation": "(4)",
                    "description": "A Court in criminal proceedings under this Act shall accordingly receive in evidence any evidence given unsworn in pursuance of subsection"
                },
                {
                    "representation": "(5)",
                    "description": "Where a person"
                }
            ]
        }
    },
    {
        "act": "SEXUAL OFFENCES ACT",
        "source": "https://mola.gov.gy/laws-of-guyana",
        "type": {
            "name": "section",
            "representation": "68",
            "title": "Penalty for giving false unsworn evidence. ",
            "context": "SEXUAL OFFENCES ACT under Penalty for giving false unsworn evidence. 68. (1) This section applies where a person gives unsworn evidence in criminal proceedings under section",
            "description": [
                {
                    "representation": "(1)",
                    "description": "This section applies where a person gives unsworn evidence in criminal proceedings under section"
                }
            ]
        }
    },
    {
        "act": "SEXUAL OFFENCES ACT",
        "source": "https://mola.gov.gy/laws-of-guyana",
        "type": {
            "name": "section",
            "representation": "69",
            "title": "Corroboration. ",
            "context": "SEXUAL OFFENCES ACT under Corroboration. 69. (1) No corroboration of the evidence of the complainant or the sworn or unsworn evidence of a child shall be required for a conviction of an offence under this Act, and the judge shall not direct the jury that it is unsafe to find the accused guilty in the absence of corroboration.  (2) Sections 61 (3) and 71 (3) of the Evidence Act shall not apply to this Act.",
            "description": [
                {
                    "representation": "(1)",
                    "description": "No corroboration of the evidence of the complainant or the sworn or unsworn evidence of a child shall be required for a conviction of an offence under this Act, and the judge shall not direct the jury that it is unsafe to find the accused guilty in the absence of corroboration."
                },
                {
                    "representation": "(2)",
                    "description": "Sections 61"
                },
                {
                    "representation": "(3)",
                    "description": "of the Evidence Act shall not apply to this Act."
                }
            ]
        }
    },
    {
        "act": "SEXUAL OFFENCES ACT",
        "source": "https://mola.gov.gy/laws-of-guyana",
        "type": {
            "name": "section",
            "representation": "70",
            "title": "Compellability.   LAWS OF GUYANA  Sexual Offences  Cap. 8:03 7  L.R.O. 1/2012 SECTION  ",
            "context": "SEXUAL OFFENCES ACT under Compellability.   LAWS OF GUYANA  Sexual Offences  Cap. 8:03 7  L.R.O. 1/2012 SECTION  70. The spouse of a person charged with an offence under this Act may be called as a witness for either the prosecution or defence and without the consent of the person charged, and if so called, notwithstanding any other law, is a LAWS OF GUYANA  Sexual Offences  Cap. 8:03 63  L.R.O. 1/2012                Warning to  jury.                                   Recent complaint.                compellable witness.  Previous consistent statements",
            "description": "The spouse of a person charged with an offence under this Act may be called as a witness for either the prosecution or defence and without the consent of the person charged, and if so called, notwithstanding any other law, is a LAWS OF GUYANA  Sexual Offences  Cap. 8:03 63  L.R.O. 1/2012                Warning to  jury.                                   Recent complaint.                compellable witness.  Previous consistent statements"
        }
    },
    {
        "act": "SEXUAL OFFENCES ACT",
        "source": "https://mola.gov.gy/laws-of-guyana",
        "type": {
            "name": "section",
            "representation": "71",
            "title": "Warning to jury. ",
            "context": "SEXUAL OFFENCES ACT under Warning to jury. 71. Where on the trial of an accused person for an offence under this Act evidence is given or a question is asked of a witness which tends to suggest an absence of complaint in respect of the commission of the alleged offence by the person upon whom the offence is alleged to have been committed or to suggest delay by that person in making any such complaint, the judge shall   (a) give a warning to the jury to the effect that an absence of complaint or a delay in complaining does not necessarily indicate that the allegation that the offence was committed is false; and  (b) inform the jury that there may be good reasons why a victim of a sexual offence may hesitate in making or may refrain from making a complaint about the assault.",
            "description": [
                {
                    "representation": "(a)",
                    "description": "give a warning to the jury to the effect that an absence of complaint or a delay in complaining does not necessarily indicate that the allegation that the offence was committed is false; and"
                },
                {
                    "representation": "(b)",
                    "description": "inform the jury that there may be good reasons why a victim of a sexual offence may hesitate in making or may refrain from making a complaint about the assault."
                }
            ]
        }
    },
    {
        "act": "SEXUAL OFFENCES ACT",
        "source": "https://mola.gov.gy/laws-of-guyana",
        "type": {
            "name": "section",
            "representation": "72",
            "title": "Recent complaint. ",
            "context": "SEXUAL OFFENCES ACT under Recent complaint. 72. (1) In considering whether a recent complaint was made as soon as could reasonably be expected, the Court shall consider the following factors   (a) the nature of sexual abuse and the stigma or  humiliation  often thought to go with them, and that they are commonly found difficult to report (particularly child sexual abuse);  (b) the relationship of the victim and accused;  (c) the particular characteristics of the LAWS OF GUYANA 64 Cap. 8:03 Sexual Offences   L.R.O. 1/2012                               Statement of child  admissible where no oral testimony.               Admissibility of childs statement. [2 of 2013]                   person in relation to whom the abuse is alleged to have been committed; and  (d) all other relevant circumstances.  (2) Whether the complaint was made as soon as could reasonably be expected will depend on the facts of the particular case, and there is no outer time limit.",
            "description": [
                {
                    "representation": "(1)",
                    "description": "In considering whether a recent complaint was made as soon as could reasonably be expected, the Court shall consider the following factors"
                },
                {
                    "representation": "(a)",
                    "description": "the nature of sexual abuse and the stigma or  humiliation  often thought to go with them, and that they are commonly found difficult to report"
                },
                {
                    "representation": "(b)",
                    "description": "the relationship of the victim and accused;"
                },
                {
                    "representation": "(c)",
                    "description": "the particular characteristics of the LAWS OF GUYANA 64 Cap. 8:03 Sexual Offences   L.R.O. 1/2012                               Statement of child  admissible where no oral testimony.               Admissibility of childs statement. [2 of 2013]                   person in relation to whom the abuse is alleged to have been committed; and"
                },
                {
                    "representation": "(d)",
                    "description": "all other relevant circumstances."
                },
                {
                    "representation": "(2)",
                    "description": "Whether the complaint was made as soon as could reasonably be expected will depend on the facts of the particular case, and there is no outer time limit."
                }
            ]
        }
    },
    {
        "act": "SEXUAL OFFENCES ACT",
        "source": "https://mola.gov.gy/laws-of-guyana",
        "type": {
            "name": "section",
            "representation": "73",
            "title": "Statement of child admissible where no oral testimony. ",
            "context": "SEXUAL OFFENCES ACT under Statement of child admissible where no oral testimony. 73. (1) A statement made by a child complainant in relation to an offence under this Act is admissible as evidence where the child does not give direct oral testimony at the trial.  (2) Sections 74 and 75 shall apply to the admissibility of evidence under subsection (1) of this section.  (3) Where a statement is tendered in evidence under subsection (1), the accused shall not be convicted on the basis of that evidence alone.",
            "description": [
                {
                    "representation": "(1)",
                    "description": "of this section."
                },
                {
                    "representation": "(2)",
                    "description": "Sections 74 and 75 shall apply to the admissibility of evidence under subsection"
                },
                {
                    "representation": "(3)",
                    "description": "Where a statement is tendered in evidence under subsection"
                }
            ]
        }
    },
    {
        "act": "SEXUAL OFFENCES ACT",
        "source": "https://mola.gov.gy/laws-of-guyana",
        "type": {
            "name": "section",
            "representation": "74",
            "title": "Admissibility of child's statement. ",
            "context": "SEXUAL OFFENCES ACT under Admissibility of child's statement. 74. (1) Without limiting any other law, where the Court is satisfied that a child is being prevented from giving evidence and where a statement is made in any written form or manner by a child or by another person on behalf of the child, that statement may be admissible in a trial as evidence of any fact of which direct oral evidence of the child would be admissible.  (2) The Court may admit into evidence the following statement made by a child   (a) a statement made to and written by the police;  (b) a statement made in the form of a statutory declaration;  (c) a statement written by the child; LAWS OF GUYANA  Sexual Offences  Cap. 8:03 65  L.R.O. 1/2012                                                 (d) a statement written by another person on behalf of a child where the child cannot write.  (3) The following provisions shall have effect in relation to any written statement of a child admissible in evidence under this section   (a) the statement shall state the childs age and that an adult of the childs choice was present with the child when it was made;  (b) if the statement is written on behalf of a child,  it  shall  be  signed or marked if possible by both the child and the person who wrote it and it shall be dated;  (c) if the statement is written on behalf of a child who cannot write, the person who wrote the statement shall read it to the child before the child puts the childs mark or thumb print on it and it shall be accompanied by a declaration of the person who wrote it that it was read to the child and that the child appears to understand it and the child agreed to it;  (d) if the statement is written on behalf of a  child  who  cannot  read, the person who wrote the statement shall read it to the child before the child signs it or marks it if possible and it shall be accompanied by a declaration of the person who wrote it that it was read to the child and the child appeared to understand it and the child agreed to LAWS OF GUYANA 66 Cap. 8:03 Sexual Offences   L.R.O. 1/2012                                    Statement in documents that appear to have been prepared for purposes of criminal proceedings or investigations.          it;  (e) if the statement refers to any  other  document,  the  copy  of  the statement given to any other party to the proceedings shall be accompanied by a copy of that document or by such information as may be necessary in order to enable the party to whom it is given to inspect the document or a copy of it.  (4) The prosecution shall give a copy of the statement to the accused not less than seven days in advance of the prosecution tendering it into evidence.  (5) Any document or object referred to and identified in a written statement tendered in evidence under this section shall be treated as if it had been produced as an exhibit and identified in Court by the witness.  (6) A child whose written statement is tendered in evidence in a trial under this section shall be treated as a person who had been examined by the Court.",
            "description": [
                {
                    "representation": "(1)",
                    "description": "Without limiting any other law, where the Court is satisfied that a child is being prevented from giving evidence and where a statement is made in any written form or manner by a child or by another person on behalf of the child, that statement may be admissible in a trial as evidence of any fact of which direct oral evidence of the child would be admissible."
                },
                {
                    "representation": "(2)",
                    "description": "The Court may admit into evidence the following statement made by a child"
                },
                {
                    "representation": "(a)",
                    "description": "the statement shall state the childs age and that an adult of the childs choice was present with the child when it was made;"
                },
                {
                    "representation": "(b)",
                    "description": "if the statement is written on behalf of a child,  it  shall  be  signed or marked if possible by both the child and the person who wrote it and it shall be dated;"
                },
                {
                    "representation": "(c)",
                    "description": "if the statement is written on behalf of a child who cannot write, the person who wrote the statement shall read it to the child before the child puts the childs mark or thumb print on it and it shall be accompanied by a declaration of the person who wrote it that it was read to the child and that the child appears to understand it and the child agreed to it;"
                },
                {
                    "representation": "(d)",
                    "description": "if the statement is written on behalf of a  child  who  cannot  read, the person who wrote the statement shall read it to the child before the child signs it or marks it if possible and it shall be accompanied by a declaration of the person who wrote it that it was read to the child and the child appeared to understand it and the child agreed to LAWS OF GUYANA 66 Cap. 8:03 Sexual Offences   L.R.O. 1/2012                                    Statement in documents that appear to have been prepared for purposes of criminal proceedings or investigations.          it;"
                },
                {
                    "representation": "(3)",
                    "description": "The following provisions shall have effect in relation to any written statement of a child admissible in evidence under this section"
                },
                {
                    "representation": "(e)",
                    "description": "if the statement refers to any  other  document,  the  copy  of  the statement given to any other party to the proceedings shall be accompanied by a copy of that document or by such information as may be necessary in order to enable the party to whom it is given to inspect the document or a copy of it."
                },
                {
                    "representation": "(4)",
                    "description": "The prosecution shall give a copy of the statement to the accused not less than seven days in advance of the prosecution tendering it into evidence."
                },
                {
                    "representation": "(5)",
                    "description": "Any document or object referred to and identified in a written statement tendered in evidence under this section shall be treated as if it had been produced as an exhibit and identified in Court by the witness."
                },
                {
                    "representation": "(6)",
                    "description": "A child whose written statement is tendered in evidence in a trial under this section shall be treated as a person who had been examined by the Court."
                }
            ]
        }
    },
    {
        "act": "SEXUAL OFFENCES ACT",
        "source": "https://mola.gov.gy/laws-of-guyana",
        "type": {
            "name": "section",
            "representation": "75",
            "title": "Statements in documents that appear to have been prepared for the purposes of criminal proceedings or investigations. ",
            "context": "SEXUAL OFFENCES ACT under Statements in documents that appear to have been prepared for the purposes of criminal proceedings or investigations. 75. (1) Without limiting any other written law, where a statement, referred to in section 74, appears to the Court to have been prepared for the purposes of   (a) pending or contemplated criminal proceedings; or  (b) a criminal investigation,  the statement shall not be tendered in evidence in a trial without leave of the Court, and the Court shall not give leave unless it is of the opinion that the statement ought to be admitted in the interest of justice.  LAWS OF GUYANA  Sexual Offences  Cap. 8:03 67  L.R.O. 1/2012                                                 (2) In considering whether the admission of a statement under subsection (1) would be in the interest of justice, the Court shall have regard   (a) to the contents of the statement;  (b) to any risk of unfairness to the accused,  or  if  there is more than one accused to any one of them, if it is likely that the statement can be controverted and the person making the statement does not attend to give oral evidence in the proceedings;  (c) to any other circumstances that appear to the Court to be relevant.  (3) A written statement mentioned in this section shall be tendered in evidence by the prosecution any time before the prosecution closes its case against the accused   (a) if the statement is written by the child, by  the  prosecution submitting the statement to the Court; or  (b) if the statement is written on behalf of a child, by calling the person who wrote the statement to put the statement into evidence.  (4) Where a statement is tendered into evidence under subsection (1), it shall be read to the Court, and the accused is entitled to challenge its admissibility before it is admitted into evidence or tendered at paper committal. LAWS OF GUYANA 68 Cap. 8:03 Sexual Offences   L.R.O. 1/2012          No conviction on statement alone.      Evidence of sexual activity where com-plainant under 16 years.    Second                       Schedule.                          (5) Where the accused exercises the right under subsection (4), the Court shall conduct a hearing in the absence of the jury and public and decide whether the whole or any part of the statement is admissible into evidence.",
            "description": [
                {
                    "representation": "(1)",
                    "description": "would be in the interest of justice, the Court shall have regard"
                },
                {
                    "representation": "(a)",
                    "description": "if the statement is written by the child, by  the  prosecution submitting the statement to the Court; or"
                },
                {
                    "representation": "(b)",
                    "description": "if the statement is written on behalf of a child, by calling the person who wrote the statement to put the statement into evidence."
                },
                {
                    "representation": "(2)",
                    "description": "In considering whether the admission of a statement under subsection"
                },
                {
                    "representation": "(c)",
                    "description": "to any other circumstances that appear to the Court to be relevant."
                },
                {
                    "representation": "(3)",
                    "description": "A written statement mentioned in this section shall be tendered in evidence by the prosecution any time before the prosecution closes its case against the accused"
                },
                {
                    "representation": "(4)",
                    "description": "Where a statement is tendered into evidence under subsection"
                },
                {
                    "representation": "(5)",
                    "description": "Where the accused exercises the right under subsection"
                }
            ]
        }
    },
    {
        "act": "SEXUAL OFFENCES ACT",
        "source": "https://mola.gov.gy/laws-of-guyana",
        "type": {
            "name": "section",
            "representation": "76",
            "title": "No conviction on statement alone. ",
            "context": "SEXUAL OFFENCES ACT under No conviction on statement alone. 76. Where a statement is tendered in evidence under sections 74 or 75, the accused shall not be convicted on the basis of that evidence alone.  Evidence of sexual activity",
            "description": "Where a statement is tendered in evidence under sections 74 or 75, the accused shall not be convicted on the basis of that evidence alone.  Evidence of sexual activity"
        }
    },
    {
        "act": "SEXUAL OFFENCES ACT",
        "source": "https://mola.gov.gy/laws-of-guyana",
        "type": {
            "name": "section",
            "representation": "77",
            "title": "Evidence of sexual activity where complainant under 16 years. ",
            "context": "SEXUAL OFFENCES ACT under Evidence of sexual activity where complainant under 16 years. 77. (1) Where the complainant in proceedings for an offence under this Act is under 16 years of age, no evidence shall be adduced that the complainant has engaged in any sexual activity (with the accused or with any other person) other than the sexual activity that forms the subject matter of the charge unless the Court determines in accordance with the procedure set out in the Second Schedule, that the evidence   (a) is of criminal sexual activity involving the complainant, and there is evidence of a conviction of a third party for this criminal sexual activity;  (b) is to be used to show that inappropriate sexual knowledge was not   learnt from the accused, or that the complainant had a motive to lie; and  (c) is of facts sufficiently similar to the facts in issue to have significant relevance  (2) Any evidence referred to in subsection (1) shall only be admitted to the extent that the Court finds that the proposed evidence is material to a fact in issue in the case and LAWS OF GUYANA  Sexual Offences  Cap. 8:03 69  L.R.O. 1/2012       Evidence of sexual activity, reputation inferences.                       Evidence of sexual activity, in general.      Second  Schedule.            that its probative value is not outweighed by its inflammatory nature or potential prejudice to the proper administration of justice or the complainants personal dignity and right of privacy.",
            "description": [
                {
                    "representation": "(1)",
                    "description": "shall only be admitted to the extent that the Court finds that the proposed evidence is material to a fact in issue in the case and LAWS OF GUYANA  Sexual Offences  Cap. 8:03 69  L.R.O. 1/2012       Evidence of sexual activity, reputation inferences.                       Evidence of sexual activity, in general.      Second  Schedule.            that its probative value is not outweighed by its inflammatory nature or potential prejudice to the proper administration of justice or the complainants personal dignity and right of privacy."
                },
                {
                    "representation": "(a)",
                    "description": "is of criminal sexual activity involving the complainant, and there is evidence of a conviction of a third party for this criminal sexual activity;"
                },
                {
                    "representation": "(b)",
                    "description": "is to be used to show that inappropriate sexual knowledge was not   learnt from the accused, or that the complainant had a motive to lie; and"
                },
                {
                    "representation": "(c)",
                    "description": "is of facts sufficiently similar to the facts in issue to have significant relevance"
                },
                {
                    "representation": "(2)",
                    "description": "Any evidence referred to in subsection"
                }
            ]
        }
    },
    {
        "act": "SEXUAL OFFENCES ACT",
        "source": "https://mola.gov.gy/laws-of-guyana",
        "type": {
            "name": "section",
            "representation": "78",
            "title": "Evidence of sexual activity, reputation, inferences. ",
            "context": "SEXUAL OFFENCES ACT under Evidence of sexual activity, reputation, inferences. 78. (1) In proceedings in respect of a sexual offence, evidence as to the sexual activity or reputation of the complainant is not admissible, and the defence shall not be allowed to cross-examine on the matter.  (2) In proceedings in respect of a sexual offence, evidence that the complainant has engaged in sexual activity, whether with the accused or with any other person, is not admissible to support an inference that, by reason of the sexual nature of that activity, the complainant   (a) is more likely to have consented to the sexual activity that forms the subject-matter of the charge; or  (b) is less worthy of belief.",
            "description": [
                {
                    "representation": "(1)",
                    "description": "In proceedings in respect of a sexual offence, evidence as to the sexual activity or reputation of the complainant is not admissible, and the defence shall not be allowed to cross-examine on the matter."
                },
                {
                    "representation": "(2)",
                    "description": "In proceedings in respect of a sexual offence, evidence that the complainant has engaged in sexual activity, whether with the accused or with any other person, is not admissible to support an inference that, by reason of the sexual nature of that activity, the complainant"
                },
                {
                    "representation": "(a)",
                    "description": "is more likely to have consented to the sexual activity that forms the subject-matter of the charge; or"
                },
                {
                    "representation": "(b)",
                    "description": "is less worthy of belief."
                }
            ]
        }
    },
    {
        "act": "SEXUAL OFFENCES ACT",
        "source": "https://mola.gov.gy/laws-of-guyana",
        "type": {
            "name": "section",
            "representation": "79",
            "title": "Evidence of sexual activity in general. ",
            "context": "SEXUAL OFFENCES ACT under Evidence of sexual activity in general. 79. (1) Where the complainant in proceedings for an offence under this Act is sixteen years of age or over, no evidence shall be adduced that the complainant has engaged in sexual activity (with the accused or with any other person) other than the sexual activity that forms the subject-matter of the charge, unless the Court determines, in accordance with the procedure set out in the Second Schedule, that the evidence    (a) is of specific instances of sexual activity; and   (b) (i) tends to  rebut  evidence  that   was  previously  adduced  by  another party to the  proceedings; LAWS OF GUYANA 70 Cap. 8:03 Sexual Offences   L.R.O. 1/2012                                Previous allegations of sexual offences.                 (ii) where the accused  denies  sexual  penetration,  tends  to explain the presence of semen or the source of pregnancy or disease or any injury to the complainant, where it is   relevant to a fact in issue; or  (iii) is of consensual sexual activity of the complainant with the accused where this is reasonably contemporaneous with the date of the alleged offence.  (2) Any evidence referred to in subsection (1) shall only be admitted to the extent that the Court finds that the proposed evidence is material to a fact in issue in the case and that its probative value is not outweighed by its inflammatory nature or potential prejudice to the proper administration of justice or the complainants personal dignity and right of privacy.",
            "description": [
                {
                    "representation": "(1)",
                    "description": "shall only be admitted to the extent that the Court finds that the proposed evidence is material to a fact in issue in the case and that its probative value is not outweighed by its inflammatory nature or potential prejudice to the proper administration of justice or the complainants personal dignity and right of privacy."
                },
                {
                    "representation": "(a)",
                    "description": "is of specific instances of sexual activity; and"
                },
                {
                    "representation": "(b)",
                    "description": "(i) tends to  rebut  evidence  that   was  previously  adduced  by  another party to the  proceedings; LAWS OF GUYANA 70 Cap. 8:03 Sexual Offences   L.R.O. 1/2012                                Previous allegations of sexual offences."
                },
                {
                    "representation": "(2)",
                    "description": "Any evidence referred to in subsection"
                }
            ]
        }
    },
    {
        "act": "SEXUAL OFFENCES ACT",
        "source": "https://mola.gov.gy/laws-of-guyana",
        "type": {
            "name": "section",
            "representation": "80",
            "title": "Previous allegations of sexual offences.  PART VI  BAIL   ",
            "context": "SEXUAL OFFENCES ACT under Previous allegations of sexual offences.  PART VI  BAIL   80. (1) The defence shall not introduce evidence directly or ask questions in cross-examination suggesting that previous allegations of sexual offences by the complainant may have been false without the prior permission of the Court.  (2) The Court shall not give such permission unless   (a) the defence can adduce concrete evidence that the previous allegation was in fact false; and  (b) the relevance of the evidence to the case of the accused is demonstrated to LAWS OF GUYANA  Sexual Offences  Cap. 8:03 71  L.R.O. 1/2012          Factors to be taken into account.                                       the satisfaction of the Court.   PART VI BAIL",
            "description": [
                {
                    "representation": "(1)",
                    "description": "The defence shall not introduce evidence directly or ask questions in cross-examination suggesting that previous allegations of sexual offences by the complainant may have been false without the prior permission of the Court."
                },
                {
                    "representation": "(2)",
                    "description": "The Court shall not give such permission unless"
                },
                {
                    "representation": "(a)",
                    "description": "the defence can adduce concrete evidence that the previous allegation was in fact false; and"
                },
                {
                    "representation": "(b)",
                    "description": "the relevance of the evidence to the case of the accused is demonstrated to LAWS OF GUYANA  Sexual Offences  Cap. 8:03 71  L.R.O. 1/2012          Factors to be taken into account.                                       the satisfaction of the Court.   PART VI BAIL"
                }
            ]
        }
    },
    {
        "act": "SEXUAL OFFENCES ACT",
        "source": "https://mola.gov.gy/laws-of-guyana",
        "type": {
            "name": "section",
            "representation": "81",
            "title": "Factors to be taken into account. ",
            "context": "SEXUAL OFFENCES ACT under Factors to be taken into account. 81.  Where the Court is required to determine whether to grant bail in respect of an offence under this Act the Court shall take into account   (a) the need to secure the health, safety and well-being of the complainant or any witness;  (b) the need to secure the health, safety and well-being of any child affected by the offence or by the decision on bail;  (c) any hardship that may be caused to the accused or the family members of the accused if bail is not granted;  (d) the record of the accused with regard to the commission of violent acts and whether there is evidence in or on the record of physical or psychological abuse to children;  (e) whether there are substantial grounds for believing that the accused, if released on bail would   (i) fail to surrender to custody;  (ii) commit an offence while on bail; or  (iii) interfere with witnesses or LAWS OF GUYANA 72 Cap. 8:03 Sexual Offences   L.R.O. 1/2012                   Bail for sexual offences.                                     otherwise obstruct the course of justice, whether in relation to the accused or any other person;  (f) any other matters which may be relevant to the case in question.",
            "description": [
                {
                    "representation": "(a)",
                    "description": "the need to secure the health, safety and well-being of the complainant or any witness;"
                },
                {
                    "representation": "(b)",
                    "description": "the need to secure the health, safety and well-being of any child affected by the offence or by the decision on bail;"
                },
                {
                    "representation": "(c)",
                    "description": "any hardship that may be caused to the accused or the family members of the accused if bail is not granted;"
                },
                {
                    "representation": "(d)",
                    "description": "the record of the accused with regard to the commission of violent acts and whether there is evidence in or on the record of physical or psychological abuse to children;"
                },
                {
                    "representation": "(e)",
                    "description": "whether there are substantial grounds for believing that the accused, if released on bail would"
                },
                {
                    "representation": "(i)",
                    "description": "fail to surrender to custody;"
                },
                {
                    "representation": "(f)",
                    "description": "any other matters which may be relevant to the case in question."
                }
            ]
        }
    },
    {
        "act": "SEXUAL OFFENCES ACT",
        "source": "https://mola.gov.gy/laws-of-guyana",
        "type": {
            "name": "section",
            "representation": "82",
            "title": "Bail for sexual offences. ",
            "context": "SEXUAL OFFENCES ACT under Bail for sexual offences. 82. (1) Where an accused   (a) is charged with an offence under this Act which includes penetration, and has a prior sexual offence conviction, or  (b) is charged with committing a sexual offence with a child under section 10, 11, 12, 13, 16, 18 or 21,  the Court shall order that the accused be detained in custody until dealt with according to law, unless the accused, having been given a reasonable opportunity to do so, shows just cause why the detention of the accused in custody is not justified.  (2) For the purposes of subsection (1), just cause will be shown where the accused demonstrates that   (a) detention is not necessary to ensure the attendance of the accused in Court in order to be dealt with according to law;  (b) detention is not necessary for the protection or safety of the public, including for the protection of any complainant of or witness to the offence;  LAWS OF GUYANA  Sexual Offences  Cap. 8:03 73  L.R.O. 1/2012                                  Conditions of bail.                (c) there is not a substantial likelihood that the accused will, if released from custody, commit a criminal offence or interfere with the administration of justice; and  (d) detention is not necessary to maintain confidence in the administration of justice, having regard to all the circumstances, including   (i) the apparent strength of the prosecutions case;  (ii) the gravity of the offence;  (iii) the circumstances surrounding the commission of the offence,  including whether a weapon was used; and  (iv) the fact that the accused is liable, on conviction, for a potentially lengthy term of imprisonment.",
            "description": [
                {
                    "representation": "(1)",
                    "description": "Where an accused"
                },
                {
                    "representation": "(a)",
                    "description": "detention is not necessary to ensure the attendance of the accused in Court in order to be dealt with according to law;"
                },
                {
                    "representation": "(b)",
                    "description": "detention is not necessary for the protection or safety of the public, including for the protection of any complainant of or witness to the offence;  LAWS OF GUYANA  Sexual Offences  Cap. 8:03 73  L.R.O. 1/2012                                  Conditions of bail."
                },
                {
                    "representation": "(2)",
                    "description": "For the purposes of subsection"
                },
                {
                    "representation": "(c)",
                    "description": "there is not a substantial likelihood that the accused will, if released from custody, commit a criminal offence or interfere with the administration of justice; and"
                },
                {
                    "representation": "(d)",
                    "description": "detention is not necessary to maintain confidence in the administration of justice, having regard to all the circumstances, including"
                },
                {
                    "representation": "(i)",
                    "description": "the apparent strength of the prosecutions case;"
                }
            ]
        }
    },
    {
        "act": "SEXUAL OFFENCES ACT",
        "source": "https://mola.gov.gy/laws-of-guyana",
        "type": {
            "name": "section",
            "representation": "83",
            "title": "Conditions of bail. ",
            "context": "SEXUAL OFFENCES ACT under Conditions of bail. 83. (1) Where the accused is charged with an offence under this Act, the Court, in granting bail, may also order that the recognisance be subject to any of the following further conditions as the Court considers appropriate   (a) that the accused abstain from communicating, directly or indirectly, with any complainant, witness or other person identified in the order except in accordance with the conditions specified in the order as the judge considers necessary;  (b) that the accused not harass or molest, LAWS OF GUYANA 74 Cap. 8:03 Sexual Offences   L.R.O. 1/2012                                                  or cause another person to harass or molest, a specified person, including the complainant or any relevant child;  (c) that the accused not be in a locality in which are situated the premises in which a specified person, including the complainant or any relevant child, resides, works or is frequently present at;  (d) that the accused not be on premises which are or in a locality in which is situated the place of education of a specified person named in the order, including the complainant or any relevant child;  (e) where the accused continues to reside, work or attend a place of education with a specified person, including the complainant or any relevant child, that the accused do not enter or remain in the place of residence, employment, or education;  (f) that the accused report at such times as are specified at a specified  police station;  (g) that the accused remain within a territorial jurisdiction specified in the order;  (h) that the accused notify the police officer or other person designated  in the order of any change in the address, employment or occupation of the accused; LAWS OF GUYANA  Sexual Offences  Cap. 8:03 75  L.R.O. 1/2012                              Complainant to be notified if accused released on bail.         Orders following conviction.        (i) that where the accused is the holder of a passport, the accused deposit it as specified in the order; and  (j) that the accused comply with any other condition specified in the order that the Court considers necessary to ensure the safety and security of any complainant of or witness to the offence or in the interest of the public.  (2) Where a police officer believes on reasonable grounds that a person who has been granted bail subject to one or more of the conditions set out in subsection (1) has failed to comply with a condition of the recognizance, the police officer may apprehend the person without a warrant.  (3) Where bail has been granted to a person on a condition imposed under subsection (1) and the person contravenes or fails to comply with the condition, the bail shall be forfeited and the accused is liable to be re-arrested.",
            "description": [
                {
                    "representation": "(1)",
                    "description": "and the person contravenes or fails to comply with the condition, the bail shall be forfeited and the accused is liable to be re-arrested."
                },
                {
                    "representation": "(a)",
                    "description": "that the accused abstain from communicating, directly or indirectly, with any complainant, witness or other person identified in the order except in accordance with the conditions specified in the order as the judge considers necessary;"
                },
                {
                    "representation": "(b)",
                    "description": "that the accused not harass or molest, LAWS OF GUYANA 74 Cap. 8:03 Sexual Offences   L.R.O. 1/2012                                                  or cause another person to harass or molest, a specified person, including the complainant or any relevant child;"
                },
                {
                    "representation": "(c)",
                    "description": "that the accused not be in a locality in which are situated the premises in which a specified person, including the complainant or any relevant child, resides, works or is frequently present at;"
                },
                {
                    "representation": "(d)",
                    "description": "that the accused not be on premises which are or in a locality in which is situated the place of education of a specified person named in the order, including the complainant or any relevant child;"
                },
                {
                    "representation": "(e)",
                    "description": "where the accused continues to reside, work or attend a place of education with a specified person, including the complainant or any relevant child, that the accused do not enter or remain in the place of residence, employment, or education;"
                },
                {
                    "representation": "(f)",
                    "description": "that the accused report at such times as are specified at a specified  police station;"
                },
                {
                    "representation": "(g)",
                    "description": "that the accused remain within a territorial jurisdiction specified in the order;"
                },
                {
                    "representation": "(h)",
                    "description": "that the accused notify the police officer or other person designated  in the order of any change in the address, employment or occupation of the accused; LAWS OF GUYANA  Sexual Offences  Cap. 8:03 75  L.R.O. 1/2012                              Complainant to be notified if accused released on bail.         Orders following conviction."
                },
                {
                    "representation": "(i)",
                    "description": "that where the accused is the holder of a passport, the accused deposit it as specified in the order; and"
                },
                {
                    "representation": "(j)",
                    "description": "that the accused comply with any other condition specified in the order that the Court considers necessary to ensure the safety and security of any complainant of or witness to the offence or in the interest of the public."
                },
                {
                    "representation": "(2)",
                    "description": "Where a police officer believes on reasonable grounds that a person who has been granted bail subject to one or more of the conditions set out in subsection"
                },
                {
                    "representation": "(3)",
                    "description": "Where bail has been granted to a person on a condition imposed under subsection"
                }
            ]
        }
    },
    {
        "act": "SEXUAL OFFENCES ACT",
        "source": "https://mola.gov.gy/laws-of-guyana",
        "type": {
            "name": "section",
            "representation": "84",
            "title": "Complainant to be notified if accused released on bail.  PART VII SENTENCING  ",
            "context": "SEXUAL OFFENCES ACT under Complainant to be notified if accused released on bail.  PART VII SENTENCING  84. If an accused charged with an offence under this Act is released on bail, the prosecutor shall immediately inform the complainant of that fact, and any conditions of bail.  PART VII SENTENCING",
            "description": "If an accused charged with an offence under this Act is released on bail, the prosecutor shall immediately inform the complainant of that fact, and any conditions of bail.  PART VII SENTENCING"
        }
    },
    {
        "act": "SEXUAL OFFENCES ACT",
        "source": "https://mola.gov.gy/laws-of-guyana",
        "type": {
            "name": "section",
            "representation": "85",
            "title": "Orders following conviction.  PART VIII MEDICAL CARE AND SUPPORT FOR VICTIM  ",
            "context": "SEXUAL OFFENCES ACT under Orders following conviction.  PART VIII MEDICAL CARE AND SUPPORT FOR VICTIM  85. Where an accused is convicted of an offence under this Act, in addition to passing sentence the Court may   (a) order that the accused pay civil compensation to the complainant; and  (b) make one or more of the following LAWS OF GUYANA 76 Cap. 8:03 Sexual Offences   L.R.O. 1/2012                                   Health worker to report  childs sexual abuse.        National Task Force for Prevention of Sexual Offences.   orders   (i) drug treatment and drug testing order;  (ii) rehabilitation order;  (iii) protection and safety order; and  (iv) where the offence for which the accused has been convicted suggests risk of HIV transmission to the complainant, a HIV testing order and disclosure of the results to the Court and complainant; and  (v) mental and psychological treatment.  PART VIII MEDICAL CARE AND SUPPORT FOR COMPLAINT",
            "description": [
                {
                    "representation": "(a)",
                    "description": "order that the accused pay civil compensation to the complainant; and"
                },
                {
                    "representation": "(b)",
                    "description": "make one or more of the following LAWS OF GUYANA 76 Cap. 8:03 Sexual Offences   L.R.O. 1/2012                                   Health worker to report  childs sexual abuse.        National Task Force for Prevention of Sexual Offences.   orders"
                },
                {
                    "representation": "(i)",
                    "description": "drug treatment and drug testing order;"
                },
                {
                    "representation": "(v)",
                    "description": "mental and psychological treatment.  PART VIII MEDICAL CARE AND SUPPORT FOR COMPLAINT"
                }
            ]
        }
    },
    {
        "act": "SEXUAL OFFENCES ACT",
        "source": "https://mola.gov.gy/laws-of-guyana",
        "type": {
            "name": "section",
            "representation": "86",
            "title": "Health worker to report child's sexual abuse.  PART IX PREVENTION  ",
            "context": "SEXUAL OFFENCES ACT under Health worker to report child's sexual abuse.  PART IX PREVENTION  86. Where a health worker treats a child and finds evidence that the child has been sexually abused, notwithstanding any law relating to medical confidentiality, the health worker shall report the suspected abuse to the police and keep a record of having done so.  PART IX PREVENTION",
            "description": "Where a health worker treats a child and finds evidence that the child has been sexually abused, notwithstanding any law relating to medical confidentiality, the health worker shall report the suspected abuse to the police and keep a record of having done so.  PART IX PREVENTION"
        }
    },
    {
        "act": "SEXUAL OFFENCES ACT",
        "source": "https://mola.gov.gy/laws-of-guyana",
        "type": {
            "name": "section",
            "representation": "87",
            "title": "National Task Force for Prevention of Sexual Offences. ",
            "context": "SEXUAL OFFENCES ACT under National Task Force for Prevention of Sexual Offences. 87. (1) There shall be established an inter-agency task force to be known as the National Task Force for the Prevention of Sexual Violence which shall have the duty to develop and implement a national plan for the prevention of sexual violence. LAWS OF GUYANA  Sexual Offences  Cap. 8:03 77  L.R.O. 1/2012                                                  (2) The President shall appoint the members of the Task Force, which shall include the Ministers of Legal Affairs, Home Affairs, Human Services and Social Security, Amerindian Affairs, Education, Health, Local Government, Youth, Sport and Culture, senior public officers with responsibility for law enforcement, health and human and social services and persons from non-governmental organisations.  (3) The Task Force shall carry out the following activities either directly or by one or more of the constituent ministries as appropriate   (a) develop and publish within a reasonable time of the coming into force of this Act, a National Plan for the Prevention of Sexual Offences, which shall include the necessary steps to eradicate sexual violence in Guyana;  (b) develop initiatives for prevention of sexual violence;  (c) co-ordinate the implementation of the National Plan;  (d) commission and co-ordinate the collection, publication and sharing of data among government agencies;  (e) establish policies to enable the Government to work with non-governmental organisations, faith-based organisations, community-based organisations and other elements of civil society to prevent sexual violence and provide LAWS OF GUYANA 78 Cap. 8:03 Sexual Offences   L.R.O. 1/2012                                                  assistance to victims of sexual violence;  (f) provide guidance to the Sexual Violence Unit;  (g) develop national policy guidelines and protocols for victims of sexual violence and address matters relating to police services, prosecution, medical services, social service, probation service and prison service;  (h) monitor the implementation of this Act, the National Plan and the National Policy Guidelines and protocols;  (i) co-ordinate national education and awareness programmes;  (j) focus special attention on the issues of sexual violence in remote areas, including access to police support and medical attention, court services;  (k) determine the effectiveness of public awareness exercises and measures to be taken to ensure effectiveness;  (l) provide guidance on the development of training programmes specified under section 91;  (m) within a reasonable time of this Act coming into force, publish a paper on integration of  reports to be made, seeking medical care and evidence gathering and recommend either the LAWS OF GUYANA  Sexual Offences  Cap. 8:03 79  L.R.O. 1/2012                        Sexual  Violence Unit.                   Data.                 establishment of a special centre, or a unit at hospitals or at police stations, and setting out the necessary steps to establish any integrated services;  (n) in general, ensure acceptable and uniform treatment of all sexual offence matters;  (o) produce an annual report updating data and statistics, reporting on the implementation of the Act, National Plan and National Policy Guidelines, and other prevention activities.  (4) The Task Force shall meet at least once every three months.",
            "description": [
                {
                    "representation": "(1)",
                    "description": "There shall be established an inter-agency task force to be known as the National Task Force for the Prevention of Sexual Violence which shall have the duty to develop and implement a national plan for the prevention of sexual violence. LAWS OF GUYANA  Sexual Offences  Cap. 8:03 77  L.R.O. 1/2012"
                },
                {
                    "representation": "(2)",
                    "description": "The President shall appoint the members of the Task Force, which shall include the Ministers of Legal Affairs, Home Affairs, Human Services and Social Security, Amerindian Affairs, Education, Health, Local Government, Youth, Sport and Culture, senior public officers with responsibility for law enforcement, health and human and social services and persons from non-governmental organisations."
                },
                {
                    "representation": "(3)",
                    "description": "The Task Force shall carry out the following activities either directly or by one or more of the constituent ministries as appropriate"
                },
                {
                    "representation": "(a)",
                    "description": "develop and publish within a reasonable time of the coming into force of this Act, a National Plan for the Prevention of Sexual Offences, which shall include the necessary steps to eradicate sexual violence in Guyana;"
                },
                {
                    "representation": "(b)",
                    "description": "develop initiatives for prevention of sexual violence;"
                },
                {
                    "representation": "(c)",
                    "description": "co-ordinate the implementation of the National Plan;"
                },
                {
                    "representation": "(d)",
                    "description": "commission and co-ordinate the collection, publication and sharing of data among government agencies;"
                },
                {
                    "representation": "(e)",
                    "description": "establish policies to enable the Government to work with non-governmental organisations, faith-based organisations, community-based organisations and other elements of civil society to prevent sexual violence and provide LAWS OF GUYANA 78 Cap. 8:03 Sexual Offences   L.R.O. 1/2012                                                  assistance to victims of sexual violence;"
                },
                {
                    "representation": "(f)",
                    "description": "provide guidance to the Sexual Violence Unit;"
                },
                {
                    "representation": "(g)",
                    "description": "develop national policy guidelines and protocols for victims of sexual violence and address matters relating to police services, prosecution, medical services, social service, probation service and prison service;"
                },
                {
                    "representation": "(h)",
                    "description": "monitor the implementation of this Act, the National Plan and the National Policy Guidelines and protocols;"
                },
                {
                    "representation": "(i)",
                    "description": "co-ordinate national education and awareness programmes;"
                },
                {
                    "representation": "(j)",
                    "description": "focus special attention on the issues of sexual violence in remote areas, including access to police support and medical attention, court services;"
                },
                {
                    "representation": "(k)",
                    "description": "determine the effectiveness of public awareness exercises and measures to be taken to ensure effectiveness;"
                },
                {
                    "representation": "(l)",
                    "description": "provide guidance on the development of training programmes specified under section 91;"
                },
                {
                    "representation": "(m)",
                    "description": "within a reasonable time of this Act coming into force, publish a paper on integration of  reports to be made, seeking medical care and evidence gathering and recommend either the LAWS OF GUYANA  Sexual Offences  Cap. 8:03 79  L.R.O. 1/2012                        Sexual  Violence Unit.                   Data.                 establishment of a special centre, or a unit at hospitals or at police stations, and setting out the necessary steps to establish any integrated services;"
                },
                {
                    "representation": "(n)",
                    "description": "in general, ensure acceptable and uniform treatment of all sexual offence matters;"
                },
                {
                    "representation": "(o)",
                    "description": "produce an annual report updating data and statistics, reporting on the implementation of the Act, National Plan and National Policy Guidelines, and other prevention activities."
                },
                {
                    "representation": "(4)",
                    "description": "The Task Force shall meet at least once every three months."
                }
            ]
        }
    },
    {
        "act": "SEXUAL OFFENCES ACT",
        "source": "https://mola.gov.gy/laws-of-guyana",
        "type": {
            "name": "section",
            "representation": "88",
            "title": "Sexual Violence Unit. ",
            "context": "SEXUAL OFFENCES ACT under Sexual Violence Unit. 88. (1) The Minister shall establish a Sexual Violence Unit in the Ministry of Human Services and Social Security.  (2) The Sexual Violence Unit, or until it is established, the Director of Social Services shall support the Task Force in carrying out the provisions of section 87 (3).",
            "description": [
                {
                    "representation": "(1)",
                    "description": "The Minister shall establish a Sexual Violence Unit in the Ministry of Human Services and Social Security."
                },
                {
                    "representation": "(2)",
                    "description": "The Sexual Violence Unit, or until it is established, the Director of Social Services shall support the Task Force in carrying out the provisions of section 87"
                }
            ]
        }
    },
    {
        "act": "SEXUAL OFFENCES ACT",
        "source": "https://mola.gov.gy/laws-of-guyana",
        "type": {
            "name": "section",
            "representation": "89",
            "title": "Data. ",
            "context": "SEXUAL OFFENCES ACT under Data. 89. (1) All data collected shall respect the privacy of victims or complainants of sexual offences.  (2) Data shall include, but shall not be limited to, number of reports to the police, number of arrests, prosecutions and successful convictions, gender and age of victims or complainants, geographical locations where offences are alleged to have happened, number of persons seeking medical care, types of injuries received by victims or complainants, relationship of victim or complainant to accused, number of matters withdrawn from Court and number of matters where complainants chose not to proceed further.  LAWS OF GUYANA 80 Cap. 8:03 Sexual Offences   L.R.O. 1/2012  Public awareness.",
            "description": [
                {
                    "representation": "(1)",
                    "description": "All data collected shall respect the privacy of victims or complainants of sexual offences."
                },
                {
                    "representation": "(2)",
                    "description": "Data shall include, but shall not be limited to, number of reports to the police, number of arrests, prosecutions and successful convictions, gender and age of victims or complainants, geographical locations where offences are alleged to have happened, number of persons seeking medical care, types of injuries received by victims or complainants, relationship of victim or complainant to accused, number of matters withdrawn from Court and number of matters where complainants chose not to proceed further.  LAWS OF GUYANA 80 Cap. 8:03 Sexual Offences   L.R.O. 1/2012  Public awareness."
                }
            ]
        }
    },
    {
        "act": "SEXUAL OFFENCES ACT",
        "source": "https://mola.gov.gy/laws-of-guyana",
        "type": {
            "name": "section",
            "representation": "90",
            "title": "Public awareness. ",
            "context": "SEXUAL OFFENCES ACT under Public awareness. 90. (1) The Minister, in co-operation with other governmental agencies and non-governmental organisations shall prepare and disseminate public awareness programmes designed to educate victims and potential victims of sexual offences and their families of the risk of victimization.  (2) Awareness programmes referred to in subsection (1) shall include but shall not be limited to   (a) information regarding care arrangements for children, appropriate and inappropriate behaviour including touching and words, safe and preventative practices;  (b) sex education;  (c) information regarding exposure to and treatment of HIV and Acquired Immune Deficiency Syndrome and other sexually transmitted diseases;  (d) information relating to the psychological harm to a victim of sexual offences;  (e) the measures and services in place to ensure the safety of victims or complainants;  (f) information on how to contact relevant law enforcement authorities;  (g) information about the rights of victims and potential victims of sexual violence; and  (h) information about how to recognise LAWS OF GUYANA  Sexual Offences  Cap. 8:03 81  L.R.O. 1/2012                                         Education and training.       sexual abuse and where to seek help.  (3) The Minister in co-operation with other governmental agencies and non-governmental organisations shall prepare and disseminate public awareness programmes designed to discourage behaviour that fosters the abuse of persons that leads to sexual violence.  (4) Awareness programmes referred to in subsection (3) shall include, but shall not be limited to   (a) materials that include the impact of sexual violence on individual victims; and  (b) aggregate information on sexual violence worldwide and domestically as well as warnings of the potential for criminal consequences for engaging in sexual violence or any offence under this Act.  (5) Materials used in the public awareness programmes shall include as appropriate pamphlets, brochures, posters, advertisements in mass media, and any other methods appropriate for reaching victims or potential victims of sexual violence.  (6) Any material used under this section shall preserve the privacy of the victim or complainant and the family of each.",
            "description": [
                {
                    "representation": "(1)",
                    "description": "shall include but shall not be limited to"
                },
                {
                    "representation": "(2)",
                    "description": "Awareness programmes referred to in subsection"
                },
                {
                    "representation": "(a)",
                    "description": "materials that include the impact of sexual violence on individual victims; and"
                },
                {
                    "representation": "(b)",
                    "description": "aggregate information on sexual violence worldwide and domestically as well as warnings of the potential for criminal consequences for engaging in sexual violence or any offence under this Act."
                },
                {
                    "representation": "(c)",
                    "description": "information regarding exposure to and treatment of HIV and Acquired Immune Deficiency Syndrome and other sexually transmitted diseases;"
                },
                {
                    "representation": "(d)",
                    "description": "information relating to the psychological harm to a victim of sexual offences;"
                },
                {
                    "representation": "(e)",
                    "description": "the measures and services in place to ensure the safety of victims or complainants;"
                },
                {
                    "representation": "(f)",
                    "description": "information on how to contact relevant law enforcement authorities;"
                },
                {
                    "representation": "(g)",
                    "description": "information about the rights of victims and potential victims of sexual violence; and"
                },
                {
                    "representation": "(h)",
                    "description": "information about how to recognise LAWS OF GUYANA  Sexual Offences  Cap. 8:03 81  L.R.O. 1/2012                                         Education and training.       sexual abuse and where to seek help."
                },
                {
                    "representation": "(3)",
                    "description": "shall include, but shall not be limited to"
                },
                {
                    "representation": "(4)",
                    "description": "Awareness programmes referred to in subsection"
                },
                {
                    "representation": "(5)",
                    "description": "Materials used in the public awareness programmes shall include as appropriate pamphlets, brochures, posters, advertisements in mass media, and any other methods appropriate for reaching victims or potential victims of sexual violence."
                },
                {
                    "representation": "(6)",
                    "description": "Any material used under this section shall preserve the privacy of the victim or complainant and the family of each."
                }
            ]
        }
    },
    {
        "act": "SEXUAL OFFENCES ACT",
        "source": "https://mola.gov.gy/laws-of-guyana",
        "type": {
            "name": "section",
            "representation": "91",
            "title": "Education and training. Previous consistent statements LAWS OF GUYANA 8 Cap. 8:03 Sexual Offences   L.R.O. 1/2012  SECTION PART X MISCELLANEOUS  ",
            "context": "SEXUAL OFFENCES ACT under Education and training. Previous consistent statements LAWS OF GUYANA 8 Cap. 8:03 Sexual Offences   L.R.O. 1/2012  SECTION PART X MISCELLANEOUS  91. (1) The Ministers of Legal Affairs, Home Affairs, Health, Human Services and Social Security shall ensure that training programmes on sexual violence are developed and delivered to police, prosecutors, magistrates and judges, health workers, probation officers, social workers and the prison service, whether directly or by collaboration with other appropriate governmental agencies and non-governmental LAWS OF GUYANA 82 Cap. 8:03 Sexual Offences   L.R.O. 1/2012                                        Rules of Court and  regulations.              Law inconsistent with this Act.   Laws to be applied.  c.  5:03 c. 10:01      Repeal and savings.       organizations.  (2) The Judicial Service Commission shall ensure that training is provided to magistrates and judges not only on implementation of this Act, but also on existing laws, procedures and obligations relating to sexual offences, for example regulating requests for adjournments, cross-examination of the complainant, and on sexual offences in general, including rape myths.    PART X MISCELLANEOUS",
            "description": [
                {
                    "representation": "(1)",
                    "description": "The Ministers of Legal Affairs, Home Affairs, Health, Human Services and Social Security shall ensure that training programmes on sexual violence are developed and delivered to police, prosecutors, magistrates and judges, health workers, probation officers, social workers and the prison service, whether directly or by collaboration with other appropriate governmental agencies and non-governmental LAWS OF GUYANA 82 Cap. 8:03 Sexual Offences   L.R.O. 1/2012                                        Rules of Court and  regulations.              Law inconsistent with this Act.   Laws to be applied.  c.  5:03 c. 10:01      Repeal and savings.       organizations."
                },
                {
                    "representation": "(2)",
                    "description": "The Judicial Service Commission shall ensure that training is provided to magistrates and judges not only on implementation of this Act, but also on existing laws, procedures and obligations relating to sexual offences, for example regulating requests for adjournments, cross-examination of the complainant, and on sexual offences in general, including rape myths.    PART X MISCELLANEOUS"
                }
            ]
        }
    },
    {
        "act": "SEXUAL OFFENCES ACT",
        "source": "https://mola.gov.gy/laws-of-guyana",
        "type": {
            "name": "section",
            "representation": "92",
            "title": "Rules of court and regulations. ",
            "context": "SEXUAL OFFENCES ACT under Rules of court and regulations. 92. (1) Rules of Court may be made for the purpose of regulating the practice and procedure of the Court in proceedings under this Act.  (2) The Minister may make regulations for carrying out the provisions of this Act and for prescribing anything that needs to be prescribed.",
            "description": [
                {
                    "representation": "(1)",
                    "description": "Rules of Court may be made for the purpose of regulating the practice and procedure of the Court in proceedings under this Act."
                },
                {
                    "representation": "(2)",
                    "description": "The Minister may make regulations for carrying out the provisions of this Act and for prescribing anything that needs to be prescribed."
                }
            ]
        }
    },
    {
        "act": "SEXUAL OFFENCES ACT",
        "source": "https://mola.gov.gy/laws-of-guyana",
        "type": {
            "name": "section",
            "representation": "93",
            "title": "Laws to be applied. ",
            "context": "SEXUAL OFFENCES ACT under Laws to be applied. 93. Where any provision of any law is in conflict or inconsistent with any provision of this Act, the provision of this Act shall prevail.",
            "description": "Where any provision of any law is in conflict or inconsistent with any provision of this Act, the provision of this Act shall prevail."
        }
    },
    {
        "act": "SEXUAL OFFENCES ACT",
        "source": "https://mola.gov.gy/laws-of-guyana",
        "type": {
            "name": "section",
            "representation": "94",
            "title": "Law inconsistent or in conflict with this Act. ",
            "context": "SEXUAL OFFENCES ACT under Law inconsistent or in conflict with this Act. 94. Except as otherwise provided by this Act, the Evidence Act and the Criminal Law (Procedure) Act shall apply to this Act where necessary with such modifications, adaptations and qualifications that may be needed for the due administration of this Act.",
            "description": "Except as otherwise provided by this Act, the Evidence Act and the Criminal Law (Procedure) Act shall apply to this Act where necessary with such modifications, adaptations and qualifications that may be needed for the due administration of this Act."
        }
    },
    {
        "act": "SEXUAL OFFENCES ACT",
        "source": "https://mola.gov.gy/laws-of-guyana",
        "type": {
            "name": "section",
            "representation": "95",
            "title": "Repeal and savings.  FIRST SCHEDULE: Paper Committals for Sexual Offences  SECOND SCHEDULE: Part One - Procedure for applying to admit evidence of sexual activity where complainant over 16 years of age. Part Two - Procedure for applying to admit evidence of sexual activity where complainant under 16 years of age.   __________________________  CHAPTER 8:03  SEXUAL OFFENCES     7 of 2010 An Act to reform and consolidate the laws relating to sexual offences and to provide for related matters.    [25TH MAY 2010]     Short title.      Interpretation.    PART I PRELIMINARY  ",
            "context": "SEXUAL OFFENCES ACT under Repeal and savings.  FIRST SCHEDULE: Paper Committals for Sexual Offences  SECOND SCHEDULE: Part One - Procedure for applying to admit evidence of sexual activity where complainant over 16 years of age. Part Two - Procedure for applying to admit evidence of sexual activity where complainant under 16 years of age.   __________________________  CHAPTER 8:03  SEXUAL OFFENCES     7 of 2010 An Act to reform and consolidate the laws relating to sexual offences and to provide for related matters.    [25TH MAY 2010]     Short title.      Interpretation.    PART I PRELIMINARY  95. Notwithstanding the repeal of any law by this Act, if there are any pending proceedings instituted, the proceedings shall be disposed of or continued under the law as it stood immediately before the commencement of this section.  LAWS OF GUYANA  Sexual Offences  Cap. 8:03 83  L.R.O. 1/2012 s. 43     Interpretation. [2 of 2013]         Paper committal to be held by magistrate.  Proceedings in the presence of accused. [2 of 2013]                              FIRST SCHEDULE   PAPER COMMITTALS FOR SEXUAL OFFENCES",
            "description": "Notwithstanding the repeal of any law by this Act, if there are any pending proceedings instituted, the proceedings shall be disposed of or continued under the law as it stood immediately before the commencement of this section.  LAWS OF GUYANA  Sexual Offences  Cap. 8:03 83  L.R.O. 1/2012 s. 43     Interpretation. [2 of 2013]         Paper committal to be held by magistrate.  Proceedings in the presence of accused. [2 of 2013]                              FIRST SCHEDULE   PAPER COMMITTALS FOR SEXUAL OFFENCES"
        }
    }
]