[
    {
        "act": "CREDIT REPORTING ACT",
        "source": "https://mola.gov.gy/laws-of-guyana",
        "type": {
            "name": "section",
            "representation": "1",
            "title": "Short title. ",
            "context": "CREDIT REPORTING ACT under Short title. 1. This Act may be cited as the Credit Reporting Act.",
            "description": "This Act may be cited as the Credit Reporting Act."
        }
    },
    {
        "act": "CREDIT REPORTING ACT",
        "source": "https://mola.gov.gy/laws-of-guyana",
        "type": {
            "name": "section",
            "representation": "2",
            "title": "Interpretation.  PART II LICENSING OF CREDIT BUREAUS  ",
            "context": "CREDIT REPORTING ACT under Interpretation.  PART II LICENSING OF CREDIT BUREAUS  2. In this Act    adverse action means any denial, cancellation or any unfavourable change in the terms and conditions of a transaction regarding a consumer based in whole or in part on information contained in a credit report;  authorised person means a person authorised by the credit bureau to access the data or information collected and processed by the credit bureau;  the Bank means the Bank of Guyana established under the Bank of Guyana Act;  Companies Act means the Companies Act;  consumer means any legal or natural person whose data has been included in a credit bureau;  credit bureau means a legal person licensed under this Act to engage in the practice of collecting and processing credit information or other related information for the purpose of furnishing credit reports and offering value added services;  credit information means the information referred to in section 12 (5);  credit information provider means any entity that furnishes credit information to a credit bureau;  credit provider or lender means an institution, part of whose activities is providing lending service to its clients; LAWS OF GUYANA 6 Cap. 84:01 Credit Reporting  L.R.O. 1/2012                                                   credit report means information related to the economic obligations of a consumer, including the payment history of such obligations, guarantees, publicly available information and any other relevant data compiled by a credit bureau;  credit-scoring means a statistical formula that is used, usually with the help of computers, to estimate future performance of prospective borrowers and existing consumers;  data available to the public means any data subject to be disclosed to the general public according to the laws of Guyana;  data processing means any operation or set of operations or technical procedures, automated or not, which permits, within a data base, compiling, organising, storing, elaborating, selecting, extracting, comparing, sharing, communicating, transmitting or cancelling of data;  data quality adequacy means the adequacy of the data quality to the level prescribed by regulations;  file in relation to information on any consumer means, all of the information on that consumer recorded and retained by a credit bureau regardless of how the information is stored;  format means the standardised layout, agreed to by the credit information providers and the Bank, of data or information to be submitted to a credit bureau;  negative credit information or data means adverse information related to a consumer including but not limited to credit defaults or late payments to all types LAWS OF GUYANA Credit Reporting Cap. 84:01 7  L.R.O. 1/2012                                                 of lending facilities;  personal information means any information about a consumer, other than    (a) credit information;  (b) the consumers name, present and past addresses, national registration number or other numerical reference, or reference scheme used for identification purposes; and   (c) any other relevant information about the consumer which is reasonably required in order to enable the credit information to be utilised for the purposes of this Act;  positive credit information or data means any consumer information including, but not limited to, a consumers total credit exposures including loans sizes, maturity, terms and conditions, repayments and collaterals;  service provider or third party service provider means a third party providing services of collecting, compiling, storing and processing data or information on behalf of a credit information provider or a credit bureau according to a specific agreement signed by the parties;  source means the source from where the information is originally obtained;  user means any person entitled under section 11 to access the data or information contained in a credit bureau;  LAWS OF GUYANA 8 Cap. 84:01 Credit Reporting  L.R.O. 1/2012                    Licence to carry on credit bureau activities.     c. 89:01                          Application for licence.   value added services means any service based on the data or information provided by credit information providers and any other data lawfully obtained by a credit bureau which the credit bureau may, in addition to credit reporting, provide to increase the value of the service it offers including, but not limited to, alert, anti-fraud, credit scoring and identification theft prevention.  PART II LICENSING OF CREDIT BUREAUS",
            "description": [
                {
                    "representation": "(a)",
                    "description": "credit information;"
                },
                {
                    "representation": "(b)",
                    "description": "the consumers name, present and past addresses, national registration number or other numerical reference, or reference scheme used for identification purposes; and"
                },
                {
                    "representation": "(c)",
                    "description": "any other relevant information about the consumer which is reasonably required in order to enable the credit information to be utilised for the purposes of this Act;  positive credit information or data means any consumer information including, but not limited to, a consumers total credit exposures including loans sizes, maturity, terms and conditions, repayments and collaterals;  service provider or third party service provider means a third party providing services of collecting, compiling, storing and processing data or information on behalf of a credit information provider or a credit bureau according to a specific agreement signed by the parties;  source means the source from where the information is originally obtained;  user means any person entitled under section 11 to access the data or information contained in a credit bureau;  LAWS OF GUYANA 8 Cap. 84:01 Credit Reporting  L.R.O. 1/2012                    Licence to carry on credit bureau activities.     c. 89:01                          Application for licence.   value added services means any service based on the data or information provided by credit information providers and any other data lawfully obtained by a credit bureau which the credit bureau may, in addition to credit reporting, provide to increase the value of the service it offers including, but not limited to, alert, anti-fraud, credit scoring and identification theft prevention.  PART II LICENSING OF CREDIT BUREAUS"
                }
            ]
        }
    },
    {
        "act": "CREDIT REPORTING ACT",
        "source": "https://mola.gov.gy/laws-of-guyana",
        "type": {
            "name": "section",
            "representation": "3",
            "title": "Licence to carry on credit bureau activities. ",
            "context": "CREDIT REPORTING ACT under Licence to carry on credit bureau activities. 3. (1) A person shall not engage in credit bureau activities in Guyana without a licence under this Act.  (2) A person shall not be licensed to carry on the business of a credit bureau unless that person is a body corporate under the Companies Act, limited by shares and whose activities are restricted by its articles of incorporation to carrying on the business of a credit bureau.  (3) Any person who contravenes subsection (1) commits an offence and is liable on summary conviction to a fine of one million dollars and imprisonment for one year and to a further fine of fifty thousand dollars for each day during which the offence continues after conviction.  (4) A credit bureau shall not carry on the business of a credit bureau unless it pays annually the fee as prescribed by the Bank.  (5) Any credit bureau which contravenes subsection (4) commits an offence and is liable on summary conviction to a fine of one million dollars.",
            "description": [
                {
                    "representation": "(1)",
                    "description": "commits an offence and is liable on summary conviction to a fine of one million dollars and imprisonment for one year and to a further fine of fifty thousand dollars for each day during which the offence continues after conviction."
                },
                {
                    "representation": "(2)",
                    "description": "A person shall not be licensed to carry on the business of a credit bureau unless that person is a body corporate under the Companies Act, limited by shares and whose activities are restricted by its articles of incorporation to carrying on the business of a credit bureau."
                },
                {
                    "representation": "(3)",
                    "description": "Any person who contravenes subsection"
                },
                {
                    "representation": "(4)",
                    "description": "commits an offence and is liable on summary conviction to a fine of one million dollars."
                },
                {
                    "representation": "(5)",
                    "description": "Any credit bureau which contravenes subsection"
                }
            ]
        }
    },
    {
        "act": "CREDIT REPORTING ACT",
        "source": "https://mola.gov.gy/laws-of-guyana",
        "type": {
            "name": "section",
            "representation": "4",
            "title": "Application for licence. ",
            "context": "CREDIT REPORTING ACT under Application for licence. 4. (1) A person shall apply to the Bank in the prescribed form for a licence to carry on the business of a credit bureau. LAWS OF GUYANA Credit Reporting Cap. 84:01 9  L.R.O. 1/2012                                                  (2) An applicant for a licence to carry on the business of a credit bureau shall submit a fee as prescribed by the Bank along with the application which shall include the following    (a) a statement which shall contain the name of the applicant, address of its registered office in Guyana, and the name, address and nationality of each director;  (b) a certified copy of its articles of incorporation and certificate of incorporation;  (c) a mission statement and goals;  (d) operation manuals, including manuals on data loading, quality control, security policies, user manuals and procedures for processing requests from consumers;  (e) a five year business plan, continuity plan, ownership, governance and management structure;  (f) proposed pricing policy;  (g) proposed format and layouts of information including mandatory fields and voluntary fields to be supplied by the credit information providers;  (h) proof as may be required by the Bank that the company satisfies the LAWS OF GUYANA 10 Cap. 84:01 Credit Reporting  L.R.O. 1/2012              Evaluation of application.                Issuing of  Licence.                       minimum stated capital required by section 21; and  (i) any other information as the Bank may reasonably require.  (3) The Bank may require the applicant to attest to the truth of the statements made in the application by submitting a duly notarised affidavit to that effect.",
            "description": [
                {
                    "representation": "(1)",
                    "description": "A person shall apply to the Bank in the prescribed form for a licence to carry on the business of a credit bureau. LAWS OF GUYANA Credit Reporting Cap. 84:01 9  L.R.O. 1/2012"
                },
                {
                    "representation": "(2)",
                    "description": "An applicant for a licence to carry on the business of a credit bureau shall submit a fee as prescribed by the Bank along with the application which shall include the following"
                },
                {
                    "representation": "(a)",
                    "description": "a statement which shall contain the name of the applicant, address of its registered office in Guyana, and the name, address and nationality of each director;"
                },
                {
                    "representation": "(b)",
                    "description": "a certified copy of its articles of incorporation and certificate of incorporation;"
                },
                {
                    "representation": "(c)",
                    "description": "a mission statement and goals;"
                },
                {
                    "representation": "(d)",
                    "description": "operation manuals, including manuals on data loading, quality control, security policies, user manuals and procedures for processing requests from consumers;"
                },
                {
                    "representation": "(e)",
                    "description": "a five year business plan, continuity plan, ownership, governance and management structure;"
                },
                {
                    "representation": "(f)",
                    "description": "proposed pricing policy;"
                },
                {
                    "representation": "(g)",
                    "description": "proposed format and layouts of information including mandatory fields and voluntary fields to be supplied by the credit information providers;"
                },
                {
                    "representation": "(h)",
                    "description": "proof as may be required by the Bank that the company satisfies the LAWS OF GUYANA 10 Cap. 84:01 Credit Reporting  L.R.O. 1/2012              Evaluation of application.                Issuing of  Licence.                       minimum stated capital required by section 21; and"
                },
                {
                    "representation": "(i)",
                    "description": "any other information as the Bank may reasonably require."
                },
                {
                    "representation": "(3)",
                    "description": "The Bank may require the applicant to attest to the truth of the statements made in the application by submitting a duly notarised affidavit to that effect."
                }
            ]
        }
    },
    {
        "act": "CREDIT REPORTING ACT",
        "source": "https://mola.gov.gy/laws-of-guyana",
        "type": {
            "name": "section",
            "representation": "5",
            "title": "Evaluation of application. ",
            "context": "CREDIT REPORTING ACT under Evaluation of application. 5. For the purpose of evaluation of an application for a licence the Bank may require    (a) an audit;  (b) further documents or information; or   (c) personal interview with the directors of the applicant.",
            "description": [
                {
                    "representation": "(a)",
                    "description": "an audit;"
                },
                {
                    "representation": "(b)",
                    "description": "further documents or information; or"
                },
                {
                    "representation": "(c)",
                    "description": "personal interview with the directors of the applicant."
                }
            ]
        }
    },
    {
        "act": "CREDIT REPORTING ACT",
        "source": "https://mola.gov.gy/laws-of-guyana",
        "type": {
            "name": "section",
            "representation": "6",
            "title": "Issuing of licence. ",
            "context": "CREDIT REPORTING ACT under Issuing of licence. 6. (1) The Bank may within sixty days of receipt of an application, grant or refuse to grant a licence.  (2) The Bank may refuse to accept an application which does not contain all of the information specified in section 4, by providing written notice to the applicant of such refusal.  (3) The Bank shall within fourteen days from the receipt of an application referred to in subsection (1) send the applicant a formal letter of acceptance or refusal of the application or a letter of deficiency which stipulates a deadline for the rectification of the deficiencies outlined.  (4) The Bank shall take no further action in the matter and the computation of the time under subsection (1) will not commence unless the deficiencies are rectified within the time specified.  LAWS OF GUYANA Credit Reporting Cap. 84:01 11  L.R.O. 1/2012                                             Revocation of  licence.     (5) The time limit provided in subsection (1) may be extended by the Bank for an additional period not exceeding thirty days upon written notice to the applicant stating that further information is needed to review the application.  (6) Upon determination that the applicant satisfies the requirements of this Act the Bank may, after consultation with the Minister, issue a licence.  (7) A licence shall be in the prescribed form and shall be valid unless it is revoked in accordance with section",
            "description": [
                {
                    "representation": "(1)",
                    "description": "may be extended by the Bank for an additional period not exceeding thirty days upon written notice to the applicant stating that further information is needed to review the application."
                },
                {
                    "representation": "(2)",
                    "description": "The Bank may refuse to accept an application which does not contain all of the information specified in section 4, by providing written notice to the applicant of such refusal."
                },
                {
                    "representation": "(3)",
                    "description": "The Bank shall within fourteen days from the receipt of an application referred to in subsection"
                },
                {
                    "representation": "(4)",
                    "description": "The Bank shall take no further action in the matter and the computation of the time under subsection"
                },
                {
                    "representation": "(5)",
                    "description": "The time limit provided in subsection"
                },
                {
                    "representation": "(6)",
                    "description": "Upon determination that the applicant satisfies the requirements of this Act the Bank may, after consultation with the Minister, issue a licence."
                },
                {
                    "representation": "(7)",
                    "description": "A licence shall be in the prescribed form and shall be valid unless it is revoked in accordance with section"
                }
            ]
        }
    },
    {
        "act": "CREDIT REPORTING ACT",
        "source": "https://mola.gov.gy/laws-of-guyana",
        "type": {
            "name": "section",
            "representation": "7",
            "title": "Revocation of licence. ",
            "context": "CREDIT REPORTING ACT under Revocation of licence. 7.  (8) A fee in an amount prescribed by the Bank shall be payable by a credit bureau to the Bank for the issue of the licence and after the issue of the licence the prescribed fee shall be paid not later than 1st February each year.  (9) A licence to carry on business as a credit bureau may contain such terms and conditions as may be specified by the Bank.  (10) The Bank shall publish in the Gazette and at least two daily newspapers of general circulation in Guyana notice of the issue of the licence.  (11) If the Bank determines that the applicant does not satisfy the requirements of this Act, the Bank shall inform the applicant in writing of its reasons for refusal to grant the licence.",
            "description": [
                {
                    "representation": "(8)",
                    "description": "A fee in an amount prescribed by the Bank shall be payable by a credit bureau to the Bank for the issue of the licence and after the issue of the licence the prescribed fee shall be paid not later than 1st February each year."
                },
                {
                    "representation": "(9)",
                    "description": "A licence to carry on business as a credit bureau may contain such terms and conditions as may be specified by the Bank."
                }
            ]
        }
    },
    {
        "act": "CREDIT REPORTING ACT",
        "source": "https://mola.gov.gy/laws-of-guyana",
        "type": {
            "name": "section",
            "representation": "8",
            "title": "Supervision of credit bureau. ",
            "context": "CREDIT REPORTING ACT under Supervision of credit bureau. 8. (1) The Bank shall have overall authority to    (a) issue a licence to any applicant for a licence to operate a credit bureau in Guyana; and  (b) supervise the activities of a credit bureau.  (2) In the performance of his duties under this Act an authorised officer of the Bank shall be entitled at all reasonable times to    (a)  conduct on-site inspections of a credit bureau's premises or every premise where the service is provided and the credit information is compiled, processed and stored, as often as the Bank shall deem necessary;   (b)  have access to all books, accounts, records, contracts, minutes of meetings, and any other documents, electronic data and any other relevant information in the possession or control of any director, officer or employee of any credit bureau; LAWS OF GUYANA Credit Reporting Cap. 84:01 15  L.R.O. 1/2012                                              Power to issue instructions.       (c) require any director, officer, employee, or auditor of any credit bureau to furnish such information or to produce such books, records or documents as are in their possession or control that relate to the operations of the credit bureau;  (d) summon any director, officer, employee, or auditor of any credit bureau to appear before a Committee appointed by the Bank to investigate or review any aspect of the credit bureau's operations.  (3) The Bank may appoint one or more persons whom it deems to be qualified to conduct on-site inspections at a credit bureau's premises or the premises where the service is provided.  (4) The Bank may in the case of an inspection conducted, charge the fees and costs of such inspection to the credit bureau being inspected and require payment of such fees and costs by the credit bureau.  (5) Any person summoned to attend or produce books or documents under this section who refuses or neglects to do so, or refuses to answer any question put to him by or with the concurrence of the investigator, commits an offence and is liable on summary conviction to a fine of five hundred thousand dollars.",
            "description": [
                {
                    "representation": "(1)",
                    "description": "The Bank shall have overall authority to"
                },
                {
                    "representation": "(a)",
                    "description": "conduct on-site inspections of a credit bureau's premises or every premise where the service is provided and the credit information is compiled, processed and stored, as often as the Bank shall deem necessary;"
                },
                {
                    "representation": "(b)",
                    "description": "have access to all books, accounts, records, contracts, minutes of meetings, and any other documents, electronic data and any other relevant information in the possession or control of any director, officer or employee of any credit bureau; LAWS OF GUYANA Credit Reporting Cap. 84:01 15  L.R.O. 1/2012                                              Power to issue instructions."
                },
                {
                    "representation": "(2)",
                    "description": "In the performance of his duties under this Act an authorised officer of the Bank shall be entitled at all reasonable times to"
                },
                {
                    "representation": "(c)",
                    "description": "require any director, officer, employee, or auditor of any credit bureau to furnish such information or to produce such books, records or documents as are in their possession or control that relate to the operations of the credit bureau;"
                },
                {
                    "representation": "(d)",
                    "description": "summon any director, officer, employee, or auditor of any credit bureau to appear before a Committee appointed by the Bank to investigate or review any aspect of the credit bureau's operations."
                },
                {
                    "representation": "(3)",
                    "description": "The Bank may appoint one or more persons whom it deems to be qualified to conduct on-site inspections at a credit bureau's premises or the premises where the service is provided."
                },
                {
                    "representation": "(4)",
                    "description": "The Bank may in the case of an inspection conducted, charge the fees and costs of such inspection to the credit bureau being inspected and require payment of such fees and costs by the credit bureau."
                },
                {
                    "representation": "(5)",
                    "description": "Any person summoned to attend or produce books or documents under this section who refuses or neglects to do so, or refuses to answer any question put to him by or with the concurrence of the investigator, commits an offence and is liable on summary conviction to a fine of five hundred thousand dollars."
                }
            ]
        }
    },
    {
        "act": "CREDIT REPORTING ACT",
        "source": "https://mola.gov.gy/laws-of-guyana",
        "type": {
            "name": "section",
            "representation": "9",
            "title": "Power to issue instructions. ",
            "context": "CREDIT REPORTING ACT under Power to issue instructions. 9. Where in the opinion of the Bank, a credit bureau has failed to comply with this Act, any order, direction or notice imposed by the Bank or any condition in the licence, the Bank may instruct the credit bureau in writing to perform the acts as in the opinion of the Bank are necessary LAWS OF GUYANA 16 Cap. 84:01 Credit Reporting  L.R.O. 1/2012                             Annual audit and compliance review.                         to rectify the situation and on failure of the credit bureau to do so the Bank may    (a) restrict the scope of its business in a particular way;  (b) suspend the licence until it rectifies the situation;  (c) order the suspension or removal from office of any director, officer, employee or other person of the credit bureau; or   (d) take any other action that may be necessary.",
            "description": [
                {
                    "representation": "(a)",
                    "description": "restrict the scope of its business in a particular way;"
                },
                {
                    "representation": "(b)",
                    "description": "suspend the licence until it rectifies the situation;"
                },
                {
                    "representation": "(c)",
                    "description": "order the suspension or removal from office of any director, officer, employee or other person of the credit bureau; or"
                },
                {
                    "representation": "(d)",
                    "description": "take any other action that may be necessary."
                }
            ]
        }
    },
    {
        "act": "CREDIT REPORTING ACT",
        "source": "https://mola.gov.gy/laws-of-guyana",
        "type": {
            "name": "section",
            "representation": "10",
            "title": "Annual audit and compliance review.  PART III CREDIT REPORTING  ",
            "context": "CREDIT REPORTING ACT under Annual audit and compliance review.  PART III CREDIT REPORTING  10. (1) Every credit bureau shall with the approval of the Bank appoint annually an independent auditor to conduct an annual and compliance review of the credit bureau in accordance with this Act and applicable standards.    (2) The duties of an auditor appointed under this section shall include the following    (a) to make a full review of the credit bureau's records and accounts and to make to the shareholders of the credit bureau a report on the financial statements indicating whether in his opinion such statements are fair and properly drawn up, whether they exhibit a true and fair statement of the affairs of the credit bureau in accordance with applicable standards and requirements as to format and content specified by the Bank, and in LAWS OF GUYANA Credit Reporting Cap. 84:01 17  L.R.O. 1/2012                                                 any case in which the auditor has called for information or explanation from the directors, officers or agents of the institution, whether a satisfactory response was received;  (b) to make a full review of the credit bureau's internal control and security structures, risk management controls and the credit bureau's procedures for compliance with the requirements of this Act and with any standards applicable to credit bureaus;  (c) to prepare a full report of its findings which it shall submit to the credit bureau.  (3) Prior to making his reviews and reports under this section the auditor shall obtain from the credit bureau a copy of the most recent report of inspection of the credit bureau prepared by the Bank and any order, direction, notice or other action issued or taken by the Bank under this Act.  (4) A credit bureau shall within three months of the end of its financial year deliver the audit report to the Bank and which report it shall deliver to shareholders within two weeks of delivery of the report to the Bank.  (5) A credit bureau shall bear the cost of the annual audit and compliance review.  (6) An auditor performing his duties under this section shall not be liable to any person in any action in tort or contract for any act done or not done, or any statement or report made or not made, in good faith and in the exercise of his duties under this section and his reasonable professional judgment. LAWS OF GUYANA 18 Cap. 84:01 Credit Reporting  L.R.O. 1/2012                  Permissible purpose.                                    (7) If any credit bureau fails to comply with the requirements of subsection (4) it commits an offence and is liable on summary conviction to a fine of five hundred thousand dollars.  PART III CREDIT REPORTING",
            "description": [
                {
                    "representation": "(1)",
                    "description": "Every credit bureau shall with the approval of the Bank appoint annually an independent auditor to conduct an annual and compliance review of the credit bureau in accordance with this Act and applicable standards."
                },
                {
                    "representation": "(2)",
                    "description": "The duties of an auditor appointed under this section shall include the following"
                },
                {
                    "representation": "(a)",
                    "description": "to make a full review of the credit bureau's records and accounts and to make to the shareholders of the credit bureau a report on the financial statements indicating whether in his opinion such statements are fair and properly drawn up, whether they exhibit a true and fair statement of the affairs of the credit bureau in accordance with applicable standards and requirements as to format and content specified by the Bank, and in LAWS OF GUYANA Credit Reporting Cap. 84:01 17  L.R.O. 1/2012                                                 any case in which the auditor has called for information or explanation from the directors, officers or agents of the institution, whether a satisfactory response was received;"
                },
                {
                    "representation": "(b)",
                    "description": "to make a full review of the credit bureau's internal control and security structures, risk management controls and the credit bureau's procedures for compliance with the requirements of this Act and with any standards applicable to credit bureaus;"
                },
                {
                    "representation": "(c)",
                    "description": "to prepare a full report of its findings which it shall submit to the credit bureau."
                },
                {
                    "representation": "(3)",
                    "description": "Prior to making his reviews and reports under this section the auditor shall obtain from the credit bureau a copy of the most recent report of inspection of the credit bureau prepared by the Bank and any order, direction, notice or other action issued or taken by the Bank under this Act."
                },
                {
                    "representation": "(4)",
                    "description": "it commits an offence and is liable on summary conviction to a fine of five hundred thousand dollars.  PART III CREDIT REPORTING"
                },
                {
                    "representation": "(5)",
                    "description": "A credit bureau shall bear the cost of the annual audit and compliance review."
                },
                {
                    "representation": "(6)",
                    "description": "An auditor performing his duties under this section shall not be liable to any person in any action in tort or contract for any act done or not done, or any statement or report made or not made, in good faith and in the exercise of his duties under this section and his reasonable professional judgment. LAWS OF GUYANA 18 Cap. 84:01 Credit Reporting  L.R.O. 1/2012                  Permissible purpose."
                },
                {
                    "representation": "(7)",
                    "description": "If any credit bureau fails to comply with the requirements of subsection"
                }
            ]
        }
    },
    {
        "act": "CREDIT REPORTING ACT",
        "source": "https://mola.gov.gy/laws-of-guyana",
        "type": {
            "name": "section",
            "representation": "11",
            "title": "Permissible purpose. ",
            "context": "CREDIT REPORTING ACT under Permissible purpose. 11. (1) A credit bureau shall not disclose credit information except   (a) to a credit information provider who it has reason to believe intends to use the information in connection with a credit transaction involving the consumer in respect of whom the information is to be furnished and involving the extension of credit to, or review or collection of an account of the consumer;  (b) to a credit information provider to evaluate the creditworthiness of a consumer;  (c) to a third party service provider for the purpose of collecting, compiling, storing and processing data or information in accordance with the specific agreement signed by the parties;  (d) to the consumer to whom the information pertains;  (e) with written permission and instructions of the consumer to whom LAWS OF GUYANA Credit Reporting Cap. 84:01 19  L.R.O. 1/2012                             Credit information providers.         c. 85:03        c. 85:03          it relates, for the purposes of    (i) purchasing or collecting of a debt of a consumer to whom the information pertains; (ii) entering into a renewal of a tenancy agreement; (iii) underwriting of insurance involving the consumer; (iv) facilitating a financial or other commercial transaction involv- ing the consumer; (v) employment of the consumer.  (2) A credit bureau that wilfully discloses credit information in contravention of the provisions of this section commits an offence and is liable on summary conviction to a fine of one million dollars.",
            "description": [
                {
                    "representation": "(1)",
                    "description": "A credit bureau shall not disclose credit information except"
                },
                {
                    "representation": "(a)",
                    "description": "to a credit information provider who it has reason to believe intends to use the information in connection with a credit transaction involving the consumer in respect of whom the information is to be furnished and involving the extension of credit to, or review or collection of an account of the consumer;"
                },
                {
                    "representation": "(b)",
                    "description": "to a credit information provider to evaluate the creditworthiness of a consumer;"
                },
                {
                    "representation": "(c)",
                    "description": "to a third party service provider for the purpose of collecting, compiling, storing and processing data or information in accordance with the specific agreement signed by the parties;"
                },
                {
                    "representation": "(d)",
                    "description": "to the consumer to whom the information pertains;"
                },
                {
                    "representation": "(e)",
                    "description": "with written permission and instructions of the consumer to whom LAWS OF GUYANA Credit Reporting Cap. 84:01 19  L.R.O. 1/2012                             Credit information providers.         c. 85:03        c. 85:03          it relates, for the purposes of"
                },
                {
                    "representation": "(i)",
                    "description": "purchasing or collecting of a debt of a consumer to whom the information pertains;"
                },
                {
                    "representation": "(v)",
                    "description": "employment of the consumer."
                },
                {
                    "representation": "(2)",
                    "description": "A credit bureau that wilfully discloses credit information in contravention of the provisions of this section commits an offence and is liable on summary conviction to a fine of one million dollars."
                }
            ]
        }
    },
    {
        "act": "CREDIT REPORTING ACT",
        "source": "https://mola.gov.gy/laws-of-guyana",
        "type": {
            "name": "section",
            "representation": "12",
            "title": "Credit information providers. ",
            "context": "CREDIT REPORTING ACT under Credit information providers. 12. (1) A credit bureau may obtain credit information as provided in subsection (5) from any of the credit information providers referred to in subsection (2).  (2) The credit information providers are    (a) a bank licensed under the Financial Institutions Act;   (b) a company other than a bank licensed to conduct financial business under the Financial Institutions Act;  (c) any other entity the Bank may designate as a credit information provider by notice published in the Gazette and two daily newspapers of general circulation in Guyana.  LAWS OF GUYANA 20 Cap. 84:01 Credit Reporting  L.R.O. 1/2012                                                  (3) A credit information provider shall not provide credit information unless the credit information provider is satisfied after undertaking all reasonable enquiries and investigations, that the information is reliable.  (4) For the purpose of this Act, credit information is reliable if it    (a) is accurate in all materials respects;  (b) is presented in a fair and balanced manner; and   (c) does not include the personal information of any consumer unless the consumer consents in writing to the inclusion, and such consent is attached to the information.  (5) Subject to subsection (3), a credit information provider may disclose to a credit bureau, the following information    (a) the amount and nature of loans or advances or other credit facilities granted by a credit information provider to any consumer;  (b) the nature of the security taken from any consumer in respect of credit facilities granted to the consumer by a credit information provider;  (c) the nature of any guarantee or other non-fund based facility furnished to any consumer by a credit information provider;  LAWS OF GUYANA Credit Reporting Cap. 84:01 21  L.R.O. 1/2012                                                   (d) information about any consumer's financial means, creditworthiness or history of financial transactions including antecedents and adverse court judgments, obtained by the credit information provider in relation to transactions involving the provider;  (e) any credit related information that the Bank considers appropriate to include as credit information for the purposes of this Act and specifies by notice published in the Gazette and two daily newspapers of general circulation in Guyana.  (6) A credit information provider that contravenes subsection (3) commits an offence and is liable on summary conviction to a fine of one million dollars.  (7) A credit bureau may collect data or information from public sources, including    (a) data available to the general public;  (b) court judgment;  (c) immovable property registers;  (d) company registers.  (8) A credit bureau commits an offence if that credit bureau discloses credit information obtained from a person other than a credit information provider or from a source referred to in subsection (7) and is liable on summary conviction to a fine of one million dollars.   LAWS OF GUYANA 22 Cap. 84:01 Credit Reporting  L.R.O. 1/2012  Consent.                                 Data quality  and security.",
            "description": [
                {
                    "representation": "(1)",
                    "description": "A credit bureau may obtain credit information as provided in subsection"
                },
                {
                    "representation": "(5)",
                    "description": "Subject to subsection"
                },
                {
                    "representation": "(2)",
                    "description": "The credit information providers are"
                },
                {
                    "representation": "(a)",
                    "description": "data available to the general public;"
                },
                {
                    "representation": "(b)",
                    "description": "court judgment;"
                },
                {
                    "representation": "(c)",
                    "description": "immovable property registers;"
                },
                {
                    "representation": "(3)",
                    "description": "commits an offence and is liable on summary conviction to a fine of one million dollars."
                },
                {
                    "representation": "(4)",
                    "description": "For the purpose of this Act, credit information is reliable if it"
                },
                {
                    "representation": "(d)",
                    "description": "company registers."
                },
                {
                    "representation": "(e)",
                    "description": "any credit related information that the Bank considers appropriate to include as credit information for the purposes of this Act and specifies by notice published in the Gazette and two daily newspapers of general circulation in Guyana."
                },
                {
                    "representation": "(6)",
                    "description": "A credit information provider that contravenes subsection"
                },
                {
                    "representation": "(7)",
                    "description": "and is liable on summary conviction to a fine of one million dollars.   LAWS OF GUYANA 22 Cap. 84:01 Credit Reporting  L.R.O. 1/2012  Consent.                                 Data quality  and security."
                },
                {
                    "representation": "(8)",
                    "description": "A credit bureau commits an offence if that credit bureau discloses credit information obtained from a person other than a credit information provider or from a source referred to in subsection"
                }
            ]
        }
    },
    {
        "act": "CREDIT REPORTING ACT",
        "source": "https://mola.gov.gy/laws-of-guyana",
        "type": {
            "name": "section",
            "representation": "13",
            "title": "Consent. ",
            "context": "CREDIT REPORTING ACT under Consent. 13. (1) A credit information provider shall not share with a credit bureau data or information including electronic data or information collected on a consumer without the consumer's prior consent.  (2) Consent may be recorded in any format and where it is electronically recorded it shall be accompanied by an electronic signature.  (3) Consent shall be included in the consumer's credit application.  (4) A credit information provider shall not share with a credit bureau personal information about a consumer unless the information is necessary for one or more of the credit reporting or credit risk appraisal functions or activities of the credit bureau and shall only be shared with the written consent of the consumer.  (5) A credit information provider that contravenes subsection (1) or (4) commits an offence and is liable upon summary conviction to a fine of one million dollars.",
            "description": [
                {
                    "representation": "(1)",
                    "description": "or"
                },
                {
                    "representation": "(2)",
                    "description": "Consent may be recorded in any format and where it is electronically recorded it shall be accompanied by an electronic signature."
                },
                {
                    "representation": "(3)",
                    "description": "Consent shall be included in the consumer's credit application."
                },
                {
                    "representation": "(4)",
                    "description": "commits an offence and is liable upon summary conviction to a fine of one million dollars."
                },
                {
                    "representation": "(5)",
                    "description": "A credit information provider that contravenes subsection"
                }
            ]
        }
    },
    {
        "act": "CREDIT REPORTING ACT",
        "source": "https://mola.gov.gy/laws-of-guyana",
        "type": {
            "name": "section",
            "representation": "14",
            "title": "Data quality and security. ",
            "context": "CREDIT REPORTING ACT under Data quality and security. 14. (1) A credit bureau shall have in place operational guidelines and security systems and shall take all reasonable steps to ensure that credit information received from the credit information providers is accurately recorded, up to date and is protected against loss, unauthorised access or use, modification, or unauthorised disclosure.  (2) A credit bureau shall keep records of all incidents on data quality breaches held under its system.  (3) A credit bureau may refuse to create a file based on information received from credit information providers if it considers the information not to be reliable.  LAWS OF GUYANA Credit Reporting Cap. 84:01 23  L.R.O. 1/2012   Confidentiality.                       c. 85:06   c. 85:03           c. 75:01    c. 47:02              Immunity.",
            "description": [
                {
                    "representation": "(1)",
                    "description": "A credit bureau shall have in place operational guidelines and security systems and shall take all reasonable steps to ensure that credit information received from the credit information providers is accurately recorded, up to date and is protected against loss, unauthorised access or use, modification, or unauthorised disclosure."
                },
                {
                    "representation": "(2)",
                    "description": "A credit bureau shall keep records of all incidents on data quality breaches held under its system."
                },
                {
                    "representation": "(3)",
                    "description": "A credit bureau may refuse to create a file based on information received from credit information providers if it considers the information not to be reliable.  LAWS OF GUYANA Credit Reporting Cap. 84:01 23  L.R.O. 1/2012   Confidentiality.                       c. 85:06   c. 85:03           c. 75:01    c. 47:02              Immunity."
                }
            ]
        }
    },
    {
        "act": "CREDIT REPORTING ACT",
        "source": "https://mola.gov.gy/laws-of-guyana",
        "type": {
            "name": "section",
            "representation": "15",
            "title": "Confidentiality. ",
            "context": "CREDIT REPORTING ACT under Confidentiality. 15. (1) Subject to subsection (2) any person including credit information provider officials, credit bureau users and any other person who receives, compiles, processes or stores credit information or who is otherwise concerned with the administration of this Act, shall not disclose the contents of confidential documents or information received in connection with the performance of any duty or function under this Act.  (2) A disclosure shall not be deemed inconsistent with any duty imposed by this section, where it is a disclosure permitted under the provisions of this Act.  (3) A licensed financial institution that provides data to a credit bureau under this Act does not violate the provisions of    (a) sections 49 and 63 of the Off-Shore Banking Act;  (b) section 63 of the Financial Institutions Act;  (c) section 23 of the Co-operative Financial Institutions Act;  (d) the Telecommunication Act; and   (e) any other relevant law.  (4) A person who contravenes subsection (1) commits an offence and is liable on summary conviction to a fine of one million dollars and imprisonment for six months.",
            "description": [
                {
                    "representation": "(1)",
                    "description": "commits an offence and is liable on summary conviction to a fine of one million dollars and imprisonment for six months."
                },
                {
                    "representation": "(2)",
                    "description": "A disclosure shall not be deemed inconsistent with any duty imposed by this section, where it is a disclosure permitted under the provisions of this Act."
                },
                {
                    "representation": "(3)",
                    "description": "A licensed financial institution that provides data to a credit bureau under this Act does not violate the provisions of"
                },
                {
                    "representation": "(a)",
                    "description": "sections 49 and 63 of the Off-Shore Banking Act;"
                },
                {
                    "representation": "(b)",
                    "description": "section 63 of the Financial Institutions Act;"
                },
                {
                    "representation": "(c)",
                    "description": "section 23 of the Co-operative Financial Institutions Act;"
                },
                {
                    "representation": "(d)",
                    "description": "the Telecommunication Act; and"
                },
                {
                    "representation": "(e)",
                    "description": "any other relevant law."
                },
                {
                    "representation": "(4)",
                    "description": "A person who contravenes subsection"
                }
            ]
        }
    },
    {
        "act": "CREDIT REPORTING ACT",
        "source": "https://mola.gov.gy/laws-of-guyana",
        "type": {
            "name": "section",
            "representation": "16",
            "title": "Immunity. ",
            "context": "CREDIT REPORTING ACT under Immunity. 16. The Bank, a credit bureau, any of their directors, officers or employees, or a credit information provider shall not be liable in damages for disclosing information in good LAWS OF GUYANA 24 Cap. 84:01 Credit Reporting  L.R.O. 1/2012            Retention  period.                                         Cross-border data flows.                 faith in the performance of their duties under the provisions of this Act.",
            "description": "The Bank, a credit bureau, any of their directors, officers or employees, or a credit information provider shall not be liable in damages for disclosing information in good LAWS OF GUYANA 24 Cap. 84:01 Credit Reporting  L.R.O. 1/2012            Retention  period.                                         Cross-border data flows.                 faith in the performance of their duties under the provisions of this Act."
        }
    },
    {
        "act": "CREDIT REPORTING ACT",
        "source": "https://mola.gov.gy/laws-of-guyana",
        "type": {
            "name": "section",
            "representation": "17",
            "title": "Retention period. ",
            "context": "CREDIT REPORTING ACT under Retention period. 17. (1) A credit bureau shall maintain in respect of each consumer about whom it has obtained credit information, a file    (a) stored in a secured manner;  (b) consisting of all the material and information that a consumer is entitled to have access to under section 27;  (c) for a period of seven years after the date of termination or settlement of the credit extended by the credit provider or lender.  (2) In a case where the contract between a credit information provider and a credit bureau is terminated the credit information provider shall continue to supply for the time that the Bank may specify, to the credit bureau, data and information on those consumers who were previously part of the periodic update under the terms and conditions of the contract providing the contractual relation between the credit provider or lender and the consumer has not been terminated.  (3) A credit bureau that contravenes any of the provisions of this section commits an offence and is liable upon summary conviction to a fine of one million dollars.",
            "description": [
                {
                    "representation": "(1)",
                    "description": "A credit bureau shall maintain in respect of each consumer about whom it has obtained credit information, a file"
                },
                {
                    "representation": "(a)",
                    "description": "stored in a secured manner;"
                },
                {
                    "representation": "(b)",
                    "description": "consisting of all the material and information that a consumer is entitled to have access to under section 27;"
                },
                {
                    "representation": "(c)",
                    "description": "for a period of seven years after the date of termination or settlement of the credit extended by the credit provider or lender."
                },
                {
                    "representation": "(2)",
                    "description": "In a case where the contract between a credit information provider and a credit bureau is terminated the credit information provider shall continue to supply for the time that the Bank may specify, to the credit bureau, data and information on those consumers who were previously part of the periodic update under the terms and conditions of the contract providing the contractual relation between the credit provider or lender and the consumer has not been terminated."
                },
                {
                    "representation": "(3)",
                    "description": "A credit bureau that contravenes any of the provisions of this section commits an offence and is liable upon summary conviction to a fine of one million dollars."
                }
            ]
        }
    },
    {
        "act": "CREDIT REPORTING ACT",
        "source": "https://mola.gov.gy/laws-of-guyana",
        "type": {
            "name": "section",
            "representation": "18",
            "title": "Cross-border data flows. ",
            "context": "CREDIT REPORTING ACT under Cross-border data flows. 18. A credit bureau may store and keep in a different country data collected under this Act provided it is done with the Approval of the Bank .   LAWS OF GUYANA Credit Reporting Cap. 84:01 25  L.R.O. 1/2012 Security.",
            "description": "A credit bureau may store and keep in a different country data collected under this Act provided it is done with the Approval of the Bank .   LAWS OF GUYANA Credit Reporting Cap. 84:01 25  L.R.O. 1/2012 Security."
        }
    },
    {
        "act": "CREDIT REPORTING ACT",
        "source": "https://mola.gov.gy/laws-of-guyana",
        "type": {
            "name": "section",
            "representation": "19",
            "title": "Security. PART IV CREDIT BUREAU ACTIVITY ",
            "context": "CREDIT REPORTING ACT under Security. PART IV CREDIT BUREAU ACTIVITY 19. (1) A credit bureau shall take the necessary steps to protect the data or information in its custody, possession or control from misuse, loss, unauthorised access and modification or disclosure including the following    (a) preparation of operational guidelines and installation of security systems;  (b) providing computer security programmes, access and data communication protocols to prevent unauthorised access to the computer system and database, or interception of communication between the credit bureau and its users;  (c) maintenance of data access logs and audit trails to record all activity in the database and computer systems;  (d) providing disciplinary and contractual procedures and penalties to apply in the case of any unauthorised or improper access, modification or deletion of any information held in the credit bureau's database or computer system, by any employee, agent or contractor to the credit bureau; and   (e) conduct of workshops and preparation of training manuals for authorised personnel, covering the requirements of this Act.  (2) When disclosing data or information to a third party service provider additional measures shall be taken, such as   LAWS OF GUYANA 26 Cap. 84:01 Credit Reporting  L.R.O. 1/2012                                 Governance.                         (a) the execution of an agreement between the credit bureau and the third party service provider containing the conditions of the service regarding the data or information;  (b) documented security measures containing the specific steps to be taken by the users in order to ensure the protection and the integrity of the database.  (3) A credit bureau which contravenes any provision of this section commits an offence and is liable on summary conviction to a fine of one million dollars.  PART IV CREDIT BUREAU ACTIVITY",
            "description": [
                {
                    "representation": "(1)",
                    "description": "A credit bureau shall take the necessary steps to protect the data or information in its custody, possession or control from misuse, loss, unauthorised access and modification or disclosure including the following"
                },
                {
                    "representation": "(a)",
                    "description": "the execution of an agreement between the credit bureau and the third party service provider containing the conditions of the service regarding the data or information;"
                },
                {
                    "representation": "(b)",
                    "description": "documented security measures containing the specific steps to be taken by the users in order to ensure the protection and the integrity of the database."
                },
                {
                    "representation": "(c)",
                    "description": "maintenance of data access logs and audit trails to record all activity in the database and computer systems;"
                },
                {
                    "representation": "(d)",
                    "description": "providing disciplinary and contractual procedures and penalties to apply in the case of any unauthorised or improper access, modification or deletion of any information held in the credit bureau's database or computer system, by any employee, agent or contractor to the credit bureau; and"
                },
                {
                    "representation": "(e)",
                    "description": "conduct of workshops and preparation of training manuals for authorised personnel, covering the requirements of this Act."
                },
                {
                    "representation": "(2)",
                    "description": "When disclosing data or information to a third party service provider additional measures shall be taken, such as   LAWS OF GUYANA 26 Cap. 84:01 Credit Reporting  L.R.O. 1/2012                                 Governance."
                },
                {
                    "representation": "(3)",
                    "description": "A credit bureau which contravenes any provision of this section commits an offence and is liable on summary conviction to a fine of one million dollars.  PART IV CREDIT BUREAU ACTIVITY"
                }
            ]
        }
    },
    {
        "act": "CREDIT REPORTING ACT",
        "source": "https://mola.gov.gy/laws-of-guyana",
        "type": {
            "name": "section",
            "representation": "20",
            "title": "Governance. ",
            "context": "CREDIT REPORTING ACT under Governance. 20. (1) A credit bureau shall have a board of directors consisting of not less than five directors.  (2) A person may be appointed a director who is qualified in law, banking, finance, administration or accounting or any other fit and proper person.  (3) A person shall not be a director or officer or perform any corporate management functions of a credit bureau who    (a) has been a director, chief executive officer or other officer of a company which has been wound up by a court or has been placed in receivership;  (b) has been convicted by a court for an offence involving dishonesty; LAWS OF GUYANA Credit Reporting Cap. 84:01 27  L.R.O. 1/2012          c. 12:21                                          Capital requirement.           (c) has been adjudged a bankrupt under the Insolvency Act;  (d) in the opinion of the Bank is not a person of sound probity and character.  (4) Members of the board of directors shall ensure    (a) that the activities conducted by a credit bureau are in full compliance with the Act and with any other law to which it is subject;  (b) that a specific unit is maintained to attend to the requests of the consumers under Part V;  (c) that competent and sufficient staff are employed to comply with the obligations according to this Act; and   (d) that a credit bureau appoints an independent external auditor to undertake the annual audit and compliance review required by section",
            "description": [
                {
                    "representation": "(1)",
                    "description": "A credit bureau shall have a board of directors consisting of not less than five directors."
                },
                {
                    "representation": "(2)",
                    "description": "A person may be appointed a director who is qualified in law, banking, finance, administration or accounting or any other fit and proper person."
                },
                {
                    "representation": "(3)",
                    "description": "A person shall not be a director or officer or perform any corporate management functions of a credit bureau who"
                },
                {
                    "representation": "(a)",
                    "description": "that the activities conducted by a credit bureau are in full compliance with the Act and with any other law to which it is subject;"
                },
                {
                    "representation": "(b)",
                    "description": "that a specific unit is maintained to attend to the requests of the consumers under Part V;"
                },
                {
                    "representation": "(c)",
                    "description": "that competent and sufficient staff are employed to comply with the obligations according to this Act; and"
                },
                {
                    "representation": "(d)",
                    "description": "that a credit bureau appoints an independent external auditor to undertake the annual audit and compliance review required by section"
                },
                {
                    "representation": "(4)",
                    "description": "Members of the board of directors shall ensure"
                }
            ]
        }
    },
    {
        "act": "CREDIT REPORTING ACT",
        "source": "https://mola.gov.gy/laws-of-guyana",
        "type": {
            "name": "section",
            "representation": "21",
            "title": "Capital requirement. LAWS OF GUYANA 4 Cap. 84:01 Credit Reporting  L.R.O. 1/2012  SECTION  ",
            "context": "CREDIT REPORTING ACT under Capital requirement. LAWS OF GUYANA 4 Cap. 84:01 Credit Reporting  L.R.O. 1/2012  SECTION  21. A credit bureau shall be required to satisfy the minimum capital requirements specified by the Bank.   LAWS OF GUYANA 28 Cap. 84:01 Credit Reporting  L.R.O. 1/2012  Permissible activities.                                   Duties and responsibilities.",
            "description": "A credit bureau shall be required to satisfy the minimum capital requirements specified by the Bank.   LAWS OF GUYANA 28 Cap. 84:01 Credit Reporting  L.R.O. 1/2012  Permissible activities.                                   Duties and responsibilities."
        }
    },
    {
        "act": "CREDIT REPORTING ACT",
        "source": "https://mola.gov.gy/laws-of-guyana",
        "type": {
            "name": "section",
            "representation": "22",
            "title": "Permissible activities. ",
            "context": "CREDIT REPORTING ACT under Permissible activities. 22. (1) A credit bureau may engage in the following activities   (a) collect and store information to create credit histories;  (b) process credit related data;  (c) create credit reports and disseminate them among the users in exchange for the payment of a fee;  (d) carry out statistical research;  (e) provide value added services upon request from the users based on data stored in the credit bureau.  (2) A credit bureau shall not engage in activities different from those described under subsection (1).  (3) A credit bureau which contravenes the provisions of this section commits an offence and is liable on summary conviction to a fine of one million dollars.",
            "description": [
                {
                    "representation": "(1)",
                    "description": "A credit bureau may engage in the following activities"
                },
                {
                    "representation": "(a)",
                    "description": "collect and store information to create credit histories;"
                },
                {
                    "representation": "(b)",
                    "description": "process credit related data;"
                },
                {
                    "representation": "(c)",
                    "description": "create credit reports and disseminate them among the users in exchange for the payment of a fee;"
                },
                {
                    "representation": "(d)",
                    "description": "carry out statistical research;"
                },
                {
                    "representation": "(e)",
                    "description": "provide value added services upon request from the users based on data stored in the credit bureau."
                },
                {
                    "representation": "(2)",
                    "description": "A credit bureau shall not engage in activities different from those described under subsection"
                },
                {
                    "representation": "(3)",
                    "description": "A credit bureau which contravenes the provisions of this section commits an offence and is liable on summary conviction to a fine of one million dollars."
                }
            ]
        }
    },
    {
        "act": "CREDIT REPORTING ACT",
        "source": "https://mola.gov.gy/laws-of-guyana",
        "type": {
            "name": "section",
            "representation": "23",
            "title": "Duties and responsibilities. ",
            "context": "CREDIT REPORTING ACT under Duties and responsibilities. 23. (1) A credit bureau shall    (a) receive data or information from credit information providers and load such data or information into its systems;  (b) provide the users with credit reports upon request in accordance with the provisions of this Act;  (c) grant access to the consumer's credit reports on proof of identify; LAWS OF GUYANA Credit Reporting Cap. 84:01 29  L.R.O. 1/2012                                                  (d) maintain the established level of data quality adequacy;  (e) request credit information providers to correct information when there are sufficient grounds to do so;  (f) comply with this Act, orders, directions, notices, instructions or conditions imposed by the Bank and any code of conduct on credit reporting;  (g) maintain information in adequate systems and premises to avoid unauthorised access, loss, damage, modification or unauthorised disclosure;  (h) maintain data for the period prescribed under section 17;  (i) dedicate a specific unit with trained personnel to serve the requests of the consumers and provide sufficient protection to consumers regarding their data in compliance with this Act;  (j) keep a log of all the enquiries or requests received from the users in a format that records the purpose for which the information was requested; and  (k) report all breaches of data security promptly to the Bank.  LAWS OF GUYANA 30 Cap. 84:01 Credit Reporting  L.R.O. 1/2012                             Liquidation of a credit bureau. c. 89:01   c. 89:01                 (2) A credit bureau may charge a fee for its services according to the credit bureau's pricing policy.  (3) A credit bureau may use the data from credit information providers to build scoring models and value added services.  (4) A credit bureau and the credit information providers shall not use the credit information contained in the credit bureau for marketing purposes.  (5) A credit bureau which contravenes the provisions of subsections 1(g) and (h) and (4) commits an offence and is liable on summary conviction to a fine of one million dollars.  (6) A credit information provider which contravenes the provisions of subsection (4) commits an offence and is liable on summary conviction to a fine of one million dollars.",
            "description": [
                {
                    "representation": "(1)",
                    "description": "A credit bureau shall"
                },
                {
                    "representation": "(a)",
                    "description": "receive data or information from credit information providers and load such data or information into its systems;"
                },
                {
                    "representation": "(b)",
                    "description": "provide the users with credit reports upon request in accordance with the provisions of this Act;"
                },
                {
                    "representation": "(c)",
                    "description": "grant access to the consumer's credit reports on proof of identify; LAWS OF GUYANA Credit Reporting Cap. 84:01 29  L.R.O. 1/2012"
                },
                {
                    "representation": "(d)",
                    "description": "maintain the established level of data quality adequacy;"
                },
                {
                    "representation": "(e)",
                    "description": "request credit information providers to correct information when there are sufficient grounds to do so;"
                },
                {
                    "representation": "(f)",
                    "description": "comply with this Act, orders, directions, notices, instructions or conditions imposed by the Bank and any code of conduct on credit reporting;"
                },
                {
                    "representation": "(g)",
                    "description": "maintain information in adequate systems and premises to avoid unauthorised access, loss, damage, modification or unauthorised disclosure;"
                },
                {
                    "representation": "(h)",
                    "description": "and"
                },
                {
                    "representation": "(i)",
                    "description": "dedicate a specific unit with trained personnel to serve the requests of the consumers and provide sufficient protection to consumers regarding their data in compliance with this Act;"
                },
                {
                    "representation": "(j)",
                    "description": "keep a log of all the enquiries or requests received from the users in a format that records the purpose for which the information was requested; and"
                },
                {
                    "representation": "(k)",
                    "description": "report all breaches of data security promptly to the Bank.  LAWS OF GUYANA 30 Cap. 84:01 Credit Reporting  L.R.O. 1/2012                             Liquidation of a credit bureau. c. 89:01   c. 89:01"
                },
                {
                    "representation": "(2)",
                    "description": "A credit bureau may charge a fee for its services according to the credit bureau's pricing policy."
                },
                {
                    "representation": "(3)",
                    "description": "A credit bureau may use the data from credit information providers to build scoring models and value added services."
                },
                {
                    "representation": "(4)",
                    "description": "commits an offence and is liable on summary conviction to a fine of one million dollars."
                },
                {
                    "representation": "(5)",
                    "description": "A credit bureau which contravenes the provisions of subsections 1(g) and"
                },
                {
                    "representation": "(6)",
                    "description": "A credit information provider which contravenes the provisions of subsection"
                }
            ]
        }
    },
    {
        "act": "CREDIT REPORTING ACT",
        "source": "https://mola.gov.gy/laws-of-guyana",
        "type": {
            "name": "section",
            "representation": "24",
            "title": "Liquidation of a credit bureau.  PART V RIGHTS OF THE CONSUMER  ",
            "context": "CREDIT REPORTING ACT under Liquidation of a credit bureau.  PART V RIGHTS OF THE CONSUMER  24. (1) A credit bureau may be liquidated in accordance with the Companies Act.  (2) Notwithstanding anything in the Companies Act a credit bureau shall not, except with the approval of the Bank, pass any resolution for the suspension of its activities or the voluntary winding up of its business.  (3) Where the credit bureau is to be liquidated under subsection (1) or action is taken under subsection (2) the database containing information related to the credit history of the consumers shall be transferred to the Bank to decide if the credit bureau activities can be continued, or whether the data shall be    (a) destroyed;  LAWS OF GUYANA Credit Reporting Cap. 84:01 31  L.R.O. 1/2012               Right to information by the consumer.                        Notification.            (b) returned to each credit information provider; or   (c) transferred to another licensed credit bureau by a bidding process.  PART V RIGHTS OF THE CONSUMER",
            "description": [
                {
                    "representation": "(1)",
                    "description": "or action is taken under subsection"
                },
                {
                    "representation": "(2)",
                    "description": "the database containing information related to the credit history of the consumers shall be transferred to the Bank to decide if the credit bureau activities can be continued, or whether the data shall be"
                },
                {
                    "representation": "(3)",
                    "description": "Where the credit bureau is to be liquidated under subsection"
                },
                {
                    "representation": "(a)",
                    "description": "destroyed;  LAWS OF GUYANA Credit Reporting Cap. 84:01 31  L.R.O. 1/2012               Right to information by the consumer.                        Notification."
                },
                {
                    "representation": "(b)",
                    "description": "returned to each credit information provider; or"
                },
                {
                    "representation": "(c)",
                    "description": "transferred to another licensed credit bureau by a bidding process.  PART V RIGHTS OF THE CONSUMER"
                }
            ]
        }
    },
    {
        "act": "CREDIT REPORTING ACT",
        "source": "https://mola.gov.gy/laws-of-guyana",
        "type": {
            "name": "section",
            "representation": "25",
            "title": "Right to information by the consumer. ",
            "context": "CREDIT REPORTING ACT under Right to information by the consumer. 25. (1) Credit information providers shall inform consumers of    (a) the name, address and telephone number of the credit bureau that will collect, process and disseminate information about consumers;  (b) the purpose of the collection, processing and dissemination of the information; and   (c) their rights to check their own credit history as well as to correct erroneous information.  (2) A credit bureau shall provide detailed information regarding how to access or correct data.",
            "description": [
                {
                    "representation": "(1)",
                    "description": "Credit information providers shall inform consumers of"
                },
                {
                    "representation": "(a)",
                    "description": "the name, address and telephone number of the credit bureau that will collect, process and disseminate information about consumers;"
                },
                {
                    "representation": "(b)",
                    "description": "the purpose of the collection, processing and dissemination of the information; and"
                },
                {
                    "representation": "(c)",
                    "description": "their rights to check their own credit history as well as to correct erroneous information."
                },
                {
                    "representation": "(2)",
                    "description": "A credit bureau shall provide detailed information regarding how to access or correct data."
                }
            ]
        }
    },
    {
        "act": "CREDIT REPORTING ACT",
        "source": "https://mola.gov.gy/laws-of-guyana",
        "type": {
            "name": "section",
            "representation": "26",
            "title": "Notification.  ",
            "context": "CREDIT REPORTING ACT under Notification.  26. (1) Where a credit provider takes adverse action against a consumer based in whole or in part on a consumer report received from a credit bureau the credit provider shall inform the consumer of the action taken.  (2) The credit provider shall supply the name and address of the credit bureau making the report together with a notice that the consumer may obtain from the credit bureau a free copy of the consumer report upon which the adverse LAWS OF GUYANA 32 Cap. 84:01 Credit Reporting  L.R.O. 1/2012       Access to information or data.                                           action was taken.",
            "description": [
                {
                    "representation": "(1)",
                    "description": "Where a credit provider takes adverse action against a consumer based in whole or in part on a consumer report received from a credit bureau the credit provider shall inform the consumer of the action taken."
                },
                {
                    "representation": "(2)",
                    "description": "The credit provider shall supply the name and address of the credit bureau making the report together with a notice that the consumer may obtain from the credit bureau a free copy of the consumer report upon which the adverse LAWS OF GUYANA 32 Cap. 84:01 Credit Reporting  L.R.O. 1/2012       Access to information or data.                                           action was taken."
                }
            ]
        }
    },
    {
        "act": "CREDIT REPORTING ACT",
        "source": "https://mola.gov.gy/laws-of-guyana",
        "type": {
            "name": "section",
            "representation": "27",
            "title": "Access to information or data. ",
            "context": "CREDIT REPORTING ACT under Access to information or data. 27. (1) A consumer has the right to receive a copy of all the information maintained by a credit bureau on his own credit history, in the form of a credit report, which shall include    (a) a list of users that have accessed his data during the previous six months;  (b) detailed information on the description of any codes used in the report so the consumer can clearly understand the report; and   (c) the source of the data or information.  (2) A consumer shall have the right to obtain a credit report free of charge in the following circumstances    (i) once a year upon his request; and   (ii) where arising from an investigation under section 28 any data or information error is attributable to a credit information provider or a credit bureau.  (3)  The fee for further access to information or data shall be reasonable according to administrative costs borne by the credit bureau.  (4) A consumer has the right to obtain a copy of the credit report from a credit bureau in any of the following forms      LAWS OF GUYANA Credit Reporting Cap. 84:01 33  L.R.O. 1/2012                Challenging data.                                (a) in person;  (b) in writing upon receipt of sufficient proof of identity; or   (c) on-line if adequate measures are in place to avoid unauthorised access.  (5) A credit bureau shall respond within fourteen days of receipt of the consumer's request for a copy of his credit report.",
            "description": [
                {
                    "representation": "(1)",
                    "description": "A consumer has the right to receive a copy of all the information maintained by a credit bureau on his own credit history, in the form of a credit report, which shall include"
                },
                {
                    "representation": "(a)",
                    "description": "in person;"
                },
                {
                    "representation": "(b)",
                    "description": "in writing upon receipt of sufficient proof of identity; or"
                },
                {
                    "representation": "(c)",
                    "description": "on-line if adequate measures are in place to avoid unauthorised access."
                },
                {
                    "representation": "(2)",
                    "description": "A consumer shall have the right to obtain a credit report free of charge in the following circumstances"
                },
                {
                    "representation": "(i)",
                    "description": "once a year upon his request; and"
                },
                {
                    "representation": "(3)",
                    "description": "The fee for further access to information or data shall be reasonable according to administrative costs borne by the credit bureau."
                },
                {
                    "representation": "(4)",
                    "description": "A consumer has the right to obtain a copy of the credit report from a credit bureau in any of the following forms      LAWS OF GUYANA Credit Reporting Cap. 84:01 33  L.R.O. 1/2012                Challenging data."
                },
                {
                    "representation": "(5)",
                    "description": "A credit bureau shall respond within fourteen days of receipt of the consumer's request for a copy of his credit report."
                }
            ]
        }
    },
    {
        "act": "CREDIT REPORTING ACT",
        "source": "https://mola.gov.gy/laws-of-guyana",
        "type": {
            "name": "section",
            "representation": "28",
            "title": "Challenging data. ",
            "context": "CREDIT REPORTING ACT under Challenging data. 28. (1) If the information contained in his credit report is disputed by a consumer, as being illegal, inaccurate, erroneous or outdated the consumer shall notify the credit bureau in writing of the dispute and shall provide sufficient evidence including documents to support his request for the resolution of the dispute.  (2) The credit bureau shall investigate and resolve the matter within thirty days of receipt of the consumer's request, and may    (a) if the inaccuracy is attributable to a public source, notify the source and request that accurate information is provided;  (b) if the inaccuracy is attributable to the credit information provider, inform the credit information provider and follow the procedures established for consumer's rights.  (3) During the investigation the credit bureau shall make a note in the consumer's report that it has been challenged and inform the users of such investigation.   LAWS OF GUYANA 34 Cap. 84:01 Credit Reporting  L.R.O. 1/2012                                                  (4) The credit bureau shall notify the consumer of the results of the investigation and may    (a) delete the data or information if on investigation it is found to be illegal, inaccurate, erroneous or outdated;  (b) modify the data in the terms contained in the request submitted by the consumer; or   (c) if the investigation does not resolve the dispute notify the consumer of his right to file a brief statement setting forth the nature of the dispute, provided that    (i) the statement shall, as far as practicable, not exceed one hundred words; and   (ii) it shall be the duty of the credit bureau if requested by the consumer, to provide the consumer with competent assistance in writing a clear summary of the nature of the dispute.  (5) Where a statement of a dispute is filed under subsection (4)(c), the credit bureau shall, in any subsequent credit report containing the information in question, clearly note that it is disputed by the consumer and provide either the consumer's statement or a clear and accurate summary of the statement.  (6) Following any deletion or modification of information which is found to be illegal, inaccurate, LAWS OF GUYANA Credit Reporting Cap. 84:01 35  L.R.O. 1/2012                         Dispute resolution.                            Legal action.    erroneous or outdated or any notation as to disputed information, the credit bureau shall furnish    (a) notification that the item has been deleted or modified as the case may be; or   (b) notification of the statement or summary filed or provided pursuant to subsection (4) or (5),  to any person who has within two years prior to the deletion, modification or notation received a consumer report which contained the challenged data.  (7) Credit information providers and credit bureaus shall issue adequate guidelines to ensure compliance with the preceding subsections.",
            "description": [
                {
                    "representation": "(1)",
                    "description": "If the information contained in his credit report is disputed by a consumer, as being illegal, inaccurate, erroneous or outdated the consumer shall notify the credit bureau in writing of the dispute and shall provide sufficient evidence including documents to support his request for the resolution of the dispute."
                },
                {
                    "representation": "(2)",
                    "description": "The credit bureau shall investigate and resolve the matter within thirty days of receipt of the consumer's request, and may"
                },
                {
                    "representation": "(a)",
                    "description": "notification that the item has been deleted or modified as the case may be; or"
                },
                {
                    "representation": "(b)",
                    "description": "notification of the statement or summary filed or provided pursuant to subsection"
                },
                {
                    "representation": "(3)",
                    "description": "During the investigation the credit bureau shall make a note in the consumer's report that it has been challenged and inform the users of such investigation.   LAWS OF GUYANA 34 Cap. 84:01 Credit Reporting  L.R.O. 1/2012"
                },
                {
                    "representation": "(4)",
                    "description": "or"
                },
                {
                    "representation": "(c)",
                    "description": "if the investigation does not resolve the dispute notify the consumer of his right to file a brief statement setting forth the nature of the dispute, provided that"
                },
                {
                    "representation": "(i)",
                    "description": "the statement shall, as far as practicable, not exceed one hundred words; and"
                },
                {
                    "representation": "(5)",
                    "description": "Where a statement of a dispute is filed under subsection"
                },
                {
                    "representation": "(6)",
                    "description": "Following any deletion or modification of information which is found to be illegal, inaccurate, LAWS OF GUYANA Credit Reporting Cap. 84:01 35  L.R.O. 1/2012                         Dispute resolution.                            Legal action.    erroneous or outdated or any notation as to disputed information, the credit bureau shall furnish"
                },
                {
                    "representation": "(7)",
                    "description": "Credit information providers and credit bureaus shall issue adequate guidelines to ensure compliance with the preceding subsections."
                }
            ]
        }
    },
    {
        "act": "CREDIT REPORTING ACT",
        "source": "https://mola.gov.gy/laws-of-guyana",
        "type": {
            "name": "section",
            "representation": "29",
            "title": "Dispute resolution. ",
            "context": "CREDIT REPORTING ACT under Dispute resolution. 29. (1) A consumer who is dissatisfied with the action taken under section 28 or who believes a credit bureau or credit information provider has contravened this Act with respect to information affecting the consumer, may make a complaint of the matter in writing to the entity or person designated by the Minister to hear the matter.  (2) The entity or person designated by the Minister under subsection (1) shall investigate the matter and determine it within thirty days of the commencement of the investigation.  (3) A consumer who is dissatisfied with a decision of the entity or person designated by the Minister may appeal to the High Court.",
            "description": [
                {
                    "representation": "(1)",
                    "description": "shall investigate the matter and determine it within thirty days of the commencement of the investigation."
                },
                {
                    "representation": "(2)",
                    "description": "The entity or person designated by the Minister under subsection"
                },
                {
                    "representation": "(3)",
                    "description": "A consumer who is dissatisfied with a decision of the entity or person designated by the Minister may appeal to the High Court."
                }
            ]
        }
    },
    {
        "act": "CREDIT REPORTING ACT",
        "source": "https://mola.gov.gy/laws-of-guyana",
        "type": {
            "name": "section",
            "representation": "30",
            "title": "Legal action.  PART VI MISCELLANEOUS   ",
            "context": "CREDIT REPORTING ACT under Legal action.  PART VI MISCELLANEOUS   30. Notwithstanding anything in this Act, a consumer is entitled to commence legal action against a credit information provider, or a credit bureau where the LAWS OF GUYANA 36 Cap. 84:01 Credit Reporting  L.R.O. 1/2012                  Civil liability  for wilful or negligent non- compliance.                                       consumer has suffered damages as a result of the misuse or inaccuracy of the data.  PART VI MISCELLANEOUS",
            "description": "Notwithstanding anything in this Act, a consumer is entitled to commence legal action against a credit information provider, or a credit bureau where the LAWS OF GUYANA 36 Cap. 84:01 Credit Reporting  L.R.O. 1/2012                  Civil liability  for wilful or negligent non- compliance.                                       consumer has suffered damages as a result of the misuse or inaccuracy of the data.  PART VI MISCELLANEOUS"
        }
    },
    {
        "act": "CREDIT REPORTING ACT",
        "source": "https://mola.gov.gy/laws-of-guyana",
        "type": {
            "name": "section",
            "representation": "31",
            "title": "Civil liability for wilful or negligent non-compliance. ",
            "context": "CREDIT REPORTING ACT under Civil liability for wilful or negligent non-compliance. 31. (1) Any credit bureau, credit information provider or user of the consumer information which wilfully fails to comply with any requirement imposed under this Act with respect to any consumer is liable to that consumer in an amount equal to the sum of   (a) any actual damages sustained by the consumer as a result of the failure;  (b) such amount of punitive damages as the High Court may allow; and   (c) in the case of any successful action to enforce any liability under this section, the costs of the action together with reasonable attorney's fees as determined by the High Court.  (2) Any person who is negligent in complying with any requirement imposed under this Act with respect to any consumer is liable to that consumer in an amount equal to the sum of    (a) any actual damages sustained by the consumer as a result of the failure;  (b) in the case of any successful action to enforce liability under this section, the costs of the action together with reasonable attorney's fees as determined by the High Court.  LAWS OF GUYANA Credit Reporting Cap. 84:01 37  L.R.O. 1/2012  Unlawful disclosure.                        Power to make regulations.",
            "description": [
                {
                    "representation": "(1)",
                    "description": "Any credit bureau, credit information provider or user of the consumer information which wilfully fails to comply with any requirement imposed under this Act with respect to any consumer is liable to that consumer in an amount equal to the sum of"
                },
                {
                    "representation": "(a)",
                    "description": "any actual damages sustained by the consumer as a result of the failure;"
                },
                {
                    "representation": "(b)",
                    "description": "in the case of any successful action to enforce liability under this section, the costs of the action together with reasonable attorney's fees as determined by the High Court.  LAWS OF GUYANA Credit Reporting Cap. 84:01 37  L.R.O. 1/2012  Unlawful disclosure.                        Power to make regulations."
                },
                {
                    "representation": "(c)",
                    "description": "in the case of any successful action to enforce any liability under this section, the costs of the action together with reasonable attorney's fees as determined by the High Court."
                },
                {
                    "representation": "(2)",
                    "description": "Any person who is negligent in complying with any requirement imposed under this Act with respect to any consumer is liable to that consumer in an amount equal to the sum of"
                }
            ]
        }
    },
    {
        "act": "CREDIT REPORTING ACT",
        "source": "https://mola.gov.gy/laws-of-guyana",
        "type": {
            "name": "section",
            "representation": "32",
            "title": "Unlawful disclosure. ",
            "context": "CREDIT REPORTING ACT under Unlawful disclosure. 32. (1) An authorised person who intentionally provides information concerning a consumer from a credit bureau's files to an unauthorised person shall be liable on summary conviction to a fine of one million dollars and to imprisonment for six months.  (2) An unauthorised person who intentionally obtains information regarding a consumer from a credit bureau or credit information provider under false pretence commits an offence and is liable on summary conviction to a fine of one million dollars and to imprisonment for six months.  (3) Where a person commits an offence under this Act, for which no penalty is expressly provided, the person is liable on summary conviction to a fine of five hundred thousand dollars.",
            "description": [
                {
                    "representation": "(1)",
                    "description": "An authorised person who intentionally provides information concerning a consumer from a credit bureau's files to an unauthorised person shall be liable on summary conviction to a fine of one million dollars and to imprisonment for six months."
                },
                {
                    "representation": "(2)",
                    "description": "An unauthorised person who intentionally obtains information regarding a consumer from a credit bureau or credit information provider under false pretence commits an offence and is liable on summary conviction to a fine of one million dollars and to imprisonment for six months."
                },
                {
                    "representation": "(3)",
                    "description": "Where a person commits an offence under this Act, for which no penalty is expressly provided, the person is liable on summary conviction to a fine of five hundred thousand dollars."
                }
            ]
        }
    },
    {
        "act": "CREDIT REPORTING ACT",
        "source": "https://mola.gov.gy/laws-of-guyana",
        "type": {
            "name": "section",
            "representation": "33",
            "title": "Power to make regulations. ",
            "context": "CREDIT REPORTING ACT under Power to make regulations. 33. (1)The Bank may make such subsidiary legislation, and issue such notices or directions or make guidelines as may be required for the carrying out of the purposes of this Act.  (2) Without prejudice to the generality of the provisions of subsection (1), the regulations, notices and guidelines may in particular provide for all or any of the following matters    (a) the form of an application for a licence and of a licence;  (b) the fees payable along with the application for a licence and for the grant of a licence;  (c) the scope and procedure for the conduct of the annual audit and compliance review; LAWS OF GUYANA 38 Cap. 84:01 Credit Reporting  L.R.O. 1/2012                                   Cooperation with  supervisory authority.     (d) the procedure and security mechanisms for the cross-border transfer of data;  (e) prescribing the particulars and the form of the books, accounts and records to be kept by a credit bureau and the returns to be made by a credit bureau;  (f) prescribing the level of data quality adequacy;  (g) prescribing the capital requirements of a credit bureau;  (h) any other matter  that is required to be or may be prescribed by or under this Act.  (3) Regulations made under this section may provide for a penalty, on summary conviction of a fine not exceeding one million dollars.",
            "description": [
                {
                    "representation": "(2)",
                    "description": "Without prejudice to the generality of the provisions of subsection"
                },
                {
                    "representation": "(a)",
                    "description": "the form of an application for a licence and of a licence;"
                },
                {
                    "representation": "(b)",
                    "description": "the fees payable along with the application for a licence and for the grant of a licence;"
                },
                {
                    "representation": "(c)",
                    "description": "the scope and procedure for the conduct of the annual audit and compliance review; LAWS OF GUYANA 38 Cap. 84:01 Credit Reporting  L.R.O. 1/2012                                   Cooperation with  supervisory authority."
                },
                {
                    "representation": "(d)",
                    "description": "the procedure and security mechanisms for the cross-border transfer of data;"
                },
                {
                    "representation": "(e)",
                    "description": "prescribing the particulars and the form of the books, accounts and records to be kept by a credit bureau and the returns to be made by a credit bureau;"
                },
                {
                    "representation": "(f)",
                    "description": "prescribing the level of data quality adequacy;"
                },
                {
                    "representation": "(g)",
                    "description": "prescribing the capital requirements of a credit bureau;"
                },
                {
                    "representation": "(h)",
                    "description": "any other matter  that is required to be or may be prescribed by or under this Act."
                },
                {
                    "representation": "(3)",
                    "description": "Regulations made under this section may provide for a penalty, on summary conviction of a fine not exceeding one million dollars."
                }
            ]
        }
    }
]