[
    {
        "act": "SAVINGS SCHEMES ACT",
        "source": "https://mola.gov.gy/laws-of-guyana",
        "type": {
            "name": "section",
            "representation": "1",
            "title": "Short title. ",
            "context": "SAVINGS SCHEMES ACT under Short title. 1.  This Act may be cited as the Savings Schemes Act.",
            "description": "This Act may be cited as the Savings Schemes Act."
        }
    },
    {
        "act": "SAVINGS SCHEMES ACT",
        "source": "https://mola.gov.gy/laws-of-guyana",
        "type": {
            "name": "section",
            "representation": "2",
            "title": "Interpretation.  PART II SAVING SCHEMES COMMITTEE ",
            "context": "SAVINGS SCHEMES ACT under Interpretation.  PART II SAVING SCHEMES COMMITTEE 2.  In this Act  approved Savings Scheme means a Savings Scheme approved by the Minister under this Act;  bank has the meaning assigned to it by section 2 of the  Financial Institutions Act;   Committee means the Savings Schemes Committee established by section 3; CHAPTER 85:05  SAVINGS SCHEMES ACT LAWS OF GUYANA Savings Schemes Cap. 85:05 5  L.R.O. 1/2011  c. 75:01              Establishment of the Savings Schemes Committee.                                 financial institution has the meaning assigned to it by section 2 of the  Co-operative Financial  Institutions Act;  Savings Scheme means a scheme intended to encourage persons to save money and involving deposit of money for a specific period.  PART II SAVINGS  SCHEMES  COMMITTEE",
            "description": "In this Act  approved Savings Scheme means a Savings Scheme approved by the Minister under this Act;  bank has the meaning assigned to it by section 2 of the  Financial Institutions Act;   Committee means the Savings Schemes Committee established by section 3; CHAPTER 85:05  SAVINGS SCHEMES ACT LAWS OF GUYANA Savings Schemes Cap. 85:05 5  L.R.O. 1/2011  c. 75:01              Establishment of the Savings Schemes Committee.                                 financial institution has the meaning assigned to it by section 2 of the  Co-operative Financial  Institutions Act;  Savings Scheme means a scheme intended to encourage persons to save money and involving deposit of money for a specific period.  PART II SAVINGS  SCHEMES  COMMITTEE"
        }
    },
    {
        "act": "SAVINGS SCHEMES ACT",
        "source": "https://mola.gov.gy/laws-of-guyana",
        "type": {
            "name": "section",
            "representation": "3",
            "title": "Establishment of the Savings Schemes Committee. ",
            "context": "SAVINGS SCHEMES ACT under Establishment of the Savings Schemes Committee. 3.  (1) There is hereby established a committee to be known as the Savings  Scheme  Committee  consisting  of  not  more  than  eleven persons appointed by the Minister by instrument in writing from among persons appearing to him to be qualified as having experience of, and shown capacity in, such matters which he considers will be beneficial in the functioning of the Committee and, without prejudice to the generality of the foregoing, in particular in matters relating to banking, finance, mobilisation of funds, industry, commerce, law or administration, or appearing to him to represent workmen.  (2) The Committee shall be a body corporate.  (3) The seal of the Committee shall be kept in the custody of the chairman or the secretary of the Committee and shall be authenticated by the signature of the chairman and the secretary of the Committee.  (4) Every document purporting to be an  instrument  duly executed under the seal of the Committee shall be received in evidence and  deemed, without further proof, to be so executed unless the contrary is proved.  (5) All documents, other than those required by law to be under seal, made by, and all decisions of, the Committee may be signified under the hand of the chairman or the secretary of the Committee.  LAWS OF GUYANA 6 Cap. 85:05 Savings Schemes   L.R.O. 1/2012           Functions of the Committee.          Meetings and procedure of the Committee.                       (6) Every change in the membership of the Committee shall be notified in the Gazette.  (7) The terms and conditions of appointment of the chairman and  other  members  of  the  Committee  shall  be  such  as  may  be prescribed by the Minister by regulations.",
            "description": [
                {
                    "representation": "(1)",
                    "description": "There is hereby established a committee to be known as the Savings  Scheme  Committee  consisting  of  not  more  than  eleven persons appointed by the Minister by instrument in writing from among persons appearing to him to be qualified as having experience of, and shown capacity in, such matters which he considers will be beneficial in the functioning of the Committee and, without prejudice to the generality of the foregoing, in particular in matters relating to banking, finance, mobilisation of funds, industry, commerce, law or administration, or appearing to him to represent workmen."
                },
                {
                    "representation": "(2)",
                    "description": "The Committee shall be a body corporate."
                },
                {
                    "representation": "(3)",
                    "description": "The seal of the Committee shall be kept in the custody of the chairman or the secretary of the Committee and shall be authenticated by the signature of the chairman and the secretary of the Committee."
                },
                {
                    "representation": "(4)",
                    "description": "Every document purporting to be an  instrument  duly executed under the seal of the Committee shall be received in evidence and  deemed, without further proof, to be so executed unless the contrary is proved."
                },
                {
                    "representation": "(5)",
                    "description": "All documents, other than those required by law to be under seal, made by, and all decisions of, the Committee may be signified under the hand of the chairman or the secretary of the Committee.  LAWS OF GUYANA 6 Cap. 85:05 Savings Schemes   L.R.O. 1/2012           Functions of the Committee.          Meetings and procedure of the Committee."
                },
                {
                    "representation": "(6)",
                    "description": "Every change in the membership of the Committee shall be notified in the Gazette."
                },
                {
                    "representation": "(7)",
                    "description": "The terms and conditions of appointment of the chairman and  other  members  of  the  Committee  shall  be  such  as  may  be prescribed by the Minister by regulations."
                }
            ]
        }
    },
    {
        "act": "SAVINGS SCHEMES ACT",
        "source": "https://mola.gov.gy/laws-of-guyana",
        "type": {
            "name": "section",
            "representation": "4",
            "title": "Functions of the Committee. ",
            "context": "SAVINGS SCHEMES ACT under Functions of the Committee. 4.  The functions of the Committee shall be  (a)   to prepare, manage and operate Savings Schemes; and   (b)    any other function, relating to  finance  or  banking, it is authorised or directed by the Minister by order to undertake and perform.",
            "description": [
                {
                    "representation": "(a)",
                    "description": "to prepare, manage and operate Savings Schemes; and"
                },
                {
                    "representation": "(b)",
                    "description": "any other function, relating to  finance  or  banking, it is authorised or directed by the Minister by order to undertake and perform."
                }
            ]
        }
    },
    {
        "act": "SAVINGS SCHEMES ACT",
        "source": "https://mola.gov.gy/laws-of-guyana",
        "type": {
            "name": "section",
            "representation": "5",
            "title": "Meetings and procedure of the Committee. ",
            "context": "SAVINGS SCHEMES ACT under Meetings and procedure of the Committee. 5. (1) The Minister may by regulations prescribe the procedure of the Committee, including the intervals at which the meetings of the Committee shall be held and the quorum for its meetings.  (2) Subject to the provisions of this Act and any regulations made by the Minister, the Committee may regulate its own proceedings and may make rules for that purpose.  (3) Any minutes made of a meeting of the Committee shall, if duly signed by the chairman or other person presiding at the meeting, without further proof of any other matter or thing, be receivable in all legal proceedings as prima facie evidence of the proceedings of the Committee of which the minutes have been made and of the meeting of the Committee, in respect of the proceedings of which the minutes have been so made, having been duly convened and held.   LAWS OF GUYANA Savings Schemes Cap. 85:05 7  L.R.O. 1/2011 Power to appoint sub- committees.                Power to delegate.          Protection of members of the Committee or any sub- committee thereof.                        Officers and other employees of the",
            "description": [
                {
                    "representation": "(1)",
                    "description": "The Minister may by regulations prescribe the procedure of the Committee, including the intervals at which the meetings of the Committee shall be held and the quorum for its meetings."
                },
                {
                    "representation": "(2)",
                    "description": "Subject to the provisions of this Act and any regulations made by the Minister, the Committee may regulate its own proceedings and may make rules for that purpose."
                },
                {
                    "representation": "(3)",
                    "description": "Any minutes made of a meeting of the Committee shall, if duly signed by the chairman or other person presiding at the meeting, without further proof of any other matter or thing, be receivable in all legal proceedings as prima facie evidence of the proceedings of the Committee of which the minutes have been made and of the meeting of the Committee, in respect of the proceedings of which the minutes have been so made, having been duly convened and held.   LAWS OF GUYANA Savings Schemes Cap. 85:05 7  L.R.O. 1/2011 Power to appoint sub- committees.                Power to delegate.          Protection of members of the Committee or any sub- committee thereof.                        Officers and other employees of the"
                }
            ]
        }
    },
    {
        "act": "SAVINGS SCHEMES ACT",
        "source": "https://mola.gov.gy/laws-of-guyana",
        "type": {
            "name": "section",
            "representation": "6",
            "title": "Power to appoint sub-committees. ",
            "context": "SAVINGS SCHEMES ACT under Power to appoint sub-committees. 6.  (1) The Committee may appoint such sub-committees as it thinks fit:  Provided that any sub-committee so appointed shall include not less than two members of the Committee, and may include persons who are not members of the Committee.  (2)  Subject to the provisions of this Act, the constitution, functions and procedures of a sub-committee constituted under subsection (1) shall be determined by the Committee.",
            "description": [
                {
                    "representation": "(1)",
                    "description": "shall be determined by the Committee."
                },
                {
                    "representation": "(2)",
                    "description": "Subject to the provisions of this Act, the constitution, functions and procedures of a sub-committee constituted under subsection"
                }
            ]
        }
    },
    {
        "act": "SAVINGS SCHEMES ACT",
        "source": "https://mola.gov.gy/laws-of-guyana",
        "type": {
            "name": "section",
            "representation": "7",
            "title": "Power to delegate. ",
            "context": "SAVINGS SCHEMES ACT under Power to delegate. 7.  Subject to the provisions of this Act, the Committee may delegate to any of its members or to any sub-committee constituted under section 6 (1) the power and authority to carry out on its behalf such functions as the Committee may determine.",
            "description": [
                {
                    "representation": "(1)",
                    "description": "the power and authority to carry out on its behalf such functions as the Committee may determine."
                }
            ]
        }
    },
    {
        "act": "SAVINGS SCHEMES ACT",
        "source": "https://mola.gov.gy/laws-of-guyana",
        "type": {
            "name": "section",
            "representation": "8",
            "title": "Protection of members of the Committee or any sub-committee thereof. ",
            "context": "SAVINGS SCHEMES ACT under Protection of members of the Committee or any sub-committee thereof. 8.  (1) Subject to subsection (2), no action, suit, prosecution or other proceedings shall be brought or instituted personally against a member of the Committee or any of its sub-committees in respect of any act done  bona  fide in pursuance of the execution or intended execution of his duties under this Act.  (2) Where a member of the Committee or any of its sub- committees is exempt from liability by reason only of subsection (1), the Committee or the sub-committee, as the case may be, shall be liable to the extent that it would be if such member was a servant or agent of the Committee or the sub-committee, so, however, that if in any case the Committee or the sub-committee is not liable for any of the above-mentioned acts, then subsection (1) does not operate to exempt such member as therein stated.",
            "description": [
                {
                    "representation": "(1)",
                    "description": "does not operate to exempt such member as therein stated."
                },
                {
                    "representation": "(2)",
                    "description": "Where a member of the Committee or any of its sub- committees is exempt from liability by reason only of subsection"
                }
            ]
        }
    },
    {
        "act": "SAVINGS SCHEMES ACT",
        "source": "https://mola.gov.gy/laws-of-guyana",
        "type": {
            "name": "section",
            "representation": "9",
            "title": "Officers and other employees of the Committee. ",
            "context": "SAVINGS SCHEMES ACT under Officers and other employees of the Committee. 9.  The Committee may employ at such remuneration and on such other terms and conditions as it thinks fit, a secretary and such other officers and  employees as it deems LAWS OF GUYANA 8 Cap. 85:05 Savings Schemes   L.R.O. 1/2012  Committee.                Funds and resources to  the Committee.                                  necessary for the purpose of carrying out the functions of the Committee:  Provided that if the office of secretary is vacant or if the secretary is for any reason unable to perform the functions of his office, the Minister may assign a public officer in the Ministry to carry out the functions of the office of secretary.",
            "description": "The Committee may employ at such remuneration and on such other terms and conditions as it thinks fit, a secretary and such other officers and  employees as it deems LAWS OF GUYANA 8 Cap. 85:05 Savings Schemes   L.R.O. 1/2012  Committee.                Funds and resources to  the Committee.                                  necessary for the purpose of carrying out the functions of the Committee:  Provided that if the office of secretary is vacant or if the secretary is for any reason unable to perform the functions of his office, the Minister may assign a public officer in the Ministry to carry out the functions of the office of secretary."
        }
    },
    {
        "act": "SAVINGS SCHEMES ACT",
        "source": "https://mola.gov.gy/laws-of-guyana",
        "type": {
            "name": "section",
            "representation": "10",
            "title": "Funds and resources of the Committee.  PART III SAVINGS SCHEMES ",
            "context": "SAVINGS SCHEMES ACT under Funds and resources of the Committee.  PART III SAVINGS SCHEMES 10.  (1) The funds and resources of the Committee shall consist of   (a)     such  sums  as  may  be  provided  by  or  under  an appropriation law;  (b)   such sums as may be allocated from time to time to the Committee from loan funds;  (c)   moneys  earned  or  arising  from  any  property  or investments of the Committee;  (d)      all other sums or property which may in any manner be  received by, or become payable to, or vested in, the Committee in the performance of its functions or in respect of any matter incidental, thereto.  (2) For the purposes of this section, the expression loan funds means such sums as may be made available, from time to time, by the Government by way of loan.      LAWS OF GUYANA Savings Schemes Cap. 85:05 9  L.R.O. 1/2011     Approval of savings schemes.       Management and operation  of approved savings schemes.             c. 85:02     Deduction of sums from emoluments of employees and deposit in approved Savings  Scheme.         PART III SAVINGS  SCHEMES",
            "description": [
                {
                    "representation": "(1)",
                    "description": "The funds and resources of the Committee shall consist of"
                },
                {
                    "representation": "(a)",
                    "description": "such  sums  as  may  be  provided  by  or  under  an appropriation law;"
                },
                {
                    "representation": "(b)",
                    "description": "such sums as may be allocated from time to time to the Committee from loan funds;"
                },
                {
                    "representation": "(c)",
                    "description": "moneys  earned  or  arising  from  any  property  or investments of the Committee;"
                },
                {
                    "representation": "(d)",
                    "description": "all other sums or property which may in any manner be  received by, or become payable to, or vested in, the Committee in the performance of its functions or in respect of any matter incidental, thereto."
                },
                {
                    "representation": "(2)",
                    "description": "For the purposes of this section, the expression loan funds means such sums as may be made available, from time to time, by the Government by way of loan.      LAWS OF GUYANA Savings Schemes Cap. 85:05 9  L.R.O. 1/2011     Approval of savings schemes.       Management and operation  of approved savings schemes.             c. 85:02     Deduction of sums from emoluments of employees and deposit in approved Savings  Scheme.         PART III SAVINGS  SCHEMES"
                }
            ]
        }
    },
    {
        "act": "SAVINGS SCHEMES ACT",
        "source": "https://mola.gov.gy/laws-of-guyana",
        "type": {
            "name": "section",
            "representation": "11",
            "title": "Approval of Savings Schemes. ",
            "context": "SAVINGS SCHEMES ACT under Approval of Savings Schemes. 11. (1) The Committee may, and if so directed by the Minister shall, submit to the Minister one or more Savings Schemes for approval.  (2) The Minister may approve any Savings Scheme with or without modification.",
            "description": [
                {
                    "representation": "(1)",
                    "description": "The Committee may, and if so directed by the Minister shall, submit to the Minister one or more Savings Schemes for approval."
                },
                {
                    "representation": "(2)",
                    "description": "The Minister may approve any Savings Scheme with or without modification."
                }
            ]
        }
    },
    {
        "act": "SAVINGS SCHEMES ACT",
        "source": "https://mola.gov.gy/laws-of-guyana",
        "type": {
            "name": "section",
            "representation": "12",
            "title": "Management and operation of approved Savings Schemes. ",
            "context": "SAVINGS SCHEMES ACT under Management and operation of approved Savings Schemes. 12. (1) The Committee shall manage and operate every approved Savings Scheme and accept deposits from persons under any such scheme.  (2) For all or any of the purposes of any approved Savings Scheme managed and operated by it, the Committee may appoint as its agent any bank, any financial institution, the Post Office or any other person, if it or he consents to function as such.  (3) The Bank of Guyana shall, if so directed by the Minister by order, perform in relation to the Committee, and such approved Saving Schemes as may be specified by the Minister in the order, the functions conferred on that Bank in relation to banks under section 36 the Bank of Guyana Act.",
            "description": [
                {
                    "representation": "(1)",
                    "description": "The Committee shall manage and operate every approved Savings Scheme and accept deposits from persons under any such scheme."
                },
                {
                    "representation": "(2)",
                    "description": "For all or any of the purposes of any approved Savings Scheme managed and operated by it, the Committee may appoint as its agent any bank, any financial institution, the Post Office or any other person, if it or he consents to function as such."
                },
                {
                    "representation": "(3)",
                    "description": "The Bank of Guyana shall, if so directed by the Minister by order, perform in relation to the Committee, and such approved Saving Schemes as may be specified by the Minister in the order, the functions conferred on that Bank in relation to banks under section 36 the Bank of Guyana Act."
                }
            ]
        }
    },
    {
        "act": "SAVINGS SCHEMES ACT",
        "source": "https://mola.gov.gy/laws-of-guyana",
        "type": {
            "name": "section",
            "representation": "13",
            "title": "Deduction of sums from emoluments of employees and deposit in approved Savings Scheme. ",
            "context": "SAVINGS SCHEMES ACT under Deduction of sums from emoluments of employees and deposit in approved Savings Scheme. 13.  (1) Any employee may with the consent of his employer authorise the employer, in such form as may be specified by the Committee, to deduct from the emoluments payable by the employer to the employee such sums, and at such intervals, as may be specified by the employee and to deposit the same in the account of such employee in any approved Savings Scheme specified by him.  (2) Where any authorisation has been made by any employee in the manner referred to in subsection (1)  (a)  the employer shall deduct from the emoluments of the employee such LAWS OF GUYANA 10 Cap. 85:05 Savings Schemes   L.R.O. 1/2012                                                 Guarantee by the Govern- ment of payment of sums, and at such intervals, as may be specified by the employee and notwithstanding anything contained in any other written law, it shall be lawful for the employer to do so;  (b)   the employer shall deposit the sums so deducted in the account of the employee in the approved Savings Scheme specified by him within such time as may be specified by the Committee; and  (c)    the employer shall  maintain a separate account in respect   of   the   sums   deducted   in   pursuance   of   the authorisation:  Provided that where more than one employee of the employer have authorised the employer in the manner referred to in subsection (1) in relation to the same approved Savings Scheme, the employer may maintain one account in respect of the deductions made from the emoluments of all such employees for deposit in their accounts in that approved Savings Scheme.  (3) Notwithstanding anything contained in any other written law, the sums deducted by any employer from the emoluments of his employees in pursuance of any authorisation referred to in subsection (1) shall, in the case of insolvency or winding up of the employer, have priority over all other debts due from the employer, other than debts due to the State.",
            "description": [
                {
                    "representation": "(1)",
                    "description": "shall, in the case of insolvency or winding up of the employer, have priority over all other debts due from the employer, other than debts due to the State."
                },
                {
                    "representation": "(2)",
                    "description": "Where any authorisation has been made by any employee in the manner referred to in subsection"
                },
                {
                    "representation": "(a)",
                    "description": "the employer shall deduct from the emoluments of the employee such LAWS OF GUYANA 10 Cap. 85:05 Savings Schemes   L.R.O. 1/2012                                                 Guarantee by the Govern- ment of payment of sums, and at such intervals, as may be specified by the employee and notwithstanding anything contained in any other written law, it shall be lawful for the employer to do so;"
                },
                {
                    "representation": "(b)",
                    "description": "the employer shall deposit the sums so deducted in the account of the employee in the approved Savings Scheme specified by him within such time as may be specified by the Committee; and"
                },
                {
                    "representation": "(c)",
                    "description": "the employer shall  maintain a separate account in respect   of   the   sums   deducted   in   pursuance   of   the authorisation:  Provided that where more than one employee of the employer have authorised the employer in the manner referred to in subsection"
                },
                {
                    "representation": "(3)",
                    "description": "Notwithstanding anything contained in any other written law, the sums deducted by any employer from the emoluments of his employees in pursuance of any authorisation referred to in subsection"
                }
            ]
        }
    },
    {
        "act": "SAVINGS SCHEMES ACT",
        "source": "https://mola.gov.gy/laws-of-guyana",
        "type": {
            "name": "section",
            "representation": "14",
            "title": "Guarantee by the Government of payment of amounts due from the Committee. ",
            "context": "SAVINGS SCHEMES ACT under Guarantee by the Government of payment of amounts due from the Committee. 14.  (1) The Government shall, by order signed on behalf of the Government by the Minister, and on such terms and subject to such conditions as may be specified in the LAWS OF GUYANA Savings Schemes Cap. 85:05 11  L.R.O. 1/2011 amounts due from the Committee.                                             Investment of amounts in the accounts in any approved Savings  Scheme. order, guarantee the payment by the Committee to each of the persons in whose name an account is maintained in an approved Savings Scheme, of the amount he is entitled to receive under that Scheme from the Committee when the amount becomes due for payment.  (2) Where any amount becomes payable by the Government pursuant to a guarantee given in exercise of the powers conferred by subsection (1), that amount shall be charged on the Consolidated Fund and the Minister shall direct payment of the same to issue out of the Consolidated Fund.  (3) Where any amount is paid out of the Consolidated Fund in pursuance of  any  liability  incurred  by  the  Government  under  a guarantee given in exercise of the powers conferred by subsection (1), the Committee shall repay such amount (together with interest thereon at such rate as the Minister may specify) to the Consolidated Fund in such manner and at such time as the Minister may direct.  (4) Where  the  Government  has,  in  exercise  of  the  powers conferred by subsection (1), given any guarantee in respect of the amounts due under any approved Savings Scheme, the Minister shall, so long as the guarantee is in force, lay before the National Assembly as soon  as may be possible after the end of each financial year a statement containing the particulars of the sums deposited under the approved Savings Scheme and outstanding at the end of that financial year and the amounts, if any, which have been either issued out of the Consolidated Fund under this section or paid into the Consolidated Fund in or towards repayment of any money so issued.",
            "description": [
                {
                    "representation": "(1)",
                    "description": "The Government shall, by order signed on behalf of the Government by the Minister, and on such terms and subject to such conditions as may be specified in the LAWS OF GUYANA Savings Schemes Cap. 85:05 11  L.R.O. 1/2011 amounts due from the Committee.                                             Investment of amounts in the accounts in any approved Savings  Scheme. order, guarantee the payment by the Committee to each of the persons in whose name an account is maintained in an approved Savings Scheme, of the amount he is entitled to receive under that Scheme from the Committee when the amount becomes due for payment."
                },
                {
                    "representation": "(2)",
                    "description": "Where any amount becomes payable by the Government pursuant to a guarantee given in exercise of the powers conferred by subsection"
                },
                {
                    "representation": "(3)",
                    "description": "Where any amount is paid out of the Consolidated Fund in pursuance of  any  liability  incurred  by  the  Government  under  a guarantee given in exercise of the powers conferred by subsection"
                },
                {
                    "representation": "(4)",
                    "description": "Where  the  Government  has,  in  exercise  of  the  powers conferred by subsection"
                }
            ]
        }
    },
    {
        "act": "SAVINGS SCHEMES ACT",
        "source": "https://mola.gov.gy/laws-of-guyana",
        "type": {
            "name": "section",
            "representation": "15",
            "title": "Investment of amounts in the accounts in any approved Savings Scheme.   PART IV MISCELLANEOUS  ",
            "context": "SAVINGS SCHEMES ACT under Investment of amounts in the accounts in any approved Savings Scheme.   PART IV MISCELLANEOUS  15. Such part of the amounts in the accounts in any approved Savings  Scheme  as  may  be  specified  by  the  Minister  shall  be invested  (a)    in such securities as may be approved by the LAWS OF GUYANA 12 Cap. 85:05 Savings Schemes   L.R.O. 1/2012                   Accounts and audit.              Annual report.                  Power of Minister to  give directions.   Minister, in the proportion specified by him; or  (b)      in  any  other  manner  as  may  be  specified  by  the Minister.  PART IV MISCELLANEOUS",
            "description": [
                {
                    "representation": "(a)",
                    "description": "in such securities as may be approved by the LAWS OF GUYANA 12 Cap. 85:05 Savings Schemes   L.R.O. 1/2012                   Accounts and audit.              Annual report.                  Power of Minister to  give directions.   Minister, in the proportion specified by him; or"
                },
                {
                    "representation": "(b)",
                    "description": "in  any  other  manner  as  may  be  specified  by  the Minister.  PART IV MISCELLANEOUS"
                }
            ]
        }
    },
    {
        "act": "SAVINGS SCHEMES ACT",
        "source": "https://mola.gov.gy/laws-of-guyana",
        "type": {
            "name": "section",
            "representation": "16",
            "title": "Accounts and audit.  LAWS OF GUYANA 4 Cap. 85:05 Savings Schemes   L.R.O. 1/2012  SECTION ",
            "context": "SAVINGS SCHEMES ACT under Accounts and audit.  LAWS OF GUYANA 4 Cap. 85:05 Savings Schemes   L.R.O. 1/2012  SECTION 16.  (1) The Committee shall keep accounts of its transactions to the satisfaction of the Minister and the accounts shall be audited annually by an auditor appointed by the Minister.  (2) The  members,  officers  and  other  employees  of  the Committee shall grant to the auditor appointed under subsection (1) access to all books, documents, cash and securities of the Committee and shall give to him on request all such information as may be within their knowledge in relation to the operation of the Committee.",
            "description": [
                {
                    "representation": "(1)",
                    "description": "access to all books, documents, cash and securities of the Committee and shall give to him on request all such information as may be within their knowledge in relation to the operation of the Committee."
                },
                {
                    "representation": "(2)",
                    "description": "The  members,  officers  and  other  employees  of  the Committee shall grant to the auditor appointed under subsection"
                }
            ]
        }
    },
    {
        "act": "SAVINGS SCHEMES ACT",
        "source": "https://mola.gov.gy/laws-of-guyana",
        "type": {
            "name": "section",
            "representation": "17",
            "title": "Annual report. ",
            "context": "SAVINGS SCHEMES ACT under Annual report. 17.  (1) As soon as may be possible after its accounts for any year have been audited in accordance with the provisions of section 16, the Committee  shall submit to the Minister a report on its operations throughout that  year, together with a statement of its accounts so audited.  (2) A copy of the report mentioned in subsection (1) together with a copy of the report of the auditor shall be laid before the National Assembly.",
            "description": [
                {
                    "representation": "(1)",
                    "description": "together with a copy of the report of the auditor shall be laid before the National Assembly."
                },
                {
                    "representation": "(2)",
                    "description": "A copy of the report mentioned in subsection"
                }
            ]
        }
    },
    {
        "act": "SAVINGS SCHEMES ACT",
        "source": "https://mola.gov.gy/laws-of-guyana",
        "type": {
            "name": "section",
            "representation": "18",
            "title": "Power of Minister to give directions. 19   Orders regarding application of the Financial Institutions Act and  Bank of Guyana Act to the Committee. ",
            "context": "SAVINGS SCHEMES ACT under Power of Minister to give directions. 19   Orders regarding application of the Financial Institutions Act and  Bank of Guyana Act to the Committee. 18.  (1) The Minister may give to the Committee directions of a general character as to the policy to be followed by the Committee in the exercise and performance of its functions and the Committee shall give effect to any such directions. LAWS OF GUYANA Savings Schemes Cap. 85:05 13  L.R.O. 1/2011                Orders regarding application of the Financial Institutions Act t  and Bank of Guyana Act to the Committee. c. 85:03         c. 85:02           Limitation provisions excluded.   Super- annuation benefits of public officers and teachers employed with the Committee.  c. 27:02          (2) The Committee shall provide such facilities to the Minister as will enable him to verify any information furnished in pursuance of this section.",
            "description": [
                {
                    "representation": "(1)",
                    "description": "The Minister may give to the Committee directions of a general character as to the policy to be followed by the Committee in the exercise and performance of its functions and the Committee shall give effect to any such directions. LAWS OF GUYANA Savings Schemes Cap. 85:05 13  L.R.O. 1/2011                Orders regarding application of the Financial Institutions Act t  and Bank of Guyana Act to the Committee. c. 85:03         c. 85:02           Limitation provisions excluded.   Super- annuation benefits of public officers and teachers employed with the Committee.  c. 27:02"
                },
                {
                    "representation": "(2)",
                    "description": "The Committee shall provide such facilities to the Minister as will enable him to verify any information furnished in pursuance of this section."
                }
            ]
        }
    },
    {
        "act": "SAVINGS SCHEMES ACT",
        "source": "https://mola.gov.gy/laws-of-guyana",
        "type": {
            "name": "section",
            "representation": "20",
            "title": "Limitation provisions excluded. ",
            "context": "SAVINGS SCHEMES ACT under Limitation provisions excluded. 20.  No written law prescribing a period of limitation within which a sum of money may be recovered shall apply to a claim for a sum of money by the Committee.",
            "description": "No written law prescribing a period of limitation within which a sum of money may be recovered shall apply to a claim for a sum of money by the Committee."
        }
    },
    {
        "act": "SAVINGS SCHEMES ACT",
        "source": "https://mola.gov.gy/laws-of-guyana",
        "type": {
            "name": "section",
            "representation": "21",
            "title": "Superannuation benefits of public officers and teachers employed with the Committee. ",
            "context": "SAVINGS SCHEMES ACT under Superannuation benefits of public officers and teachers employed with the Committee. 21. (1) Where, with the approval of the appropriate authority, an officer  (a)  is  seconded   or   temporarily   transferred   from a pensionable office within the meaning of the Pensions Act to an office with the Committee, section 5 of that Act shall apply  to  him  as  if  his  service  in  the  office  with  the Committee were service in a public office; (b)      is transferred from a pensionable office within the meaning of the LAWS OF GUYANA 14 Cap. 85:05 Savings Schemes   L.R.O. 1/2012                   c. 39:05            [9 of 1971]                     Pensions Act to a substantive appointment in an   office  with  the  Committee,  his  service  with  the Committee shall be other public service within the meaning of,  and for the purposes of, such provisions in relation thereto as are contained in the Pensions Act.  (2) Where a teacher who has done qualifying service within the meaning of the Teachers Pensions Act is, with the approval of the appropriate authority  (a)     seconded   or   temporarily    transferred   from   his pensionable  office  as  a  teacher  to  an  office  with  the Committee, section 5 of the Pensions Act (as it applies mutatis  mutandis to  a  teacher  under  section  7C  of  the Teachers Pensions (Amendment) Act) shall apply to him as it applies in the case of a public officer;  (b)   is transferred from his pensionable office as a teacher to a substantive appointment  in  an  office  with  the Committee, his service with the Committee shall be treated as if it were other public service within the meaning of, and for the purposes of, such provisions in relation thereto as are contained in, the Pensions Act and as if he were a public officer to whom the Pensions Act applies.  (3) In this section, appropriate authority means the person or authority vested by law with power to appoint LAWS OF GUYANA Savings Schemes Cap. 85:05 15  L.R.O. 1/2011      Power to make regulations.   the officer to the pensionable office held by him (and to which the Pensions Act applies) or to appoint the teacher to the office held by him as a teacher, as the case may be.",
            "description": [
                {
                    "representation": "(1)",
                    "description": "Where, with the approval of the appropriate authority, an officer"
                },
                {
                    "representation": "(a)",
                    "description": "seconded   or   temporarily    transferred   from   his pensionable  office  as  a  teacher  to  an  office  with  the Committee, section 5 of the Pensions Act"
                },
                {
                    "representation": "(b)",
                    "description": "is transferred from his pensionable office as a teacher to a substantive appointment  in  an  office  with  the Committee, his service with the Committee shall be treated as if it were other public service within the meaning of, and for the purposes of, such provisions in relation thereto as are contained in, the Pensions Act and as if he were a public officer to whom the Pensions Act applies."
                },
                {
                    "representation": "(2)",
                    "description": "Where a teacher who has done qualifying service within the meaning of the Teachers Pensions Act is, with the approval of the appropriate authority"
                },
                {
                    "representation": "(3)",
                    "description": "In this section, appropriate authority means the person or authority vested by law with power to appoint LAWS OF GUYANA Savings Schemes Cap. 85:05 15  L.R.O. 1/2011      Power to make regulations.   the officer to the pensionable office held by him"
                }
            ]
        }
    },
    {
        "act": "SAVINGS SCHEMES ACT",
        "source": "https://mola.gov.gy/laws-of-guyana",
        "type": {
            "name": "section",
            "representation": "22",
            "title": "Power to make regulations.  _______________   17 of 1983 An Act to make provisions for the establishment of the Savings Schemes Committee, for encouraging savings by persons, and for matters connected therewith.   [15TH OCTOBER, 1983]      Short title.       Interpretation.       c. 85:03      PART I PRELIMINARY  ",
            "context": "SAVINGS SCHEMES ACT under Power to make regulations.  _______________   17 of 1983 An Act to make provisions for the establishment of the Savings Schemes Committee, for encouraging savings by persons, and for matters connected therewith.   [15TH OCTOBER, 1983]      Short title.       Interpretation.       c. 85:03      PART I PRELIMINARY  22.  (1) The Minister may make regulations for carrying into effect the purposes of this Act.  (2) Without prejudice to the generality of the foregoing and in particular the regulations may provide for all or any of the following matters  (a)  the  terms  and  conditions  of  appointment  of  the chairman and other members of the Committee;  (b)   the  procedure  of  the  Committee,  including  the intervals at which the meetings of the Committee shall be held and the quorum for its meetings;  (c)      any other matter that is required to be, or may be, prescribed by the Minister by regulations made under this Act.  __________             LAWS OF GUYANA 16 Cap. 85:05 Savings Schemes   L.R.O. 1/2012   SUBSIDIARY LEGISLATION  _________________   O. 16/1985 SAVINGS SCHEMES (BANKING) ORDER  made under section 12(3)   Citation.          Bank of Guyana to perform functions of banker to Committee and approved Savings Schemes. Cap. 85:02",
            "description": [
                {
                    "representation": "(1)",
                    "description": "The Minister may make regulations for carrying into effect the purposes of this Act."
                },
                {
                    "representation": "(2)",
                    "description": "Without prejudice to the generality of the foregoing and in particular the regulations may provide for all or any of the following matters"
                },
                {
                    "representation": "(a)",
                    "description": "the  terms  and  conditions  of  appointment  of  the chairman and other members of the Committee;"
                },
                {
                    "representation": "(b)",
                    "description": "the  procedure  of  the  Committee,  including  the intervals at which the meetings of the Committee shall be held and the quorum for its meetings;"
                },
                {
                    "representation": "(c)",
                    "description": "any other matter that is required to be, or may be, prescribed by the Minister by regulations made under this Act.  __________             LAWS OF GUYANA 16 Cap. 85:05 Savings Schemes   L.R.O. 1/2012   SUBSIDIARY LEGISLATION  _________________   O. 16/1985 SAVINGS SCHEMES"
                },
                {
                    "representation": "(3)",
                    "description": "Citation.          Bank of Guyana to perform functions of banker to Committee and approved Savings Schemes. Cap. 85:02"
                }
            ]
        }
    }
]