[
    {
        "act": "CORPORATIONS (PROVISION FOR CONVERSION INTO PUBLIC COMPANIES) ACT",
        "source": "https://mola.gov.gy/laws-of-guyana",
        "type": {
            "name": "section",
            "representation": "",
            "title": "1.Short title.",
            "context": "CORPORATIONS (PROVISION FOR CONVERSION INTO PUBLIC COMPANIES) ACT under 1.Short title.1. This Act may be cited as the Corporations(Provision for Conversion into Public Companies) Act.",
            "description": "This Act may be cited as the Corporations(Provision for Conversion into Public Companies) Act."
        }
    },
    {
        "act": "CORPORATIONS (PROVISION FOR CONVERSION INTO PUBLIC COMPANIES) ACT",
        "source": "https://mola.gov.gy/laws-of-guyana",
        "type": {
            "name": "section",
            "representation": "",
            "title": "2.Interpretation.",
            "context": "CORPORATIONS (PROVISION FOR CONVERSION INTO PUBLIC COMPANIES) ACT under 2.Interpretation.2.In this Act appointed day, in relation to a corporation, means theday specified by the Minister by order under section3(1);company and public company have the same meaningsas in section 2 (1) (b) and (h), respectively, of theCompanies Act;corporation has the same meaning as in section 2(d) of theLAWS OF GUYANA4Cap. 85:08Corporations (Provision for Conversion into Public Companies)L.R.O. 1/2012c. 19:05Conversion ofcorporationsinto publiccompanies.c. 89:01c. 19:05Public Corporations Act.",
            "description": [
                {
                    "representation": "(1)",
                    "description": "(b) and"
                },
                {
                    "representation": "(d)",
                    "description": "of theLAWS OF GUYANA4Cap. 85:08Corporations"
                }
            ]
        }
    },
    {
        "act": "CORPORATIONS (PROVISION FOR CONVERSION INTO PUBLIC COMPANIES) ACT",
        "source": "https://mola.gov.gy/laws-of-guyana",
        "type": {
            "name": "section",
            "representation": "3",
            "title": "Conversation of corporations into public companies.",
            "context": "CORPORATIONS (PROVISION FOR CONVERSION INTO PUBLIC COMPANIES) ACT under Conversation of corporations into public companies.3. (1)With  effect  from  such  date  as  may  bespecified  by the Minister, by order, in relation to anycorporation, that corporation shall be deemed to be a publiccompany limited by shares.(2)The appointed date shall not be earlier than tendays, or such longer period not being more than thirty days,from the date on which the order specifying the day is madeby the Minister.(3)The corporation, in respect of which an orderhas been made under subsection (1), shall before theappointed day submit to the Registrar of Companies withthe articles of incorporation the other documents that arerequired to be filed by a company under sections 67 (1), 188(1), and 479 of the Companies Act for the purpose of itsincorporation.(4) The stock and equity interest (if any) in acorporation in relation to which an order had been madeunder subsection (1) shall, notwithstanding anything in theCompanies Act, remain the  same  as  on  the  dateimmediately  before  the appointed day, except ant change iseffected thereof pursuant to  this  Act,  the Companies  Actor  the  articles  of incorporation of the company.(5)Where in respect of any corporation an orderhas been made under subsection (1), from the appointed daythe word incorporated or the abbreviation inc. shall bepart of its names and (a)the Public Corporations Act shall ceaseto apply to that corporation, except forsection 8 of the Act or any otherprovision thereof that may be utilizedto facilitate the operation of this Act;andLAWS OF GUYANACorporations (Provision for Conversion into Public Companies)Cap. 85:085L.R.O. 1/2012(b) all  the  persons  who  were  directors  ofthecorporation immediately beforesuch date shall cease to be directors.(6)Notwithstanding anything in the CompaniesAct or the articles of incorporation of the company, theMinister may issue  or  transfer  shares  in  the  company  tothe  State  or  a person,   and,   in   the   case   of   anissuance   of   shares,   a memorandum from the Minister tothe Registrar of Companies regarding the consideration forthe shares shall be accepted by the Registrar as valid; andthe directors of the company shall accept the issuance ortransfer of the shares and register the same in the books ofthe company.(7)Subject to the other provisions of this Act andnotwithstanding the incorporation of a corporation as apublic company, for all purposes including for the purposesof assets and liabilities, licences granted, contracts enteredinto prior to the date on which it is so incorporated andsubsisting on that date, continuation of employment and allother rights and obligations,   and   the continuation   oflegal   proceedings instituted by or against it and pendingon such date, it shall be deemed that the company is thesame corporate body as the corporation.(8)In respect of a corporation for which and orderhas been made under subsection (1), nothing effected orauthorized by this Act (a) shall be regarded as placing thecorporation or the public company intowhich it has been converted or anyother person in breach of contract orconfidence or as otherwise making anyof them liable for a civil wrong;(b) shall be regarded as giving rise to a rightfor any person to terminate or cancelLAWS OF GUYANA6Cap. 85:08Corporations (Provision for Conversion into Public Companies)L.R.O. 1/2012Transitionalprovisions.c. 89:01Power to makeregulations.anycontract or arrangement or toaccelerate theperformance of anyobligation;(c)shall be regarded as placing the publiccompany or any other person in breachof any enactment or rule of law orcontractualprovision prohibiting,restricting, or regulating the assignmentor transfer of any property or thedisclosure of any information.(d)shall release any surety wholly or inpart from any obligation; or(e)  shall invalidate or discharge any contractor security.",
            "description": [
                {
                    "representation": "(4)",
                    "description": "The stock and equity interest"
                },
                {
                    "representation": "(1)",
                    "description": "shall, notwithstanding anything in theCompanies Act, remain the  same  as  on  the  dateimmediately  before  the appointed day, except ant change iseffected thereof pursuant to  this  Act,  the Companies  Actor  the  articles  of incorporation of the company.(5)Where in respect of any corporation an orderhas been made under subsection"
                },
                {
                    "representation": "(b)",
                    "description": "all  the  persons  who  were  directors  ofthecorporation immediately beforesuch date shall cease to be directors.(6)Notwithstanding anything in the CompaniesAct or the articles of incorporation of the company, theMinister may issue  or  transfer  shares  in  the  company  tothe  State  or  a person,   and,   in   the   case   of   anissuance   of   shares,   a memorandum from the Minister tothe Registrar of Companies regarding the consideration forthe shares shall be accepted by the Registrar as valid; andthe directors of the company shall accept the issuance ortransfer of the shares and register the same in the books ofthe company.(7)Subject to the other provisions of this Act andnotwithstanding the incorporation of a corporation as apublic company, for all purposes including for the purposesof assets and liabilities, licences granted, contracts enteredinto prior to the date on which it is so incorporated andsubsisting on that date, continuation of employment and allother rights and obligations,   and   the continuation   oflegal   proceedings instituted by or against it and pendingon such date, it shall be deemed that the company is thesame corporate body as the corporation.(8)In respect of a corporation for which and orderhas been made under subsection"
                },
                {
                    "representation": "(a)",
                    "description": "shall be regarded as placing thecorporation or the public company intowhich it has been converted or anyother person in breach of contract orconfidence or as otherwise making anyof them liable for a civil wrong;(b) shall be regarded as giving rise to a rightfor any person to terminate or cancelLAWS OF GUYANA6Cap. 85:08Corporations"
                },
                {
                    "representation": "(e)",
                    "description": "shall invalidate or discharge any contractor security."
                }
            ]
        }
    },
    {
        "act": "CORPORATIONS (PROVISION FOR CONVERSION INTO PUBLIC COMPANIES) ACT",
        "source": "https://mola.gov.gy/laws-of-guyana",
        "type": {
            "name": "section",
            "representation": "4",
            "title": "Transitional provisions.",
            "context": "CORPORATIONS (PROVISION FOR CONVERSION INTO PUBLIC COMPANIES) ACT under Transitional provisions.4. (1) The Minister may after a corporation has beenincorporated as a public company pursuant to section 3, atthe request of the Directors  of  the  companyor afterconsultation with such Directors,   by   order,   make   suchprovisions,   including provisions relating to the assets ofthe corporation transferred to the public company, asappear to him to be necessary or expedient to facilitate thetransition of the corporation to a public company limited byshares under the Companies Act:Provided that no such order shall be made after theexpiry of two  years  from  the  date  on  which  thecorporation  was registered as a public company.(2)An order made under subsection (1) shall besubject to negative resolution of the National Assembly.",
            "description": [
                {
                    "representation": "(1)",
                    "description": "shall besubject to negative resolution of the National Assembly."
                }
            ]
        }
    }
]