[
    {
        "act": "DEALERS IN FOREIGN CURRENCY (LICENSING) ACT",
        "source": "https://mola.gov.gy/laws-of-guyana",
        "type": {
            "name": "section",
            "representation": "1",
            "title": "Short title.  ",
            "context": "DEALERS IN FOREIGN CURRENCY (LICENSING) ACT under Short title.  1. This Act may be cited as the Dealers in Foreign Currency (Licensing) Act.  LAWS OF GUYANA 4 Cap. 87:01 Dealers in Foreign Currency (Licensing)  L.R.O. 1/2012 Interpretation. [9 of 1995]   c. 86:01       c. 85:02                    c. 85:02    c.86:01 (repealed)                  c. 85:03",
            "description": "This Act may be cited as the Dealers in Foreign Currency (Licensing) Act.  LAWS OF GUYANA 4 Cap. 87:01 Dealers in Foreign Currency (Licensing)  L.R.O. 1/2012 Interpretation. [9 of 1995]   c. 86:01       c. 85:02                    c. 85:02    c.86:01 (repealed)                  c. 85:03"
        }
    },
    {
        "act": "DEALERS IN FOREIGN CURRENCY (LICENSING) ACT",
        "source": "https://mola.gov.gy/laws-of-guyana",
        "type": {
            "name": "section",
            "representation": "2",
            "title": "Interpretation. ",
            "context": "DEALERS IN FOREIGN CURRENCY (LICENSING) ACT under Interpretation. 2. In this Act  authorised dealer has the same meaning as in the Foreign Exchange (Miscellaneous Provisions Act)  the Bank has the same meaning as in the Bank of Guyana Act;  exempted foreign currency means any foreign currency which  (i) is received as a result of the settlement of any monetary obligation or transaction in foreign currency, where such settlement is in accordance with section 21 of the Bank of Guyana Act; (ii) is required to be sold to an authorised dealer under section 25 (1) (c) of the Exchange Control Act; (iii) is received by any person in foreign currency by virtue of the provisions contained in any other written law;  foreign currency means any currency other than Guyana dollars and includes a travellers cheque designated in a foreign currency;  licence means a licence under this Act;  licensed business means the business of buying and selling foreign currency a licensee is authorised to carry on;  licensed financial institution has the same meaning as in the Financial Institutions Act;  licensed premises means the premises specified in a licence as the premises where the licensed business may be LAWS OF GUYANA Dealers in Foreign Currency (Licensing) Cap. 87:01 5  L.R.O. 1/2012                Application for   licence.  [9 of 1995]          Grant of licence. [9 of 1995]                      carried on by the holder of the licence;  licensee means the holder of a licence, which has not been suspended or revoked or the term of which has not expired;  prescribed means prescribed by the Minister by regulations;   week means a period of seven days beginning with Monday and ending with Sunday.",
            "description": [
                {
                    "representation": "(i)",
                    "description": "is received as a result of the settlement of any monetary obligation or transaction in foreign currency, where such settlement is in accordance with section 21 of the Bank of Guyana Act;"
                },
                {
                    "representation": "(1)",
                    "description": "(c) of the Exchange Control Act;"
                }
            ]
        }
    },
    {
        "act": "DEALERS IN FOREIGN CURRENCY (LICENSING) ACT",
        "source": "https://mola.gov.gy/laws-of-guyana",
        "type": {
            "name": "section",
            "representation": "3",
            "title": "Application for licence. ",
            "context": "DEALERS IN FOREIGN CURRENCY (LICENSING) ACT under Application for licence. 3. (1) Any person who is desirous of carrying on the business of buying and selling foreign currency may apply to the Bank in the prescribed form for a licence for that purpose.  (2) Every application for a licence shall be accompanied by such fees as may be prescribed.",
            "description": [
                {
                    "representation": "(1)",
                    "description": "Any person who is desirous of carrying on the business of buying and selling foreign currency may apply to the Bank in the prescribed form for a licence for that purpose."
                },
                {
                    "representation": "(2)",
                    "description": "Every application for a licence shall be accompanied by such fees as may be prescribed."
                }
            ]
        }
    },
    {
        "act": "DEALERS IN FOREIGN CURRENCY (LICENSING) ACT",
        "source": "https://mola.gov.gy/laws-of-guyana",
        "type": {
            "name": "section",
            "representation": "4",
            "title": "Grant of licence. ",
            "context": "DEALERS IN FOREIGN CURRENCY (LICENSING) ACT under Grant of licence. 4. (1) The Bank, after consultation with the Minister, may, having regard to  (a) the experience of  the applicant for a licence in dealing in foreign currency;  (b) the financial resources of the applicant; and  (c) the character  and antecedents of the applicant,   grant or refuse to grant to him a licence.  (2) Where the Bank is of the opinion that, having regard to the likely volume of the business of buying and selling foreign currency in the area where the applicant proposes to carry on the licensed business, an adequate number of persons have already been granted 1icences and LAWS OF GUYANA 6 Cap. 87:01 Dealers in Foreign Currency (Licensing)  L.R.O. 1/2012            Term of licence and renewal. [9 of 1995]            Premises where licensed business to be carried on. [9 of 1995]           Conditions of licence. [9 of 1995]         are carrying on licensed business in the area, the Bank,  after consultation with the Minister, may refuse a licence to the applicant.  (3) A licence shall be in such form as may be prescribed and such fees as may be prescribed shall be paid for the grant of the licence.",
            "description": [
                {
                    "representation": "(1)",
                    "description": "The Bank, after consultation with the Minister, may, having regard to"
                },
                {
                    "representation": "(a)",
                    "description": "the experience of  the applicant for a licence in dealing in foreign currency;"
                },
                {
                    "representation": "(b)",
                    "description": "the financial resources of the applicant; and"
                },
                {
                    "representation": "(c)",
                    "description": "the character  and antecedents of the applicant,   grant or refuse to grant to him a licence."
                },
                {
                    "representation": "(2)",
                    "description": "Where the Bank is of the opinion that, having regard to the likely volume of the business of buying and selling foreign currency in the area where the applicant proposes to carry on the licensed business, an adequate number of persons have already been granted 1icences and LAWS OF GUYANA 6 Cap. 87:01 Dealers in Foreign Currency"
                },
                {
                    "representation": "(3)",
                    "description": "A licence shall be in such form as may be prescribed and such fees as may be prescribed shall be paid for the grant of the licence."
                }
            ]
        }
    },
    {
        "act": "DEALERS IN FOREIGN CURRENCY (LICENSING) ACT",
        "source": "https://mola.gov.gy/laws-of-guyana",
        "type": {
            "name": "section",
            "representation": "",
            "title": "5.1994)    Dealers in Foreign Currency (Licensing) Regulations 15 (Reg. 3/1990, 3/1996, 7/1996, 1/2000),   LAWS OF GUYANA Dealers in Foreign Currency (Licensing) Cap. 87:01 3  L.R.O. 1/2012 CHAPTER 87:01  DEALERS IN FOREIGN CURRENCY (LICENSING) ACT  ARRANGEMENT OF SECTIONS  SECTION ",
            "context": "DEALERS IN FOREIGN CURRENCY (LICENSING) ACT under 5.1994)    Dealers in Foreign Currency (Licensing) Regulations 15 (Reg. 3/1990, 3/1996, 7/1996, 1/2000),   LAWS OF GUYANA Dealers in Foreign Currency (Licensing) Cap. 87:01 3  L.R.O. 1/2012 CHAPTER 87:01  DEALERS IN FOREIGN CURRENCY (LICENSING) ACT  ARRANGEMENT OF SECTIONS  SECTION 5.  Term of licence and renewal.",
            "description": "Term of licence and renewal."
        }
    },
    {
        "act": "DEALERS IN FOREIGN CURRENCY (LICENSING) ACT",
        "source": "https://mola.gov.gy/laws-of-guyana",
        "type": {
            "name": "section",
            "representation": "6",
            "title": "Premises where licensed business to be carried on.  ",
            "context": "DEALERS IN FOREIGN CURRENCY (LICENSING) ACT under Premises where licensed business to be carried on.  6. (1) A licence shall specify the premises where the licensed business may be carried on and the licensed business shall not be carried on in any other premises.  (2) Where a licensee is desirous of shifting the licensed business to premises other than the premises specified in the licence, he shall make an application therefor in the prescribed form along with such fees as may be prescribed and, where the Bank grants the application, the licence shall be amended accordingly.",
            "description": [
                {
                    "representation": "(1)",
                    "description": "A licence shall specify the premises where the licensed business may be carried on and the licensed business shall not be carried on in any other premises."
                },
                {
                    "representation": "(2)",
                    "description": "Where a licensee is desirous of shifting the licensed business to premises other than the premises specified in the licence, he shall make an application therefor in the prescribed form along with such fees as may be prescribed and, where the Bank grants the application, the licence shall be amended accordingly."
                }
            ]
        }
    },
    {
        "act": "DEALERS IN FOREIGN CURRENCY (LICENSING) ACT",
        "source": "https://mola.gov.gy/laws-of-guyana",
        "type": {
            "name": "section",
            "representation": "7",
            "title": "Conditions of licence. ",
            "context": "DEALERS IN FOREIGN CURRENCY (LICENSING) ACT under Conditions of licence. 7. (1) Every licence shall be subject to the provisions of this Act, and such conditions as may, from time to time, be prescribed or specified in the licence.  (2) The conditions of a licence referred to in subsection (1) may include a condition as to the furnishing of security by the licensee, the amount and forfeiture thereof and the power of the Bank to vary the amount of the security from LAWS OF GUYANA Dealers in Foreign Currency (Licensing) Cap. 87:01 7  L.R.O. 1/2012         Revocation and suspension of licence. [9 of 1995]                                 Right of licensee to buy, sell or hold foreign currency. [9 of 1995]        time to time.",
            "description": [
                {
                    "representation": "(1)",
                    "description": "may include a condition as to the furnishing of security by the licensee, the amount and forfeiture thereof and the power of the Bank to vary the amount of the security from LAWS OF GUYANA Dealers in Foreign Currency"
                },
                {
                    "representation": "(2)",
                    "description": "The conditions of a licence referred to in subsection"
                }
            ]
        }
    },
    {
        "act": "DEALERS IN FOREIGN CURRENCY (LICENSING) ACT",
        "source": "https://mola.gov.gy/laws-of-guyana",
        "type": {
            "name": "section",
            "representation": "8",
            "title": "Revocation and suspension of Licence. ",
            "context": "DEALERS IN FOREIGN CURRENCY (LICENSING) ACT under Revocation and suspension of Licence. 8. (1) The Bank may revoke a licence granted to a licensee if (a) he has ceased to carry on the licensed business for a period of not less than six months; or  (b) has contravened, or failed to comply with, any of the conditions subject to which the license was granted or any provision of this Act.  (2) A licence may be suspended by the Bank for such period as may be specified by it on the ground that the licensee has contravened, or has failed to comply with, any of the conditions subject to which the licence was granted or the provisions of this Act, or pending any investigation into a complaint that the licensee is guilty of any such act or omission.  (3) The Bank shall not revoke or suspend a licence unless the holder of the licence has been given a reasonable opportunity of being heard.  (4) Any action taken by the Bank under this section shall only be taken after consultation with the Minister.",
            "description": [
                {
                    "representation": "(1)",
                    "description": "The Bank may revoke a licence granted to a licensee if"
                },
                {
                    "representation": "(a)",
                    "description": "he has ceased to carry on the licensed business for a period of not less than six months; or"
                },
                {
                    "representation": "(b)",
                    "description": "has contravened, or failed to comply with, any of the conditions subject to which the license was granted or any provision of this Act."
                },
                {
                    "representation": "(2)",
                    "description": "A licence may be suspended by the Bank for such period as may be specified by it on the ground that the licensee has contravened, or has failed to comply with, any of the conditions subject to which the licence was granted or the provisions of this Act, or pending any investigation into a complaint that the licensee is guilty of any such act or omission."
                },
                {
                    "representation": "(3)",
                    "description": "The Bank shall not revoke or suspend a licence unless the holder of the licence has been given a reasonable opportunity of being heard."
                },
                {
                    "representation": "(4)",
                    "description": "Any action taken by the Bank under this section shall only be taken after consultation with the Minister."
                }
            ]
        }
    },
    {
        "act": "DEALERS IN FOREIGN CURRENCY (LICENSING) ACT",
        "source": "https://mola.gov.gy/laws-of-guyana",
        "type": {
            "name": "section",
            "representation": "9",
            "title": "Right of licensee to buy, sell or hold foreign currency. ",
            "context": "DEALERS IN FOREIGN CURRENCY (LICENSING) ACT under Right of licensee to buy, sell or hold foreign currency. 9. (1) Subject to the provisions of this Act and the conditions of the licence, a licensee shall be entitled to carry on the business of buying and selling foreign currency.  (2) A licensee shall not be under any obligation to sell to an authorised dealer the foreign currency bought by the licensee under this Act.  (3) The price at which a licensee may buy or sell any foreign currency shall be determined by the licensee and LAWS OF GUYANA 8 Cap. 87:01 Dealers in Foreign Currency (Licensing)  L.R.O. 1/2012                     c. 85:03           Special provisions relating to authorised dealers who are licensees.                     Right to sell foreign currency to, and to buy foreign currency from, licensee. [9 of 1995]      shall be displayed at a prominent place on the licensed premises.  (4) No licensee, other than a company which is a licensed financial institution under the Financial Institutions Act, may engage to any extent in the lending or borrowing or acceptance of deposits, of Guyana dollars or any foreign currency.  (5) Any person who contravene the provisions of subsection (4) shall be guilty of conducting a financial business without a licence within the meaning of the Financial Institutions Act and shall be liable to the penalties prescribed under the Financial Institutions Act therefor.",
            "description": [
                {
                    "representation": "(1)",
                    "description": "Subject to the provisions of this Act and the conditions of the licence, a licensee shall be entitled to carry on the business of buying and selling foreign currency."
                },
                {
                    "representation": "(2)",
                    "description": "A licensee shall not be under any obligation to sell to an authorised dealer the foreign currency bought by the licensee under this Act."
                },
                {
                    "representation": "(3)",
                    "description": "The price at which a licensee may buy or sell any foreign currency shall be determined by the licensee and LAWS OF GUYANA 8 Cap. 87:01 Dealers in Foreign Currency"
                },
                {
                    "representation": "(4)",
                    "description": "shall be guilty of conducting a financial business without a licence within the meaning of the Financial Institutions Act and shall be liable to the penalties prescribed under the Financial Institutions Act therefor."
                },
                {
                    "representation": "(5)",
                    "description": "Any person who contravene the provisions of subsection"
                }
            ]
        }
    },
    {
        "act": "DEALERS IN FOREIGN CURRENCY (LICENSING) ACT",
        "source": "https://mola.gov.gy/laws-of-guyana",
        "type": {
            "name": "section",
            "representation": "10",
            "title": "Special provisions relating to authorised dealers who are licensees. ",
            "context": "DEALERS IN FOREIGN CURRENCY (LICENSING) ACT under Special provisions relating to authorised dealers who are licensees. 10. (1) An authorised dealer may be granted a licence under this Act.  (2) Where an authorised dealer is granted a licence under this Act, the business that the licensee is entitled to carry on under section 9 and the business as authorised dealer shall be carried on in separate units or divisions, separate accounts and other records shall be maintained for the two businesses and the foreign currency received in the course of transactions as licensee shall be kept separate from the foreign currency received in the course of transactions as authorised dealer.",
            "description": [
                {
                    "representation": "(1)",
                    "description": "An authorised dealer may be granted a licence under this Act."
                },
                {
                    "representation": "(2)",
                    "description": "Where an authorised dealer is granted a licence under this Act, the business that the licensee is entitled to carry on under section 9 and the business as authorised dealer shall be carried on in separate units or divisions, separate accounts and other records shall be maintained for the two businesses and the foreign currency received in the course of transactions as licensee shall be kept separate from the foreign currency received in the course of transactions as authorised dealer."
                }
            ]
        }
    },
    {
        "act": "DEALERS IN FOREIGN CURRENCY (LICENSING) ACT",
        "source": "https://mola.gov.gy/laws-of-guyana",
        "type": {
            "name": "section",
            "representation": "11",
            "title": "Right to sell foreign currency to, and to buy foreign currency from, licensee. ",
            "context": "DEALERS IN FOREIGN CURRENCY (LICENSING) ACT under Right to sell foreign currency to, and to buy foreign currency from, licensee. 11. (1) Any person entitled to sell foreign currency, not being exempted foreign currency, may sell it to a licensee.  (2) The Bank, after consultation with the Minister, may permit any person holding exempted foreign currency to sell a part or the whole of it to a licensee and, where any such permission is granted, the person may sell a part or whole, as the case may be, of the exempted foreign currency to a licensee in accordance with the permission.  LAWS OF GUYANA Dealers in Foreign Currency (Licensing) Cap. 87:01 9  L.R.O. 1/2012                     Receipts.             Act to override other written laws.  c. 86:01     Keeping of accounts and other records. [9 of 1995]         (3) A permission under subsection (2) may be granted subject to such conditions as may be specified by the Bank, after consultation with the Minister, or without any conditions.  (4) Subject to the provisions of subsection (5), any person may buy any foreign currency from a licensee.  (5) The Bank, after consultation with the Minister may, by notification in the Gazette, direct that a licensee may sell a foreign currency, to any person, only for such purposes as may be specified in the notification or only to any person authorised by the Bank, after consultation with the Minister, to buy the foreign currency for any specified purpose, and the licensee shall comply with the direction.",
            "description": [
                {
                    "representation": "(1)",
                    "description": "Any person entitled to sell foreign currency, not being exempted foreign currency, may sell it to a licensee."
                },
                {
                    "representation": "(2)",
                    "description": "may be granted subject to such conditions as may be specified by the Bank, after consultation with the Minister, or without any conditions."
                },
                {
                    "representation": "(3)",
                    "description": "A permission under subsection"
                },
                {
                    "representation": "(4)",
                    "description": "Subject to the provisions of subsection"
                },
                {
                    "representation": "(5)",
                    "description": "The Bank, after consultation with the Minister may, by notification in the Gazette, direct that a licensee may sell a foreign currency, to any person, only for such purposes as may be specified in the notification or only to any person authorised by the Bank, after consultation with the Minister, to buy the foreign currency for any specified purpose, and the licensee shall comply with the direction."
                }
            ]
        }
    },
    {
        "act": "DEALERS IN FOREIGN CURRENCY (LICENSING) ACT",
        "source": "https://mola.gov.gy/laws-of-guyana",
        "type": {
            "name": "section",
            "representation": "12",
            "title": "Receipts. ",
            "context": "DEALERS IN FOREIGN CURRENCY (LICENSING) ACT under Receipts. 12. (1) A licensee shall give to any person selling any foreign currency to the licensee, a receipt and keep a duplicate of the receipt.  (2) A licensee shall take from every person buying any foreign currency from the licensee a receipt and give the purchaser a duplicate of the receipt.",
            "description": [
                {
                    "representation": "(1)",
                    "description": "A licensee shall give to any person selling any foreign currency to the licensee, a receipt and keep a duplicate of the receipt."
                },
                {
                    "representation": "(2)",
                    "description": "A licensee shall take from every person buying any foreign currency from the licensee a receipt and give the purchaser a duplicate of the receipt."
                }
            ]
        }
    },
    {
        "act": "DEALERS IN FOREIGN CURRENCY (LICENSING) ACT",
        "source": "https://mola.gov.gy/laws-of-guyana",
        "type": {
            "name": "section",
            "representation": "13",
            "title": "Act to override other written laws. ",
            "context": "DEALERS IN FOREIGN CURRENCY (LICENSING) ACT under Act to override other written laws. 13. Any Act authorised to be done by this Act and done in accordance with it shall not be deemed to be an offence under any other written law notwithstanding anything contained in that other written law.",
            "description": "Any Act authorised to be done by this Act and done in accordance with it shall not be deemed to be an offence under any other written law notwithstanding anything contained in that other written law."
        }
    },
    {
        "act": "DEALERS IN FOREIGN CURRENCY (LICENSING) ACT",
        "source": "https://mola.gov.gy/laws-of-guyana",
        "type": {
            "name": "section",
            "representation": "14",
            "title": "Keeping of accounts and other records. ",
            "context": "DEALERS IN FOREIGN CURRENCY (LICENSING) ACT under Keeping of accounts and other records. 14. (1) Every licensee shall maintain a proper account in which shall be recorded  (a) the amount of each foreign currency purchased  by the licensee each day and the price paid therefor;  (b) the amount of each foreign currency sold by the licensee each day and the LAWS OF GUYANA 10 Cap. 87:01 Dealers in Foreign Currency (Licensing)  L.R.O. 1/2012                       c. 85:02            Returns. [9 of 1995]                      price received therefor;  (c) the opening and closing balances each day in respect of each foreign currency held by the licensee;  (d) any other particulars that may be prescribed by the Bank, by regulation or notice published in the Gazette, to further the purposes of this Act or the exercise of the Banks functions under the Bank of Guyana Act.  (2) A licensee shall maintain a record in respect of each day of the price, determined by the licensee, for the purchase and sale of each foreign currency, bought and sold by him that day, when he opened and closed the licensed business for the day (hereinafter called the opening and closing rates).",
            "description": [
                {
                    "representation": "(1)",
                    "description": "Every licensee shall maintain a proper account in which shall be recorded"
                },
                {
                    "representation": "(a)",
                    "description": "the amount of each foreign currency purchased  by the licensee each day and the price paid therefor;"
                },
                {
                    "representation": "(b)",
                    "description": "the amount of each foreign currency sold by the licensee each day and the LAWS OF GUYANA 10 Cap. 87:01 Dealers in Foreign Currency"
                },
                {
                    "representation": "(c)",
                    "description": "the opening and closing balances each day in respect of each foreign currency held by the licensee;"
                },
                {
                    "representation": "(d)",
                    "description": "any other particulars that may be prescribed by the Bank, by regulation or notice published in the Gazette, to further the purposes of this Act or the exercise of the Banks functions under the Bank of Guyana Act."
                },
                {
                    "representation": "(2)",
                    "description": "A licensee shall maintain a record in respect of each day of the price, determined by the licensee, for the purchase and sale of each foreign currency, bought and sold by him that day, when he opened and closed the licensed business for the day"
                }
            ]
        }
    },
    {
        "act": "DEALERS IN FOREIGN CURRENCY (LICENSING) ACT",
        "source": "https://mola.gov.gy/laws-of-guyana",
        "type": {
            "name": "section",
            "representation": "15",
            "title": "Returns. ",
            "context": "DEALERS IN FOREIGN CURRENCY (LICENSING) ACT under Returns. 15. (1) Every licensee shall make and furnish to the Bank every Monday a return stating the opening and closing rates for each of the days  on which the licensee carried on the licensed business in the preceding week.  (2) Every licensee shall make and furnish to the Bank, not later than every Wednesday in a week, a return stating the following particulars pertaining to the licensed business in respect of the preceding week  (a) the amount of each foreign currency which the licensee held when he opened for business at the beginning of the week;  (b) the amount of each foreign currency purchased by him in the week;  LAWS OF GUYANA Dealers in Foreign Currency (Licensing) Cap. 87:01 11  L.R.O. 1/2012                        Production and examination of books. [9 of 1995]                         (c) the amount of each foreign currency sold by him in the week;  (d) the amount of each foreign currency held by the licensee when the licensee closed business at the end of the last day on which he carried on business in the week;  (e) such other particulars as may be prescribed by the Bank, by regulation or notice published in the Gazette, to further the purposes of this Act or the exercise of the Banks functions under the Bank of Guyana Act.",
            "description": [
                {
                    "representation": "(1)",
                    "description": "Every licensee shall make and furnish to the Bank every Monday a return stating the opening and closing rates for each of the days  on which the licensee carried on the licensed business in the preceding week."
                },
                {
                    "representation": "(2)",
                    "description": "Every licensee shall make and furnish to the Bank, not later than every Wednesday in a week, a return stating the following particulars pertaining to the licensed business in respect of the preceding week"
                },
                {
                    "representation": "(a)",
                    "description": "the amount of each foreign currency which the licensee held when he opened for business at the beginning of the week;"
                },
                {
                    "representation": "(b)",
                    "description": "the amount of each foreign currency purchased by him in the week;  LAWS OF GUYANA Dealers in Foreign Currency"
                },
                {
                    "representation": "(c)",
                    "description": "the amount of each foreign currency sold by him in the week;"
                },
                {
                    "representation": "(d)",
                    "description": "the amount of each foreign currency held by the licensee when the licensee closed business at the end of the last day on which he carried on business in the week;"
                },
                {
                    "representation": "(e)",
                    "description": "such other particulars as may be prescribed by the Bank, by regulation or notice published in the Gazette, to further the purposes of this Act or the exercise of the Banks functions under the Bank of Guyana Act."
                }
            ]
        }
    },
    {
        "act": "DEALERS IN FOREIGN CURRENCY (LICENSING) ACT",
        "source": "https://mola.gov.gy/laws-of-guyana",
        "type": {
            "name": "section",
            "representation": "16",
            "title": "Production and examination of books. ",
            "context": "DEALERS IN FOREIGN CURRENCY (LICENSING) ACT under Production and examination of books. 16. Any public officer authorised by the Bank in this behalf may, during the hours the licensed premises of a licensee are ordinarily open for business, enter thereon and  (a) request the licensee or any of his employees to produce any accounts, books, records and documents  (i) relating to the licensed business as are found therein; or (ii) likely to contain, in the opinion of such public officer, evidence of the contravention of any provision of this Act or any condition of the licence granted to the licensee,   and may examine and take copies of the same; or  (b) question  (i) the licensee or any of his LAWS OF GUYANA 12 Cap. 87:01 Dealers in Foreign Currency (Licensing)  L.R.O. 1/2012         Penalties. [9 of 1995]                                 c.85:03 c.85:02     Power to make regulations. [9 of 1995]    employees; or (ii) any other person found on the licensed premises.",
            "description": [
                {
                    "representation": "(a)",
                    "description": "request the licensee or any of his employees to produce any accounts, books, records and documents"
                },
                {
                    "representation": "(i)",
                    "description": "the licensee or any of his LAWS OF GUYANA 12 Cap. 87:01 Dealers in Foreign Currency"
                },
                {
                    "representation": "(b)",
                    "description": "question"
                }
            ]
        }
    },
    {
        "act": "DEALERS IN FOREIGN CURRENCY (LICENSING) ACT",
        "source": "https://mola.gov.gy/laws-of-guyana",
        "type": {
            "name": "section",
            "representation": "17",
            "title": "Penalties. ",
            "context": "DEALERS IN FOREIGN CURRENCY (LICENSING) ACT under Penalties. 17. (1) Any person who sells to any person other than a licensee or authorised dealer, any foreign currency, which under section 11 may be sold to a licensee, shall be liable, on summary conviction, to a fine of ten thousand dollars and to imprisonment for one year.  (2) Any person, not being a licensee or authorised dealer, who buys or sells any foreign currency shall be liable, on summary conviction, to a fine of not less than fifteen thousand dollars and to imprisonment for three years.  (3) Any person who fails or refuses to comply with any request made under section 16 (a) by any public officer authorised by the Bank, or fails or refuses to answer any question by such public officer, or obstructs any such public officer from carrying out his functions under section 16, shall be liable, on summary conviction, to a fine of twenty thousand dollars and to imprisonment for one year.  (4) Any person who is guilty of the contravention of any provision of this Act or any condition of the licence for which no penalty has been specified by any other provision of this Act, shall be liable, on summary conviction, to a fine of ten thousand dollars and to imprisonment for one year.  (5) Nothing in this Act shall be construed as limiting or impairing the authority of the Bank to take any action under the Financial Institutions Act or the Bank of Guyana Act.",
            "description": [
                {
                    "representation": "(1)",
                    "description": "Any person who sells to any person other than a licensee or authorised dealer, any foreign currency, which under section 11 may be sold to a licensee, shall be liable, on summary conviction, to a fine of ten thousand dollars and to imprisonment for one year."
                },
                {
                    "representation": "(2)",
                    "description": "Any person, not being a licensee or authorised dealer, who buys or sells any foreign currency shall be liable, on summary conviction, to a fine of not less than fifteen thousand dollars and to imprisonment for three years."
                },
                {
                    "representation": "(3)",
                    "description": "Any person who fails or refuses to comply with any request made under section 16"
                },
                {
                    "representation": "(a)",
                    "description": "by any public officer authorised by the Bank, or fails or refuses to answer any question by such public officer, or obstructs any such public officer from carrying out his functions under section 16, shall be liable, on summary conviction, to a fine of twenty thousand dollars and to imprisonment for one year."
                },
                {
                    "representation": "(4)",
                    "description": "Any person who is guilty of the contravention of any provision of this Act or any condition of the licence for which no penalty has been specified by any other provision of this Act, shall be liable, on summary conviction, to a fine of ten thousand dollars and to imprisonment for one year."
                },
                {
                    "representation": "(5)",
                    "description": "Nothing in this Act shall be construed as limiting or impairing the authority of the Bank to take any action under the Financial Institutions Act or the Bank of Guyana Act."
                }
            ]
        }
    },
    {
        "act": "DEALERS IN FOREIGN CURRENCY (LICENSING) ACT",
        "source": "https://mola.gov.gy/laws-of-guyana",
        "type": {
            "name": "section",
            "representation": "18",
            "title": "Power to make regulations.  __________________________ 19 of 1989 An Act to make provision for the licensing of persons carrying on the business of buying and selling foreign currency, and for matters connected therewith.  [13TH MARCH, 1990]  Short title.     ",
            "context": "DEALERS IN FOREIGN CURRENCY (LICENSING) ACT under Power to make regulations.  __________________________ 19 of 1989 An Act to make provision for the licensing of persons carrying on the business of buying and selling foreign currency, and for matters connected therewith.  [13TH MARCH, 1990]  Short title.     18. (1) The Bank may make regulations for carrying out the purposes of this Act.  (2) Without prejudice to the generality of the LAWS OF GUYANA Dealers in Foreign Currency (Licensing) Cap. 87:01 13  L.R.O. 1/2012                                    provisions of subsection (1), such regulations may, in particular, provide for all or any of the following matters  (a) the forms of an application for a licence and of a licence;  (b) the fees payable along with the application for a licence and for the grant of a licence;  (c) the form of an application for renewal of a licence and the fees payable therefor;  (d) the form of an application for the change of licensed premises and the fees payable along with it;   (e) the conditions of a licence;  (f) the particulars that an account to be kept by a licensee shall contain;  (g) the particulars that a return under section 15(2) shall contain;  (h) any other matter that is required to be, or may be, prescribed by or under this Act.  __________________________        LAWS OF GUYANA 14 Cap. 87:01 Dealers in Foreign Currency (Licensing)  L.R.O. 1/2012  SUBSIDIARY LEGISLATION  _________________   Nt. 2 24th May 1994 DEALERS IN FOREIGN CURRENCY (LICENSING) NOTICE  made under section 11 (2)",
            "description": [
                {
                    "representation": "(1)",
                    "description": "The Bank may make regulations for carrying out the purposes of this Act."
                },
                {
                    "representation": "(2)",
                    "description": ""
                },
                {
                    "representation": "(a)",
                    "description": "the forms of an application for a licence and of a licence;"
                },
                {
                    "representation": "(b)",
                    "description": "the fees payable along with the application for a licence and for the grant of a licence;"
                },
                {
                    "representation": "(c)",
                    "description": "the form of an application for renewal of a licence and the fees payable therefor;"
                },
                {
                    "representation": "(d)",
                    "description": "the form of an application for the change of licensed premises and the fees payable along with it;"
                },
                {
                    "representation": "(e)",
                    "description": "the conditions of a licence;"
                },
                {
                    "representation": "(f)",
                    "description": "the particulars that an account to be kept by a licensee shall contain;"
                },
                {
                    "representation": "(g)",
                    "description": "the particulars that a return under section 15(2) shall contain;"
                },
                {
                    "representation": "(h)",
                    "description": "any other matter that is required to be, or may be, prescribed by or under this Act.  __________________________        LAWS OF GUYANA 14 Cap. 87:01 Dealers in Foreign Currency"
                }
            ]
        }
    }
]