[
    {
        "act": "GUYANA EXPORT PROMOTION COUNCIL    ACT",
        "source": "https://mola.gov.gy/laws-of-guyana",
        "type": {
            "name": "section",
            "representation": "1",
            "title": "Short title. ",
            "context": "GUYANA EXPORT PROMOTION COUNCIL    ACT under Short title. 1. This Act may be cited as the Guyana Export Promotion Council Act.",
            "description": "This Act may be cited as the Guyana Export Promotion Council Act."
        }
    },
    {
        "act": "GUYANA EXPORT PROMOTION COUNCIL    ACT",
        "source": "https://mola.gov.gy/laws-of-guyana",
        "type": {
            "name": "section",
            "representation": "2",
            "title": "Interpretation. ",
            "context": "GUYANA EXPORT PROMOTION COUNCIL    ACT under Interpretation. 2. In this Act  Council means the Guyana Export Promotion Council established by section",
            "description": "In this Act  Council means the Guyana Export Promotion Council established by section"
        }
    },
    {
        "act": "GUYANA EXPORT PROMOTION COUNCIL    ACT",
        "source": "https://mola.gov.gy/laws-of-guyana",
        "type": {
            "name": "section",
            "representation": "3",
            "title": "Establishment and incorporation of Council. ",
            "context": "GUYANA EXPORT PROMOTION COUNCIL    ACT under Establishment and incorporation of Council. 3.",
            "description": "3."
        }
    },
    {
        "act": "GUYANA EXPORT PROMOTION COUNCIL    ACT",
        "source": "https://mola.gov.gy/laws-of-guyana",
        "type": {
            "name": "section",
            "representation": "4",
            "title": "Functions of Council. ",
            "context": "GUYANA EXPORT PROMOTION COUNCIL    ACT under Functions of Council. 4. (1) It shall be the function of the Council  (a) from time to time, to make recommendations and tender advice to the Minister on the formulation of national export policies and on the implementation of such policies;  (b) from time to time, to make LAWS OF GUYANA Guyana Export Promotion Council Cap. 91:11 5  L.R.O. 1/2012                              Employment of staff of Council.              Secondment or transfer of officers to recommendations and tender   advice   to   the   Minister   on practical   measures  to stimulate the export trade of the country; and  (c)   to   promote   and   enhance   the   orderly development of the export trade of the country.  (2) Subject to the provisions of this Act and to any directions given   by the   Minister,   the   Council   shall,   for   the purpose  of  the discharge of its functions under subsection (1), have power to do all such things and  engage in all such activities as are in its opinion necessary for, or conducive to the proper discharge of its functions, including (without  prejudice  to  the  generality  of the foregoing) research, training consultancy and advisory activities  and  the compilation and issue of journals, bulletins and other publications.  (3) The Minister may in writing exclude specified products from the purview of the Council.",
            "description": [
                {
                    "representation": "(1)",
                    "description": "It shall be the function of the Council"
                },
                {
                    "representation": "(a)",
                    "description": "from time to time, to make recommendations and tender advice to the Minister on the formulation of national export policies and on the implementation of such policies;"
                },
                {
                    "representation": "(b)",
                    "description": "from time to time, to make LAWS OF GUYANA Guyana Export Promotion Council Cap. 91:11 5  L.R.O. 1/2012                              Employment of staff of Council.              Secondment or transfer of officers to recommendations and tender   advice   to   the   Minister   on practical   measures  to stimulate the export trade of the country; and"
                },
                {
                    "representation": "(c)",
                    "description": "to   promote   and   enhance   the   orderly development of the export trade of the country."
                },
                {
                    "representation": "(2)",
                    "description": "Subject to the provisions of this Act and to any directions given   by the   Minister,   the   Council   shall,   for   the purpose  of  the discharge of its functions under subsection"
                },
                {
                    "representation": "(3)",
                    "description": "The Minister may in writing exclude specified products from the purview of the Council."
                }
            ]
        }
    },
    {
        "act": "GUYANA EXPORT PROMOTION COUNCIL    ACT",
        "source": "https://mola.gov.gy/laws-of-guyana",
        "type": {
            "name": "section",
            "representation": "5",
            "title": "Employment of staff of Council. ",
            "context": "GUYANA EXPORT PROMOTION COUNCIL    ACT under Employment of staff of Council. 5.  (1) The Council, with the approval of the Minister, may employ at such remuneration and on such other terms and conditions as it thinks fit (including the payment of pensions, gratuities and other like benefits by reference to the service of its officers and other employees) a Chief Executive Officer and such other officers and employees as the Council may require to carry out its functions effectively.  (2) The Council may, at any time, retain the services of experts and other professional persons and may pay such remuneration in respect thereof as the Council, with the approval of the Minister, may determine.",
            "description": [
                {
                    "representation": "(1)",
                    "description": "The Council, with the approval of the Minister, may employ at such remuneration and on such other terms and conditions as it thinks fit"
                },
                {
                    "representation": "(2)",
                    "description": "The Council may, at any time, retain the services of experts and other professional persons and may pay such remuneration in respect thereof as the Council, with the approval of the Minister, may determine."
                }
            ]
        }
    },
    {
        "act": "GUYANA EXPORT PROMOTION COUNCIL    ACT",
        "source": "https://mola.gov.gy/laws-of-guyana",
        "type": {
            "name": "section",
            "representation": "6",
            "title": "Secondment or transfer of officers to Council. ",
            "context": "GUYANA EXPORT PROMOTION COUNCIL    ACT under Secondment or transfer of officers to Council. 6. (1) Where a public officer is seconded or temporarily transferred from a pensionable office within the meaning of LAWS OF GUYANA 6 Cap. 91:11 Guyana Export Promotion Council  L.R.O. 1/2012  Council. c. 27:02                    c. 39:05    Remuneration of members.    Disclosure of interest.        Protection of persons acting under this Act. c. 5:07  Funds and resources of Council.     the Pensions Act to an office with the Council, section 5 of that Act shall apply to him as if his service with the Council were service in a public office.  (2) Where a public officer is transferred from a pensionable office to an office with the Council, his service with the Council shall be other public service within the meaning of, and for the purpose of, such provisions applicable in relation thereto as are contained in, the Pensions Act (including the Pensions Regulations 1957).  (3) Subsections (1), (2) and (3) shall, as they apply in relation to a public officer, apply mutatis mutandis in relation to a teacher to whom the Teachers Pensions Act applies and who is employed by the Council.",
            "description": [
                {
                    "representation": "(1)",
                    "description": "Where a public officer is seconded or temporarily transferred from a pensionable office within the meaning of LAWS OF GUYANA 6 Cap. 91:11 Guyana Export Promotion Council  L.R.O. 1/2012  Council. c. 27:02                    c. 39:05    Remuneration of members.    Disclosure of interest.        Protection of persons acting under this Act. c. 5:07  Funds and resources of Council.     the Pensions Act to an office with the Council, section 5 of that Act shall apply to him as if his service with the Council were service in a public office."
                },
                {
                    "representation": "(2)",
                    "description": "and"
                },
                {
                    "representation": "(3)",
                    "description": "shall, as they apply in relation to a public officer, apply mutatis mutandis in relation to a teacher to whom the Teachers Pensions Act applies and who is employed by the Council."
                }
            ]
        }
    },
    {
        "act": "GUYANA EXPORT PROMOTION COUNCIL    ACT",
        "source": "https://mola.gov.gy/laws-of-guyana",
        "type": {
            "name": "section",
            "representation": "7",
            "title": "Remuneration of members. ",
            "context": "GUYANA EXPORT PROMOTION COUNCIL    ACT under Remuneration of members. 7. There shall be paid to the members of the Council such remuneration, whether by way of salaries or travelling or other allowances, as the Minister may determine.",
            "description": "There shall be paid to the members of the Council such remuneration, whether by way of salaries or travelling or other allowances, as the Minister may determine."
        }
    },
    {
        "act": "GUYANA EXPORT PROMOTION COUNCIL    ACT",
        "source": "https://mola.gov.gy/laws-of-guyana",
        "type": {
            "name": "section",
            "representation": "8",
            "title": "Disclosure of interest. ",
            "context": "GUYANA EXPORT PROMOTION COUNCIL    ACT under Disclosure of interest. 8. It shall be the duty of a member who is in any way,  whether  directly  or  indirectly,  interested  in  any  contract  or  any other arrangement with the Council to declare the nature of his interest at a meeting of the Council and he shall not take part in any discussion of, or vote on any question relating to, the contract or other arrangement.",
            "description": "It shall be the duty of a member who is in any way,  whether  directly  or  indirectly,  interested  in  any  contract  or  any other arrangement with the Council to declare the nature of his interest at a meeting of the Council and he shall not take part in any discussion of, or vote on any question relating to, the contract or other arrangement."
        }
    },
    {
        "act": "GUYANA EXPORT PROMOTION COUNCIL    ACT",
        "source": "https://mola.gov.gy/laws-of-guyana",
        "type": {
            "name": "section",
            "representation": "9",
            "title": "Protection of persons acting under this Act. ",
            "context": "GUYANA EXPORT PROMOTION COUNCIL    ACT under Protection of persons acting under this Act. 9.  Any person acting under this Act shall be entitled to the protection afforded by the Justices Protection Act.",
            "description": "Any person acting under this Act shall be entitled to the protection afforded by the Justices Protection Act."
        }
    },
    {
        "act": "GUYANA EXPORT PROMOTION COUNCIL    ACT",
        "source": "https://mola.gov.gy/laws-of-guyana",
        "type": {
            "name": "section",
            "representation": "10",
            "title": "Funds and resources of Council. ",
            "context": "GUYANA EXPORT PROMOTION COUNCIL    ACT under Funds and resources of Council. 10.  (1) The funds and resources of the Council shall consist of  (a) such sums as may be provided by Parliament; LAWS OF GUYANA Guyana Export Promotion Council Cap. 91:11 7  L.R.O. 1/2012                              Charging of fees for service rendered.   Borrowing powers of Council.      Guarantee by Minister of Finance of borrowing by Council and repayment of sums paid to (b) revenue obtained by virtue of the provisions of section 11;  (c) such moneys or other assets as may accrue to, or vest in,  the  Council  by  way  of  grants, subsidies,  bequests, donations or gifts;  (d) sums  borrowed  by  the  Council  for  the purpose of meeting any of its obligations or discharging any of its functions;  (e) all other sums or property that may in any manner become payable to or vested in the Council in respect of any matter incidental to its powers and duties.  (2) The expenses of the Council including any remuneration of its members, officers and employees shall be paid out of the funds and resources of the Council.",
            "description": [
                {
                    "representation": "(1)",
                    "description": "The funds and resources of the Council shall consist of"
                },
                {
                    "representation": "(a)",
                    "description": "such sums as may be provided by Parliament; LAWS OF GUYANA Guyana Export Promotion Council Cap. 91:11 7  L.R.O. 1/2012                              Charging of fees for service rendered.   Borrowing powers of Council.      Guarantee by Minister of Finance of borrowing by Council and repayment of sums paid to"
                },
                {
                    "representation": "(b)",
                    "description": "revenue obtained by virtue of the provisions of section 11;"
                },
                {
                    "representation": "(c)",
                    "description": "such moneys or other assets as may accrue to, or vest in,  the  Council  by  way  of  grants, subsidies,  bequests, donations or gifts;"
                },
                {
                    "representation": "(d)",
                    "description": "sums  borrowed  by  the  Council  for  the purpose of meeting any of its obligations or discharging any of its functions;"
                },
                {
                    "representation": "(e)",
                    "description": "all other sums or property that may in any manner become payable to or vested in the Council in respect of any matter incidental to its powers and duties."
                },
                {
                    "representation": "(2)",
                    "description": "The expenses of the Council including any remuneration of its members, officers and employees shall be paid out of the funds and resources of the Council."
                }
            ]
        }
    },
    {
        "act": "GUYANA EXPORT PROMOTION COUNCIL    ACT",
        "source": "https://mola.gov.gy/laws-of-guyana",
        "type": {
            "name": "section",
            "representation": "11",
            "title": "Charging of fees for services rendered. ",
            "context": "GUYANA EXPORT PROMOTION COUNCIL    ACT under Charging of fees for services rendered. 11.  Subject to the provisions of any regulations made under section 19, the Council may, in respect of any services rendered by it under   this   Act,   charge   such   fees   or   make   such   financial arrangements as it may deem fit.",
            "description": "Subject to the provisions of any regulations made under section 19, the Council may, in respect of any services rendered by it under   this   Act,   charge   such   fees   or   make   such   financial arrangements as it may deem fit."
        }
    },
    {
        "act": "GUYANA EXPORT PROMOTION COUNCIL    ACT",
        "source": "https://mola.gov.gy/laws-of-guyana",
        "type": {
            "name": "section",
            "representation": "12",
            "title": "Borrowing powers of Council. ",
            "context": "GUYANA EXPORT PROMOTION COUNCIL    ACT under Borrowing powers of Council. 12. The Council may, with the  approval of the Minister responsible  for  finance,  borrow  any  money  required  by  it  for meeting any of its obligations or discharging any of its functions.",
            "description": "The Council may, with the  approval of the Minister responsible  for  finance,  borrow  any  money  required  by  it  for meeting any of its obligations or discharging any of its functions."
        }
    },
    {
        "act": "GUYANA EXPORT PROMOTION COUNCIL    ACT",
        "source": "https://mola.gov.gy/laws-of-guyana",
        "type": {
            "name": "section",
            "representation": "13",
            "title": "Guarantee by Minister of Finance of borrowing by Council and  repayment of sums paid to meet guarantees. ",
            "context": "GUYANA EXPORT PROMOTION COUNCIL    ACT under Guarantee by Minister of Finance of borrowing by Council and  repayment of sums paid to meet guarantees. 13. (1) With the approval of the National Assembly, the Minister responsible for finance may guarantee, in such manner and on such conditions as he may think fit, the payment of the principal and interest on any authorized borrowing of the Council. LAWS OF GUYANA 8 Cap. 91:11 Guyana Export Promotion Council  L.R.O. 1/2012  meet guarantees.                        Estimates, accounts and audit.                      (2) Where the Minister responsible for finance is satisfied that there  has  been  default  in  the  repayment  of  any  principal moneys or interest guaranteed under this section, he shall direct the repayment out of the general assets and revenues of the amount in respect of which there has been such default.  (3) The Council shall make to the Accountant General, at such  time  and  in  such  manner  as  the  Minister  responsible  for finance may direct, payments of such amounts as may be so directed in or towards repayment of any such sum issued in fulfilment of any guarantee given under this section, and payment of interest on what is outstanding for the time being in respect of any sums so issued at such rate as the Minister responsible for finance   may direct, and different rates of interest may be directed as respects  different sums and as respects interest for different periods.",
            "description": [
                {
                    "representation": "(1)",
                    "description": "With the approval of the National Assembly, the Minister responsible for finance may guarantee, in such manner and on such conditions as he may think fit, the payment of the principal and interest on any authorized borrowing of the Council. LAWS OF GUYANA 8 Cap. 91:11 Guyana Export Promotion Council  L.R.O. 1/2012  meet guarantees.                        Estimates, accounts and audit."
                },
                {
                    "representation": "(2)",
                    "description": "Where the Minister responsible for finance is satisfied that there  has  been  default  in  the  repayment  of  any  principal moneys or interest guaranteed under this section, he shall direct the repayment out of the general assets and revenues of the amount in respect of which there has been such default."
                },
                {
                    "representation": "(3)",
                    "description": "The Council shall make to the Accountant General, at such  time  and  in  such  manner  as  the  Minister  responsible  for finance may direct, payments of such amounts as may be so directed in or towards repayment of any such sum issued in fulfilment of any guarantee given under this section, and payment of interest on what is outstanding for the time being in respect of any sums so issued at such rate as the Minister responsible for finance   may direct, and different rates of interest may be directed as respects  different sums and as respects interest for different periods."
                }
            ]
        }
    },
    {
        "act": "GUYANA EXPORT PROMOTION COUNCIL    ACT",
        "source": "https://mola.gov.gy/laws-of-guyana",
        "type": {
            "name": "section",
            "representation": "14",
            "title": "Estimates, accounts and audit. ",
            "context": "GUYANA EXPORT PROMOTION COUNCIL    ACT under Estimates, accounts and audit. 14.  (1) The Council shall, in, accordance with the directions of the Minister, submit to the Minister for approval, estimates of revenue and expenditure for the ensuing financial year.  (2)  The  Council  shall  keep  proper  accounts  and  other records in respect of its operations and the accounts shall be audited annually by an auditor appointed by the Council with the approval of the Minister.  (3) All books of accounts kept by the Council shall be subject to examination and audit at any time by the Auditor General.  (4)  The  members,  officers  and  employees  of  the  Council shall grant   to the auditor appointed under subsection (2) or the Auditor General  access to all books, documents, cash and securities of the Council and shall give him on request all such information as may be within their knowledge in relation LAWS OF GUYANA Guyana Export Promotion Council Cap. 91:11 9  L.R.O. 1/2012    Report.                      Power of Minister to give directions to Council.   Exemption from taxes and duties.   Limitation provisions excluded. c. 7:02     Regulations. to the operation of the Council.",
            "description": [
                {
                    "representation": "(1)",
                    "description": "The Council shall, in, accordance with the directions of the Minister, submit to the Minister for approval, estimates of revenue and expenditure for the ensuing financial year."
                },
                {
                    "representation": "(2)",
                    "description": "or the Auditor General  access to all books, documents, cash and securities of the Council and shall give him on request all such information as may be within their knowledge in relation LAWS OF GUYANA Guyana Export Promotion Council Cap. 91:11 9  L.R.O. 1/2012    Report.                      Power of Minister to give directions to Council.   Exemption from taxes and duties.   Limitation provisions excluded. c. 7:02     Regulations. to the operation of the Council."
                },
                {
                    "representation": "(3)",
                    "description": "All books of accounts kept by the Council shall be subject to examination and audit at any time by the Auditor General."
                },
                {
                    "representation": "(4)",
                    "description": "The  members,  officers  and  employees  of  the  Council shall grant   to the auditor appointed under subsection"
                }
            ]
        }
    },
    {
        "act": "GUYANA EXPORT PROMOTION COUNCIL    ACT",
        "source": "https://mola.gov.gy/laws-of-guyana",
        "type": {
            "name": "section",
            "representation": "15",
            "title": "Report. ",
            "context": "GUYANA EXPORT PROMOTION COUNCIL    ACT under Report. 15.  (1) The Council shall not later than six months after the end   of   each   financial   year   submit   a   report   to   the   Minister containing  (a) an  account  of its  transactions  throughout the  preceding financial year in such details as the Minister may direct: and  (b) a statement  of the  accounts of the  Council audited  in accordance with section 14 (2).  (2) A copy of the report together with a copy of the auditors report shall be printed and laid before the National Assembly.",
            "description": [
                {
                    "representation": "(1)",
                    "description": "The Council shall not later than six months after the end   of   each   financial   year   submit   a   report   to   the   Minister containing"
                },
                {
                    "representation": "(a)",
                    "description": "an  account  of its  transactions  throughout the  preceding financial year in such details as the Minister may direct: and"
                },
                {
                    "representation": "(b)",
                    "description": "a statement  of the  accounts of the  Council audited  in accordance with section 14"
                },
                {
                    "representation": "(2)",
                    "description": "A copy of the report together with a copy of the auditors report shall be printed and laid before the National Assembly."
                }
            ]
        }
    },
    {
        "act": "GUYANA EXPORT PROMOTION COUNCIL    ACT",
        "source": "https://mola.gov.gy/laws-of-guyana",
        "type": {
            "name": "section",
            "representation": "16",
            "title": "Power of Minister to give directions to Council ",
            "context": "GUYANA EXPORT PROMOTION COUNCIL    ACT under Power of Minister to give directions to Council 16.  The Minister may give to the Council written directions of a general or special character as to the policy to be followed by the Council in the discharge of its functions and the Council shall give effect to those directions.",
            "description": "The Minister may give to the Council written directions of a general or special character as to the policy to be followed by the Council in the discharge of its functions and the Council shall give effect to those directions."
        }
    },
    {
        "act": "GUYANA EXPORT PROMOTION COUNCIL    ACT",
        "source": "https://mola.gov.gy/laws-of-guyana",
        "type": {
            "name": "section",
            "representation": "17",
            "title": "Exemption from taxes and duties. ",
            "context": "GUYANA EXPORT PROMOTION COUNCIL    ACT under Exemption from taxes and duties. 17.  The Council shall be exempt from the payment  of customs duty, capital gains tax, Corporation tax, income tax, property tax and purchase tax.",
            "description": "The Council shall be exempt from the payment  of customs duty, capital gains tax, Corporation tax, income tax, property tax and purchase tax."
        }
    },
    {
        "act": "GUYANA EXPORT PROMOTION COUNCIL    ACT",
        "source": "https://mola.gov.gy/laws-of-guyana",
        "type": {
            "name": "section",
            "representation": "18",
            "title": "Limitation provisions excluded. ",
            "context": "GUYANA EXPORT PROMOTION COUNCIL    ACT under Limitation provisions excluded. 18. The Limitation Act shall not apply to proceedings instituted by the Council for the recovery of money due to the Council or any other property to which a claim is made by the Council.",
            "description": "The Limitation Act shall not apply to proceedings instituted by the Council for the recovery of money due to the Council or any other property to which a claim is made by the Council."
        }
    },
    {
        "act": "GUYANA EXPORT PROMOTION COUNCIL    ACT",
        "source": "https://mola.gov.gy/laws-of-guyana",
        "type": {
            "name": "section",
            "representation": "19",
            "title": "Regulations.                       SCHEDULE  __________________________           LAWS OF GUYANA 4 Cap. 91:11 Guyana Export Promotion Council  L.R.O. 1/2012     CHAPTER 91:11    GUYANA EXPORT PROMOTION COUNCIL    3 of 1983 An Act to establish the Guyana Export Promotion Council to promote export trade in Guyana.  [9TH  APRIL, 1983]   Short title.    Interpretation.       Establishment and incorpora- tion of Council.      Schedule.    Functions of Council.          ",
            "context": "GUYANA EXPORT PROMOTION COUNCIL    ACT under Regulations.                       SCHEDULE  __________________________           LAWS OF GUYANA 4 Cap. 91:11 Guyana Export Promotion Council  L.R.O. 1/2012     CHAPTER 91:11    GUYANA EXPORT PROMOTION COUNCIL    3 of 1983 An Act to establish the Guyana Export Promotion Council to promote export trade in Guyana.  [9TH  APRIL, 1983]   Short title.    Interpretation.       Establishment and incorpora- tion of Council.      Schedule.    Functions of Council.          19.  The Minister may, after consultation with the Chairman of the Council, make regulations for the carrying out of the provisions of this Act.   LAWS OF GUYANA 10 Cap. 91:11 Guyana Export Promotion Council  L.R.O. 1/2012  SCHEDULE",
            "description": "The Minister may, after consultation with the Chairman of the Council, make regulations for the carrying out of the provisions of this Act.   LAWS OF GUYANA 10 Cap. 91:11 Guyana Export Promotion Council  L.R.O. 1/2012  SCHEDULE"
        }
    }
]