[
    {
        "act": "PETROLEUM ACT",
        "source": "https://mola.gov.gy/laws-of-guyana",
        "type": {
            "name": "section",
            "representation": "",
            "title": "0.5\u201d ",
            "context": "PETROLEUM ACT under 0.5 0.375 10 I.W.G.",
            "description": "0.375 10 I.W.G."
        }
    },
    {
        "act": "PETROLEUM ACT",
        "source": "https://mola.gov.gy/laws-of-guyana",
        "type": {
            "name": "section",
            "representation": "1",
            "title": "Short title. ",
            "context": "PETROLEUM ACT under Short title. 1.  This Act may be cited as the Petroleum Act.  CHAPTER 92:01 PETROLEUM ACT LAWS OF GUYANA Petroleum Cap. 92:01 5  L.R.O. 1/2012   Interpretation.     c. 82:24                                      Mooring,",
            "description": "This Act may be cited as the Petroleum Act.  CHAPTER 92:01 PETROLEUM ACT LAWS OF GUYANA Petroleum Cap. 92:01 5  L.R.O. 1/2012   Interpretation.     c. 82:24                                      Mooring,"
        }
    },
    {
        "act": "PETROLEUM ACT",
        "source": "https://mola.gov.gy/laws-of-guyana",
        "type": {
            "name": "section",
            "representation": "2",
            "title": "Interpretation.  IMPORTATION  ",
            "context": "PETROLEUM ACT under Interpretation.  IMPORTATION  2.  (1) In this Act which is less than eighty-five degrees Fahrenheit ascertained as prescribed in section 13, methylated spirits within the meaning of the Spirits Act,  ether,   carbon  bisulphide  or  any  product  or  mixture containing  methylated spirits, ether or carbon bisulphide, and carbide of calcium;  licensed building means any building, tank with pipe lines or other erection in respect of which the Chief Fire Officer has issued a licence for the storage of petroleum under section 6;  ordinary   petroleum   means   petroleum   other   than   dangerous petroleum;  petroleum includes crude petroleum, oil made from petroleum or from coal, shale, peat or other bituminous substance or any other product of petroleum, methylated spirits within the meaning of the Spirits Act,  ether, carbon bisulphide and any product or mixture containing any of them, and carbide of calcium; and  warehouse means any place or building provided by the Minister for the storage of petroleum under section 6(1).  (2) The Minister may by order declare that the provisions of this Act relating to petroleum, or any of them, shall apply to such other inflammable liquid or substance as may be specified in such order, subject to any modifications as may be prescribed therein.   IMPORTATION",
            "description": [
                {
                    "representation": "(1)",
                    "description": "In this Act which is less than eighty-five degrees Fahrenheit ascertained as prescribed in section 13, methylated spirits within the meaning of the Spirits Act,  ether,   carbon  bisulphide  or  any  product  or  mixture containing  methylated spirits, ether or carbon bisulphide, and carbide of calcium;  licensed building means any building, tank with pipe lines or other erection in respect of which the Chief Fire Officer has issued a licence for the storage of petroleum under section 6;  ordinary   petroleum   means   petroleum   other   than   dangerous petroleum;  petroleum includes crude petroleum, oil made from petroleum or from coal, shale, peat or other bituminous substance or any other product of petroleum, methylated spirits within the meaning of the Spirits Act,  ether, carbon bisulphide and any product or mixture containing any of them, and carbide of calcium; and  warehouse means any place or building provided by the Minister for the storage of petroleum under section 6(1)."
                },
                {
                    "representation": "(2)",
                    "description": "The Minister may by order declare that the provisions of this Act relating to petroleum, or any of them, shall apply to such other inflammable liquid or substance as may be specified in such order, subject to any modifications as may be prescribed therein.   IMPORTATION"
                }
            ]
        }
    },
    {
        "act": "PETROLEUM ACT",
        "source": "https://mola.gov.gy/laws-of-guyana",
        "type": {
            "name": "section",
            "representation": "3",
            "title": "Mooring, loading   and discharging of craft with petroleum on board. ",
            "context": "PETROLEUM ACT under Mooring, loading   and discharging of craft with petroleum on board. 3.  (1) The master of any craft with a cargo consisting [44 of 1952                   dangerous petroleum means petroleum having a flash point \"Commissioner-General\" means the Commissioner-General of  Authority Act;the Revenue Authority appointed under the Revenue 12 of 1982]c. LAWS OF GUYANA 6 Cap. 92:01 Petroleum   L.R.O. 1/2012  loading and petroleum on board.                             Removal of petroleum after landing. [44 of 1952 4 of 1972]           wholly or in part of petroleum, shall from the time such craft enters any port in Guyana, or from the time any petroleum is placed on board of such craft until it goes out to sea or until the petroleum is removed from on board, conform to such directions in respect of the place at which it is to be moored, loaded or discharged as may be issued generally for all such craft or  (2) If any such craft is moored, loaded discharged at any place in contravention of any such directions, the owner and master of such craft shall each be liable to a fine of seven hundred and fifty dollars, and it shall be lawful for the Harbour cause such craft to be removed at the expense of the owner or master thereof, to such place as may be in conformity with such directions, and all expenses incurred in such removal  may be  (3) This section shall not apply to petroleum contained in the supply tanks or bunkers of craft the motive power of which is obtained from petroleum.",
            "description": [
                {
                    "representation": "(1)",
                    "description": "The master of any craft with a cargo consisting [44 of 1952                   dangerous petroleum means petroleum having a flash point \"Commissioner-General\" means the Commissioner-General of  Authority Act;the Revenue Authority appointed under the Revenue 12 of 1982]c. LAWS OF GUYANA 6 Cap. 92:01 Petroleum   L.R.O. 1/2012  loading and petroleum on board.                             Removal of petroleum after landing. [44 of 1952 4 of 1972]           wholly or in part of petroleum, shall from the time such craft enters any port in Guyana, or from the time any petroleum is placed on board of such craft until it goes out to sea or until the petroleum is removed from on board, conform to such directions in respect of the place at which it is to be moored, loaded or discharged as may be issued generally for all such craft or"
                },
                {
                    "representation": "(2)",
                    "description": "If any such craft is moored, loaded discharged at any place in contravention of any such directions, the owner and master of such craft shall each be liable to a fine of seven hundred and fifty dollars, and it shall be lawful for the Harbour cause such craft to be removed at the expense of the owner or master thereof, to such place as may be in conformity with such directions, and all expenses incurred in such removal  may be"
                },
                {
                    "representation": "(3)",
                    "description": "This section shall not apply to petroleum contained in the supply tanks or bunkers of craft the motive power of which is obtained from petroleum."
                }
            ]
        }
    },
    {
        "act": "PETROLEUM ACT",
        "source": "https://mola.gov.gy/laws-of-guyana",
        "type": {
            "name": "section",
            "representation": "4",
            "title": "Removal of petroleum after landing. ",
            "context": "PETROLEUM ACT under Removal of petroleum after landing. 4.  (l) Subject to subsections (2) and (3), all petroleum imported into Guyana shall, on being landed, be removed immediately by the importer from the wharf and shall be stored in a warehouse or licensed building:  Provided that this section shall not apply to petroleum landed for immediate transit from the port of arrival to other places in Guyana, or to petroleum transferred to another vessel.  (2) Ordinary petroleum imported into Guyana and having a flash point exceeding one hundred and fifty degrees of craft with discharging specially for  any such craft by the Harbour Master, Commissioner- General or other proper officer of the port. Master, Commissioner-General or  other officer as  aforesaid to sued for and recovered  by the  Harbour  Master, Commissioner- General or other officer against such owner or master. LAWS OF GUYANA Petroleum Cap. 92:01 7  L.R.O. 1/2012                       Conditions  of keeping petroleum. [44 of 1952 4 of 1972 12 of 1982]                      Fahrenheit shall on being landed, be removed immediately by the importer from the wharf and  shall  be stored in a building licensed for storing such petroleum.  ordinary petroleum having a flash point exceeding one  hundred and fifty degrees Fahrenheit is discharged  after  three of the clock in the afternoon, allow such ordinary petroleum to remain on the wharf at which it was discharged until the morning of the next day, when it shall be immediately removed and stored as in this section provided.  (4) Any person contravening any of the   provisions of this section shall be liable on summary conviction to a fine of three hundred dollars.",
            "description": [
                {
                    "representation": "(l)",
                    "description": "Subject to subsections"
                },
                {
                    "representation": "(2)",
                    "description": "Ordinary petroleum imported into Guyana and having a flash point exceeding one hundred and fifty degrees of craft with discharging specially for  any such craft by the Harbour Master, Commissioner- General or other proper officer of the port. Master, Commissioner-General or  other officer as  aforesaid to sued for and recovered  by the  Harbour  Master, Commissioner- General or other officer against such owner or master. LAWS OF GUYANA Petroleum Cap. 92:01 7  L.R.O. 1/2012                       Conditions  of keeping petroleum. [44 of 1952 4 of 1972 12 of 1982]                      Fahrenheit shall on being landed, be removed immediately by the importer from the wharf and  shall  be stored in a building licensed for storing such petroleum.  ordinary petroleum having a flash point exceeding one  hundred and fifty degrees Fahrenheit is discharged  after  three of the clock in the afternoon, allow such ordinary petroleum to remain on the wharf at which it was discharged until the morning of the next day, when it shall be immediately removed and stored as in this section provided."
                },
                {
                    "representation": "(4)",
                    "description": "Any person contravening any of the   provisions of this section shall be liable on summary conviction to a fine of three hundred dollars."
                }
            ]
        }
    },
    {
        "act": "PETROLEUM ACT",
        "source": "https://mola.gov.gy/laws-of-guyana",
        "type": {
            "name": "section",
            "representation": "5",
            "title": "Conditions of keeping petroleum.   STORAGE  ",
            "context": "PETROLEUM ACT under Conditions of keeping petroleum.   STORAGE  5.  (1) Except as otherwise provided in this Act, no person shall keep   (a) carbide of calcium in any quantity exceeding five pounds; or   (b) dangerous petroleum (other than carbide of calcium) in any quantity exceeding one gallon;   (c) ordinary   petroleum  in  any  quantity  exceeding  one hundred gallons, in   any place other than a warehouse or licensed building:   Provided that the Chief Fire Officer may authorise any fit and proper person in writing to keep for sale in any store, by (3) The  Commissioner-General     maywhenever  LAWS OF GUYANA 8 Cap. 92:01 Petroleum   L.R.O. 1/2012                                   Petroleum warehouses  and licensed buildings.  [19 of 1932 12 of 1982]         him, ordinary petroleum in any quantity not exceeding one thousand five hundred gallons.  (2) Any person who keeps dangerous petroleum or ordinary petroleum otherwise than in accordance with this section, and the occupier of any premises wherein such petroleum is so kept, shall be liable on summary conviction to a fine of three hundred dollars and the petroleum shall be forfeited.                    (3) This section shall not apply to  (a) petroleum   for the time being contained in the tank of any motor vehicle, motor vessel or boat;  (b) petroleum being transported in accordance with this Act; or  (c) methylated spirits in any quantity not exceeding four gallons where kept by a registered chemist and druggist.   STORAGE",
            "description": [
                {
                    "representation": "(1)",
                    "description": "Except as otherwise provided in this Act, no person shall keep"
                },
                {
                    "representation": "(a)",
                    "description": "petroleum   for the time being contained in the tank of any motor vehicle, motor vessel or boat;"
                },
                {
                    "representation": "(b)",
                    "description": "petroleum being transported in accordance with this Act; or"
                },
                {
                    "representation": "(c)",
                    "description": "methylated spirits in any quantity not exceeding four gallons where kept by a registered chemist and druggist.   STORAGE"
                },
                {
                    "representation": "(3)",
                    "description": "This section shall not apply to"
                },
                {
                    "representation": "(2)",
                    "description": "Any person who keeps dangerous petroleum or ordinary petroleum otherwise than in accordance with this section, and the occupier of any premises wherein such petroleum is so kept, shall be liable on summary conviction to a fine of three hundred dollars and the petroleum shall be forfeited."
                }
            ]
        }
    },
    {
        "act": "PETROLEUM ACT",
        "source": "https://mola.gov.gy/laws-of-guyana",
        "type": {
            "name": "section",
            "representation": "6",
            "title": "Petroleum warehouses and licensed buildings. ",
            "context": "PETROLEUM ACT under Petroleum warehouses and licensed buildings. 6. (1) The Minister may from time to time provide a warehouse in the City of Georgetown, the town of New Amsterdam, and any other place or places for the storage of petroleum and may provide a separate warehouse for the storage of dangerous petroleum.  (2) Each   warehouse   shall   be   under   the   charge   Minister may from time to time appoint.  (3) The Chief Fire Officer may issue to any person of   the Commissioner-General  or   such other officer as the LAWS OF GUYANA Petroleum Cap. 92:01 9  L.R.O. 1/2012                             Making and packing of petroleum.  [19 of 1932]              Hours of delivery. [19 of 1932]  applying therefor a licence authorising him to use any building, tank with pipe- lines, or other erection for the storage of petroleum, and such licence shall   specify   the time it shall remain in force, and the maximum quantity and kind or kinds of petroleum that may be stored within such building, tank or other erection. The Chief Fire Officer may at any time renew such licence.  (4) The Chief Fire Officer may for any cause which he may deem sufficient refuse to issue a licence, or revoke or suspend any licence already issued.  (5) No licence shall be transferred without the previous consent in writing of the Chief Fire Officer.  (6) A licensed building shall be under the charge of the licensee, who will be held responsible for the carrying out in relation thereto of the provisions of this Act.  (7) For every original licence so issued a fee of five dollars shall be paid.",
            "description": [
                {
                    "representation": "(1)",
                    "description": "The Minister may from time to time provide a warehouse in the City of Georgetown, the town of New Amsterdam, and any other place or places for the storage of petroleum and may provide a separate warehouse for the storage of dangerous petroleum."
                },
                {
                    "representation": "(2)",
                    "description": "Each   warehouse   shall   be   under   the   charge   Minister may from time to time appoint."
                },
                {
                    "representation": "(3)",
                    "description": "The Chief Fire Officer may issue to any person of   the Commissioner-General  or   such other officer as the LAWS OF GUYANA Petroleum Cap. 92:01 9  L.R.O. 1/2012                             Making and packing of petroleum.  [19 of 1932]              Hours of delivery. [19 of 1932]  applying therefor a licence authorising him to use any building, tank with pipe- lines, or other erection for the storage of petroleum, and such licence shall   specify   the time it shall remain in force, and the maximum quantity and kind or kinds of petroleum that may be stored within such building, tank or other erection. The Chief Fire Officer may at any time renew such licence."
                },
                {
                    "representation": "(4)",
                    "description": "The Chief Fire Officer may for any cause which he may deem sufficient refuse to issue a licence, or revoke or suspend any licence already issued."
                },
                {
                    "representation": "(5)",
                    "description": "No licence shall be transferred without the previous consent in writing of the Chief Fire Officer."
                },
                {
                    "representation": "(6)",
                    "description": "A licensed building shall be under the charge of the licensee, who will be held responsible for the carrying out in relation thereto of the provisions of this Act."
                },
                {
                    "representation": "(7)",
                    "description": "For every original licence so issued a fee of five dollars shall be paid."
                }
            ]
        }
    },
    {
        "act": "PETROLEUM ACT",
        "source": "https://mola.gov.gy/laws-of-guyana",
        "type": {
            "name": "section",
            "representation": "7",
            "title": "Marking and packing of petroleum. ",
            "context": "PETROLEUM ACT under Marking and packing of petroleum. 7. (1) Each lot of dangerous petroleum or ordinary petroleum stored in a warehouse or licensed building shall be stored separately, and shall have a distinguishing mark and be so packed that an account may be taken of the same as often as may be deemed necessary or expedient.  (2) The owner of petroleum in a warehouse, or his agent, shall have free access to the warehouse during such hours as the warehouse may be open for the receipt or delivery of petroleum, to examine and inspect the same, and subject to any regulations made under section 26, to take all necessary precautions for preventing leakage and waste.",
            "description": [
                {
                    "representation": "(1)",
                    "description": "Each lot of dangerous petroleum or ordinary petroleum stored in a warehouse or licensed building shall be stored separately, and shall have a distinguishing mark and be so packed that an account may be taken of the same as often as may be deemed necessary or expedient."
                },
                {
                    "representation": "(2)",
                    "description": "The owner of petroleum in a warehouse, or his agent, shall have free access to the warehouse during such hours as the warehouse may be open for the receipt or delivery of petroleum, to examine and inspect the same, and subject to any regulations made under section 26, to take all necessary precautions for preventing leakage and waste."
                }
            ]
        }
    },
    {
        "act": "PETROLEUM ACT",
        "source": "https://mola.gov.gy/laws-of-guyana",
        "type": {
            "name": "section",
            "representation": "8",
            "title": "Hours of delivery. ",
            "context": "PETROLEUM ACT under Hours of delivery. 8.  (1) Petroleum shall not be received into or delivered from any licensed building except between the hours of six oclock in the forenoon and six oclock in the afternoon, except LAWS OF GUYANA 10 Cap. 92:01 Petroleum   L.R.O. 1/2012                    Prohibition  of naked  light,  etc. or  smoking in any warehouse or licensed building. [19 of 1932]              Use of petroleum in machines.  [19 of 1932 12 of 1982]     with the permission of the person in charge of the nearest police station:  Provided that this subsection shall not apply to petroleum required for the bona fide locomotion of vehicles and delivered by means of a sealed   pipe-line,  so controlled  that  it  is unnecessary  to  open the enclosure in which the storage receptacles are situated.  (2) If any petroleum is received or delivered contrary to this section, the licensee of such building shall be liable to a fine of one thousand five hundred dollars.",
            "description": [
                {
                    "representation": "(1)",
                    "description": "Petroleum shall not be received into or delivered from any licensed building except between the hours of six oclock in the forenoon and six oclock in the afternoon, except LAWS OF GUYANA 10 Cap. 92:01 Petroleum   L.R.O. 1/2012                    Prohibition  of naked  light,  etc. or  smoking in any warehouse or licensed building. [19 of 1932]              Use of petroleum in machines.  [19 of 1932 12 of 1982]     with the permission of the person in charge of the nearest police station:  Provided that this subsection shall not apply to petroleum required for the bona fide locomotion of vehicles and delivered by means of a sealed   pipe-line,  so controlled  that  it  is unnecessary  to  open the enclosure in which the storage receptacles are situated."
                },
                {
                    "representation": "(2)",
                    "description": "If any petroleum is received or delivered contrary to this section, the licensee of such building shall be liable to a fine of one thousand five hundred dollars."
                }
            ]
        }
    },
    {
        "act": "PETROLEUM ACT",
        "source": "https://mola.gov.gy/laws-of-guyana",
        "type": {
            "name": "section",
            "representation": "9",
            "title": "Prohibition of naked light, etc., or smoking in any warehouse or licensed building. ",
            "context": "PETROLEUM ACT under Prohibition of naked light, etc., or smoking in any warehouse or licensed building. 9.  (1) No lighted candle, lamp, lantern or naked light of any kind, no   match, no article of an explosive or highly inflammable nature, other   than petroleum, shall under any pretence or for any purpose whatever be taken into or dangerously near any licensed building, warehouse, or vehicle used for the hawking of petroleum; and no wire as a fixture or as a wandering lead used as a conductor for electricity shall be so taken into any licensed building or warehouse.  (2) No   person   shall   under   any   circumstances   smoke in or dangerously near any licensed building, warehouse, or vehicle used for the hawking of petroleum.  (3) Any   person   contravening   any   of   the   provisions of this section shall be liable to a fine of one thousand five hundred dollars or to imprisonment for six months.",
            "description": [
                {
                    "representation": "(1)",
                    "description": "No lighted candle, lamp, lantern or naked light of any kind, no   match, no article of an explosive or highly inflammable nature, other   than petroleum, shall under any pretence or for any purpose whatever be taken into or dangerously near any licensed building, warehouse, or vehicle used for the hawking of petroleum; and no wire as a fixture or as a wandering lead used as a conductor for electricity shall be so taken into any licensed building or warehouse."
                },
                {
                    "representation": "(2)",
                    "description": "No   person   shall   under   any   circumstances   smoke in or dangerously near any licensed building, warehouse, or vehicle used for the hawking of petroleum."
                },
                {
                    "representation": "(3)",
                    "description": "Any   person   contravening   any   of   the   provisions of this section shall be liable to a fine of one thousand five hundred dollars or to imprisonment for six months."
                }
            ]
        }
    },
    {
        "act": "PETROLEUM ACT",
        "source": "https://mola.gov.gy/laws-of-guyana",
        "type": {
            "name": "section",
            "representation": "10",
            "title": "Use of petroleum in machines.    HAWKING  ",
            "context": "PETROLEUM ACT under Use of petroleum in machines.    HAWKING  10. (1) No person shall use a machine for the manufacture of gas from petroleum or which uses petroleum as fuel unless and until the Chief Fire Officer has issued to him on application therefor a licence to have upon the   premises described in such licence any quantity of petroleum, not exceeding a limit to be specified in the licence to be used in connection   with such machine. Such licence shall not be granted unless it appears to the Chief Fire Officer that the use of LAWS OF GUYANA Petroleum Cap. 92:01 11  L.R.O. 1/2012                                         Permission  to hawk petroleum.       such machine is unattended with  material risk or danger, and that the premises in which such machine is kept are so situated and constructed as to be consistent with public safety.  (2) Every such licence shall contain a full description of the machine intended to be used and of the premises where it is situated, and shall specify the time during which the licence is to be in force.  (3) There may be annexed to any such licence any conditions as to the time of use of the machine, the mode or manner in which the petroleum is to be stored, and any other matters which the Chief Fire Officer may think necessary for diminishing the risk from explosion or fire, and the premises so licensed shall be subject to similar control and inspection as any licensed building under this Act.  (4) Any licensee who violates any condition of a licence issued under this section may have his licence forfeited, and shall be liable to a fine of seven hundred and fifty dollars:  Provided that in any proceedings hereunder in computing the quantity of petroleum which the licensee is authorised by the licence to have and use upon his premises, the quantity contained in the machine in respect of which the licence is granted shall be excluded from the computation, unless the quantity of petroleum contained in any such machine exceeds the limit specified in the licence.  HAWKING",
            "description": [
                {
                    "representation": "(1)",
                    "description": "No person shall use a machine for the manufacture of gas from petroleum or which uses petroleum as fuel unless and until the Chief Fire Officer has issued to him on application therefor a licence to have upon the   premises described in such licence any quantity of petroleum, not exceeding a limit to be specified in the licence to be used in connection   with such machine. Such licence shall not be granted unless it appears to the Chief Fire Officer that the use of LAWS OF GUYANA Petroleum Cap. 92:01 11  L.R.O. 1/2012                                         Permission  to hawk petroleum.       such machine is unattended with  material risk or danger, and that the premises in which such machine is kept are so situated and constructed as to be consistent with public safety."
                },
                {
                    "representation": "(2)",
                    "description": "Every such licence shall contain a full description of the machine intended to be used and of the premises where it is situated, and shall specify the time during which the licence is to be in force."
                },
                {
                    "representation": "(3)",
                    "description": "There may be annexed to any such licence any conditions as to the time of use of the machine, the mode or manner in which the petroleum is to be stored, and any other matters which the Chief Fire Officer may think necessary for diminishing the risk from explosion or fire, and the premises so licensed shall be subject to similar control and inspection as any licensed building under this Act."
                },
                {
                    "representation": "(4)",
                    "description": "Any licensee who violates any condition of a licence issued under this section may have his licence forfeited, and shall be liable to a fine of seven hundred and fifty dollars:  Provided that in any proceedings hereunder in computing the quantity of petroleum which the licensee is authorised by the licence to have and use upon his premises, the quantity contained in the machine in respect of which the licence is granted shall be excluded from the computation, unless the quantity of petroleum contained in any such machine exceeds the limit specified in the licence.  HAWKING"
                }
            ]
        }
    },
    {
        "act": "PETROLEUM ACT",
        "source": "https://mola.gov.gy/laws-of-guyana",
        "type": {
            "name": "section",
            "representation": "11",
            "title": "Permission to hawk petroleum.  TESTING O F   PETROLEUM  ",
            "context": "PETROLEUM ACT under Permission to hawk petroleum.  TESTING O F   PETROLEUM  11.  (1) Any person who is licensed in pursuance of section 6(3) may, subject to this Act and any enactments for the time being in force with respect to hawkers and pedlars, hawk such petroleum by himself or his servants.  (2) The petroleum   shall   be   stored   in   the   licensed building between the hours of six oclock in the afternoon of one day and six oclock in the forenoon of the LAWS OF GUYANA 12 Cap. 92:01 Petroleum   L.R.O. 1/2012               Persons authorised  to test petroleum.        Mode of determining temperature. Second Schedule.               following day and also when the petroleum is not in the course of being hawked.  (3) Any person contravening any of the   provisions of this section shall be liable to a fine of three hundred dollars.   TESTING  OF PETROLEUM",
            "description": [
                {
                    "representation": "(1)",
                    "description": "Any person who is licensed in pursuance of section 6(3) may, subject to this Act and any enactments for the time being in force with respect to hawkers and pedlars, hawk such petroleum by himself or his servants."
                },
                {
                    "representation": "(2)",
                    "description": "The petroleum   shall   be   stored   in   the   licensed building between the hours of six oclock in the afternoon of one day and six oclock in the forenoon of the LAWS OF GUYANA 12 Cap. 92:01 Petroleum   L.R.O. 1/2012               Persons authorised  to test petroleum.        Mode of determining temperature. Second Schedule.               following day and also when the petroleum is not in the course of being hawked."
                },
                {
                    "representation": "(3)",
                    "description": "Any person contravening any of the   provisions of this section shall be liable to a fine of three hundred dollars.   TESTING  OF PETROLEUM"
                }
            ]
        }
    },
    {
        "act": "PETROLEUM ACT",
        "source": "https://mola.gov.gy/laws-of-guyana",
        "type": {
            "name": "section",
            "representation": "12",
            "title": "Persons authorised to test petroleum. ",
            "context": "PETROLEUM ACT under Persons authorised to test petroleum. 12. (1) The Government Analyst and every assistant government analyst are hereby authorised to test Petroleum.  (2) The Minister may in addition appoint fit and proper persons as authorised to test petroleum and may at any time revoke any such appointment and shall cause to be published in the Gazette notice of every such appointment and revocation.",
            "description": [
                {
                    "representation": "(1)",
                    "description": "The Government Analyst and every assistant government analyst are hereby authorised to test Petroleum."
                },
                {
                    "representation": "(2)",
                    "description": "The Minister may in addition appoint fit and proper persons as authorised to test petroleum and may at any time revoke any such appointment and shall cause to be published in the Gazette notice of every such appointment and revocation."
                }
            ]
        }
    },
    {
        "act": "PETROLEUM ACT",
        "source": "https://mola.gov.gy/laws-of-guyana",
        "type": {
            "name": "section",
            "representation": "13",
            "title": "Mode of determining temperature.   LAWS OF GUYANA 4 Cap. 92:01 Petroleum   L.R.O. 1/2012  SECTION  ",
            "context": "PETROLEUM ACT under Mode of determining temperature.   LAWS OF GUYANA 4 Cap. 92:01 Petroleum   L.R.O. 1/2012  SECTION  13. (1) The temperature at which petroleum gives off inflammable vapour shall, for the purposes of this Act, be ascertained  (a) in the manner set forth in the Second Schedule; or  (b) in  such  manner  as  may  from  time  to  time  be prescribed by the Minister by order.  (2) A model of any apparatus to be used in such ascertainment shall be kept at the Government Laboratory at Georgetown.  either from the ships manifest or in any other manner, that any vessel entering any port in Guyana, is laden or partly laden with petroleum for importation, he shall cause not less than three of samples for and procuring petroleum of arrival of Notification",
            "description": [
                {
                    "representation": "(1)",
                    "description": "The temperature at which petroleum gives off inflammable vapour shall, for the purposes of this Act, be ascertained"
                },
                {
                    "representation": "(a)",
                    "description": "in the manner set forth in the Second Schedule; or"
                },
                {
                    "representation": "(b)",
                    "description": "in  such  manner  as  may  from  time  to  time  be prescribed by the Minister by order."
                },
                {
                    "representation": "(2)",
                    "description": "A model of any apparatus to be used in such ascertainment shall be kept at the Government Laboratory at Georgetown.  either from the ships manifest or in any other manner, that any vessel entering any port in Guyana, is laden or partly laden with petroleum for importation, he shall cause not less than three of samples for and procuring petroleum of arrival of Notification"
                }
            ]
        }
    },
    {
        "act": "PETROLEUM ACT",
        "source": "https://mola.gov.gy/laws-of-guyana",
        "type": {
            "name": "section",
            "representation": "14",
            "title": "Notification of arrival of petroleum and procuring of samples for testing. ",
            "context": "PETROLEUM ACT under Notification of arrival of petroleum and procuring of samples for testing. 14.  As soon  as  the Commissioner-General  ascertains, LAWS OF GUYANA Petroleum Cap. 92:01 13  L.R.O. 1/2012 testing.      Testing   and certifying   of samples. [19 of 1932]  First Schedule.    Effect of certificate as to kind of petroleum. [19 of 1932]      Testing and certifying of petroleum in warehouse  or licensed building. [19 of 1932]                   samples to be taken of each brand or quality of such petroleum, and shall transmit such samples to a person authorised to test petroleum in order that the same may be tested.",
            "description": "As soon  as  the Commissioner-General  ascertains, LAWS OF GUYANA Petroleum Cap. 92:01 13  L.R.O. 1/2012 testing.      Testing   and certifying   of samples. [19 of 1932]  First Schedule.    Effect of certificate as to kind of petroleum. [19 of 1932]      Testing and certifying of petroleum in warehouse  or licensed building. [19 of 1932]                   samples to be taken of each brand or quality of such petroleum, and shall transmit such samples to a person authorised to test petroleum in order that the same may be tested."
        }
    },
    {
        "act": "PETROLEUM ACT",
        "source": "https://mola.gov.gy/laws-of-guyana",
        "type": {
            "name": "section",
            "representation": "15",
            "title": "Testing and certifying of samples. ",
            "context": "PETROLEUM ACT under Testing and certifying of samples. 15. Within twenty-four hours (public holidays excepted) of the receipt of such samples, the person authorised shall test the samples so tested by him consist of dangerous petroleum or ordinary petroleum, as the case may be.  do so, forward one copy of the certificate to the owner of the petroleum from which  the samples have been taken, and such petroleum shall be considered to all intents and purposes, to be dangerous petroleum or ordinary petroleum,  as the case may be, unless a certificate to the contrary  is  obtained  later  or  the  contrary  is  proved in  any legal proceedings.",
            "description": "Within twenty-four hours (public holidays excepted) of the receipt of such samples, the person authorised shall test the samples so tested by him consist of dangerous petroleum or ordinary petroleum, as the case may be.  do so, forward one copy of the certificate to the owner of the petroleum from which  the samples have been taken, and such petroleum shall be considered to all intents and purposes, to be dangerous petroleum or ordinary petroleum,  as the case may be, unless a certificate to the contrary  is  obtained  later  or  the  contrary  is  proved in  any legal proceedings."
        }
    },
    {
        "act": "PETROLEUM ACT",
        "source": "https://mola.gov.gy/laws-of-guyana",
        "type": {
            "name": "section",
            "representation": "16",
            "title": "Effect of certificate as to kind of petroleum ",
            "context": "PETROLEUM ACT under Effect of certificate as to kind of petroleum 16. The Commissioner-General  shall when requested to LAWS OF GUYANA 14 Cap. 92:01 Petroleum   L.R.O. 1/2012     First Schedule.            Certificate of evidence.  First Schedule.                  Seizure of petroleum  kept in  of the Act.      Issuing of  (4) On receipt of any such receptacle the person authorised shall test the petroleum in the receptacle and shall certify in duplicate in the form in the First Schedule   whether such petroleum is dangerous petroleum or ordinary   petroleum. The officer in charge of the warehouse or other person as aforesaid shall forward one copy of the certificate to the owner of the petroleum or the licensee of the building from which such samples have been taken, and such petroleum shall be considered to all intents and purposes to be dangerous petroleum or ordinary petroleum, as the case may be.",
            "description": [
                {
                    "representation": "(4)",
                    "description": "On receipt of any such receptacle the person authorised shall test the petroleum in the receptacle and shall certify in duplicate in the form in the First Schedule   whether such petroleum is dangerous petroleum or ordinary   petroleum. The officer in charge of the warehouse or other person as aforesaid shall forward one copy of the certificate to the owner of the petroleum or the licensee of the building from which such samples have been taken, and such petroleum shall be considered to all intents and purposes to be dangerous petroleum or ordinary petroleum, as the case may be."
                }
            ]
        }
    },
    {
        "act": "PETROLEUM ACT",
        "source": "https://mola.gov.gy/laws-of-guyana",
        "type": {
            "name": "section",
            "representation": "17",
            "title": "Testing and certifying of petroleum in warehouse or licensed building. ",
            "context": "PETROLEUM ACT under Testing and certifying of petroleum in warehouse or licensed building. 17. (1) It shall be lawful for the officer in charge of a petroleum warehouse to cause samples to be taken of any petroleum kept in such warehouse, and for any officer of Customs, district commissioner, or member of the police force or for any other person appointed for that purpose by the Minister, at any reasonable time during the day to enter any other premises and to inspect and take samples of any petroleum kept on such premises or offered or exposed for sale therein and to submit such samples to a person authorised to test petroleum.  (2) Where a sample of petroleum is taken under this section, the person taking the sample shall then and there divide it into three parts and place each part in a separate receptacle marked and sealed.  (3) He shall then deliver or cause to be delivered one of such receptacles to the owner of the petroleum and another to a person authorised  to  test  petroleum  and  shall  keep  the  third  for  future comparison and production in court, if necessary. the same, and shall certify in duplicate to the Commissioner-  General, in the form contained in the First  Schedule, whether",
            "description": [
                {
                    "representation": "(1)",
                    "description": "It shall be lawful for the officer in charge of a petroleum warehouse to cause samples to be taken of any petroleum kept in such warehouse, and for any officer of Customs, district commissioner, or member of the police force or for any other person appointed for that purpose by the Minister, at any reasonable time during the day to enter any other premises and to inspect and take samples of any petroleum kept on such premises or offered or exposed for sale therein and to submit such samples to a person authorised to test petroleum."
                },
                {
                    "representation": "(2)",
                    "description": "Where a sample of petroleum is taken under this section, the person taking the sample shall then and there divide it into three parts and place each part in a separate receptacle marked and sealed."
                },
                {
                    "representation": "(3)",
                    "description": "He shall then deliver or cause to be delivered one of such receptacles to the owner of the petroleum and another to a person authorised  to  test  petroleum  and  shall  keep  the  third  for  future comparison and production in court, if necessary. the same, and shall certify in duplicate to the Commissioner-  General, in the form contained in the First  Schedule, whether"
                }
            ]
        }
    },
    {
        "act": "PETROLEUM ACT",
        "source": "https://mola.gov.gy/laws-of-guyana",
        "type": {
            "name": "section",
            "representation": "18",
            "title": "Certificate of evidence.   MISCELLANEOUS   PROVISIONS  ",
            "context": "PETROLEUM ACT under Certificate of evidence.   MISCELLANEOUS   PROVISIONS  18.  (1) In any proceedings before a magistrate under this Act a certificate in the form in the First Schedule purporting to be signed by any person authorised to test petroleum shall be receivable as prima facie evidence of any matter or thing therein stated.  (2) If the person who has tested the petroleum is called as a witness in any such proceedings, the party calling him shall unless the magistrate   otherwise   expressly   orders,   be liable to pay all costs occasioned by his having been so called.  (3) In any such proceedings the part of the petroleum retained by the person who took the samples shall be produced in court.  MISCELLANEOUS   PROVISIONS",
            "description": [
                {
                    "representation": "(1)",
                    "description": "In any proceedings before a magistrate under this Act a certificate in the form in the First Schedule purporting to be signed by any person authorised to test petroleum shall be receivable as prima facie evidence of any matter or thing therein stated."
                },
                {
                    "representation": "(2)",
                    "description": "If the person who has tested the petroleum is called as a witness in any such proceedings, the party calling him shall unless the magistrate   otherwise   expressly   orders,   be liable to pay all costs occasioned by his having been so called."
                },
                {
                    "representation": "(3)",
                    "description": "In any such proceedings the part of the petroleum retained by the person who took the samples shall be produced in court.  MISCELLANEOUS   PROVISIONS"
                }
            ]
        }
    },
    {
        "act": "PETROLEUM ACT",
        "source": "https://mola.gov.gy/laws-of-guyana",
        "type": {
            "name": "section",
            "representation": "19",
            "title": "Seizure of petroleum kept in contravention of the Act. ",
            "context": "PETROLEUM ACT under Seizure of petroleum kept in contravention of the Act. 19. (1) If any petroleum is imported, kept, offered or exposed for sale contrary to this Act or the conditions of any licence issued under this Act, the same shall be liable to be seized by any officer of customs, district commissioner, or member of the police force and, upon proof of such importation, keeping or offering or exposing for sale may be adjudged to be forfeited.",
            "description": [
                {
                    "representation": "(1)",
                    "description": "If any petroleum is imported, kept, offered or exposed for sale contrary to this Act or the conditions of any licence issued under this Act, the same shall be liable to be seized by any officer of customs, district commissioner, or member of the police force and, upon proof of such importation, keeping or offering or exposing for sale may be adjudged to be forfeited."
                }
            ]
        }
    },
    {
        "act": "PETROLEUM ACT",
        "source": "https://mola.gov.gy/laws-of-guyana",
        "type": {
            "name": "section",
            "representation": "20",
            "title": "Issuing of warrant for searching house, etc., in which petroleum is suspected to be unlawfully kept. ",
            "context": "PETROLEUM ACT under Issuing of warrant for searching house, etc., in which petroleum is suspected to be unlawfully kept. 20.  (1) It shall be lawful for any magistrate or justice of contravention  LAWS OF GUYANA Petroleum Cap. 92:01 15  L.R.O. 1/2012 warrant for searching house, etc. in which petroleum is suspected to be unlawfully kept.                        Forfeiture of petroleum where quantity in excess is  kept.     Disposal of forfeited petroleum.   Penalty for assault on the peace on reasonable cause being assigned upon oath before him to issue a warrant  under his hand for searching in the day time any house, storehouse, warehouse, shop, cellar, yard, wharf, or other place in which petroleum is suspected to be kept contrary to this Act.   (2) All petroleum found to be kept contrary to this Act, and also the  vessels or other receptacles in which the same is kept, shall be immediately seized by the person finding the same, who, unless the Minister shall otherwise direct, shall with all convenient speed after the   seizure,  remove  such  petroleum  and  the  vessels  and  other receptacles  in  which  it  is  contained  to  a  warehouse  or  licensed building, and may detain such petroleum and such vessels and other receptacles until it is adjudged whether the same shall be forfeited:  Provided that proceedings for forfeiture shall be commenced within seven days after the seizure.  (3) Any person so seizing or detaining petroleum, vessels or receptacles  shall  not  be  liable  to  any  action  for  such  seizure  or detention, or for any loss or damage which may be occasioned thereby otherwise than through his wilful act or neglect.",
            "description": [
                {
                    "representation": "(1)",
                    "description": "It shall be lawful for any magistrate or justice of contravention  LAWS OF GUYANA Petroleum Cap. 92:01 15  L.R.O. 1/2012 warrant for searching house, etc. in which petroleum is suspected to be unlawfully kept.                        Forfeiture of petroleum where quantity in excess is  kept.     Disposal of forfeited petroleum.   Penalty for assault on the peace on reasonable cause being assigned upon oath before him to issue a warrant  under his hand for searching in the day time any house, storehouse, warehouse, shop, cellar, yard, wharf, or other place in which petroleum is suspected to be kept contrary to this Act."
                },
                {
                    "representation": "(2)",
                    "description": "All petroleum found to be kept contrary to this Act, and also the  vessels or other receptacles in which the same is kept, shall be immediately seized by the person finding the same, who, unless the Minister shall otherwise direct, shall with all convenient speed after the   seizure,  remove  such  petroleum  and  the  vessels  and  other receptacles  in  which  it  is  contained  to  a  warehouse  or  licensed building, and may detain such petroleum and such vessels and other receptacles until it is adjudged whether the same shall be forfeited:  Provided that proceedings for forfeiture shall be commenced within seven days after the seizure."
                },
                {
                    "representation": "(3)",
                    "description": "Any person so seizing or detaining petroleum, vessels or receptacles  shall  not  be  liable  to  any  action  for  such  seizure  or detention, or for any loss or damage which may be occasioned thereby otherwise than through his wilful act or neglect."
                }
            ]
        }
    },
    {
        "act": "PETROLEUM ACT",
        "source": "https://mola.gov.gy/laws-of-guyana",
        "type": {
            "name": "section",
            "representation": "21",
            "title": "Forfeiture of petroleum where quantity in excess is kept. ",
            "context": "PETROLEUM ACT under Forfeiture of petroleum where quantity in excess is kept. 21.  If there is stored in any place a greater quantity of petroleum than the quantity permitted by this Act or by any licence issued under this Act to be kept in such place, the whole of the petroleum in such place may be forfeited, and the person occupying or using such place or the licensee, if the place be a licensed building, shall be liable to a fine of seven hundred and fifty dollars.",
            "description": "If there is stored in any place a greater quantity of petroleum than the quantity permitted by this Act or by any licence issued under this Act to be kept in such place, the whole of the petroleum in such place may be forfeited, and the person occupying or using such place or the licensee, if the place be a licensed building, shall be liable to a fine of seven hundred and fifty dollars."
        }
    },
    {
        "act": "PETROLEUM ACT",
        "source": "https://mola.gov.gy/laws-of-guyana",
        "type": {
            "name": "section",
            "representation": "22",
            "title": "Disposal of forfeited petroleum. ",
            "context": "PETROLEUM ACT under Disposal of forfeited petroleum. 22.  Any   petroleum   forfeited   under   this   Act,   together   with   the vessels or other receptacles containing the same, shall be dealt with as the Minister may direct.",
            "description": "Any   petroleum   forfeited   under   this   Act,   together   with   the vessels or other receptacles containing the same, shall be dealt with as the Minister may direct."
        }
    },
    {
        "act": "PETROLEUM ACT",
        "source": "https://mola.gov.gy/laws-of-guyana",
        "type": {
            "name": "section",
            "representation": "23",
            "title": "Penalty for assault on persons acting under this Act. ",
            "context": "PETROLEUM ACT under Penalty for assault on persons acting under this Act. 23.  Every person who assaults, molests, or obstructs any person acting under this Act, shall be liable to a fine of three LAWS OF GUYANA 16 Cap. 92:01 Petroleum   L.R.O. 1/2012  persons acting under this Act.  Protection of person acting  Procedure.        Power to make regulations.                             hundred dollars.",
            "description": "Every person who assaults, molests, or obstructs any person acting under this Act, shall be liable to a fine of three LAWS OF GUYANA 16 Cap. 92:01 Petroleum   L.R.O. 1/2012  persons acting under this Act.  Protection of person acting  Procedure.        Power to make regulations.                             hundred dollars."
        }
    },
    {
        "act": "PETROLEUM ACT",
        "source": "https://mola.gov.gy/laws-of-guyana",
        "type": {
            "name": "section",
            "representation": "24",
            "title": "Protection of person acting under the Act. ",
            "context": "PETROLEUM ACT under Protection of person acting under the Act. 24.  Every person acting under this Act shall be entitled to the protection afforded by the Justices Protection Act.",
            "description": "Every person acting under this Act shall be entitled to the protection afforded by the Justices Protection Act."
        }
    },
    {
        "act": "PETROLEUM ACT",
        "source": "https://mola.gov.gy/laws-of-guyana",
        "type": {
            "name": "section",
            "representation": "25",
            "title": "Procedure. ",
            "context": "PETROLEUM ACT under Procedure. 25.  All prosecutions and proceedings for offenses, forfeitures and penalties   under   this  Act,  may  be  instituted  under  the  Summary Jurisdiction Acts by any Harbour Master, officer of customs, district commissioner, member of police force, or other person appointed by the Minister under this Act.",
            "description": "All prosecutions and proceedings for offenses, forfeitures and penalties   under   this  Act,  may  be  instituted  under  the  Summary Jurisdiction Acts by any Harbour Master, officer of customs, district commissioner, member of police force, or other person appointed by the Minister under this Act."
        }
    },
    {
        "act": "PETROLEUM ACT",
        "source": "https://mola.gov.gy/laws-of-guyana",
        "type": {
            "name": "section",
            "representation": "26",
            "title": "Power to make regulations.  FIRST SCHEDULE   Certificate of test of Petroleum.  SECOND SCHEDULE      Test apparatus mode of testing.   _________________________ 1953   Ed. c. 347 _______________________________________________________  7 of 1930   An Act to regulate the importation, storage and sale of petroleum.      Short title.  [22ND MARCH, 1930]    ",
            "context": "PETROLEUM ACT under Power to make regulations.  FIRST SCHEDULE   Certificate of test of Petroleum.  SECOND SCHEDULE      Test apparatus mode of testing.   _________________________ 1953   Ed. c. 347 _______________________________________________________  7 of 1930   An Act to regulate the importation, storage and sale of petroleum.      Short title.  [22ND MARCH, 1930]    26.  (1) The Minister may make regulations for any of the purposes of this Act, and in particular with relation to  (a) the importation,   landing,   receiving,   depositing, guarding, delivery, hawking and removing from one place to any other place of petroleum;  (b) the conditions upon which the persons to whom and the premises for which any licence under this Act may be issued;  (c) the general management and  regulation of ware-houses and licensed buildings and oil engines, and the duties and conduct of any person or persons in charge thereof or employed in connection therewith;  (d) the kind and quantity of petroleum that may be kept in any licensed building; specifications for and the nature of the  buildings in which petroleum may be stored and the surroundings and situation of the premises on which such c. 5:07 under the Act.  LAWS OF GUYANA Petroleum Cap. 92:01 17  L.R.O. 1/2012                           ss. 15, 17 and",
            "description": [
                {
                    "representation": "(1)",
                    "description": "The Minister may make regulations for any of the purposes of this Act, and in particular with relation to"
                },
                {
                    "representation": "(a)",
                    "description": "the importation,   landing,   receiving,   depositing, guarding, delivery, hawking and removing from one place to any other place of petroleum;"
                },
                {
                    "representation": "(b)",
                    "description": "the conditions upon which the persons to whom and the premises for which any licence under this Act may be issued;"
                },
                {
                    "representation": "(c)",
                    "description": "the general management and  regulation of ware-houses and licensed buildings and oil engines, and the duties and conduct of any person or persons in charge thereof or employed in connection therewith;"
                },
                {
                    "representation": "(d)",
                    "description": "the kind and quantity of petroleum that may be kept in any licensed building; specifications for and the nature of the  buildings in which petroleum may be stored and the surroundings and situation of the premises on which such c. 5:07 under the Act.  LAWS OF GUYANA Petroleum Cap. 92:01 17  L.R.O. 1/2012                           ss. 15, 17 and"
                }
            ]
        }
    }
]