[
    {
        "act": "TRADE UNION RECOGNITION ACT",
        "source": "https://mola.gov.gy/laws-of-guyana",
        "type": {
            "name": "section",
            "representation": "1",
            "title": "Short title. ",
            "context": "TRADE UNION RECOGNITION ACT under Short title. 1. This Act may be cited as the Trade Union Recognition Act.",
            "description": "This Act may be cited as the Trade Union Recognition Act."
        }
    },
    {
        "act": "TRADE UNION RECOGNITION ACT",
        "source": "https://mola.gov.gy/laws-of-guyana",
        "type": {
            "name": "section",
            "representation": "2",
            "title": "Interpretation ",
            "context": "TRADE UNION RECOGNITION ACT under Interpretation 2. (1) In this Act  bargaining unit means that unit of workers determined by the Board as an appropriate bargaining unit;  Board means the Trade Union Recognition and Certification Board established under section 4;  collective agreement means an agreement in writing between an employer and the recognised majority union on behalf of workers employed by the employer in a bargaining unit for which the union is certified, containing provisions respecting terms and conditions of employment of the workers and the rights, privileges or duties of the  employer or of the recognised majority union or of the workers and for the regulation of the relationship between an employer and the recognised majority union;  collective bargaining means treating and negotiating with a view to the conclusion of a collective agreement or the revision or renewal thereof or the resolution of disputes;  employer means any person or body of persons, firm, company, public corporation, public authority, or the State who or which has entered into a contract to employ any person and includes, any agent, representative or manager of such person, body of persons, firm, company, public corporation, public authority or the State who is placed in authority over the persons employed;  lock-out means action which, in contemplation or furtherance of a dispute, is taken by one or more employers, whether parties to the dispute or not, and which consists of the closing of a place of employment or LAWS OF GUYANA 6 Cap. 98:07 Trade Union Recognition  L.R.O. 1/2012                                      c. 98:03            the suspension of work by an employer or the refusal  by an employer to employ or continue to employ any number of workers;  recognised majority union means a trade union certified under Part III as the bargaining agent for workers comprised in a bargaining unit;  the most representative organisations   (a)    in  relation  to  workers  means  the  most    representative organisations of workers; and  (b)   in relation to employers, means the most representative organisations of employers;  the relevant date means such date as the Board considers appropriate for determining any matter before it under Part III;  strike means a cessation of work, a refusal to work, to continue to work  or to take up work by workers acting in concert or in accordance   with  common  understanding  and  includes  any concerted  interruption of work or slowing down by workers commonly known as a sit down strike or a go-slow;   Trade Union or Union means an association registered as a Trade Union under section 15 of the Trade Unions Act not being an association  or  organisation of employers registered as a Trade Union under this Act;  undertaking includes any trade or business or any activity involving the employment of workers;  workers subject to subsection (2) means  (a)      any person who has entered into or works LAWS OF GUYANA Trade Union Recognition Cap. 98:07 7  L.R.O. 1/2012                                              c. 39:04              under a contract with an employer to do any skilled, unskilled manual, technical, clerical or other work, for hire or reward, whether such contract be expressed or implied, oral or in writing, or partly in writing, and whether it is a contract of service or apprenticeship or a contract personally to execute any work or labour; or  (b)     any person who by any trade usage or custom or, as a result of any established pattern of   employment or recruitment of labour in any business or industry is usually employed or usually offers himself for an accepts employment accordingly, and includes any such person   (i)   who has been dismissed, discharged, retrenched, suspended, interdicted, refused employment, or not employed whether or  not in connection with or in consequences of, a dispute;  (ii) whose dismissal, discharge, retrenchment, suspension, inter-diction or refusal of employment has led to a dispute; or  (iii)     who has ceased to work as a result of a lock-out or a strike.  (2) For the purpose of this Act, no person shall be regarded as a worker if he is a member of a disciplined force referred to in paragraph (a), (b) or (c) of the definition of disciplined force in article 154 of the Constitution,  or an apprentice within the meaning of the Industrial Training Act.  LAWS OF GUYANA 8 Cap. 98:07 Trade Union Recognition  L.R.O. 1/2012   Delegation by Minister. [1 of 2009]                        Establishment  of Trade Union Recognition and Certifica- tion Board.     Composition of the Board. [1 of 2009]",
            "description": [
                {
                    "representation": "(1)",
                    "description": "In this Act  bargaining unit means that unit of workers determined by the Board as an appropriate bargaining unit;  Board means the Trade Union Recognition and Certification Board established under section 4;  collective agreement means an agreement in writing between an employer and the recognised majority union on behalf of workers employed by the employer in a bargaining unit for which the union is certified, containing provisions respecting terms and conditions of employment of the workers and the rights, privileges or duties of the  employer or of the recognised majority union or of the workers and for the regulation of the relationship between an employer and the recognised majority union;  collective bargaining means treating and negotiating with a view to the conclusion of a collective agreement or the revision or renewal thereof or the resolution of disputes;  employer means any person or body of persons, firm, company, public corporation, public authority, or the State who or which has entered into a contract to employ any person and includes, any agent, representative or manager of such person, body of persons, firm, company, public corporation, public authority or the State who is placed in authority over the persons employed;  lock-out means action which, in contemplation or furtherance of a dispute, is taken by one or more employers, whether parties to the dispute or not, and which consists of the closing of a place of employment or LAWS OF GUYANA 6 Cap. 98:07 Trade Union Recognition  L.R.O. 1/2012                                      c. 98:03            the suspension of work by an employer or the refusal  by an employer to employ or continue to employ any number of workers;  recognised majority union means a trade union certified under Part III as the bargaining agent for workers comprised in a bargaining unit;  the most representative organisations"
                },
                {
                    "representation": "(a)",
                    "description": "any person who has entered into or works LAWS OF GUYANA Trade Union Recognition Cap. 98:07 7  L.R.O. 1/2012                                              c. 39:04              under a contract with an employer to do any skilled, unskilled manual, technical, clerical or other work, for hire or reward, whether such contract be expressed or implied, oral or in writing, or partly in writing, and whether it is a contract of service or apprenticeship or a contract personally to execute any work or labour; or"
                },
                {
                    "representation": "(b)",
                    "description": "or"
                },
                {
                    "representation": "(2)",
                    "description": "For the purpose of this Act, no person shall be regarded as a worker if he is a member of a disciplined force referred to in paragraph"
                },
                {
                    "representation": "(i)",
                    "description": "who has been dismissed, discharged, retrenched, suspended, interdicted, refused employment, or not employed whether or  not in connection with or in consequences of, a dispute;"
                },
                {
                    "representation": "(c)",
                    "description": "of the definition of disciplined force in article 154 of the Constitution,  or an apprentice within the meaning of the Industrial Training Act.  LAWS OF GUYANA 8 Cap. 98:07 Trade Union Recognition  L.R.O. 1/2012   Delegation by Minister. [1 of 2009]                        Establishment  of Trade Union Recognition and Certifica- tion Board.     Composition of the Board. [1 of 2009]"
                }
            ]
        }
    },
    {
        "act": "TRADE UNION RECOGNITION ACT",
        "source": "https://mola.gov.gy/laws-of-guyana",
        "type": {
            "name": "section",
            "representation": "3",
            "title": "Delegation by Minister.  PART II RECOGNITION AND CERTIFICATION BOARD  ",
            "context": "TRADE UNION RECOGNITION ACT under Delegation by Minister.  PART II RECOGNITION AND CERTIFICATION BOARD  3. The Minister may delegate to a public officer not below the level of a Senior Labour Officer in the Ministry responsible for Labour any of his functions under this Act, with the exception of the functions conferred by sections 5 and 37(1).  PART II RECOGNITION AND CERTIFICATION BOARD",
            "description": "The Minister may delegate to a public officer not below the level of a Senior Labour Officer in the Ministry responsible for Labour any of his functions under this Act, with the exception of the functions conferred by sections 5 and 37(1).  PART II RECOGNITION AND CERTIFICATION BOARD"
        }
    },
    {
        "act": "TRADE UNION RECOGNITION ACT",
        "source": "https://mola.gov.gy/laws-of-guyana",
        "type": {
            "name": "section",
            "representation": "4",
            "title": "Establishment of Trade Union Recognition and Certification Board. ",
            "context": "TRADE UNION RECOGNITION ACT under Establishment of Trade Union Recognition and Certification Board. 4. There is hereby established a Board to be known as the Trade Union Recognition and Certification Board which shall be a body corporate.",
            "description": "There is hereby established a Board to be known as the Trade Union Recognition and Certification Board which shall be a body corporate."
        }
    },
    {
        "act": "TRADE UNION RECOGNITION ACT",
        "source": "https://mola.gov.gy/laws-of-guyana",
        "type": {
            "name": "section",
            "representation": "5",
            "title": "Composition of the Board. ",
            "context": "TRADE UNION RECOGNITION ACT under Composition of the Board. 5. (1) The Board shall consist of seven members, each appointed for a period of two years, as follows  (a)      a Chairman appointed by the Minister after consultation with the most representative organisations of workers and the most representative organisations of employers;  (b)  three members appointed by the Minister on  the nomination of the most representative organisations of workers;  (c)  three members appointed by the Minister on  the nomination of the most representative organisations of employers.  (2) In respect of each member of the Board (other than the Chairman) the Minister shall, in like-manner as that whereby that member was appointed, appoint an alternate member for a period ending on the date on which the member in respect of whom he was appointed, ceases to be LAWS OF GUYANA Trade Union Recognition Cap. 98:07 9  L.R.O. 1/2012                                                                                                  Secretary and other officers  of the Board. such a member.  (3) An alternate member may act for the member in respect of whom he was appointed for such time as that member is unable to discharge the functions of his office or for such time as that member is acting as Chairman.  (4) Where the Chairman is for any reason, unable to carry out his functions under this Act, the Minister may, after consultation with the most representative organisations of workers and the most representative organisations of employers; respectively, appoint a Chairman to act for the period of his inability to carry out his functions under this Act, from among the members of the Board.  (5) A member of the Board may at any time resign his office by writing under his hand addressed to the Minister, and upon the date of the receipt by the Minister of such resignation the member shall cease to hold office.  (6) [Repealed by Act No. 1 of 2009]  (7) The Minister shall revoke the appointment of the Chairman or any other member if the member indulges in any action that is inimical to the function of the Board, or if the member is absent without the permission of the Board from three consecutive meetings of the Board.  (8) The appointment, removal, resignation or death of any member or alternate member of the Board shall be notified by the Minister in the Gazette.  (9) No member or alternate member shall be dismissed or otherwise victimised by his employer on account only of his being a member of the Board.",
            "description": [
                {
                    "representation": "(1)",
                    "description": "The Board shall consist of seven members, each appointed for a period of two years, as follows"
                },
                {
                    "representation": "(a)",
                    "description": "a Chairman appointed by the Minister after consultation with the most representative organisations of workers and the most representative organisations of employers;"
                },
                {
                    "representation": "(b)",
                    "description": "three members appointed by the Minister on  the nomination of the most representative organisations of workers;"
                },
                {
                    "representation": "(c)",
                    "description": "three members appointed by the Minister on  the nomination of the most representative organisations of employers."
                },
                {
                    "representation": "(2)",
                    "description": "In respect of each member of the Board"
                },
                {
                    "representation": "(3)",
                    "description": "An alternate member may act for the member in respect of whom he was appointed for such time as that member is unable to discharge the functions of his office or for such time as that member is acting as Chairman."
                },
                {
                    "representation": "(4)",
                    "description": "Where the Chairman is for any reason, unable to carry out his functions under this Act, the Minister may, after consultation with the most representative organisations of workers and the most representative organisations of employers; respectively, appoint a Chairman to act for the period of his inability to carry out his functions under this Act, from among the members of the Board."
                },
                {
                    "representation": "(5)",
                    "description": "A member of the Board may at any time resign his office by writing under his hand addressed to the Minister, and upon the date of the receipt by the Minister of such resignation the member shall cease to hold office."
                },
                {
                    "representation": "(6)",
                    "description": "[Repealed by Act No. 1 of 2009]"
                },
                {
                    "representation": "(7)",
                    "description": "The Minister shall revoke the appointment of the Chairman or any other member if the member indulges in any action that is inimical to the function of the Board, or if the member is absent without the permission of the Board from three consecutive meetings of the Board."
                },
                {
                    "representation": "(8)",
                    "description": "The appointment, removal, resignation or death of any member or alternate member of the Board shall be notified by the Minister in the Gazette."
                },
                {
                    "representation": "(9)",
                    "description": "No member or alternate member shall be dismissed or otherwise victimised by his employer on account only of his being a member of the Board."
                }
            ]
        }
    },
    {
        "act": "TRADE UNION RECOGNITION ACT",
        "source": "https://mola.gov.gy/laws-of-guyana",
        "type": {
            "name": "section",
            "representation": "6",
            "title": "Secretary and other officers of the Board. ",
            "context": "TRADE UNION RECOGNITION ACT under Secretary and other officers of the Board. 6. (1) There shall be a Secretary to the Board who shall be appointed by the Minister from amongst persons who are LAWS OF GUYANA 10 Cap. 98:07 Trade Union Recognition  L.R.O. 1/2012             Seal of the Board.              Remuneration of members of the  Board  and Secretary.  Meetings.                     public officers.  (2) It shall be the duty of the Minister to provide the Board with such resources as may from time to time be required by the Board for the discharge of its functions.",
            "description": [
                {
                    "representation": "(1)",
                    "description": "There shall be a Secretary to the Board who shall be appointed by the Minister from amongst persons who are LAWS OF GUYANA 10 Cap. 98:07 Trade Union Recognition  L.R.O. 1/2012             Seal of the Board.              Remuneration of members of the  Board  and Secretary.  Meetings.                     public officers."
                },
                {
                    "representation": "(2)",
                    "description": "It shall be the duty of the Minister to provide the Board with such resources as may from time to time be required by the Board for the discharge of its functions."
                }
            ]
        }
    },
    {
        "act": "TRADE UNION RECOGNITION ACT",
        "source": "https://mola.gov.gy/laws-of-guyana",
        "type": {
            "name": "section",
            "representation": "7",
            "title": "Seal of the Board. ",
            "context": "TRADE UNION RECOGNITION ACT under Seal of the Board. 7. (1) The seal of the Board shall be kept in the custody of the Chairman or the Secretary, as the Board may determine, and shall be affixed to instruments issued by the Board or to resolutions of the Board.  (2) The seal of the Board shall be officially and judicially noticed.   (3) All documents, other than those required to be under seal, made by, and all decisions of the Board may be signified under the hand of the Chairman or the Secretary.",
            "description": [
                {
                    "representation": "(1)",
                    "description": "The seal of the Board shall be kept in the custody of the Chairman or the Secretary, as the Board may determine, and shall be affixed to instruments issued by the Board or to resolutions of the Board."
                },
                {
                    "representation": "(2)",
                    "description": "The seal of the Board shall be officially and judicially noticed."
                },
                {
                    "representation": "(3)",
                    "description": "All documents, other than those required to be under seal, made by, and all decisions of the Board may be signified under the hand of the Chairman or the Secretary."
                }
            ]
        }
    },
    {
        "act": "TRADE UNION RECOGNITION ACT",
        "source": "https://mola.gov.gy/laws-of-guyana",
        "type": {
            "name": "section",
            "representation": "8",
            "title": "Remuneration of members of the Board and Secretary. ",
            "context": "TRADE UNION RECOGNITION ACT under Remuneration of members of the Board and Secretary. 8. The Chairman, other members and the Secretary of the Board shall receive such remuneration as may be determined by the Minister.",
            "description": "The Chairman, other members and the Secretary of the Board shall receive such remuneration as may be determined by the Minister."
        }
    },
    {
        "act": "TRADE UNION RECOGNITION ACT",
        "source": "https://mola.gov.gy/laws-of-guyana",
        "type": {
            "name": "section",
            "representation": "9",
            "title": "Meetings. ",
            "context": "TRADE UNION RECOGNITION ACT under Meetings. 9. (1) The Board shall meet at such times as may be necessary or expedient for the transaction of its business and the meetings shall be held at such places and times and on such days as the Board may determine.  (2) The quorum of the Board shall be the Chairman and three other members, of whom one shall be a member appointed under section 5 (1) (c) and one appointed under section 5 (1) (d).  (3) Where two consecutive meetings have been summoned within ninety-six hours, each meeting being forty-eight hours apart and each meeting not having the requisite quorum specified in subsection (2), for the next meeting thereafter, any four members shall constitute a quorum.  LAWS OF GUYANA Trade Union Recognition Cap. 98:07 11  L.R.O. 1/2012 Prohibition as to interest.",
            "description": [
                {
                    "representation": "(1)",
                    "description": "(d)."
                },
                {
                    "representation": "(2)",
                    "description": "The quorum of the Board shall be the Chairman and three other members, of whom one shall be a member appointed under section 5"
                },
                {
                    "representation": "(3)",
                    "description": "Where two consecutive meetings have been summoned within ninety-six hours, each meeting being forty-eight hours apart and each meeting not having the requisite quorum specified in subsection"
                }
            ]
        }
    },
    {
        "act": "TRADE UNION RECOGNITION ACT",
        "source": "https://mola.gov.gy/laws-of-guyana",
        "type": {
            "name": "section",
            "representation": "10",
            "title": "Prohibitions as to interest. ",
            "context": "TRADE UNION RECOGNITION ACT under Prohibitions as to interest. 10. (1) A member of the Board shall not, so long as he is in any way directly or indirectly concerned in any matter before the Board by reason of  (a)     his holding office in, or being a member of, any union concerned in the matter; or  (b)   being the employer or a director, a shareholder, partner or manager of the business of the employer who is concerned in the matter,  take part in any deliberation or decision of the Board on such matter or officiate at any poll taken by the Board for the purpose of determining such matter.  (2) Nothing is subsection (1) (b) shall apply to any shareholder if the total value of his shareholding does not exceed such amount, of the total nominal value of the issued share capital of the company as the rules of procedure of the Board provide.  (3) It shall be open to any member of the Board present at any meeting thereof to challenge the entitlement of any other member of the Board, including the Chairman, to take part in any deliberation or decision on any matter before the Board, or to officiate at any poll to be taken by the Board for the purpose of determining such matter on the ground that such other member is directly or indirectly concerned in the matter by reason of any circumstances, referred to in subsection (1).  (4) Upon any such challenge being taken, the Board shall enquire into the merits thereof, and, after giving reasonable opportunity to the member challenged to be heard in answer thereto, shall determine the challenge by a ruling which shall be binding and conclusive for all purposes. LAWS OF GUYANA 12 Cap. 98:07 Trade Union Recognition  L.R.O. 1/2012                    Duties of the Board.              Procedure at hearing etc.                        Power to summon witnesses, etc.  c. 19:03     (5) Where it is shown to the satisfaction of the Board that a member thereof has failed to comply with the provisions of this section, the Board may declare void all proceedings, determinations and other decisions taken or made on any occasion of such failure, but no proceedings, determinations or other decisions of the Board taken or made on any such occasion shall be, or be deemed to be, invalidated by reason only of such failure, unless the Board so declares.",
            "description": [
                {
                    "representation": "(1)",
                    "description": "(b) shall apply to any shareholder if the total value of his shareholding does not exceed such amount, of the total nominal value of the issued share capital of the company as the rules of procedure of the Board provide."
                },
                {
                    "representation": "(a)",
                    "description": "his holding office in, or being a member of, any union concerned in the matter; or"
                },
                {
                    "representation": "(b)",
                    "description": "being the employer or a director, a shareholder, partner or manager of the business of the employer who is concerned in the matter,  take part in any deliberation or decision of the Board on such matter or officiate at any poll taken by the Board for the purpose of determining such matter."
                },
                {
                    "representation": "(2)",
                    "description": "Nothing is subsection"
                },
                {
                    "representation": "(3)",
                    "description": "It shall be open to any member of the Board present at any meeting thereof to challenge the entitlement of any other member of the Board, including the Chairman, to take part in any deliberation or decision on any matter before the Board, or to officiate at any poll to be taken by the Board for the purpose of determining such matter on the ground that such other member is directly or indirectly concerned in the matter by reason of any circumstances, referred to in subsection"
                },
                {
                    "representation": "(4)",
                    "description": "Upon any such challenge being taken, the Board shall enquire into the merits thereof, and, after giving reasonable opportunity to the member challenged to be heard in answer thereto, shall determine the challenge by a ruling which shall be binding and conclusive for all purposes. LAWS OF GUYANA 12 Cap. 98:07 Trade Union Recognition  L.R.O. 1/2012                    Duties of the Board.              Procedure at hearing etc.                        Power to summon witnesses, etc.  c. 19:03"
                },
                {
                    "representation": "(5)",
                    "description": "Where it is shown to the satisfaction of the Board that a member thereof has failed to comply with the provisions of this section, the Board may declare void all proceedings, determinations and other decisions taken or made on any occasion of such failure, but no proceedings, determinations or other decisions of the Board taken or made on any such occasion shall be, or be deemed to be, invalidated by reason only of such failure, unless the Board so declares."
                }
            ]
        }
    },
    {
        "act": "TRADE UNION RECOGNITION ACT",
        "source": "https://mola.gov.gy/laws-of-guyana",
        "type": {
            "name": "section",
            "representation": "11",
            "title": "Duties of the Board. ",
            "context": "TRADE UNION RECOGNITION ACT under Duties of the Board. 11. The Board shall be charged with responsibility as more specifically set out under Part III for the determination of all applications and matters concerning the certification of trade unions as recognised majority unions.",
            "description": "The Board shall be charged with responsibility as more specifically set out under Part III for the determination of all applications and matters concerning the certification of trade unions as recognised majority unions."
        }
    },
    {
        "act": "TRADE UNION RECOGNITION ACT",
        "source": "https://mola.gov.gy/laws-of-guyana",
        "type": {
            "name": "section",
            "representation": "12",
            "title": "Procedure at hearings, etc. ",
            "context": "TRADE UNION RECOGNITION ACT under Procedure at hearings, etc. 12. (1) Every party to a matter before the Board shall be entitled to appear at any hearing thereof and may be represented thereat by an attorney-at-law or a duly authorised representative.  (2) The Board may determine the periods that are necessary for the fair and adequate presentation of a matter by the parties thereto, and may require matters to be presented within any period so determined.  (3) The Board may require or permit evidence or arguments to be presented either orally or in writing or partly orally and partly in writing.  (4) Subject to the provisions of this section the Board may regulate its procedure.",
            "description": [
                {
                    "representation": "(1)",
                    "description": "Every party to a matter before the Board shall be entitled to appear at any hearing thereof and may be represented thereat by an attorney-at-law or a duly authorised representative."
                },
                {
                    "representation": "(2)",
                    "description": "The Board may determine the periods that are necessary for the fair and adequate presentation of a matter by the parties thereto, and may require matters to be presented within any period so determined."
                },
                {
                    "representation": "(3)",
                    "description": "The Board may require or permit evidence or arguments to be presented either orally or in writing or partly orally and partly in writing."
                },
                {
                    "representation": "(4)",
                    "description": "Subject to the provisions of this section the Board may regulate its procedure."
                }
            ]
        }
    },
    {
        "act": "TRADE UNION RECOGNITION ACT",
        "source": "https://mola.gov.gy/laws-of-guyana",
        "type": {
            "name": "section",
            "representation": "13",
            "title": "Power to summon witnesses, etc. ",
            "context": "TRADE UNION RECOGNITION ACT under Power to summon witnesses, etc. 13. (1) For the purpose of dealing with any matter brought before it the Board shall have all powers, privileges and immunities as are vested in a commissioner appointed under the Commissions of Inquiry Act.  (2) Any summons may be issued by the Secretary LAWS OF GUYANA Trade Union Recognition Cap. 98:07 13  L.R.O. 1/2012     Power to enter premises.                                 Appointment of committees.                            Power of the Board to delegate.         Board may of the Board and shall have the same force and effect as a summons issued under the Commissions of Inquiry Act.  14 (1) The Board or any authorised officer of the Board may, on giving twenty-four hours notice in writing, enter any premises for any purpose in relation to the taking of a poll under this Act.  (2) An officer shall, on demand, produce a duly authenticated document evidencing his authority to act in pursuance of subsection (1).  (3) Every person who hinders or molests, or otherwise interferes with any member of the Board or any authorised officer in the exercise of any function pursuant to this Act shall be guilty of an offence and liable on summary conviction to a fine of twenty-eight thousand dollars and to imprisonment for six months.",
            "description": [
                {
                    "representation": "(1)",
                    "description": "The Board or any authorised officer of the Board may, on giving twenty-four hours notice in writing, enter any premises for any purpose in relation to the taking of a poll under this Act."
                },
                {
                    "representation": "(2)",
                    "description": "An officer shall, on demand, produce a duly authenticated document evidencing his authority to act in pursuance of subsection"
                },
                {
                    "representation": "(3)",
                    "description": "Every person who hinders or molests, or otherwise interferes with any member of the Board or any authorised officer in the exercise of any function pursuant to this Act shall be guilty of an offence and liable on summary conviction to a fine of twenty-eight thousand dollars and to imprisonment for six months."
                }
            ]
        }
    },
    {
        "act": "TRADE UNION RECOGNITION ACT",
        "source": "https://mola.gov.gy/laws-of-guyana",
        "type": {
            "name": "section",
            "representation": "15",
            "title": "Appointment of committees. ",
            "context": "TRADE UNION RECOGNITION ACT under Appointment of committees. 15. (1) The Board may appoint committees from amongst its members to examine and report to it on any matter arising out of or connected with any of its powers and duties under this Act.  (2) The Board may reject the report of any such committee or adopt it either wholly or with such modifications, adaptations, qualifications and exceptions as the Board may think fit.",
            "description": [
                {
                    "representation": "(1)",
                    "description": "The Board may appoint committees from amongst its members to examine and report to it on any matter arising out of or connected with any of its powers and duties under this Act."
                },
                {
                    "representation": "(2)",
                    "description": "The Board may reject the report of any such committee or adopt it either wholly or with such modifications, adaptations, qualifications and exceptions as the Board may think fit."
                }
            ]
        }
    },
    {
        "act": "TRADE UNION RECOGNITION ACT",
        "source": "https://mola.gov.gy/laws-of-guyana",
        "type": {
            "name": "section",
            "representation": "16",
            "title": "Power of the Board to delegate. ",
            "context": "TRADE UNION RECOGNITION ACT under Power of the Board to delegate. 16. Subject to the provisions of this Act, the Board may delegate to a committee consisting of the Chairman and at least two other members, one being a member appointed under section 5(1)(c) and the other being a member appointed under section 5(1)(d), authority to carry out such duties and functions and to exercise such power on its behalf, as it may determine.",
            "description": [
                {
                    "representation": "(c)",
                    "description": "and the other being a member appointed under section 5(1)(d), authority to carry out such duties and functions and to exercise such power on its behalf, as it may determine."
                }
            ]
        }
    },
    {
        "act": "TRADE UNION RECOGNITION ACT",
        "source": "https://mola.gov.gy/laws-of-guyana",
        "type": {
            "name": "section",
            "representation": "17",
            "title": "Board may state case to the High Court.   PART III CERTIFICATION OF RECOGNITION  ",
            "context": "TRADE UNION RECOGNITION ACT under Board may state case to the High Court.   PART III CERTIFICATION OF RECOGNITION  17. (1) The Board may, on the application of any party LAWS OF GUYANA 14 Cap. 98:07 Trade Union Recognition  L.R.O. 1/2012  state case to the High Court.                     c. 3:02                Application for certification of recognition. [1 of 2009]                to a, matter before the Board, or on its own motion, state a case on any point as to the interpretation or application of this Act or any other written law, for the opinion of the High Court.  (2) The High Court shall hear and determine all questions arising on any case stated, and the determination of the Court on any such questions shall be conclusive for all purposes.  (3) The statement of facts in any case so stated shall, for the purpose of the determination thereof, be conclusive.  (4) The Rules Committee established under section 67 of the High Court Act may make rules regulating the manner in which the Board may state a case and all other matters relating to the procedure for hearing and determining the case.   PART III CERTIFICATION OF RECOGNITION",
            "description": [
                {
                    "representation": "(1)",
                    "description": "The Board may, on the application of any party LAWS OF GUYANA 14 Cap. 98:07 Trade Union Recognition  L.R.O. 1/2012  state case to the High Court.                     c. 3:02                Application for certification of recognition. [1 of 2009]                to a, matter before the Board, or on its own motion, state a case on any point as to the interpretation or application of this Act or any other written law, for the opinion of the High Court."
                },
                {
                    "representation": "(2)",
                    "description": "The High Court shall hear and determine all questions arising on any case stated, and the determination of the Court on any such questions shall be conclusive for all purposes."
                },
                {
                    "representation": "(3)",
                    "description": "The statement of facts in any case so stated shall, for the purpose of the determination thereof, be conclusive."
                },
                {
                    "representation": "(4)",
                    "description": "The Rules Committee established under section 67 of the High Court Act may make rules regulating the manner in which the Board may state a case and all other matters relating to the procedure for hearing and determining the case.   PART III CERTIFICATION OF RECOGNITION"
                }
            ]
        }
    },
    {
        "act": "TRADE UNION RECOGNITION ACT",
        "source": "https://mola.gov.gy/laws-of-guyana",
        "type": {
            "name": "section",
            "representation": "18",
            "title": "Application for certification of recognition. ",
            "context": "TRADE UNION RECOGNITION ACT under Application for certification of recognition. 18. (1) A trade union that desires to be treated as a recognised majority union shall apply to the Board in writing to be so certified in accordance with the provisions of this Part.  (2) The application shall describe the proposed bargaining unit in respect of which certification is sought and shall be in the prescribed form.  (3) The union making the application hereinafter referred to as the claimant union shall serve a copy of the application on the employer and on the Minister.  (4) The application shall be determined, within four months of the date of its receipt by the Board, in LAWS OF GUYANA Trade Union Recognition Cap. 98:07 15  L.R.O. 1/2012          Appropriate- ness of bargaining unit.                                            Determination of recognised union where only one union accordance with the following provisions of this Part.",
            "description": [
                {
                    "representation": "(1)",
                    "description": "A trade union that desires to be treated as a recognised majority union shall apply to the Board in writing to be so certified in accordance with the provisions of this Part."
                },
                {
                    "representation": "(2)",
                    "description": "The application shall describe the proposed bargaining unit in respect of which certification is sought and shall be in the prescribed form."
                },
                {
                    "representation": "(3)",
                    "description": "The union making the application hereinafter referred to as the claimant union shall serve a copy of the application on the employer and on the Minister."
                },
                {
                    "representation": "(4)",
                    "description": "The application shall be determined, within four months of the date of its receipt by the Board, in LAWS OF GUYANA Trade Union Recognition Cap. 98:07 15  L.R.O. 1/2012          Appropriate- ness of bargaining unit.                                            Determination of recognised union where only one union accordance with the following provisions of this Part."
                }
            ]
        }
    },
    {
        "act": "TRADE UNION RECOGNITION ACT",
        "source": "https://mola.gov.gy/laws-of-guyana",
        "type": {
            "name": "section",
            "representation": "19",
            "title": "Appropriateness of bargaining unit. ",
            "context": "TRADE UNION RECOGNITION ACT under Appropriateness of bargaining unit. 19. (1) When an application is made under section 18, the Board shall determine the bargaining unit it considers appropriate (hereafter referred to as the appropriate bargaining unit) and in so doing the Board shall have regard to   (a)    the community  of interest between the workers in the proposed bargaining unit including work location, working hours, work arrangements and payment systems;  (b)    the nature and scope of the duties of the workers in the proposed bargaining unit;  (c)   the  organisational  structure  of  the employers undertaking and the views of the employer and the trade union thereon;  (d)    the  historical  development,  if  any, of collective bargaining in the employers under-taking; and  (e)   any other matter which the Board considers to be relevant to good industrial relations.  (2) In considering the appropriateness of a bargaining unit the Board shall not be restricted by the terms of the application.",
            "description": [
                {
                    "representation": "(1)",
                    "description": "When an application is made under section 18, the Board shall determine the bargaining unit it considers appropriate"
                },
                {
                    "representation": "(a)",
                    "description": "the community  of interest between the workers in the proposed bargaining unit including work location, working hours, work arrangements and payment systems;"
                },
                {
                    "representation": "(b)",
                    "description": "the nature and scope of the duties of the workers in the proposed bargaining unit;"
                },
                {
                    "representation": "(c)",
                    "description": "the  organisational  structure  of  the employers undertaking and the views of the employer and the trade union thereon;"
                },
                {
                    "representation": "(d)",
                    "description": "the  historical  development,  if  any, of collective bargaining in the employers under-taking; and"
                },
                {
                    "representation": "(e)",
                    "description": "any other matter which the Board considers to be relevant to good industrial relations."
                },
                {
                    "representation": "(2)",
                    "description": "In considering the appropriateness of a bargaining unit the Board shall not be restricted by the terms of the application."
                }
            ]
        }
    },
    {
        "act": "TRADE UNION RECOGNITION ACT",
        "source": "https://mola.gov.gy/laws-of-guyana",
        "type": {
            "name": "section",
            "representation": "20",
            "title": "Determination of recognised union where only one union is involved.  LAWS OF GUYANA 4 Cap. 98:07 Trade Union Recognition  L.R.O. 1/2012  SECTION ",
            "context": "TRADE UNION RECOGNITION ACT under Determination of recognised union where only one union is involved.  LAWS OF GUYANA 4 Cap. 98:07 Trade Union Recognition  L.R.O. 1/2012  SECTION 20. (1) Where only one union has applied under section 18, the Board shall carry out a membership survey to determine the extent of support which the union enjoys on LAWS OF GUYANA 16 Cap. 98:07 Trade Union Recognition  L.R.O. 1/2012  is involved.                                     Determination of recognised majority union where two or more unions are involved. [1 of 2009]                        the date of the application among the workers comprised in the appropriate bargaining unit.  (2) Where it appears to the Board from the results of the survey that the union is supported on the date of application by at least forty per cent of the workers comprised in the appropriate bargaining unit, the Board shall certify the union as the recognised majority union for that unit.  (3) In carrying out any membership survey under this Act the Board shall satisfy itself, by whatever means it deems appropriate, as to the authenticity of any documents submitted.",
            "description": [
                {
                    "representation": "(1)",
                    "description": "Where only one union has applied under section 18, the Board shall carry out a membership survey to determine the extent of support which the union enjoys on LAWS OF GUYANA 16 Cap. 98:07 Trade Union Recognition  L.R.O. 1/2012  is involved.                                     Determination of recognised majority union where two or more unions are involved. [1 of 2009]                        the date of the application among the workers comprised in the appropriate bargaining unit."
                },
                {
                    "representation": "(2)",
                    "description": "Where it appears to the Board from the results of the survey that the union is supported on the date of application by at least forty per cent of the workers comprised in the appropriate bargaining unit, the Board shall certify the union as the recognised majority union for that unit."
                },
                {
                    "representation": "(3)",
                    "description": "In carrying out any membership survey under this Act the Board shall satisfy itself, by whatever means it deems appropriate, as to the authenticity of any documents submitted."
                }
            ]
        }
    },
    {
        "act": "TRADE UNION RECOGNITION ACT",
        "source": "https://mola.gov.gy/laws-of-guyana",
        "type": {
            "name": "section",
            "representation": "21",
            "title": "Determination of recognised majority union where two or more unions are involved. ",
            "context": "TRADE UNION RECOGNITION ACT under Determination of recognised majority union where two or more unions are involved. 21. (1) [Repealed by Act No. 1/2009]  (2) Where two or more trade unions have applied under section 18 in relation to the same bargaining unit, the Board shall carry out a secret poll among workers in the unit and shall certify as the recognised majority union for the unit the claimant union which is shown by the poll to have the greatest support among the workers, provided that no union shall be certified where less than forty percent of the workers take part in the ballot.  (3) Where the results of the poll show a tie or are inconclusive, a second poll shall be carried out within seven days, and in the event of a second tie or the results being inconclusive, a further poll shall be conducted within fourteen days:  Provided that where a certified union is being challenged and the challenging union satisfies the Board, by means of a survey, that the support of the challenging union among the workers in the unit is not less than forty per cent, the Board shall cause a poll to be taken, but the certificate of recognition of the challenged union shall not be cancelled where the challenging union fails to obtain a majority of not LAWS OF GUYANA Trade Union Recognition Cap. 98:07 17  L.R.O. 1/2012               Issue and contents of certificates.                                     Compulsory recognition and duty to treat.                  less than forty per cent amongst the workers in the unit.",
            "description": [
                {
                    "representation": "(1)",
                    "description": "[Repealed by Act No. 1/2009]"
                },
                {
                    "representation": "(2)",
                    "description": "Where two or more trade unions have applied under section 18 in relation to the same bargaining unit, the Board shall carry out a secret poll among workers in the unit and shall certify as the recognised majority union for the unit the claimant union which is shown by the poll to have the greatest support among the workers, provided that no union shall be certified where less than forty percent of the workers take part in the ballot."
                },
                {
                    "representation": "(3)",
                    "description": "Where the results of the poll show a tie or are inconclusive, a second poll shall be carried out within seven days, and in the event of a second tie or the results being inconclusive, a further poll shall be conducted within fourteen days:  Provided that where a certified union is being challenged and the challenging union satisfies the Board, by means of a survey, that the support of the challenging union among the workers in the unit is not less than forty per cent, the Board shall cause a poll to be taken, but the certificate of recognition of the challenged union shall not be cancelled where the challenging union fails to obtain a majority of not LAWS OF GUYANA Trade Union Recognition Cap. 98:07 17  L.R.O. 1/2012               Issue and contents of certificates.                                     Compulsory recognition and duty to treat.                  less than forty per cent amongst the workers in the unit."
                }
            ]
        }
    },
    {
        "act": "TRADE UNION RECOGNITION ACT",
        "source": "https://mola.gov.gy/laws-of-guyana",
        "type": {
            "name": "section",
            "representation": "22",
            "title": "Issue and contents of certificate. ",
            "context": "TRADE UNION RECOGNITION ACT under Issue and contents of certificate. 22. (1) The Board shall issue a certificate under its seal to the union and to the employer in every case in which it certifies a trade union as the recognised majority union.  (2) The certificate shall contain a statement of the following particulars  (a)    the  name  of  the employer and the trade union thereby certified;  (b)   the category or categories of workers comprised in the bargaining unit;  (c)    the number of workers comprised in the bargaining unit at the relevant date; and  (d)   such other matters as may be prescribed.",
            "description": [
                {
                    "representation": "(1)",
                    "description": "The Board shall issue a certificate under its seal to the union and to the employer in every case in which it certifies a trade union as the recognised majority union."
                },
                {
                    "representation": "(2)",
                    "description": "The certificate shall contain a statement of the following particulars"
                },
                {
                    "representation": "(a)",
                    "description": "the  name  of  the employer and the trade union thereby certified;"
                },
                {
                    "representation": "(b)",
                    "description": "the category or categories of workers comprised in the bargaining unit;"
                },
                {
                    "representation": "(c)",
                    "description": "the number of workers comprised in the bargaining unit at the relevant date; and"
                },
                {
                    "representation": "(d)",
                    "description": "such other matters as may be prescribed."
                }
            ]
        }
    },
    {
        "act": "TRADE UNION RECOGNITION ACT",
        "source": "https://mola.gov.gy/laws-of-guyana",
        "type": {
            "name": "section",
            "representation": "23",
            "title": "Compulsory recognition and duty to treat. ",
            "context": "TRADE UNION RECOGNITION ACT under Compulsory recognition and duty to treat. 23. (1) Where a trade union obtains a certificate of recognition for workers comprised in a bargaining unit in accordance with this Part, the employer shall recognise the union, and the union and the employer shall bargain in good faith and enter into negotiations with each other for the purpose of collective bargaining.  (2) A recognised union which fails to comply with the provisions of subsection (1) shall be guilty of an offence and liable on summary conviction to a fine of twenty-eight thousand dollars.  (3) An employer who fails to comply with the provisions of subsection (1) shall be guilty of an offence and liable on summary conviction to a fine of twenty-eight thousand dollars and in addition, to a fine of five hundred LAWS OF GUYANA 18 Cap. 98:07 Trade Union Recognition  L.R.O. 1/2012                                                Record of certification.            dollars for every day the breach continues until the employer has complied with such provisions.  (4) Where a trade union has been certified under section 22, or has made application for certification under section 18, an employer who decides to close an undertaking must give the Board and the concerned trade union  (a)      reasonable notice of his intention;   (b)      reasons for his decision; and  (c)     the numbers and categories of workers to be affected.  (5) The union concerned must be consulted before the final decision to close is taken.  (6) An employer who closes an undertaking without complying with subsections (4) and (5) shall be guilty of an offence and shall be liable on summary conviction to a fine of fifty-six thousand dollars and to imprisonment for six months.  (7) In any prosecution under subsection (6) the onus shall be on the employer to prove that he gave the Board and the union concerned reasonable notice and reasons in accordance with subsection (4).",
            "description": [
                {
                    "representation": "(1)",
                    "description": "shall be guilty of an offence and liable on summary conviction to a fine of twenty-eight thousand dollars and in addition, to a fine of five hundred LAWS OF GUYANA 18 Cap. 98:07 Trade Union Recognition  L.R.O. 1/2012                                                Record of certification.            dollars for every day the breach continues until the employer has complied with such provisions."
                },
                {
                    "representation": "(2)",
                    "description": "A recognised union which fails to comply with the provisions of subsection"
                },
                {
                    "representation": "(3)",
                    "description": "An employer who fails to comply with the provisions of subsection"
                },
                {
                    "representation": "(4)",
                    "description": "and"
                },
                {
                    "representation": "(a)",
                    "description": "reasonable notice of his intention;"
                },
                {
                    "representation": "(b)",
                    "description": "reasons for his decision; and"
                },
                {
                    "representation": "(c)",
                    "description": "the numbers and categories of workers to be affected."
                },
                {
                    "representation": "(5)",
                    "description": "shall be guilty of an offence and shall be liable on summary conviction to a fine of fifty-six thousand dollars and to imprisonment for six months."
                },
                {
                    "representation": "(6)",
                    "description": "the onus shall be on the employer to prove that he gave the Board and the union concerned reasonable notice and reasons in accordance with subsection"
                },
                {
                    "representation": "(7)",
                    "description": "In any prosecution under subsection"
                }
            ]
        }
    },
    {
        "act": "TRADE UNION RECOGNITION ACT",
        "source": "https://mola.gov.gy/laws-of-guyana",
        "type": {
            "name": "section",
            "representation": "24",
            "title": "Record of certification. ",
            "context": "TRADE UNION RECOGNITION ACT under Record of certification. 24. (1) Every trade union shall keep a record of its certification made by the Board under section 22, in the prescribed form for the purposes of this Act.  (2) The production of the record or of a copy of the relevant portion thereof certified by the Secretary of the Board shall be admissible in all courts and shall be conclusive proof of the matters therein stated.  LAWS OF GUYANA Trade Union Recognition Cap. 98:07 19  L.R.O. 1/2012 Offences by trade unions. [1 of 2009]                                  Offences by employers.",
            "description": [
                {
                    "representation": "(1)",
                    "description": "Every trade union shall keep a record of its certification made by the Board under section 22, in the prescribed form for the purposes of this Act."
                },
                {
                    "representation": "(2)",
                    "description": "The production of the record or of a copy of the relevant portion thereof certified by the Secretary of the Board shall be admissible in all courts and shall be conclusive proof of the matters therein stated.  LAWS OF GUYANA Trade Union Recognition Cap. 98:07 19  L.R.O. 1/2012 Offences by trade unions. [1 of 2009]                                  Offences by employers."
                }
            ]
        }
    },
    {
        "act": "TRADE UNION RECOGNITION ACT",
        "source": "https://mola.gov.gy/laws-of-guyana",
        "type": {
            "name": "section",
            "representation": "25",
            "title": "Offences by trade unions. ",
            "context": "TRADE UNION RECOGNITION ACT under Offences by trade unions. 25. (1) (a) Except where the Board has failed to determine the application within the period of four months any trade union which in furtherance of a claim to be certified as the recognised union for the whole or any part of that unit, induces workers to strike shall be guilty of an offence and liable on summary conviction to a fine of twenty-eight thousand dollars.  (b) Subject to subsection (1) (a), any worker who in furtherance of a claim by union to be certified under section 22, takes part in a strike shall be guilty of an offence and liable on summary conviction to a fine of seven thousand dollars.  (2) Subject to subsection (1) (a), where an offence has been committed under this section by a trade union with the consent or connivance of any officer of the union or any person purporting to act in such capacity, such officer or person shall be guilty of an offence and liable on summary conviction to a fine of twenty-eight thousand dollars.",
            "description": [
                {
                    "representation": "(1)",
                    "description": "(a), where an offence has been committed under this section by a trade union with the consent or connivance of any officer of the union or any person purporting to act in such capacity, such officer or person shall be guilty of an offence and liable on summary conviction to a fine of twenty-eight thousand dollars."
                },
                {
                    "representation": "(b)",
                    "description": "Subject to subsection"
                },
                {
                    "representation": "(2)",
                    "description": "Subject to subsection"
                }
            ]
        }
    },
    {
        "act": "TRADE UNION RECOGNITION ACT",
        "source": "https://mola.gov.gy/laws-of-guyana",
        "type": {
            "name": "section",
            "representation": "26",
            "title": "Offences by employers. ",
            "context": "TRADE UNION RECOGNITION ACT under Offences by employers. 26. (1) No worker shall be dismissed, or have his employment adversely affected, or his position altered by his employer, by reason of the circumstances that the worker  (a)     is an officer, delegate or member of a trade union;  (b)     has appeared as a witness or has given any evidence in proceedings under this Act; or  (c)  has for reasonable cause absented himself from work without leave after he has made an application for leave for the purpose of carrying out his duties under the Act as an officer or delegate of a trade union and such LAWS OF GUYANA 20 Cap. 98:07 Trade Union Recognition  L.R.O. 1/2012                                                  leave has been unreasonably refused or withheld.    (2) An employer shall not  (a)    make  the employment  of a worker  subject to the condition that he shall or shall not become a member of a trade union or shall relinquish his membership of a trade union;  (b)   dismiss a worker, or adversely affect his employment, or alter his position to his prejudice by reason of his participation in the activities of a trade union outside his working hours;  (c)    with intent to dissuade or prevent a worker from becoming such officer, delegate or member, or from so appearing or giving evidence, threaten to dismiss him, or to affect his employment adversely or to alter his position to his prejudice by reason of the circumstances that the worker is or proposes to become, an officer, delegate or member of a trade union, or that worker proposes to appear as a witness or to give evidence in any proceeding under this Act.  (3) An employer who contravenes any of the provisions of subsection (1) or (2) shall be guilty of an offence and liable on summary conviction to a fine of twenty-eight thousand dollars; and the magistrate making the order for LAWS OF GUYANA Trade Union Recognition Cap. 98:07 21  L.R.O. 1/2012         Effect of certification as the recognised majority union.                                            New collective agreement of recognised majority union.   conviction shall also order that the worker be reimbursed any wage lost by him and direct that, notwithstanding any rule of law to the contrary, the worker be reinstated in his former position or in a similar position with terms and conditions of employment no less favourable.",
            "description": [
                {
                    "representation": "(1)",
                    "description": "or"
                },
                {
                    "representation": "(a)",
                    "description": "make  the employment  of a worker  subject to the condition that he shall or shall not become a member of a trade union or shall relinquish his membership of a trade union;"
                },
                {
                    "representation": "(b)",
                    "description": "dismiss a worker, or adversely affect his employment, or alter his position to his prejudice by reason of his participation in the activities of a trade union outside his working hours;"
                },
                {
                    "representation": "(c)",
                    "description": "with intent to dissuade or prevent a worker from becoming such officer, delegate or member, or from so appearing or giving evidence, threaten to dismiss him, or to affect his employment adversely or to alter his position to his prejudice by reason of the circumstances that the worker is or proposes to become, an officer, delegate or member of a trade union, or that worker proposes to appear as a witness or to give evidence in any proceeding under this Act."
                },
                {
                    "representation": "(2)",
                    "description": "shall be guilty of an offence and liable on summary conviction to a fine of twenty-eight thousand dollars; and the magistrate making the order for LAWS OF GUYANA Trade Union Recognition Cap. 98:07 21  L.R.O. 1/2012         Effect of certification as the recognised majority union.                                            New collective agreement of recognised majority union.   conviction shall also order that the worker be reimbursed any wage lost by him and direct that, notwithstanding any rule of law to the contrary, the worker be reinstated in his former position or in a similar position with terms and conditions of employment no less favourable."
                },
                {
                    "representation": "(3)",
                    "description": "An employer who contravenes any of the provisions of subsection"
                }
            ]
        }
    },
    {
        "act": "TRADE UNION RECOGNITION ACT",
        "source": "https://mola.gov.gy/laws-of-guyana",
        "type": {
            "name": "section",
            "representation": "27",
            "title": "Effect of certification as the recognised majority union. ",
            "context": "TRADE UNION RECOGNITION ACT under Effect of certification as the recognised majority union. 27. Where a trade union is certified as the recognised majority union   (a)    such union shall immediately replace any other trade union that immediately before such certification was the recognised union for the workers comprised in the bargaining unit and, subject to paragraph (c), shall have exclusive authority to enter into collective bargaining on behalf of workers in that unit;  (b)    if another trade union has previously been certified in respect of workers comprised in the bargaining unit, the certificate of the last mentioned trade union shall be revoked in respect of such workers;  (c)    if, at the time of certification a collective agreement is in force, such trade union shall be substituted as a party to the agreement in place of the union that was a party to the agreement.",
            "description": [
                {
                    "representation": "(a)",
                    "description": "such union shall immediately replace any other trade union that immediately before such certification was the recognised union for the workers comprised in the bargaining unit and, subject to paragraph"
                },
                {
                    "representation": "(b)",
                    "description": "if another trade union has previously been certified in respect of workers comprised in the bargaining unit, the certificate of the last mentioned trade union shall be revoked in respect of such workers;"
                },
                {
                    "representation": "(c)",
                    "description": "if, at the time of certification a collective agreement is in force, such trade union shall be substituted as a party to the agreement in place of the union that was a party to the agreement."
                }
            ]
        }
    },
    {
        "act": "TRADE UNION RECOGNITION ACT",
        "source": "https://mola.gov.gy/laws-of-guyana",
        "type": {
            "name": "section",
            "representation": "28",
            "title": "New collective agreement of recognised majority union. ",
            "context": "TRADE UNION RECOGNITION ACT under New collective agreement of recognised majority union. 28. Where a recognised majority union is substituted as a party to a collective agreement in accordance with section 27 (c), the union so substituted as a party to the collective agreement may submit to the employer proposals for the revision of the collective agreement or for a new LAWS OF GUYANA 22 Cap. 98:07 Trade Union Recognition  L.R.O. 1/2012            Limitation on application for certification.                                      collective agreement and the parties shall bring into effect, the revised or new collective agreement expeditiously the collective agreement in force so remaining until a new collective agreement is signed.",
            "description": "Where a recognised majority union is substituted as a party to a collective agreement in accordance with section 27 (c), the union so substituted as a party to the collective agreement may submit to the employer proposals for the revision of the collective agreement or for a new LAWS OF GUYANA 22 Cap. 98:07 Trade Union Recognition  L.R.O. 1/2012            Limitation on application for certification.                                      collective agreement and the parties shall bring into effect, the revised or new collective agreement expeditiously the collective agreement in force so remaining until a new collective agreement is signed."
        }
    },
    {
        "act": "TRADE UNION RECOGNITION ACT",
        "source": "https://mola.gov.gy/laws-of-guyana",
        "type": {
            "name": "section",
            "representation": "29",
            "title": "Limitations on application for certification. ",
            "context": "TRADE UNION RECOGNITION ACT under Limitations on application for certification. 29. (1) No application for certification of recognition shall be entertained or proceeded with where  (a)     there is a recognised majority union for the same bargaining unit described in the application; and  (b)     the application is made earlier than two years after the recognised majority union obtained certification as such, but an application may be made with leave of the Board although two years have not expired since the certification was obtained.  (2) Where a union desires to obtain leave of the Board pursuant to subsection (1) (b) it shall make an application to the Board for the purpose, and if the Board is satisfied that good reasons exist for making the application for certification of recognition before the expiration of the period of two years, the Board may grant leave accordingly.  (3) In determining whether good reasons exist under subsection (2), the question, whether the union making the application to the Board, has the support of more than fifty per cent of the workers comprised in the bargaining unit for which the recognised majority union is certified, may be taken into account, but may not be the sole reason on which leave is to be granted.  (4) No application for certification of recognition may be made by a trade union earlier that twelve months LAWS OF GUYANA Trade Union Recognition Cap. 98:07 23  L.R.O. 1/2012                   Variation of bargaining unit after certifica- tion.                            from the date when the application made by that union for certification with respect to the same bargaining unit was last determined or from the date when its certificate of recognition was cancelled.   (5) An application for certification of recognition once made may not be withdrawn, except with leave of the Board. (6) Where a union is dissatisfied with the, decision of the Board made under subsection (2), the union shall have a right of appeal to the Minister.",
            "description": [
                {
                    "representation": "(1)",
                    "description": "(b) it shall make an application to the Board for the purpose, and if the Board is satisfied that good reasons exist for making the application for certification of recognition before the expiration of the period of two years, the Board may grant leave accordingly."
                },
                {
                    "representation": "(a)",
                    "description": "there is a recognised majority union for the same bargaining unit described in the application; and"
                },
                {
                    "representation": "(b)",
                    "description": "the application is made earlier than two years after the recognised majority union obtained certification as such, but an application may be made with leave of the Board although two years have not expired since the certification was obtained."
                },
                {
                    "representation": "(2)",
                    "description": "Where a union desires to obtain leave of the Board pursuant to subsection"
                },
                {
                    "representation": "(3)",
                    "description": "In determining whether good reasons exist under subsection"
                },
                {
                    "representation": "(4)",
                    "description": "No application for certification of recognition may be made by a trade union earlier that twelve months LAWS OF GUYANA Trade Union Recognition Cap. 98:07 23  L.R.O. 1/2012                   Variation of bargaining unit after certifica- tion.                            from the date when the application made by that union for certification with respect to the same bargaining unit was last determined or from the date when its certificate of recognition was cancelled."
                },
                {
                    "representation": "(5)",
                    "description": "An application for certification of recognition once made may not be withdrawn, except with leave of the Board."
                },
                {
                    "representation": "(6)",
                    "description": "Where a union is dissatisfied with the, decision of the Board made under subsection"
                }
            ]
        }
    },
    {
        "act": "TRADE UNION RECOGNITION ACT",
        "source": "https://mola.gov.gy/laws-of-guyana",
        "type": {
            "name": "section",
            "representation": "30",
            "title": "Variation of bargaining unit after certification. ",
            "context": "TRADE UNION RECOGNITION ACT under Variation of bargaining unit after certification. 30. (1) The bargaining unit and record of certification, or recognition may be varied in accordance with the provisions of this section.  (2) Application may be made to the Board, for variation of the bargaining unit not earlier than one year after the date of the certificate of recognition.  (3) An application for variation of the bargaining unit may be made by  (a)     the recognised majority union;   (b)     the employer;  (c)    workers employed in the bargaining unit for which the union is certified, for the exclusion from that bargaining unit of those workers or any of them on the ground that it is no longer an appropriate bargaining unit in so far as it includes those workers or any of them; or  (d)    workers not so employed but LAWS OF GUYANA 24 Cap. 98:07 Trade Union Recognition  L.R.O. 1/2012                                Poll for continued certification.              Prosecutions.             employed by the same employer, for their inclusion in the bargaining unit for which the union is an appropriate bargaining unit for the inclusion of those workers.  (4) The Board shall not entertain an application under subsection 3 (c) unless it is satisfied that not less than fifty percent of the workers comprised in the bargaining unit have signified in writing their concurrence in the application.  (5) Where, on an application under subsection (3) the Board is satisfied, after having considered the circumstances set out in section 19, that workers should be excluded from, or included in, a bargaining unit, it may vary the bargaining unit accordingly and make an order for the variation of the certification and record thereof, made under section",
            "description": [
                {
                    "representation": "(1)",
                    "description": "The bargaining unit and record of certification, or recognition may be varied in accordance with the provisions of this section."
                },
                {
                    "representation": "(2)",
                    "description": "Application may be made to the Board, for variation of the bargaining unit not earlier than one year after the date of the certificate of recognition."
                },
                {
                    "representation": "(3)",
                    "description": "the Board is satisfied, after having considered the circumstances set out in section 19, that workers should be excluded from, or included in, a bargaining unit, it may vary the bargaining unit accordingly and make an order for the variation of the certification and record thereof, made under section"
                },
                {
                    "representation": "(a)",
                    "description": "the recognised majority union;"
                },
                {
                    "representation": "(b)",
                    "description": "the employer;"
                },
                {
                    "representation": "(c)",
                    "description": "unless it is satisfied that not less than fifty percent of the workers comprised in the bargaining unit have signified in writing their concurrence in the application."
                },
                {
                    "representation": "(d)",
                    "description": "workers not so employed but LAWS OF GUYANA 24 Cap. 98:07 Trade Union Recognition  L.R.O. 1/2012                                Poll for continued certification.              Prosecutions.             employed by the same employer, for their inclusion in the bargaining unit for which the union is an appropriate bargaining unit for the inclusion of those workers."
                },
                {
                    "representation": "(4)",
                    "description": "The Board shall not entertain an application under subsection 3"
                },
                {
                    "representation": "(5)",
                    "description": "Where, on an application under subsection"
                }
            ]
        }
    },
    {
        "act": "TRADE UNION RECOGNITION ACT",
        "source": "https://mola.gov.gy/laws-of-guyana",
        "type": {
            "name": "section",
            "representation": "31",
            "title": "Poll for continued certification. ",
            "context": "TRADE UNION RECOGNITION ACT under Poll for continued certification. 31. On an application made by a minimum of forty per cent of workers in a bargaining unit for which a union is certified the Board shall cause a poll to be taken to determine whether the union shall continue to be so certified.",
            "description": "On an application made by a minimum of forty per cent of workers in a bargaining unit for which a union is certified the Board shall cause a poll to be taken to determine whether the union shall continue to be so certified."
        }
    },
    {
        "act": "TRADE UNION RECOGNITION ACT",
        "source": "https://mola.gov.gy/laws-of-guyana",
        "type": {
            "name": "section",
            "representation": "32",
            "title": "[Repealed by Act No. 1 of ",
            "context": "TRADE UNION RECOGNITION ACT under [Repealed by Act No. 1 of 32. [Repealed by Act No. 1 of 2009]  PART IV PROSECUTIONS",
            "description": "[Repealed by Act No. 1 of 2009]  PART IV PROSECUTIONS"
        }
    },
    {
        "act": "TRADE UNION RECOGNITION ACT",
        "source": "https://mola.gov.gy/laws-of-guyana",
        "type": {
            "name": "section",
            "representation": "33",
            "title": "Prosecutions. ",
            "context": "TRADE UNION RECOGNITION ACT under Prosecutions. 33. Subject to article 187 of the Constitution, no prosecution shall be commenced for any offence under this Act unless authorised by the Board.  LAWS OF GUYANA Trade Union Recognition Cap. 98:07 25  L.R.O. 1/2012   Recovery of fines and wages.          c. 7:01           Where State is employer.                      Rules. [1 of 2009]                    Regulations.",
            "description": "Subject to article 187 of the Constitution, no prosecution shall be commenced for any offence under this Act unless authorised by the Board.  LAWS OF GUYANA Trade Union Recognition Cap. 98:07 25  L.R.O. 1/2012   Recovery of fines and wages.          c. 7:01           Where State is employer.                      Rules. [1 of 2009]                    Regulations."
        }
    },
    {
        "act": "TRADE UNION RECOGNITION ACT",
        "source": "https://mola.gov.gy/laws-of-guyana",
        "type": {
            "name": "section",
            "representation": "34",
            "title": "Recovery of fines and wages. ",
            "context": "TRADE UNION RECOGNITION ACT under Recovery of fines and wages. 34. Where any person is convicted for an offence under this Act, the order imposing any fine, or requiring the reimbursement of any wages lost, may also direct that the fine or wages, if not paid in accordance with the order, may be recovered by levying execution in accordance with the provisions of Part IV of the Summary Jurisdiction (Petty Debt) Act, as if the order were a judgement for the payment of money with the meaning of that Part, and thereupon, execution may be levied accordingly.",
            "description": "Where any person is convicted for an offence under this Act, the order imposing any fine, or requiring the reimbursement of any wages lost, may also direct that the fine or wages, if not paid in accordance with the order, may be recovered by levying execution in accordance with the provisions of Part IV of the Summary Jurisdiction (Petty Debt) Act, as if the order were a judgement for the payment of money with the meaning of that Part, and thereupon, execution may be levied accordingly."
        }
    },
    {
        "act": "TRADE UNION RECOGNITION ACT",
        "source": "https://mola.gov.gy/laws-of-guyana",
        "type": {
            "name": "section",
            "representation": "35",
            "title": "Where State is employer.  PART V RULES, REGULATIONS  ",
            "context": "TRADE UNION RECOGNITION ACT under Where State is employer.  PART V RULES, REGULATIONS  35. Notwithstanding the provisions of this Act, where the State is the employer the State or any agent or representative of the State shall not be liable to prosecution under this Act but an aggrieved party may apply to the High Court for a declaration and the High Court may make an order declaratory of the rights of such party.   PART V RULES, REGULATIONS",
            "description": "Notwithstanding the provisions of this Act, where the State is the employer the State or any agent or representative of the State shall not be liable to prosecution under this Act but an aggrieved party may apply to the High Court for a declaration and the High Court may make an order declaratory of the rights of such party.   PART V RULES, REGULATIONS"
        }
    },
    {
        "act": "TRADE UNION RECOGNITION ACT",
        "source": "https://mola.gov.gy/laws-of-guyana",
        "type": {
            "name": "section",
            "representation": "36",
            "title": "Rules. ",
            "context": "TRADE UNION RECOGNITION ACT under Rules. 36. Subject to this Act and to any regulations made thereunder, the Board may make rules providing for the form and manner in which matters may be brought before it and determined:  Provided that before such rules are made they shall be sent to the most representative associations of workers and the most representative associations of employers, trade unions and employers respectively, for their comments.",
            "description": "Subject to this Act and to any regulations made thereunder, the Board may make rules providing for the form and manner in which matters may be brought before it and determined:  Provided that before such rules are made they shall be sent to the most representative associations of workers and the most representative associations of employers, trade unions and employers respectively, for their comments."
        }
    },
    {
        "act": "TRADE UNION RECOGNITION ACT",
        "source": "https://mola.gov.gy/laws-of-guyana",
        "type": {
            "name": "section",
            "representation": "37",
            "title": "Regulations. __________________________    33 of 1997 An Act to provide for the improvement and promotion of industrial relations by the establishment of procedures for the certifying of trade unions as recognised majority unions and for matters connected therewith.  [16TH NOVEMBER,1998] TRADE UNION RECOGNITION ACT  CHAPTER 98:07 LAWS OF GUYANA Trade Union Recognition Cap. 98:07 5  L.R.O. 1/2012 Short title.        Interpretation. [1 of 2009]                                           ",
            "context": "TRADE UNION RECOGNITION ACT under Regulations. __________________________    33 of 1997 An Act to provide for the improvement and promotion of industrial relations by the establishment of procedures for the certifying of trade unions as recognised majority unions and for matters connected therewith.  [16TH NOVEMBER,1998] TRADE UNION RECOGNITION ACT  CHAPTER 98:07 LAWS OF GUYANA Trade Union Recognition Cap. 98:07 5  L.R.O. 1/2012 Short title.        Interpretation. [1 of 2009]                                           37. (1) The Minister may make regulations generally for carrying out the provisions of this Act, and, without prejudice to the generality of the foregoing, regulations may   (a)     provide for the conduct of surveys and polls; and  (b)  prescribe anything which is to be LAWS OF GUYANA 26 Cap. 98:07 Trade Union Recognition  L.R.O. 1/2012  prescribed under this Act.  (2) A person who contravenes any of the regulations made under this Act, shall on summary conviction be liable to a fine of twenty-eight thousand dollars, and in the case of a   continuing offence, to a further fine of two thousand dollars for each day during which the offence continues.  _______________   LAWS OF GUYANA                                           Trade Union Recognition  Cap.",
            "description": [
                {
                    "representation": "(1)",
                    "description": "The Minister may make regulations generally for carrying out the provisions of this Act, and, without prejudice to the generality of the foregoing, regulations may"
                },
                {
                    "representation": "(a)",
                    "description": "provide for the conduct of surveys and polls; and"
                },
                {
                    "representation": "(b)",
                    "description": "prescribe anything which is to be LAWS OF GUYANA 26 Cap. 98:07 Trade Union Recognition  L.R.O. 1/2012  prescribed under this Act."
                },
                {
                    "representation": "(2)",
                    "description": "A person who contravenes any of the regulations made under this Act, shall on summary conviction be liable to a fine of twenty-eight thousand dollars, and in the case of a   continuing offence, to a further fine of two thousand dollars for each day during which the offence continues.  _______________   LAWS OF GUYANA                                           Trade Union Recognition  Cap."
                }
            ]
        }
    }
]