[
    {
        "act": "OCCUPATIONAL SAFETY AND HEALTH ACT",
        "source": "https://mola.gov.gy/laws-of-guyana",
        "type": {
            "name": "section",
            "representation": "1",
            "title": "Short title. ",
            "context": "OCCUPATIONAL SAFETY AND HEALTH ACT under Short title. 1. This Act may be cited as the Occupational Safety and Health Act.",
            "description": "This Act may be cited as the Occupational Safety and Health Act."
        }
    },
    {
        "act": "OCCUPATIONAL SAFETY AND HEALTH ACT",
        "source": "https://mola.gov.gy/laws-of-guyana",
        "type": {
            "name": "section",
            "representation": "2",
            "title": "Interpretation. ",
            "context": "OCCUPATIONAL SAFETY AND HEALTH ACT under Interpretation. 2. (1) In this Act  Advisory Council means the National Advisory Council on Occupational Safety and Health established under section 10;  agricultural undertaking means an undertaking or part thereof engaged in cultivation, animal husbandry including livestock production and care, forestry, horticulture, the primary processing of agricultural  products or any other  form of agricultural activity;  air-receiver means  (a) any vessel (other than a pipe or coil, or an accessory, fitting or part of a compressor) for containing compressed air and connected with an air compressing plant;  (b) any fixed vessel for containing compressed air or compressed exhaust gases and used for the [9TH DECEMBER, 1997]  therewith or material thereto. health of persons at work, and for purposes connected industrial establishments, for occupational safety and An Act to provide for the registration and regulation of 32 of 1997 OCCUPATIONAL HEALTH AND SAFETY ACT  CHAPTER 99:06 LAWS OF GUYANA 8 Cap. 99:06 Occupational Safety and Health  L.R.O. 1/2012                                                 purpose of starting an internal combustion engine;  (c) any fixed or portable vessel (not being part of a spraying pistol) used for the purpose of spraying by means of compressed air, any paint, varnish, lacquer or similar material; or  (d) any vessel in which liquid is stored and from which it is forced by compressed air;  appointed day means the date on which this Act comes into operation;  article means an object which is formed to a specific shape or design during its manufacture or which in its natural shape, and whose use in that form is dependent in whole or in part on its shape or design;  Authority means the Occupational Safety and Health Authority established under section 12;  biological agent means bacteria, viruses, fungi, rickettsiae, chlamydia and parasites;  bodily injury includes injury to health;  chemical means a chemical element and compound, and a mixture thereof whether natural or synthetic;  child means a person under the age of fifteen;  Commissioner means the occupational safety and health commissioner appointed under section 21; LAWS OF GUYANA Occupational Safety and Health Cap. 99:06 9  L.R.O. 1/2012                                                  committee means a joint workplace safety and health committee established under section 23;   competent person means a person who  (a) is qualified because of knowledge, training and experience to organize the work and its performance; (b) is familiar with this Act and the regulations that apply to the work; and (c) has knowledge of any potential or actual danger to safety or health in the workplace;  construction includes   (a) building, including excavation and the construction, structural alteration, renovation; repair maintenance (including cleaning and painting) and demolition of all types of buildings or structures;  (b) civil engineering, including excavation and the construction, structural alteration, repair, maintenance and demolition of, for example, airports, docks, harbours, inland waterways, dams, river and avalanche and sea defence works, roads and highways, railways, bridges, tunnels, viaducts and works related to LAWS OF GUYANA 10 Cap. 99:06 Occupational Safety and Health  L.R.O. 1/2012                                                 the provision of services such as communications, drainage, sewerage, water and energy supplies; and  (c) the erection and dismantling of buildings and structures, as well as the manufacturing of prefabricated elements on the construction site;  construction site means any, site at which any of the processes or operations described in the definition of the term construction are carried on;  critical substance means a chemical, physical agent or biological agent, or combination thereof prescribed as a critical substance to which the exposure of a worker is prohibited, regulated, restricted, limited or controlled;  domestic worker means a person employed to do household work in another persons home or dwelling;  driving-belt includes any driving strap, rope or chain;   employer means  (a) any person who employs one or more workers;  (b) attorney, agent, foreman, manager, supervisor, clerk and any other person engaged in the hiring or superintending the labour or service of any worker;   LAWS OF GUYANA Occupational Safety and Health Cap. 99:06 11  L.R.O. 1/2012               c. 95:02                                      (c) as the context requires, the operator, principal contractor, contractor or subcontractor;  existing industrial establishment means any industrial establishment which is in operation on the appointed day;  factory has the same meaning as in sections 2 and 3 of the Factories Act and includes any agricultural undertaking, construction site or logging operation which is outside the scope of the definition of factory in that Act;  fume includes gas, vapour or smoke;  hazardous biological agent means any biological agent at an excessive level for which relevant information exists to indicate that the biological agent at this level is hazardous;  hazardous chemical means any chemical which has been classified as hazardous in accordance with Article 6 of the International Labour Organisation Convention (No. 170) or for which relevant information exists to indicate that the chemical is hazardous;  hazardous physical agent means any physical agent at excessive level for which relevant information exists to indicate that the physical agent at this level is hazardous;  hazardous substances means a substance or mixture of substances which by virtue of chemical, physical or toxicological properties either singly or in combination, constitutes a hazard;  homework means the doing or any work in the manufacture, preparation, improvement, repair, alteration, assembly or completion of any article or any LAWS OF GUYANA 12 Cap. 99:06 Occupational Safety and Health  L.R.O. 1/2012                                                 part thereof by a worker for wages in his own home or other promises occupied primarily as living accommodation;  International Labour Organisation Convention (No. 170) means the International Labour Organisation Convention concerning safety in the use of chemicals at work adopted in Geneva on 25th day of June 1990;  industrial establishment means a factory, shop, office, or workplace and any, building or other structure or premises appertaining thereto but does not include premises occupied for residential purposes only;  inspector means any person who is designated as an inspector under section 12;  logging operation means the operation of felling or trimming trees for commercial or industrial purposes or for the clearing of land, and includes the measuring storing, transporting or floating of logs, the maintenance of haul roads, scarification, the carrying out of planned burns and the practice of silviculture;  major hazard installation means an installation which produces, processes, handles, uses, disposes of or stores, either permanently or temporarily; one or more hazardous substances or categories of substances in quantities which exceed the threshold quantity as prescribed;  machinery includes  (a) stationary or portable boilers in an industrial establishment;  (b) steam or other engines in an industrial establishment; LAWS OF GUYANA Occupational Safety and Health Cap. 99:06 13  L.R.O. 1/2012                                                  (c) all apparatus or appliances for generating, developing, receiving or transforming, or measuring or testing the volume, voltage, pressure or frequency of, or for distributing or applying any mechanical, electric or natural power to any industrial or manufacturing process in an industrial establishment;  (d) furnaces and fuel or storage tanks situate within, opening into or attached to the structure of, or directly connected with, any industrial establishment;  (e) railway locomotives, tractors, road rollers or other type of road locomotive;  (f) marine boilers, steam receivers and air receivers on any ship or vessel which is not a foreign ship;  (g) vats, tanks, cooling or drying devices used for the storage of, or otherwise in connection with, the product of any mechanical process, and situate within or attached to the premises within which such process is carried on;   (h) any plant, or apparatus used to LAWS OF GUYANA 14 Cap. 99:06 Occupational Safety and Health  L.R.O. 1/2012                                                 generate, purify, mix, heat, or cool any fume, gas or vapour; and (j) any driving belt;  medical inspector means any registered practitioner who is designated as a medical inspector under section 15;  mine means  (a) any surface or underground site where the following activities, in particular, take place-  (i) exploration of mineral resources that involves the mechanical disturbance of the ground; (ii) the extraction of mineral resources; (iii) preparation, including crushing, grinding, concentration or washing of the extracted material;  (b) any machinery, equipment, appliance, plant, building, or civil engineering structure used in conjunction with any activity referred to in subparagraph (a);  new industrial establishment means any industrial establishment which first commences to operate at some time after the appointed day;  occupational disease means  (a) a disease  prescribed as  an LAWS OF GUYANA Occupational Safety and Health Cap. 99:06 15  L.R.O. 1/2012                                                 occupational disease under section 75(2) (C) (e);  (b) a work-related disease;  occupier means the person who controls the industrial establishment and the work that is done there;  owner means the person for the time being receiving the rackrent of the premises used as an industrial establishment, whether on his own account or as agent, trustee, receiver, mortgagee in possession for any other person, or who would so receive the rent if the premises were let at a rackrent;  physical agent includes electromagnetic radiation, ionising radiation, noise, vibration, heat, cold, humidity and pressure;  power means electrical energy, and any other form of energy which is mechanically transmitted and is not generated by human or animal energy;  prescribed means prescribed by this Act or a regulation made under this Act;  prime mover means every engine, motor or other appliance which provides mechanical energy derived from steam, water, wind, electricity, the combustion of fuel or other source;  sanitary conveniences includes urinals, water-closets, or closets, privies and any similar conveniences;  safety and health  representative means a safety and health representative selected under section 22;  ship, vessel and harbour have the same meanings as LAWS OF GUYANA 16 Cap. 99:06 Occupational Safety and Health  L.R.O. 1/2012                         c. 98:03                        are respectively assigned to them in any law relating to shipping;  shop means a building, booth or stall or a part of such building, booth of stall where goods are handled, exposed or offered for sale or where services are offered for sale;  supervisor means a person who has charge of a work place or authority over a worker;  technical examiner means a person who is designated as a technical examiner under section 20;  threshold quantity means for a given hazardous  substance  or category of substances that quantity, as prescribed, which if exceeded identifies a major hazard installation;  trade union has the same meaning assigned to it in the Trade Unions Act;  woman means a woman who has attained the age of 18 years;   worker means any employed person and apprentice;  workplace means any industrial establishment or place or premises where a worker needs to be or go by reason of his or her work and which is under the direct or indirect control of the employer;  work-related disease means a condition that results from exposure of a worker in a workplace to a chemical, physical agent, or biological agent to the extent that the normal physiological mechanisms of such worker is affected and his health impaired thereby;  young person means a person who has ceased to be a child LAWS OF GUYANA Occupational Safety and Health Cap. 99:06 17  L.R.O. 1/2012                                                 and has not attained the age of eighteen years.  (2) Premises shall not be excluded from the definition of an industrial establishment by reason only that they are open air premises.  (3) Any premises belonging to or in occupation of the state or any municipal or any other public or local government authority shall not be excluded from the definition of an industrial establishment;  (4) A person who works in an industrial establishment whether for wages or not, either in a process or in clearing or oiling any part of the machinery or plant, or in any other land of work whatsoever incidental to or connected with the process, or connected with the article made or otherwise the subject of the process therein, shall save as is otherwise provided by this Act, be deemed to be employed therein for the purposes of this Act and any proceedings thereunder.  (5) A young person who works in an industrial establishment, whether for wages or not, in collecting, carrying or delivering goods, carrying messages or running errands shall be deemed to be employed in the industrial establishment for the purposes of this Act or of any proceedings thereunder.  (6) For the purposes of this Act and the regulations, a ship being manufactured or under repair shall be deemed to be a construction site.  (7) An owner does not become an employer at a construction site by virtue only of the fact that the owner has engaged an architect, professional engineer or other person solely to oversee quality control at a construction site.  (8) Except where otherwise expressly provided, the LAWS OF GUYANA 18 Cap. 99:06 Occupational Safety and Health  L.R.O. 1/2012                  Application of Act to industrial establishment, etc.                                 Work in private residence.                    Self-employed person and provisions of this Act shall be in addition to and not in substitution for or in diminution of the provisions of any other written law.  (9) A reference to regulations in this Act, unless the context otherwise requires, means regulations made under this Act.",
            "description": [
                {
                    "representation": "(1)",
                    "description": "In this Act  Advisory Council means the National Advisory Council on Occupational Safety and Health established under section 10;  agricultural undertaking means an undertaking or part thereof engaged in cultivation, animal husbandry including livestock production and care, forestry, horticulture, the primary processing of agricultural  products or any other  form of agricultural activity;  air-receiver means"
                },
                {
                    "representation": "(a)",
                    "description": "a disease  prescribed as  an LAWS OF GUYANA Occupational Safety and Health Cap. 99:06 15  L.R.O. 1/2012                                                 occupational disease under section 75(2)"
                },
                {
                    "representation": "(b)",
                    "description": "a work-related disease;  occupier means the person who controls the industrial establishment and the work that is done there;  owner means the person for the time being receiving the rackrent of the premises used as an industrial establishment, whether on his own account or as agent, trustee, receiver, mortgagee in possession for any other person, or who would so receive the rent if the premises were let at a rackrent;  physical agent includes electromagnetic radiation, ionising radiation, noise, vibration, heat, cold, humidity and pressure;  power means electrical energy, and any other form of energy which is mechanically transmitted and is not generated by human or animal energy;  prescribed means prescribed by this Act or a regulation made under this Act;  prime mover means every engine, motor or other appliance which provides mechanical energy derived from steam, water, wind, electricity, the combustion of fuel or other source;  sanitary conveniences includes urinals, water-closets, or closets, privies and any similar conveniences;  safety and health  representative means a safety and health representative selected under section 22;  ship, vessel and harbour have the same meanings as LAWS OF GUYANA 16 Cap. 99:06 Occupational Safety and Health  L.R.O. 1/2012                         c. 98:03                        are respectively assigned to them in any law relating to shipping;  shop means a building, booth or stall or a part of such building, booth of stall where goods are handled, exposed or offered for sale or where services are offered for sale;  supervisor means a person who has charge of a work place or authority over a worker;  technical examiner means a person who is designated as a technical examiner under section 20;  threshold quantity means for a given hazardous  substance  or category of substances that quantity, as prescribed, which if exceeded identifies a major hazard installation;  trade union has the same meaning assigned to it in the Trade Unions Act;  woman means a woman who has attained the age of 18 years;   worker means any employed person and apprentice;  workplace means any industrial establishment or place or premises where a worker needs to be or go by reason of his or her work and which is under the direct or indirect control of the employer;  work-related disease means a condition that results from exposure of a worker in a workplace to a chemical, physical agent, or biological agent to the extent that the normal physiological mechanisms of such worker is affected and his health impaired thereby;  young person means a person who has ceased to be a child LAWS OF GUYANA Occupational Safety and Health Cap. 99:06 17  L.R.O. 1/2012                                                 and has not attained the age of eighteen years."
                },
                {
                    "representation": "(c)",
                    "description": "all apparatus or appliances for generating, developing, receiving or transforming, or measuring or testing the volume, voltage, pressure or frequency of, or for distributing or applying any mechanical, electric or natural power to any industrial or manufacturing process in an industrial establishment;"
                },
                {
                    "representation": "(d)",
                    "description": "furnaces and fuel or storage tanks situate within, opening into or attached to the structure of, or directly connected with, any industrial establishment;"
                },
                {
                    "representation": "(e)",
                    "description": "railway locomotives, tractors, road rollers or other type of road locomotive;"
                },
                {
                    "representation": "(f)",
                    "description": "marine boilers, steam receivers and air receivers on any ship or vessel which is not a foreign ship;"
                },
                {
                    "representation": "(g)",
                    "description": "vats, tanks, cooling or drying devices used for the storage of, or otherwise in connection with, the product of any mechanical process, and situate within or attached to the premises within which such process is carried on;"
                },
                {
                    "representation": "(h)",
                    "description": "any plant, or apparatus used to LAWS OF GUYANA 14 Cap. 99:06 Occupational Safety and Health  L.R.O. 1/2012                                                 generate, purify, mix, heat, or cool any fume, gas or vapour; and"
                },
                {
                    "representation": "(j)",
                    "description": "any driving belt;  medical inspector means any registered practitioner who is designated as a medical inspector under section 15;  mine means"
                },
                {
                    "representation": "(i)",
                    "description": "exploration of mineral resources that involves the mechanical disturbance of the ground;"
                },
                {
                    "representation": "(C)",
                    "description": "(e);"
                },
                {
                    "representation": "(2)",
                    "description": "Premises shall not be excluded from the definition of an industrial establishment by reason only that they are open air premises."
                },
                {
                    "representation": "(3)",
                    "description": "Any premises belonging to or in occupation of the state or any municipal or any other public or local government authority shall not be excluded from the definition of an industrial establishment;"
                },
                {
                    "representation": "(4)",
                    "description": "A person who works in an industrial establishment whether for wages or not, either in a process or in clearing or oiling any part of the machinery or plant, or in any other land of work whatsoever incidental to or connected with the process, or connected with the article made or otherwise the subject of the process therein, shall save as is otherwise provided by this Act, be deemed to be employed therein for the purposes of this Act and any proceedings thereunder."
                },
                {
                    "representation": "(5)",
                    "description": "A young person who works in an industrial establishment, whether for wages or not, in collecting, carrying or delivering goods, carrying messages or running errands shall be deemed to be employed in the industrial establishment for the purposes of this Act or of any proceedings thereunder."
                },
                {
                    "representation": "(6)",
                    "description": "For the purposes of this Act and the regulations, a ship being manufactured or under repair shall be deemed to be a construction site."
                },
                {
                    "representation": "(7)",
                    "description": "An owner does not become an employer at a construction site by virtue only of the fact that the owner has engaged an architect, professional engineer or other person solely to oversee quality control at a construction site."
                },
                {
                    "representation": "(8)",
                    "description": "Except where otherwise expressly provided, the LAWS OF GUYANA 18 Cap. 99:06 Occupational Safety and Health  L.R.O. 1/2012                  Application of Act to industrial establishment, etc.                                 Work in private residence.                    Self-employed person and provisions of this Act shall be in addition to and not in substitution for or in diminution of the provisions of any other written law."
                },
                {
                    "representation": "(9)",
                    "description": "A reference to regulations in this Act, unless the context otherwise requires, means regulations made under this Act."
                }
            ]
        }
    },
    {
        "act": "OCCUPATIONAL SAFETY AND HEALTH ACT",
        "source": "https://mola.gov.gy/laws-of-guyana",
        "type": {
            "name": "section",
            "representation": "3",
            "title": "Application of Act to industrial establishment, etc. ",
            "context": "OCCUPATIONAL SAFETY AND HEALTH ACT under Application of Act to industrial establishment, etc. 3. (1) Except where otherwise expressly provided, this Act shall apply to every industrial establishment and to all owners and occupiers thereof and employers and workers therein.  (2) Subject to section 73, this Act shall apply to industrial establishments belonging to or occupied by the State, but in case of any public emergency, the Minister may by order for the duration of the period  specified in the order, exempt from this Act any industrial establishment  (a) belonging to or occupied by the State;  (b) in which work is being carried out on behalf of the State; or  (c) whose activities are vital to the national interest.",
            "description": [
                {
                    "representation": "(1)",
                    "description": "Except where otherwise expressly provided, this Act shall apply to every industrial establishment and to all owners and occupiers thereof and employers and workers therein."
                },
                {
                    "representation": "(2)",
                    "description": "Subject to section 73, this Act shall apply to industrial establishments belonging to or occupied by the State, but in case of any public emergency, the Minister may by order for the duration of the period  specified in the order, exempt from this Act any industrial establishment"
                },
                {
                    "representation": "(a)",
                    "description": "belonging to or occupied by the State;"
                },
                {
                    "representation": "(b)",
                    "description": "in which work is being carried out on behalf of the State; or"
                },
                {
                    "representation": "(c)",
                    "description": "whose activities are vital to the national interest."
                }
            ]
        }
    },
    {
        "act": "OCCUPATIONAL SAFETY AND HEALTH ACT",
        "source": "https://mola.gov.gy/laws-of-guyana",
        "type": {
            "name": "section",
            "representation": "4",
            "title": "Work in private residence. ",
            "context": "OCCUPATIONAL SAFETY AND HEALTH ACT under Work in private residence. 4. (1) This Act shall not apply to work performed by the owner or occupant of a private residence in or about a private residence or the lands and appurtenances used in connection therewith.  (2) This Act shall apply to a domestic worker and to an owner or occupant of a private residence with respect to the work performed by the domestic worker for the owner or occupant of a private residence.",
            "description": [
                {
                    "representation": "(1)",
                    "description": "This Act shall not apply to work performed by the owner or occupant of a private residence in or about a private residence or the lands and appurtenances used in connection therewith."
                },
                {
                    "representation": "(2)",
                    "description": "This Act shall apply to a domestic worker and to an owner or occupant of a private residence with respect to the work performed by the domestic worker for the owner or occupant of a private residence."
                }
            ]
        }
    },
    {
        "act": "OCCUPATIONAL SAFETY AND HEALTH ACT",
        "source": "https://mola.gov.gy/laws-of-guyana",
        "type": {
            "name": "section",
            "representation": "5",
            "title": "Self-employed person and person engaged in homework.  PART II                     REGISTRATION OF INDUSTRIAL ESTABLISHMENTS  ",
            "context": "OCCUPATIONAL SAFETY AND HEALTH ACT under Self-employed person and person engaged in homework.  PART II                     REGISTRATION OF INDUSTRIAL ESTABLISHMENTS  5. (1) Sections 13, 16, 20, 30, 32, 33, 34, 35, 47, 48(l)(c), LAWS OF GUYANA Occupational Safety and Health Cap. 99:06 19  L.R.O. 1/2012 person engaged in homework.                          Register of industrial establishments and particulars thereof.                                         Application for registration of industrial (e), (f) and (g), 56, 59(l), 60,61, 62, 63, 64, 65, 69, 70, 77, 78, 79, 80, 81 and 82 and the regulations in relation thereto, shall apply mutatis mutandis to a self-employed person.  (2) Sections 13, 30-38, 46, 47, 49, 56-65, 67,70,71, 74,78 and 83 and the regulations in relation to fire escape, first aid, safety and health and welfare shall apply mutatis mutandis to workers engaged in homework and employers of those workers.  PART II REGISTRATION OF INDUSTRIAL ESTABLISHMENTS",
            "description": [
                {
                    "representation": "(1)",
                    "description": "Sections 13, 16, 20, 30, 32, 33, 34, 35, 47, 48(l)(c), LAWS OF GUYANA Occupational Safety and Health Cap. 99:06 19  L.R.O. 1/2012 person engaged in homework.                          Register of industrial establishments and particulars thereof.                                         Application for registration of industrial"
                },
                {
                    "representation": "(f)",
                    "description": "and"
                },
                {
                    "representation": "(2)",
                    "description": "Sections 13, 30-38, 46, 47, 49, 56-65, 67,70,71, 74,78 and 83 and the regulations in relation to fire escape, first aid, safety and health and welfare shall apply mutatis mutandis to workers engaged in homework and employers of those workers.  PART II REGISTRATION OF INDUSTRIAL ESTABLISHMENTS"
                }
            ]
        }
    },
    {
        "act": "OCCUPATIONAL SAFETY AND HEALTH ACT",
        "source": "https://mola.gov.gy/laws-of-guyana",
        "type": {
            "name": "section",
            "representation": "6",
            "title": "Register of industrial establishments and particulars thereof. ",
            "context": "OCCUPATIONAL SAFETY AND HEALTH ACT under Register of industrial establishments and particulars thereof. 6. (1) Every industrial establishment and the particulars thereof which are specified, in section 7 shall be registered under this Act with the Authority.  (2) Until compliance with the provisions of section 7(2). every registration done under any other law before the appointed day in respect of any existing industrial establishment, shall, be deemed to have been done under this Act and shall continue in effect under this Act for the purpose of the application of the provisions of this Act to such industrial establishment.  (3) The department responsible for registering any existing industrial establishment referred to in subsection (2) shall notify the Authority of the particulars or every such registration.  (4) The Authority shall keep a register of industrial establishments registered under section 7(l) and (2) and shall cause to be  entered therein the particulars from time to time registered in respect of application for registration of such industrial establishment.",
            "description": [
                {
                    "representation": "(1)",
                    "description": "Every industrial establishment and the particulars thereof which are specified, in section 7 shall be registered under this Act with the Authority."
                },
                {
                    "representation": "(2)",
                    "description": "and shall cause to be  entered therein the particulars from time to time registered in respect of application for registration of such industrial establishment."
                },
                {
                    "representation": "(3)",
                    "description": "The department responsible for registering any existing industrial establishment referred to in subsection"
                },
                {
                    "representation": "(4)",
                    "description": "The Authority shall keep a register of industrial establishments registered under section 7(l) and"
                }
            ]
        }
    },
    {
        "act": "OCCUPATIONAL SAFETY AND HEALTH ACT",
        "source": "https://mola.gov.gy/laws-of-guyana",
        "type": {
            "name": "section",
            "representation": "7",
            "title": "Application for registration of industrial establishment and particulars thereof. ",
            "context": "OCCUPATIONAL SAFETY AND HEALTH ACT under Application for registration of industrial establishment and particulars thereof. 7. (1) Every person who is the owner or employer of an industrial establishment shall LAWS OF GUYANA 20 Cap. 99:06 Occupational Safety and Health  L.R.O. 1/2012 establishment and particulars thereof.                                              (a) within thirty days after the appointed day, in the case of an existing industrial establishment not already registered under any other law;  (b) within thirty days after the industrial establishment commences to operate as such, in the case of a new industrial establishment; and  (c) within thirty days after the anniversary of every certificate of registration or continuation of registration or renewal of registration granted under subsection (4),  make application to the Authority in the prescribed form for the registration of such industrial establishment.  (2) Every person who is the owner or occupier of an existing industrial establishment referred to in section 6(2) shall within one year after the appointed day, make application to the Authority for a certificate of continuation of registration under this Act.  (3) Every application under subsection (1) or (2) shall contain the following particulars  (a) the names and addresses of the owner and of the occupier of the industrial establishment to which the application relates;  (b) the address and location of the industrial establishment;  (c) the nature and the object of the process carried on industrial LAWS OF GUYANA Occupational Safety and Health Cap. 99:06 21  L.R.O. 1/2012                                                 establishment;  (d) the number of employees employed in the industrial establishment  (i) normally; and (ii) at the date of application;  (e) the hazardous chemicals and hazardous physical agents present in the industrial establishment, as listed in the hazardous materials inventory required to be prepared under section 61(1) of this Act; and  (f) whether the industrial establishment or mine is a major hazard installation.  (4) The Authority shall, upon the receipt of an application under subsection (1) or (2) containing the particulars specified in subsection (3) forthwith cause to be registered or continued to be registered as the case may be, the industrial establishment, and the particulars thereof, to which the application relates, and the Authority shall issue to the applicant a certificate of registration or continuation of registration or renewal of registration, as the case may be of the  industrial establishment in the prescribed form.  (5) Every application for the registration or continuation of registration or renewal of registration shall be made on the prescribed form and accompanied by the prescribed fee.  (6) Any person who intends to erect or cause to be erected a new industrial establishment  or any  new  building appurtenant to any existing industrial establishment shall, before the erection of such industrial establishment or building is commenced, give notice in writing to the LAWS OF GUYANA 22 Cap. 99:06 Occupational Safety and Health  L.R.O. 1/2012       Application for registration of change in particulars registered.             Correction of register.                             Authority of his intention as aforesaid, and shall furnish the  Authority  with  such  drawings,  plans  or  specifications  as  are specified in section",
            "description": [
                {
                    "representation": "(1)",
                    "description": "or"
                },
                {
                    "representation": "(a)",
                    "description": "the names and addresses of the owner and of the occupier of the industrial establishment to which the application relates;"
                },
                {
                    "representation": "(b)",
                    "description": "the address and location of the industrial establishment;"
                },
                {
                    "representation": "(c)",
                    "description": "the nature and the object of the process carried on industrial LAWS OF GUYANA Occupational Safety and Health Cap. 99:06 21  L.R.O. 1/2012                                                 establishment;"
                },
                {
                    "representation": "(2)",
                    "description": "containing the particulars specified in subsection"
                },
                {
                    "representation": "(3)",
                    "description": "forthwith cause to be registered or continued to be registered as the case may be, the industrial establishment, and the particulars thereof, to which the application relates, and the Authority shall issue to the applicant a certificate of registration or continuation of registration or renewal of registration, as the case may be of the  industrial establishment in the prescribed form."
                },
                {
                    "representation": "(d)",
                    "description": "the number of employees employed in the industrial establishment"
                },
                {
                    "representation": "(i)",
                    "description": "normally; and"
                },
                {
                    "representation": "(e)",
                    "description": "the hazardous chemicals and hazardous physical agents present in the industrial establishment, as listed in the hazardous materials inventory required to be prepared under section 61(1) of this Act; and"
                },
                {
                    "representation": "(f)",
                    "description": "whether the industrial establishment or mine is a major hazard installation."
                },
                {
                    "representation": "(4)",
                    "description": "The Authority shall, upon the receipt of an application under subsection"
                },
                {
                    "representation": "(5)",
                    "description": "Every application for the registration or continuation of registration or renewal of registration shall be made on the prescribed form and accompanied by the prescribed fee."
                },
                {
                    "representation": "(6)",
                    "description": "Any person who intends to erect or cause to be erected a new industrial establishment  or any  new  building appurtenant to any existing industrial establishment shall, before the erection of such industrial establishment or building is commenced, give notice in writing to the LAWS OF GUYANA 22 Cap. 99:06 Occupational Safety and Health  L.R.O. 1/2012       Application for registration of change in particulars registered.             Correction of register.                             Authority of his intention as aforesaid, and shall furnish the  Authority  with  such  drawings,  plans  or  specifications  as  are specified in section"
                }
            ]
        }
    },
    {
        "act": "OCCUPATIONAL SAFETY AND HEALTH ACT",
        "source": "https://mola.gov.gy/laws-of-guyana",
        "type": {
            "name": "section",
            "representation": "8",
            "title": "Application for registration of change in particulars registered. ",
            "context": "OCCUPATIONAL SAFETY AND HEALTH ACT under Application for registration of change in particulars registered. 8. Where  any  change  takes place  in  any  of  the  particulars registered under section 7 (4), the owner or occupier for the time being of the  industrial establishment to which the particulars relate shall, within thirty days after the date upon which the change takes place, make application to the Authority for the registration of the change, and the Authority shall amend the register of industrial establishment accordingly and issue to the applicant a verification of registration of the change as aforesaid.",
            "description": "Where  any  change  takes place  in  any  of  the  particulars registered under section 7 (4), the owner or occupier for the time being of the  industrial establishment to which the particulars relate shall, within thirty days after the date upon which the change takes place, make application to the Authority for the registration of the change, and the Authority shall amend the register of industrial establishment accordingly and issue to the applicant a verification of registration of the change as aforesaid."
        }
    },
    {
        "act": "OCCUPATIONAL SAFETY AND HEALTH ACT",
        "source": "https://mola.gov.gy/laws-of-guyana",
        "type": {
            "name": "section",
            "representation": "9",
            "title": "Correction of register.  PART III ADMINISTRATION  (a) Governmental  ",
            "context": "OCCUPATIONAL SAFETY AND HEALTH ACT under Correction of register.  PART III ADMINISTRATION  (a) Governmental  9. (1) The Authority may take such steps as considered necessary to ascertain whether (a) any industrial establishment registered under this Act is being operated as an industrial establishment; or  (b) any change has taken place in the particulars registered under section 7 in respect of any industrial establishment.  (2) Where the Authority ascertains that any industrial establishment registered as aforesaid is not being operated as an industrial establishment, or that a change has taken place in the particulars registered as aforesaid in respect of any industrial establishment, the Authority shall remove the name of the industrial establishment from the register or shall make such amendment to the register as the circumstances may require.     LAWS OF GUYANA Occupational Safety and Health Cap. 99:06 23  L.R.O. 1/2012       Establishment and functions of National Advisory Council on Occupational Safety and Health.                                   PART III ADMINISTRATION  (a) Governmental",
            "description": [
                {
                    "representation": "(1)",
                    "description": "The Authority may take such steps as considered necessary to ascertain whether"
                },
                {
                    "representation": "(a)",
                    "description": "Governmental"
                },
                {
                    "representation": "(b)",
                    "description": "any change has taken place in the particulars registered under section 7 in respect of any industrial establishment."
                },
                {
                    "representation": "(2)",
                    "description": "Where the Authority ascertains that any industrial establishment registered as aforesaid is not being operated as an industrial establishment, or that a change has taken place in the particulars registered as aforesaid in respect of any industrial establishment, the Authority shall remove the name of the industrial establishment from the register or shall make such amendment to the register as the circumstances may require.     LAWS OF GUYANA Occupational Safety and Health Cap. 99:06 23  L.R.O. 1/2012       Establishment and functions of National Advisory Council on Occupational Safety and Health.                                   PART III ADMINISTRATION"
                }
            ]
        }
    },
    {
        "act": "OCCUPATIONAL SAFETY AND HEALTH ACT",
        "source": "https://mola.gov.gy/laws-of-guyana",
        "type": {
            "name": "section",
            "representation": "10",
            "title": "Establishment and functions of National Advisory Council on Occupational Safety and Health. ",
            "context": "OCCUPATIONAL SAFETY AND HEALTH ACT under Establishment and functions of National Advisory Council on Occupational Safety and Health. 10. (1) There is hereby established an Advisory Council to be known as the Advisory Council on Occupational Safety and Health consisting of not less than twelve nor more than twenty members appointed by the Minister from among persons nominated for such appointment by bodies or persons representative of the concerns referred to in subsection (2).  (2) The members of the Advisory Council shall be appointed for such term as the Minister determines and shall be representative of management, labour, technical or professional bodies or persons which or who are concerned with and have knowledge of occupational safety, welfare and health. (3) The Minister shall designate a chairman and a vice-chairman of the Advisory Council from among the members appointed.  (4) The Minister may fill any vacancy that occurs in the membership of the Advisory Council.  (5) The remuneration and expenses of the members of the Advisory Council shall be determined by the Minister and shall be paid out of the moneys appropriated therefor by the National Assembly.  (6) The Advisory Council, with the approval of the Minister, may make rules and pass resolutions governing its procedure, including the calling of meetings, the establishment of a quorum, and the conduct of meetings.    LAWS OF GUYANA 24 Cap. 99:06 Occupational Safety and Health  L.R.O. 1/2012                                                                                   Committees.         (7) The functions of the Advisory Council are  (a) to advise the Minister on matters relating to occupational safety and health or arising out of the operation of this Act which may be brought to its attention or be referred to it, including the formulation of a national policy on occupational safety and health;  (b) to make recommendations to the minister relating to programmes of the Authority in occupational safety and health including enforcement and the implementation of a national policy on occupational safety and health; and  (c) to promote public awareness of occupational safety and health.  (8) The Advisory Council shall file with the Minister not later than the 1st day of June in each year an annual report upon the affairs of the Advisory Council for the previous year.  (9) The Minister shall submit the report to the National Assembly if it is in session or, if not, at the next ensuing session.",
            "description": [
                {
                    "representation": "(1)",
                    "description": "There is hereby established an Advisory Council to be known as the Advisory Council on Occupational Safety and Health consisting of not less than twelve nor more than twenty members appointed by the Minister from among persons nominated for such appointment by bodies or persons representative of the concerns referred to in subsection"
                },
                {
                    "representation": "(2)",
                    "description": "The members of the Advisory Council shall be appointed for such term as the Minister determines and shall be representative of management, labour, technical or professional bodies or persons which or who are concerned with and have knowledge of occupational safety, welfare and health."
                },
                {
                    "representation": "(3)",
                    "description": "The Minister shall designate a chairman and a vice-chairman of the Advisory Council from among the members appointed."
                },
                {
                    "representation": "(4)",
                    "description": "The Minister may fill any vacancy that occurs in the membership of the Advisory Council."
                },
                {
                    "representation": "(5)",
                    "description": "The remuneration and expenses of the members of the Advisory Council shall be determined by the Minister and shall be paid out of the moneys appropriated therefor by the National Assembly."
                },
                {
                    "representation": "(6)",
                    "description": "The Advisory Council, with the approval of the Minister, may make rules and pass resolutions governing its procedure, including the calling of meetings, the establishment of a quorum, and the conduct of meetings.    LAWS OF GUYANA 24 Cap. 99:06 Occupational Safety and Health  L.R.O. 1/2012                                                                                   Committees."
                },
                {
                    "representation": "(7)",
                    "description": "The functions of the Advisory Council are"
                },
                {
                    "representation": "(a)",
                    "description": "to advise the Minister on matters relating to occupational safety and health or arising out of the operation of this Act which may be brought to its attention or be referred to it, including the formulation of a national policy on occupational safety and health;"
                },
                {
                    "representation": "(b)",
                    "description": "to make recommendations to the minister relating to programmes of the Authority in occupational safety and health including enforcement and the implementation of a national policy on occupational safety and health; and"
                },
                {
                    "representation": "(c)",
                    "description": "to promote public awareness of occupational safety and health."
                },
                {
                    "representation": "(8)",
                    "description": "The Advisory Council shall file with the Minister not later than the 1st day of June in each year an annual report upon the affairs of the Advisory Council for the previous year."
                },
                {
                    "representation": "(9)",
                    "description": "The Minister shall submit the report to the National Assembly if it is in session or, if not, at the next ensuing session."
                }
            ]
        }
    },
    {
        "act": "OCCUPATIONAL SAFETY AND HEALTH ACT",
        "source": "https://mola.gov.gy/laws-of-guyana",
        "type": {
            "name": "section",
            "representation": "11",
            "title": "Committees. ",
            "context": "OCCUPATIONAL SAFETY AND HEALTH ACT under Committees. 11. (1) The Advisory Council may establish committees to assist it in the performance of its functions and may appoint such persons whether or not they are members of the Advisory Council as it may deem fit to be members of any such committees:  Provided that the Chairman of every such committee LAWS OF GUYANA Occupational Safety and Health Cap. 99:06 25  L.R.O. 1/2012                        Establishment of Occupational Safety and Health Authority and designation of inspectors.                                    Power of the Authority and of an inspector.  shall be a member of the Council.  (2) Any person appointed under subsection (1) who is not a member of the Council or a public officer may be paid such remuneration and expenses as may be determined by the Minister.",
            "description": [
                {
                    "representation": "(1)",
                    "description": "who is not a member of the Council or a public officer may be paid such remuneration and expenses as may be determined by the Minister."
                },
                {
                    "representation": "(2)",
                    "description": "Any person appointed under subsection"
                }
            ]
        }
    },
    {
        "act": "OCCUPATIONAL SAFETY AND HEALTH ACT",
        "source": "https://mola.gov.gy/laws-of-guyana",
        "type": {
            "name": "section",
            "representation": "12",
            "title": "Establishment of Occupational Safety and Health Authority and designation of inspectors. ",
            "context": "OCCUPATIONAL SAFETY AND HEALTH ACT under Establishment of Occupational Safety and Health Authority and designation of inspectors. 12. (1) There is hereby established an authority to be known as the Occupational Safety and Health Authority comprising such officers as may be designated by the Minister by notice published in the Gazette, and where no such authority is established, the Authority shall be the Chief Occupational Safety and Health Officer.  (2) Subject to subsection (3), all industrial establishments and all machinery shall be inspected by the Authority, or, subject to the directions of the Authority by an inspector.  (3) The Minister may make regulations for the inspection of industrial establishments and machinery, or of some classes of industrial establishments or of certain kinds of machinery, by such persons as may be designated in such regulations.  (4) The Minister may, by notice published in the Gazette designate fit and proper persons to be inspectors for the purposes of this Act.  (5) No person who is the occupier of any industrial establishment or is directly or indirectly interested therein or in any process or business carried on therein, or in a patent connected therewith, or is employed in or about such establishment shall be appointed an inspector or act as such.",
            "description": [
                {
                    "representation": "(1)",
                    "description": "There is hereby established an authority to be known as the Occupational Safety and Health Authority comprising such officers as may be designated by the Minister by notice published in the Gazette, and where no such authority is established, the Authority shall be the Chief Occupational Safety and Health Officer."
                },
                {
                    "representation": "(2)",
                    "description": "Subject to subsection"
                },
                {
                    "representation": "(3)",
                    "description": "The Minister may make regulations for the inspection of industrial establishments and machinery, or of some classes of industrial establishments or of certain kinds of machinery, by such persons as may be designated in such regulations."
                },
                {
                    "representation": "(4)",
                    "description": "The Minister may, by notice published in the Gazette designate fit and proper persons to be inspectors for the purposes of this Act."
                },
                {
                    "representation": "(5)",
                    "description": "No person who is the occupier of any industrial establishment or is directly or indirectly interested therein or in any process or business carried on therein, or in a patent connected therewith, or is employed in or about such establishment shall be appointed an inspector or act as such."
                }
            ]
        }
    },
    {
        "act": "OCCUPATIONAL SAFETY AND HEALTH ACT",
        "source": "https://mola.gov.gy/laws-of-guyana",
        "type": {
            "name": "section",
            "representation": "13",
            "title": "Powers of the Occupational Safety and Health Authority and of an inspector. ",
            "context": "OCCUPATIONAL SAFETY AND HEALTH ACT under Powers of the Occupational Safety and Health Authority and of an inspector. 13. (1) The Authority, and every inspector, shall for the purposes of this Act have power   LAWS OF GUYANA 26 Cap. 99:06 Occupational Safety and Health  L.R.O. 1/2012                                                 (a) whenever he has reasonable cause to believe that any person is employed in an industrial establishment, to enter, inspect and examine such industrial establishment and every part thereof at any hour of the day or night;  (b) whenever he has reasonable cause to believe any place to be an industrial establishment, to enter, inspect and examine such place by day;  (c) whenever he has reasonable cause to believe that explosive or highly inflammable materials are stored or, used in any building of which an industrial establishment forms part, to enter, inspect  and examine any part of such building by day;  (d) to enter any ship or vessel in any dock or harbour or at any wharf, quay or stelling and make such inspection and examination as he may deem fit;  (e) to require the production of the registers, certificates, notices and documents kept in pursuance of this Act, and to inspect, examine, and copy any of them;  (f) upon giving a receipt therefor, to remove any register, certificate, notice and document kept in pursuance of this Act for the purpose of making copies therefor or extracts therefrom, and upon making copies thereof or LAWS OF GUYANA Occupational Safety and Health Cap. 99:06 27  L.R.O. 1/2012                                                 extracts therefrom, to promptly return the same to the person who produced or furnished them;  (g) to make such examination, inquiry or test as may be necessary to ascertain whether, in respect of any industrial establishment or the persons employed therein, or in respect of any prescribed occupation, the provisions of this Act and of the enactments for the time being in force relating to public health are being complied with;  (h) to conduct or take tests without unduly disturbing the workplace,  of  any equipment, machine, device, article, material, chemical, physical agent, or biological agent in or about a work place and for such purposes, to take and carry away such samples as may be necessary subject to the employer being notified of such samples taken and carried away;  (i) to require in writing an employer to cause any tests described in paragraph (h ) to be conducted or taken, at the expense of the employer, by a person  possessing such special expert or professional knowledge or qualifications as specified by the inspector and to provide, at the expense of the employer a report or assessment by that person;  (j) in any inspection, examination, LAWS OF GUYANA 28 Cap. 99:06 Occupational Safety and Health  L.R.O. 1/2012                                                 inquiry or test, to be accompanied and assisted by or take with him any person having special, expert or professional knowledge of any matter, take photographs, and take with him and use any equipment or material required for such purpose;  (k) to require any person whom he finds in an industrial establishment to give such information as it is in his power to give as to whom is the occupier of the industrial establishment;  (l) to examine either alone or in, the presence of any other person as he thinks fit, with respect to matters under this Act, every person whom he finds in an industrial establishment or whom he has reasonable cause to believe to have been employed or to have been employed within the preceding two months in an industrial establishment, or in respect of any prescribed occupation and to require every such person to be so examined and to sign a declaration of the truth of the matters respecting which he is so examined:  Provided however, that no person shall be required under this paragraph to answer any question, or to give any evidence, tending to incriminate himself;  (m) to require that any equipment, machine, device, article or process be LAWS OF GUYANA Occupational Safety and Health Cap. 99:06 29  L.R.O. 1/2012                                                 operated or set in motion or that a system or procedure be carried out that may be relevant to an examination, inquiry or test;  (n) to require in writing an employer to have equipment, machinery, or device tested, at the expense of the employer, by a professional engineer and to provide, at the expense of the employer, a report bearing the seal and the signature of the professional engineer stating that the equipment, machinery or device is not likely to endanger a worker;  (o) to require in writing that any equipment, machinery or device not be used pending testing described in paragraph (n);  (p) to require in writing an owner or employer to provide, at the expense of the owner or employer, a report bearing the seal and signature of a professional engineer stating  (i) the load limits of a floor, roof, part of a building, structure or temporary work; (ii) that a floor, roof, part of a building, structure or temporary work is capable of supporting or withstanding the loads being applied to it or likely to be paid to it; or  (iii) that a floor, roof, part of a building, structure or LAWS OF GUYANA 30 Cap. 99:06 Occupational Safety and Health  L.R.O. 1/2012                                                 temporary work is capable of supporting or withstanding all loads to which it may be subjected without causing the materials therein to be stressed beyond the allowable unit stresses established under any building code or law;  (q) to require in writing an owner of a mine or part thereof to provide, at the owners expense, a report in writing bearing the seal and the signature of a professional engineer stating that the ground stability of, the mining methods and the support or rock reinforcement used in the mine or part thereof is such that a worker is not likely to be endangered;   (r) to require in writing, within such time as is specified a person who is an employer, manufacturer, producer, importer, distributor or supplier to produce records or information, or to provide, at the expense of such person a report or evaluation made by a person or organisation having special, expert or professional knowledge or qualifications as are specified by the inspector of any process, chemical, physical agent, or biological agent or a combination of such a chemical and such agents present, used or intended for use in a workplace and the manner of use, including  (i) the ingredients thereof and LAWS OF GUYANA Occupational Safety and Health Cap. 99:06 31  L.R.O. 1/2012                                                 their common or generic name or names; (ii) the composition and property thereof, (iii) the toxicological effect thereof; (iv) the effect of exposure thereto whether by contact, inhalation, or ingestion; (v) the protective measures used or to be used in respect thereof; (vi) the emergency measures used or to be used to deal with exposure in respect thereof; and (vii) the effect of the use, transport and disposal thereof,  (s) to require the production of any material concerning the content, frequency and manner of instruction of any training programme and inspect, examine and copy the material and attend any such programme;  (t) where the inspector is a registered medical practitioner, to carry out such medical examinations as may be necessary for the purposes of his duties under this Act;  (u) whenever he has reasonable cause to believe that there may  be any serious obstruction in the execution of his powers, duties and functions under paragraphs (a), (b), (c) or (d), to take a member of the police force or the rural constabulary with him into the industrial  establishment, building, LAWS OF GUYANA 32 Cap. 99:06 Occupational Safety and Health  L.R.O. 1/2012                                  Certificate of appointment of Inspector.           Appointment of medical inspectors.                  ship or vessel, as the case may be;  (v) to exercise such other powers, duties and functions as may be necessary to carry this Act into full effect.  (2) The occupier of every industrial establishment his agents and servants shall furnish the means required by an inspector as necessary for the entry, inspection, examination, inquiry, the taking of samples or otherwise for the exercise of his powers, duties and functions under this Act in relation to that industrial establishment.",
            "description": [
                {
                    "representation": "(1)",
                    "description": "The Authority, and every inspector, shall for the purposes of this Act have power   LAWS OF GUYANA 26 Cap. 99:06 Occupational Safety and Health  L.R.O. 1/2012"
                },
                {
                    "representation": "(a)",
                    "description": "whenever he has reasonable cause to believe that any person is employed in an industrial establishment, to enter, inspect and examine such industrial establishment and every part thereof at any hour of the day or night;"
                },
                {
                    "representation": "(b)",
                    "description": "whenever he has reasonable cause to believe any place to be an industrial establishment, to enter, inspect and examine such place by day;"
                },
                {
                    "representation": "(c)",
                    "description": "or"
                },
                {
                    "representation": "(d)",
                    "description": "to enter any ship or vessel in any dock or harbour or at any wharf, quay or stelling and make such inspection and examination as he may deem fit;"
                },
                {
                    "representation": "(e)",
                    "description": "to require the production of the registers, certificates, notices and documents kept in pursuance of this Act, and to inspect, examine, and copy any of them;"
                },
                {
                    "representation": "(f)",
                    "description": "upon giving a receipt therefor, to remove any register, certificate, notice and document kept in pursuance of this Act for the purpose of making copies therefor or extracts therefrom, and upon making copies thereof or LAWS OF GUYANA Occupational Safety and Health Cap. 99:06 27  L.R.O. 1/2012                                                 extracts therefrom, to promptly return the same to the person who produced or furnished them;"
                },
                {
                    "representation": "(g)",
                    "description": "to make such examination, inquiry or test as may be necessary to ascertain whether, in respect of any industrial establishment or the persons employed therein, or in respect of any prescribed occupation, the provisions of this Act and of the enactments for the time being in force relating to public health are being complied with;"
                },
                {
                    "representation": "(h)",
                    "description": "to conduct or take tests without unduly disturbing the workplace,  of  any equipment, machine, device, article, material, chemical, physical agent, or biological agent in or about a work place and for such purposes, to take and carry away such samples as may be necessary subject to the employer being notified of such samples taken and carried away;"
                },
                {
                    "representation": "(i)",
                    "description": "the ingredients thereof and LAWS OF GUYANA Occupational Safety and Health Cap. 99:06 31  L.R.O. 1/2012                                                 their common or generic name or names;"
                },
                {
                    "representation": "(j)",
                    "description": "in any inspection, examination, LAWS OF GUYANA 28 Cap. 99:06 Occupational Safety and Health  L.R.O. 1/2012                                                 inquiry or test, to be accompanied and assisted by or take with him any person having special, expert or professional knowledge of any matter, take photographs, and take with him and use any equipment or material required for such purpose;"
                },
                {
                    "representation": "(k)",
                    "description": "to require any person whom he finds in an industrial establishment to give such information as it is in his power to give as to whom is the occupier of the industrial establishment;"
                },
                {
                    "representation": "(l)",
                    "description": "to examine either alone or in, the presence of any other person as he thinks fit, with respect to matters under this Act, every person whom he finds in an industrial establishment or whom he has reasonable cause to believe to have been employed or to have been employed within the preceding two months in an industrial establishment, or in respect of any prescribed occupation and to require every such person to be so examined and to sign a declaration of the truth of the matters respecting which he is so examined:  Provided however, that no person shall be required under this paragraph to answer any question, or to give any evidence, tending to incriminate himself;"
                },
                {
                    "representation": "(m)",
                    "description": "to require that any equipment, machine, device, article or process be LAWS OF GUYANA Occupational Safety and Health Cap. 99:06 29  L.R.O. 1/2012                                                 operated or set in motion or that a system or procedure be carried out that may be relevant to an examination, inquiry or test;"
                },
                {
                    "representation": "(n)",
                    "description": "to require in writing an employer to have equipment, machinery, or device tested, at the expense of the employer, by a professional engineer and to provide, at the expense of the employer, a report bearing the seal and the signature of the professional engineer stating that the equipment, machinery or device is not likely to endanger a worker;"
                },
                {
                    "representation": "(o)",
                    "description": "to require in writing that any equipment, machinery or device not be used pending testing described in paragraph"
                },
                {
                    "representation": "(p)",
                    "description": "to require in writing an owner or employer to provide, at the expense of the owner or employer, a report bearing the seal and signature of a professional engineer stating"
                },
                {
                    "representation": "(q)",
                    "description": "to require in writing an owner of a mine or part thereof to provide, at the owners expense, a report in writing bearing the seal and the signature of a professional engineer stating that the ground stability of, the mining methods and the support or rock reinforcement used in the mine or part thereof is such that a worker is not likely to be endangered;"
                },
                {
                    "representation": "(r)",
                    "description": "to require in writing, within such time as is specified a person who is an employer, manufacturer, producer, importer, distributor or supplier to produce records or information, or to provide, at the expense of such person a report or evaluation made by a person or organisation having special, expert or professional knowledge or qualifications as are specified by the inspector of any process, chemical, physical agent, or biological agent or a combination of such a chemical and such agents present, used or intended for use in a workplace and the manner of use, including"
                },
                {
                    "representation": "(v)",
                    "description": "to exercise such other powers, duties and functions as may be necessary to carry this Act into full effect."
                },
                {
                    "representation": "(s)",
                    "description": "to require the production of any material concerning the content, frequency and manner of instruction of any training programme and inspect, examine and copy the material and attend any such programme;"
                },
                {
                    "representation": "(t)",
                    "description": "where the inspector is a registered medical practitioner, to carry out such medical examinations as may be necessary for the purposes of his duties under this Act;"
                },
                {
                    "representation": "(u)",
                    "description": "whenever he has reasonable cause to believe that there may  be any serious obstruction in the execution of his powers, duties and functions under paragraphs"
                },
                {
                    "representation": "(2)",
                    "description": "The occupier of every industrial establishment his agents and servants shall furnish the means required by an inspector as necessary for the entry, inspection, examination, inquiry, the taking of samples or otherwise for the exercise of his powers, duties and functions under this Act in relation to that industrial establishment."
                }
            ]
        }
    },
    {
        "act": "OCCUPATIONAL SAFETY AND HEALTH ACT",
        "source": "https://mola.gov.gy/laws-of-guyana",
        "type": {
            "name": "section",
            "representation": "14",
            "title": "Certificate of appointment of inspector. ",
            "context": "OCCUPATIONAL SAFETY AND HEALTH ACT under Certificate of appointment of inspector. 14. (1) Every Inspector appointed under section 12(4) shall be furnished with a prescribed certificate of his appointment.  (2) When visiting an industrial establishment or place to which any of the provisions of this Act applies, he shall, if required so to do, produce the said certificate to the occupier or manager of the industrial establishment or place.",
            "description": [
                {
                    "representation": "(1)",
                    "description": "Every Inspector appointed under section 12(4) shall be furnished with a prescribed certificate of his appointment."
                },
                {
                    "representation": "(2)",
                    "description": "When visiting an industrial establishment or place to which any of the provisions of this Act applies, he shall, if required so to do, produce the said certificate to the occupier or manager of the industrial establishment or place."
                }
            ]
        }
    },
    {
        "act": "OCCUPATIONAL SAFETY AND HEALTH ACT",
        "source": "https://mola.gov.gy/laws-of-guyana",
        "type": {
            "name": "section",
            "representation": "15",
            "title": "Appointment of medical inspectors. ",
            "context": "OCCUPATIONAL SAFETY AND HEALTH ACT under Appointment of medical inspectors. 15. (1) The Minister may, by notice published in the Gazette, designate a sufficient number of registered medical practitioners to be medical inspectors for any of the purposes of this Act.  (2) No medical practitioner who is the occupier of an industrial establishment, or is directly or indirectly interested therein, or in any process or business carried on therein, or in a patent connected therewith, shall act as medical inspector for that industrial establishment:  Provided that the Minister may authorise a registered medical practitioner who is employed by the occupier of an industrial establishment in connection with the medical supervision of persons employed in the industrial establishment but is not otherwise interested in the industrial LAWS OF GUYANA Occupational Safety and Health Cap. 99:06 33  L.R.O. 1/2012                Powers and duties of medical inspector.                                establishment, to act as medical inspector for such industrial establishment for the purpose of examining and certifying the fitness of young persons.  (3) Where there is no medical inspector for an industrial establishment, the Government Medical Officer for the medical district in which the industrial establishment is situate shall be the medical inspector for that industrial establishment.",
            "description": [
                {
                    "representation": "(1)",
                    "description": "The Minister may, by notice published in the Gazette, designate a sufficient number of registered medical practitioners to be medical inspectors for any of the purposes of this Act."
                },
                {
                    "representation": "(2)",
                    "description": "No medical practitioner who is the occupier of an industrial establishment, or is directly or indirectly interested therein, or in any process or business carried on therein, or in a patent connected therewith, shall act as medical inspector for that industrial establishment:  Provided that the Minister may authorise a registered medical practitioner who is employed by the occupier of an industrial establishment in connection with the medical supervision of persons employed in the industrial establishment but is not otherwise interested in the industrial LAWS OF GUYANA Occupational Safety and Health Cap. 99:06 33  L.R.O. 1/2012                Powers and duties of medical inspector.                                establishment, to act as medical inspector for such industrial establishment for the purpose of examining and certifying the fitness of young persons."
                },
                {
                    "representation": "(3)",
                    "description": "Where there is no medical inspector for an industrial establishment, the Government Medical Officer for the medical district in which the industrial establishment is situate shall be the medical inspector for that industrial establishment."
                }
            ]
        }
    },
    {
        "act": "OCCUPATIONAL SAFETY AND HEALTH ACT",
        "source": "https://mola.gov.gy/laws-of-guyana",
        "type": {
            "name": "section",
            "representation": "16",
            "title": "Powers and duties of medical inspectors. ",
            "context": "OCCUPATIONAL SAFETY AND HEALTH ACT under Powers and duties of medical inspectors. 16. (1) The medical inspector for an industrial establishment shall have power at all reasonable times to inspect the general register of that industrial establishment.  (2) It shall be the duty of a medical inspector to investigate and report  (a) upon any case of death or injury caused by exposure in an industrial establishment to fumes or other noxious substances, or due to any other special cause specified in instructions of the Minister as requiring investigation; (b) upon any case of death, or injury which the Authority in  pursuance of any general or special instructions of the Minister may refer to him for that purpose; and  (c) upon any case of disease of which he receives notice under this Act.  (3) The medical inspector, for the purpose of an investigation under this section shall have all the powers of an inspector under this Act, and, in addition thereto, the power to enter any room in a building to which the person killed, injured or affected has been removed. LAWS OF GUYANA 34 Cap. 99:06 Occupational Safety and Health  L.R.O. 1/2012                  Power of inspector to require certificate of fitness for work.                             Fees of medical inspectors.   (4) Regulations may be made under this Act regulating  (a) the duties of medical inspectors; and  (b) any special inquiry, examination or investigation held or performed by medical inspectors in pursuance of instructions or directions of the Minister.",
            "description": [
                {
                    "representation": "(1)",
                    "description": "The medical inspector for an industrial establishment shall have power at all reasonable times to inspect the general register of that industrial establishment."
                },
                {
                    "representation": "(2)",
                    "description": "It shall be the duty of a medical inspector to investigate and report"
                },
                {
                    "representation": "(a)",
                    "description": "the duties of medical inspectors; and"
                },
                {
                    "representation": "(b)",
                    "description": "any special inquiry, examination or investigation held or performed by medical inspectors in pursuance of instructions or directions of the Minister."
                },
                {
                    "representation": "(c)",
                    "description": "upon any case of disease of which he receives notice under this Act."
                },
                {
                    "representation": "(3)",
                    "description": "The medical inspector, for the purpose of an investigation under this section shall have all the powers of an inspector under this Act, and, in addition thereto, the power to enter any room in a building to which the person killed, injured or affected has been removed. LAWS OF GUYANA 34 Cap. 99:06 Occupational Safety and Health  L.R.O. 1/2012                  Power of inspector to require certificate of fitness for work.                             Fees of medical inspectors."
                },
                {
                    "representation": "(4)",
                    "description": "Regulations may be made under this Act regulating"
                }
            ]
        }
    },
    {
        "act": "OCCUPATIONAL SAFETY AND HEALTH ACT",
        "source": "https://mola.gov.gy/laws-of-guyana",
        "type": {
            "name": "section",
            "representation": "17",
            "title": "Power of inspector to require certificate of fitness for work. LAWS OF GUYANA 4 Cap. 99:06 Occupational Safety and Health  L.R.O. 1/2012 SECTION ",
            "context": "OCCUPATIONAL SAFETY AND HEALTH ACT under Power of inspector to require certificate of fitness for work. LAWS OF GUYANA 4 Cap. 99:06 Occupational Safety and Health  L.R.O. 1/2012 SECTION 17. (1) Where the Authority or an inspector is of an opinion that the employment of any young person in an industrial establishment, or in any particular process or kind of work in an industrial establishment, is prejudicial to the health of the young person or to the health of other persons, he may, anything contained in a certificate (previously obtained) of fitness of the young person for employment to the contrary notwithstanding, serve notice in writing on the occupier of the industrial establishment requiring that the employment of that young person in the industrial establishment or in the process or kind of work as the case may be, be discontinued after the period named therein, being not less than one or more than seven days after the service of the notice.  (2) No occupier of an industrial establishment shall, after the period named in the notice under subsection (1), employ the young person to whom the notice relates contrary to requirements set out in the said notice, unless the medical inspector for the industrial establishment has, after the service of the notice, personally examined the young person and certified that he is fit for employment in the industrial establishment or in the process or kind of work, as the case may be.",
            "description": [
                {
                    "representation": "(1)",
                    "description": "Where the Authority or an inspector is of an opinion that the employment of any young person in an industrial establishment, or in any particular process or kind of work in an industrial establishment, is prejudicial to the health of the young person or to the health of other persons, he may, anything contained in a certificate"
                },
                {
                    "representation": "(2)",
                    "description": "No occupier of an industrial establishment shall, after the period named in the notice under subsection"
                }
            ]
        }
    },
    {
        "act": "OCCUPATIONAL SAFETY AND HEALTH ACT",
        "source": "https://mola.gov.gy/laws-of-guyana",
        "type": {
            "name": "section",
            "representation": "18",
            "title": "Fees of medical inspectors. ",
            "context": "OCCUPATIONAL SAFETY AND HEALTH ACT under Fees of medical inspectors. 18. (1) The fees to be paid to medical inspectors for carrying out their duties under this Act shall, in so far  as they LAWS OF GUYANA Occupational Safety and Health Cap. 99:06 35  L.R.O. 1/2012                               Periodical report of medical inspector to the Authority.   Appointment of technical examiners.                     Appointment of Occupational Safety and Health Commissioner.    relate  to any examination or certificate with respect to the fitness of a young person for employment in an industrial establishment or to any examination or medical supervision of persons employed in an industrial establishment carried out in pursuance of regulations made under this Act, be paid by the occupier of that industrial establishment and in any other case shall be defrayed as an expense of carrying this Act into effect.  (2) Such fees shall, subject to any agreement made between the medical inspector and the occupier of an industrial establishment in respect of the fees payable by the occupier be of such amount as may from time to time be prescribed.",
            "description": [
                {
                    "representation": "(1)",
                    "description": "The fees to be paid to medical inspectors for carrying out their duties under this Act shall, in so far  as they LAWS OF GUYANA Occupational Safety and Health Cap. 99:06 35  L.R.O. 1/2012                               Periodical report of medical inspector to the Authority.   Appointment of technical examiners.                     Appointment of Occupational Safety and Health Commissioner.    relate  to any examination or certificate with respect to the fitness of a young person for employment in an industrial establishment or to any examination or medical supervision of persons employed in an industrial establishment carried out in pursuance of regulations made under this Act, be paid by the occupier of that industrial establishment and in any other case shall be defrayed as an expense of carrying this Act into effect."
                },
                {
                    "representation": "(2)",
                    "description": "Such fees shall, subject to any agreement made between the medical inspector and the occupier of an industrial establishment in respect of the fees payable by the occupier be of such amount as may from time to time be prescribed."
                }
            ]
        }
    },
    {
        "act": "OCCUPATIONAL SAFETY AND HEALTH ACT",
        "source": "https://mola.gov.gy/laws-of-guyana",
        "type": {
            "name": "section",
            "representation": "19",
            "title": "Periodical report of medical inspector to Authority. ",
            "context": "OCCUPATIONAL SAFETY AND HEALTH ACT under Periodical report of medical inspector to Authority. 19. Every medical inspector shall in each year make at the prescribed time a report in the prescribed form to the Authority as to the examinations made for other duties performed by him in pursuance of this Act.",
            "description": "Every medical inspector shall in each year make at the prescribed time a report in the prescribed form to the Authority as to the examinations made for other duties performed by him in pursuance of this Act."
        }
    },
    {
        "act": "OCCUPATIONAL SAFETY AND HEALTH ACT",
        "source": "https://mola.gov.gy/laws-of-guyana",
        "type": {
            "name": "section",
            "representation": "20",
            "title": "Appointment of technical examiners. ",
            "context": "OCCUPATIONAL SAFETY AND HEALTH ACT under Appointment of technical examiners. 20. (1) The Minister may, by notice publish in the Gazette, designate persons who by virtue of training and experience are duty and properly qualified to examine equipment, drawings, plans, or specifications of any workplace, to be technical examiners for the purposes of carrying out such examination or other duty under this Act or as prescribed.  (2) The Minister may by regulations prescribe the fees to be paid to technical examiners for any examination or the duty carried out by them under this Act or as prescribed.",
            "description": [
                {
                    "representation": "(1)",
                    "description": "The Minister may, by notice publish in the Gazette, designate persons who by virtue of training and experience are duty and properly qualified to examine equipment, drawings, plans, or specifications of any workplace, to be technical examiners for the purposes of carrying out such examination or other duty under this Act or as prescribed."
                },
                {
                    "representation": "(2)",
                    "description": "The Minister may by regulations prescribe the fees to be paid to technical examiners for any examination or the duty carried out by them under this Act or as prescribed."
                }
            ]
        }
    },
    {
        "act": "OCCUPATIONAL SAFETY AND HEALTH ACT",
        "source": "https://mola.gov.gy/laws-of-guyana",
        "type": {
            "name": "section",
            "representation": "21",
            "title": "Appointment of Occupational Safety and Health Commissioner.  (b) Non-Governmental  ",
            "context": "OCCUPATIONAL SAFETY AND HEALTH ACT under Appointment of Occupational Safety and Health Commissioner.  (b) Non-Governmental  21. (1) The Minister may appoint an Occupational Safety and Health Commissioner who shall carry out the duties and exercise the powers of the Commissioner under this Act.  (2) The Minister or, where any direction or LAWS OF GUYANA 36 Cap. 99:06 Occupational Safety and Health  L.R.O. 1/2012    c. 98:01 (Subsidiary Legislation)                     Safety and health representatives and their functions and powers.                        reference is made to the Commissioner, the Commissioner, shall in relation to procedural matters,  have all the powers of an arbitration tribunal to which the provisions of the Labour (Arbitration Procedure) Regulations apply and the provisions of those Regulations shall mutatis mutandis apply to any appeal, claim, rebuttal, complaint, or order filed with the Minister or Authority, or directed or referred by the Minister or Authority to the Commissioner, under this Act.  (3) The Commissioner appointed under subsection (1) shall be paid such remuneration and expenses as the Minister determines.  (b) Non-Governmental",
            "description": [
                {
                    "representation": "(1)",
                    "description": "shall be paid such remuneration and expenses as the Minister determines."
                },
                {
                    "representation": "(2)",
                    "description": "The Minister or, where any direction or LAWS OF GUYANA 36 Cap. 99:06 Occupational Safety and Health  L.R.O. 1/2012    c. 98:01"
                },
                {
                    "representation": "(3)",
                    "description": "The Commissioner appointed under subsection"
                },
                {
                    "representation": "(b)",
                    "description": "Non-Governmental"
                }
            ]
        }
    },
    {
        "act": "OCCUPATIONAL SAFETY AND HEALTH ACT",
        "source": "https://mola.gov.gy/laws-of-guyana",
        "type": {
            "name": "section",
            "representation": "22",
            "title": "Safety and health representatives. ",
            "context": "OCCUPATIONAL SAFETY AND HEALTH ACT under Safety and health representatives. 22. (1) At a construction site or other workplace where no committee is required under section 23 and where the number of workers regularly exceeds five, the employer shall cause the workers to select at least one safety and health representative from among the workers at the workplace who do not exercise managerial functions.  (2) If no safety and health representative is required under subsection (1) and no committee is required under section 23 for a workplace, the Minister may, by order, require an employer to cause the workers to select one or more safety and health representatives from among the workers at the work-place or part thereof who do not exercise managerial functions, and may provide in the order for the qualifications of such representatives.  (3) Every order made under subsection (2) may contain directions as the Minister considers advisable concerning the carrying out of the functions of safety and health representative.  (4) In exercising the power conferred by subsection (2), the Minister shall consider the matters set out in section LAWS OF GUYANA Occupational Safety and Health Cap. 99:06 37  L.R.O. 1/2012                                                 23(5).  (5) The selection of a safety and health representative shall be made by those workers who do not exercise managerial functions and who will be represented by the safety and health representative in the workplace, or the part or parts thereof, as the case may be.  (6) Where there is a trade union or trade unions representing the workers referred to in subsection (5), the selection of a safety and health representative may be delegated by a majority of such workers to the trade union or trade unions.  (7) Unless otherwise required by the regulations or by an order by an inspector, a safety and health representative shall inspect the physical conditions of the workplace at least once a month.  (8) If it is not practical to inspect the workplace at least once a month, the safety and health representative shall inspect the physical condition of the workplace at least once a year, inspecting at least a part of the workplace in each month.  (9) The inspection required by subsection (8) shall be undertaken accordance with a schedule agreed upon by the employer and the safety and health representative.  (10) The employer and workers shall provide a safety and health representative with such information and assistance as such representative may require for the purpose of carrying out an inspection of the workplace.  (11) A safety and health representative shall have power to identify situations that may be a source of danger or hazard to workers and to make recommendations or report his findings thereon to the employer, the workers and the LAWS OF GUYANA 38 Cap. 99:06 Occupational Safety and Health  L.R.O. 1/2012                                                 trade union or trade unions representing the workers.  (12) A safety and health representative has the power  (a) to obtain information from the employer concerning the conducting or taking of tests of any equipment, machine, device, article, material, chemical, physical agent or biological agent in or about a workplace for the purpose or occupational safety and health;  (b) to be consulted about, and be present at the beginning of, testing referred to in paragraph (a) conducted in or about the workplace if the representative believes his presence is required to ensure that valid testing procedures are used or to ensure that the test results are valid; and  (c) to obtain information from the employer respecting  (i) the identification of potential or existing hazards of materials, processes or equipment; and (ii) safety and health experience and work practices and standards in similar or other industries of which the employer has knowledge.  (13) An employer who receives written recommendations from a safety and health representative shall respond in writing within twenty-one days. LAWS OF GUYANA Occupational Safety and Health Cap. 99:06 39  L.R.O. 1/2012                                              Joint work-place safety and health committee.  (14) A response of an employer under subsection (13) shall contain a timetable for implementing the recommendations the employer agrees with and give reasons why the employer disagrees with any recommendations that the employer does not accept.  (15) Where a person is killed or critically injured at a workplace from any cause, the safety and health representative may, subject to section 69 (2), inspect the place where the accident occurred and any machine, device or article, and shall report his findings in writing to the employer and the Authority.  (16) A safely and health representative is entitled to take such time from work as is necessary to carry out his duties under subsection (7) and (15) and the time so spent shall be deemed to be work time for which the representative shall be paid by his employer at the representatives regular or premium rate as may be proper.  (17) A safety and health representative or representatives of like nature appointed or selected under the provisions of a collective agreement or other agreement or arrangement between the employer and the workers, has in addition to his functions and the powers under the provisions of the collective agreement or other agreement or arrangement, the functions and powers conferred upon a safety and health representative by this section.  (18) A safety and health representative shall maintain and keep a record of the exercise of his functions and powers conferred upon him, by this section and shall make the same available for examination by an inspector.",
            "description": [
                {
                    "representation": "(1)",
                    "description": "and no committee is required under section 23 for a workplace, the Minister may, by order, require an employer to cause the workers to select one or more safety and health representatives from among the workers at the work-place or part thereof who do not exercise managerial functions, and may provide in the order for the qualifications of such representatives."
                },
                {
                    "representation": "(2)",
                    "description": "may contain directions as the Minister considers advisable concerning the carrying out of the functions of safety and health representative."
                },
                {
                    "representation": "(3)",
                    "description": "Every order made under subsection"
                },
                {
                    "representation": "(4)",
                    "description": "In exercising the power conferred by subsection"
                },
                {
                    "representation": "(5)",
                    "description": "The selection of a safety and health representative shall be made by those workers who do not exercise managerial functions and who will be represented by the safety and health representative in the workplace, or the part or parts thereof, as the case may be."
                },
                {
                    "representation": "(6)",
                    "description": "Where there is a trade union or trade unions representing the workers referred to in subsection"
                },
                {
                    "representation": "(7)",
                    "description": "and"
                },
                {
                    "representation": "(8)",
                    "description": "shall be undertaken accordance with a schedule agreed upon by the employer and the safety and health representative."
                },
                {
                    "representation": "(9)",
                    "description": "The inspection required by subsection"
                },
                {
                    "representation": "(a)",
                    "description": "conducted in or about the workplace if the representative believes his presence is required to ensure that valid testing procedures are used or to ensure that the test results are valid; and"
                },
                {
                    "representation": "(b)",
                    "description": "to be consulted about, and be present at the beginning of, testing referred to in paragraph"
                },
                {
                    "representation": "(c)",
                    "description": "to obtain information from the employer respecting"
                },
                {
                    "representation": "(i)",
                    "description": "the identification of potential or existing hazards of materials, processes or equipment; and"
                }
            ]
        }
    },
    {
        "act": "OCCUPATIONAL SAFETY AND HEALTH ACT",
        "source": "https://mola.gov.gy/laws-of-guyana",
        "type": {
            "name": "section",
            "representation": "23",
            "title": "Joint workplace safety and health committee. ",
            "context": "OCCUPATIONAL SAFETY AND HEALTH ACT under Joint workplace safety and health committee. 23. (1) A joint workplace safety and health committee is required  LAWS OF GUYANA 40 Cap. 99:06 Occupational Safety and Health  L.R.O. 1/2012                                                 (a) at a workplace at which twenty or more workers are regularly employed;  (b) at a workplace with respect to which an order to an employer is in effect under section 59; or  (c) at a workplace other than a construction site where fewer than twenty workers are regularly employed, with respect to which a regulation concerning critical substances applies.  (2) Subject to subsection (3), this section does not apply  (a) to an employer at a construction site at which work is expected to last less than three months; or  (b) to a prescribed employer or workplace or class of employers or workplaces.  (3) Despite subsections (1) and (2), the Minister may, by order require an employer to establish and maintain one or more joint workplace safety and health committees for a workplace or a part thereof and may, in such order, provide for the composition, practice and procedure of any committee so established.  (4) The employer shall cause a joint workplace safety and health committee to be established and maintained at the workplace unless the Minister is satisfied that a committee of like nature or an arrangement, programme or system in which the workers participate was, on the LAWS OF GUYANA Occupational Safety and Health Cap. 99:06 41  L.R.O. 1/2012                                                 appointed day established and maintained pursuant to a collective agreement or other agreement or arrangement and that such committee, arrangement, programme or system provides benefits for the safety and health of the workers equal to, or greater than, the benefits to be derived under a committee established under this section.  (5) In exercising the power conferred by subsection (3), the Minister shall consider  (a) the nature of the work being done;  (b) the request of an employer, a group of the workers or the trade union or trade unions representing the workers in a workplace;  (c) the frequency of occupational disease or injury in the workplace or in the industry of which the employer is a part;   (d) the existence of safety and health programmes and procedures in the workplace and the effectiveness thereof; and  (e) such other matters as the Minister considers advisable.  (6) A committee shall consist of  (a) at least four persons, for a workplace where fewer than fifty workers are regularly employed; or  (b) at least six persons or such greater number of persons as may be LAWS OF GUYANA 42 Cap. 99:06 Occupational Safety and Health  L.R.O. 1/2012                                                 prescribed, for a workplace where fifty or more workers are regularly employed.  (7) At least half the members of a committee shall be workers employed at the workplace who do not exercise managerial functions.  (8) The members of a committee who represent workers shall be selected by the workers who do not exercise managerial functions and who will be represented by those members of the committee in the workplace or the part or parts them of as the case may be.  (9) Where there is a trade union or trade unions representing the workers referred to in subsection (8), the selection of the members of a committee referred to in subsection (8) may be delegated by a majority of such workers to the trade union or trade unions.  (10) The employer shall select the remaining members of a committee from among persons who exercise managerial functions for the employer and, to the extent possible, who do so at the workplace.  (11) A member of the committee who ceases to be employed at the workplace ceases to be a member of the committee.  (12) Two of the members of a committee shall, on a rotating basis, co-chair the committee, one of whom shall be selected by the members who represents workers and the other of whom shall be selected by the members who exercise managerial functions.  (13) It is the function of a committee and it has power to  LAWS OF GUYANA Occupational Safety and Health Cap. 99:06 43  L.R.O. 1/2012                                                 (a) identify situations that may be a source of danger or hazard to workers:  (b) make recommendations to the employer and the workers for the improvement of the health and welfare of workers;  (c) recommend to the employer and the workers the establishment, maintenance and monitoring of programmes, measures and procedures respecting the safety of workers;  (d) obtain information from the employer respecting  (i) the identification of potential or existing hazards of materials, processes or equipment; and (ii) safety and health experience and work practices and standards in similar or other industries of which the employer has knowledge;  (e) obtain information from the employer concerning the conducting or taking of tests of any equipment, machine device, article, material, chemical, physical agent or biological agent in or about a workplace for the purpose of occupational safety and health; and  (f) be consulted about, and have a designated member representing LAWS OF GUYANA 44 Cap. 99:06 Occupational Safety and Health  L.R.O. 1/2012                                                 workers be present at the beginning of testing referred to in clause (e) conducted in or about the workplace if the designated member believes his presence is required to ensure that valid testing procedures are used or to ensure that the test results are valid.  (14) The member of the committee who represent workers shall designate one of them who is entitled to be present at the beginning of testing described in subsection (13)(f).  (15) An employer who receives written recommendations from a committee shall respond in writing within twenty-one days.  (16) A response of an employer under subsection (15) shall contain a time table for implementing the recommendations the employer agrees with and give reasons why the employer disagrees with any recommendations that the employer does not accept.  (17) A committee shall maintain and keep minutes of its proceedings and make the same available for examination and review by an inspector.  (18) The members of a committee who represent workers shall designate a member representing workers to inspect the physical condition of the workplace.  (19) The members of a committee are not required to designate the same member to perform all inspections or to perform all of a particular inspection.  (20) Unless otherwise required by the regulations or by an order by an inspector, a member designated under LAWS OF GUYANA Occupational Safety and Health Cap. 99:06 45  L.R.O. 1/2012                                                 subsection (18) shall inspect the physical conditions of the entire workplace at least once a month.  (21) If it is not practical to inspect the entire workplace in any one day in a month, in accordance with subsection (20), the member designated under subsection (18) shall continue on any one or several remaining days of the said month to inspect at least a part of the workplace on each such day until the entire workplace is inspected in that month.  (22) The inspection required by subsection (21) shall be undertaken in accordance with a schedule established by the committee.  (23) The employer and the workers shall provide a member designated under subsection (18) with such information and assistance as the member may require for the purpose of carrying out an inspection of the workplace.  (24) The member designated under subsection (18), shall inform the committee of situations that may be a source of danger or hazard to workers and the committee shall consider such information within a reasonable period of time.  (25) The members of a committee who represent workers shall designate one or more such members to investigate cases where a worker is killed or injured at a workplace from any cause and one of those members may, subject to section 69(2), inspect the place where the accident occurred and any machine, device or article, and shall report his or her findings to the employer and the Authority is the committee.  (26) An employer required to establish a committee under this section shall post and keep posted at the workplace the names and work locations of the committee members in a conspicuous place or places where they are LAWS OF GUYANA 46 Cap. 99:06 Occupational Safety and Health  L.R.O. 1/2012                                                  most likely to come to the attention of the workers.  (27) A committee shall meet at least once every three months at the workplace and may be required to meet by order of the Minister.  (28) A member of a committee  is entitled to  (a) one hour or such longer period of time as the committee determines is necessary to prepare for each committee meeting;  (b) such time as is necessary to carry out the members duties under subsections (20), (21) and (25).  (29) A member of a committee shall be deemed to be at work during the times mentioned in subsection (28) and the members employer shall pay the member for those times at the members regular or premium rate as may be proper.  (30) Any committee of a like nature to a committee established under this section in existence in a workplace under the provisions of a collective agreement or other agreement or arrangement between an employer and the workers has, in addition to its functions and powers under the provisions of the collective agreement or arrangement, the functions and powers conferred upon a committee by this section.  (31) Where a dispute arises as to the application of subsection (2), or the compliance or purported compliance therewith by an employer, the dispute shall decide by the Commissioner after consulting the employer and the workers or trade union or trade unions representing the workers.   LAWS OF GUYANA Occupational Safety and Health Cap. 99:06 47  L.R.O. 1/2012 Worker trades committee.",
            "description": [
                {
                    "representation": "(1)",
                    "description": "and"
                },
                {
                    "representation": "(a)",
                    "description": "one hour or such longer period of time as the committee determines is necessary to prepare for each committee meeting;"
                },
                {
                    "representation": "(b)",
                    "description": "such time as is necessary to carry out the members duties under subsections"
                },
                {
                    "representation": "(c)",
                    "description": "recommend to the employer and the workers the establishment, maintenance and monitoring of programmes, measures and procedures respecting the safety of workers;"
                },
                {
                    "representation": "(2)",
                    "description": "Subject to subsection"
                },
                {
                    "representation": "(3)",
                    "description": "Despite subsections"
                },
                {
                    "representation": "(4)",
                    "description": "The employer shall cause a joint workplace safety and health committee to be established and maintained at the workplace unless the Minister is satisfied that a committee of like nature or an arrangement, programme or system in which the workers participate was, on the LAWS OF GUYANA Occupational Safety and Health Cap. 99:06 41  L.R.O. 1/2012                                                 appointed day established and maintained pursuant to a collective agreement or other agreement or arrangement and that such committee, arrangement, programme or system provides benefits for the safety and health of the workers equal to, or greater than, the benefits to be derived under a committee established under this section."
                },
                {
                    "representation": "(5)",
                    "description": "In exercising the power conferred by subsection"
                },
                {
                    "representation": "(d)",
                    "description": "obtain information from the employer respecting"
                },
                {
                    "representation": "(e)",
                    "description": "conducted in or about the workplace if the designated member believes his presence is required to ensure that valid testing procedures are used or to ensure that the test results are valid."
                },
                {
                    "representation": "(6)",
                    "description": "A committee shall consist of"
                },
                {
                    "representation": "(7)",
                    "description": "At least half the members of a committee shall be workers employed at the workplace who do not exercise managerial functions."
                },
                {
                    "representation": "(8)",
                    "description": "may be delegated by a majority of such workers to the trade union or trade unions."
                },
                {
                    "representation": "(9)",
                    "description": "Where there is a trade union or trade unions representing the workers referred to in subsection"
                },
                {
                    "representation": "(i)",
                    "description": "the identification of potential or existing hazards of materials, processes or equipment; and"
                },
                {
                    "representation": "(f)",
                    "description": "be consulted about, and have a designated member representing LAWS OF GUYANA 44 Cap. 99:06 Occupational Safety and Health  L.R.O. 1/2012                                                 workers be present at the beginning of testing referred to in clause"
                }
            ]
        }
    },
    {
        "act": "OCCUPATIONAL SAFETY AND HEALTH ACT",
        "source": "https://mola.gov.gy/laws-of-guyana",
        "type": {
            "name": "section",
            "representation": "24",
            "title": "Workers trades\u2019 committee. ",
            "context": "OCCUPATIONAL SAFETY AND HEALTH ACT under Workers trades committee. 24. (1) If a committee is required at a construction site, other than a construction site where fewer than fifty workers are regularly employed or that is expected to last less than three months, the committee shall establish a worker trades committee for the construction site.  (2) The members of a worker trades committee shall represent workers employed in each of the trades at the workplace.  (3) The members of a worker trades committee shall be selected by the workers employed in the trades the members are to represent.  (4) Where there is a trade union representing the workers referred to in subsection (3), the selection of the members of a worker trades committee may be delegated by a majority of such workers to the trade union.  (5) It is the function of a worker trades committee to inform the committee at the workplace of the safety and health concerns of the workers employed in the trades at the workplace.  (6) Subject to subsection (7), a member of a worker trades committee is entitled to such time from work as is necessary to attend meetings of the worker representative of the committee with respect to proposed testing strategies for representative of the committee concerning testing strategies to be used.    (7) The committee for a workplace shall determine the maximum amount of time for which members of a worker trades committee for the workplace are entitled to be paid under subsection (6) for each meeting of the worker trades committee.   LAWS OF GUYANA 48 Cap. 99:06 Occupational Safety and Health  L.R.O. 1/2012 Consultation on industrial hygiene testing.                            Summary to be furnished.   c. 36:01",
            "description": [
                {
                    "representation": "(1)",
                    "description": "If a committee is required at a construction site, other than a construction site where fewer than fifty workers are regularly employed or that is expected to last less than three months, the committee shall establish a worker trades committee for the construction site."
                },
                {
                    "representation": "(2)",
                    "description": "The members of a worker trades committee shall represent workers employed in each of the trades at the workplace."
                },
                {
                    "representation": "(3)",
                    "description": "The members of a worker trades committee shall be selected by the workers employed in the trades the members are to represent."
                },
                {
                    "representation": "(4)",
                    "description": "Where there is a trade union representing the workers referred to in subsection"
                },
                {
                    "representation": "(5)",
                    "description": "It is the function of a worker trades committee to inform the committee at the workplace of the safety and health concerns of the workers employed in the trades at the workplace."
                },
                {
                    "representation": "(6)",
                    "description": "for each meeting of the worker trades committee.   LAWS OF GUYANA 48 Cap. 99:06 Occupational Safety and Health  L.R.O. 1/2012 Consultation on industrial hygiene testing.                            Summary to be furnished.   c. 36:01"
                },
                {
                    "representation": "(7)",
                    "description": "The committee for a workplace shall determine the maximum amount of time for which members of a worker trades committee for the workplace are entitled to be paid under subsection"
                }
            ]
        }
    },
    {
        "act": "OCCUPATIONAL SAFETY AND HEALTH ACT",
        "source": "https://mola.gov.gy/laws-of-guyana",
        "type": {
            "name": "section",
            "representation": "25",
            "title": "Consultation on industrial hygiene testing. ",
            "context": "OCCUPATIONAL SAFETY AND HEALTH ACT under Consultation on industrial hygiene testing. 25. (1) The employer at a workplace shall consult a safety and health representative of the committee with respect to proposed testing strategies for investigating industrial hygiene at the workplace.  (2) The employer shall provide information to a safety and health representative of the committee concerning testing strategies to be used to investigate industrial hygiene at the workplace.  (3) A safety and health representative or a designated committee member representing workers at a workplace is entitled to be present at the beginning of testing conducted with respect to industrial hygiene at the workplace if the representative or member believes his or her presence is required to ensure that valid testing procedures are used or to ensure that the test results are valid.  (4) The committee members representing workers shall designate one of them for the purpose of subsection (3).",
            "description": [
                {
                    "representation": "(1)",
                    "description": "The employer at a workplace shall consult a safety and health representative of the committee with respect to proposed testing strategies for investigating industrial hygiene at the workplace."
                },
                {
                    "representation": "(2)",
                    "description": "The employer shall provide information to a safety and health representative of the committee concerning testing strategies to be used to investigate industrial hygiene at the workplace."
                },
                {
                    "representation": "(3)",
                    "description": "A safety and health representative or a designated committee member representing workers at a workplace is entitled to be present at the beginning of testing conducted with respect to industrial hygiene at the workplace if the representative or member believes his or her presence is required to ensure that valid testing procedures are used or to ensure that the test results are valid."
                },
                {
                    "representation": "(4)",
                    "description": "The committee members representing workers shall designate one of them for the purpose of subsection"
                }
            ]
        }
    },
    {
        "act": "OCCUPATIONAL SAFETY AND HEALTH ACT",
        "source": "https://mola.gov.gy/laws-of-guyana",
        "type": {
            "name": "section",
            "representation": "26",
            "title": "Summary to be furnished.  (c) Provisions Applicable To Inspection, etc.  ",
            "context": "OCCUPATIONAL SAFETY AND HEALTH ACT under Summary to be furnished.  (c) Provisions Applicable To Inspection, etc.  26. (1) A committee established, or safety and health representative selected, under this Act for an employer, may request the Authority to obtain from the National Insurance Board, established under  the National Insurance Act, an annual summary of data relating to such employer in respect of the number of work accident fatalities, the number of lost workday cases, the number lost workdays, the number of non-fatal cases that required medical aid without lost workdays, the incidence of occupational diseases, the number of work-related injuries, and such other data as the committee or safety and health representative may request.  (2) Upon such request and receipt of such annual summary of data, the Authority shall send copies thereof to the committee, safety and health representative and the employers and the employer shall cause a copy thereof to be posted in a conspicuous place or places at the work-place LAWS OF GUYANA Occupational Safety and Health Cap. 99:06 49  L.R.O. 1/2012                      Representation during inspections.                                               where it is most likely to come to the attention of the workers.  (3) The Authority shall, in accordance with the objects and purposes of this Act, ensure that persons and organizations concerned with the purposes of this Act are provided with information and advice pertaining to its administration and to the protection to the occupational safety and occupational health of workers generally.  (c) Provisions applicable to Inspections, etc.",
            "description": [
                {
                    "representation": "(1)",
                    "description": "A committee established, or safety and health representative selected, under this Act for an employer, may request the Authority to obtain from the National Insurance Board, established under  the National Insurance Act, an annual summary of data relating to such employer in respect of the number of work accident fatalities, the number of lost workday cases, the number lost workdays, the number of non-fatal cases that required medical aid without lost workdays, the incidence of occupational diseases, the number of work-related injuries, and such other data as the committee or safety and health representative may request."
                },
                {
                    "representation": "(2)",
                    "description": "Upon such request and receipt of such annual summary of data, the Authority shall send copies thereof to the committee, safety and health representative and the employers and the employer shall cause a copy thereof to be posted in a conspicuous place or places at the work-place LAWS OF GUYANA Occupational Safety and Health Cap. 99:06 49  L.R.O. 1/2012                      Representation during inspections.                                               where it is most likely to come to the attention of the workers."
                },
                {
                    "representation": "(3)",
                    "description": "The Authority shall, in accordance with the objects and purposes of this Act, ensure that persons and organizations concerned with the purposes of this Act are provided with information and advice pertaining to its administration and to the protection to the occupational safety and occupational health of workers generally."
                },
                {
                    "representation": "(c)",
                    "description": "Provisions applicable to Inspections, etc."
                }
            ]
        }
    },
    {
        "act": "OCCUPATIONAL SAFETY AND HEALTH ACT",
        "source": "https://mola.gov.gy/laws-of-guyana",
        "type": {
            "name": "section",
            "representation": "27",
            "title": "Representation during inspections. ",
            "context": "OCCUPATIONAL SAFETY AND HEALTH ACT under Representation during inspections. 27. (1) Where an inspector makes an inspection of a workplace under the powers conferred upon him or her under section 13, the employer or group of employers shall afford a committee member representing workers or a safety and health representative, if any, or a worker selected by a trade union or trade unions, if any, because of knowledge, experience and training, to represent it or them and, where there is no trade union, a worker selected by the workers because of knowledge, training and experience to represent them, the opportunity to accompany the inspector during his physical inspection of a workplace, or any part thereof.  (2) Where there is no committee member representing workers, no safety and health representative or worker selected under subsection (2), the inspector shall endeavour to consult during his physical inspection with a reasonable number of the workers concerning matters of safety and health at their work.  (3) The time spent by a committee member representing workers, a safety and health representative or a worker selected in accordance with subsection (2) in accompanying an inspector during his physical inspection, shall be deemed to be work time of which he shall be paid by his employer at his regular or premium rate as may be proper.  LAWS OF GUYANA 50 Cap. 99:06 Occupational Safety and Health  L.R.O. 1/2012 Request for and inspections.              Seizure of documents or articles.                                 Orders by inspectors for non-compliance.",
            "description": [
                {
                    "representation": "(1)",
                    "description": "Where an inspector makes an inspection of a workplace under the powers conferred upon him or her under section 13, the employer or group of employers shall afford a committee member representing workers or a safety and health representative, if any, or a worker selected by a trade union or trade unions, if any, because of knowledge, experience and training, to represent it or them and, where there is no trade union, a worker selected by the workers because of knowledge, training and experience to represent them, the opportunity to accompany the inspector during his physical inspection of a workplace, or any part thereof."
                },
                {
                    "representation": "(2)",
                    "description": "in accompanying an inspector during his physical inspection, shall be deemed to be work time of which he shall be paid by his employer at his regular or premium rate as may be proper.  LAWS OF GUYANA 50 Cap. 99:06 Occupational Safety and Health  L.R.O. 1/2012 Request for and inspections.              Seizure of documents or articles.                                 Orders by inspectors for non-compliance."
                },
                {
                    "representation": "(3)",
                    "description": "The time spent by a committee member representing workers, a safety and health representative or a worker selected in accordance with subsection"
                }
            ]
        }
    },
    {
        "act": "OCCUPATIONAL SAFETY AND HEALTH ACT",
        "source": "https://mola.gov.gy/laws-of-guyana",
        "type": {
            "name": "section",
            "representation": "28",
            "title": "Request for inspections. ",
            "context": "OCCUPATIONAL SAFETY AND HEALTH ACT under Request for inspections. 28. Subject to section 23(20), an inspector may in writing direct a safety representative or a member designated under section 23(18) to inspect the physical condition of the work-place or part thereof at specified intervals.",
            "description": "Subject to section 23(20), an inspector may in writing direct a safety representative or a member designated under section 23(18) to inspect the physical condition of the work-place or part thereof at specified intervals."
        }
    },
    {
        "act": "OCCUPATIONAL SAFETY AND HEALTH ACT",
        "source": "https://mola.gov.gy/laws-of-guyana",
        "type": {
            "name": "section",
            "representation": "29",
            "title": "Seizure of documents or articles. ",
            "context": "OCCUPATIONAL SAFETY AND HEALTH ACT under Seizure of documents or articles. 29. (1) While acting under the authority of this Act, an inspector may, without a warrant or court order, seize any article or document that is produced to him or that is in plain view, if the inspector reasonably believes that this Act or a regulation has been contravened and that the article or document will afford evidence of the contravention.  (2) The inspector may remove the article or document seized or may detain it in the place in which it is seized. (3) The inspector shall inform the person from whom the article or document is seized as to the reason for the seizure and shall give the person a receipt for it; the person from whom the article or document is seized, shall, immediately on receiving information as to the reason for the seizure and the receipt of the article or document seized, bring such information and receipt to the attention of management.  (4) The inspector shall bring an article or document seized under the authority of this section before the Authority or, if that is not reasonably possible, shall report the seizure to the Authority.",
            "description": [
                {
                    "representation": "(1)",
                    "description": "While acting under the authority of this Act, an inspector may, without a warrant or court order, seize any article or document that is produced to him or that is in plain view, if the inspector reasonably believes that this Act or a regulation has been contravened and that the article or document will afford evidence of the contravention."
                },
                {
                    "representation": "(2)",
                    "description": "The inspector may remove the article or document seized or may detain it in the place in which it is seized."
                },
                {
                    "representation": "(3)",
                    "description": "The inspector shall inform the person from whom the article or document is seized as to the reason for the seizure and shall give the person a receipt for it; the person from whom the article or document is seized, shall, immediately on receiving information as to the reason for the seizure and the receipt of the article or document seized, bring such information and receipt to the attention of management."
                },
                {
                    "representation": "(4)",
                    "description": "The inspector shall bring an article or document seized under the authority of this section before the Authority or, if that is not reasonably possible, shall report the seizure to the Authority."
                }
            ]
        }
    },
    {
        "act": "OCCUPATIONAL SAFETY AND HEALTH ACT",
        "source": "https://mola.gov.gy/laws-of-guyana",
        "type": {
            "name": "section",
            "representation": "30",
            "title": "Orders by inspectors for non-compliance ",
            "context": "OCCUPATIONAL SAFETY AND HEALTH ACT under Orders by inspectors for non-compliance 30. (1) Where an inspector finds that a provision of this Act or the regulations is being contravened, the inspector may order, orally or in writing, the owner, employer, or person whom he, or she believes to be in charge of a workplace or the person whom the inspector believes to be the contravener to comply with the provision and may require the order to be carried out forthwith or within such period of time as the inspector specifies.  LAWS OF GUYANA Occupational Safety and Health Cap. 99:06 51  L.R.O. 1/2012                                                 (2) Where an inspector makes an oral order under subsection (1), the inspector shall confirm the order in writing before leaving the workplace.  (3) An order made under subsection (1) shall indicate generally the nature of the contravention and where appropriate the location of the contravention.  (4) An order made under subsection (1) may require an employer to submit to the Authority a compliance plan prepared in the manner and including such items as required by the order.  (5) The compliance plan shall specify what the employer plans to do to comply with the order and when the employer intends to achieve compliance.  (6) Where an inspector makes an order under subsection (1) and finds that  the contravention or this Act or the regulations is a danger or hazard to the safety and health of a worker, the inspector may  (a) order that any place, equipment, machine, device, article or any process or chemical shall not be used until the order is complied with;  (b) order that the work at the workplace as indicated in the order shall stop until the order to stop work is withdrawn or cancelled by an inspector after an inspection;  (c) order that the workplace where the contravention exists  be cleared of workers and isolated by barricades, fencing or any other means suitable to prevent access thereto by a worker LAWS OF GUYANA 52 Cap. 99:06 Occupational Safety and Health  L.R.O. 1/2012                                                 until the danger or hazard to the safety or health of a worker is removed.  (7) Despite subsection (6)(b), an employer who gives notice to an inspector of compliance with an order made under subsection (6) may resume work pending an inspection and decision by an inspector respecting compliance with the order if, before the resumption of work, a committee member representing workers or a safety and health representative, as the case may be, advises an inspector that in his opinion the order has been complied with.  (8) In addition to the orders that may be made under subsection (6), where an inspector makes an order under subsection (1) for a contravention of section 62 or 65 or the Authority has been advised of an employers inability to obtain an unexpired chemical safety data sheet, the inspector may order that the hazardous chemical shall not be used or that the article that causes, emits or produces the hazardous physical agent not to be used or operated until the order is withdrawn or cancelled.  (9) Where an inspector makes an order under this section, he may affix to the workplace, or to any equipment, machine, device or article a copy thereof or a notice in the prescribed form and no person, except an inspector, shall remove such copy or notice unless authorized to do so by an inspector.  (10) Where in inspector makes an order in writing or issues a report of his inspection to an owner, employer or person in charge of the workplace, the owner, employer or person in charge of the workplace shall forthwith cause a copy or copies thereof to be posted in a conspicuous place or places at the workplace where it is most likely to come to the attention of the workers and shall furnish a copy of such order or report to the safety and health representative or the LAWS OF GUYANA Occupational Safety and Health Cap. 99:06 53  L.R.O. 1/2012                              Entry into barricaded area.            Notice of compliance.                committee, if any, and the inspector shall cause a copy thereof to be furnished to a person who has complained of a contravention of this Act or the regulations.  (11) An inspector shall hold or afford to an owner, employer or any other person an opportunity for a hearing before making an order.  (12) Notwithstanding the requirements specified in this section with regard to in order of an inspector, where an inspector has reason to believe that a person has committed an offence against this Act or the regulations, he may give that person a notice offering him the opportunity to discharge any liability to conviction for that offence by payment to the Authority of a sum of money which amounts to two- thirds of the minimum prescribed penalty within twenty-eight days of the date of the notice.",
            "description": [
                {
                    "representation": "(1)",
                    "description": "for a contravention of section 62 or 65 or the Authority has been advised of an employers inability to obtain an unexpired chemical safety data sheet, the inspector may order that the hazardous chemical shall not be used or that the article that causes, emits or produces the hazardous physical agent not to be used or operated until the order is withdrawn or cancelled."
                },
                {
                    "representation": "(2)",
                    "description": "Where an inspector makes an oral order under subsection"
                },
                {
                    "representation": "(3)",
                    "description": "An order made under subsection"
                },
                {
                    "representation": "(4)",
                    "description": "An order made under subsection"
                },
                {
                    "representation": "(5)",
                    "description": "The compliance plan shall specify what the employer plans to do to comply with the order and when the employer intends to achieve compliance."
                },
                {
                    "representation": "(6)",
                    "description": "may resume work pending an inspection and decision by an inspector respecting compliance with the order if, before the resumption of work, a committee member representing workers or a safety and health representative, as the case may be, advises an inspector that in his opinion the order has been complied with."
                },
                {
                    "representation": "(a)",
                    "description": "order that any place, equipment, machine, device, article or any process or chemical shall not be used until the order is complied with;"
                },
                {
                    "representation": "(b)",
                    "description": "order that the work at the workplace as indicated in the order shall stop until the order to stop work is withdrawn or cancelled by an inspector after an inspection;"
                },
                {
                    "representation": "(c)",
                    "description": "order that the workplace where the contravention exists  be cleared of workers and isolated by barricades, fencing or any other means suitable to prevent access thereto by a worker LAWS OF GUYANA 52 Cap. 99:06 Occupational Safety and Health  L.R.O. 1/2012                                                 until the danger or hazard to the safety or health of a worker is removed."
                },
                {
                    "representation": "(7)",
                    "description": "Despite subsection"
                },
                {
                    "representation": "(8)",
                    "description": "In addition to the orders that may be made under subsection"
                },
                {
                    "representation": "(9)",
                    "description": "Where an inspector makes an order under this section, he may affix to the workplace, or to any equipment, machine, device or article a copy thereof or a notice in the prescribed form and no person, except an inspector, shall remove such copy or notice unless authorized to do so by an inspector."
                }
            ]
        }
    },
    {
        "act": "OCCUPATIONAL SAFETY AND HEALTH ACT",
        "source": "https://mola.gov.gy/laws-of-guyana",
        "type": {
            "name": "section",
            "representation": "31",
            "title": "Entry into barricaded area. ",
            "context": "OCCUPATIONAL SAFETY AND HEALTH ACT under Entry into barricaded area. 31. Where an order is made under section 30(6) (c), no owner, employer or supervisor shall require or permit a worker to enter the workplace except for the purpose of doing work that is necessary or required to remove the danger or hazard and only where the worker is protected from the danger or hazard.",
            "description": [
                {
                    "representation": "(6)",
                    "description": "(c), no owner, employer or supervisor shall require or permit a worker to enter the workplace except for the purpose of doing work that is necessary or required to remove the danger or hazard and only where the worker is protected from the danger or hazard."
                }
            ]
        }
    },
    {
        "act": "OCCUPATIONAL SAFETY AND HEALTH ACT",
        "source": "https://mola.gov.gy/laws-of-guyana",
        "type": {
            "name": "section",
            "representation": "32",
            "title": "Notice of compliance. ",
            "context": "OCCUPATIONAL SAFETY AND HEALTH ACT under Notice of compliance. 32. (1) Within three days after an employer who has received an order under section 30 believes that compliance with the order has been achieved, the employer shall submit to the Authority a notice of compliance.  (2) The notice shall be signed by the  employer and shall be accompanied by  (a) a statement of agreement or disagreement with the contents of the notice, signed by a member of the committee representing workers or by a safety and health representative, as LAWS OF GUYANA 54 Cap. 99:06 Occupational Safety and Health  L.R.O. 1/2012                        Injunction proceedings.              1 Appeals from order of an inspector.                  the case may be; or  (b) a statement that the member or representative has declined to sign the statement referred to in paragraph (a).  (3) The employer shall post the notice of compliance submitted under subsection (1) for a period of fourteen days following its submission to the Authority in a place or places in the workplace where it is most likely to come to the attention of workers.  (4) Despite the submission of a notice of compliance,  an employer achieves compliance with an order under section 30 when in inspector determines the compliance has been achieved.",
            "description": [
                {
                    "representation": "(1)",
                    "description": "for a period of fourteen days following its submission to the Authority in a place or places in the workplace where it is most likely to come to the attention of workers."
                },
                {
                    "representation": "(2)",
                    "description": "The notice shall be signed by the  employer and shall be accompanied by"
                },
                {
                    "representation": "(a)",
                    "description": "a statement of agreement or disagreement with the contents of the notice, signed by a member of the committee representing workers or by a safety and health representative, as LAWS OF GUYANA 54 Cap. 99:06 Occupational Safety and Health  L.R.O. 1/2012                        Injunction proceedings.              1 Appeals from order of an inspector.                  the case may be; or"
                },
                {
                    "representation": "(b)",
                    "description": "a statement that the member or representative has declined to sign the statement referred to in paragraph"
                },
                {
                    "representation": "(3)",
                    "description": "The employer shall post the notice of compliance submitted under subsection"
                },
                {
                    "representation": "(4)",
                    "description": "Despite the submission of a notice of compliance,  an employer achieves compliance with an order under section 30 when in inspector determines the compliance has been achieved."
                }
            ]
        }
    },
    {
        "act": "OCCUPATIONAL SAFETY AND HEALTH ACT",
        "source": "https://mola.gov.gy/laws-of-guyana",
        "type": {
            "name": "section",
            "representation": "33",
            "title": "Injunction proceedings. ",
            "context": "OCCUPATIONAL SAFETY AND HEALTH ACT under Injunction proceedings. 33. In addition to any other remedy or penalty therefor, where an order under section 30 (6) is contravened, such contravention may be restrained upon an application made to the High Court at the instance of the Authority.",
            "description": [
                {
                    "representation": "(6)",
                    "description": "is contravened, such contravention may be restrained upon an application made to the High Court at the instance of the Authority."
                }
            ]
        }
    },
    {
        "act": "OCCUPATIONAL SAFETY AND HEALTH ACT",
        "source": "https://mola.gov.gy/laws-of-guyana",
        "type": {
            "name": "section",
            "representation": "34",
            "title": "Appeals from order of inspector. ",
            "context": "OCCUPATIONAL SAFETY AND HEALTH ACT under Appeals from order of inspector. 34. (1) Any employer, owner, worker or trade union which considers himself, or itself aggrieved by any order made by an inspector under this Act or the regulations may, within seven days of the making thereof, appeal to the Minister. (2) An appeal to the Minister may be made in writing or orally or by telephone, but the Minister may require the grounds for appeal to be specified in writing before the appeal is heard.  (3) The appellant, the inspector from whom the appeal is taken and such other persons as the Minister may specify shall be parties to an appeal under this section.  (4) The Minister may, having regard to the circumstances, determine the appeal or direct that an appeal LAWS OF GUYANA Occupational Safety and Health Cap. 99:06 55  L.R.O. 1/2012                                                           Obstruction of inspector.  be determined on his behalf, by the Commissioner.  (5) The Minister or, where the Commissioner has been directed under subsection (4), the Commissioner so directed, may, notwithstanding section 21(2), give such directions and issue such orders as he considers proper or necessary concerning the procedures to be adopted or followed.  (6) On an appeal under this section, the Minister or, where the Commissioner has been directed under subsection (4), the Commissioner so directed, may substitute his findings for those of the inspector who made the order appealed from and may rescind or affirm the order or make a new order in substitution therefor, and for such purpose has all the powers of an inspector and the order of the Minister or the Commissioner as the case may be shall stand in the place of and have the like effect under this Act and the regulations as the order of the inspector.  (7) In this section, an order of an inspector under this Act or the regulations includes any order or decision made or given or the imposition of any term or condition therein by an inspector under the authority of this Act or the regulations or the refusal to make an order or decision by an inspector.  (8) A decision of the Minister or the Commissioner, as the case may be, under this section is final.  (9) On an appeal under this section, the Minister or, where the Commissioner has been directed under subsection (4), the Commissioner so directed, may suspend the operation of the order appealed from pending the disposition of the appeal.",
            "description": [
                {
                    "representation": "(1)",
                    "description": "Any employer, owner, worker or trade union which considers himself, or itself aggrieved by any order made by an inspector under this Act or the regulations may, within seven days of the making thereof, appeal to the Minister."
                },
                {
                    "representation": "(2)",
                    "description": "An appeal to the Minister may be made in writing or orally or by telephone, but the Minister may require the grounds for appeal to be specified in writing before the appeal is heard."
                },
                {
                    "representation": "(3)",
                    "description": "The appellant, the inspector from whom the appeal is taken and such other persons as the Minister may specify shall be parties to an appeal under this section."
                },
                {
                    "representation": "(4)",
                    "description": "The Minister may, having regard to the circumstances, determine the appeal or direct that an appeal LAWS OF GUYANA Occupational Safety and Health Cap. 99:06 55  L.R.O. 1/2012                                                           Obstruction of inspector.  be determined on his behalf, by the Commissioner."
                },
                {
                    "representation": "(5)",
                    "description": "The Minister or, where the Commissioner has been directed under subsection"
                },
                {
                    "representation": "(6)",
                    "description": "On an appeal under this section, the Minister or, where the Commissioner has been directed under subsection"
                },
                {
                    "representation": "(7)",
                    "description": "In this section, an order of an inspector under this Act or the regulations includes any order or decision made or given or the imposition of any term or condition therein by an inspector under the authority of this Act or the regulations or the refusal to make an order or decision by an inspector."
                },
                {
                    "representation": "(8)",
                    "description": "A decision of the Minister or the Commissioner, as the case may be, under this section is final."
                },
                {
                    "representation": "(9)",
                    "description": "On an appeal under this section, the Minister or, where the Commissioner has been directed under subsection"
                }
            ]
        }
    },
    {
        "act": "OCCUPATIONAL SAFETY AND HEALTH ACT",
        "source": "https://mola.gov.gy/laws-of-guyana",
        "type": {
            "name": "section",
            "representation": "35",
            "title": "Obstruction of inspector. ",
            "context": "OCCUPATIONAL SAFETY AND HEALTH ACT under Obstruction of inspector. 35. (1) No person shall hinder, obstruct, molest or interfere with or attempt to hinder, obstruct, molest or LAWS OF GUYANA 56 Cap. 99:06 Occupational Safety and Health  L.R.O. 1/2012                                                      interfere with an inspector in the exercise of a power or the performance of a duty under this Act or the regulations.  (2) Every person shall furnish all necessary means in the persons power to facilitate any entry, inspection, examination, testing or inquiry by an inspector in the exercise of his powers or performance of his duties under this Act or the regulations.  (3) No person shall knowingly furnish an inspector with false information or neglect or refuse to furnish information required by an inspector in the exercise of his duties under this Act or the regulations.  (4) No person shall interfere with any monitoring equipment or device in a workplace.  (5) No person shall knowingly  (a) hinder or interfere with a committee, a committee member or a safety, and health representative in the exercise of a power or performance of a duty under this Act;  (b) furnish a committee, a committee member or a safety and health representative with false information in the exercise of a power or performance of a duty under this Act;   (c) hinder or interfere with a worker selected by a trade union or trade unions or a worker selected by the workers to represent them in the exercise of a power or performance of a duty under this Act.  LAWS OF GUYANA Occupational Safety and Health Cap. 99:06 57  L.R.O. 1/2012 Information confidential.",
            "description": [
                {
                    "representation": "(1)",
                    "description": "No person shall hinder, obstruct, molest or interfere with or attempt to hinder, obstruct, molest or LAWS OF GUYANA 56 Cap. 99:06 Occupational Safety and Health  L.R.O. 1/2012                                                      interfere with an inspector in the exercise of a power or the performance of a duty under this Act or the regulations."
                },
                {
                    "representation": "(2)",
                    "description": "Every person shall furnish all necessary means in the persons power to facilitate any entry, inspection, examination, testing or inquiry by an inspector in the exercise of his powers or performance of his duties under this Act or the regulations."
                },
                {
                    "representation": "(3)",
                    "description": "No person shall knowingly furnish an inspector with false information or neglect or refuse to furnish information required by an inspector in the exercise of his duties under this Act or the regulations."
                },
                {
                    "representation": "(4)",
                    "description": "No person shall interfere with any monitoring equipment or device in a workplace."
                },
                {
                    "representation": "(5)",
                    "description": "No person shall knowingly"
                },
                {
                    "representation": "(a)",
                    "description": "hinder or interfere with a committee, a committee member or a safety, and health representative in the exercise of a power or performance of a duty under this Act;"
                },
                {
                    "representation": "(b)",
                    "description": "furnish a committee, a committee member or a safety and health representative with false information in the exercise of a power or performance of a duty under this Act;"
                },
                {
                    "representation": "(c)",
                    "description": "hinder or interfere with a worker selected by a trade union or trade unions or a worker selected by the workers to represent them in the exercise of a power or performance of a duty under this Act.  LAWS OF GUYANA Occupational Safety and Health Cap. 99:06 57  L.R.O. 1/2012 Information confidential."
                }
            ]
        }
    },
    {
        "act": "OCCUPATIONAL SAFETY AND HEALTH ACT",
        "source": "https://mola.gov.gy/laws-of-guyana",
        "type": {
            "name": "section",
            "representation": "36",
            "title": "Information confidential. ",
            "context": "OCCUPATIONAL SAFETY AND HEALTH ACT under Information confidential. 36. (1) Except for the purposes of this Act and the regulations or as required by law  (a) an inspector, a person accompanying an inspector or person who, at the request of an inspector, makes an examination, test or inquiry, shall not publish, disclose or communicate to any person any information, material statement, report or result of any examination, test or inquiry acquired, furnished, obtained, made or received under the powers conferred under this Act or the regulations;  (b) no person shall publish, disclose or communicate to any person any secret manufacturing process or trade secret acquired,  furnished, obtained, made or received under the provisions of this Act or the regulations;  (c) no person to whom information is communicated under this Act and the regulations shall divulge the name of the informant to any person; and  (d) no person shall disclose any information obtained in any medical examination, test or X-ray of a worker made or taken under this Act except in a form calculated to prevent the information from being identified with a particular person or case.  (2) No employer shall seek to gain access, except by an order of court or other tribunal or in order to comply with another Act or in order to employ or continue to employ LAWS OF GUYANA 58 Cap. 99:06 Occupational Safety and Health  L.R.O. 1/2012                                              Copies of reports.           Immunity.        a worker in a food manufacturing establishment, to a health record concerning a worker without the workers written consent.  (3) An inspector or a person who, at the request of an inspector, accompanies an inspector, or a person who makes an examination, test, inquiry or takes samples at the request of an inspector, is not a compellable witness in a civil suit or any proceeding, except an inquest under section 71 of this Act, respecting any information, material, statement or test acquired, furnished, obtained, made or received under this Act or the regulations.  (4) The Authority may communicate or allow to be communicated or disclosed information, material, statements or the result of a test acquired, furnished, obtained, made or received under this Act or the regulations.  (5) Subsection (1) shall not apply so as to prevent any person from providing any information in the possession of the person, including confidential business information, in a medical emergency for the purpose of diagnosis or treatment.",
            "description": [
                {
                    "representation": "(1)",
                    "description": "shall not apply so as to prevent any person from providing any information in the possession of the person, including confidential business information, in a medical emergency for the purpose of diagnosis or treatment."
                },
                {
                    "representation": "(a)",
                    "description": "an inspector, a person accompanying an inspector or person who, at the request of an inspector, makes an examination, test or inquiry, shall not publish, disclose or communicate to any person any information, material statement, report or result of any examination, test or inquiry acquired, furnished, obtained, made or received under the powers conferred under this Act or the regulations;"
                },
                {
                    "representation": "(b)",
                    "description": "no person shall publish, disclose or communicate to any person any secret manufacturing process or trade secret acquired,  furnished, obtained, made or received under the provisions of this Act or the regulations;"
                },
                {
                    "representation": "(c)",
                    "description": "no person to whom information is communicated under this Act and the regulations shall divulge the name of the informant to any person; and"
                },
                {
                    "representation": "(d)",
                    "description": "no person shall disclose any information obtained in any medical examination, test or X-ray of a worker made or taken under this Act except in a form calculated to prevent the information from being identified with a particular person or case."
                },
                {
                    "representation": "(2)",
                    "description": "No employer shall seek to gain access, except by an order of court or other tribunal or in order to comply with another Act or in order to employ or continue to employ LAWS OF GUYANA 58 Cap. 99:06 Occupational Safety and Health  L.R.O. 1/2012                                              Copies of reports.           Immunity.        a worker in a food manufacturing establishment, to a health record concerning a worker without the workers written consent."
                },
                {
                    "representation": "(3)",
                    "description": "An inspector or a person who, at the request of an inspector, accompanies an inspector, or a person who makes an examination, test, inquiry or takes samples at the request of an inspector, is not a compellable witness in a civil suit or any proceeding, except an inquest under section 71 of this Act, respecting any information, material, statement or test acquired, furnished, obtained, made or received under this Act or the regulations."
                },
                {
                    "representation": "(4)",
                    "description": "The Authority may communicate or allow to be communicated or disclosed information, material, statements or the result of a test acquired, furnished, obtained, made or received under this Act or the regulations."
                },
                {
                    "representation": "(5)",
                    "description": "Subsection"
                }
            ]
        }
    },
    {
        "act": "OCCUPATIONAL SAFETY AND HEALTH ACT",
        "source": "https://mola.gov.gy/laws-of-guyana",
        "type": {
            "name": "section",
            "representation": "37",
            "title": "Copies of reports. ",
            "context": "OCCUPATIONAL SAFETY AND HEALTH ACT under Copies of reports. 37. The Authority may, upon receipt of a request in writing from the owner of an industrial establishment who his entered in an agreement to sell the same and upon payment of the fee or fees prescribed, furnish to the owner or a person designated by the owner copies of reports or orders of an inspector made under this Act in respect of the workplace as to its compliance with subsection 52(1).",
            "description": "The Authority may, upon receipt of a request in writing from the owner of an industrial establishment who his entered in an agreement to sell the same and upon payment of the fee or fees prescribed, furnish to the owner or a person designated by the owner copies of reports or orders of an inspector made under this Act in respect of the workplace as to its compliance with subsection 52(1)."
        }
    },
    {
        "act": "OCCUPATIONAL SAFETY AND HEALTH ACT",
        "source": "https://mola.gov.gy/laws-of-guyana",
        "type": {
            "name": "section",
            "representation": "38",
            "title": "Immunity.  (d) Expenses of Administration  ",
            "context": "OCCUPATIONAL SAFETY AND HEALTH ACT under Immunity.  (d) Expenses of Administration  38. No action or other proceeding for damages or prohibition shall be instituted respecting any act done in good faith in the execution or intended execution of a persons duties under this Act or in the exercise or intended exercise of a persons powers under this Act or for any alleged neglect or default in the execution or performance in good faith of the LAWS OF GUYANA Occupational Safety and Health Cap. 99:06 59  L.R.O. 1/2012                                    Levy to defray expenses. c. 36:01                                  c. 36:01   persons duties or powers if the person is  (a) an inspector, a medical inspector, a technical examiner or an advisory for the Authority.  (b) a safety and health representative or a committee member;  (c) a worker selected by a trade union or trade unions or by workers to represent them; or  (d) the Commissioner.   (d) Expenses of Administration",
            "description": [
                {
                    "representation": "(a)",
                    "description": "an inspector, a medical inspector, a technical examiner or an advisory for the Authority."
                },
                {
                    "representation": "(b)",
                    "description": "a safety and health representative or a committee member;"
                },
                {
                    "representation": "(c)",
                    "description": "a worker selected by a trade union or trade unions or by workers to represent them; or"
                },
                {
                    "representation": "(d)",
                    "description": "Expenses of Administration"
                }
            ]
        }
    },
    {
        "act": "OCCUPATIONAL SAFETY AND HEALTH ACT",
        "source": "https://mola.gov.gy/laws-of-guyana",
        "type": {
            "name": "section",
            "representation": "39",
            "title": "Levy to defray expenses.  PART IV SAFETY AND HEALTH  ",
            "context": "OCCUPATIONAL SAFETY AND HEALTH ACT under Levy to defray expenses.  PART IV SAFETY AND HEALTH  39. (1) The Minister may fix an amount that shall be levied by the National Insurance Board established under the National Insurance and  Social Security Act against employers of workers in industrial establishments, to defray the expenses of the administration of this Act and such amount not exceed an amount prescribed by the Minister for the fiscal year in which this Act comes into force and shall be subject to an increase in each subsequent fiscal year by a sum not exceeding ten per cent of the amount fixed for the preceding fiscal year.  (2) The National Insurance Board shall add to the assessment and levies made under the National Insurance and Social Security Act upon employers under that Act a sum calculated as a percentage of the assessments and levies and which percentage shall be determined as the proportion that the amount fixed under subsection (1) bears to the total sum that the National Insurance Board fixes and determines to be assessed for payment by such employers and the National Insurance and Social Security Act shall apply to such sum and LAWS OF GUYANA 60 Cap. 99:06 Occupational Safety and Health  L.R.O. 1/2012                                   Safety of buildings, ways, machinery and plant.                            to the collection and payment thereof in the same manner as it applies to an assessment and levy made under that Act.  (3) The National Insurance Board shall collect the assessment and levy imposed under this section and shall pay the amounts so collected to the Authority.  (4) Regulations made under section 75(2) (c) (h) shall prescribe the provisions for giving effect to this section.  PART IV SAFETY AND HEALTH",
            "description": [
                {
                    "representation": "(1)",
                    "description": "bears to the total sum that the National Insurance Board fixes and determines to be assessed for payment by such employers and the National Insurance and Social Security Act shall apply to such sum and LAWS OF GUYANA 60 Cap. 99:06 Occupational Safety and Health  L.R.O. 1/2012                                   Safety of buildings, ways, machinery and plant.                            to the collection and payment thereof in the same manner as it applies to an assessment and levy made under that Act."
                },
                {
                    "representation": "(2)",
                    "description": "The National Insurance Board shall add to the assessment and levies made under the National Insurance and Social Security Act upon employers under that Act a sum calculated as a percentage of the assessments and levies and which percentage shall be determined as the proportion that the amount fixed under subsection"
                },
                {
                    "representation": "(3)",
                    "description": "The National Insurance Board shall collect the assessment and levy imposed under this section and shall pay the amounts so collected to the Authority."
                },
                {
                    "representation": "(4)",
                    "description": "Regulations made under section 75(2)"
                },
                {
                    "representation": "(c)",
                    "description": "(h) shall prescribe the provisions for giving effect to this section.  PART IV SAFETY AND HEALTH"
                }
            ]
        }
    },
    {
        "act": "OCCUPATIONAL SAFETY AND HEALTH ACT",
        "source": "https://mola.gov.gy/laws-of-guyana",
        "type": {
            "name": "section",
            "representation": "40",
            "title": "Safety of buildings, ways, machinery and plant. ",
            "context": "OCCUPATIONAL SAFETY AND HEALTH ACT under Safety of buildings, ways, machinery and plant. 40. (1) Where it appears to the Authority that any building or part of a building, or any part of the ways, machinery or plant, in an industrial establishment is in such a condition as to be likely to cause risk of bodily injury to, or to endanger the safety of, persons employed in connection  with the industrial establishment or any class of such persons  (a) the Authority may serve on the occupier of the industrial establishment a notice in writing requiring him, before a date to be specified in the notice  (i) to furnish such drawings, specifications and other particulars as may be necessary to determine whether such building or part of the building, or such part of the ways, machinery or plant as aforesaid can be used without risk of bodily injury or danger to safety as aforesaid; (ii) to carry out such tests as may be necessary to determine the LAWS OF GUYANA Occupational Safety and Health Cap. 99:06 61  L.R.O. 1/2012                                             Prohibition of employment of children in factories. [22 of 2009]      strength or quality of any specified parts of the building, ways, machinery or plant as aforesaid, and to inform the Authority of the results of such tests; or  (b) the Authority may serve the occupier of the industrial establishment a notice in writing specifying the measures which should be adopted to remove the risk of bodily injury, and  the danger to safety as aforesaid, and requiring such measures to be carried out before a date to be specified in the notice.  (2) Where it appears to the Authority that the use of any building or part of a building, or any part of the ways, machinery or plant, in an industrial establishment involves imminent risk of bodily injury to, or imminent danger to the safety of, persons employed in connection with  the  industrial establishment or any class of such persons, the Authority may serve on the occupier of the industrial establishment a notice in writing prohibiting such use as aforesaid until the building or part of the building, or part of the ways, machinery or plant, as the case may be, has been repaired or altered in such a manner to remove such imminent risk, such imminent danger, as aforesaid.",
            "description": [
                {
                    "representation": "(1)",
                    "description": "Where it appears to the Authority that any building or part of a building, or any part of the ways, machinery or plant, in an industrial establishment is in such a condition as to be likely to cause risk of bodily injury to, or to endanger the safety of, persons employed in connection  with the industrial establishment or any class of such persons"
                },
                {
                    "representation": "(a)",
                    "description": "the Authority may serve on the occupier of the industrial establishment a notice in writing requiring him, before a date to be specified in the notice"
                },
                {
                    "representation": "(i)",
                    "description": "to furnish such drawings, specifications and other particulars as may be necessary to determine whether such building or part of the building, or such part of the ways, machinery or plant as aforesaid can be used without risk of bodily injury or danger to safety as aforesaid;"
                },
                {
                    "representation": "(b)",
                    "description": "the Authority may serve the occupier of the industrial establishment a notice in writing specifying the measures which should be adopted to remove the risk of bodily injury, and  the danger to safety as aforesaid, and requiring such measures to be carried out before a date to be specified in the notice."
                },
                {
                    "representation": "(2)",
                    "description": "Where it appears to the Authority that the use of any building or part of a building, or any part of the ways, machinery or plant, in an industrial establishment involves imminent risk of bodily injury to, or imminent danger to the safety of, persons employed in connection with  the  industrial establishment or any class of such persons, the Authority may serve on the occupier of the industrial establishment a notice in writing prohibiting such use as aforesaid until the building or part of the building, or part of the ways, machinery or plant, as the case may be, has been repaired or altered in such a manner to remove such imminent risk, such imminent danger, as aforesaid."
                }
            ]
        }
    },
    {
        "act": "OCCUPATIONAL SAFETY AND HEALTH ACT",
        "source": "https://mola.gov.gy/laws-of-guyana",
        "type": {
            "name": "section",
            "representation": "41",
            "title": "Prohibition of employment of children in factories. ",
            "context": "OCCUPATIONAL SAFETY AND HEALTH ACT under Prohibition of employment of children in factories. 41. (1) No child shall be employed in any factory or in the business of a factory outside the factory, or in any business trade or process ancillary to the business of the factory.  (2) Where it appears to the Authority that the presence in any factory or part of the factory, of children who cannot lawfully be employed therein may be dangerous to LAWS OF GUYANA 62 Cap. 99:06 Occupational Safety and Health  L.R.O. 1/2012                    c. 99:01        Construction and sale of new machinery.                                    them or injurious to their health, the Authority may serve on the occupier of the factory a notice in writing requiring him to prohibit and to prevent the admission of such children to the factory, or part of the factory, as the case may be.  (3) Nothing in this section affects or limits section 3(1) of the Employment of Young Persons and Children Act.",
            "description": [
                {
                    "representation": "(1)",
                    "description": "No child shall be employed in any factory or in the business of a factory outside the factory, or in any business trade or process ancillary to the business of the factory."
                },
                {
                    "representation": "(2)",
                    "description": "Where it appears to the Authority that the presence in any factory or part of the factory, of children who cannot lawfully be employed therein may be dangerous to LAWS OF GUYANA 62 Cap. 99:06 Occupational Safety and Health  L.R.O. 1/2012                    c. 99:01        Construction and sale of new machinery.                                    them or injurious to their health, the Authority may serve on the occupier of the factory a notice in writing requiring him to prohibit and to prevent the admission of such children to the factory, or part of the factory, as the case may be."
                },
                {
                    "representation": "(3)",
                    "description": "Nothing in this section affects or limits section 3(1) of the Employment of Young Persons and Children Act."
                }
            ]
        }
    },
    {
        "act": "OCCUPATIONAL SAFETY AND HEALTH ACT",
        "source": "https://mola.gov.gy/laws-of-guyana",
        "type": {
            "name": "section",
            "representation": "42",
            "title": "Construction and sale of new machinery. ",
            "context": "OCCUPATIONAL SAFETY AND HEALTH ACT under Construction and sale of new machinery. 42. (1) In the case of any machine in an industrial establishment being a machine intended to be driven by mechanical power  (a) every set-screw, bolt or key on any revolving shaft, spindle, wheel or pinion shall be so sunk, encased or otherwise effectively guarded by situation and design as to prevent danger;  (b) all spur and other toothed or friction gearing which does not require frequent adjustment while in motion, shall be completely encased unless it is so situated, or is of such design, as to be as safe as it would be if completely encased.  (2) Any person who sells, or lets on hire, or as agent of the seller or  hirer causes or procures to be sold or let on hire for use in an industrial establishment in Guyana any machine intended to be driven by mechanical power which does not comply with the requirements of this section shall be guilty of an offence.  (3) The Minister may make regulations extending subsection (2) to machinery or plant which does not comply with such requirements of this Act as may be specified in the regulations, and any regulations made under this subsection LAWS OF GUYANA Occupational Safety and Health Cap. 99:06 63  L.R.O. 1/2012                            Provisions as to sanitary or other arrangements.                                  may relate to machinery or plant in a specified process.  (4) Nothing in this section shall be construed as applying to any machine imported into, or constructed in, Guyana before the commencement of this Act and regulations made under this section shall not apply to any machinery or plant imported into, or constructed in, Guyana before the coming into force of such regulations.",
            "description": [
                {
                    "representation": "(1)",
                    "description": "In the case of any machine in an industrial establishment being a machine intended to be driven by mechanical power"
                },
                {
                    "representation": "(a)",
                    "description": "every set-screw, bolt or key on any revolving shaft, spindle, wheel or pinion shall be so sunk, encased or otherwise effectively guarded by situation and design as to prevent danger;"
                },
                {
                    "representation": "(b)",
                    "description": "all spur and other toothed or friction gearing which does not require frequent adjustment while in motion, shall be completely encased unless it is so situated, or is of such design, as to be as safe as it would be if completely encased."
                },
                {
                    "representation": "(2)",
                    "description": "to machinery or plant which does not comply with such requirements of this Act as may be specified in the regulations, and any regulations made under this subsection LAWS OF GUYANA Occupational Safety and Health Cap. 99:06 63  L.R.O. 1/2012                            Provisions as to sanitary or other arrangements.                                  may relate to machinery or plant in a specified process."
                },
                {
                    "representation": "(3)",
                    "description": "The Minister may make regulations extending subsection"
                },
                {
                    "representation": "(4)",
                    "description": "Nothing in this section shall be construed as applying to any machine imported into, or constructed in, Guyana before the commencement of this Act and regulations made under this section shall not apply to any machinery or plant imported into, or constructed in, Guyana before the coming into force of such regulations."
                }
            ]
        }
    },
    {
        "act": "OCCUPATIONAL SAFETY AND HEALTH ACT",
        "source": "https://mola.gov.gy/laws-of-guyana",
        "type": {
            "name": "section",
            "representation": "43",
            "title": "Provisions as to sanitary and other arrangements. LAWS OF GUYANA Occupational Safety and Health Cap. 99:06 5  L.R.O. 1/2012 SECTION  ",
            "context": "OCCUPATIONAL SAFETY AND HEALTH ACT under Provisions as to sanitary and other arrangements. LAWS OF GUYANA Occupational Safety and Health Cap. 99:06 5  L.R.O. 1/2012 SECTION  43. (1) In every part of an industrial establishment in which workers are employed  (a) suitable and sufficient means of ventilation shall be provided and maintained.  (b) suitable and sufficient means of lighting shall be provided and every such part of an industrial establishment shall be kept suitably and sufficiently lighted.  (2) In every industrial establishment there shall be provided and maintained at suitable points conveniently accessible to all workers an adequate supply of wholesome potable water, and vessels containing the water shall be clearly marked with the words Drinking Water.  (3) Where workers take any meals in the industrial establishment, there shall be provided and maintained suitable and sufficient facilities for the taking of those meals.  (4) In every industrial establishment there shall be provided and maintained for the use of the industrial establishment suitable and sufficient accommodation for clothing not worn during working hours with separate accommodation where male and female workers are employed. LAWS OF GUYANA 64 Cap. 99:06 Occupational Safety and Health  L.R.O. 1/2012                                                 (5) In every industrial establishment, not being an industrial establishment exempted from the provisions of this subsection, there shall be provided and maintained for the use of the workers suitable and sufficient sanitary convenience and suitable and sufficient washing facilities.  (6) An industrial establishment shall be exempted from the provisions of subsection (5) if there is in force a certificate granted by the appropriate authority exempting that industrial establishment therefrom, and any such certificate shall remain in force until it is withdrawn by the Authority, but no such certificate shall be granted with  respect to any industrial establishment unless the authority is satisfied that by reason of restricted accommodation or other special circumstances  affecting the industrial establishment it is reasonable that such a certificate should be in force with respect thereto, and that suitable and sufficient sanitary conveniences or washing facilities as the case may be, are otherwise conveniently available, and, subject as hereinafter provided, a certificate in force with respect to any industrial establishment shall be withdrawn if the Authority at any time ceases to be so satisfied as aforesaid:  Provided that, if the occupier of an industrial establishment is aggrieved by the withdrawal of such a certificate, he may appeal to the magistrates court for the district in which the industrial establishment is situated and that court may make such order concerning the certificate as appears to the court, having regard to the matters aforesaid, to be just and equitable.  (7) If it appears to the appropriate authority that there has been, in the case of any industrial establishment a contravention of any of the provisions of this section, the Authority shall, by notice served on the occupier of the industrial establishment, require him to take, within such time as may be limited by the notice such action as may be specified in the notice for the purpose of securing compliance LAWS OF GUYANA Occupational Safety and Health Cap. 99:06 65  L.R.O. 1/2012                                                Apportionment of expenses.             with the said provision, and, if any person served with such a notice fails to comply with the requirements thereof he shall be liable on summary conviction to a fine of seven thousand, five hundred dollars or in the case of a second or subsequent conviction in respect of the same requirement to a fine of twelve thousand, five hundred dollars or seven hundred and fifty dollars for every day since the first conviction in respect of that requirement, whichever is the greater:  Provided that it shall be a defence to any proceeding under this subsection to prove that there was no contravention of this section or that the requirements of any such notice as aforesaid were, within a reasonable time after service of the notice, complied with in so far as they were necessary to secure compliance with this section.  (8) In this section  suitable and sufficient means suitable and sufficient in the opinion of the appropriate authority, having regard to the circumstances and conditions affecting an industrial establishment or any part of an industrial establishment and  appropriate authority means the authority whose duty it is to enforce this section.",
            "description": [
                {
                    "representation": "(1)",
                    "description": "In every part of an industrial establishment in which workers are employed"
                },
                {
                    "representation": "(a)",
                    "description": "suitable and sufficient means of ventilation shall be provided and maintained."
                },
                {
                    "representation": "(b)",
                    "description": "suitable and sufficient means of lighting shall be provided and every such part of an industrial establishment shall be kept suitably and sufficiently lighted."
                },
                {
                    "representation": "(2)",
                    "description": "In every industrial establishment there shall be provided and maintained at suitable points conveniently accessible to all workers an adequate supply of wholesome potable water, and vessels containing the water shall be clearly marked with the words Drinking Water."
                },
                {
                    "representation": "(3)",
                    "description": "Where workers take any meals in the industrial establishment, there shall be provided and maintained suitable and sufficient facilities for the taking of those meals."
                },
                {
                    "representation": "(4)",
                    "description": "In every industrial establishment there shall be provided and maintained for the use of the industrial establishment suitable and sufficient accommodation for clothing not worn during working hours with separate accommodation where male and female workers are employed. LAWS OF GUYANA 64 Cap. 99:06 Occupational Safety and Health  L.R.O. 1/2012"
                },
                {
                    "representation": "(5)",
                    "description": "if there is in force a certificate granted by the appropriate authority exempting that industrial establishment therefrom, and any such certificate shall remain in force until it is withdrawn by the Authority, but no such certificate shall be granted with  respect to any industrial establishment unless the authority is satisfied that by reason of restricted accommodation or other special circumstances  affecting the industrial establishment it is reasonable that such a certificate should be in force with respect thereto, and that suitable and sufficient sanitary conveniences or washing facilities as the case may be, are otherwise conveniently available, and, subject as hereinafter provided, a certificate in force with respect to any industrial establishment shall be withdrawn if the Authority at any time ceases to be so satisfied as aforesaid:  Provided that, if the occupier of an industrial establishment is aggrieved by the withdrawal of such a certificate, he may appeal to the magistrates court for the district in which the industrial establishment is situated and that court may make such order concerning the certificate as appears to the court, having regard to the matters aforesaid, to be just and equitable."
                },
                {
                    "representation": "(6)",
                    "description": "An industrial establishment shall be exempted from the provisions of subsection"
                },
                {
                    "representation": "(7)",
                    "description": "If it appears to the appropriate authority that there has been, in the case of any industrial establishment a contravention of any of the provisions of this section, the Authority shall, by notice served on the occupier of the industrial establishment, require him to take, within such time as may be limited by the notice such action as may be specified in the notice for the purpose of securing compliance LAWS OF GUYANA Occupational Safety and Health Cap. 99:06 65  L.R.O. 1/2012                                                Apportionment of expenses.             with the said provision, and, if any person served with such a notice fails to comply with the requirements thereof he shall be liable on summary conviction to a fine of seven thousand, five hundred dollars or in the case of a second or subsequent conviction in respect of the same requirement to a fine of twelve thousand, five hundred dollars or seven hundred and fifty dollars for every day since the first conviction in respect of that requirement, whichever is the greater:  Provided that it shall be a defence to any proceeding under this subsection to prove that there was no contravention of this section or that the requirements of any such notice as aforesaid were, within a reasonable time after service of the notice, complied with in so far as they were necessary to secure compliance with this section."
                },
                {
                    "representation": "(8)",
                    "description": "In this section  suitable and sufficient means suitable and sufficient in the opinion of the appropriate authority, having regard to the circumstances and conditions affecting an industrial establishment or any part of an industrial establishment and  appropriate authority means the authority whose duty it is to enforce this section."
                }
            ]
        }
    },
    {
        "act": "OCCUPATIONAL SAFETY AND HEALTH ACT",
        "source": "https://mola.gov.gy/laws-of-guyana",
        "type": {
            "name": "section",
            "representation": "44",
            "title": "Apportionment of expenses.  PART V DUTIES OF EMPLOYERS, WORKERS AND OTHER PERSONS  ",
            "context": "OCCUPATIONAL SAFETY AND HEALTH ACT under Apportionment of expenses.  PART V DUTIES OF EMPLOYERS, WORKERS AND OTHER PERSONS  44. If any occupier of an industrial establishment who has incurred or is about to incur any expense for the purpose of securing that the requirements of the last foregoing section are complied with respect to the industrial establishment, alleges that the whole or any part of the expense ought to be borne by any other person having an interest in the premises, he  may apply to the magistrates court for the district in which the industrial establishment is situated and that court may make such order concerning the expense or its apportionment as appears to the court, having regard to all the circumstances of the case, including the terms of any LAWS OF GUYANA 66 Cap. 99:06 Occupational Safety and Health  L.R.O. 1/2012                  Duties of employer at construction site.                                   Duties of employer generally. [22 of 2009]        contract between the parties, to be just and equitable, and any order made under this section may direct that any such contract as aforesaid shall cease to have effect in so far as it is inconsistent with the terms of the order.  PART V DUTIES OF EMPLOYERS, WORKERS AND OTHER PERSONS",
            "description": "If any occupier of an industrial establishment who has incurred or is about to incur any expense for the purpose of securing that the requirements of the last foregoing section are complied with respect to the industrial establishment, alleges that the whole or any part of the expense ought to be borne by any other person having an interest in the premises, he  may apply to the magistrates court for the district in which the industrial establishment is situated and that court may make such order concerning the expense or its apportionment as appears to the court, having regard to all the circumstances of the case, including the terms of any LAWS OF GUYANA 66 Cap. 99:06 Occupational Safety and Health  L.R.O. 1/2012                  Duties of employer at construction site.                                   Duties of employer generally. [22 of 2009]        contract between the parties, to be just and equitable, and any order made under this section may direct that any such contract as aforesaid shall cease to have effect in so far as it is inconsistent with the terms of the order.  PART V DUTIES OF EMPLOYERS, WORKERS AND OTHER PERSONS"
        }
    },
    {
        "act": "OCCUPATIONAL SAFETY AND HEALTH ACT",
        "source": "https://mola.gov.gy/laws-of-guyana",
        "type": {
            "name": "section",
            "representation": "45",
            "title": "Duties of employer at a construction site. ",
            "context": "OCCUPATIONAL SAFETY AND HEALTH ACT under Duties of employer at a construction site. 45. (1) An employer at a construction site shall ensure that  (a) the measures and procedures prescribed by this Act and the regulations are carried out on the construction site;   (b) he and every worker performing work on the construction site complies with this Act and the regulations;   (c) the safety and health of workers on the construction site is protected  (2) Where so prescribed, an employer at a construction site shall, before commencing any work on a construction site, give to the Authority notice in writing of the construction work containing such information as may be prescribed.",
            "description": [
                {
                    "representation": "(1)",
                    "description": "An employer at a construction site shall ensure that"
                },
                {
                    "representation": "(a)",
                    "description": "the measures and procedures prescribed by this Act and the regulations are carried out on the construction site;"
                },
                {
                    "representation": "(b)",
                    "description": "he and every worker performing work on the construction site complies with this Act and the regulations;"
                },
                {
                    "representation": "(c)",
                    "description": "the safety and health of workers on the construction site is protected"
                },
                {
                    "representation": "(2)",
                    "description": "Where so prescribed, an employer at a construction site shall, before commencing any work on a construction site, give to the Authority notice in writing of the construction work containing such information as may be prescribed."
                }
            ]
        }
    },
    {
        "act": "OCCUPATIONAL SAFETY AND HEALTH ACT",
        "source": "https://mola.gov.gy/laws-of-guyana",
        "type": {
            "name": "section",
            "representation": "46",
            "title": "Duties of employer generally. ",
            "context": "OCCUPATIONAL SAFETY AND HEALTH ACT under Duties of employer generally. 46. (1) An employer shall ensure that  (a) the equipment materials and protective devices and clothing as prescribed are provided;  (b) the equipment, material and protective devices and clothing LAWS OF GUYANA Occupational Safety and Health Cap. 99:06 67  L.R.O. 1/2012                                                 provided by the employer are suitable and adequate and maintained in good condition;  (c) the measures and procedures prescribed are carried out in the workplace;  (d) the equipment, materials and protective devices and clothing provided by the employer are used as prescribed;  (e) a floor, roof, wall, pillar, support or other part of a workplace is capable of supporting all loads to which it may be subjected without causing the materials therein to be stressed beyond the allowable unit stresses established under any Act; and  (f) without prejudice to the provisions of any Act that governs environmental protection and pollution control in Guyana, work in a workplace is carried out without causing a discharge of noxious, hazardous, or polluting matter into air, water, or soil so far as is reasonably practicable or except under and in accordance with any license for the purpose granted under the authority of any Act.  (2) Without limiting the strict duty imposed by subsection (l), an employer shall  (a) provide information, instruction and supervision to a worker to protect the LAWS OF GUYANA 68 Cap. 99:06 Occupational Safety and Health  L.R.O. 1/2012                                                 safety and health of the worker;  (b) in a medical emergency for the purpose of diagnosis or treatment provide, upon request, information in the possession of the employer including confidential business information, to a legally qualified medical practitioner and to such other persons as may be prescribed;  (c) when appointing a supervisor, appoint a competent person;  (d) acquaint a worker or a person in authority over a worker of any hazard in the work and in the handling, storage, use, disposal and transport of any article, device, equipment, chemical, physical agent or biological agent.  (e) afford assistance and co-operation to a committee and a safety and health representative in the carrying out by the committee and the safety and health representative of any of their functions;  (f) & (g) [Repealed by 22 of 2009];  (h) take every precaution reasonable in the circumstances for the  protection of a worker;  (i) post, in the workplace, a copy of this Act and any explanatory material prepared by the Authority outlining LAWS OF GUYANA Occupational Safety and Health Cap. 99:06 69  L.R.O. 1/2012                                                 the rights, responsibilities and duties of workers;  (j) prepare and review at least annually, a written occupational safety and health policy in consultation with the committee or safety and health representative, if any, or a worker selected by the workers to represent them and develop and maintain a programme to implement that policy;  (k) post at a conspicuous location in the workplace a copy of the occupational safety and health policy;  (l) provide to the committee or to a safety and health representative the results of any report respecting occupational safety and health that is in the employers possession and, if that report is in writing, a copy of the portions of the report that concern occupational safety and health;  (m) advise workers of the results of any report referred to in paragraph (l) and, if the report is in writing, make available to them on request copies of the portions of the report that concern occupational safety and health;  (n) after being notified by a female worker that she is pregnant, adapt the working conditions of such worker or ensure that she is not involved in the use of or exposure to chemicals or substances or terms or conditions of LAWS OF GUYANA 70 Cap. 99:06 Occupational Safety and Health  L.R.O. 1/2012                                                                   work, which  are hazardous to her health and the health of the unborn child; where alternative work not involving the use or exposure or terms or conditions as aforesaid is available such work shall be assigned to such worker during pregnancy with the right of such worker to return to her previous work after the birth of her child;  (o) provide and maintain a safe, sound, healthy and secure working environment as far as is reasonably practicable;  (p) ensure that the work-place, machinery, equipment and processes under his control are safe and without risk to safety and health as far as is reasonably practicable; and  (q) ensure that, as far as is reasonably practicable, the chemicals, physical agents and biological agents shall under his control are without risk to safety and health when the appropriate measures of protection are taken.  (3) For the purposes of subsection (2)(c), an employer may appoint himself as a supervisor where the employer is a competent person.  (4) Subsection (2) (j) does not apply with respect to a workplace at which five or fewer workers are employed.   LAWS OF GUYANA Occupational Safety and Health Cap. 99:06 71  L.R.O. 1/2012               Additional duties of employers.",
            "description": [
                {
                    "representation": "(1)",
                    "description": "An employer shall ensure that"
                },
                {
                    "representation": "(a)",
                    "description": "provide information, instruction and supervision to a worker to protect the LAWS OF GUYANA 68 Cap. 99:06 Occupational Safety and Health  L.R.O. 1/2012                                                 safety and health of the worker;"
                },
                {
                    "representation": "(b)",
                    "description": "in a medical emergency for the purpose of diagnosis or treatment provide, upon request, information in the possession of the employer including confidential business information, to a legally qualified medical practitioner and to such other persons as may be prescribed;"
                },
                {
                    "representation": "(c)",
                    "description": "when appointing a supervisor, appoint a competent person;"
                },
                {
                    "representation": "(d)",
                    "description": "acquaint a worker or a person in authority over a worker of any hazard in the work and in the handling, storage, use, disposal and transport of any article, device, equipment, chemical, physical agent or biological agent."
                },
                {
                    "representation": "(e)",
                    "description": "afford assistance and co-operation to a committee and a safety and health representative in the carrying out by the committee and the safety and health representative of any of their functions;"
                },
                {
                    "representation": "(f)",
                    "description": "&"
                },
                {
                    "representation": "(2)",
                    "description": "(j) does not apply with respect to a workplace at which five or fewer workers are employed.   LAWS OF GUYANA Occupational Safety and Health Cap. 99:06 71  L.R.O. 1/2012               Additional duties of employers."
                },
                {
                    "representation": "(g)",
                    "description": "[Repealed by 22 of 2009];"
                },
                {
                    "representation": "(h)",
                    "description": "take every precaution reasonable in the circumstances for the  protection of a worker;"
                },
                {
                    "representation": "(i)",
                    "description": "post, in the workplace, a copy of this Act and any explanatory material prepared by the Authority outlining LAWS OF GUYANA Occupational Safety and Health Cap. 99:06 69  L.R.O. 1/2012                                                 the rights, responsibilities and duties of workers;"
                },
                {
                    "representation": "(j)",
                    "description": "prepare and review at least annually, a written occupational safety and health policy in consultation with the committee or safety and health representative, if any, or a worker selected by the workers to represent them and develop and maintain a programme to implement that policy;"
                },
                {
                    "representation": "(k)",
                    "description": "post at a conspicuous location in the workplace a copy of the occupational safety and health policy;"
                },
                {
                    "representation": "(l)",
                    "description": "and, if the report is in writing, make available to them on request copies of the portions of the report that concern occupational safety and health;"
                },
                {
                    "representation": "(m)",
                    "description": "advise workers of the results of any report referred to in paragraph"
                },
                {
                    "representation": "(n)",
                    "description": "after being notified by a female worker that she is pregnant, adapt the working conditions of such worker or ensure that she is not involved in the use of or exposure to chemicals or substances or terms or conditions of LAWS OF GUYANA 70 Cap. 99:06 Occupational Safety and Health  L.R.O. 1/2012                                                                   work, which  are hazardous to her health and the health of the unborn child; where alternative work not involving the use or exposure or terms or conditions as aforesaid is available such work shall be assigned to such worker during pregnancy with the right of such worker to return to her previous work after the birth of her child;"
                },
                {
                    "representation": "(o)",
                    "description": "provide and maintain a safe, sound, healthy and secure working environment as far as is reasonably practicable;"
                },
                {
                    "representation": "(p)",
                    "description": "ensure that the work-place, machinery, equipment and processes under his control are safe and without risk to safety and health as far as is reasonably practicable; and"
                },
                {
                    "representation": "(q)",
                    "description": "ensure that, as far as is reasonably practicable, the chemicals, physical agents and biological agents shall under his control are without risk to safety and health when the appropriate measures of protection are taken."
                },
                {
                    "representation": "(3)",
                    "description": "For the purposes of subsection"
                },
                {
                    "representation": "(4)",
                    "description": "Subsection"
                }
            ]
        }
    },
    {
        "act": "OCCUPATIONAL SAFETY AND HEALTH ACT",
        "source": "https://mola.gov.gy/laws-of-guyana",
        "type": {
            "name": "section",
            "representation": "47",
            "title": "Additional duties of employers. ",
            "context": "OCCUPATIONAL SAFETY AND HEALTH ACT under Additional duties of employers. 47. (1) In addition to the duties imposed by section 46, an employer shall  (a) establish an occupational health service for workers as prescribed;  (b) where an occupational health service is established as prescribed, maintain the same according to the standards prescribed;  (c) keep and maintain accurate records of the handling storage, use and disposal of chemicals, physical agents or biological agents as prescribed;  (d) accurately keep and maintain and make available to the worker affected such records of the exposure of a worker to chemicals, physical agents or biological agents as may be prescribed;  (e) notify the Authority of the use or introduction into a workplace of such chemicals, physical agents or biological agents as may be prescribed;  (f) monitor at such time or times or at such interval or intervals the levels of chemicals, physical agents or biological agents in a workplace and keep and post accurate records thereof as prescribed;  (g) comply with any standard limiting the exposure of a worker to chemicals, LAWS OF GUYANA 72 Cap. 99:06 Occupational Safety and Health  L.R.O. 1/2012                                                 physical agents or biological agents as prescribed;  (h) establish a medical surveillance program for the benefit of workers as prescribed;  (i) provide for safety-related medical examinations and tests for workers as prescribed;  (j) where so prescribed, only permit a worker to work or be in a workplace who has undergone such medical examinations, tests or X-rays as prescribed and who is found to be physically fit to do the work in the workplace;  (k) where so prescribed, provide a worker with written instructions as to the measures and procedures to be taken for the protection of the worker;  (l) carry out such training programmes for workers, supervisors and committee members as may be prescribed;  (m) adopt provisions to protect the privacy of workers and ensure that health surveillance is not used for discriminatory purposes or in any manner prejudicial to their interests, where a prescribed occupational health service is established under subsection (1)(a), prescribed safety-related medical examinations and LAWS OF GUYANA Occupational Safety and Health Cap. 99:06 73  L.R.O. 1/2012                                                 tests are provided under subsection  (1)(i), and only workers who have undergone prescribed medical  examinations and tests are permitted to work under subsection (1) (j); and  (n) keep, maintain, and make available to workers in the workplace, in a location that is readily accessible, a medicine chest with contents as prescribed, and shall ensure that first aid, including trained personnel, is available at the workplace.  (2) For the purposes of subsection (1) (a), a group of employers, with the approval of the Authority, may act as an employer.  (3) If a worker participates in a prescribed medical surveillance programme or undergoes prescribed medical examinations or tests, his or her employer shall pay  (a) the workers costs for medical examinations or tests required by the medical surveillance programme or required by regulation;  (b) the workers reasonable travel costs respecting the examinations or tests; and  (c) the time the worker spends to undergo the examinations or tests, including travel time, which shall be deemed to be work time for which the worker shall be paid at his premium rate as may be proper.  LAWS OF GUYANA 74 Cap. 99:06 Occupational Safety and Health  L.R.O. 1/2012                                                                (4) In addition to providing information and instruction to a worker as required by section 46(2) (a), an employer shall provide  (a) to every worker, training on the safe and healthy manner of carrying out his work; and  (b) subject to subsection (6), to every committee member who represents workers, if any, or a safety and health representative, if any, training on this Act and the regulations that apply to the work.  (5) In relation to the training that a worker, a committee member who represents workers, if any, or a safety and health representative, if any, receives under subsection (4), his employer shall pay for the workers committee members or representatives (a) costs for the training;  (b) reasonable travel to the location where the training is provided; and  (c) time spent to undergo the training which shall be deemed to be work time which the worker, committee member or representative shall be paid at his or her premium rate as may be proper.  (6) If a trade union exists at the workplace, the employer shall involve the trade union in the provision of the training required by subsection (4)(b).    LAWS OF GUYANA Occupational Safety and Health Cap. 99:06 75  L.R.O. 1/2012 Duties of Supervisors.                                       Duties of workers.",
            "description": [
                {
                    "representation": "(1)",
                    "description": "(a), a group of employers, with the approval of the Authority, may act as an employer."
                },
                {
                    "representation": "(a)",
                    "description": "costs for the training;"
                },
                {
                    "representation": "(b)",
                    "description": "reasonable travel to the location where the training is provided; and"
                },
                {
                    "representation": "(c)",
                    "description": "time spent to undergo the training which shall be deemed to be work time which the worker, committee member or representative shall be paid at his or her premium rate as may be proper."
                },
                {
                    "representation": "(d)",
                    "description": "accurately keep and maintain and make available to the worker affected such records of the exposure of a worker to chemicals, physical agents or biological agents as may be prescribed;"
                },
                {
                    "representation": "(e)",
                    "description": "notify the Authority of the use or introduction into a workplace of such chemicals, physical agents or biological agents as may be prescribed;"
                },
                {
                    "representation": "(f)",
                    "description": "monitor at such time or times or at such interval or intervals the levels of chemicals, physical agents or biological agents in a workplace and keep and post accurate records thereof as prescribed;"
                },
                {
                    "representation": "(g)",
                    "description": "comply with any standard limiting the exposure of a worker to chemicals, LAWS OF GUYANA 72 Cap. 99:06 Occupational Safety and Health  L.R.O. 1/2012                                                 physical agents or biological agents as prescribed;"
                },
                {
                    "representation": "(h)",
                    "description": "establish a medical surveillance program for the benefit of workers as prescribed;"
                },
                {
                    "representation": "(i)",
                    "description": "provide for safety-related medical examinations and tests for workers as prescribed;"
                },
                {
                    "representation": "(j)",
                    "description": "where so prescribed, only permit a worker to work or be in a workplace who has undergone such medical examinations, tests or X-rays as prescribed and who is found to be physically fit to do the work in the workplace;"
                },
                {
                    "representation": "(k)",
                    "description": "where so prescribed, provide a worker with written instructions as to the measures and procedures to be taken for the protection of the worker;"
                },
                {
                    "representation": "(l)",
                    "description": "carry out such training programmes for workers, supervisors and committee members as may be prescribed;"
                },
                {
                    "representation": "(m)",
                    "description": "adopt provisions to protect the privacy of workers and ensure that health surveillance is not used for discriminatory purposes or in any manner prejudicial to their interests, where a prescribed occupational health service is established under subsection"
                },
                {
                    "representation": "(n)",
                    "description": "keep, maintain, and make available to workers in the workplace, in a location that is readily accessible, a medicine chest with contents as prescribed, and shall ensure that first aid, including trained personnel, is available at the workplace."
                },
                {
                    "representation": "(2)",
                    "description": "For the purposes of subsection"
                },
                {
                    "representation": "(3)",
                    "description": "If a worker participates in a prescribed medical surveillance programme or undergoes prescribed medical examinations or tests, his or her employer shall pay"
                },
                {
                    "representation": "(4)",
                    "description": "In addition to providing information and instruction to a worker as required by section 46(2)"
                },
                {
                    "representation": "(5)",
                    "description": "In relation to the training that a worker, a committee member who represents workers, if any, or a safety and health representative, if any, receives under subsection"
                },
                {
                    "representation": "(6)",
                    "description": "If a trade union exists at the workplace, the employer shall involve the trade union in the provision of the training required by subsection"
                }
            ]
        }
    },
    {
        "act": "OCCUPATIONAL SAFETY AND HEALTH ACT",
        "source": "https://mola.gov.gy/laws-of-guyana",
        "type": {
            "name": "section",
            "representation": "48",
            "title": "Duties of supervisors. ",
            "context": "OCCUPATIONAL SAFETY AND HEALTH ACT under Duties of supervisors. 48. (1) A supervisor shall ensure that a worker  (a) works in the manner and with the protective devices and clothing, measures and procedures required by this Act and the regulations; and  (b) uses or wears the equipment, protective devices and clothing that the workers employer requires to be used or worn.  (2) Without limiting the duty imposed by subsection (1), a supervisor shall  (a) advise a worker of the existence of any potential or actual danger to the safety or health of the worker of which the supervisor is aware;  (b) where so prescribed, provide a worker with written instructions as to the measures and procedures to be taken for protection of the worker; and  (c) take every precaution reasonable in the circumstances for the protection of a worker.",
            "description": [
                {
                    "representation": "(1)",
                    "description": "A supervisor shall ensure that a worker"
                },
                {
                    "representation": "(a)",
                    "description": "advise a worker of the existence of any potential or actual danger to the safety or health of the worker of which the supervisor is aware;"
                },
                {
                    "representation": "(b)",
                    "description": "where so prescribed, provide a worker with written instructions as to the measures and procedures to be taken for protection of the worker; and"
                },
                {
                    "representation": "(2)",
                    "description": "Without limiting the duty imposed by subsection"
                },
                {
                    "representation": "(c)",
                    "description": "take every precaution reasonable in the circumstances for the protection of a worker."
                }
            ]
        }
    },
    {
        "act": "OCCUPATIONAL SAFETY AND HEALTH ACT",
        "source": "https://mola.gov.gy/laws-of-guyana",
        "type": {
            "name": "section",
            "representation": "49",
            "title": "Duties of workers. ",
            "context": "OCCUPATIONAL SAFETY AND HEALTH ACT under Duties of workers. 49. (1) A worker shall  (a) work in compliance with the provisions of this Act and the regulations;  (b) use or wear the equipment, protective devices and clothing that the workers LAWS OF GUYANA 76 Cap. 99:06 Occupational Safety and Health  L.R.O. 1/2012                                                 employer requires to be used or worn;  (c) report to his or her employer or supervisor the absence of or defect in any equipment or, protective device and clothing of which the worker is aware and which may endanger himself, or another worker;  (d) report to his or employer or supervisor any contravention of this Act or the regulations or the existence of any hazard of which he or she knows; and  (e) take care of the personal protective  equipment, devices and clothing the workers employer provides.  (2) No worker shall  (a) remove or make ineffective any protective device required by his or her employer, without providing an adequate temporary protective device and when the need for removing or making ineffective the protective device has ceased, the protective device shall be replaced immediately;   (b) use or operate any equipment, machine, device or article or work in a manner that may endanger himself, or any other worker; or  (c) engage in any prank, contest, feat of strength, unnecessary running or rough and boisterous conduct. LAWS OF GUYANA Occupational Safety and Health Cap. 99:06 77  L.R.O. 1/2012                       Duties of occupiers generally.                           Duties of occupier to protect safety and health of public.      (3) A worker is not required to participate in a prescribed medical surveillance programme unless the worker consents to do so.  (4) No worker shall be required to use equipment or machinery without any protective device required by the regulations or by his or her employer being in position.",
            "description": [
                {
                    "representation": "(1)",
                    "description": "A worker shall"
                },
                {
                    "representation": "(a)",
                    "description": "remove or make ineffective any protective device required by his or her employer, without providing an adequate temporary protective device and when the need for removing or making ineffective the protective device has ceased, the protective device shall be replaced immediately;"
                },
                {
                    "representation": "(b)",
                    "description": "use or operate any equipment, machine, device or article or work in a manner that may endanger himself, or any other worker; or"
                },
                {
                    "representation": "(c)",
                    "description": "engage in any prank, contest, feat of strength, unnecessary running or rough and boisterous conduct. LAWS OF GUYANA Occupational Safety and Health Cap. 99:06 77  L.R.O. 1/2012                       Duties of occupiers generally.                           Duties of occupier to protect safety and health of public."
                },
                {
                    "representation": "(d)",
                    "description": "report to his or employer or supervisor any contravention of this Act or the regulations or the existence of any hazard of which he or she knows; and"
                },
                {
                    "representation": "(e)",
                    "description": "take care of the personal protective  equipment, devices and clothing the workers employer provides."
                },
                {
                    "representation": "(2)",
                    "description": "No worker shall"
                },
                {
                    "representation": "(3)",
                    "description": "A worker is not required to participate in a prescribed medical surveillance programme unless the worker consents to do so."
                },
                {
                    "representation": "(4)",
                    "description": "No worker shall be required to use equipment or machinery without any protective device required by the regulations or by his or her employer being in position."
                }
            ]
        }
    },
    {
        "act": "OCCUPATIONAL SAFETY AND HEALTH ACT",
        "source": "https://mola.gov.gy/laws-of-guyana",
        "type": {
            "name": "section",
            "representation": "50",
            "title": "Duties of occupiers generally. ",
            "context": "OCCUPATIONAL SAFETY AND HEALTH ACT under Duties of occupiers generally. 50. (1) Except as otherwise expressly provided, it shall be the duty of every occupier of an industrial establishment to ensure that Part IV and such other provisions of this Act or such regulations as impose duties on him, arc complied with.  (2) An occupier shall, upon the direction of the Authority, prepare, or revise a written statement of his general policy with respect to the safety and health of persons employed in the industrial establishment, specifying the organisation and arrangements for the time being in force for carrying out that policy and the provisions specified in subsection (1), and the occupier shall submit the statement and any revision thereof to the Authority and bring them to the notice of all persons employed in the industrial establishment.  (3) The Authority may, having regard to the statement submitted under subsection (2), direct the occupier to appoint at his own expense, a safety officer who shall be responsible for ensuring that the policy and the provisions specified in subsection (1) are complied with.",
            "description": [
                {
                    "representation": "(1)",
                    "description": "are complied with."
                },
                {
                    "representation": "(2)",
                    "description": "An occupier shall, upon the direction of the Authority, prepare, or revise a written statement of his general policy with respect to the safety and health of persons employed in the industrial establishment, specifying the organisation and arrangements for the time being in force for carrying out that policy and the provisions specified in subsection"
                },
                {
                    "representation": "(3)",
                    "description": "The Authority may, having regard to the statement submitted under subsection"
                }
            ]
        }
    },
    {
        "act": "OCCUPATIONAL SAFETY AND HEALTH ACT",
        "source": "https://mola.gov.gy/laws-of-guyana",
        "type": {
            "name": "section",
            "representation": "51",
            "title": "Duties of occupiers to protect safety and health of public. ",
            "context": "OCCUPATIONAL SAFETY AND HEALTH ACT under Duties of occupiers to protect safety and health of public. 51. (1) The occupier of every industrial establishment shall be under a duty to take steps to protect the safety and health of the public in the vicinity of his industrial establishment from dangers created by the operation or processes carried on therein, and shall take special care to ensure that plant and equipment used therein are of such integrity and that such adequate safety systems exist as to LAWS OF GUYANA 78 Cap. 99:06 Occupational Safety and Health  L.R.O. 1/2012                                          Duties of owners.                prevent the occurrence of hazardous emissions.  (2)Where the Authority is of the view that the steps taken under subsection (1) are inadequate, it may issue directions in writing to the occupier specifying the measure to be taken in an industrial establishment or in its vicinity to prevent injury to the public and the period within which those measures are to be taken.   (3) Directions under subsection (2) may include a requirement   (a) to obtain and implement advice from specialists or expert consultants;  (b) to implement  measures  to abate  nuisances  arising from the operations carried on in industrial establishments; or  (c) to implement measures to prevent the occurrence of hazardous emissions. (4) An occupier who fails to comply with directions issued under subsection (2) commits an offence.",
            "description": [
                {
                    "representation": "(1)",
                    "description": "are inadequate, it may issue directions in writing to the occupier specifying the measure to be taken in an industrial establishment or in its vicinity to prevent injury to the public and the period within which those measures are to be taken."
                },
                {
                    "representation": "(3)",
                    "description": "Directions under subsection"
                },
                {
                    "representation": "(2)",
                    "description": "commits an offence."
                },
                {
                    "representation": "(a)",
                    "description": "to obtain and implement advice from specialists or expert consultants;"
                },
                {
                    "representation": "(b)",
                    "description": "to implement  measures  to abate  nuisances  arising from the operations carried on in industrial establishments; or"
                },
                {
                    "representation": "(c)",
                    "description": "to implement measures to prevent the occurrence of hazardous emissions."
                },
                {
                    "representation": "(4)",
                    "description": "An occupier who fails to comply with directions issued under subsection"
                }
            ]
        }
    },
    {
        "act": "OCCUPATIONAL SAFETY AND HEALTH ACT",
        "source": "https://mola.gov.gy/laws-of-guyana",
        "type": {
            "name": "section",
            "representation": "52",
            "title": "Duties of owners. ",
            "context": "OCCUPATIONAL SAFETY AND HEALTH ACT under Duties of owners. 52.",
            "description": "52."
        }
    },
    {
        "act": "OCCUPATIONAL SAFETY AND HEALTH ACT",
        "source": "https://mola.gov.gy/laws-of-guyana",
        "type": {
            "name": "section",
            "representation": "53",
            "title": "Duties of owners of construction sites. ",
            "context": "OCCUPATIONAL SAFETY AND HEALTH ACT under Duties of owners of construction sites. 53. (1) Before beginning construction work, the owner shall determine whether any critical substances are present at the construction site and shall prepare a list of all critical substances that are present at the site.  (2) If any work on a construction site is tendered, the person issuing the tenders shall include, as part of the tendering information, a copy of the list referred to in subsection (l).  (3) An owner shall ensure that a prospective employer at a construction site on the owners property has received a copy of the list referred to in subsection (1) before entering into a binding contract with the employer.  (4) The employer at a construction site shall ensure that each prospective contractor and subcontractor for the construction work has received a copy of the referred to in subsection (1) before the prospective contractor or subcontractor enters into a binding contract for the supply of work on the construction site.  (5) An owner who fails to comply with this section is liable to employer at a construction site and every contractor and subcontractor who suffers any loss or damages as the result of the subsequent discovery on the construction site of a critical substance that the owner ought reasonably to have known of but that was not on the list prepared under subsection (1).  (6) An employer at a construction site who fails to comply with this section is liable to every contractor and LAWS OF GUYANA Occupational Safety and Health Cap. 99:06 81  L.R.O. 1/2012         Duties of supplier.                              Duties of directors and officers of a body corporate.               subcontractor who suffers any loss or damages as the result of the subsequent discovery on the construction site of a critical substance that was not on the list prepared under subsection (1).",
            "description": [
                {
                    "representation": "(1)",
                    "description": "before the prospective contractor or subcontractor enters into a binding contract for the supply of work on the construction site."
                },
                {
                    "representation": "(2)",
                    "description": "If any work on a construction site is tendered, the person issuing the tenders shall include, as part of the tendering information, a copy of the list referred to in subsection"
                },
                {
                    "representation": "(3)",
                    "description": "An owner shall ensure that a prospective employer at a construction site on the owners property has received a copy of the list referred to in subsection"
                },
                {
                    "representation": "(4)",
                    "description": "The employer at a construction site shall ensure that each prospective contractor and subcontractor for the construction work has received a copy of the referred to in subsection"
                },
                {
                    "representation": "(5)",
                    "description": "An owner who fails to comply with this section is liable to employer at a construction site and every contractor and subcontractor who suffers any loss or damages as the result of the subsequent discovery on the construction site of a critical substance that the owner ought reasonably to have known of but that was not on the list prepared under subsection"
                },
                {
                    "representation": "(6)",
                    "description": "An employer at a construction site who fails to comply with this section is liable to every contractor and LAWS OF GUYANA Occupational Safety and Health Cap. 99:06 81  L.R.O. 1/2012         Duties of supplier.                              Duties of directors and officers of a body corporate.               subcontractor who suffers any loss or damages as the result of the subsequent discovery on the construction site of a critical substance that was not on the list prepared under subsection"
                }
            ]
        }
    },
    {
        "act": "OCCUPATIONAL SAFETY AND HEALTH ACT",
        "source": "https://mola.gov.gy/laws-of-guyana",
        "type": {
            "name": "section",
            "representation": "54",
            "title": "Duties of suppliers. ",
            "context": "OCCUPATIONAL SAFETY AND HEALTH ACT under Duties of suppliers. 54. (1) Every person who supplies any machine, device, tool or equipment under any rental, leasing or similar arrangement for use in or about a workplace shall ensure  (a) that the machine, device, tool or equipment is in good condition;  (b) that the machine, device, tool or equipment complies with this Act and the regulations; and  (c) if it is the persons responsibility under the rental, leasing or similar arrangement to do so, that the machine, device, tool or equipment is maintained in good condition.  (2) An architect and an engineer contravenes this Act if, as a result of his certification required under this Act or any other Act that is made negligently or incompetently, a worker is endangered.",
            "description": [
                {
                    "representation": "(1)",
                    "description": "Every person who supplies any machine, device, tool or equipment under any rental, leasing or similar arrangement for use in or about a workplace shall ensure"
                },
                {
                    "representation": "(a)",
                    "description": "that the machine, device, tool or equipment is in good condition;"
                },
                {
                    "representation": "(b)",
                    "description": "that the machine, device, tool or equipment complies with this Act and the regulations; and"
                },
                {
                    "representation": "(c)",
                    "description": "if it is the persons responsibility under the rental, leasing or similar arrangement to do so, that the machine, device, tool or equipment is maintained in good condition."
                },
                {
                    "representation": "(2)",
                    "description": "An architect and an engineer contravenes this Act if, as a result of his certification required under this Act or any other Act that is made negligently or incompetently, a worker is endangered."
                }
            ]
        }
    },
    {
        "act": "OCCUPATIONAL SAFETY AND HEALTH ACT",
        "source": "https://mola.gov.gy/laws-of-guyana",
        "type": {
            "name": "section",
            "representation": "55",
            "title": "Duties of directors and officers of a body corporate. ",
            "context": "OCCUPATIONAL SAFETY AND HEALTH ACT under Duties of directors and officers of a body corporate. 55. Every director, manager, secretary or other officer of a body corporate shall take all reasonable care to ensure that the body corporate complies with  (a) this Act and the regulations;  (b) orders and requirements of an inspector, a medical inspector, a technical examiner the Commissioner and the Authority; and  LAWS OF GUYANA 82 Cap. 99:06 Occupational Safety and Health  L.R.O. 1/2012             Refusal to work.                                             (c) orders of the Minister.",
            "description": [
                {
                    "representation": "(a)",
                    "description": "this Act and the regulations;"
                },
                {
                    "representation": "(b)",
                    "description": "orders and requirements of an inspector, a medical inspector, a technical examiner the Commissioner and the Authority; and  LAWS OF GUYANA 82 Cap. 99:06 Occupational Safety and Health  L.R.O. 1/2012             Refusal to work."
                },
                {
                    "representation": "(c)",
                    "description": "orders of the Minister."
                }
            ]
        }
    },
    {
        "act": "OCCUPATIONAL SAFETY AND HEALTH ACT",
        "source": "https://mola.gov.gy/laws-of-guyana",
        "type": {
            "name": "section",
            "representation": "56",
            "title": "Refusal to work. ",
            "context": "OCCUPATIONAL SAFETY AND HEALTH ACT under Refusal to work. 56. (1) A worker may refuse to work or do particular work where he has reasonable justification to believe that   (a) any equipment, machine, device or article the worker is to use or operate presents an imminent and serious danger to the life or health of himself, or another worker; or  (b) the physical condition of the workplace or the part thereof in which he works or is to work presents an imminent and serious danger to his life or health.  (2) The provisions in this section shall not apply to a worker (a) who belongs to any of the categories of  persons specified for such purpose in an order of the Minister; and  (b) when that workers refusal to work would directly endanger the life, safety or health of another person.  (3) The categories of persons to which subsection (2)(a) refers may be  (a) a person employed in, or a member of the police force or the fire service;  (b) a person employed in the operation of a correctional institution or facility;  (c) a person employed in the operation of  LAWS OF GUYANA Occupational Safety and Health Cap. 99:06 83  L.R.O. 1/2012                          c. 54:01                        (i) a hospital, sanatorium, nursing home, home for the aged, psychiatric institution, mental health or mental retardation centre or a rehabilitation facility; (ii) an ambulance service or a first aid clinic or station;  (iii) a laundry, food service, power plant or technical service or facility used in conjunction with an institution, facility or service described in paragraph (c) (i) and (ii);  (d) a person who is employed in any of the services mentioned in the Schedule to the Public Utility Undertakings and Public Health Services Arbitration Act, but who is not specified in subsection (3)(a) to (c) inclusive.  (4) Upon refusing to work or do particular work, the worker shall forthwith report the circumstances of the refusal to the workers employer or supervisor who shall forthwith investigate the report in the presence of the worker and, if there is such, in the presence of one of  (a) a committee member who represents workers, if any;   (b) a safety and health representative, if any; or  (c) a worker who because of knowledge, experience and training is selected by a trade union that represents the LAWS OF GUYANA 84 Cap. 99:06 Occupational Safety and Health  L.R.O. 1/2012                                                 worker, or if there is no trade union, is selected by the workers to represent them,  who shall be made available and who shall attend without delay.  (5) Until the investigation is completed, the worker shall remain in a safe place near his or her work station.  (6) The worker who refuses to work under subsection (1) shall be deemed to be at work and the workers employer shall pay him at the regular or premium rate, as may be proper, for the time extending from the time when the worker started to refuse to work under subsection (1) to the time when the investigation mentioned in subsection (5) is completed.  (7) Where, following the investigation or any remedial action taken by the employer or supervisor to deal with the circumstances that caused the worker to refuse to work or do particular work, the worker has reasonable justification to believe that  (a) the equipment, machine, device or article that was the cause of the refusal to work or do particular work continues to present an imminent and serious danger to the life or health of himself or another worker; or  (b) the physical condition of the workplace or the part thereof in which he worked continues to present an imminent and serious danger to the life or health of himself,  the worker may refuse to work or do the particular work and LAWS OF GUYANA Occupational Safety and Health Cap. 99:06 85  L.R.O. 1/2012                                                 the employer or the worker or a person on behalf of the employer or worker shall cause an inspector to be notified thereof.  (8) An inspector shall investigate the refusal to work in the presence of the employer or a person representing the employer, the worker, and the person mentioned in subsection (4) (a), (b) or (c); if any  (9) The inspector shall, following the investigation referred to subsection (8), decide whether the machine, device, article or the workplace or part thereof presents an imminent and serious danger to the life or health of the worker or another person.  (10) The inspector shall within two working days of notification to him under subsection (7), give his decision, in writing, to the employer, the worker, and the person mentioned in subsection (4) (a), (b) or (c), if any.  (11) Pending the investigation and decision of the inspector, employer, subject to the provisions of a collective agreement, if any shall  (a) assign the worker reasonable alternative work during such hours; or  (b) subject to section 58, where an assignment of reasonable alternative work is not practicable, give other directions to the worker.  (12) Pending the investigation and decision of the inspector, no worker shall be assigned to use or operate the equipment, machine, device  or article or to work in the workplace or in the part of the workplace being investigated as long as there is continuing imminent and serious danger to LAWS OF GUYANA 86 Cap. 99:06 Occupational Safety and Health  L.R.O. 1/2012                                     Complaint regarding refusal to work.                   the life or health of any worker or person and until after the  employer or supervisor has taken remedial action, if necessary, to deal with the circumstances that caused the worker to refuse to do particular work.  (13) The worker who refuses to work under subsection (7) shall be deemed to be at work and the workers employer shall pay him at the regular or premium rate, as may be proper, for the time extending from the time when the worker started to refuse to work under subsection (7) to the time when the inspector has given a decision under subsection (9) provided that the inspector decides that the machine, device, article or workplace or part thereof presents in imminent and serious danger to the life or health of the worker or another person.  (14) A person mentioned in subsection (4) (a), (b) or (c), shall be deemed to be at work and the persons employer shall pay him at the regular or premium rate, as may be proper for the time spent by the person carrying out the duties under subsections (4) and (8).",
            "description": [
                {
                    "representation": "(1)",
                    "description": "to the time when the investigation mentioned in subsection"
                },
                {
                    "representation": "(a)",
                    "description": "assign the worker reasonable alternative work during such hours; or"
                },
                {
                    "representation": "(b)",
                    "description": "or"
                },
                {
                    "representation": "(2)",
                    "description": "The provisions in this section shall not apply to a worker"
                },
                {
                    "representation": "(3)",
                    "description": "The categories of persons to which subsection"
                },
                {
                    "representation": "(c)",
                    "description": "a worker who because of knowledge, experience and training is selected by a trade union that represents the LAWS OF GUYANA 84 Cap. 99:06 Occupational Safety and Health  L.R.O. 1/2012                                                 worker, or if there is no trade union, is selected by the workers to represent them,  who shall be made available and who shall attend without delay."
                },
                {
                    "representation": "(i)",
                    "description": "a hospital, sanatorium, nursing home, home for the aged, psychiatric institution, mental health or mental retardation centre or a rehabilitation facility;"
                },
                {
                    "representation": "(d)",
                    "description": "a person who is employed in any of the services mentioned in the Schedule to the Public Utility Undertakings and Public Health Services Arbitration Act, but who is not specified in subsection"
                },
                {
                    "representation": "(4)",
                    "description": "and"
                },
                {
                    "representation": "(5)",
                    "description": "is completed."
                },
                {
                    "representation": "(6)",
                    "description": "The worker who refuses to work under subsection"
                },
                {
                    "representation": "(7)",
                    "description": "to the time when the inspector has given a decision under subsection"
                },
                {
                    "representation": "(8)",
                    "description": "An inspector shall investigate the refusal to work in the presence of the employer or a person representing the employer, the worker, and the person mentioned in subsection"
                },
                {
                    "representation": "(9)",
                    "description": "provided that the inspector decides that the machine, device, article or workplace or part thereof presents in imminent and serious danger to the life or health of the worker or another person."
                }
            ]
        }
    },
    {
        "act": "OCCUPATIONAL SAFETY AND HEALTH ACT",
        "source": "https://mola.gov.gy/laws-of-guyana",
        "type": {
            "name": "section",
            "representation": "57",
            "title": "Complaint regarding refusal to work. ",
            "context": "OCCUPATIONAL SAFETY AND HEALTH ACT under Complaint regarding refusal to work. 57. (1) An employer, a worker at the workplace or a representative of a trade  union  that  represents  workers  at  the  workplace may  file  a complaint with the Authority if he has reasonable grounds to believe that the worker,  trade  union or employer  at the workplace acted recklessly or in a bad faith with respect to the refusal to work under section",
            "description": [
                {
                    "representation": "(1)",
                    "description": "An employer, a worker at the workplace or a representative of a trade  union  that  represents  workers  at  the  workplace may  file  a complaint with the Authority if he has reasonable grounds to believe that the worker,  trade  union or employer  at the workplace acted recklessly or in a bad faith with respect to the refusal to work under section"
                }
            ]
        }
    },
    {
        "act": "OCCUPATIONAL SAFETY AND HEALTH ACT",
        "source": "https://mola.gov.gy/laws-of-guyana",
        "type": {
            "name": "section",
            "representation": "58",
            "title": "No discipline, dismissal, etc., by employer.  PART VI HAZARDOUS CHEMICALS, PHYSICAL AGENTS AND BIOLOGICAL AGENTS  ",
            "context": "OCCUPATIONAL SAFETY AND HEALTH ACT under No discipline, dismissal, etc., by employer.  PART VI HAZARDOUS CHEMICALS, PHYSICAL AGENTS AND BIOLOGICAL AGENTS  58. (1) No employer  or person acting on behalf of an employer shall  (a) dismiss or threaten to dismiss a worker;  (b) discipline or suspend or threaten to discipline or suspend a worker;  (c) impose any penalty upon a worker; or  (d) intimidate or coerce a worker,  because the worker has acted in compliance with this Act or the regulations or an order made thereunder, or has sought the enforcement of this Act or  the  regulations  or  has  observed  the procedures established by the employer or has given evidence in a proceeding in respect of the enforcement of this Act or the regulations or in an inquest under section",
            "description": [
                {
                    "representation": "(1)",
                    "description": "No employer  or person acting on behalf of an employer shall"
                },
                {
                    "representation": "(a)",
                    "description": "dismiss or threaten to dismiss a worker;"
                },
                {
                    "representation": "(b)",
                    "description": "discipline or suspend or threaten to discipline or suspend a worker;"
                },
                {
                    "representation": "(c)",
                    "description": "impose any penalty upon a worker; or"
                },
                {
                    "representation": "(d)",
                    "description": "intimidate or coerce a worker,  because the worker has acted in compliance with this Act or the regulations or an order made thereunder, or has sought the enforcement of this Act or  the  regulations  or  has  observed  the procedures established by the employer or has given evidence in a proceeding in respect of the enforcement of this Act or the regulations or in an inquest under section"
                }
            ]
        }
    },
    {
        "act": "OCCUPATIONAL SAFETY AND HEALTH ACT",
        "source": "https://mola.gov.gy/laws-of-guyana",
        "type": {
            "name": "section",
            "representation": "59",
            "title": "Orders of Authority. ",
            "context": "OCCUPATIONAL SAFETY AND HEALTH ACT under Orders of Authority. 59. (1) Where a chemical, physical agent or biological agent or a combination of such chemical and agents is used or intended to be used in the workplace and its presence in the workplace or the manner of its use is in the opinion of the Authority likely to endanger the health of a worker, the Authority shall by notice in writing to the employer order that the use, intended use, presence or manner of use be  (a) prohibited;  (b) limited or restricted in such manner as the Authority specifies; or  (c) subject to such conditions regarding administrative control, work practices, engineering control and time limits for compliance as the Authority specifies.  (2) Where the Authority makes an order to an employer under subsection (1), the order shall  (a) identify the chemical, physical agent or biological agent, or a combination of such a chemical and agents, and the manner of use that is the subject LAWS OF GUYANA Occupational Safety and Health Cap. 99:06 89  L.R.O. 1/2012                                                 matter of the order; and  (b) state the opinion of the Authority as to the likelihood of the danger to the health of a worker, and the Authoritys reasons in respect thereof, including the matters or causes which give rise to the Authoritys opinion.  (3) The employer shall provide a copy of an order made under subsection (1) to the committee, safety and health representative and trade union, if any, and shall cause a copy of the order to be posted in a conspicuous place in the workplace where it is most likely to come to the attention of the workers who may be affected by the use, presence or intended use of the chemical, physical agent or biological agent or a combination of such a chemical and agent.  (4) Where the employer, a worker or a trade union considers that he or it is aggrieved by an order made under subsection (1), the employer, worker or trade union may by notice in writing given within seven days of the making of the order, appeal to the Minister.  (5) On an appeal under subsection (4), the Minister or, the Commissioner who has been directed under subsection (6) to determine the appeal, may suspend the operation of the order appealed from pending the disposition of the appeal.  (6) The Minister may, having regard to the circumstances determine the appeal within thirty days of notice of such appeal or direct that the appeal be determined on his behalf by the Commissioner within the said period.  (7) The Minister or, where the Commissioner has been directed under subsection (6), the Commissioner so directed, may notwithstanding section 21(2) give such LAWS OF GUYANA 90 Cap. 99:06 Occupational Safety and Health  L.R.O. 1/2012                                                 directions and issue such orders as he considers proper or necessary concerning the procedures to be adopted or followed.  (8) On an appeal, the Minister or, where the Commissioner has been directed under subsection (6), the Commissioner so directed, may substitute his findings for those of the Authority and may rescind or affirm the order appealed from or make a new order in substitution therefor and such order shall stand in the place of and have the like effect under this Act and the regulations as the order of the Authority, and such order shall be final and not subject to appeal under this section.  (9) In making a decision or order under subsection (1) or (8), the Authority, the Minister or, where the Commissioner has been directed under subsection (6), the Commissioner so directed shall consider as relevant factors  (a) the relation of the chemical or agent, combination of chemicals and agents  or by-product  to a chemical or a biological agent that is known to be a danger to health;  (b) the quantities of the chemical or agent, combination of chemicals and agents or by-product used or intended to be used or present;  (c) the extent of exposure;  (d) the availability of other processes, chemicals and agents or equipment for use or intended use;  (e) data regarding the effect of the process or chemicals or agent on LAWS OF GUYANA Occupational Safety and Health Cap. 99:06 91  L.R.O. 1/2012                          New chemicals or biological agents.                          health; and  (f) any criteria or guide with respect to the exposure of a worker to a chemical, physical agent or biological agent or a combination of such a chemical and agents that are adopted by a regulation.  (10) This section does not apply to critical substances.  (11) The Authority is not required to hold or afford to an employer or any other person an opportunity for a hearing before making an order under subsection (1).",
            "description": [
                {
                    "representation": "(1)",
                    "description": "or"
                },
                {
                    "representation": "(a)",
                    "description": "the relation of the chemical or agent, combination of chemicals and agents  or by-product  to a chemical or a biological agent that is known to be a danger to health;"
                },
                {
                    "representation": "(b)",
                    "description": "the quantities of the chemical or agent, combination of chemicals and agents or by-product used or intended to be used or present;"
                },
                {
                    "representation": "(c)",
                    "description": "the extent of exposure;"
                },
                {
                    "representation": "(2)",
                    "description": "give such LAWS OF GUYANA 90 Cap. 99:06 Occupational Safety and Health  L.R.O. 1/2012                                                 directions and issue such orders as he considers proper or necessary concerning the procedures to be adopted or followed."
                },
                {
                    "representation": "(3)",
                    "description": "The employer shall provide a copy of an order made under subsection"
                },
                {
                    "representation": "(4)",
                    "description": "Where the employer, a worker or a trade union considers that he or it is aggrieved by an order made under subsection"
                },
                {
                    "representation": "(5)",
                    "description": "On an appeal under subsection"
                },
                {
                    "representation": "(6)",
                    "description": "The Minister may, having regard to the circumstances determine the appeal within thirty days of notice of such appeal or direct that the appeal be determined on his behalf by the Commissioner within the said period."
                },
                {
                    "representation": "(7)",
                    "description": "The Minister or, where the Commissioner has been directed under subsection"
                },
                {
                    "representation": "(8)",
                    "description": "On an appeal, the Minister or, where the Commissioner has been directed under subsection"
                },
                {
                    "representation": "(9)",
                    "description": "In making a decision or order under subsection"
                },
                {
                    "representation": "(d)",
                    "description": "the availability of other processes, chemicals and agents or equipment for use or intended use;"
                },
                {
                    "representation": "(e)",
                    "description": "data regarding the effect of the process or chemicals or agent on LAWS OF GUYANA Occupational Safety and Health Cap. 99:06 91  L.R.O. 1/2012                          New chemicals or biological agents.                          health; and"
                },
                {
                    "representation": "(f)",
                    "description": "any criteria or guide with respect to the exposure of a worker to a chemical, physical agent or biological agent or a combination of such a chemical and agents that are adopted by a regulation."
                }
            ]
        }
    },
    {
        "act": "OCCUPATIONAL SAFETY AND HEALTH ACT",
        "source": "https://mola.gov.gy/laws-of-guyana",
        "type": {
            "name": "section",
            "representation": "60",
            "title": "New chemicals or biological agents. ",
            "context": "OCCUPATIONAL SAFETY AND HEALTH ACT under New chemicals or biological agents. 60. (1) Except for purposes of research and development, no person shall   (a) manufacture;   (b) distribute; or  (c) supply,  for commercial or industrial use in a workplace any new chemical or new biological agent unless the person first submits to the Authority notice in writing; of the persons intention to manufacture, distribute or supply such a new chemical or agent and the notice shall include the ingredients of such a new chemical or agent and their common or generic name or names and the composition and properties thereof . (2) Where in the opinion of the Authority, which opinion shall be  made promptly, the introduction of the new chemical or new biological agent referred to in subsection (1) may endanger the safety or health of the workers in a workplace, the Authority shall require the manufacture, LAWS OF GUYANA 92 Cap. 99:06 Occupational Safety and Health  L.R.O. 1/2012                                  Hazardous materials inventory.                          distributor or supplier, as the case may be, to provide, at the expense of the manufacturer, distributor or supplier, a report or assessment, made or to be made by a person possessing such special, expert or professional knowledge or qualifications as are specified by the  Authority, of the new chemical or agent intended to  be manufactured, distributed or supplied and the manner of use including the matters referred to in section 13 (1)(r)(i) to (vii).  (3) For the purpose of this section, a chemical or biological agent is not considered to be new if, before a person manufactures, distributes or supplies the chemical or agent in Guyana, it was used in a workplace other than the persons workplaces in Guyana or it is included in an inventory compiled or adopted by the Authority.",
            "description": [
                {
                    "representation": "(1)",
                    "description": "may endanger the safety or health of the workers in a workplace, the Authority shall require the manufacture, LAWS OF GUYANA 92 Cap. 99:06 Occupational Safety and Health  L.R.O. 1/2012                                  Hazardous materials inventory.                          distributor or supplier, as the case may be, to provide, at the expense of the manufacturer, distributor or supplier, a report or assessment, made or to be made by a person possessing such special, expert or professional knowledge or qualifications as are specified by the  Authority, of the new chemical or agent intended to  be manufactured, distributed or supplied and the manner of use including the matters referred to in section 13"
                },
                {
                    "representation": "(a)",
                    "description": "manufacture;"
                },
                {
                    "representation": "(b)",
                    "description": "distribute; or"
                },
                {
                    "representation": "(c)",
                    "description": "supply,  for commercial or industrial use in a workplace any new chemical or new biological agent unless the person first submits to the Authority notice in writing; of the persons intention to manufacture, distribute or supply such a new chemical or agent and the notice shall include the ingredients of such a new chemical or agent and their common or generic name or names and the composition and properties thereof ."
                },
                {
                    "representation": "(2)",
                    "description": "Where in the opinion of the Authority, which opinion shall be  made promptly, the introduction of the new chemical or new biological agent referred to in subsection"
                },
                {
                    "representation": "(i)",
                    "description": "to"
                },
                {
                    "representation": "(3)",
                    "description": "For the purpose of this section, a chemical or biological agent is not considered to be new if, before a person manufactures, distributes or supplies the chemical or agent in Guyana, it was used in a workplace other than the persons workplaces in Guyana or it is included in an inventory compiled or adopted by the Authority."
                }
            ]
        }
    },
    {
        "act": "OCCUPATIONAL SAFETY AND HEALTH ACT",
        "source": "https://mola.gov.gy/laws-of-guyana",
        "type": {
            "name": "section",
            "representation": "61",
            "title": "Hazardous materials inventory. ",
            "context": "OCCUPATIONAL SAFETY AND HEALTH ACT under Hazardous materials inventory. 61. (1) An employer shall make or cause to be made and shall maintain an inventory of hazardous chemicals and all hazardous physical agents that are present in the workplace.  (2) The inventory required by subsection (1)  (a) shall contain such information as may be prescribed, and in addition shall include  (i) toxic properties, including both acute and chronic health effects in all parts of the body; (ii) chemical or physical characteristics, including flammable, explosive, oxidizing and dangerously reactive properties; (iii) corrosive and irritant properties; (iv) allergenic and sensitizing LAWS OF GUYANA Occupational Safety and Health Cap. 99:06 93  L.R.O. 1/2012                                                 effects;  (v) carcinogenic effects; (vi) teratogenic and mutagenic  effects;  (vii) effects on the reproductive system;  (b) shall be prepared in consultation with the committee or safety and health representative, if any, for the workplace or with a worker selected by the workers to represent them, if there is no committee or safety and health representative.  (3) Where an inventory required by subsection (1) is amended during a year, the employer, not later than the 1st day of February in the following year, shall prepare a revised version of the inventory incorporating all changes made during the preceding year.  (4) Where, under this Act or the regulations, an employer is required to identify or obtain the identity of the ingredients of a hazardous chemical, the employer shall not be in contravention of this Act or the regulations if the employer has made every effort reasonable in the circumstances to identify or obtain the identity of the ingredients, but has been unable to do so due to circumstance beyond his control.  (5) An employer shall advise the Authority in writing if, after making reasonable efforts, the employer is unable to identify or obtain the identity of the ingredients of a hazardous chemical as required by this Act or the regulations.  (6) Except as may be prescribed, subsection (1) does not apply to an employer who undertakes to perform work or supply services on a construction site in respect of LAWS OF GUYANA 94 Cap. 99:06 Occupational Safety and Health  L.R.O. 1/2012                           Hazardous chemical identification and data sheets.                                 chemicals to be used on the site.  (7) The employer shall keep readily accessible at the workplace a floor plan, as prescribed, showing the names of all hazardous chemicals and their locations, and shall post a notice stating where the floor plan is kept in a place or places where it is most likely to come to the attention of workers.",
            "description": [
                {
                    "representation": "(1)",
                    "description": "does not apply to an employer who undertakes to perform work or supply services on a construction site in respect of LAWS OF GUYANA 94 Cap. 99:06 Occupational Safety and Health  L.R.O. 1/2012                           Hazardous chemical identification and data sheets.                                 chemicals to be used on the site."
                },
                {
                    "representation": "(2)",
                    "description": "The inventory required by subsection"
                },
                {
                    "representation": "(a)",
                    "description": "shall contain such information as may be prescribed, and in addition shall include"
                },
                {
                    "representation": "(i)",
                    "description": "toxic properties, including both acute and chronic health effects in all parts of the body;"
                },
                {
                    "representation": "(v)",
                    "description": "carcinogenic effects;"
                },
                {
                    "representation": "(b)",
                    "description": "shall be prepared in consultation with the committee or safety and health representative, if any, for the workplace or with a worker selected by the workers to represent them, if there is no committee or safety and health representative."
                },
                {
                    "representation": "(3)",
                    "description": "Where an inventory required by subsection"
                },
                {
                    "representation": "(4)",
                    "description": "Where, under this Act or the regulations, an employer is required to identify or obtain the identity of the ingredients of a hazardous chemical, the employer shall not be in contravention of this Act or the regulations if the employer has made every effort reasonable in the circumstances to identify or obtain the identity of the ingredients, but has been unable to do so due to circumstance beyond his control."
                },
                {
                    "representation": "(5)",
                    "description": "An employer shall advise the Authority in writing if, after making reasonable efforts, the employer is unable to identify or obtain the identity of the ingredients of a hazardous chemical as required by this Act or the regulations."
                },
                {
                    "representation": "(6)",
                    "description": "Except as may be prescribed, subsection"
                },
                {
                    "representation": "(7)",
                    "description": "The employer shall keep readily accessible at the workplace a floor plan, as prescribed, showing the names of all hazardous chemicals and their locations, and shall post a notice stating where the floor plan is kept in a place or places where it is most likely to come to the attention of workers."
                }
            ]
        }
    },
    {
        "act": "OCCUPATIONAL SAFETY AND HEALTH ACT",
        "source": "https://mola.gov.gy/laws-of-guyana",
        "type": {
            "name": "section",
            "representation": "62",
            "title": "Hazardous chemical identification and data sheets. ",
            "context": "OCCUPATIONAL SAFETY AND HEALTH ACT under Hazardous chemical identification and data sheets. 62. (1) An employer  (a) shall ensure that all hazardous chemicals present in the workplace are labelled in a way easily understandable to the workers, or are identified in the prescribed manner,  (b) shall obtain or prepare, as may be prescribed, an unexpired chemical safety data sheet for all hazardous chemicals present in the workplace;  (c) shall ensure that the identification required  by paragraph (a) and chemical safety data sheets required by paragraph (b) are available in English and such other languages as may be prescribed;  (d) shall ensure that when hazardous chemicals are transferred into other containers or equipment, the contents are indicated in a manner which will make known to workers their identity, any hazards associated with their use, and any safety precautions to be observed; and  LAWS OF GUYANA Occupational Safety and Health Cap. 99:06 95  L.R.O. 1/2012                                              Inventory and chemical safety data sheets to be made available.        (e) shall ensure that information is provided on the handling and disposal of hazardous chemicals which are no longer required and containers which have been emptied but which may contain residues of hazardous chemicals, so that the  risk to safety and health and to the environment is eliminated or minimised.  (2) No person shall remove or deface the label or identification described in subsection (1) (a) for a hazardous chemical.  (3) An employer shall ensure that a hazardous chemical is not used, handled or stored at a workplace unless the prescribed requirements concerning identification, chemical safety data sheets and worker instruction and training are met.  (4) An employer shall advise the Authority in writing if the employer, after making reasonable efforts, is unable to obtain a label or chemical safety data sheet required by subsection (1).  (5) A chemical safety data sheet expires three years after the date of its publication.",
            "description": [
                {
                    "representation": "(1)",
                    "description": "(a) for a hazardous chemical."
                },
                {
                    "representation": "(a)",
                    "description": "and chemical safety data sheets required by paragraph"
                },
                {
                    "representation": "(b)",
                    "description": "are available in English and such other languages as may be prescribed;"
                },
                {
                    "representation": "(c)",
                    "description": "shall ensure that the identification required  by paragraph"
                },
                {
                    "representation": "(d)",
                    "description": "shall ensure that when hazardous chemicals are transferred into other containers or equipment, the contents are indicated in a manner which will make known to workers their identity, any hazards associated with their use, and any safety precautions to be observed; and  LAWS OF GUYANA Occupational Safety and Health Cap. 99:06 95  L.R.O. 1/2012                                              Inventory and chemical safety data sheets to be made available."
                },
                {
                    "representation": "(e)",
                    "description": "shall ensure that information is provided on the handling and disposal of hazardous chemicals which are no longer required and containers which have been emptied but which may contain residues of hazardous chemicals, so that the  risk to safety and health and to the environment is eliminated or minimised."
                },
                {
                    "representation": "(2)",
                    "description": "No person shall remove or deface the label or identification described in subsection"
                },
                {
                    "representation": "(3)",
                    "description": "An employer shall ensure that a hazardous chemical is not used, handled or stored at a workplace unless the prescribed requirements concerning identification, chemical safety data sheets and worker instruction and training are met."
                },
                {
                    "representation": "(4)",
                    "description": "An employer shall advise the Authority in writing if the employer, after making reasonable efforts, is unable to obtain a label or chemical safety data sheet required by subsection"
                },
                {
                    "representation": "(5)",
                    "description": "A chemical safety data sheet expires three years after the date of its publication."
                }
            ]
        }
    },
    {
        "act": "OCCUPATIONAL SAFETY AND HEALTH ACT",
        "source": "https://mola.gov.gy/laws-of-guyana",
        "type": {
            "name": "section",
            "representation": "63",
            "title": "Inventory and chemical safety data sheets to be available. ",
            "context": "OCCUPATIONAL SAFETY AND HEALTH ACT under Inventory and chemical safety data sheets to be available. 63. (1) A copy of the most recent version of the inventory and of every unexpired chemical safety data sheet required by this Part in respect of hazardous chemicals in a workplace shall be (a) made available by the employer in the workplace in such a manner as to allow examination by the workers;  (b) furnished by the employer to the LAWS OF GUYANA 96 Cap. 99:06 Occupational Safety and Health  L.R.O. 1/2012                                                 committee or safety and health representative, if any, for the workplace or to a worker selected by the workers to represent them if there is no committee or safety and health representative;  (c) furnished by the employer on request, if so prescribed, to the medical inspector of the, district in which the workplace is located;  (d) furnished by the employer on request, if so prescribed, to the fire department which serves the location in which the workplace is located; and  (e) filed by the employer with the Authority on request, if so prescribed.  (2) The Authority, at the request of any person, shall request an employer to furnish a copy of the most recent version of the inventory or of an unexpired chemical safety data sheet, as the case may be.  (3) At the request of any person, the Authority shall make available to the person for inspection a copy of any inventory or chemical safety data sheet requested by the person and in the possession of the Authority.  (4) The Authority shall not disclose the name of any person who makes a request under subsection (2) or (3).  (5) In addition to the requirements imposed under subsection (1), a copy of every chemical safety data sheet required by subsection (1) shall be made available by the employer in the workplace in such a manner that it is readily accessible by all workers who may be exposed to the LAWS OF GUYANA Occupational Safety and Health Cap. 99:06 97  L.R.O. 1/2012                                          \\  Assessment for hazardous chemical.                 hazardous chemical to which it relates.  (6) An employer who makes a chemical safety data sheet readily accessible on a computer terminal at a workplace  (a) shall take all reasonable steps necessary to keep the terminal in working order;  (b) shall give a worker upon request a copy of the chemical safety data sheet; and  (c) shall teach all workers who work with or in proximity to hazardous chemicals, the safety and health representative, if any, at the workplace and the members of the committee how to receive the chemical safety data sheet on the computer terminal.",
            "description": [
                {
                    "representation": "(1)",
                    "description": "shall be made available by the employer in the workplace in such a manner that it is readily accessible by all workers who may be exposed to the LAWS OF GUYANA Occupational Safety and Health Cap. 99:06 97  L.R.O. 1/2012                                          \\  Assessment for hazardous chemical.                 hazardous chemical to which it relates."
                },
                {
                    "representation": "(a)",
                    "description": "shall take all reasonable steps necessary to keep the terminal in working order;"
                },
                {
                    "representation": "(b)",
                    "description": "shall give a worker upon request a copy of the chemical safety data sheet; and"
                },
                {
                    "representation": "(c)",
                    "description": "shall teach all workers who work with or in proximity to hazardous chemicals, the safety and health representative, if any, at the workplace and the members of the committee how to receive the chemical safety data sheet on the computer terminal."
                },
                {
                    "representation": "(d)",
                    "description": "furnished by the employer on request, if so prescribed, to the fire department which serves the location in which the workplace is located; and"
                },
                {
                    "representation": "(e)",
                    "description": "filed by the employer with the Authority on request, if so prescribed."
                },
                {
                    "representation": "(2)",
                    "description": "or"
                },
                {
                    "representation": "(3)",
                    "description": "At the request of any person, the Authority shall make available to the person for inspection a copy of any inventory or chemical safety data sheet requested by the person and in the possession of the Authority."
                },
                {
                    "representation": "(4)",
                    "description": "The Authority shall not disclose the name of any person who makes a request under subsection"
                },
                {
                    "representation": "(5)",
                    "description": "In addition to the requirements imposed under subsection"
                },
                {
                    "representation": "(6)",
                    "description": "An employer who makes a chemical safety data sheet readily accessible on a computer terminal at a workplace"
                }
            ]
        }
    },
    {
        "act": "OCCUPATIONAL SAFETY AND HEALTH ACT",
        "source": "https://mola.gov.gy/laws-of-guyana",
        "type": {
            "name": "section",
            "representation": "64",
            "title": "Assessment for hazardous chemicals. ",
            "context": "OCCUPATIONAL SAFETY AND HEALTH ACT under Assessment for hazardous chemicals. 64. (1) Where so prescribed, an employer shall assess all chemicals and biological agents produced in the workplace for use therein to determine if they are hazardous.  (2) The assessment required by subsection (1) shall be in writing and a copy of it shall be  (a) made available by the employer in the workplace in such a manner as to allow examination by the workers;  (b) furnished by the employer to the committee or safety and health representative, if any, for the workplace or to a worker selected by LAWS OF GUYANA 98 Cap. 99:06 Occupational Safety and Health  L.R.O. 1/2012              Hazardous physical agents.                                         the workers to represent them, if there is no committee or safety and health representative.",
            "description": [
                {
                    "representation": "(1)",
                    "description": "shall be in writing and a copy of it shall be"
                },
                {
                    "representation": "(2)",
                    "description": "The assessment required by subsection"
                },
                {
                    "representation": "(a)",
                    "description": "made available by the employer in the workplace in such a manner as to allow examination by the workers;"
                },
                {
                    "representation": "(b)",
                    "description": "furnished by the employer to the committee or safety and health representative, if any, for the workplace or to a worker selected by LAWS OF GUYANA 98 Cap. 99:06 Occupational Safety and Health  L.R.O. 1/2012              Hazardous physical agents.                                         the workers to represent them, if there is no committee or safety and health representative."
                }
            ]
        }
    },
    {
        "act": "OCCUPATIONAL SAFETY AND HEALTH ACT",
        "source": "https://mola.gov.gy/laws-of-guyana",
        "type": {
            "name": "section",
            "representation": "65",
            "title": "Hazardous physical agents. ",
            "context": "OCCUPATIONAL SAFETY AND HEALTH ACT under Hazardous physical agents. 65. (1) A person who distributes or supplies, directly or indirectly, or manufactures, produces or designs an article for use in a workplace that causes, emits or produces a hazardous physical agent when the article is in use or operation shall ensure that such information as may be prescribed is readily available respecting the hazardous physical agent and the proper use or operation of the article.  (2) Where an employer has an article described in subsection (1) in the workplace, the employer shall ensure that the information referred to in that subsection has been obtained and is  (a) made available in the workplace for workers who use or operate the article or who are likely to be exposed to the hazardous physical agent; and  (b) furnished by the employer to the committee or safety and health representative, if any, for the workplace or a worker selected by the workers to represent them, if there is no committee or safety and health representative.  (3) An employer to whom subsection (2) applies shall post prominent notices identifying and warning of the hazardous physical agent in the part of the workplace in which the article is used or operated or is to be used or operated.  (4) Notices required by subsection (3) shall contain such information as may be prescribed and shall be in English LAWS OF GUYANA Occupational Safety and Health Cap. 99:06 99  L.R.O. 1/2012        Instruction and training.                                    Confidential business information.       and such other language or languages as may be prescribed.",
            "description": [
                {
                    "representation": "(1)",
                    "description": "in the workplace, the employer shall ensure that the information referred to in that subsection has been obtained and is"
                },
                {
                    "representation": "(2)",
                    "description": "applies shall post prominent notices identifying and warning of the hazardous physical agent in the part of the workplace in which the article is used or operated or is to be used or operated."
                },
                {
                    "representation": "(a)",
                    "description": "made available in the workplace for workers who use or operate the article or who are likely to be exposed to the hazardous physical agent; and"
                },
                {
                    "representation": "(b)",
                    "description": "furnished by the employer to the committee or safety and health representative, if any, for the workplace or a worker selected by the workers to represent them, if there is no committee or safety and health representative."
                },
                {
                    "representation": "(3)",
                    "description": "shall contain such information as may be prescribed and shall be in English LAWS OF GUYANA Occupational Safety and Health Cap. 99:06 99  L.R.O. 1/2012        Instruction and training.                                    Confidential business information.       and such other language or languages as may be prescribed."
                },
                {
                    "representation": "(4)",
                    "description": "Notices required by subsection"
                }
            ]
        }
    },
    {
        "act": "OCCUPATIONAL SAFETY AND HEALTH ACT",
        "source": "https://mola.gov.gy/laws-of-guyana",
        "type": {
            "name": "section",
            "representation": "66",
            "title": "Instructions and training. ",
            "context": "OCCUPATIONAL SAFETY AND HEALTH ACT under Instructions and training. 66. (1) In addition to providing information and instruction to a worker as required by section 46(2)(a), an employer shall ensure that a worker exposed or likely to be exposed to a hazardous chemical or to a hazardous physical agent receives, and that the worker participates in, such instruction and training as may be prescribed.  (2) The instruction and training to be given under subsection (1) shall be developed and implemented by the employer in consultation with the committee or safety and health representative, if any, for the workplace.  (3) An employer shall review, in consultation with committee or safety and health representative, if any, for the workplace, the training and instruction provided to a worker and the workers familiarity therewith at least annually.  (4) The review described in subsection (3) shall be held more frequently than annually, if  (a) the employer, on the advice of the committee or safety and health representative, if any, for the workplace, determines that such reviews are necessary; or (b) there is a change in circumstances that may affect the safety or health worker.",
            "description": [
                {
                    "representation": "(1)",
                    "description": "shall be developed and implemented by the employer in consultation with the committee or safety and health representative, if any, for the workplace."
                },
                {
                    "representation": "(2)",
                    "description": "The instruction and training to be given under subsection"
                },
                {
                    "representation": "(3)",
                    "description": "shall be held more frequently than annually, if"
                },
                {
                    "representation": "(4)",
                    "description": "The review described in subsection"
                },
                {
                    "representation": "(a)",
                    "description": "the employer, on the advice of the committee or safety and health representative, if any, for the workplace, determines that such reviews are necessary; or"
                },
                {
                    "representation": "(b)",
                    "description": "there is a change in circumstances that may affect the safety or health worker."
                }
            ]
        }
    },
    {
        "act": "OCCUPATIONAL SAFETY AND HEALTH ACT",
        "source": "https://mola.gov.gy/laws-of-guyana",
        "type": {
            "name": "section",
            "representation": "67",
            "title": "Confidential business information.  PART VII NOTIFICATION OF ACCIDENTS AND OCCUPATIONAL DISEASES  ",
            "context": "OCCUPATIONAL SAFETY AND HEALTH ACT under Confidential business information.  PART VII NOTIFICATION OF ACCIDENTS AND OCCUPATIONAL DISEASES  67. (1) An employer may file a claim with the Minister for an exemption from disclosing (a) information required under this Part in an inventory, label or chemical safety data sheet; or  (b) the name of a toxicological study used LAWS OF GUYANA 100 Cap. 99:06 Occupational Safety and Health  L.R.O. 1/2012                                          Interpretation.       by the employer to prepare a chemical safety data sheet,  on the grounds that it is confidential business information and that disclosure of such information to a competitor would be liable to cause harm to an employers business, so long as the safety and health of workers are not compromised thereby.  (2) An application under subsection (1) shall be made only in respect of such types of confidential business information as may be prescribed.  (3) Any worker of the employer or any union representing the workers of the employer may file with the Minister a rebuttal to the claim made by the employer under subsection (1).  (4) The Minister shall make a determination or direct the Commissioner to make a determination on his behalf, on every claim made under subsection (1) and on every rebuttal  made  under subsection (3).  (5) Information that an employer considers to be confidential business information is exempt from disclosure from the time a claim is filed under subsection (1) until the claim is finally determined and for three years thereafter, if the claim is found to be valid.  PART VII NOTIFICATION OF ACCIDENTS AND OCCUPATIONAL DISEASES",
            "description": [
                {
                    "representation": "(1)",
                    "description": "until the claim is finally determined and for three years thereafter, if the claim is found to be valid.  PART VII NOTIFICATION OF ACCIDENTS AND OCCUPATIONAL DISEASES"
                },
                {
                    "representation": "(a)",
                    "description": "information required under this Part in an inventory, label or chemical safety data sheet; or"
                },
                {
                    "representation": "(b)",
                    "description": "the name of a toxicological study used LAWS OF GUYANA 100 Cap. 99:06 Occupational Safety and Health  L.R.O. 1/2012                                          Interpretation.       by the employer to prepare a chemical safety data sheet,  on the grounds that it is confidential business information and that disclosure of such information to a competitor would be liable to cause harm to an employers business, so long as the safety and health of workers are not compromised thereby."
                },
                {
                    "representation": "(2)",
                    "description": "An application under subsection"
                },
                {
                    "representation": "(3)",
                    "description": "Any worker of the employer or any union representing the workers of the employer may file with the Minister a rebuttal to the claim made by the employer under subsection"
                },
                {
                    "representation": "(4)",
                    "description": "The Minister shall make a determination or direct the Commissioner to make a determination on his behalf, on every claim made under subsection"
                },
                {
                    "representation": "(5)",
                    "description": "Information that an employer considers to be confidential business information is exempt from disclosure from the time a claim is filed under subsection"
                }
            ]
        }
    },
    {
        "act": "OCCUPATIONAL SAFETY AND HEALTH ACT",
        "source": "https://mola.gov.gy/laws-of-guyana",
        "type": {
            "name": "section",
            "representation": "68",
            "title": "Interpretation. ",
            "context": "OCCUPATIONAL SAFETY AND HEALTH ACT under Interpretation. 68. In this Part  employer includes anybody of persons corporate or incorporate and the legal personal representative of a deceased employer, and, where the services of a worker are temporarily lent or let on hire to another person by LAWS OF GUYANA Occupational Safety and Health Cap. 99:06 101  L.R.O. 1/2012                             Notification of accidents.            First Schedule.               the person with whom. the worker has entered into a contract of service or apprenticeship, the latter shall, for the purposes of this Act be deemed to continue to be the employer of the worker whilst he is working for that other person. In relation to a person plying for hire with any vehicle or vessel the use of which is obtained by that person under a contract of bailment (other that higher-purchase agreement), the person from whom the use of the vessel or vehicle is so obtained shall, for the purposes of this Act, be deemed to be the  employer; and in relation to a person employed for the purpose of any gain or recreation and engaged or paid through a club, the manager or members of the managing committee of the club, shall for the purposes of this Act, be deemed to be the employer.",
            "description": "In this Part  employer includes anybody of persons corporate or incorporate and the legal personal representative of a deceased employer, and, where the services of a worker are temporarily lent or let on hire to another person by LAWS OF GUYANA Occupational Safety and Health Cap. 99:06 101  L.R.O. 1/2012                             Notification of accidents.            First Schedule.               the person with whom. the worker has entered into a contract of service or apprenticeship, the latter shall, for the purposes of this Act be deemed to continue to be the employer of the worker whilst he is working for that other person. In relation to a person plying for hire with any vehicle or vessel the use of which is obtained by that person under a contract of bailment (other that higher-purchase agreement), the person from whom the use of the vessel or vehicle is so obtained shall, for the purposes of this Act, be deemed to be the  employer; and in relation to a person employed for the purpose of any gain or recreation and engaged or paid through a club, the manager or members of the managing committee of the club, shall for the purposes of this Act, be deemed to be the employer."
        }
    },
    {
        "act": "OCCUPATIONAL SAFETY AND HEALTH ACT",
        "source": "https://mola.gov.gy/laws-of-guyana",
        "type": {
            "name": "section",
            "representation": "69",
            "title": "Notification of accidents. ",
            "context": "OCCUPATIONAL SAFETY AND HEALTH ACT under Notification of accidents. 69. (1) Where any accident arising out of and in the course of the employment of any worker occurs and  (a) causes loss of life to such worker; or  (b) disables such worker, for more than one day, from earning full wages at the work at which he was employed at the time of such accident,  written notice of the accident in the Form and accompanied by the particulars set out in the First Schedule, shall forthwith in the case of paragraph (a) and within four days in the case of paragraph (b), be sent by the employer to the Authority and the committee, safety and health representative or trade union, if any.  (2) Where any accident causing disablement has been notified under this section, and after such notification the accident results in the death of the person disabled, notice in writing of the death shall forthwith be sent by the employer to the Authority and the committee, safety and LAWS OF GUYANA 102 Cap. 99:06 Occupational Safety and Health  L.R.O. 1/2012             Second Schedule.                                   health representative or trade union, if any, as soon as the fact of the death comes to the knowledge of the employer.  (3) Where an accident causing disablement has been notified under this section and the said disablement has ceased, notice in writing of the date when the disablement ceased shall be sent by the employer to the Authority and the committee, safety and health representative or trade union if any within two weeks from that date, in the Form and accompanied by the particulars set out in the Second Schedule.  (4) Any employer who fails to comply with the requirements of subsection (1), (2) or (3) shall be liable on summary conviction to a fine of not  less than ten thousand dollars nor more than fifty thousand dollars and to imprisonment for three months.  (5) Where any accident to which this section applies occurs to a worker whose services are for the time being temporarily lent or let on hire to another person by the employer, such other person shall, if he fails to report the accident to the employer immediately, be guilty of an offence, and the employer shall not be liable under the provisions of subsection (4) unless it is established that he knew of the accident.  (6) Where a person loses his life or is disabled under subsection (1), no person shall, except for the purpose of  (a) saving life or relieving human suffering;  (b) maintaining an essential public utility service or a public transportation system; or  LAWS OF GUYANA Occupational Safety and Health Cap. 99:06 103  L.R.O. 1/2012                       Notification of occupational diseases and other diseases.                         Third Schedule.      (c) preventing unnecessary damage  to  equipment  or other property,  interfere with, disturb, destroy, alter or carry away any wreckage or article at the scene or connected with the occurrence which gave rise to loss of life or disablement until permission so to do has been given by an inspector.  (7) A register of all accidents to which this section applies shall be kept by the employer in the form prescribed by regulations made under this Act.",
            "description": [
                {
                    "representation": "(1)",
                    "description": "Where any accident arising out of and in the course of the employment of any worker occurs and"
                },
                {
                    "representation": "(a)",
                    "description": "saving life or relieving human suffering;"
                },
                {
                    "representation": "(b)",
                    "description": "maintaining an essential public utility service or a public transportation system; or  LAWS OF GUYANA Occupational Safety and Health Cap. 99:06 103  L.R.O. 1/2012                       Notification of occupational diseases and other diseases.                         Third Schedule."
                },
                {
                    "representation": "(2)",
                    "description": "or"
                },
                {
                    "representation": "(3)",
                    "description": "shall be liable on summary conviction to a fine of not  less than ten thousand dollars nor more than fifty thousand dollars and to imprisonment for three months."
                },
                {
                    "representation": "(4)",
                    "description": "unless it is established that he knew of the accident."
                },
                {
                    "representation": "(5)",
                    "description": "Where any accident to which this section applies occurs to a worker whose services are for the time being temporarily lent or let on hire to another person by the employer, such other person shall, if he fails to report the accident to the employer immediately, be guilty of an offence, and the employer shall not be liable under the provisions of subsection"
                },
                {
                    "representation": "(6)",
                    "description": "Where a person loses his life or is disabled under subsection"
                },
                {
                    "representation": "(c)",
                    "description": "preventing unnecessary damage  to  equipment  or other property,  interfere with, disturb, destroy, alter or carry away any wreckage or article at the scene or connected with the occurrence which gave rise to loss of life or disablement until permission so to do has been given by an inspector."
                },
                {
                    "representation": "(7)",
                    "description": "A register of all accidents to which this section applies shall be kept by the employer in the form prescribed by regulations made under this Act."
                }
            ]
        }
    },
    {
        "act": "OCCUPATIONAL SAFETY AND HEALTH ACT",
        "source": "https://mola.gov.gy/laws-of-guyana",
        "type": {
            "name": "section",
            "representation": "70",
            "title": "Notification of occupational diseases and other diseases. LAWS OF GUYANA 6 Cap. 99:06 Occupational Safety and Health  L.R.O. 1/2012 SECTION  ",
            "context": "OCCUPATIONAL SAFETY AND HEALTH ACT under Notification of occupational diseases and other diseases. LAWS OF GUYANA 6 Cap. 99:06 Occupational Safety and Health  L.R.O. 1/2012 SECTION  70. (1) Every qualified medical practitioner attending on or called in to visit a patient whom he believes to be suffering from occupational disease contracted in the course of his employment as a worker shall, unless such a notice has been previously sent, forthwith sent, addressed to the Authority a notice stating the name and full postal address of the patient and the disease  from which, in the opinion of such medical practitioner, the patient is suffering and the name and address of the place at which, and of the  employer by whom, he is or was last employed.  (2) If any qualified medical practitioner fails to send any notice in accordance with the requirements of this section, he shall be liable on summary conviction to a fine of not less than ten thousand dollars nor more than thirty thousand dollars.  (3) Any employer who believe or suspects, or has reasonable grounds for believing or suspecting that a case of occupational disease has  occurred among the workers employed by him, shall forthwith send written notice of such case, in the form, and accompanied by the particulars set out in the Third Schedule, to the Authority and to the committee, safety and health representative or trade union, if and to the Local Sanitary Authority of, and, in the case of workers employed in industrial establishments, to the medical LAWS OF GUYANA 104 Cap. 99:06 Occupational Safety and Health  L.R.O. 1/2012                                          Inquest in case of death by accident or occupational disease.                 inspector for the area within which the place of employment of such workers is situated, and the provisions of this Act with respect to the notification of accidents shall apply to any such case in like manner as to any such accident as is mentioned in these provisions.  (4) If an employer is advised by or on behalf of a worker that a claim in respect of a prescribed disease as defined in the Third Schedule of the National Insurance and Social Security Act has been filed with the National Insurance Board by or on behalf of the worker, the employer shall give notice in writing within four days of being so advised, to the  Authority and to the committee, safety and health representative or trade union, if any, containing such information and particulars as are prescribed.  (5) The Minister may, as respects any class or description of place where workers are employed, by regulations made under this Act apply this section to any disease, other than an occupational disease.",
            "description": [
                {
                    "representation": "(1)",
                    "description": "Every qualified medical practitioner attending on or called in to visit a patient whom he believes to be suffering from occupational disease contracted in the course of his employment as a worker shall, unless such a notice has been previously sent, forthwith sent, addressed to the Authority a notice stating the name and full postal address of the patient and the disease  from which, in the opinion of such medical practitioner, the patient is suffering and the name and address of the place at which, and of the  employer by whom, he is or was last employed."
                },
                {
                    "representation": "(2)",
                    "description": "If any qualified medical practitioner fails to send any notice in accordance with the requirements of this section, he shall be liable on summary conviction to a fine of not less than ten thousand dollars nor more than thirty thousand dollars."
                },
                {
                    "representation": "(3)",
                    "description": "Any employer who believe or suspects, or has reasonable grounds for believing or suspecting that a case of occupational disease has  occurred among the workers employed by him, shall forthwith send written notice of such case, in the form, and accompanied by the particulars set out in the Third Schedule, to the Authority and to the committee, safety and health representative or trade union, if and to the Local Sanitary Authority of, and, in the case of workers employed in industrial establishments, to the medical LAWS OF GUYANA 104 Cap. 99:06 Occupational Safety and Health  L.R.O. 1/2012                                          Inquest in case of death by accident or occupational disease.                 inspector for the area within which the place of employment of such workers is situated, and the provisions of this Act with respect to the notification of accidents shall apply to any such case in like manner as to any such accident as is mentioned in these provisions."
                },
                {
                    "representation": "(4)",
                    "description": "If an employer is advised by or on behalf of a worker that a claim in respect of a prescribed disease as defined in the Third Schedule of the National Insurance and Social Security Act has been filed with the National Insurance Board by or on behalf of the worker, the employer shall give notice in writing within four days of being so advised, to the  Authority and to the committee, safety and health representative or trade union, if any, containing such information and particulars as are prescribed."
                },
                {
                    "representation": "(5)",
                    "description": "The Minister may, as respects any class or description of place where workers are employed, by regulations made under this Act apply this section to any disease, other than an occupational disease."
                }
            ]
        }
    },
    {
        "act": "OCCUPATIONAL SAFETY AND HEALTH ACT",
        "source": "https://mola.gov.gy/laws-of-guyana",
        "type": {
            "name": "section",
            "representation": "71",
            "title": "Inquest in case of death by accident or occupational disease. ",
            "context": "OCCUPATIONAL SAFETY AND HEALTH ACT under Inquest in case of death by accident or occupational disease. 71.  (2) Where a worker complains that an employer or person acting on behalf of an employer has contravened subsection (1), the worker may either have the matter dealt with by final and binding settlement, by arbitration under a collective agreement, if any, or file a complaint with the Authority, where a complaint is filed with the Authority, the Authority shall direct that the complaint be determined on its behalf by the Commissioner.  (3) The Commissioner directed under subsection (2) shall inquire into any complaint filed under subsection (2).  (4) On an inquiry into a complaint filed under subsection (2), the Commissioner shall, notwithstanding section 21(2) give such directions and issue such orders as he LAWS OF GUYANA 88 Cap. 99:06 Occupational Safety and Health  L.R.O. 1/2012                        Orders of Authority.                               considers proper or necessary concerning the procedures to be adopted or followed.  (5) On an inquiry by the Commissioner into a complaint filed under subsection (2), the burden of proof that an employer or person acting on behalf of an employer did not act contrary to subsection (1) lies upon the employer or the person acting on behalf of the employer.  PART VI HAZARDOUS CHEMICALS, PHYSICAL AGENTS AND BIOLOGICAL AGENTS",
            "description": [
                {
                    "representation": "(2)",
                    "description": "give such directions and issue such orders as he LAWS OF GUYANA 88 Cap. 99:06 Occupational Safety and Health  L.R.O. 1/2012                        Orders of Authority.                               considers proper or necessary concerning the procedures to be adopted or followed."
                },
                {
                    "representation": "(3)",
                    "description": "The Commissioner directed under subsection"
                },
                {
                    "representation": "(4)",
                    "description": "On an inquiry into a complaint filed under subsection"
                },
                {
                    "representation": "(5)",
                    "description": "On an inquiry by the Commissioner into a complaint filed under subsection"
                },
                {
                    "representation": "(1)",
                    "description": "lies upon the employer or the person acting on behalf of the employer.  PART VI HAZARDOUS CHEMICALS, PHYSICAL AGENTS AND BIOLOGICAL AGENTS"
                }
            ]
        }
    },
    {
        "act": "OCCUPATIONAL SAFETY AND HEALTH ACT",
        "source": "https://mola.gov.gy/laws-of-guyana",
        "type": {
            "name": "section",
            "representation": "72",
            "title": "Powers of Minister to direct formal investigation of accidents and cases of occupational disease. ",
            "context": "OCCUPATIONAL SAFETY AND HEALTH ACT under Powers of Minister to direct formal investigation of accidents and cases of occupational disease. 72. (1) The Minister may, where he considers it expedient so to do, direct a formal investigation to be held into any accident arising out of and in the course of employment of any worker or case of occupational disease contracted or suspected to have been contracted in the course of employment of any worker and of its causes and circumstances, and with respect to any such investigation the following provisions shall have effect  (a) the Minister may appoint a competent person to hold the investigation and may appoint any person possessing legal or special knowledge to act as an assessor in holding the investigation;  (b) the person or persons so appointed (hereafter in this section referred to as the court) shall hold the investigation in open court in such manner and under such conditions as the court may think most effectual for ascertaining the causes and circumstances of the accident or case of occupational disease, and for enabling the court to make the report in this section mentioned;  (c) the court shall have for the purposes of the investigation all the powers of a court of summary jurisdiction under the Summary Jurisdiction Acts and, in addition power  (i) to enter and inspect or to LAWS OF GUYANA 108 Cap. 99:06 Occupational Safety and Health  L.R.O. 1/2012                                                 authorise any person to inspect any place or building the entry or inspection whereof appears to the court requisite for the said purpose;   (ii) by summons signed by the court to require the attendance of all such persons as it thinks fit to call before it and examine for the said purposes, and to require answers or returns to such inquiry as it thinks fit to make;  (iii) to require the production of all books, papers, and  documents which it considers relevant; (iv) to administer an oath and require any person examined to make and sign a declaration of the truth of the statements made by him in his examination;  (d) persons attending as witnesses before the court shall be allowed such expenses as would be allowed to witnesses attending before the High Court in its civil jurisdiction, and in the case of dispute as to the amount to be allowed the same shall be referred by the court to the Registrar of the Supreme Court, who on request signed by the court shall ascertain and certify the proper amount of the expenses;  (e) the court shall make a report to the Minister stating the cause and LAWS OF GUYANA Occupational Safety and Health Cap. 99:06 109  L.R.O. 1/2012                                                 circumstances of the accident or case of occupational disease and adding any observations which the court thinks right to make;  (f) the court may require the expenses incurred in and about  an investigation under this section (including the remuneration of any persons to act as assessors) to be paid in whole or part by any person summoned before it who appears to the court to be, by reason of any act or default of his part or on the part of any servant or agent of him, responsible in any degree for the occurrence of the accident or case of occupational disease, but any such expenses not required to be so paid shall be deemed to be part of the expenses of the Authority in the administration of this Part;   (g) if any person without reasonable excuse (proof whereof shall lie on him) either fails, after having had the expenses (if any) to which he is entitled tendered to him, to comply with any summons or requisition of a court holding an investigation under this section, or prevents or impedes the court in the execution of its duty, he shall be liable on summary conviction to a fine of five thousand dollars and in the case of a failure to comply with a requisition for making any return or producing any document he shall be liable on LAWS OF GUYANA 110 Cap. 99:06 Occupational Safety and Health  L.R.O. 1/2012                                         Application to Government, etc.                 summary conviction to a fine of five hundred dollars for every day on which such failure continues;  (h) the expenses of the Authority in the execution of the provisions of this section shall be defrayed out of monies provided by Parliament;  (i) if any witness objects to answer any question or to produce any document on the ground that it may tend to incriminate him, or on any other lawful ground, he shall not be  required to answer such question or to produce such document nor shall he be liable to any penalty in respect of such refusal.  (2) The Minister may cause the report of the court to be made public at such time and in such manner as he thinks fit.",
            "description": [
                {
                    "representation": "(1)",
                    "description": "The Minister may, where he considers it expedient so to do, direct a formal investigation to be held into any accident arising out of and in the course of employment of any worker or case of occupational disease contracted or suspected to have been contracted in the course of employment of any worker and of its causes and circumstances, and with respect to any such investigation the following provisions shall have effect"
                },
                {
                    "representation": "(a)",
                    "description": "the Minister may appoint a competent person to hold the investigation and may appoint any person possessing legal or special knowledge to act as an assessor in holding the investigation;"
                },
                {
                    "representation": "(b)",
                    "description": "the person or persons so appointed"
                },
                {
                    "representation": "(c)",
                    "description": "the court shall have for the purposes of the investigation all the powers of a court of summary jurisdiction under the Summary Jurisdiction Acts and, in addition power"
                },
                {
                    "representation": "(i)",
                    "description": "if any witness objects to answer any question or to produce any document on the ground that it may tend to incriminate him, or on any other lawful ground, he shall not be  required to answer such question or to produce such document nor shall he be liable to any penalty in respect of such refusal."
                },
                {
                    "representation": "(d)",
                    "description": "persons attending as witnesses before the court shall be allowed such expenses as would be allowed to witnesses attending before the High Court in its civil jurisdiction, and in the case of dispute as to the amount to be allowed the same shall be referred by the court to the Registrar of the Supreme Court, who on request signed by the court shall ascertain and certify the proper amount of the expenses;"
                },
                {
                    "representation": "(e)",
                    "description": "the court shall make a report to the Minister stating the cause and LAWS OF GUYANA Occupational Safety and Health Cap. 99:06 109  L.R.O. 1/2012                                                 circumstances of the accident or case of occupational disease and adding any observations which the court thinks right to make;"
                },
                {
                    "representation": "(f)",
                    "description": "the court may require the expenses incurred in and about  an investigation under this section"
                },
                {
                    "representation": "(g)",
                    "description": "if any person without reasonable excuse"
                },
                {
                    "representation": "(h)",
                    "description": "the expenses of the Authority in the execution of the provisions of this section shall be defrayed out of monies provided by Parliament;"
                },
                {
                    "representation": "(2)",
                    "description": "The Minister may cause the report of the court to be made public at such time and in such manner as he thinks fit."
                }
            ]
        }
    },
    {
        "act": "OCCUPATIONAL SAFETY AND HEALTH ACT",
        "source": "https://mola.gov.gy/laws-of-guyana",
        "type": {
            "name": "section",
            "representation": "73",
            "title": "Application to Government, etc. ",
            "context": "OCCUPATIONAL SAFETY AND HEALTH ACT under Application to Government, etc. 73. Without prejudice to the generality of the application of this Part, it is hereby declared that this Part shall apply in the case of accidents, occupational disease, or disease prescribed in regulations made under section 70, occurring to persons employed by or under   (a) any department of Government other than members  of the Guyana Police Force or of the Guyana Defence Force;   (b) such persons or class of persons (not being members of the Guyana Police Force or the Guyana Defence Force) or employed by or under any department of Government as may be LAWS OF GUYANA Occupational Safety and Health Cap. 99:06 111  L.R.O. 1/2012                      Accidents, explosions etc., at an industrial establishment.                    Power of Minister to make regulations.                  specified by order of the Minister,  and in such cases notice to be given under this Act by the employer shall be given by such person as the  head of the department of Government shall by written instructions direct.",
            "description": [
                {
                    "representation": "(a)",
                    "description": "any department of Government other than members  of the Guyana Police Force or of the Guyana Defence Force;"
                },
                {
                    "representation": "(b)",
                    "description": "such persons or class of persons"
                }
            ]
        }
    },
    {
        "act": "OCCUPATIONAL SAFETY AND HEALTH ACT",
        "source": "https://mola.gov.gy/laws-of-guyana",
        "type": {
            "name": "section",
            "representation": "74",
            "title": "Accidents, explosions, etc., at an industrial establishment.  PART VIII REGULATIONS  ",
            "context": "OCCUPATIONAL SAFETY AND HEALTH ACT under Accidents, explosions, etc., at an industrial establishment.  PART VIII REGULATIONS  74. Where any notification is not required under section 69 and 70 and an accident, premature or unexpected explosion, fire, flood or inrush of water, failure of any equipment, machine, device, article, cave-in, subsidence, rockburst, or other incident as prescribed occurs at an industrial establishment, notice in writing of the occurrence shall be given to the Authority and to the committee, safety and health representative or trade union, if any, by the employer at such industrial establishment within two days of the occurrence containing such information and particulars as are prescribed.  PART VIII REGULATIONS",
            "description": "Where any notification is not required under section 69 and 70 and an accident, premature or unexpected explosion, fire, flood or inrush of water, failure of any equipment, machine, device, article, cave-in, subsidence, rockburst, or other incident as prescribed occurs at an industrial establishment, notice in writing of the occurrence shall be given to the Authority and to the committee, safety and health representative or trade union, if any, by the employer at such industrial establishment within two days of the occurrence containing such information and particulars as are prescribed.  PART VIII REGULATIONS"
        }
    },
    {
        "act": "OCCUPATIONAL SAFETY AND HEALTH ACT",
        "source": "https://mola.gov.gy/laws-of-guyana",
        "type": {
            "name": "section",
            "representation": "75",
            "title": "Power of Minister to make regulations. ",
            "context": "OCCUPATIONAL SAFETY AND HEALTH ACT under Power of Minister to make regulations. 75. (1) Subject to negative resolution of the National Assembly, the Minister may from time to time make regulations  (a) prohibiting the employment of, or modifying or limiting the period of employment of, all persons or any class of persons in connection with any manufacture, machinery, plant, process or description of labour certified by the Authority, by notice published in the Gazette, to be dangerous;  (b) prohibiting, limiting or controlling the use of any material or process; LAWS OF GUYANA 112 Cap. 99:06 Occupational Safety and Health  L.R.O. 1/2012                                                  (c) modifying or extending any special provision for any class of industrial establishments contained in this Act;  (d) for the purpose of ensuring the health or safety of persons who are employed in any industrial establishment or in connection  with machinery or with any employment within the meaning of paragraph (a); and  (e) generally for giving effect to the purposes of this Act.  (2) In particular, and without prejudice to the generality of the foregoing provisions, any such regulations may provide for  A. (a) the safe means of approach or access to, and exit from, any industrial establishment, or machinery;  (b) the fencing and covering of all dangerous places or machines;  (c) life saving and first aid appliances and first aid services to be provided by employers;  (d) securing safety in connection with all operations carried on in an industrial establishment;  (e) securing safety in connection with the use of cranes, winches, pulley-blocks, and of all engines, machinery, LAWS OF GUYANA Occupational Safety and Health Cap. 99:06 113  L.R.O. 1/2012                                                 mechanical gear and contrivances generally whatsoever;  (f) the periodic inspection, testing and classification, according to age, type or condition, of boilers, and for the issue and display of certificates in connection therewith, and for the regulating of the type of safety valves to be fixed to any boiler and the maximum pressure at which boilers of any age, type, class, or condition may be operated;  (g) amending the duties and responsibilities assignable to any person under Part V of this Act;  (h) the proper ventilation of any industrial establishment, having regard to the nature of the process carried on therein;  (i) the sanitation, including the provision of lavatory accommodation and sanitary conveniences (having regard to the number of workers employed) at any industrial establishment;  (j) the fees to be paid for the inspection or examination of any industrial establishment or class of industrial establishment and any machinery therein;  (k) the forms and certificates to be used under this Act;  LAWS OF GUYANA 114 Cap. 99:06 Occupational Safety and Health  L.R.O. 1/2012                                                 (l) the records and registers to be maintained for the purposes of this Act;  (m) the lifting or moving of loads by any woman or young person;  (n) the appointment, powers, duties, and fees of medical inspectors;  (o) the medical supervision of workers;  (p) the prescribing of occupations for the purposes of section 13;  (q) the contents of notices required to be displayed under this Act;  (r) defining any word or expression used in this Act or the regulations that is not defined in this Act;  (s) designating or defining any industry workplace, employer or class of workplaces or employers for the purposes of this Act, or the regulations or any provision thereof; (t) exempting any workplace, industry, activity, business, work, trade, occupation, profession, employer or any class thereof from the application of a regulation or any provision thereof;  (u) limiting or restricting the application of a regulation or any provision thereof to any workplace, industry, activity, business, work, trade, LAWS OF GUYANA Occupational Safety and Health Cap. 99:06 115  L.R.O. 1/2012                                                 occupation, profession, employer or any class thereof;  (v) exempting an employer from the requirements of section 63(l) (a) or (b) with respect to a hazardous chemical;   (w) any matter or article that is required or permitted to be regulated or prescribed under this Act;  (x) any matter or article, where a provision of this Act requires that the matter or article be done, used or carried out or provided as prescribed;  (y) any matter or article, where it is a condition precedent that a regulation be made prescribing the matter or article before this Act or a provision of this Act has any effect;  (z) the fees other than those referred to in paragraphs (j) and (u) and the payment or refund of fees;  (B) (a) the classes of workplace for which and circumstances under which a committee shall consist of more than six  persons and in each case prescribing the number of persons;  (b) the employer of workplaces or classes thereof for the purposes of section 23 (1)(b);  (c) exempting any workplace, industry, activity, business, work, trade, LAWS OF GUYANA 116 Cap. 99:06 Occupational Safety and Health  L.R.O. 1/2012                                                 occupation, profession, employer or any class thereof from the application of section 23(2);  (d) the conditions for eligibility, qualifications, selection and terms of committee members, and the operation of the committee;  (e) regulating or prohibiting the installation or use of any machine, device or article or any class thereof;  (f) requiring that any equipment, machine, device, or article used bear the seal of approval of an organization designated by the regulations to test and approve the equipment, machine, device, or article and designating organizations for such purposes;  (g) the classes of employers who shall establish and maintain a medical surveillance program in which workers may volunteer to participate;  (h) medical surveillance programmes ;  (i) the reporting by physicians and others of workers affected by any chemical, physical agent, or biological agent or combination thereof;  (j) regulating or prohibiting atmospheric conditions to which any worker may be exposed in a workplace:  LAWS OF GUYANA Occupational Safety and Health Cap. 99:06 117  L.R.O. 1/2012                                                 (k) the methods, standards or procedures for determining the amount, concentration or level of any atmospheric condition or any chemical, physical agent, or biological agent or combination thereof in a workplace;  (l) any chemical, physical agent, or biological agent or combination thereof as a critical substance;  (m) prohibiting, regulating, restricting, limiting or controlling the handling of, exposure to, or the use and disposal of any critical substance;  (n) adopting by reference, in whole or in part, with such changes as the Minister, considers necessary, any code or standard and requiring compliance with any code or standard that is so adopted;  (o) adopting by reference any criteria or guide in relation to the exposure of a worker to any chemical, physical agent, or biological agent or combination thereof;  (p) enabling the Authority by notice in writing to designate that any part of a construction site shall be an individual construction site for the purposes of this Act and the regulations and prescribing to whom notice shall be given;  LAWS OF GUYANA 118 Cap. 99:06 Occupational Safety and Health  L.R.O. 1/2012                                                 (q) permitting the Minister to approve laboratories for the purpose of carrying out and performing sampling, analyses, tests and examinations, and requiring that sampling, analyses, examinations and tests be carried out and performed by a laboratory approved by the Minister;  (r) the registration of employers of workers,  (s) the establishment, equipment, operation and maintenance of mine rescue stations. as the Minister may direct, and for the payment of the cost thereof and the recovery of such cost from  the mining industry;  (t) the training programmes that employers shall provide;   (u) the floor plans for the purposes of section 61(7);  (v) the forms and notices and providing for their use under this Act;  (w) building standards for industrial establishments;  (x) the name or description of any chemical as a hazardous chemical, any biological agent as a hazardous biological agent, and any physical agent as a hazardous physical agent;  LAWS OF GUYANA Occupational Safety and Health Cap. 99:06 119  L.R.O. 1/2012                                                 (y) prohibiting an employer from altering a label on a hazardous chemical in prescribed circumstances;  (z) the criteria to be used by the Commissioner to determine whether information is confidential business information in an application under section 67(1);  (C) (a) requiring an employer to disclose to such persons as may be prescribed the source of toxicological data used by the employer to prepare a chemical safety data sheet;  (b) the format and contents of a chemical safety data sheet;  (c) the intervals at which a safety and health representative or a committee member designated under section 23(18) shall inspect all or part of a workplace;  (d) the medical examinations and tests that a worker is required to undergo to ensure that the workers health will not affect his ability to perform his job in a manner that might endanger others in keeping with section 47(1)(a);  (e) carrying into effect the provisions of Part VII and declaring certain diseases to be occupational disease for the purposes of this Art;  LAWS OF GUYANA 120 Cap. 99:06 Occupational Safety and Health  L.R.O. 1/2012                                      Penalty for breach of regulations.                 Liability of employers, owners, directors and others.   (f) any provision with respect to the payment of any fixed fine in order to discharge any liability to conviction for the purpose of section 30(12);  (g) the threshold quantity of a given hazardous substance or category of substances which, if exceeded, identifies a major hazard installation;  (h) provision with respect to the levy to defray expenses of administering this Act for the purposes of section 39;  (i) all other matters which the Minister may consider to be in anyway incidental to, connected with or conducive to the discharge of the provisions of this Act.  (3) No young person shall be employed in a factory otherwise than in accordance with regulations made under this section.",
            "description": [
                {
                    "representation": "(1)",
                    "description": "Subject to negative resolution of the National Assembly, the Minister may from time to time make regulations"
                },
                {
                    "representation": "(a)",
                    "description": "or"
                },
                {
                    "representation": "(b)",
                    "description": "the format and contents of a chemical safety data sheet;"
                },
                {
                    "representation": "(c)",
                    "description": "the intervals at which a safety and health representative or a committee member designated under section 23(18) shall inspect all or part of a workplace;"
                },
                {
                    "representation": "(d)",
                    "description": "the medical examinations and tests that a worker is required to undergo to ensure that the workers health will not affect his ability to perform his job in a manner that might endanger others in keeping with section 47(1)(a);"
                },
                {
                    "representation": "(e)",
                    "description": "carrying into effect the provisions of Part VII and declaring certain diseases to be occupational disease for the purposes of this Art;  LAWS OF GUYANA 120 Cap. 99:06 Occupational Safety and Health  L.R.O. 1/2012                                      Penalty for breach of regulations.                 Liability of employers, owners, directors and others."
                },
                {
                    "representation": "(2)",
                    "description": "In particular, and without prejudice to the generality of the foregoing provisions, any such regulations may provide for  A."
                },
                {
                    "representation": "(f)",
                    "description": "any provision with respect to the payment of any fixed fine in order to discharge any liability to conviction for the purpose of section 30(12);"
                },
                {
                    "representation": "(g)",
                    "description": "the threshold quantity of a given hazardous substance or category of substances which, if exceeded, identifies a major hazard installation;"
                },
                {
                    "representation": "(h)",
                    "description": "provision with respect to the levy to defray expenses of administering this Act for the purposes of section 39;"
                },
                {
                    "representation": "(i)",
                    "description": "all other matters which the Minister may consider to be in anyway incidental to, connected with or conducive to the discharge of the provisions of this Act."
                },
                {
                    "representation": "(j)",
                    "description": "regulating or prohibiting atmospheric conditions to which any worker may be exposed in a workplace:  LAWS OF GUYANA Occupational Safety and Health Cap. 99:06 117  L.R.O. 1/2012"
                },
                {
                    "representation": "(k)",
                    "description": "the methods, standards or procedures for determining the amount, concentration or level of any atmospheric condition or any chemical, physical agent, or biological agent or combination thereof in a workplace;"
                },
                {
                    "representation": "(l)",
                    "description": "any chemical, physical agent, or biological agent or combination thereof as a critical substance;"
                },
                {
                    "representation": "(m)",
                    "description": "prohibiting, regulating, restricting, limiting or controlling the handling of, exposure to, or the use and disposal of any critical substance;"
                },
                {
                    "representation": "(n)",
                    "description": "adopting by reference, in whole or in part, with such changes as the Minister, considers necessary, any code or standard and requiring compliance with any code or standard that is so adopted;"
                },
                {
                    "representation": "(o)",
                    "description": "adopting by reference any criteria or guide in relation to the exposure of a worker to any chemical, physical agent, or biological agent or combination thereof;"
                },
                {
                    "representation": "(p)",
                    "description": "enabling the Authority by notice in writing to designate that any part of a construction site shall be an individual construction site for the purposes of this Act and the regulations and prescribing to whom notice shall be given;  LAWS OF GUYANA 118 Cap. 99:06 Occupational Safety and Health  L.R.O. 1/2012"
                },
                {
                    "representation": "(q)",
                    "description": "permitting the Minister to approve laboratories for the purpose of carrying out and performing sampling, analyses, tests and examinations, and requiring that sampling, analyses, examinations and tests be carried out and performed by a laboratory approved by the Minister;"
                },
                {
                    "representation": "(r)",
                    "description": "the registration of employers of workers,"
                },
                {
                    "representation": "(s)",
                    "description": "the establishment, equipment, operation and maintenance of mine rescue stations. as the Minister may direct, and for the payment of the cost thereof and the recovery of such cost from  the mining industry;"
                },
                {
                    "representation": "(t)",
                    "description": "the training programmes that employers shall provide;"
                },
                {
                    "representation": "(u)",
                    "description": "the floor plans for the purposes of section 61(7);"
                },
                {
                    "representation": "(v)",
                    "description": "the forms and notices and providing for their use under this Act;"
                },
                {
                    "representation": "(w)",
                    "description": "building standards for industrial establishments;"
                },
                {
                    "representation": "(x)",
                    "description": "the name or description of any chemical as a hazardous chemical, any biological agent as a hazardous biological agent, and any physical agent as a hazardous physical agent;  LAWS OF GUYANA Occupational Safety and Health Cap. 99:06 119  L.R.O. 1/2012"
                },
                {
                    "representation": "(y)",
                    "description": "prohibiting an employer from altering a label on a hazardous chemical in prescribed circumstances;"
                },
                {
                    "representation": "(z)",
                    "description": "the criteria to be used by the Commissioner to determine whether information is confidential business information in an application under section 67(1);"
                },
                {
                    "representation": "(B)",
                    "description": "(a) the classes of workplace for which and circumstances under which a committee shall consist of more than six  persons and in each case prescribing the number of persons;"
                },
                {
                    "representation": "(C)",
                    "description": "(a) requiring an employer to disclose to such persons as may be prescribed the source of toxicological data used by the employer to prepare a chemical safety data sheet;"
                },
                {
                    "representation": "(3)",
                    "description": "No young person shall be employed in a factory otherwise than in accordance with regulations made under this section."
                }
            ]
        }
    },
    {
        "act": "OCCUPATIONAL SAFETY AND HEALTH ACT",
        "source": "https://mola.gov.gy/laws-of-guyana",
        "type": {
            "name": "section",
            "representation": "76",
            "title": "Penalty for breach of regulations.  PART IX OFFENCES, PENALTIES AND PROCEDURE  ",
            "context": "OCCUPATIONAL SAFETY AND HEALTH ACT under Penalty for breach of regulations.  PART IX OFFENCES, PENALTIES AND PROCEDURE  76. (1) There may be annexed to the breach of any regulation made under this Act such penalty not exceeding fifty thousand dollars as may be prescribed, and such penalty may be sued for and recovered under the Summary Jurisdiction Acts.  PART IX OFFENCES, PENALTIES AND PROCEDURE",
            "description": [
                {
                    "representation": "(1)",
                    "description": "There may be annexed to the breach of any regulation made under this Act such penalty not exceeding fifty thousand dollars as may be prescribed, and such penalty may be sued for and recovered under the Summary Jurisdiction Acts.  PART IX OFFENCES, PENALTIES AND PROCEDURE"
                }
            ]
        }
    },
    {
        "act": "OCCUPATIONAL SAFETY AND HEALTH ACT",
        "source": "https://mola.gov.gy/laws-of-guyana",
        "type": {
            "name": "section",
            "representation": "77",
            "title": "Liability of employers, owners, directors and others. ",
            "context": "OCCUPATIONAL SAFETY AND HEALTH ACT under Liability of employers, owners, directors and others. 77. (1) Notwithstanding anything contained in this Act, where an employer or an occupier or an owner of premises to which this Act applies contravenes this Act or any regulation made thereunder, the employer, occupier, owner or competent person, as the case may be commits an offence if LAWS OF GUYANA Occupational Safety and Health Cap. 99:06 121  L.R.O. 1/2012                                   Special provisions as to evidence.                       it is proved that he failed to take reasonable steps to prevent the contravention.  (2) In a prosecution of an offence under any provision of this Act, any act or neglect on the part of any manager, agent, representative, officer, director or supervisor of the accused, whether a body corporate or not, shall be the act or neglect of the act or neglect of the accused.  (3) Where an offence under any provision of this Act or the regulations committed by a body corporate is proved to be committed with the consent or connivance of, or to have been attributable to any neglect on the part of, any director, manager, secretary or other officer of the body corporate or a person who was purporting to act in such capacity, he as well as the body corporate shall be guilty of that offence and shall be liable to be proceeded against and punished accordingly.",
            "description": [
                {
                    "representation": "(1)",
                    "description": "Notwithstanding anything contained in this Act, where an employer or an occupier or an owner of premises to which this Act applies contravenes this Act or any regulation made thereunder, the employer, occupier, owner or competent person, as the case may be commits an offence if LAWS OF GUYANA Occupational Safety and Health Cap. 99:06 121  L.R.O. 1/2012                                   Special provisions as to evidence.                       it is proved that he failed to take reasonable steps to prevent the contravention."
                },
                {
                    "representation": "(2)",
                    "description": "In a prosecution of an offence under any provision of this Act, any act or neglect on the part of any manager, agent, representative, officer, director or supervisor of the accused, whether a body corporate or not, shall be the act or neglect of the act or neglect of the accused."
                },
                {
                    "representation": "(3)",
                    "description": "Where an offence under any provision of this Act or the regulations committed by a body corporate is proved to be committed with the consent or connivance of, or to have been attributable to any neglect on the part of, any director, manager, secretary or other officer of the body corporate or a person who was purporting to act in such capacity, he as well as the body corporate shall be guilty of that offence and shall be liable to be proceeded against and punished accordingly."
                }
            ]
        }
    },
    {
        "act": "OCCUPATIONAL SAFETY AND HEALTH ACT",
        "source": "https://mola.gov.gy/laws-of-guyana",
        "type": {
            "name": "section",
            "representation": "78",
            "title": "Special provisions as to evidence. ",
            "context": "OCCUPATIONAL SAFETY AND HEALTH ACT under Special provisions as to evidence. 78. (1) Any person who is found in an industrial establishment at any time at which work is going on or the machinery is in motion, except during the intervals for meals or rest, shall, until the contrary is proved be  deemed for the purposes of this Act to have been then employed in the industrial establishment:  Provided that this subsection shall not apply to an industrial establishment in which the only persons employed are members of the same family dwelling there.  (2) Where, in any proceedings under this Act with respect to a person under or over  a specified age, it appears to the court that such person is apparently under or over such age, it shall lie on the defendant to prove that the person is not under, or not over, the specified age, as the case may be.  (3) Where any entry is required by this Act to be made in the general register or in any other register or record, LAWS OF GUYANA 122 Cap. 99:06 Occupational Safety and Health  L.R.O. 1/2012                                                 the entry made by the occupier of an industrial establishment or on his behalf shall, as against him, be admissible as evidence of the facts therein stated, and the fact that any entry with respect to the observance of any provision of this Act has not been made, shall be admissible as evidence that that provision has not been observed.  (4) In any proceeding or prosecution under this Act  (a) a copy of an order or decision purporting to have been made under this Act or the regulations and purporting to have  been signed by the Minister, Commissioner, Chief Occupational Safety and Health Officer or an Inspector;  (b) a document purporting to be a copy of a notice, certificate, drawing, record or other document, or any extract therefor given or made under this Act or the regulations and purporting to be certified by an inspector:  (c) a document purporting to certify the result of a test or an analysis of a sample of air and setting forth the concentration or amount of a chemical, physical agent, or biological agent in a workplace or part thereof and purporting to be certified by an inspector; or  (d) a document purporting to certify the result of a test or an analysis of any equipment, machine, device, article or substance and purporting to be LAWS OF GUYANA Occupational Safety and Health Cap. 99:06 123  L.R.O. 1/2012                                                         Offences.        certified by an inspector,  shall be evidence of the order, decision, writing or document, and the facts, appearing in the order, decision, writing or document without proof of the signature or official character of the person appearing to have signed the order or the certificate and without further proof.  (5) In any proceeding or prosecution under this Act, a copy of an order or decision purporting to have been made under this Act or the regulations,  and purporting to have  been signed by the Minister, Commissioner, Chief Occupational Safety and Health Officer or an inspector may be served  (a) personally in the case of an individual or in case of a partnership upon a partner, and in the case of a body corporate, upon the president, vice-president, secretary, treasurer or a director, or upon the manager or person in charge of the workplace; or  (b) by registered letter addressed to any of the persons mentioned in paragraph (a) at the last known place of business of the person, partnership or body corporate, as the case may be,  and the same shall be deemed to be good and sufficient service thereof.",
            "description": [
                {
                    "representation": "(1)",
                    "description": "Any person who is found in an industrial establishment at any time at which work is going on or the machinery is in motion, except during the intervals for meals or rest, shall, until the contrary is proved be  deemed for the purposes of this Act to have been then employed in the industrial establishment:  Provided that this subsection shall not apply to an industrial establishment in which the only persons employed are members of the same family dwelling there."
                },
                {
                    "representation": "(2)",
                    "description": "Where, in any proceedings under this Act with respect to a person under or over  a specified age, it appears to the court that such person is apparently under or over such age, it shall lie on the defendant to prove that the person is not under, or not over, the specified age, as the case may be."
                },
                {
                    "representation": "(3)",
                    "description": "Where any entry is required by this Act to be made in the general register or in any other register or record, LAWS OF GUYANA 122 Cap. 99:06 Occupational Safety and Health  L.R.O. 1/2012                                                 the entry made by the occupier of an industrial establishment or on his behalf shall, as against him, be admissible as evidence of the facts therein stated, and the fact that any entry with respect to the observance of any provision of this Act has not been made, shall be admissible as evidence that that provision has not been observed."
                },
                {
                    "representation": "(4)",
                    "description": "In any proceeding or prosecution under this Act"
                },
                {
                    "representation": "(a)",
                    "description": "at the last known place of business of the person, partnership or body corporate, as the case may be,  and the same shall be deemed to be good and sufficient service thereof."
                },
                {
                    "representation": "(b)",
                    "description": "by registered letter addressed to any of the persons mentioned in paragraph"
                },
                {
                    "representation": "(c)",
                    "description": "a document purporting to certify the result of a test or an analysis of a sample of air and setting forth the concentration or amount of a chemical, physical agent, or biological agent in a workplace or part thereof and purporting to be certified by an inspector; or"
                },
                {
                    "representation": "(d)",
                    "description": "a document purporting to certify the result of a test or an analysis of any equipment, machine, device, article or substance and purporting to be LAWS OF GUYANA Occupational Safety and Health Cap. 99:06 123  L.R.O. 1/2012                                                         Offences.        certified by an inspector,  shall be evidence of the order, decision, writing or document, and the facts, appearing in the order, decision, writing or document without proof of the signature or official character of the person appearing to have signed the order or the certificate and without further proof."
                },
                {
                    "representation": "(5)",
                    "description": "In any proceeding or prosecution under this Act, a copy of an order or decision purporting to have been made under this Act or the regulations,  and purporting to have  been signed by the Minister, Commissioner, Chief Occupational Safety and Health Officer or an inspector may be served"
                }
            ]
        }
    },
    {
        "act": "OCCUPATIONAL SAFETY AND HEALTH ACT",
        "source": "https://mola.gov.gy/laws-of-guyana",
        "type": {
            "name": "section",
            "representation": "79",
            "title": "Special rules for the determination of the occupier of an industrial establishment in the case of a partnership or a company. ",
            "context": "OCCUPATIONAL SAFETY AND HEALTH ACT under Special rules for the determination of the occupier of an industrial establishment in the case of a partnership or a company. 79. (1) Any person who  (a) being the owner or occupier, or manager of an industrial establishment fails within the time limited by section 7 to make LAWS OF GUYANA 124 Cap. 99:06 Occupational Safety and Health  L.R.O. 1/2012                                                 application to the Authority for registration of such industrial establishment; or  (b) fails to give notice to the Authority as required by section 7(6); or  (c) fails to furnish the Authority within a reasonable time with the information required by him under section 7; or  (d) being the owner, occupier or the manager of an industrial establishment contravenes or fails to comply with section 8; or  (e) obstructs the Authority or inspector in the execution of his powers, duties or functions under this Act; or  (f) is the occupier of an industrial establishment in which an obstruction under paragraph (e) takes place,  shall be liable on summary conviction to a fine of twenty-five thousand dollars.  (2) Any person who  (a) wilfully delays the Authority or inspector in the exercise of any power under section 13; or  (b) fails to comply with any requirement of the Authority or an inspector in pursuance of section 13; or (c) fails to produce any register, certificate, notice or document which LAWS OF GUYANA Occupational Safety and Health Cap. 99:06 125  L.R.O. 1/2012                                                 he is required by or in pursuance of this Act to produce; or  (d) wilfully withholds any information as to who is an occupier of an industrial establishment, or as to who is the employer in the case of a prescribed occupation; or  (e) conceals or prevents, or attempts to conceal or prevent, a person from appearing before or being examined by the Authority or an inspector,  shall be deemed to obstruct the Authority or an inspector in the execution of his duties under this Act.  (3) Any person who  (a) obstructs a medical inspector in the exercise of his powers under section 16;  (b) being the occupier of an industrial establishment, contravenes or fails to comply with any requirement of a notice under section 17;  (c) being the occupier of an industrial establishment, contravenes or fails to comply with any requirement of a notice under section 40; or  (d) contravenes section 41 (1); or  (e) contravenes or fails to comply with any requirement of a notice under section 41(2); or LAWS OF GUYANA 126 Cap. 99:06 Occupational Safety and Health  L.R.O. 1/2012                                                  (f) contravenes or fails to comply with any of the provisions of section 42; or  (g) being the occupier of an industrial establishment, contravenes or fails to comply with any of the provisions of section 84; or  (h) being the occupier of an industrial establishment fails to comply with any requirement of the Authority under section 85; or  (i) being the occupier of an industrial establishment fails to comply with any of the provisions of section 86,  shall be liable on summary conviction to a fine of twenty-five thousand dollars, and in the case of continuing offence shall be liable to a fine of one thousand dollars for every day upon which such offence continues after conviction.  (4) Subject to subsection (5) and (6), any person who by any act or omission contravenes or fails to comply with  (a) a provision of this Act or the regulations;  (b) an order or requirement of an inspector or the authority; or  (c) an order of the Minister or the Commissioner,  shall, unless a penalty is otherwise specifically provided, be liable to a fine of not  less than ten thousand dollars nor more LAWS OF GUYANA Occupational Safety and Health Cap. 99:06 127  L.R.O. 1/2012                                             Special rules as to making of complaints for offences. [22 of 2009]      than fifty thousand dollars and to imprisonment for a term of not more than twelve months.  (5) If a body corporate is convicted of an offence under subsection (1), the maximum fine that may be imposed upon the body corporate shall be five hundred thousand dollars.  (6) If an inspector or any of the other persons referred to in section 36(l) (a) is convicted of an offence involving a contravention of section 36 (1) (a), the fine that may be imposed on such inspector or other person shall be not less than fifteen thousand dollars nor more than fifty thousand dollars.  (7) On a prosecution for a failure to comply with  (a) section 45 (1);  (b) section 46(l) (b), (c) or (d): or  (c) section 48 (1).  it shall be a defence for the accused to prove that every precaution reasonable in the circumstances was taken.  (8) The payment of any fixed fine required under section 30(12) for contravention of any provision of this Act or the regulations shall have no bearing on the force of this Part.",
            "description": [
                {
                    "representation": "(1)",
                    "description": "(a), the fine that may be imposed on such inspector or other person shall be not less than fifteen thousand dollars nor more than fifty thousand dollars."
                },
                {
                    "representation": "(a)",
                    "description": "section 45"
                },
                {
                    "representation": "(b)",
                    "description": "section 46(l)"
                },
                {
                    "representation": "(c)",
                    "description": "section 48"
                },
                {
                    "representation": "(d)",
                    "description": "contravenes section 41"
                },
                {
                    "representation": "(e)",
                    "description": "contravenes or fails to comply with any requirement of a notice under section 41(2); or LAWS OF GUYANA 126 Cap. 99:06 Occupational Safety and Health  L.R.O. 1/2012"
                },
                {
                    "representation": "(f)",
                    "description": "contravenes or fails to comply with any of the provisions of section 42; or"
                },
                {
                    "representation": "(2)",
                    "description": "Any person who"
                },
                {
                    "representation": "(3)",
                    "description": "Any person who"
                },
                {
                    "representation": "(g)",
                    "description": "being the occupier of an industrial establishment, contravenes or fails to comply with any of the provisions of section 84; or"
                },
                {
                    "representation": "(h)",
                    "description": "being the occupier of an industrial establishment fails to comply with any requirement of the Authority under section 85; or"
                },
                {
                    "representation": "(i)",
                    "description": "being the occupier of an industrial establishment fails to comply with any of the provisions of section 86,  shall be liable on summary conviction to a fine of twenty-five thousand dollars, and in the case of continuing offence shall be liable to a fine of one thousand dollars for every day upon which such offence continues after conviction."
                },
                {
                    "representation": "(4)",
                    "description": "Subject to subsection"
                },
                {
                    "representation": "(5)",
                    "description": "If a body corporate is convicted of an offence under subsection"
                },
                {
                    "representation": "(6)",
                    "description": "If an inspector or any of the other persons referred to in section 36(l)"
                },
                {
                    "representation": "(7)",
                    "description": "On a prosecution for a failure to comply with"
                },
                {
                    "representation": "(8)",
                    "description": "The payment of any fixed fine required under section 30(12) for contravention of any provision of this Act or the regulations shall have no bearing on the force of this Part."
                }
            ]
        }
    },
    {
        "act": "OCCUPATIONAL SAFETY AND HEALTH ACT",
        "source": "https://mola.gov.gy/laws-of-guyana",
        "type": {
            "name": "section",
            "representation": "80",
            "title": "Special rules as to making of complaints for offences. ",
            "context": "OCCUPATIONAL SAFETY AND HEALTH ACT under Special rules as to making of complaints for offences. 80. (1) The Permanent Secretary or the Chief Occupational Safety and Health Officer may institute or cause to be instituted prosecution for the purpose of enforcing any  of the provisions of this Act or the regulations and any inspector may appear as prosecutor for and on behalf of the Permanent Secretary or the Chief Occupational Safety and Health Officer, as the case may be.  LAWS OF GUYANA 128 Cap. 99:06 Occupational Safety and Health  L.R.O. 1/2012                                  Power of court to order cause of contravention to be remedied.                               Proceedings against persons other than occupiers. (2) All complaints under this Act may be heard and determined and all offences and penalties may be prosecuted and enforced in the manner provided by the Summary Jurisdiction Acts.  (3) No prosecution under this Act shall be instituted except by or with the previous sanction of the Authority.  (4) Any proceeding under this Act or the regulations may be taken  in a magistrates court of the district in which the offence or breach is alleged to have been committed or of the district in which the accused is resident or carries on business although the subject-matter of the proceeding did not arise in that district.  (5) Subject to section 83, no prosecution under this Act shall be instituted more than one year after the last act or default upon which the prosecution is based occurred.",
            "description": [
                {
                    "representation": "(1)",
                    "description": "The Permanent Secretary or the Chief Occupational Safety and Health Officer may institute or cause to be instituted prosecution for the purpose of enforcing any  of the provisions of this Act or the regulations and any inspector may appear as prosecutor for and on behalf of the Permanent Secretary or the Chief Occupational Safety and Health Officer, as the case may be.  LAWS OF GUYANA 128 Cap. 99:06 Occupational Safety and Health  L.R.O. 1/2012                                  Power of court to order cause of contravention to be remedied.                               Proceedings against persons other than occupiers."
                },
                {
                    "representation": "(2)",
                    "description": "All complaints under this Act may be heard and determined and all offences and penalties may be prosecuted and enforced in the manner provided by the Summary Jurisdiction Acts."
                },
                {
                    "representation": "(3)",
                    "description": "No prosecution under this Act shall be instituted except by or with the previous sanction of the Authority."
                },
                {
                    "representation": "(4)",
                    "description": "Any proceeding under this Act or the regulations may be taken  in a magistrates court of the district in which the offence or breach is alleged to have been committed or of the district in which the accused is resident or carries on business although the subject-matter of the proceeding did not arise in that district."
                },
                {
                    "representation": "(5)",
                    "description": "Subject to section 83, no prosecution under this Act shall be instituted more than one year after the last act or default upon which the prosecution is based occurred."
                }
            ]
        }
    },
    {
        "act": "OCCUPATIONAL SAFETY AND HEALTH ACT",
        "source": "https://mola.gov.gy/laws-of-guyana",
        "type": {
            "name": "section",
            "representation": "81",
            "title": "Powers of court to order cause of contravention to be remedied. ",
            "context": "OCCUPATIONAL SAFETY AND HEALTH ACT under Powers of court to order cause of contravention to be remedied. 81. Where the occupier of an industrial establishment is convicted of an  offence under this Act the court may, in addition to or in substitution for a penalty, order him to take within the time specified in the order, such steps as may be therein specified for remedying the matters in respect of which the contravention occurred and may, on application, enlarge the time so specified, and where such an order is made, the occupier shall not be liable under this Act in respect of the continuation of the contravention during the time allowed by the court, but if, after the expiration of that  time  is originally specified or enlarged by subsequent order, the order is not complied with, the occupier shall be liable to a fine of five thousand dollars for each day on which the noncompliance continues.",
            "description": "Where the occupier of an industrial establishment is convicted of an  offence under this Act the court may, in addition to or in substitution for a penalty, order him to take within the time specified in the order, such steps as may be therein specified for remedying the matters in respect of which the contravention occurred and may, on application, enlarge the time so specified, and where such an order is made, the occupier shall not be liable under this Act in respect of the continuation of the contravention during the time allowed by the court, but if, after the expiration of that  time  is originally specified or enlarged by subsequent order, the order is not complied with, the occupier shall be liable to a fine of five thousand dollars for each day on which the noncompliance continues."
        }
    },
    {
        "act": "OCCUPATIONAL SAFETY AND HEALTH ACT",
        "source": "https://mola.gov.gy/laws-of-guyana",
        "type": {
            "name": "section",
            "representation": "82",
            "title": "Proceedings against persons other than occupiers. ",
            "context": "OCCUPATIONAL SAFETY AND HEALTH ACT under Proceedings against persons other than occupiers. 82. Where under this Act any person is substituted for the occupier with respect to any provision of this Act, any order, summons, notice or proceeding which for the purpose LAWS OF GUYANA Occupational Safety and Health Cap. 99:06 129  L.R.O. 1/2012                     Power to make a complaint at any time for an offence under Part II.                Display of notices.                                   Power of the Authority to require returns.      General register.   of any of those provisions is by or under this Act required or authorised to be served on or taken in relation to the occupier, is hereby required or authorised (as the case may be) to be served on or taken in relation to that person.",
            "description": "Where under this Act any person is substituted for the occupier with respect to any provision of this Act, any order, summons, notice or proceeding which for the purpose LAWS OF GUYANA Occupational Safety and Health Cap. 99:06 129  L.R.O. 1/2012                     Power to make a complaint at any time for an offence under Part II.                Display of notices.                                   Power of the Authority to require returns.      General register.   of any of those provisions is by or under this Act required or authorised to be served on or taken in relation to the occupier, is hereby required or authorised (as the case may be) to be served on or taken in relation to that person."
        }
    },
    {
        "act": "OCCUPATIONAL SAFETY AND HEALTH ACT",
        "source": "https://mola.gov.gy/laws-of-guyana",
        "type": {
            "name": "section",
            "representation": "83",
            "title": "Power to make a complaint at any time for an offence under Part II.  PART X MISCELLANEOUS  ",
            "context": "OCCUPATIONAL SAFETY AND HEALTH ACT under Power to make a complaint at any time for an offence under Part II.  PART X MISCELLANEOUS  83. A complaint may be made for an offence under Part II although more than one year has elapsed since the date on which the offence is alleged to have been committed.  PART X MISCELLANEOUS",
            "description": "A complaint may be made for an offence under Part II although more than one year has elapsed since the date on which the offence is alleged to have been committed.  PART X MISCELLANEOUS"
        }
    },
    {
        "act": "OCCUPATIONAL SAFETY AND HEALTH ACT",
        "source": "https://mola.gov.gy/laws-of-guyana",
        "type": {
            "name": "section",
            "representation": "84",
            "title": "Display of industrial establishment notices. ",
            "context": "OCCUPATIONAL SAFETY AND HEALTH ACT under Display of industrial establishment notices. 84. (1) There shall be displayed in every industrial establishment a notice containing such abstract of this Act and the regulations made thereunder, as may be prescribed.  (2) All notices required under this Act, to be displayed in an industrial establishment shall be displayed where they can be conveniently read by the persons employed in the industrial establishment, at some conspicuous place at or near the main entrance to the industrial establishment and shall be maintained in a clean and legible condition:  Provided that the Authority may direct that all or any of the aforesaid documents shall be posted in such parts of the industrial establishment either in addition to or in substitution for such conspicuous place as aforesaid, as it may direct.",
            "description": [
                {
                    "representation": "(1)",
                    "description": "There shall be displayed in every industrial establishment a notice containing such abstract of this Act and the regulations made thereunder, as may be prescribed."
                },
                {
                    "representation": "(2)",
                    "description": "All notices required under this Act, to be displayed in an industrial establishment shall be displayed where they can be conveniently read by the persons employed in the industrial establishment, at some conspicuous place at or near the main entrance to the industrial establishment and shall be maintained in a clean and legible condition:  Provided that the Authority may direct that all or any of the aforesaid documents shall be posted in such parts of the industrial establishment either in addition to or in substitution for such conspicuous place as aforesaid, as it may direct."
                }
            ]
        }
    },
    {
        "act": "OCCUPATIONAL SAFETY AND HEALTH ACT",
        "source": "https://mola.gov.gy/laws-of-guyana",
        "type": {
            "name": "section",
            "representation": "85",
            "title": "Power of authority to require returns. ",
            "context": "OCCUPATIONAL SAFETY AND HEALTH ACT under Power of authority to require returns. 85. The Authority may require occupiers, or managers of industrial establishments to submit such returns, occasional or periodical, as may in its opinion be required for the purpose of this Act.",
            "description": "The Authority may require occupiers, or managers of industrial establishments to submit such returns, occasional or periodical, as may in its opinion be required for the purpose of this Act."
        }
    },
    {
        "act": "OCCUPATIONAL SAFETY AND HEALTH ACT",
        "source": "https://mola.gov.gy/laws-of-guyana",
        "type": {
            "name": "section",
            "representation": "86",
            "title": "General register. ",
            "context": "OCCUPATIONAL SAFETY AND HEALTH ACT under General register. 86. There shall be kept in every industrial establishment, or such place outside the industrial establishment as may be approved by the inspector, a register, LAWS OF GUYANA 130 Cap. 99:06 Occupational Safety and Health  L.R.O. 1/2012                                                          Enforcement by Local Sanitary Authority of regulations made under this Act.   in the prescribed form, called the general register and there shall be entered in or attached to that register  (a) the prescribed particulars as to the persons employed in the industrial establishment who have not attained the age of eighteen;  (b) the prescribed particulars as to the washing, white washing or odour washing, painting or varnishing of the industrial establishment; and  (c) the prescribed particulars as to every accident and case of industrial disease occurring in the industrial establishment of which notice is required to be sent to an inspector; and  (d) all reports and particulars as required by any other provision of this Act to be entered in or attached to the general register; and  (e) such other matters as may be prescribed. (2) The occupier of an industrial establishment shall send to an inspector such extracts from the general register as the inspector may from time to time require for the purpose of the execution of his duties under this Act.",
            "description": [
                {
                    "representation": "(a)",
                    "description": "the prescribed particulars as to the persons employed in the industrial establishment who have not attained the age of eighteen;"
                },
                {
                    "representation": "(b)",
                    "description": "the prescribed particulars as to the washing, white washing or odour washing, painting or varnishing of the industrial establishment; and"
                },
                {
                    "representation": "(c)",
                    "description": "the prescribed particulars as to every accident and case of industrial disease occurring in the industrial establishment of which notice is required to be sent to an inspector; and"
                },
                {
                    "representation": "(d)",
                    "description": "all reports and particulars as required by any other provision of this Act to be entered in or attached to the general register; and"
                },
                {
                    "representation": "(e)",
                    "description": "such other matters as may be prescribed."
                },
                {
                    "representation": "(2)",
                    "description": "The occupier of an industrial establishment shall send to an inspector such extracts from the general register as the inspector may from time to time require for the purpose of the execution of his duties under this Act."
                }
            ]
        }
    },
    {
        "act": "OCCUPATIONAL SAFETY AND HEALTH ACT",
        "source": "https://mola.gov.gy/laws-of-guyana",
        "type": {
            "name": "section",
            "representation": "87",
            "title": "Enforcement by Local Sanitary Authority of certain provisions. ",
            "context": "OCCUPATIONAL SAFETY AND HEALTH ACT under Enforcement by Local Sanitary Authority of certain provisions. 87. (1) The provisions of regulations made under this act relating to cleanliness, ventilation, overcrowding, lighting, drinking  water, washing facilities and sanitary conveniences shall be enforced by a Local Sanitary Authority of the district in which the industrial establishment is situate.  LAWS OF GUYANA Occupational Safety and Health Cap. 99:06 131  L.R.O. 1/2012                                                 (2) For the purpose of their duties under this section a Local Sanitary Authority and its officers shall without prejudice to their other powers, have all such powers of entry, inspection, taking legal proceedings, or otherwise, as the Authority or an inspector has, and accordingly in relation to their said duties the provisions of this Act as to furnishing means required by the Authority or an inspector, and delaying or obstructing the Authority or an inspector, shall be construed as including references to such officers; but no such power of entry, inspection or taking legal proceedings shall be exercised except by officers of the Local Sanitary Authority authorised by the Authority in writing in that behalf either generally or specially.  (3) Where the Authority or an inspector finds any Act or default in relation to any matter in an industrial establishment which is liable to be dealt with by the Local Sanitary Authority he shall give notice thereof in writing to the Sanitary Authority aforesaid and to the Central Board of Health. It shall be the duty of the Local Sanitary Authority to make such inquiry into the subject of the notice and take such action thereon as seems to the Authority proper for the purpose of enforcing the law and to inform the Authority or the inspector as the case may be, and the Central Board of   Health of the proceedings taken in consequence of the notice.  (4) If within one month after notice of an act or default is given by the Authority or an inspector under this section to a Local Sanitary Authority proceedings are not taken for remedying or punishing the default or act, the Central Board of Health, the Authority or the inspector as the case may be may take proceedings for the remedying or punishment of the default or act, in accordance with this Act.  (5) The Authority or an inspector shall for the purpose of his duties under this section have the same powers in regard to any such matters as he has with respect to other matters under this Act and he may for that purpose take, like LAWS OF GUYANA 132 Cap. 99:06 Occupational Safety and Health  L.R.O. 1/2012      Savings.                  s. 69(1)                            proceedings of enforcing this Act or for remedying or punishing any default or act as might be taken by the Local Sanitary Authority.",
            "description": [
                {
                    "representation": "(1)",
                    "description": "The provisions of regulations made under this act relating to cleanliness, ventilation, overcrowding, lighting, drinking  water, washing facilities and sanitary conveniences shall be enforced by a Local Sanitary Authority of the district in which the industrial establishment is situate.  LAWS OF GUYANA Occupational Safety and Health Cap. 99:06 131  L.R.O. 1/2012"
                },
                {
                    "representation": "(2)",
                    "description": "For the purpose of their duties under this section a Local Sanitary Authority and its officers shall without prejudice to their other powers, have all such powers of entry, inspection, taking legal proceedings, or otherwise, as the Authority or an inspector has, and accordingly in relation to their said duties the provisions of this Act as to furnishing means required by the Authority or an inspector, and delaying or obstructing the Authority or an inspector, shall be construed as including references to such officers; but no such power of entry, inspection or taking legal proceedings shall be exercised except by officers of the Local Sanitary Authority authorised by the Authority in writing in that behalf either generally or specially."
                },
                {
                    "representation": "(3)",
                    "description": "Where the Authority or an inspector finds any Act or default in relation to any matter in an industrial establishment which is liable to be dealt with by the Local Sanitary Authority he shall give notice thereof in writing to the Sanitary Authority aforesaid and to the Central Board of Health. It shall be the duty of the Local Sanitary Authority to make such inquiry into the subject of the notice and take such action thereon as seems to the Authority proper for the purpose of enforcing the law and to inform the Authority or the inspector as the case may be, and the Central Board of   Health of the proceedings taken in consequence of the notice."
                },
                {
                    "representation": "(4)",
                    "description": "If within one month after notice of an act or default is given by the Authority or an inspector under this section to a Local Sanitary Authority proceedings are not taken for remedying or punishing the default or act, the Central Board of Health, the Authority or the inspector as the case may be may take proceedings for the remedying or punishment of the default or act, in accordance with this Act."
                },
                {
                    "representation": "(5)",
                    "description": "The Authority or an inspector shall for the purpose of his duties under this section have the same powers in regard to any such matters as he has with respect to other matters under this Act and he may for that purpose take, like LAWS OF GUYANA 132 Cap. 99:06 Occupational Safety and Health  L.R.O. 1/2012      Savings.                  s. 69(1)                            proceedings of enforcing this Act or for remedying or punishing any default or act as might be taken by the Local Sanitary Authority."
                }
            ]
        }
    },
    {
        "act": "OCCUPATIONAL SAFETY AND HEALTH ACT",
        "source": "https://mola.gov.gy/laws-of-guyana",
        "type": {
            "name": "section",
            "representation": "88",
            "title": "Savings.  FIRST SCHEDULE SECOND SCHEDULE THIRD SCHEDULE  FOURTH SCHEDULE  __________________________  LAWS OF GUYANA Occupational Safety and Health Cap. 99:06 7  L.R.O. 1/2012           Short title.              Interpretation.                              PART I PRELIMINARY  ",
            "context": "OCCUPATIONAL SAFETY AND HEALTH ACT under Savings.  FIRST SCHEDULE SECOND SCHEDULE THIRD SCHEDULE  FOURTH SCHEDULE  __________________________  LAWS OF GUYANA Occupational Safety and Health Cap. 99:06 7  L.R.O. 1/2012           Short title.              Interpretation.                              PART I PRELIMINARY  88. Subsidiary legislation made under any Act repealed by this Act, shall with any necessary modifications and subject to the power of the Minister to amend or revoke them, continue in force as if they were made under section 75 of this Act.  ____________________   FIRST SCHEDULE  NOTICE OF ACCIDENT  Accident Register No...............",
            "description": "Subsidiary legislation made under any Act repealed by this Act, shall with any necessary modifications and subject to the power of the Minister to amend or revoke them, continue in force as if they were made under section 75 of this Act.  ____________________   FIRST SCHEDULE  NOTICE OF ACCIDENT  Accident Register No..............."
        }
    }
]