[
    {
        "act": "BAKERIES (HOURS OF WORK) ACT",
        "source": "https://mola.gov.gy/laws-of-guyana",
        "type": {
            "name": "section",
            "representation": "1",
            "title": "Short title. ",
            "context": "BAKERIES (HOURS OF WORK) ACT under Short title. 1. This Act may be cited as the Bakeries (Hours of Work) Act.",
            "description": "This Act may be cited as the Bakeries (Hours of Work) Act."
        }
    },
    {
        "act": "BAKERIES (HOURS OF WORK) ACT",
        "source": "https://mola.gov.gy/laws-of-guyana",
        "type": {
            "name": "section",
            "representation": "2",
            "title": "Interpretation. ",
            "context": "BAKERIES (HOURS OF WORK) ACT under Interpretation. 2. In this Act  bakery means any premises in which a person, otherwise than in pursuance of a contract of service, engages by LAWS OF GUYANA 4 Cap. 99:07 Bakeries (Hours of Work)                                Restriction of working hours in bakeries. [23 of 1951 19 of 1994]       Power of Minister to make orders modifying the restrictions imposed by section",
            "description": "In this Act  bakery means any premises in which a person, otherwise than in pursuance of a contract of service, engages by LAWS OF GUYANA 4 Cap. 99:07 Bakeries (Hours of Work)                                Restriction of working hours in bakeries. [23 of 1951 19 of 1994]       Power of Minister to make orders modifying the restrictions imposed by section"
        }
    },
    {
        "act": "BAKERIES (HOURS OF WORK) ACT",
        "source": "https://mola.gov.gy/laws-of-guyana",
        "type": {
            "name": "section",
            "representation": "3",
            "title": "Restriction of working hours in bakeries. ",
            "context": "BAKERIES (HOURS OF WORK) ACT under Restriction of working hours in bakeries. 3.",
            "description": "3."
        }
    },
    {
        "act": "BAKERIES (HOURS OF WORK) ACT",
        "source": "https://mola.gov.gy/laws-of-guyana",
        "type": {
            "name": "section",
            "representation": "4",
            "title": "Power of Minister to make orders modifying the restrictions imposed by section ",
            "context": "BAKERIES (HOURS OF WORK) ACT under Power of Minister to make orders modifying the restrictions imposed by section 4. (1) The Minister may, subject to the provisions of subsection (2) of this section, by order, direct that the restrictions imposed by section 3 shall not apply, or shall apply subject to such modifications as may be specified in the order, in respect of employment in bakeries  L.R.O. 1/2012 LAWS OF GUYANA Bakeries (Hours of Work) Cap. 99:07 5  L.R.O. 1/2012                                                 (a)      in dough-making;   (b)      in oven-firing;  (c)   in work  undertaken  by  reason of a breakdown of machinery or plant, or other unforeseen emergency;  (d)    in  work  for  the purpose of providing supplies for public holidays and feast days;  (e)     in respect of employment in any bakery in work for the purpose of meeting a sudden and unexpected demand for bread;  (f)   where  the occupier of a bakery is acquiring or erecting new  plant or premises, in respect of employment in that bakery   during such period as the Minister  considers reasonable in the circumstances; and  (g)     in work done in any circumstances or for any other purpose in or for which the Minister is satisfied that special provision should be made.  (2) No order made under this section shall permit, or shall be construed as permitting, the employment of any person for more than seventy-two hours in any week in a bakery in the manufacture of bread or flour confectionery or in any other work incidental thereto.  (3) Any order made by the Minister under this section may be made  LAWS OF GUYANA 6 Cap. 99:07 Bakeries (Hours of Work)                         Power of the Minister to modify the restrictions imposed by section",
            "description": [
                {
                    "representation": "(1)",
                    "description": "The Minister may, subject to the provisions of subsection"
                },
                {
                    "representation": "(2)",
                    "description": "No order made under this section shall permit, or shall be construed as permitting, the employment of any person for more than seventy-two hours in any week in a bakery in the manufacture of bread or flour confectionery or in any other work incidental thereto."
                },
                {
                    "representation": "(a)",
                    "description": "in dough-making;"
                },
                {
                    "representation": "(b)",
                    "description": "in oven-firing;"
                },
                {
                    "representation": "(c)",
                    "description": "in work  undertaken  by  reason of a breakdown of machinery or plant, or other unforeseen emergency;"
                },
                {
                    "representation": "(d)",
                    "description": "in  work  for  the purpose of providing supplies for public holidays and feast days;"
                },
                {
                    "representation": "(e)",
                    "description": "in respect of employment in any bakery in work for the purpose of meeting a sudden and unexpected demand for bread;"
                },
                {
                    "representation": "(f)",
                    "description": "where  the occupier of a bakery is acquiring or erecting new  plant or premises, in respect of employment in that bakery   during such period as the Minister  considers reasonable in the circumstances; and"
                },
                {
                    "representation": "(g)",
                    "description": "in work done in any circumstances or for any other purpose in or for which the Minister is satisfied that special provision should be made."
                },
                {
                    "representation": "(3)",
                    "description": "Any order made by the Minister under this section may be made  LAWS OF GUYANA 6 Cap. 99:07 Bakeries"
                }
            ]
        }
    },
    {
        "act": "BAKERIES (HOURS OF WORK) ACT",
        "source": "https://mola.gov.gy/laws-of-guyana",
        "type": {
            "name": "section",
            "representation": "5",
            "title": "Power of the Minister to modify the restrictions imposed by section ",
            "context": "BAKERIES (HOURS OF WORK) ACT under Power of the Minister to modify the restrictions imposed by section 5. The Minister may, where he considers it desirable so to do by reason of any breakdown of machinery or plant or other unforeseen emergency, permit the employment of any person in a bakery in the manufacture of bread or flour confectionery on any Sunday.",
            "description": "The Minister may, where he considers it desirable so to do by reason of any breakdown of machinery or plant or other unforeseen emergency, permit the employment of any person in a bakery in the manufacture of bread or flour confectionery on any Sunday."
        }
    },
    {
        "act": "BAKERIES (HOURS OF WORK) ACT",
        "source": "https://mola.gov.gy/laws-of-guyana",
        "type": {
            "name": "section",
            "representation": "6",
            "title": "Overtime. ",
            "context": "BAKERIES (HOURS OF WORK) ACT under Overtime. 6. (1) A person who is employed in a bakery in the manufacture of bread or flour confectionery or in any other work incidental thereto shall be paid  (a)     at twice the rate at which he would but for this section be paid, in respect of work  (i)     on Sundays, Christmas Day, the day after Christmas Day if Christmas falls on a Sunday, Eid-Ul-Azha Day or, if that day is a Sunday, the following day, Phagwah Day or, if that day is a Sunday, the following day, Good Friday, Easter Monday, Labour Day, that is to say the L.R.O. 1/2012 LAWS OF GUYANA Bakeries (Hours of Work) Cap. 99:07 7  L.R.O. 1/2012                                    Register of employees.            1st May, or, if that day is a Sunday, the following day;  (ii)   between the hour of seven in the evening of any day and the hour of five in the morning of the succeeding day; and  (b)    at one and a half times the rate at which he would but for this section be paid, in respect of work  (i)     on any public holiday, other than as specified in paragraph (a) (i); or  (ii)   on any day in excess of eight hours:  Provided that where the hours of work, or any of them, under this paragraph also fall under paragraph (a), the provisions of paragraph (a) shall apply in respect of such hours.  (2) Any person who contravenes subsection (1) shall be liable on summary conviction to a fine of thirty-one thousand, two hundred and fifty dollars.",
            "description": [
                {
                    "representation": "(1)",
                    "description": "shall be liable on summary conviction to a fine of thirty-one thousand, two hundred and fifty dollars."
                },
                {
                    "representation": "(a)",
                    "description": "shall apply in respect of such hours."
                },
                {
                    "representation": "(i)",
                    "description": "on any public holiday, other than as specified in paragraph"
                },
                {
                    "representation": "(b)",
                    "description": "at one and a half times the rate at which he would but for this section be paid, in respect of work"
                },
                {
                    "representation": "(2)",
                    "description": "Any person who contravenes subsection"
                }
            ]
        }
    },
    {
        "act": "BAKERIES (HOURS OF WORK) ACT",
        "source": "https://mola.gov.gy/laws-of-guyana",
        "type": {
            "name": "section",
            "representation": "7",
            "title": "Register of employees. ",
            "context": "BAKERIES (HOURS OF WORK) ACT under Register of employees. 7. (1) The occupier of a bakery shall keep a register (hereinafter in this Act referred to as the register of employees) of the persons employed in the bakery in the manufacture of bread or flour confectionery or in any other work incidental thereto.  (2) The register of employees shall be in such form, and shall contain such particulars, as are from time to time prescribed by the Minister by notice published in the Gazette.  LAWS OF GUYANA 8 Cap. 99:07 Bakeries (Hours of Work)       Powers of the Chief Labour Officer and other officers.  [7 of 1949 12 of 1967] 19 of 1977                                      (3) The register of employees shall be kept up to date.",
            "description": [
                {
                    "representation": "(1)",
                    "description": "The occupier of a bakery shall keep a register"
                },
                {
                    "representation": "(2)",
                    "description": "The register of employees shall be in such form, and shall contain such particulars, as are from time to time prescribed by the Minister by notice published in the Gazette.  LAWS OF GUYANA 8 Cap. 99:07 Bakeries"
                },
                {
                    "representation": "(3)",
                    "description": "The register of employees shall be kept up to date."
                }
            ]
        }
    },
    {
        "act": "BAKERIES (HOURS OF WORK) ACT",
        "source": "https://mola.gov.gy/laws-of-guyana",
        "type": {
            "name": "section",
            "representation": "8",
            "title": "Powers of the Chief Labour Officer and other officers. ",
            "context": "BAKERIES (HOURS OF WORK) ACT under Powers of the Chief Labour Officer and other officers. 8. (1) The Chief Labour Officer, the Deputy Chief Labour Officer, the Assistant Chief Labour Officer, any Inspector of Labour, any Assistant Inspector of Labour or any officer or sub-officer of police shall, for the purpose of the execution of this Act, have power  (a)   to  enter,  inspect  and  examine at any hour of the day or night, any bakery and every part thereof, when he has reasonable cause to believe that any person is employed therein,  and  to  enter  by  day  any place which he has reasonable cause to believe to be a bakery; and  (b)   to take with him such assistants as he considers necessary; and  (c)     to require the production of the register of employees kept under section 7, to inspect, examine and make copies of any entries  therein and, if he so thinks fit, to remove the register to his office; and  (d)    to  make such examination and inquiry as may be necessary to ascertain whether the provisions of this Act or of any order made thereunder or of any enactments for the time being in force relating to public health are complied with, in relation to the bakery and any persons employed therein;  L.R.O. 1/2012 LAWS OF GUYANA Bakeries (Hours of Work) Cap. 99:07 9  L.R.O. 1/2012                                              Offences.  [7 of 1949 23 of 1951 (e)     to require any person whom he finds in a bakery to give such information as it is in his power to give as to the name and place of residence of the occupier of the bakery;   (f)   to examine, either alone or in the presence of any other person, as he thinks fit, with respect to matters under this Act, every person whom he finds in a bakery or whom he has reasonable cause to believe to be or to have been within the preceding two months employed in a bakery, and to require every  such person to be so examined and to sign a declaration of the truth of the matters in respect of which he is so examined:  Provided that no person shall be required under this paragraph to answer any question or to give any evidence tending to incriminate himself; and  (g)    to exercise such other powers as may be necessary for carrying this Act into effect.  (2) The occupier of every bakery, his agents and servants, shall furnish the means required by the Chief Labour Officer, or other officer specified in subsection (1), as necessary for an entry, inspection, examination, inquiry or otherwise for the exercise of his powers under this Act in relation to such bakery.",
            "description": [
                {
                    "representation": "(1)",
                    "description": "The Chief Labour Officer, the Deputy Chief Labour Officer, the Assistant Chief Labour Officer, any Inspector of Labour, any Assistant Inspector of Labour or any officer or sub-officer of police shall, for the purpose of the execution of this Act, have power"
                },
                {
                    "representation": "(a)",
                    "description": "to  enter,  inspect  and  examine at any hour of the day or night, any bakery and every part thereof, when he has reasonable cause to believe that any person is employed therein,  and  to  enter  by  day  any place which he has reasonable cause to believe to be a bakery; and"
                },
                {
                    "representation": "(b)",
                    "description": "to take with him such assistants as he considers necessary; and"
                },
                {
                    "representation": "(c)",
                    "description": "to require the production of the register of employees kept under section 7, to inspect, examine and make copies of any entries  therein and, if he so thinks fit, to remove the register to his office; and"
                },
                {
                    "representation": "(d)",
                    "description": "to  make such examination and inquiry as may be necessary to ascertain whether the provisions of this Act or of any order made thereunder or of any enactments for the time being in force relating to public health are complied with, in relation to the bakery and any persons employed therein;  L.R.O. 1/2012 LAWS OF GUYANA Bakeries"
                },
                {
                    "representation": "(e)",
                    "description": "to require any person whom he finds in a bakery to give such information as it is in his power to give as to the name and place of residence of the occupier of the bakery;"
                },
                {
                    "representation": "(f)",
                    "description": "to examine, either alone or in the presence of any other person, as he thinks fit, with respect to matters under this Act, every person whom he finds in a bakery or whom he has reasonable cause to believe to be or to have been within the preceding two months employed in a bakery, and to require every  such person to be so examined and to sign a declaration of the truth of the matters in respect of which he is so examined:  Provided that no person shall be required under this paragraph to answer any question or to give any evidence tending to incriminate himself; and"
                },
                {
                    "representation": "(g)",
                    "description": "to exercise such other powers as may be necessary for carrying this Act into effect."
                },
                {
                    "representation": "(2)",
                    "description": "The occupier of every bakery, his agents and servants, shall furnish the means required by the Chief Labour Officer, or other officer specified in subsection"
                }
            ]
        }
    },
    {
        "act": "BAKERIES (HOURS OF WORK) ACT",
        "source": "https://mola.gov.gy/laws-of-guyana",
        "type": {
            "name": "section",
            "representation": "9",
            "title": "Offences. ",
            "context": "BAKERIES (HOURS OF WORK) ACT under Offences. 9. (1) Where any person is employed in a bakery in the manufacture of bread or flour confectionery or in any LAWS OF GUYANA 10 Cap. 99:07 Bakeries (Hours of Work)   4 of 1972 19 of 1994]                                               other work incidental thereto, and any of the provisions of section 3 or 5, or of an order made under section 4, has been contravened in respect of such employment, the occupier of the bakery shall be liable on summary conviction to a fine of twelve thousand, five hundred dollars.  (2) Where  (a)  no register of employees is kept as required  by section 7; or  (b)    the name of an employee, or of a person who was an employee, is or has been omitted from such register; or  (c)    any particulars required by the notice under section 7 to be entered in the register of employees in respect of any employee are omitted from the register of employees, or are inaccurately stated therein,  the occupier of the bakery shall be liable on summary conviction to a fine of thirty-one thousand, two hundred and fifty dollars.  (3) Any person who  (a)    wilfully delays the examining officer, or any of his assistants under section 8(1)(b), in the exercise of any power under that section; or  (b)   fails to produce the register of employees which he is required by that section to produce; or  L.R.O. 1/2012 LAWS OF GUYANA Bakeries (Hours of Work) Cap. 99:07 11  L.R.O. 1/2012                               Power of magistrate to modify agreements.               (c)     wilfully  withholds  any information as to who is the occupier of any bakery; or  (d)   conceals or prevents, or attempts to conceal  or prevent, a person from appearing before or being examined by the examining officer; or  (e)     in any way obstructs the examining officer in the exercise of his powers or duties under section 8,   shall be liable on summary conviction to a fine of thirty-one thousand, two hundred and fifty dollars.  (4) Where an offence under subsection (3) takes place in a bakery, the occupier of the bakery shall be guilty of an offence under that subsection.  (5) In subsection (3) the expression examining officer means the Chief Labour Officer or other officer specified in section 8 (1).",
            "description": [
                {
                    "representation": "(1)",
                    "description": "Where any person is employed in a bakery in the manufacture of bread or flour confectionery or in any LAWS OF GUYANA 10 Cap. 99:07 Bakeries"
                },
                {
                    "representation": "(2)",
                    "description": "Where"
                },
                {
                    "representation": "(a)",
                    "description": "wilfully delays the examining officer, or any of his assistants under section 8(1)(b), in the exercise of any power under that section; or"
                },
                {
                    "representation": "(b)",
                    "description": "fails to produce the register of employees which he is required by that section to produce; or  L.R.O. 1/2012 LAWS OF GUYANA Bakeries"
                },
                {
                    "representation": "(c)",
                    "description": "wilfully  withholds  any information as to who is the occupier of any bakery; or"
                },
                {
                    "representation": "(3)",
                    "description": "the expression examining officer means the Chief Labour Officer or other officer specified in section 8"
                },
                {
                    "representation": "(d)",
                    "description": "conceals or prevents, or attempts to conceal  or prevent, a person from appearing before or being examined by the examining officer; or"
                },
                {
                    "representation": "(e)",
                    "description": "in any way obstructs the examining officer in the exercise of his powers or duties under section 8,   shall be liable on summary conviction to a fine of thirty-one thousand, two hundred and fifty dollars."
                },
                {
                    "representation": "(4)",
                    "description": "Where an offence under subsection"
                },
                {
                    "representation": "(5)",
                    "description": "In subsection"
                }
            ]
        }
    },
    {
        "act": "BAKERIES (HOURS OF WORK) ACT",
        "source": "https://mola.gov.gy/laws-of-guyana",
        "type": {
            "name": "section",
            "representation": "10",
            "title": "Power of magistrate to modify agreements. ",
            "context": "BAKERIES (HOURS OF WORK) ACT under Power of magistrate to modify agreements. 10. Where, by reason of an agreement in force at the commencement of this Act between the lessor and the lessee of premises the whole or any part of which is used for the manufacture of bread or flour confectionery or any other work incidental thereto, the lessee is prevented from carrying out structural or other alterations in the premises, the lessee may apply to the magistrate of the magisterial district in which the premises are situate and, if the magistrate is satisfied that, having regard to the restrictions on hours of work imposed by or under this Act, the lessee ought reasonably to be allowed to carry out any such structural or other alterations, the magistrate may make such order setting aside or modifying the terms of the agreement as the magistrate considers just and equitable in the circumstances LAWS OF GUYANA 12 Cap. 99:07 Bakeries (Hours of Work)           Saving for  work in biscuit factories.        Meaning of  term employment. [16 of 1958]              of the case.",
            "description": "Where, by reason of an agreement in force at the commencement of this Act between the lessor and the lessee of premises the whole or any part of which is used for the manufacture of bread or flour confectionery or any other work incidental thereto, the lessee is prevented from carrying out structural or other alterations in the premises, the lessee may apply to the magistrate of the magisterial district in which the premises are situate and, if the magistrate is satisfied that, having regard to the restrictions on hours of work imposed by or under this Act, the lessee ought reasonably to be allowed to carry out any such structural or other alterations, the magistrate may make such order setting aside or modifying the terms of the agreement as the magistrate considers just and equitable in the circumstances LAWS OF GUYANA 12 Cap. 99:07 Bakeries (Hours of Work)           Saving for  work in biscuit factories.        Meaning of  term employment. [16 of 1958]              of the case."
        }
    },
    {
        "act": "BAKERIES (HOURS OF WORK) ACT",
        "source": "https://mola.gov.gy/laws-of-guyana",
        "type": {
            "name": "section",
            "representation": "11",
            "title": "Saving for work in biscuit factories.   __________________________ 1953 Ed. c. 120 _______________________________________________________ 4 of 1946 An Act to regulate the working hours in bakeries and for purposes connected therewith.   [23RD MARCH, 1946]  Short title.     Interpretation.    ",
            "context": "BAKERIES (HOURS OF WORK) ACT under Saving for work in biscuit factories.   __________________________ 1953 Ed. c. 120 _______________________________________________________ 4 of 1946 An Act to regulate the working hours in bakeries and for purposes connected therewith.   [23RD MARCH, 1946]  Short title.     Interpretation.    11. This Act shall not apply in respect of the employment of persons in a bakery in which the sole or principal work carried on is the manufacture of biscuits, or in such part of a bakery as may be specified in an order made by the Minister, being a part in which the Minister is satisfied that the sole or principal work carried on is the manufacture of biscuits.",
            "description": "This Act shall not apply in respect of the employment of persons in a bakery in which the sole or principal work carried on is the manufacture of biscuits, or in such part of a bakery as may be specified in an order made by the Minister, being a part in which the Minister is satisfied that the sole or principal work carried on is the manufacture of biscuits."
        }
    }
]